0,USER
1,"Hey Reddit, the guy on the left is the CEO of Digg.  URL"
0,they're damn hurting
0,"Sorry guys, my tweets and twitter are slow today for some reason."
1,working on my final (maybe?) and tending to my sunburn... back to columbus tomorrow for swimming... be there!
1,"USER so you're more a half eaten bag of dry roasted peanuts than a half full bag of dry roasted peanuts, gal?"
0,Just got tix to see SYTYCD taped live next week. And I can't go.  Tragic. #sytycd.
0,"USER all I can do is take my meds, work out daily and eat rite.  I feel so fat!"
1,iCar Remote URL   #iphone #app #fake
1,Good Morning Friends! Quote: The road of success is always under construction.!
0,"USER Well I usually do that too, except she just made fun of me  hmm..."
1,USER they are double checking for me  ox
0,USER I'm not sure what I want to do for a career anymore.
0,i finished my packet of chocolate snakes
0,USER i hope ftsk/wtk don't come in december  i don't wanna miss that grrrnufiedjknsc
0,tummy ache
1,#unfollowdiddy FOLLOW ME!!!!
1,USER oh great!  hope you'll have a blast there! ;)
1,USER someday soon
1,USER haa well I'm 1 up on you cos I washed the car this morn
0,"USER awww, i just meant to ask you for a pic. there are no red carpet ones yet  what did u wear?"
0,Stupid back robbery in Vancouver is keeping our news cameras away.  #webraising
1,USER that means no tweeting too
1,USER maarrryy kate! i know  i'm not really doing anything.. pool. :p what about you?
1,USER just got home and it was flawless
0,USER I would be sad to not see squirrels.   I <3 them!
0,USER buh bye ne ne...  Im leavin 2day! ooh n cute fit yesterday! via. twitpic. 2 thumbs up. lol
0,isPlayer Has Died! Sorry
1,USER haha. why chris? panget nya eh! peace. lol
1,USER Hell yes!
0,"USER I've took a good old fix of Calpol, (hardcore or what?) normally eating habits should resume shortly. I don't want to go out"
0,"USER  Sorry to hear, but good on you for surviving intact! I'm OK, was q happy earlier, bit bleugh now - kinda out of it but OK x"
1,USER but a good one. Thx- I like the boys in my catagory
1,new video is up!  URL
1,USER Let me know what the Pilot 78G's are like! And if the Japanese F nibs are fine enough!
1,U will thank me for this one  ENJOY USER URL
0,hello i wish that someone would talk to me im so bored!!!
1,"Poor Ivette ... not getting his tweets, clearly."
0,"Luisa, Trish, USER & USER just left!"
1,USER HAVE A GOOD DAY
1,cant wait till river riot. panic is coming back  ahhh i love them sooo much!
0,I am god damn freezing!
0,Feels like I haven't had enough USER and USER recently
0,"Oh and for those who care, my laptop is broke again."
1,Off to see hannah montana for no apparent reason.
0,USER Awww.  He's so cute. But that sucks. I wanted a kiss. Okay. You're getting better at the message thing.
0,USER im not sure TheDoves could even try to put on a bad show! wish i were there
1,USER Just a general discussion course to get qualified to teach English at elementary school
0,left her Mummy in the Tube Station at South Kensington when she really belongs in Cornwall - it is all very odd!
0,"[vid] too bad the UFC didnt go all the way w/Pride.  ""If Only Pride and the UFC Could Have Gotten Along..."" ( URL )"
0,you know Monnie's upset when she ignores the raid and start abusing people on MySpace. Someone make me happy
0,waiting for the doctor to see my baby boy
1,if only I could fast forward a few years to when I'm already a special ed teacher.
0,i feel like crying....i ned my mom now
1,USER  and I got Liz Johnson's book and two from FIRST....    good stuff!
1,"USER We're in season 7, I watched all 6 previous seasons in around a month... it felt great, yet a little dirty"
0,I wanna transfer even just for 2 years!
1,"USER   cant wait to see you guys on tuesday nite  im going for my friends birthday, we are so excited about it  ! x"
0,"Happy Friday, guys! You're fairly quiet today.... Is is crappy outside where you are? Cos it's pretty crappy here."
1,"Worked out, mowed the lawn, now going to lay out"
1,USER Oh dear!  Brown has struck a nerve with you today.  Of course you are right but dont forget he was on GMTV.
1,USER  I love having you back on here  you always help me smile ...enjoy your night... Amy
1,"Seriously though... this is becoming a problem... oh well. work at 10, here's hoping I wake up"
1,USER that'll be a sheep skin for max comfort
1,USER Cool! Im about to leave my house and get some gas
0,"USER um ok, but i might not get there til like 10.30 cos my buses are gay  but alright."
1,USER I just heard before the storm with miley
1,USER So what does it mean then? lol. its really cool!  x
1,Server side replies 4tw! it doesnt care how many times you mail me - it still replies  excellent for redirecting peeps to specific faqs!
0,Just got done unloading gear in the rain  I hope it stops before 7:10!
1,i'm getting excited about dublinnnn! wow
1,USER we have a lot of the same blogs that we visit  #crocsfeelgood02
0,USER and you say you read my Tweets lol  what's up!
0,URL - Daily Mugshot #4 - Keeping mommy warm. I miss her...
1,Hey Baby - Jonas Brothers
1,USER Hey there! You will enjoy seeing them...your perspective will be very different
1,USER thankyou
0,in class nodding off. i have carpel tunnel
1,Kings of Leon.
1,USER it doesn't matter when you get it. what matters is that you've got it!
1,i kissed a girl and I liked it. the taste of her cherry chapstick. I kissed a girl just to try it.  hahahaha siiiiiiiikeeee ;)
0,i fell asleep at 5 and just woke up. I'm fucked for the rest of the night and will never fall asleep again.
1,USER Sent it already!
0,Kimi overtakes two cars in the closing laps but its not enough - he finishes 10th with no points
1,"USER USER I like Mr Tweet. It's like #ff, only more permanent & forces you to give a reason"
0,summer work
1,"The kids next door have deceided to scream Hannah Montana in the garden, I think its time to turn the amp up full blast, and scream back"
1,flew kites yesterday for the first time in Years...  felt great
1,"After school, I think I'm going to just go home and SLEEP."
0,"I'm so tired!! Headed across they bay to meet mom for lunch, since she decided to go out of town today, when I leave monday"
0,"Poop, Truck Race postponed until 1:30 PM tomorrow."
0,USER Any info on Jeanette? Some forums report she was fired from iCarly
0,USER aww honey I'm sorry
1,Titanic thangg tomorrow :| text meeeeeeeee
1,"USER Hey Rob, no not at all   I am always up for meeting new people"
0,USER the amount that don't is kinda crazy  (I receive all the artwork for various shows and no images / picture = dull looking show
0,I have Chelsea Tourettes!!  SORRY NEIGHBOURS!!
0,"i think that was the worst shift i have ever worked, people are so bloody stupid, seriously. // no cold rock anymore?"
1,"Got URL woohoo, in Japan it is difficult to get such hotel domains"
1,eating nachos with my gurlz
1,just starting. lets be tweet friends
0,So ill. So tired. So much moving to do
1,USER Oh and we did create some super awesome robot aliens from Reverse art truck finds.  Room messy- kids and grownups happy
1,USER glad you had a good flight
1,USER hahahaha  ill keep deleting and you keep tweeting. and i had a grand time
0,"Awake. No new iPhone software, no Duels of the Planeswalkers yet"
0,USER wazzza wrong wif ya daddy??
1,USER hello I'm doing great  how are you? Have a great weekend
1,USER yeah there are so many of us angry feeters  Tim's THAT good lol... I have been good I go on I  just havent posted for a while
0,Aww. I feel sorry for Caity.
1,Missy higgins kate voegele grace potter and the nocturnals
0,USER it feels like u r left out hey?  yup - back to my thesis with me after short break
0,USER OHNOES! I am very sorry
0,work is horrible today  would much rather be at home listening to radio 1.
0,"USER The field rep from GEB was there. Chances are if I did something bad, Guiding Eyes'd hear about it.  else, I wouldn't care much.."
1,USER juz order some  Dad's gonna love it for sure =]
1,Neighborhood yard sale today. 3 on our block & 20-30 others in 2 block radius. Need directions?
0,USER awhz  but you look sexy with the white hair :/ can't wait to see the new movie. x
1,USER i will wait with interest .. i'm having a few issues with my flats on a 5 string warwick .. see if you can help me out
0,english exam tomorrow
1,"USER do you hear voices in your head now, or are you just being poetic?"
1,USER Best of Luck!
0,"Oh no, the big fish died!"
1,USER I like the thought of you just pondering.. going crazy.. wondering ... hahah
1,"#protip make sure you if ENV[""RAILS_ENV""} ==""production"" your google analytics code.  throws off your numbers elsewise"
0,USER speak for yourself
0,USER i did all that and still it didn't work  and the songs i wanted were there then not??
1,"USER something ""breathtaking"" to look at..."
1,USER USER USER Morning girls!!
1,"USER no, sometimes they just don't, but we still love them."
0,im gonna find someone someday who might actually treat me well. oh taylor swift...
0,"USER happy birthday! My total apologies for last night, had to write  do you have wheels yet?"
0,superb footie result making mushroom pork for tea as I live in an apartment on 1st floor and cant hold a  bbq
1,USER oooh!  believe it or not i haven't even worn mine yet! :/ I shall wear it soon!!! hehe looks like a fruitful day out ;)
0,Going to pick up Burger King for our last lunch
1,USER lol yes come whisper to me
1,USER thanks for the donation girlfriend!! You r the best
1,My brother just brought me into the car lift! Wohoo! There's a first time for everything! Mine came late though. Haha!  here already!
0,USER  Not yet.  Need more traffic on the old blog methinks. How about u? #fotomoto
0,"About to eat dinner  and set the table, sad"
1,Bed. Oops! ;) Church will come early. Such a fun night.
1,Feeling a bit better today. Had an awesome time at Rocco's last night!  looking forward to dinner tonight. Happy Tuesday!
1,USER Your very welcome
0,i need to get the battery replaced for my car zapper. When i use just my car key to unlock the alarm goes off but im lazy..
1,URL - hmmm some leather work
0,USER y no invitan
1,"Nighty, night. <3  I'm going to sleep to have more nightmares."
0,USER aw man i want tacos and beer!
1,Leaving for Iluma shopping centre now
1,"talking to Tash. she's helping me with some CSS shit. :p i'm hopeless when it comes to these kinda things.  thank you, TashiePOOP. (:"
0,Tired and have a headache today
1,"USER Wow. I may have just busted out some Mom-level teary eyes. That post is so beautiful. Thanks, sister"
1,"USER the week it falls on, and a week after the exact date"
0,just my luck.....Story of my life
0,just learned of upcoming round of musical-offices. maybe this time get private space? maybe get a door? will def lose my window.   sad.
0,Has to report for jury duty selection tomorrow.  wish me luck.
0,"so many weeks of nothing, now i have multiple invitations for sat. which do i choose?"
0,emotional reservoir at a new all time low. First time I've struggled over here since the first month
0,"Just got up, my eyes are huuuuurting lol"
1,"USER That. Is. Hilarious.  I hear most of the time hotel actually staff ignore them, assuming they're pulled by tourists."
0,"USER maybe it's a song that isn't in the system  yup yup, playmate angela!"
1,USER  Please do. Would love that. Have a lovely day.
0,USER my girl had to be at work at 2
1,USER promise them some chutney if they submit their work to the LRA
0,1 exam down 3 to go  advanced functions tomorrow! eep
0,"Did nothing all day, and feel bad about it."
0,USER poor danny...too bad..i was hoping  for him to win dis season 8...
0,franklin is miserable after getting fixed yesterday  and i'm miserable too
1,"USER yeah actually that might be a good trial for the kittehs. if you can drive it down on saturday, that would be awesome"
1,Somebody is bumping Britney Spears outside.
1,Budi's shot is published as the latest cover of Indonesia's NG Traveler!!! Damn you ... It's like me writing for Oprah. Happy for him tho
0,USER Can't believe you are coming to PEI Canada in July and I'm not going   I know your show will be fab. Sing a song for me. A big fan.
0,I forgot what I wanted to say. That really sucks.  I just became a ninja on Free Realms. Haha. 'Life of Pi' keeps getting better.
0,USER I didn't watch. I had to unpack...still have a lot to do
1,Holy crap! They just killed a zombie with a sledgehammer to the face! That's seven kinds of won right there
1,USER USER said that we weren't connected... So I am changing that...
1,ZTecWiz bought mIRC for $10
0,even jesus had more followers than this
1,Got kicked out of adult swim  Rockband session in full swing
1,"USER Though since I stopped smoking, I've gotten /alarmingly/ good at making Californian Rolls..."
1,USER  enjoy your time off !
1,USER Thanks.  I hope it stays this way through... most of forever
0,USER wish I could but I am in Tacoma
0,USER awww!  im sorry. i know how that must feel. ill miss you when i move! this year
1,has an iPhone
0,I tryed to get me a iPhone ....................  did'nt work  grrrrrrrrrrrrrrr
0,India is out of World Cup T20 Cricket
0,USER sadly no to both   All my money this month is accounted for - cant afford a hotel
0,my cousin is breaking up with her musician boyfriend  devo I love him
1,USER URL - aw.. I'm so excited.. recording it  p.s. 15 days  TX misses you
0,"Life just handed me a game piece that says 'go back three spaces, lose your next turn' Looks like I have to go back to school"
1,desperate housewives with the ma.
1,USER it's all good- thank god it over and I survived  damn those blended gay drinks
1,"Sim,PUK! New number"
1,i love my #bestfriends because they always make me smile  write what you think about your #bestfriends xD #bestfriends
0,Feels Rough.  Need a weekend to get over the one just gone! Looking forward to a chilled night on the sofa tonight. Anything good on TV??
0,USER we didn't forget your gift set. Your driver just called. Technical difficulties. Cust service will call u tomorrow.
1,"grawrrrrrr. can't wait till April 30th and May 21st  WhoOt! to being young, happy, semi-single and kinda slightly in <3"
1,"USER haha ok, good luck"
1,USER We didn't stalk you...we just love your presence
0,USER He wouldn't eat this morning and he typically wolfs his food right down.
0,USER ahhh pho sounds so good right now
1,Shout out 2 all my new followers!! Thank u 4 making me have more people following me than I'm following
0,"USER ;; lmfao. that's so messed up. i would've shared wit you (well, nah, not really, i just lied).         have fun drinkin!"
1,URL sum more me pics prompted by USER
0,finally home. its gross out today  21 days!!
1,USER Just thinking about how Oedipal your last tweet to me was. A week or so ago you referred to me as your twitter mom!
1,USER  Great! Thanks
0,USER Hey are you quiet today or is it me...work was nuts today...no tweeting time
0,#squarespace has yet to give me my free iPhone gift card.   so sad...
1,USER nooo! i wish! i'm still trying to see if I can go see him SOLO!
1,USER o the bitchy things i could say to you right now about that comment but I am better than that
0,My sister just ran over a butterfly
1,USER lol thats funny! lucky girl!!!!
1,USER wasssssssup!  glad 2 c u & Jackie here
1,"USER no, no. She was there for me  hahaha."
0,Ew i'm a big sket  why the hell am i giving advice hahaah.
0,USER and i cant come  cause im sat in a hospital bed with my laptop feeling sorry for myself. =/ tests are retarded.
1,Can't wait for my walk today  Gonna be awesome
1,Llegando de Salsear!! Maï¿½ana work in my new work!
0,feeling really bad I can't help this crow I see with a broken wing
1,USER sometimes I just need to relearn halt. Instead of ahhhhhh-thud!
0,USER its so sad  im not even gunna look.  Ive had my share of taylor id be fine if i dont c a new pic of him for a week
1,making wire wrapped jewelry  i'm burnt but i don't feel like doing nothing. not yet.
1,up and at em
0,USER idk  hopefully soon i miss bacolod!! gaarr
0,USER sooooo. .  i dont have a house to go back to
1,USER 1 year and 4 months.  He's so smart and so so sweet. I love being a momma.
0,USER would you happen to know how to burn a DVD that plays on anything
0,USER were like they won..so I got happy  I have loads of exams next week
1,feeling so great!
0,Two hours into a four hour test.
0,5 days till i get my braces.
1,"USER IDK! But i also didn't eat Bfast! ....and i meant already, not ilready"
0,USER  make it count. but don't kill yourself!
1,Back in Van and its absolutely gorgeous out.
1,USER :that's what a shopacholic usually said to themselves...
0,USER I really wish I'd had one last night... I got about 2 hours sleep in the end.
1,"I'm happy to be a Pastor and I love preaching! It's really a great honor from God.. Thank you, Daddy"
1,"USER creep.  I learned it to outsing someone who was condescending to everyone playing.  I umm, can sing."
0,USER I don't think so
1,heyheyhey  featuring rory and MATT
0,another great win for the Jets last night. 5 straight. sadly my last game next week
0,I HEAR THE ICE CREAM MAN AND HAVE NO MONEY IN THE HOUSE!
0,"going to work, then black-out drunk this time. jucy hates me"
1,USER Hope to hear from you soon about from what we discussed
1,USER haha mines the saints
1,USER Glad you got to walk.  Finish the damn thesis.
0,USER well I'd meant today (sunday) but that was when we'd planned on going to poughkeepsie.  Now everything's changed
0,"Sitting at home, going to work in the morning  @ Dakota Ridge Apartments URL"
0,"I guess our server is putting me in the corner for a time-out, a 504 Gateway Time-out"
1,USER Thanks bro
1,USER thank you kindly!
0,thinking of the packing I've got to do is giving me a headache!
0,USER but i dont want to pay for the data plan  Its like $30 extra dollars a month
0,"oh noes. Her pianist for leavers can't play cause its a break, her fingers are broken!!"
0,sowi... i cant make it to ur place..
0,'s Blackberry is dead. Only 3 more days until I get my iPhone.  3 days without a phone.
1,Just up after a refreshing nap
1,Listening to slipknot and the thunder outside Mmmmm
0,"USER yeah, I've just been working and worrying about my cat - I'm afraid it's CRF, have a vet appt tomorrow to confirm."
1,USER Am amazed by how much you work Ken.....
1,Podcast Episode 8 uploading as i type  subscribe please www.RandolphStProductions.mypodcast.com thank you
0,isPlayer Has Died! Sorry
1,"just another epic video done by us...its called ""The Theory of Why""...  check it outt!"
0,Apparently a bad mood affects the passage of time.
1,USER wifi was very spotty and unreliable... and we were all so focused on what the speakers were saying anyway.
1,"USER it was fucking awesome, I eagerly await a sequel"
1,getting ready to go to breakfast with the family.
0,exam week
0,off to gym!
1,if you get a twtter while on your cell on the toilet-does it make it a shitter? i wish you could reply back and tell me what an ass i am
1,USER We were busy watching USER  & USER and the baby and the dogs (You gotta not clash your tweets with SwS) Sorry! ;)
0,USER ah touche..omg what elenore did to simon! i wanted to cry
1,USER were not love  lol just kidding! Can you be here?
0,@#odna I think I'm out for the night
0,USER blah. Sorry to hear that
1,USER I'm always down for good ol' tennis
0,USER true dont have a data plan tho  maybe this is the time
1,USER billy or just monkeytwizzle is fine by me
0,"really tired, just want to go back sleep but start work in an hour"
1,USER lol...well its not that bad of surgery
0,"Hmm, $25 to see the Decemberists, but I have to go to Raleigh on a work night... or $95 for cheap seats to the Bolshoi? Probably neither"
1,harhar :3 daldal ni mileY cyrus .. me nami2sx lahn pla XD the rain is over now ! yehei .. im in gud mud agen
1,USER I highly doubt that
0,Not at work today.
0,Im not having a very good day
1,Just finished reading a great book called Marcelo In The Real World. Not my usual style but i loved it
0,"USER I miss you & USER making youtube videos  make one soon? k, thanks"
0,Goodmorning twitter land!!! Upset I have to go to work this morn in the rain  no board for me today!!!
0,USER yeah something was telling she was gonna be there.  that's sad...
0,So i don't have a pet snake anymore  stupid boys.
1,USER I know right! yea we will fit it in..  lets see something else to talk about.. NY!! i want to go there
0,"Like clockwork, CPing.com is down @ 6am GMT"
0,Why the hell is the radiator next to my bed on full heat? Ugh. It's hot enough as it is with the sun on me through the window!!!  So hot
1,Feeling much better today.  And my appendix is still in tact
1,Playing blues brothers. Hell yeah!
0,Working early today! This weather is suckyyyy!! BOOOOO
1,Going to watch Gone With The Wind
0,USER  Not really sure
0,"This child that is writing here is gonna die of starvation  My mum thought I wouldn't be up till late afternoon thus, no sandwich for me."
1,"Saw the movie ""Up"" today.  Very cute and the kids liked it."
0,Monday already!?!  Another long and annoying week ahead.
0,Started on time at work 2day. Only 3 days before a 4 day weekend! I think I'll survive unless they really shut down my big project
0,USER I haven't seen you tweeting!
0,anyone like the 1985 movie phenomenon...back to the future??? anyone???
0,is considering a set of electric drums for home. My Pearls are at the church & I have nothing to throw beats on at home.  BOO!
0,I feel like the only 18-year-old here
0,USER hey dawlin...was I bein mean to u? I've not been myself lately
1,USER I'm sure she would.
0,"So, instead of running, I just spent buried in the code of my website. Epic Nerd Fail.  I suck."
0,missin` already my highschool days...
1,USER Hope your first day of your big girl job was great!
0,Has to go to the doctor at 2..
0,USER Oh  I wish I could help you feel better *hugs*
1,"USER haha, yes, a follow on tweet!!  you watching bbc 2?"
1,Start making money online the easy way! URL - I made $13 today already
0,Why can't I get 3.0 yet???
1,USER That's a quality tune!
0,atlantic city is a huge waste of money
1,Now has loaded herself with sweets can't wait till Wednesday as i am going to be a pig and eat them and is topping up my tan  and Hi ppl
0,Need to get gas but dont feel like paying
1,i'm very happy xD
0,"i am now going to two banks, then doctors at 2, wish me luck, immm sooo nervous, i don't want anything to be wrong"
0,"USER i really want to, milk...  too much coffee.... but soon!"
1,USER I realize that  I was just ranting
1,USER I get home on the 25th  Im really getting sick of chinese food hahah!  Hope youre doing well!
0,kinda upset....my buddy is going out of town. i wanted to hang out with him....but i have to leave for canada next tues..
0,"USER Oh goodness, that songs annoys me! My friends love to jam to it, but it doesn't make sense at all!"
0,Work.....ugh....
1,40 more to go
1,USER busy and hard to catch up-too cold for beer maybe bourbon
0,USER nm just woke after not enough sleep
0,Why the fuck can't I be over this ??? I feel like crying bit I realy don't want to  why is this bothering me sooooooo much !?
1,USER I have those all the time. Haha
0,bye my long hair!
1,Today is a day for cleaning.... Time to turn up my music so i can do it with style
1,Playing hide and seek in WalMart.
0,USER yes at the hollywood bowl on july 5
0,"Morning, am waiting for the train in the lovely sunshine! Its too nice to go to work today!"
1,hanging out with USER at the party. he says hi.
0,Fuck i swear this bitch makes me feel like crap all time
1,Correction. Driving my family car cos my parents allowed him to  - URL
0,"USER aww, why not  yeah i am (read below)"
0,USER  Love yourself!
1,Fleet Foxes again! Perhaps something fresh might be in order  www.myspace.com/jamesbenton1   Thanks.
1,USER hfy I was like omg that's keith LOL dimples and sexyness man that's ummmmm
0,at my cousins and the internets cappe. not much i can do
0,Oh no... Monday is here!!! *screams* Blues...
1,USER You are too sweet. And right.
0,Missin someone special
1,USER You should rest a lot! And sleep early! ;) Hope you'll give me a shoutout.
0,just watched marley and me. and bawled my eyes out
0,The heat can go to hell. I hate my oven of a work truck
0,i don't feel good  haha i think i'm about to go up to exxon and visit USER
0,I'm so upset. I took a benadryl an hour ago and it has yet to kick in.
0,i totally forgot about our history test tomorrow. crap. i gotta go study.....
0,Drank our last can of cheerwine.   now i have to wait two weeks to get more.
1,i'm going to publish its preface.
0,aww...!  i've got a booboo. it hurts! huhuhu!
1,URL - salmon tonight  ...yum 2 my tum!
1,"no man, no phone, no trouble = 100% freedom !!! i'm loving it"
0,I wish i could've gone to omaha last night.
1,USER i know i know for some reason it wont let me put it in the record label bit. i will keep trying
0,USER yesm I am fully aware I said traffice twice.  I need to go back to school.
0,"I hate it when I let everything get to me.     maybe sleep will fix it, if I can sleep.   :/"
1,USER Morning Wossy. ust caught last week's Fri Night programme.Get Hugh Jackman back each week!!  Most amused by the Lady Gaga interview
1,At Applebee's having dinner with my baby
0,"Thank you !! USER USER  - incidentally, there is no USER on twitter. It's too many letters for a name on twitter"
1,is updating iBlog  URL
0,John Sterling toys with my Yankee feelings
0,"back from Mass & lunch...about to go to the NC or library to work on my paper so I won't be distracted...not feeling very inspired, sigh"
1,"USER Im great thx, how r u"
1,getting my 2010 mazda 3 on thursday. sooooo excited
0,I also promised that I wouldn't read/comment a story until exams were over. SORRY MIBBIANS.
1,Prepping for a school visit. Can't wait!
1,"Ok, since we are 7 days away from the event, time to turn #wcchicago into a trending topic.  (via USER)"
