0,USER
1,"USER Great job Heather! & it's not like you never are or something, but you looked stunning in your outfit today! Gorgeous!"
1,USER Aww you are so beautiful. you made my day  I love you wife! lol
0,USER OMG! i think something is wrong with your phone lol  because I havent gotten anything after u said you'll be back tues.   ???
1,"Celebrating Ashari's big day today. Happy 6th Birthday, baby!"
0,Dude. This day has been going by so freakin slow.
1,Got a tour bus today instead of the normal bus we usually get
0,USER where did you watch MTV movie awards?? I so wanted to see it
1,no words could explain
0,"USER good luck, hope ya ain;t got anything to bad! let us know how ya feeling for rehearsal tomorrow?!"
1,The countdown begins now.  7.
1,USER Thats good to hear!
1,"just perfecting the two of hearts dance, its going well"
1,USER oh it should be
1,USER I've watched it already  COOL
1,Promoting Indie Unsigned Artists Across Social Networks. - Twitter.com/heavygrinder for one
1,"USER lol well I coulda opted for big, tall, Jew, Bruno balls in my face! I'm super jealous of eminem right now lol"
1,URL  for McCoy's initial rant.
0,Its too sunny outside to be stuck in an office all day
1,USER good idea.  it is such a  fucking awesome pen!
0,Oh no I feel a cold coming on
1,loves Florence for giving away a free download of the Jamie T remix of RabbitHeart
1,USER Great news about the PS3 patch finally coming out. Thanks for the info
1,USER I will wave at you!
1,You Changed my life in a moment.
1,USER just remember gaz has done heartbeat and home and away and neighbours from hell lol  he'll be fine
0,My sunburn is on fire!!!  someone shoot me!
0,My heart goes out to Exodus..so young...
1,USER Shouldn't you know your National Holidays?
1,Need for Speed:Shift has a nice track list URL and a small but interesting car list URL . Might buy it
0,"USER  We're fostering a standard poodle that owners moved away and left. He was 29# when he was found, now back up to 50. People suck."
1,USER WTF? Are you in my home town?
0,Eating Strawberry Jaffa cakes... not really that tasty
0,"Still learning arts and of course informatics. Yesterday I learned 'til 12pm and today since, I don't know, 9am. I've got a lot to do."
1,USER Happy Birthday!!  Wishing you a great day!!
1,loved being snow white last night
0,leaving the USER library after a disastrous trig test  going to get a pick me up & head home for a sleepless night
1,Bussin' it to San Diego! Sitting next to USER
0,USER I want stats too  lol
1,"I could cry right now, I'm so relieved.  But still not happy."
0,"USER I like the sun you brat. It's all your fault, praying for bad weather"
0,USER yup! i'm on my own! so lazy
1,USER any Indochina/Ho Chi Ming materials to share? It is exactly what we are talking in class right now  Thanks!
1,im beginning to see the light!  goodnight! (bye) URL
0,USER  oh  i knew you were to busy for me
1,the AC is on!!
1,"drinking blueberry green tea   oh and for those who were wondering, nick got it right.  i was going straight home, so i went commando. lol"
1,Is feeling optimistic all will be well
1,amber is eating cherries && im hanging with mitchel in 2 days!!
1,waiting fo kelsey to get hur then sspp picnic
1,"USER i wouldn't mind krumping w/ him!  LOL USER i think i learned it from d ""bring it on 3 movie""  yey for cheerleaders!"
0,is revising philosophy and ethics  boo!!  talk 2 me ?
0,"oh...my...gawd! I am so tired.......i look like i spent the entire night crying after being punched in the face, my eyes are that bad"
0,"Hey USER Hey, I'm late today   (iwearyourshirt live > URL"
1,jeeeeeezzz.... i've finally done that CD for my mum  .... Hoedown Throwdown on #radiodisney
1,Michael and I are on our way to the West Coast GAPS meetinga!
0,USER Your picture isn't coming up on tweetie but it on twitter site. Annoys me!  lol
1,Gahhhhhjgfdfgbj :< My BlackBerry is dying. I want to cry. Anyone have a spare?
1,USER Hi Tim: Thx for the follow. Looking forward to learning more about what you do  Have a great day! Carol
0,What the fuck is taking so long for a 9530 .15x leak?! 9500 got there's close to a week ago
0,USER I am lost. Please help me find a good home.
1,Just had an amazinq qirls-niqht-out. I quess its always qreat to have an excuse to wear tiny dresses & heels
0,"USER Oh, that sounds nice, can I come round for tea then? I'm having mac & cheese"
1,"USER ahh, ok, got ur point, will surely do that, thanx"
1,"USER Let's Go Caro ! Let's Go.  You're so perfect, you will be ready."
1,"USER Our plans are to vacation in Vegas for 2010, so hopefully that holds together"
1,mcdonalds run at 3 am with the bestfriend dirtydurs. delivering it back to seans bitchass
1,will eat  URL
1,USER very sultry  I could do a lot with you and my camera I think
0,USER  I want some.
1,USER I am now
1,USER hahha well its definitely a plus when a man can cook
1,"Loving college, chasing starlight, and waiting for the world's greatest."
0,USER  hope you feel better! I'm gonna try to go the eff to sleep now. Gnite/morning!
0,"USER - yep, turned pink briefly before slightly burning! was cool though. bit of a shock being back"
0,i  am really getting discouraged
1,"Oh no, I forgot a big fav...#followfriday USER....sorry about that!"
0,"I'd really like the weather to cheer up, far too grim at the moment!"
0,Still tired  got work at 3 ....
1,"Duncan Riley: USER ask the consumers about 2015-2018, they'll be able to tell you then  (via Twitter) URL"
1,USER ahh its alright for some! hehee  hope your having fun!! how many shows left?
0,"USER Too darn cute, I love it! Sorry to hear about the sand in your food"
0,isPlayer Has Died! Sorry
1,what a long tiring but fun weekend
0,"I wish my pool was up, sooobadly"
1,"USER GIRL!  Work it! Hope you had the Slammer, and had fun with the Moldovan! I want to hear details!!!"
1,Time for bed since i feel like hell and there's nothing better to do.  G'night!
1,USER Amen.. yes and one of the groups was an awesome church choir In a public library singing We are standing on Holy Ground
1,USER haha adam lambert looks awesome there.
1,cont... Eccentric personality. 11 years of bad luck if you do not forward.
1,"USER THANK U, do u feel better now?  and USER no clue what ur talking about!"
1,For all the cat lovers - a Poem on Cats  URL
0,In ocean city till Friday for AVP! Then of to NYC for another. Won't be home till monday  I miss it!!!!
0,Argh! Someone got up on the roof next door and threw some mechanical thing down- including a bottle of oil- all over the broccoli now
0,USER USER see i told you!..at this point the only thing that gets me going is a certain wolf
1,USER URL - Erm both
0,i h8 myspace
1,"is about to bypass the house by stopping at Macy's. I have a coupon burning a hole in my wallet. I need tops bad, or dresses, or shorts."
0,Two bodies found from that missing Paris plane.   URL
1,"USER DON'T listen to him, return it, GOD will bless you with something bigger"
1,"USER best saturday for you .. my grandpa has just died , but at list he's with God now"
0,"jazz_santi= pure win win yes, im leaving for school now, new adventures lie ahead....  the only thing we have to fear is beef!"
1,Close friend delivering a talk on self-confidence for the first time and she rocks!
1,Lazy days at the beach house!
0,My cookies just floated away with all the rain...
1,"is having a well-deserved break today..NO PHONE CALLS, NO EMAILS..only plenty of catch up movies to doooooo"
1,USER ooooooooh...
1,"USER awesome, dude.    great for starting a day off right."
1,USER u r as u said to me but only by looks...... u r btr by hrt but jus dont get ngry wid me.....
0,"my heart broke today when my son wanted me to stay home and said, ""Mom, why can't you work here?"""
0,*texts USER* Okay...I guess...
1,"OMG. roxy from eastenders uncle is sir alan sugar.. corr, imagine the birthday/christmas presents she would get."
0,I lost my connection again! Damn it!!
1,Send a video clip of you smiling for a Project Create A Smile video. It would mean a lot! Thank you!  projectcreateasmileUSER.com
0,USER *tear* no man....this will be the second one I miss
1,USER Yup - that's us!
1,USER Hi
0,Y all of a sudden it got boring at work. USER left me  no one to talk to literally!
1,update......i am still alive
0,this is my only day off this weekend so lots of housey things to get done
0,USER Psh first off dad makes em better second off i dont have any pancake mix  thirdly im not actually a pancake fan
0,USER I feel really bad for all those kids
0,Mornin'. Ouch I think I have sunburn on my back lmaoooo
1,USER haha exactly! so i sleep through the day instead
0,USER im fine..except for t weather...scorchin heat
1,USER anything excitificating?
0,Great now my picture won't show up
1,Thank you Conan for not forgetting about Seattle  (via USER)
0,USER goodluck!! sorry I could be there  I owe you one xoxox
1,USER hahahahaha u look really good in ur picture
0,USER lucky bitch! haha we have COLDDD rain up here in MA  i would give anything for hot rain right now!
1,"USER CONGRATS! And you looked ""mah-vel-ous"" on the Red Carpet!"
0,Ick....its sooo hot outside.
1,USER 'morning! Have a great day today.
1,"USER well, keep at it the mileage will come"
1,"Voltando do almoï¿½o tocou no rï¿½dio ""God give rock'n roll to you"" hummmmm... sï¿½ tenho uma frase sobre isso ""put in the soul of every one!"""
0,"I think my phone is dying a slow death, symptoms include freezing and major trackball issues  #sadblackberry"
1,USER Thank you!
0,"USER You lucky.. person... I'm back at school tomorrow, and my friends are too busy to see it today"
0,It's all over! Prac is finished  One of the best experiences of my life  Will miss all my students
1,My baby`s comin home!
1,"hm, what to do... a bit of work, a bit of fun ..."
1,You're a genius USER . Your #regex rec just helped me solve a minor annoyance on some code
0,"did not make it to the wedding. woke up at 4  finally bought crank 2  Jason Statham, here i come."
1,Just woke up...lol. Still worring a lil about Paula...hope she had a sae flight & I hope shes now resting
1,"Thank you to all our new followers.  If you haven't checked out the video for our upcoming single, please do: URL"
0,USER Hope yuo had a good flight! Wish the flight would've landed a little further south!
0,"USER spotlight search is the best feature!!! oh yeah, fine tune fastforward on movies/music is cool. no MMS or video"
1,USER I completely have a long standing  interest in audio production... that's the next step...
1,"USER hope you have a great time here in sunny Glesga  (ok, maybe not so sunny right now)"
1,USER I hope we get In the good kind of trouble.
0,Would have went to the protest but it was scheduled way too early for working people living outside of lexington
1,"listening to the radio,waiting for McFly"
0,My USER keeps leaving me
0,So bored this Saturday night
1,USER be sure to wear some flowers in your hair  #mamas&thepapas
1,"No rain, no rainbow"
0,Mrs pestering me for portions. I'm to tired
0,USER Going crazy right now haha.. Wanna go home
0,USER yes he is. and I keep hoping one appears in your area. not so far.
0,USER I think that Chelsea will now win the game.That will be a shame that I will not be able to go the Kings Road on Sunday  #facup
0,My skin doctor said I have to remove my moles on my skin
0,USER yeah... i know.....
1,USER Thanks for the shoutout!  Enjoy the tunes!  #chuckmemondays #chuckeu #musicmonday
1,USER hi Helen...greetings from Kinsale
0,USER it usually just turns back on after a few minutes.. but this time it didn't
0,"Bored!! Nothing on TV, can't write on Melo bc its too much work with my poor finger.   I should clean but mehhh.  Gonna buy paint 2morrow!"
0,meh too clammy
0,Does anyone know if the new Ubertwitter version fixes the battery drain issue? Its back to draining my BB like crazy.
0,i want my long hair back!
0,"alright, good pull him.   come on garon."
0,Why can't I go and see USER this sunday? Why do I live in Argentina? IT'S SO UNFAIR
1,"USER Same, off to get some shut eye. Night, speak soon"
0,USER i want cheetos.  what kinda chips you got?
0,"I am really mad that the twittedfon app , aim app, and one of my games is not working on ipoood"
1,"USER I am coming to see you in Greenville, SC Thursday night!  Please sing the Tin Man for me!!!"
1,USER shhhhh! Don't let the women know the only good thing about it!
0,"Bored, redoing my myspace...Its kinda making me mad cause it's not doing what i tell it to do  Oh well I'm gunna keep trying..."
1,USER Good luck Sophia!
0,Ran to the beach even though I'm sore. Gorgeous outside. AND got to see Ascher. Going to miss him  Stupid Gatsby ate my earring though.
1,I love Nevel longbottom
1,"USER COOL, WELL TAKE CARE. FEEL FREE TO STOP BY."
1,so tired..but happy
0,i feel like watching a disney movie...too bad we dont have a vcr anymore
0,"USER USER Morning! Oh no, more of them?  #terremoto #earthquake #italy"
0,Monday morning - got the whole week ahead before the next weekend
1,"Thinking that I could have gone to 235 on my Deadlift today  Another awesome workout at Joust! Hating the rain, no run tonight."
1,munching on m&ms! pretty little colourful m&ms! yum!
1,USER thank you so much for the rt
1,Goodnight Twitterverse. Maths Exam First Thing Then Down To The Park
0,USER so I am bored an on the computer and googling my gmail handle (joellester) and I find you.  Sorry for taking your name.
1,Good morning! And what a morning it is... My pictures are on the front page of both 20min. and News in Bern.
1,"Another gorgeous day, to nice to be stuck in front of the PC"
0,how anyone could ever abandon a boston terrier.. i'll never understand
1,Brewing some DD coffee!   ::nana_banana::
0,Back to work today
1,"USER Ok, I'm going to the fabric store this morning so will check out padding & send you an email later today w/ the details."
1,"USER hahahahha, naaaah, not quite. i got tired and i was half falling asleep at my computer.  i barely slept good lastnight. :/"
0,I want another Henna!  URL
1,USER haha thankyou
0,USER  it stinks... but its rlly easy so thats good... omg im so nervous for science!!!  is it hard?
0,is tryin 2 find a photo.......got none small enough 2 put up
1,USER I hereby dedicate my first reply to you! Hope you're ok.
0,USER Why are you insulting me? What did I do to you?
1,#delongeday #delongeday #delongeday #delongeday #delongeday #delongeday #delongeday #delongeday #delongeday #delongeday #delongeday
1,hectic preparations for a client visit.. probably spending more money  on the visit then we make on their billing
0,I hate damp days.  Arthritis giving me jip!  I can hardly walk.  I feel 87 not 27!
1,New week of work
0,"USER LOL I know but it's not like I just up and hijacked it, I found your post b/c I thought it was fun way to make #ONTD tweets."
1,happy that the NO vote won!
1,hanging around. listening to music.
0,#iremember skipping English class because apparently I can't spell.
0,Time to go to the grocery store
1,9 minutes till lines vines and trying times !!!
1,USER You can do it!
0,And my heart just broke....he is married.....to Scarlett Johansson.....
1,heart birthday month!
1,USER big deal? they can talk. they are probably going to become bffs. oh and can u pop ur little man out already
1,"Happy mother's day to all mothers out there, your the best"
0,Just checked out these tags in the Mission URL  Now I'm miss SF
1,Getting ready for a party!
0,Eatin at Boca Chica... Shoulda ordered the skirt steak
1,USER ty very much im going to listen just after faith hill
0,Ugghh too early for summer !
0,watching the D10. I SO miss shoe-shopping!!! I HATE MY LIFE!!!  decided NOT to 'follow' a certain famous girl. Her tweets are RETARDED!!!
0,"USER oh, what a shame  why does that always happen.  I hope it does clear up for you though x"
0,Im Never gonna leave this chair.... But i have to!!
0,"USER aw, tam, i'm sorry.  that sucks huge ones."
0,done! back hurts
0,USER that's awful! so many very horrible things happening right now
1,"URL - All Painted up, Powdered up & ready 4 work!   Those skinny Desperate Housewives can kiss my Curvy a$$!    ..."
1,Just added a pretty picture to my Myspace. Ahhhhhh!  To pretty!
0,still feel like hell but Torchwood is helping. i miss the pain killers from the hospital.
0,me+towel+evil hidey razor=disaster.
1,"USER Well, I'm sure you're still enjoying the city!!  The right thing will come along"
0,What's with this rain?! Come out Mr Sunshine
0,...clarks is where we got caught
0,USER sozzzle rach for signing out of msn it went wierd and now it wont let me back on
1,"USER Thank you so much for following us. As one of the first couple followers, your support is incredibly appreciated"
0,welcome all our new followers! we will follow you back as soon as twitter let's us follow more than 2000 people
0,Bouncing Rush makes me feel nauseous
1,"USER This is really weird, seeing a tweet from another Yourdon. I thought there was only one of us on Twitter ..."
1,closed my cable position with 30 pips
1,"""Destiny does what she wants"" aka Girls do what they want//The Maine<3"
0,stayed in bed all day..had lots of cravings..sucked at making lambing
1,mai thi v?n  ch? ngh?a bay c? r?i
1,Our zone is on twitter!This is a great way for our zone to be more connected to one another
0,USER What exactly is Scottish money? BTW thanx for your rain from yesterday. It's raining cats and dogs in Amsterdam! Rrrrr...cold
1,Crookers always puts that extra oomph into my workday
1,USER Thanks for following
0,#mcflyforgermany #mcflyforgermany #mcflyforgermany #mcflyforgermany #mcflyforgermany #mcflyforgermany  wir sind raus!  USER
1,G'day to everyone.
1,URL - a present for our brother
0,"USER hey havent seen you in ages! we original 105 girls must catch up sometime?life was fun back then, now its all stupid uni work"
0,"USER re: ""Allergies are a bitch!"" I hear that I'm suffering over here also"
1,"whoops meant trying timeS....whoopsie. fave songgs: before the storm, turn right, poison ivy, fly with me. gahh they are all so amazing."
1,i cleaned my room yesterday  Today i'm doning some homework and right now i'm listen to savannah
0,USER OMG I dnt know how I didnt faint coming into this world...ugh stomach is turning now
1,USER I was recently at a local event where USER was talking about  a mom who took the medicine. just found out it was you!
0,"USER Great profile photo!!! I lived in Alaska in the 70's beautiful, I want to return"
0,"USER I was supposed to be there, but I got stood up"
1,USER how you doin hun?
0,USER BOOO  hahah. there is a danish town in california? how odd. haha. how did you like aebleskiver then?
0,"USER Danny! I miss you,please come back to Rio.."
1,"USER Alternatively, lets not  Although I'm sure you'll look lovely in them!"
0,USER summers already started lol.. not looking forward to the rest of it  working thruout
0,"Can't believe it, am sneezing, again! This cold just won't go away"
1,USER Aww I saw the pic USER put up...congrats!!!!!
0,I realise people are not tagging anymore.
0,I want june gloom to come back. Fuck the heat
0,is at home sick today.
0,"USER ""Libs are the NATIONAL redecorators"" sad but true"
0,going to double overtime!
0,B0o NoT mEetInG uS iN 0aKlaNd 2nItE He CiTy b0uNd..
0,USER Argos was disturbingly uneventful. I'm disappointed.
1,Preparing for Wednesdays St Charles Realtor golf tournament sponsorship. Shud b gud and great 4 ur biz
0,This explains a lot  funny it should be called after a poisonous snake! URL
0,RedDusk_Perth - not much   fingers crossed though
1,Woo last monday ever!!  Its again gonna be a looong day.
0,My doggy is hurt  it'll be ok though! xoxo
0,"USER oh no, i hope your doing better now"
0,USER I wish I lived here. Just a vacay.
1,"Lesson Learned: If even you can't accept yourself, how can you expect others to accept you..."
0,morning! I avoided the 'good morning' though  another working day starts without a tweet  I really start getting worried *cries*
1,"Ok, off to the climbing gym for a bit."
0,USER really?  I found Target to be the same or cheaper here in houston.
1,I always pipette the poop out of the betta barracks whenever I see it so I guess Julep is helping me out by pointing at it
0,USER We should!! I wish we could make the weather
1,USER Sounds good!
0,My Dad is now in ICU...
1,watching bbc sound  heard clodge once and seen me once
1,"USER nothing special, this will work I'm an adamant spammer hater, but you're now safe. Plus, I will now follow you! A bonus!"
0,is bored...bored bored bored bored bored and is STILL doing referencing! where is distraction when you want it?
0,USER I am very angry at this information Marcos!!!!!!
0,"USER So I totally didn't say happy birthday to you. Life has been super hectic. Sorry lovely lady.  Oh btw, Happy Belated Bday!"
1,"wondering why CA can't get it's sh$t together! Closing parks, school programs, banning marriage, etc, etc.... Great weather though"
0,"Re-pinging USER: Iheartradio----> Houston, Texas----> 94.5 The Buzz--- iPhone problems  URL"
0,NO MORE MSHS!!!!!!!! Gotta go to work...too tired
0,Ohhhh #BSB such lovely beautifully talented mennnn <3  I miss Kevin
1,USER So my recommendation was good?
0,My life has been totally destroyed by a jealous jerk who cant handle the fact that he screwed up and lost me
1,is very hopeful...she thinks she found coveralls for her outfit.
0,"...you'd think my cheechee's were fake with as much money as I have to put in to support them!!!  I KNOW I KNOW, TMI!!!"
0,USER i'm sorry baby  RIP
0,i was gonna post a Mother's Day Special but I went very very wrong with my mom's makeup  Maybe next year... *sighs*
1,USER During revamp and shortly after. They're out of $ now & in real trouble... but I'm going to be good & not bag them publicy
0,Off to bed I have to go play CEO for the day!!!! We need new staff. ........bunkee?  wait I meant
1,"USER ? ??????. ???????? ?????? ??? ?????? ""????????""."
0,Ouuchh! I Just Bit my tounge
0,not as good at super smash bros 64 as I remember
1,USER hope ur wife is doing better now and hopefully will relieve you of your extra duties
1,i think USER and USER and i need a dance party tomorrow pre-show. y/n kiddies?
1,SDK Adobe Air installÃ©
1,USER it was gooood!! I was bad @ it..but it was fun. Cute boys
0,USER your tweet a few weeks ago got me onto the original one... I've only managed 40 on that
0,ohh hell yes! Kerrang! is back on!!  it went off before!  it killed me!!
1,Shortly I will have to attend an internal meeting. Hoping to get a good view of one colleagues boobs. I guess it an E-Class...
1,no wine o'clock for me tonight had my fill last night  thanks USER  was a great night
1,USER Ooh. What's a national merit scholar?
1,About to start drivin to Houston...my home town  good to go back and visit
1,Another try for the free iphone. #squarespace
0,Why is my twitter stuck on mobile version?
0,has had a very unusual day  hope jess' mum is okay after the accident
0,why does the rain fall when you don't need it to?
1,USER Will you let us know what movie is it? I would like to watch your work there.
1,"Just had a free lunch at Oliver Garden - Italian, thanks Cisco Team"
1,USER in my experience an ounce is all that's needed. Any more than that and you risk becoming staid
1,USER Be seeing you there!
0,Life at home for the summer isn't supposed to feel stressful like this. I just want to crawl back into bed and hide the day away.
0,USER Well hurry up and figure it out!! LOL. It'll be awhile before Giulia can come though.  Mono is like spreading all over.
1,I'm hanging....what an insane weekend!!! And oh yes it carries on tonight...its a public holiday tomorrow  i love SA!!!
1,:yawn and stretch: mawnin twiddies!!!!! Up and at it already. And got that text I been waiting days to see  today lookin good already.
0,"thinks her mother is mad! Confirmed! he he. Meg up, hub ironing so on with dreaded essay"
1,"USER the only thing i remember from that visit was ""oh crap i think i want to go to wm now""..i was pretending to listen"
0,"USER O.O... Bunnies?!?  I love bunnies! Can I have a bunny? Can I? I'm allergic to dogs, so I can't have a puppy."
1,going to hang with my boyfriend
0,USER I wanna be there
1,"Yay yay, Disneyland today!! and maybe ""The Hangover"" at the 21 and up theatre"
0,"is in ICT, but nearly finished work (H). but wishes she was outside in the bloody sun"
0,Bus only just arrived. was sposed to be here 25 mins ago. Cant wait till i can drive again so i dnt have to rely on busses.
1,"Busy weekend ahead: advising appt, kays baccalaureate mass, making cupcakes for jareds party, 7up bday party, more cupcakes & kays grad"
1,Congrats to Jason and Kelsey... its a boy!!!
0,USER Aw. :** I MISS YOU TOO!
0,"on my break from work, frustrated that the barca store wont let me ship!!"
0,Whoa! This is early... Already been woken by the sun  time to fit more sleep in please!
0,Wow I think I'm going to get sick! I woke up throwing up
1,USER Enjoy! Just don't go in with expectations that it'll be exactly like the book
1,USER dude tell me more abt Axis banks virtual credit card system.. sseems  i need a card
0,USER I'll be up all night doing homework
0,"USER well, now u know how sad it's my love life!  ...well i hav to work a lot! I want to forget everything about that! Mua! Lov u!"
0,Could not find a getter for updatedDate ..
0,I done being badd  sowwie got carried away
0,Wow 2day kinda sucks
1,I'm feelin' so g00d.
0,"USER me too, boooo"
0,"USER Hi, it seems you have the same thing as me Vestibular Migraine  how long you had it & how do you cope"
1,Should call Rachel tomorrow and then we can hang out and be awesome
0,"Was hoping to catch my man USER today at the Hawaii 70.3 Ironman on Universal, but no such luck.  Check results later."
1,USER I'm going to try my best to!
0,congested and body out of whack.
1,Make it a gr8 day tweeps!
1,heyy USER ! you're cute
0,Im soo soo Sick !! Ate pizza it didnt amke me any better so
