0,USER
0,USER nooooooooooo i dont want to
0,Just saw my TweetCloud. I feel I must apologise to everyone...  URL
0,blah! first day of finals
0,USER THIS IS WHAT HAPPENS WHEN I'M NOT THERE TO BENEFIT
0,is is still waiting...  URL
0,i gotta send my baby back in for replacement
1,USER thankiez
0,USER Mines been pretty good. Why not good?
1,USER Came out great - thanks  URL - Aunt Bessie deserves thanks too
0,"I was trying to find my way to the car @ the university. However, my tom-tom was wrong-wrong, and made me walk twice as long-long."
1,Heads Up!! First round of giveaways start Monday Morning! Don't miss out  URL
0,Party was awesome and now i feel sick!
0,USER This Nadal situation is bumming me out
0,"Ow, landed on my head trying to do a back flip...fail."
0,USER very true but it still hurts at times
1,USER :aceng! hhaha. thanks for following me  are you on vacation or something? IRII BNGET! hhaha
0,"Haircut. Bye bye dead hair, dead long hair"
1,USER i just block the people who seem really shady... is that bad?
0,I wish i was sleep right now
0,USER I haven't taken offence at anything yet! LOL. You are being presumptuous I think. It's hard you are always out of synch with me
1,USER .... I did not missed a single episode...
0,USER Aww  now you've made me cry
1,"USER Thanks so much for the review, Jenny! I'm so glad you enjoyed the novel!"
0,I'm sorry for all of the embarrassing displays at my house tonight boys  I'm really really sorry
0,Just found out that one of my coworkers in St. Paul (who I actually know and talk to) got laid off. This blows.
0,"USER yes, he's the turd burglar, i never knew how it went down. i can't be mad if he shits himself cause a bad dream"
0,its only Monday
0,would like to thank the gobshites upstairs for finally going to sleep!!! most annoying night here ever!!!!
1,At Seven... Again!!!
1,USER what?? all that u say to ciara
0,USER my phone died  what's up lil bro?
0,is enjoying her baileys and watching baileys. but im all by myself
1,"USER Sofis, thank you for the shout out. I hope you are well and have an awedome weekend."
0,I went and got Dunkin Donuts coffee yeah I know I shouldn't but its sooo good and I got hash browns and my puppies aer like wheres mine
1,USER u should tell ppl where u'll be in vancouver.
1,I'm gunna tour with disney on ice the summer after i graduate ahaha
1,Happy Sunshine to all
0,USER i have no money to go see it  i'll wait fro the dvd lol
0,"Indians can hit, they can't pitch.  USER And now Derrek Lee / Has 32 RBIs / Still behind d'Ro  #Cubs"
1,"USER Can u follow me please 8D, I â¥ ERICA!!!she rocks, she`s the best actress."
0,I'm soooo mad.  Someone stole my dang bike. I bought it last summer to have to ride around the neighborhood and to the gym.  WTF?
0,"tonight was no fun and super lame. waste of time and stupid bars/alcohol. i wish that there were cute, nice guys to party with....but no."
0,USER meebo kept booting me
1,just talked to Mikee via phone call  aww. i miss her!
1,"USER yyyyyyaaaaayyy me,haha"
0,did i mention i hate french? i used to be good at it. how did i manage to forget everything i knew in 5 years?
0,Omgeeeeee i been n traffic for two hours now
0,my tummy hurts
1,Having fun at the pool!   URL
0,"USER ain't my friend no more, she didn't even get me an easter egg"
1,I'm gonna go shopping today with my bestfriend  I hope I find the shoes that I want!
0,last day on cikini
0,Its so hot!!! Cant sleep!
0,USER i wish there was a like button on twitter
0,Why the fuck this chick got 14 missed calls on my phone from her back to back at 430am!?!? Damn yeen my woman  u crazy mufucka. -baq2sleep
0,"USER Maybe your body was eminating so much excitement, it broke your iphone? Sorry about ur texts tho, that sucks."
1,"Trying on those khackis and dresses at 4, packing at 5. I like things to be ordered like that. OCD"
1,USER Hehe. This would make a cracking Open Source Project. There are never enough blog platforms
0,"USER i try so hard,sometimes dont get results  but keep trying"
0,Uppload picture? It dosent work
0,awaiting the F1 race! no candy left though
1,USER Thanks for the follow Friday
0,not feeling 2 well got a BIG headache n my job is sooo stressful..damn im so sick  i need a break 4real
0,Were did the UK summer go? horrible weather atm
0,"Glad Susan Boyle lost, she was rather arrogant. Arms are still glowing after a heavy dose of moisturiser"
1,"So, 7Â½ hours until Wall Street opens & I can't sleep! Can't wait to see how my first official day of trading goes. Trading tips, anyone?"
1,"Home from Brandon & Heidi's shower, so great to see the girls! Glad Danny boy joined me"
1,"USER USER They're in Murfeesboro,TN. However you spell that!"
0,"Turn of events, may need to return to Malaysia sooner than expected"
1,URL - at supercross at quest field with Krissa and some marines
1,"USER Why would I want to go see Sam? Happy 7300th tweet, by the way, for being awesome!"
1,"exactly! but people will never learn. ughh,that's cool im excited for you! i'm pretty happy cause my summer is full of concerts yay"
1,USER I agree! We'll have to go back very soon. Thanks for a lovely anniversary evening
1,USER cool  I will see you Monday afternoon #cfp09
0,"USER Say it isn't so! We just got you guys back, please don't make us say 'Goodbye' yet"
0,USER not me
1,had a fantastic time (as to be expected) hanging with USER all day.
0,USER - oh no.   I'm so sorry to hear that.
1,USER I have been waiting for sequel!
0,so tired cos a storm decided to happen right outside my window as i went to go to sleep
1,USER cheers for the recommnedation mate!
0,is sad that today is her last day in san diego
1,USER - I'm right here!
0,USER lol :L im well angry my  m8 gets to go to2 JB concerts  x
0,:: not gonna let tha cavs ruin my nite  but I'm def not watchin tha finals this year! ::.
0,"USER I've tried doing that, but my NDS just says ""Loading..."" and does nothing"
0,"So I was falling asleep, then that earthquake hit and scared my sleep away"
0,USER hope so - I don't have an iPhone (USER)
1,"USER no i think you made a good point, just wanted you to know that I learned from the experience and wont do it again"
1,SO EXCITED about seeing the beautiful Caleb and Nathan tomorrow at the o2
0,"oh, that's so stupid!  USER"
1,USER Friday shall be known as #tappingfriday.
1,Logging out of twitter now. Buonanotte
1,"USER hey, thanks for the saturday's friday follow."
1,USER URL - eeeek cant wait!!
1,"New video at URL Check it out, regardless if your a fan!"
1,good moring! ..back on the slave shiP!
0,USER hi mike did you hear the farrah fawcett died
0,Just played with an iPhone 3G S in the Apple store. Much faster; I really want one
0,"USER Sadly, it was not"
0,It's too hot to go to work! Boooo
1,USER Thank You!
1,USER I just had my last final today...good luck this week.
1,USER I had a great time today! Thank you  Hope you can use one of those photos I took today
0,USER i am.. i'm at work now
0,USER have no link here... there is only a Twitter and Flickr backchannel
1,getting ready for chrystal's plane to land...  hour and a half and she's all mine
0,USER Sketching on a PADD. Not a lot of paperwork when your a helmsmen.
0,This morning a doc in Kansas was murdered by anti-abortion extremists. What a tragicly sad day for our country
1,USER Cool! I'll be there!  Just tweet me when ur there.. ;)
1,Double date at bdubs
1,USER doesnt taco bell call it fourthmeal?  i'm hungry too.
0,"USER I wanted to do that myself, but turns out I'm coeliac. hard to ask for gluten free food in a war zone."
0,thank god its Friday.... oh wait
0,workin on mah case study again ..
0,USER He doesn't know what 'j' stands for - he's old and has lost his memory  That's what 3 years of marraige does ;)
0,"""Ã? thá»©c tráº» em Viá»t Nam cÃ²n thua ThÃ¡i Lan vÃ  LÃ o"". Nghe Äau xÃ³t quÃ¡"
1,USER its on britains got more talent now  well. it was its adverts now.
0,Anyone playing Mafia Wars?? Just started today and have lost interest already  prob dont need another addiction but its not that great
0,I am achgein in every body part its not niice ... Dats wat happens wen u jump in a pond drunk n dnt get enuf sleep  sad times
1,USER spread the word hun
0,USER um...clean it because u have 12 foot people over all the time?? lol. sorry u fell.
0,I had the most amazing dream I'm so sad my alarm clock ruined it
1,"USER  when I interviewed IV, I mentioned I found her thru u - she gave a big shoutout 2 ya."
1,"USER Bing works on IE6... Honestly, they care. You can't wash your sins just like that"
0,USER wish u were here too! So bad
0,I nvr wanted May to come to an end
0,USER ohhhh i'm so dumb  i've gone through every language :'(
1,USER That's right! Hey you
0,I told myself I'd give the #cafepressfail MP a one month trial: Day 3 and my trigger finger is twitchy. I'm think I'm opting out today...
1,Thank you for the  #ff  USER  USER USER
1,"USER can u follow USER  ? u just click on that USER and click follow like u would follow anyonee, please  oxx"
0,Getting ready for zee wedding its TOO EARLY I NEED SLEEP
0,One of my favorite bands has a free show in portland today. And I can't go
1,Preparing on UMTS presentation
1,"i miss my dad and his jokes about life. well im off tweeters, goodnight and sleeptight"
0,drank soda so i cant sleep
0,USER iya betull! hehe iya bagus! eh hana happy kalo gak salah 17 bulan ya hahahha but I think I'm wrong  pokoknya selamat! hehe
0,sorry i am a lil quiet today. i'm not much in a good mood from yesterday evening ...it followed me on to today
0,"Twitter is broken, and I miss it."
1,Listening Miley Cyrus songs. Bought the newest cd!! Going to pick it up on monday.
1,loves the new background on Twitter
1,Drinking and smoking is very bad.---but im grown tho
1,USER I'm planning to start reading new moon from the top.. Hopefully I'll finish reading it prior sa movie..
0,USER never thought they were going to change the entrance marking scheme so fast
1,"USER No, but I have a 2-ton crane. Come to think of it, an hydraulic press would be a nice thing to have."
1,you guys are going to LOVE me! DVD QUALITY of wolverine streaming online! no need to download or pay to watch  URL
0,My ears are so itchy! Need to remember to put sunscreen on them too
0,It IS NOT going 2 b a good traffic day! But in light of many more serious issues in the world like plane crash (  ) I'm not gonna complain
1,USER well looks like they did. while we werent looking
0,"Going to bed, have a wonderful night all! I will try and be more interesting, lost 3 followers, please don't leave me tweeters, pweez"
1,"five hours, fourty two minutes, and 9 seconde till the three day weekend starts... but who's counting"
1,"#ThisDay in 1903, Pepsi Cola company forms. Now this company has surely touched lives of many"
1,USER How have u been DA! KayCee here
0,Whats to be a big  time singer but that will never happen
1,USER This is great - I feel like I'm connected a bit ...
0,i need a lil nightlight this is the only time I have to read my books! when leanne is off to bed!
0,going home
1,I'm back guys
0,USER I am lost. Please help me find a good home.
1,"manooooooooooh,quee sonooo hehe"
0,USER I think I'm listening to Mitchell Musso  It's hurting my ears.
0,"USER congrates, good job ....i still go another year"
1,Fishing with Tyler!!! Maybe we will catch dinner
1,USER Hey hey! How come you got a new Twitter?
0,USER yeah definitely not so good this year  and I'm worn out chasing the kids kites when they let go
1,suppose to be studying but is busy watching 'the story of us' ..hehe
0,USER really? people say i looked doped all the time
1,so today was actually pretty good
0,Ate something bad
0,USER Nope  I was wearing factor 30 sun cream too!
0,sister was just admitted to the hospital...waiting to hear how bad it is
0,its official... I'm as ill as i cud get... Wish my mum was in the country at times like this..
0,Is watching Primeval toight coz i didnt watch it last week  thank god it is repeating it! and it's the last episode! that's not good!  â¥
1,going to USER 's party. rocking to nickelback
0,"working 1-9:30 tonight. oh man, i definitely did not get enough sleep for such a long shift. good money though, right?"
1,USER a good book or a hardbound journal! haha
0,"USER I've started to via email, more since I've met TOG's on here.  Work at 8 though so never get to listen to the show"
1,USER I wonder if my wife knows I would happily live out my days in the 8 X 16 ft. shack I built in Arkansas in '71 if I could ?
0,is being freaked out by Frito... he sounds like he can't breathe
0,USER aw dustin I'm sorry   That has to be hard
0,my blackberry isnt charging!  poor baby might be broken D:
0,missed whale at jack fish alley by 40 mins
1,Photo: theanimalblog: Hermosa imagen  URL
1,"yaay weekend!!! ...  badminton, basketball, beer!.. aah!.."
1,"on a FOB mission at 430am. spam, rice, & eggs. love it"
0,.USER *rethinking my desire for an iTouch* Sorry  to hear that hon.
1,Go to townsquare and find me there bitchess.
0,USER  boo. I used to live in upland... Have funnnn
0,"USER Yeah, I don't know, I'm just dissapointed USER is a total different person now. I didn't expect it from him. Not with me"
0,ictt :/ toooo early
0,USER yeah. My friend can't go anymore cause of work so we had to cancel.
0,I'm so clumsy  slipped at least ten times today.
1,USER ..except on Twitter. It's where all the COOL royalty hangs out.
0,the epicness is now over now here comes the hangover... yay...
0,"It's 8:06am, I'm up, but I have no exams. Why? I have a staff meeting in work"
0,Nature's rough. Just heard some kind of animal screaming outside my window while it was mostly likely being killed.
0,USER I wanna be there  sawyer foreva!
1,"USER Thanks for the Kris Allen interview; nice chemistry and had lots of fun!  Cheers from Erie, PA"
1,I think I'm going to enjoy this summer
1,USER thank you for the follow
1,"USER  You just went to look at the women.  LOL  Send me a beef philly, no onions with american cheese"
1,USER i know
0,"USER isnt it amazing weather!! im dun to a crisp also lol bit too much today,but not tipsy  lol"
0,Sooooooooo not ready to get up. Dad has to wake me up so freakin early everytime I stay here!
1,USER weits
1,USER I love that sentence
0,Lifes been crazy recently sorry for not paying enough attention to everyone
0,I really wanna talk to Emily; but she really doesn't want to talk to me.  :'( *crys*
0,ugh...I hate feeling this way    hopefully tomorrow will be better than today!
0,USER USER I triieeedddd. I dunno  ill try again? USER you'll have to go to nyc with me.
0,SQL Server really doesn't like it if the table isn't owned by dbo
1,rainy day on my day off..humph...i'm thinking a movie is in order? i wana c the hangover
0,USER i miss obsessing over kstew with you. you only slightly judged me for it!
1,USER Thanks  John Mayer is really great! i like his music a lot!
0,Its 5am! Time to go home.   I haven't even left yet and already I miss chris!  This sucks! On our way to airport.
1,thanks for following me  I intend to be a good thing in your day
0,So sorry to hear about the 2 colliding trains.  My prayers go out to anyone who lost a loved one.
1,NIce to hear so many people enjoying their day  That's what weekends are all about.
1,USER me to  but i didnt admit tht haha
0,It's Monday morning and u have 5 more days for the weekend!!!
0,I hate lifetime movies ugh make me sad love stories always end happy whatever
1,USER LOL exactly!  Too funny you just took me back
0,"i have a veryy hard bet with a friend i have to have  100,000 followers and she too :S omg i have to win! but i don't think"
0,Zaddies out of dog food and i feel bad
1,USER LOLOL. i watch them when nothing else is on.
0,USER Haha nice nice. Oh dear Matt is dating someone. Frick everyone in hollywood has someone.  It's making me SUPER jealous.
0,working on my CJ PAPER!!
1,i love the sun shine
1,USER haha.. tell them they are the monks of the IT world..
0,USER Mmmm shushi! I haven't had sushi in more than a year because I live in the middle of nowhere at the moment.
0,USER Please file a bug report. We probably broke something with our recent JS performance improvements
1,"What is it with kids and spinning around in circles? She's delighted, but I'm getting vertigo just watching from afar"
0,"USER I tried, but that takes me to godaddy.com, no link for a video."
1,awkward family photos URL So funny!
0,USER well it sure was convincingg! and things are still going wrong
0,USER I'm a minute in and I want to strangle the used car salesman doing the presentation. Is he related to the ShamWOW guy?
0,i have no idea why my back i so painful.
1,you belong with me USER!  i â¥ that song! (:
1,"Can't go wrong with Chocolate!   Mr Beck, thanks for all that your doin! I pray for you, your family and staff.  ~camino~"
0,That's it!  That's all I slept?!  Wow I got bamboozled!
0,"nan coming over today, but my brother s still off school"
1,USER which reminds me that i could use a drink right about now. peace.
1,looking for some new frinds on twitter
0,"USER no, I saw your post but I'm not familiar with anything that does that"
0,USER just sittin on this haha pure bored  n omg dont say tht :| am takin tht off am actually paranoid about it! is it really :^)?
0,USER Your metaphors are conflicting. But I sympathize.   Here! Laugh! I command thee! URL
1,? USER woooo new single!!!  URL
1,"USER Eeerrr, normal people kinda go to sleep at that very time."
1,I'm attempting to make Hot Cross Buns with Bella & Ari
0,"SEO SEO SEO SEO, I'm sad                        WHY SEO AROUND THE WORLD !"
0,USER you're with my boys!  tell them i love them haha
1,"USER (maybe you need to explain that you're from ""up north""  )"
1,USER thanks
1,Tonight was pretty chill  Get drunk with my girls shooot <3 I love them
1,USER Palm Poop??  Ewwww...see never stray away from your iPhone.
1,"USER Oh, well that makes sense. I grew up in Houston too. My parents had season tickets to the first Texans season.  Ready for the game?"
1,"Wants the new book ""Holly's Inbox"""
1,"USER USER mine is breakfast because the next dude i get with has to be like the last, and make me breakfast."
0,Huge party at my house tn... except .. that ... it's my parents throwing it. aw..........................
1,SUMMERRRRRRRRRRRR!!!!!!! vlog today!! woohoo! so excited!!
0,I'm back in Huntsville now. Lets see how refreshed I feel at work tomorrow. Ewww... work.
0,"Holy shitballs, Fear Factory's Archetype album is absolutely metal as fuck. Shame the album after that was weak"
1,"USER lol Gd , don't know what else to say lol emm ...  Hello Again"
0,Only me and USER came to see Mr. Kane
0,My stomach feels funny.  Must be all the antibiotics still roaming around in there.
1,USER lol..in my relationship 2..we stay arguing & dnt even remeber what 4 or how it started..ur not alone joey
1,USER Hahaha oh yes! Sounds like quite the amazing plan you got there. I'm up for it!
1,USER Of course.  You're best friends with a female Einstein!
0,USER ouch ouch ouch!!!
1,"USER Treat yourself, go shopping"
1,Anyone know any testers who need a job?  I need to hire people for my team
0,USER no idea  been staying away from junk food and artificial shit and my body is just shutting down
0,"USER USER Thank youu! I hope soo, hopefully I don't fail anything this sem  it's been SO ROUGH. Just ask USER."
0,working on my oral presentation and upset.........
1,just saying hi from Budapest
0,USER i hate you right now
1,Just woke up... I'll go for a run in a few minutes
0,"USER Does doc have drops for that? Not sure when it's on eye, but patch will keep him from touching & less irritation maybe-poor guy"
0,idk what imma do without my camera
0,last day of grade 9. omygee. then math exam tmr  after that i'll be SEMI-HAPPY. (:
1,USER hey demi! Say hi to me! Please?Just 1 Hi then my day will be colorfull than yesterday!
0,USER it was fun times and much needed relaxation. Went by too quickly though.
1,"had a nice day off. please check out my art, i'm new, i need feedback! love,d- wecreate.imagekind.come"
1,Wow! A very hectic weekend
1,Watching old Iron Chef
1,"oops, I'm too tired to even type correctly. guess i'm proof it's true though   ""A ruffled mind makes a restless pillow.""--Charlotte Bronte"
1,Wow... how weird. I just saw a new Chase commercial with a different song... a song I actually like.
0,My laptop isn't working
1,has eaten some cheese so now is going to mouthwash
1,#startrek show 2nd time around was equally good as first. Satisfied geek here
0,"I had something I really wanted to tweet, but then I got a text message and forgot what it was."
1,ok back to Palms now. What an awesome night tonight was
0,Grieving is not fun... I miss Bill so much
1,Done with the family gathering. Having a haircut and later maybe a movie   URL
0,I miss my mustache..
0,i think i got the delhi belly  cant take spicy food no more (
0,"USER well, yea my brother is kinda in a mess right now . Too much alcohol I guess .."
1,yay for being on the radio!
1,..if you were a beautiful sound in the echoes all around then i'd be your harmony..  URL
1,USER I know...sorry to burst your philosophical bubble
1,well i should be getting to bed now...goodnight!!
1,USER Good morning!have a great day
1,USER haha very nice
0,"Ok, I'm off to bed so I can get up before 8 and get ready for work"
1,David Reutimann donates $5000 towards Carl Long's #nascar fine - website shows $9408.30 donated so far.  URL
0,ugh. last night i got hit i the nose and it stills hurts really bad  there's a huge bump on my nose now. wish the pain would go away...
1,USER Hahaha I just saw that!! It was awesome
1,Gonna work out later
1,Bad desisions with free beer. Ahhhh no ..... I miss someone
0,Time to leave Michigan...... back to Ohio
1,"USER *g* as long as u know its not gonna happen i suppose its fine  (the auth i talked about killed tea & so on, not the best)"
1,"the voices in my head are snoring so I guess that means its time for me to go to sleep and dream of sean smith  night night xxx"""
0,USER 97 here
1,USER  Good Morning   Lovely to start the day with good feelings
0,USER yes!!! That's how I feel at work
0,USER i miss u  soooooooooooo much !!
0,lying on the couch wishing I was out walking...  oh well...watching a moviee! kinda bored though! oh darnnn
1,"yeeahhh just finished my new painting,.."
1,USER going to work in trials at City of Westminster court with Junior and Zaineb so it should be funn I suppose  wanna do Law
0,USER oh man  how long til you get more?
0,USER Did they say why?  That's no good
1,USER: yeah. I'm fine. I just feel really dizzy. Thanks for asking!
0,Im not sleepy but need to get sleep because of work early tommorrow
1,USER a well... as long as you don't spam up the timeline with stuff from twitterfeed you should be fine
1,USER Oh no! Hope you find your voice soon
1,"Done producing ""Setiapku Denganmu"" for Phalique Verbalize Flo. Nice song look out for it! Now doing my song ""Satu Dalam Sejuta"""
0,I keep trying to stay up late but it just isn't working!
0,USER hmm...i think the plans hv changed...
0,Dreams + plane crash = nightmare
0,USER ....
1,Getting in the shower
1,yey!!!sarah intro coming up!!!  might have to go for food so---fave scene is chuck with lil girl! #chuckmemondays
1,I'm a lover not a fighter  smh @ the girl drama last night!
0,USER i'm well sad now
1,USER mkk  thank u
1,USER fab  I'd love to do that!
1,I have a lot of talented friends! and I love them all
0,Hey everyone - it's my birthday today but I'm not doing anything special at all - didn't get organised - one boring day - go to gym tho
0,I wish i played soccer today
1,USER lol im watching it too hehe. 2 hour spesh tonight!!!
1,URL - I love that! What do you think ?
1,I'm wiped - sweet dreams lovies
0,i have nothing to wear!
0,has a headache.
1,"Been to the gym with my PT, I can hardly walk... Hopefully it will be better in the morning"
1,USER I like the food angle to it. Thanks.
1,I'm talking to Amanda now. About The Mars Volta.
1,take a look at our new design!  URL
0,USER Hey baby just saw in concert at Palladium had HOT PINK BOAS tried to get you attention you did not see me & now im sad
1,"#FollowFriday USER USER USER USER USER USER USER If I missed ya, just stop and say hi"
1,"USER Pandawa, Kurawa  easy to pronounce ;)"
1,USER hope everything with css worked out for you raen. yours is great
0,is tanning; work in a few hours
1,USER  y thank u! and of course everyone follow USER b/c she's so sweet!
0,my finger is now pregnant
1,"USER *hugs* that's all, just *hugs* ."
0,sad for the people on Air France Airlines...RIP
1,USER Still thinking social media?
0,"Ok, really starting to get tired of these damn bats. I cant even enjoy being home from my vacation."
0,USER I got this nasty skin infection on my nose
1,USER She don't look so Desperate any more
1,"USER That would be so funny!  ""Hi Ms Cruz! This is Kayleen, she's your student for the day""-J ""Hola.""-K"
1,USER no way! srk's class and sallu's fake abs!
1,"Preparing to take off for training, damn those shoes look nice  Also heard the sad news of Robbie McEwen today, hope he'll be better soon!"
1,USER I just listened to your music dude.  Really good!
1,and back on the bus... :/  Calishfornia here I come !
1,"Weird dream last night: boat in pool, cut in half by chainsaw, everyone sank to bottom, USER was there & saved them all."
0,"USER I still want pics for the before-after ""stuff like that""  e foste tu k prometeste"
0,USER maybe your right broken on my home machine now too
0,last day of summer
1,whoohoo Mtv Movie Awards Tonight
1,"USER they're particularly nice, when the weather cooperates, sitting out front and people-watching while imbibing."
1,USER Nevermind   Trolls and spammers are the speed bumps of the internet.
0,Ugghh...Stupid Tv on the blink...westinghouse tech supports sucks
