0,I got my period.  And I forgot pads.
0,USER came back empty handed?? poor thing
1,Moblie phones are moblie !!!! Home phones keep there asses at home  !!!!
1,Gotta give a shout out to my peeps in Calgary and Edmonton! Such nice people
0,"USER hahaha I will NEVER have that problem, even in heels"
1,USER You gotta be happy you're #5 for Adelaide though
0,USER  i have #awesomecouch  plus i like being to cuddle up to the back... need man to cuddle
0,USER Yup! Finally got me some 3GS lovin' at the Fido kiosk.  Apple store got a bad shipment of phones
1,USER ha ....where have you been ??? ... Not seen you around for a while . Too busy on LP ??? hahahah . You've been missing alaska D
1,CONGRATS GRADUATES
0,USER it was quite amazing! I wish you could have seen it as well! USER your fault for geeking it out
0,Jenn jenn jenn oh why oh why won't u pass on ur iTunes knowledge onto me?
0,I'm so hungry with my dad
1,USER Robert Pattinson... Mmmmm indeed!
1,USER xD I knoww. but its all good. we'll MAKE it through it all .
0,get better number!!  USER
1,"Abby had a GREAT doggy play date today!  Needless to say, she's exhausted now.  YAY!"
0,USER
0,Morning everyone... not such a sunny day today  heading to Maidenhead shortly...
1,"Uggghhh, I'm kinda bored. I think I'll play my guitar and listen to a little bitt'a John Lennon"
1,USER When's your birthday.
1,has changed my profile pic again  It is from It's a Sensory World. URL
1,"That's tweeter, not tweeker.    Note the difference."
1,USER i see you graduate in 10 days  but i thought it was on the 12th?
1,"USER yup, from your comp. to the right of the tweet where u fav it, there's a trashcan"
1,"USER okay  I'm gonna start now I think... but there's really not much to do, is there?"
0,"USER Mosquitoes, not yet but they'll arrive soon"
1,This year is going to be an adventure.... & i'm lookin forward to every minute! I'm ready to be happy
1,"JUST HAD A GREAT BREAKFEST... "" THANK'S MOM  """
0,"Heartbreak hotel. Of course it happens now. I really dont want to go home  heartbreak hotel, on sooo many levels"
1,Just read that Michael Moore proposes $2 a gallon tax on gas. Who said liberals don't have good ideas?
0,i waws going to plant flowers today but it raineed and it has ben raing!
0,USER USER awwww I wish I was goin wit yall tonight but I got other plans
0,in the common room with matt. english lit pre release woo! haha its a beast
1,USER I'm adjusting to the APRIL SNOW!!!  Lots of good stuff happening for me besides that tho...just have to find a new band
0,i put way too much soy sauce on my rice
1,Happy Birthday Roseanna !  18 Today ! Wooooooooo
0,Didn't run fast enough to catch The Monolators
0,"grandma made chex mix for amy and i. my bag went missing before i could eat any of it. apparently, amy stole it and ate the whole thing"
0,it's a nice day outside. too bad i'm at home sitting here
0,USER  Clean Me!
0,UGH! I hate spiders!!! Why god made them idk? To give me heart attacks. Great now my chest is gonna hurt and I'm paranoid.
0,"Why does no-one ever comment on my blog?! I know people read it, and it's so pretty  URL"
1,phillies game today  phillie phanatic birthday
1,Thanks for the love everyone!  Right back at ya!
0,"sims 3 didnt work on my computer at first.  but then i used it on my mothers computer and SUCCESS! only thing is, she limits my usage."
1,USER unlike you sikulala darasani  I was a the perfect student...always alert and all
1,"reading some Lost-ish stuff, my husband is making me meatloaf and mashed potatoes for dinner"
0,USER I have 8 open currently - below average
0,"USER don't please use Hulu ... nobody outside US can see, and no change in sight"
1,USER  You Too!! Thankiesss
0,"USER  - Gina, you know you're getting old when you didn't know that Eminem had dropped a new album.."
0,USER ahhh tht sucks  whats up then?
1,USER You're a lesbian  Thankies for also making yesterday and today so AMAZEEEE  xoxo
0,Gonnnnaa study all day  hopefully with USER for some of the time!
1,Love you Gavin & Lish.
0,somehow #twhirl doesnt work properly on my office network..
0,Gloom and Doom in LA  Where is the sunshine? Last interview today Pray for me!
0,I missed the earthquake.
0,USER hey wow! You are! And just in time for my temperary exit. My ipod of 4 or so years took a terminal turn yesterday  #DeathInTheFamily
0,drinking tons of water cause i ate bad today.
0,To indo depois eu voltooo.... ps: i miss you
1,"USER i've seen n comment ur Ashita no Kioku, thanks for uploading it!  n i've seen AU cm too! SakurAiba lol"
0,guess not
0,Such a bad headache
0,USER - nope
0,is packing.
1,"just saw the movie ""UP"". it was sooo cute  the beginning was a little sad though. Dug is the best!!"
1,USER Sugar helps a hang over...Have a soda
0,My phone needed to be charged yesterday and now I've lost it and can't ring it because it has gone dead
0,USER It is a foreign 4-door... Kia Rio  White with a big black molding stripe. Looks like a reverse oreo!
1,I liked this weekend.It was lovely.It makes me happy for once.
1,"USER haha hell ya id love to find some boys to toke with, and thats a very sexy bike"
1,any internet marketers want to test an web app i designed to help track tweaks to sales pages and websites? contact me
1,USER thanks for following me  Goodnight and God Bless...
0,"It's all so sad, now just pretty much waiting for him to die and it's so horrible to think he will be gone. My poor dad.My poor cousins"
1,Trying to plan this trip back to Ohio to visit my sis at the end of the summer!!  I really like it there!!
0,Just got kicked out of my house so tile can be finished.  Can't wait for life to be back to normal.
0,Urinary tract infection lecture..
1,Turning twitter off for the day
0,USER faye i'm totally sun burnt from today as well
1,"On me own, someone bring me stuff to read"
0,"idotutorials.com has crashed, i believe."
1,"URL - My little munchkin, Benji"
1,hanging with jessss  having fun!
1,"USER Morning my dear, i'm off to get my eyebrows and hair done... How girly do i sound today? Haha. Have a nice day"
1,"Huge fan of your website, been following for many years now. I don't post comments though :/ The changes look great, love your work!"
1,"USER sorry to hear that. Go lift some weights, that usually helps getting aggressions out"
1,My Recital- concert was aired again on T.V. last night
1,"Hey, off to Santa Cruz again two months later!  Is this a theme?  I hope so."
0,"USER if that series happens, it has the potential to be super boring...  Chauncey will make mincemeat of Orlando."
0,...but then i got woken up just as one thing led to another... ahaa i tried to go back to sleep but couldn't
1,The cover and page 1 of my kid book are done. I love photoshop
0,"USER haha release that tension!  pop it in pop it out, repeat! Haha work at 4am  sleepy time nighty night!"
1,USER Nightmare on Elm Street
1,USER funny
0,USER seems to be happening to everybody as of late
1,lmao not school again  I love my mom.well w. chloe and titan my lil babys.waitin for my boo to wake his ass up.text me.out l8r.
1,USER Hey she is cute.  I like red!  but still I would prefer USER  She was the BEST!
0,"USER, i've an endless supply of sexoi summer clothes but i brought warm things"
1,yahh.. kelas XII!! focus! focus! for my future
0,"noo.. this is getting worse. I'm totally asleep only after 7am for today! ""thinking too much"" syndrome is here to stay."
1,jjoooooooooooo.....got one
0,Download was the best weekend of my life. so sad its over now
1,USER Trips to DFW just got a lot more expensive for me with that PaB wall.
1,USER Well you better get it used to them.  It will be in them for a long time now.
0,I think that Kate treated Jon like crap - ta da.  I'm sad for their family and all families that fall apart over lack of communication...
0,"sad day. ""codes in the clouds"" is such a great name for a meh band"
0,I don't sit on public toilet seats
0,URL pop'n music wii characters! OH GOD WHERE ARE THEIR LEGS. Hopefully this isn't all of them. I'm greedy and want Zizz
1,USER haha.. hommie we r so coming and visiting u then  in an 100% serious kinda way
1,USER it's not so old 33 year old woman going to bed kali. hehe
0,Blah! Home doing homework .& studying while my friends are out!
0,USER poor red
0,so very tired
1,"My History books just arrived  Now I have something to do in my 12 weeks off. Bar sleeping, I mean"
1,USER and how IS Betty? aka Mrs. McKay?  (waving hi to her from #Vegas)
1,Just got home from auburn. Resting for about an hour before headed to grace. Pray its a restful hour
0,USER sorry got screwed into not getting to go and barely touching to computer.   Hope you had a good time.
1,USER
0,USER  I own all the airwolf dvds AND I had the poster as a tween.  too bad he has to go hit his gfs all the time
0,im soooo shortttttttt
1,sleeping late and enjoying the day tomorrow.
1,USER yeah i was shocked he probably just pitied you..... thats y i talk to you from time to time
1,"USER Hope your day gets better! Make Erick, Sammy and Kane take care of everything for you and take time off"
0,"I hate you Internet Explorer 8, Just when I thought I I had worked out IE, ohhh no it throws another spanner in to the works  #rage"
1,"USER  Have a safe trip in Miami   Make sure u hit up Wet Willies in South Beach ! Ask  4 the drink called "" Call A Cab """
1,USER in june. the 6th. a sat!
0,oh gosh a whole day spend I.T assignmenting. faaaaaaaaaaah what a waste of weekend
0,USER yep i knew but couldnt get out of work damn i wanted to see Johnn Connor
0,After the shit I just saw! I know I made the right choice  SMH watch the company you keep yall!!!SMDH if they only knew the voodoo he do
1,USER Check your inbox! Enjoy Beirut
0,Done practicing. Still missing camp.
0,I'm getting stuck at every traffic light this morning
0,Knotts or yearbook? I don't think I can get both  Too expensiveee.
0,Why do I always miss the important texts? Gahh and it was from someone I'd least expect too
1,USER jameson is my poison of choice... send me one!
0,USER the joke is we were together and she just ended up beating me to the finish
0,USER Welcome to my world for the last few months
1,USER I'm sitting here in Calgary hoping you guys are planning to come back to Alberta in '09. Yes? No? At least gimme a maybe!
1,USER You just can't keep away!
1,I just had the best three days and nights
1,USER : Everything
0,"SO sick today..  I have the flu..  not the swine variety, just the regular PITA variety..    My G/F is coming to take care of me!"
0,USER we shoulda kept the streak of hanging out going and went out 2nite
0,i am thinking... is it still wise to stay or just fuckin' move on...
1,USER -- thanx for following hun.
1,Admiring the pictures and stories by Tony Wolf. Brings back memories for sure
0,back home via nan's. no broken bones. just soft tissue. painkillers they gave me starting to work... but gave me none to come away with
0,"I started my new exercise thing yesterday, I did 30 mins of pilates and some wii fit and can't sit down properly now"
0,USER talk to my zhi mui too!
0,oh no!!! br ceci passed away?! what awful news for all La Sallians. he will be greatly missed  #fb
0,I wish USER would get home already so we could have oodles of sex
1,USER Praying for a safe flight home for you & the band & the crew!!   We've missed you!!
1,USER anytime you want to talk about _The Fabric of the Cosmos_ or _The Elegant Universe_ just let me know.
0,USER  Miami never gets this stuff.
0,trying to come up with my business plan. its hard juggling school and work.
0,ohhh I'm so scared...I gotproblems w/  the printer      What's wrong with it ?!
0,USER disappeared from my bag
0,"USER omg ur soooooolucky,id do anything to live there  ANYTHING!LOL"
1,"staying afterschool today  not that i have any ""friends"" on here - but if i did , i'd tell 'em to text me ! lol [ likin' us <3 ]"
0,Crazy busy morning
0,USER i missed you too  cant wait to see you  just in south america at the moment.
1,"USER Dude... I'm rockin an old school 15"" MBP. I'm maxed out at 4"
0,it just cost $30 to fill my car up. sad story
0,USER I can't get any
0,sorry for not being on...net is down. my dad has to go back and fix everything!
0,"USER Yeah, just random body parts. Like the tip of a wing, a rat tail, a crawdad head, mice heads....it was bad."
0,I`m bored.  I`ve been online since I woke up. :| There`s nothing to doooo.
1,Hanging out @ Lake Waccamaw in NC for Dawn's wedding
1,jack nicholson looks like my husband @ 1 of my daughters game going nuts on a call he don't like lol
1,Just picked up another bartending shift...Monday Happy Hours
0,USER hey you...Erik and I are just awake and moving.  Feel awful.
0,Playing online trying to forget bout KK losing to TT and promplty run AK into AA in sunday second chance on tilt
1,is watchin Taylor Swift-The Fearless Tour on NBC!!!!!!!!!!!!!!!!!!
0,"USER Ya need to get a pic to show us all hehehe How's NY my flatemate is coming in 2 weeks, wish i was too  xx"
1,USER I'm good my Bella.
1,in a few moments I will be off to dreamland  got a long flight tomorrow good night arabia
1,"Fettes Brot,Deichkind und Laas Unld."
1,"Yesss!! Walkers are Gods special creation, he can chill in there while im tweetin it up boo!! im mad hypee i get to see my boo tonight"
0,Man I lost a follower
0,USER Lmao I'mma beat u up!...I miss u  I haven't seen you since before the recession lol
1,USER I'm good. I start dental school in like a month. I'm really glad I found you on twitter!
0,I slept in and kinda chilled out all day. Metal Gear Acid broke   Stupid Gamestop refurbs. Now just kinda hanging out till time for bed.
1,USER - good morning to you  How are you today ?
1,"going to the U of I today  IF my parents will ever leave. first they say leaving at 11, then 12... well now it's 12, and we're still here!"
1,"USER Okay, I Love Owl City! Rainbow Veins is really good. As well as Fuzzy Blue Lights"
0,crap muscle pain
1,watching grey's antatomy re-runs
1,Btw...2day is amazing. All I can say is god is great! Excited bout things inthe works. Oooow weee  oh and peep www.youtube.com/hardknocktv
1,USER your welcome
1,zumba and yoga kicked my butt yesterday but it was GREAT.  being productive today
0,USER I am sorry  Its just a flesh wound though
0,No lunch today  Mom didn't pick up the goddamn phone! rest of the day is gonna be a living hell
1,waiting for dinner. mmm the roast smells nice
0,at New Fashion Hair Design in Cupertino. always run into ppl i know here. and they all use the same stylist as me. and always have appts.
1,USER HAHA we actually got a warning when we got pulled over for following too close
0,USER I don't know how
1,Staying with my grandpa
1,USER The Aristocats is leuk!
0,"Ohhh Ralph Lauren Wimbledon Polos, theyre so nice! But almost Â£100"
0,"my advice for the day: don't share IV's with others. Damn drug users don't just mess up their own lives, they mess up the whole family's."
1,just got out of the showerrr
1,is taking the dog to the vet then a play date with Annabelle
0,Already half way through my book. Don't wanna read too much of it or else I'll have nothing to read
1,"USER  ahh so happy for you, can't wait to see it, great news babe!"
0,USER I'm jealous. I'm stuck in the newsroom
0,Hmm...I'm bored already this weekend...
0,my itunes is playing in mono not stereo........ hmmmm
0,is it a Crank syndrome  ..increase heartbeat
0,USER The price is right but the software was epic fail for me. The only app set that would consistently crash.
1,tanning  it's so hot out
0,"Now people r saying they're not going to flight from brazil, to france, with AirFrance.unfortunatelly it'd have happen' anywhere"
0,I is goin to bed now
1,"I caught 4 fish  now I'm tired, happy to be going home."
1,Was is twebbstack that started the trend? I need to know who to credit on the site  #bradiewebb
0,says i still cant find my loose leaf notebooks!!  URL
1,I'm loving this hot and sunny weather
0,USER We were expecting a trip report.
1,USER I hope you find some awesome stuff!!!
1,thanx peeps 4 following me
0,Why doesn't she want me
1,USER aww so jealous!! Have fun
1,but im notttt lol. i swear twitters. the let out crowd was o-kay
0,I hate having deadline
0,My Sony Vaio is broken! no internet for me for a while !
1,USER  Because I'm real reactive guy
0,USER all the more nere wracking then
0,Goodbye michigan & USER  thanks for the awesome Gootch times!
1,"USER URL - Jealous of your amazing seat, and oh PS, nice hair."
0,URL Some more parks crashes his truck of the road. As a result I am in the office 45 minutes later than planned
1,is finally a few days off  so excited!!!!!! then interning!!!
1,was able to sell all her vends but one.  *it's a good vending session* URL
1,USER u can at my fridays
0,No nightquil shots tonight
0,USER Shoot! that's long distance!
1,USER Ah! OMG! I didn't know you had a twitter!
0,Off to bed...hoping to keep my dinner on the inside & that my tummy will stop the gymnastics   UGH!
0,USER your gonna make me cry.. My suit case should be out
0,"USER I'm sorry your thread got closed.  In the future, would you prefer we ignore all assitude to try to keep your thread open?"
1,USER URL - Raquel is so nice! Aww both of you are absolutely gorgeous! aww  xxxx
1,"USER, hi miley ! how is your day ? please rep. I m very like you and your songs. your'e my inspiration. on styles and music"
1,thinking about going to Wildwood on Sunday
1,USER Brain went well lol..I'll post pics as soon as I learn how LOL..She should get an A on this baby. It's quite creative
0,yay I was finally able 2 cast all my votes for the TCA. i votd 4 selena 4 the red carpet thing cuz she was only nominatd 4 that one award
1,USER I'm using twitter to get a hold of your ass. Twitter! Ugh! Hit me up on Skype - it's wordpress related yo.
0,Woman downstairs has a very yappy dog with the delightful name of Tallulah... I know this because woman yells at it over & over again
1,USER omg if he drinks the RS its OVER...it's called cab ride! expect some early morning tweets girl
1,USER Say Anything
1,USER Give it up already.
1,.... after another episode of Friends
0,My index finger is hurting me a lot. The pain is at the joint. Ouch.
1,"USER USER daily nerd links suffered for first time in a long time this week, next week hopefully will be back on track"
0,Think we ate dodgy burgers today. Daughter feels sick and I have dicky tummy. Clearly a case of the cows fighting back
1,"USER wow, i really cant believe you are answering everyone you cant. kudos for that.  i just love you ms suze"
1,USER I threw him out!
1,"USER Kickass... what tent are you in, I'll bring you some coffee or donuts or something. I may be getting one through work."
0,at the library right now using one of their computers. i wish i had internet at home again!
0,"USER I keep hearing that they are likely to get the 6th Yorks & Humber seat. If so I'll be devastated, that's my area"
0,My tummy hurts
1,"USER  trust me federer says things that if listen closely are so cocky, but I don't think he purposely says it"
1,URL - nah this the american family lol but did have some jamaican escovich fish
1,"Watching Mister Maker with my son, off out to luch soon"
0,USER Tweelings hurt? What's wrong
0,omg my back.. my frakin back... soooooooooo much pain. i've turned into an old man
0,"USER The thing about #DIGG is that things from 5 years ago gets reposted as ""new"""
1,The sun is shining just the way i like it
0,Got the shop's air con on at 17degrees and i'm still dying of the heat
1,Just sorted out a bunch of stuff to go in the local trade paper. Been putting it off for way too long. $ will go towards an iPhone 3GS
1,USER Googled the story and here it is...hope that helps.  URL
1,i was not aware we were back at school tomorrow! too late to prepare now
1,Kenny Lattimore is a really friendly guy.
0,going to have a shower and get ready for work.........work
1,USER yay!!! lmao. i'll look into that. i want Unlimited everything.
0,USER Bored out of my mind
0,"USER of you in my computer, LOL please answer me  <3"
1,USER hey doll ! can you give USER the tix for the dallas show tonight?she would really appreciate it
1,"USER Wow, maybe his my brother in Ur my sister in law... No... He's to pretty... U R my sister...(ps U R pretty tooo_"
1,USER don't use the latest version though   google for amarok14
0,Lost a tree in the storms last night.   URL
1,RB IS BACK
0,Long long lines at the groceryshops  URL
1,Who wants to be my best friend? Lol.
1,USER well I only wear thongs on my feet so I don't care
1,USER ouais c'est sur
1,Best of Youtube: THE BIRDS & THE BEES: THE BIRDS & THE BEES  SUBSCIRBEEEE  & leave a comment/make a video te URL
0,USER USER USER USER Glad you're all having fun in the sun while I'm stuck at work all alone
0,"OMG!!! SCOOBY DOO A-COMIN'!!! He's coming to town this weekend, and im already seeing USER! I'll have to miss ol' Scoob."
1,"USER Im so proud of my son, still remember lil leaf falling off my branch, making his father proud!"
0,"I cannot wait until I catch up to Ellen real time, it sucks watching episodes from a month ago"
0,USER Any appearance by Ace Hood is unfortunate..lol Ask billboard.
0,"ohshit. there's a line from a song in my head and i can't remember the song. all i have is 'i miss you, yeah, yeah, i miss you'."
1,"USER Yep. I hope my lame attempt with the spaces helped me to hinder them, lol. I know tomorrow I guess."
1,47 days to go. Then i'm back in america! I'm so excited! See you guys soon.
0,USER Sorry Warren didnt come it so you had to fill in on this AMAZING day!!
0,Wishing I could be cornholing with my friends on facebook.
1,USER let you off
1,tired and going to bed early for once!
0,USER It wasn't loading.
0,My mouse is all Pizza-y
1,so much to do today...and all of it probably won't get done...ohhhmy
0,marinated her tofu with too much tamari and now has a thirst that will not be sated
0,USER the memories  we miss youuu!
1,i can't wait to see her again.. for dinner
0,USER hmmm doesnt sound promising at all
0,"USER ..no, you're not complaining, back pain is the worst pain to have...it never goes away"
0,USER I want to eric!  that would be sweet!  they closed all the krispy kremes in new mexico.
1,"USER USER Seems like it was a temporary glitch, twitter loves me again"
0,doing my french homework
0,I'm homesick
1,Time to go home. It's already Monday here at Google. See you in 7 hours
0,I'm sure that he will tear my comment apart again though
0,USER Hahah!  Maybe he could give his meals to her?  And I â¥ Amy as well!  Poor love!
1,Just saw the red arrows in galway- brilliant work
1,my eyes are closer i think finally i can sleep  jajaja goodnight and goodmorning london jajaja
0,"Ugh, I just want school to be over already."
0,USER Lucky. Ive been at the pool the last 3 days but i cant go today because of my lungs
0,half of a half subway sandwich is all i get
1,"USER Uhm, the two have nothing to do with one another? Gandhi was wise, and he spent a lot of time in jail. Try again?  #tcot"
0,Sad that chris betrayed gene hunt in ashes to ashes tonight. Sadder there's only 1 episode left
1,USER thanks lady. Went well. I know better after a few days.
1,Getting ready for beyonce later  think i will tweet if it gets boring :p doubt that though!
1,"Im really looking forward to Modern Warfare 2,looks so great,loved COD 4"
0,"USER babe I'm not bout 2 go back & forth wit u, u got issues wit trust. Until u learn 2 trust me then, imma let u be"
1,And now all you Pete fans are gonna hate me..:3 WOOT again..HAVE YOU SEEN ALL THE LITTLE EMO'S AROUND NOW?!! I Love It
0,George gone  Grey's will simply not be the same.
0,URL  eu queria tanto ver cat power
0,Bored as hell in class
1,Looking for someone to write some software for me... for free.  Just let me know!
1,"Curled up in a blanket, sipping coffee & watching ""The Garden"" in my director's backyard via projector screen..training week is great"
0,USER You can't get sick! Get better!! We don't want anyone missing out on that amazing personality of yours 'cos you're down.
0,I am so fucking full
1,"But if I DO go, it will be my first Pride festival ever."
0,firday night and im up to.... Nothing  lol working in the morning blahhh
0,"USER omg I know where you are coming from, completely"
1,A comer al este-oeste  URL
0,USER i miss you too
1,USER ah yes now I see what you mean.
1,USER HELLO  you got twitter
0,I miss you
0,USER yeah maths is so boring!!! Nope it was the last test before the exam
0,USER How Is it? Does it get better? Cuz I only read the 1st chapter & didn't think it would be good cuz Bella didn't lyk Edward
1,"USER ummm, can I go for you?  i will gladly sacrifice my time."
1,"off to Paris today, for the GP Dunkerque"
0,Oh my gosh! Hes moving to canada. NOOOOOOOO  :'( Sad times..
0,"cavs lost, and I got this sinking feeling we are going to lose Lebron in 2010 also...why must my home city SUCK? Ah well, LETS GO BROWNS!"
1,Had fuuuun tonight! On our way home. I see lots of sleep in my near future
1,Oh yay  waking up to my favorite music vid
0,I'm craving Sushi and Jamba Juice!!!  I miss LA
0,oh  disney channel says it's tomorrow. daaaaaamn you disney channel
1,USER well i guess you need to rest now .
1,why yes jeeves. bring me that noose there  TOO MANY ASSIGNMENTS!
1,USER oh! wonderful! good luck onit! wish I was in the area would come show support! and probably buy 2 much stuff!
0,Doing colllege work and got an exam 2moz
0,Getting ready for work  . Save me plz!!!
0,Im on my phone... Cant c it  txt me!
0,"Food, Inc. was overbooked & was unable to get in.   #fail"
1,USER Thanks!!!  Ever want to get some for FREE let me know!!!
1,Just came inside from being outside with my buddys Jordon and Josh!
1,USER hi kristen..... how are you today?
0,USER Even without the dressing they're still over 500 calories. I love that flatbread.
0,"USER I'm sorry  my sn is ""as jellyfish do"" I'll hit you up after work tomorrow <3"
1,USER  awww thank you
1,USER i'm on
