0,I should be in bed already! OMG my hair is a fucking mess!!
1,USER Well thank you! That's very kind of you to say.
1,"Today, I have officially become a geezer. Now, get off my lawn, you hooligans!  URL"
0,Depressed. Dropped my External HDD. Won't work now. I know it's screwed  arggggggh
0,"USER hi mate, I am actually in the land of the un-well  but I hope you get a big send off!"
1,USER YOURE TRYING OUT?!?!?!
0,"Liked ""I lost 5 armored luxury cars today  Who wants to start an agency? ;-)"" URL"
0,USER Thanks for the invite!  lol tell him I said congrats!
0,quite sick going to doctor now
1,"Hello, new followers! Thanks for following  USER USER USER USER USER USER USER"
1,"hello children  hung out with nathaniel today, got a phone, and played both my guitarra AND WoW tcg. I'm happy.  and. talked to afton.<3"
0,There's no good food here & I'm starving
0,Hey guys getting ready to tae my great grandmother to the store..got to work at 3  ...Coach Cal your the man!! GO UK!!
0,"cï¿½ ai ? long thï¿½nh, ??ng nai khï¿½ng, mï¿½ th? 3 thi h?c kï¿½ n?a ch?"
1,USER-damn that means searching for a skirt and a dress. no prob.
0,That just ruined my day...
0,USER Mine just gets lamer  haha.  Hows the flyin goin?
0,still awake  exciteddd for tomorrow after school
0,USER about what! I have a bad felling  I can't sleep...
1,USER Have fun!
1,USER And yeah it might get a little mellow but it's a great opportunity to get used to it b4 ur solo tour
0,USER Im allergic to the worst...Rubber  not a joke lol even tho its very funny lol
1,USER hello i hope that you have a great day  I have a lot of homework to do! please come to cancun mexico for vacations :]
1,"I couldn't afford breakfast, so I made it, hehe  and it's good!!"
1,USER good! went doctors USER. everythings cool  bit drunk. news on bus boy too. will tweet it for everyone
1,it's time for my afternoon workout: 25 minutes of ab work followed by 45 minutes of step aerobics
0,OK I'll go to bed before causing more harm - g'night everybody! Maybe be back around 2am if the baby cries  â« URL
1,USER that is so awesome!!!! congrats!
1,USER Enjoy your meal
1,all in all the day was great
1,"USER I don't know, posting food p0rn so early in the day! My mouth's watering...."
0,cleaning my room!! this is gonna take HOURS!!!  *GAB*
0,i must have been bitten by some mosquitoes. My arm looks like it was attacked by them.
1,USER Yo sista! Wer'd dat pic of the hottie on ur bebo go?!?  Lmao
1,USER  hahaha I bet you are don't be modest ;P
1,USER lesson 2 do that in the shower  no clean up.  I'm old I know stuff!  LOL @ myself
0,slept for 11 hours.. had been awake since 5.30am yesterday..  and still i was late for the exam  gotta wake up at 5 tomoro onwards
0,URL - I on the other hand still look my usual deathly shade of pale...
0,i need to sleep cos i have to get up at 6am but im too excited and USER keeps posting tweets. go away harry let me go to bed  haha
1,USER will they be doing their 5 for 5 still?
0,USER Me too.  I can't believe we're leaving this week.
1,USER Get 100 followers a day using www.tweeterfollow.com Once you add everyone you are on the train or pay vip
0,Venting my feelings out ill try to go to sleep.again im sorry  but i miss my brother hope he comes home
1,USER OMG I almost died reading about your kiss last night!
0,very tired
1,USER yay.. go QLD.. i suppose.. i'm not really into it haa
1,"Have a lot I need to do today, plus ball game.... I love my Cathryn"
1,done eatinggg. Sisters talk againnn.
1,I can't wait to get on the phone and talk to my boyfriend!!!!!
0,Got stuck in a corridor between a whole load of S1s and fellow S5s while Rosie just laughed at me
1,going to hang out with my friend Anggie..!!  and another friends =P
1,USER Yea yea I've watched the song
0,USER No moneeey!  Youu didnt come through today fag!? DD:
1,i love it sooo much!!
0,"I should be in bed, but I can't sleep again."
1,crackdown 2
0,URL - My aunt's cat. I miss mine.  CHARRRLYYY!
0,booo. bejeweled is done for construction.
0,USER no! i promise  please!
1,USER as long as we're descreat and also say excuse me.
1,"USER yep, I'll be keeping my eye on the market stands on Saturdays"
1,"Sweet - up to chapter 7 exercises in ""Common Lisp: A Gentle Introduction to Symbolic Computing"""
0,They're burying Grandma Patty today. R.I.P.
0,"Sighs, well I accidentally clicked back space on my mouse"
1,USER  URL SOLVE IT NAO
0,FYI USER it's your a neck up nigga....lmao! Not waist up stupid!!! And u didn't take mi to coldstone w/u(in my pouting voice)
1,"I don't know how and I don't know when, but this year I know USER.   I can't wait for McFLY in Brasil :O"
0,"K, nvm. Apparently that's not Adam's new single. Whatevs. I'm bored and hungryyy!"
1,USER haha it went really good  yes we kissed =P
1,goin out wit shina & gigi . moviez
1,"USER well i think ur nearly there, u are a comical genius soon ull be a comical king like Jason."
0,ultrasound this morning   i'm so hungry ...
1,workout video < swimming < iChat with just about everyone. Can't wait for tomorrow!
0,can u tell I'm bored??
0,"Dannie's wedding was fantastic. Hanging out with USER also a blast. One of tomorrow's cancelled due to the weather,"
1,finished homework   now i don't know what to do
1,USER I do feel sorry for him but then it was obvious that it wouldnt work. I doubt he will have a career as a lumberjack
1,"USER ""David, your Amazon order for 'The Whuffie Factor' will arrive April 23""  URL"
1,"looking forward to spending the day with julie,off for dinner and a film. angels and demons."
1,USER Yes we are
0,"USER sorry, I don't play that.."
1,USER thank you for appreciating the appreciation page
1,USER nice to hear that
1,"USER Hey, I'm screaming at you"
0,USER me too  hope it's a good day for you
0,man. bad day.  gotta improve.
1,"USER We're at the same level.  But, Singapore are a lil bit higher in FIFA ranking... :shifty:"
0,and this is it the final shift b4 holiday! so don't wanna get ready
0,I'm so exhausted  someone give me a massage
0,USER That's horrible
0,Hope tips are better tomorrow and Sunday than today...$15 so far
0,in the car listening 2 babyface  now i wanna call betcha lol them slow jams always get u
1,USER to go with your egg tart pillow > URL
1,USER welcome/belated welcome?. I just signed up myself. Actually after hearing about it from your show and Mr. Kutcher. You go girl!
1,"o sorry its , USER"
0,USER email those pics on ur labtop to me...  I wana put one of them as my background!  URL
0,"Obama needs to stay the hell away from yours, mine, and our money!  we need less gov involvement, not more."
0,my tooth hurts
1,"USER As a follower, not sure I want you too either."
1,"I'm going to have a great 2 mon, I just know it"
1,OUT! :-h ... Goodnight everyone.
1,"Fuck yeah, my parents are out. Have to take care of my own Diner. Spare-Ribs it shall be!"
0,USER hmmm... Not that I noticed. You were quiet  #freegbazz
0,well the fun lasted a lil bit...now my fevers back & i feel like shit & this no voice thing isnt as entertaining. someone make me tea
1,"USER Ok thank u,cuz I'm anxious to hear it!"
0,I don't feel good
0,USER hiiii! i loove you. i dont know if dms work to my phone now  you ok?
1,"Good morning, people. Do have a nice day"
0,Looks like DataSavers URL is a pretty good company to deal with for this. HD powers up and then down.
1,i love sunflower seeds. they're even better when they're dill pickle flavoured. mmm
0,My i key is being dodgy
0,as well as coursework i have to tidy the house (fun fun) its all my mess
1,I'm stoked for school to end already!
1,Monterrey!!!!! WTF Great time there.....lotsof pretty ladies.....lots of beers and lots of great Friends!!!!! (B)(B)
0,arghhh whats with the rain  I Was supposed to go to the beach! Guess thats not happening now :/
0,Only 6 more aeronautic classes! I cant believe there are only 3 weeks of school left.  I'm going to miss oxford over the next 9 months
0,Soo bored I just cleaned up half the house! Waiting on the arrival of my first meal
1,USER Thank you
0,"Im so tired, and I have a big headache  But Im happy cause I went to Bruno's birthday and that was so great  good night"
0,How can I still be up just starting homework
0,=Super distraught!
0,"USER yeah, I dont get it. It worked again with the last vid,but I cant change the old ones info"
0,"frikkin' starving and wants food now !! edmonton still, coming home tomorrow. and i hope lucky is okay and sasha isn't too lonely w/o her"
0,I feel like I'm totally out of the twitter loop today
1,USER That 'bot' doesn't know who she's just crossed. A pissed off Jazzy is DANGEROUS!!!
1,"USER Hahahaha, I'll have to catch some rays for you"
0,Really wishes she could wind this weekend back and not have someone crash the car into us
0,GOOD MORNING TWEETS!! side tweet: USER isn't here yet... and I miss her very much
1,"USER Your welcome, always happy to render my mothering skills"
0,waking up to realize last night wasnt a dream
0,I wish I was excited about school holidays. But work fulltime coz court is in = no Melbourne  $$$ =  though.
1,Thought Adventure Land was good.. not as good as Superbad
1,USER what this tells me is ... I need a proper garage
1,I HAVE TO WAIT TILL DURING THE WEEK FOR MY NEW PHONE SO IM USING OR DADS IN THE MEAN WHILE
0,feel sleepy by now & have exam running @ 9:15 this morning.
0,USER they sure did..
0,Singing Make It Mine - Karaoke Version Again. Huge Stomach Ache + Yearbook =
0,my baby boy is sick...i feel so bad for him and wish i could take it all away
0,The last two people we hired are going through a divorce. Kinda makes me worried
0,"yes, i'm pouting."
0,"Ow, I just hit my funny bone really hard, and it's NOT funny."
1,USER how come you're going so many times?
1,I love my life  (via #zenjar )
1,rise n shine  just talkn to john and bout to start gettn ready for the day!
0,WTH. That thunder was loud! SUPER LOAD. Acccck
1,USER Good work jumping on board with #80sday jenbug.
1,working at the good food festival. come visit me at the nugat stand.
0,USER But unfortunately I'm going to the beach that day
0,korean skit and oral tmr  and i need money! $_$
0,Made it to the car and already feel like I can't handle it
0,USER D doesn't deserve this. AT ALL.
1,where is my girl  just hacking your account my dear
0,"USER I wish, he is out of town working for Mother's Day"
0,"USER Gutted  I'm going to Westonbirt  only 12 days now! xD saw them on the radioactive tour too, was awesome! Did you go? xx"
1,got my prepaid smartbro loaded for plurking..  URL
0,work is cooking bacon and it smells so friggin good! i'm so hungry
1,Work estimates for my new house... pouring over numbers numbers numbers over coffee coffee coffee... will FHA fund studio equipment?
0,awe USER cried in his new video  that's so cuute. not in a mean way tho.
0,says crazy cat went on a rampage and starts biting me. scratches all over me feet and hands  URL
0,LOL. I have to work with a not ugly guy all summer  kill me now!
0,Boo. Mad Men s3 doesn't start until August
1,USER  I  would appreciate your consideration of my proposal to speak at your Nov 09 Web 2.0 conference
1,USER you don't!
0,"Finally watched the rest of The Guild Season 2. I always feel so sorry (and hopeful at the same time) for your char, USER"
1,hello twitters
1,USER songs?  anything by David Archuleta hahaha
1,back hooome
0,oh yes its about to be a thunderstorm at 4am in nj... real sexy!!! mr.show0ff where u at babes??!!!
1,Listening to Benny Benasi on the drive home!
1,URL - i don't really eat that kind of salad.. makes me vomit..
0,having a broken bone is not fun especially when its hot outside
1,"USER sori bud i'm not like USER on her blackberry all-day, everyday...bit late with replies"
0,"USER Tom, I want a tshirt of Back to the Future like yours!"
0,"USER Shit, I'm working on the 3rd"
0,Morning Twips! Another long day at work!  Enjoy Saturday for moi! #bummer!
0,just took a geometry test.... now i have to study for a scripture test ... this is going to be so much fun..  i want to go home!
0,Silly slippery USER made me crash into the barrier a km from home. Only bumper damage #miracle can't go to gym now
0,Im in pain been stood on my feet for 15hrs  nursing is very hard but I love it and how gorgeous is this evening xXx
1,USER hey! Quit drinking over there and start  networking! Go say hi to people!
1,URL - USER here is a closer look
0,Ahhh watevvaaa then
0,Just watched #1 seeded Safina get beat by a poser
0,"To all that I need to ship stuff to,I dont think Ill get around to doing it till Monday  I know I said today but I dont think Ill have ..."
0,Trying to figure out how twitter works
1,USER I want to hear about it!! Miss you drama queen  xoxo
0,I'm not having much of a birthday dinner.  I swear that steak is required for a good night out.
1,USER i thought i was the onli one up  cant go to sleep...
1,"Plus, click here for the exclusive Ruby Slipper cocktail recipe  URL"
1,USER Take some Ibuprofen for ya muscles ... I am indeed
1,is with megan in journalism  good luck sami!
0,FRUSTRATED.
0,At work
0,is not running in the Annapolis half marathon this weekend because i failed to meet the registeration deadline & its completely filled
1,USER I like the new profile pic...very hot.
0,Frightened Rabbit are playing Glasgow tomorrow night and I can't go... boo
0,very sad
1,ps. Bahaus has one awesome Ziggy Stardust cover!  I can't ever get tired of it...not even AFI can beat it!  Well goodnight twitter world.
1,i'm working
0,Sitting in the car
1,still enjoying the sunshine here  and i'm back as an admin on M4J ..roll on saturday..
1,USER Get 100 followers a day using www.tweeterfollow.com Once you add everyone you are on the train or pay vip
1,"USER If the package doesn't get delayed again, you should be getting 2 presents from me few days after Kim's b-dayproject arrives"
1,Give USER my regards and love in the chat tonight!  not in a creepy dirty way tho. Unless she wants it that way. ;)
0,"USER this will sound racist  but i want 2c ""local"" commentary also, not just western experts, respectable analysts tho they may be."
0,USER you forgot your beef jerky!
1,I seem to have a mention in today's Sunday Mail. I didn't know until I got a whole heap of newsletter signups! Thanks Lainie!!!
1,likes the smell of new books.
1,"I'm drinking hot lemonade & checking ya'll out on Twitter  How YOU doing? I still miss ""Friends"" & Joey. Sigh. Do you?"
0,"Missing My ICE...His Birthday was the other day, but we didn't get to spend time together."
1,USER CALVIN HARRIS IS A MAN WHO UNDERSTANDS THE VALUE OF CAPSLOCK
0,My lucky batman ink pen has run out of ink.
0,trying to figure things out.......
1,going to look at apartments w/ the boyfriend!!
1,USER how do you like it?
1,"So, are we going to get to meet newest #COMPUTEREXPLORERS zee USER at conference? Hope so!The suspense is killing me"
0,My boy failed his exams. Sucks.
1,lunchtime with my peeps
1,USER leander . i think you already know .  well wait .. i `m going to upload a picture of him ...
1,URL Hilarious and stupid in equal measures
0,I miss Morgantown and my wonderful Friends and Family.    BUT I love my Jay and my doggies.  Wouldn't have it any other way!
0,Missed my song on the radio.
0,LAST WEEK OF SCHOOL!  yay!  I MISS RSOD
0,"USER Hey Lesley! where's the promotion?  the album is amazing, Electrik red deserve success!"
1,USER perhaps the folks doing the newsletter use to work for the government?
0,Staring at my computer . . . it's Monday
0,2day was the last class of: French & Law.
0,USER wish I could  damn UK!!
0,USER Caffeine withdrawal is HORRIBLE- I've been there. Hang in there.  Treat yourself to something else today!
1,nice meeting you USER
1,"HOUSTON NIGGAS, BOY YALL DONT KNOW A REAL FEMALE WEN YALL SEE 1, YALL MAKE ME LAUGH, BACK 2 DA ATL I GO"
0,I want to back to sleep...
0,USER I quite like the purple dress  flaps
1,USER Hey Kim ! how are you ? have a good night  xoxo
0,USER are you sick?!
1,"Tonight went pretty well. Made some good money, didn't get attacked by the ex, and now i'm in the magical chair"
1,studying in the sunshine
1,USER omg! luckyyy! you'll have to drive me around. just kidding
0,CRAP. Still  miss them.  )
1,Ok ima nap for a lil. Then ima go to the laundry matt
0,scrambling to find people to help me move my furniture....since my ading is sick and can help me move anymore.
1,"i love nicks voice when he sings, i especially like their new song paranoid  i think he's the only one i would go for and i dunno why"
1,USER eh thanks  ahha. wheres yours missy?
1,USER rock a bye baby on the tree top
0,"Tried few Window/Desktop managers for Winblows, nothing works as I wanted  may be commercial are good like AltDesk but do't want pay."
0,"dropped phone behind bed lastnight, just found it ... no text messages, no missed calls  lol, I'm glad"
1,"USER Bassnector just opened for USER here in SD, great show"
1,USER good luck with the job in DC hun
1,"shower, theen the maal"
0,I'm in kc...3 am and I feel like puking
0,USER if it's any consolation I'm incredible jealous of the Northern states in the US bc 100 monkeys isn't coming to the south
1,"hmmm, photoshoot day? whaddya say?"
0,Wow! Eurovision Song Contest winning song from Norway already number one on German Itunes! Just listened to it again! I don't like it!
0,So nervous I hate school  I js want my licenseee
1,awake! nope didn't work.. I'm still sleepy *yawn*
0,Damn she's just informed me she's been crushing really hard on a mutual friend. Shit.
1,"USER I did lose some weight, thank you for noticing!"
1,and i love the way kevin acts
1,Today felt like a Sunday to me. I shall be more productive tomorrow
1,USER you could always convert your allegiance to #itfc
0,"Man, I drank some iced coffee from McD's a couple hours ago, I'm wired and can't go to sleep"
1,"Morning, hopefully sunny today  not prepared for media exam ekkk"
1,USER Awww thanks mama! Don't let the stress get you down. Next time you in NY we need to meet up! Hope the night gets Better!
0,I have a bad headache and I'm at work until 6pm.
1,breakfast now.
1,"USER Congrats, Scott  what car did u get?"
1,Sounds quality is amazing tonight
0,is procrastinating... i feel ill.. but don't want to go to bed.
0,okay stopped playing Mahjong .. computer was cheating
0,USER it's not cool. Nice drunk/high pictures/tweets...
1,USER OOOOooooo  Fat Tuesday's wasn't on my list:  adding it now!    Gonna miss you guys LOTS! ((((((hugs))))))))
0,"now cuz Apple called, I lost the surprise   I'm gonna sue! Where's that Kramer's advocate? This is outrageous, egregious and unheard of!"
1,twilight agaiiiiiinnnnnnnnnnnn
0,wow where the hell have i been i jst heard David Carradine died   guys try not to suffocate urself and ur penis to get off kthnx lol dam
0,USER What?!  iPod's are cool I guess.
1,USER brother just lost 6 last night too - but we WILL be challenging it
0,"Time for me to get up, its only Tuesday"
0,That was a wicked nap but crap now i'm going to be up all night. Boo!
1,Happy Mothers day to all the moms out there. Wish I could see mine today. Fuck Work!! Special shout to Sheena and Yan!
1,i was a dinno trying to be thunder
1,"USER if you are not in nashville, I think you should come back! Just because I said. Its better than cali."
1,USER gimme a break! The certificate of celebhood isnt a twitter account!
0,I want to be like Horatio Caine
1,USER I got similar one by Jay Sean - Got my eyes on you
1,USER are you birthdaying?  happy birthday then Nat!
1,USER woo im gonna be watching
1,STOP. Look around. Beautiful isn't it? Take a moment to appreciate.
1,"Going home, going to have dinner, going to wait for my wife"
0,"USER rickshaw,Fuki,Sunhouse,Somchai,and theres another that I cant recall now. Can twitter folk come to the party?"
0,Thinks it is way too early to be getting ready for work
0,Can't sleep any longer because my dream got me thinking
0,AHHHH my Lakland bass fell on the floor
1,USER USER sounds like a great workout guys! Fred- how cool you posted a pic post workout!
1,USER Enjoy it . Don't forget your sun protection and after sun
0,wont to chance the song my mum will not let me
0,USER nope  I'm unemployable :|
1,USER I love that song.
0,"God, do something to make my USB ports work, again! It's killing me without them  #fail"
1,USER hope you have a say flight!
1,USER Ow. Try other pic then
1,"USER I couldnt get tickets for asylum, so please go to the next one  xxxx"
1,USER You guys recording/writing anything at the moment?
1,USER It is an app on Facebook and Myspace  it is like a tiny version of Animal Crossing
1,"USER Thanx dude  Its a bit of a long shot, but r u gonna come up to see the lads in Edinburgh? Free comedy shows! No Pinky!"
1,ooo summers on its wayyy
0,this night is a bum
0,my code for ghostbuster is not working so is a friend I wonder if that is a problem
0,USER I could help you build a wall around your cube for privacy if you want. Sorry work is
0,if only i lived in dallas texas again then i would totally go! but i moved 2 cali
1,Okay. So this is incredibly creepy. You really don't wanna know. Haha.
1,USER for once.................. PLEASE TELL US WHY u were thinking of this person?!?
0,USER  Mean head!
1,Rain. Tonight.
0,I wish the donkey could punch me!!   Haha!! Work hard first!! Play harder when ur done!! Yupp!
1,USER he's good.....be fun to hang out with u and see Phil at the same time. we could go to London perhaps too
0,ahhh! he doesnt get it!
1,USER thanks. I've turned on a lot of people to UT recently!!   Any plans for a next release??  Thanks  URL
0,"Accccck, homeworks!"
0,I'm a coward and a pathetic loser. No wonder I can't get any  guy that  I like.
0,"After finally getting hold of OS 3.0 4 Iphone, I'm left disappointed that I haven't bn able 2 receive mms"
1,USER ofc with u everywhere  <3
1,you know what I fuckin love. julz will NOT find NO BITCH greater then me! on some real shit. every othr female out there is WEAK as fuck
0,USER  I hate hearing stories like that
0,Just woke up and can't sleep. God this sucks
1,"you are so beautiful, you are that kind of girl that haas the chemical that makes me fall i inloveee<3"
1,"Holy octogenaresbian batman! I just got hit on by the oldest lesbian on the planet! Flattering tho, I guess."
0,"want to go to sleep, but matt is studying and won't let me"
0,Sooo jealous of my b/f.....i wanna be in Miami too!!
1,USER  adiossss <3
0,I don't wanna grow old and alone  haaa. watching The Holiday.
1,"The REAL Peter Cetera is here on Twitter now -- USER.  Note: Do not follow ""USER"" Much appreciated."
1,"I just love the picture in the booklet in which Joe stares at that horse as if he was saying ""I love you, you're much better""or something"
1,USER  Thank you for the glare down at kristin Cavallari at Heidi's wedding
1,USER What looks interesting? OSDC isn't for ages right? I have too much stuff on!!
1,Just woken up...bad dream...why my dreams r so strange? Is it the same for u?
0,USER Im allowed to feel hurt when im being attacked. Im a perosn who just wanted acceptance from a group too differnt i guess
1,USER good evening
0,USER I am sorry you are sick.. that is no good at all.  I hope you feel better soon!
1,USER have fun u 2! and let us know how the shoot went!
1,...I'll leave twitterville with this I AM NOT TEYANA TAYLOR...That is all...holla at everyone before 12 noon...I try and wake up b4 then
0,"home and bored. feel like chattin to people on msn, but no one [good] is on."
0,at home doing  nothing
1,Had such a good time with USER this a.m.   Can't wait to hang again!
0,Ahh I hate school so much   Please just save me from this darkness.
1,Hope everyone had a great Lunch
1,USER i bet it is
0,USER hmm - 2 lessons to teach and loads of admin to do  What about the world of dental assisting? *biggest hugs*
0,can't decide what will make him happier.. pre or iphone 4gs!!!!!!!!
1,"USER Night Steven.  I just have the one sermon, thankfully."
0,I am sad that i have to go home from the beach in the morning   But Camp AIM starts on Monday! EEk EEK
1,k so my favorite movie ever is on. Home Alone 2  ab
1,Shirley is Happy to be part of the tot's  via URL
0,"900 words down, only 2100 to go...although I think I am going to be way over the word count so there will have to be some trimming later"
0,i really don't want school to end..
0,havent tweeted today
0,USER lmao I was tired
1,USER yeeks. i have never had a hangover in my life. that must stink on ice. i'm good. just tired as usual.
1,USER .. hi.. i will be in napoli for 2 months starting next week. maybe u can suggest some must visit places and must dos
1,USER USER yay umm well he doesn't have to appear to quick
0,USER I loved the default tile view of folders in XP... in vista I have to change it all the time..
1,USER Denver AND Canadian women ROCK lol
1,Getting ready for dance class  woot woot!
1,USER I'm still hopeful that one day USER will use his twitter. Tell him Tom! You're the twitter-addict! That's why I love u  â¥
0,Am still at work at 6.30pm on a Friday night.
1,USER the lyrics have too many lyrics in them..
1,USER URL this link is for you. Mind checking it out a bit?
0,Today's Father's Day and i havent gotten anything for my dad
1,USER Love sending postcards!? Send some of my crazy postcards to your postcrossing friends!  URL
1,"Well, my sweet Tweets, I am bed-bound! Gotta get up in the A.M. and get whipped into shape!  Have a good night and I'll holla! Mmmm muah!"
0,"My chest, back, and sides/upper ribs hurt  I should wear a sports bra at all times!"
0,My phone is going to break......mow
0,"#inaperfectworld I would not be twittering right now, because I was too busy getting laid."
0,USER I sorry u got your heart hurt
1,USER Good Nite Babe!!
1,"USER I am curious, though. Did the 15-yr.-old working the register answer with any guesses? Halibut?"
1,"USER USER my daddio is here, too  But he's coo...and has the cutest puppy ever!"
