0,Its been on Of like 4 mind and it's melting my leg
0,"wants you to ask me if I went out on a date this weekend.... Mmm hmmm g'head, ask me!"
1,singing beyonce halo
0,"USER you have a viable excuse, helping USER move and all. Sorry I couldn't help! I wanted to wear my sexy moving outfit"
0,"USER thanks... doesn't seem to be working, unfortunately"
1,USER
1,"So basically, I want to get myself some Ray Bans. Like... right now."
0,"Didn't get to go to the beach  Still had a super fun, drama-less weekend. Who would have guessed!"
0,Fred and Wesley are better than Fred and Gunn. At least I think so
0,USER Blah that sucks. Oh wellll  apparently John Oh and Halvo's numbers are online somewhere.
0,USER hm.... I'm not sure. But in Michigan it would be 5am.... o.O and I could probably tweet up to 10pm at the latest...
1,USER one day you'll be organised
0,USER I too was sad after watching Jon & Kate! what has happened to them so sad
0,HE'S A LITTLE BITCH *shakes fist* Lmao. He's not gone. Me got scared.
1,studied on the Terrance in the sun today. I am a blessed woman!
1,Good morning twitterworld. Had a good night sleep due to someone making me happy. ;) smokin a cig then startin my day.
1,USER Thank you for the pinches which arrived today - perfect for the craft gorup I run   did you want anything towards postage?
0,USER pretty crazy isn't it!  Kind of scary too. So did Mojo save the day?!?  I think Cali would just leave me to be
0,Going to go catch a movie with the boys and anh! Too bad david had to leave
1,USER I was probably hiding behind some giant man complaining about windows..
1,"USER Funny though, I used the same terminology with my first"
0,coooooollllllllldddddddddd
0,USER I wish they had it here
0,"I hit my sister using my pillow from the back and she got shocked. Guess what she did, she actually pinched my nose real hard! Omg, hurts"
1,USER it is  Thanks.
0,going to sleep cuz i have class in the am
0,"ate too much chocolate, feel a little sick now"
1,Get Paid to socialize...!  Join me here free... URL follow me and I shall follow you
1,"going to south streeeet with kate, hopefully my mom gets me the ring i wantt!"
1,"USER Oh and make sure you do ""Who's Lovin You"" and ""Let's Get It On""  Maybe sing ""My Love"" and/or ""Cry Me A River"" by JT <3"
1,"thirty years plus of airline information. Got a question ask me, I might have an answer, if not I probably can get the answer 4 U"
0,"Bath was successful no crying, but Gavin cried about going to bed  he never does that"
1,"dont worry about it, they needed to realise sometime   i just added spongebob square pants on twitter haha"
1,USER I make a cookie with Goobers in it URL (via USER) -- they look so delicious!!
1,USER USER You are there because it is so much fun!!! Miss you
0,"USER Day was really good, at night my be in groups. Got 3 novices, 1 didn't like rough ground in the dark  V slow, lost hours (lit) then"
1,"USER ooh yes i meant saturday cos i cant go to whatever that is on friday haha oooh theyre black and theyre simple, but i love them"
1,just joined twitter
0,"Going to school  (If I won from #squarespace, I wouldn't be bored on the commute)"
0,Good morning.  Going to school. On the bus now.
0,"Tweeting in exile  will be back in a few days, faster, stronger and more jobless than ever."
0,Today is not fun for me. My mommy has to work till 9 and she's been gone since 1030! Sucks!
1,USER Thanks!
1,USER Can you tell I already have my fan on!
1,star trek was grtsat bggeting drunk now
0,"Prom was fun, but now my legs are killing me..."
1,USER are we supposed to hate your mum?
1,I shall mostly be checking the weather forecast
0,one of those day again..feeling restless
1,Oh well...now I'm going to bed. Gnight bbs
1,I need your help USER or USER let me know when you're online  you're probably sleeping now =P
0,"USER ive been doing french all weekend, i havent done any listening ones cause ive lost my cd's haha! im hopeless."
1,USER OMG U MADE IT BACK IN ONE PIECE!
1,USER my point is there are sellouts everywhere. DC doesn't want another NFL team. Boston is fine with the Sox... Not buying it
1,USER I LOVE YOU!!
0,And here we go! Wishing I was USER  #f1 USER yes it is me I am the first officially retarded Twitter user
1,USER Just saw in the news about what happened. Get well soon.  You are doing a great job with AirAsia. #malaysia
0,"is waiting for her sissy outside news center.. Thank god the gps didn't take me on a roundabout trip this time. Next stop, hougang"
0,"Ugh I hope its warm enough later on for phillips  if not, i'll just die"
1,USER I like mine green  Just somehow doesn't taste minty otherwise .. heh heh.
1,July 28th The Fray concert! Look josh
1,"..type smirnoff into your phone using predictive text... try it and see what it says, should we be worried ...yep think so   scary stuff"
0,says nothing has come up until now...  URL
0,is sickly and lost cellphone yesterday.
1,Oh how i love my family.
0,USER Hey hun I'm really sorry I can't come tonight  I've had to work and haven't even started studying for my exam Monday. Poo.
1,USER i'm also planning to go to Australia (i remembered you asked about the visa thing a while ago)
0,Staycation is officially over.  It's back to work today
1,"It's Monday already.  First appointment is a ""no show.""  It can only get better from here (?)"
0,USER nothing im borreeddd
0,"it's rainining....    was all nice and sunny yesterday, but now it's awful... bring on summer, like, now!!!"
1,USER  You might want to tell matt to be careful around vickie he might get swine flu! hahahaha
0,USER You got the palm pre? I was gonna get one but not enough $ right now
0,Reading a great book! I hav a tummy ache
1,"Listening to Madonna, cant wait to see her live in the summer, its going to be amazing. her shows are fantastic"
0,"different day, same journey. different auto, same negotiation. different tactic, same failure  bloody delhi autos!"
0,is too sick to go to star trek
0,"could have done with more sleep, i think im coming down with something."
0,"realized that someone doesn't agree with our views and attacked my website w/ a virus, sorry for the delay, will be back up on Tuesday."
0,wants to go to La Cita with her friends but instead I'm staying up all night researching the GFC
1,USER thanks for keeping us all updated! You're truly blessed. Rest well.
1,"USER hey! Haven't seen ya around lately, just wanted to say howdy"
0,USER  Just the ArchuVato concert in Seattle.  My work schedule will make it hard to attend any others
0,yep... still awake...
0,shopping
1,"USER hey miss, welcome"
0,USER heeh i can't upgrade till jan 2010
0,"Just ordered this touchscreen phone from LG! The ""Cookie"". URL My BlackBerry was broken by a girl at school..."
1,USER hahaha fun twitter party  ill bring the cupcakes ...
0,Bed time is now... Night everyone.. 8 am again
0,At airport. flight delayed  its too hot in here
0,USER my feelins hurt...supa dupa sad face:
0,losing something so important really does suck
1,"Looking for some craft fairs to participate in, in Portland, Oregon...DM if you got any leads"
1,USER haha ya neither do I!
0,Can't believe I'm back to work in... 30 minutes. *Sobs* My favourite sister has just gone home too. *Sobs harder* This fucking sucks!
1,USER high five to the bug photo!
1,USER Even I'm not dumb enough to complain that I need a better class of pervs following me. I love the ones I've got.
1,"Funny hw we tell gradu8s to dream big and make the world a better place when clearly, quite a few of them have been doing exactly that."
0,I seems to b missing out of fun.  frds r out 4 dinner while am hm counting sheeps.
0,USER USER USER Sorry girls! But no laptop! So no BLOG TV! The desktop comp doesn't have a camera or mike!
0,"wow! i got sick out of nowhere  and now i cant think straight....and mtv hasnt posted the hills online, wtf!"
1,USER he dude that`s kind of a m-e-t-a-p-h-o-r  ... know that word ?
0,"USER Ack, doesn't seem to work anymore  was an awesome tool!"
1,USER Today I'll start a new strategy.. I'll write for you every day.. till I have an answer    (Day 1)
1,good morning...today i see my cute cousins nele and jule juhuu
0,i hate not being able to twitterize on my cell phone  oh well
0,son of a bitch! miscalculated the bleed zone on ALL those cards i did last night  *headdesk*
0,waking up
0,Srsly y does tixmstr have 2 start the no tix system with Miley really  I guess I won't be going 2 the concerts . Boo no cheap seats
1,USER unfortuately there r still SO many ppl out there that still have 2 b bitchy & mean-I don't deal w/ppl like that.. talk 2 the hand
0,"man, these saturday night closing shifts are gonna kill me. I have to leave here by 9:15 in the morning.."
0,is like a bear with a sore head
1,: BREAKTHRU 1000!!! D8 BREAKTHRU 30!!! Excited about today's service bound to bring a fresh new flow into my life  Back to my FIRST love!!
1,"USER GSP! Garden State Parkway.  And yes, Georgia was random."
1,"i'm a big Zero Punc fan, this review off duke nukem forever just topped it all off for me             URL"
1,good morning good morning... rainy weather outside this morning... stay dry people... stay dry
0,Basketball-ing... Yeeehaa....  the traffic isn't that bad tonight.. USER kenapa gak basket?   URL
1,"Battery is low.. =( if i dont talk to u soon, love you all and goodnight!"
0,Whats with all the scary films on tonight  I don't like it
1,Insomnia.  im so bored.i'll be off in a few minutes again -.-  being sad and full of thughts got its good sites.i wrote more lyrics
0,Again forgot a frnds' bday  hate doing this! Have everything in my calender but i kinda miss it at the last moment!!!
1,USER mee too  Strange considering I hate fish
0,USER emo face for you.  that sucks.
0,arrgh! I can't switch the bloody thing off! gonna have to reboot!
0,"Attempting to apply for jobs, i hate applications  URL"
1,I ran around 3.5 km without stopping  I'm so proud of myself!
0,USER sorry to be the bearer of bad news.
0,USER Say what about Jose...?
1,is glad her graphic designer friend from SF remembers her  URL
0,"4) How in the hell are you going to do a investigation now, when all the #WWE tweeter had to do was ask her backstage. Fuckin BS!!  -fury1"
0,What an amazingly beautiful weekend... shame it all has to end. Not looking forward to 7 hours+ in the car tomorrow for meeting
0,"Off to bed, up at 7:45am"
0,USER your not very nice
1,USER sounds great  the road trip to texas to meet C sounds good.
0,"GM/GA/GN tWiTtErFaM! AlL nItE WrkInG,N0 tImE To TwEeT..SoRrY  tiMe t0 rEsT, tHanKs USER mY NeW f0lLowErS..wE AlL iN! GoD BlEss"
0,having trouble with follow/unfollow yet again.
1,USER Demos are easy. It's like magic but without gitwizards.
1,USER ooh what's it called? I got the milk coffee with jelly
0,Happy Saturday everyone!  Doing some house cleaning today!  Would rather be sewing
1,"done with the first ""bashing"". yey abby. ) happy birthday again dear."
1,"Bob Dylan is amazing, now it's time for bed"
1,Let my hectic day begin
1,another download milestone reached! thanks to all who download + sub to The Paul And Spike Show. get today's at URL
1,USER USER @ PhilipLocke  Thanks for following my updates
1,USER haha..i message ko sau ung website
0,USER that exactly what i was using it for haha!but itll be a while before im a partner
1,USER tenfans must stick 2gether on the ttt website & twitter
0,"cant sleep and has to be up in an hour and 15 mins for work, forget sleep now, got coffee brewing"
0,but 10 yrs of marriaqe is deep son son ; aww ; feel like cryinq for em ; lOl ; & dere 8 kidss  . damn ii hate kate ; fukd up shxt yoo
0,Ha wow my phone makes ;) instead of  it prob just hates me too
1,"Night now folks! Bye! see yah!  I got school again tomorrow, so I need to sleep early. take care everyone! xoxo <3"
0,"Came home from Cross County, Tired as"
0,"USER Not another bad eye!  If it gets really bad, make sure you see a doc, don't let it get worse. Prevention is betta than cure x"
1,"did not go see UP, but got to spend time with some old friends."
1,USER URL - Moscow... my homy city  I'm so miss that. Pretty good picture. You're look handsome though ...
1,"USER yup, USER he is cool!! you will have to catch up!!!"
1,On a very productive schedule.
0,i hate sharing sometimes. i need my powercord bc now my laptop battery is dying. my poor guy!
0,He wasn't able to stay the whole night.  He has to go back to camp.  I'll miss him!!
0,USER Damn that seems a crappy way to find out  Do you have a LinkedIn account?
1,Hangin with my hispanic familia  what y'all doin
1,Feeling much better finally...seems my head just needed a good lay down.
0,Weather like this makes me sad
0,You ever REALLY want something but you just couldn't get it. I wanted to get a smoothie today but failed
1,USER%20 ashleyy your new single is amazing--very catchy. I love your acting and your songs; such a fan  could u write me back :S
0,Realising how many times I got bitten whilst camping at the weekend...too many!
0,"Unfortunately I must ask, did Jewel write ""Life Uncommon"" or was it ghost written? Same goes for Aerosmith with ""Dream On.  ""Phooey!!!"
1,USER will do!! lol. i LOVE funfetti too!! the sprinkles are my favorite sprinkles EVER!!!
1,USER  USER URL  This is why Junkie is No.1  Unless Trigg is holding out ?
0,i'm practicing guitar. got a lesson this wednesday. i need to find a uke teacher.
1,USER We discussed sex with our son as soon as we felt he was old enough to understand (by we I actually mean my husband)
0,i forgot i have an away tennis match tomorrow. my day off has been ruined.
1,USER URL  too funny! Watch it sometime
0,"USER that was rude, wasnt it"
0,Hopefully still has a computer
0,Twitter u suck  !!
0,crowd at phoenix show is fucking awful. this might top rocket from the crypt
1,learning to play guitar!!!!! fun. but i still suck
1,USER OMG YES I KNOW WOOOOOOOOP! i'm getting my hair and nails doneee  CAN'T WAIT
1,USER sitting behind the Rox dugout about 15 or so rows. Black Rox shirt. Glasses. Pink hair in front
1,USER sorry for late reply man. Was really busy. Have a great weekend Irene!
1,USER It must be a very fulfilling job!  It looks like you enjoy it tremendously!
0,"last day before exams, and I'm all worked out"
1,"Just remembered, my cat's names after Danny from Pearl Harbour"
1,"as usual, u have surpassed yourselves. Big thanx!  I'll feed all this into Google l8r and c what comes out. Right now.. must write! x"
1,all smiles this morning despite the weather
1,Heading off to lacuna Networking after tidying up Media Hub. Now it really looks like  media company
1,1 hour to go before i quit. first shower and then off to marie and parteh !
1,"USER URL - Oh, they're so adorable!!"
0,it's toooo early for this
1,Anddd everything is all good. This is an ok morning
1,USER Get 100 followers a day using www.tweeteradder.com Once you add everyone you are on the train or pay vip
0,USER I tried to call you like Howard said but you ignored me
1,"wetsuits, wetsuits... where for art thou wetsuits? .....ooooohh doin' their job....getting wet and keeping the bodies warm"
1,Just saw Star Trek. I am not a hardcore fan or anything but it was really good! Get at it
1,USER  you want me to publish it? cause i can.
0,"USER I am friends with her there, and there has been nothing.  I posted to her wall a few days ago with no reply."
0,I want Vivien to TWIT!
0,"USER wow, thank you  have a nice weekend anyway"
1,USER Sheesh  Actually I prefer to have people with OPV follow. I love the discussion. Even though I know you are wrong
0,USER I wish I had time!! But its back to the airport already!
0,USER hey millyyy.. yeh he is  hopefully not for too long though
0,My ankle op's in 7hours & i am soo nervous! Nd sleep bt i thnk i'l b awake all nite
1,URL - Bonne JournÃ©e : Mighty Mouse + Threadless
1,USER hopefully the weather has been nice/cooperating
1,"URL - OK, you may have SEEN this Memphis Burger King sign bit if you have NOT???"
0,am i now just another page in your history....?
0,"USER i miss the beach, dear.."
1,"had a really good night yesterday  Ingeborg just left, I have found my self a couch and looking at bikinis at victoria secret, will order!"
0,USER Sounds like fun  what ya having?
1,is off to batangas...  beach on a very cool weather... ;-)
0,however the downside is I'm doing laundry on a friday night   (but I have nothing to wear for my wedding tomorrow!)
0,cant get a decent picture on here...cant get it to crop right  i'll try again later.
1,USER won't biking back get you all sweaty? Will you lose your after spa glow?!!?!? Hi B
1,USER Twitter review ASAP !
0,USER can u give me a huggg
1,It was a good night ready to repeat w/ USER tmrw  xoxo
1,"USER It's ironic. You didn't come down for weather this weekend, and the only rain we saw was a light rain on Saturday. lol."
1,the rain makes me  bc its cooled down however if it rains like this tomorrow I will be |:
1,"Reltionship HATERS...if u mess up anyones relationship, &  u didn't get one of the people out of that relationship...u should die,twice"
0,USER  where are you?
1,USER Lol! I get it!
1,always ditonggg hihihii  USER gmn td dit? bs?
1,"USER I shall dance, but I really want satan to strike me... catch ya later"
0,USER LOL its not my fault my parents never took out the training wheels
0,::::sigh::::: come on a-rod!!...grrr pop up...no good
1,"I talk by phone with my best friend .ohh, she makes me laugh so much"
1,USER I still have the blackjack
0,I do not want to wake up in 5 1/2 hrs. for work!!
0,Waking up to a headache
1,"USER don't worry, it will soon be all in the past"
0,"USER it's on hold until I get my entire line on the site, I need to get my own projects straight before hiring help"
1,USER yes it will work for us both - a good win-win situation
0,: USER just reminded me that #KrispyKreme URL has landed in Msia and has an ugly website
0,WHO EVER IS GOING TO WINTERSOUNDS TODAY CAN DIE! hahaha.. have fun people! i'm jealous as!  xoxo
1,checking out this twitter business
0,The people living next door need to be quiet - I have an exam tomorrow. It's bad enough that they were making noise at 1am this morning
0,i really hate it when i break a nail  now my whole days gonna suck! x_o
0,USER i wish i could say the same for school
1,Just woke up! Its gonna be a solid UnitedOne  I'm pumped
0,Last day of the fastival   It was great ! See you all next year
0,ugh rainnn
1,So many smart moms on twitter  #followFriday USER USER USER USER USER USERUSER
0,"Up since 5:30 am...ugh   Very productive though, but going to be so tired tonight!"
1,URL - Fav of the day
0,feels like shit sent MIL out Fri to mail stuff it was forgotten sorry USER and my friend kassi ill mail when that lady gets back
0,i could cry.
0,USER yup. did that 2 weeks ago
0,"Saadia, Logan, Josh Y., I really hope you guys don't move far away too and leave me behind."
0,ugh. mouth is sore today. still need work done on my tooth but its a start. back hurts too. blah. kinda crabby today
0,I am going to miss pit.
0,USER So you are very familiar with our miserable HEAT!   Congrats 2 your grandson ~ Lackland AFB is highly recommended!
0,"USER i didnt really mean it like that :L, but ok, but i was listening to them cuz i was sad  hehe"
0,I am not getting any fuckin tweets  lame.
0,workd out yesterday and woke up sore
1,"At school nowww, its super nice out  cant wait till after lnuch!"
0,today i watched a car mow down a family of geese crossing the street... sad   baby geese are super cute when they're all fluffy and living
1,gettin ready for work..pictures this afternoon.
0,Feeling a bit down...
0,"It's about time I let people know whats happenning, although I often wonder why I bother   but hey it'll soon be Christmas........"
0,loves Karl Wolf's track Yalla Habibi.. but can't seem to find the track online.
0,"USER, no, I'm sick..... feel very bad....  x"
0,USER  sucks. Welcome back tho.
1,"golly, hanging out with USER can make any day better"
1,"ughhh so tired.. sleeping. text it  ..illoveyou, matthew gary anderson  <3333"
0,USER omg it's so early there  did you see my gift? :3
1,"USER Lol, hi there"
1,USER the Glasgow Tourist Board should hire you Sticks - you make the place sound so attractive
1,USER You can get prepared for the Lakers to lose to Orlando in 6!! BooYaa!!
1,USER yes its the USER the comedian lol your bro got him right at beginning.lol
1,USER Chile are doing quite well I must say!
1,USER hey there
1,practising my dance and singing in this years school show *high school musical* its less cheesy though
1,"USER Congratulations for the MTV Movie Awards, especially the award of the Best Movie  Great job!!"
0,"i was goin 2 welcome my 160th follower, only 2 find it was filthy spam..although 'MyExoticFriend' does sound appealing, we cant b friends"
0,USER not my fault
1,Luving the weather and my baby KB  xxx
0,Our air conditioner isn't working...again. I'm DYING from the heat. Pants heavily.
0,OMG I FORGOT MICHEAL! So Sorry  USER
1,USER USER I love you guys. You are awesome. I understand if you leave. I hate what ppl put you guys thru. Stay real.
1,working for my business & music
0,USER I have Office 2k8.
0,Just woke up. Time for work
1,"USER USER lol, we go from no chipotle day to chipotle day. Totally fine with that   Lets have the double B's decide a time."
0,I could go for an iced coffee. Or food. Too bad i cant eat  company would be nice lol. I hate being sick
1,et celle-ci Bon Jovi â Make a Memory !  â« URL
1,"USER haha thanks, ik  maybe ill see the amazing USER! haha ;)"
1,"USER I JUST missed you from the chat... I get back home and see this   Inspiring you and others, inspires me... Thx Mari..."
0,"I think I,ll have some sushi for lunch. I feel a little bit alone in here ...."
1,"wanted to go to the beach this morning - yeah, I need breaks, too  - but I now need to wait for a plumber to fix apt. water system"
1,Is getting ready to go with her best friend Ryan
0,USER I know Im being a hypocrite but I think 3 yrs of taking his crap I am allowed to be
0,USER I don't know when I'm going to be around again   I hope soon.. how are ya?
1,Cyrano de Bergerac is playing at Tï¿½lï¿½-Quï¿½bec! woot!!! I love Cyrano!
0,"USER  got exams on the 1 & 3 june. but after that im free till oct when college starts again. when i say ""free"" i mean at work"
1,"USER Yeah, I know, I know  I went with ""penis. mwahahahaha."" I think he's going to be really insulted xD"
0,Just got back from Atlantic City - I lost!  but it was fun!  Tat's in town!!!
0,"USER there was a time in the distant past when I would say ""trust the Dr's, they know what they're doing"" Not so much any more"
1,in ten minutes shopping   demi lovato-back around demi lovato-behind enemy lines have you all seen the titanic 2 trailer? its really good!
1,#followfriday USER because she spends the time to actually talk to you
0,USER little 4 yr old running around my neighborhood all the time unsupervised.. saying sad things like mommy hits her
0,"USER I hope so, I miss him"
1,USER í´ê·¼ ì¤ì?´ì ê° ë´ëë¤.  ìê¹ ì¹ì íãì¤ëë¤.
1,just woke up.feeling great..gonna eat breakfast then church ..i wish school was over already thurs. is when summer starts i cant wait
0,USER the update isn't all that!!!  disappointed
1,Graduation! woo!
0,"USER Lil Jon east side Boys ""Weed Man"" was my fav, dont do it anymore, LOL"
1,heading out  need the exercise.
1,"FOLLOW PETER PLEASE!!!  he needs 500,000 followers by friday! USER"
0,Wants to teach already. Please 2.5 years go fast... Now would be nice... Ok no
1,"USER Clearly you have nothing to do, so we should cook out this week!  We can do my house"
0,USER oh dayumm I didn't see though. It's no workie
1,made some kool-aid.
0,Damn you AT&T I want the iPhone 3GS but I don't got 500 bones to drop on it. Time for sad face.
0,USER u shud come plz or well be forced 2 wlk all the wayz 2 ur howse which iz far
0,There were 72 applicants for the post of less than 10 guest lectures in our college. Last year there were only 15 applicants. RECESSION!
1,It's HARD being honest about stuff like this coz media n ppl be criticizing. But I figure if I can help YOU in some way. My <3 is content
1,Gotta go! My Akitas are waking up and they are hungry! Everyone have a wonderful day. Pray for peace & offer a hand to someone in need
1,Timo and I met 2 years ago today... and he just surprised me with gorgeous lilies!
0,USER...I needed that chuckle u simple ass...im missinf ma auntie so much 2day...
0,it's cloudy
0,dad's just come home and jumped on the same band wagoon as most people that Ross gave the race to Jenson etc i just wanna revise in peace
0,fcck. i qotta do this five times a week
0,"USER - sorry, baby   Wish you did.  You're welcome here any time or day you want."
0,USER It's really cold even though it's sunny!  No fair.
1,......but still have a Happy 420
1,off to bed to watch USER and prepare for Term 2. I'll be back in the land of the living some time in June
0,Andi~sweetheart~just read ur twitter~i have a huge hug for you guys and ur in my thoughts and prayers~love you and im so sorry!
0,separation anxiety from ally
1,Guys please welcome USER fellow #twitterican #graphicartist #freelancer Spread the word and love people. Make him feel welcome
0,USER what are you stressed about
1,USER: hey you
0,Wish I had some panara bread.... or jimmy johns
0,USER how is it you're watching Fight Club at 3:20? <-- jealous
1,in love with him  URL
0,It's been a year now since he passed away  When is it going to get easier? R.I.P. Pretty Pretty
1,USER Get 100 followers a day using www.tweeterfollow.com Once you add everyone you are on the train or pay vip
1,Thank god for DGs overseas!
1,"USER Yes, yes it will. I can be *diplomatic*."
0,i need another nap..i'm dragging over here
1,"Man I am all danced out. USER, grrrr, alexis gideon, etc were amazing. Great show"
