0,I think shorts n t-shirt 2day but wish i hav sum neons. But i dont hav ne!
1,Getting creative now.. better get all of my designing in while I'm feeling so chipper
0,"USER yeah, I am really bummed out, all my favorite shows get cancelled like ""Life On Mars"" and ""The Unusuals"" too"
0,USER representing...like Jeff said last year...Sarah please keep talking as long as you can talk a democrat will be in office
1,USER That it does  just wish more people would notice it
0,Feeling like total ass!!! What a waste of a Saturday! Missing my cousins shower and everything
1,USER You won't be disappointed
1,"CD is on, glass of wine, sun lounger and plenty of sunshine."
0,thoughts on the new noisettes? i'm missing the crashing drums and screeching vocals
0,watching the prince of egypt  and studying microbio
0,Heading to my wife's grandfathers funeral
0,time for work
0,USER i planned a huge plan with my friends but it failed.
1,Finally
1,Goin on a hunt for the chocolate
1,guin bk to penang later
0,USER  Right there with you on the migraines. Had one since yesterday.
1,USER Congrats miley on winning the MTV award. Your dress was beauuutiful  I want one.
0,USER hollywood i can do  just let me know when!! i miss u guys
0,USER Oh ok. I don;t watch those. I shed a tear last week for grey's Anatomy
0,"USER HAPPY SUNNY DAY! Happy Birthday Jade (for, was it, Friday?)! Happy Sunday! Unhappy going back to school tomorrow  lol xx"
1,"USER Emergen-C-tini.  2 parts vodka, 1 part Emergen-C Super Orange.  That's an original recipe"
1,Thanks 2 all new followers! I will try and do Follow Friday late again - but really appreciate the interest  Have a great wkend!
1,"sorry hines ward and dejuan blair, my new celeb crush has got to be the captain of the penguins himself, mr. sidney crosby"
1,USER Oooh!  You're really getting into Twitter now!
1,"USER No, its just the kitchen/bathroom I get, not the appliances. My appliances are all less than 5 years old anyway"
1,USER; cool tattoo! and i love your nails.
1,USER Have you tried it using the chain rule? Much less messy.
1,"seriously happy that summers in two weeks. never had a 6am wake up for classes ever in my life, and i never will again."
0,"I GOT BLISTERS ON MY FINGERS! (playing guitar), and raw skin on my feet from walking w/o socks  The dryer has been very hungry lately."
0,out and about with my papi mommy and lamee sister. I missss leo
1,"USER my daughter is 17 and getting customer svc experience in a shop, has done leisure & tourism, always wanted airline job"
0,My boss at job #2 is scary
0,*sigh* Plans for tonight just got complicated. Makes me feel stressed and weird.
1,"r USER USER earth has a great operating system, just needs a registry cleaning and good virus /malware sweep"
0,so many new supplies to play with. but this house won't clean itself
1,I LOVE that one accounts spamming can make something a trending topic  funny stuff
1,USER ha i told you so  hari kmnnn?eh udh tau blm sih rambut gue pendek se tulang selangka?
0,USER I forgot the name for a second! I was having a mind blank! And ugh. Seriously? Who performed? So pissed.
0,wants to upload her new website but has lost her password for her FTP  waaaaa
0,is hot and heartburny! No more orange juice
0,USER Am so jealous you're doing the eco-rally. My day job (eugh!) prohibits participation
0,my horoscope sayz to shut my mouth for today  aw.
0,"USER Working over the weekend!   That's really sad.  Hope you get a break soon, your schedule doesn't sound like fun."
1,"USER URL yes, they are a client of mine"
0,"Such a lovely day outside, just want to lay in the grass all day...too bad I have no suncream"
0,USER ah  but was it amazing though? (:
0,"Typical, I do a long-winded post asking about problems with my Cintiq on the USER forum and it goes tits up. Just my luck"
1,USER Just remembering my days at Chuck E Cheese.
1,wakey wakey
1,USER Perhaps time for a replay here! So little time though... Also still only halfway through The Orange Box
1,On the way to grandma for lunch Strawberry dumplings  bye
1,cla ung sa front desk... ngwewelcome ng mga guests and everything
0,I really miss Amy  CAN'T WAIT TO COME HOME SOON
1,Dontcha hate that??
1,"USER acording to the uk press susan boyle could get up to 8 million , so coming in second cant be that bad"
1,USER parenting calls... i get it. have fun man. they don't stay little long enough
1,baby c ulater. = nathan saunders
1,Got off work at 1:30 tonight. Its been a minute and my feet are aching. But I got a loooooovely surprise at work today!!  yay bay!
0,USER Sigh.
1,USER USER USER USER Can't wait to see you guys tomorrow at Spring Jam!! I'll be tweeting you!!
0,biology: the reason why i hate science
1,The end of Gossip Girl makes me fall in love with Chuck Bass.
0,USER  right on!  wish I was there.
1,USER It`s Work
1,"USER Thanks, appreciate it"
1,just working away.. good night! Great week planned.
0,USER URL - stripes and crinolin are just wrong......and corona and double stuffed pizza......
1,Poool party with friends
0,USER tempting. now if I only had a spare Â£75....  fed up being a student.
1,Degree Numba 1!!!  Hav a Fabulous day Twitters!!! Becuz I WILL!!! ;)
1,USER WWDC will still be a blast even if Apple never unveil the 3rd-gen iPhone.
0,I wish I felt good enough to play in the rain.
1,USER We should start a campaign to bring back rutabagas!!
1,"USER haha, good luck with that"
1,USER Yay Lyric! I know your book will be fabulous!
1,USER oh sweet. Love Campbell. We're right of San Tomas so somewhat close
1,won my baseball game yesterday  i did really good pitching
0,"I love CONAN! Glad he is back, but why is everyone I like moving to L.A. ?   (It's not really that cool...)"
1,"P.S USER I hope you have fun being the ringmaster(hehe) of fun this Saturday, its an amazingly generous thing for you to do"
0,Goodnight all 9 followers.
0,i hate that i cant take all my clothes to london!
0,I slept while writing an email..! I can't keep my eyes open   It's soo hard
0,donnie darko sequel is going straight to dvd!!
1,"I'm going to have a sleep now, ghost hunting last night"
0,"can't sleep, it's 4.30am and i have to be up at 8am"
1,"USER i'm trrying to help you get the 10 followers you neeed to reach 3,000, i'm so cooooool hahaa jk"
1,going to my aunt's house this weekend
0,450er Crash  URL
1,says This is one tuckered out terrier  URL
0,ugh! apple is making me wait for this update
1,USER - How about URL  (isn't EVERY day Sunday?!)
1,"USER Yay! For weeks, I went back and reread my most favorite parts of all four book. I was pretty pathetic."
0,USER  I love you girl
0,"USER hahaha  No, but I would love to.  I used to bike, but I have not picked it up since I moved up here.    You?"
1,cleaned my room all dame day ... or what i for took in today
0,"just got back from orthopedic, splint on for 2 more weeks, wow this stinks"
0,USER I'm having my period or the first time! What do I do!?
0,USER
1,USER aaaah ty
1,USER Palm Pre is on Trending Topics! When I saw that I immediately thought of you.  URL
1,USER thanks!!
1,USER right
1,Finally gonna read all my signatures on my yearbook!
1,Working @ the triathlon. someone has to give away free non-alcoholic beer
1,"finally i sent, and i've got the reply"
0,"USER I wish I could find some of mine. I had an awesome one of Zor, but hell if I can find it now"
0,"USER sorry about Mr Grey, Menlo"
1,"Mellow mood, stirred, with a panic salted rim.  Ahhhhh Rainy Monday. Sometimes it just turns out that way...."
0,USER aw you made the internet sad
1,USER I agree with you!  Looks better than twilight so far
1,USER USER it's almost May june is right around the corner!
1,"$67 for my books, no complaints. 67 more than i had plus i'm on book voucher!"
0,USER i miss you gutsss
0,USER what happens? i done have foxtel to see it
0,talking to my mom ... Germany seems especially distant today
1,USER I like it
1,USER u welcome
0,Filming went great tonight. I'm really excited how this will look. What happened after was pure misery tho.
0,I Dropped my phone in apple juice and now its not working
1,hoping Mine That Bird brings it home tomorrow
1,USER I know haah twitter is a soo hyped up now  but its all goooddie good
1,USER ok tweet number two!!! can you see this one plse? tweet back
1,USER It gives people who live 2 streets from Sainsbury's an excuse to use their car
0,my feet hurt
1,USER thanks for the link. this is my first year there  greetings from germany!
1,"USER ""The Notebook"" moved me to tears too, never to judge, just to know you better"
0,I was waiting to hear from a local (big deal) contest about my short stories yesterday.  Nothing.
1,On my way to the D for #demf.  stay tuned for updates from the motor city.
1,Brunch. lets eat guys
1,Those who voted earlier can vote again now u can vote once a day  xoxo
0,"USER Of course. Not high on detail but you make good, thought provoking, points. My only regret us that I didn't get a pic with you."
1,Anyone else want a postcard from moi?
0,Life is too short..
0,USER Not good shue. He has pneumonia now. It sounds awful but the docs say its just a matter of time. Its not very nice.
0,USER LMAO! That sucks
0,"USER That reminds me, we emailed you about your API and got no response  ^J"
0,USER I'm reading that one too..cried on the way home! sad family story
0,Ruined the chinese test with 50.1 points  20% off...still got a test of 60% and an oral exam. What do I need to pass? Whish I'd do maths.
1,"USER so let us know what you find. If/when they release Twitterific 2 for Windows, I will be happy."
1,USER well thats just silly.. that would burn a hole in the umbrella!
1,Lying in bed feeling Willow do her morning aerobics. Tim calls her our tiny dancer
0,Haha thats why im sad i thought i had money in my account so i was going to go to Lush tomorrow but i cant because i dont have a penny!
0,USER DAMN IT! I want to see that movie sooo bad.  Don't tell me anything. hehe.
1,USER Ay just watch imma have a video and pictures! i already self tan.. and have that golden natural tan!
0,My throat hurts and my voice is weird
1,USER I'm up studyin meteorology!not exactly fun but u gotta do what u gotta do!
0,"Also, went to Stereo 2day and they had no Kronenberg Blanc. Aint been able to find it anywhere...  Any ideas USER ?"
0,I think I broke my tow a month again and now it won't bend.. Is that possible?
1,Tidy up the flat...on Sunday. Stupid!!!
1,USER I just bought it on itunes!  LOVED it.
1,High five to USER for becoming USER's first full time employee!
0,"USER I ran out of microwavable burritos!!  idk, im so full though. I was up at 2:30am grilling hot dogs cause I was hungry. lol"
1,"USER HA, that's one of my favorite meals!!! Lol..  And if I'm feelin fresky, I'll add a can of chili...yummy!! (No beans ofcourse)"
1,USER You can never go wrong with oldies or country or chrisitan rock! but my ipod has mostly honor society and Jonas Brothers hehe
0,"USER awww thats sad  sorry to hear that but at least he is with the ""inlaws"" and not the ""outlaws"""
1,USER UHall was just there to pace someone and meet fans after. I think he's wonderful.  Was RnR as good as it's reputation?
1,USER Morning. Nice room you got there.
0,still sick and so it Steve
1,USER music to lee's and my ears
1,"USER I'll be right there for you, till the end, the end of times.. Please be mine...<3  - Listening to the most perfect song"
0,wahey the weeks finally moving on.. we're onto thursday. what happened to the sunshineee
0,"USER nah, i really can't afford it to be perfectly honest. it would've been fun tho  i'll just have to watch it on TV!"
1,Looks like today is going to be another wonderful day
0,I can't believe its June! I need to stop procrastinating
0,is studying for a Behavoural Science Exam
0,Terribly sick  i'm not even hungover...although my mom asked me if i was. This really sucks
1,Chicago for the weekend!!
0,USER yeah but now its raining!!  gosh!!I hate this weather.
0,"Just finished watching ""The Day the Earth Stood Still"". Mediocre at best"
0,gaining weight is super hard
1,Going out for lunch on Spring Garden. It's so nice out! Maybe I'll take some pictures at the gardens.
0,"night all, bed early. Feeling sick  Need sleep."
0,USER I did OD on brownie bites
1,"Sunday, Funday! Lunch and Art Museum with mom and dad"
0,this song has a sad story to it!  URL
1,First ones on the coach
1,can't wait for the new challenging year to come...  USER WOOOH.
0,USER i dont have enough tartan to go as you
1,USER Morning tom!! DDEnjoy ur day
1,"USER To be honest, my mom's full of them"
0,USER Jealous! It's raining in NYC
1,USER Dad just said he would sell his guns to buy me a mac...I'm excited...
1,good day and fun night
0,USER I just realized that I could have voted for Marty with all 7 of my email accounts
1,work from 12-5p...then out with chad   come to the store to buy shiny things!
1,admin all done...calls this afternoon. lets hope the sunshine is making people friendly! off to enjoy a bit of sun...and scenery
1,had a thrilling time with DAS joyride roadtrip! nice driving Pai and Paulo.  URL
0,"USER Oh honey. I'm so sorry to hear that.  Remember, I'm here for you if you need me. You're not alone."
1,USER Hope you'll enjoy your stay in Paris
1,"USER yup yup, big fan of dune"
0,Hates not being able to kiss him  forget strep throat!
0,"USER Not that I can remember. I've liked a few since NKs, and I can't quite recall something like this ever."
1,Just got the Radio Times app for my iPhone and sat playiang with it. It's  well good
1,USER I hate that! I guess just have fun and if it's meant to be things will fall into place.
0,"Anyone else sick of folks who don't understand twitter constantly bashing on it for how ""stupid and pointless it is"" uninformed FTL"
1,Prawn-ing now! I caught 5! One of it was HUGE! I'm satisfied.  - URL
1,is having a good day
1,"USER Mum says ""thanks bloke"""
0,USER it won't let me do anything without first connecting my phone
1,USER do it! no shame
1,"#MrTweet I recommend USER because she has great friends and is generous about sharing them, very smart + real"
1,"As a reward, you may download a free copy of EmailUnlimited on URL"
1,good morning tweeters  much to do for today. Lets get it started  .
1,USER  Kiki wanna play? *drags straws across the carpet*
1,I got holiday clothes  but i have no shoes :/
1,downtown with kimi. come find us.
1,USER bright sunshine here in sunny Surrey  have a good day
1,i hear music and watting to we shall have something to eat !  thats will be awesome xD
0,USER  i miss u too. i'm totally comin back tho! Lastnight was sooooooo much fun!
0,"USER haha sweet! I'm going to st.j soon prob, i wish it wasnt wet tho"
1,USER  yay
0,USER I Missed My Party
1,USER Get 100 followers a day using www.tweeteradder.com Once you add everyone you are on the train or pay vip
0,USER I wish they'd do that with NCIS. Only the last season is available.
1,USER EVERYONE should lounge by the pool with a 6-pack of Bud Light & a Subway sandwich! Preferably The CLUB!  SCarolina in da houz
0,"I miss you, USER."
0,And I'm out! What a frustrating week. One stop to make before home. Need another wind. Would suck to feel too tired to do anything.
1,USER wow. this is cool
0,Curse school
0,USER USER Sorry to disappoint you guys but I went for a 5 on top and 3 back and sides.
0,Nobodys knocking yet
0,USER   you just had to ._. me. oh yeah sats.   sigh. den when can i kidnap you ?
0,"Spotted, R and B in the parking lot of an impound lot."
1,URL - Tweeplecard starts spreading  - thx 2 USER
0,USER did the blind search site go down? I just tweeted for folks to go try it out.  #blindsearch
1,USER LOL   i didnt know it was there yesterday aha!  so do you like it ?
1,USER haha yeah  But everybody knows that McFly know how to rock live on stage
1,pix FTW - denugging & logging so much more efficient
1,Last one for the night LADIES URL  The Delfonics - La La Means I Love You .. Music from Michael
0,Going to do some quick shopping before heading over the mountain for family fun! Wish my girls were going with me. They're with their Mom
0,won't be hanging out with them that much anymore it just isn't the same without them
0,"Running late for work, was keeping up with USER updates on Roddick's match wooo...uh oh, gonna get in trouble today"
0,"On my way, going to 7 bulanan rani.. hungrrrry beraaaat"
0,USER having fun? havent heard from you in a while
1,I laaab Mufasa's voiceee!! Earl Jones on Will&Grace!!!
0,"USER Nothing here, yet."
1,USER im so glad you enjoy yourself
1,USER windows ? #take-a-mac-instead
0,USER You can listen online ;) I'm gonna be in Cardiff for the first one
1,USER  Her Tweets Are Just Tweetness #followfriday Please Follow she has a Twitter Cruise Coming UP Too
0,"wow. i knocked out around 11 last night and i just woke up. its still so early! and damn, i'm hella soooooooree!!"
0,USER i know... and it gets worse school starts on tuesdays (crying)
0,tomorrow na ung start ng 3-day retreat sa Tgyty?! i think i'd rather like to stay home this weekend and sleep all i want. srsly..
1,"USER oh, okay.  this is my 400th tweet."
1,USER might have to roll up to Bmore then!
0,im bored lol.. really bored  i dont wanna read emma.....positive re-enforcement.. i do want to read emma..
1,USER I am here. I have a Sundevils cap on. Was it me?
1,hay hay loves nae nae whos boyf is tay tay  hayley shhh-people who follow USER dont listen to her if she says its not true
1,im a wett asz bxtch duh wat yuh thought ! i love my twin jazz
0,BalÃ© de Rua.. I forgot to see it
0,USER We're really going to miss Mike and Eli.
1,Sooo excited for the fun filled day ahead
0,I listened to my ipod for a little bit.  It didn't help get rid of my boredom I am still so bored.
1,USER heyy destiny ! whatcha doing ?
0,why am i awake at 10:02 on a saturday !?
0,"My studio computer is doing some very crazy things today, and I don't like it! I would toss it out the window but I'm on the first floor."
1,"USER Tom, why you are all the times twitting ? go talk with fï¿½ns."
1,I really love reflections and shadows
1,USER Added.  cute baby pic!!! xD
0,"USER Awwwh.    Sorry!  We'll be glad when you're closer to us, though!"
0,"Bummer...if this rain keeps up, I dont know if I can head to Ida's show"
1,"bout 2 go out...mite swing by Mad Monkey, def. goin 2 Tims n chillin in the DaViEs  Big Tune>>> URL"
1,playing with my new macbook woo woo
1,"USER I will try to enjoy it, I always do"
0,USER It's raining  hopefully it clears up in time for celebrations this afternoon!!
1,and another popped to mind URL
0,butterscotch day today...    R.I.P. Butterscotch the joint best guinea pig ever
0,USER sadly I have none left. And I'm still hungry.
1,Pictures will be posted soon  I took pictures with Ally and Michelline  Hopefully I see them tomorrow again!
1,waiting to go outt  and loveing the weather
1,this is like facebook without the facebook
0,Walked that damn hill up kingsbridge now I'm starving  ... Gonna have a huge bowl of cereal and watch Sex and The City
1,USER That Single Ladies video was hilarious!
0,USER  thanks for making me relive that moment
0,Just made it home finally. I hate the drive from Reno to here.
0,USER I wish I could be there  . LUV YA!!!
0,"I am a lobster...seriously, got sooooo burned today at the beach"
0,I hurted my head
0,"Coco's tweets have really made me not like her. She was one of my favorite ""celebrities"" before. I'm really upset by this."
1,USER hi! Hope you have a great first full day here in Manila!!  haha
0,Too much traffic on the A2  Can't wait till all 10 lanes are ready ... 2010?
1,"USER I love that song, and the imagery in that video still haunts me. I love ""Even Flow"" by Pearl Jam"
0,"someone talk? my phones about to die  and i dont have charger  and allys grounded so have nothing to do tonight, everyones busy!!!"
0,practice  i don't want to run today
1,My tip of the day to you: Add a shortcut key to the Jing screencast software - I can recommend CTRL+SHIFT+J  #onlineminds
1,Leaving NC.......headed back to ks. Really ready for nyc now
0,Awww...crud. - Britt: What's your tumblarity? Me: 68. But...it was 70  Me: What's yours? Britt: 99 Me:... URL
0,About to leave to go to Virginia's bbq. It's really hot
0,"Ever since I watched Final Fantasy Advent Children Blu Ray on the Samsung 42"" Full HD LED TV I just cannot watch normal TV anymore."
1,Happy birthday to my mom and dad  so excited for the beach tomorrow
0,My dog had hip surgery today becuase she had hip problems she's only 8 years old!
0,I don't wanna get up!!!  but school! And I'm hungry.. :>
1,"Looking for a ""Loan Doc Specialist"" job, at Wells Fargo in Mpls.  If anyone has connections, please let me know!!    Thanks!"
1,I like to leave notes when ppl i know park close to my car
1,"I haven't watched the Disney Channel in awhile xD All I've been watching is NCIS, ABC Family (11am-1pm), Family Matters,&Home Improvement"
0,"Ok, this is NOT good.   Nestle Recalls Cookie Dough Products - NYTimes.com - URL"
0,cant believe tickets to the Vancouver Peace Summit start at $100. Ouch! Guess Im not going this year
1,"USER Yeah, went to Lassen View Elementary.  We talked about this before, actually"
1,watching Blonde and Blonder  by USER and Pamela Anderson!
0,It sucks not waking up next to you in the morning
0,Why do things change?
0,"ahh working all dy and was so quiet, then had to go watch the guid neighbous parade, so tired and my feet are sore"
1,"This show rocked, made some $$ and met some sweet pplz"
0,sorry to post so many times but the rally/protest is in four hours......they are armed and waiting #iranelection
1,"USER Hey, rockin' man, what's going on?"
1,USER Is that what you're doing to me cuz of all my Flash hatin'!? Hahaha! (That baby is SO cute!)
0,USER no
1,PM math class  Sturms's a dick.
1,USER as ive already said ... i aim to please
0,Back home... Task still not done
1,"USER my birthday is july 13th, close to yours!  i looove your music Summer Drive Song is amazing!"
1,USER dang i didnt know i was ur 1k .. nice   i feel special lol
1,USER im doin that too
1,have you used Miro? OMFG you should!!! URL the best internet TV software EVER. i hope i sound like ateenage fanboy
0,Writing in the sun an old lady told me I had dirt on my face but its just my facial hair
0,so bored!
1,watching fireworks go off in boston from my bedroom window. awesome
1,"besides the part where my boyfriend's dad gave me shit for NO REASON, i had an amazing weekend"
0,The show was amazing  too bad attack attack wasnt there  but still sickkk.
0,Headache..... Grrrrrr
0,"USER I got my copy of The Sims 3 yesterday! But, seeing as my DVD drive thinks it's a CD drive, I can't play it just yet."
1,USER hold up *gives you something 2 wash your mouth out wit   im sorry i pay enuff child support so BRING IT
1,Headed home for a well earned 2 days off
0,USER USER USER USER #pt2 Good Initiativeï¿½ I m a bit busy in the coming 2 weeks. Sorry for not being a part
1,Studying in Starbucks and sipping on an amazing caramel latte
0,"USER I was fine a while ago, but I think my girl, USER has a problem"
1,USER Ah yeah USER is always on top of this  love her!
0,@ jaaacckkkkk umm I dont really know anymore. Back to the drawing board  maybe like golden spoon or something
0,Meeeee but i can't
0,"USER so he must have  but i was excited to have time to actually talk to fonz, tim, and jeff for like more than just a minute!"
0,"Why can I find the small town I live in in the Weather widget on OSX, but not in the Weather.app on my iPod?"
1,well the apartment is decorated all pretty like!  Jeff still insists on hammering at 11:24 at night. Grrr!
1,Getting my car hand-washed by my babe. I'm so spoiled
1,fireworks are one of Gods greatest creations!! besides me of course
1,USER good to hear
0,Awake for like a split second ... Hungover for like forever and a day
0,A Skylit Drive - Drown the City(new version) / Burn the City(old version) good song but they shudda just stay with old version
0,And i hope this is right cause i cant turn back now
1,USER Hey mami - did you have black shades on at Funk Fest?I was backstage                         Entertainment Coordinator
1,"6 laps so far and the are big laps.  I'm not sure the distance, but I'm feeling good.  More latter."
1,USER cut it off and call me.  I misses you.
0,USER it did make me feel sad to see swineflu bods with blankets over heads but then I realised how ugly they were.. PR deals
1,"USER I'm so glad!   And that's quite a compliment, thank you!"
1,"done. submitted the thesis finally. A relief. Of course, corrections are going to be showered. That always happens.. But I am satisfied.."
1,Ghost Rider on Cinemax  URL
0,Wishes organic chemistry didn't effin exist !
0,yorkshire lost
1,LOL just watched party in your bedroom video. it always brings teh lulz
0,I have SATs tomorrow  for the first time
0,Teaching maddie the ropes of life before she leaves me
0,I had to cancel on USER today thanks to my tummy..  Plus I burnt a batch of cookies..  Today is not a good day.
1,USER yes. get a twitpic already!
0,USER i just dont understand...
1,"USER Thanks! Yeah, excellent monkey family time spent"
0,USER   Got tied up.  I try to stay very skeptical and explore every avenue of explanation - I think this makes unexplained better!
0,Jemand zufï¿½llg Wind und einen See oder so in der Nï¿½he ?? I would like to go surfing today    #surfing #wind
1,Robin.. This saturday.. again.. you guys better make it this time.. and get a hold of gabe for me or give me there number..
1,USER thanks for the #followfriday!
0,my poor sexy man now has to go to work and he looks beat because he didn't sleep well last night
1,USER URL - That's so cool.
0,USER found the field and got run over by a big guy in 1st inning. Laying in bed at home with ice on my knee.
1,URL - Fire #2
1,USER Where are YOU?
1,USER Ohh I was fooled then until you said the last bit! DOH!
