0,No Windows 7 support for VMware View yet.  (VMwareInfo.com) URL
1,"Iï¿½m on my 3rd strong coffee of the day and #ElevensesTimeï¿½s started here already! To accompany the coffee, I have Mrs Kï¿½s home-made Halva"
0,"USER LOL! She is jess! You know who ::sigh:: No not that bitch you just mentioned, you know who"
0,today my feelings were hurt at school
1,"Was driving down Park Street and saw this beggar, crying. Apparently, I saw him at the exact same location exactly one year ago, crying."
1,I need a long vacation on a secluded island with no idiots! Wish me luck!
1,going in for my 3rd and 4th period at school...exempting all my exams so no going in next week...LAST 2 CLASSES OF MY SOPHOMORE YEAR!!
1,Its 1:30am and the last guest just left the party. Had alot of fun. Thanks everyone who came
1,USER he is incredibly cute
1,USER Rar!  Don't forget to get up and slowly stretch on occasion.
1,URL   here we go now
0,I'm here..still unconscious but can at least sense a touch...can't still recognize me
1,"USER I'm glad you have sun , here I dunno if it's gonna rain or be sunny!  I know which I want"
0,He's done replying  but he read them all
0,Got a banging headache  Me thinks i need to go asleep :L
0,"aaaargh, i'm so lost here.. everthing's in english, and the freakin' profile instructions don't work"
0,Back from a university fair.  But all it did was put me off going to uni    I don't think that was the point of it...
0,If you don't know me...I'm the one walking down 55th with a swolen eye.
0,just here chilling reading ..
1,"motorcyle fixed, house is clean, going to bed"
0,USER wanna watch TF2 too
0,gawd my nose is huge!  my passport pic tomorrow is going to look so yucky.
1,USER whaat?! Why for you no going out and stuff yo?! You should get out and celebremate!
1,"USER it's an aboriginal term meaning ""the whipped little boy."" (USER)"
1,I was in a band once
1,"Softball after church. So great 2 have good, godly fellowship.  ~ God is Good ~"
0,"Great, just spilled coffee in my lap while driving"
0,USER i know! just noticed that  sent an email to them hopefully it gets fixed soon
0,"USER What do they have, Much Less? Fever? Rafa has diarrhea and a cold for the first time as well"
1,USER Haha Idk. Goodnight stevie.
0,"Vacations, I'm waiting hopefully for them! A month, yeah, I definitely can't wait"
1,"maan, been so long i havent been on the cp. which means 2 days .."
0,Stuck at ballpark with no where to park  haha we should have been first in line but the creepy man beat us! HELP!
0,URL - i miss the sharks  i love devin setoguchi
1,"Loving the dirty msn chats with the b.f,"
1,USER awwww i could never b mad @ U Omar!!! LOL no worries
0,There are way too many chocolate chips in this ice cream.
1,Had a nice run  Now for Optometrist :/
1,USER excatly
0,USER I am pretty sure you are better than me. I would never be anywhere near getting 10. I suck so bad and my teacher is wicked
1,omgg USER video You Belong With Me is so amazing! And she kinda looks like Sophia Bush with the brown hair  lovvvesss it.
1,USER We're both sticklers for language. I'm sloppy with words when too lazy to explain the difference
1,USER  hello Guy
0,whoah. i'm starting to miss him
0,I'm at work right now workin for that paycheck everybodys tired cause there ain't a damn thing to do
1,"USER yeah, i wonder how everyone would handle their acid these days  Should be an interesting sight..."
0,cough and sore throat. the weather is not helping me
1,yay horse riding and fisher and donaldson cafe
0,I want to go to irvine already  Still a little paranoid.. Love my dad!
1,"today:one wedding,one tv apperiance,now cooking some soup"
0,"USER see! I guess we all know who loves who more  I feel so heart broken, LOL"
0,USER WNCI said your band name wrong this morn-no worries though i sent that jimmy jam a msg to clear it up! lol wish i could come
0,In bed. Not wanting to do a 10 hour shift today  well needs must x
1,"tired at work after 4 hours of sleep!!loving the weather though,so sunny and warm"
1,CEO of EMC said welcome to us Technologist  ....around 7000 of us here in Orlando from 96 different countries #emcworld
0,GSCE chemistry test tomorrow
0,URGENT -- Air force officials say they have found bodies and debris from Air France flight 447 which crashed in the Atlantic.
0,missing my mom  #fb
0,"USER Wow, 12:30am? That's amazing, wish crazy stuff like that happened down here"
1,Finally home  I guess that's what happens when you live and work on the same side of the island ;P. Night Tweeps...God is love.
0,studying for final exams
0,Lost my glasses while river tubing...it sucks
0,OMG..... Just realized I'm only here for another 2 days  are ppl still going hosteling? Or have you already gone? X
1,vNDS - atleast this is clear and easy to understand!
1,Sooo excited for this weekend!
1,USER women are not the complex creatures they are made out to be
0,USER mann and the fact tht my internet is slow makes everything a million  times worse
0,USER USER I was out to my native for my friends and cousins marriage so couldn't make it
0,"Right, now back to school for my session with Mr Lister ... fun"
0,I hate getting my oil changed. I hate saying no to things i know my car needs. But i cant afford it at all.
1,USER nope. just saying I did (Id just done something CHUTZPAHtastic) you def. do
0,"Yesterday I didn't do much because I was just lazy, but today I don't feel so good."
0,"""You're so lucky to be famous and talented! It seems to be the only way that Tom Fletcher will notice anyone  "" - oh boohoo."
1,"i just made a cake! hah, excited!"
1,USER: I'd like to give you a big.. HELLO!
1,USER hey me too. Glad you had a good time doing whatever it is that u were doing
0,"USER YAY for Free RPG Day. Boo to my LGS (- friendly!) who wouldn't give me a copy of the 4e adv, although I spent $40 there!"
0,"USER oh no no, it's from the suit. I took the shirt off as soon as it got sunny"
0,wants to have a nice long Skype call with Louis  .. URL
0,I think I am going to throw up
1,im home it was a funny day  i have new shose  i like they
1,USER taxes are due at the end of april for us
0,Just got home from school LOL 2 1/2 weeks left yay!!! Then off 2 summer school
1,My favorite Blog hands down! URL  The man knows fashion
0,Liverpool beat hammers to go to top of the league.. for what might be the last time this seadon
0,USER ... Miss ur ugly face
1,USER hi! Sight seeing in gurgaon?  how far is south delhi from there? 1 hour drive?
0,"ahhh, itchy little bumps all over my arms! make it stop."
1,It's time to say 'good night'
1,isn't even to austin yet and  already met an rd from another property.  excited!
0,USER no i do not!!!!!!!!  hahaha she is gone thank god!
0,USER sitting in marketing right now and actually want to work on frankenstein
1,hey show some teeth.. smile! please give me some smile! thats it! very cute  hehe  have a great day! yes im talking to you.. take care!
0,"Hello doctor, fix my ear please."
0,"USER so sad! now, she is an angel."
1,"USER Hey thanks  1/250s & ISO 400, used Live View to frame it - amazing how quickly it moves across the frame!"
1,"hahaha... It's so funny! I have a lot of  "" JoBros"" like followers, hahaha but it doesn't matter I know who the real Jonas Brothers are"
1,USER hey ther hun <3 sorry but i gtg...im going shopping! haha well ill tweet u later. go back on later tonite! bye
0,working late...again
1,Lakers won! Yeah baby!
1,Math exam in 2 hours. Someone please wish me luck.  birthday in 11 days. 19 ppl. Canada here I come!
0,Am trying to fit all this physics theory into my feeble and low-capacity brain. Exam in two days
1,USER: i wanna know.
1,USER Well I am crashing out on the sofa. You too  Catch you in the week !
0,Not a very happy birthday today
0,USER got 3 hours.  but that's better than. Nothing. U still working?
0,thought of going to work the day after is making me upset
0,Worked my a$$ off tonight and for the first time in a while on a Saturday I was sober... Kinda sucks to be sober and alone after the club
1,"Had a busy weekend so couldn't update, except for yesterday which was spent on the couch watching SITC DVD's. Guess that's a type of busy"
1,USER yes your welcomee !!!  where do you come from?
1,"going to find some breakfast...or lunch I guess at this point.  Kiss 96.1 FM Summer Concert tonight in Ft. Collins, see you there"
1,USER Awesome.  good luck with the kegging.  I need to get into that instead of bottling
0,USER not better  think imma go to the hospital if this fever doesn't go down in an hour
1,"Saving stuff for the backup, then outta here for a while. Cooked for the week. I must say that me &father ain't that bad teamed up"
1,just sat wit sis lookin on twitter  x
0,Miserable day in Suffolk
0,USER why dont you come to florida more often?
1,URL  The report on a new PC I promised I would publish
1,USER I hope so  what are you doing today
1,"it's cold, man am i loving this weather"
0,USER oh god that's terrible
0,USER i'm so disappointed.  guess thats what happens when obesity is such a huge issue
0,enjoying another night home alone....6 days and counting....why oh why wont mi phone ringgg    lol
1,USER exactly. we are such good people. sharing is caring.
1,Gotta go.. Good night everyone!
1,"USER Well I'm not free, but I'm quite affordable.   Vanishing cookies is a great name!"
1,USER Aw that'll be lovely..is that where you are from originally? You must be looking forward to seeing her!
1,testing out ymtumbkr on my iphone  URL
0,"Shattered |: Didn't get much sleep  Suposed to being going to a BBQ tonight, but there is suposed to be thunder, lightening and floods"
1,USER enjoy your workout babe
1,doing my nails
0,all ready 2 go wiv nowhere 2 go  hopefully get moved later this afternoon i hope...cheese chocolate and sausage good on a roll?
1,"And, I'm accumulating money again, so I can use a fancy finance app. Thinking of getting another CD or an IRA.  saving for a house. crazy!"
1,"USER: hey, nice to run into you again  Love your layout btw!"
0,USER Glad you got good news and you can continue your gym workouts ;)  Wish my back was better so I could do gym workouts
1,USER yes! kayley is cooler! haha i cant stop lauhing that USER = USER
0,Toaster broken. Now Schwarzbrot for breakfast instead.
0,"USER sryy that I didn't get on msn that night, u know."
1,"mmm not waking up for class because it's canceled feels a lot better than just not waking up for it  today, Caitlin and i LOVE Lilliana."
1,Kyle is here and I am about to get some #SF4 action. First to 100 wins
0,USER Thanks for the vibes - I now have 3 mini Pisa towers but I really need a new bookshelf- i wont do a purge its hurts
0,"re-dyed the hair, early start tomorrow heading down to londons clothes show, great place to be when i feel fat.   bright side = motivation"
0,"USER so no crab huh?hehe,anyways,i need to work now and pack my freaking room!!SO MESSY!"
0,USER  wHATS   MY FRIEND SOMEONE NEEDS TO BE SLAP UP FOR YOU LOL
0,leaving work soon.... YAAAAAY!!!!!... i have been here since 8:00
1,USER I agree...antiques are the exception.
0,USER; when the hell are you coming over?!?! seriously i thought you were calling for me!
0,"USER they told me u r not the reall k ,and she made a radio interview n said she had no twitter account"
1,"Just had brekkie with Steve, Paul, Pip and Isabel. Now awaiting taxi. Great weekend...AND the Sun is shining on Bristol!!"
0,"USER Lizzy i miss you bro, why do you have to be grounded!?"
0,"I need to get some sleep but after the last few hours at the computer, I don't think my back will let me"
0,USER Miss you guys already. Gutted we didnt get to say goodbye to you Mike
1,USER Send me an email telling me about ur wedding customs in OMan  Im curious tra!
1,"USER a pleasure! i'm a factoid addict, so right up my alley"
0,"apartment hunt continues...just came visiting few sites near Orchid school, Baner..its so confusing.."
1,USER hey hows chiga is it awesome? man i wish i was there to hang out in that apple store ur always talkin bout!
1,"USER Per funding now, certainly Mr. Conway agrees w/you.  URL"
1,USER I didn't do it =( I told her not to do it but she did it anyway. I'm a good student at leats thats what my teacher say
1,USER don't worry be happy Ryan
0,"and now, bedtime. work tomorrow 12-5 and then my graduation party, which most of you twitterfolk are not attending    poo you all"
0,"HAHA! USER I know, im such a light weight  USER mmmm rum and oj!"
0,"One more slide and the deck is done, at least version 1"
0,"USER noooooooo, stay"
0,"USER hope it too! haha heyyy I just saw, u are in a band!!! what music plays your band?? I would check it but I can't"
1,EVERYONE FOLLOW USER USER USER  THEY NEED OUR HELP!!!!
0,USER  c'mon now....
1,USER lol! yea im doing that this week!
0,"I want to buy this great album but unfortunately i dont hav enuff funds  its ""long time noisy"""
1,USER i'll be sure to keep away from them
1,GoAnimate.com - check out this funny movie  URL
0,it sucks that I'm in CA and I still have to wait 3 more hr to watch the awards   (X17Live live > URL
0,This bathroom smells like a litter box
0,"#spymaster thanks for the hit list, I know who'll be moving up on it when does it refresh again? 24h? Oh good me on top of most killed"
0,"I kinda don't want this week to end.  But I'm excited about Mom and Dad coming home, moving, and stuff happening next week."
1,USER good 2 have u on board wooley head!!
1,I bought my STAR TREK tickets.  I'm not going to the 7pm show...but I'm going to the midnight IMAX showing.  I'm happy. The ennnddd.
1,USER good  Im about to have to go :\
1,USER sweet pic!! looks like USER is going to launch soon. can't wait for the update
1,Yes.  It's decided.  Xander and I are having a Pyjama Day and going to do absolutely bugger all today!  Yayness!
0,University of Texas at Austin or South Western Adventist University?  I can't decide.
0,I'm getting ready to go to sleep! I don't know why I'm so tired
1,âBing? Interesting. Iâll have to Google that when I get home.â?  USER rocks.
0,ugggh...just started making a memory book....its a good thing.that im letting go.but a bad that im finally walking away  i hate breakups
1,USER Oh! you bought already? which one? I just stole my brother's lenovo tablet PC   its pretty cool!
0,The Life Of A College Stay At Home Mom: Delay in the Bash  URL
1,passing out. now. night night. thank you all for everything & an amazing burfday
1,"ROBIN SODERLING, Be happy that you won against Nadal & Leave the Cup to Federer Already, THANKS."
1,USER You too?
0,going to the Waterfront Campus to meet with computer course instructors on curriculum
0,USER  can't see the moon here in OH... storms just rocked & rolled thru...
0,USER I know! But I don't get off til 7 on Monday and Thursday
0,WHAT'S STOPPING ME FROM SLEEPING? oh maybe your beautiful face. It's all I can see with my eyes closed!  <3
1,is away from keyboard. BRB.  URL
0,USER grocery shopping for thangs...I have a taste 4 chicken alfredo...since I ain't none on Saturday
0,Who else is bummed that Susan Boyle lost?  Kudos to the winner though.
1,Going To Have A Good Day Today. Determined..
1,Saw Star Trek today which was surprisingly awesome! Yesterday I saw the Wolverine movie. That was really good too.
1,"USER hmm.  Unfortunately, I'd like to have it both ways.   I was thinking that it makes an excellent reference tool while coding."
1,"Camelbeach with the family, once again, haha. Brandy's for the night"
1,"I know if you're young it's hard to relate to the ancient guys you saw on TV 2day at Normandy. Look deeper, they are angels and heros"
1,USER ok thats wussup i been good  just chillin today what u got up for 2day?
1,USER gooooood luck! kick some ass!!
1,USER yes yes! i havent been in sooo long! we should go
0,"USER Awwww.... This made me smile so gleeeeefully. Still though, had no messages from other people  hehe"
0,Ok i'm not happy anymore   I'm so scared i'm gonne fail on my exam
1,my home boy Drew just made me the most delicious alfredo chicken pasta since im cram studyin' mMMmm
1,"USER cheer up Liz, we all have bad runs and it seems like it's the end of the world, don't let it win. Music helps, loud music"
1,"USER  oh, MY! really where do you live?.. i know i ask before i for got.."
1,is loving her get away from Murray with her favorite couple!
1,USER tell me how A&D was..though you should watch The Hangover
0,Goddamnit Little Bohemia.
0,My place is all boxed up and so depressing  watchin nick and noras playlist until I fall asleep...wish my boo was here with me...
0,Five more minutes and then the party will be over
0,Get home from work to see my parents watching Grand Toreno... I want to see it soooo bad.
0,Sims 3 came and can't work  Bummed out.
0,USER USER J&G wrote 95% of songs. Already in process of forming with like-minded musicians. Hard but neeed decision.
1,"TIME TO MAKE THE CHANGE TWEEPS! Tweet by tweet  ""Wind of Change"" by Scorpions URL"
0,Man its a lot of international travelers that's not going nowhere tonight!!! Feel bad for them
0,so bored ri now
1,USER bah! I thought you were dropping our principles there for a moment!
0,URL  is a shame
0,I have Saturday skewl for missing too many days  lmao well ttyl guys!!!
0,my morning is seriously not a good nor happy one at all
1,My prayers were answerd!! my maths exam was acctually ok  phewww
1,"USER Err yeah, USER is a vinyl DJ!"
0,Tidyin' up my messy room and then just go out for a walk. I don't wanna study today
0,USER It really is ridiculously hot. I have my front and back bedroom windows open to create a breeze. Still hot
1,"NBA Playoffs ATS Record (34-29-1) Thursday Picks Orlando Magic -7 over Boston Celtics, Houston Rockets +8 over LA Lakers BOL"
1,"USER Aww Thank u hun i cant believe ah  i will send you when i look pc =D cuz im login from mobile.i will send you,dear friend ^"
1,Running and golf today - what a lovely day! Tomorrows my first day off/lie in for ages.. I'm gonna enjoy it!!
0,TWEET. crappy genetics work i cant do. crappy ecology work i cant do. cba to do anythinggg  babysitting tonight! :]
0,i wanna feel happpy...and i have no idea why i dont
0,USER no more interviews?
0,a sunday without you  i miss youuuuuuuuu!
1,Swimming with dolphins
1,"YAY, my hubby came home early today! Errands and Ikea are always more fun with company!"
1,"USER thanks, they were great  had fun  wat ab u?"
1,USER and!! I bought stuff today... I bet you would like  whatever I bought... I reckon you would!
1,URL - i'm gonna live here one day ha ha ha (was geography homework in year nine)
0,"is tryna find her a 30 yr old junt with a 401 k, stable job, good home with an extra room 4 me and my baggage..so tired of u young dudes"
1,lmao i love watching Jess sleep... so funny
0,USER  No  i have too many things to do due to a stupidly busy few weeks. Like clean and tidy and do stuff in the house
1,USER  OK!  Let's do it. Let's exchange visas
1,School tomorrow  But only 3 days of school this week
1,USER Thank goodness for Laura!
0,"About to go to bed. Well, shower first, but then bed. First formation at 5am. *sigh* I miss my husband dearly."
0,Stuck on the couch motionless as any movement makes the back pain a little more agonizing.  Not fun
1,USER haha no haven't got any today but soon i will get some more  haha
0,We leave tomorrow
1,USER congrats on the wedding and the stunning photos.
1,yeah. lady gaga's showcase coming to singapore on 14june!!
0,i'm only started to get my head around this stupid maths
1,Good Morning Tweeple...it's Lunes once again and I'm at this job trying to get it in!  Work Hard to Play Harder!!  LOL
1,"Boy friend told to prepare for break up, but didn't tell how. Tips invited"
1,"USER, One day I'll know what a 65 is"
1,Just bought redeeming love by francine rivers. You should do the same.  reading time.
0,"I wont be available for work for a month or so, sorry"
0,USER  thats tt.ly cruel  (see what i did there?) bwhaha
1,USER do it alex. you have friends here
1,Made for tv movies are the best
0,Making brownies and watching old Grey's episodes. I'm going to miss George.
0,just emailed amy in Vietnamm. I miss her sooooooooo much  hope she's okayyy
1,first up: Beauty Bar. Sippin on captain and coke in a hair dryer chair
0,I have a love-hate relationship with Adobe After Effects. Its actually more of my powerbook's fault. It's just powerful enough. (tear)
1,"USER It does. As we could see, u got some cute BCBG pieces in ur closet  btw, is it true tht Chester's closet is bigger than urs?"
1,USER got to admmit the caravan you had was more gadget than the other one good show btw
1,Nice to see that the maintenance has been rescheduled in respects of #iranelection. Good Twitter!
0,"Tried to tether my iPhone, but apparently it only works with the 3G. So no wicked-fast EDGE surfing for me..."
0,Poor Preston.  URL  /bored at work :B
0,I miss you already  this is not fair!
0,Damn it #pens
0,going to take a bath. i have a baaaaaaad sunburn.
1,"USER im sure loads of people will vote for you, i deff will"
0,USER I'll second that  Too difficult to head out if it rains.
1,cornetto FTW!! i love it even if it's raining  URL
1,USER
0,Back from vacation I don't wanna go to work
1,USER Does Microsoft ever think?
1,Am primit o cutie Illy de colectie: Illy - Love Difference  URL
1,USER I know your gardening pain
0,USER URL - This is right across the street from my old apt.  Meeemories...
1,Gotta love friends who come over for a pre-birthday dinner and bring you pre-birthday champagne.
0,"Whisper hello, I miss you quite terribly!  Sad that my beef is leaving soon!"
0,dang its official mi bro broke his wrisy or arm or somethin  ima be da first to sign his cast!!
1,"Going to start on the Official, ATW myspace!!"
0,"Stupid twitter told me to reply with ""leave USER"" to stop her messages and i got soo sad  i'll never let go jack!"
0,USER pshhhht! it should be AUSTRALIA HERE WE COME!
0,Home Sick  mum got mad Didnt pick up the phone when she called me in a little bit of trouble lost phone @.@
0,USER
1,"Nominated on a Belgian website! Pardon my French as that is what I mistook it for   www.rnc.be.cx , click on the banner ï¿½INDIE TOP 10ï¿½"
0,Damnit! This cuuuuuuuuuute guy was flirting with me on the road like playing catch up and waving hi & I'll probably never see him again.
1,So sleepy...... at least we won
0,I've managed to damage relationships with two persons and one department. Such a productive day
0,I wrote a poem in my sleep last night. I wish I could remember the words.
0,USER OH i was SOOO right! i kept guessing that earlier today but he never responded back  i totally knew it... somehow
1,USER pulling my mom's battery did the trick. Her phone was having the problem not mine  thanks for ur help
0,USER
0,USER I miss you too!  I wanna hug you right na-na-now! I`m quite content and happy with life. You?
0,"Marketing test this morning. Gonna need lots of prayer to pass this one, especially since I didn't study"
0,"USER plz say ""Happy Birthday Or , Roni & Mickey!"" plz plz plz  x"
0,got sent home from work as she isnt very well
1,USER Hope the train remembers the way - they can go a bit loopy on bank holidays
1,"aahh saturday  need to tidy up m room for my birthday on Tuesday weeeh . and i need to go to edeka and buy some ""birthday-stuff"" ...tweet"
0,USER URL - Benji looks thin.
0,On train. Book finished. Ipod dead. Next to smelly man.
1,USER yea kirby is cool. I always pick lucas though.  chris
0,USER Be careful! Don't go running around outside with people torching buildings on your street
0,"a simple ""what are you doing for lunch"" turned into me picking up lunch for the entire office  grrrrrrr! #Work"
1,USER  lmao I know right well my roomie got me one anyway..   so  what it is?
0,USER Still slogging through reports - 100 due for tomorrow
1,USER that's what she said?
1,everything will be ok...
0,USER Me too
1,"USER Very cute blog! You have to be the most entertaining celeb out there, perhaps because you are so real. Keep it up !"
1,USER here's an idea for a new twitterfeed feature: an option to limit twitterfeed tweets to a retweetable length
0,"USER I bought mine July 13, 2009 -hope that AT&T honors iPhone 3Gs subsidy 4 me... their Web site still says ""no"" for me = #fail"
0,My iPhone battery died this AM.
1,Perfect weather 4 a race...I'm jealous but super excited to volunteer
1,"is REALLY full after lunch at work, and likes hiding in the test booth!!"
1,"USER Ahem, may I boldly suggest the lovely Detox Cute (& the beauty Junkies)? USER (wink wink nudge nudge)"
0,USER The sky looks so grey...
1,time to sleep. moving back to bloomington
1,USER get your ass down here so we can drink
1,Woohoo!  It works!
1,Hi Twitter pals:  I would much rather be playing than working.  It is Friday after all!  Hope you are doing great today!
0,Just dropped my sistah off @ lax.    #fb
1,USER You should be  Chocolate in mail to you.
0,watching all the Arrested Development seasons from the beginning.  really miss that show
0,"USER depends on the mood too doesn't it. Umm, this is not appropriate for me right now with the woman in bed dieing"
0,USER omg yes! i've been trying since then and they keep saying I can't vote!  I'm mad.
1,"Finally home, watching saturday night live, then dreaming about my amanda boo"
0,USER In class both days during that time.  Srry I can't help out man.
0,USER theres an hourly limit  i got put in right when USER got out
0,"gmail, facebook, twitter, yahoo mail, yahoo fantasy, blogs, online bank, google calendar, finance, amex.... when will the madness stop"
1,"USER as much as I want the world to tweet, I still want first dips on the power sockets!"
0,USER Cheers - I'm not a member of the Fan Club so will have to give the autographs a miss  Would have liked Lewis's though.
0,"USER gotcha, wish they could do something tho"
0,"USER I am on battle.net with my iPhone, yes.  Kilzar is without one."
