0,No Windows 7 support for VMware View yet.  (VMwareInfo.com) URL
1,"USER Thanks!  The concert is this coming Saturday actually, it should be amazing though. Hope you are having a great weekend too!"
0,Long day in 100 degree New Orleans weather  Looking forward to the weekend. Friday always seems to be the longest day of the week! zzzzzz
0,Why is it s0o0ooo UgLy 0utside?
0,"Ok, got my update. But now I can't figure out how to send a pic message. Grrr! I just can't win today."
1,USER Thank you for the follow  How you doing?
1,USER well then sounds like your subconscious is just as whacky as mine
1,"YAY ppl wana be my friend  maybe im not ""just entertainment""  ha ha USER"
0,USER awww that sucks that you missed it
0,USER disappointed i didn't win the eyefi card  i had the right answer too.
0,USER I am so jealous. I've been up since six thirty - and in desperate need of a nap. Red Bull is not working
1,Looking for a google wave invite ???? DM me if you would like to send me an invite
0,was just reminded by Pauly that the rain brings the roaches out to the streets of Las Vegas. Kill me now
1,"this was the best secret show ever...drinks, pit, got to touch nick hexum, long show ever...omg...nothing can top this"
0,realized that I am apparently a mistake
0,i fullly killed myself today in drama. i stood on a chair which was on a step and i flipped off
1,USER WOO HOO!!!  we can't have you sleeping so much.  I am calling you tonight at 3am
1,"USER Amy, I hope you do well with we will rock you! 4th recall? They must like you  Wish you lots of good luck  xx"
0,I just drank a glass of red wine and it went down entirely the wrong way...my legs now require cleaning
0,my guinea pig is acting really weird and she's scaring me!
1,USER u always know the rt things to tweet  thx my twitter friend!!!
1,"USER Twist is amazing, read the actual joke very long back  URL"
1,"USER Yes, great, was good to get fully back organised after my trip, & spent some time breathing in the highland air"
1,Bt addicted to OMGPOP.CoM. wel cool site
1,You guys have a lot of interesting theories
0,Geometry regents (final) today
1,"Well, I met the infamous (or is that famous...) USER today. It was a pleasure Jesse"
0,Setting my flickr account to load pics tonight when I sleep! Slows my net down to much an other time
1,"USER I should've known that. Clearly, I am more of a Doctor Who fan than BTTF."
1,Spent some time with the Guild Wars 4th birthday update. Menagerie is a welcome new feature... For Rangers anyway.
1,new drawing idea
1,"USER  Don't be silly, everyone is intelligent in their own way"
0,USER unfortunately not at civic camp.
0,USER USER my name comes top and great but general search not so good  like it tho x
1,i've been eating cheetos all morning..
1,USER I really want you to play with me this summer. My friends flaked on our plan so me and you can re-roll.   ~ Dylano
0,I would really like it if my stomach would get along with food and stop making me feel so sick
1,USER Diamond is good  It guarantees you a room even if you haven't booked.
1,I love the weather!!  6 more days!!
1,USER im good! I'm soo tired why the hell am I still up! UGH gotta close my eyes now
1,who wants my autograph
0,USER SWORE: USER SHIT SHIT SHIT! aHHH HATED ON TWICE IN ONE WEEk BY BRADIE!! GAHHH HOW IS THIS POSSIBLE
0,aw no there isnt
1,USER I'm so excited to see the video when it comes out. The song is AMAZING as always. Great job guys.
1,Cake boss is hilarious
0,Math exam tomorrow
0,USER Studying through the holidays then?  What are the subjects?
1,The Jonas Brothers new cd is offically out!  Pumpeddd.
1,i miss spelman. i really can't believe it lol.
1,"USER Lol I don't blame you, it all goes horribly wrong after the wedding, at least you got the ring, thats all you need really  lol"
0,Back is rather ouchy  Bus was pretty painful!
1,USER USER will have to wait on the recipe at Simply Recipes.  Sorries!
0,"USER before you finish him whisper, ""for raping Toeknehs personal space, bitch. LOOOLLLLIIIBEAM!!!""  hug please."
0,USER USER suggested that you may know what is going on in our part of the world (grails wise). Not much in NZ
0,USER i know ahhhhhhhhh
1,"USER Thanks for adding me on Facebook, Phyo"
1,USER hell yeah! We can stay at the Hooters hotel lol maybe we'll get a good rate since your a big wig there
0,I wish I could get this right can someone help?! Plz!
1,USER Thanks Tom! Hope you like it
0,At work missing graduation
1,"USER girl I am beat, I will be posting pics and vids on FB tomorrow if not vids on FB on Youtube."
0,"USER APA PRATIKA GA LULUS? OH MY GOD, THAT LITTLE GIRL SHOULDN'T BE IN IPA! So sorry to hear that"
1,USER you would not.... plus it rained today.
0,back...on...hold...not feeling the love for united airlines right now
1,"USER :o awww, those are so pretty.  thanks for the link!  anything with daisychains are cutecutecute <3"
1,"USER 1001 ????? Gee, I just have 42 updates! Well, congratulations!  And thanks for answering my question, ahaha."
1,USER His bear's called Steve you know?
1,It is soooo nice out!
1,"Hi USER, how are you doing? Hope all's well on your side of the planet."
0,Really... I can't believe it's sunday! The weekend came & left too fast!  LOL
1,Spending the afternoon in the sunshine being splashed by paddling pool-based toddler is a GOOD way to wax Saturday
0,USER not yet  end of july we're going for a week though!
1,USER they are increddibllee!  you got their album?
0,Stupid twitteric!!! I don't know what my friends are up to every minute of the day...
1,@ Mexicana lounge ... waiting for my plane to DFW
0,USER i mean....i am so concious of it all yet cant get over the guilt of feeling like its my fault my son is bipolar...
0,People of El Paso i am afraid to tell you the local sheriff has closed down tonight's venue.. we are busy trying to reschedule the party
0,"USER, a 74 is not ""quite alright""!  on the plus side, I ate cinnamin toast crunch for breakfast, and am now eating strawberries."
1,USER awww!!! how cute... i love when parents start them early.
0,"USER awwe  feel better, you're too awesome for haters. I LOVE PEREZ HILTON!"
0,USER - Can't the automatic transaction fetch get all my history from my account
1,"Socks and Puppets is a fun game and you need to check it out, no really URL COME AND PLAY EVERYONE PLEASE GO ON"
1,"Going to sleep, the concert was fun"
1,I want to clubbb!  Effin love dancing.
0,USER at least they didn't wake you up at an ungodly hour. The sun wakes me up at an uungodlike hour every morning. i was up at 5am
0,i think people should tweet me more :L  nobody tweets me  #
0,"The best band for me USER were Korn, the biggest disapointment was Marilyn Manson he just put no effort into his performance"
1,USER Bubble Tea is always a win.
0,I'm sick. I hate being sick its saturday!
0,The cat just ran off with my sandwich.
0,this next week is gonna suck for exams  but at least they'll be over soon (:
0,"USER YIKES!  Sorry to hear that, Lily. Hope your day goes better."
0,"USER not a single word.  well, except 4 Finance papers for class. not worried though. in 3 months i can write all i want."
1,Nice to meet up the the lourdes crew again last night - even if it was just for a little while
1,"Going to work. Come visit me, depot cafe next to home depot"
0,I'm steeling myself for the huge void that the Apprentice UK concluding today will leave in my life... Back to grand designs re-runs
0,USER I haven't in a LONG time hahaha I hate the computer
1,The title really fits this today's Tel Aviv morning and I am sure will still be valid tonight  Take it easy. ? URL
1,"USER well MtL but yeah same same, different shaped ball causing the issue"
0,"going to bed, i fail at cooking with tofu, although yes man was slightly entertaining so that's a plus. work tomorrow"
0,USER poor drew
0,USER Now you have just made me completely jealous  What dates are the shows for the July one? I might just have to find a ticket (:
1,USER today is the last day to vote. URL  Speed Round starts tomorrow. Oh-GMorning
0,has a freakin' headache...arghhh kung kelan may deadline  URL
1,Is eating a honey mustard fried crunchwrap.  Yummm
0,USER Viva don't work in my building  nor wataniya
0,Its such a rainy day
1,I'm amazed at how late 4 boys will stay awake playing video games
0,missin my hubbie  he is @ work
1,I'm scaring d. Right now its so funny
0,At professional development.....
0,USER im not sure if i will watch the awards because here it will be late at night when they start..  i really want to watch them
1,cooking
1,USER yay how exciting! glad to see you're also a surgery live geek  how are you? hope the revisions going well x
0,"USER i think she's doing her own world tour isn't she, so i'm not sure she'll be there for november."
1,USER I'll tell ya what I think in a little while. Getting ready to start it now.
0,USER totally sux. seems like windows live messenger is also going down.  i use hotspot shield to bypass the firewall but still.
1,Scorchio san garden  has our summer finally arrived?
1,USER awwwwwwwwwww thanks! revising like crazy here :| lool! i'll tell him!  enjoy relaxing! xx
0,USER you missed a train
0,head achee. advil is so not helping right now
0,Brian Stole My ice cream
0,oh by the way twitter i left my headsets in stupid aliciaz car  now i wont get them bak! & i cant talk on thee telli fone!
0,Got my passport in a wet cover! Thank god .. Passport was dry.. Why cant postmen be more responsible?
1,slow morning at marathon. to many westsiders at festivals last night sleeping in
0,"USER I hear so much about fedora, but every time I try it I'm disappointed  and switch back to ubuntu"
1,USER Hey Denise I love your show and I was wondering when it will air season 2?Can't wait!I'm a big fan of yours!  xoxo
1,thinks that watching the question of sport reruns will not be beneficial in the morning....foul mood will be shown! Oh well  xx
1,"I hate this iPhone keypad thing.. Tryin to sleep .. & listening to ""love is gone""  nighttt twitter world!"
0,I feel so empty.  i'm so alone right now i miss the only thing two people that matter  imy baby
1,USER - possibly tomorrow!
0,USER At least you're at a party. I'm at work
0,Dang! I just heard the starting theme song to Corner Gas in the other room! Sounds like USER is watching without me!
0,Had to leave the garden to make lunch.
0,Doesn't like how much UK postal prices have just gone up. Now costs 20p more to mail a Black Velvet to USA/ROTW & 10p UK.
0,"man, i ain't been without V's presence in a minute...i feel like a lil kid with no momma"
0,Diary on public option falling down diary list at Dkos  URL USER #publicplan #healthreform #singlepayer #p2
0,"Just reinstalled OS X. My lappy didn't need it, but I did. I just can't bring myself to delete anything"
1,chirp! oops. i mean tweet! lol
0,USER hey hun! i couldnt imagine traveling like you do.  keep your head up! your such an inspiration to many. we all live up to you!
0,come on people. are we still writing on our profile pictures?
0,USER I was w/ my fam away from the TV.  Can't believe I missed the Cup being raised up.
0,monday again.. expecting heavy traffic..
0,USER Isn't the great Canadian pastime beer drinking? Alternately: hockey. I won't be there tonight.
1,USER I am neither
1,Great trip home
1,"USER West or East? If it's the former, enjoy the hills"
1,USER I work as long as twitter works
1,Got the unlimited  paid the lady 65 I still owe her 10. I'm missing a 20 ):
1,Thk u...Ill be ok..thks for the kind words...
1,USER trend whore
0,I don't wanna go to schoool  four more weeks
0,Aah everything is so confusing
1,USER Just wanted to give you a wave and let you know that I am enjoying your blog  Peace
1,USER Good morning sunshine.
0,USER Dan Siego! I was in San Diego with Honor Society today and I did not meet you. I am truly heart broken
1,Hmmm USER that would be my fault... I don't know the difference btwn madonna & not-madonna.
1,having fun taking pictures and photoshopping them
0,Off to sleep cause im bored! i miss my ipod
1,USER  I visited your shop yesterday & I'm looking forward to my reading
0,"USER  I know, it seems like lots of bloggers I followed are either stopping or not really posting much anymore"
0,The day started with some accident on the red subway station & had to spend almost 10 minutes in the tunnel
0,It's damn early. And damn hot. I have to work for the whole day and so I'm rly damn pissed of.  *wants more time for his projects  *
1,USER Haha! You have a point.
0,So I just balled my eyes out. Keith is an amazing and really sad movie. It's even more sad the second time you watch it...
0,USER Are you serious? It got suspended? Oh my goodness  Stupid haters are probably responsible for that.
0,"Another! Guess who said this: ""You`re getting on my last nerve, SWITCH."" HAHAHA! I miss Luner! Forgot some of Blades of Glory lines!"
1,USER I'm just up the road from you in Bentonville.
0,"USER wow, i have to open the whole thing up to change the HDD?"
0,is having a headache. HELP
0,EPIC FUCKING FAIL!!!  We FINALLY LOST!  SOOOOOOOOO PISSSED OFF BUT THE DREAM TEAM STAYS ALIVE!!! ONE LOSS AFTER 246899832277 wins
0,correction my gf has an interview at a Strip Club next week
1,USER aw good luck!!
0,"can't sleep coz of headache, headache coz i can't sleep"
0,"USER no  it won't play on my phone ! I tried to send it to the Sk, but it didn't send"
0,refreshing ups tracking url like a weasel with a crack problem. 12 ish hours to go.
1,USER As u should b proud- she's a natural!
0,"Que claro ! On the way to school, with an allergic reaction"
1,"USER Congrats girl  Hope u have fun! Forget  the beans, you have to go to Boston Chowda Co in Quincy Market. Best clam chowda eva!"
1,USER just waiting for you to write something
0,"USER Yeah, or 140 tweets. No, no rollover"
1,USER What made him change his mind?
0,USER I'm seriously getting sad! I miss Panic! At The Disco. now they sound like a Bad 'The Beetles' rip off.
0,"USER Yep, such a tease. Can't w8 4 d official trailer though. Thnx 4 askin. Stl havin ths stupid headache.  Enjoy ur day, Sandz!"
0,R.I.P. Farrah Fawcett  i knw how her son is feeling  *tears*
0,It's been a longggg day going to bed. Up at 6:30 for school  ttyl xo
0,"BORED, ALONE IN MY HOUSE, ALL NIGHT, ALONE  SUCKS... AHH ALONE GET TO CHOOSE WHAT I WATCH YAY XXX EPIC xxx"
0,I'm really missing 1205 right now  xo
1,joooos! and mild taco sauce please
1,"USER LOL!!!!! I luv u more!!!!!!  ok, so guess what I'm going 2 start calling u, E, D, Brit and everybody else???"
0,"USER sux, I'm thinking of being an accountant. Mad monies! I'm a middleschool cafeteria manager  (25k/yr)"
0,USER - I think it was too much coffee in an attempt to NOT sleep during BarBri today.
0,Have Heart is breaking up wtf
1,USER *laugh*  Indeed.  I imagine that it would be.
1,"USER USER guess, we shouldn't be eating while twittering with the laptop kot..."
0,Need to find all my application and re-install them again (my iphone has been restored  )
0,i wish there was something exciting for me rn  boring.
0,wonders will everything be okay in the end.?  URL
0,USER No dice for little brother  But he's 18 so he has 10 more years to try again.
0,"just had her nose done, and now it's really hurting .. ouch"
0,sitting in a traffic. my exit is only an half mile away and not movig anywhere
1,"Video chatting with my brother for the first time. I feel like performing. Must resist breaking out into song & dance, playing guitar."
1,Today is an inspiring day! Work It!
1,USER smallworld
1,oh haii Mr teeth whitener
1,"USER miracle of god, few people said gud morning n few gud night"
0,USER trying to. d'ya have a link? it isn't up on rg.com yet.
0,says umuulan ng malakas.. huhu..  i really don't like rain.. gloomy.. URL
1,USER Happy belated birthday. I hope you had a wonderful time
0,"Ugh, ive been denied so many cravings. Now its red velvet cake and nachos"
1,USER Used to have Melchett's Baaaah from somewhere on the internet but Mein Handy is more fun
1,"USER USER USER Night all, hope you slept well too. I'm feeling a lot better today thanks"
0,Do I really want to pay $20 for the tiny little switch on top of my iPhone? Mine is dying.  It's probably worth $5 max + s/h! #fb
1,Wow Seagolville is a little Honky Tonk town. I saw a lil red tractor mailbox and a Cowboy Church
1,USER And that's the way it should always be done!
0,beyond disapointed that mom wont go and get her the book already..
0,"USER  Oooh ! Wish I knew how ! I have loads of ideas for films, but can't write tosave my life ! Ah ! Well !"
1,pow! right in the kisser
0,URL My makeup so pretty I don't want to wash it off!
1,USER you betcha. Thanks for being someone fun to follow
1,"just had and awesome dream about LARPing, it was awesome  lots of fun"
0,No email from Dane
1,USER So wish I was close enough to come and do this for you!
0,Haha its too early
0,This whole vacation thing is not starting out so well. I'm really not happy at all
0,Watching Morocco vs. Togo match. Adebayor is not playing in the Togolian team!
0,USER no
0,So wish i was at home in the ATL to see my boy! It's def been a long time
1,"USER I should point out I'm what they call a mature student, why does that sound depressing"
0,USER  my dad has a twitter
1,USER Ahhh good.You have passed the Classics Convention test!
1,can't sleep. excited for tomorrow. listening to the fugees  good shit.
0,"Oh no  STS-127 scrubbed, due to leak."
0,"USER but but but...he got punched  and apparently it was soooooo bad, he's bed ridden"
1,USER In your mouth?
1,"USER why not add your villa & those great photos to URL ? we're offering 12 months free listings, thanks"
0,USER Well that sounds NICE! I've never been to IKEA but want to go sooo bad! We don't have them here!
0,ugh tired bored. work AGAIN tmrw
0,you guys arent very nice to adrian
1,"USER working? no doubt. right there with ya' tempted to rhyme this, but will stick to prose."
1,USER I am   I'm working on a pic of you to go up on my new site... I'll let you know when it's up and running!
0,"USER Well ain't that the truth. Where'd the damn auto-lock disable go? Copy/Paste is good and all, but, eh... I expected better"
1,Watching Fireproof
1,USER Pretttyyyyyyyyyyyyy PLEASEeee tweet USER she is a realllllly nice person who supports U!!! Check her site out!!
1,USER that's what everyone in the office keeps saying! i don't think so
0,USER thanks.. I didn't make it in today.  some wedding stuff has come up I have to tend to!
1,watching Amazing Race and wondering which episode this is... 3 right USER ? Next episode is NZ??
0,Just now getting into my bed...long days = sleepless nights
1,USER LOL!! I will be supplying my portfolio site soon... I could use the work!
1,USER yay im glad you had fun sweety  me too
0,"Welll I'm off to bed,,, I have a math exam tomorrow.  Tweet dreams and all that shizz"
1,USER heeey maagda! I'm in mu houseee .. when u'r gonna come to visit me?  .. pleaseee! comeee!.. miss u!!!!..
0,USER boys suck
1,i have officially found my favorite boys.  had a great time tonight. and found a very comfy bed ;)
0,Too sleepy but I force myself to stay up late. I have to finish my thesis today
0,so I forgot to install latex on my new machine
0,"Uh  planned on being in work by now but have a teeny weeny hangover, I only had a couple of drunks! I am SUCH a cheap date LOL"
1,Woke up this morning singing the words 'How do you talk to an angel.' Why would I be singing that so early? Hmmm  Croissant for breakfast!
1,"USER   oh ok     i was wondering what was going on, no worries, talk at me as you can"
1,USER hahahah thanks!
0,USER I miss youu
1,USER Go You!! I'm still amazed when I wake up & the house is still orderly
0,USER NOT A DARN MOVIE SIR! LOL...U SHOULD JUST MAKE YOUR OWN...ALL OF THESE REMAKES R GETTING OLD..IM TIRED OF RECYCLED FILMS
0,That sounds so relaxing. Too cool. Just doing school work again   GOD IS....
1,USER sorry my humour doesn't read well
0,great weekend! birthday went out with a bang lol! back to college 2mro!
0,USER one more show for me then its all over
0,Losing at Texas Hold em
0,USER I thought Mikey Darling = teh secks.
1,"USER Ð±ÑÐ´Ð»Ð¾ Ð¼Ð¾Ð¶Ð½Ð¾ Ð½ÐµÐ¹ÑÑÐ°Ð»Ð¸Ð·Ð¾Ð²Ð°ÑÑ, ÑÐ°Ñ?Ñ?ÐºÐ°Ð·Ð°Ð² ÐµÐ¼Ñ Ð¿ÑÐ¾ Ð°Ð±Ð¸Ð¾Ð³ÐµÐ½Ð½ÑÐ¹ Ñ?Ð¸Ð½ÑÐµÐ· Ð Ð?Ð, ÐºÐ¾ÑÐ¾ÑÑÐ¹ Ð½ÐµÐ´Ð°Ð²Ð½Ð¾ Ð¿ÑÐ¸Ð´ÑÐ¼Ð°Ð»Ð¸ URL  Ð¯ Ð½Ðµ ÑÑÑÑ"
1,"URL  Ms. Brooks: ""What goes in hard and pink then comes out soft and sticky?""  Harry replied, ""Bubble gum."""
0,what happend to this great day its sunny now
0,URL - end of summer!!!
1,is playing Word Challenge
0,shit it. shit it ttm.
1,"USER Welcome back, glad the account got sorted"
1,USER heyyyyy!
1,USER oh. LMAO well...i usually don't call people that..buuut you did something kind so you deserved the title
1,Yankees are getting whuped .. Love seein that
1,"Opera 10 Beta 1 mit [Google] Gears, yeÃ¤Ã¤h"
1,USER Remind me not to use many of these - !!!! In my tweets to you  I do overuse exclamation marks though! xx
1,USER I know
1,"Okai suddenly im very nervous about seeing USER :/ lol im so excited , but hes a cool artist, im used 2 seeing mcfly :/ hahah"
0,USER  & you dont love meeeee???  *bernie voice* get yo' sht! get yo sht & gettttttt out! lol
0,"USER yeah, til you come home with 19 tins of artichoke hearts and a can of whiskas"
0,Eating lunch mmmm..... When life throws you lemons      Make lemonade!!!
1,done packing. dinner with the family. YAYY
1,USER Mm do consider getting a new tube. I one time had this tube that just wouldn't stop leaking.  But it was all over the place.
0,"USER want to give it a try,,, but expensive...."
1,URL - yay! look what WE did!
1,USER Memo to Mediacoach: u r funny
1,USER I'm all for free hugs!
0,"tmi tweet; i havent had a period for three months and was concerned, and i finally have it and just wish it would go away. so much pain!"
1,USER its all good up here!!
0,"USER PLEASE HIRE LAUREN LEE, this is a life and death situation for us"
1,Just chilling on the sofa watching the TV
1,"USER  To top it off, the hoover i'm hoovering with weighs about 8 bastard stone!!!!! so i've kicked that a few times too!!!!"
0,USER do you need to joon my session? Will turn  to ;-D
1,USER hahaaa thanks managed to work my way out of it and got an extension :p LOL dw ibreckon we could totally do 2010 MTV awards
0,USER next tues can't be done I'm afraid  any other time mans there!
0,"USER Hmm, not available in my country though  What's the title?"
0,"Damn. I had 11 goldfish.  Oh well, that's my dinner. Anyways! Check out my blog yoooo URL"
0,I'm sitting at home bored. Wanting to go out but no one to go with
0,Finally caught up on the USER issues going on with One Piece simulcast.  Real shame too because I was finally going to watch it...
1,USER I'll look out for you!  x
0,"feels that if I get out of bed, the room will start spinning  sigh~"
0,"USER the AP.net iPhone app is crashing, must not be 3.0 compatible  fix it!!!"
1,Still doin it up in the city of brotherly love. Show tomorrow night..
1,Love it when I get into my bed and there are hot wheels hidden in my pillow case and under the blanket! Little brother
1,"USER  haha, welcome to the twitter family"
0,Its okay. My lips are blistered.
0,I have had it with powdery mildew and aphids.  So much for fresh baghali polo; the dill needs to go
0,Joaquin MUST go to school maÃ±ana. It's his last day and he must do a presentation. I hear him hacking like a pack a day smoker right now.
1,USER Downloaded it
1,I just spent a day fixing UTF-8 ID3 tags on my Android phone... now to start on the work I'm supposed to be doing.
1,NYC here we come
0,ok homework time for realllssssss. ps  think i've developed allergies
1,I need 10 ppl to follow USER tell her USER sent you  plz and thank you
0,"gahhh, loads of homework"
1,Off to bed! Goodnight twitterbugs
1,Had the best afternoon with high-school buddies yesterday (Dim Sum! Yum!) and am looking forward to a lazy day today
1,Does anyone else enjoy Oh's cereal still?
1,"USER Hey, what's it like being an uncle? Do we get to see pictures soon? lol do you feel old now? Na kidding, your not old at all"
1,"USER all good ta, into last wek of hols so chillaxin."
1,USER take a load off  Relax for me too
1,USER hehe just added phil
1,DAY 5 I JUST HAD AN AWESOME VERY LOW CAL BREAKFAST! gonna get my glasses and hit up the movies today  don't worry no popcorn for me!
0,USER I feel so sad right now. Why did he have to say that?
1,USER you'll be fine  does that one have wifi access on the plane?
1,Watched Australia last night and got to say bloody fantastic film with the added bonus of Hugh Jackman  definitely a got to see movie.
1,USER ill just illegally download it
0,"last foto, last lunch, last day  looking forward to getting home decent coffee & The English Garden #homeSweethome"
1,pumped for church tonight...long time since i last went to an evening service +/ havent seen marilyn skinner since colour conf. lazy day
0,ITS APRIL! STOP SNOWING!!!
1,"USER wow, that pic is sooo cool!"
1,If you're not watching stay as you are - if they keep the humour up like they have done I'll let you know when it's worth watching!
1,"baliiiiiiiiii  omg i cant wait ,im so excited ,its gonna be greattttt"
0,stressed. i can't wait till later.
0,I love you Dwight!!!! Career high pnts is the way to do it! Sorry LeBron
0,USER i know  but at least now i can get my camera installation cd so i can do that stickam thing next time
0,"USER believe it or not it wouldn't be the first time somebody used one in my name...Back in '02 a ""friend"" stole my ID to get a loan!"
1,"USER silly me, thanks"
1,Isaac is married!  does this mean i can take my shoes off?
1,another sunny day
0,"Off-line until Monday. Trekking with Grizzly again, for the Great Bustard. Camera at the ready. Oh dear, it's live firing on the range.."
