0,No Windows 7 support for VMware View yet.  (VMwareInfo.com) URL
0,Feels a headache coming on. That means I'll have to turn down my music
1,"USER haha! yes! do it!  listen to me, condoning theivery"
1,"There you go, the suns out"
0,"Why is everyone's twitter pictures green? Being at camp keeps me out of the twitter loop,"
1,USER Fianlly found out  URL
1,USER I expect we could both rant away 4 hours on this subject. Let's say we agree & leave it at that  Bleedin waste of money!
0,Kobe's @ disneyland right now?! damn .. I'm sad now
0,Last full working day in 18a HQ!
1,"Homeward bound on this wet day! Half way there actually, just stopping for pizza at the Flying J in Napenee."
0,My blckberry is fked up
1,USER woot. I know who wins. Kate  I know a person who knows a person who knows her lol. OH YEAH. Place your bets.
0,finially demi's itunes live from london is up.. about time... she was before miley and miley's came out 1st
0,does not like corey having to stop cuddling me to go to work
0,3. The REAL New Moon Trailer = Awesomeness!!!!! I can't wait till it comes out. Too bad it's not till fall
1,This is so awesome.  URL
1,USER Too bad it is not available in time for Mother's Day  Wonder if the Kindle 2 price will drop?
0,USER I was gonna try and get tkts.  First time in over 20 years I'd have been home to watch it.  No point without Rafa
1,is sat with her sister emily watchin tele  x
0,"It's storming out lights are blinking, going to lose Internet!"
1,Listening to music !
1,USER congrats!!!  where you gonna work?
1,"i dont want to be home right now, i want to be with people, enjoying this beautiful life we have been given by God who is in love with us"
0,"In bed, relaxing...big day at school...last day tomorrow"
1,I just spent $3 on a lifetime supply of animal crackers. Oh happy day! Olive Garden now
0,Sitting on the subway makes me miss Paris
0,"re: this morning's poll... it's irrelevent now, I can't remember my nice dream anymore"
0,USER i know  but i refuse to give up hope.
1,a Monday without Blues
1,Blubb again
1,Sleep well tonight. Have a nice day!
0,"no money, now no car, no fun"
0,USER i didnt see you today and it was my first day back  (L)(L)
1,nearly 150 updates.
1,USER  thank you
1,USER The Veronicas are awesome
0,Finally found the name of the store I use to love to visit when I lived in Round Rock. I miss it there so much
1,USER not all all dude - thanks for the info
0,"USER I just drank some espresso, but I'm still sleepy.  Can we swap metabolisms?"
1,USER np  wouldn't it be cool if they had an installment scheme?! #istyle
1,USER Thanks Sue!  Enjoy the holiday weekend.
1,USER I did  made my weekend..
1,"USER you aren't a wannabe, you are you"
0,"USER I shall return it this Thursday. Sadly, I found no music :: sad face ::"
0,Hot hot hotttttttttt~~~ And Im not talking abt babes.. How sad
0,again at work....its booooooooorriiiiiiiiiiiiiiiing  any one who knows how can i spend my time?
0,USER we didn't have our usual weekend run-in this weekend
0,My head feels like its being squished by a vice
1,alright USER. let's do this
1,"URL - oh & she says she doesnt like the pic, just the editing. but psh, the pic is gorgg."
1,yeso. because smosh u freakin rule!!!!!!!!!!!!!!!!!!!!!!!!!!!!!!!!
1,USER  Well Leigh was USER but maybe she gave up.  Boo to that.  Welcome to the twitterverse!!  Have fun!
0,USER got my brother admitted into the hospital so he canbget better. Involved a lot of phone calls
0,The power was out for 15 hours
1,USER Get 100 followers a day using www.tweeteradder.com Once you add everyone you are on the train or pay vip
0,Can i just say that my soon to be ex boyfriend's small penis made me celibate and bored me as well
1,USER I hope u will feel better after a good nap.
1,USER Awesome. Thanks! Feedback is always good
1,USER awww now you're gonna make me blush!
1,USER unfortunately we don't but someday I hope we will need more help.
1,USER The episode of Hannah Montana with the Jonas Brothers is showing right now in the Philippines. Can't help but laugh. Hahahah.
1,USER dang. Was hopin for an inside track.  I've got 1 scoped out. Hope to get it soon. URL
0,I want a regular day
1,"USER Oh man! More time in Mexico? So terrible!    Just kidding, hope everything works out okay."
1,USER There's always gonna be someone out there looking for a ticket.  Have you tried posting about it on ETS?
1,"aced my geography project, aced the citizenship test, and probably passed the political beliefs project. im really stoked."
1,Good morning
0,USER waaaahhh  oh and good thing we didn't do anything last night. I died. :/
1,hoping her mom has a great day today
0,I MUST run tomorrow. Moving overseas has really messed up my workouts
1,"6am never looks good... But not gonna lie, Tikis with Christine and surprisingly a few rampers was a blast!"
1,USER Good night
0,first saturday in a while that I have been awake for. Now I don't know what to do with myself. I am bored
1,USER your welcome kate
0,USER me either its happy... yet sad
0,"USER yeah i heard earlier he cancelled - ""Bigmouth Strikes Again""?"
1,USER podcast
1,check out  URL Updated...
1,Is eagerly waiting for the Twilight New Moon..  #twilight
1,watching wizards of waverly place.
1,"USER Amen to that. Hello, Mimi!"
1,"it was raininq last niqht .  Now its okay . Anywho, have a qood day, loves !"
1,Went to Michaels for art suppiles!
1,Good morning tweeps!
0,"USER Please don't feel that way about yourself  I love you, even though I haven't seen you in so long! <3"
0,not feeling work today   ....do i ever?
0,i really wish this migrane would go away
1,watching the Magic with USER and hopefully celebrating their return to the NBA Finals in a few hours.    Vamos Magic!!!!!
1,USER Get 100 followers a day using www.tweeteradder.com Once you add everyone you are on the train or pay vip
0,At the hospital in LaCrosse visiting Mr. Hansen. He has a very bad case of pnemonia. Fffffffuuuuuuuu-
0,"Ok, been waiting for three hours now - maybe not meant to be"
0,Good Morning Twitter People! I really miss USER
1,"USER hahaha i really can't wait  i'll need a laugh after revision all day :/ wicked  you're gonna cry i think, it's so sad xx"
1,USER ooh nono it's really big! they call it a hydropool
1,USER Missed you too mama
0,drowning in florida right now
0,"Note to people going to Hamilton pool, don't, It's too packed. And if you then decide to go to Barton creek, don't, there's no water"
0,"I have rehearsals 10-4 today, and thenagain tomoro, and the next day, and the next, and then one more and I am finished with that school!"
0,is sick and tired of bein sick and tired
0,Vacation over but not cold
1,"USER In The Beano with an ermine cape, rippling muscles and a Simon Cowell-style fluoro smile, I think."
1,"sometimes, one beer isn't enough!"
0,My msn's retarded
1,USER Taylor Lautner & Shia LaBeouf.
1,"Yesterday, we received 1.plass on the gallop competition!  A barrel that stood Helgeland travlag, 1.plass on! : D Best pony! Team Darkness"
0,ugh. work on my night off. boo
1,thank god my eastern massage teacher is giving me an extension to turn in my project...WOO-HOO! now time for our tea party
1,USER yep. well actually nope!  hi
1,"USER tell the new believer ""hi"" from a fellow believer.   welcome to the family."
1,"USER Mm Yes, same here. Bat them with something"
1,gettin tha day started early!!
1,"USER It is, Ane. I'm sure Chakai and Lucas would love it."
0,USER lol what r u doin now? Bored  ?
1,"Good parts of ""Sex Drive"" - James Marsden. Seth Green. Fall Out Boy cameo. The end."
0,USER but we still aren't up there  I don't understand #dannygokeyislove
1,USER hahahaha.yeah.he still didnt fully guess it.but thats good.we wnt it to be a suprise.
1,USER That's no problem for me  But I just want the sharpest lens ! The rest of my kit will be primes anyway.
0,"USER he was only there for like 7 minutes!  but it was worth it, I got like 5 pics!!!"
1,USER We just launch our website and we are offering $15.00 Site fee credit! Join now! URL Join us
1,im joining twitter  lol
1,Congratulations USER and USER and USER & all other graduates
1,USER - question 100 has to be my favorite.
0,I think i'm getting sick
1,USER thanks. That's what happens when you rush- painful lesson learned
1,USER yes i will  i work till around 4 =]
1,USER hey Danny how was the gig last night? How's going with the new album?  plz answer me  xx #mcflytoisrael
0,So they're calling for some nice rain on Thursday   I hope they're wrong and it changes so I don't have to stand outside in it.
1,off to work I go!  have a fabulous afternoon tweeeples
0,my phone iz dead! i didnt have time to get my contacs n shyt! i wuz goin to da club tonite  fuk mayn daz y always keep yo charger wit u!!!
1,dismantled a couple of the photoboards from my 21st and creating a photo wall instead
0,oh my god the last crusade is such an awesome movie.
1,tomorrow may not be the same....... ooooooooooh yeahh........ Each one teach one
0,USER Krissy tell twitter to be nice it's not listening to me
0,Losting all my hopes for my story and for their story.. Our destiny is the same of them.. I don't know what to think now..
0,USER I knowww
1,_USER ok very true. Should have been starting to stop pimping
1,USER sweat my ass off i did
1,Also this is a question for my ladies. what is the ultimate sign that you are in love and that that person loves you too? Good night
0,Looking forward to Wimbledon but no Nadal this year !!
1,Watching MTV Movie Awards. Brilliant.
0,Has A Headache
0,"I hate leaving, I miss my friends way too much"
1,USER hehe cool
0,USER I'm sorry about your Aunt
0,USER it said that it couldnt find you
1,They're fuc*in amazing! love this band...and my sweetie does too  â« URL
0,"USER Ya, the weather has been super weird here. It looked like it was gonna rain today but of course it didn't, darnitt,"
0,"USER miley, i need and advice... what do u do when youre tired of everything around u? have u ever felt like that?"
0,.USER Too late now.    I just wish I had been on the mailing list for the Coraline treasures.
0,"Day #3! Tasha goes home today  walk around Leaside, Duffs for lunch. Just saw/talked to my kindergarten teacher"
1,"USER Cool!  I was looking forward to seeing Aero & ZZ Top, but it's too far & expensive. :< I also heard something about Poison"
0,is hoping some hot apple cider will help her to feel better... this coughing fit is hell
1,USER yep that's it  any word from milky way?? xx
0,is hella fucking bored i didnt do shit today
1,"USER lol, I don't think you are the person I was talking about  Gimmie a call, my phone was off."
0,i'm craving for burgers AGAIN.. pls suggest one place..
1,"USER  I hope they are marvelous, tho!"
0,Wow I'm ready to go home. The boys have been in their crates since 2.
0,"USER tweetie looks cool, only thing stopping me is lack of columns   their iphone app is awsome though"
0,almost to MV..wonder what Bailey doin??  ..anywho IM OUT HERE! haha
0,still a bit shaky from the confrontation with somebody else being hit by a car WITH ambulance and police cars..
0,USER yup it's raining here
1,"Used to play my old flute with/to the horses when nobody was around! LOL, Forgot about that.Was a big goof named PenDragon.   He <3 music?"
1,"USER truce, it shall be then"
0,USER Ooh I love a nice rug to pee on. Don't do that anymore though  Humans get so cross.
1,USER ty!
0,"virgin blue really dropped the ball today. Flight delayed 3 times, 3 different gates. And my boarding pass and seat had to be changed."
1,USER yeah. But then Sam Neil wants to cut your face off.
0,ok so this is odd... I saw my first UFO about 35 mins ago over denver colorado I got a picture but its just a dot
1,"USER: sure dear, after i finish this FO ep i'm watching.  i'll be sure to leave a comment too."
0,become a fan of playfish and can not get rid of it
1,USER sure. what's your email?
1,USER welcome thanks for the follow
0,omg.. my sunburn still hurts
0,Good night. I miss you.  URL
0,"USER No way! Eggplant is awesome! Unless, apparently, you are you. Or my intestines."
1,listen my song from my i-pod
0,AAAHHHHH I AM SOOO ANGRY! i feel like crying..... why don't people listen to me EVER?!?!? even when I ask for the TINIEST things!!!!
0,not feeling well. might sleep. please dear god don't let anyone disturb me
1,USER but mostly all winter and basic stuff! thats it
0,: it's too hot and car shopping sucks
1,USER please follow me  I'm following you :]
0,MNF - Monday Night Football!!!  Oh wait...its June
1,Glad to see waffles are trending...as that's what I'm about to make.  Happiness.
1,"USER Drove the other car yesterday and my foot didn't do well when braking lol,think it'll be better tomorrow. Boy racer me, no"
1,USER no calls for me yet
0,I have to have a new e-mail address    At&t is making me... bullies!
0,USER Cant wait for you guys to come on.  Too sick to leave house   Sucky!  Cant wait.  YAY Triple J live webcasts!!
0,"Just brought Stewart, my beloved Yorkie home from cremetory. 2nd one this week. At least he + Bridget r home now.  RIP sweet furbabies"
0,USER The area looks amazing! Shame I havn't got tickets
1,USER Well I dont want it to be joke
1,USER Aww ash!!! Anytime dear! You are pretty awesome yourself!
0,USER Thought we were going to hear 'Ego'?
1,USER aww...wishing you a speedy & healthy recovery
1,Feels bad for passing out... Thanks Tia
0,USER lol. yea.. well.. winter here SUCKS. hate the snow
0,season finale of Keeping up with the Kardashians tonight in the UK   USER when's the next series?
1,"Went out on my deck, looked up and saw a shooting star.  Can't say what I wished for or it won't come true. Nothing bad, of course."
0,USER Thats too bad
1,USER im good  i really like the picture you have of miley as your default. i respect her as well <3
0,hopes i doesn't get swine flu!!!! Like 10 people in my year have it
0,Why he gotta look like that?
1,"USER hi. Are you available to translate some stuff into Japanese? (Kind of, today?"
1,Waiting for my pills to kick in so my nipples stop hurting and i can go to sleep
1,USER Sounds like a plan- My curiousity just has to see this! Ridiculous. I'll punch around 2!
1,URL  There is something which I really like about Alaskan - It looks different  #Chicago #Airport #Alaskan
1,Off to petclub to buy the kitties food. Hopefully the have some new reptiles to look at and maybe bring one home
0,USER I can't freaking wait Matt!
1,"""arsenal and tottenham sound like name brands of premium bacon or sausage ."" USER comments are the dumbest at times.."
0,USER Ha...I miss mobile web!!!
0,my blackberry keeps restarting by itself.. what happened to you???!!!
0,i'm still awake after taking 3 sleeping pills. this sucks.   i feel like i'm slowly deteriorating.
0,Morning all. very wet here
1,USER On tweeting yer eating - I find that amusing too. Do whatcha do best - Be yourself. I'm new here too & trying that.
1,USER Thanks for the kind words re: my dad. They were very much appreciated.
0,Aww maa boo not feelin 2 well
1,USER Course we aren't as crass - we don't claim to be the only country with press freedom either
1,USER jk yo. don't really.. she'll think i'm stalking her or something.. evn though she told us a million times.. congratulations
0,"USER me either, I feel like when I'm on my own, I'll have days when i'll cry out of the no where, reminiscing about the past."
1,yay 100 followers and the 100th isn't even a dmb fan but she's much much more special  crazy right?
0,Looks like 02UK is down!
1,USER But u have ur dulhan na...... Crisis...... You want another one to add to that  ;)
1,"very true my friend, i'm not really feeling a mullet though, not this time anyway ;) next time ey?"
1,Having a good day is all a state of mind they tell me.  Alternatively I could go to the park
1,is tired and in bed nice and toasty thanks to my new heater
1,"; Waking up in Vegas, After Bali and Vanuatu. Then plastic surgery with Katherine and Jared. Then Barcelona with Jesse."
0,I was actually happy to see that leaders of both national were discussing one-one re eliminating terrorism. This editorial is a bummer
0,Leaving DesertFest already
1,USER Have fun in Vegas!!!
1,Finished work and the weather is gorgus x Get the sun tan cream out
1,"Time to go to work. Again, please, no spoilers on #TrueBlood.  Thanks!"
1,"USER URL - I do not deserve surely, but this will let me resist from purchasable Operation Flashpoint 2"
1,USER lol. Manager apaa.. Hahaha thanks anyway
1,Editing more shots from the paul brown shoot!  myspace.com/evilcreations
1,USER As far as procrastination when it comes to writing: let me know when you find a cure  I procrastinate until the very last minute
1,USER I have no idea what the plans are yet but i'll text Dave when I find out.
0,Im struggling to buy my textbook...
1,USER You posted my mantra for the day   I won't give up!
0,USER I am lost. Please help me find a good home.
0,my new pipe looks like anal beads.
1,I'm starting to feel really blessed i chose to be a Communication Studies major.
0,is in dire need of some Cinnamon Bun Ice Cream! Is it you or what you do that has a hold of me?
0,USER Maybe I should wait for more challenging until after I can pass any of the Fieldrunners maps...on Easy...
0,"is that the sun out? nooo, go away. I liked the june gloom weather"
1,"USER wow. omg yous were amazing on BGT, totally deserved to win!"
1,Is nearly at the bus station in Eindhoven
0,says back from Lowe's run. Now to unload all that wood  URL
1,Thank you sooo much!
1,"ima rocking up to school with a wooden stake, metal colinder and garlic  thanks eriel babe."
1,yayy people are following me  hahaha. THANKS JENNA AND TOSH!
0,"USER: that sucks  good seeing ya last night tho for once, jashik. You have fun? I got sooo shwasted-faced"
0,boo for still being at work
0,"today i'm learning about twitter... so far i'm lost, confused and getting a headache"
0,"USER Just drank a little too much with that last sip, just like waterboarding, and like the real thing: no good info afterwards"
1,loving Mafia Wars on facebook..
1,USER I can't take credit for that name.  I'm watching Pushing Daisies
1,USER Good morning to you Eric!!
1,Sitting by the lake listening to JB-life really doesn't get better
0,Really hating how bored i am. Its summer for gods sake!
0,"passed the first section of the P&C insurance test, but barely failed the other.   I'll try again next week."
0,is having a stomachache... damn pineapples! grrrrrr  URL
1,"USER heh, I think so; been in all the relevant arsmeet threads, and 1 or 2 other post-a-pic type ones.  Are your eyeballs seared?!"
1,URL - Cute shirt from USER
0,email overload
0,USER what happened??????
1,Me and shawn talked alot tonight  goodnight!
0,"why I love so much, why your make me smile all the time? why your so special but i cant have u  ? I got scared to try."
0,"USER Not been yet, was hoping to go today but got lots of paperwork to do!"
1,"USER lol...great review but it's actually Alexis who bit through her lip, not Leah...and it's Stephanie Tanner who says ""how rude"""
0,"USER: haha trust me, meee toooo. i overreacted but my mom has this greek pedastal thing & i was on her bed and slammed my toe"
1,"Eating Corn Pops, waiting for the doggers to come back inside. Going back to bed surrounded by puppy love"
1,Celebrities must link to their Twitter accounts to verify them? URL  #seo
0,Soliciting blows. In Nordstrom looking at flower girl dresses.
1,Going to Narnia to get lost! Yippie
1,Go Lakers Go Lakers Go ! Sorry. I'm Jus So Proud Of Them
1,"let's see if i can go all weekend without turning on my computer. time to step up, kuro! byakuya signing off!"
0,"Bit of a setback, now on antibiotics"
1,"USER yeah, we do! I'm just now back to work & not 100%. but i will be on-air, right?  sinus infection/stomach virus=tough week"
0,USER wish y'all would've came last nite
0,USER I'm getting sick too   I need to change my sheets
1,"USER Oooh! Big feet means big...shoes.  Btw, got your FB msg. He IS pretty hot...AND his BF is black. ;)"
1,I'm still excited for every new follower - the world seems to me growing endlessly
1,USER USER Goodnight
0,USER no  he's very clean I wanted to be able to say yes he's very dirty ;)
0,family and friends dinner at Eric's Hot Restauran. GOSH.. food there's so yummylicious! Prepare to gain 1 kg
1,USER did you get your pics out of the tootsie's office yet? don't forget!!!
1,How lovely is the weather  waiting for supernatural to come on... anyone else major hooked ?
0,"USER No, you're right. I'm whining. I'm overly attached to one of them and It was just particularly bad timing."
1,in ICT. Next to gay tayyibahhhhhhhh!   DREWWWWWWWW  JESSUUUUUUUUUUUUUUUUUUUUUUUUUUUUU
1,USER yuuuup! 9 miles  it's for cancer! for a good deed!
1,got accepted into military police and was made platoon i/c today  - URL
0,USER Nooooooo! Thats so upsetting. I'd love to meet her.
1,GOOD NIGHT everyone!! Remember to watch #BONES tomorrow so we help with the ratings...a lot of people watching means lots of ratings
1,USER because of your start naka ... I cant did it alone ... Many many thx again ka
1,mmmmm... the boy in the first daughter is hottttt
1,A Snob's Guide to the Internet Class System URL (via USER) I'm not saying a word
1,band practice soon
0,prop 8 sucks.. and so do homophobes
1,I just love Jesse McCartney.
0,No plans that weekend   USER
1,listeninq to Birthday Sex
0,USER I didnt even know you were there.   I'm sorry
0,Man im so tired its just not funny  i need/want to sleep but my eyes dont want to close
1,"USER So, I guess that all depends on how late you slept in. Congratulations."
1,Going out Sailing today. Who would have thought that it would sunshine today
1,URL And THAT marvellous product sounds like music to my ears - literally . I've got it on good authority that it works
1,USER what cords/strings do you mean? you have a picture of it? maybe i can tell you what they're for...
1,USER hey doll! are we getting another season of DG..ps. i freakin love your style
0,USER yes OF COURSE!!! Once it is released.. do your thang! and theres PLENTY of footage of Cha Cha.. No footage of Jack
1,Wow Simply me!
1,ok have to go and eat now
1,Still blushing about what happened at the awards ) he just texted me &asked if he can take me to the top of the world
1,USER  shake it aha  xoxo lovely lexy
0,"USER uggg no not at home, it's being so dumb"
1,"USER what's the definition of that. Its public service when it serves the greater good, but when is it 'civic'? Non-military?"
1,"back in the garage working, garbage day tomorrow, woohoo, take it all away"
0,My life bout to change tomorrow y'all
0,USER You have heat??? we dont even have the sun right now
0,USER awww....that just makes me feel bad.
0,Frank gave me some more ice but half fell on Jane.
0,USER revising  exam 2mz!
0,is very very sleepy  URL
1,"It was the boring things in life that I remembered the most.-Russel, UP--cute and funny movie"
1,USER 7174519212  WHAT SHOWS ARE YOU DOING THIS WEEK I WANT TO SEE YOU caps was needed
0,I just burnt my tongue on pizza and now I have a massive roof-of-mouth blister
0,Finance management pre-reading include 200 pages
0,is studying for a human geo test
0,My toes are icicles...
0,woke up early to sew. forgot that everyone everywhere is staying in our apartment. my whole sewing area is covered in dudes sleeping.
0,Miss tay' ...
1,No no you did'nt get me  I saw Leo do it yesterday re: URL
0,listening to music. i have a bad cough.
1,just bought638783 things at pac sun
1,So excited to see boo meyer tomorrow!!
0,and my Cameron
1,just had an awesome supper....Chicken shishkebab with a homemade greek salad...DELiCIOUS
1,"finger in the employment ministry, interview in radvision, shrinking shirt, work for scepia (no charge), looking for job, a nap, pilates"
0,USER aww I want coffee!!!! dmn it
1,"USER hey, how often do you have these cyber parties and what exactly do you do?  Dance around with hubby and twitter?  New to this"
0,expressio study-o est exclusion funnio
1,Only one month left for the yearly 4-day fishing trip to northen Sweden. Pikes beware!
1,Got home from running goose pond not too long ago.  Just waiting to hop into the shower before lunchy.  Then hitting the park with Celia
0,Just woke up! what to do.... Study? oh god no.... I hate that I have exams in a week
1,aaah TGIF  not too shabby.
1,USER me too girl...me too!
0,USER I don't think I can come  I suck...I know. Weather is supposed to be crappy also. Don't hate me!
1,USER Hey! You should be in the Lost thread on BGP. Pawz and I have been burning it up in there all day.
0,0ffline. i need to learn for chemestry
0,Lunch with the tersiguels and stacy was amazing!  Now at mica till midnite forgot my computer
0,Up giving Parker a popsicle to help his fever  doctor in the AM!
1,made one hell of a dinner for me and my husband.
1,Studying for finals with jackieee
0,USER  I try pretty hard to engage everyone I follow! Some of them lack interesting shit to say so they end up unfollowed
0,USER Tomorrow begins my examination of maturity ... I'm fear .. do not sleep tonight
0,battery low. need to switch the PC  #dwgmf
0,"USER It's not a very good time to buy at the moment anyway. We bought our place for Â£200,000 it's so not worth that now."
1,watching USER special
0,"USER yeah the main web UI is built to be slick and pretty, they don't seem to go for functional use"
0,"I'm afraid that when I put up my blog, I will get loads of abuse from racists"
1,At sundae school with nick allan and sarah for her birthday. Mmm  Even though i am not eating ice cream.
1,USER I LOVE YOU
0,going to lay down. Fuck tonight
0,"Dear Makiri, you're not going to be double-bagelled, are you? You're still pretty but ugh that is not good.  #Wimbledon"
1,URL Please keep on voting for USER and USER and make sure they stay at the top 20!
1,Goodnight & Sweet Dreams!! XOXO
1,got me a date with a nifty guy. my moxie finally pays off!!
