0,Traffic lights at Windsor Bridge are only letting through 3 vehicles at a time - causing tailbacks on Upper Bristol Rd & late buses
1,USER thanks  i try my best to take good photos
1,USER neither can I. I love your photos
0,"so to old to be out till 6am, still recovering  ....."
1,USER It's mer-great to be gay anywhere! Purrr...
1,Sheesh!!  Loving last minute MMday Weekend bookings!  Each one will be pleased!  YAY!
1,USER Nice
0,Stanford CS dept. email confirms passing of Stanford CS Professor Rajeev Motwani. Very very sad to hear that.
0,"USER yeah I know IM+, but yet only push email  ... boring ...  seams no app working yet"
0,I don't feel good  it's been on and off all day. i blame kassie! i cannot be sick. i have a lot to do tomorrow & have a chorus concert.
0,USER I'm already there. I wish you were here.
1,trying to get rid of my hangover
1,So eats and then study. Sorted  x
0,all ready to go...my car alarm is going crazy...my key won't work... so far a bad day for me
0,Wouldnt be good to publisise
0,USER oh if ONLY
0,"USER I know  even though I don't know who you're talking about, hahaha. text me, I have to discuss the sleepover.<33"
0,sick  Cant do anything today!
1,Herceptin day today *boring!* 12 out of 18 though
1,USER I really like Head First  Just thought I'd let you know...I really don't listen to the rumors...I could care less lol
0,USER Not much on TV tonight   All repeats. I hear that Nurse Jackie show is real good.  Weeds is on too.  Love that show!
1,HAPPY MOTHERS DAY TO ALL
0,RIP My 360
0,Vacation is over. Getting ready to leave.
1,USER Post some pictures of SF  Good luck with house hunting!
1,On my way to school... Just heard the Y-100 Phone Tap lololol  I love Elvis Duran & The Morning Zoo
0,I've been out all day. Went to see the place where Pride and Prejudice filmed - beautiful! Got really bad stomach ache now though
1,"yay, food time  then finale of gossip girl :'( i will miss blair and chuck (L)"
0,USER Loved the Drowned World tour - unfortunately couldn't afford to go when it was here at the MGM.
1,Goodnight America .. Good Morning Europe
0,scared for cammi because she will be lonely without another dog and that wont be good for her health
0,"I saw the ""girl of my dreams"" n my dream tonight. She was perfect! Everything i ever wantd. & she was so familiar. Now i cant rememba ha"
0,going to sleep...ate way too much today like a fat. school tomorrow  blahh! good weekend tho :]
1,USER Thanks for spreading the word about my video shoot!
1,"USER I just wanted to say I think you're an awesome character - well, based on TV at least  have a nice day!"
1,USER and a good excuse to buy a box
1,USER lmao how was your weekend?
1,cant wait till tonight for the MTV awards!!
1,USER I enjoyed the run (and was quite happy with the pace)
1,USER lol it was good too  I went in!
1,"USER, hello there my darlin!!! how is LA treatin you???"
0,USER aww  not gud! this cold sore has taken over lip- so luks like sum1s punched me
1,Finally home  Awesome day  I <3 USER USER USER USER
1,URL Business Rap About My Progress ) Sorry i love music tho
0,my bff is changing of school
1,has a date with linda on thursday.
1,"USER none the less, thank you."
1,"USER teehee, okayy i will!"
1,"USER You rip it out of me for being a young 'un.  And if Google bashing is passe, then Googler baiting bust still be OK?"
0,"apparently this hotel is too ""classy"" to have ice machines or vending machines.  but there is $11 water in the room.  Not joking"
1,"USER too early ,,, I'll spill my corn flakes"
0,The chicken in my chicken jalfreezi is dry
0,Fwd: USER i made it thru but u were u gone  so sad!!
1,USER I have so many similar pictures now.
1,dinner ordered  going dark to pay attention to mrs wolfcat
1,USER I just rescued a 9 month old lab and have to take him out on a lead... can you change the weather to cooler this week???
1,USER URL - awwwwwww so happy she is ok
0,could really do with some Lentil as Anything goodness right now...oh why don't they have one in Sydney?!
1,"USER I haven't been down in 18 months; there's more art, more colour, more living history. And little fish!"
0,"ok - that sucked, getting up from mini(man) floor and I totally rolled over on my bad knee"
0,USER oh I'm so jealous!  I guess I'll have to go there! If only I had money haha.
1,"USER Hey!!! I'm fine, thanks, it's nice to see you too"
1,making a victoria sponge. i feel a thunderstorm a-coming
0,"USER I watch in youtube, or online  is airing in japan, tv tokyo i think, all mondays"
0,Can't make the #irce tweetup  But where are people going to be later? Looking to enjoy some Sam Adams with ecomm tweeps!
0,USER it seemed like it sorry
0,Should go to sleep earlier
0,Kho lam moi co 1 doi ma catch the eyes  Wonderring wonderring wonderring
1,USER  You shouldn't have used that word RESOLUTION. They always fail.  So you will be at stanchart? How many Kms?
0,USER look who's talking :/  :sadbluefaceguy:
0,USER Not much Tony tonight on NCIS
0,Had a blast at school today with the rest of the SSCs. So lethargic now
1,"it's sad I am professional but someday i'd really like to share some of the ""corporate"" bullshit I have to read everyday"
1,"USER thanks, thought I would weave a pictoral narrative"
0,Back from tim's with Stacey! I don't think they had pickles
1,USER Thaaanks Paulaa! I loooove yaa girl
0,"USER ohhh don't think about terrorism! i dont think it could be that, cuz if it was the world would now REAL FAST!  idk.."
1,USER him matty jared and baggles...omigoddd. Ps. my mom says we can prob do sleepovers next yearr!  I <3 college...I <3 drinkin...
1,haven't twitted for a long time
1,"USER   At least I'm wearing them, right?"
1,curry cooking - tikka masala marinading
1,good morning all  if it's nice out today i'm gonna try to get out to the pool.
1,Excited about going to the tattoo shop tonight
0,USER I remember when we used to be friends!
0,USER i hate that too!  sorry david.
0,wish I had my own multi room house so I could help out all my friends who are with out a place to sleep...its like the list keeps growing
0,watching the indy race and wishing I was there
0,"I woke up with a stomach ache, but HAD to go to lab.  Now it's time to nap!"
1,hangin in the land of ho tomorrow!! Be back in the afternoon sometime!!
1,"is reading Artemis Fowl, there actually quite an excellent read  Thanks Cooper xD"
0,USER Nope!
1,I actually made it to toastmasters w/out any issues this time! So glad I went - soon it'll be me up in front of an audience... scary
1,looks like a beautiful day! might do some shopping...might buy myself a mixer..hmmm  (via USER) Yes!
0,am i THAT disgusting??? stupid husband wont even make love to me!!!
1,USER I just learned sumthin! Cool! Massively multiplayer online role-playing game = MMORPG!
0,cant sleep .. but want toooo.   rawr.
1,USER are you going to watch yourself on hannah montana?  its on in 2 minutes!
1,USER ;Planning on going after school sometime!  I hate spiders too! I usuallty get Elaine or my dad too kill them! Lol!!
1,Enjoying a late lunch - back to the madness of reality! Got to love it
0,USER oh no I cant make that unfortunately  we're SO busy preparing 4 the launch of ZooLoo that lunch time stuff is out 4 now.
1,I has gone wireless!!
1,USER I'm bleSSed & highly favored  working hard as usual.....waSSup with U!?
0,USER I think they are too ashamed to bring it up. Have you heard Julian is actually professional? URL Fake show
1,USER I do respect the way you think   #p2 #tcot
1,USER I wanna come!!
1,Problems solved. Playing Spore. Generally happy.
1,USER: sounds like bull sh*t to me... Maybe don't go there anymore until they're REALLY there 4 him.    brandi
1,USER i promise
0,washing my own hair.... this might take a few hours ugh damn alex for not being at work today
1,USER that photo of your feet holding up those blue heels is beautiful!! i assume aiden took it? if so tell him i dig it
0,"USER YEEEEAHA! first follower lol, u guys found a drummer yet? i still dont even know what happened to scott"
1,URL I love the Tocatta and Fugue in D.  URL
0,can't beleive how cold and rainy it is
0,"USER Yeah, one of my friends used to live off of Fountain on Curson and said that happened a lot over there.  Sucks!  I'm sorry."
0,"Tomorrow I have to go back to home..  But I like it so much over here!! I wanna live here the whole week, and in the weekend in R'dam. ;D"
0,USER I know.  I cnt imagine wht any scarring wld look lk after removal. But I think having tattoos on the face is not gd anyway!
0,Sooo thought Tucson was pronounced tuksun. I got laughed at
1,USER can I borrow your life?  hehehe
0,Aww i'm dead emotional after watching that leavers dvd  i dont want to leave
0,USER  what it do!... it still kinda hurtss
0,USER but I don't have NBAtv.....
1,Episode 5: Murder on the Harper's Island Express. Yep. They all did it!!  my money's still on Abby's dad for the Big Bad. We'll see...
0,"its a day for painting,  as no sunshine here yet"
0,"USER WHAT :| Aww that sucks  Get well soon, ha!"
0,Back in court.  BlaH
1,URL - Coffe shake  thats tomtom's new invention.
1,"USER Arrrr! I love this part of that post: 'Blimey. Hell just froze over, pigs flew, and the pope did his business in the woods.'"
1,"URL - Me and Sam Jones' day in Boston for the Great Urban Race! 70s roller disco girls, team Giggle Sisters"
0,no drama today. but thats OK coz. i super happy
0,Aaaaand nothing
0,"USER What's wrong, love?  â¥"
0,Craving for new blackberry device. The 8520 Gemini is not so attractive though
0,"'s office is minus Priggdog and Kdog, and is boring and banterless"
1,"USER sorry to hear your sick!  I had a bad cold last week, dayquil worked wonders for me!  Get better"
1,More Star Wars humor: URL
1,USER i just take a bath... i feel better  then... i  big day is infront of me
1,"USER awesome! I actually ahve to work while i'm in town, so I'll see what I can do. I'll check in."
1,Finally going to bed  goodnight everyone...
1,Onboard a ship in the middle of the Atlantic.  Tomorrow's port of call:  Nassau.  Don't hate the player...hate the game.
1,USER  whatcha still doing up?
1,"USER Awww.  I feel so special.  But that's okay, you can keep Joe. Keith has no equal!"
1,I LOVE SHANCY!
1,hauling out the trailer for grad party #1 tonight..everything's movin along so far and dad doing great
1,USER Good to know! Taking the wee one to see it first showing tomorrow.
0,Aye! I Need a job.. but where... dun dun dahh. i get so nervous going to places and asking for a job  i tend to embarass myself. lol
1,grilled cheese with tomato and celery with peanut butter
1,crash time
1,"From lifehacker: ""The popular Linux distribution Fedora (you know, the one that isn't Ubuntu) has just released a new major version"""
1,USER  I really want to come to Montreal this year! I am hoping too!!! How was it last year?! Let me know if they can send hats!
1,USER july 18
1,"USER Norway is on my list of future biz trips but by then, you'll prolly be in the US and I can see you like CRAZY!"
0,USER  please don't
1,the g in g-string stands for groin
1,"USER Hi  How are you? Have fun at your gigs , excuse me for my bad english i'm from germany! Okay, Have a nice day."
1,Marcus Antonius is portrayed as a total ass in Rome. And Octavian is moody. Cicero is just touching.  Lucius  Vorenus's wife is pretty.
1,USER haha loveeeee  That'll be a mad show.
1,USER at least theres sister bonding
0,I woke up in extreme pain.
1,I'm relaxing in my room  Text me.
1,Hello world ! Going to Maubeuge and Paris today... weather looks good
1,"USER ...will be out up and i will have much more free time and ill update the site more often,i promise  im off now.bye xo"
1,GOOD MORNING EVERYONE!!
1,Katy Perry on Saturday!!!  x
1,USER good cuz imma need u to meet me in new haven at about.. 3:30 4 u kno what  if u can that is
0,sarah doesnt like my tweets of the day  sorry
0,Last exam - Last exam tomorrow! (finally :/) Biology  I hate it Greatâ¦ URL
0,"~USER That's approx. 11am on Saturday. Probably won't be able to do that, sorry."
1,Picknick time  Nice to relax after my run
1,USER take me to berlin  please?
1,hmm... missing my frnds!! the r da gr8st in the world  (OMG wish twitter had emoticons.. wud b gr8)
1,Boys over flowers is nice !
0,Gah really sick. I thinkim getting the flu
1,At Alexis' house. Going to eat downtown. Then drive inns with some cuties.
1,USER yup the mammary glands they animate are known to have a life of their own  not that I mind :O
1,yahhh  the sun is shining and i am happy
0,Take me back to New York  I miss it there.
1,so twitterhood how was YOUR day???  Mine is great  brushin the haters off   its a nasty job but someone has to do it
0,Sick dog day morning  URL
1,"USER ......a girl scout.....um, can't remember the rest.  It's Heathers though"
1,USER hello thanks for following  Hope you are having a great day.
1,"USER ?? ??, ?? ???????... ??????? ?? ???????. ??????? ?? ???????????."
0,"Laptop hijacked by daughter, I'm experiencing tweet withdrawl symptoms"
0,"Having roast gammon for dinner this evening. Only one problem, I forgot the pineapple."
1,USER I knew I liked you. A gal after my own heart.  I have to beg my wife to see movies like that.
1,sucha bum. love it.
1,USER USER USER USER USER USER Thank you for the FFs my friends!
1,USER You found a dress????
1,USER thanks for pointing out the slip. That's what 16.3% alc will do to you--makes your brain and fingers disconnect.
1,And follow me boys  USER USER USER USER USER USER USER
0,Prom photos are the absolute worst
1,"good lord how could i be banned already? i haven't done anything yet!  btw, great stream   (TomBobBlender live > URL"
1,"USER im on facebook, aim, iTunes, & twitter!  multi-tasking."
1,"ooh... I love that one, thanks USER. I just gulped it down  â« URL"
1,"USER Ooh, Ooh, I know....it's a chicken!!!!! Yay me!!!!"
0,a good morning just turned into a bad day .. RIP Gio
0,I would like to do something with my friends for my birthday
0,USER you're in Zurich on Monday! And I'm not able to come!!! I'm so sad  but the way to Zurich is way too expensive! -.-
1,lol i have not tweeted and a damn long time!
0,Aww; back in cumberland. This town sucks.
1,At sonic
1,decisions decisions.... mootools on modx OR kss on plone
0,chatting with my sister who is so feeling blue
0,i've got an economics exam tomorrow.
0,USER The cyclazine doesn't seem to help much. Had some this morning.  Think it may be an ulcer. Gastroscopy on Monday - Yay! Fun!
1,"USER Thanks,<3 iiiillllyyy"
1,USER Because up and down are on the same axis?
1,John's playing Wii Zelda and I just ate some awesome pizza. It's a good Friday night
1,I'm planning to watch 'Clandestine' at 8:30pm at Paramount.
0,was a weird mix of reputable & woo at MB$ the woo was quite unsettling & diminished cred of reputable companies there  but its all about $
1,hoping can buy some new books
0,i wanna go to topshop  please open in torontooo.
1,What Did I Do to Your Heart - Jonas Brothers
1,USER and USER sorry for what happened to you guys.some people have no lives of their own.hope u guys feel better
1,"now, at cousin's birthday partay!"
1,Oh my God....pirei vi meu vizinho gato hj!  Ui ui.....Good Morning twittesssss ;* Have a nice day!
0,going to bed cause fat man says so
0,wish i can blog it but i cant  i swore to Linus love si wont send it out ro tell anyoenabout it
1,USER: I LOVE IT!    Nice snap!
1,USER do you now  oh no he didn't....
1,USER Sleeping at this time of day? That's just crazy talk!
1,"USER ahh ok then, yes with vegemite"
1,USER Hi Miren! Welcome to Twitter
0,USER what happend with Dimitrov?
1,"URL - waiting for them to set up our hookah table... which took too long so we left, with smoothies!"
0,"Didn't really get any studying done.  I got a little side-tracked...oops! lol, thanks to D.W....AND I have homework due."
0,USER no more punk look lacy?
0,"at home eating lunch, gonna do a LOT of studying today! blah!.. no beach today i dont think so.. its not hot enough"
1,Happy - ready to go home
1,I desperately need to learn some basic time management skills!
0,Just had a hard time watching Law & Order: SVU... An ep dealing with a child who was once a sex slave in Uganda = really depressing.
1,TWitter!!! Finally joined  Follow me i'll follow u :d
0,"If I can't go, It will be real tears that come out."
0,"10 down, just one more. So so tired!"
0,"USER, USER  i double that."
1,Lying in bed trying to wake up
1,USER and yeh this wins all. the Kradam bromance comment... I was like !!! o_o !!! hahahaha. did you watch thr Best Day/Week ever?!
1,"and now he wants the pleasure of sleeping in my bed instead of the cold, hard hallway floor.  i think not mr. pupperz."
1,USER LOL! It's on the right? I gotta try when I get home. I'm using it at work. So the X is where it should be.
1,USER I like it
0,"USER Yep got my packing done already, gotta get up at 5am tmrw  Saved my last ambien for the flight."
0,fucking homework
1,It will
0,"USER May 29th , yeah katie will.  Will be $30 for me though"
0,USER ((HUGS))
1,USER aaaww! I love you too!<3
1,"USER He loved it, so Happy Birthday!!!   He said you sounded like a mixture of John Lennon, Chrissie Hynde, and Janis Joplin."
0,"Work  in San Jose, CA URL"
1,Birthday in 37 min!
1,"its getting late, goodnight world"
0,"USER yeah, ultra runner....going to make my own soon! Nothing is working! BURN is awful!"
0,Trying to convince former Bonny RPers to set aside their skepticism about last night's awesomeness and give this another go. Failing.
1,ohmyy. Goodnightt. Ps USER you ate a panda?
1,Half way through our new site
0,I wish i'd had > 5 hours sleep.  Staffing ticketdesk at Goldcoast after work & tomorrow morning.  Should probably lunch-nap in my car now
1,Half marathon - done. Can finally stop forcing myself to eat like a monster and dehydrate the old-fashionef way
1,USER My thought is that texting while driving is not very safe.
0,Hopefully usu ignore what grandma said and keep her promise...
1,"Getting Ready For Bed & Taking Video Blogs For Youtube, I'm a woman you see, we can  multi-task  Youtube.com/hayleighg6 <-- Check Me Out.!"
1,USER I am going to spend 4 weeks in the Utah Mts.    Lehi?
1,According to USER the Blizz D got me about 30 points!
1,Look USER --- > USER 's here. We should all go one day and have pancakes together.
1,Watching the soup. Joel Mchale always delivers
1,"USER awww - share!!!  Besides, pretty sure not many people follow me AND have membership there so you're safe -go for it   It has begun!"
1,"USER love the Painted House! half-way through, wish it would last longer"
0,I'm glad my Homer is still rolling strong in year 3. Hope he goes a while longer. Can't afford a new lappy
1,USER hhahah oh yes I know that  teleportation would make life much easier
1,USER if you bring me food right now i'll eat with you
0,is soooo missing her husband right now.
0,Damn I got a busy ass week ahead of me all work and no play
0,Work work work
0,"USER I want the ""Meet the Medic"" video already  Spy, Scout and Heavy are my favorite XD why yes, I've found tf2 slash >_>; (i<3it)"
0,USER man archie you are living my DREAM. I'm half-Filipino and I haven't been to the Philippines! Shameful right?
0,"USER I've been well, thx. Just getting up for an early morning meeting and wondering why I agreed to it. Don't like getting up early"
1,USER I appreciate the note and look forward to it.   BTW you guys are awesome marketers. What I wouldn't give....
0,Woo-Hoo! Back in Minnesota and totally missed the bachelorette last night
0,proposal was cute! Vitamin Water should NOT cost $4.50 @ the movies!!
1,welcome to twitter estela
1,USER yes its going to be fun see you there
1,USER really? Darn maybe i shouldn't go. Lol jk
1,Just draged my sisteraround the town...To find closed shops! If it wasn't so hot outside she woulda killed me! Saved by the sun
0,needs a full body massage badlyyyyyyyyyy
0,USER Let me know how it is! It's not available for me yet  I hate waiting!
0,catching up on the office season 5. i've missed so much
0,"Overall first impression: Good and simple search, very fast. Of course searched first for ""djsojus"" - no results  #OneRiot"
0,USER Votedd =]] Man I Miss Him  Lol x
0,"USER Morning, Blair! I never apologized for our little fight. I'm really sorry. I was a bitch.  I really like you. You make me"
1,Ooopps over slept. Is it really 10am? Best get up then and get my shizzle in gear
1,USER Loud and clear  good afternoon!
0,disappointed to hear that ExtrasOnly is taking over casting on Leverage
0,"""USER""have you the e-mail from Miley ???? I want to write with her but I cant"
1,Day off having fun
1,"USER Hmm, idk  everything"
0,I really love to sleep.  I love my bed.
1,USER O.o Heirate mich
0,Just having a barbeque when it started to rain!  So filling in my visa application for Uganda instead!
1,"USER Haha, that's cuz you're awesome possum"
1,USER aww i am gunna miss you kiddo... i guess we are going have to hang out when you come back.
0,"USER Fine here, thanks. The order's with amazon & tried play, game, JL already - all say same  How are things with you today?"
1,USER USER USER Watching the video podcast on UCSC tv. Great work guys
1,USER Thank you so much for mentioning URL on your smarty pants blog!  URL
1,Amazing how easy the Mac-Wii-internet connection is.
0,My chest hurts...
1,"Plans to read ""my sister's keeper"" befor the movie comes out.  saw the preview just now, and I think I would love it."
1,"USER as if I even need to tell you this, but your hater is a fucking pathetic person. you're the shit, sister."
0,i sit here ...but its boring!!!
0,USER i am ashamed to say i have never seen it
1,USER hey love!!!  have a good night!
1,"hung out with my best friend all weekend, ate great food, drank nice wine, and things are back to the way they were"
0,come on... drop by 1  67. marketingwithrenee.com
0,"TASENOO: Just finshed a 12hr shift,and bloody car won,t start don,t u hate that!"
1,USER Lol Im glad U broke it down
0,USER if they enable flas think of the effect it would have on their app store
0,USER This is de-caf! Although I've long thought that the addictive part of coffee isn't just the caf
0,The new prescription in my glasses is making me dizzy
0,If only a pizza place were open right now.
0,Installing OS 3.0 right now. Backup is taking HOURS.
0,USER aw sorry to hear that.
1,USER I'm envious of your ability to do animations yourself and quickly.
0,USER What a shame that is  but theyre showin it tomorrow at 9 on MTV!!!!
1,USER Good luck.  You're prolly done w/ it by now though. XD
0,"am attempting to sort out under my bed,which i HATE doing due to the fact its very cobwebby and that equals big,nasty,terrifying spiders."
1,USER aWWIE THANX IAPPRECIATE it
0,USER  ikr! now it's such a dump! it's so ugly na... :|
1,juz back from syd - audition went well!
1,and his band AROUND A have just won the Battle Of The Bands rock contest!! WE LOVE YOU!
1,USER jensen and danneel bought a cockapoo named Icarus. And he said on stage that he loves her.
0,USER for 2nights. your mom planning it. but i don't think i'm going
1,"Put up some new posts, kind of on a roll  Check it out  URL"
0,"USER watching twilight for the millonth time, mourning the end of the wkend"
1,USER thanks baaaaabe  hope you're having a good day.
1,"To all of my Twitter followers out there, THANK YOU AND GOD BLESS YOU for all of the wonderful and inspiring comments you post to me!!!"
0,"Chrome is way too slow, gonna try the full release!"
0,"Morning all, I didn't watch any dvds last night  I fell asleep after i had my bath"
1,"USER raccoon! dont get crazy now lol. haha that so reminds me of bon qui qui  idk if u like boys, i like them too hahaha"
0,USER awww   i still â¥ you!
1,USER awesome definitely go for it! Will definitely root for you
0,i'm packing a box but i don't know what to put in it.. everything is crap i should have left at home in the first place.  :\
0,USER haha yeah i know
0,"USER Wait a minute, that means I'm getting really old"
1,just went for i drive around pretty pro hahawell i like to think so. im really tired right now. going shopping tomorrow  yay
1,HOLY SHIT TIM SALE IS COMING TO SUPANOVA! AND DAVE GIBBONS HASNT CANCELLED!
0,I forgot my ipod
0,The weather always seems to match my mood.
1,USER it's in there
0,The movie; Year one sucks
0,"USER Book by Dan Brown, author who wrote Da Vinci Code. A&D out in theaters on Fri. And, no, haven't started reading yet."
1,went to a birthday celebration. reminded me that mum's turning 55 this august.  love you mum!
0,USER will need new Xcode sdk for iPhone OS 3.0 tooâ¦
1,USER Thanks!    She's a lot cuter than me!
0,rained out the festival
1,USER Please show us the new studio's pics!!!
0,"Ugh, back in Oklahoma. I definitely did not miss the humidity."
1,"Finally got all the books updated & bills taken care, both company & personal. Now chilling with a glass of wine."
1,"saturday niggggghhhhht, i got no darn plans but yet again i barly have any,"
0,USER Andrea you ruin my fun
1,did not update my twitter for a day had and overnight stay at palmas del mar
1,"USER  I've already done my washing, I have a spring in my step this morning"
0,USER URL - aww your mean!
1,I'm going to eat at my grandma's house
1,Today planning to watch movies and going to the city with my bestfriend Mirjam
1,USER lol. I am a danger to myself. We'd been chatting in the cab so felt rude not to! My London friends cracked up about it
0,"USER i can't get onto the damned site to VOTE for you!!!  i've voted looooooads, so how davids beating you, i don't know! :["
1,"USER I find the concept of ""solving"" the oceans to be splendidly amusing."
0,is terrified about her chem regent
0,USER What? No comprende
0,#myweakness Loving photography passionately but loathing sales. Being an artist is one thing but art business is 95% sales/ 5% art.
0,USER Some people's kids...
1,USER  I want Egypt  but don't want to jinx it with expectations
