1,USER eu uso wireless no vista
0,i think i can actualy hear my head pounding!  i hate feeling sick.
1,USER Freut mich
0,At Great Wall China Buffet in pickering. So full! But omg scared to go outside... Looks like a hurricane or tornado storm
0,USER OHHHH THAT REMINDS ME. I know it's not one of yours.... can you send me some of my toothpaste?
1,USER dont tell kim but you're definately the favorite!
0,"Spongebob baloon in the cornor of my bedroom, pretty scary when I see it at night"
1,"USER  i'd love it if it was! If it is, make sure you let me know!"
0,"Oh My God, Listening to Rob Thomas' ""Her Diamonds"" and let me tell you I LOVE it. one of the best songs ever.... feeling bad for Chris"
0,USER yup..  sadly...
1,everyone add USER the next heavy weight boxing champ in the making
0,USER i wish i was in london right now
0,"USER haha you got exactly the same as me, i went docs today, badtimes innit  x"
0,earlier tweet was a bad idea... i feel sick now
0,I wanna eat out.
1,USER Lots of luck winging its way to you
0,"USER USER - They are 5 and 3. One is home sick from preschool, so that's not a help either"
1,found a charger
0,can't be doing with this work during good weather! its unfair
1,USER oh i might have to tune in
1,Last tweet this hour. TAYLENA IS SO FREAKING AWESOME!!! I love them!   Check them out grabbing some yogurt!  *Youtube*
1,USER  may the best blue team win!!!
1,USER great! hope you have a good time! & look forward to hearing about it
1,I have started using twitter... Welcome myself to twitter...
0,More Frustrated than ever with these Twitter applications  Crossing  fingers for new laptop t... Read more at URL
0,Well thats that then. Exam failed and bsc gone
1,Happy Mommy Day!!!
1,USER LOL I have a memory of an elephant
1,USER
0,Disappointing day
1,Still more time to wait for kitties..... but they're doing well
0,i need to sneeze but i can't
0,I'm back in the whales vagina and its glorious! But its missing Ro
1,"USER hey! u're welcome, thanks 4 the follow me too  how are u?"
0,"Okay, apparently I DIDN'T miss the deadline for JB m&g's, but it would be kinda lame to win, I would feel really bad about it."
1,"USER why, thanks!"
0,"Left ""Up"" due to out-of-focus projection.   Hopefully my complaints to theater management will get it fixed for everyone else still there."
1,USER oh you're no fun. lol. hooray for gaming videos! hurry up and get it done.
0,"Geeeee....... Here comes the old witch. Bye bye bright sky, so long sweet dreams. And say hello to the nightmare"
1,"USER OK, so now that you've had your Cupcake for a bit, how's it taste?"
0,exhausted  i really dont feel well.....i think i might pass out again
1,"USER sleep under your desk  was at paddington earlier, didn't see any CB people!"
1,Going shopping today with friends
1,USER Hola mi powerful PR LADY YOU  Last night was great. You are amazing you know that right?? Besos mami.
1,heading down to KL now for dinner. See you guys at the show later
1,Sent email to Tony Blackburn blaming him Lol
1,"Hacked my PSP with ChickHEN, now it's running 5.00-M33"
1,USER Hello You!!
1,Getting ready to go to the beach for a week.
1,Has today off  now what to do with it?
1,Night everyone.  love you guys.
1,USER yo thanks Den you free around 6 for an hour today either tinderbox or your place?
0,No work today  no monies for Paul
1,USER aaaaaaaaaaaaaaa        ta thx
0,Grad wasn't fun
1,ty u to laura/USER for sharing URL with me!
1,Just sick and tired of not having it all!
0,URL - in the gutter again
0,USER im need u to believe me if u dont who will  LOL
1,we go together like vegemite and toast
0,Oh god. I think my stomach is falling out.
0,USER and I do not recopmmend eating at Pho 79 (State and Glenwood)... Poor service and the food was not delicious
1,watching squrills at the park. and he's just laying on the table. he's cuuutee
0,USER i'm sad now i leave for 2 hours and u didn't even miss me  anywho um i still luv u and whats with getting a frozen turkey?
0,I can't get to bed
1,USER Wooooo! Congratulations on the win for Best Movie Song  You totally deserved it!
0,"USER shame, that still sucks tho"
1,USER Did you get stung?  The bees and bugs in the South are horrible.  Hope you weren't attacked too badly
0,I'm starting work now
1,USER we never look as good as the guys who do it
1,"USER if you are 4 for 5, no one care about the trip @ 2nd"
1,USER I still have to make the optimum use of it....still figuring it out. Evernote is a cool tool though
0,Feeling much better! School is coming to a close on my senior year
0,uhhhhh WOT IS UP? ahahah uh i want you to ACTUALLY want me please? ..... no .... NEVER GOING TO HAPPEN
1,#Oracle agrees to buy #Sun. Guess #MySQL will loose some advocates. See a rise in #PostgreSQL  URL
0,Why is no one around when I'm losing my shit over health concerns.
0,Texting a friend who I haven't seen in a while and he's fiine but has a girlfriend.  I kno I kno.. That always happen huh lol
0,i dont fell so good today
0,awww crap. have to report at 830
1,USER in the studio until end of june then... woohoo ... everything is done... time to start another...
0,glad federer got his record and career grand slam title but still sad nadal didn't get his 5 in a row
0,USER USER Ben should get twitter.  He would never tweet though
0,sooooore throat
1,Beautiful day
0,"I was eating a pizza and I took a bite - it was nasty so I jus threw it away - then I look to my left, a homeless guy, now I feel crappy"
1,I'm waiting at the VW garage for them to fix a small problem - then I'm going cruisin'!!
0,USER I said that 5 times and i didnt get kicked
1,yo scott man i got an awesome question for you quickfire questions ill tell ya later
0,gosh!!! there is no AC working in office..no mails working..but I am suppose to work
0,it's raining
1,"Turned out to be a wonderful day off after such a long day yesterday. The pool, the sun, Chilis, Brett, Erika, and smores with Mom. YES."
0,is reading the IT girl before she has the day from hell tomorrow with homework WHOOP WHOOP too long till school starts up again
1,USER Thanks for the follow!
0,Thinks Valve got the L4D2 announcement all wrong
1,USER it's great that you enjoyed it  it was a great atmosphere at the church
1,"About to pass out, amazing night"
0,"USER Been on a trip, but co-ordiantor meeting went well and all graded as ""good"" so far!  Observation tomorrow.  Ta!"
1,Taking a break after two-three hours of working on the project. Time to watch some Jon & Kate + 8
1,"I am one of them b/c I nominated myself LOL, I have no shame in admitting it, go vote me in guilty pleasure, vote daily  URL"
0,Dang it!  The power went out at work and I was ready to go home...then it came back on
1,I'm enjoying a wonderful pedicure!! Loving it!!!
0,"crying? yea close to that..  im not happy.. i will nver be.. miss u guys, all the good times.. wish i can return to those times.."
0,USER ha ha... a bit sunny would be great but no it is not... It is cloudy...
0,Off to BestBuy... Buh Bye iPhone  well at least until the new one! =D
0,aww it got messed up
0,uggh still sick. I've been sick for days
1,Just chillin' watching the cat stalk shadows
0,"USER oh no you alright what happened? and poor fishy! was it a goldfish?  ah i won't be at dance either, too much work. thurs?"
1,s|outs to all the fat girls who have no friends
1,"USER Yes, this Tweet is on."
0,is making a blueberry cake and totally just burned my tongue tasting it!!!!!!! OUCH!!!!!
0,Just wanted 2 let every1 know that I'm still sick!!! I'm still in bed w/a fever!!
1,USER DM me if you want to chat more. Good luck!
0,Thinking about the past brings me alot of tears  but everything happens for a reason
0,My feet are tired.
0,"USER can't do it,cuz every thing is so m3affin w akeed kl 7ad yt7ar6am fa '3em'6oni"
0,the 1st year was a really bad movie. but picking theo up from work in a lil & chillllllin. i miss brit & manda already
1,USER I did and I cocked it up a bit but managed to salvage it
1,Got a new car  2009 hyundai sonata. Please note the increase in baller status.
1,USER  Pretty sure you'll feel better tomorrow!
0,Wishing I was still asleep
0,someone hit me up on aim then signed off  imhurt
0,USER  well I at least will come bug when you pack & trust I will come visit you especially for the summer I have nothing better to do
1,USER you are going to do great at the RnR. Looking forward to hearing about it
0,Not much on the car photography this week  Been SLOOOW
1,I'm home...time to get breakfaaaaast
1,it's my couz's birthday! we'll have fun fun fun!
0,Going to walmart with the kids to get dogfood! Between the food the kids eat and the dogs its no wonder I'm broke!
0,i have to admit the chiropractor made me cry today
0,Someone left a whole pita wrap outside of daphne's greek cafe
0,USER Pleeaasseeee.
0,"Kinda sad, why does history have to repeat itself"
1,off to my business exam....1 hour 15 minutes of mind numbing blankness
0,USER I totally made those pancakes last fall. They're good... Even though pancakes make me sick
1,eatin with carlos cuz he wants to hang out with me!!!
1,"USER Aaah, and see I'm about to leave the Vegas sun/heat and trade it for TX sun/heat... Boston is great though, you'll love it!"
1,USER So glad to know. I was waiting for your review. I think they are already talking about a sequel
1,Going to sleep soon le. 2moro need to wake up early. Good night all.
0,says sayang ung tongue's workshop  huhuhuhu. URL
1,"Tomorrow, I only have one class to attend! Yay, happiness!"
1,WANTS TO GO TO NY & CHILL WITH THE HOMIESSSS
1,mtv movie awards then bed
1,"USER always a pleasure ... God Bless you too  thx - really glad to do it, no need to thank me always ;)"
1,going to warwick today
1,huh? a pineapple juice for dinner? yay im too lazy to prepare food
1,USER You're welcome! What was this powerpoint presentation for exactly??
1,"USER yeah thanks, just chilled and had a chat  planning a girls holiday for next year - soooo excited! You had a good night? xx"
1,USER Good morning Swagger man.  watchu doin? y u up so early? lol
0,USER I haven't heard from her...   did you try to call her?
0,"USER  Poor Lion...Damnit, you REALLY need to get a lady!! Any prospects yet??"
0,"USER 1novel Scifi based in asteriod belt, 2shorties. Most time at mo non-fiction  Fantasy in notebook not plotted yet, tnx 4 interest"
0,"Omg, it's 7:30AM! I haven't been up this early since college let out."
1,USER Ice Cream is ALWAYS on the list! haha
1,USER David Tennant is one extremely good looking man Ben. Enough to turn gay women straight
0,I hate waking up all digustingly nauseous.
0,The baby has been crying for 25 minutes straight. I hate this.
0,I really need to blog more. My poor blog is all empty and naked.
0,USER Word up! Too bad I can't feel the drunkeness
0,"USER - Yeah, heard it's awesome. There's no Chrome yet for Mac though, right?"
0,USER sad that the moment i leave the northeast u mike and jasen are there  fml
1,URL - Working on this. Do you like this text effect? Any suggestion?
0,I was on my way to church and then realized i hav no gas and no money for gas  ugh
0,didnt get to see 'up'
0,"study pants, play time with my loveeeees and then the lake! sad i missed the river trip"
1,USER yeah....sorry 'bout that break. I owe you at least 5 min.
1,USER he he.. ok..  bt these days u never know..  so got dat doubt..
1,USER I see
1,USER outside is good.... just about to email you your web versions
1,USER homeygadd. are you serious? i wasn't able to come (obviously) so i wouldn't know what those are. care to explain?
0,damnit. there was something amazing i wanted to tweet.. but i forgot.
0,"""Cool!"" My mobile phone is broken & now i temporarily have to use my dad's old nokia 3310"
1,USER good comment  well Josie has repeatedly said marketing is her forte isn't it? She did it! lol #awaresg
0,I need a glass of reisling right now... To bad it's Sunday...Atlanta sucks with that no alcohol sales on Sunday law
1,"USER I'm on vacation all week, don't know about the actual ongoings in the XP project.  But yes, I catch your drift."
0,Not looking forward to tomorra
1,Going to bed!
1,USER Your crazy  But I love that about you! Have funnn
0,USER ...for eating a potato? Why do you have so many it's confusing me
0,You'd think someone who wants to be a nomad would enjoy moving more
1,"USER 2,000 more votes for you to be the number one. I can do that! Hahaha. Mind replying to USER and me?"
1,USER OMG... harsh weather. Where are you? My strawberries lasted all year. I had a Tomato plant in January.
1,Reviewing things is fun  ...
1,Baking bitter almond cookies
0,USER dude i miss you too
1,USER you are like a child thomas. how cute!
1,USER Best way to wake up.
1,flickr-ing.  maybe I won't be studying at all today cos I'll be off to see my adorable little cousin at 2 pm
1,USER stripping for HA2 now are we?
0,USER phaket.  what did anneliese want to do?
1,reunions are super fun!  can't wait for ours! haha
0,shiit!! i fell of a bike !! i'm so stupid lol but i'm sad
0,my feet are killing! expensive but shit shoes!!!!! ughhhhhhhh
0,:O look at that rain!
1,AMAZING weekenddd! havent been home allll weekedn  swimming in your clothes with your best friends at 9clock at night is so raddd!
0,"USER ya i'd love to get together! i'm actually living up in golden, just moved there last week, taking some summer classes"
1,"USER I was there! You were soo good, I loved you. You have a lovely smile  x"
0,Rubiks Cube SpeedSolving... Sub 60
0,"USER I love foods too, but my doctor told me this morning to lay off the fried foods  (borderline-high triglycerides)"
1,"USER USER well in that case, I don't actually have a questions, but hello there"
0,Morning guys. Gettin ready for school
1,I'm so pumped for the day!
0,just got her ipod touch stolen... at her own pool. why does this shit always happens to me
0,trust me to get sick as soon as my gcse's start
0,A bird just took on my rental car at 70 mph. Bird bought the farm.  Will let the wife drive for a while.
1,USER Thanks very much Helen
0,fuck A levels!
0,"well now my mom has the cold and so does my dad and my middle bro, im sorry everyone for passing it on"
0,This show is giving me butterflies in my tummy. I miss love
1,"The chapter on worship reminds me of ToK... Which is REALLY cool. & ""i dont think there is any better worship than wonder"""
1,USER i go places alone. there is nothing wrong with it   have fun with the family!
0,is attempting to watch nurse jackie. why is it they only bring the good tv shows out in the states whats wrong with the uk?
1,USER Geek fest? Is it Trekkie like? Post pics of train wrecks
1,USER LOLLL Amelia DONG? Sowee couldn't help sniggering at that! Please dun kill me Amelia
0,i feel awful.  but i have to work at 2... ughhh
1,Finished with assessment 1 and 2 for my students for business system analysis subject
1,Posting a new post now
1,"We're working on a new set of bases. We've got other stuff coming up before the bases, but they are on the way."
1,The Lucidity Book is out.  I have an illustration there. yey!
1,"OMG, this video is making my stomach hurt from laughing. Red Hot Chili Peppers (sorta)  URL"
1,"meeting some friends later... but first, i need to get home"
0,"USER See, I'd LOVE to make bracelets for my man, but somehow, the beads, they always end up looking too feminine on him."
0,Guess no CI today.  boss man shut the shop down early. . . drats. . . try again tomorrow.
1,"USER perfect, Bro. Gracias! But I notice you didn't register on my TwitterCounter guestlist"
1,Sitting down to watch qualifying wondering whether to twitter Jake live on air see if his mobile goes off
0,"raquel just got picked for a really long trial. she is very happy and so am i cuz i didnt get picked! but, im still stuck here"
1,USER - ah! well happy early birthday then  i hope it's a great one!
0,"Busy moving today, Wishing we had more $$$ to fix up the house"
0,"I can't ask people to install FP10 to see our ads, can I? Nah..."
1,"USER Hi Audrey, I'm following you"
1,USER HAPPY BDAY Frankie!!!  Hope Chip gives u a nice surprise!
0,Sitting at full stop on the M1 in nottingham as accident is cleared (via USER) - me too
0,"Tennis was fun, although I'm aching now.  Blisters on hands too."
1,USER Why Pune? Don't you have to work in Bombay?
0,USER I would have if I didn't have triathlon tomorrow   Maybe next time!
0,Man i had to wake up at 6 in the morning i'm so tired right now tht i cant keep it open
0,just found out I uploaded the wrong pic to twitpic last night
0,USER my grandmother is in hospital she is dying  really upset bout that... and i start school again tommorow WOOO *im actually excited*
0,USER im glad we have the confidence..if only we had rossi
0,"USER  and you get to see stacey, you turd i hate you"
1,"Itweeted at the same timeas Chris, Yaldisss Maytee"
1,USER it's incredible in 3-d
0,USER why you gotta say that about people who ain't following you?  (not nice) lol
1,USER nothing a well placed grenade can't handle
0,Hates working Every Sunday Morning
0,am i such a jerk?
0,Tonight was tooooo crazzzyyyy
1,USER That's what Sundays are for! I love Sundays!
1,"USER I told Ci that day that I love her & her biggest fan from Melbourne, Australia & she said ""Thanks Love""!!"
1,suppose i better go get ready going shopping
0,wrappin up the illest session i've had in the longest!! bout to head home and tend to USER!! poor baby hurt himself playin ball
0,Lala why cant i ever sleep? I think i have like a sleeping disorder.  craving pop eyes imma stop tweeting. I over do it at night
0,"Just pierced catrinaas nose and lip. It got my anger out, fucking D as my final grade for psych  now going to nens <3!"
0,Just back from computer support visit to neighbour. Their 8Mb broadband is actually delivering 135k. Oh dear
1,"So, 2k today, huzzah. If I can keep this up (no uni, off work until Thurs) then I can finish the novel by week's end. Nice! Night tweets!"
0,"USER i miss you  i need another tour like NOW. shame i can't go to iow festival or anything else...meh, i'll just watch the dvd (: xx"
0,"Had chilie con carne for dinner,just settled down to watch washington @ Yankees though its pissin in New York so there's a game delay"
1,update tracks on the iPhone something crazy
1,USER yes Barbara your tweet is working..... you are doing a great job with it too
1,thinks that karma is about to work its magic
0,"USER already saw your pict, want to hype it, but I can't because using blackberry"
1,"USER goeie tip, thanks"
1,USER Night you too
0,hubby woke me up...now having a hard time going back to sleep!
0,USER ok. thanks for the info. waaaahh nkakalungkot wala na sila..
0,hahah r u sickk tooo??  USER
0,"Saber is suffering a headache, would like to rest but can't leave the website. Hooty and LorD swamped with work, Remus wireless-less"
0,USER i don't think i can go!!  bball is at a weird time and y the time we get back and stuff i'll have 2 shower and homework.
0,Reading some fanfiction. It's what lonely people do.
0,USER Ahhhh it gave me an error when i tried to post a comment
0,is Joe Jackson mad I missed Electrik Red in NYC
1,you know what's awesome? chocolate crackles
0,knows that it is odd that I am twitting again. BUT ANYWAY! I am quite  cause I could not go down to church today to help out. TMR I SHALL!
0,definately not looking forward to all this rain.....ugh  wassup bestieUSER
0,USER I was so sleepy earlier but now that i'm in bed its not working for me.  i'll be lucky to get 3 hours.
0,Wishes he was at home playing on GH: Metallica. Instead im gonna have to do some revision later on
1,i converted the climbing wall around my garage to suit my three year old  also working on the garden.  right now going on a bike ride.
1,having breakfast and watching cartoons
0,There is a broken gear right in the guts of my machine.  No more sewing today
0,"USER Only one thing: Blair said finally that she loved Chuck, but than he dind't listen to that, and just went away! That was stupid!"
0,I have a sore throat
1,USER haha that daniel craig icepop is cool
1,listening to songs
0,To love me means you have to fight to prove to me that you love me. Sometimes i just can't tell with you... I miss the old you
1,USER the girls love YouMeter...did I tell you that?
0,USER i feel great in my skirt and red shoes... ...  your going to miss a great day
1,Okay good night all
0,freewebs.com/lookitsasha <-- I AM SO BORED. twitter is boring to you can't post ernough just check my sites blog
1,USER hey youre kind weird. just a little bit.
1,Trying to convince Adam to get a twitter.
0,USER You are not feeling well either  Just a hot shower and early night with a good book. I wish I had a bath !
0,basking in the glory of my Jumbotron debut tonight at the Padres game! woohoo! too bad the home team lost 8-0
0,where is my camera?
0,USER Not today with this weather - searching in ivy covered trees or nettles is bad enough in the dry
0,USER staged grrr twitter doesnt let you undo typo's
0,"Some complex ideas have born in my brain last night.. and it is now disturbing me from working on simple things,..."
1,eating a chocolate frosty & waitiing for oscar to text mee
1,Just finished my history coursework! yay!
1,A bath in nice cold weather - nothing like it
0,USER i miss you its not even funny
0,i'm so tired
0,I completely forgot  what is urs like?
0,USER we miss u too jamie! Like really really bad
0,USER mornin! not back to bed  killer nephew jst turned up an decided hes stayin here all day to play wi wee ging. tears are imminent
1,"Learning 'Bubbly', 'Butterfly Fly Away' and 'Almost Lover on acoustic. Baby has been neglected... we're staying near the top-o'-alphabet"
0,"Booked tickets to see the Herd. Sadly, New Kids cancelled their Aus tour.  Now, when it Nickelback coming to BNE!!?? (SHUT UP!!!!)"
1,USER Prisoner guy was either Scott or Steve on one of the early episodes. I'm good with faces
1,also Ghost Adventures is an awesome series on Travel Channel
0,It's dull today  sad times but on the plus side I'm away to spend more moneys I'm town again today!!!  URL
1,"USER I've just read that, you're EVIL and when are you coming to cook for me?"
1,is going to make a really good vegetable soup tonight.
0,Stressed.... Headache..... Stressed
0,I wanted a dad to be card but my girlfriend didn't get me one
1,Rear fog light on!
1,USER wheres the clip at on wwe.com? Hey im Steph btw  x
0,is gonna go home today.  im not ready to go back to stupid del rio.....
1,USER I have in this road trip  we are only in second place because the nl west is full of gaps. its all about the pads/giants for
1,USER I like my BBQ sauce sweet and tangy - bourbon is a good addition!
1,USER good morning luv.
0,mum just gave me my  flu needle  and for the first time in so long i do not feel tired at all YAY
0,I wanna change my gamertag. Anyone got any good ideas? USER and yes Cobra Starship was taken
0,I was leaping around because I thought I heard the mail man. I sprained my ankle & it wasn't even him!
1,"Went to the gym, enjoyed the swimming pool, Jacuzzi relaxation, and then having a couple of SubWay sandwiches . Awesome"
0,USER heyy! long timeeeee! haha Iï¿½m so sorry! becuase I dont understand  I miss you!!!
1,"USER No big deal or anything, but Michael Thot (from Kid Nation) FINALLY accepted me on facebook.  â¥"
1,USER time to take ur cat for a walk
0,USER I like this.... Ps I just said hella and no one was there to respond.
0,I'm driving through my old neighborhood  aww the memories
0,"So, being inspired at #wwdc is pretty cool. Turns out the problem space I picked for my first iPhone app is pretty complicated"
1,"USER  Sounds fun.  McGill...BA Art History, Bishops BA honours History, Queens MA history....IU PhD"
1,USER URL - can i have your hoodie?
1,All it needs are some 22's and its perrfffeeccttt
1,*gasp* Andrew Bacon and I haven't talked in forever! I'm excited nowwwww
1,Just finnished my Double Cheeseburger. It was good  Ready to watch the Spanish F1
0,I shouldn't have opened my big fat mouth. Now he's mad at me
1,"USER Someone should tell the boys that!!  Anyone going to Wolves?,  if you meet the boys ask them to tweet onstage at reading!!"
1,USER dm me the details
0,Only I could end up on a long weekend call when I am not on call  So much for it's the weekend woo hoo.
1,USER thanks!  how's it going in LA??
1,"USER hehe, yeah but am back now.."
1,USER good morning  although it is 3.35 pm where i am...
1,USER at least its not 110 outside
0,"USER whoa, Lucky you, I ve a wall b4 me"
0,tired.. have a stiff neck..  watched the best of french and saunders.. v funny..reading on the road- jack kerouac and then jon ronson.
0,"Ouch, my back. Man I'm sick"
0,USER I think I will have either shrivelled up or imploded by then.
1,USER Do we need to start tweeting again? I am up for it.
1,USER ya i think that's my fave MJ song too. It's a bit of a feel good eighties classic.
0,"USER well i think my followers hate me, they NEVER talk to me  but im pretty sure they are, jus not hardcore ones like some guys"
0,Hello world. Head is banging oweeee  Britney was fab! Having beans on toast then headin into work. Welcome home USER missed yoooouuu!!
1,USER  Are U having a nice time in Sweden
1,Made it. Safely back home. Thanks for all your prayers & well wishes twitter fam
0,USER erm... Nah doesn't sound like anything for me  lol yes working already.so much to catch up as frittered yesterday with iphone!
1,"none of your selo-bullshit-tape ....theres god, then theres me .....testicle shaped treats .....hahaaaaaa.....goning on about kilts"
0,need to sleep early!! aalis nanaman ako bukas  buhbye URL
1,USER Thanks Joyce! It's not a great as yours but maybe I'll get there
1,USER I'm SOOOOO excited to see some Full Service! Thank you so much for all you do! Relax! You deserve it! I <3 YOU!  Andrea
1,USER I'll check him out thanks
0,my tooth is coming in
1,USER yes you can just type d username then message
