1,Nice to meet U USER  URL  Don't want U 2 miss this
1,USER Got the black van and the balaclavas sorted..Are you exited for M&Ds?
0,My facebook account is still disabled and I have not received any response to my mail to the Facebook-ghosts
0,is a lil upset she got dissed from going to the shooting range this morning b/c guys wanted a guy day
0,USER Imagine being able to buy A2 prints of some of those big double page spreads from early 2000AD? AWESOME! (will never happen  )
1,Footy time soon  oh yeah!!
0,USER is the definition of amazinggg! so sad i missed her signing today  <\3
0,"Why am I sick?  now, in june.  Uh oh and there's practice tomorrow"
0,USER  aaaah maan.. i always miss hanging ou with LIG ...  I need to make sure I make it to the next Retreat event :-D
1,"is bk in town, great time tonight, guess now going to Adams"
0,"USER bb, i'm so sorry"
1,USER your concert in nj saturday was freakin amazing....best ive ever been to!! If only you guys were like ten yrs younger lol
0,"USER Did not know and that's exactly what I was asking, yup. Thx... I owe you as well, I know"
1,Where oh where has my little dog gone oh where oh where can it be? <- I dont think I got that right?
1,Looking forward to an afternoon of  Whatever the weather ;)
1,USER Muon biet kq iphone hang ngay thi follow luon #squarespace ay
0,Sniffle sniffle cough. Ahchoo. Grrr...ugh.  sniffle
1,just sunning my self at the bus stop
0,USER eu ouvi sp all day.
1,"in bed, eating lunch and now going to watch Ghost town!"
0,i went to sleep in 6 AM and for some reason i'm awake now
0,good morning. i am sad. my german friend leaves today
1,30 minutes before I have to punch down that bread and let rise for another 30!  hope its tasty
1,My new flat  URL
0,love how dad said he'd be ready to go at like 3:15 and it's now 4pm and I'm still working.
1,"USER #musicalmess.. I understand, got a 250 GB external hard drive almost full of music..I am sure I could purge...music OCD?"
1,USER yuuuuuuum :p so jel! man haha i still have umm brownies haha gave them to my bro !   x0x
0,"USER it's based on a true story, anyway. so i guess if you were to wiki it you would have found that out yourself"
1,"USER  I'd say 12, but maybe I'm missing someone?"
0,USER dooood! it is working! tea time later? are you working tonight?
0,USER ughhh that stinks!!! i hope you feel better
0,watching the rice and lsu game rice is losing
0,Today is such a Murphy's Law for me
0,"USER I wish, by telling you, I was wrong, but alas  #Canucks"
0,I itch
1,3 more exams then no school.
0,today is fucking crazy if i dont reply to emails/phone i apologise now!
1,thank you charlie por hacer el mall run conmigo
0,USER lmao i dont like science  i dont want to fail! how many do u have left?
0,"USER: tweet,tweet,why don't you answer me?  i know you're not like tom,addicted on twitter,but ,it would make my day much better!:*"
1,Gud morning everybody....
1,USER lol cool i know it has something to do with madina lake but what is it? & i'll check it out later i'm on my itouch right now
0,"USER nice, I did the light cleaning yesterday. I guess that means I need to do the heavy stuff today as well. Scrub tubs and floors"
1,USER nooo are u? ;-) just gettig dressed then heading out to the garden
0,"dammit, didn't get to hang with Roxx last night, but doing so tonight. she leaves tomorrow."
0,USER you're very welcome doll it just did something to me! How's the show! I want to tune in but can't!
0,I don't wanna come out of my room. I'm so upset right now. I hate boys. I always get lied to and mistreated. Idk what to do
0,USER i nooooo  but im not getting in... thats y i got my laptop and food
1,@#3wordsaftersex Thanks for nothing...
1,USER Thank  you
0,Hateing the weather
1,USER I love that show.    They are really a cool family.  The kids are great.
0,"USER Whathe, I have that same drive, and it doesn't show up in 7 like that."
0,wants to go to bed but cant leave this sucky game.... im on at church in the morn in going to regret this  sorry tim.
1,pink and charcoal gray it is  sorta schoolgirlish
0,USER ha ha ha yeah. So how have you been huh? I miss Miguel
1,"has the longest chat with the madness, so lovely !!! and then i must say again how great it was chattin to block party"
1,"USER by the way, I'll be in Islington this Thursday night. Want me to come pick up the books?"
0,laying in bed... my feet hurt
1,USER Isn't Demi's album amazing? I got it the day it came out <3 Can't wait for her new one! It's gonna be awesome
1,USER - congratulations to you  that's one of the reasons i featured you a few weeks ago: URL
1,USER close  have a read here URL
1,USER You're amazing!!!! I love youu so much Jooe â¥ Celes
0,needs to eat. Her last meal was 4AM today.  URL
0,"Boo Nuggets are losing  Not sure why I care since I never watch basketball, but I gotta cheer for the home team, eh?"
1,"USER USER doing a pub crawl around Melbourne, it sounds like he's having fun hehe"
1,"another lovely night with the boyfriend  watched made of honor, my idea for sure ha, it was so cute!"
0,"Great day yesterday - Shopping, Catch up with friends, & Movie night.. Now back to projects"
1,USER Awwwwwwww...that is one good-looking baby!  Great news to wake up to.  Congratulations
0,USER I know I wouldn't.
0,i only hav 8 followers                 !
0,"USER *hugs* I can relate, dear."
0,Daniel won DSDS  but it was soo exciting ...
0,Had to apologise to Dad for not getting card sorted in time
1,"is proud that Wilmington, DE has decreased the number of homicides compared to this time last year by 62%.  Absolutely commendable!"
1,"USER wah style only! like that bo hua lehz. || wah pamper lehz, must try someday, think go there feel like royalty  nice!"
1,"USER Yes, many.  Tennis, basketball, running, adventure racing, climbing, golf, triathlon..."
0,"Just dropped my 17"" MacBookPro on concrete  seriously dented now, but still working like a charm!"
1,USER i got it from elle who got it from michael balana...
1,Is  going to meet the ladies to do all things lady
1,Doing done early fathers day shopping
1,2 days til Florida !!! Working.. Packing...
0,USER Why don't ya follow me?
1,USER Congrats on the program
0,"#addictedto love songs   i know, how lame lol"
1,At work. Thinking I might abbreviate this day
1,Hope everyone enjoyed their weekends! I know I did
0,is sad. Fam left today (from their visit) & the house seems a bit too quiet.  URL
1,Morning everyone! Don't really feel like going to get my hair cut today so don't think I will
1,USER Thank you my dear. Eye of the beholder I'm sure.
0,I woke up not even five minutes ago and i'm already on the bus. I have no cigarettes and i really need one. I hate running late
0,missing my friends alreadyy!!!!   bohuuhuu  im sad
1,URL - USER colombia loves youu... you have a huge fans here
1,aww i just got to hold a newborn
0,USER She was sad last night   We are trying to work something out for her but I don't know...its tough!
1,is at work. Glad to be home
1,Just got back from the Dentist..
0,had such an amazing Saturday with my cousins but now its time for bed cause their leaving 2moro  Good night everyone
1,Wacko Jacko is coming to London in 2 months...hopefully we can all relax a little and enjoy life for once!!
0,Two girls just stopped by the house and took our last two kittens
0,"USER just tried and no, the sites are still down."
0,"There\'s nothing I could say to you, nothing I could ever do to make you see, what you mean to me ...."
1,"USER You lucky duck! I was going to ask how you decided. Easier when you don't have to, eh?"
1,USER sounds like we're in the same boat.
1,"USER It's Twilight, isn't it?"
0,Boys are confusing
1,USER I can't wait to see that soon - I've heard it's good
1,OMG ITS RAINING!!!!  ....i should just go sit outside and get soaking wet....on second thought thats a bad idea. >.<
1,USER mmmm I feel I lie in might be in order  X
0,USER I'm only poor because the economy sucks.
0,USER no HS for you?  Wonder why. . . Mabry seems to like it most of the time esp if I wrap her in the MB and then put her in the HS
0,USER lmfao. U tweeted it while I was tweetn. Haha. Remember I dnt have a twitter app yet
0,USER i wish my testing was over....... itz gunna b over in like 3 weekz...
1,"Watching Before the Game on channel ten. Love that show, Hughsy is great as always"
1,"USER You could've just worn it  Told him it was for you. After you sent it, just say you returned it  Yoko = Mistress of Deception."
0,"wtf my boyfriend said to me go to america a few min ago and now he said better not going, first make me happy and now this  i wanna go!!!!"
1,USER 'Yonnie' it's your birtdayyyy...happy birthday 'Yonnie'...haha..and USER 's continued...yayyyy for tonight!
0,"USER Agree it's a good idea 2 separate work + personal accts on social media, but the AP policy does seem 2 apply 2 personal profiles"
0,slept really bad last night  in need of some coffee asap!
0,lmao my mom was all trynna tell me something and i told her to shut uppp
0,blah blah blah lets go get hit on by creepers at work
1,"USER Hmm...Magic fan, huh? Why's that? Just curious since you're out in L.A. and all..."
0,in carlsbad all weekend (except to work) no bueno
0,USER IM HERE!!! cept work blows
0,I'm no longer able to draw parallel lines and right angle
1,I feel like line dancing to what did i do to your heart
0,USER Thanks for the #followfriday! Sorry I missed you when you were in town. Work got in the way.   When will you be back?
0,USER hows life going withput eastenders  ?
1,"USER it's a media player. URL idk, plug your iphone in and see if it detects it."
1,On the way to oldtown.  just found out something new! Bayski's scared of birds.. LOL
1,im chillin like a fresh ripe orange
1,USER seriously
1,USER I believe there is no such decision
0,Going to Tyler to shop for dad.  I have no idea what to get him!
1,#letsmakeamess I wanna hear all of them duh....but particularly 6 Months & Josey
1,"just had spicy tuna salad, salmon sashimi and dynamite roll from Omakase for dinner... yummmmy!!  so busog and happy!!"
1,URL link to the blog if you want to check it out. we're going to try to keep this one updated
0,bored  getting new baby chicken though
1,USER is gravity a paid software? wow didnt know. but should that b much of a problem?
0,life after school has way too much free time and not nearly enough money to take advantage of it all
0,hates USER
0,USER  Do you need someone to talk to?
1,"gossip girl finale shall be starting soon for the first time on fox8, i cant wait... although i've already seen it 5 times"
1,USER depends... Both gave grotty and emaculate places. Guess it boils down to which areas u frequent most!!  X
1,"So Facebook has unique urls and usernames, I already got mine!"
1,USER Or early!
1,school starts tomorrow... good thing i only have one subject on my load. Design Workshop a major for second year class.  yey
0,USER mmm pasta.. i wanted to go to #bonnaroo but i was too brokeee.
0,Math is killing me softly with it's algebra and other matemathic SHIT
1,"Do you know about Peruvian Food?? It's my specialty...you should try it sometime soon, it's delicious"
0,USER Aching all over. Got a cold  bluergh
0,USER I want an invite - sick of seeing all these links for people playing and being left out
0,You make my crazier ..  when u come back?  = Soon please
0,Where Did Our Warmth Go?? Calgary is raining and it's freezing cold.  need some hugs...
1,"USER Neville so totally rocks. He's been my favorite character from HP since, like, ever. And Matthew rocks for his playing him"
0,USER USER miley what's the link to vote for you!! i can't find it
1,USER Stop by Cupertino and say hi!
1,Praying for a job to pay this ish !   having faith in god  been blessed thus far
0,Looks gloomy out
0,USER: I want the new forme of pokemans.
1,its taylor!!!! kenny's sister!  sorta.... soooo hyper! but people anger me. (tom and ashley ='(  ) muahahhahahahahhaha -tayyy
0,USER me too
0,i always lost my gpg key when i need it
0,"USER I bet its cool down in SR, huh? It's not here. I haven't stopped sweating since noon when dad and I were packing"
1,USER u should have used a straw.
0,"I have my car back now, thank goodness. The garage didn't charge me, but did highlight Â£570 worth of other work that needed to be done."
0,i can't believe that Archie and Cook are already leaving the Philippines  will miss them! ArchuCook forever! <3
0,damn...I think sonic is already closed
1,USER I amm!!  my nose is just messed up
1,"feels like monday, so it's the perefect week. one day, and then weekend! nice..."
0,Working on : Shi Ji project
0,If only I was rich and could of afforded to go on the NKOTB cruise.
1,HAI TWITTERS
0,I need to find more Bay Area folks so I can network with local peeps
1,USER noted.  live long and prosper!
1,USER You work with Drupal and SharePoint as well? I don't see that combination often
0,"Only been up for like an hour, even although i planned to get up at 9! Had a weird dream...never found out how i escaped though"
0,"Re: drunk tweeting. I can't even drunk IRC, let alone drunk tweeting. IApparently I haven't lived"
0,Waaaaaaasup! Its cold and rainy here  big hug!
1,"Now knows why bottle service is necessary, lovvvving it"
1,"Just finished the final edit of the video....I'll be premiering ""Why R U"" on Monday, June 8th on 106 & Park! Tune in..."
1,USER here: URL ohh thanks! Hehe Lakers or Magic? Kahit sino. Haha Laglag na team ko eh.
1,USER You Looked as always Awesome At Cedars-Sinai Medical Centerâs âRock-N-Reel. I Love Your Style.  YouÂ´re Great
0,USER Thanks honey .. yeah I woke up worse this morning
1,USER Thank you!!!
1,just going to bed  ni-night xx
0,"am sick, i hate being sick, and the doc wont let me work because i have the flu... not that flu! just the regular flu.."
1,so. far. gooooooooooone.
0,Nicky you are at disneyland.. used to be my favorite place to be at..but now.. its not anymore..
0,got up at 10am... wondering what the day will bring...NO SUNSHINE for sure  ... me wants the summer back
1,USER Goodmorning
1,"Omg! It so windy! Yay! Lol thats what woke us up, was the sound of the trees"
1,21 dayssssssss ;; who's heard damed if i do damed if i dont hahahahha so goood  im happy now
0,"USER  Wasn't a avid watcher myself, but I hate to see a decent genre show get cancelled. Glad to see we'll get more Chuck tho!"
1,USER My turn? half asleep trying to stay up to watch movie oh and BOOYAH!
1,USER thx for the great photos on URL
0,Trying to remove a glass of Samuel's Gorge Shiraz from a light coloured carpet   Jeez that wine has a lot of colour!
0,i want my pup
1,bye guys
0,Working today
0,"If you're lucky enough to be around the special dad in your life, be sure to spend every second w/him today! There are so many who can't."
1,USER yeah I did thanks  you had a good weekend? X x
1,"I finally left Sea-Tac, on the way to my house at this moment. See you guys at NoMT tomorrow"
1,One more time!  Shaq responds to twitter fans from his 'shaqberry'   URL
0,Ugh Ryan Reynolds got married too!
1,New Moon actually looked really good
0,USER There in my hubbys car
0,Waiting for any takers
0,"USER I know... to me the point of the finale, the finale that made me cry for an hour, is officially lost.  I won't be watching."
1,sitting and having some beers @ bww with ross and seth
0,USER I do but I never get any response back.  jk
0,"just had some toast, hopefully that will make me feel better, the thought of going to working in a couple of isn't though"
0,After one drive-by shooting at one of our rentals two years ago I have to check this news every time I see it:  URL
1,just sharing my Chinese spare ribs recipe  URL
1,"USER FROM BREA: May part ka na sa story namin, ikaw yung micstand! Dandan the micstand!"
0,Starting to rain a little at the concert  hopefully it stops but it prob wont
0,Going 2 church phone died got this poop phone
0,Almost 2 more hours then i'm out of work. Time couldn't go by any slower.
0,"USER I'd like to chat, but I can't!"
0,ItÂ´s raining cats and dogs
1,"Good luck USER---I hope you get out there on the track, gorgeous!!!  Knock their socks off   Love ya!"
1,my gosh i'm twitter addicted!! help me
1,"finished preparing lesson 3, now breakfast"
0,USER I thought u were watching tinker bell
0,USER Because Cincy sucks  but I'm trying wakeboarding tomorrow at Wake Nation!
0,so sad about jon and kate
1,britains got talent  shaheen was AMAZING and flawless!!!  love it
0,On the plane. No upgrade  Ttfn URL
0,kind of sick
0,wonder girls + jonas brothers = o___O; why can't we have any other group besides wonder girls come here~
0,tired from work. but i wanna do something tonight if ashleys goes out in town i wont be happy
0,USER lollllll i hope he is! cuz thats just crazy. but he DID have a layover in chicago so i'm guessing he's really in ct now
1,USER USER USER u guys r tweeting entirely tooooo much for this night! Lol JK  tweet on tweet on lol
0,"USER Aw, lots of gingivitis?  (your hair couldn't handle how sexytastic you are)"
1,I just woke up  hehe
1,Salt-free lemon-pepper chicken turned out quite nicely.  Dana ate a lot!
1,Word to your mother! Happy Mother's Day!
1,"USER There's no link - we're playing it at the coffee shop, not online, so come in, get some coffee, & give it a listen!"
1,USER Washing not going to happen! Wait until the basket is full  believe I'm having roast something for tea! It looked pink!
1,USER  I used to just catch the train to Melb central and walk to everywhere from there. Got lost looking for chapel st recently!
1,"USER Love both those films. You watched Walk Hard a while back, didja like his cameo?"
1,USER there's nothing wrong with that. glad u had nice weather.
1,"Also, people need to stop complaining about The Sims 3! I think people had too many high expectations, it's still just a game and fun!  x"
0,USER damn you - i can;t get the game till october
1,Aahhh America  LA for the next few days. Getting ready to make a mess! Www.letsmakeamesstour.com. See you soon kiddies
0,Yo say a prayer for my boy Benedict Agostini... May God help you brother.  I hope you come home ASAP.
0,The Euro stores don't do Oilers crocs
0,Intimate acoustic affair with Mika at Le Poisson Rouge tonight! Sold Out
0,USER I cried
1,USER ola.thanks for following.word of warning.I tweet a lot.
1,USER not if I didnt see it pal.
1,krtv: USER  Great Falls got a Thai eatery two weeks ago!: krtv: USER  Great Falls got a Thai eat.. URL
1,X-Men Origins: Wolverine = very good
0,"Well,  so far at camp it has been  well inreresting,wanna go home but having fun.wish I had my friends"
1,When did your heart go missing !  â« URL
0,USER  but hoow r u ?
1,Ok I REALLY need to go to bed and stop playing around with Twitter adding new friends!! Hello all you new people
1,S. Darko. i bet its gonna suck.
1,Homee  now lets do some schoolwork haha
1,"USER Get outta bed, lazy bones!  I've been up for hours"
0,Trying to learn this twitter shit and getting frustrated
0,USER why is there no UK tour or tour dates?  (especially Scotland (A))
0,I ammm soooo drunk and I ate way to much carbs  I'm not gonna like me soon
0,"USER URL - Yep, I've been getting that a lot recently too."
0,studyinggg for comm techh :|.  whatt a boree
0,i cant find my itouch for the 64577 billionth time n i need it to sleep
0,USER cant find your youtube
1,USER who has great songs? haha sorry
0,USER I wish I could see it in DestroyTwitter  Any update on bringing the API thumbnail method to pic.gd?
0,my poor Bella teething sooo bad last cpl nights
1,There we go
0,Morning people! Last day of my holiday today. Back to work tmrw  It's a 14hr shift too!
1,USER looooove that song ^^ the beatles are beastly amazing
1,i'm up  .... it's friday.... YAY
0,USER you're so hurtful
0,Why did I ever start watching the OTTBs?  I just can't do it yet.    Somebody make me turn it OFF.
1,Its not knowing who you are its knowing who you want to be
0,Omg drama good thing for vodka y turkey sauge nice after soccer game jejjje.except allergies...
1,USER the thing about storm is it doesn't have wifi. It certainly looks cooler though
1,USER I'm home na. Eating my precious ICE CREAM. Haha! Brownie Fudge ala Mode!
1,USER she doesn't like u anymore. She's my friend now  ...love u kait! Miss u!
0,"USER Unfortunately, I think it's another way of saying ""haven't found crash site yet.""  Sad."
0,"The worldsbnot getting smaller, there is just less things in it  rip x"
0,Really wish I could see Eddie Izzard on tour  Damn the stupid expensive tickets!!! CAKE OR DEATH?!!!
1,USER a watch list or friend list would be nice
0,"Feel like hell, dizzy, loopy, nauceous... My head is pounding, from the Meds. I'm going to bed soon.  I'm no fun tonight."
1,Watching season 1 of Dexter......
0,"aww twiter i miss you.. today i'll post a little more.. i mea, after the movie theater..ahah soo coold here"
0,USER :O   That's a real worry. Maybe you should tell him you want to be good friends and work on it slowly?
0,"I am still kinda sad about the you know. Thomas leaving, but none of my friends like them so no one understands me."
1,USER not in many a moon but that sounds just the excuse to read it again!
1,"mar, im sure you will ur suprise  where is the sun people?"
0,"Half time and it's 1-1. Kevin Kilbane, what are you doing to us."
0,Leaving lv a day early. Got waaaaay too much work to do!!! I think I need a laptop with me 24/7 now
1,USER Good morning
0,I am soooooooooooooo bored!!! 11th hr on the train in the last 24hrs! Why is my school so far away!?! And why do i have no food!?
0,USER yes it is
1,Back to the daily grind
1,New Display Pic!
1,USER well done u!! Treat urself to a v well deserved massage
1,Retweeting USER: You are our Two Schooners community!   We've got a home on twitter now!
1,USER a nice massage! With massage oil  haha
0,Sitting in the hotel lobby waiting for derek to come back for me. He knew I would take longer than him to get ready so he left me here.
0,"USER: Okay, it's Tiananmen Thursday to mark 20 years...sadly  Here's the second of my blips; ya got me in... â« URL"
0,USER oh that's me  sorry
1,the internet will be the reason why i fail my exams this week
0,shattered! PWG botched his hybrid dolphin shirt order and sent him xl
0,thinking about how one thing can blow everything.
1,USER you need to upload a photo that is relatively small  Hiya!!!
0,USER URL - it is not showing
1,USER  Hey how is the Drone BPO sets going? Update me!
0,USER ick. that is sad news
0,"USER i should just scold them, bo ji to ask for more nachos & popcorn vouchers.  hahaha!"
1,had a really good time at megans house & the beach
0,Just had some news which means I definitely need to find a perm job  Anyone still hiring these days?
0,Crud. I spelled Babysitting wrong in last tweet. Sorry
0,Hey USER BYEEEEEEE   (I LOVE TILA TEQUILA USER live > URL
0,USER awww I'm sorry.. I'm definately gonna miss u
0,bought three types of cupcakes today from fleur-de-lys. i dont like the packaging tho! ruining the beautiful cupcakes  distorted i tell u!
0,"USER ah there is tickets... i'll be on a late shift tho, so can't do it"
1,what was it called? i need to know! i fell like a coffee now  excuse me
0,oh no she's awake :O fuck ing cat
0,I have sore muscles...
0,USER ashton!! what's that? they're scary
0,has gingerale all over her keyboard.
1,USER oh and tell lukeyyy he better come tomorrow too
1,You should be proud. I just changed my DL address for the first time since USER & I got married. That was four moves ago.
0,Me = lame even tho i'm out.
1,hates the weather.. work then...
0,Damn i woke up late and forgot today the bus runs every hour  i'm finna be late for work .. Not good
0,GM filed bankruptacy... a stupid transition from General Motors to Government Motors...
1,"oh thank you.  you make me laugh, too.  I love you <3 <3 <3"
0,i have four blisters on my hand now  ugh.
0,USER & even in my dream I still felt so bad cuz I know ur married  & the dream was oneadoze dat felt so real I woke up sweating
0,this cough is killing meeeeeeeeeeee
1,Oh joy. more monkey Island games! Finally
0,Friday in Hangzhou with not a pub in site
1,meeting with our youth pastor to iron out some things for our Do Hard Things summer book study!
1,USER I can totally picture that now. You're Painting the town with sass I bet
1,USER just in time for the new 2010 collection
1,"USER lol, I gotta cheer for the Magic just a little bit. That way I wont fully betray Dwight"
0,Watching tv. Thinking i might go to bed soon. I've gotta get up early in the morning.
0,F1 chinese Grand Prix a WET race .....
1,Watching recordings of HOUSE.. I LUV this show
1,"USER Those are all extremely helpful & also amusing. I think she will like that last, or maybe the druther, best."
0,Nothing like finding out your child is sick right after you leave an event.    Sorry UUs...
0,USER i sowwy.  im sure he's more than proud of the person you are thou!
1,so i'm praying that the cab comes to nashville on their headliner
1,"USER def my favorite actor everytime you're in a movie i gotta see it. you're handsome, its also the personality in your roles  ~Bree"
1,USER mamma mia is a very very nice film
1,USER wah thanks very much
0,"is in Arizona, about to go shopppinggggg. it's so hot here tho"
1,Morning twitter world
0,I'm hella maad right now.. smh blacK ppl don't kno how 2 act shit got shut down
0,I don't feel very good  What is everyone doing today?
0,I think my keyboard on my blackberry bold is wearing out.  I've only had it since jan 1st!
0,"USER unfortunately, they look a lot alike, I always have to spit the coffee ones out"
0,USER I knowwww! It was such a great movie and adorable and now I want a little dog
0,has a sore throat
1,Is a beautiful morning here..a good start to Friday
0,MATHS EXAM TOMORRRRRRRRRRROW
1,"USER Thanks Joel. Yes, 2 girls. I Just fell further down the ladder"
1,dNishabanisha1 omg  you did tweet me!      I don't feel like studying... :-/
