1,*even* i meant. trying to get a hang of typing on my BB.
0,"Ugh, I want to rent a movie on iTunes - but all the iPhone upgraders are killing it"
1,USER Morning! I wanna be like U when I grow up
1,USER I'm glad you enjoyed the A&M MOVE event!  I did too! Great to see you! Glad you finally got some sleep in a good bed! ;)
0,walking around in the same haze... losing time in these strange days
1,USER <333333333 love you!
1,lol black dont crack and white u gotta light right...ha...snl is funny...NOT..yea it is tho
0,USER  It's probably one of those things where you sign in and the system sends an auto tweet even before you know what's going on
1,USER You were AMAZING John! Haha when I saw you I was freaking out
1,USER Ahhh... Complications can have all sorts of ramifications. And can be lots of fun.
0,Ended up dropping maccy off at Next Byte coz everything me & USER tried didn't work  will be computerless til at least Tuesday.
1,"USER Oh, thank you very much"
0,@ JFK International Airport URL
1,at work looking over live search maps
1,"Going home, see you at night in local time"
0,USER Last time I tried the JAT I couldn't even get two chapters in.
1,LINCOLN TUNNEL<3 i love new york so much.
0,Supposed to be having a drug test but I'm having performance issues.
1,USER really debby....ive had that song stuck in my head all day..what a RANDOM song to have stuck in ur head
1,USER nice magazine   if you ever need a fitness photographer - URL
1,USER  did you ever tell her it was really you :-P ?
1,I'm trying to make chocolate chip coockies
0,trying to put a pic on my profile but it wont let me omg!!!!!!!!!!!!!!!!!!!!!!!!
1,Getting ready then going to open mic night with Rachelll
0,USER URL  --> the link to my pictures ... some are blurry
1,"USER Wow, you should write a big sign and run over with it"
0,I've never been this upset to see boobies
1,USER is such a cool guy..  a USER guy
0,is confused and lost in thought..
1,USER I can tweet u now....yay me *happy dance*  x
1,What you up to then?
0,Scanner still nog working... *angry* Maybe I should buy a new one.. Even though I don't want to..
0,USER report me away! getting kicked out of school sounds like a pretty attractive option right now. seriously.
1,In class haha
1,USER Hey there girlfriend...hope you have a great day....with lots of coffee & music!
1,USER That insta garden looks great! Slowly building up mine
0,Way too much liquor.
0,"USER that sucks.  will i be online tomorrow? when im at the airport, yeah. (:"
0,controlling the throbbing pain in my head
1,"USER USER -- thank you! don't worry tho, just a minor setback.."
0,"USER Hiya, sounds like you're not having fun"
1,going to the buffet with the sis & momz ... shud be funn
1,cannot be assed with revision. go failure
1,i just laughed SO much watching all time low videos
0,"I just hope I can find my focus repair manual so I can attempt to fix my window w/o help though its supposed to rain all day,Ugh  fck this"
0,SOCIPSY paper. I wanna eat Marty's cracklings
0,USER Did they leave me out on purpose!
0,Nooooooooooooooo!!!!!! School today. But the worst part is that I wont be able to tweet troughout the day
1,USER cant wait for my tickets to get here
1,"Only allowed 140 letters. Had to drop a ""p"". Haha. Don't judge me."
0,wow our camel rides are now cancelled
0,USER wish I sould be any where close to your shows   Pls come to South America!
0,is not amused by the Hole 'reunion' and is clinging on the vague possibility that it's some kind of hideously mistimed April Fools.
1,USER Hello Ashrah! Hope you and Zahar are doing well!
1,USER is a bomb story teller.... lmao
1,"Finally leaving gosh, probably just gunna sleep until i get home"
1,USER gone to the brite side for a new toy.  enjoy
1,URL  - seems you can bully into getting the peace nobel
1,USER YESSSS      NO SERIOUSLY GET YOUR WORK PRINTED AND COME AND SHO.
0,"USER Yes, Dr Strangelove was great! S&S are showing so many things... Wish I could see Lyon's films tonight but I have to work"
0,Is still hungry after subway sandwich.
0,looking for someone to hango ut with
1,is hanging with umma and Hae
0,Right back to U!--> Gratitude hug> USER & to USER USER USER USER USER USER USER USER
0,Wishes she had some chocolate
1,is over it.  URL
1,URL - best friend got the seventeen mag job
1,"ending my evening on the best note.  i will love you forever, tweets."
0,"When I'm done cleaning, I'm never touching another fucking blind again in my life. It doesn't help either when there are ants by my feet."
1,just got a ZOOM LENS HELL YEAH
0,"18 days left for summeeerrr, I cannot wait until then."
0,Covered in flour. I forgot how agressive Josh can be. Haha
1,"A man falls in love through his eyes, a woman through her ears."
0,Grandparents are in town.....should be an interesting weekend....they don't like my puppy
1,"I don't this well, so Tom speaks for me"
1,decided to stay another night in melbs
1,On the phone with family and talking about stuff
1,USER Lol at work gotta keep myself busy.... lol And what bikini pic u no likie  haha
0,USER HAHAHA...WELL ITS REALLY WATCHING ME...IM JUST NOT GOING TO SLEEP B/C I HAVE NO JOB OR SCHOOL UNTIL MONDAY
0,USER damn at work
1,<3 no day but today
1,"Wow... just hit a century with my followers... Meagre, I know. But significant nonetheless"
1,Tweeting directly from my blog... how cool...!
1,URL - kaylah &the vest i sew buttons on
0,The TV won't turn on  And it's brannnnn new.
1,USER thanks.
0,"So this is the awesome weather you've been keeping from me, sleep pattern. Beautiful. Now off to chat with mum from the library, indoors!"
1,USER Like that???
0,USER - yeah..  He deserves someone better..
1,got 1st lesson as a self employed golf doctor in 5 minutes
1,"USER USER Sure why not  Im far from typical, but in this case I am confident yes. Thought the challenge was scaring me?"
1,"USER Cold tile in my case.  My mom was going to throw the rug out, so I saved it and put it to good use."
0,"USER I pretty much died when I was running errands earlier. I was like, wtf?! IT IS APRIL. NOT JULY.  lol i had to check the month."
1,trying to suuuupress the tooo fresh feeling I got  - USER
0,Also waiting on a reply about a house that we really want to rent......(she says whilst biting her nails impatiently) xxx
1,USER matthew wants you to bring him some of that
1,USER I have my big ol cup of java  My day is looking better
1,USER chillin waitin for Napper 2 call me
1,Starting work tomorrow
0,USER get days like that myself no worries..Twitter is strangely  A firm part of my life   Ambivelent x
0,"Left the dentist, my teeth are in some pain now  got some chips an guac from chiptole, gettin gas then goin back to pool .."
0,the owner of tiny's subs on camp plenty just died
0,When USER is on tell her i FUCKING LOVEE HER <33I dont thihnk ill be on later
0,WOW. My teacher just called me a skunk cuz of my hair
0,USER we didn't get rain since more then a year ..  I want a storm  too
1,haha i love my cousin
1,shoutout to USER - *waves* thx for your comments on my blog.
1,"Wow this socal weather is weird, the rain stopped and the sun came out.  I got my sunroof open and flying up the highway, Lerdo Hwy 1mil"
0,my stomach hurts. i need to cut down on fast food & a bunch of sodas. they're tearing me apart!
1,USER so did you enjoy the little kids slapping your arse ;) shh the fairs amazinng thankyou
0,Its cold
0,Semiannual yard/house cleaning day. How's that for boring? And its for a party that USER and i aren't even invited to.
0,does not want to drive 10 hours back to Amarillo!!!  But has to  Will post pics tomorrow guys!
0,USER so i wasnt invited for breakfast????
0,Feeling sad for selling my Corsa  But I think I`ll have the same fun with Punto though...
0,doing hw while everyone is at the party.. Story of my life..
0,USER We had more issues at around 3 then 2  I am so sorry- that makes for a difficult night!
1,USER UR most welcome Amy!  Have a great wknd!
1,Exhausted. Need some rest  good night all  xoxo
1,so glad that my phone can play videos already
1,Loving the people on Ustream atm. It's brilliant
1,USER you should follow me and my bro USER Were ur hugest fans
1,jake stinks
1,USER  URL  heeeeyy pleasee tell me what do you think bout it!!!! please please please!!!  ;)
0,"I wish cool people lived here. I want to have a bad teen movie summer where they sneak out and laugh all the time, and go to the beach."
0,Root canal calling in the morning...
0,USER i wish i knew what it meant to be locked in... im so out of the loop
0,USER it does kinda hurt.
1,I'm eating cheezits...with TWO flavors!  sharp cheddar & parmesan. :-D
1,off to the boyfriend's friends birthday thingy  always on the go
1,"USER Hey nattoh looks funny. And it's even vegan. I think I'd like it, it sounds yummy."
0,Not feeling so hot  pretty congested and have a little cough. Prayers would be appriaited cuz i can't afford to get sick again.
1,Good morning Tweethearts! Happy Mother's Day to all of the moms. You have the hardest job in the world..u r appreciated. Be blessed!
0,isPlayer Has Died! Sorry
0,USER
0,So bored in cooking and ill  xxxxxx
1,USER how bout' no
1,"At the mall with Jaybee, Kulak nd Don  I LOVE THEM ALL."
0,USER nice * my videos  broken
1,USER amuse toi bien
1,"HOLEY shit, you twat!  i love youuuu ."
0,Have to take dh to hospital today due to abdomenal pain  I have 1 hour to clean my house for my mom....
0,bored as at home. grounded for the night
1,USER plus he iiiis paid to make girls panic while he sings.
1,"USER  They are cute. I think I would go for 'Glamour Robot, Pearl' -  could use her as Jewelry Stand - she's already used to pearls"
0,sweating
0,whut the FUCK is that smell. i hate public transport.
1,"USER heyyy that's what im doing right now! i wish i could help, but im pretty sure i just failed the test i took on it.  haha"
0,USER Me too
0,"USER - i know and i forgot where the came fom  good news though, new site's coming soon, hopefully its better than xfrs#zrt blogger!"
0,USER NO! Please don't do it Jules  what's a conch?
1,"Making ""MusicInOurSoul"" video this week"
0,((SIGH)) I SOOOO AM NOT IN THE MOOD FOR TODAY....NOPE NOT AT ALL.
1,USER congrats! i love you! happy for you sweet pea
1,I felt creative and made miso oatmeal -- it was good!
1,USER I'm using multiple account for different groups. At least it's a nice feature
0,my car is about to be infultrated by projectile vomit
0,Love my Mac but the Apple Airport Express sucks!
1,USER *hugs ya* Hiya sweetie!! Hows you? Sorry wasn't ignorin ya was drivin!
1,USER haha I was up but I wasn't doing hit  wandering around aimlessly more like
0,usher is getting divorced
0,"just finished watching 'ghost blah2 girlfriend'. It's funny  jaah, back to BROKE time"
0,of course the car starts fucking up  when I have plans to party  fml !
1,"USER So I'm told, he's becoming a regular"
0,Dammit my camera has no batteries.
0,Off to bed now. I sure hope I can get some sleep...
0,geez USER  you've alread seen DRAG ME TO HELL too ? fuuuuuuuuuuuck...this is why i miss living in LA  how was it ?
0,"USER A bit, yeah, thanks.  Missed Fizzy and Chris for the second day in a row, though."
0,USER no mt. dew slushies for us this week
1,"havent got my survey questions the market research lady was meant to send i can tanswer them if i dont have them,off to basketball to win"
0,its too nice outside to be working
0,"And great, now I have lost Marvin my blind cat. Mom didn't look what he was doing this morning and now he is nowhere to be found"
0,"USER Ours are never very impressive, but yours are"
0,Ryohei's blog translation 2009.06.04&07: weekly update!!just two entries this week  both about soccerseems lik.. URL
1,"USER Good morning!  I hope you called me something good when you said ""Bonjour."""
0,"Holy cow! It's 8:00 pm, and I'm ready to hit the sack! So much for a romantic, celebratory evening w/DH"
0,USER 3 way and my crush ended today
1,is so happy today
0,I get an instant sad face when I see a little kid lose their balloon
1,USER Morning...besides the new flood hope all is well
1,oh yea!  ? URL
1,My phone died last night.. And i miss my stef
0,USER is leaving houston tonight
0,"USER I wasn't quick enough to shut the door so it stays inside, it's too fast for me  Sneaky little shit."
1,USER BWAHAHAHAHA.  All too true - at least the ones I dropped this week.
1,when can i ever do a barre chord???
1,"USER you'll have a drink bc the race is over...I'm telling you,it's an addiction that leads to Elvis presiding over our wedding"
0,USER I'm not a big fan of the rain cuz they cancelled like our school sports day
1,You Rock!!  USER
1,USER great photographs! saw you guys play at the westjet street party. short set but awesome nonetheless
1,USER hey kathy URL <-The Book Jill Read  It's a good one...a must read   It took me HOURS to read
0,"Was gonna take the canoe out, but it's not very nice out & we have a lot to do  gonna do errands & hopefully some more planting/gardening."
0,"Just brought credit.  Gah my shoes gave me sores on my heels, they're bleeding and hurt  Fck you shoes!"
1,USER hi benton! how are u? When you finish your new song? I can't wait! goos luck
1,USER ty for the follow!
0,Just eat something and now I feel sick  hopefully we will open soon I am watching fight club!
0,"USER omg, i know the song and like, 3 moves from the dance. it's awesome. haha, the dance thing was on dc last night and i missed it!"
1,They're watching 27 Dresses
0,USER Come back to the WHITE SOX!!
1,"USER Yeah, I knew Anjali was pregnant right away. Well, congrats to her."
1,iz happy i don't have to go to school this friday
1,USER haha thanks  that was nice
0,USER apparently the update released yesterday-ish fixed that
1,pushing daisies has returned... this makes me smile
0,"Ok, I'll drop the fun for a second. It is fucked up that an abortion doctor (George Tiller) was killed at a church. God, insane people."
1,USER thats deff GAY! haha
0,Funeral  very bad bad bad bad times....
1,"USER love the new icon, you look really pretty"
0,i miss my friend amangda.. dis is sadd
1,"USER ok....i want to be that lucky! (actually, I have been run over by cars twice in my life, so maybe I am!  )"
1,USER I was just thinking the same thing!!! How was ur day out???
1,New hair colour!!! So happy and excited going to show the world!!! - dammit can't find my camera lol.. When I do the world will know!!
1,"USER I don't think ""Go"" is strong enough. It needs some ""FECKOFF"" Cat"
1,Dance party anyone?!
1,Good morning all  Been at work 3 hrs so 4 1/2 to go then the weekend starts for me yaay. Hope you've all had brill Fri night/Sat morning!
1,So thankful for my family and friends
0,USER Aaaww...well you'll look faaabulous when you are done. I still need to get my hair and nails done
1,SOOOO HAPPY DIVERSITY WON!!!!!
0,"dolled up, prim and proper just to be sent home for looking so pale and sickly. this isnt fair, i can still move despite a 38.1 whattt!!!"
0,everybody's getting there hurr did i want to!
0,"g: >>4558858 Why so rage lately bro?  You usually are pretty chill and seem pretty nice, but today you seem pretty off"
1,does USER want a twitter war :O. i think soo  MUAHAHAHAHHAHAHAH
0,"USER im beginning to get too big for mine, and i dont think they make any that are any bigger"
1,USER Happy Sunday back atcha!
0,"Morning,took kids to school,taking dogs for walk then normally I'd go back 2 sleep but I'm back @ work so gotta get ready"
1,the packing begins!!!!!! feeling good
0,My family's dog died
0,I don't seem to have a confirmation email for w-tech. I hope I'm registered!
0,USER
1,"It's Friday and I want to go out, but I have to wake up early and hop on the End of the World Train  (Tren del fin del Mundo) tomorrow."
1,USER Any mention of beach + vacation sounds exotic to me
0,USER noo.  but they're in the baby aisle by the diapers & stuff.
1,USER sicilian way...of course ! lol..but i spray them will olive oil then put em on the griddle..like you said ...less oil
1,"USER Awww, have fun!   We'll miss you!"
1,Walking around the hotel at 1 in the morning
1,"LOVE THIS  USER ""Enthusiasm is the mother of effort, and without it nothing great was ever achieved."" ~ Ralph Waldo Emerson"
1,JOnas brothers are doing a cover of I'VE GOT YOU by mcfly on their tour XD Can't wait to hear it
1,USER I don't suppose you're allowed to do this inside homes? Say.. the St Regis Residences Singapore?
0,USER The sky is cloudy here in Holland
1,USER Thanks for the tip!! I love mac lipglass  xoxo
1,"USER The cake USB hub is crazy!  Are you tempted to press ""add to cart"" and ""checkout now""?"
0,"USER Might sound like a stupid idea, but maybe try reinstalling those apps that aren't working properly. Just a thought"
1,USER ya.. just look out 4 a new one. if u get one u can sell the other one ;)  oh take a look at kwick
0,USER sorry to hear that
0,"I live in Melbourne,why didn't Hamish & Andy foist money upon me?"
1,We got dugg!  Vote more   Top Ten Seattle Cupcakes: URL
1,USER Stavros Flatley all the way!!!!!
1,thank god
0,I want to be sitting in Hollys lounge room too.
0,"ahh...sick again  way to go, swinus."
1,USER cuz you're a model of the photoshoot !always nice ppl does these things
1,Can't wait for Vegas! loved the Hawaiian guy with the unpronounceable name and tap girl and Mia as always  #SYTYCD
0,USER Seriously?? Thats so sad
1,"Morning folks.. it's happy Go Monday in St. Louis, Missouri -- Have a great day.."
1,"It's a beautiful day! Slept til 1:00, setup new wireless router, getting ready to assemble new grill so we can cook out later. Good times"
1,is chillin with Misty May my dog..   She's a rare breed..
0,I hate running late 4 work! No time to stop for my diet dr pepper this am
1,USER classic!  I email spammed you 2.
0,USER well I wanna know y u didn't reserve ma hotel 4 N.O...lol...u dnt want me 2 go
1,USER If You have HALO: ODST you will have an invite to the beta multiplayer version - just thought you'd like to know
0,he hates me  i just know it DILLIGAF NO
0,No coke. SHOCKER.
1,USER I'm going in! And thank you!
1,USER ohhh yeah<33 i'm completly in love with these ones
1,"USER sadly, I did not happen to be French as a child. or as an adult."
0,I haz a sad  kittehs are all gone as of today. *sniffle*
0,"USER seriously, the fans, and even cast..we are all speaking it just seems as if they can't hear us"
1,At the Seminole HardRock hotel for dinner and some nickel slots!
0,"USER my cousin in s.a bought his wife a Porsche Cayenne 4 her bday, remind me again wat am i doing overseas?"
0,USER no chat for me  im on my mobile
1,USER get some sleep so we can have dinner and u will still have time to go to work princess
0,wishing i could fall off the face of the earth! Why does school have to be soooooo expensive?!!
0,Sigh. I wish I knew more Japanese Finding images for these rare movies was almost impossible.
0,"USER for you the hand gestures are completely over, this is just because it is you.. sorry i didn't wait for you today babyface"
0,"i had my chance and blew it, now i have to suffer the consequences..gnite tweeps"
1,Hey! A loja agora tem twitter
0,Still throwing up a lung.  Might have to go get soup.
0,USER ooc yes....
0,"Omggg, i need to stop eating and start doing cardio  - URL"
1,USER I plan to scribble all over it with markers of at least five different colours! Fun!!
1,USER Very cool! Good luck!
0,"search, check, nice. mms, check. copy/paste, check. video...? video...? VIDEO??!!! noooo...  Choppy, low res, I don't care, PLEASE #iphone"
0,may not see pwnage tonight
0,Dinner time lack of food
0,USER i've been studying since 2am  1 more week anna!
0,damn I hate Danish error messages in visual studio  wonder if it's possible to get them in english....
0,USER thanks .. I really need to get my head into study mode! I get the feeling the CISM is easier than the CISA so far
0,Just had the worst dream of her whole entire life
0,back to college for me now havnt had any sleep very tierd! hope its nice and sunny 2day
1,USER oh really  why is that?  hmmm
0,USER but.... but...  i wants huuuuuuuugs. #squarespace
1,USER cannot wait until half blood prince! good job!!  x
1,USER if you figure out how to get streamer to work let me know
1,"has an amazing suntan after 2 days basking in the sun AND getting paid for it, result"
0,Last day! Sitting at lunch in Malibu. 17 Miles to go.  gonna miss everybody. Experience of a lifetime! Ps registering for ALC 9!! #ALC8
0,Ah I am now in da hood.  Funkytown between 16th and 22nd on Oak Park in my lovely Berwyn I'll.
1,I'm excited for E3 this year! Check out all the coverage at URL  It's gonna rock!
0,USER I didn't get anything if u did
1,Installing The Sims 3. Doing homework tonight. And YAY! Dad is home again!
1,you wont have a character if you dont have enemies
1,prince harry's in new york to play polo... im thinkin im headed up for a visit
0,USER Why?
0,USER not the one ailment that wine won't cure! i'm sorry. that's wack
1,with dana &nd tianna! hope everyones having a good weekend!
1,USER you enjoy the party tonight
0,USER aye!!!! I want some of those songs! But there isn't any way!
0,USER i may not see u this summer  out of money
1,mommy is home now! (: going 2 get my hair cut & trimmed.  and then getting a birfday card for a partayy. <3 cyaa all later!
1,Nortel ( My ex company )  outing and other function pics  URL
1,"strawberries for breakfast, yay."
0,i am a lil mad i really wanted that phone
0,Good night twitter friends - I'm nodding off at the 'puter
1,"Bought one top  didn't have time to try it on, so fingers crossed it fits. Was v pretty though. Saw a couple of purple dresses that liked"
0,"No!!!!! I recorder it last night, lol O well, will still watch it tho.  X"
0,USER Oh no!!  I'm in Sydney for IMATS on the 12th!!
1,USER your welcome
1,"didn't like it. then again, i liked ""Australia"", so... yeah..."
0,aaah...have to learn for school  english test tomorrow !
1,USER ...Yawn is it that time already!
0,USER not sure if you're a leno fan but last night was his last time hosting the tonight show. Tear
1,USER Just wondering what data you were using to calculate it
0,I'm crossing my fingers and hoping that this copy of Sims 2 works...last copy totally bit it hard.
0,I'm really bored. Like really really really really boorrrreedddd. I wish I had internet on my phone
0,USER URL - flouri exei mesa??egw thelw mia gwnia na mou krathseis
0,Good Morning. O Globo tells me Katia B will be singing today at Copacabana Palace. A bit too early. Won't be able to make it
0,"so close, yet so far...had to turn around"
1,thanks haha sana.XD pressurized ka... wag! easy lang dapat.
1,"USER Makes sense, if you're comfortable with strangers."
1,USER what list? Where r u? Make me a sandwitch
0,USER AW MAN I NEED THAT WHITE CASTLE!! None in TX!!
1,"at home, with my babys  we are making photos and laughing!"
0,i actually survived all night in my heels! oh god the headaches already kicking in
0,chillin' waiting 4 my puddin' pop 2 come home! I miss her
0,USER because I wish it were
0,just had a bowl of bran flakes and is about to ave a shower and do revision!
1,"USER hi, saw your DA page pretty good"
1,USER O oh! I can feel the  'does size matter' debate coming on here
1,"USER I lost a $50 once. that sucks, hope you find it"
0,"This might be a starting of a bad day, And bad days lead to bad weeks!"
1,Is actually stoked for a Monday  (and going to bed now!)
0,"USER I can ask around about the XBL cards, as for the Mac Pro, I just got one last weekend"
1,USER I'm going to the v-fest in mtl  and I can't wait to also see how mtl looks in the summer.
0,USER i wish you luck. Mine was in production for over 2 weeks
0,Out of work finally! my fingers are hurt..
1,"i met kitties and puppies. so cute! yes, im in the pet shop."
0,I hate it when United lose
1,USER yes you may!!
0,Going home but will be back! After I get groceries and stuff
1,thinking i am going to go fix some brownies   they sound yummy!
0,NOOOOOOOOO  Jonas Brothers Youtube got suspended.  I hope it was not cause of Joe's video.
1,The new view from our deck  Beautiful! - Photo: URL
1,USER really!?!? coooooool
1,Got back from... thingummy. Work. Yer.
1,USER you were wearing pants right ha ha  JUST KIDDING
0,"Massively cracked vaio screen  Is it viable to get it replaced, or am I realistically looking at new machine?"
0,I'm looking a film: HANNAH MONTANA THE MOVIE. I DID LOOK IT IN THE CINEMA BUT NOW I'M LOOKING ONLINE sorry miley  but i have to see you
0,No dreams last night
0,no one is signing up to come talk?  the lighting on this webcam sucks anyway...URL
1,Such a good time tonight!!!!! Gnight all!!!!!!!
1,USER Whoa! Cool. Such a gr8 time. R ur pics online? Went against Docs order but I know I'm healed.
0,I did that once
0,can't fall asleep.
0,This ALWAYS happens to me! Its usually hard for me to just walk into a store to buy shoes. I end up havin to special order them! Sucks!
0,"Full periods , tomorrow."
0,USER She probably does hate me... most people do... because I suck... you said it yourself!
0,ohh s**t... drop by 2  60. articledashboard.com
0,today was such a good day. my and my homiiies in dance ate everything with salsa. so funnny. now my stummy hurts
0,Wanna play
0,USER yay i love swimming.. i use to go swimming alone.. but now there is no place to go
0,USER *sigh* I feel sorry for her condition and you having to deal with it
1,USER you're so sweet.. taking in an abandoned kitten like that
0,THAT's good thinking!      U.S. releases secret list of nuclear sites - NY Times:   URL
0,"going to soccer game, in the rain"
1,"USER I love seeing how much you get for what you spend, girl!"
1,USER wow i only just figured out twitter. how exciting! how arre youu?  xxx
1,We do have some Thai weather here in England though
1,The Obsession Over SHAMWOWS Is Hilarious  Ha! I Bought My Uncle One!
1,USER of course  I know what its like to lose a pet my kitten just got taken away from me my ex moved out and took her  from me
