1,*even* i meant. trying to get a hang of typing on my BB.
0,I think I know why I cant sleep lately....I want some DryIceCanKill
1,You guys HAVE to go to this site!  URL - UNLIMITED FREE RINGTONES!!
0,"USER Also, I don't have Green Lantern underwear. Just Silver Surfer >__> And Spider-man >__> My sister bought BOTH for me."
0,up from my short nap (booo) now finally taking whip to auto-mobile hospital  lol
0,waiting for my rancid box to come in the mail
1,"got alot of videos & pixs, im going to make a youtube page so ill give ya the link 2morrow. ii* got good videos to"
0,"Im up and awake finally, dont wanna b tho  xx"
0,FRIDAY!! I gotta work tommorow tho
1,Fun fun night with USER USER USER and of course the one and only USER
1,Off of work early. Late night grocery shopping later with mama
0,USER how about I'm just going to stay home from now on.
1,USER That is so lovely! I will endeavour to make it a nice experience for my patients in the future
1,"To all of you, my friends, much love to ya!!!"
1,I HATE YOU LEXI
1,USER i'm finally opening pocket edward up tomorrow so he can watch the vmas.
1,"USER Hahaha, I'm a rockstar now ? Thanks, just stating the common sense. Read your comment, and made my response too"
0,i am really stuck helppppppppppppppp
0,USER I really hated doing it Lisa  You know I'm not one to give up ANY of my sites. I just couldn't handle it anymore
0,Had a great week in London! Now back at work in Istanbul...
0,USER no I was in quite a bit of pain from friday night I was going to go today but weather is terrible
0,USER no money then no atlantis  i really wish i could come i feel in my heart that im the biggest fan of you love you xxx take care
1,USER if they're not catholic they can apply contaceptives ;) problem (boredom) solved!
0,USER...... i dont know every thing
1,"USER did u hear this mornings round? done for now, but who knows, maybe ill get her to fuck me outside ur doorway"
1,USER any plans for them to hold one in Ireland ?
1,I actually had a pretty good day  who knows what tomorrow will bring!
0,Great. BlackBerryOS 4.5 software is on my phone. BB rebooted. Has been at a white screen with the hourglass spinning for 10 minutes now.
1,pick and choose your battles wisely  that's the secret to happiness even when everything around you is relatively chaotic and unfamiliar
1,"Good day my people, my community, my village! I know its raining at times today, but its healthy. Renew the soil(SOUL)."
0,t.v. isnt working supposed to storm alllllll day
1,"Bad head and not from drinking - fantastic night with the D'arcys, it was so worth all the effort"
1,preface is done...the rought draft anyway.  i may have a new career ahead of me.    it's not too shabby if i do say so myself.
1,ONly five more days come on Jordon you can graduate
1,#f1 I thought boycott was something to do with cricket !
1,Help Jaime raise money for cancer research and she'll shave her head. URL If you cant donate ReTweet
0,USER I'm so sorry  But I was kinda hungry and I got nothing else to eat lol
0,USER - I am so sad. I completely missed ur twitter about the dingdongditch in downtown ATL. I would've totally been there!
0,USER  yezzzzz is very bad
1,Wow gotcha and best friends awesome. Well done results to come.  and dancing on ceiling to come
1,"kid is on the way home    managed to get 3 pieces well on way with sculpey today, but finished nothing."
0,"#iremember Pogs, yoyos, sherbert straws and Gogos at school. Man those things were go fun they always got banned"
0,i absolutely HATE having a cold
0,USER Totally.
1,USER ah i see.
0,D: D: maths scores were shucks asss ): im sad
0,"Just got to the crib, feels so empty with out my NANA here  Reading ""become a better you"" by Joel Osteen, feeling loved and lonely..."
1,USER Happy Anniversary to you and pete
0,home from california  unpacking and whatnot
1,"Good Morning! Getting ready for the ""Question of the Day"" at 9am (PST) then I'm going back to sleep"
1,USER As if your face could ever be lame! I'm glad ya'll had fun!
1,I am sooooo tired now. My feet hurt! BLISTERS! Might do it all again 2moz though  x
1,USER Change your picture mate
0,Is pissed off that I can't get updates on my phone solely because I'm Canadian...i'm dissapointed w/the fastest growing website around
0,Sexy lady- mc magic. Bad memories.
0,USER thanks for the link but I can't read it  English or French I can read.
0,i need a bigger dooney.  all my shit won't fit. HEY! that rhymed.
0,"USER aww, that bruise on your leg must have hurt.  it shall heal pretty soon."
0,USER How we can obtain that deluxe edition?  I think it was sold out or not? please a second release ;) . . . Greetings from Peru
1,USER woo! Good job I'm proud of you
1,USER  he knows me too well dont you USER!!
1,USER ohh girl its right around the corner  can't wait! oh and ur anklet should be there by tuesday
0,see i thought she blocked me from following her like Greg Grunberg did!  ..
0,Shower. Work in under an hour.
1,Tralee and Mike... IT'S YOUR WEDDING DAY!  Can't wait to photograph it!
0,Not another Monday
0,Guilty.
0,is sad. needs a hug
0,I really wish more people I know were on twitter
1,USER you're not that many years older than me! We're playing #getoffmylawnwars
0,I have a lot on my mind  & i'm on a one hour worth of sleep...
0,"USER Don't jump the gun with a tutorial, we need the actual jailbreak software first. I'm not so sure it's going to happen today"
0,"Sittin on balcony, waiting for english then maths! oh joy!  pot noddle for lunch? hmm i think so! x"
0,omgsh this rain is insane!!! wth it's supposed to be almost summer
1,USER Thanks you Felix! I plan on catching him this week. Will let you know what happens!   How's your weekend going?
1,USER DAMN! I discovered that the normal edition just doesn't have the 4 s4 episodes.. so I'm probably gonna buy it neway.
0,"USER No I can't  it's still for 599 bastards! I""m being fucked right now"
1,USER Ah but I have a laptop - Twitter in the sun anyone?
0,USER I know...but I lost mine
0,USER There was already a mellymonster.  So I am failsauce.
1,"""it takes a week, and with the doctors help it takes seven days"" baha"
1,USER Me too! Although probably these days records and record players are words that sound strange. Remember back in the day
0,USER: hahaha i thought ur body was aching after that. DANG i'm missing the head massage
1,My son did the chicken dance at school for World Day  And now he broke a glass in a pantry.
1,USER you asked for it!  URL
0,USER. Me tooooooooo *hunger strikes* I just got finished serving 4 annoying customers! Wtffff!
0,Cant believe the cardinals have given up the lead and Im sitting here hoping they can get it back.......
1,USER oatmeal is gross taste like doodoo and your welcome for the pissing
1,"USER umm, whatevs!"
1,now has a cold face from walkkng to the servo haha oh well the joys of living almost on top of a mountain
0,Watching Fullmetal Alchemist. This episode is so disturbing and sad.
1,"USER I think each style of beer is its own food group. Stouts, Ales, Lagers, etc. etc."
0,USER Oh my god. I love Carolina Heat! I've never gotten to see YMAEWK bc when they were supposed to play ATL their van broke down
0,"Gahhhhhhhhh, i feel so sore  Sleepova tonight :L MISSED OUT ON GROOVIN THE MOO D: CRI"
1,USER definitely needs a snip
1,will watch Boys over Flowers while writing down notes....
1,"USER either a movie set or gonna eat at Teds!! LOL BY THE WAY HAPPY SUNDAY, hope  your enjoying your day with ur fam!"
1,Just got back from SM Sta. Mesa with Dad and Tabs.
1,USER We're glad too!  SO you think you'll make it to one of the schools then? You have a ideal candidate?
1,USER
1,"Across The Universe is such a great movie. I highly recommend it, if you like The Beatles."
0,"USER *giggles* i donÂ´t really like family things, coz most of the time itÂ´s boring ... anyway with my family"
1,later I'm going to the hairdresser     *I'm happy*
0,"OK I just came from ""Charco Azul"", and It Was awesome!, now to do some laundry...argh!"
1,thinking about chris pine & listening to jimmy buffet
1,USER USER I could see Warren and Garth doing those.
1,"Just finished  organzing my paper work, About to wash my hair. gotta look pretty for this week"
0,Jay's last show in 2 minutes.
0,just woke up! looks rainy out  no pool today?
0,Its hard to tweet when you have to type on yourself
0,Oh no! The four core hostesses are down to three!  Hence why I'm working Monday through Saturday next week.
1,USER Thanks for making it a great party. And taking pictures too.
0,"USER HAHAH, my artworks are in my multiply. I haven`t drawn anything for 2 weeks  Noooo! CSB? I wanna go inside CSB!"
1,USER There is an important World Cup qualifier for the United States on TV at 5 - try to dial that one in.
1,USER Enjoying Rat Hole Radio. Great live performance there
0,bro is home. demoted to the pc. byebye macbook. see you soon.  hahaha
1,SO not tired. Updating my ipod. And burning him a CD. Goodnight
0,getting pounded by a tstorm in champaign
0,"...*arrrrgh* What a bad weather for a wedding  rain, rain, rain..........................."
0,Sometimes I wish the older ones didn't have to resort to donuts.    URL
1,USER I joined 6 Aug 2008! I beat you!
1,Good Morninggggggggggg ! Or Afternoonnnnnnn
1,Retweet USER tryingout tinytwitter on my smartphone so this is my hello world via tinytwitter
0,doesn't think she's going to cheer up for a long time
1,USER have you tried contacting USER? Maybe they can help you get it working!
1,"At the uni ahah in the ""bistro u""  slept during the past two courses. Thinking about my future death j-16/18 gonna be mad!!!"
0,URL Wanna go to the beach.. But still raining outside!
0,staying at home on her 21st  cos she's sick
0,still bugged by the flu
0,"Hahaha 8ball, I just got it. Yes or No. Like an actual one. I had one of those ""date balls"" I lost it during moving."
0,"USER It's regarding Lost! I can't go any further yet, cause I have 2 or more friends on twitter who havent seen the ep yet"
1,I'm happy because i lost 5kg in one month. I want 10 more
1,"School's finally finished, it kinda felt like today took forever. But it was a good day! The weathers sunny now"
0,Going to shoot. Im scared.
1,Definition. Bliss: When husband takes all five kids with him for weekly shopping trip to Costco. House is quiet . . . . . . .
1,USER you work so hard
1,USER le empathy  nobody is usually awake when I get home on Friday night
1,Sonny with a chance.
0,"woohoo! darn, it's so hot here in the Philippines.. and it's one of the effects of Global Warming.."
1,4 Sleeps til freedom
0,"Drinking Tea, learning French and dreading the next four years"
0,i want a makeover . . . anyone wanna play salon? lol so f'in bored. she's playing video games and wont let me play  (she dont wanna lose)
1,USER Ah.... at least you're in your right mind.
0,River Tame Flood Risk Management Strategy Consultation. Closes 10 August (Massive PDFs  ) URL Public mtgs next 3 Fris
1,"Really, really funny redo of Total Eclipse of the Heart music video. Some really funny shizzat!  URL"
1,"URL - Tom (: Bit too light, but stil"
1,USER C-can I~?
1,USER what took you so long?
0,"USER USER  ...I would've taken ranch, too!!!"
1,"USER I see , that must be quiet indeed then  Im good thanks  Looking forward to actually starting the day.."
0,I just got sad cause I was thinking there was another show the idols usually visit and realized it was TRL
0,USER  brb packing some to ship over to NZ. i had like 6 pieces last night!
0,Twitter Is Losing Its SPARK. .smh
0,USER  Really? That kind of saddens me a little
1,USER Ah. Then it *is* a sexual disfunction.
1,USER thank u I can always count onuto make me smile  x x
0,oh how I miss having a pet
0,"USER I'm not in a spamming mood, sorry  #springsteentalktomcfly"
1,USER we're real
1,URL - I also miss my best girl friend who calls me her guy friend
1,USER Bom dia USER <ï¿½==follow
0,USER will do  <3
1,USER hey you too! I thought of you when I wrote that up
0,hanna stopped talking to me again  i guess i'm just under the pet society level now
0,O2 just called to give me a better deal with my phone package hopefully. System crash tho  come on o2
1,"USER not quite - fyi the creatives gathering informally at Rundle Lounge tonight, St James Gate all week"
0,just walked in my house and my little cousin is having a sleep over and the are watching the cheetah girls 2
0,I have come to the conclusion I have the smallest boobs in my family and am a member itty bitty titty commity
0,"USER im sad because of USER hes still not following me, im going to cut all my hair off and eat a bucket of ice cream"
1,why copy paste when you can quote reply? it just takes two clicks
0,I hate having anxiety and intrusive thoughts
1,Adult swim and my pillow... Goodnight tweeps
0,USER Your older brother called you a douche  you gunna take that from him?
0,Headache!
1,USER ya know what...maybe...a very big maybe
1,Going to work today at the school
0,USER How come Rajon don't twitter? His momma don't let him?
0,Glad that many people used Target's Facebook app to steer donations. Sad National Parks & Kids In Need received the least votes tho  #fb
1,USER lol. The way you describe it I can hardly wait. Be sure to let engrish.com know
0,Shift 2. crossed into AL? Sunrise chasing us. Missed some calls
1,"Damn, sorry, fell asleep and dreamt it was KKR playing! Awake now"
1,NAP time   my favorite time.
1,eating sushi and watching prison break  life is good
0,"Sad about Ferrari, though.  6th and 9th."
0,Definitely ate the wrong thing tonight  Ugh
1,"USER hey, would you like to be a blogger for FamousCuteBoys.com? if so, tweet me back with your email address and i'll invite you"
0,USER I had the regular mochi. I just felt like it didn't contrast enough in taste or texture to be a good topping.
1,Wellesley for the night! Then home for tomorrow
1,i â¥ eloise !! ah. need to buy the book.
0,USER Congrats on 4K!! ( I want to get one.. but I am Canadian..  )
1,USER Agreed!
0,USER I've been up the whole time and I haven't learned a thing and I'm about to sleep. What am I doing w/my life? hahaha-fail
0,"Kirstie never replies to me USER , so I don't follow her anymore"
0,"USER I can't see your page using Firefox, it's just blank"
0,I just wanna go get Bruce Willis.
1,good mornin'
0,USER mdr le ptit bateau en plastoc ï¿½ la fin. We missed the fuckin' boat too !!!!
1,USER I hear ya Blair ... I'm chained to one as well
0,meditating on my plans for the weekend...gotta work saturday...
1,USER oww rivers are so calm and beautiful *-* ur lucky too!
1,It's Double XP weekend on CoD:WaW PS3
1,USER hey miley!I'm following you for a long time you're amazing! please can you follow me? please  Answer  From Argentina !!
1,"USER, your songs are nice!  i'm listening to them everyday. d-_-b"
0,"Ohhhh dear, I've been blocked by somebody  how will I survive? ? ?"
0,USER omg hahaah why arnt u followin me then !! nahjokin how did ur live thing goo hun gutted i cldnt see u  wens pull it out ?? xxxx
1,my boyfriend is with me.  I am happy
0,#infsum began today. i think if i can make it past the tennis stuff i'll be ok. but i have little interest in or knowledge of tennis
1,"USER Please go live, I'm so bored"
1,USER good.. I can't wait!  Mikka and I are coming to Cali to visit friends.. maybe we'll see ya there too!
1,hey send me your pic from your twitter profile in a ext to my phone
1,USER USER Thanks guys. Installing now!
1,USER That is great to hear!! Thanks Chip!
0,"I want to go home  This school is like jail... -.-"""
1,Giving blood.    They called me a squirter.  :-\
1,USER Can I come over too?
0,"Sam Worthington, has no Twitter."
0,"just finished watching HIJNTIY. I know, Im so outdated like that!  my fav scene gotta be when ben affleck proposed. thats all. not bad la."
0,Got cut early cause i'm sick
0,Im so hungry already and I still have an hour till I can eat.
0,"Stuck in an almight traffic jam in inverness, looks like it's going to add a couple of hours to our journey"
1,USER can she spell rivalsforever?
0,My iPhone keeps freezing and hanging  Hopefully OS3.0 tomorrow will fix it
0,USER thks it's freakin cloudy here.
1,honnor society on july 23rd with erin and dana  yessss
1,USER hahahahaha can't wait to see you
0,that sucks
0,i need a good idea... FAST!
1,USER i'm always nice.  did you get all the upgrades done? been good weather lately. hoping for more this weekend. Sunshine FTW
0,"USER yeah July 27th, I think. But it was reported that R might not go due to his busy schedule"
1,USER How can I help with that?
1,USER Happy bday cj for day after tomorrow hun have a great day  xoxo
1,Soccer lunch break
0,I want to sleep o j j is playing games in his iPhone
1,Hello all... wishing all mothers a very happy mother's day today.. & everyday... & Happy Tweeting...
0,"Good luck to Falkirk and Everton *thumbup* (via USER) - Oops, sorry Bairns and Toffees"
1,USER thanks for following us  you are welcomed to view some of your comics through our webpage url located to ur right
1,Hanging with lauren steph and mason. Reminiscing.   <3 Chrissy
0,bDule crashes often... and now does not connect to fb anymore
0,Eating lunch and then working on my paper till its done! But not feeling so hot even with a two hour nap.
0,My mouth is sore  its not very nice lolz watching top 40 lolz
1,Eating toast. Then shower and go purse shopping with Marena
1,"USER haha..it was a joke.  Some elbow grease and windex did get it out. Thank goodness, all proof of my stupidty is now gone!"
1,USER USGA's gotta keep up w/ those big ole honkin' drivers you guys hit!
0,URL    Very sad.
1,listening to Be with you - Akon.
1,"Well back and alive and kicking again, time for my 30th b-day tomorrow"
0,USER How was your yard sale? And sorry for texting you so late last night
0,"USER not bad, car is down again - Radiator sprung a leak"
1,USER Thanks for ReTweet.
1,"USER Honestly, give it a try  It's just like pineapple but a bit softer. If you don't think about what you're eating, it'll be ok!"
0,I never twitter anymore
1,@ taylorrhicks enjoy chicago..b new venue is always cool. You shine everywhere you go. I know who you are. In time so will everyone.
1,USER was there 2 weeks back
0,ohhh  i hate watching animal cops! it makes me so sad for the animals but soooo pissed at the idiot people!!
1,"Shower, eat, read, then sleep to wake up early for morning food hunt with the girls and drumline. Then after watching 17 again!!"
0,I'm feeling the worst BF right now! My BF has got a really important exam tomorrow and I forgot to send her a good luck message.
1,is discovering Bali. long time no visit  happy holiday people!
1,Just finished & emailed the long-awaited drawing for the medical project.  I hope it'll go through.
1,cupcakes anyone?
0,looks like no Moments show today   hopefully later this month or then beginning of next month.
1,WTH #liesboystell #liesgirlstell #3wordsaftersex BGT #twistory #thingsmummysaid #3breakupwords #jonaswebcast Hulu Desktop Bing Hi All!!!!
1,"USER ooohhhh... he did really good  so, can he come over and give my ""other"" pointers... he needs bunches of help in that area..lol"
0,I really need to go shopping for a fathers day gift... But I don't have my car!!  Ughhh!!!
1,"USER Well, we can't all be perfect."
0,the sound of rain would be amazing right now without all the wind
0,I'm jealous of all the k-8 students who don't have to go to school tomorrow!
0,"USER skittles candy has a phrase they use to sell it, it is ""taste the rainbow"" anyway can not use babel fish anymore  no translator"
1,Wedding anniversary meal yest. - first 5* proper meal out with wife since Rohan born. She did well and only checked her phone 80 times
0,Our trip to starkville didn't work out    o well...glad to be home!
1,searching for Miley Cyrus concerts close to my area! I would be so happy if there was one by me Miley! Please come by NJ!
1,USER glad to hear it.  hope ur good fortune continues into...latter today rofl
1,"this is awesome, twitting with gmail  awesome"
0,my parents have made the decision of going to Cornerstone
0,"It just hit me that I still haven't gotten over the fact, all though its been 3-4 weeks, that he's gone."
1,USER i think this solves so many things. you are set now. lucky  bitch
0,Getting ready and heading to Jersey to get two shots @ doctors  Grandmas after that. Text me.
0,Monday again  well atleast the race was good this weekend and Chris Jackson picked up that win AGAIN!!  Woo thats what I'm talking bout!!
1,USER ok xD fair enough
0,i'm scared.. somebody hold me please
0,"I think my iPod has gone caput, it won't turn on, even when plugged in. I can't live without my iPod.  #fb"
0,Going watch The Proposal with Claire. Cloudy day in LA!
1,"USER thanks, a canal boat trip, will get me in the mood for Venice in June!"
0,USER :hands you orange juice: Drink up and rest. I hope you feels better soon
0,"USER Wait, OMG WHAT?!! What is this rubbish about Jeff? OMG!!  I don't know what's going on and I feel icky lol."
0,Millennium MAXS Masters: Joy lost their 2nd game against Chilli Peppers 5-3!  Their last game in Preliminary Round is vs. London Shock! ;)
1,haha I love when USER does his mini rap in 'We've Got It Goin On' haha
0,"USER   I sent my donation to #Eric and wanted to put the banner on, but my avatar disappeared when I tried ~"
0,USER sadface
0,i miss hanging out with my boys.
1,USER mornin' mother of the dance
1,USER Sicily sounds like a cool place!
0,i hate my allergy  specially today..
0,USER USER i dont even remember how to play it
1,URL - me with no make-up  lol natural
1,Editing pictures.
0,panera ... i'm so hungry.   8-4 no food... a cereal bar this morning Phylicialicious
1,Passed the re-qualification  Now it's time for some working out followed by some phone calls. Or maybe I'll make the phone calls first...
0,"OK, I'm trying to use USER but they're not following me back, which means I can't DM them, which means I can't use their service."
1,USER sorry was just a song
1,"USER CONGRATS T!!! We're MAJOR! Shadoworld is the TEAM, Shadoworld is the MOVEMENT! Have a great weekend!"
1,So just tested the home Cinema with the concert of Sade (Lovers life) cool concert and great sound
1,USER heh - good point
0,Sick of john getting the crap end of the stick
0,"USER Ouch  Make sure to wash your hands well in case it's something on them, and rinse your eyes if you can. Warm water. Let me kno"
0,DANG have to work tonight
1,USER Np at all. Good way to meet new friends.
1,"USER lost is so good! it's very confusing, and i even watched it from day one! but, i guess ""lost"" just makes you lost. haha"
0,just got back from the footy... school tomorown
0,USER Don't beat yourself up. I've learned there's no 'set age' in life where you HAVE to own certain things (car/apt/etcetc).
0,I should go to bed but i am hungry and i can't sleep when I'm hungry.
1,USER that's too bad you can't make it. Hope you have fun in the garlic capitol of the world.
1,just a shout out to hayden krebs. he is amazing at life. makes school enjoyable  well done krebs.
0,finished patching audition but it's not allowing me to access! what's this
1,on the lake
1,USER:  Thats right DONT GIVE UP!!
0,USER I see you have some #oredev envy. I have it too.
1,Trying to finish a song. Shhhhh  - URL
1,"Well, time for rest. NOT! So much work!!!"
0,Just tired from everything..
0,I didn't get anything at sawgrass.
1,Way sunburnt but happy my phone works
1,"project natal lucks amazing, i cant belvie it"
0,Now onto crafts...making a scrapbook page while I wait for my honey to come home & intensely craving chips that I don't have.
1,"USER dude, your quizzes turn me into a 6 year old jumping up and down to get it right. Mental regression or something."
0,Iris by Goo Goo Dolls make me cry
0,USER with the slavic characters? he doesn't support unicode
0,USER Not enough info about what you get. We spent a fortune using a UK mobile to call a hotel in LA as we didn't realise.
0,USER hmm I'm hungry 2!! I want food!!
1,like my new life
0,oi vey... sick poley bears really put a damper on beautiful days
0,cuil is a very nice search engine.. i use it for 1 of 3 search querries.. google is still the number 1...
0,"USER OMG me too!! Stupid Skype.  Hahaha, hang in there. July's coming!"
0,Chilling before the joi of crappy work
0,"Most deffitnitly, and I hate mosquitos I just got bit by one"
0,"USER lmao. your mum yelled? aw.  but shoes!!! remember, pictures are better!!! xox"
1,USER cant help it  woo aug 8th
1,"USER sorry man, i was bored. that's what bored asians do  j/k"
1,Yay I got to sleep in a little this AM!! Off to my first cardio session
0,"USER I love the Monopoly but it must be in person to negotiate, barter, haggle, intimidate. Only a few friends like playing."
1,testing phtwitters on a sun cp
1,USER twitatale???? but whaayee twitatale?!!  i made it... i made it! i am here..n i'm gonna follow u.. ;) haha..how u doin?
0,My bruises hurt.
0,why the hell is my address book typing in arabic? i don't know how to change it.
0,got work tomorrow
1,USER enjoy the time
0,"::fingers crossed:: waiting as I update to iPhone OS 3.0, sadly will have to live without my custom R. Kelly alert sounds for a lil while"
1,"USER my mom, sister and her friendss. yeahhh!  i went on this sort of appocalypse ride and it was cool  ha and the pirate ship"
1,Watching the end of Harry Potter on ABC. They were so cute back then!
1,YEAH!!! gonna get cooked up!  Red/Blackie coming soon.
1,"...just seen the trailers of ""Surrogates""... Mr Willis is back in full force..... likin it..."
1,"USER - you're right, completely insane! Yet brings a smile to our faces"
1,"USER: mine too, and i consider myself really lucky. i've heard horror stories. anyway, hopefully she packed an umbrella."
1,USER It was funnn wasn't it soo proud of you puntas next time it willl be just you and meee
0,Ohh i hate workkkk  can i go back to myrtle NOW
