1,*even* i meant. trying to get a hang of typing on my BB.
1,away to bake in the sun
1,all shiny and clean now
0,USER I'm sad we'll miss H&O too.
0,"is gutted Sarah's leaving her, and shes going to be allllll alone tomorrow"
1,USER Disregard previous post. Sweden and Seba visit. Got it. Take lots of pictures of Sweden! I'm jealous!
0,I miss my laptop
1,Sunday night solo jam sesh with Taylor.  URL
0,I think my modem failed-having pc withdrawals..
0,USER :/ not good! Do you know what the new drug was?
1,is slowly getting use to twitter!!
0,What a horrible time to be woken up in that dream. Things were just getting good.
1,3rd How could be? URL  PLEASE VOTE!
0,"USER we'll have to try to set one up together, maybe we can work it out"
1,USER Glad it's over for now. Enjoying the wide open spaces and the home cooking!
1,is goin 2 hav a water balloon fight w/ kim and some other frends!
0,Not even 9:30 am and I've already had tears of anger/frustration. It's going to be a long week
1,lookfindfree: not meâ¦ iâm starting to get my tumblarity back  dammit. now im down to 184 wtfffffffffff! i... URL
1,USER aceeeeeeeeeeeeeeeeeeeeeeeeeee
0,USER Why do u just reply when ppl say bad things to u?  I just wanna know if u received my present.. URL *cry*
1,USER Why thank you blondie
1,"USER im just gonna keep spamming you  i don't see how people think your gay, ;) your dead yum!"
1,"Buggy...I bought baby wipes today at Target, & didn't get home with them.  Really?!  I hate that.  Oh darn...gotta go back 2 morrow"
0,"USER and that's how they screw you hardest.   i hope it works for you soon, though."
0,USER la. so I still can't have my Subway today.  . will wait for tomorrow. going to have 2 sandwitches tomorrow. haha haha..
0,cry myself to sleep tonight
0,Not going to get my hopes up though
1,math anal. snicker* we're all playing tennis this week. end of story.
0,wen can i girl catch a break  lol
1,Goodnight. My job here is done
1,ok i re uploaded the wheres the wheres the remote game should be up and ready at 2:30 california time
0,So sad...just read that PRIMEVAL has been canceled
0,USER happy birthday! can't make it back to slc tonight  hope it's a blast
1,the cute german guy has a face book
1,WOOT! My first tweet from my new Palm Pre! This phone was  definitelyworth the hype
0,Going to a picnic with the fam. First have to get the bubbles out of Xander's belly  poor guy is screaming
1,Didn't sleep at all. Can't wait to come home and have a decent night of sleep. Now back to Korzo for some coffee  Come and join me
1,"gardening in the rain isnt much fun, think ill stop for now and go to the garden centre for some inspiration instead"
1,USER You can build your social network girlie!  It's a great way to make connections!  U just gotta learn how to use it.
0,twitter allows so little procrastination  wish someone would hurry up and do something interesting on facebook
0,I started my period
1,"So hot today, and I'm so tired, so much happenin...I want to karaoke"
1,Baby Zander  so cute. I wish he would wake up and play with me!  URL
0,USER But all pool and no gym make USER a big  boy   USER is being a good boy today.
0,USER exactly what i was thinking
0,USER it's meant to rain or something right? gutted!
0,URL not that bakersfield's bike trail isn't faa-bulous.... but its no pacific grove. sigh. I miss it
0,It's raining *sigh*  I really need a nap -___-
1,USER thanks for the follow ladies! checked out the shades. they are pretty DOPE!  yall might have to ship me a pair!
1,I like the Triple J morning news reporter. She can make mistakes like any other normal person. Titanic sank in 2012? Ok.
0,Feels like 0 degrees in lecture classes.. Freezing cold and hungry!
0,I feel so deflated. No more doggy.
1,Finally sleep time
1,my interview went great...meet the new marketing specialist!  Hello!
1,USER USER ÙØ¹ÙÙ Ø¬ÙØ¹Ø§Ù Ø´ÙÙ Ø¨Ø³ Ø§ÙÙ?Ø·ÙØ± Ø¹Ø§ÙØ·Ø±ÙÙ ÙØ´Ø§Ù ÙÙÙ ÙØ§ Ø±Ø­ ÙÙ .. Ø´ÙØ±Ø§ Ø¹ÙÙ Ø§ÙØªÙØ§ÙÙÙ Ø§ÙØ¯Ø§Ø¦Ù ÙÙØªØ§Ø¨Ø¹Ø© Ø£Ø®Ø¨Ø§Ø± Ø¬ÙØ¹Ù ÙÙØ¹Ø³Ù
1,USER hey wanna dance? on my lunch break
1,Wants to see land of the lost
0,USER I miss that place soooooooooo much
0,"Time to stop working, hunger pangs, missed lunch, also think I've picked up son's summer cold"
1,going to madies house
0,"just watched marley & me, had some pizza and cuddled with my man... still have the damn swine flu"
0,USER was high 20s up to 36 in Spain and have come back to 15 and miserable in UK....
0,Unfortunately installing an operating system in a virtual machine does not count as studying for my operating systems exam
0,USER Exactly
1,USER all you need is an ipod.  still jamming to kinito!
1,TPB Sez: Don't worry - we're from the internets. It's going to be alright.
1,just watched kellie pickler on ellen! aw man funny stuff! loe both of them!
1,excited for today. breakfast at maudie's and yoga at the springs
1,USER Sent!! let me know how it goes!
1,USER  Stop whining.  You'll be happy to have it August when it's 100 degrees everywhere else
1,well.....I`m doing homework too  i have a lot of it...ufff
0,USER lol damn...u crushed the hopes i had for us  its cool-- i move on rather quickly :-P
0,"i'm thinking that tonight's plans are not gonna happen. sigh...sadface. i shouldn't be surprised, but i am."
1,USER heyy you can tweet i follow you!
1,2.5 more days of school left  then summmmmer!
0,Why does this keep happening with my Time Machine?   URL
0,sleep. but only about 6 hours.
0,USER that was pretty lame babe
0,is awake too early and he could have slept in.
0,bak chang not even properly heated up yet  sooooo hungrrryyyyyy
0,I can't get the new sk.. I jus upgraded to my BB like 2months ago
1,USER USER ...or a cat with edible add-ons? Energy crisis solved!
0,wishes she lived in America....i dont belong here
0,At school now! Going to go soon  need to go to lessons  xx
0,aww shucks! i wanted to rent shopaholic now! but i guess it aint out today yet! USER   annoyed 2 arnt ya!!
1,thx for the follows!! USER USER
1,USER  Nice nice! I like all the updates bout SE05
1,One more week left of school. I am going to miss these little boogers  I am teaching summer school though so the party never ends!!!
0,"Google going down means DoubleClick goes down too, means I can't get any work done."
1,USER lol fer sure! i love you guys
0,USER Haha. That actually makes me really sad.
0,what?? SOLD OUT ??? oh....   already?? how? ...... *crying* ... not fair...
0,Needs to get something from my car but scared someone is lurking and will attack me when I'm out there. I'm a wimp when D's not here.
1,"USER hello you  migraine for me, ugh! drugs and sleep"
1,USER well only  if you can afford aircdn...but your still great
0,USER I'm going to have to pass this time.  I have soccer mom duties.
1,USER points for me  Yeahhh lol. So whats on your mind?
0,"USER: me freakin toooo, and I'm making goals on an empty tummmy"
0,"Writing dialogue sucks!  It's very frustrating!  I talk more than anyone I know, so you would think it would be a natural thing!"
0,"oh , I'm so tired that I will go to bed for now"
0,Im school  CBA doing anything today...Its almost the weekend this week has went by so fast  xo
0,USER it hates me too  bitch of a thing:L:L
0,"USER Oh no, that had better not be making it's way down here. I want to walk into town"
0,awww which1 of my twiggaz would like to get me a extra strength tylenol....
1,URL - woo! just finished my drawing of USER
0,"4 different doctors, 2 male aides, 3 nurses and a friend told me earlier that I lost weight.  And that I look stressed."
0,USER I thought from your BB email...I have no idea on TB
1,"bored. going to dinner with the fam tonight. and i must say, summer school is getting better"
0,"Diversity won  Look, the were nice but...Susan Boyle is Susan Boyle..."
1,I feel like weight has been lifted from my shoulders...funny how things can toughen you up when yeah finally say no more
0,USER a las 5? :S
0,USER who makes porn wants to read about my day? SUHWEET. And then I saw they follow like a million people.  Poo
0,am stuck revising history and RE! everyone at bafta i well jealous!
1,sick..and making tea. tea always makes me feel better
0,wont let me upload my pic
0,1000 mg of tylenol + 800 mg of motrin + ice pack = still throbbing hand. Shoot me now  oh it hurts and to make it better its my right hand
0,Sometimes I just have to expect they might not feel the same way
1,just came home from Night at the museum 2 .. aww the jonas brothers were so cute
1,USER Yeah it was great to meet you as well! We had a lot of fun! Hope they have it again next year
1,USER just checking whether the patriotism was due to a home state winning...glad it wasn't
1,"omg, Take That were amazing and so were the Saturdays! i was dancing all night long!"
1,"GoodMorning, Hope Everyone Has A Beautiful Day Today  x"
0,"good morning everyone, weather is horrid today"
1,USER Good night and sweet dreams
0,USER I'm 25 in december that's not good at all next big birthday is 30  after 21 it flys by for sure
0,USER Thanks for reminding
0,"USER That must be why it popped into my head. When Vinnie Paz from Jedi Mind Tricks says it, it sounds good. I guess you're not him"
0,its a friday night and i have nothing to do but sit here and waste my time on twitter and facebook.. i'm sooo lame !
0,USER dead serious.  and his cat didn't make it. we're going over there soon. i'm waiting for kevin to get back from his friends
0,"my pimple is still visible. and it looks like i pierced my nose..  so yea its on the ""bestest"" spot ever."
1,yes according to weather.com its going to be hot by the end of next week again  heello beachh
1,USER pulled an all nighter..i have a test i didnt know about in a few hours  had to study study study lol
0,Dammit... I need to stop buying furniture
0,USER Good for ya! I'm still contemplating on getting it. It's bloody AU$99
0,That was a horrible dream. I'm too scared to sleep now  crazy killers
0,my body is sore
0,"Decided to watch Asian live action dramas. Gonna start with Korean. gf suggested ""Kim Sam Soon"" but I can't find a stream"
0,now I too must shun. shunshunshun.
1,USER yur right nexttt me  hehe
0,twitpic!fail
1,SHED BOYS ARE SO OVERRATED NEW BOYS!
1,"USER dude, that would be fun. bring a CD of banjo music to play during your getaway"
0,USER srsly  i wish school would end already.
1,"Now I'm going to have breakfast, so tweet ya later  -x-"
1,USER thank you
0,"turns out i have no money, have to drink regular coffee  i dont know where it all goes!"
0,My stomach hurts
0,USER I can't get to my table though!!  hahaha
0,USER you too!! didn't go to juneteenth/my phone was still dead all day yesterday  let's dance again soon!
1,USER   Everything alright?  How are the kiddies?
1,"USER thanks dun sa link ng forum ha. nagbabasa lang muna ako dun. cute naman. meron pang ""i love christi because..."""
1,"I'm going now, night  x"
0,USER so his family will be less mortified probably...  whos having the speculation?
0,Working on the lawn mower
0,"USER not counting down, counting up how many days I have gone unsexed"
1,"USER Im great thanks  Naaah, coz we dont have a winter break or anything. I have a two week holiday in about 5 weeks?"
0,ist etwas genervt
0,in need of a massage
1,work in 6 hrs grrr perhaps i should go to sleep if i dont wanna feel crappy in the morning... my cat is weird... weird...
1,"at my moms houseeeee, talk"
0,It would be kind of fun to go retro and set up a bbs for grins.... except I haven't had a phone line in over 10 years...
1,USER good morning to you too!
0,"A customer wanted an industrial, but was not set up for it  SO HE GOT A SNUG INSTED! what a smart choice!"
0,USER sometimes they gotta learn the hard way
0,it took so long to join twitter i wish i did it earlier
1,Got it! Thanks
1,USER coolness. otherwise great job
1,USER we get to wear normal clothes  not uniforms ;)
1,URL my ride today...stats too
0,Such a beautiful day to be cooped up inside
1,USER LOL i haven't watched a complete game in so long so it was fun watchin' it with every1 here
0,USER  i do too  i wanna i wanna
0,miss's chris. a lot
0,going to my flat in dundee soon for the last time  its going to be odd not living in dundee anymore after being there for 2 years!
1,"USER Which is why you shouldn't have supported the man who built ECHELON and GTMO. 1 day, they fall into enemy hands. Enjoy.  #tcot"
0,"USER Naoko saturday, Burn sunday"
0,USER I can't watch it until next week cos i live in England  But i'm still excited for next week haha
1,"USER: The first two describe the instructor, the third the room.  Think about it."
1,got a day off today
1,"QI last night was top fun! Got a sore throat laughing at Sean Locke, Rob Brydon, Jo Brand et al. Many thanks to USER"
0,and starting al over again with new account
1,USER eh! awesomeness! now's my turn to ber-scone... before it expires. haha
1,"USER still busy?! my phone is so crap. ta, i'll go get in now"
0,"woo feel ugh, nothing tylenol + caffeine  can't fix. A little poker and some vanilla coke...then work"
1,USER Big Sis I wanna go LOL..........dont leave lil ol me out da loop
0,my head's killing meeeeee.
1,"USER They throw it away, like they throw away all their used medical equipment."
0,USER and this is better 4 me than a snickers bar or hersheys w/almonds.... which i use to b addicted to b4. i miss them  LOL
1,"oh .yey i now have a new pic. i just love it when u change your pic and they say ""thats a nice pic"" it makes me feel all warm and fuzzy"
1,USER did you like terminator?
0,i love NKOTB!! I need to see them again. i wish i could
1,"Nice looking day today...perhaps some high, thin cloudiness.  Temps in the mid 80s"
1,posted my very first tutorial. that took like FIVE hours to do! URL great fun though
0,Morcheeba ï¿½ Slow Down - soon time to leave  so a final few tracks from me ? URL
0,"USER hey wii, i read your gm. how are you na?  em worried"
0,Back at work. And switch my python with an old and bad php cms... Sick sad world.
0,USER so jealous that I have never had the chance to go to the viperroom-      maybe someday-
1,USER wow that's such a great story!  do you ever get to see each other?
0,"USER of course, pj still liked it. i think it's ambiance banyo na"
0,USER sadly no  lets still get wasted anyway please =]
1,heya I am online now...check my web to chat with me
1,so what did everyone think of the mtv movie awards? I didn't think they were that great :| but Kriten Stewart is literally the best! lol
0,Gosh...Im in such a MESS!!! Lol! Its like..aargh 4get it...like u care abt my messy situation! Like u can do anything bout it!
1,"USER aww, thanks don!"
0,USER fasho! I'm in finals week now  so after this I'm all set n ready to do work! Let's just do it like Nike!( Corny I kno lol)
1,USER Hello  I'm supposed to be making my dinner right now and you prob just had breakfast.
0,USER I miss you
1,Based on USER 's endorsement I'm going to try kombucha. So if it makes me puke it's her fault.  <3
0,"PALM PRE ON SALE TOMORROW!!!  alas, i will not have one."
1,wrote a NU happy-happy blog post after 11 days offline -> URL
0,"USER Ian left  Aw well, whatever makes him happy. <3"
1,Is fresh air as close to God as we can be on Earth? You feel its presence and see it works it keeps life and is wrapped around us always
1,USER Only two days left! How exciting
0,I think the storm is making my tv sound all fuzzy or whatever
0,USER when you come to indonesia again? indonesia miss your perform
1,"USER A great post on PR, many thanks from a PR person. P.S. I *like* the green avatar"
1,working  - Listening to The Prodigy: Omen (URL )
1,"USER dude, why not? ""watch your back"" haha!"
1,"....and yes, i CAN dowhateveriwant"
0,sick and can't sleep
1,USER Get well Soon...... I can smell the Vicks in North London.....
1,cant wait for lunch so bad haha  Linux outlaws 95 is really good episode !linuxoutlaws
1,USER USER our family have two child guinea pigs  <- lovely so we do have a zoo then
0,USER lol I know -_- I really want her phone
0,USER : miss You..
1,USER hey baby  you okay? i love you xxx
0,working on a sunday  USER promissed it would be just a little work. dough!
0,"If anyone is interested in presale tix for Wisin y Yandel, I have a password from iTunes. there are no more tix available @ MSG."
1,"USER yeah i have like 2 or 3 more quarters to go. story is a bit long for twitter, facebook me for details"
0,is proud of her will power to say no to cake today but I did have breakfast @ McDonalds this morning
1,"Iceland is great, 4,7 Earthquake !! And nice surroundings... spent 3 hours at Blue Lagoon"
0,stressed beyond BELIEF. need a nap
0,Hi tweeters... Work pulled me from y'all today
1,USER It's not as amusing as it seems. Think i need to buy some tissues!
1,Hey young world...Goodmorning
1,USER Congrats! It looks great! I can't wait until we get our new layout!
1,"omg just finished writing a song!! ""Unexplainable Love"" itz good"
1,Just enjoying the weather
0,"Sun!  More exams tomorrow and all week.  At least Spanish is over.. 1 down, 10 to go..  x"
0,USER so u used to live in the Bean and it isn't one of ur fav cities  URL
1,About To Go Out Shopping  Going To Wembley On Saturdayy!
0,USER  Hard to find a new job in this climate!  Check out what I started doing when I left my job URL
0,RIP exodus.. sympathy goes out to the Tyson family what a tragedy
1,"Someone wrote on amazon, that my Werewolfstory in the ""Gaylï¿½ste"" Anthology is one of her favorites. Yay"
1,USER I love you too! sorry bout work:/ muah! feel better? lol
0,It's so hard to say goodbye after 3 amazing years  I'm going to miss everyone so much!
1,USER Super cool    Picture?!?!?!
0,jaden is gone for two weeks
0,USER aww I'm sorry 2 hear that. Break out that homeowner's insurance! A pipe burst downstairs in my basement last week
0,Bummed that GRO doesn't have any Cali dates yet!
1,USER Wow. I think you's have to be skinny and under 30 to pull that particular look off
1,USER  he would indeed mike
1,GREAT meeting!!! Guess the growing up thing isn't too too bad LoL. On my way to the mall now to shop for Orlando next week.
1,"holy crap, i am still alive! hopefully hanging with my friend katie today."
0,is sick as a dog!!
0,"teaching a big worshop in greenville, and my ipod died!!! what the,,,,,, and i have no back up"
0,No plans for later!  Wow stuck at home again. Kbye.
1,"I'm on twitter, myspace, twitter i'm charging my phone & ipod, and to top it off, i'm buying JONAS stuff"
1,"Starting to twitter.. This is interesting.. Hmmm.. Well, I guess I made it.. This is fun!"
1,Nawww!!11!!!  Congratulations Lyn-z and Gerard on Bandit Lee. i honestly couldnt be happier for you!!!
0,USER Missed you at LoDo's
1,Good.Morning. everyone have a great dayy!
0,I GAVE STEPHIE FOOD POISONING FOR NOT HEATING UP HER CHICKEN PROPERLY
0,Nuggets game with everyoneeeee except USER.
0,is going to collect rent.
1,"USER Oh, good, I can watch them both then."
1,USER You got to be kidding right?its only 10.how can i be drunk?i just want tea.
0,Carradine and Han from Enter The Dragon on the same day  . The nine year old me is throwing hard mud at the petrol station to stop crying
0,im terrified of storms  this is not cool. there is a tornado like 10 miles from my house
1,USER ete is the best. greeting from switzerland and good luck
1,Ruby Wax is hilarious! What a fabulous woman
1,USER I love that you want to pet a wild bear. I thought I was the only one with such crazy ideas
0,Layin in bed awake. Txtin my girl in vegas. Wishin I didn't have to work and I was w her
0,Just realised that I have been sitting on my sandwich for lunch.  Sat on it during the train in too.  Fail
1,USER you're very welcome sweetie
0,Goodmorning to everyone..hope today is a better day for everyone..looks too gloomy outside to feel motivated to do anything
0,Wants her camera back!
0,relaxin'....dreary sunday here in ri
0,USER  Bitch.
0,I can't get into the #ontdstartrek chat
1,JESUS CHRIST MONKEY BALLS! drag me to hell...what an ending
0,USER It's so much more fun to diy than to hire someone isn't it? What color(s)? i'm already regretting the color I used 4 my room
0,"USER rofl. did you create the ringtone yourself using the flaw in the system? If so, my Bill Hicks ""people suck"" tone is in danger"
1,USER we will have a third.  Friday I really considered adopting a 6 mo old grl and 15 mo boy. 4 ages 2 and under now that is nuts!
1,watching the dark knight
0,"USER yeah, no thats pretty awesome, spesh for a tues night, nah im at home editing a shoot i did  i think you win"
0,Why is it so hot today??
0,cleaning the bathrooms--gross. Poor Jack was just buried.
1,USER it's okay... till you get stabbed  x
1,"I'm in Paris, just got hair cut and had yummy crepe lunch. Exam went well and Im feeling great! A bientot"
0,USER I just hope they at least find the plane soon. Imagine being a relative or friend and not knowing
0,"Watching CSI Miami, was going pub quiz then realised I was skint"
1,i love you my bestfriend
1,Is at the movies  me and stephanie have torrets! Hahaha
1,"I'm just lying around, watching Mike Rowe."
0,Soo hungryy!! LOL I haven't eaten since 1pm.. No good!! Wats open right now that's good??
1,"USER lol! I'll let you off then, you have good reason! Have a good un"
0,USER Was barnaroo a petting zoo at bonnaroo? Maybe the goat ate your phone.
1,Hhave a WII? Make sure that you have the latest 4.0E update and DON'T DO ANY MORE JUST YET.... Easy Softmod for homebrew is now possible
0,USER i'm with virgin media
0,I just realized my toothpaste= Colgate. And all this while I thought it was Pepsodent!!
1,USER make a video!!! do it
0,USER I know me too! Sorry I wasn't feeling good at all...  Soon though... in mid June we're gonna get together. We'll chill then ;-)
0,Supposed to making a summer pudding but it doesn't feel much like summer today
0,I have the sniffles
1,"USER I don't have to know every single video, now do I, huh? I'm not that kind of a freak"
1,Good morning everyone
0,USER right on haha. kennywood? perhaps? please! hahah i wish they had new big coasters though  step it up kennywood!
1,USER Yeeeah. ILY!  So how's life down under?
0,why are all of the girls that are pretty have to be little whores?  seriously....
0,at the health department with the poor people
0,I'm really starting to hate my job : I'm really starting to hate my job  URL
0,"i'm freaking starving and the class didnt even start yet. shit, i wanna go eat somethinngg"
0,USER sucks to be outside the US at this time
0,USER This is lame. I don't wanna go to bed. Hmph.  I had 8 hours of uninterrupted sleep last night.. I'm not braggin. jst sayin.
1,USER seems to have updated that all on it's own  cool pics btw
0,USER sounds like a proper monday.  Poor you.
0,"someone motivate mee, been on the laptop for 3hrs and not wrote 1 wordd!! soooo bored"
1,USER Haha for sure! Totally understand since we're in the same field.
0,USER also that's very sad for ronnie. no porn or candy? that's proper brutal  if i were a prison warden i'd let him have porn
1,Sitting with dalesy in the library doing media revision! Fun fun fun
1,USER no they aren't Ã. argh they were really good but they broke up don't know why! want them back together again   x
1,Listening to Yes FM and trying to make birthday plans for my birthday trip
1,USER hey!
1,USER girl . I was just about to call you .
1,USER    lol - you consider yourself a serial tweeter?  I was thinking USER = serial tweeter - borderline unfollow material
1,wordt t Sambal Kitchen of the garlic queen?
1,Sneak preview of my blog layout idea.  URL
0,USER I know me too!! But they didn't have any
0,Playing Street Fighter IV. It kicks ads. Can't wait for E3! Too bad it's during school
0,"ah, shit. these single-core inits are becoming more often. windows box's CPU is dying"
0,Feelin so lousy I may just curl up and disappear into nowhere.  I need a hug and pint of chocolate ice cream
1,USER Hooray for easy days. It's almost 9am Monday here. Happily busy working on joint splendidness w/ USER
0,working on my algebra project  then have to finish my spanish essay
1,"USER Haha thing is, the Tesco one is a bit far out of Dundee. Eeep! Way out by the Kingsway. There's buses though!  x"
0,guys wish me luck ya for my biology practical exam tmmrw.im so clueless ya know
1,"USER awww what's the matter, kyra? we @ SugarLoot miss you"
0,"Remembers a time (last Monday) when he could straighten his arms. Weightlifting sux. 4 days later, still in pain"
1,can i make a dress out of a swath of silk organza and some safety pins?? you bet your ass i can! and it was bloody gorgeous too. le sigh
1,USER thankkkkkk yewwwww
0,i flooded my car!
1,USER I'm ok thanks  Just about to finish and go homeee )
0,Sd week went by faaast
1,USER Press 'Ctrl' on bottom right. It's there.  KY
1,USER URL - great  where can i get such an ice bomb
0,drinking my coffee. it is worth it to wait a day for my book to come in? probably
1,USER USER apple is *so* easy
0,"I'll make your <3 beat like it's on cocainee!! Work all day, then a serious nap, SO MAD I missed speidi on ""I'm a celebrity"" last nite"
0,USER Sucks to be you right now. Sorry bout that
0,USER oh...  I'm sorry.  Please excuse my ignorance
0,USER awesome.. thanks a lot dude!! You rock ;) But you gotta tell me how you did it. I don't wanna get stuck at that stage again
1,Thanks to everyone that participated.  I'm off for my regular post #freestufffriday lay down
0,USER  im sorry to hear that.
0,"USER YES  Tell meee. But like, you can't get preggies so why must use condom. :O"
0,USER: At least Grand Prix is a bit of entertainment. Am absolutely freezing & stil waiting 4 summer 2 arrive
0,Lost by ONE freakin point!  Goin to in n out now yum
1,Congrats all... Hope You all had a wonderful weekend... Now get You Ass up and get back to work
