1,*even* i meant. trying to get a hang of typing on my BB.
1,"Go West, Young Lady singing at Bridgestreet! And Worshiping!"
1,All clean now
1,"Thanks everyone for all of the #FollowFriday love. You guys rock! Welcome new followers, hope you all find my tweets fun & interesting"
0,back in work.. Friday Night was fun! sheffield was awesome! and the peak district was lovely... i can hardly keep my eyes open
1,USER Is Jordan's shoe tied this time?  Tell him jeans are sexy not man-pris though. hehe Much love to all the guys still!!
1,My twitterfon doesn't show ads  URL
0,Has drank a load of kick and cant sleep now  SHIT
1,Finally home  I have to work on my project now. Ergh.
1,Surgery went well....lotsa after pain though.....its really bad....they keep giving her dilodid and it seems to help....I want some..
1,picnic at pugneys today i think! awe wakefield is a cool place to live!!
0,Had sum delicious Wendys about 30 mins ago n came home to find my mom just cooked. Had to stuff myself so she wouldn't feel bad  I'm sick
1,*tic tac toe* chatting w/ friends in YM
0,USER no the film is... i'm not
0,Never thought I would make it thru this day
1,USER you know it! But I'll be ok. It's not TOO bad here  when do you head this way?
0,"USER Sometimes, turning the other cheek doesn't cut it, and the best you can do for Jesus is get it over with quick."
1,is looking forward to the turn out of events this week.  URL
0,The Proclaimers are playing in Shetland on August 29th. Why does all the good stuff happen up there when I'm not around?
0,the interweb doesn't work so well with a broken DNS somewhere between me and it.
0,USER Feel better! My babies are sick too
1,USER just make sure the quality doesn't suffer. A lot of them ladies prefer cheap outfits but lots of them
0,USER i miss my hamster Zippidy... she was dead in the house for 3 days cause i didnt wanna admit that she dead..
0,USER but I'm in my PJs and need to shower
1,get ready for the new commercial...it will blow your mind
0,also the last day of Holidays tomorrow
1,USER pretty much... the judging bit.. not sure about the guy bit just yet
0,I'm kind of hurt that somebody tried to report me as Twitter spam
0,seriously so lost on dis shit!!! how do i get ppl to respond
1,backpack seems to be big enough... lucky me.
0,USER aww.. thats bad..  I dont have a headache but Im like in a zombie mode xD haha
0,Started smoking again with all the moving crap! I'm so weak ;( Need to give em a miss! wont be able to run round the block at this rate
0,USER man that sucks!  i was thinking about being a r.a (is that right?) but nah...hope all is good!
1,URL - USER - Nice look Harvey. Haha.. Love your show
0,Today I saw some clips of young girls and boys being shot in Iran and I feel so angry and upset!
1,"Eggplant & goat cheese dip made, devoured, and remaining bits packed away"
1,USER Thanks so much
0,USER Ditto  it doesn't help that I'm listening to Demi's AHMAZING new single right now...sigh...what I wouldn't give to meet her!
1,(Cont) just that..... THE PAST!!!! So glad I got my FlyGuy! He Always makes me smile!!!!
1,USER thank you!
0,"USER aww...  I must convert you then.I like cars more than most of my male friends,Tom always pokes fun at my carloving manliness."
1,USER i want to laugh because i know *exactly* what you mean ... but i wont
1,and OMG USER looked so HOT!.   but what happened with Zac's hair ? LOL
0,I just realized I deleted a voicemail that I really really wanted to keep.  Sadness...
0,Is wanting Quesnel back
1,USER ahhhh...RISK..i love that quote...thanks 4 reminding!
1,USER Get 100 followers a day using www.tweeteradder.com Once you add everyone you are on the train or pay vip
1,"USER good, good - working on Sunday which will be a bit of a pain, but otherwise easing back into the Sydney life  how've you been?"
1,USER Zappos...   how long have you been on? Did you find anything?
1,USER ME TOO!    You'll have to make a trip out here to Langley to try some delish Township 7
1,USER Shit... you should have seen that! I had caps on my ears and could no stand the noise. This should be illegal
1,need 167 words and I am finito  Woot  #pseudowrimo #writingmuses
1,USER have fun...keep us posted
0,lol USER I toll you I wanted philly cheese ! n u left
0,Shit! I think I sprained my ankle... What am I going to do for my 1.6km NAPFA run tomorrow?!? Damn.
1,"USER as Alan Partridge said, Wings are the band the Beatles could have been LOL. I play a 1980, 4001 rickenbacker bass. S'lovely"
1,USER congrats im following you
0,USER i am SO said i missed you guys at Six Flags.
0,USER plz look! you answear lot of people and all i ask is to say what you think > URL x stop ignoring me!
1,T-minus one hour.
1,Loves Dick's Drive-In. And her crewmates
1,got my belly pierced!!! it looks so awesome! and it didn't even hurt!!
0,USER  haha soooo party tonight???
0,I'm just about to have a siesta.. at 8:42 pm xD haha but i have to wake up then again
0,Thinking of going to watch new Transformers and/or Terminator movies at cinema tomorrow... hate going on my own though
1,USER we'll tweet together to you  or when we don't we're watching @ Angels & Demons or playing Wii!!
1,Terminator was so good!
1,USER I totally agree!  The little 4/6 ounce tupperware shakers are perfect  have fun in south beach.
0,"going to do more practice now, before going to play at a funeral"
1,in the car with rhi to her singing concert  wish her luck she's nervous!
1,"KRZQ SKATE JAM has been post-poned. However, the tickets being sold for it are good for the June 12th show w/ Ming & Ping @ Vixxen!"
1,LOL. All my friends are text brigade-ing me haha. I have the best friends ever.
0,USER someone on ur facebook told me u disconnected ur number...is that true?
1,"USER Good afternoon to you Amanda, and glad you're having fun!"
1,"K, i know i lied before, but im really getting off of twitter now. Haha. Soo text."
1,USER Send it to I+Ã - they will check for Corporate ID and copyright issues
1,USER Appreciate the empathy
0,he's gone
0,is printing dvds for a funeral slideshow.
1,"USER I've been trying to give people a JNNPR break. You know, American Idol took a lot out of us all.  I'll be finished soon!"
1,"USER I'm looking at obscuring actors mouths in my film so I can redub the audio later, All I had was one of your comments"
1,USER thankyou!! I love your drunk tweeeets! ahaah
1,sooo tired!!great gig @ Heraklio last night!! off to get some sun now
0,doesn't like how he sounds.
1,"USER i love latte and funk dance  we have alot in common, and btw i am quite obsessed with BB"
0,USER I wanna go to cali
1,"USER up to 10,537. You're getting there. How's the weather there? Dreary & semi-rainy here in spamtown."
1,USER yay
0,USER u got me feeling horrible now
0,and I have to work
1,USER its packed as hell. but its also Sat. and around dinner time. Its prime time here. Hope you have fun tonight!
1,USER is pink chicken why your head hurts?
1,Goodnight my lovelies
0,The Oddo's grandfather passed away in his sleep
0,Looks like I am heading to Florida to spend some time with dad before he leaves me for good
1,USER I wanted to go after class..can u meet me there @ like 1 or are u busyy?? Let me know cuz if not I can prolly wait til 5
0,USER lucky! i have 6 hours till i get to go home.
0,USER I know  sigh
1,"I love to joke with my students.  For example...Hey USER, can we make a band and call it ""The ST-D Experiment""?"
1,USER thanks sands  your support means a lot
0,"I mean, i did 8 miles and had to get off the bike halfway through. This is bad. I NEVER get off the bike"
1,Yay. I can has lawyer to get me out of stupid ticket.
1,in baton rouge at travel league  its going to be a loooong day
1,"USER wow what a surprising place :""o he'll work here? its ok bby, if u got bored there, u cud come to jogja &we'll sum fun here"
0,off to another exciting day at work.  i hate my job! fml: off to another exciting day at work.  i hate my jo.. URL
0,"USER dear ksam, we didn't hang out much at all."
0,"Ahhh, Mother's Day. I for one love and respect mine more than her ego will allow her to fully accept. I REALLY wish she lived closer."
0,"USER  Goodnight , work for me too in morning"
1,USER i wont lol what would i do without it!! And my work day is over too!
0,USER hope so
0,wants REESE'S PEANUT BUTTER CUP!  did i spell it correctly? he-he
1,Good Morning!!  Little under the weather today ..will be back and forth heading back to bed for a bit
0,My coccyx hurts!!!  Decided to give back in to the painkillers... Risking spending some productive time on the laptop...
0,ohmygosh i just fucked up my whole day. i felt sleep and wasn't able to do everything i wanted
1,USER have a blast at the finale.
0,"Oh my god, my bed was SO comfortable this morning <3. But I have to do laundry"
1,USER I dont know but you should give me some icecream or something. WOULD be appreciated thanks
0,i'm still sad that the Russian killed Apollo Creed
0,USER boss which part r u in? i wud join u..here its drizzling only
0,"Sigh, I think my PMS is making my mind totally over-analyse things and making me sad"
1,And..I'm bababa-BACK!
0,synch probs with Touch Diamond2 vs Mercedes C
1,USER Thanks for the follow from Glasgow! Who will you thank today?
0,wishing i really could build dee t-800
0,Just got home from eating tacos! . . Last day i went out with my babe. .
0,USER Sorry  I'll stop by later ;-)
0,"We saw I Love You, Man. Based on that movie and friends' reviews of The Hangover, we picked the wrong movie"
0,USER ROFL was it really good? i wouldve freaked out  did i tell u bout my walkout of the $ movies when watching texas chainsaw mass?
0,USER I'm was so going to planet fitness to but of some steam but now I have yo go to work ggrrrrr.
0,I want to be in Honduras...feelin' kinda homesick
0,"Wahhh, you can't SEE my picture, even though it's uploaded already..."
1,dananananannananana BATMAN!   Heidi is wearing a goodnite!!! hahah!!!
1,"USER USER USER OOC: EA E3 presentation in a few mins, you guys!"
1,has a new fan.   URL
1,USER welcome to twittarrr
1,Always waiting... forever waiting...!
0,Miss the past few days when I actually had a life
1,is its mothers day!
0,i miss you baby
0,I have been nursing an injured squirrel all day & she died in my arms not that long ago -kids will be so sad - they had named her Hammy!
0,Ahh how I wish I had my family with me  def hard to be alone when u r going through such tough times like surgery by yourself..
1,'Ham Chlormint kyon khaate hain bala?' good one w/ Sallu  URL
1,USER Congratulations Demi ! You deserve it !
0,no one cares about me in my family  it has taken three years for my mother to buy me some curtains
0,USER  Gr8 news yr Dad is ok. I lost mine to a HA 5 yrs ago @ 65. He wasn't so lucky. Makes u more aware of your own mortality.
1,...These still under 2 n a half hrs to take the Title for this evening so Keep those Tweets witty...but above all...Keep um real
0,Hungry and thirsty but it's too close to lunch to go for breakfast. And my last.fm library keeps crashing as soon as it's pas the advert.
0,"USER  only in e-mail marketing, where rendering technology is like 10 years behind the curve"
0,USER do u think i'm talkative with all the questions...? know what i really hope ur kristen i've been fooled by many posers
1,USER thank you!  i hope it works tokio hotel
1,"#followfriday, follow these please  @ lawgurl, USER, USER,"
1,USER all people know you'll be the winner in mtv awards today.. LOVE YOU! Good luck  <3!
0,"USER Sorry dude, it went last night."
1,Finished with tracking the first song!
1,USER Happy bday. Have a good one
0,USER never invite that gamepro guy on listen up again... please
1,"I think USER has been sucked into the ""Twilight"" world."
0,USER nd me i will go to the bed  tomorrow exam T-T
0,just wishing our 7 year old wasn't sick
0,Damn... I didn't get to finish follow friday
1,Back home again
1,"""I'm a celebrity get me out of here"" is dumb. hahaha ""spidey"" are full of themselves thankgosh they left, i'm rooting for Sanjaya"
1,Boo Lakers! Good thing I left on a mini trip up the street! LoL!  I love taking pictures..Here are a few!
0,Poor Mikey still in the hospital.
1,#musicmonday DEF LEPPARD
0,"Wow, last nightUSER was a hard nut 2 crack.Someone even asked Roog If he had some reggaeton?!Got flashed while doing 130 on a 100 way"
0,USER yes lots of toys I miss woolworths    ummmm dr who !!just don't let the darlics near me I'm scared of them lmao!!!
1,USER ok..stupid idea to try to hug him while he's in transport somewhere. I say we booze him up and then kidnap him
1,USER Yikes! hope I don't have to!
0,Back 2 work 2morrow!!! Sucks!!!
0,"anyone make money off of their websites?  if so, hit me up, I'm curious how you are going through it, I need even more hosting for P*N"
1,Hang out with USER at the Social Gaming Summit 2009 in SF!  URL #sgs09 #SFO
1,"USER hi,"
0,working 1-6pm.  Its gonna be a busy/crazy day.
1,USER we already discussed this today but yeaaaaaah
1,New track up!! Go listen
0,USER Sorry for missing out on the fun wasn't close to a computer!
1,Some days i really hate my job....2 more hours left!!
1,"is working on URL in the new,improved,larger picture format  love it!"
1,"Phew! Not inside drill competition  on the way back now, no some odour-full bus."
0,USER But... Its a mac
0,USER don't think abt the dead squirrels!
1,Welcome USER to Dearborn!  Land of Ford and orange construction barrels!
0,im missing my family....
0,I wish my cold was over    <33
1,URL - 1000 Islands Conservancy Zone. This was part of my Saturday.
0,ihadadream that the jobros were at my housewatching homeandaway with my family and then shortstack called but i had tohang up on them
1,On my way home Ohay
0,"USER naa av finished but well i failed  got resits 2 do tho b4 i can graduate. i no i am, i need sum excitement in me lil life!"
1,this song is very very very sexy.. all about girl talk   ? URL
1,"USER dont worry, even if you dont win, it dosent matter, its only an award, you dont need that to prove how amazing you are."
1,"USER Well, my head doesn't feel like it's gonna explode anymore  You?"
0,USER  well... i try to make that my friends follow you... but they dont want to open a twitter account...  sorry...
0,"wow, 2 months after my first ""tweet"", haha. Now here's my 2nd one. Happy it's summer, no school for 2 months! next: college applications"
1,USER and USER - looking pretty shiny if you ask me!
0,"Hasn't been on for ages, shit time last week, hubby had a fire in his workshop, so lucky, could have lost it all   Had good wkend though"
1,"USER Hey, Patrick! Congrats on the new gig! Good to see you here on Twitter."
0,USER me too!!! I woke up at 11pm when Neil came to bed and wanted to chat and didn't get back to bed until 2am.
0,time for work  two more days till next day off
0,last day of school!!!  and its raining  after 29 days without rain! >:| stupid seattle weather...
0,USER Clearly you can multitask. Why can't I?
0,But I can't 4 that long! But ya I'm just really bored right now and no one is online 2 chat with!  Oh well. *sighs*
0,USER Here in Argentina the elections are in next June 28th.I dunno who to vote yet
0,USER You have over 100 followers...  damn you!!
1,I had a lovely birthday
0,USER Go us
0,is trying to find artwork for the paper...And his stomach is feeling uneasy.
0,snapped my board  getting a new one tomorow!
0,So I slept like 4 hours ...  And I have some stuff to do ! It's going to be a long long day....
1,Happy Mothers Day! . I am going to a mother's day bbq!
0,USER You will be missed tonight.
0,USER i miss you
0,Wish I was at the PWY gig
1,USER you've joined a great club
1,just booked my consultation for Brazilian Blowout yippee  !!
0,My truck is near death.
0,USER That is really scary and sad
0,"My ONLY responsibility was to pack annnnd.... I forgot jeans.  So, don't judge me if you see me in pajama pants today, k? k."
1,USER Yes sir. Right away!!!!
0,"USER #qgoogle  Yeah, many times! Not satisfied with the results though"
0,Why won't my picture work?
0,#dreams Had to speak at night honoring michelle obama as fashion icon. Did so wearing her clothes. Got pee on them while changing.
1,"If England lose today, Pakistan is automatically in the second round. Go Pakistan!  xD"
1,"been relaxing in bed watching tv, waiting to call in for work, then have to get started on my album for my dad for fathers day"
0,so bummed out.
0,USER i forgot how to nudge  but hiiiiiiiiiii
0,Is up and totally tired and soo not looking forward to colege the worst day ever
1,Sore from scooter riding all day long
1,"USER sorry, u were the only 1 on the list that I had enuf energy 2 attack at the moment...lol. U r more than welcome 2 atk me back"
1,USER thats well sweet! we love you being in a band too!
1,thinks it's time for New Zealand to turn away from the big political parties. Mount Albert for RAM?
0,we're all sad. Lol  besides tron. He's a strong nigga
1,He apologized for that guy even tho he didnt kno who he was...really amazing...there are decent ppl still left in this world
0,ILL. I really hope it's not swine...
1,USER I get really tired of people who label your not sharing their speciality as ignorance. You're not ignorant. Fear not
1,USER  yes i did  They are sooo dreamy! lol
0,Adam Lambert on Rolling Stone...Omg why do you have to be gay?!
1,USER...thinkin bout pink elephant...what about you? on second thought #brightcolors on yummy harlem niggas
0,USER impressive script indeed. I dont want to seem like a dick. Just limp patriotism/cause backing irks me. No quick fix
1,..rockin the center part like there's no tomorrow. what will tonight bring me
0,USER Very jealous! Seeing him later this year at MEN but won't be the same as a little gig
0,I really need sleeping aids... Insomnia + facebook + feeling like shit = not good times.
1,I'm thinking of what happens to the Gods of the older times... who is left to praise them? I'll be there for them!
1,USER you said art!
0,my graduation day was a blur.  i wanna watch the tape. i have never seen it.
0,looking forward to Tuesday and Wednesday but i'm mega bored now. wish I had money to go out
0,My head has not stopped itching since I set foot in this barbers. Have I made a big mistake
0,USER :o i heard loadsa people are goin..
1,"USER awwwww, thank you!"
0,I WANT TO GO OUT  Mummy dont allow
1,I'm gonna kick USER in the vag.  Pray for him.
1,URL - this is the coolest pic of all of us at lake compounce
0,"Bar review. Every station on Sirius is playing songs from undergrad days in btown. Ryan Adams, ben harper, John Mayer, jeffery gaines."
0,I wish I would have charged my computer before heading to the graduation. It's almost dead.
0,USER I never saw In Too Deep!
0,USER yeee! haha quite amusingg. im on perez's side! lol and i think its cus we dont have DATA  SAD.
1,WHO GOT A SiDEKiCK ? HiT ME UP ! ! amaniyUSER.com  POW ! S.O.D. && P.T.E. Thats What i Repesent Until The End...
1,this boy got me a pretty amazing vintage camera. i like him.
0,USER still waiting for your CD to reach my postbox in the UK from Amazon.com! It's painful waiting for good music in the UK
0,i missed guitar practice  summer is going to be hard
1,Another day of Record Label Development. Not bad
0,"USER And thanks for hosting! That was lots of fun. Sorry about your ZFS partition, though."
1,exhausted! but glad i got to see UNC become national champs!
1,USER Ahh well. I had a friend cosplay one of the lawyers from the game and he 'objected' to a Stormtrooper at a convention
0,qu? nï¿½y Cavs khï¿½ th?ng r?i. V?y lï¿½ t?t c? cï¿½c ??i mï¿½nh thï¿½ch ??u ko vï¿½o ?c Final  ch?c ko dï¿½m thï¿½ch ??i nï¿½o n?a
1,"with Lincoln this morning, can't take him to school until 12:00. At least I get to spend time with him"
0,Finally took my Bonnaroo wristband off
1,"USER USER  Thanks for the props, and we appreciate you for following Central Ohio's News Leader."
0,Don't get the iPhone OS3  2.2.1 should still be uptodate #apple #fail
0,"USER helps a little, but now I'm sad you're inside too"
0,"ohh, god. I miss Cambridge and the Mcfly concert! 4 week ago   buuhoo."
1,Intese lightning turned into angry thunderstorm
0,Morning. Back in college today  but going home at 1pm. Yay for my Mondays!
0,#shortstack is dropping
0,"USER I did  Not too sure what to make with the yarn. 2 pairs of socks, probably - but need good first pattern for my huge feet"
0,Just wants to in home and lay down. Ugh. I'm miserable.
0,OMG talent show in school got put with fucking freaks
0,USER Omg don't scare me like that
1,"USER some1s a happy boy this morning  what u going to switzerland for?lucky boy! can i come?we could get drunk,plan!!!haha."
0,USER stupid boys!! and brothers on top of thay.  I am going to have to live w/mine now.  waahh! help me! please!
0,USER I have no idea - It still bothers me  At least we got a good movie out of it
0,USER aww  some guy is talking to me on msn and saying i sent him photos of me.. i soo did not. arghhh
0,USER ok.. i need to by it then
0,needs money but has no desire to work today.
0,"USER will try really hard to make it, but i can't promise.might have loreto interviews the day after"
0,very lonley  #jtv URL
1,is waiting to hear the interview  xx
1,USER haha! Lucky you! I'm in college!
1,USER pussy oh and I saw some hot ab pictures of taylor lautner ughh he's gorgeous
1,USER good luck on your finals!
0,"USER hang in there hon! Been there, and it sucks"
1,Flying back to AZ today and then editing my red carpet coverage all day
1,"Just updated my blog  Market Analysis for June 1 , 2009 URL"
1,"Shower, shave and coffee and it's only 12pm"
1,USER Thanks. Much appreciated.
0,"...still ill since last sunday.  but however, it's time to prepare for next set: sat, june 27th 20.00 cet @ airfiel grossenhain (ger)"
1,relaxing
1,USER Hey! R u Going to the PCD and Lady GaGa concert?? I love the new song by Lady GaGa and rihanna  Your so lucky if your going!
1,USER i'll look for it. you must love your job... it allows you the luxury to spend hours infront of the set
0,a very sad news day today
1,USER: working on first draft of my compilation: 'SHOWTIME v1.0' ..it's gonna be a good one. i can tell
0,"USER but i dont want you to cry hunny, okay?  and especially NOT cause of me!!"
1,"USER yeah,2nd year,how 'bout you?"
0,Aaah up to early I have a history and french exam today  So upsetting haha  zzzzzzzzzzzzzzzzzzzzzzzzzzzzzzzzzzzzzzzzzzzzzzzzzzzzzzzzz
0,USER We only got the edge of it  I want the full on thunder and lightening that was heading over matlock when I left. I love storms.
1,Haunted mental asylums. Fantastic
1,Cooking dinner for the man
0,sorry i tried to tell u but i couldnt! i was takin a test and i had to turn my phone off! im so sorry!
1,"USER I wish!  Friend needed some research done, so I helped her tweet it"
1,"USER i like it, devon."
0,Goodnite and sweet dreams twiggas
0,USER i'm in helene's office... the office across the hall belongs to someone else now!
1,Unbind the broken/release the pieces that's left/and time will heal them/ - Title: Letting go -/#haiku USER
0,"USER yeah i saw when this was first announced and checked prices. EXTREMELY high and unaffordable  however, i'd still visit you again!"
0,"I would rather have a balanced life and a full weekend, than more money and come in on Sunday. I want to say no to overtime"
0,"Charlie, spike, and nahla are impossible to take care of"
1,USER sureee. ) mee too!  ;;) )
1,"my legs hurt like no other! but the dance was amazing!  very good night, id say."
0,my gnome left me  two days were not enough for our happiness  I MISS HER ALREADY
1,USER the same!
1,looking froward to FALL FRENZY!
1,"Oh, yes... Happy NINE year annivarsary to Hanson's second studio album, ""This Time Around."""
0,USER Oh no! That's heartwrenching news! You have my sympathies  I hope your mom will get you so more! And bite MissyLou for theft!
0,I WANNA TAKE A NAP D: but i've got a lot to do
0,...its not out yet
0,Internet has been wonky today.
0,Gentlemen's Club advertised on radio that the have Chocolate Pudding wrestling on Saturday nights... I wanna go...
1,Early Niteee! Gots 3 Services Tommrow!..Nite Twitters!
1,USER that V curse only applies to NLHE
0,"USER My phone has been in my car all night I'm too lazy to go get it!!! I kno just awful dnt nobody call me but u , don and tj"
0,"Yeah.  What number do I have to text in order to Tweet from my phone?haha, I don't remember what u told me before. Sorry! Haha!"
1,"USER thanks! they are really old - i need to do another one, with more recent photos, with better camera"
0,USER i dunno... i only use the app version
0,USER  but i dont wanna
1,"USER USER  Great to hear that man. Go, Yellow, go!"
0,I'm about to get in the shower! ;) I'm a bit sad finding out NOW that Playboy's casting at the mansion. I would have held off till then!
0,wish i was watching crank 2
0,"today was so-so lots of work, AHH i need USER tickets"
1,Just bought a ....variety of body parts at Walmart  I say a good night!
0,USER - I currently feel like I'm going to be sick. Erghh.  Go t' town. It's lovely out. Just don't lie on the grass.
1,USER GOOD LUCK! Hope all goes well
0,"USER awesome!2 months!..but i go on holiday with some friends so..that's 10 days less,and on camp,thats another 10 days"
1,I'll make you FAMOUS bishes!
0,everyone in my house hates me today
0,Yeah. Me too. I totally know how you feel KT...
1,"USER Great, good to know."
0,USER awww don't say that!
0,erg! the beaches are perfect back home today  gville hang out plz!
1,"Hooray USER for finally joining the addiction! ....now, to just get him to get a Balckberry....."
0,I wish we had a toaster oven in the office.  Pizza from a microwave is disgusting
0,USER dealing w/ post-BEA  by talking about it nonstop & annoying everyone around me. ha! & looking at photos and big stack of bks!
1,"Narrowly avoided a bad hangover, that was close. Feelin better now, ready to go out"
