0,@kindareal still not doing well with the contacts  im such a wuss!!
0,the air france happening was sooo sad there was a baby on the plain too 
0,On our way back home. Dog threw up in the truck. 
0,home from the cottage....and burnt 
0,They ask sooo many questions 
0,It's Sunday!! Tomorrow it will be my last day on Maui 
0,Is flipping between world hunger info-mercials and obesity clinic documentaries. SMH 
0,@Lady_Gig thanks for the follow! Have a great Sunday! I would but I'm off to work in a couple of hours until 8 o'clock tomorrow morning 
0,"Back from work, my feet are still hurting after last night "
0,@olympusjack why wasn't i invited? 
0,packing for camp 
0,i've watched titanic hundreds of times but leo dying still gets me every time. 
0,@beardandbeers I forgot my jacket at the Barbary last night.  I suck.  
0,thinks kristina hates me....for good 
0,How could this situation get any worse 
0,All packed up about 2 have brunch at BB Kings before heading to the airport..Why am I so sad when I have to return to VA 
0,"@PanMassBike Sadly, I won't be around on the weekend of August 1-2  I'll be back on tour with my show. Thanks for the invite though! #pmc"
0,I cant find my lady gaga cd 
0,@djdrizzle you're not even that far from us smh should have stopped in D-town 
0,I'm actually really scared for Bio.... 
0,Maths homework 
0,sorry i haven't been tweeting. my internet has been dead all day 
0,@1bigcurt thats what I want... im missing the person who cooks it tho    and lord knows by lil behind needs to start w/ balanced bkfast
0,@whitelily22 *hugs*  Hope everything gets better soon.
0,@shade53 
0,@dlpasco dude that sucks 
0,@erin82883 oh. i didn't know that! well yay! tmw is too far away. 
0,"really, really, REALLY, R E A L L Y   wants to go to sleep... "
0,@Mom2chunkymonky  Sorry to hear that. Hopefully the nap helps.
0,Science and maths text tomorow; get any worse?  x
0,Saw Newton Faulkner in Wakefield last night. Awesome show by a great entertainer. I'd go again if the tour wasn't sold out. 
0,@LJWJKealing I was so sad to see that banner ad yesterday. 
0,From iPod touch! Awesome. Still not sure hw to put videos!! 
0,sq flight prices dropped by 6 bucks  and there are now seats for 4th jul. ROAR. cld hv left a wk later! 
0,@gelicaaaaaa nah i didnt look   we rly need to watch them this summer
0,@VATD i keep applying but failing 
0,@aplusk http://twitpic.com/2of3d - Your wife is ver very much beautiful omg 
0,I think it's time for a dry June... Red wine hangover sucks 
0,@kinagrannis i just hope i could hang out with you someday kina.. 
0,"@DrunkenGamer Thanks man, i've checked through that site already, i can't find it, and Linotype Agogo is the wrong one "
0,@Lamb_Bella She Still Haven't Accept Me Yet 
0,sore throat 
0,Off twitter for quite sometime now! @manimeow could only see your GM wala msg now!  No power in Kerala. Monsoon X-(
0,"@graan_jonlo Hi Phil! Oh well, still sunny here, but I'm inside working   (Having said that, it did snow the other day!)"
0,Very very tired and sleepy this afternoon 
0,I lost my car in the parking lot 
0,no one to talk to  xxx
0,I`m so annoyed. :| ) I wanna go to Metro Station !   But I`m arriving on the 12th. :-<
0,"@deafblind Dude, I'm not done yet. You should see the amount of cake I have left. "
0,@tommcfly wanna vote for you to be Mr Twitter but the page isn't working properly.. 
0,"@bootnumlock  Fix is on the blog, pls check it out. A stupid typo on my part  Let me know if it works for you as well. http://bit.ly/q9NOX"
0,"im thinking of you mir, can you read it please?  â« http://blip.fm/~7ssy4"
0,"JImmy Spencer is picking who he thinks will win, not who he'd like to win I think. Unfortunately, I give better odds to KB than Dale Jr. "
0,I wanna go to Metro Station !  But I`m arriving on the 13th. :-<
0,"Watching friends, so pissed off  xx"
0,"@Charlotteis Yeah, I'm going to be missing a few days. Wisdom teeth.  Basically going to be drunk on medication, haha."
0,"OK...T-mobile has made me a happy woman finally.  Now, I have to get over this hangover.  Breakfast tasted terrible.  "
0,ms bocinas chafean 
0,"Ugh, so tired   Mornings and I are mortal enemies."
0,Hope to get a good night's sleep...since i need to wait till after midnight to turn in everytime 
0,"@KitriCastanets I heard too. Graphics are updated like nobody's business. Image heavy though, causes laggage "
0,"I showered, got dressed, and I'm ready to go, but everyone in my house is snoring. I want pancakes! Someone rescue me please. "
0,"@NeverShoutSophi Thanks a lot   lol , Im On My Bass Now "
0,Great. Forgott my keys at my parents. Now drove half way back to meet them. Stupid waste of time 
0,"great night.. not such a good morning, since i have to study n i really dont want too! "
0,Staring hard into my laptop with nothing to do and waiting for the anti-virus software to complete the scan. So bored... 
0,Misses Dirty D   _Going to spend time with Jess and tha family_
0,@themissyc hahaha all I had was 50.  id use spf 1000 if it was possible. LOL! <3
0,"Can't believe that I'm flying home today.  then on Wednesday flying out to NYC. Woot. Jones beach, here I come!!"
0,Jay-Z just got killed in a car accident!!!!! NO!!!!!!!!!!!!! I LOVE HIM SO MUTCH!! 
0,@grantepowell  lol if u can get here in 30 mins or so u are very welcome  i want a lg cookie i think  id love iphone but cost way to much 
0,studying for exams 
0,"breakaway  really wnt another can of coke, bt already had 1 today and a redbull :S MUST go rev for maths 2moro  hope mum n andy are ok!"
0,Off to work. I have a 6 and a half hour shift today. Let's hope I can make it through the day. I'm exhaaaaauuuusted 
0,"i think i'll be dozing off with this bio file of notes next to me! migarine, flu and fever, freaking go awaayyyy! "
0,@greekpeace just responded to you on fb. 
0,@jasonwendell It's going to be a site with a bunch of desktop and web apps. There's a lot more to it but I only have 140 characters. 
0,"Only seven days in, and I have already used my two days a month that I call in. Now I must goto work every day I am scheduled until July. "
0,"@mikebone no i know...it's 11:30 pm on sunday here.  tomorrow morning at 5:30am and 7:30am will be the live feed, and breakfast is 7:30 "
0,"feeling better, but still a bit sick "
0,@jtimberlake  wow! justin you're the besth !!! i love you! realy i like so much how you dance! please follow me 
0,wish i could sleep in.  my body just won't let me 
0,Im so freaking tired 
0,@WATERSNANANA  damn I wish I was back home in brooklyn...where the summer jam at New York?  
0,Am i going to miss BB tonight... 
0,Just woke up and my head is pounding! 
0,Just woke up it's 12:34 pm and there was only one update on @perezhilton .com 
0,Twittelator is failing me and not being able to access twitter.  sadface
0,OWWW! I was just stretching and I think I pulled an effing muscle in the right side of my neck! OUCHHHHH! 
0,why does always rain when i'm on holiday 
0,Any version of linux + ATI drivers = epic fail...... Almost makes a man want to use windows 
0,"Home abt to get that wii fit in since I'm not going to the track today and then to the open house, and I just remembered veggies only "
0,"Love my weekend, hate your weekdays! "
0,Re: Drew's Sub. No bike....  View: http://bit.ly/IK0Oy  by Drew44
0,@thedomesticdiva Both! Happy and sad... 
0,&i cried again realizing that i have only a few days left to spend with u. 
0,I'm coming to the end of my Bond marathon. Sad now. 
0,"Rode my bike (for the first time in many years) to Randall's for breakfast supplies, but they lacked Little Smokies and Crescent Rolls. "
0,Hella depressed! Iiun even kno why 
0,@only1_cHi Yes...maybe worse 
0,Tennis all morning?    Where's MTP????  This is ruining my Sunday morning routine.
0,"I'm watching Michael Palin's ""Around the world in 80 Days"" from the BBC as I work.  I'm really wanting to travel now. "
0,I don't like my new playlist that I made. Need to keep working at it. 
0,@Dezz_MCR  are you following that account?
0,@lanehartwell i totally feel you. 
0,its storming! I'm scared! 
0,Heading to Charlie's Beer Garden to watch the sox game on a beautiful afternoon. Last day of vacation 
0,I miss my boo bear   *L!nd@*<3*Cr@!g*
0,watching london ink with my dad and sister. i really want a tattoo. 
0,@HeyTreeeee I didn't go party last night either. 
0,raining 
0,Wish I didn't have to get off the skytrain and go to work. 
0,Cathie and I are missing the Lighthouse family this morning  http://yfrog.com/86jnbj
0,Today: Church> Gardening> Made hanging baskets> Went round a country house> Tea and Cake> roast dinner => middle aged before my years  NG
0,"I feel like an old glove today.   I need a long bout of sleep, I think."
0,Wishes he could have an Escapism pre-meet. But is the only Escapist in the area 
0,I hope I'll can see the 3D movie again with Agus 
0,Hes all gone  oh well get to see him tuesday night
0,church was great today!  miss being @ church. in stl!  
0,"50F is just too cold for june, minnesota!  DO NOT WANT "
0,stil finking bout who she luvs  but unfortunatey 4 me its neva gna happen
0,"Spencer is picking who he thinks will win, not who he'd like to win I think. Unfortunately, I give better odds to KB than Dale Jr  #nascar"
0,Lmao def not my fault my nigga but I acknowledge the tax lol @kingja327 n @hovitosway35 ::heres 40 cash split it :: 
0,@LuvableGftofGod I am well. Had a beautiful weekend. I went to the NY Greek Picnic but a lil sad because I wish BK was here. 
0,@franklanzkie good morntingggg frank. How have u been? U don't lub me no more... 
0,"@ash_kay its ok mamas, we jus gotta chill again  i missed you guys! like almost 2am"
0,@KathrynJaz im okay with subtle hah. i never go outside 
0,"@liveonmars lol! Good for you on the jog, I skipped it today. So I'm sure I feel it tomorrow. "
0,@MariahCarey82 think it'll get wider release soon? 
0,loves being at home with her family....bar humbug....work tomorrow 
0,about to go to work all day 
0,"Ew, fuck work. "
0,going to orlando cellphone is broken 
0,@lindsayknox03 you lucky lucky girl   i hope to hear all of your stories tomorrow morning as i live my life vicariously thru yours!
0,My nose started peeling 
0,"@shawnified now shooooooo , go sleep lah , LOL . if not i  in msn . LOL"
0,i cried last night  cause i miss kahel so much ! i remembered all the awesome memories. 
0,@sophiakills the childrens hospital orientation thing? I know right. I really wanted to volunteer there. 
0,ugh sO far day has started Off bad  hOpe it gets better
0,wow take a breath i havent hear u long time agoooooooooooooo 
0,"When you break the lid to your crock pot it's pretty much over for that appliance, right? Yeah, that's what I thought "
0,my abs hurt so bad 
0,@LeanneBarbery EESH Look after yourself hun not fun 
0,fuck. i think i may have tivoed an hour of msnbc's weekend prison show crap instead of pushing daisies last night..... 
0,@guruubii Not that I've managed to find...  x
0,Hurt my foot REALLY bad..emily has to help me walk everywhere  
0,@girly613 thats messed up!! 
0,@THE_REAL_SHAQ I jus saw the piece abt the horses getting slaughtered. My ? why not the same outrage as the country had abt the dogs?  sad
0,"@mitchelmusso i preordered your album and am still waiting for it to arrive to me in the UK  i bet it's amazing though, xxx"
0,Is really bored.  Chatting with shakaaa!!
0,Finally! Deutsch final went well. My next final is next week...finance!! I cant wait for the summer! 
0,needs help with homework 
0,"@juhidee119 sadly no, i would have let him. it was my co worker. "
0,@chriscornell you're lucky...we're getting snow 
0,@TynzBoomPow My brother wants you to follow him. HAHA! GO FOLLOW K. i wanna watch Hannah Montana too 
0,"great nite! wish i could just chill now, but have to fix computer "
0,La Boqueria was CLOSED! (so no El Quim for us   )  Turns out Katya gets as mean as I do when she's hungry... don't tell her....
0,So so and so tired 
0,"@cg219 yeah but it's really ugly, involves very frequent intervals to detect right button and also based on undocumented Key.isDown(2)... "
0,mcfly secrets isn't what they used to be 
0,@Amrix lol havent worked that bit out yet - also wasnt allowed to take pics of performance  - its worth going to see it!
0,"@jamiemcreject Jamie, condolence.  Yeah, like Steph said, she's in a better place now. At least she doesn't have to suffer anymore."
0,@lyrehs  i can't believe you're still awake! BIG HUGS!
0,hit by the la la land machine 
0,Not in the mood for work at all today 
0,@kellxmcr oooh that sucks  is it on a PC or Mac?
0,@JoJojb in LA at some fairgrounds. aww i found times. its 12-4 
0,Oh Dear this isn't looking good  Ravi Bop out already [sigh]
0,sims 3 will not work for me  soooooo unfair! no sims 3 for me!
0,"On the road again. I just deleted all of my pictures and videos from the past 3 weeks, accidentally.  wah..."
0,@jamiemcreject Condolence Jamie  she's in my prayers right now.....
0,@chibu yay for new houses! wish i could've helped 
0,"it's times like these, special occasions, where i wish everyone i love will be there. i wish i could see my best friend, I miss her a lot "
0,just realized I don't have any batter mix for pancakes     So backup plan is grape nuts and orange iced cinnamon rolls for brunch.
0,oh god the European authorities must REALLY hate torrents cause they are taking them down. first its Pirate Bay. whats next?  NOOOO!!!!
0,Should Of Been More Injury Time.. 2 Points ..Disappointing Game.. 
0,@fragileheartxx I have a fever too  I don't feel well -_-
0,@talkradiohost Sadly No. Too expensive. Was able 2 go coz I was #3 on a list. I'm #4 today  I'll be watching w/ friends & fam. GO LAKERS!
0," packing up all of our stuff, gettin ready to leave our wonderful b&b. Gotta find somewhere to kill time till we can pick up our dog  ..."
0,"@srk_SaY13 ""...THERE IS SUPERSTITIOUS..."" listenin to that! lol OMG"" ITS SKL TOMO! NOOOO!  x"
0,Wishing my dreams could come true  Knowing they never will 
0,aww damn my sweets finished 
0,"sleepy and tired, but tough reality is awaiting for her this week. "
0,oh great and now he's gone to a child bowler. Please let this be over quickly 
0,stupid model wont freaking paint!! The stuff keeps falling offfffff!!!!     
0,morning twits! i been bad - not updating    well here i am!
0,@jadoredaff wazz goodie daff long time no see or speak 
0,Homework Sunday 
0,"Got no revision done 2day  ,, French Open  Turkish Grand Prix  Federer  D-Day  Sims 3  Rubens  Button  Vettel  Rove  Barrichello"
0,wants the rain to stop before 6 
0,"@RoyalBlueStuey Yeah, I heard, go for it. Do you know who else they've got? I'm at Queens again next week but there's no Nadal or Djok!! "
0,@CydaraElise me know 
0,@jordanknight link doesn't work for me    it's a nk conspiracy!!!
0,watchin mariah embarass herself  lol @BeaTJuNKiie21
0,Time to study all day long 
0,Just finished planting garden #2 for the year. Any more frost - that's it no garden! I will have to buy relish at the store then. 
0,I wish i had a pool 
0,@MuGzyMcFLy  booo
0,"goodmorning everyone, I got ur pokes lol...im here im here...idk what im doing 2day  "
0,My poor N had red rough knees yesterday after a day of scooting around everywhere... 
0,@heathersnotbsc thats no good  side effects suck
0,missed another event 
0,feeeeel siiiick i loook terrible  ahhh fuck it
0,Mom I Miss You! 
0,Miss my cat and my friends in Britain. 
0,is about to do her maths homework. ugrh... 
0,"@jordanknight i would love to vote, but that link won't load! "
0,BONES Season 4 finale. Very nice but also very sad. 
0,"Here's ""lil digger's"" cousin - TNT's RaceBuddy http://twitpic.com/6u4lb   #nascar"
0,@theimp67 nyah nyah nyah! if i had money i would go in for a takeaway too! but i dont 
0,life's such a â² ure not here now. 
0,"Up, checked on my friend's doggie because he went on a trip.  Doggie's pretty different today....."
0,still 4 month til the Miyavi show.. 
0,Looking at plane tickets to go Home...I hate how airfare is stupid high to bank on the damn tourists. No resort/beach; just send me Home 
0,"woke up with a toothache and a stuffy nose  Sigh, this is not going to be a good day for me... #yeg"
0,gotta get dropped off at my ex girlfriends house by my mom so that i can hitch a ride to camp with her new boyfriend. at least hes cool. 
0,Mail app only appears to store 2-3 weeks worth of mail 
0,Drag me to hell was scary 
0,I miss my puppy  http://mypict.me/2VpB
0,Got Dreamweaver. Talking on Skype while FAILING at coding 
0,@jordanknight i would vote but i can't get the domdamn link to work!!!!! 
0,bruise on my right hand wont dissapear 
0,"I saw an omnipotent being yesterday. Went back to meet him but he had gone  Bet noone will believe me,I have witnesses !"
0,"Awh I didn't win the lottery, back to work tomorrow for me "
0,Trying to find a job its too hard 
0,@Rocker384 Mondays are my least favorite days of the week 
0,@lostinsound Gav & Stace is the shit. I stuck on the 2nd series the other night and watched it from start to end. 3rd and last series 
0,i'm going to practice driving today. my driving test is next thursday  i regret lagging for so long. could've had a license by now...
0,@bludog61 Mornin! I missed it.  I was at my friends bday
0,"@HurtFamily Ohhh yes, IÂ´d love to be there so much too.  I saw him in Bochum which was great - Now IÂ´m looking foward to Hamburg. ;)"
0,@JessDover Nothing fun today... 
0,Leaving new york today  Really don't want to leave my friends behind.
0,@Pancua I forgot my lunch 
0,Maria... I never got anything in the mail. I checked the address and it's right but nothing ever came 
0,I'm sad!  I can't see Trey tonight! FML...I NEED to be 21!
0,@tommcfly I would vote for you but the bloody site isn't working for me! 
0,Omg. I think I got my doggy sick!  Can that happen??
0,i just wish i was at wwdc 
0,"@gallarotti Keep on rubbing it in  .. I envy you SO much. Was actually planning to make such trip this year, but with this economy "
0,"Starting at 4:00 pm EST (see megan? im using the time zone), my cell phone is being taken away from me "
0,@jordanknight url doesn't work.  is it wrong or just on my end!
0,"Very disappointed with the results of the elections. Separatists, racists and catholics still seem to dominate our government "
0,At Liz's house. I MISS YOU TWITTER! my daddy needs to get the laptop fixed 
0,"this is real, this is me. - hiyajenny Nâawww Iâm like so much taller than you  When me and Claire come to... http://tumblr.com/xzf1z4zev"
0,"Back from work, now I'm tired "
0,"@Proachrox i'm sorry you're having a rough day  well, it's better to let it all out then bottle it up....hope you feel better."
0,@jordanknight your link is not workin 4 me 
0,@Andywaine argh! i wish you werent so busy!    we could have had a camp rock dayy!
0,Ryan Sheckler.com oh boy i love that thing! I want to meet him so bad 
0,"@DrCSaroyan I didn't know you did yoga. That's cool, I love yoga though my class just recently ended. "
0,Sims 3 will not work for me  soooooo unfair! no Sims 3 for me!
0,@Kevin_AnR_Shine I wish I could come to ur July 15th event but I'm stuck in Chicago. 
0,@x3beckyyy sexypants leaves soon 
0,Someone pointed out in the bugs list @precentral that the #pre doesn't display the home state of an unknown caller.  FAIL!  I need that. 
0,miss them 
0,@robdyrdek I can't make it to new york this weekend to see you 
0,"Major headache today, but must go to work "
0,It's beginning to look alot like. . . a bad Sunday 
0,Umm... not that nice a day right now 
0,Wearing shoes and socks for the first time since Cobra. Shoes fail. 
0,"so glad i didnt go pre-pharm. i know they're making a lot of money, but counting pills all day and dealing with crazy sick ppl all day "
0,http://twitpic.com/6u4td - @GewoonLianne Not a very good picture. Sorry. 
0,@PeytonSlamming oh neat! I'll be at practice though.  is this a recurring thing?
0,OOC got five more minutes. Got to go to work. 
0,Not tweeted for 4 days. 
0,OH: Home. I wanna take a nap so bad but need to do homework  http://tinyurl.com/r9328b
0,just woke up! finna do this car wash 
0,"After years of refusal, I joined facebook. B/c my dear friend's daughter is in the hospital and she only sends updates via fbook. "
0,I'm out mentally and psychcally 
0,@MissJohanaLove yeah it's awesome cuz Mexico is now 5th place but at the same time Honduras is now 4th  stupid salvadorians lol
0,My computer has gone strange  x
0,Leaving the lake.  but had a great weekend..just went by too fast!
0,"@fiddlecub Well, I SAW you plenty at E3, nestled next to the rest of the GS crew in your fishbowl war room. Never got to say Hi, though. "
0,Not really looking forward to BlogHer now. @childsplayx2 likes exotic and @karlerikson likes ebony. Tall blond me won't even be noticed. 
0,@totesfawkward Excited for it? New fones. Snow leopard? Rebranding unibody mbooks?  I know what tweet trends will be tomorrow.
0,Damn..now my HDD is also heating up   http://twitpic.com/6u4tq
0,Is in bed with her cousins!! Not looking forward to work at 1:00 
0,No beach volleyball for me  Maybe a Lord of the Rings marathon or french films all day instead - that's a good compromise
0,@MitchelMusso I wish I could come to one of your concerts! But I don't see that you're playing in AZ 
0,@Stpsam actually no. They are ignoring me. 
0,"TR @Umad80 rofl....Just remember that Twitter API limit...If you exceed too many in an hour, no more posts  "
0,@Arree @_santi @sykery aw.... I wanna go to breakfast 
0,@MSPRETTYPRETTY (whipes tears)  ok *sniff sniff* lol..wat u do'n ugz..
0,@jordanknight Link isn't working hon. 
0,"@AceMas21x2 oh dear, looks like the twitter detectives were on to you! "
0,"3 days till my bday! That should put me in a better mood, but doesnt "
0,i have a test at school  tomorrow  i hate tests
0,So I couldn't hang for the Cheetah Girls movie night  mega worried about this rere_-
0,ARGHH tech gcse tomorrow!! im starting to panic now  i probably shouldnt have left revision to now
0,I just found out that Jag (our neighbor's little cat) was killed by another cat a couple weeks ago. 
0,played Left4Dead yesterday. Involved lots of screaming and shootind at ones own/teammate's leg. Hate zombies. And suck at aiming. 
0,Bored as ! Quite tired as well school tomorrow  I want it to be christmas xxx
0,"@bbgoodMAYA i found your myspace today, but i cant add you because i dont know your email. "
0,"julie left  two days of work free though, good."
0,has been struck down with another cold 
0,Work... 
0,Saying goodbye to my apartment and walk-in closet. 
0,@hannahvicedo Can you figure out what time is the replay of Oprah on hallmark channel? I missed it.  please
0,"Actually can't remember half of all this History, bad times! "
0,I need some tlc... 
0,@WalkInTheSun_ and i keep forgetting what the site is haha :p no i'm not  none of the forest gigs are anywhere near me (n) you? x
0,Dish duty followed by CPR class. Not my favorite day of camp!! 
0,@shannonsgoat oh sorry your going out no syrup for you  *later I promise*
0,"and ya, @sreejithraman da partey was fuN!!! bt 2 days in a row is prety tough on me  im getin sooo tired ..."
0,@jordanknight The pg won't load for me. 
0,Settling down to dinner with the family and a nice quiet evening before the return to work tomorrow.  100 emails down about 250 to go! 
0,Ahh! Me & Poundcake overslept 2day!  Guess we'll have 2 catch th@ Wednesday service.
0,It would seem the answer is no  I cannot claim my twitter feed with technorati
0,"Am feeling horrid. Nose is burning, eyes watering, body sore. Am already in bed "
0,@_HarryKim OOC:  it's okay.  
0,I'm really scared 
0,"Aww, I wish I had a friend to go to Orange Wednesdays with. "
0,@GameGuyPete I a very sorry to hear about the loss. It is hard to lose somebody that is that close to you. Best of luck. 
0,what happend?? 
0,Ugh...I don't like crying 
0,"Eatting breakfast wit @djredz...@flyyseni I'm so jealous u goin to a.c without me, my ass will be @ work "
0,"@NerdwithSwag I loved that gaming unit, mine broke quik tho!  I couldn't play those games now after playing ps3! Ps3 is crazy dope!"
0, i  missed church.....AGAIN.......stupid backwards sleeping habits.....
0,iss in alotta pain  - i love you ( 2Greedy ] Â«- LOL *insider* .
0,"@elanurel Yeah, no shit to that.  But I suspect the usefulness will go on long past the chemo--I used to love reading fic on my handheld."
0,@mrskutcher i have to say i have been to the states twice and it really affected me to see so much pain. san fran was worst. city of love 
0,5.1 (electronic) music is so incredibly awesome and fun to listen to. it's a shame there's almost none. 
0,@PaulaCook I have to work... 
0,My daddy is picking me up at one 
0,"@liamsbitch Yeh ""summer"".  I went into the exam yesterday and it was kinda cloudy but dry, came out it was raining heavily and quite cold "
0,"babysitting super bored,alex isnt coming back until tomorrow  ehh missing him"
0,Alzheimer-grandma is depressing. 
0,@stasia19 i hope it's not bad 
0,@ebarrera i just got used to wandering in at 9 am to watch the games. now they're playing an old wimbledon match. 
0,@EmilysPearl sounds yummy! Sorry for not getting to hang last night 
0,"@yelyahwilliams http://twitpic.com/6u375 - lol hayley, you're lucky, there are no wind tunnels near where i live  but when we tour ire ..."
0,its raining again 
0,"Rewrite just not flowing today. Going to have to put it aside for a bit, I think. "
0,@ReemerFletcher Hey! Leave Miley alone 
0,my blisters from wearing birkenstocks have turned swollen  *ouch* wear expensive slipper also can get blister -___-
0,Welcome to June in England  http://twitpic.com/6u4ww
0,I'm too tireddd 
0,looks like nobody can go to gay pride  i wanna kill someone
0,@dieslermusic @PrincessSarahXx - me too! I still think he prefers Kate though 
