0,@kindareal still not doing well with the contacts  im such a wuss!!
0,"omg, serious toothache going on right now "
0,i know your live is very hard......but iÂ´m always will help you you are my friend  donÂ´t be so sad sometime god will help you!!! <<3
0,"maaaaaaaan, got another 4 hours til JLS  x"
0,revision 
0,@dannywood I LOVE that you run a charity for cancer research. I run a charity for cancer patients: Henry's Angels. Lost my guy to cancer. 
0,being somewhat sick 
0,raining again. writing my story- feeling lonely  x
0,@aleshabell I wish I were in miami 
0,methinks I grew taller. AND THERE IS NOTHING FUNNY WITH WANTING TO HEAL MY SWEATY FEET 
0,wants to eat.  http://plurk.com/p/z3n39
0,"@VH1Hoopz i can't  ask me why please so you can be like the 3rd celebrity to talk to me i think, if not that, then probably 6th"
0,good mood gone (it better comes back soon) right now i feel rubbish 
0,"@staaceeyy haha he is confusing, i just hope they dont  </3"
0,Not looking forward to moving up classes next month 
0,"has blood all down her stairs, coz he dog cut her foot. Poor doggy "
0,"porject todayy.  alexi,kassie&sabrina are coming overrr. WOO. imma make little people out of clay! "
0,You didn't even text me  how sad.
0,Really wants to see her boyfriend right now 
0,"Yaaawn.. Mornin Tweet, getting geared up from my slumber to go hit the roads! Plan to train extra hard today cos it's my last day @ home! "
0,I need a hug !! Haha 
0,@GeoffLiving Ugh...thanks for bringing that disaster again - think I'll just ask @shashib to open exit door so I can jump out 
0,Tired and doesn't want to go to work later on ughhhhh 
0,I wish I had someone to cuddle up with atm 
0,i hate that this weekend is all clouds and rain  i want sunshine on my days off!
0,i miss josh and his voice  .. goin to watch Drillbit Taylor.. I'm going off now.. I'll try to twit on school tomorrow rock on!
0,@twitter what's #twittergag?  Is there a limit to how many Tweets we can make in an hour?  I've been gagged twice randomly  Not fair!
0,uh...2morrow vacations end  need 2 do something for school... >.<
0,I really wanna see my boyfriend right now 
0,@StewartKris Kristen! Please follow me.  I really really want to communicate with you! PLS PLS PLS. IM BEGGING!!!! I LOVE YOU!  ...
0,Sunday morning isn't the same without the City section of the Times 
0,mam wont let me have pizza  .. and the scent of cooked dinner is getting stronger  NOOOO!!
0,Going to the zoo today -- that is if the rain doesn't get too bad 
0,Then clean and off to a funeral 
0,Back in North Yorkshire. Still sick. Perhaps I am just love sick? Miss you Sean 
0,Leaving for Toronto in about an hour. Looks like the weather is as crappy there as here. 
0,@RieTheChick why wasn't ur own sister invited? 
0,@CrimsonMe  regarding spymaster recruitment. I still don't have an invite 
0,Has anyone had any issues with Windows Mobile Device Center on Windows 7 ? I cant get it to work 
0,"Great, even without the kiddies here, I can't sleep in "
0,"@butterbean74 yeah i now, would be a happy accident. i think. lol. have contraceptive injection tho so not much chance of it  broody now!"
0,Hungry this morning ~ There's no cream cheese in the fridge ~ My bagel is sad  #haiku
0,@StewartKris Kristen! Please follow me.  I really really want to communicate with you! PLS PLS PLS. IM BEGGING!!!! I LOVE YOU! (
0,@Pallekenl  it does take up a lot of space. 6 GB.  I have a big hard drive. i hope it doesn't kill my computer. michelle would be really 
0,Tired at work with headache  7 more hours to go...oh and getting up at 530 am tommorrow...good times
0,I can't breathe. I haven't taken a real breath in two days. I hate when people prove your worst thoughts about them true. 
0,"@greenlife182 Damn it, I went out and spotted no rainhats whatsoever. Plenty of oldies, but no rainhats "
0,has a cold 
0,Hope the trading and the gifting buttons come again 
0,OMG! Last night was the last Mad tv ever!!! 
0,Guten morgen alle. woke up earlier than hoped with a bad neck pain. Oh well. Looking forward to another day of yard work. 
0,Should probably be revising. I'm really tired though. 
0,@Audioptics Where oh where?  Come back...
0,@mjanofsky My last day in Williston is on Saturday. I'm going over to the Plattsburgh store. 
0,"installed boxee plugin to  VIsta's WMC but no #boxeetv icon appears on my 360 extender, "
0,@QuilAteara1 thats no fun 
0,@MiriamCheah oh no!!! I just looked this up on youtube! Its really good! 
0,finished kyle xy just now 
0,@scottcrazyfresh I hate sleeping in too much and missing out on all that day. 
0,People talk so loudly in parking lots 
0,packing up for the trip back down to Orlando. 
0,up and ready to do some work....no summer jam activities for me 
0,Here's a small note i wrote to my santu.. My car that was sold last week  http://bit.ly/ECKiY
0,@StewartKris Kristen! Please follow me.  I really really want to communicate with you! PLS PLS PLS. IM BEGGING!!!! I LOVE YOU!  .
0,#google page speed addon crashed my firefox 
0,@squishycookie HEY WHY AREN'T YOU ONLINE OMG I WANT TO TALK TO YOU LIKE NAO BEFORE YOU LEAVE. 
0,Lookin forward to 5s tonight workin mon to thursday next week 
0,My cell phone is broken  need to see if I can get it fixed...
0," i just went to take a sip of my tea, and lifted the wrong cup. mmmm cold tea!"
0,I just want the damn iPhone OS 3.0 update to come out now 
0,i am kinda missing the rain 
0,@jessdl23 too bad you didn't let me know you were interested I just sold my JB & Jersey tickets a few weeks ago 
0,"our servers are down at the moment here in Kosovo, working on streaming the show to you "
0,says another rainy day.  http://plurk.com/p/z3ns6
0,@TateBFG yea I'm feelin good. Thx! Grilled cheese is bangin! I didn't get to eat 1 last night  so ill make 1 this mornin
0,Sometimes you're walking home from work in the morning and you see a used hypodermic needle on the sidewalk. 
0,@TessAaaah hates me and wont tweet me back 
0,You still haven't written back.    Are you in church or something?  Or just sleeping?
0,absolutely hanging ... one and a half hours sleep and so much alcohol 
0,more bodies found from air france flight. now its at 5 
0,reyt fancies a roast dinner 
0,Showered and dressed and feeling a little more human - really don't want to go back to work tomorrow  !!
0,ahhhhh i'm so bored and fricked out 
0,me and @pcdmelodyt got the same thing. is that sick of knee 
0,ulcer on tongue. sore throat. cant speak properly bcos it's painful 
0,Drivin back to ohio to do some more studyin! Yay 
0,@iRicochet u shud come plz or well be forced 2 wlk all the wayz 2 ur howse which iz far 
0,"Paraguay, the leader of the exhausting 10-nation qualifying league, slipped to a  2-0 home defeat against Chile yesterday "
0,Not wanting to go to work 
0,@urbanflights What a waste of my 5 bucks. 
0,On the plane. Already missing @mattpippen and @CassidyAlexis 
0,@laurasmannequin yep they do. 
0,*pours out a 40 for Steve Nash* Pity that Phoenix is starting to become a retirement home for Hall of Famers past their prime 
0,@LilianRM ash 
0,I really need to get up and put my makeup on 
0,i havent felt well for a week and i have to start work tomorrow 
0,"@xjade09x cool! mines just boring purple, i wasnt allowed to choose anything for my own room "
0,k so im um now im goin back to sleep... i feel tired but i dont i feel weak but im not i feel sad that i am  do-do now so is my baby boy
0,@terrydactyl_ Oh you changed your pic again 
0,"I managed to wake up in time to see Kallis and Smith get out  But all in all a good total.Nice to watch cricket after a while,even if T20."
0,sitting talkin to my boy... he is going to the movies with his friends tho so i am gonna miss him  but i gotta study anyway
0,time is ticking and i still don't have Beyonce tickets...  BIIIGG SAD FACE
0,I woke up early and thought about school 
0,My foot fking hurts 
0,he's just being mean like all the time 
0,wanted to go swimming but it doesnt look like thats happening now  got ready for nothing :/ eugh
0,"finished with doing college work,  ALOT more tomorrow "
0,church.. brunch then airport to drop someone off 
0,omg! geography sucs  doin homework n totaly mysified don't hav a clue wot im doing...
0,@missheidi At least they weren't $450 shoes! Still though... 
0,"Another packed day. IAC, Foreclosure demonstration, and thrn FIST meeting. I'm sleepy  everyone enjoy your Sunday!"
0,"is so sad james is leaving  only 12 more days.. and incredibly sunburnt.. i'm SO red, and my mother screamed when she saw it.. woooo "
0,Trying to transcode a DVD with Handbrake. Unfortunately seems to have given up and is stuck on 7.26%... Fail 
0,jst woke up. still no luck finding a good enough new surf board online  Roxy has dissappointed me with their 2009 line. breakfast. peace.
0,Ferrari what are you's doing! Another bad race 
0,@StewartKris Kristen! Please follow me.  I really really want to communicate with you! PLS PLS PLS. IM BEGGING!!!! I LOVE YOU!  ...
0,@danipoynterjudd p.e tomorrow .....i want it to rain  x
0,"LOL is so sad james is leaving  only 12 more days.. and incredibly sunburnt.. i'm SO red, and my mother screamed when she saw it.. wooo.."
0,I'm waiting for baby to be back home from sabai. I guess I've food poisoning again.  oh man. - http://tweet.sg
0,i'm off to go to sleep!! school starts tomorrow.... 
0,ACT tutoring 
0,hes leavingg..  ... forever... i think i might cut myself to death... :L
0,doesn't want Monday to come 
0,i had 7 followers   but who cares... My baby kitten is dying!   He was so sweet... Well what else to say..?
0,@pamelafox Welcome to Japan! Not sure if I can make the developer day though 
0,"   let's have a moment of silence for our childhood homes... sadly, it can't be replaced and we can never go back"
0,@MizzLayal it succckkksss  its warming up now though
0,@psittacism I see. Not about clowns then? 
0,@chasinghayley just been bowling. Now waiting while lyndsey stalks nathan! Miss tom  want amother autograph
0,Worst week of my life 
0,#f1 Vettel lost the race on lap 1  still glad to see both Red Bull drivers on podium... #maxout
0,Grammy is leavn me for the rest of the month gonna miss her 
0,Back in Stuttgart!  Over my holiday at home..  But thats the life!
0,at home.....unpacked case......p'ssing down and cold outside.... back in work tomoz.... YAY - (not !)   
0,On a long long line at kfest 
0,Had an ugly dream... Wishing it didn't come true... Idk what I'd do if it did 
0,Ehhh I just woke up with the worst allergies 
0,"last of my flatmates just left, empty flat now  just like when i first got here. this feels so strange!"
0,"Not exploring  B feels nauseated, and I have a sore throat. Wah!"
0,@pshah_its_amy haha yep! i wanna to see if i could talk to people in french but its english only 
0,oh dang!  Its tied 4-4 in the second set 
0,@ gbfilms OMG! vista crashed and I have to edit the movie all over again 
0,@pcdmelodyt aaaaw  hope u get better soon! wanna c all my Dolls on shinning on stage again. Much love
0,"@Amethystic Me too, he seems like a lovely man. I hope Sam goes after this elimination, grr. Speaking of food, I want some. Has none "
0,spongebob is over...was way too fast again 
0,Today is the day 
0,i dont like preparing my stuffs for school 
0,@alexalltimelow its all over! 
0,I wake up right now ... I miss my dog ... 
0,"Good morning! Didn't get nearly enough sleep last night  Soo tired...Have to babysit from noon 'til three, then Giants-Marlins game!!"
0,sorry all my tweets lately have been about blog posts. we just haven't had cell phone service for any random updates 
0,"Socked in sky once again, I don't think there will be any skydiving today... "
0,Ahnh! So tired! My Mommy's coming to get me at 12. 
0,@wafflematic cuz i don't 
0,"Is live on cfxrnetradio.com, got a few gremlins in the studio today "
0,is really really really missing you 
0,@awesomegan Eeee i don't want to be the one 
0,Coilpack failed. Spare but no spanner 
0,@spiller2 no unfortunately missing it all -have to work 
0,@mocharemel not my fault my phone's so slow  i'm done! 
0,"@Aga83 Last year he was awesome, good car. Its really just a pity that he has ended up with a dog of a car "
0,barking dogs... AGAIN! 
0,"Ok... finally getting there. And during this unscheduled computer breakdown, I've managed to catch up on some much needed research, woo! "
0,"sitting here in my grandma's wake  she died like last tuesday,sooo sad . but, I definitely want her humungous mansion!  sooo mean :|"
0,"Umbrella's out ,,, seems like its drizzling ,,, dont want a break  #rolandgarros #frenchopen"
0,double hangover! ooooooooooo 
0,I'm going back to sleep. My head's killin me. 
0,&&&&&& my nanas in the hospital 
0,"drinking coffee and listening to jay z myspace, while eating pancakes for breakfast.  very sad not to have seen sasha dj.   AnD thank u. ;"
0,"@springtree yes, we lose a lot of creating hours that way, don't we "
0,On the way back to the Indianapolis! Wish I was at church 
0,@evelyn138 either you woke up crazy early or stayed up hella late.  Either way I want IHOP now 
0,"i wanna be singer, i <3 singing, but my singing sucks "
0,"Rooting Roger Fed to his 1st French Open..Btw,i've got my head phones on..and i swear im hearing white noise "
0,@thebookmaven No such thing as Clean the Office day while on deadline... 
0,Weekend wrapping up 
0,Heading to @Freena through the rain 
0,@Joitou2 thats awesome! im not giong 2 1 though because my concert sold out in like 15 mins and i wasnt even home when they went on sale 
0,I gotta stop stayin out til 4am when I gotta work in the morning... I feel like shit 
0,@tasha_pencil NO but I've always wanted to!  Have you?
0,@CWaterhouse The weather is great here but I am at work 
0,"@guckstdu ok, help me get more followers for some reason I keep losing them I lost 10pp in two days  idk what I'm doing wrong so plz help"
0,thinks on what to do tomorrow... UST's closed tomorrow...  http://plurk.com/p/z3owl
0,i wish i was at broad appetit 
0,needs more friends 
0,"Oh last night. Oh my head. Ow Ow Ow  However, <3 <3 <3 Holly!"
0,I cannot find the strength in me to get up and get ready for work...  8am on sunday.. Who does that?!
0,Was going to go golfing today... rain.  Now I am just going to clean my room and study biology. Inclimate weather sucks.
0,I think my mom's dog suffers from doggy depression. 
0,Nothing to do 
0,My Tweetdeck seems to have a mind of it's own today and keeps disappearing from my screen 
0,@Addiiee I want Niley to reunite! 
0,Noooo go away cough! I don't want to get sick 
0,@AmbDuckett where were u lastnite! 
0,lazing around today . back to school tomorrow. 
0,I don't want to go home 
0,@PoetressFloetic Ha you're gonna be salty when the food comes and you have to watch your friend eat the good stuff. 
0, i run all out of people. oh well that was a pretty successful hunt haha ;D now i need a bunch of people to add me so i have more victims.
0,Studying all day even though it's beautiful out 
0,Why does it have to rain on the lastweek of school ? 
0,@rachmurrayX ohh did i  .. bummer was it just like our usuall chats? random facts and what not.
0,at work. boutta die. hungry& exhausted. wawa. 
0,"sad.. thinking about my bf, i really miss him "
0,is back from the beach. 
0,@naturalpod Have any tips...began an organic garden yesterday and the birds have begun to pick at my seedlings 
0,@FrankieTheSats take that are awesome! i wish i could be there!  sometimes is really sad live in Brazil LOL
0,"@vin495 I spoke too soon, too much cloud ... it's nice and warm when the sun's out but it isn't out enough. Damn. "
0,@CathrineSchack That was not good  It sucks when stores are closed...
0,my left foot still hurts from my heels i wore the night b4 last...i stood in the same place 4 like 6hrs so i wouldn't lose my spot 
0,@emzyjonas just eating dinner at ma laptop watching scrubs lol x dont wanna go to skwl 2moz 
0,I regret to inform you that im watching Big Brother on Catch-up  #fail
0,@Yazziness I cant be botheredddd I feel tired 
0,At the airport missing the fam already  and to too it off it's finally a beautiful clear day in south Florida. When I get back new diet
0,Studying for CCNP  really need slp
0,great beach weather.... too bad i have work at 11  
0,"is thr sme law of conservation of feature-richness? #twitbin adds some over twtrfox, so it lacks some too!  No expanding shortURLs..."
0,Awake....getting ready for work..first day back in a long time...ugh.wish I could be doing something else 
0,I've woken up with a massive headache two days in a row. 
0,@cmaecy where have you been? and where's @nareejo? i miss her 
0,"@chantillynative yup, i think so...buisness as usual..well it sucks!  "
0,Its the morning and I am feeling like shit as I predicted  and I don't feel any better and to top that I had about 4 hours of sleep 
0,Ugh just woke up I'm still tired 
0,@Songo72 LOL! No T-Checks. Only ComCheks. Sorry 
0,church. Amber's last kid jam  last last one for the season though.  season
0,"omg me and @zadr are awake  gotta do some shopping before picking up @importantshock, @simX and @mgorbach.."
0,I need to buy a cheap and cheerful teapot but don't know where from now that wollies is gone 
0,feel like crap 2day  I guess I just need 2 pray I am in Church
0,"@gossipgirl14_xo me neither, that math test is going to kick my ass "
0,"@Claire111 haha naughty milo! i let nim out at ten last night, and he's still not come back  x"
0,Sick with food poisoing 
0,Ahh....overslept! Not making sunday school!    *StEf*
0,I just woke up. I had a terrible dream. 
0,Still waiting i'm hungry now!I'm getting uncomfortable in this chair grad party later hope I can make it starting to fell sick 
0,just found out driving to cairns would be like driving from melbourne to here...it's even a little further than that! 
0,"Getting ready for church....Ahhh I go through this every sunday, what should I wear Sheeessshh I told ya'll I needed a personal assistant "
0,"@littlepluto :E <- gespaltene zunge, i know german "
0,@MissKeriBaby  I Took Off For Ur Show Today Like A Month Ago....But I Forgot About It Soo Im Off To Work 
0,"@RedGray been looking too, can't find one "
0,Just heard that no one was hurt in that house fire in my subdivision. So glad to hear that but sad for their lose 
0,Is disappointed about the 2 shot defeat to Kent 
0,Back at surabaya. Finally 
0,@XgillsX lucky you! 
0,@darlingnickieb nevr talks to me anymore 
0,Packing again.  leaving Boston in a little while.
0,Gaah! My load decreased from 40+ to 18! 
0,says goodbye since i wont be onlie for the whole week since school's starting..  see you guys soon! g'night!... http://plurk.com/p/z3plq
0,WHY IS MY MACBOOK GOING SOOOOOOOOO SLOW!?!!? someone fix it  blahhh
0,"@fancyxkid True. Too bad, for me all I can look forward to is uncle... "
0,My pc's dvd drive is dead.. Wonder if I can fix it.. 
0,"holidays for me now,...are just too exp to pay for "
0,I'm soooo tired. I have to get up at 6:40. Stupid work exp. 
0,@kdjccr  WHERE HAVE YOU BEEN ALL OF MY LIFE?! I need some serious aunt time; im having WITHDRAWLS 
0,Going to have to follow #wcchicago tweets; can't make it to Day 2. 
0,@freeandflawed mine burns from the pukey 
0,"heavy hate sundays, there so boring "
0,@LorenYxox Aw that sucks  haha bet your stoked 2 get back home!haha xxxxxx
0,Flu & Sore throat......ain't fun 
0,@pdurham doughouts for realz... mmmm nom nom nom!! i had porridge! 
0,I also think I've developed another allergy. I'm in chronic pain after eating a bananna lol 
0,"My thoughts: Threats are unacceptable, period. And @Trent_reznor went WAY too far in violating someone's anonymity. Too bad--I like Trent "
0,Ð?ÐµÑ Ñ Ð¼Ð½Ñ? Ð±Ð¾Ð»ÑÑÐµ Ð¼Ð¾ÐµÐ³Ð¾ Ð»ÑÐ±Ð¸Ð¼Ð¾Ð³Ð¾ iPod Classic 160Gb 
0,"#f1 Ferrari seemed lost, no gains  *sigh* surprised by Brawn's first failure, but it's still Button-domination #maxout"
0,Now im going for some starbucks with @RyanLollis before he heads back upstate 
0,Its a beautiful day. so of course im working til sundown 
0,"@DysenteryPinky Well, they don't tour here in Europe. I live in germany, i hope they come next year. "
0,@kherihines I don't even know how to start a topic trend on twitter.    
0,@AbbieFletcher_ same! except revision  what subject you doing it for? you up to much today ? xx
0,"FAIL! @sugarlessgrl: #f1 Ferrari seemed lost, no gains  *sigh* surprised by Brawn's first failure, but it's still Button-domination #maâ¦"
0,@MissVxo it really is 
0,Home sweet home! Missing camp alreadyy 
0,Great. . .soOo i broke my laptop 
0,Know what I hate? FF with an awesome storyline that sounds like it's been written by a 12 year old. So much lost potential reading 
0,was 20 minutes late today  i swear im going to get fired
0,hates getting raked over on artificially inflated closing costs. 
0,Is not lovin' this migrane. 3rd one this week. Not Impressed 
0,eyes won't stop watering  crappy hayfever and genetics
0,@glaiq omg! i dont think id like to see the vid you sent me. i dont like him flirting  haha
0,"aw ive just read all my myspace messages, some are proper sad "
0,@preclude rawrrr fix my face 
0,"www.Farttr.com FartWatch: After taking the pills, i'm farting uncontrollabe  http://cli.gs/h3sdLv"
0,Just woke up... Man I wish I had been here for the Florida question 
0,Just dropped off Oscar at work 
0,"Good news, I got registered for the last course I need to graduate.  Bad news, its' at the navy yard "
0,"My feets, my legs and my toe hurt! And i gotta walk home! "
0,@Conceet It really does! and I needed a bunch of things and I was really in shopping mood and then its not opened anyway! 
0,"Always happy to see Jenson is front, but it's a shame Seb lost it on the first lap. He was obviously disapointed on the panel "
0,I had a dream that i was implanted with an atomic detonator that would explode if i got nauseous. Now im sick to my stomach. 
0,busy spending my Sunday writing design proposals to potential clients 
0,It's a sad day...time to leave Orlando and go back to PG ...i had so much fun...i'm still not ready to leave 
0,i really wanna get sims 3 ce. but i mssed it 
0,lol @MissesAE rub it in why don't ya  lmao
0,"has a crashed desktop, poor OS's none of them load cause I have a Effin' Dynamic Sata drive connected "
0,The New Palm Pre phone is so cool! I want one. 
0,http://twitpic.com/6jsf8 - The days when it was sunny 
0,I hate when they play 'One' on the radio. They always cut out the best parts.  
0,"@IzaLach Nie mam Comedy Central  ale przepadam za The Lonely Island, chyba czÄsto siÄ tam produkujÄ."
0,"okay here we go, seesmic desktop doesnt allow me to view my followers or friends. thats a negative. "
0,I wanna relax! And not learning whole the time.. 
0,I'm un-believeably tired!! well thats what I get for staying up late!! 
0,@jhayu thats the Fair Usage Policy. All unlimited plans now come with a data cap. 
0,"Glad golf was called off yesterday, I might have drown "
0,I went to bed too late and got up too early 
0,@galore154 ME TOO!! Except this computadora be so jank that I can't  What moviedja watch?
0,its raining.. outside and in my heart... my internet didn't worked in days  okay.. 24 hours but its looong!
0,extremely depressed after sad movie. 
0,"@ilana23 I tried doing the mobile thingy with Twitter, then there! 18 "
0,"Averaged 18.5mph over hilly-ish route (when I was moving, not repairing punctures  ). Avg power 212W, NP 238W."
0,http://twitpic.com/6tu7b - paccking 
0,could be watching the Tony Awards right about now 
0,"@pickapucka 90210 pun da abes tengok. waaa  btw i forgot, when is the boxing day eh?"
0,@em_ems  hope ur ok? im alright been a bit sick all weekend tho! stayed in watching harry potter dvds last night LOL
0,@DaveyGrime So I unlock all these achievements for Dead Space only to realize I'm signed in as Dave 
0,@KrisKaine That's a cool idea. I did a couple a while back... I'm really not that good at it. 
0,Right about now is when i really miss the harley.   
0,Bus finally came. But we're at the front 
0,"yay! finally fixed my contact list, but now ive to install everything again and again and again "
0,"mfffmm,im awake-ish. oh boy, it's gonna be a long day "
0,THIS IS NOT A GOOD DAY TO HAVE A BAD HAIR DAY 
0,I can't find anyone to cover for me @ the church so I have to say bye to chad early 
0,Sinus infection.  Going back to bed. 
0,Melting in the heat 
0,I HATE being lost  especially when I don't know where I am going!
0,"@JBerntsen: I was also absent... I can take a hint, Joel.  lol"
0,@FlowerB Yeah the cheap stuff kind of goes lumpy and doesn't soak up what it should  eeeek!
0,"wow I never go on here anymore, probably cause my life sucks! YES! "
0,@ValleyPrincess morning.  How are you today?  I just wanna go back to bed.  
0,"My cat is sick .i love u ,blair "
0,at my grans bout to go out shopping 
0,I don't like when big spiders are near my head when i'm in bed. 
0,last nights' chili+ this mornings coffee = havoc on my tummy... 
0,After-vacation crash.   I want to go back to my mom's.
0,"#frenchopen its 5-5 now, with serves "
0,don't wanna go to school after this weekend.. it was horrible...  tomorrow test  aaah i hate maths..
0,"i want to dye my hair, but then knowing me it'll go wrong and my hair won't go back to the way it is "
0,heading home now 
0,"not tired! i really need to get a better sleeping pattern, i also want my present from zoe haha everyones knows wat it is except me  lol"
0,I'm actually sick sick sick of revision. Yes 3 sicks! Thats how sick I am! I'm so going to fail psychology 
0,I'm sure that he will tear my comment apart again though 
0,working inventory!!!!! 
0,wanna meet @jonasbrothers & @ddlovato so bad 
0,@SarahAnnGreen yeah I saw that - which sounds like a very Bernie thing 
0,Has another day of revision... 
