0,@kindareal still not doing well with the contacts  im such a wuss!!
0,"@RUNNINGLOPRO He was facing Federer in the French Open finals and I wanted him to win, but he lost "
0,has an upset tummyy. 
0,mugging fr her last paper. 5 more chapters to go! 
0,"@choobrenda yup mine is, but there were afew times today when it couldnt load for me too, could be due to human traffic perhaps "
0,@SophieReedy owhh I love you baby 
0,i dropped a bottle of my fav perfume and it broke 
0,@kirstiealley I love you but why do you always YELL! So early for yelling  no yelling?
0,At the office on a sunday afternoon... Sucks 
0,in town. still haven't managed to get new shoes or jeans 
0,Just nearly been attacked by a bee 
0,"Et tu damned rain, couldn't watch #Federer win his career grand slam coz of power outage "
0,Writing a test tomorrow 
0,@Danni_denton its raining  
0,@funmiosiyale hey do you no wat the c/w questions are? i left my bio folder in my locker  thanx x
0,@XxChaza hey hey huni!! miss you! 
0,but anthony just left and now my apartment is boring again 
0,I didn't talk to @cheesewings last night. I'm sad.  
0,Sunday boring sunday...what a sad weekend...I'm spending the biggest part of it alone...  fuck!
0,"is working on art isp's. god, what a fantastic torture device... "
0,"wow, weekend is already over "
0,At garys grave with Jess. We saw his brother so left 
0,"Ahoo hoo hoo, got a head ache "
0,peculiar dreams haunted by the ex i still love prevented me from sleeping well last night. I alreay need a nap. 
0,I'm gonna freeze because i left my hoodie 
0,still lonesome. I don't have the dogs. 
0,couldn't watch the final match.....I'm feeling bad that I don't have a TV 
0,At the horse show. I'm suspicious my horse is sore though so they're taking her back home. 
0,has a SUPER sore back 
0,"My head hurts again today.  oh yeah, good morning!"
0,i miss him soo much..hes everything i want and need...i need him to survive 
0,"I`M GONNA TRY TO SLEEP excited for the activities lined up this year! :""> gonna be a busy year! "
0,@anambanana NOOOOOOOOO.  Maybe she meant Frankie. HAHAHAH.
0,good morning yall! haha got up at 9 so i just wanted to say ill  miss yah Steph  ur my best friend!!!!
0,@TynzBoomPow How is hannah montana? I wanna watch 
0,"still sleepy, about to get ready for work "
0,"There's a feeling I get, where I'm not sad, I'm not angry, but something is bothering me. When this happens, I 'cannot' listen to music. "
0,...but it didn't work. huhu 
0,ear ache need a humsey hug 
0,@Obajoo I want you to get a PartyBot. I put mine in my purse and took it places but kept forgetting to take pictures. 
0,@KrinaR i didnt win the tickets either!!!  STUPID CAPITAL!! ur not missing much!! they're playing top 40!!
0,http://twitpic.com/6ty1r - can't wait when will i see these people again 
0,@SkaPunkPezzy Shiiiiiiiiiiiit sorry about yesterday; I was over at my friends' house and we all passed out for several hours 
0,@nova937music  Well just imagine them having a horrible time there & it will make you feel so much better
0,"I'm really bored, bored as hell, bored and all bored "
0,@p3nman it was only thunder ... no rain 
0,will write a test tomorrow 
0,@nkw1998 KELLY!!!! :'((( im like bored 
0,got to spend my morning in the ER.  my cat cut my eyelid with his back claw.  had to get a tetanus shot too 
0,My weekend in Yercaud has come to an end. I'm back at the burning hot melting pot known as Chennai. 
0,back from dinner. I'm in a desperate need of money. 
0,Ow think I have a migraine coming on  Light all blotchy.
0,back from dinner. Iâm in a desperate need of money.  http://tumblr.com/xyd1z4b4f
0,back from dinner. I'm in a desperate need of money.  http://plurk.com/p/z4bwm
0,unfortunately my vacation is over and getting ready to head to the airport  now to count the days till my vacation in vegas lol
0,@runaholickassy morning lang ako pwede.  i have errands sa hapon.  
0,"i never met kevin costner last night. in fact, i didn't even see him on stage. "
0,Laptop has bitemarks in top left corner of screen & @  back there's a hole.Think my mate's dog had a chew.Gutted.Pls send tea & sympathy 
0,its raining !! what happened to the sunshine 
0,"No Weekend, dead tired but load of work so no fun only work "
0,is tired and not looking forward to work tomorrow 
0,Wish i had't crashed  (wrong moment..)
0,The ceremony is just not the same without Nadal 
0,HeadAche still present. 
0,"been revising for HOURS now, so bored of readin about Mussolini  Been through 5 albums on my iPod so came here for a break"
0,My bastard Internet died just before Roger won 
0,"this song needs a bridge, i need to shuffle some stuff around, it doesn't flow "
0,@Bryanslife yay! =] but now you got me sick!!!!!! 
0,@flyfiddlesticks Unable to post from email though! 
0,"""and i miss you.. and i need you, i do"" <3 hungry "
0,@KshayKrazy Hey I never got your text.......I'm sad I had something important to tell you......now I forgot! 
0,Home from jim jams drinking a sweet tea.. I have to go buy brittanys present for tom  here we go again..
0,working on homework all day 
0,@dannygokey awesome! will miss it though  have a blast & keep tweeting!
0,Getting ready for work again  did not want to wake up this morning.
0,"3rd 12 hour shift in a row is not fun, especially when it is day 5 of the week and I have to work tomorrow as well "
0,I have officially been ordered to bed  Night everyone! Thanks for the chat @ReneeBarber & @tealou catch ya later today 
0,work was dead! i want to see @Kiss_TheseStars 
0,"Ughhh, my stomach is still killing me "
0,mcmuffin in my belly! no iced tea though 
0,@MrsMerrygoldx3 7??? we're gonna have to listen to music from now until 7!!! no summeritme ball??  loooooool
0,Nothing to do. I really want an iPhone 
0,My car got hit at a friends house. 
0,is not well 
0,its cold now too  Just know I'm not gonna pass media this year and wreck my chances at getting into portsmouth grr
0,"@DrFernKazlow So sorry 2 hear abt yr canine friend  Zoey, my puppy, is 3 lbs all black tiny toy.5mos. Zoe means LIFE in Greek -yep-she is!"
0,@marthamaed I wish you were there last night  I missed you!
0,Downloading music and showering soon. I'm tired. 
0,My arm really hurts  doctors again tomorrow.
0,@Ezkeemoox i wish i lived near you guys we could movie marathon 4eva 
0,oooouch! my throat is SO sore 
0,@schaeferj89 Not well 
0,I want to play The Sims 3 
0,@capnsmak you sir have just lost points with me for that statement  
0,@colourfulponies I got left out when everyone went and saw it. 
0,"@facktura diorg dah siap2 kan list tau barang2 apa yg diorg nak..so nak taknak terpaksa jugak beli..  awan's team got 4th place, haha "
0,"@cuelight Well, technically, school's out for summer for most people, but I have to take summer classes, so my session begins tomorrow. "
0,@ChosenOnePR take me with you i didn't get any tix  lol
0,"@grum Lol yeah it's so cold tonight! I whinged like a sissy when I stepped outside tonight. Then the sneezes came, and with the cold! "
0,Zero motivation to do ANYTHING today! 
0,Slept lateish no plod  On way to Paoli for hoops. Delores is evil!
0,suppose i'd better clean me flat 
0,toby  :/
0,"Before I go, I dislike xx for using the same font. "
0,"@ElleBeeeeee have to buy food etc and can save more moneys  feel so bad coz i already said yes to snick, i hope i dont get her in trouble!"
0,"At the airport, headed to Spring-Mo "
0,had bad dreams about alligators and guns last night 
0,@makennaisme Twitter violation. I follow you but your not following me? 
0,headache  ... but sooooo worth it haha
0,holy shit....sunday's already over! it's back to holy grail tomorrow   sob sob
0,B just left  after we got breakfast - think I may head to the beach to drown my sorrows. Love her!
0,sick and tired !! ...Work tonight 5-10 
0,@abooood Ø´Ù?Øª Ø§ÙÙÙÙØ¹ ÙÙÙ ÙØ§Ù?ÙÙØª Ø´ÙØ¡ ÙØ¨Ù Ø¹Ø§Ø¨Ø¯ 
0,"@espinoza11 i know, its  not a pleasant feeling... "
0,@kalemeow The fail was indeed present in plenty...sorry if we caused any of it by being short handed up in Austin 
0,getting ready for work :-/ 7 - 11 is looking like hell for me .. hwever i shall focus on the money . as i am extremely skint ..   eurgh
0,"@freeandflawed No, unfortunately that day is no good for me.  "
0,camp was extremely fun. i got about 1121839283 mosquito bites though. and a hurt knee 
0,Missing someone 
0,So i woke up this mornin with a big bump on my wrist and it hurts so bad..i dnt know how i got it 
0,@markhoppus  only in dreams 
0,"Saw 'The Hangover' yesterday, then went to BA's for pizza and beer. Spent the night watching TV with ____. Shitty weather again today "
0,We'll be heading for New York to settle the girls into an apartment for school this fall.  Not sure how I'll respond to empty nest here. 
0,Good job Federer. Too bad we couldn't see that epic win! Still working. 
0,"Just spent 8 hours straight playing Sims 2, didn't move or anything i think my bum is numb  bad timesss!"
0,"@samwilliamh bah, and i still gotta finish some work for tomorrow "
0,Sun poisoning 
0,The weekend flew byyyy. 
0,Nou Nou Nou!!! Gmail please recover you! I must read important emails! Sigh! 
0,Just found out Brownie chewed up my new flip-flops  I thought this chewing phase was past.
0,@GlobalGrind How is an ex stripper/freak who puts her business out now concerned about her image? You get what you dish out. 
0,had kind of a pooy night.. morning isn't going too much better. last night i felt depressed and now i feel sick 
0,"Good morning fellows  sometimes I wanted to be an early bird, I'm almost asleep...hate snoring brothers. "
0,My lil sis and her broken arm awhhh poor baby! I hate cn lil kids hurt! She's 4!!!   http://mypict.me/2UXH
0,"@simasays Same with here. Customer service, products...the entire shopping experience has done downhill. "
0,@omgjfg Heyy my mum is on the phone and i have no minutees  do u want to go out tonight? i duno if i do or not i may just save myself for.
0,wishes these things were easier to talk about 
0,@flumpyflump this is confusing 
0,Aim 7 Beta is out and it looks like they're trying to turn AIM into Twitter  WHERE IS THE ORIGINALITY?
0,monsters vs aliens.... not funny enough... 
0,Twitter sucks!  i want some dairy queen.
0,I bet i wont have a voice tomor  damn cold
0,awake at 3:00 had about 2 hours sleep.... complete gayness 
0,@CopperCrimeStpr not at all. I think I'm broken. 
0,"@geekigirl and another   but i know you will make up for it! everyone left, lights were too bright and no one danced in the end anyway."
0,"The trophy on his hands feels so wrong.    There's no rolling on clay, no biting, no Spanish anthem. *whines*"
0,Boreddd :/ the weathers been quite bad again  xxxxx
0,watchin tv a sobbing for summer and missin my cuz buds and friends sniff... 
0,oh on....i finish last at McRitchie 5K run.... 
0,@deviousrex um...the site still does not work 
0,Still have no voice but now my throat hurts badly...... Maybe I need a tonsillectomy or an adnoidectomy// I hope its neither 
0,@danydany No school tomorrow for me xD  Exam on Tuesday and Thursday though   Lots of revision to get through
0,Portable tearoom? Rad. http://bit.ly/5S9dv  Too bad I missed it at Felissimo in NYC. 
0,Why did Strollo's (where Dexter's used to be) close? That was a good little place. 
0,Soo bored bout to go write my essay i guess. 
0,@CurrenSy_Spitta  not talkin to me.. 
0,@sachakourkiva I wish i was in paris 
0,@xoxoBear UGH i hate the fact you're off tmrw! && I begin workin 9-6 mon-fri 
0,Daddy is moving back to Atlanta today...  lucky bastard...chicago real soon though so its all good
0,@ANUELADY34 Yea tomorrow back to da damn daily routine... too bad it aint holidays  lol
0,It seems like everything i do something goes wrong story of my life i should be used to it by now but no poor little baby hammy 
0,@Yuifan16 I really don't know why it took me so long to write chapter 16 
0,@ElleBeeeeee i feel shiteous  i really want to come back but money is a bother  missing you terribly *cries* xxxxxxxxxxxxxxlove you more
0,Im going to bed before i get blocked on facebook or my account gets deleted. I guess this is a sign. Work tomorrow  Goodnight
0,is having a bad day... water came through the cieling and went all over my HD compositing monitor...... 
0,"@Hollywelch BOOORED, DOING HOMEWORK "
0,playing call of duty. game update borked my save. 
0,@Roofz I wish I did pass. 
0,i don't like you anymore  (and it's gone already ha.)
0,Knew the rain wouldn't stay away 
0,Waking up! 
0,@iitsMolly  I'm sorry!
0,isnt feeling too good 
0,For some reason my recently listened tracks on Last.fm Web Radio are not scrobbled. 
0,need to lose weight 
0,@Danni_denton its stopped now but soaked the gazeebo 
0,"It's just me and my boy this morning. My girl is spending the day with her best friend who moves away tomorrow morning.  Ugh, it's so sad."
0,I miss my girls 
0,#Firefox My firefox is again typing stupidly. Typing goes all over the place!! 
0,@TiffanyHempill  I can't believe I missed all the fun 
0,"Game 2, magic vs. lakers tonight. Will be at work.    Will turn on sportscenter when I get home. DHoward and JNelson better get it going!!"
0,ohhh the magic are being mean! its #BeatLA not BEAT LA  what ever!
0,wants to be with her baby now 
0,just missed 11:11! 
0,@Shin_Shan I lost it  oh it had my life supply of music in it aswell LOL  Boohooo xx
0,@OliviaDAngelo without me  I'm never leaving again!! Ps I didn't prove u wrong last night but I DID finish new moon
0,@Sabullkaa I miss you now  .. Nice Week with Emo.Big.Ass 
0,now i have pink eye in my left eye ... when is it gonna end!!! 
0,@komiksboy will do 
0,One of our pet rats died yesterday     RIP Martha.  Poor Molly is all alone now.
0,Tired and teary. No idea why. Cramming for exams which I feel destined to fail. Not even sporadic sunshine makes it better. 
0,"@viktoriaamarie Aweee da babyyy!  it's okk, once ppl see we starred in a movie together we'll defss get more followers ;)"
0,@LynnK10 No kidding! If we can drive in one run himself that'll be one more than we've had in the last two games. Sad 
0,"caught a bug from my brother, a really BAD one. my throat is killing me and I'm hacking my ass off "
0,"go for it or not!  Not changing the url, so don't worry.  And NO, it won't be saying And Then There Were FOUR....sorry "
0,Off for a Sunday roast! Without the meat though 
0,Missed church cuz I overslept 
0,why did i have 8 shots of blackberry stoli last night.. now i have to skip the gym 
0,So little of the weekend left 
0,Buying a new metrocard 
0,i want more sleep. work is being a drag queen. 
0,"waaah! imcleaningupmylaptopwithmyminivaccum... thespacebarisn'tworking... see?... well, gudnyt.... i should be up by 4am! "
0,@Saskiafairy @Trucco905 i hate my feet!!!! 
0,Wow. I didn't know it was past 11pm already. :| I still have training tomorrow. 
0,@gelaliwanag Why was the video like that?  )
0,@rossmurderscene its unreal the amout of swiftness I've had to do its disgusting my hairs half done and I'm sooo sleepy 
0,Thanks auntie for keeping me out all night now i'm not allowed to go to sleep 
0,is not going to be unplugging tomorrow evening 
0,I am lazy today...preparing for school is calling. 
0,Not good. I want my freedom back. 
0,is pissed because her new notebook has a shitty screen resolution 
0,Slept for another 3 hours and still really tired.  oh well! I'll just go to bed at 9 today. I'll make up the four hours of shity sleep.
0,"@A_RAVEN well, i fail unless a sandwich counts "
0,@aliceinnyc don't have an extra... Sorry 
0,@shazothman makes the two of us! malas nya nak g kerja... bgn pagi! 
0,@honeytits you didnt score with me. 
0,God i want some new video games!! Wish i had more money..but im broke as a joke 
0,feels quite sick. Probably all the excitement of connecting stuff which then worked  Not good.
0,tired  just woke up.
0,@sbaylatin no work 
0,@Floor_model considering the rain that's coming I do too.  Looks like I won't get to do either! 
0,Helped @audybaby get ready for her trip to Europe yesterday and this morning. Now I'm all alone for three weeks. 
0,has put on weight 
0,Hubby must be purchasing tickets.  I see the Staten Island Stalker is back  lurking on my blog.
0,Bye bye miami  its been real....
0,@sugarbugslings working on a sunday?  at least you all have the afternoon together ENJOY!
0,@katieboocat tnx katie... hope my problem is still negotiable for those on the Twitter creators. 
0,"@PhilLadden The weather is okay, but the balloons didn't launch.  The wind was either heading straight up or south. They needed west!"
0,feeling worried ? panic ? 
0,@loungepotato She hates us 
0,i don't want al to leave   boooo
0,"@wysiwygjt No, I'm going to be in Tel Aviv tomorrow morning. I had absolutely no idea there was a tweet up tonight. I was not invited. "
0,Hi @twitters.. !Today my day is so exaiting. The list: Modeling school+ Again with the bests+ Study mathematics  + makeup test for parade.
0,Just hit a big jam on the M6 
0,"I didn't trust d lifeline of Mumbai today, our beloved locals, a mistake which I do very rarely, n i payed d price. I was late by an hour "
0,@chicalicious512 Dinner w/ all the girls then prolly 1Oak or Cipriani. Looks like I'll need 2 buy a japanese doll & carry it with me  lol
0,Fuck! I forgot to say iced... This is depressing 
0,I love Tabs but she's the reason I have to clean this house so much 
0,"found a @CameronPhillips, but her last update was in Feb  maybe she is in other time."
0,stupid red wings....... take advantage of five penalties in a row...... 
0,Just ate a pb&j for lunch welcome back decent meals... I'm so ready for a nap but I won't get one 
0,@JonathanWee  you luh. all your fault. hahahha. sorry. i could drag them to watch spongebob
0,"my granddaughter so hurt, daddy canceled summer visitation at 10 pm last night supposed to start today 9am. he's in TN we're  in  OH. "
0,I heard my guy just go the tk supras and I wanted them  ima still cop em
0,why isn't there anymore A&W here? misses the rootbeet float and curly fries 
0,Woke up early  my nina is in town so excited to see her. Going to the swap meet in a lil!
0,"@tommcfly Tom, my dream is you reply me, but I'm almost giving up... You have many followers, will be difficult reply me "
0,I wish...No I already deleted Episode 2 from my computer.  Have to go back and find them.   It'll be worth it.
0,Just woke up; still really tired  talk to me.
0,@catarina5 do u still think it was better for u to leave him? I cant concentrate.. Can u help me? 
0,Enjoyed A&E's 'Private Sessions' w/EnVogue this morning. They sound great. Looked sloppy though  Always baffles the mind...
0, I want to play some kind of Online Boxing........=.= Can't Find it...D: I WANT BOXING BITCHES!!!
0,@showMe_Heaven I can't and i don't know why 
0,(www.TecNasty.com) MrBigz: crap - i sold friday.  : MrBigz http://bit.ly/JtvGp
0,wondering if sim 3's that good or if i should just keep on playing sims 2  i bet you people will stop making cool stuff to download for us
0,"Ugh, feel like shut... Pleeease don't let this be flu; I have an exam on Thurs and I don't wanna be forced into Special Consideration  #fb"
0,somehow i managed to catch a cold in 80 degree weather....how great! ugh....laying down 
0,@BATYASMUSIC he's dead so dad took him to the lab 2tay  hope he'll come back from there..i miss him.. *snif snif*
0,@ColdFunk  damnit! /returns to 'how to attract male varieites handbook'
0,...Shit... I am NOT ready for this cello recital 
0,So much for me showing off saying I've never had a night......lmao 
0,has a lot of assignments to work on 
0,I hate Fenway Season. 
0,"Work, always work "
0,@snookca Oh wow! I'm glad everyone is ok. Sorry about the car... 
0,"@LeahBfly11 thanks girl, you have a Blessed one as well...I aint make it to church today either "
0,"busiest night ever yesterday!!!  no food left for tonight, though  "
0,happy bday to my father!!... ps seems like im loosing followers by the minute 
0,@Christabel_SMM But i dont have it  unless i go torrent it <.<
0,heading home  i want to stay!
0,@heycollin I fell and the carpet rubbed all of the skin off of my knee. 
0,@juhnet_win i hate them 
0,Grandpa J & Nana C came over this morning and I ate breakfast with them. Then I showed them my books. They had to go back home though. 
0,"creating the lamest roast ever...battery chicken, frozen veg and ready made mash! sooo tired and shop had nothing left "
0,Jim's going-away party is today... so much fun! But I sure will miss him 
0,No zoo.  but We're doing something today. Family from kentucky left
0,"now sims 2 isnt working, bloody excellent "
0,@samitbasu @allvishal @tinytoots @adityab - why you do this while I'm writing my thesis? 
0,@Janefonda Why do you have trouble walking?         â¥
0,@no23no COME BAAAAAAAACK! 
0,By @maddy2101 ich bin zu doof fÃ¼r cal  #-Typo3 #Extension
0,"drama coursework drags on, "
0,@tommcfly bonjour tom   now  i think you should tweet back cuz if you do i get to see you on the 26th of june if you dont i dont  sotwet
0,@ggette whatever. I called you pa. Texted you 3x inviting you to the poker kaya. Anyhow you could have replied and said no 
0,can hardly move this morning 
0,Miss MLLF!!!!!! Things are definitely not the same 
0,still not slept  and got black eye Grrr
0,Just got my first ticket. For parking in the wrong spot. Arghhh! 
0,My heart and prayers go to the families of the AIR FRANCE 447 passengers. May God be with them. 
0,Got my first ticket last night. For parking in the wrong spot. Arghhh! 
0,@guytustin my party is moving to Sarasota  sad to have not met
0,Is still waiting for a reply i gotta feeling i.ll be waiting a while  if at all x x
0,"It would appear that, yes, I was unwittingly enticed into another long walk. Ain't moving an inch tomorrow. Still don't have any whisky. "
0,"Escapes From Alcatraz in 7 days! Goals this week: hydrate, sleep, eat well, no mas vino  & swim in my new zoot (hope it's not too tight)!"
0,@Hollywelch it's a looot of information 
0,I remember when I could roll out of bed and just walk 5 minutes to the beach... Now its going to take me forever 
0,Oh the match is clearly tilted Federer's way... darn it I miss Nadal  in that match 
0,"WTF do we have a right to Camp outdoors the cops harassed us till be paid 500 bucks, foreigners cribbed about the same issue "
0,is looking for her ru yi you. Can't find it anywhere 
0,It's sooo hot outside.  Guess I'm doing my 4 mile run on the treadmill.  
0,I wish I was at church. 
0,@MadameCrow I'm really sorry lana 
0,White Horse-Taylor Swift <3 The video is sooo sad. 
0,What will I do? 
0,Sick n it's way too hot outside. Yucky night last night: sick & the pens game was horrible 
0,says Happy Sunday everyone! Looks like it's another rainy day here. 
0,just woke up.. don't want to go to school tomorrow. 
0,@mark_s_taylor Indeed! (I know I'm a week late answering you; I neglected my @ list this past week...  )
0,is sad to leave CPH today  #fb
0,Enjoying some fresh baked bread whilst cosying up with the xbox and Andy. Still some thunder and lightening outside 
0,Just finished series 7 of The Shield. Great stuff! Sad it is no more 
0,@SayJayyx3 Ihave seen a lot on the internet about that and I think the animations are much better. but my laptop is not equipped for it 
0,Ugh im sooooo mad i missed da party last nite   12DAYS 
0,Off to check @djnickg ... So much un binned colonel in my car I could open my own freakin branch  http://mypict.me/2UZm
0,"@frenchiep aw frenchie , don't you think you work a lot ? "
0,"@evilgumbo u approve, not 1st wedded row? "
0,"AHHHH i hate cleaning.... it's not at all fun  ireland people are coming to my house monday and they don't really like me, damit it. riley"
0,Having a shower.. and then.. studying ALL DAY 
0,Just realized he forgot to watch french open final 
0,"Wedding today at the Four Seasons Beverly Hills. No 5DII, just EX1 "
0,Two more days and vacations will be over.  Slept like maniacs all this while.
0,@candicekei yess! i left him a comment with like 20 sad smilies yesterday  he will be missedddd. *sigh*
0,"@thehouseofjukeb no, illin like a megavillain "
0,"@saaaaaarah15 wait, what :|:| your mum has CANCER :O OMG im SOOO sorryy   :'( thaa's TERRIBLEE!!"
0,"Good weekend, but actually knackered now : i need another day to sleep "
0,"I'm bored,the boys are discussing something I dont understand so I better be quiet.booooo "
0,on the plane headed back to NOLA 
0,On my break at work. The day is going too slow 
0,Can't believe I dropped my iPhone! I'm viewing things from A cracked screen 
0,@MsJuicy313 Wait!?!? I didn't even know that somebody else said that!!! My tummy is angry 
0,Hubby is bringing home a new kitty condo/tree for our cats.Their old one is on the curb for garbage pickup. They are howling @ the window 
0,@BeckyC3 lol. i need a drink but if i move my parents will make me tidy my room 
0,Awake & ready to enjoy the day! Dreading another full time work week startign tomorrow 
0,ive been deserted... 
0,I am so hungry! But it's 1.20am now! And that means no food. 
0,@tommcfly good! we all miss you 
0,"wow, i accidentally kicked the fridge and got grounded. this sucks reallllllll bad "
0,"watching 1408, cant hang out with my baby today..  im sad.."
0,Thank you TLC for listenin.... too much shit happened that I couldn't even tweet 
0,i just wanna go home 
0,I want candy...that's not good since I don't have any 
0,@Talk2Micki so how can I contact u than so selfish 
0,is home && tired  x
0,@CookingWithAmy  Please tell style editor Miranda Jones we said hello and give her a big hug! We wanted to go 
0,- over snoozed and missed the tatas walk. Crap! 
0,@mikeintosh yesssssa!!! Too bad they only sell them at certain jacks 
0,In LA and the weather is not good! The weather back home in PA is better! 
0,@savina_donitia i wish i was at the pool getting a tan! im at work so sad 
