0,@kindareal still not doing well with the contacts  im such a wuss!!
0,@alancostello but Its loud and there standIng In the same room as It 
0,I DO NOT wanna go to church...  ughh
0,I wish my laptop was a phone so somebody could phone it and I could find it 
0,"@Sammehxo and i wanted to see oasis too  my cousins goin im well jelous, but shes wearin my boots so ill be there spirit hahah"
0,@Kat_LB I have a feeling Vettel is going to get him! 
0,Its 7:40 am.. feeding our boy.. Richie has a fever  My Poor love! - Baby
0,running off 2 hrs of sleep..back at the damn airport   the grind doesn't stop...Level was ridiculoussssss
0,i think my personal computer is broken 
0,I think I did not do anything. But a failure happened. 
0,"sad i didn't get to go today. but seriously, everytime i cough it hurts my lungs "
0,The Turkish GP is not going too well for Kimi  hmph
0,@callmeuschi uhhh shiat.. sorry darling.. I forgot that Marina wants to come over for dinner on Thursday..   ya have time on the weekend?
0,when the hell is torchwood going to be on??? It annoys me that we have to wait until autumn for all the DW stuff... neeed torchwood! 
0,"If its alright, ill lie awake at night pretending I am curled up at your side. What would I do without @delta_goodrem and her songs? "
0,well its chucking it down here thunder and lightning  chun up tho gonna beat davids ass at pool later 
0,"@LadyEcclesxX Nice, Im going to Poland to see my Grama and grandad who isint very well "
0,me poorley with cold yuk! 
0,my tooth is bleeding    but i don't know which one :/ cbb to get a mirror 
0,On my way 2 marineland. Sans une familial membre. 
0,nooooo thunder and lightening! me's scared 
0,I feel completely rubbish - have tonsillitis 
0,Cool. I wake to my ear KILLING me. I just wanna go back to sleep! 
0,"Movie finished, eating Thai and we're so close to Hyde park yet we have no skates  Sad pandas indeed."
0,"in the room, doing my homework "
0,"is it just me, or is The Kite Runner movie not adapted very well from the book?i'm disappointed "
0,"at dinner, my big brother bit into a cherry tomato and it went all over my face and top ..not cool "
0,pinnacle nt responding 
0,"when will this crisis end?! i'm afraid i might be one of them, i just hope not.. "
0,@DClax  you know It dude!!!I would save u some but u never save me food   Ima call u when I wake up man I had a long night !! -_- !!!!
0,@swkjason back riaos...  bt nw sweating all over again...l
0,"@nextread A bit colourless for my tastes, sorry Gav. "
0,@vaguebelle It's just so tragic 
0,"I run a non-profit website. That's not the way I planned it, but it's the way it worked out "
0,OMG it's so cold today! 
0,@ZeeCrazayHobo You alright? 
0,@beverlyinart Am I too late for Venice beach?.... That's what I thought. 
0,"ATT FB friends: China has locked down FB. I'll keep communicating via a Twitter app, until they track it down, too.   Behind the #GFW"
0,@Fifi1976 lucky you. I envy you. I wish was away  have fun tho 
0,@mchenwears Relaxation! This is the first day in a long time we have NOTHING to do. Except Mark leaves on a business trip 
0,@1RUnited I wanna join you but i can't find it 
0,Waiting to board train... They are playing musical platforms at Norwich station 
0,@babibabs i suck as an intern  i generally suck as a person. there's no way i can handle all this stress
0,@W3ZTY Can't yo mum give you like abit of the money  I really want to pre-sale the tickets tommorowww 
0,"working on a sunday, like a non-normal person "
0,@Capricci0so Here in Guangzhou it is pretty well blocked.  Has been for the last couple of hours.  
0,so im up again...... hmph i'm like a cat..... i jus take naps 
0,Got to head back to NJ today 
0,really bored wanna meet up with someone but everyone is out 
0,"ready to go home and sleep, not looking forward to the drive after work "
0,anyone want to come round on friday? cus its my birthday then and im probs gunna be playing wow by myself 
0,"I must prepare for the final exam!! Phew.. Iâll need to study more, before I take the exam. Okay.. I'm going to have a really hard time!! "
0,I'm such a pessimistic this year 
0,back to school tomorrow. Gutted 
0,"@cloverdash Here too  I'll be staying in all day tucked up under the covers, I think!"
0,@snw Party pooper 
0,"sunday lunch over, and pavlova gone "
0,sitting in the airp0rt lo0king extra l0st and extra bored .. im so sleepy 
0,@KamiliaElsay yeah but under 16's have to be with an over 18! 
0,@kelleyliv Thanks for FF love!  I was totally swamped and forgot all about it.  
0,"my mood all of a sudden turned bad  don't know what i'm going to do now, a bit grumpy"
0,was just enjoying toast and coffee and would b going to watch BB live feed - C4 are poo.   #bb10 #thisisdavina
0,@cait hey wow! You are! And just in time for my temperary exit. My ipod of 4 or so years took a terminal turn yesterday  #DeathInTheFamily
0,It hurts... 
0,I don't have one. 
0,"@Non_Pacem  Several people are moving this summer, the one you would know is Jessi. She is moving to Cape Cod. "
0,2 hour long Welsh GCSE exam tomorrow!! Dreading it   Rydw i'n dwp iawn
0,@minunianda have good fellowship at church ..can't go have to work 
0,@Seaicilin   that's a sucky way to start your day
0,@brett_ski YOU WENT?!!! *SOBS*  Did you tell me you where going and I passed... it seems like my mind blocked out Nin/Ja  
0,"just saw Rubens trending, don't be confused art people - apparently he is a racing driver   - (does he like size 0 as well?)"
0,@BeckyC3 My thumb hurts  I dont know why lol
0,Ow my head 
0,@danriordan it was rubbish! What a joke... 
0,@ksulisto I wanna have dinner with mommy too 
0,"This is my failing attempt at doing hwk  Help me.  Sorry I haven't boothed in a couple of days, I was busy... http://tinyurl.com/qg83sb"
0,Back to work tomorrow. I know I'm going to find it very hard to get up in the morning. I think it's about 2 degrees out there at the mo! 
0,I Got To Mow My Yard Today It's Going To Rain 2morrow 
0,Hate my PC! My brand new Sims 3 wont' play properly  Ahhhhh
0,@Don_J thankies... i'm such a big baby when it comes to thunder n lightening 
0,Leaving 
0,no updates  nawwww
0,"@RichardCarter that's a feat even for you! You are def cooking them for me next year, as i will be cooker-less in college "
0,I want some ice cream 
0,I just wanna go to the beach and swim  why my friends are such fun sponges?
0,"Geography Revision, Boring "
0,@DedaCorleon Damn fam sorry to hear bout your weekend hope you got home ok 
0,@amenisaytoyou i miss hk too 
0,@cozmosis  i reached my tweet limit like an hour ago 'coz i kept tweeting  #suckmyhypotheticalballs too much :]
0,"@minorityx   I don't even know you that well, but you come across as being so nice and lovely! don't let other people get you down <3"
0,reallllyyyyy wish i didn't have to go to work today. 
0,Im in Love with Guys i cant have 
0,@AllyAyr @tezzer57 Perfect sunday afternoon tv  I want my live feed with coffee!
0,@shenheng yap! wait for Monday! i'm rethinking again... i seriously fail at touchscreen qwerty 
0,just burnt the toast 
0,@ashtonishing the most difficult thing to defend against 
0,Bit miffed to find someone's just stolen a  big portion of my research on ancestry.co.uk 
0,back to the job...... 
0,@lalameow are you ok? 
0,i am veri upset that i onli have 1 follower 
0,i want loads of things...for my birthday...but i know i cant get... 
0,http://twitpic.com/6tpvc One of the puppies we sold. I just edited the pic abit. He was so damn cute 
0,@jakkaj coulda told me that 1.5 hours ago. :p wasted evening.  lol
0,Just woke up and showered. Gotta getbready for church now 
0,"I need to find some time to work on my crafts, I think its been two weeks since I last sat down to sew "
0,"oh, what an interesting sunday this is going to be "
0,"still planning to learn for the German writing test, still haven't done anything for it. im too lazy "
0,"If at first you don't succeed, maybe skydiving is not for you "
0,says plurk karma finally reached the 50s. still no heartsy smileys. boo.  http://plurk.com/p/z2x3y
0,wants play basket with her friends. miss you guys 
0,"Okay I need some help, remember that F1 video on ITV where lots of people mimed to MCR? Does anybody have linkage? I cannot find it   x"
0,"@judez_xo rarely let my emotions show, i just keep it all bottled up "
0,Ferrari still not on good level to compete with the Brown Gp in Turkey 
0,Shit missed the start of the F1 
0,my laptops operating system was corrupted!!! im using my cousins... 
0,"Good Morning, I just came back from the Vet.,but I have to go back at 4:00 to pick my baby up. I miss him already!  "
0,stupid cinema closed like how bout a warnin a website isnt that wat they 4!!!!!! so wantd 2 c christian bale in terminater salvation 
0,And now it decides to stop raining  I want to watch F1
0,"Bored, cant see videos or pics on my phone  entertain me..."
0,"i hope tomorrow will be brighter than today,and tonight i enjoy with my dissapointed about him.. i havent success to forget him! help "
0,@cat_elliott  i'm off but no way i can get out there....i work until 9pm thursday & have to be back to work at 10am sunday. 
0,Watching Parent Trap - the one with Lindsay Lohan. Awful that Natasha R.'s Dead  
0,@ElToroDeRafa I hate slow internet! Nole lost on Sat and Rafa on Sun  It was heartbreaking (
0,Looking for recommendations for a Wordpress designer who my be able to help with my personal site. Can't afford to pay much though 
0,just coem back from Londres.  Didn't get to buy anything... 
0,@Sebianoti I know my grandad isnt either he has Enthasimea and fibres in his lungs! hes dying and hes proper ill! i miss them loads! x 
0,@UzimaCollective @ work  could be worse! Hope your day is blessed.
0,@lewisusher i'm jealous  .. how bittersweet.
0,@LadyEcclesxX + btw my mother is having second thoughts about buying the gaga tickets!!! 
0,@Yeoj yesss i do lol it was my mission to update everyday but i failed at that attempt  hehe
0,@andrewjpan @justinkoh @bytebot its not a public holiday tomorrow guys. 
0,back home now had some lunch. now i really just wanna go to bed but got things to do ppl to see ;(  
0,Gutted the sims 3 doesnt work on my computer 
0,I so can't sleep! I think I have semi-insomina! I take knaps & can't sleep for more than 4hrs straight!  I need my BED! 
0,@lilj_j15_SODMG I didn't know that uber twitter took my url and shortened it   the url is in my profile - 502motorsports.com
0,"isnt feeling it today, "
0,another weekend another family get together. joy 
0,Still couldn't fund a blazer I like that's less than Â£200 
0,why is noody tweeting today  im really bored. someone make this exciting!!
0,our golden retriever has a NASTY hot spot on his hip.  Nooooo!   
0,@fsez wasn't hot; e cold season @ e mmt. but e hard grounds & all actuali hurts  i'll be careful abt wearg crocs thou! and thx 4 ur tip ;)
0,"by this time tomorrow morning, i'd be at work already "
0,"Yesterday! Market (Woot!), Art Fair ($$$), Greekfest (yawn), Mowing (hot), Party (fun). More sunburn. "
0,ahh no desperate housewives tonight! 
0,My head is stillllll pounding. 
0,"Finally.. The bus is comin, heading hums... Sighh, Tireeeddd... "
0,"Bit of a washout, we seem to have jinxed the show   Better luck next time hopefully"
0,i'm alone. i'm sad. i don't wanna go to school yet  broadband's really really ... Read More: http://is.gd/RxMd
0,is soooooo bored lol want to watch#bb10 now but no live feed 
0,i don't want to go to work 
0,http://twitpic.com/6tpzo - Skate Asia 2006 victory party. I miss this! 
0,damn all the peoples of the u s of the a is sleeping 
0,can't do hard very well on guitar hero 
0,gone to waste na rin.. ammmp  http://plurk.com/p/z2xr0
0,"I feel crappy this morning. In other words, I don't think soccer's in the cards. Stupid body. "
0,I'm hungry and we can't figure out what to eat 
0,"the rain is making me bored, so bored that i am watching mtv's pimp my ride, which i hate! "
0,"@simonmayo No, Margaret leaving has killed it off "
0,I wanna go back to my dads 
0,"How do you forget about your best friends birthday that u were with for nearly 4 years? I'm so sorry Jay, love u always xx "
0,@aidenmckenna bc ur getting the sims 
0,"wow, it got to 55 degrees last night. Unseasonably cold for TN. So much for Global Warming! "
0,ERyan comments. Love the GP but to paraphrase a now well worn soundbite: When the Greens hit rock bottom it seems they start drilling! 
0,me wants breakfast now. mommys not awake to cook for me  what to have??
0,cant believe its meant to be summer.. the weather is terrible 
0,"@DanielApt I think I have to be able to solve that one, but I don't think I can haha. Math sucks and I have a 4 for it "
0,"@gverdouw mmm, guilty as charged. Problem just seems to be that I can't find motivation to study "
0,"great way to start the morning: walk outside in my underwear, see my crush at the pool naked & asleep with some chick, didny get a soda "
0,Just chipped my tooth  bad times. i friggin hate the dentist
0,"@Bambosh cologne n munich? fuck! too far from my town. ghrrrr ;/. i wish you good times with boys from Metro Station, coz i'm not goin' "
0,@HeatherGastardi we miss you too.  Hope you have a busy day so it goes by quickly 
0,Crying again 
0,relaxing.. its cold in here 
0,"Listening to Sing It Loud in the car, goddamn I miss those gigs so much "
0,"@AmyWal Your face! Hope you had a good time at the ball! Sorry your tracks fell off  I will take the blame...Get out of bed, I miss you."
0,Feeling Down  ...
0,Ouch shit.. I forgot to cut my fingernails yesterday and the bitch just broke off... It's soooo annoying now! 
0,"@clionac Glad it went well... gutted I didn't make it, The Villager was a very quiet affair "
0,@Kitalpha yes. They won't let us take pictures inside the house 
0,@elsua Un-fucking-believable. In LPA is cloudy as shit! 
0,@Orlaminogue Orla your on twitter!  I really doubt you would of..  Get my text?
0,@eidismile I'm sorry you're not feeling well  drink lots of water and sleep it off!
0,@cat_elliott Totally wish i could come  I want 5 hot men singin to me on my b-day!
0,"i ammmm soooo sleepy, its not even 6am yet. y has my bladder developed an internal alarm clock "
0,"@robday I am so jealous you get your own space, I have nothing "
0,@maddieprior ...angels...fairy's...christmas...nickname frm granddad while still in belly?! I have NO idea wut ur middle name could be!! 
0, this is gonna be a long and hard day. I know it
0,not feeling to hot today annnnnnnd my eye is STILL twitching. 
0,i'm in love with @Leonardino12 's rount dounut like cookies he makes!!and i'm still sick.i g2g 2 a stupid medical tomz and missing school 
0,@emjaystar Ok well.........when at my own place....its everyday atleast once. And then also maybe to help me sleep! Yes Im single 
0,Still couldn't find a blazer that's less than Â£200 
0,I won't so it even if i tried. 
0,@MomtoBrady hee hee - I'm out of pb 
0,"@chalkasian not really ""rice guilt"", more ""calorie guilt"".  veggies: 140, rice: 480!   The rest of the dish was almost 1000 more though "
0,I don't want to go to camp this year 
0,"Can't sleep -- I shut Daniel's car door on my index finger, and now its in throbbing pain and purple!!!! "
0,only has 13 followers 
0,@micpena why?!  is there something wrong?.
0,"Morning yall! No expectations for a good day to me  Listening to ""Run"" Leona Lewis! http://bit.ly/UqYc5"
0,"@jbastiancole oops. no.  I could have, but I decided that that was less than totally awesome."
0,it's raining. yay. as long as it's dry tomorrow from 5.45-8.30 it's okay. i hate to work and ride to school in the rain 
0,This revision just isn't working!  xoxo
0,@Eric218 [jealous!] I tried to get tickets in Orlando but it sold out too fast 
0,@lewisusher  I'm gonna miss ATL and SYG a lot too
0,These two weeks were to short! WAY to short 
0,@Glasgowlassy I was hoping to come home and someone would offer a massage but no I'm still waiting 
0,"@scott_fuller ughhdfkojdfklfadsj  im getting you a blackberry world, that way you can call me every day."
0,I just saw the time we've been here for hours. 
0,gtg.....dunno y....feelin xtremely BORED!!! 
0,I read where kids are bastardizing English?...Nothing new America's been fucking with it for years 
0,I wish intelligence could be bought from market... 
0,Missing Malta and longing to go back 
0,Last night was so fun. Too bad I'm still feeling sicky. My other eye now matches the scary one. No church today 
0,Nick is sleeping....his last day at home. 
0,@Sadiealice there two other awful ingredients in that too. I hate them.. hate them more after 4 of them... 
0,Trying to get the laptop to work 
0,watching the rain come down on my washing! 
0,It's raining again! 
0,I'm going to miss dance.  I will miss everyone who is graduating. Hope you guys have fun elsewhere
0,i need the sun back 
0,I only got about 4 hrs of sleep  I am not a happy lady. I want sleeeeeeeeep!
0,@SarahCasonHall sorry I missed you! Once I got to my seat my phone has zero service 
0,"Ugh, going to work on a sunday.. "
0,Realizing I am not going to be able to watch the French Open final 
0,@gustible are you on the road again 
0,Proper bored of being ill now  cheer me up please x
0,@vickyjones91 i knw right stupid 
0,soo good that the storm always comes when i'm at home alone  the thunder is so formidable..
0,*COULDN'T! SCREW YOU T9 DICTIONARY! i fail at life.   
0,"off to Niagara Falls to attend ""In memory of Tori Stafford Day"" ... "
0,@DaRealAngelLola Early morning headaches are no good ma ma  take an aspirin and relieve yourself asap
0,things are just not going well at all.  work all day and then an assload of homework and laundry
0,@Jadeebethxx well we dont know if they are...but *hug* 
0,tryna upload a new song  but i cant!!!!
0,@mrhankmanthe3rd Hoping they do an early upgrade program again or i'm going to be even longer without an iphone 
0,"@realitydistortd i was same last night,had bout 5 hours.. im knackerd!! "
0,Wtf it's so nice out! Why do I have work all day  ujgggc
0,arhhh need to do some english  Why didn't I do any yesterday again?
0,Is exhausted and feeling so ill 
0,Just waking up w/ the babygirl. She's fed and watching handy manny now. Getting ready to go to anniversary party--not ours. 
0,ish mahal nya delivery! 
0,"been up for almost an hour, puking. soo glad im off these next two days. back to bed... i hope. "
0,watching a horrible film called madhouse.... im actually quite frightened 
0,Hey @tiedinknots! >< @lalameow Awww.  Ask him for new ones! D
0,im thinking i broke my iPod...i plugged it in and it still wont turn on... 
0,"yeah, I think I'm going to be sick. I was painting the wall outside, and the rain wanted to kill me..  BOAH."
0,@ninjamoeba still in the bottle 
0,@JulieLauber  i miss you already! wahhh! 
0,hmmm - playing sims of all things and am very tired 
0,@samjmoody  i lost me daschund the other week   proper lost him... but he'd ran back home himself n was standin there waitin for me.. GAH
0,this hotel internet is so slow  at least you can get on things unlike school internet every things blocked even twitter! home 15 days!
0,"no  all alone, no luv for the evil ?conley?"
0,@meg_moorlach but I have to work 12-5:30...boo 
0,OMG! I overslept  Shuffling around to get the best info @ #Mega09
0,watching a film called madhouse... and im scared shitless...  
0,it' s raining for days in Germany 
0,@ameltoe oh my fuck moscado is my fave wine ever!!! I miss u 
0,"ERyan comment>Love the GP but paraphrasing a now well worn soundbite,When the Greens hit rock bottom it seems they start drilling!  #le09"
0,@Beyy maybeeeeeess ahahaha. i wanna be at jupiters  ily nb
0,So tired after the ball - 2 hour drive back and only a few hours sleep 
0,Still 21 hrs till my placebo Album can be legally downloaded 
0,im watching the f1 now. . ahh go kimi go 
0,@drewKoh me too 
0,Aaaaaaaaand I just shattered my iPhone 
0,evey1 plz pray for @heidimontag she's in the hospital and its not looking to good  shame on u @nbc
0,Our last Sunday in Raleigh 
0,EEE I am so jealous that stu is at one of the biggest gigs of the year  and im in bed! haha bet thats gonna be a good day  booo *green*
0,looking 4 work & its not looking too good 
0,Feeling a bit melancholic today. Probably because I've been working too much. I'm nearly through the pile. Hope I don't collapse too soon 
0,wants to attend a prom badly  All the prettaye dresses!
0,I want Nick to talk about me like he talks about Miley...He never will 
0,@jaraca that was so sent yesterday morning. i love how smrt the mobile nets are ... tho it's a shame i'm up now ... i'm super hungover 
0,has just finished work......dreading goin back in tonite 
0,"Just dyed my hair the wrong colour  ""I see no point of living if I cant be beautiful"" I feel like Howl felt right now!"
0,its 6am and I have been up since 9am yesterday...this is a serious problem!  Starbucks here I come!
0,just realized my journal is fullâ¦ too late to go to buy a new one 
0,@SomeKuwaitiya heeeey miss you  shloon al exams ?
0,hmmm very boreed  nice day might go get a tan
0,"@judez_xo awh  yeah ive had alot of people say stuff similar to that, i need to take notice... its also my self-confidence that doesnt+"
0,Check this video out -- Bill Cosby's Nerds NERDY  HEHEHEH h http://bit.ly/2fAzo
0,@billyraycyrus  YOU WHERE IN MTL?..and I missed you 
0,Gone before we even woke up 
0,"@indie_eire Apologies, it sprears I am somewhat moody today "
0,"can't track livetiming for the race. some java script issue. damn this office comp, can't install anythng  #Turkish Grand Prix"
0,cant be bothered to do any work but only have to go in Tuesday and Wednesday and im done my first year its the only thing driving me 
0,@MissREbella looking for a job in London it's so hard  I am gonna end up designing for the homeless at this rate lol
0,"@SianySianySiany @zairesheppard and her mate are still sleeping in the living room, which is where the telly is. No TV for me "
0,"Leaving for New York shortly... I usually travel VERY light, but somehow my luggage is full of my clothes. Strange. "
0,aww someone unfollowed 
0,Going to go get the disk replaced. If this doesn't work i'll cry 
0,just got back from a party (: im tired. cold. and i think im getting sick 
0,Not a good way to start the work day being over a hour late. 
0,Back to VA today 
0,Ohno I think my 'puter speaker is dying... Things are v crackly 
0,@leethompson Don't scare me with stories like that 
0,OHMY. HELLO HELL ! GOODBYE STRESS-FREE DAYS!  lol.
0,@ErrnBbtt I couldn't find my camera cable before i left so pics are going to have to wait till i get home  but i am taking a ton!
0,First time at PastaMania.. And suffering from super chilli 
0,is going to get ready and is hungry  dinneeerrrrr x
0,On my merry way 2 work. Again....can't wait til l8er. Lastnite was nice....til it was time 2 say goodbye. 
0,"@benrlr I finish at 5. . . 3 more hours  want to go home. . Must. . . Revise . . And sleep! Ha, how are ya Mr b? x"
0,Heading home today! Goodbye Florida! 
0,became movers today...but didn't earn a cent  what a tiring day!
0,"@Spidersamm but i love you, and i care for you "
0,is hurting right now..  http://plurk.com/p/z2zk4
0,@SAngelloLIVE sorry to hear that man 
0,@ROCtheSHO Lol yes I remember that! Ha remember when I had the whole classroom Jumpin Out the Window! I miss the kids 
0,"@mrobinson85 why wasn't I invited to do that?  Totally would have, walking by rouge I really, really wanted to go in. haha"
0,It's 9am and I can tell u that it is total beach weather right now! I wanna go! 
0,Trying to re-imerse myself back into my online communities after about a month...not working very well 
0,@BananasMel  same idea..I eat one.I'd like to be able to deliver......   
0,"@exwebjunkie is that the new AF merchant? Send some this way, stayed the same for 2 weeks! "
0,Just woke up..baby is sick 
0,"I'm feeling sick, my mom is making me clean up the house and my brothers are still sleeping. Not fair! "
0,@shaundiviney my ipod froze. and I need to listen to you to make me happy  will you come sing to me? x
0,"hungry..... dad went voting, but he was back way to fast, i wanted to do a video  oh well, Tuesday maybe "
0,@jaycloth no sign of iPhone update yet matey boy 
0,@sugarghc I want those cookies now 
0,"@ohsojelly & I'm imaging how he looks like,sitting all alone outside!  Aww..I want to hug him!"
0,@darsoid another headcake? 
0,LOL this is the first time i've ever been late 
0,preparing for the ESL Pro Series Finals: Where are my sunglasses? 
0,"@Ms_Poynter_1988 whey lol I really want to call cricket ground to see if i can take billi at all, phone bill too high though  pants!"
0,"@realitydistortd oohh 5 hours is not enough for me,,Haha.need at least 7 "
0,@MyriadM  poor llama... its not worth it. now you burnt your feeding hand...
0,@TechboyUK sun's out here now  now have a bath room full of wet bike and kit...!
0,I am pretty sure this Tortilla Crusted Fish is really good... I just wouldn't really know 
0,@BlowhornOz oh no thats pity...but thank you very much for your information!!so i must wait for the ps3 game 
0,@hatticusrex Don't even know how to get there 
0,i hate homework!but i have to do it now...tomorrow school 
0,Just had an omlette! Not a fan of eggs but dads good in the kitchen and we need to go shopping so there is no food in the house 
0,@mbmcclenny hipsters are moving in and the drive-in has moved out.  Sadness...  
0,should i give up my music?.. 
0,Muchos champagne drinking going on in the River Island bar - it's a private partay though so no bubbles for us 
0,Parked next to a broken bird... Legs snapped in half  saddest thing ever.
0,"Ha thats depressing, you've just got overtaken by Piquet "
0,Im sick  feel so awful and i have A LOT of assignments and assessments and tests and other course crap to do and deal with >
0,@mcherrywv Groceries.   then work. Need that coffee IV. Lol
