0,Had some bad japanese at Central World today
1,"Me and michelle are such badassess, we just dipped without paying at Kobe"
0,"ugh..my family is going camping, but josh has playoffs, so we'll be here alone all weekend"
1,USER I'm taking Domo with me to fight him
1,"watching challenge on food network, going to make myself a wrap for dinner. going to jupiter tomorrow for a couple of days."
1,"1240 words, time to call it a day and wait for my mum and my boyfriend's parents to come over for dinner!"
1,USER call me ;) 0448417513
0,...talking to mommy. she feels guilty about clashing plans w/black & white affair party.  still undecided to go tho..
0,dead on my feet. gotta be up in 3 hours. damn tired. so drunk. not the best feeling in the world...
0,"USER I'M SO STUPID! (YES YOU'RE) THE BOY THAT I LOVE, LIE ME  I CANT BELIEVE IT, HE BACK WITH HIS EX-GF NOW IS HIS GF"
0,I guess if Tosca was in San Fransisco I can't regret it too badly; way too far of a drive to get there anyway
0,i cant find sound effects for my school work
1,Good times  The sun is now out. The report I'm working on is coming together well. Reckon it's almost time for a slap up Sunday lunch
0,USER yeah! i felt so bad for que  but i was laughing so hard at rob being dunked in the water hahaha
1,"would it be the stupidest idea in the world if I ever DJ'd a night? I have an ipod, 9000+ songs and NO talent.. what more do I need?"
1,'s morning cliche: Getting up was a bitch!
0,Hates car trouble and suggests that everyone change their oil regularly.
1,USER dinner and boggy time  have a good night lovely.x
1,USER letting me have a listen would seem to make those albums wayy more fun!
1,#myweakness a funny girl.. Who knows when to be serious but keeps me laughing
1,"USER saw you on twitpic, random but what does the 'gold' tattoo actually mean? i'm curious"
1,ill and bored on bank holiday.. Nothings open.. Bad times.. Film it is
1,USER NYC all day baby
1,USER good flight and good choice
0,Alice is awesome. I wanna rip Jame's head off tooooo.
0,"knowing what i'm probably going to be waking up to in the morning, makes me want to sleep for the next 3275897592 years. Depressing night"
0,USER  I know the feeling
1,Having a pj dayy.....Doesnt happen veryy often
0,USER thanks now i miss them even more now
0,"fuck, just realised im 26 in 21 days."
0,USER . . .  If only I Lived in Zurich
0,Not really doing anything at all at work today
1,convincing shicara to join twitter. ahaha.
0,"keep looking at my evo photo & being happy, then sad it's over"
1,USER i know man D: i hope you're feeling a bit better now  hahahaa jo whiley is asking nick jonas if he's back with miley :')
1,USER Glad you found one you liked. Your welcome
0,USER Maybe some of us do care. Don't judge.
0,"I've only had a donut an 2 choc fingers since breakfast, roast dinner is an hour away  do I need another finger??!!"
1,USER article posted!
0,Road trip axed. Gotta catch up on a few things around here. Like Springtini  ...and spring cleaning.
0,patheticly fat
1,Working with TWEET!!!
0,"Not feeling too good, seriously thought my allergies were just going crazy, but now feel puny"
0,"USER Nope, it hasn't opened in Dallas yet! I'm not hearing very good things, though."
1,Oh! I forgot to say The Bangels sang national anthem at Dodger game today and Lakers Sasha Vujacic threw the first pitch
0,eww i have to work in 1 hour and 20 minutes
0,My head hurts  At least I have KB and Baby Nov to keep me company.
0,"Yeah Lisa, I Forgot about you and wrote everything in Portuguese  ... Damn Pedro !!!"
1,"its 3am, I should be sleeping and not wandering. Gah!  Goodnight! have a great day USER USER USER USER"
1,USER Aaah!  She's blushing now!
1,USER  Thanks! checkig the site now. my husband is dealing w/ a domestic discturbance. will aprreciate your prayers. thnaks again
1,USER ha ha. Yu ain't gonna get me talking bout tears on here lol. Got it all bumping on my pandora right now. My mood for tonight
0,"USER dont think they are doin another this yr thou   if its a arena tour thinkin newcastle, glasgow and manchester. x"
0,USER I can't get that horrible dream I had last night of Simbacat out of my head!  Its unnerving me!
1,"the weather looks nice again today  Saints ECC final later, hopefully i'll get to watch it!"
0,i dont want to go to work
0,"USER That's great! My bro has drank out of the cup, it seems everyone has but me.   I've seen it from afar but not close up."
0,USER I don't know how they allowed to get away with it
0,"USER Lulz good morning, and unfortunately not a very happy friday for me so far"
1,"USER Mr. Blamire thanks for the mention, it's an honor.   Your Steam Wars illustrations are awesome!!!"
1,"USER Come to mexico and I do to you all the Mexican or Italian food that you want jaja â¥ xoxo from Monterrey, Mexico"
1,sooooo warm again. love it  got some sunburn boo. I never tan - fact!
1,talking to my best friend. i just scared her to death
0,USER I know  how are you sir?
1,USER not bad.  where people saw it could be miley?
1,USER i didn't get it! Yum sushi
0,USER It's not yet out?
0,My neck hurts sooooo BAD    OUCH!!!
1,Homemade vegetable beef soup.....yum!
0,USER hahaha im trying to get USER to call me  but no such luck... hmmm imma try again 4434156058 darryl
1,USER yup because when they're drunk they're brave enough to say the truth!!
1,"USER installations, laptops. This is it. I'm getting the hang, and dreaming of automating some of it. Especially printer additions"
1,USER hadn't thought of that but if it means you'll be there I'll make some
0,"yyyyaaawwwwnnn i left the icecream out overnight  now im very sad =,("
0,is bored. school tomorrow  twenty twenty gig on 9 th sep at abc2
1,"Laying in a hammock, under a tree, by a cute little pond is seriously one of the most relaxing things in the world."
0,Please don't say I've got to upload one at a time...  Boo.
0,"Home at last. tonight was a good one, had suttin missin tho"
0,"I'm used to being the one who is late. Damn, waiting around really sucks. Sorry to anyone I've ever made wait a long time"
1,USER  you should look on ticketmaster  tickets are like 20 quid xx
0,USER but of course!! I can't view it from here   but I will this evening.
1,"Morning     hair,makeup,breakfast then off to my workexperience till 6.30pm!!"
0,Countdown....4 more days till I go to south carolina! It's late and I wish I didn't have to sleep alone
1,"Does your skin care routine keep away redness, wrinkles, and acne? Mine does.      www.votrevu.com/socalbeauty  Want FREE samples?"
1,ooh! iam now addicted to USER 's OUR SONG!! i think i played it for more than 30 times today!! and still counting... waaaaaaah!
0,"Watching Strictly Ballroom for the zillionth time. I adore it so! Also, I have the oddest craving for a PB&J, but I have no grape jelly."
1,USER cleaning and lurking?  Multi-tasker! Clurker?
1,"USER Besides, anyone who's spent time with Singaporeans and are half awake must've learned about Hokkien..."
1,Cough cough... :hide: :hide: :-P  :redface: :redface:     URL URL
1,USER not scared of you either lady!!!
0,"USER awwweeeh but from what you've said, i'm not surprised."
0,On my way to work wish I had more days off
1,USER That kind of wicked adrenaline makes for interesting art.
1,USER You should try Blanton's Bourbon too! its great. and it's not just the name
0,omg chocolate lava cake @ del frisco's is the bizness! not a good post-workout meal tho  URL
0,"USER We have two cars, plus a new company car, so one has to go. Shame to lose my Mazda but makes sense"
0,im just ranting out my feelings!!!! ill be over it in the morning hopefully...
0,Good Morning!  I have to work all day today!
1,USER you're welcome
0,wtf my sis just reminded me some place in ny & nj they sale jobro hot coco and a shake called thats just the way we shake  i want one! NOW
0,USER This very weekend - Friday thru Sunday. Leaving Monday. Absurdly short notice - I suck at being prepared to get canned.
0,USER fraid not
1,"if you have bebo, vote for me on this poll please?  URL"
1,Have been sat in the sun reading about gender categories. Thinking about soup for lunch and looking forward to BBQ at no. 45 later
0,My cat has gone missing.  We're rather distraught about it. Prolly he'll show up just when we're resigned to him being gone for good.
0,Off to work.  Maybe I'll win an iPhone while I'm in there! #squarespace
1,"USER haha artist! ill jst call u artist i said! hahaha... bloggin, about that.. im twerkin on a new site!"
0,all packed up. A little shopping at Downtown Disney then headed to the airport
1,"USER We don't usually play music, it's all talk and bs.  Cool, I'll check that link out."
1,Hahahaha DUMBASS trick
1,"USER  wow, thank you....that was my first response in twitland"
0,"""6 students beaten last night in the dorm died today. they were from my university. we wore black today  #iranelection (repost from iran)"
0,Over Dan's. Delicious Brats. Xbox is blinking 3 lights red out of 4
1,this is a great evening! snow crab & grilled chicken = excellent surf & turf to go along with my salad! a nice drink and a game 2 watch!
0,"Morning, got to go to work soon."
0,USER And now it's over!
0,URL - McFly  wasnt that close tbh
1,USER hey baby.  looks like everyone's joining the twitter craze...
1,USER LOL! I think he shud get a pic of his taken with the bunnies himself now  The damn LCR site is alrdy NSFW at work though!
1,USER I hope today goes well
0,"Bersakit sakit dahulu, bersenang senang kemudian. I wanna go shopping"
1,Doesn't see the point of this twitter thing... waste of time and effort me thinks!
1,USER Major Fail. Since you asked
1,USER Good night chica!!!
1,"USER Aww man, happy anniversary!  - You are a ninja."
0,gosh i wish yesterday was today.  i miss everyone so so much.
1,USER that would be the FailWhale. Love it.
0,"Oh dear, hangover time, far too much to drink of everything last night  Was a good night though"
0,Opps I over slept rushing to work
1,USER omg i forgot about that! thnks for the reminder
1,USER exciting stuff!! sounds like you're on a real journey bru  enjoy it!
0,Good morning!! Outside is rain and inside is pain  Maybe its not a good morning yet!!??
1,"Jus waking up and i feel refreshed, got sum errands to run before work, then find some time to pack after i get off...ugh so little time"
1,"Man, aren't I just a bottle of sunshine today?! Going to try and stop complaining now."
0,Is out dining outside w/ my Bri!!! TB is being whack and didn't join us
0,USER aww.. a baby holga. I want one too.
1,"I just had a ""LOL moment"" with Alexis...totally worth the planning!"
1,Remedy migration complete. Only outstanding issue is the crystal reports server. Go figure.
0,the reason i left you tonight was that i thought you left me first all alone. even carlos took off.
0,at work looking forward to going home and sleeping in 7 hours
0,USER I miss snow in April. It snowed here....uhhh twice? maybe? and it was ages ago  I would have danced with you!
0,"If there's a dude out there who wants this to be their wedding song too, then I think we could be future wifies  URL"
0,USER PDS slides are useless.
0,"USER Faanks mir, no it's my girls from mexico, ima miss them"
1,"Hello, lovelies. What've you all been up to? Well, I'm here at Twitter, d'you fancy that?"
0,USER I read French...
1,two black guys and a FAT girl = double stuffed oreo!
0,USER hey love..x is half 2 the earliest you can come up ?  we can go out for longer if ya come up a bit earlier ; ) x
0,i have three elbow creases in my left elbow. i am becoming wrinkly  i blame the rash.
1,USER ebook included?? I'm betting not but worth checking
0,"the final blow hits you, somebody else gets what you wanted again you know its all the same, another time and place, repeating history"
1,going to soccer  yeahhhh
1,USER Qualitativ sind 'normale' vom Sound her viel besser.
1,USER ooohh... well USER said he's a good cook. We should go to his place
1,USER didn't think so thank you
1,Still aint been to bed. Walking home from getting coffee. You know hanover aint to bad at this hour. Kinda peacefull.
0,USER no TweetDeck for Pre yet?
1,hello (: this is me on twitter at 135 in the morningg.
0,USER are you listening to cher? :p excited for the 2010 projects   AND i've lost my let the good times roll off the ipod
0,USER fair enough. It MAY be something connected to you..but that DOESNT mean people have to be mean about it
0,USER i feel like such a pansy when i run from them. But i can't help it-it's a legit phobia!
1,More #FridayFollow USER thx 4 FF last week - sorry not 2 reply sooner USER - thx 4 sharing great info  Have a lovely day!
1,USER Don't be ridiculous! Everyone knows the green ones taste the best! Breakfast of champions or people in a hurry - either way
1,USER YA BEAUTY
0,"USER -- Oh how sweet, I didn't have the option when my last kitty was put to sleep, I was out of the country & my parents didn't"
1,i loved all the sun and all but have to say i do love the rain  since im not out in it today
0,USER It tastes the same as if I'd made Japanese curry. Stupid curry powder
1,USER that it is
1,All up in Alhambra. A lot of good memories. They were playing Gaga at Jamba
0,"USER Refresh my memory, which one was that? LOL. I'm trying to put a handle on it, but I'm drawing a blank."
1,naked night take 2
1,Eating breakfast at ankiis place too
0,How do i do a resume
0,USER I want to join but my knee still busted. So sad.
0,Watching Golden Girls b4 I go to bed. Remembering Bea Arthur
0,"Farrah RIP  we will miss u! ""Angel of Music"
1,"USER lol ;) I looked on the website, but I can't find them... I wish I had the money to buy those jeans though. Haha, good"
0,Damn - I appear to still be in bed. Not good!
0,I wish someone would USER my tweets...
1,USER The guy complaing in the BBC story here -> URL
0,USER  That sucks
0,"backkk from watching last weeks supernatural, omg.. dean crying  makes me sad"
0,Cj and I are trying to save a dying bird that hit against our window
1,cant wait for home star runner and aiden tomorrow
1,yankee game was so much fun!!! off to connecticut
1,Havent done anything all weekend and I'm loving it!! just running errands and study and tv  i needed one like this...next weekend it's ON!
0,USER wah omg strong hands and arms! i can only do 3
0,on the way home from the dr with Kaitlyn- good 6 mth checkup! 13lb 12oz and 25.5 inches! 3 shots though
1,USER hey there.. thanks for following me  i followed u already. let's be friend!
1,practice for soaring with song. david fosters band and brett kissel and william joseph.OMG!!!!
1,URL I simply LOVE it
0,URL scary  Hope it turns up safe.
1,"USER - I agree! I usually bring a book, magazine or get immersed into an iPhone app  What do you do?"
0,Dood no1 has shwed me love today.....  URL
1,All's quiet on the western front - gonna go out now
1,"USER i just watched your duet with miley cyrus on youtube, ""i wanna know you""  im still singing it til now! love it"
0,I feel that too...
1,USER 1 baptism turned into 4!!!  God is good
1,"USER Morning, what does it smell like, in the mornings in Colchester then? Lol"
0,Back to the hole in the ground tomorrow... save me
0,"Work work work... if I don't shut down tweet deck, I'll never get any done."
1,"USER yes, it does"
1,USER Thank you!
1,ok fixed the background.
1,USER I could sleep for a week myself.
0,USER yea...meant to be in at 6am again... I really don't know what's going on like  x
0,USER home safe.. didnt go do what i wanted to do b/c i got a random ass email from an ex-boo and it made me feel bad!
0,No luck.  Where is my kitty? <3 Ami
1,is thankful for the weekend!
1,"study high, take tests high, get high scores -- classic"
1,"So the Jonas brothers are flying to South America (maybe they're there already, who knows), but let's pray for a safe flight!"
0,USER I haven't talked to you since the last day of school!  that's no right.
0,"USER haha ! it wont be for at least 2 years  believe me, if it wasnt for my fmaily and school, i would leave tomorrow .."
0,is doing work sooooo not good
0,Morning all. I'm about to head out for some breakfast and then it'll be time to go to work
0,On my way home   I want to stay longer.
0,Super tired. Got school again tmrw
1,has decided that it's not worth it
0,"USER Nah,not in front of a judge.Just in front of a bunch of scallies and lawyers in wigs.Not cool as I did nowt wrong  Hate work."
1,"USER he he.. they usually better at returning calls than us, so I'd forgive that"
0,"USER a handful of mixed nuts, no time for a real lunch today"
1,"Booyah, I found a real live Lavender plant a while ago  I'm so Psyched  I love how it fills the room with its gentle scent."
0,"my girls warned me i'd feel like this, i pushed you away, and now i miss you holdin me"
1,USER you are aware da LOL nije Srpska rec either?  *runs for the hills*
0,NOOOOOOOO! They talkin about going to envy!! (jumpin in front of speeding cars NOW)
0,"""Lost""'s Juliet just died! NNOO!!  And it doesn't look like she'll be back since she'll be a lead in ""V."" Lost is becoming a sausage fest!"
0,USER aw gdgd ... sme here ma throat killin me too lyks  xx
1,In Iowa City for the weekend!!!!!
0,Nothing like swiping your transpass on the bus and realizing u never bought a new one for the week smh. This is so going to be a bad day
1,USER It's reset now so I'm fine
0,USER I know
1,"okay , i'm happy again , i hope saturday turns out the way I want it to be .  yes my birthdays on the 4th , best birthday GIRL HAHA"
0,"i had a good night with USER and USER, i'm not as stoked for work in the AM though"
1,USER shout out on the mixtape
0,USER Stop tormenting that poor doggy
1,USER Of course it's normal!
1,USER Any chance of another update? Sorry if you've been asked this a million times
0,Note to self never soak your coffee mug in soap. Ethiopian Bold Cascade isn't my fav
1,"Krill - the most unique discovery of the decade? see yourself, and tell me if I am wrong  URL"
1,USER yes! We are planning on brunch tomorrow. Sounds great after spending the day cleaning the roof!
1,yay i got my first guitar it 60 pounds with a case and a tuner mum gave me sister guitar yesterday but now i got my real one
0,i o telefone naum tocou mais hj !
0,wonders.. it's gonna be a long long night..
1,USER  my thoughts exactly.
0,"USER Eh up you  We are talking SAAB 9-5 se, estate too. Had to get a 2.0t as insurance wouldn't touch Poppet on a 2.3t"
0,USER Hahaha. You never ask me.
0,Suffering PC blues   What I need is a MAC!
1,Boyfriend is making pb&j for me  terminator 1 & 2.. Because he's forcing me to watch them
1,Pushing down my cuticles.. Chanty would be so proud
1,"USER I'm happy about it. I fel bloated, so I thought I was going to gain instead. But nope."
1,Loves his seeeester
1,"Hey USER just found out that ""The video is no longer available due to a copyright claim by Home Box Office, Inc.."" sorry..."
1,so many albums coming out this summer!
0,#squarespace the weather is killing me
0,"is DEPRESSED. She had huge hopes in going 2 see Mark Kanemura in Beaumont 2morrow, only 2 see her dream die. Maybe someday in the future"
1,USER I do  . Am I not a good girl ?
0,"I wanna go home, working on a Sat should be banned!!"
0,No lions... drove for over 5 hours and not a single lion to brand!!
0,"USER  get a hug them, and then have a beer"
0,"USER Since coming home, I havent watched Price is Right   I need to find when it comes on the West Coast X_X"
0,Oh sucky... my phone doesn't support Loopt  URL
1,Heck Yeah i am!!! micah had an extra ticket  Im paying him back of course :p ...
1,"ellani made me twitter, so here you go  lol im watching tv while doing gay art work"
1,oh a shoutout to USER. thnx so much for ur time!
0,USER GeekDad question: can you fit 3 isofixen seats across your car? Just been trying to cram 3x in a saab. My bus is knackered
0,"right on with work  cant concentrate at all today, again)"
0,bored  in the school and trying to study for the exam :S
1,yay i won the mac eye shadows !
0,"Last night of vbs    I'm sad, but it'll be fun!"
0,Leaving on a jet plane [ do miss you  ]
1,"On the bus homeward bound. Its a nice night out, sunsetting, getting dark"
1,I'm a horrible person and ain't been on Facebook in so long so friend welcome and follow our friend USER u too! Miss ya back
1,USER RE: Teething: My mom always used rum for our teeting.  If you're drunk enough the screaming doesn't matter so much.
1,"Melbourne - Mazda - E1600 - 1981 - $8,000  - new ad received and will be posted on the HCC site soon"
0,bored outta my mind! Wish I could shake this mood I'm in...disappointed and frustrated
0,why am i not in dallas?
0,3.0 on iPhone still can't spell...
0,"watching the very last episode of that 70s show, haven't watched it yet"
0,Everytime I eat I feel so nauseous. Someone make me feel better
1,USER your so lame sometimes!
0,USER  Awww M  you can tell your husband was a 'cat person' only cat people get that special relationship.
0,"im watching wwe, smackdown. call or text me if you've got my number. im in pain  hopefully tomorrows better :/"
0,USER  deleted b.c f copyright laws....
0,"The ""quart bag"" ... it defies logic.  That's all I gotta say. It just may be my undoing."
1,USER well sam and his cronieees have to do it again   i think...lol ocr..the examboard..
0,I really wanted the news to say that the passengers were found on an island.    URL
1,Ok hair is cut - small lunch break - then off to find that outfit we can't live without
1,USER aaww... pati dw la salle start na bukaz... gud luck rachi...
1,USER you WISH. I'm just being brainwashed by you guys
0,MÃ¬nh Äang muá»n há»?i em nÃ y xem cÃ³ thanh toÃ¡n qua payoo Äc ko  URL
0,"it's raining here, i wish i could be cuddled up in bed w my tim"
1,Playing Crysis on the new PC
0,at work ! Fuck !
1,USER tweet deck and an app on fb
0,I'm having trouble adding BlogThis! to my blogger blog. Can't figure what I'm doing wrong.
1,"This was probably one of the best weekends I've had in a while.  All things good have to come to an end, though. I'm at work to prove it."
1,"loves jb's new song..""fly with me"" fantastic.!"
0,Why do all the twitter apps for blackberry suck? I want my iphone back
1,"USER THANK YEW, I now learned something today."
0,Gaga afterparty in Toronto is 25+ ...WTF?! SHE isn't even 25!  USER
1,USER USER USER tomorrow party?!  getting sick of not doing anything at nighttime
0,USER oh yea! i remember that from when i had comcast...naw i got AT&T U-Verse now.  ..its GREAT but no HANGING W/MR. COOPER. LOL.
1,i have a craving to watch school of rock again.
1,is finishing his plate for COLREND
1,USER cupcakes! clearly.
0,"in bed, my midnight snack and I, twix  theres a fat girl in me somewhere"
0,"i thought it was meant to be morning sickness, not all day sickness"
1,up at 2:26 playin the piano  and writin songsss.
1,My mom is graduating today
1,"USER Awww, your too kind! Thanks for #followfriday  Did you get the PC fixed?"
0,I wish I were outside taking pictures today.  The clouds are amazing!  The breeze is incredible!  Why am I stuck in an office?!
0,USER Paladin truck sooo does not turn as good as priest car
1,The sun is shining today and Georgian terraced homes of Belgravia look even more cosy than ever
1,well USER you look so gorgeous in looks magazine here in my country
0,Stuck at the Airport. My day in Vegas (with a customer) just got cut by a few hours
0,Missed my flight   damn elevated terrorist level...praying for a standby miracle..
1,wrapped up in my doona with a bag of chips all comfy about to watch what happens in vegas
1,Despite my best efforts to worry I find myself calm and happy today
1,USER No... I would hunt you down if the show wasn't KILLER!  GET IT?? HA! HA! I know...I'm sorry! It's late!
0,I'm feeling low..
0,"attempting a poetry essay, listening to jessie rose and feeling fat"
1,David Archuleta is really good  Welcome to the Phils
1,Yoga!! Here i go!!!
0,USER hahahahah  nothing ugh my eye is all watery  and i dont know why :\ soo whats up with you?
0,Oh noesh he fell.....
1,"USER I expect to see you at work today, or i will beat the crap out of you"
1,I wonder if I can get USER to deliver a big gulp and candy bar to me again today
1,USER Mood Gorningue  (English is difficult ...)  Bonne journÃ©e
1,USER DUDE!! MS is having double experience points. You should level up some more!!
1,USER If ur willing to call 911 for me than I'll look into Itunes just for you.
0,My throat hurts
1,USER Yeahp.  I love my friends in school.  CSI:NY IS THE BEST.
0,tripping through tiredness is nottt nice
1,"Get yer freak on-it's Monday! Have a Great one, if it's possible to have a great Monday!"
1,USER please give me a shout out  i would just die
1,Going to confirmation practice. LOL.  See you
1,New phone! Same number.
1,USER  <-- that's a big smile for you.
1,USER need any help ?
1,oo shit .. jus got paid hellz yea
0,ive put up 2 blogs on mileyworld and neither are showing up  im getting on it and gonna try and fix it! sorrrryy
1,for some reason i was excited to get up this morning for school.. last day of classses!
0,Fucking boredom... Makes me wanna go have a smoke...
0,early bedtime in williamsburg... tomorrow is my last day...
0,"USER I'd like to be here, but I'm still missing.  #hhrs"
0,"tomorrow is holiday for another ppl, but not for me at all.."
0,I miss beachhouseee
0,"I picked up the FLYERPROMONOW mag yesterday at 4 with Erika Roman on the cover, and at 8 i hear she passed away  Life is short u guys"
1,I am dying of boredom. Just edited MySpace! 1.0.
0,"USER school isn't the same without you,  ."
0,USER I was not hugged
1,"USER It sounds like you are doing better than my parents already.  (They are good, but were young & weird re this one topic)"
1,USER arn is bringing me from n'abbey. Maybe he'll help u out too
1,"Just woke up. I wonder what God has in store for today!  JReb lip sync tonight! Woohoo!! Alright, everyone have a wonderful day!"
