1,So tired.my back hurts..same with the feet...waiting outside the back exit to see if i can get a pic w lady gaga
1,USER URL - lovee the outfit
1,"USER Hi there, sweets  I'm doing well - and you?"
0,"saying good bye forever to two of my closest friends, sam and ham"
1,USER looking forward to spending time with you - your trip certainly has expanded since last we spoke  visiting lots of places!
0,"i'm so sick of school, I want to stay off.  I really want to explore daily booth more. Before i jump on another bandwagon x"
1,"USER Oh yeah now you mention it, I had a girl spam/scam call me on Skype. Wonder if they have 886 baiters / 'baters"
0,USER aww  i will keep sending it ;)
1,USER you're so cute ... really..  thanks again keepsafe..
1,USER funny pics -  im curious how the video will be
0,wants to become famous on some kind of social networking site but has no skill  so I guess i'm hopeless. At least I have swimming =]
1,USER your welcome have fun enjoying them
0,"shaq aint nobody watch i'll show you,,he's soft in the middle,,"
0,thinks she should stop having chocolates for few days
1,im just back from shower lol
1,"look for my short story ""fear of fear"" in the next issue of Abursdist Monthly Review"""
1,USER well ain't that a beauty!
0,USER I'm not sure I was very good. Although I did do one move where I was standing on my hands. Evie not jealous enough though
0,up early today. gonna do some running  and some cardio.  get at me twitts.
0,off 2 work in a bit....i hate the rain
1,If your wondering my pic was taking last year on my sisters birthday i like to take weird pics thats why its only my eye LOL
1,USER it's when u post another user's tweet and reply to it or something.
0,trying to find Demi's web cast thing b/c i missed it
1,USER  i love your songs! especially your song.. love story  reply on me! thanks!
0,Haley doesn't love me nemore
0,USER I can imagine  This country is strange sometimes. It can be so progressive yet so backwards.
0,"USER I wouldn't say I am waiting in line for the3GS, but I am waiting for the 3GS to come to Denmark. It is still $112USD per month"
0,The bus gods have vetoed my Chipotle plans.
0,very sad today.......
0,USER you guys didnt call me for the photo shoot  let's do another one!
1,"with ny favorites  last day of school tomorrow, hell yeah"
0,I really don't like doing the appraisal. The format is not user friendly.
1,Office 2010 in 39 days
1,"I am glad I have a lot of friends, but I am even happier that I have close friends."
0,USER deeeeeeeeeeeeeeeeeeeeer ! i am not gonna join anyer trip with you guys  cause i gotta go to singapore on july 4th
1,USER you are bro! May you have more blessings!!!
0,I hardly tweeted today.. don't know why
1,Lexus of north miami that store is a damn mini mall..... Gotta be one of the biggest dealerships in da world.... 09 GS450 Hybrid hmmm..
0,missing Jake!! Failing Chemistry  crap day. Such a very crap day.
0,"is enjoying the thunderstorm...NOT!! no tv, no internet and flickering lights"
1,Just going to put the kiddies to bed.  will be back later
0,"Awww just one more buckle to give out  That makes me sad,,,,"
0,i'd like to know why I never sleep.
1,wow its really sunny   hope its like this for my birthday!
0,just opened my mouth and insert my foot and chewed really hard!    hoping I can make ammends
1,only a few more hours till exams are over... yay!!!  cant wait till midday tomorrow    then its paaaaarrrttttyyyyy time!!  woooo!!!
1,"oh my gosh, i almost forgot to pack my Bible for Disney (ahh!),-  i would have died!!!... ok- it is safely in my carry-on right now"
0,I can't get in touch with Kat.
1,is listenin to everybody knows by john legend
0,USER I like Rock N Roll Jesus. It's a good Album.
1,USER Aww thanks  Good mornin
0,USER just wanted to ride my bike  went in wrong directions because there were no road signs and then the road was broken up and..
0,drizzling rooftops result in hurt legs
1,USER Your wife has great taste in cards!  That's my FAVE!
0,I'm so mad that I can't find my scarf! ARrrrGG!  Goodnight ya'll
0,"OMG! I can't believe Miley lost for ""Breakthrough Star"" on the MTV Awards!!!  -Congrats Ashley!-"
1,USER  yea girl dat was da fuckn dayz..lol everytime i think about dat..girl us that nite at the hotel do u remember that ?
0,I want the new iphone 3G s .. shame i have 3 months left on 3 contract
1,"If anyone else takes me stalking them on Twitter as 'the highest compliment', please send me your username and I will get on it for you."
0,Leaving Monteray to go back to Sacramento  *kickin & screamin'*
0,USER now im upset for ya  why did this maggot own you anyways?
0,Contacted by Makeup Forever to cater an event with 1000 cupcakes!  Love them - shame I must decline. No way I can handle that quantity.
0,"Watching shows like Nigella Feasts makes you terribly hungry. It makes my stomach grumble, and hurt."
1,Amazing Game Tonight! How Bout That Damn Orlando Magic Team?!
1,"It's a beautiful day down at the farm. I get to take care of cats, ducks, chickens,and llamas. Llamas are so cool!"
1,"USER I think i'll have a clear out later,make room for goodens  How's you?"
1,USER  Hey dude I left the guitar mag in work. But tell you what Â£50-60 and you choose for me. I trust your judgement mate
1,USER URL -  I love this pic!!! you look sooo cute 2gether!
1,USER HI you!  Hope you're having a great evening!
0,I am SO tierd of all the neighborhood kids. I need some that are my age and are NOT annnoying!!
1,Spending 3 days in Tel Aviv. Israel is really a cool country
1,"hey y'all.. r u guys bored?? cuz i really am.. so,, umm,, if someones bored, what should they do?? pease give me some tips..."
0,Milo and I are at the emergency vet.
0,"some sun, clouds, rain!... no,again.. some sun, clouds, rain!... again.."
0,cant sleep.......i have so much on my mind right now
0,"USER yo, I'm swamped and I have to shoot a wedding in the morning. I can't go out tonight"
0,whatthedeuce! Im so not in the mood to write reflection papers!
1,"USER ""Just announced: Hadouken! on sale this Friday at 9am!"""
1,USER  Yeah the spammers are discriminating: none of the females  are part of the target group apparently
1,Is relaxing at the pool with my ipod and a good book..
1,USER I say yes! Parking sucks and food is over rated. Order pizza
0,Can people I use to know stop getting fat as fuck? Jeeebus!  I'm an ass.
1,USER you betcha!!!
0,Ughhh. Started cleaning the room 2 hours ago && am so freakin' disgusted with myself. It's so filthy in here!!
0,USER are you going to have to get them removed?
0,They're 12 and gonna be 15.. Where in da world does da time go? My niece too.. She was just a butterball ystrdy n ma nephew 4mos already
1,URL - USER awww you are so sweet thank you
0,"in freeport, no phone service ohh"
0,"Going to hikari san's house. Yay i get to hang out with luca, taiko, and junna    oh wea and my sis"
1,Chillin with USER waiting on the guys.
0,USER - OT4 (he's sharing the bath with cabbages). Shadow on the bottom left only gets soap though
0,Dang! I think I should go and get rady for school.  I have to go extra early coz of the dang traffic plus the heavy rain. >.<
0,english revision
0,USER or 40 shirts in Primark
0,USER No! come join us once more Kaleb dont leave us
1,USER Jamming to what???!!!
1,Can't sleep. Boo this sucks cause my favorite time to sleep is during a storm so I'm up watching twilight. Btw IM UNBLOCKED!!!
1,USER thx man!
1,"Look, I sent a tweet!  This should hold me over for a couple of weeks"
0,"USER awwww no  *hands you a drink, and some Nikes* ;)"
1,i now have every song Heidi Montag has ever released.
1,I'm officially going to bed! Goodnight
1,USER good movie huh  *puts a big smirk on my face hehe
1,USER hahahahahahahz  yea i think that was us lolz
0,Cramps.....yuck..
1,USER I don't chat our stylist up... Poor girl gets enough of me when I sit in the chair every month myself  He just likes me around.
1,USER is one of my idols. I love her
1,a call out to mommies with toddlers! june 27 breastfeeding and beyond with attachment parenting lecture. interested?
1,Star Trek + booze + awesome ppl = an awesome nite! Relaxing poolside 2day till I go out with 2 more amazing people tonight! Great weekend
0,USER Oh  I guess I'll just have to hang out with my non-21 friends!
0,Prayers for all the victims of the DC Metro crash...how tragic.
1,ooh 5 hours to go till the biggg surprisse
0,kill me now- still doing global to much distractions
0,i miss my guitar.
1,afternoon drinking always takes it out of you. time for a cuppa
1,USER awws adorable? who is that?
1,loveliest day in a while!
1,Guess who just posted on Universal Causality? ME!  URL
1,Thanks 4 the love guys! Lol. Im currently getting my brakes fixed. For FREE!  I love bein me! Its fun! Wutcha guys doin
0,this is the first time I am annoyed with ONTD!!
0,sorry for lack of tweets when I was away - phone decided it didn't like texting
0,Air france plane went missing
0,ess now
0,uugh jam segini Manjabal udah tutup???how come?? Pdhl pingin banget tahu goreng & jambal rotinya   URL
1,USER i love your albumm
0,it's too sunny to be in doors painting
1,USER yaay! are you still there?
0,USER wish i could have gone to a party lol
0,n0t feeling well this time..
1,Going through thanking all my new followers
0,"Man, that test was no joke! I guess I was a fool to believe I didn't need to study what was said to be NOT TESTABLE!"
0,USER What? I'm sorry!
1,You are welcomed. Love your quotes! Have a good evening!  USER
0,how a credit crd in my purse get deactivated.... thiz gurl says a phone could have done it.... any one heard of dat b4 let me know
0,I guess your dads more fun than me
0,My Gmail is down again.
0,SF Giants what happened in the 9th tonight.
1,omg yey! we leave 4 vacation in 2 weeks! by this time on the 29th we'll be chillin in the cabin!! yey!!!  *liz <3's u!*
0,Danishes are messy.  But yummiehhh!!
0,fuk my wrist hurts!!!! im out of commission
0,"I'll be leaving the hotel before 8:30 EDT. I'm on way through Erie, PA and onto Niagara Falls. There's a chance of rain and hail, though"
0,Chandler is hot and i feel bad  should I shave him?? Cuz its only gonna get hotter.. what do u tweeples think?
0,"I thought I had glittery powder in my hair because it seemed sparkly. Turns out, it's just grey."
0,"USER Oh, my, god. Are you referring to me? Bad things will happen to you if you are."
0,USER oh haha that sux
1,"USER LOL, me too but even I don't drink wine for breakfast"
1,USER that's a nice tweet!!
1,USER Yes - following that I think
0,I was really looking forward to the milkshake that is at the bottom of my car
1,"For those who came by tonight, Thank you  Good times, good times!"
1,I love sundresses and mexican food
1,USER I'm trying! I will be leaving work this coming Friday at noon (1/2 day). I'll have to take it from there.
1,goodnight babies  beach trip pretty much is going to set the tone for summer
0,about to watch elizabethtown by myself. USER should come over and watch it with me. i miss him
0,USER ur leaving me for a week  i know i dont see u everyday but i like the fact that ur in the same city as me
0,Late (much too late) meal of Thai yellow curry w veg and tofu + Yuengling light lager. Friday night w/out my baby is predictably wild...
1,USER and I are having SO MUCH FUN!
1,time for a tea break
0,Is NOT pregnant
0,NOBODY INFORMED ME THERE WAS A 'ZACK ATTACK'ON COMEDY CENTRAL with nothing but zack galifinakis most of today
1,USER I am thinking about doing the same next week. Hmm...will be my first time. My hair is past my knees and I'm going to donate it!
0,wish I could go to the Taste festival in London! back 3 weeks too late
0,"USER  lucky, its been sooo fricken freezing down here"
0,USER it ran out of space to put your thing int there (thats what she said) I feel sick too.
0,Not feeling well... My tummy hurts
0,TinyTweeter doesn't understand russian letters
0,USER yes I know
1,"USER Lol! what, i'm miles away, i doubt your sting however long its reach, can get to me ... nah, still in Londres"
1,USER oh yeah... we are feeling the 'Forks weather' right now.
1,USER I just noticed someone saying something about getting an iphone app for it. Nice.
0,"my son's cloth diaper leaked last night   In my bed   Hmmm, I wonder why.  #clothdiapers"
1,"Main St life has its ups and downs, but right now we are as high as a kite! Take a walk downtown today"
0,USER I know that would be so sad
1,is gettin ready to have a lovely bath mmm
0,"Holy molly, so many emails to go through"
0,ne comprend absolument RIEN ï¿½ twitter
0,"why is it that everytime i'm going home from work, it starts to rain.."
1,USER Bestest followers for the best Mr Twitter Universe! U deserve it!
0,"URL - i miss him..  i really miss ivan nikko,, haha!"
1,URL - goddd this guy is sooo cute!
1,"USER I'd rather be loving,, but I can't help how I have to be right. It's hard."
1,L is taking over for the rest of the day/night. I'm starting off with a new poll. What's your favorite Immi collab? Mine's Blue October's
1,Studying and being happy. Pretty sure I am in love with my state!
1,"USER You should write a poem about that, you got a good start"
1,Simon Cowell on Craig Ferguson's show now. They are hilarious together.  #fb
1,"Mcfly came on Tmf 3 times. All About You, Obviously & 5 Colour's In Her Hair. i'm soo happy and busted came on like 5 times"
1,USER ok i was just about to shower and watch The Hours. let's do the hours so we can spazz later
1,USER LOL (: well you got them so ur taking me to work tomorrow  hehe. awwee i cant wait for you to pick me up. come earlier.
0,Monday  sigh...
1,went to borders to get some wedding magazines and a book about where we're going for the honeymoon. yay
1,i love that this is in my head before i fall asleep  URL post midnight cheese
0,deadlines looming. i think it's going to be an all-nighter
1,USER ready
0,supposed to go memorial/assembly shopping but plans are getting delayed!!
1,"USER yes, u definitely have earned it!!"
1,You got a game that you like but you don't know if your computer can run it? Go here  -> URL
0,My weekend off has been cancelled by work.  I knew it was to good to be true.
1,"USER No pics, am on old computer and no camera software installed. Check out USER Group on Rav for spoilers"
1,Tweeting from my phone just for the heck of it
0,You know you've priced your stuff too low on eBay when all of it sells within 2 hours
1,Last saturdays event went really well. im going to do another one. As lots of people has asked!!
0,And Byron Bay area. www.allnaturalexpo.com BOOHOO. None in the Sydney area
0,USER your sadder than me. I'm on sofa. on friday night. on twitter
0,"Playing music, stoned..with a very bad cold"
0,USER i wish you'd call ME
0,"USER i get no rain  it cant rain here, then the beautiful sidewalk graffiti will be gone. i was expecting that to last all summer"
1,USER yeah the merlot of that was right across. but i got the last syrah of it
0,USER I hid all the knives.... but I forgot the spoons.
1,Still enjoying fab sun here....! Its great not having to work today
0,"USER aww boo.  I like you, please remember to re-follow!"
0,work in just under 3 hrs arg
1,USER A visit to AXIOO's office would solve that problem..
1,Just waiting for USER to fire up the BBQ  Cold beer in hand!
0,conflict of interest..... fuck off
1,... on the road again - my rear view mirror at 100 mph... this is Germany  URL
1,USER Grateful for this new day that I have never seen before... ready to go....
0,jelly is jerk.  and is jealous cuz i'm smart.
0,Ft greene is effing cute like I don't ever want to go back to my ghetto part of town
1,twitter on my phone? Whatever next?!
0,USER grace's dad died  it was so sad
0,"Aww, bit of a disappointment. was goin to watch a film but cant no more."
1,URL - I don't remember who made this but I love it so much I have to post it and share
0,is sick..had to go to work even tho i sounded like a man
0,"My stomach is grumbling.  Im soooo hungry, I havent eaten anything all day"
1,"Spent the day in bed passed out on back pain meds. Feeling a bit better tonight...  Well-rested, anyway."
0,my life suck too USER
1,USER me .. But then again I'm on east coast time. 7:56 am
0,"USER haha...that makes me laugh.  how much do you think...awe shit, I miss you"
1,"learning hella sick songs on tha guitar from catherinem, alesana, ateyu, as i lay dying . . list goes on and on.   night twits !!"
0,i lost my livelavelive braclet  i wear it everyday fml
0,USER I can't believe I was sick during free comic book day.
1,"USER yeah, sure! send them"
0,doing something really boring. WAIT y am i doing it. OH YEAH coz i HAVE to
0,USER 8th
1,"Just played Fuzzball, now searching for Hamthrax  URL"
1,"USER got it. it's fucking great! I <3 Let's Be Mates, and the title track is a really beautiful ballad"
0,Noon in th NL and i'm still in bed. Guess it's safe to say  I'm not going to work today... I feel  blah
1,Done with TEIT Semester -2 examz....Software Engg. was bad.. rest were quite bearable
0,Just wake up. I'm ill.  xx
0,"Restoring data into my new iPhone - No, I couldn't work my way into a 3Gs"
1,USER omg! No offense nirwaben  lol law ethics and communication was weird today. They questioned plenty of unquestionables.
0,big problem... i'm barely scheduled to work w/ my favorites this season. WHY DO I ONLY HAVE ONE DAY WITH TIFF?!   guhhhh
0,USER Like the new Flickr pics. I have to wait until next month to play!
0,Low key i miss my boo..but I'm not talkn to him cuz I hate to be ignored
1,God I feel so tired  age kicking in? :p it's just 23:44...
0,USER Lestat... From the Anne Rice books and Queen of the Damned w/ Aaliyah R.I.P.
1,USER Look at you twittering away about sports. Imagine that
0,Is in science class.  FML!
1,"Sometimes it is better to just drop ..instead of doing the usual ""copy, paste and  then crop!"""
1,going to make the most of the sun today!
0,Oh man the right side of my face is proper swollen I need a doctor!! I am NOT going out tonight
0,"USER Arse. I want to try and sleep again, I don't get much chance to sleep in these days"
1,USER Copywriter for huge Manchester firm
0,Prodigiy and The Crystal Method tomorrow for USC Birthday party and I have to work  first time I miss the Crystal Method. SAD!
0,i want my money
0,USER I miss you to
1,USER thats a great song.
0,USER My friends are TOTALLY picking on Dora!!! *crying*  the beginning song is different than before.  I was sad
0,Goodmorning! Great day yesterday. Homework day
1,i met Jimmy Fallon today [at exit the king]  and hes soooo nice
0,USER take it... i ate too much
1,USER come to South Africa
0,"30 more minutes of my life! Wait, wtf. What am I doing after this??"
1,I realized i had too much coffee i can't sleep haha. Got home in 3 minutes. no traffic so what to do???  Ugly Betty it is!
0,How does it feel to repatriate your lover back to her home country??  tough one
1,USER that was 16 year old Georgie.
1,well starting to feel back to normal  well normal as i can be.
0,Ur so mean shelby  imma cry now
1,"Now comes the fun part  Because you can find only a few offers per country or you live outside US, your changes can be quite tiny."
1,going to a p-a-r-t-y! yay!
1,For those asking how to send it to me send it to sxephilUSER.com  thanks guys   Heading out for dinner and a movie with Linz
1,"watchin ""best week ever"" THIS is the way to watch reality tv"
1,"Making bread tonight, need to heat the house & keep forgetting to food shop  This should keep me going for  a while"
1,"USER I'm about to run out the door. But I wanted to say hi to you, Megan! Hope all is well!!  Noeleen"
0,"went out tonight but learned the saying ""beer before liquor, never sicker"" is not just a saying"
1,"USER easy on your purpose, you may need it some day!"
0,is not looking forward to another night of revision
0,USER morning you..I dont see you on here as much anymore...
1,gud mownin  URL
0,USER missing?  i hope you find him soon!
0,and our second flight is canceled.
1,SUNSHINE YAY  URL
0,USER jus really like her and it sux 2 b so far away
0,i feel like crying!  damn damn damn!
0,"So depressed. Taught writing class tonight. Fell totally flat. No class interaction, tripped over my tongue. Never experienced that B4"
0,"USER AM seeing a brilliant chiropractor, he works wonders. Surgury? Last thing on my mind, but thinking about it more as i hurt"
0,"USER I'm sick the next day without fail, no matter how much or what I drink. If I got to bed, even feeling tipsy i'll puke"
0,"poor bear (my gsd) is staying at the vets this   thanks for all of your kind comments, everything crossed x"
1,haha Gosh! I'm having such a lovely time!  Vacations are great!
0,USER I risked it on the interwebz ended up paying 160 for 2
1,USER dont get annoyed by it!! embrace it!! its so much fun once you figure out how everything works
0,USER What's wrong?
1,"USER My sentiments exactly. Windows is ""back from the dead"" with 7, but OS X is still the preferred OS of choice."
0,"do we have homework USER? we gotta pay for booking, credit card involved. i dont have a credit card"
0,So my mums phoneline is bust. Boo
0,USER damn!  I haven't even grubbed on some suopper yet.  Too lazy and I don't do fast food anymore.
0,i'd pay money to not have to be at work right now. still feeling like poo and wishing i was home in bed.
1,Love being @ the movies when no one is here!!!!  moving getting started gotta go...
1,USER I didn't know that
0,USER I don't have one  I keep meaning to get one but at the moment I need to move house first
1,USER I prefer a little more sugar a little more spice! *wink* What can I say hippie at heart.
0,"Oh, how I hate being home. Where's my manbear?"
0,i don't want to be quarantine  i don't wanna miss school :|
0,OMG Allergies!! Staying at home doing laundry. I wanna kiss Leoooo but I can't
1,USER Right?  I think the 100 deg heat kind of kills it tho
1,is looking forward to gettin the sims 3 wooooopp   (i'm such a nerd)
0,The BIA is populated by idiots and mental deficients
1,USER only subconsciously GO #redwings
0,went to  Netto's highlight of my day so far  here's hoping it gets a little more interesting/exciting....
1,USER Have a great night
1,USER Oh Fine! You mustn't be scared
0,2nd race 2nd place again. Eliminated from heats
1,getting ready for what is going to be a long day
1,USER Are you okay Jodie? Love that acoustic version by the way!
0,SB is very pissy today
1,USER - ahhh is it really you guys  jess and ashleigh xx
1,i want to write my new story in less than 3 days.... hope i'm rly going to do that
0,USER Still pretty insanely pissed about the nuggets getting their ass handed to them last night
0,"USER the same ""attempting"" to study lol. i need some food  lol"
1,USER Good for you Miley! You deserve a nice day every once and a while.
1,USER USER
1,"USER  like binge drink, like everyone else my age does :S i just  life to drink an occasional glass  hmm let me think"
0,USER *sigh* you are right Nikki  Thank u for having uploaded it to ur account so many times x
1,USER have you tried turning it up to 11?
1,Had a blast with USER last night.  Fashion show = free liquor  And Vinyls = awesome dance party  Great night!
0,I hate the weather in Taipei. It always makes me SICK.
1,"USER, Present and accounted for"
0,wants some of the emonade at Jamaican resturant  but they were closed today...  No fair so ready to get back home and make some $$$
1,"USER:  (USER  and USER) JoJos, limo, Dominics and then a nightcap on the yacht? Sounds fancy, but ...not so much"
0,USER Have you tried restarting everything
1,USER On an iPhone you mean?
0,Wow...I seriously don't know what to say.
0,"'I may say it was your fault, cause I know you could have done more' ouvindo The Kooks, ja que nÃ£o fui no show"
1,USER USER USER well fuk playing nice and letting myself be treated like crap ALL THE TIME...moving on
0,Been sick today  eughh Avoiding revision for tomorrows dreaded GCSE exams!!
1,USER Nps  Hope you had a good one!
1,"Not much sleep last night, thinking about new tunes and watching King of the Hill. Coffee to go, please!"
1,going out to sunbath
1,I love quotes . . . . they make me feel so positive
0,Lost the debate
1,USER Please please please book them!  They are amazing!
0,USER FINE I JUS WON'T LIKE THE SONG DEN  ...ALL BEKUZ OF USER
1,Chillen at the tollensstraat
0,I'm beyond exhausted and not ready for the day.  And it's going to be sooooo long!!!!
0,"Slept with the fan on high, tryna cool off my hot ass apartment, my face hurts now"
0,USER No it really isn't the same  but the people who went to sherwood forest tonight must be proper  because the time has
1,Feels good & productive to work europe hours... quiet & peaceful at night
0,USER awwww.. i was looking forward to seeing you and the other dancers here in the phili
1,Nicole- YOU JUST LIKE ME FOR MY ADAMS APPLE
1,i just got out of the shower. i'm all clean!
1,just done shoppine w/ my loveliest momma!  now back to my computer
1,my black is beautiful
0,USER MILEY YOU'RE NOT COMING TO PHILLY/ATLANTIC CITY?!?!?!!? NOOOOOOOO Newark is too far for us south jersey-ans. i'm soo upset
1,Still at the Relay for Life. Free Starbucks coffee!  (via USER)
1,USER Yeah waaaaaaay over 75 General! LMAO   Chef BoyR P
1,Cleaning my room and listening to britney.
0,6:37- no fish yet...
1,can someone please explain to me why I have Steve Winwood stuck in my head? cruel and unusual!
1,Contemplating getting Sacred 2 next week - so I can play with my other half....on my Xbox 360 that is
1,USER Omg do it! That's so cool
1,"my personal version: I will follow you 'till you love me -kiss me, hug me, have sex with me- paparazzi  ? URL"
0,Do you ever get those days where you wake up in a bad mood? That is me today
0,USER little Josiah. Ryan was like that when he was sick recently. You wish you could do something.  ?
1,bout to be heading home soon
