0,oops look like i overspend dis month  no surprise though
0,why wont the sun come out???
0,USER sad you cant join me either babe  i miss you man!
1,Finally bought a decent digital portable tv- hurray for Technika
1,Non-trivial muscle soreness from today's hike. Time for bed & books...
0,Ahh job interview at criterion today! I hope I get it!!!!.
1,"Yeah, computers about to die, so im gonna go plug it in and do something else. Hanging out with Keaton tomorrow? I hope"
1,"USER your juliecentric updates are adorable USER i lost motivation about an 2hrs ago sigh, but tomorrow is another day!"
0,USER wtf? where r u going & y wasn't i invited?!
1,USER URL - haha loved much
0,Fuck! This is so not what I needed this morning
1,Ironing whilst watching Atonement and drinking cider - life isn't so bad
1,watching soccer
0,USER damn and i couldnt make it  going to a after party?
0,..where did the weekend go
1,USER Im reading those too!  How was the Sorceress?? I have it on my dwnload list with Audible-can't fig out how 2 put on blkbry?
0,"Wasn't jealousy that caused it,was the first time in 35 years I have loved someone  USER: ""Not a good use ... â« URL"
1,I am hoping K has a wonderful last week at school!!!
0,USER I am lost. Please help me find a good home.
0,URL I miss my puppy in Thailand
1,"is laying on the beach with sam, steve, vi, daryl, hannah, & ariel"
0,USER But our Supt won't let us bring laptops to admin meetings anymore  (Talking about when time moves VERY slowly...)
1,USER well that's one more contribution than you've made  burnnnnn
1,USER Ah I didn't see this until just now! Thanks  #ohnotheydidnt
0,USER sorry your back still hurts  is there anything you can take for it?
1,USER hey girl. hope da kids are doing better!!!! don't 4get to tweet every once n again.
0,"Hey, Starbucks... I'd like to drink my chai tea next time instead of wearing it. Please don't serve my drink in a faulty cup."
0,"USER .....yep i can see it...but i have no clue how to use twitter, sorry"
0,USER It's honestly badass wish i had more money
1,"USER omg, i love that song!! My fave song right now is one and the same  i just uploaded a new pic =D"
0,USER lol k when i can be bothered. that guy i thought i blocked is talking to me again on myspace IM
1,USER  Well of course...Anything for my big sis..Love you too!
1,"The results of my own quiz: I'm one part Herb, One Part Les Five Parts Johnny Fever... and two part Venus from the waist down."
1,Bom diaa!  Dormi bem essa noite. e dormi muito! good for a start of 'the hell-week'!
1,watched some amazing graphic car designers on tv. dad's going to buy me an airbrush kit
0,"USER Nope I've never had red velvet before! I should try it before I die, right? ! I end on the 30th and start on the 1st!"
1,One English GCSE exam down one more too go
0,Something bit me on the hand and it itches like crazy
1,USER so where is the point ? increasing your efforts till work reaches free time again ?
0,Just changed over from windows to a n iMac n none of my old software works oops picked the wrong time to do my web maintenance n trouble
1,USER STAR TREK.  SEE IT.
1,"USER no, I'm driving. He's helping me flower shop"
0,USER U havent texted me yet!
1,USER I'm way ahead of you
0,"Thanks for nothing FCC. W/O perfect signal, digital gives you nothing. I have/had 2 TV's that weren't perfect but now they're worthless"
1,"USER nope, i couldn't ask that via twitter.. maybe in a DM. but you dont follow me so i cant DM you.."
1,is obsessed with this new B&B scent. Heaven in a bottle. It's called True Blue Naked
0,USER I'm afraid my theatre exile will go on forever.
0,Just left the house didn't expect this kind of entertainment!!! Hope it ends safely!!!
0,Super depressed..failed a mid term already..bellyache..crammin for another mid term
0,In other news: I want to register for this Artslam thing but I'm too afraid.  I'll just do it independently I suppose.
0,"USER FF and Chrome are meant to produce the same looking design, not different  That is IE's job"
1,USER good job man! just 19 years late to the table ;)you have 2 sequels to go now
1,USER I have not an artistic bone in my body - but i really like that logo!  prob b/s i LOVE symmetry!
1,Freaking out. Just jumped out of bed because Fandango called to let me know Harry Potter tickets are out. I'm going to cry w happiness
0,"USER yeah, my mom is allergic to most fruits. She always gets a swollen tummy too"
0,Hello hang over  no i dont think we can be friends
1,#BBXXX USER U shoulda spent less time sucking up 2 USER. Speaking of which when did Rob add the XXX? Me no likey. 2 porno.
1,USER Yo! I haven't seen you in a while! Lets all hang out sooon
1,USER oh it is
0,USER I know no more suicide stick men and 3D square shapes
0,I'm soo tired wish i was laying in my yard and not sitting in class
1,Can't wait to to check out the #interiordesign here this weekend....and the food  URL
1,USER prettttttty gooooooooooooooood  youz
0,"USER ou seja, Skype com a Nani = sono."
1,just  watched  the movie miss poter   its  a  nice  movie
1,Picked up a netbook for the kids. It's a pretty cool machine. More powerful than the one I used when I started at Thetus.
1,"USER Yup, nothing but real talk!"
1,I'm enjoying some southern hospitality with my host Poppa Falcon in lovely Columbus Ga.
1,"USER Oh, so you're not looking for someone to telecommute?"
0,"I can't BELIEVE how many work emails I am getting despite being on leave.  I'M NOT GETTING PAID, people.   #fb"
1,Needs Help Confused lol
0,Trying to manipulate some data directly in the db for #sugarcrm for a client  Not happy Jan...
1,Wow rachel maddow is starting to wear more and more makeup
0,Announced just now that Farrah Fawcett has died..
1,USER where you taking me then?!
0,whaaaaat i lost a damn follower.
1,"a lovely day filled with swimming, jet skiing, and tubing  yay!"
1,USER Will you make my night and say goodnight to me???  I love you!!!
1,"USER lols, it's 'coz i'm unique like that"
0,Great! - First it took ages to download the 3.0 update and now the activation server is down  #iphone update
0,well...they had a swim team practice so we had to leave early  Going to K & W (I feel like an old person lol) with mom in a bit.
1,"Always extra busy around here when a trade show is coming up  Look for us at the Summer Fancy Food Show, June 28-30, booth #2580"
1,"Gonna eat some Popeye's Chicken!  USER Jay, stop copying me."
1,USER thank you so much  Im glad you apreciate my artwork!
0,"USER you are so right! No one on that show is a Joe Flanagan!!!! Don't think I'll be tuning in, not my cup o' tea"
1,Chicken rice for lunch  Oops I'm so full.
1,I should have the N86 in my hands come this Saturday. Now that would be something
1,"Sooooo so tired from the gym... tomorrow class, fast& furious then gym"
1,"sorry i didnt tweet i have sore eyes so i need to rest, but i have 1 hour to use the comp"
1,"USER  well if you really wanna watch it, you would lie ) i watched with sila din and gelo btw"
1,"Just landed @ Ohare, vacay has begun"
1,USER thats wat i thot...but bahala na cla ui.
0,Q: Are the crayons only in CS4? I only get color squares in CS3  #creativetechs
0,"not happy with the hair dresser, she balded me"
1,"USER ooh, i'm jealous! I wish I couldve gone to the maker fair too! Learn welding! Make a eyore statue that spits sparks!"
0,My cable and internet were shut off in the apartment today as scheduled and I'm still here.
1,USER dude can u get u get ur wireless dongle? if u dnt hv one can u ask sum1 to? thnx
0,so sad about the Dallas Cowboys-
1,i lyk miley.. shes so talented..
0,"Starcom this morning, laundry and relaxing later... It's so nice outside! Why did I choose to go into work today"
1,nappingg in the sun with shmarr emma jamie & max
0,Saw a kitty on the way home and attempted to rescue it... And failed.  it ran away.
1,Watching CSI. The episode guest starring Taylor Swift.
1,"even if we have to be outside. oh and btw; my x bf is apparently is not invited! i don't know why, i think it would be cool to hang out"
0,"USER ahh boys, would sooo love to be at emirates right now  hope all goes well!! see u soon <3 xx"
0,USER Do you have a suggestion for something I can drink so My semen doesn't tast so sour - My wife won't swallow anymore
0,USER shut up laura! lmao you killed the romance
1,USER USER thanks!  would u guys be keen on being contributing writers?
0,Just remembered it's late night at work.... I don't finish till 7pm
1,USER Welcome
0,USER I love collecting fonts - it's just a pain everytime I reinstall Windows.
0,USER absolutely nothing! i'm so bored!  what are you doing?
0,USER being updated to have multiple 'skins' for different GT members. Nightmare. 82k of CSS to hack!  No time to redo; woe is me.
1,O Monday...here we go
1,perfect ending to a really good week
0,USER awww. being sick does suck!  Darwin said you and him should throw a pity party  URL
1,USER I don't even iron my work shirts  Couldn't imagine ironing all my stuff!!
0,USER you have every right to be hurt and angry! I think you should say something to her and let her know how unprofessional that was!
1,USER oops thats keep it up
0,I'm not signing up for early shows anymore. I'm not awake enough to be quickwitted enough to make sales at 7:30am.  blah! Sleep?
0,I dont think we have any cookies  Oh well Ill settle for a muslie bar
0,"just found out that we're gonna have vacation in bulgaria and in greece,,how cool is that,,but i have to wait til 16th august"
0,"Just got home..haven't seen my bunnies in a month, and my baby bunny dies in my arms. My car died this morning, my bunny died tonight wow"
1,Just got USER added as my default search engine in IE8.  Or should I say decision engine?   Try it out!  URL
1,USER it will happen. One day you'll randomly catch me chillin USER's casa  that'd be so radical hahaha
0,"USER Toy story 3 looks like its gonna be awesome, shame we have to wait til next june  <3"
1,"Im totally gunna change my name to Amaya. it's japanses name  it means "" night rain""  any thoughts, anyone?"
1,USER haha. yeah i didnt even notice until like now. thanks! haha. anyways im excited now  text you later
0,What a shitty night! Matt has pissed me off again and hurt my feelings on purpose  Im tired of having a heart. I wanna remove it
0,Missed rehersal  i hate it when you cant breath from your nose!!!!! FML
0,USER Nope
0,History final   i'm scared.
1,Fucking Vegas... Can't wait to leave this city...   P.S. Did I mention I was born in Russia
1,USER You obviously have a more trusting naturing than us!
0,vacation just ended
0,thunderstorm=no bike ride.
1,USER lol good point. It was pretty great
1,USER i knew you would!
0,anyone got o2 mobile broadband for la Mac? can't get the bloody thing to work on mine.
0,Damn yall... Ima be 26 nxt wk. I am old as hell!
1,"bed, up early to read my world art book, class 12 to 6 at FIDM then off to Apple"
0,is missing the welsh coast today
0,NXNE is almost over!  Staff party tonight should be kick ass!
1,Cannot wait until tomorrow! SJTC with the bestie   I deserve a good day
1,"USER Actually, I had a blog even before that, in 2003. Yes, I fell in love with blogging almost as soon as it was invented."
0,"USER ""room"" in that last sentence means ""cupo"" [ sorry, couldn't find other way to explain it but by translating  ]"
0,I was going to go see Seventeen Again with my sister and her friend and now we might not...
1,is so thankful that nothing is wrong. PTL!
1,USER So far blessed and feeling good. Vegas is the place! Have fun if you go!
0,"Awake by 8am whilst Georgia still sleeps. Not happy, I want to still be asleep"
1,"hahaha by the time u see this, u'd have watched drag me to hell."
0,"going to dentist now, getting a filling arghhhh  be back sooon x"
0,"USER: I do!! I love flying.. unless the TV monitor in front of me is broken, which happened on my last long haul flight"
0,USER i want to comment but don't understand what you're saying
0,USER i only get that when i'm around alot of people. it sucks.
1,It's raining hard!
0,going to bed
0,"pain pain painy pain pain pain, PAAAAINY PAIN PAIN pain paaaain. okay i'll stop singing now,"
1,USER *shrugs* no clue. . .all I can speak too is what I observe.
0,Boooo shots required for college
0,"USER URL -  i was almost sick, had an excruciating headache and then went to another party. Doubtless USER ..."
1,Watching the ramen girl.
1,come over to city hall and buy a root beer float! its for a good cause!
1,is going to watch 'the wedding'.............Now.  haha. brb
1,USER Hi  Sorry for the late reply xD What's your dA name?
0,Photo: taylor182: iâm so jealous  I have a whole bundle of them. Your free to help yourself to any flavor... URL
0,"Just got done feeding the dogs, my sister took her pitbull  I miss him"
0,Didnt get good sleep last nite and Im feeling it this morning
1,USER he's soooooo cute. *hugs*
1,have a new fave song: Lady GaGa feat. Akon & Kardinal Offishall - Just Dance   makes me hit the repeat button LOL it's totally awesome!
0,Not a bloody number! Is it asking to much to win a few million quid.
1,USER I have my phone for that!  sorry your feeling restless...hope you get to sleep soon.
1,Any more guesses on the Vanity pages? URL 200th fan also gets USER T-Shirt. 10 minutes left
1,USER  Excellent.....It said I will live until I'm 91.4 !!  I think its due to my low blood pressure and lack of children
0,homework madness time!
1,USER lol maybe
0,USER it was the back door! And that wasn't me!
1,USER Hey girl! Been meaning to call you since last week. Everything ok w/u?  I'm just chuggin along!
0,Looks like the season is over for my mavs.  next year! Mffl
0,buu  i've almost reached the 1000 updates and i dont know what to say or do ...
0,"USER hurumf, why do i see happy weekend"
1,"Have a plan going to janet's gaga birthday party tonight at lollita, kemang. Yeay! Happy birthday my janette"
0,back to work  but at least i've finding out interesting info and motivated since i know i don't have to be here much longer ha
0,dads in the hosp. can't sleep.i hate fibro & PTC. they have both pwn me 2nite. I hurt   all i can think about is makeup shoppin.im shallow
0,USER And now I'm jealous
0,"Argh, is USER mad at me?"
0,USER do you need me to check the FTP? I'm sorry I'm not more on the ball with that lately
0,Is at a boring wedding  yaye for me
0,USER that's really sad.    thanks for the info though.
1,"USER Trick is to speak English, not Albertan"
0,"USER and it does still lose the ""in reply to"" link too"
0,im stiil hearin Don't Forget
1,I saw the bunny family today that's living in our yard
1,USER cool i get to go to the Darien Lake show the day after
1,"USER 3 nightbusses in one week.... one of them yesterday, did the trick I believe"
1,thought USER blog tv was gooooood. Tar for playing youmeatsix haha!
0,"KCT, QUERO FIC NOW"
0,USER really? sad news  oh my favorite desserts :..(
1,USER Wow! *faints*
0,USER they passed prop 8 again
0,is starting his ridiculously intensive revision of Russian history
0,"Oh, Tupac  ...Happy 38th Birthday"
0,So that tooth pain is now worse and I can barely swallow without excruciating pain. The right half of my mouth just hurts alot.  #FB
1,USER i want to get that hippogryph and some new pets
1,USER yes going to my dad this afternoon to celebrate his birthday
1,USER ah i see i see  this is fab
0,"USER I decided to stay at home, too. Still sick. And I really hate 8 am classes."
0,Happy Fathers day to all dads out there I dont got a dad any morhe tomoorow it be 4 months since he died from lung cancer miss you dad
1,Here's how you can help w/Project Souarna: URL thanks to all who's been asking how to donate. YOU're awesome
0,Gosh. Why does 'Titanic' make me cry everytime I watch it
1,"I'm gonna study later! I think so... I always say I wanna study but in the end, I end up playing facebook!!! ilyMiley!"
1,Back from the quick journey to the shops - now with chicken
0,"I bought my dog a nylabone, and she's literally eating it"
0,Waiting for Jay Leno to start. Tomorrow night's his last show
0,USER Good luck! Have a great evening. Sorry I couldn't make it.
1,Taking a break with more tea and some honey on toast. Support the bees!
1,Brooke is here nowwww and Aunt Sandy.
1,USER thanks for approving my twitter request!
0,stupid shit...i hate my retard hands i cant even type without my pinky  you make me fell bad too. sorry
0,I'm so damn hungry!! FEEEED ME SEYMOUR! URL  seriously..
1,satuuuuurday night
0,gah. i miss ALL of my friends!!!! and i miss him soo dearly
1,You the fucking best! Ohhhhh Drake u know it.
0,My stomach hurts
0,USER i have a maths exam too  but i dont get study leave typical!!
0,USER oh man right?? I had no idea what I was signing up for when I saw that movie. So sad.
0,Damn Larry king is crying
1,back from tuition
1,USER everything in moderation
0,Twitter is not sending any tweets to my phone.  wtf.
0,USER O bug  I have no idea what to say. At least you arenï¿½t GAINING on diet!
1,USER hey sexy
0,tired still .. hate bad dreams that wake you up in the middle of the night  .. work 12-5 .
1,Creating assets for Flash whilst eating a packet of discos... there are far fewer discos in a packet than I remember!? Back to vector...
1,"USER good night too, have a nice dream"
1,"Thanks, USER, for the writeup about my garden on Apartment Therapy re-nest.   URL And nice to see you here."
0,awww anyone remember that show higher ground  I LOVED IT im tryin to find it on dvd if ne one knows are i can let me know please
1,I hate it when my hosting service analytics go dark. No report since Saturday. Hope someone is listening in June...I can't tell.
1,USER why the count of Tuscany ?
1,USER its great to get paid to chill
0,Aw man I've actual made myself sick by being hooked on nasal spray  my nose and throat are fucked
0,USER i forgot all about that song
0,"USER Hey Tim, I haven't heard from you in a minute! How are you and the girls? Last we talked Audrey was sick"
0,just ate a massive curry laksa....doubt it will be as nice coming out as it did going in..
0,I raped my own face last night because I didn't shave. Ow. Redness  How the other guy remained unscathed is a mystery.
1,YAAAY! the Atlanta Friends Meeting (Quakers) has started a meditation on Tuesday evenings! I can participate without getting up at 8am!!!
0,"At work, and not even get paid for it!"
1,Watch: URL  I can't wait for Joongie's new mv
0,USER Good Luck TT.. Mad i havent been able to watch you when u go on live these few times laptop is  trippin  Luv u hun
1,"USER Haha, I'll try to get up later at 3am to catch it"
1,"USER I'm thinking of early retirement on an island in the Caribbean!  Aaah, if only..."
0,where'd you go?! lol
0,damn my computer just shut down
1,USER Yay!
0,"USER Bleurgh, I gave her the benefit of the doubt for so long"
0,Am gearing up for a 0-day weekend.
1,State testing no phones allowed T
1,DAMN IT! okey maybe i like the album but there's a few songs i don't like at all.
1,Finished my oral. It's not bad actually
1,AHH so excited for New Moon
0,I feel so tired
1,USER I plan on going.
1,USER USER I know..that's why the tweet
0,"USER No, it was only one day. What is wca? From Ceres? I haven't seen any of the old Ceres crew at any meets"
1,"first day of work, all hail!"
1,Is going out. Because motivation has been lost...no use in trying when you don't want to!
1,USER You could learn something useful instead!
0,I'm going to work
1,"USER yesss, it's cool, my favorite tune in 2003. Interestingly. Waiting for your remix..."
1,"USER congrats on having a daughter!  buying girl clothes and girl toys is super fun, speaking as an aunt of two nieces"
1,I liked the TIME piece on Twitter. It would be interesting to see what the magazine will say a year from now
0,thats weird i'm in wisconsin and suddenly all the chi town peeps are in colorado  sorry im missin them
1,YES talent show today!  -aaron
1,jessica alba is so gorgeous in that new revlon mascara commercial
0,Over 50% of global fishing stocks are fully exploited URL & fish farms pose potential mad cow risk  URL
0,OMG!!!  the sun's out today!!!  Unfortunately it will only make an appearance today.  Back to rain tomorrow and for the weekend.
1,we're playing with aMazuino URL simple but frustrating game
1,Is wedding crashing
1,*Uses CURA on USER* *Gives COFFEE to USER* *Uses DETACHMENT on USER* *Gives ETHER to Self* Yeah. I'm that dorky. Deal.
0,The coach purse that I would have killed someone for isn't here anymore! Complete downer.
0,craving something sweet... I'm thinking Oreos. No milk though
1,i â¥ masquerade by ashley tisdale this is a great song
0,"It's nice and sunny outside; I hate it :| Come back, clouds"
1,USER if you take backstreet boya and put them in silk mc hammer pants with sgt peppers/beatles coats and lame music then you have SMAP
0,it's so hot outside. Ice cream time! What's the catch? the bees are annoying
0,tRyiN tO sLeEp But sOmetHiNgS MiSSiNg
0,USER: o my girlie sounds so good with this hellish heat
1,"Alrighty, chopped up and prepared the ingredients for dinner tonight. Did all the housework today, and preparing dinner later."
0,"USER I noticed....too bad  O well, I can't say I can dispute that list too much"
1,"New song from USER plus ep release date, tour dates, and a video update! So exciting  where's WI like you promised USER ..."
1,USER  it's ready next week!!
1,USER yep... U got it ...
0,"USER awn  of course i'll pray for you, my queen! i'm sure your voice will be better tomorrow! <3"
0,playin hooky and chillin with Lauren before she heads to Washington....booo my bestie is grownig up!
0,"USER awww, im so sorry hun  im sure she didn't do it on purpose though, she seems so sweet! Maybe it was a 24 hour thing? :s"
1,USER Hooray!
1,USER It's a Jap dish. It's a porkchop cooked in egg on top of a bowl of rice. Yum.
0,USER i wont be there  im doing the shirts on the 27th
1,USER Alhamdulillah I know mine but it would be good for USER
1,USER I'll give it a go later.  xx
0,"i need to b a little more friendly.  I dont really know anyone in NY, or its surrounding areas."
0,USER ooh yall went to vegas  im really sad i coulda left school lol
0,Rockets lost.   We will be back next year!!
1,USER Jonathan Ansell now on Twitter  URL
1,USER oh right cool.  good luck in exam
1,USER Thanks for the recommendation  ^J
0,oh dear. last day of te holidays  back to school tomorrow. yay?
1,USER Shhhhhhhhhhhh Don't spoil it for all those catholics
1,Its warm today!!! Prob rain tomorrow!! hehe
0,USER where have you been?!!!
0,USER really?! whoa! i love the spiral staircase. hey did u get my facebook message???
1,"USER If you want the same app on Linux, go with LAMP."
0,USER I pay $75! But I'm in Venezuela HAHA!  I want to see Quest&Beat    I
0,aagh campus Peets closed during summer sessions! I forgot
0,Pick the wrong time to head to jersey  extra exxtrra traffic!! But I'm using my time wisely working out my vocals nd thinkin of a new song
0,USER  ! Feel better. because I say so.
1,"hairdresser by me was closed today, so i guess i'll have it cut tomorrow"
0,i got two more pairs of knee socks from Wetseal for $1 each...i think im addicted..i wish i had thought to get USER a pair!
1,USER Wow..  Thats so Early. Here its 8.50 in the PM lol. You in USA ?
1,USER you are such a cutie and it's great to see you do such good things
0,USER Am I the only one your pics wont work for? It wont log your pics...
0,"I want to order all of USER's sheet music books, they look so amazing but so expensive!"
0,so tired. aaaaaaaaahhhhhhhhhhhh
0,USER I heard it rocks ?! Tried to go myself but it was sold out
0,"USER Oh that sucks, I hate getting berries that are sour   The ones I got were the organic ones on sale, I think for $2.99"
0,I want my laptop...NOW!!!!  dammittt
1,Looking forward to Ben's first soccer game tomorrow
1,watching the hills
1,Am enjoying a pint and a paper in the pub
1,USER The challenge starts when you go back to express
0,think more than doing. swt!
1,USER :thumbup: Here too. It'll be even better around the end of August.
1,"Hy all, have a good day"
0,mourning 4 my kittens...
0,Tomorrow's show guest may be MIA...and we were planning champagne and everything for our 1 year anniv.
1,"Just Found Details About McFly's New Album, 'Take Off' Can't Wait for the Up Close Tour, 14 Days Till Wolves [LL] So Excited"
0,"USER ach noo way, thats unfair"
1,USER don't let me stop you! I'll vicariously enjoy the toasties from here
1,USER it's driving me insane!  all i want is a lie in!!!
0,I want to go to the bookstore~
1,URL  URL updated.  Come on ovah! ;)
0,USER hey lovely!! hows you?not on long just bout to head off.got stuff to do  .our suns away today   xxx
1,USER i think that's the point  #facupfinal
0,i wanna be in greecee / creteee right now
0,Weather is 100% suitable enough to move from jeans to combat pants. Will still b wearing long sleeves in public though. Yes. Body issues
0,was mad USER last night!
1,LOVE TO TWITTER ... YEAH ... I LOVE TO TWITTER !!!
1,"USER I am well thank you, your good self?"
1,Watching Oprah that I had taped from earlier! It's was about Twitter today!
1,the first rule of baby fight club is dont talk about baby fight club...bahahahaha...GNW
1,USER And isn't that done right in Espresso
0,sick  going to graduation party.
1,USER i am honing my rage to get into the evil league of evil. Hi ho silver.
0,USER y ur brain and heart hurt
1,Pics cause it happened! My first socks.  URL & URL & URL
1,"just got rid of IGNITION from my house, now lots of cleaning to do! i love our youth"
0,history test
1,USER Haha thanks
0,i miss him already.
0,USER: yeah .. This super sucks!! I is sad!
0,is on his way to work and mad at his boo thang.....
1,"USER Congrats on the new bookings, looks like your Ad went over well. I hope this brings many new clients your way"
1,USER thanks!! i totally remember the b-day shindig i threw during our elementary school years.  we met 20+ yrs ago. can you believe?
