0,USER  Don't drink all the apple drink witout me wile I'm not der  mani luvz u my hj partner muah muah we always here 4ya
0,oh no...not again
0,its gona be a long day no siara
0,Im getting tired of this.
0,"I coughted this morning, then there was this ""crack"" sound in my back and now I'm blocked ... again"
0,my sisters kitten is crazy! it attacks anything that moves lol even my finger when i was asleep lol :@ made me bleed it did lol
1,URL - Lmao she's brave! She ended up doing army tactics climbing down the chair leg lol. That's my girl!
1,USER awesome picture. wow your talents just dont end
1,USER thanks!!!!
1,exhausted!!!!  there was chaos at work....loved it
0,USER I work at my college's library so all the cute fire students are always coming in. it's been raining a lot now  and good luck!
1,"USER Well, it was more them laughing with me.  Even I knew there was something desperate and goofy about eating beans from a can!"
0,USER Amazon says its selling Halo Wars for $70 not $42.
0,Really bored and tired
0,I'm not feeling totally recovered yet
1,Just dropped off alice
0,USER I know right.
1,revising chemistry for exam tomorrow (N) and listening to same difference (Y)
0,"USER yep, looked at Turkey, Tunisia, Malta, even Croatia"
0,"USER  Hugs. Sorry to hear. Most medics are morons, we should be receiving better treatment than this. Good luck & take care x"
1,work? nahhhh. come visit me.
1,wants to watch Night at the Museum 2 and Angels and Demons!
0,wishes USER would reply  shes so awesome!!
0,I cannot BELIEVE the results of tonight's episode of So You Think You Can Dance!!  Two good but invisible dancers got the boot.
1,"wish it would stop raining !! .. role on the 14th July, Malta here i come"
0,Tired that my hotmail search does not seem to work
0,"USER my sleeping pattern really is wack. sleeping at 6am is normal for me now  Tanzania will fix it. 9pm sleep, 5am morning prayer! =D"
1,Just got home from work.  I work at the Museum of Contemporary Art in Chicago as a security guard.  Come see the Olafur Elliason show
0,USER I think so...I hate ironing. He's lucky I loved him or I'd have told him to do it himself! He made me get up to iron.
1,USER heck I'll work till the wee hours tonight and all day tomorrow if it means having the fee in time
0,Starting the week hurting from headache to broken toe  I need a vacay!
1,"Whatever Happened to Baby Jane freaked me out as a kid- saw it again last night, and it's still scary, but very campy too"
0,i am tweetless. i guess the best thing to do right now is join a trending topic.. i miss you my dear dog
1,FIRECRACKERS TO DAY  !
0,woke up 2day with a realy sore throat and got a bloody gig 2day  of all the days 2 get it lol xxx
1,hasn't tweeted in a while. whoopsie i guess. married... love love love looking and relooking at all the pictures on facebook
1,USER thanks..
0,is home and bored... and cold!!!  can't wait for Monday.. GO PIES!!!!!!!!!  Hubby doesn't want to go to the game on Monday
0,USER I saw it on youtube but it wouldn't let me play the video
1,"USER Hey there, I hope you like my post  URL"
0,ouvindo unusual you  vou morrer tchau
1,USER like those tiny cute moustache or those manly Chuck Norris-like type ?
0,"needs her cumis.... Just wondering, will I meet you tommorow???  URL"
1,"Barnaby Joyce reckons Kevin Rudd is a ""psycho chook"" URL That one will have to go down as an historic quote"
0,I wanna go back to sleep
1,USER I wish!
0,USER i still didnt  ill probably get it next week
1,USER I use tools to follow extra closely to a special group of twitters. And you just entered that special group.
0,USER - haha yeh i know hehe ... but they dont have some of the live KOL songs ...  blip does
0,The Aquabats are still without a label and so can not release their new album. Why cant anyone see that this one ios gonna be huge!
0,stilllll raining
0,I have hiccups
1,Watching harry potter being a bum
0,USER USER hahah i can't stop watching though it's so grosssssssss. his bottom was dirty FOR TV
0,USER  I'm sorry they crap so much.   I will have them buy you a Christmas gift.
1,"rocking 50 Cent blowing kush hits this morning ""I got deep in that kitty kat I did I did""...next up Venice Carnivale"
0,theres nothing to watch but top chef
0,USER what happened to jb tonite?? they wern't on the countdown
0,"USER I'm sorry! My headsets being technically bipolar since I got it. Doesn't pass the mic test, not muted, plugged in. I feel bad"
1,USER like he is jus slow now but his mother lives right by there he is really sweet I used 2 go talk 2 him
0,how wonderful. am not able to get to sleep 'cause my bladder's so uncomfortable >___<...i think it may be time to just go to the ER?
1,"just took my passport-sized photo at a neighbourhood photo shop, and they are still using the old polaroid camera and film"
0,USER sorry I couldn't be there.  I love you and wish you the best of luck! Congratulations!
0,USER my dads gf lives out here and he moved in with her. miss clinton so much
0,USER He is all cuteness!! Sorry I couldn't make it.  Still waiting for delivery guys. Boo.
0,USER working insane hours
1,Happy A.M.!!  Think I'll be a bioottcchhh 2day...N a biotchy mood
1,"USER Shift+3 or Alt+3, depends how you've got it set up"
1,"USER non- fail. ali found cappachino mix.  now, to mail rin a cappachino. this might not fit in the mail box."
0,USER sorry Matt heavy NDA - but it's not a Twitter app ;) Whats up with Apple btw? They don't seem in a hurry to release yours
1,"They beerpong, I family guy."
0,just submitted something to failblog. if it shows up i will post link. if not...
0,"I hope I don't get a parking ticket.  Also, there are little dead bugs everywhere..."
0,so . . . tired . . .
1,I am done for the day
1,Bundle up when u go out. It's chilly out there.
0,"USER yeah Han just went up with the lil one.. im down here still with wine.. on my own, like a fuckin lush.."
1,USER yes it is!
0,I am watching Madea Goes to Jail. I love it! I've got to study
0,USER Out of your car?! Oh no!
0,It isnt meant for me to watch a movie.
1,"USER YOU rocked last night. Thank you for the best evening. So much more than I expected!! Awesome, I am still smiling"
0,USER haha I will lol you got so excited.yeah I was suppose to go.but I'm trying to get a job.I'm so broke  haha.maybe later this yr illgo
0,USER yay! glad you're getting use of the bits!! i wish we still had sephora in the uk
1,i'm off to dreamland. have a great night  URL
0,USER USER excepet also who was painting the kichen!
0,"USER dude, that is so strange.  R u serious?  I can't believe that happens.  That's when social netw is bad I guess."
0,USER USER WELCOME TO CANADA! Hope you feel at home!! Wish I could be in Toronto with you.
1,"In bed from a long night: SPYG's last meeting, Mad Hatter with leaders, West 50 for Jacek's birthday and then Tim's. Off to sleep"
0,I wanna get up and go somewhere bt am so lazy now..
1,"Covering the Bartending Wars, Finals 11pm tonight at McFadden's 1206 N. State Parkway... Pinoys JR and Stephanie competing  Grand Priz ..."
1,USER you have a lot of followers.. kinda creepy.
1,"Will be in BB until Tuesday, staying with the sis. Commuting to work from there."
1,USER oh alright. Its good to keep a little anonymity between me and my following. You're cool. I'll recommend you for #followfriday
0,I'm going to lay down for a bit. My arms hurt soooooo bad. Damn growing pains
0,USER  i wish i could
1,20 min to and hour till the best breakfast for me mum
0,USER yea i heard back when she made the crypic video on youtube..broke my heart i started watching the dvds from season 1-6 now
1,I've never been that close to falling asleep while standing.  looking forward to pushing faders tomorrow AM
0,USER found a poor little lizard in the NMR room. I think he learned his lesson  URL
0,Has time speeded up? It's almost 2pm and I've still got stacks to do
0,USER  why did you have to go off and make me a sad panda?
1,On the streetcar on the way to work
0,more doctors!
1,USER thanks  I have an awesome hairdresser.. One of those personalities where we just get each other's vision for my hair. Haha
1,USER okay doke  u with neil?
1,I'm so proud of myself
1,woah took me ages to do my new twitter background but now its finally finished
1,USER Thank you!
0,sytycd...fine with the girls...but they got ride of max  ... hmmm....O well...
1,You're welcome. Looking forward to seeing photos of those 30-plus-inch trout! USER  thank you for your #followfriday mention
1,USER   Thanks for the follow  looking forward to your words of wisdom!
0,USER awww dude u gonna pull an all nighter?  that sucks dont tire yourself over english! VALUE YOUR SLEEP
0,USER what questions did you do?...i found it crazy hard aswell and i think i have failed!
1,USER  Love the name. Glad to have you join us on twitter
0,OMG!!!! Luv Chat!! =/   .... Churchill Fun Fair todayy!! yayy!!! still haven't gotten the emaill!! ughh  !!!
1,USER whoa!
1,"Lol, Concert Band + Neon coloured Poster board + Markers + Amped Girls + Chris = Epic Lolz (So out of place  ) #fb"
0,I sad to hear about Farrah Fawcett
0,Gah why am I so mad about never seeing fallon again?!
1,"USER oh god! i hate beth ditto too. she was on the front cover od style...bleurgh. Anyway, thanks for dropping off my stuff!  ...."
1,going to do a history exam and go to st helens with esme to change my red hair colour
1,Goodnight world  ZZZzzz
0,Chuck is BACK!  But hopefully without too many casualties  URL
1,USER YAY! Us Geek Girls must stick together cause we are massively awesome!
0,bummed  my computer crashed...wondering how I will replace everything
1,"USER hahah that was sent late... Let's dance across the states, we'll dominate this nation!"
0,"is getting annoyed at itunes, it won't let me add anymore songs  stupid thing... anyway enough moaning"
1,yun oh! I'm freaking back! missed plurking non-stop!  URL
1,Lots of excellent #followfriday suggestions for you - I'll do them all later
0,Im feeling so lonely now  Boring.
0,i got 4 shots  my arms feel terrible
1,"Once Again, I love my job  URL"
0,USER unknown blonde is his publicist. No Michael?
0,"#iremember clackers, nearly broke my hand"
1,"tired after night of acid reflux doom, starting the washing pile of baby things and may tidy up, but may just spend the day in my jamas"
1,USER Yes
0,"Homeee, great night but I'm so tired! I have to wake up for summer school in less than 6 hours  suckssss, goodnight."
0,USER corbin has it...been playing with his and service is a joke here  URL
1,USER Don't forget to print out your resume and put it in the look-book!
0,USER thats not a friend
0,Am I a bad person for not wanting to go home for Father's Day?  I was never close to my dad and I want to not do something for a weekend.
1,USER Also FB pages are indexed by search engines while groups are not
0,"Anyone planning to watch ""The Orphanage"", do so when you're asleep. That way you won't feel like you wasted nearly 2 hours of your life."
0,USER we have a schnauzer/sheltie mix that barks like a wild crazed thing. People dont like him much when we walk him.
1,USER yay go me! im getting there  and screww internet explorer download mozilla firefox its waaaaaaay better!
1,getting ready for church as Fed moves on up two sets in the final. Hopefully he can pull off a win before 10:30!
1,Happy mothers day!
1,Making an radio-program!
0,"is up and ready for a whole day piano teaching in this weather!! Bad times  Still, all money goes towards my Tenerife holiday!"
0,missed u today!
1,Going to an iDance party. Lol  yey.
1,"USER I know, E will kill me for posting something showing their room in such a tip."
0,hi im just woke up .... mmm ... nothing special to do
0,USER  sorry. That sucks.
1,USER oh yes.  aw crap. :| how can you tell? idk how to find out what time & stages they're all on. katy perry > lady gaga though.
0,i don't like rain
0,"USER its good aye, soon randwick will be open though I'm happy I caught up in bio it took an hour"
1,"USER juz follow who u wanna follow soe u knoe whats goin on w/ em.. me, i dunno who i wanna follow pa e.. haha"
0,damn. i think they're spam people..
0,USER I'm gonna be Tehran still tomorrow
1,USER  awww feall betta!  thats how lots of ppl r.. ull get threw it! im prayin!  lol  -Farrah
0,i need more ice but it's all run out
1,USER Need a partner in crime?
0,I wish I drank on the job...  that's me
0,"hmm, I placed one of my chili plants in the sun on the balcony to find it on the floor some hours later. Damage: 1 branch broke off"
1,"USER Aww! Poop! Dear Eddie, because we are lamefaces. Sorry for failing. Love, Netflicks xxx. I SO would love to see that!"
1,woah !! elephants on cma
1,USER Big hole in the ceiling there!
0,USER Nope!
1,USER thanks and yeah I'm having a great time
0,no dancing today  not well:'(
1,In the middle of matura  First part was easy
0,USER oh...i think i get it. im sorry
1,"USER good morning little ones, looks like you're still sleeping - stay warm   (hawkcam live > URL"
1,"just finished karaokeing w/my dad for an hour we love that song that song ""Kumot at Unan"" by APO Hikings hehe  less than 5 seconds ago"
1,Who out there wants to describe crowdsourcing to USER??
0,"must. resist. urge. to. drink. cider. in sun.  am really not concentrating on revision, not one iota"
0,alone and un cared for
0,USER That sucks!!  Wish I had suggestions for you.
0,LAST DAY in NZ...
1,"USER Where you at?   No tweeting today? No gardening either, I bet?"
1,USER Just chomped on your seaweed. And liked it
1,"USER Thank you, but I actually picked the GE and my sis had the final say,"
0,USER I hate my bed  it feels like lil demon gnomes are sticking forks in my back all night
1,"USER aw, i'm sorry. i'm sure things will work out. just think positive!!"
1,USER I should have typed that I knew it was a law.  My question was WHY.
0,USER hey! U only come here on wkends now
0,my macbook is sad... power cord port is so loose i'm scared to move it 'cuz it takes like 20 minutes of fiddlin' to make it work again...
0,Damn M-Audio IE-30s! I just remembered how much I <3 u & now the right earbud has ceased functioning  My Shure's r 2 bright w/ lame bass.
1,"Off now to have a bit of early lunch, then perhaps a siesta  Hope to catch up with you all later, have a good day xx"
1,Mtv movies and music awards
0,USER Twittermom just knew that ankle wasn't ready for class yet! (It sounds good anyway) Back to RICE huh.
1,Want the F-5E please. Anyone willing to donate?  URL
1,I made a dedication for Karolka from my class !  I love you
0,"I want to rant and rave, but I dont think mine will come out very nice right now!!!!"
1,wonderfully exhausted...seeing old friends never gets tiring to me
0,I'm awake.  drinking a latte. I had a sexy dream last night that I keep thinking about!
0,I apparently became immune to regular iced coffee  I now need an espresso shot in it too
0,USER - I have leader ship training
0,when is the Open Happiness video coming out???????????????
1,"thinks this is a strange idea and sight, but thought I'd try it anyways to keep in touch with folks"
1,My private coffee bar is ready for heavy coffee drinking  - URL
1,USER Oh my god!! You sound like me! I am the same way always
0,"Resting, trying to find some relief from the heat"
1,"USER --don't give up in frustration, some of us are live and in person.  (i know what you mean, though!  It can get annoying!)"
1,USER sent some yummy one to the list this morning
0,Ewwww. It's cold and raining in Boston! Where's summer dammit! And this kinda ruins my date tonight  I dnt do rain and cold! Nope...
1,USER Lol! What did you do to tick FB friends off?
1,USER thanks for FF
1,USER Good morning Danny! Have a wonderful day with your family..I will be with mine too
1,is listening to his brother play the solo of Sweet Child Of Mine  URL
0,I feel like I wanna cry
0,"omg, asked my mom if i can buy the big bang board game and she almost slapped me LMAOO feel like bb internet shopping"
1,I'm totally stoked about my flower vase. It's so badass...like you really don't even need to put flowers in it. It's THAT badass.
1,"Time To Sleep, Need To Wake Up Early Tomorrow! Good Night Twitter Hood.. Hope Tomorrow Be A Great Day"
1,"Morning World! Thank you Lord for another beautiful day  Can't wait for    Jonas Brothers ""Fly With Me "" music video tomorrow night!"
1,USER Walk on part DEFINITELY - that would be MY big break I've been waiting for forever
0,Morning twitterland. Wishing my USER good luck in his new class 3 nights a week. What I'm I gonna do??
0,The miley cyrus documentary is on and they r talking about justing and how she is dating him -  o how I wish
0,"USER im heading to the gym..bout to go in, u know im obsessed now"
1,"USER Thanks for the feed Major, it's been much appreciated!"
1,i have forgotten how much i love my Nokia N95-1
1,came in from practice  it was fun !!!!
1,USER  A lady after my own heart !
0,"Just moved out from UVA    Oh well, It's summa fools! Helping with Reema's memorial garden in the AM. The Mego's grad partyyyyy"
0,"USER oh she did??!! yay! I'll check it out in a few minutes. not gonna be here long, i feel blah!"
1,USER Yay  Another one for me for watch on youtube tomorrow
1,USER URL - love this photooO!!!!! mrs.jonass
0,What a long day. I can't find my aloe vera
1,"USER hey, you seen all of Battlestar Galactica? We've just got a collectors edition in at work"
0,feeling very happy this morn...off to meet friends for some brekky..then swimmin later..where has the sun gone though???
1,"Sorry, forgot to say: good morning Twitterworld"
0,USER aww...thats a bad thing? or no? Miss you...seriously!  I just got out of work and thought you would be on
0,USER 7-4 Gettysburg  third quarter
1,going to my bro's play high school musical 2
1,"ice creme, yum!"
1,chillin  having a good time. tired though.
0,does not want to go back.
1,"USER USER  Thanks for the shout Kelly ,Have a great day lol"
1,"USER Beer for dinner, Whiskey for desert  #WordCamp #Hungry"
1,"USER ohh i will, i plan on it..... camera is in my bag  i hope wellingtons going well"
0,In the stock room at work organising flip flops. Seriously. I'd rather be at home and in bed right now. Or anywhere with aaron
0,Anybody want to bring me lunch?
1,USER Morning! I know -- I love the Netherlands! You're offering me a job? You hardly know me
1,USER  It's a tough one but that's why Rafa is paid all that money. I'm sure it's a problem any manager would love to have
0,Going to be a lonely weekend without my baby
0,USER ouuu demi....sorry!  i feel so bad ...but ill pray for you
1,best of the joy of painting  YAY~ lalalalala... boreddddd.
0,USER seems like a TON of good people are getting hit with stuff right now..
1,USER Thankssss!
1,loves how everyone thinks I'm going to be a nurse! I not a nurse... I'm a lab rat!
0,USER Missed you and Amanda tonight   Wish you would have been there. . . we had a BLAST!
0,"""one last time"" by Elise Estrada...sad song"
0,"It's almost 3:00 am. I'm eating cottage cheese while I tweet, but nobody cares because nobody follows me.  sigh"
1,"Now I see everything I'd ever need, Is the boy in front of me.. He's Much Better..."
1,USER ...but on the soundtrack it will be called empty as am.  kristen and dakota are now filming the runaways and kristen has a
0,*gasp* a blue Elephant that reminds me of Elmer? If only it weren't so expensive   URL
1,USER Happy Birthday to Tron from the Lugo's
1,Hanging with Lexie Lou. Just like the good ol' days
0,Why do I think I have fucked up the most precious thing in my life.........
0,oh i cant believe there are so many celebrities on twitter haha but i dont know if they wanna chat with or something or uhmm never mind
0,i took a picture with USER but i guess it didn't come out...it's not on the camera
0,Hi ladies I miss you guys
0,no strip club and no money
1,"Mornin' - Sun is out, today is good."
1,"Up in 3D, late night chats, USER & friends, ice skating, ultimate fb, Revolutionary Road, church w/ USER & USER, family  #fb"
0,Dead and Gone comes out tomorrow!!!!! Can't wait! Although I'm not sure I will have much time to read it until the week after this...sigh
0,USER yo son pls send me the slaughterhouse track budden leaked I can't download it
0,"USER Think you did mate, I did too"
1,Laying out  <33
0,likes suzie... but misses her buttercup
0,USER OMG YOU ARE GETTING THEM TOO  they just wont stop
1,There are some great honey based recipes for you & the kids to download  at -  URL - Join in the fun for honey week
1,IDIOTat)girlarsonist - th*nks for the follow add. I hope the flyers lose though  (chris_renner)
0,Leaving today.. So sad
1,"wedding party tonight, gonna be fun... i hope"
1,"USER Saw the pix u posted of Lexa's achievement... I love how your search says ""fanfi"" hehe,  Rock on!"
1,listening to #wearehunted URL - Bohemian Rhapsody / Queen It's the Queen's music. Enjoy this.
1,USER congrats on quitting  thumbs up!
1,USER in college
0,USER YES I WORK AT 2 AM TOMORROW TOO GIRL!  sucks!
0,Editing photos. Again. It's grim. Don't know why I bother to learn new things  URL
0,"USER Steady, not too much fun, remember you have to go to work later"
0,USER I want one picture too   lol
1,USER hey Kris !! i'm happy to find you here ;) that's cool !  kisses  <3
1,USER ma'am I'll never let it said that I keep another man awake. Woah...
1,"USER Would anyone want to invest in Facebook? Every time they redesigned their site, stock would drop 50%."
0,"I miss my giant pearls & am sick of wearing this little, regular-sized, punkass ones."
0,iced coffeeeee at 213 in da am...love working overnights
1,USER Woo for clean closet !! *Snoopy Dance*
0,Still moving my IMAP mails to Exchange servers..
0,"Well, I effed the iphone.  It was nice knowing you"
0,Needs to take my iron. My anemia is coming back full force
0,i wanna partyyyyyyyyyyyyyyyyyyyyyyy so badly
0,blue cheese is bitch.. whenever i start to crave cheese i know my weight is in upswing.
1,Video: STAR TREK DELETED SEX SCENE (via SciFiAssasin) oh this is just funny  â¦ why are you wearing that... URL
1,USER yeah happy with that purchase
1,Just joined twitter
0,"USER baha It is my new favourite thing, perfectamondo pour le weather, I was hoping no one would notice"
0,USER What the hell *were* they serving then?
0,Hangin with the Fasha!!! but sad bc my piercings have to come out today
0,still in germany!
0,Gosh I have a headache......I feel real sad and depressed...missin him
0,"So now, I have conjunctivitis in my left eye. Is this a sign of something? What did I do wrong to deserve this?LOL I'm dying people!"
1,just had a very good manicure and pedicure for just two bucks  ayeaaah!
0,damnn school thing tonight
1,"Everyday is Like Sunday uplifts me towards a day at work, from which I get to leave an hour early - see, sometimes it's the little things"
1,Heading home from an overall good night on my part!
0,USER p.s I've already eaten my lunch and some chocolate!
0,i dont know why twitter just now sent that thru. but 1 word: headache.
1,"USER sure hope so, you bring great insight to the investigations!"
0,USER Ugh!   Hope the BBQ goes well without rain!
0,I didn't with the BK fries VIP Experience thing from JB...   I'm sad...
0,USER Anything for USER. So sorry man  I am not a patsy generally...
0,Fitna make some moves.. .. I'm very bored and my girls are bored too! Too bad daddy is busy today
0,uggggh. So early
1,USER Not a big Trekkie but trailer looks awesome & reviews have been really good so far!! Looking forward to it!
1,I cannot wait for next Wednesday - Melbourne for 5 days  gonna have dinz with USER hahaha
0,google chrome isn't much better than firefox  URL
1,"USER hey john, takes a while to get used to it. Really designed for use with your mobile. Can link it to your Facebook page also"
1,USER  listen to DH...he know of what he speaks
1,Lying next to the pool with goosebumps and thinking about KFC... I declare this day a lost cause
1,Getting some cheese popcorn!! Yummy
1,"jus woke up, and looking forward to tonight"
0,searching for Uncharted 2 beta codes
0,does not want to take her car to the garage 2morro  its gunna cost so much!  bad times. <3
0,"work was so busy tonight. you would think after getting sunburnt on the last day of school i would learn, apparently not. i'm all sore"
1,USER We don't blame you for having a life (well us SANE people don't) Can't wait for the next blog!
1,USER  You are all doing a great job though!
0,"it's so sad what's happened to Neda.. She was an innocence girl, and they just shot her.. In front of her dads eyes. That's so sad.."
0,Coldest day in the office and I forgot my jacket. Am going to freeze to death
0,USER I wasn't invited
1,USER i luhhh u
0,USER i ruined the picture with my brooklyn anger  lol
1,"here again...who knows? take it as it comes, & gotta c how the kids r listenin'!  Hope all of ya have a gr8 1!!!"
0,USER but I wanted caffeine
1,"Oh, glorious food. How I've missed you so...all day. We meet again. Hi."
0,"USER i keep getting floor seats for demi, lol im tempted but she needs to lose her tan"
0,sandy takes so long.
0,Yesterday my #iphone crashed during upgrd to 3.0.  Lost all music/vid/tv shows/bks.Still working on getting it back to preupgrade shape.
0,I wish I was USER house with sophiehattch
0,I NEED MY OTHER HALF  GAVE AWAY SOME DISNEY TIX I GOT FOR FREE LOL
1,"It's summertime! Day drinking, laying at the pool, reading, parties, friends, etc. Ordering in with Lauren for a night of MTV tonight"
0,USER Whaaattt why? So you're backing out?  DO EEEET!
1,"USER Good morning  thank you for educating me. Had to look up EDGE, 3G and oxymoron. Wiser now ;)"
0,USER I'm sorry your birthday started off bad.
1,USER bahahaha. No but it was fun. Thanks for having this. We should def have more spontaneous bonfires (without lighter fluid)
1,"USER she said she doesnt care. and I say, its ok for her to be cute"
0,I am a bad friend!!!
