1,USER We are new to this Twitter malarky but were sure to follow you as soon as we got on here! Hope you are well
0,sick like a puppy
1,"USER thank you babe <3 and thanks for the candies! you want me to get fat, huh? just kidding. it's very sweet"
0,USER Hasn't completely broken so hopefully can fix as having a manicure tomorrow
1,prom was cool  i love my friends  graduation countdown: 5 days
0,USER actually thats not really a far drive from there. I love the Columbia Mall! Its been 4eva since i have been there!  need2shop
1,USER Thanks so much!
1,at holly's  asif i have to wait till quater to 9 to see the zutons  why couldnt they be on earlier its too cold !!
1,Finished up deadline early today; hoping to either catch a flick or go swimming w/ friends later!
1,(USER) Shut up and put your money where your mouth is thats what you get for waking up in vegas
1,No drink in summer is ever as nice as matke ka paani in a steel glass
0,is disappointed because i wont be home to watch mommy enjoying her birthday gift tomorrow.
0,Turns out the high cost of coaching isn't all the volunteer hours or having to stand in the rain but missing chance to golf with family
1,at tanyas  wanting him to come see me!
0,At pardos! Again! Hahaha... there's a lot of people with my parents I doubt we'll be leaving soon!  i'm so sleepy! but hungry too!
0,"so dissapointed....was watching Master Chef and then lost the station, all I've got is a fuzzy telly"
1,where to? the stars.
1,"USER Woah, I'm sorry about that! I hope you can check out the other topics--the housing one should have been the only blank one"
1,"USER LOL... I never had it on GBA, though I did get the re-release on the PS1. Nothing but pure awesome."
1,"USER if you're cool and you know it, reply to this tweet"
1,"Glad its very close to the weekend, im in the, laying around-watching movies-w.sum1 mood, hope u come"
0,alrite breakfast and internet searching done. Time to get into the study. Exam is 5.45pm tomoro night  still so much time... sigh
1,It's monday here in NJ
0,"Work is MAD blocking sites! No fun  but they aren't blocking facebook, twitter & youtube"
1,"USER keep an eye out, at an hour when more people I interact with might actually see it"
0,fresh prince and sleepy sleeps my nightly routine  gotta go to Dmv early tmrw
1,Great show today on GB. Discussing the issues on paltalk in Eolias room Freedom Can Surely Stand. See you all there
1,just got a Twitter
1,USER yes. Will be here until wednesday  can't wait for tonight.
1,"USER You, too!"
0,Falling asleep very slowly lol....still aching
0,"in my old life, id have a health dept certificate and liquor license by noon on tuesday. and would have signed a lease by friday. le sigh"
0,people never cease to amaze me...time to get ready for work
1,USER 6 months ago you'd be right. PD is a single man now
1,USER ..what? uh. old man say what?
1,USER see you there  Section 5 Row B
0,has a fever i can't seem to sweat out
1,USER lol Never that boo! I just seen you at the table doing the same ish I was. Don't nobody be twitter like us
1,USER yeah there were 4 of us in our room  we have a few vids... Our youtube channel is insearchofnkotb
0,"gah, i always miss the stickam chats"
0,USER I JUST caught your interview on Nova! That was awesome!! Just wish i had tickets to the shooowww!!
0,USER And I'm being forced to do the silly gyms concert tonight despite the fact I can't sing at the moment.  I hate being ill
1,USER Your best bet re: troubleshooting your web site issues is to use the forum & other resources in Google Webmaster Central
1,working on success-team and ... some new idea  ...millionaire  ???
1,USER á»«a. a Äá»nh Äá»i tráº£ sau nÃ¨ em
1,USER Aww ThAt'S CuTe....U MuSt HaVe A GrEaT GiRl
1,USER Thanks  I guess it's about ï¿½50 pa. but you need a mac have a look here: www.mobileme.com
0,USER Its just frustrating.  Some are really appreciative for the smallest thing you do. I should learn the art of low expectation.
1,USER You get any sleep?  You sound blah
0,"im hungry, but idk what to eat"
0,its hawt... but am pissed off a lil... plans for tonight have gone somewhere..
1,"It's only 8:30am & already I am sick of people...big ones, little ones, real ones, virtual ones. Does not include you, never any of you"
1,USER no kidding...I think the #magic fans have pushed Twitter over capacity
0,USER That suuuuuucks.
0,"I've been playing tetris so much that as I'm typing this, I'm picturing sticking blocks into the spaces between the words. This sucks."
0,"USER  wtf.....winter isn't due til monday, am freezing"
1,USER Why thank you!
1,USER re: subway pizza: how come? The thought of a few hundred people breathing on your pie?
1,USER haha...yes i dedicate to everyone i know here (home)...and i don't care if they know
0,USER omg. I liked that finger! I mourn your finger.
1,Super excited to see the Hangover tonight. Some of reminds me of my bachelorette party.  Don't go to vegas too close to your wedding.
0,"awake, shouldnt be, feel poopy"
1,USER like the prophet said
1,is soaking up the sun
0,Rcct meeting tomorrow. It will be fun! Last day to see Spencer before he leaves for tour.
0,"USER ... two books we read, and yes USER i agree with u short storie, i spent a while reading everything last nite! big waste"
1,iight honey twitters... I am out for a walk with my crazy dog lol twitt ya all later  xXx I want some sun.. pleazze
1,am watching my 9pm chinese show...!
0,USER I use MSN but I have your yahoo ID on it... so that's where I could catch you..   Sorry I missed you man!
1,i have the biggest headache ever. why is everyone doing things?! man i have no life. im going to bed
0,USER aww not fun
1,i gotta take a whiz. lol
0,Off to cook some smth. edible 14-03!!! I can't even call it brunch
1,"USER good luck, honey! do your best"
0,I smell like gasoline thanks to Irving's faulty shut off switch on their gas pump. My poor Jessica Simpson wedges
1,USER thats cool glad you had a ok weekend
0,wish i had my guitar
0,"It's giving me a headache, but it's soooo kewl   URL"
1,You know what's happening NEXT WEEK?? I'm gonna see the JONAS BROS & DEMI LOVATO yeaaah. And in 4 days I'm in PARIS. Amazing
0,I can't believe it is my last day at WBOC-TV.  Thanks to all the viewers who have watched over the past couple of years.  I am sad!
1,USER I am well...how about you?
0,really wanted to watch Star Trek  I shall get the DVD. At least there will be no screaming kids or tall people sitting in front of my TV.
1,September 4th we open for Tye Tribbet...what non established artist do that lol oh yea....us  cnt help it it's God given right Mali lol
1,USER my favorite song is White Horse  and you ?
1,woah bumping into a lot of unexpected and unliked people tonight. but i do love USER
1,"USER  Hey, I'm baack! And, thanks so much for all those kind notes while I was gone. They made me smile at times when I needed it!"
1,USER your stuff is so cute
0,"bored on computer, will go to bed to get ready for work. my husband has diarrhea so no cookie tonite.  URL"
0,Damn! Does this mean they wont be doing sexify from there anymore?   NO FAIR!
0,USER Sleeping under the stars with friends and 4 wheeling is a great time wish I got to do it more.
0,Sleep :]. My foot hurts
1,USER Tell me about it!!
0,Why can't I listen to Mark Morriss' version of Gouge Away anywhere?
1,USER I'm a bad girl (6) ! jajaja xD I love you friend  :*
1,official countdown for PV.. T-Minus two days!! wooo
0,Happy Fathers day to any Daddies out there. I miss Dad today a year ago he passed we have our second fathers day without him
1,Ushers: You guys made Mother's Day really awesome today! Thanks for coming in early to prep the surprise gifts for all our moms!!
0,Okay so im back. Twitter withdrawal is not fun
0,all men! YouTube is down!
0,So Dis Is Da Perfect Time To Take A Nap... But I Cant Fall Asleep
1,USER everything is good today  you didn't know? Lol
0,USER susan boyle come second place!  she deserve to win!<3
1,USER URL - You look so sweet and happy together!
1,USER can't go a day without a drink? I can refer you to someone...ha!
1,Well that's a relief
1,USER dont worry... I can send off of mine your way if you would like.  There are PLENTY to go around.
1,"USER Well, we all will abide by whatever paradigms we prefer"
1,USER I think he just didn't want to bother with answering any questions.
0,"USER yup i have four doggies, two chihuahuas, one yorkie and one maltese, but they don't live with me  they're at my parents house."
0,Just watched USER cry in his Happy Fatherless Day video.  I'm getting a little emotional! No dad here either.
0,"USER kreng, i thought everyone knew what time D was leaving.my batt was dead too the whole day yday so i cudnt text."
1,suki is pretty good for lunch
0,USER OH!!!!!!!!!!!!!!!!!!!!!!!!!!!!!!!!!!!!!!!! now remember our pizzas are smaller than yours mr!  *cries*
1,In my bed relaxxin
0,On my way home from foleyyy. im hungwy
1,Talkin to my love ethan! So excited to c him tuesday!  *Ethan's girl*
1,USER omg troy is so funny lol
1,USER Ummm redish?? It still looks cool as it is though  but don't go blonde  x
0,USER nooo! haha. i love them all  but especially not Paula.
0,Weddings make me depressed
1,"USER Now you have to ask Danny and jordan, and all tweeters will be happy"
1,USER how was your wkend?
0,lesson learned-do not put off tomorrow what you can do today. b/c tomorrow you might feel sick! (like i do today.  so sad. yoga later.
1,Gellin like a felon
1,- I just got a new phone...with unlimited texting...I'm only 10 years behind the trends...    440-813-5380
1,USER waaaay ahead of you
1,Don't you just love 3hour powernaps.
0,Enjoying a cup of hot teh tarik.. soothing... Still not getting anything done.
0,is going home.  Noone wants to see Angels & Demons with me.
1,USER come to Texas! ive been driving since i was 12 we have big open roads and pastures. we can have a helluva time
1,"USER I saw your posts had become JapanSoc-able etc, good thinking!   Your site is coming along so well."
1,"USER speaking of camwhoring, you're doing the mosaic right? yes?!? yes?!?"
0,just read that lacroix has filed for bankruptcy--a sad day for fashion history and couture
0,USER I thought i was one of your hoes
0,USER I miss my cousin
0,watching newport harbor marathon<3 stilll siiick
0,USER WHAT. How so? I'm wearing YELLOW. I'm just sad my cheeks are so swollen
1,"I love how Pacquiao doesn't talk trash about other boxers, and talks with his fists in the ring. He's also very humble."
0,its d last day i'm getting online..!
1,USER ok that's fine
1,USER i got a new bible today. it is now my goal to read the whole thing!
1,USER did you ask her?!!?!
1,Spend your time wisely! watch my new video! 5 stars pleeeeaaasse! Subscribe! www.youtube.com/jradguitarpunk
0,it's currently raining in downtown Seattle....the 29 day streak without rain is over!  unless... it's not raining at sea-tac.
0,"USER No, I haven't seen it yet!  But once it comes out on DVD.. ;) hehe. Haha"
0,USER thank you  ahhh what do you have? i hope you feel better soon love
1,Just ate a yummy chocolate bar I'm missing my baby can't wait till he gets home
1,and im off the hook... i am ready for some serious parteeey!
0,on the bus....whyyyy???
1,USER wow! great!  how was the vacation? we need to talk. I gotta tell u something! very important! Go get online around afternoon!
1,I seen Obsessed with Beyonce and  It was amazing I could hardly hear anything with the people screaming but what I did hear was Great.
1,USER good morning buddy whats up
1,Ugh. tiring trip :| haha just got home from AC
1,Today looks like a good day for maxidresses and sandals  im well happy
0,shut up. i have no friends
1,home again! rainy weather doesnt help the garage sale cause. atleast i get to cosy up in bed with new moon book  lovely afternoon xox
1,Watching House
0,At the dentist again  ugh my head hurts and I'm hungry!
0,i wish i was famous.
0,on our way out the hotel to go home
0,hindi na nawalan ng assignments!!  tired
1,loving suze orman
1,Its amazing what a breath of 'fresh' air can do for your perspective... I'm not mad anymore
0,USER wish u were here too!    soon!  Can't wait!
1,"Wow. Havent been on here is forever. Uh, going to do the dishes soon. Watching Boys Over Flowers, again"
1,is watchen season 1 of ugly betty again  love it!!!
0,USER aww man that sucks
0,has hiccups.  URL
1,USER  why you gotta talk about me like that!
0,hell.... debugging again..
1,Shower time.
0,grabbing some food before class maybe... 11:05-12:20 & 12:30-3:10  then nap or swimming and some speech thing for class at 6ish ewww! bye
0,"USER Schools still off here to, not back till Wednesday!   I've been ill most of the hols, so not been able to do anything"
1,USER happy birthday
0,is awake at 11? i must be losing it. this is waaaaay to early for me. i could have made it another 2-3 hours
0,getting off now
1,USER I thought you were already happy.
1,Ignis down
0,USER me too
0,USER all the tickets went over the weekend! Sorry!!
1,I think he's the choclate chips to my mint ice cream
1,i'll trade my boyfriend 4 a super hero
0,"The violent in Iran is getting more gruesome. Nada, you will be remembered."
0,USER Tink!...darn it! It wasn't a knightmare! My son did erase all my pics.
1,USER the Mr. Is not neccesary but sounds pretty good.
1,i just heard the song it waz so asome
1,USER we will!
0,"nothing green to wear  going to wear white instead, no clouds today, sooo hot."
0,USER :holds up hands: I had *nothing* to do with it Sam! I was trying to get him cleaned up! :looks at USER: Tell him!
1,USER hey Jess! There's a new froyo place in UC. Yogurt Train by Koi Sushi. I know how you love your froyo  Im gona try em out 2nite.
0,Lucy's bowels erupted while I was at work this morning
1,USER -coughthesatsthesatsthesatscough- ummm.... tom?
1,USER Thankx Love
1,USER nice photos dude. I may ask for the originals to make wallpapers for my home theater PC.
1,I heart sudoku  it's addicting.
1,USER they chose you for a reason... just keep going!
0,is feeling so INCOMPLETE right now..depressing
0,Sadness! Everyone is bailing on partying tonight!
0,essendon lost  jeex why dont u learn to kick straight bombers....ohh well at least our coach isnt terry wallace
0,I hate stairs! This will surely leave another mark on my arm..  my oh my! Hope they find more info about that missing Air France..
1,"Have a fantastic weekend everybody, hope the weather is good wherever you are"
1,USER Everyone likes boobies
0,yo... i'm bored... wanted to do somthing other than sit on twitter all nite (no offense ya'll) cuz i'm off tomorrow... but here I am
0,USER  yay! my sister always tells my to shut up  then she pokes my really hard and it hurts D:
1,uber cool
1,USER if you go on the boat today...I'm coming
1,USER Things can only get better then
0,for some reason my pic wont load soo sad
0,It's getting very difficult for me to stick to the list. I haven't done anything.
0,I am now back at my grandparents' and I'm super tired
1,USER Thank you
0,Hospital time   URL
0,who the hell decided A. going to school 45 min away from hm n B. 8 am classes were good ideas?!? Oh yah! I did.
1,"OR, just contact me"
1,"USER happy #juddday, tom"
0,sadness. my son is staying statistically improbable with his 33% chance of getting hurt on his birthday. nothing serious but still...
0,off to hurricane festival. worst thing: no internet 'til mon
0,Firefox keeps crashing
1,"USER ohh, true!  i thought he was talking about plumbing problems"
0,Looking out my window. Everything is dead quiet.   - x3 .
0,"i miss youuuuuuuuuuuuuuuuuuuu, kejebak dah gue huaaaaaaaaaaaaaaa"
0,USER hate to rain on your patade but the sun is going away for you soon... It got cloudy up here about an hour ago
1,Awesome jam session form PhillyD: URL
0,Rolling out of bed
0,USER USER I just realized I have to find a new coffee shop up north when I move  I'm not sure they exist up there DAHHHH
0,"has a poor half-shaved dog. So sad, he has fleas."
0,USER at least they didn't take your whole car.
0,work tomorrow...err..today...booooo!
0,Finds the rain soothing... dreading going back to school in a few days.
1,USER Happy Birthday! Have an awesome one
1,USER you should help out an unsigned band!  mine. we'd love to play your show. www.myspace.com/friendsforhire
0,trying to figure twitter out ... got no idea what i'm doing!!!!
1,"Trying to figure out desktop version of USER, causing unintended Tweets in learning curve. Please disregard"
0,USER me too
1,Finally got my BlackBerry 2 stop freezing! (Knock on wood) It is so aggravating when it does that...headed out to get dessert w/ my mom
0,i need him. so much  ;*
0,USER Aww I wish I could get bgt here in Toronto
0,is pretty tired and has to wake up tomorrow to do that stupid paper over serotonin
1,USER I like that!.......
1,"Twishers!! (twitter+bbdishers) Doin' the happy dance!  We made it to 1000!  Seriously, I didn't think it would happen til season started"
1,USER Useful links pleaseeeee!
0,"USER and USER were right, Thrice's Vheissu is mediocre at best"
0,"up early, bad cramps"
0,USER  Yeah.  Movie-going is pretty darn expensive these days.
0,"USER this is not a true story. I do feel punished since those A words weren't in alphabetical order, though"
0,"USER thanks, you're right  are you off to bed?"
0,forgot my headphones
0,USER and on that note i'm off to bed got a crappy long shift tomorrow
0,Don't you hate it when you get bad news!!
0,USER I wish you were here so we could workout together USER always has something going on and is too busy to workout with me
1,With tiffany at chilis!
1,USER Sorry we can't make it tonight. Hope you guys have fun. Cook the shit out of some food for me!
0,USER have your tried www.pyramidcollection.com ? They've got a gorgeous ivory gown but I can't link it. don't know how.
0,Just rolled out of bed. Not feeling much better. Time to mow the lawn
1,Just saw USER!  Said hi but didn't think about getting pic in time.
1,is off to the shops
0,had a long night in the ER with my daughter...this morning we are so tired & she won't get out of bed
0,USER its hard to find the time! D: I have to wake up an hour and a half earlier than I normally would in order to be able to eat
1,Face exfoliated and moisturized.....feels good
1,Sunning myself in Ibiza  oh happydays
1,my daddy made me coffee! what an awesome way to start a monday
1,USER No news for the public eye - things are just FAB though.  What is the latest episode of Gossip Girl (season 2?) you have?
1,"USER dont worry, I'll still follow you even if USER drops you"
1,USER  boooooo-riiiiing.  i hear a fog horn: BOOO-riiiing.      everyone's twitter is boring.  You've arrived!
0,I haven't slept yet
0,"Okay so i've changed my mind, Magic is putting horrible thoughts in my head.. It's killing me"
0,USER awwwwwwwww!! that's great .. I hope you put it to good use .. for me? it was a dust collector
1,With my b..  finaallllyyyy!!
0,Kvartal panel blind system is giving me a headache. Missing parts
1,hello tweeples !!!!!!! my day's been amazingly good so far !!
1,"USER YOU! =D Your trying hard, huh?  Ummm, let me see, what menu is the break options on?"
0,THOU SHLL NOT JUDGE..SO IMMA LEAVE IT ALONE..SORRY HAD A MOMENT..SO OVER SO MANY PEOPLE
1,Perfect six  Hopefully they're not equal to six days =s
0,"getting ready fer school. and ugh, i don't wanna go today!"
1,yay 18  i just might make my goal!
0,"Oh, and I haven't seen my dogs yet. They're still at daycare from yesterday. We were supposed to pick them up this morning!"
1,USER should work now.  let me know...
0,"sorry for disappointing you, whoever you are"
0,USER boo bicycle thiefs! I would be livid
0,i just found out hedgehogs are illegal in california.    i'm depressed. and moving. maybe oregon or somewhere on the east coast.
0,I'm can't sleep. & bored wit noOne to talk to on Twitter  USER
1,USER wooooww where the hell ya been!?? lol miss ya luv!
1,"USER IMO: Superstar, Hush, Once More With Feeling. But really - it should be a BTUB long weekend."
0,Ayone need a kitty?? Someone left her here in a box!!!
0,USER DX you are still not a jerk.
1,"USER well if them fans stop liking you guys.. then their not true fans. you guys are absolutly awsome, and we all hope you know that"
1,"USER i have to say, it's kinda cute  REALLY? YAAA!! but arrg that's a sunday... friday was better but anyways, they're comming"
1,USER As do I
1,"USER And you're wise, witty, and smart as hell. Combine all together for perfection. Time for a buyout? Kindness aint cheap."
1,....what am i doing?? what are you doing.?.ppl talk to me!
0,"Grrr, Twitter.  Why won't my default pic upload? I've tried diff pics, all day."
0,"i forgot to put my work clothes in the dryer  also, i love my new slippers!"
0,I am in Kerkyra but seriously mizzzzz Cyprus  <3 lolz I wanna go back even though they have Prada here... <3
0,first attempt in making roti jala ===> FAILED BIG TIME! It became an american roti jala i.e. pancake.
0,"USER 403 FORBIDDEN, i can't see it... SO CURIOUS TO KNOW WHAT IT IS!"
0,USER that's forever from now
1,we're meeting tonight USER going to the same place should be done by 9 we can do something after. will text during date
1,"USER yep!  you know how he is with his kisses. he kissed the E! News reporter on the cheek, too."
0,USER damn I didn't know you were showing anything this time around - I won't be in town starting this friday
0,"USER bah, and i still gotta finish some work for tomorrow"
0,Has got a sore throat
1,Gordon Brown OR Brown um brown....hm.... my coat is brown  anyone agree message me
1,Going out in the sun now
0,"USER Okay, have to revise that. Productpage says nope."
0,USER out with a bang does that mean this is it???
0,sat in the airport lounge waiting to go home. so glad diversity won bgt woop woop. Got to finish of my assignment today  fun times lol xx
1,USER it was good haha
1,I did already  haha
0,ooh no #asylm is at the bottom of trending topics  try to keep it on there guys
0,"USER And now maybe you'll stop in & get a free meal! LOL, hell, how much do some kids eat anyway? Lot of those places aren't here"
1,"Going to bed somewhat early, so I can talk to my best friend early in the morning!"
1,and how we love logoes  USER
1,New KsE song is pretty goood
1,I use this to know how long I work on a piece: URL
0,"Wow, I am TIRED. Gonna be out w/in the hour I'm thinking. I still wish I had some vitamin c.  I have a feeling I'm going to want soup too!"
0,USER : i wasn't near a comp dear.
1,such a FAB wknd!  i've got great friends
1,"right, helpdesk is now set up, just need to fill it with knowledge base articles and then create all the user accounts - fun"
1,"USER it's my birthday today, plz wish me a happy birtday  I love u"
0,USER  If i tweeted more you'd know that Sometimes our lives are too parallel.  Just left a kids party.  No wine.
1,USER just sald and then i had a pear and nutella on toast
1,turning off the laptop early tonight!
0,do someone know why youtube.com/jonasbrothersmusic says it does NOT exist??? aaaaaaaaaaaaa what's wrong???!!!!  USER
1,.USER Think you will be tweeting during your keynote? Bet front row hecklers will be! Need spread the love.
1,USER Congratulations  Very well done.
0,had a great weekend and did not want it to end! hello monday
0,MAN I'm so bored I can't think straight ughhhhh
0,USER she doesn't want to go  this reaaallly sucks. i'm thinking about stealing the car lol
0,"USER ragin must only work tonight then, bummer"
1,business in the front party in the back
0,hurt my neck
1,USER lala songs
0,"USER I'll try 2 enjoy it! But I'm looking for a ""w/end"" job too  BUT yesss we'll hafta link up very soon!"
1,Parallels finished dowlnoading.
0,Dangit the MTV Movie Award post is moving too fast for me  and keeps killing LJ.
0,"Good Morning. Coffee and emails again. The Berry is going to hospital today, he is sick  so I will have to do it all from the MAC."
0,badtrip. sira ang router sa bahay...  URL
1,USER goodnight Mina
0,"Wow, luar dh cerah, masih mengemas! Bilik dh takde ruang utk berdiri. Otak serabut. USER Paellas! Yummy, I'm so lapar rite now"
1,"Estate agents, University HR freaks and Film crew - all dealt with! Hooray! Now for a few hours work before well earned pub and catch up"
1,I'm all packed up and ready for the big Philippine Island Trip w/ my family.  Hope to buy some goodies for my friends! will keep u posted!
0,Egg yolk with a 10day old embryo is freaking gross.  - URL
0,USER Yes mozzies worse - more rains this year. neighbor using organic treatment for them. smells like raw chicken with paprika.
0,"Still reading IA for the www ... *must* get through the ""Thesauri, Controlled Vocabularies, and Metadata"" chapter  ... URL"
1,"USER So, you are around 50?"
0,Back to school tommorow.. bye
0,"IHOP before work, now I got the itis & don't wanna work."
1,Yasmina was most definitely the right candidate
1,"Okay, kitty has gone to bed before me, that's kind of sad.  I need to go see to my girl   Talk to you all later."
0,USER :O that was very rude. I offered to straighten your hair. I think the price you'dve paid would be very fair.
1,#followfriday Thanks USER USER USER USER USER USER USER USER USER
1,got a call back from one of the jobs i applied for to make an interview....yyyyyaaaayyyyyy!!!!
0,It's gonna be one of those days like last week again.  Like sundials in the shade...useless.
0,"USER the concert was okay, the awards took a while though. next year ms. roth said we have to do contest solos though."
1,Morning Campers! What a beautiful day it is once again today...we start our useless end of year tests later....cba
1,USER I have been looking for internships all day! im back from dinner. i hope you'll have a good lunch break
0,"ive lost some contacts, dont know why"
0,USER I can't send through direct cuz ur not following me
1,USER Well... I'll think about it
