1,Chillin with the pates in cali
1,"working as hard as ever  finished a book by Kurt Vonnegut this morning, next on the list would be Dickens and Rushdie..."
0,#LVATT #LVATT #LVATT #LVATT #LVATT #LVATT #LVATT #LVATT #LVATT #LVATT LINES VINES AND TRYING TIMES COMES OUT IN AUSTRALIA FRIDAY THE 19TH
0,USER hey hey...  I already know what you're thinking... I'M SORRRY!! How much I owe man..do u take payments lol...I miss my friend.
1,"is off to play poker for charity tonight!  wish me luck, boys and girls!"
1,"Woo, I am in Australia... It's nice and cold here"
1,"about to lay down, i am tired!!! looking foward to next weekend ALREADY! lol Good night twitters"
0,just started eating pizza(: + just had a fight with robbiee it so so so sucks  xx
1,Rescued two adorable pit mix pups today.  LC and Brody.  Looking to adopt?  E-mail me for more info and pics!
0,"didnt made my goal that was completing 1,000 updates  i made it 'till 982.. lol!"
1,is playing pet society on facebook
1,USER iight I got you
1,wants to thank Ken for making me extremely happy today.  URL
1,Hello 3:30 AM.  Hope I don't see you again for a long time
0,USER come back for another year  pllleeeaaasse
1,USER ha lol
0,"hmm i gotta upload pictures TOMORROW, imma miss you OPO"
1,Raining in Marikina. Loving it really.
1,USER Thanks!
0,USER Can't seem to find an online version. The Green Edition of BIV seems to be hard copy only  #BIV
0,R.I.POWER IZ THE WIZ!
0,"how can it be that I unfollow someone, it says 'no longer following' & then before you know it...they're back!!!"
1,USER ah yes I can always count on u to wake me up at 4 in the mornin' due to ur twittering. I dont mind though
0,"USER used and abused, huh? i do feel like that sometimes, especially when clients ignore my invoices."
1,USER Thanks!
1,"hey so USER you're flashing the multi personas on us with the new pic, eh?"
0,USER ok what did I do? I'm black....I caught the ITIS....srry
1,taking care of cute babies.
0,My head aches  I feel a little off.
1,"USER hello my dear.. I'm about to try and get my ""vegan"" on as well  it's tough when travelling tho"
0,USER  stop it.
0,"USER OMG! Kelly really responded. Diddy never responds to me,"
0,is hungover  but had a good night
0,USER i always wants those.. but i would look really dumb!
1,USER Shoot.  Got the gag order today. One legal team hashing it out with another. Can't talk about stuff between spokesmodels
1,Just spend the last hour cleaning the Roadster. Looks great
1,USER Okay... Coming your way in 2min
0,MORNING! ... but its raining and I may be going to work today in the rain...
0,"USER Eek, Sabrina! I'll miss your sextastic voice too.  & our late night convos.. I need my own cell!"
0,USER Thanks. I have not blogged for a very long time
0,USER meeeeeeee too. it sucks
1,It's times like these when I'm so proud of being a Twilight Fan. Off now to watch the trailer as much as I can possibly watch it
0,USER Hi Wormsy... I am trying to say hi again but you never see it
1,Headed to church with Alex!  Thank you God for a pretty day!!
0,"Having a duvet day. Just watched a marathon of the hills, now for the Hamlet revision, been putting it off all day"
1,USER ooh love the picture niqa
1,USER LOL give him the breakfast and say it is snack.
1,"Am stuck on Spectacle Island for a while--the boats are way behind--but there are worse things than sitting on sand on a sunny day, 75F"
1,USER woot!!! your first tweet had my name on it.   I heart you!
0,"USER Did the bikeathon for the 2nd time yest, all went well think they had record No of entrants, they ran out of medals !"
0,USER Sorry to break that to you
0,Is upset that she can't get her phone working..
0,"is having Principles of Computing lab session. *yawns* boring. sleepy. urrrgh. work later, damnit."
0,USER sad news  we should text each other so you won't be bored!
0,"Okay. I left work early today.  I went to see a dentist, and I'm not happy.    After that I had a back acne treatment at the Chinatown."
1,twitter is kinda confusing. I think I'll sleep instead
0,is getting ready to eat some tapioca pudding  then do history stuff...
1,USER yep u got em all
0,job hunting- s'pose its gotta be done
0,"I want to go see USER on tour and maybe even Kelly Pickler, but I don't believe I can sit through a Taylor Swift concert."
0,USER ouchh  poor danny
0,USER :O woow that movie was on fx. I dvred it but the last 5 mins if the movie got cut off after the timer
1,USER  ha ha ha soooo know where your mind is lol.  well sweet dreams at least :-P
1,Haven't really managed to do anything useful today but I have bought a pair of shoes
1,"USER nah not filmed in IMAX afaik, unfortunately. Will ask around tomorrow and book"
1,First tweet from the new computer!!!  so happyyyyyy! =]]
0,At service. I forgot to put sunscreen on! My feet are burning
0,Headache
1,"I didn't make of to church today guys, LOL but I'll be back next week  I promise!"
0,eastern standard time. not a big fan of you right now
1,"wow, i've been surfing the net while chatting in the telephone with one of my closest friends.. now this is fun"
1,I got into Zions
1,USER Thanks Dustin. I get so emotionally involved...now that I'm getting old it's like all my clients are my kids
1,"i love the sun! tooo much i think. back to the garden now, then fam round for BBQ and water fight. will be jokes"
1,"USER Hi, I am already there business wise, we're going to move in full this year"
1,ok..last time ill be online all weekend...manhattan here i come!! txt me if your around and come party with me!!
0,I hate Liam  !!!
0,I am a sucker for my own cooking  maybe I should stop cooking.. haha
0,hayfever sucks
0,Alan Rickman is so goddamn hot.
1,URL  melon and coppering look! i'm on a roll this week
0,"staring at something i know would never stare back...broken, scattered, lost, and alone...  ...         URL"
1,USER : wii FTW mate!!! Loving my newly acquired Guitar Hero too
0,"summer kit is well under way, amazing how medication can affect the imagination..I hate feeling bad"
1,"omg beatles rock band :O, i hav to get that"
0,bleh i dont wana work today  got one day off again... And they say its suppose to possibly get up in the 80s this week or close to it. ICK
1,"USER Hey, i love you guys! I think your amazing! I am a HUGEEE! fan from the UK!!!   Hehe, Reply Back <3 x"
0,The job search is really starting to get on my nerves.
1,"just posted some pictures from ""biazo."" tomorrow i'll post instructions on how to get your free pictures  URL"
1,USER wasn't me! I'm more likely to be on a bike! .. and thats what im about to hop on! mw keep both hands onthe wheel except when ..
1,USER - i have been conducting the same experiment on 5 hours which has now been going on for almost 2 years.
1,"USER Yes, people skills and social manners are quite nice.  If you a few billion, guess you need MORE love to gently guide you."
0,USER Poor you Tom! hah I Soo wish I could be there tonight!!!  xx
0,Miss someone desperately
1,USER Your not all bad ... Parker is a good Booth boy LOL Anyway it's part of your charm .. being a lil bit bad ass
0,USER Yeah...it's just hard realising the truth about these ppl and my relationships with them. Makes me a sad panda
1,USER the next wk I C Drs too but maybe then? I would love it! I did go to Mac Grill.  John was not there! Thought of U!
1,USER that u would.... <3 ya!!!!!!
0,OMFG IT'S CHRISSSSS :O i'd never have had him down for that sort o thing
1,"USER Good morning, Allie.  Hope you have a good day at school!"
0,I want to keep Sleeping   I have to go to the gym! Ok I am getting up now.
0,"USER Sorry about the useless dick part, so rude of me,  But okay cant wait, we still going to the towers right or no?"
1,"Verbal Reasoning, you are much more enjoyable now I remember"
0,USER my bad it WAS happenin @ Lux and Layla  sorry I'm late
0,"I have to answer every single phone call, customer request and email today  Boss & sales guy are at a trade show, and FCW has allergies."
0,ive been babysitting this whole weekend.. help me!!!!  I better get maddd $$$$$
1,USER An addition onto your home is the only *sane* solution to the proper care of your books. Plus you can buy more books when done
0,I miss sam already
0,sorry phillip!  You're up kupono! my phone need some luvin
1,Dancing in ryan's car!
0,I just lost a lot of money on roulette   oops
1,packing for aother two night trip
0,USER At least you get to work!!!
0,"Keep waking up, going back to sleep, having a nightmare, and waking up again. But i'm too tired to get out of bed."
0,fuck...xbox is broken again
1,USER yeah i like it alot
0,Got to marine world early and I'm already impatient in the line to park
0,USER  I will.  Today just got away from me.
1,USER morning   was wondering if you had any tips for writers block? thx
1,USER YAY  Congrats!   This seems to have been a pretty good day for everyone
0,Is lonely... Wantn someone to cuddle w.
1,USER Look at you all sharp dressed man in Central Park
0,USER I finished math last week and i have like 8723487234 more Chinese stuff to do  Keep going with math - it's pretty easy!
0,i wanna move to the north west side of town
0,Boyfriend is leaving me in a few hours.
0,USER it's not raining anymore
0,"USER: That was a parking meter, not a streetlight, wasn't it?"
1,.poker poker poker. addicted to it.
1,USER Fanccccy! Go to Tao..Mr. Chow's got nothing on Tao
1,#followfriday USER - interactive tweets with aloha! look forward to meeting on next visit to Hawaii!     ...follow worthy!
1,"USER Hey Jo, just want to say thanks for everything, your an absolute legend!! Was great to see you on friday  <3 Kirstie xx"
1,USER I'll be 16 next month
1,USER : I highly recommends you join www.m2e.asia You can earn money from free shareholder by dividends. Even you do NOTHING!
1,Had a really good lntj. Now watching JONAS. then off to bed.
1,this weekend was sooo fun!! i hope i sleep good 2night ahh hopefully i dont get randomly excited like USER does...& makes me do!
1,"USER thanks for reminding me that we have marshmallows in the cupboard   personally, i like roasting the mini ones over a candle"
0,USER but Im never there
0,"Mornin twitterville! Glad its Fri., but wish i was headin sumwhere 4 a mini vacation,  ! Oh well one day soon, hopefully!"
1,Watching legally blonde
1,Just want to wish a happy mother's day to all the moms outthere. Have a great day!!!!
1,can't wait to fail her math exam
1,"Settling in for sleep so I can be up n at'em for the Rose Festival Grand Floral Parade! Ah the memories of Dad, bro, n I watching it."
0,"USER That was sympathetic, BTW. It's VERY annoying when yr car is damaged by stealth"
1,Simply awesome cover of one of my favorite songs.  Enjoy  ? URL
0,USER you didn't drink enough cranberry juice.
0,Last ever choir rehersal in 16 minutes. Leaving tomorrow for a 7day Berlin tour including four days on a bus. With no internet. For 7days
0,"i h8 wen the screen of my fone is broke ppl are txtin me n i have no money for a new fone, my friend is depresed n my bro in hospital!"
0,i think i caught a fever
1,USER Glad you're enjoying the site! It can certainly be addictive. Just one more matchup...
0,"gah, i HATE my shaky lineart.  i could do it all in vector form, but that would feel like cheating"
0,getting ready to go to Dallas... hot and humid...
1,Graduation today  Happy for My kids But Im going to miss them... I already got attached i Just love them <\3JLP
0,USER well atleast u hope they dont  true
1,i <3 my camo hat
1,It's mum's birthday. Omw to meet family for dinner
0,Is about to get her 2nd cervical cancer injection!!!
0,doesn't have a TV and really wants to be watching the Tonys...
1,USER Fortune cookie says your friends appreciate your WordPress installation skills  (as well as other tech stuff)
0,"USER Aww 80 hrs is so long from now! Boo  When you break it down to hrs it seems so long, lol"
0,"is thinking it was by Grace, that she got home safely from Tae Kwon Do class. She felt sick and lightheaded during the entire class"
0,USER How is the race going? I'm working
1,Sunny Perf is once again welcoming its Sydney guests  Such a lovely city.
0,Too many ideas. Need to write. Ugh my back is killing me. I just wanna go home to my Fox even if he'll be gone all weekend
1,got a dress for the social
1,Part 3! Hehe. So whose hanging with us tonight?!
1,USER if u had a gmail account then probably u'd knw!
0,I got pulled over tonight for the first time ever in my life    at least I didn't get a ticket though...*sigh* but I'm still sad
0,... I'm gonna go home and cry now
1,"On my way to LA to see my boyfriend Brandon Boyd. Don't worry, the nubby knows"
1,I spent 2 hours today crafting The Best of Etsy which will be in Indie Fixx next week. So y'all better tune in. It's THAT good.
0,USER lol my bad  whens studio man??? i got sum kebab sticks if you want some? now YOU read more carefully...holla when u clock.
0,The kids are running me ragged  hard work today. MrsB is off having a lovely time.
0,britany fuck video's are following me again GRRR.  >
0,Tamothy you blew my cover!
0,#dontyouhate not being around the people you love/care about
1,"USER heh, nice new background"
1,lunch-time
1,USER Thank you so much! has anyone ever told you that you are the shiznit!?
1,"All set for Get Diverted this Saturday at Plan B in Brixton, always a great crowd"
1,USER Good Afternoon!! haha
0,USER PLEASE DONT  ...  i hate you
1,USER Good Luck with your audition
1,I haven't been on here in a while! Dropping by to say hello before I head off to work!! I hope everybody has a good afternoon/evening!
1,just came from Rocklin High's graduation--stay off crack people!!!!!! lmfao
0,USER because i had to work so early Saturday  and you got it on the Shia thing!!!
0,My battle bar still won't work no matter what I do. About to uninstall again and give up.
0,Back from TO and tired ... to bad weekends aren't 3 days
1,"USER Aww, yay! He's a good guy."
1,"USER like my oldest in the entrepreneurial mind frame, it could work out quite well for your cause."
1,"In the car, music loud, drifting to sleep. Hes singing at the top of his lungs, out of tune. This is the time of my life."
1,USER amenn to that. He is so finee
0,USER ayt. i won't do this season tho  kaya let me know if you're watching so i can come and we can see each other naman!
0,USER nope we got beat 3-2  the captain scored an own goal in the last minute :|
0,awwww well i feel silly
0,I can't believe I'm this bored on a friday night.. booooooooo me!
0,How long does it take for a sprained ankle to heal? That's a self diagnosis btw. It's been 2 friggin weeks! Still swollen.
0,USER my snaps...  from APTW...  have still not reached me..
0,"USER Yop is only sold in the UK, Ireland, France, Switzerland, and Canada (go wiki).  We have similar drinks in the US but not Yop"
0,hitting a all time low drinking my wine outta a martini glass ... I'm too short to reach the right glass
0,USER holy crap i was there an hour ago :O aww im gonna miss it
0,"USER, who will i stay with? HAHA, dude pls put me w someone that can help me look cute cause i dunno how to do my hair HAHA"
0,Im too upset to be on here! Im goin to bed. Maybe I'll feel better tomorrow. Naw I wont cause I still gotta look at my hurt car!
0,USER Girl this movie is sad  It was on network television a long time ago
0,USER Chinitaaaaa...!!!
1,"Luvn my new soft pink, lacey....ooop'ooop<3"
0,"USER i know, me too, plus my ipod headphones are being all staticy.  but im listening to jesse mccartney! (:"
0,USER so sorry we didn't sleep @ ur house   what a day
0,is so CONFUSED!  URL
1,"USER i'm sure you figured it out by now, but it was Bonkers! went to bed before seeing your tweet  sorry!"
1,"USER i saw your blends and let me say, they are awsome! you're really good man! keep doing that and you're going to be big!"
1,Ok i just ordered food  *:?XoXo?:*
0,Little hungover.. Gotta go to rehearsals
1,"USER helloooooooooooooooooooooo.....I guess I'm now ""following"" you..."
1,"USER pah! nice day outside! love it!  ""matha fackas!"" ha"
0,Consulting e-mail sent to Lammy regarding my next tatt ;P We'll see what happens. I wanted to get it done before my birthday  sheesh...
1,USER did you get it
0,USER I'd never heard of Sidney Mnisis - Shame the player on the site is only 30 sec previews
1,The new version of see u in the dark is the bestt!  i love USER.
1,"Not so good workout 2nite.  A healthy dinner for the most part, but whipped cream accidentally spilled all over the strawberries. Bummer"
1,"get YoungQ ladies, he may send that message on"
0,"USER um, tix for Matt are 40$ usd..and Ian doesn't wanna go.   not sure I can swing tix and bus....on a weeknight...any ideas?"
1,"USER food weather? lol, well not all the time only summer we get good weather so far its bin the hottist this year  good times lol"
1,"? USER ... thx for ur msg, so awesome!  luv the new single! xoxo URL"
0,USER miguel switched his name and got on twitter. so he too cool to be my friend anymore  BOOOOOOOOOOOOOOo.
1,"Just got home, and I got to see my friend Zahra whom I haven't seen since We graduated!!!  That makes me so happy."
1,Stfu. Im done with you kids. Goodnight to an amazing day
0,USER I don't like the chocolate one. Plus eating it makes me break out
0,missing him now!
1,Still have a headache. Spring & dehydration don't mix. Am happy with my rev progress tho
1,USER hey let me know if u wanna go to earthfest today. I'm sure we won't be leaving till like 13:00.  Goodnight Twitter!
0,USER i know. it's soo soon. and i bet there going to be heaps expensive
1,"is getting hooked up on conan ;) ""The criminal must be him!"" heeex"
1,USER hey serra! i miss you. what's up? is everything okay? uhm. just text me if you need someone to talk to.
1,Watching chelsea lately the whole day
0,I guess i'll have to wait until tonight to get LVATT
1,USER Never mind eh. Mine was the text sent from cbf
1,USER I'm good! ready for bed!  how are you?
1,"Just had long, long nap. I miss USER & USER LOTS & they are only in eugene"
1,This A's game crowd is great! Anyone here: hope you enjoy the show!!
0,Boo. I'm not in paris any more
1,will be volunteering tomorrow  URL
0,USER aww no which one?
1,USER are u coming to the uk after kc tour? we're miss u.. btw ure no.9 in this week chart
1,its my birthday today
0,USER --Nothing
1,USER thanx!
1,USER the MOST AWESOMEST DAY OF THE YEAR! happy bday princess (again)
1,lovin that we're in Florida
1,Whoa. I Shot The Sherrif! Forgot about that one in the mix
0,"Dude, I'm so bummed. Just found one of my fave ""hole in the wall"" restaurants has closed.  RIP Hard Times Cafe."
1,"USER Not for while, I'm going to start looking into touring after the fall"
1,Skating is fun right about now! Just heard bsb larger than life
0,"Shoot, I need to find a crock-pot recipe for ladies night in.  Have prior engagement right before so can't go with usual donation"
0,USER But... Butt.. But... I wanna see u now
0,"USER YOU + wedding = electric drums, sorry!!"
0,USER
0,USER I think/hope they might put an age limit on next year on the back of that  #bgt
1,Y do men cheat? bcoz they know its easier to get forgiveness than permissions
0,"USER Priority is getting him to ""working actor"" status, since TJB isn't monetized. There's no budget at all."
0,"USER Ugh, but it was never suppose to happen!"
0,"Oh yeah. Can't believe I forgot. EXAMS ARE OVER! brap, brap! Gotta do work for 6th Form now tho"
1,"wow, happy mothers day for america  x"
0,"USER don't say ""Jesus"" like that  p.s can you fix my bike drink thing soon..."
0,Need to find something new to do Monday nights. Medium is over
0,USER Yes. 1 reason I left medicine and went to tech. The kids broke my heart.  We never hear about those little fellas. sad.
0,"USER Are the magazine just going 2 B on sale in USA right? I'm from Spain  Whatever,thank you so much for everything you do on JHQ!"
1,not comfy at all
0,i should be painting
0,USER ooh :o they must be so tired!
1,"Thanks for all who included me in their #followfriday list, and hello to my new followers"
0,I liked the idea of a compositional constraint--140 chars. But why the font colour constraint? Of course its challenging too.
0,"is in the middle of uploading new pics on Facebook and Myspace. Saw ""Terminator"" last night and was disappointed. Missing story line."
1,USER Really enjoyed your sessions at Rich Dad Live. Especially the 'after' sessions. I could have listened to you all day.
1,getting messages from you makes me get all smiley and happy.
0,USER awesome! My girl is in panama city
1,USER Next time I will met you in Boston! (via USER) => or Los Angeles... i might come back here next year!
1,oh and Austin TX here I come!
0,"but more importantly, gahhh metro collision!"
0,Dying a little inside...my phone is on the fritz.
1,USER good point. everyone DOES deserve to be happy
1,USER Just making sure
0,"just ran 2.xxx km, had to stop cos chest was starting to hurt wtc  stamina dropped... obviously. shucks."
1,editing movies is fun
0,"USER hopefully, he will decide to do better this time around. Maybe have something to do with them. Its a shame how hes missed out"
1,"USER I was also thinking shorter, but have to be careful, else it'll look like your style"
0,"So I took leah 2 my dads & step moms 4 the weekend, gonna b quiet around the house"
0,URL - I don`t like my sched
1,"USER U know what? U were so goodie at dancing last night!! Smugg! Thankerly, sexy!  Miss u bigger!!"
0,... Everything is so fucked up...
1,"USER Yes, I agree, your pic is much better   Enjoy your weekend!"
0,Hey USER tavadooooooo   (show89 live > URL
0,Pakis's ruined the match ..
0,USER kettle cant call pot black no?
1,ALLNIGHTER also my weekend goal is compelete  fbook note for unstable minds! yay
1,Im off to watch a spot of tv lmao
1,I am thoroughly enjoying my new ringtone
0,giving up.  why do i always give upp
1,Thanks friend USER for the lunch advice
0,USER I want to go again too!!!!
0,"Off to work I go, its pouring down with rain and my socks are all wet  ew stylish huh? Lol"
0,my thoughts are still with those lost souls on Air France Paris flight....saw sad pics of family getting news at airport-bad paps
0,he's mad at me
1,USER i know i know!! Fuck yourself behind!!!
0,"USER yeah I meant to do something productive with them, but time ran out  Didn't get lose much exciting though, c'ept the dreamcast"
0,USER going to see if i can rotate day/night shift.. oh and of course day shift is a pay cut..
1,"USER thanks, doll"
0,Buen dia! con gripe  . Very usefull jQuery link: URL
1,Another damp and rainy day here in Sicily. Feel like sneaking into bed and sleep all day  Wish I could drink coffee to keep me alive
1,USER hi cha...never heard about the ish bet. u and sarah G...i'm sure u wudn't say things like that...no worries
0,terrible red mark in phonetics test  so sad!!
0,I am very bored because i am doing bloody textiles revision and its really nice out so im tres tres anoyed
1,"USER I'll be sure to include that in the next goody bag haha. Hope you all had fun while you were here, come back soon!"
0,Seeing Sookie and Bill together makes me wish I waited for someone special.. LOL
0,USER hmmm that's a good question! -I'll tweet you when I do! I wish I could go on now!  x
1,"USER you are now entitled to a free upgrade to the ""Ali Baba"" suite for mentioning the Rotz on Twitter"
0,i think i ate too many dumplings. tummy feels bleh now.
0,is gonna miss maureen and caroline
0,I mean listenting .. UG spelling!
1,OMG EVERYONE SHOULD SMILE!!!!!!
0,USER the blackberry i have is the 1st blkbry dat came out & only reason y i have it is cuz my other cell broke so im stuck wit dis 1
0,"USER, wait, make that THREE papers  Gah."
0,So tired i feel i'm going to pass out... But no one will give me relief to sleep
1,"USER just don't use the paint, you look way better."
0,"USER all of mine are already impacted... i have no idea what that means, but they said that it could complicate things."
0,USER wah wah wah!!?!?! Gerrard Way?! *k sorry but that's probably one ugly baby*
1,"So my first time on twitter hmm, we shall see if I continue with it I heard its addicting"
0,USER I totally love you.. I will miss ur tweets
0,USER I never said you wasn't i was just pointing out the truth! It's okay for dudes but not for girls.. fckin double standard!
0,sitting in school  sucks to be me!
0,"USER iplayer works only in the UK, at least the videos"
0,Finally back to kayla's with kay lake and shelby ! .. Interesting night ! I hate being the only one awake !
1,First day of classes...  ready to learn...
0,Getting a time out error in everything! Aak
1,"""Only those who have learned the power of sincere & selfless contribution experience life's deepest joy: true fulfillment."" Tony Robbins"
1,USER Hello! Your man looks gorgeous in those pics!
1,"USER damn straight! that's all hocus pocus sciency stuff. If the jurassic park guy and GW say it's BS, that's good enuf 4 me!"
1,"USER In Ai, not Ps. Lots of times I could duplicate existing shapes to use as masks & save time. ""Doh!"" moment earlier today"
0,"USER Lol how cute. Aww, Kasey  I shouldn't be laughing. Just found out Ivanovoc is out too. Wtf."
1,"USER hehe, computer time out."
1,"USER They'll be knocking on your door, all right, Rosita.  It's called the census.  #tcot #tfhs"
0,at Work Again : It's so gross outside I hope it's not like this all day.   URL
1,"USER that's not an answer. in fact, the only answer i think i'll understand is, ""yes"""
1,USER I think of it as having many life times other wise My life might not look that great to most ppl  To me I'm blessed
1,had fun at asia and amaris' sweet sixteen last night
0,"USER And since I am going to VB and NC, he won't come out then either. Esp since he used up all his fan love in Ohio."
1,I'm going to go back to the gym tomorrow.  I'm determined to lose weight and have a six pack by the beginning of my junior year!
0,USER i know!!! im kinda freakin out haha have you found who your boy likes?
