1,USER No probs.
0,"USER gahh, still nothing  you?"
0,USER anoo lol! nopes  watching bekah! am gutted! dying for a drink hahaha u ? x
1,I CANNOT BELIEVE MY MUM'S FRIEND DOESN'T KNOW WHO MUSE IS :O >_< Is nice to talk to her bout gigs
1,USER awesome  i saw you at soundwave
0,It'z so sunny outside ....my last day of being 18  xx
0,"Morning guys. Me very tired, and still"
1,"USER  I read your post on Color trends, its Interesting post, keep up the good work"
0,At Charle's with the power out. LOL! Damn SaveMart lost power and we could not buy beer.
0,USER I'm actually kinda starving but I can't get out ofbed nevermind the flat
0,Watching my all time fav show.. The price is right!! Need Bob Barker again tho
1,cousin's basketball champ today; winners! congrats grizzlies!!
0,USER I sorry.
1,"USER  fart , did u check your facebook inbox.....thought would help u get through your studying and get u amped 4 the hols"
1,Getting Ready For Another GREAT! Day At School
1,Now there's a Mr. Sub ad behind home plate! More T-Dot food memories
0,I just love  when my internet doesn't work.
1,I come into to work for a half day and there's a woot-off? Today is looking good.
1,Getting ready--lunch--KD meeting--then HOMEEEEEEEEE!
0,"USER I'm off tomorrow too. I tried to get on Judge Jor Brown, all booked up   Vh-1 has some pilot S.R.O is casting too."
0,USER oh jeez lol USER USER i confused  lol
0,USER  Not good.
0,USER NO magazine yet  No Caleb for me to lick.
0,It's not the 'tards USER It's when my reactions against the 'tards turn people I thought were friends against me.
1,URL - Look at my babykitty  he stole my sweater !
0,USER lol I just had breakfast not too long ago sorry love
1,"USER Morning. Just a wee reminder that you're on Market Kitchen today at 7pm & 10pm, then repeated tmrw at 8am, 12.30pm and 4pm."
1,"chill night, slept late. this is how summer should be."
1,"enjoyed watching ""Ne le dis Ã  personne"" on Star Movies earlier.  URL"
0,i dont think i did to well in my interview today
0,Missed Sheebas marriage
0,at the phone store. i want internet on my phone! my phones crap
0,Going to the library to finish massive amounts of work.  Being productive now will allow me to enjoy finals week... as I say goodbye.
1,USER they r having fun. We've spent most of the day outside  I bribed them with ice cream to clean the bedroom ;)
1,USER I'm looking forward to coffee in the morn'.
1,wow 21 followers thank u very much who ever followed me...
0,Sitting here trying to write a song....but FoodNetwork is distracting me!!!
0,USER dude that really sucks
1,just finished making my birthday list
1,FTSK ft. SG - Whoa Oh :::: I had this song stuck in my head for about 2 days. :I LOL
1,going jogging with #stackoverflow podcast #57. Great
1,USER I love it!
0,"there are so many good clips from last night, but most of them have copyrighted music. fml."
1,boardwalk at Myrtle
0,Is there any ground colder and more miserable than the Carlisle Grounds in Bray!
1,USER have a good day!
1,"USER LOL like the second way, no space LOL ur learning  u following mark? Ludwigdrummer89"
0,USER I'm not sure why I'm not sleeping. My body refused to relax no matter how tried I am
1,Got 30/05/09-07/06/09 booked off work! Ahhh..9 Days of glorious relaxation
0,tÃ´ exausto
0,No way! Terminator Salvation Drive-In @ amsterdam arena tonight! Sure! I'm not there to witness it.
1,USER whole different game in a gi. So many lapels to grab hold of and choke your opponent with
0,bio test tomorrow.  six freaking chapters.
0,USER Ohh. Yeah i was still there
0,"I feel lightweight relaxed, but my feet hurt  I still smell like chlorine and need to shower."
1,USER thanxxx brother
1,hey everyone !!!well im bak home !!! just puttin sum new songs on ma ipod  byeee xxx
0,So lame I have to wait another day for Transformers.
1,Super excited about MSU Football  Got season tickets with boy..Tailgating here I come!!
0,"USER thank for the hugs, keep them coming bad day has continued into today as well"
1,much better.  new shorts!  i needed some for summer. and my rainbow nerdfighters shirt with rainbow makeup... URL
1,USER Thank you for your good wishes...it will be a good one!  Hopefully productive too....
0,eating muffins. i'm not feeling better though  keep on voting for MCR everyone !
0,argh!!!! writers block
0,"USER n i have no choice then to tube the as is stuff cuz there isn't any1 drawing original  i think just kat, pixels and stephie"
1,"Who has the funniest, most awesomest girlfriend in the world?  Sorry fellaz...  That girl, is mine."
0,Yay for having a giant headache  stupid glasses.
1,USER There are plenty of good things in California. ME
1,katy perry is keeping me going.
1,USER elected  and she won her council seat also!  what ward do you want DCC results for?
0,"Had bad discomfort in leg and spasms. Fell asleep earlier, going back to sleep, getting up in 5 hrs. tonight's actual productivity: 0"
0,"Haven't twittered in forever, drinking at kathys slowed down so bad I'm bored"
1,donating blood soon  can't wait!!
0,but I'm sick in bed so there's not much else I can do
1,USER ooooh yayyy!! Then you can get on the loopt!! Get it get it
0,USER aww  why have you had no internets?
1,USER  I answered No to your question about the Crocks tee hee  did you get my email?
0,"Yes, I was in the protest in Westwood a couple nights ago. Pouyan, please tell your family to be cautious, the videos are   USER"
0,I sadly didn't get to watch the rest of it.  I missed the first hour. Only saw the 1st 10 minutes. I'll have to rent it. Lol
0,Car broken in to.
0,USER i sorta forgot perf. reviews were due monday  corn flakes sound good!!!!!!! thanks!!!!
1,Spy hazing...   #ChuckMeMondays #Chuck
0,i lost my phone... cant find it anywhere.
1,Livechat with the jonas boys
0,didn't win the USER comp....ah well... woulda been nice..... feeling bummed
1,"At JW 4th Place.  Just had a great service with Dr. Stephan Munsey, really had a great time."
1,says whoa! a friend of mine got an iPhone 3G 8GB for $300 ish from the Australian eBay.  Great deal! URL
1,Getting ready to to to school
1,i love weekends. they are great. can't wait to see all time low next weekend!
1,USER i think you should get out the pool and make a video (: like now n_n kthanks!
0,"USER if i dont get hubby some coffee in this house before he runs out, I'm going to be in BIG time trouble."
1,you are amazing bby.
0,"USER -   Eeek, sorry for the bad recommend.  I don't have a mac, so I was just going by second-hand opinion haha"
1,"USER ta very much, i was doing temp work anyway but it was shit, i want a stress free life"
0,5:43 in the evening and I am attending classes
0,"USER glad u're havin' fun! now, go back to reality, study! ugh i hate it! i hate doing my report"
0,USER Man thats insane. I'm waiting for my 3G jailbreak! I miss my full flexibility
1,"today was funn!;8thgradepromodance,bananabay,then cue."
1,"USER LIFE!, why not?! blockbuster had movies 3 for $20!, i got a slurpee!, etc"
0,Twitter is acting up...
1,USER I bought Esprit's skirt and blouse from Ellos.fi. Cost way too much but I liked the skirt so much
1,USER i will get myself a new plant in my new room soon..  any idea??!!
1,USER  Thank you
1,USER Of course! s_s party in my teeny studio apt... let me know when.
1,USER *curls up next to emily* we go to craig owens together
1,USER atleast you have twitter until you get in  iphones are lifesavers!
1,"Okay, I'm back in the game."
1,Just picked up a 40pc rotary tool for $30 -- bargain
1,Hi!  we're going to Niagara Falls today i think.
0,"Dang, spoke to soon. TV just shut off!"
0,"""Rate limit exceeded"""
0,Going to try and go back to sleep. Wish me luck.
0,Got a bad sunburn. I am going to drench myself in sun-screen from now on!
0,Sticks and stones may break my bones...but words will hurt forever.
0,"USER Ahh well enjoy hun, we got a mass sort out of stuff this weekend  had a mini 1, now its the biggun !!"
0,USER  I'm sorry to hear that.
0,"being lazy, hoping shes not getting sick!"
1,"Ok. Off to work now. Hope still capable on such a day!!! Have a lucky day, Fluffettes!"
0,"USER I live in the US, but I live in Alaska and no one big ever come's up here"
0,We eat out every night!! I want a nice home cooked meal
1,"USER did you see this, URL ?  HAH!"
0,"USER the end of season 3 ,is sad,I dont like see dean going to hell"
1,"is sitting with Clover in the sun, last day in Fundy,  had a fun weekend"
1,"USER  It's cool, next year ya gonna take it all...all your fans still here for ya"
0,still in bed just thinking about what went on yesterday
1,USER Don't tell anybody! ... or else I'll baby check you to pluto. Infertile fo lyf!
1,Cavs all day
1,"So, to make up for my horrible tweeting yesterday, I will be tweeting a lot today"
0,"Twitters it brings a chill down my spine just to think I have to sign out, good night all  But I'll be back at 7am tomorrow xoxo."
1,"USER make that, congratulations FOR tweeting"
1,yeah  just made twitter
0,USER I work today
1,USER Exactly have you bought undies lately......
1,USER haha... why is that? im guna save that twitter!  haha
1,"USER the giveaway post looks great!  thanks, Nina!"
0,DUDE!! WTF RITE NOW 2 THIS RAIN !!
0,USER maintenance! Happens often.  lol
0,damm SmartXX V3 out of stock everywhere.... so Xbox has to wait
0,USER so sad u can't be there on wed.
1,Hi everyone
1,American idiot will always be one of those songs I go into automatic air guitar. Lol
1,*yawns* Im tired but im not. School just ended yesterday and now i get to record my song that im writing right now on my computer.
1,can't wait for school to end and for the concerts to start
0,USER: o NO it ain't it can't die this summer is gonna off the chain
0,Highland Golf Tournament today at Tillery.... Why did it have to be the hottest day of the year so far on the day we play golf
0,DID I COME 2 THIS CLUB 2 SEE MAINO & USER SAID HE IS NOT HERE TIL WK? WHATTT? WOW..IM DISAPPOINTD USER
1,"Off resident evil now, letting jon play gta"
1,USER just got back from seeing you! you were great
0,*yawn* time to get ready for school
1,USER Wahey! Fancy meeting you here  Thanks for the tweet and great to be twittered together
1,USER Looking for bulk SMS solutions? URL
0,USER Is it true you no longer do half-and-half pizzas? Website has the option but was told in-store that you don't
0,Discovery HD wasn't working for Deadliest Catch
0,"Will the rain please stop, it's gonna make me sleepy at work."
0,Just woke up and i gained and lost a follower overnight!     wekk i am off to teach my grandma how to use the internet byeith!
1,On my way back from carson's grad party.
0,"USER awww! Miss u too! Been workin mama...takin care of foo, he's sick  might go 2cinespace 2marro! When we havin a sleepover??"
0,Want to read but i have to revise noooooooooooooooooooooooo. stupid tests and i am not even in year 11
1,Goodnight to all fakes and god bless the ones who think they're real. Oh I forgot....God Bless my fat ass too!  Goodnight
0,Archives? What? When? Where? PAL?
1,E-mailing Rite Aid to stock makeup faster cause Kate and I demand more Fine Wink
0,Bah! Think I need a holiday
1,"aaw i miss seeing them together. Anyway,im really effin sleepy. GOOD NIGHT SLEEPY HEADS"
1,can't wait for her anniversary dinner tonight at Capische - URL with her hubby! Their 4th anniv. is next Tuesday!
1,Had to make sure i didn't schedule orientation on the day harry potter comes out.
0,forgot my lunch at home
0,USER USER hala!  wish ko lang pwedeng matulog.  nasa opisina pa rin ako eh    i've been here since 7am today
1,less than 3 weeks
0,"momy, i love you"
1,dancing wit my niece to Mc Hammer ( u cant touch tis )...lol...luv dat song..
0,Soooooo bored n lonely!!  Guess I'll start dinner soon.
0,"so tired, but it's not bedtime yet"
0,"USER Oh, you guys.  I'm SO sorry."
0,"PLEASE go to URL and vote for Kawa, P&S, or DeVille - that horrid Primal Grounds is winning"
0,"USER oh and I'm not 100% sure on Metric, I'm trying to work something out but count on a No  haha..bummed."
1,Here on my mom's office. Nothing much to do.
0,Has the worst back ache ever and cant even go home
0,USER  i prob have to wait 30 mins to an hour!!
0,This heartburn is killing me! & my hubby keeps forgetting to buy me tums!
0,Figuring what to eat now after seeing Food Inc.  I haven't had dinner and I missed the Farmers Market this weekend.
0,"USER did i tell u i thought kelly kapowski was mexican? as a young latina, i just saw what i wanted... someone who looked like me"
1,USER my pleasure. Have a top weekend.
0,"USER you bastard. No sun, no beach."
1,USER Bom diaaaaaaaaaaaaa!!!!!!!
1,caught a nice looking racoon in a trap today
0,In pain (physical and emotional) tired and still need to work on my 2 minute argument
1,Hurrah for Button winning the F1. And the rain's stopped now. It just gets better
1,Amazing music. Pleasant surrondings. Graceful thoughts. This blissful & abundant existince is so suiting. I love my life period!
0,Awake  and getting some more contacts on myspace.
1,heading to bed now  night
1,"USER I know, Ann. Take it to the next level: URL"
1,warm fire..hot tea..warming up cold toes
0,Cant wait for my new iPod.. Episode 6 Of JONAS is the Funniest thing ive seen in a while :') haha So Corny but GOOD! I have art homework
0,Aww  How tragic!! Rip Farrah Fawcett! She will always be remembered.
0,USER ....I already would have if my Mom's camera hadn't broke and now she can't take a picture of me.
0,then i checked on her later in the day and she fell out of her nest so she has been living in our garage 4 the past 2 days now shes gone
0,yahoo! cena got revenge against the big show! too bad for jeff...
0,i seem to have lost my running watch  so sad.
0,USER *dances and breaks face* Ouch.  That hurt.
1,off to ateneo for vanna's dwtl weekend!!!
1,USER We save soooooo much $ w/ our gardens
0,I wish there was a Whole Foods in Lancaster
0,Having trouble sleeping. And it's chilly to boot.
1,"Going to London for the weekend, back on Sunday"
0,USER It was amazing! The best one of their's I think I've been to! I'm so sad it's over now though  x
1,USER Glad to be of help!  The Word is always inspiring. God bless!
0,i encourage you to never buy a pair of rainbow sandals..they will tear up your feet like nobody's business
0,Watching the spam followers flow through
0,have a headache
0,NOOOOOO!  I dont want PS3!!!! :'( :'(
0,wants for wednesday to come.  URL
1,lykeee teal hair  mayb pics tomarrow... mastamind shit if only u knew ;)
1,is welcoming USER to twitter
1,"I like ""The Open Door""  Can't wait for the new album. #music"
0,USER I think mine is over 1000 again after finals week.
1,USER my in-laws live nearby
0,"- USER USER I went to work once last year with no pants. Ironically, that was my last day of work at that job. FML"
0,USER the problem is I don't have a computer just my ph
1,Keep your head in the stars and your feet on the ground.
1,USER LOL shes my big sis!
0,Family is all gone now   now for a busy weekend of hockey and relay for life #fb
0,USER I still have a little asma and btw we need to go out together before I leave ok?
1,at the dance recital. using kiki's phone to write this. wearing a snazzy costume. I rock this junk.
0,enjoying a lazy saturday before I actually have to start working
1,USER Thought I heard a chopper overhead!  HUGS back at ya!  Good to see u made it to Nairobi safe n snd!   Thnx gdnss ur done 4/bit!
0,stupid internet going off becasue its raining
0,USER but what hurts is exercise & I need to be much more physically fit.
0,USER USER  yeah we have drops but they aren't working at all. Usually they do the job but not this time
0,Sitting in the sun while son eats coke bottle sweets. He hasn't offered me one yet
0,I should probably get back to work.. bleeeeeeeeeeeh
0,"I took a kick to the lower abdomen in mma class today, and now my bladder is aching like a pregnant woman"
1,Oh well suppose I'd better do some work. Should be quiet today though. So might get some tweeting time squeezed in.
1,USER woohoo Preloved! don't forget to send us a preloved box
0,"I always hate Wednesdays, I don't get to talk with liane while at work!"
0,about to leave for work
1,good morning !!! It's 10.22 am in Germany and today i go shopping
1,Just arrived in Brum meeting Mr Smith for a few shandys before we hit HTID
0,sometimes you just need a friend
0,"USER well true that, mad that it HAD to be vancouver though, hate how things wokred out that night  AND ATL DIDNT COME OUT"
0,USER Actually? I just looked and realized I am on song 29 of 30 and soon I will have heard them all. Want more.
0,Hit my knee yesterday. Expecting major bruising...
0,USER Damn I wish I was going to PAX this year
0,I don't feel so good...  Hope to get better for work's sake!
0,"USER About TSCC, it grew on me. I had to watch the 1st season twice before I got it. Loved it by the end . . . . Of course."
1,Heading to the Austin Aztex season opener against Minnesota Thunder. Looks like great weather for the match.
1,I saw Caleb's little kicks for the first time this morning
1,Dance recital todayyy!!! 10 years at M&T this year
1,Estreando o Twitter
1,USER haha! Yay!
0,USER ... to breathe like on some kinda tube and mcm.. Kurusssssssssssss. Ahhh kesiannnn Jill.
0,URL  scared the fuck out of me with the title.. thought of Amy
0,ay! i think i have tendonitis in my right forearm...it'll feel like a rubber band is stretching and hurts every once in a while
1,"Ughh Boredom, I soooo DONT wanna do this!!...I`ll be good tommorrow"
0,Back in Gib.
1,"Watching Federer... and suffering, man! please dont lose! this year is the best chance to win RG!!! Nadal is out!"
0,USER Bugga! just what you don't need
0,"Wow! An amazing hour of sister talk on rain soaked roads of Parsi colony.  Damn, I'm going to miss her"
1,USER morning! Have u really been up the whole night?!
1,"okay, actually going to watch the TBS documentary now over lunch"
0,USER that's what i'm thankful for. and the same goes to you. i'm gonna miss you when you move.
0,USER Yeh ditto i think an Gona fail  i do rubbish under pressure !
0,USER thanks..  i'll try.
0,Going away for the weekend
0,USER Me either M-F That is my alarm clock
0,USER: what was the question about? transformers 2? cineworld isn't showing it friday 00:01am here.
1,"First time @ Moody Inc Saturday Sessions (Rumba Room)....Nice lil set up and of course will be back, FREE+DRINKS=ME"
0,bug me when people spam!!  ugh
0,"USER  Usually there's not much I can say to help, so that's why I usually don't respond...people do care."
0,"USER Unfortunately, she's an active role in the cycle too. They both need help."
0,Looking for some expert in C and Unix with NSE/BSE market connectivity experience.  Do we have them in real world
1,Yay my bf is on twitter now
1,USER I watched it already  And I dont really like it 'cause there isnt any close ups of yesung :3
1,USER k done! I will start figuring out what day! Mmm BBQ... USER ps you're coming! Then u can meet the alien
1,USER a new guitar but I say we still go and bond and catch up if you'd like so let me know.  I think I shall go text you now!
0,"I tend to use photoshop for everything these days, I almost hit compose in it"
0,USER    stare at candace for a bit. I'm sure she'll do something that will distract you.
0,"USER - Sorry. Yes you are right, but you have to buy credits now to use the service. It is no longer free"
1,"USER lady gaga is awesomeeeee. i listen to her cd every thursday in my carpool, ha"
0,"USER i love RPGs / sims & strategy so why it is I could never really ""get"" The Sims series?"
0,USER I've been working 3rd shift 20+ years and hate it when they say 'Good Morning' when I walk in at 2300!
0,"are spammers starting to spam tweet in addition to just following ppl?  that surely spells the end of twitter, know?"
1,USER What recession? My company is growing faster than ever  URL
1,stupid stupid school taking away my social life. CAN NOT WAIT TILL THIS WEEKEND.
0,"USER oow dear, i know but hey come here today \o/ amanda forgot it"
1,Does Iron Chef ever really get old?  I think not.  Night!
0,USER another similarity ... Both off school today!  hope u feel better
0,After party cleanup
0,missed the ultimate fighter finale  damn you direct tv
0,Watching the Giro wishing I had a pink Giro hat right now  I'd rock it all day on this mothers day !
1,Just now leav'n funny bone. The GM let us stay there all night  Lmao...good to know worthy people. On my way home  all the drinks and fun
1,i had a dream about tiaras and sashes.....     xoxo erin
1,"USER Yes, it did."
0,"England just let it's skies open. Hail, Thunder, Lightning, Rain. WOAH. I can't even see out my window it's so yucky! i'm scared!"
1,Going 2 bed now. Good night everyone.
1,USER USER have you heard USER preview of his remix of that??   URL
1,good morning
0,temporarily deaf in my left ear  hopefully just temporary lol damn shotgun lol
0,USER oh yarmes  i will give you food tomorrow you poor thing!
0,My laptop is still broken
0,My right eye is kind of red. Have 2 wear my glasses 4 the rest of the day.
1,I can't wait for HOLIDAY.  let's get tan-ned.
0,USER good to know because i am terrified of thunder
1,via USER: thankyou so much for the follow  namaste
0,Fuck! I didn't know the Freemont Solstice Parade was today!!    URL
1,Might read some (or alot) manga before I lie in bed. iPhone manga
1,hi there!
0,USER i slept till 10 as well  i never do that!
0,Can somebody tell me why can't I see my Friends or Followers list?
1,USER I'm having a ton of fun with this novel.  I hope it makes people happy! *crosses fingers*
0,"USER you guys are lucky. we dont get done till may 15  but its all good. and wow, cobb... i smell your pain..."
1,is back in the 5 oh 2  nashville in the a.m.
1,Why am I up so early? Yesterday was great! Syttende Mai celebration was so much fun!
0,"there was a bird in my maths room. feel sorry for it, everyone was screaming"
1,"""is this real life? ...why is this HAPPENING to me? ...is this going to last FOREVER?"" the innocent words of a 6yr old hold true even now"
0,Fuck my gums. And fuck having to fill out paperwork so I can't go to elitch's
1,Carlo got me all set up on Twitter so y'all look out.
0,"USER Morning , haha. I have to leave soon  #asot400"
0,i hate admitting it but i really miss her   oh regrets. only in this case i didn't do anything wrong
0,USER i was afraid of overfeeding mine as well lol but I guess that's not the case. I think by the end of tonight all my fish are dead
0,USER Ouchhhh. That sucks
1,"USER I was leepy this morning when you left, so not sure if I said this - Happy Birthday Bloke"
0,praying for those in that plane ... praying hard.
1,We haven't even been off a week yet and I'm already in full summer mode.
0,doesn't want to leave Star Records yet.
1,USER I have more than 100 pics on my NKOTB community page though....You should check it out!
0,USER tht sucks!!! i know the feeling! sorry  let me know if the movie is good!
0,Really hate being awake when everyone is sleeping. Miss my babyyyy.
0,USER: no.  graduated.
0,USER I'm still waiting   Will I get a text when it's done?
0,"having drinks with mom in edmonton , last night here  sad times."
0,.USER you have to work on Saturdays??
1,USER hey pip  . are you okae 8-) ?
0,I cannot sleep since he left. This royally sucks. Ice creeaaaaam and couches
0,USER ohmygod! are you serious?! i'm so sorry!
0,farkk i miss mcfly being so young
1,finishing the COLLAB !!
0,USER Omg I'm SO sorry for your loss  my thoughts go out to u and ur family
0,You will be missed little one
1,USER Unless you want the blog deleted then I am not posted it
0,USER Critical Thinking! Its the worst ever
0,USER thanks! hahaha I bought cigs today & the guy said I looked 17  prob the bangs.
0,"USER this is why I follow USER lol. .. nah I'm not watching, internet connection prohibts   When r u gonna watch?"
1,USER what's up with your iPhone? Maybe you can beat some info out of them about the rumoured next iPhone?
0,"loved last week.... such a wonderful week, but sad it ended!"
0,"USER you make it sound so easy but when you mix that w stress, pms, school, work and not having a partner to help me..it's so hard!"
0,going to be miserable with my USER
1,can't wait to go to fiesta texas
1,Evening crafters! Hope everyone had a great weekend.
0,Finna get back to work. These long nights and early mornings have me discombobulated. Seriously.  I didn't know what the date was
1,USER Yeah. But both kinds have smth in common. The brain become useless for a while.
1,"USER not a problem, bro. don't let it bother ya"
1,USER i love you and hope you're having fun!  i am
0,"there's no damn single numerical list, it goes page by page with pictures  this is going to take awhile to make the list myself ugh lol"
0,Just when everyone's all together again James goes away tomorrow for a month. I'm going to miss him so much
0,no gloom or shadow
0,USER havent tried that yet.. only had a few minutes to play on the macbook at home this morning and cant run tweetdeck at work
1,USER YAY you should  they're awesome
1,USER haha they had some classics
1,"& Sari recommend ""My Life In Ruins""! 4 thumbs up!"
0,"USER they mama went to get them food and they became food, id die if someone just ate my doggie Oh Em Gee just the thought makes me"
0,Oh god I feel sick with nerves!
0,An 8 year old called in and requested birthday sex on 92.5 hahahaha. He probably gets more vag than I do...over ruled
0,The old folks tale where you dreamt abt u broke your teeth means u'll lose a relative or close ones is 'true'
1,URL all moved in to our Gurnee apartment
1,"Good morning ""Tweetybirds"" ! A new day to be positive! God is good! Now, let me start off right with some cappucino!"
0,USER I think USER had said they weren't allowed to mention twitter
0,youtube sucks tonight. internal server error
1,Hoping that AShley T. And Taylor Lautner will get a Movie Award  and just relexing
1,USER I will look for your book
