1,PM #7887 (IMAGEZZ.com) said: Work it! Work it!  Hope all you lovely beasts are having a great night   URL
1,Diamonds are the best suit  don't care what anyone says!
1,USER Will try!  bit warm today though
0,"USER u have no idea how much i envy you right now, i seriously h8 having to wait on new episodes, and when the take breaks, aar"
1,"USER Ha! No, Tuesday is a person, a tatooist who I'm secretly in love with  well, not so secretly actually..."
0,USER I did... and the cat answered....I didnt know what to say after that
0,USER I miss you too! I'll be back in like a month or so! P.S. - I used to love getting bonus checks too but I don't have a job
1,USER its fine
0,"straightening my hair, and cleaning my room"
1,"I do love TSN's intros. Not as much as CBC's, but they'll do! And yay, my 900th tweet!"
1,We ALL love you.
0,USER Aww you do care  you missed me. Still no birthday card though
0,USER i have 5 years sales experience. but i don't live in LA
0,"Wtf, TweetSharp, give me some documentation"
1,USER  That'll be fine. 6 sounds good. Thank you! (really really appreciate it  )
1,USER I'll cheer you up boo... lol
0,Ahh  Time for me to have a stress meltdown!! I'm gonna fail English and Drama  WHY didn't I do all this stuff earlier :'( *swears lots*
0,USER we love you!  And only wanted to do something nice.
0,bit disapponted with new DM album. Hope it's a grower.
1,in Long Island wit my cousins & friends
0,going over to anthony's finally...it's been 3 days
1,USER LOL sad. Don't you have an emergency stock hidden in your cupboard? I have one  .
1,"Saw Star Trek yesterday and Wolverine today....loved them both, Jackman abs and ass and Spock ears"
1,USER Great! Thank you  Try French Hill Farm for camp also.
0,RIP bumper...you'll be missed
1,USER Have u been a fan of ER since the beginning? Those alot of years!!
1,it's lovely and sunny now
0,is in bed with the cold booo
0,cannot sleep.
1,"USER Hahaha, I know right!"
1,I could watch Batman The Animated Series all day.
0,"USER I'd hug you, too!  Poor Frumph....."
0,If anyone's interested in doing a tech/culture type podcast w/ me email me at marieDOTboranUSER.com. I have ideas but no AV equip
0,I don't know how to work this thing..... BOOOO
1,"is wearing flipflops!!  it is so happy! ahah, school till 11 then joe's for athea's birthday lunch! <3"
1,eating ice cream
0,"USER thankyou for an awesome show tonight, it was our last a-level so especially epic lol, though sorry that Harry hurt his hand"
1,USER Jacob! How are you?!
0,USER USER  we are looking through Ali's iPod.....
1,at the Y enjoying an amstel then out to Corsons Inlet to fish with the boy$.  URL
0,making a new blog. I couldn't find my old one
0,Joey's gone to bed.the house is calm and quiet. I miss Emily.
0,immm goin crazy. i dont even know whatt to do nemoreeee...............hmmmmm.....puffffff...pass gulp.      l0l
1,have done the photoshoot for my secret project with USER and nurul
0,is at work. booo!
0,USER wtf?! That is a goddamn shame.
0,twitter is still not working on my phone  what will entertain me at work? jasooon fix it pleassssse
0,Had a nice time @ my brothers! But I've got a migraine
0,Apparently iPhone software version 3.0 doesn't magically become available at midnight on the 17th
1,USER hehe true. i wonder what he will come up with
1,USER Hilarious.
0,Taking all the stuff down off the walls -- the roofers will be working the next few days -- looks really bare in here now
1,wow so danny's gone and its btwn kris and adam? adam's gonna win hands down fo shezzay
0,USER i knoeeeee bakal gila gilaan nihhhh. iyah gw baru beliin mantan gw the sims 3 dibawa ke indo.. jadi ngilerrr
1,"USER Hahaha I wouldn't call it nesting, more finding any excuse ;) and go you!!"
0,USER  think i'm going to give up on him when his going to like me it going to be late
1,USER nice to see you at Twitter
0,USER don't make me sad. my mom had surgery weds. so i'm the only one to like take care of her. i didn't have the heart to go.
1,USER good to see you're as stoked as me
0,Packing sucksss... Last real day at XO...
0,Xbox live is down and i was having fun playing halo
0,isPlayer Has Died! Sorry
0,USER i got the 3G in March
0,"USER u cook? i dont know what to cook, im sooo hungry right now..."
1,"USER So Close is a pretty amazing song, are more coming?!"
0,If people are having loud sex...am I a perv to listen in??....I'm gonna miss having room mates  lmao
1,USER well that changes everything! Hehe
1,"Great party, great people.. Nice of the cops to show up to"
0,Tony is finding more and more gray hairs in his beard...  Ima start calling them silver I think. ;-). URL
1,USER Haha! I know  those pups are damn cute  I went all awww when I saw the pics  Eat well!
0,i am doing nothing at all..
0,USER herniated disc...and it's extremely bad now
1,USER can i beat da betchs ass up fr danny  puhwezz    ~~la gummybear
0,USER It was! I just saw it a couple hours ago. It made my mom and I cry.
1,USER uh huh yeah right!! jacob is like to die for!! & edward still doesnt have a heart  ahahhaha
1,USER if u are still up in 20mins we can have a chat on Msn
0,USER I broke my bracelet  The bell hopped right off it
0,glad to be done work for the day...worried bout a friend tho....didn't look to happy today
0,just woke up  kinda not feeling well... URL
1,"USER We can agree to disagree on spam issue and ""phenomena"" of online gaming mob rule.  (written by WoW habituate)"
0,USER taking ages
1,Ya y - flowers are all planted; storm's rolling in; time for dinner!
0,doing something this morning I don't like to do....coloring my hair.
1,USER USER hahahaha! good question.
1,today i've completed all my legal and psych homework  i'm currently doing my health homework trying to get it done all tonight!
1,#seb-day #seb-day #seb-day #seb-day #seb-day #seb-day #seb-day #seb-day #seb-day #seb-day #seb-day #seb-day #seb-day #seb-day #seb-day
0,I've had a headache for a week. when will it end
0,"USER  cool thanks!  That would be fun!  Usually it's on Fox, but not this year   today is the last race on fox for the season"
1,USER hahhaa that was lucky  we wouldn't make very good travel buddies would we? BA are rubbish they don't seem to like me very much
0,"USER I KNOW  there needs to be a ""Year 2"" hahaha"
1,USER New moon
0,USER Happy Birthday Matt! Sorry I didn't call you earlier today. My phone is broken
1,USER hi cutie  welcome to the twitternation
0,USER I wish it was that easy
0,The good news: It's not swine flu lol. The bad news: He's still waayyyy too sick to be traveling so vacation officially canceled.
1,USER Thank you!
1,"USER you should be wasted. It's a birthday party, drink up. haha.  See you Aug 24th   xx"
0,USER You may have some shrimp... as soon as you help cut the heads off the poor things
1,USER 'monotonous' is the right spelling
1,"USER , it true other way"
1,I have finally mastered the pen tool in Adobe Illustrator!!!
1,USER If they do can you send it to me too!
0,Getting ready to go bail some hay tommrrow.
0,Monday Monday Monday...
0,i only can go online in school
1,martin starr was brillant in ADVENTURELAND last night  id see that flick again in a heart beat
1,USER yaya  if i give you a cd would you burn it for me ? pweaze
1,USER You're welcome
1,USER YEA!!!
1,USER All are well.  2 grandbabies now and the twins are graduating HS next Fri. My little Emelina is 5 and awesome.
0,She's on her way back to Des Moines. Sad faces
0,"toilets are blocked at work, I have to pee, badly"
0,USER sad times...just when I thought I wouldn't feel like the fat kid not getting chosen for the dodge ball team
1,USER let's try again next week shall we
0,Didnt get to see my bestfriend tonight...
0,USER not enough
0,.sigh. woke up late. where did my day go
0,sittin at home realy bored..missing my baby  love him sooo much xxx
0,USER and the nudity...don't forget that  i watch old episodes online and realize how ripped off i was a child !
0,"USER Numbers on that Stand Down site (URL are outdated, btw - even more homeless vets now."
0,USER maybe because of nick. i dunno  miley's not following USER anymore either
0,"AAAAH it was a PERFECT dream with jonas brothers, so USER woke up me  hate u girl grrr, UIOEUAIOEIOU"
1,USER
1,bathroom is clean..... now on to more enjoyable tasks......
1,"USER I will always love u Brandz you bought me pizza, let me mess w/ your equipment, sing to you, and I beat you in Street fighter"
0,Sittin Here Watchin My Sisters Get Ready To Have Fun
1,"Fancy a cultural night in with a film?  URL  Excellent film, English subs might help"
0,holy cow! staring at this darn screen is giving me such a head ache  Hopefully this day flies by because my head is going to explode!
1,"USER LOOOOOL ati always excited? i'm a better actor than i thought, apparently  I'm alright, hopped up on ice coffee. yum! you?"
1,USER YOU ARENT DEAD!
0,USER I won't make it tonight since I still have a shitload of homework to do which is supposed to be ready on Wednesday
1,"My Twitter profile is worth  $249 URL oh yaa Karol, I'm beating you!!"
1,Still tired from last night time for bed  maybe babysitting early afternoon then going to the circus at 5
0,What a gloomy day    Cricket is on though so may be able to watch an England Victory in between the odd bit of work...
1,"I turned my twitter back on.  On my way to San Antonio. Riverwalk tonight, Fiesta Texas tomorrow, and competit.. URL"
0,USER reportate
0,"first aid courses are ï¿½250  really want to redo mine, but i'm not sure i can afford it at the moment"
0,Wow!! what happened to those guys on trouble in paradise is scary
0,ii must have aint the wrong thing cause ii feel HORRIBLE!
0,Morning tweeters. It's a bank holiday here in the UK so naturally I'm wide awake and up already (yet another night of very little sleep
0,my sister woke me up at like 7  im tireddd. i hope today is fun...
0,Shoot me now! The copier stopped workin! Been sittin here waitin for sum1 to come fix it for the past 20mins!
0,Facebook keeps throwing errors at me when I try to accept charity invites. Guess I'm not allowed to be charitable.
1,listening to the fame.. the entire album is a hit! i love it .. go gaga
1,USER Happy Anniversary
1,"USER not yet, but looking forward to great weather!"
1,"USER yeah, like everything he writes... it's just always weird to get back to a world without talking cats and unicorns"
0,USER Hang in there. Catching up sucks.
1,Official GLOBE user na ulit!
1,"USER No wonder you're so sweet, then!"
0,USER: why the tears babe?
1,USER what does ding dong ditch mean? sorry for now knowing.
0,"wishing everyone (including me) wasn't so busy all the time, because i never get to see the people i care about"
1,USER Thanks Jim.  How are you? Got anything fun planned this weekend?
1,USER hey! guess what? I slept through the night.  thank you. How did u sleep?
1,"USER Does it come with chips?  Are you coming to the ETO Show? If so, be sure to say hello. You can't miss me. Tallish, bald, camera."
1,I just got back from tennese on a vacation!
1,USER well I'm for sure not that!! So I look forward to seeing it
0,revising for exams
1,"Love song for the night, in honor of USER MacIntyre Day, ""Just The Way You Are"" by Scotty Mac   Love & Light ! Joy WA 31"
0,USER In line for 1 hr!+ salesppl said codes not in the system to allow 3G -> 3GS at subsidized pricing & unable 2 reach rogers!
0,"Happy Wednesday, everyone! Reading some reax to HR1109 from back home...it is THAT bad."
1,USER Awesome stuff BJ.  More of Tom Dwan please
0,Morning world.... raining.
1,follow me
1,"USER for some reason. the ""exclusive presale"" link See emailed me - doesn't work, and no one else knows about it lol. Morning"
1,USER aw JONATHAN. twitpic is jealous because they're not you
1,USER Even though ana ma adri shno is this job bs what you did was just great... i love that about you
0,"Not feeling too well at all  whole body hurts, no energy...getting some sleep."
0,Full of fear right now.
1,USER we'r planin on going nxt mar/apr 4 the boy's bday i'l c btween now/then if u guys mite wana go?
0,So tired. Work today.
1,"Items on my To-Buy list: jeans, heels, eyeliner, and a graduation dress"
0,"OK, so I load Parallels and migrate settings from VM. C3D license is pooched."
0,"*thinking what to do next..Financial Theory Homework, Building Assignment, Risk Management assignment oh & Fractional Interest"
1,How dare it rain on my parade.......morning
1,Beau just cooked.. lemon pepper chicken spinach alfredo pasta  mmm.
0,USER Unfollowed me? Or USER? Please not me!
1,USER USER Jennie wants you guys to follow her   USER
1,31 days until the Jonas Brothers/Honor Society concert
0,"USER same, i wanna go but i'd end up skint if i did"
1,Finished my first meeting. The client liked my proposal a lot. Good feelings
1,USER I think Caroline?s oldest one.  He has a great smile.
0,why is it so bloody expensive to get off this frigging island in Summer  If only we could drive away...
1,Hello beautiful people! What are you planning to do today that will make someone smile? Tell me
1,"USER what, you sleep with your clients?!? People remember their first love, their first  backseat of a car, but their client? Ugh!"
1,USER everything has a twinkling fractal nature.  Takes a quick eye to see it
1,USER I just noticed your twitter bio. Very cool!
1,"USER we are on Twitter too, trying to find other PHP-Fusion users!"
0,USER I resent that!
1,USER what's goin on miss ego!?!?!
1,USER USER USER Thanks.  I think I will- just a little editing and I should have it done-
0,HELP THERE'S A SPIDER  + 600th update lol
0,I don't get vegetarians. 4 my 2nd day meat/sweet fast I had salad 4 lunch salad 4 dinner and broccoli 4 desert - doesn't feel like I ate
1,"USER come baby,come  I want to know the news you said you're gonna tell me :X"
0,"I canceled the Self-Control workshop for today, rain"
0,I'm worried about my mommy.   Her mammogram didn't look good & she was referred to a surgeon to get her results and discuss options. Ugh.
1,Go treat your mother's right today  <3
0,Just got off of work!! Gotta get up early to check on my uncle at the hospital!! Hope everything goes good for him!!
1,USER Good luck! I'm sure you will do fine  xx
0,lol I just realised I kind of look like shrek in my iranised icon
1,I'm good thanks busy working through my list of thigns to do  USER USER USER
1,Going to shoot hoops. be back soon.
0,USER Nope just single player
1,USER But of course! I think I'm going to break down and get some yummy chocolates to... sometime in June.
0,waking up EARLY bc of a FAIL last night
1,USER I never lose! LOL. Okay did sometimes.
1,"USER that contest was a good idea! You should do more, so I have another chance when I'm not at work"
1,my 30th update yay
0,Fuckin work  I need a beer
1,"bom dia  ... lindo dia, by the way"
1,THE SCRIPT:Before the worst. Ther back  How i've missed their irish accents x] alls right with the world again. Its now officaly summer
1,"USER Yay! If USER is gellicious, I am Cherrylicious! =P Sana ma-meet namin kayo."
0,someone forgot to remove the pin bones from this salmon.
0,USER except the fact that I have to work.  no cruisin this year.
1,Working on a Twitter project for an upcoming tradeshow...love mixing work and play when I can.
0,"USER love you, brother!  miss you.  i texted you, but you didn't answer."
1,Love the pink panties  URL
0,blog updated- www.angelaminicuci.wordpress.com Rainy in Roma
0,Why isn't this working
1,USER mike jus share ur exp with me dude am jus 21
0,I need a massage or something
1,"Ok, too much downer news today. I'm posting about organic savings tomorrow!"
0,Tammy and Krystal e lafing at me  not funny
1,USER I had a few. I'm not driving. But I am seeing double. Good times over here.
1,3 miles in the pouring rain...euphoric
1,there is a really cute mexican guy at work.
0,Haha. Yeah.
0,USER YOU FORGOT THE X'S AGAIN IN THE SECOND POST. It does.
1,Just completed Rolando
0,kh? thï¿½n nï¿½ng... cï¿½y ti?p ?i nhï¿½  nhï¿½n ?nh giï¿½ ko ch?u ?c.. d?o nï¿½y c?ng trï¿½ng x?p x? ?.. l?y nhanh ko ? :<
0,ugh damn! my usual babysitters graduation is on Wednesday and I just got a meeting request from my boss during her graduation
1,I just stayed up all night watching Buffy the Vampire Slayer. Why? I have to work all morning. That was dumb. Season 2 starts at 3pm!
0,USER I knoooow!! I hate being so far!
1,Chuck Playlist: Christmas TV by Slow Club. From Chuck vs. the Ring  #chuck #chuckmemondays #lovechuck
0,Trust me to get a cold when Dublin's finally having the best weather ever  Brittas Bay tomorrow? i'm thinking yes
0,went to run a 5k in honor of Daniel Wultz
0,Does anyone know how to get your email account un-blacklisted? Hotmail/yahoo/Gmail & some others keep bouncing my emails back
1,"Hey tweeps! Glad to have all of you as friends! You brighten my day, and there's never a dull moment"
1,USER I voted for the Barista quote - Inspired!
0,"and back from the bbq, Coley had a blast! Brava light is yummers! too bad I had to drive, Coley wouldn't sleep over"
1,USER Hanging out at the gate...come say hi?
1,USER Im not even going to comment on that one lol Just know i like it  Hope to connect w/you again love..Dont forget about me..Muah!!
0,i only got 19 followers now    its happening again!  im gonna lose all my followers again!  lol
1,USER Thanx! I'll take a qik look at it
0,its too hot to sleep! Not going to be in the best of moods at work today
1,"How's everyone's night been going? Good, I hope?"
1,"USER Last Thurs was my first time attending Faith Builders, and it was awesome! Looking forward to coming back this Thurs."
0,Tring to get over my jet lag after 2 weeks in the USA. Back at work already amd hols already fading into distant memory
1,"USER haha yeah, one day i'll overcome my sissy arms"
1,USER I'll let you know what time I need wake-up call
0,tried to help save a baby bird ... i guess i will have to let nature take its course!
1,Am thinking about meeting a rich man and becoming a house wife
0,USER I have 12GB of music in mine - don't even want to know how long it's gonna take for everything to update.
1,"Excited for Monday (that makes me VERY strange doesn't it) Also, in 45 days my credit score shoots way up....feeling blessed"
0,saying goodbye to Charleston and my friends
0,I wish i was at the strawberry festival right now
0,USER i tried to im you but it wouldnt let me
0,Walking around the house. Nothing to doooo.  I asked my dad for an M&M McFlurry! Waiting for it now.
1,"USER very well, nothing flash - but different to chocolate 4 a change. good 2 meet U yesterday  gr8 atmosphere & discussion"
1,Just finished some homework. Now it's time to watch some NASCAR
1,"Oh, btw, I'm lovin' OTH more, great season finale!"
1,USER sleep well
1,USER hey vanessa how are you
1,kick off your shoes and relax your feet
1,USER  we were @ Paradise Sushi - my friend Chef Dion made 'em for us!
0,"USER what does it mean, I have no idea lol. well done you, Im on graphics"
1,"USER wow, when here night its day there and when hr day its night there. Lol"
1,"I think my brother is going out late again...ugh. Whatever, i'm in the mood for Owl City! Who's with me?!"
1,Congratulations USER Paranoid made it to JoJo's top 9@ 9 whoo hoo
0,"USER she didn't, eff off  I was about to sit next to diana, but zac efron keep holding it and the movie suddenly done lol"
1,"love taylor swift's song titled ""i heart question mark"" so much."
0,At the gym. Pup is okay but needs eye drops and week off daycare for leg.
1,USER Happy b-day to ur mom
1,Fuddruckers with USER
1,Singing in the rain! Maybe not singing but it is raining!
1,"Listening to How You Live, by USER. Makes me smile."
0,USER Its very tough isn't it I'm virtually picking people up and shaking them to get every penny out! V stressful
0,USER oh dear - hugs to your 4yo
1,Is at school painting her nails listening to jls beat again
0,USER Aww man. I'll be up there the week before that.
0,This Jon & Kate ish is out of control.I am SO sick of it.Feel bad but prbly gonna tell Allison she can't watch anymore
1,I swim for 1 hour today!
0,USER your bored I'm doing book keeping
0,USER I need Chinese food.  Serious.  Craving & last 2 nights have been Chinese Food FAIL   lol
0,Got school in the mornin then laundry n a dentist appointment  hopefully my sunburn turns into a tan soon
1,USER Transformers wasn't that good -- it was decent -- but not Top 100. That said you can find another movie to avoid work
1,"USER ROFL right now b/c I'm tweeting about u w/o ur username & u can't see it! (Take me back!!!!)  (I know, maybe tomorrow.)"
1,"USER heyyy! I'm one happy camper at Cisco! Changing the way we live, work and play!!"
1,USER Welcome home.  There's a cool breeze where I am in Stafford
0,Sad that we won't be able to get together to make the movie this weekend.
1,USER LOL im not even kidding. were like sooo alike. i even look like her. and my friends call me miley
0,"back from the beach  miss it!!, in orlando now!!! gunna chillout tonight..hopefully have a lill fun hehe. if im not too sick :/"
1,Awh good ol Celine Dion will do it
1,USER wow thanks  we share <3 for wisin y yandel. glad we found eachother
0,miss my earring  going home earlier in the hope that the store is still open....
0,USER im goin to kelantan tomoro.. got weddings to shoot..
0,in the mall getting ready to take pictures in a mall
1,It's 1:30 in the morning...it's freezing cold...BUT IM HAVING SO MUCH FUN haha I love my friends!
1,"going to bed, goodnight my fellow tweets"
1,"Thinkin about going to watch that new movie ""up"" looks cute and funny. it got 4stars... good sign"
1,"USER aww, shucks, thanks for following me!  sorry i'm not as interesting a twitter-er to follow as you are..."
0,USER  sounds like a fab show but am out seeing Russell Howard I am afraid  You need USER defo ;o)
0,is worried about her grandma
1,USER Thanks
1,"Shoutout to big sis . . .my number one hater! Because of her, I stay lovely"
0,I miss the abundance of readily available climbing walls in England
0,USER ahaha atleast your doing something  lonliness can kill
1,"mmm, dinner smells good, I think I should call it a day"
0,just saw an ad for rush *tear* I cried so much last season
1,i dont know what to do ahhh :/ but oh well. emmas home
0,where to start from
1,I have to go now - speak to you all later... In about 4 hours or so
1,USER URL - lolz nice
1,Fucking twitter
1,Walked away with a DVD player and a ihome from the all night party....yeah buddy rollin like a big shot
0,not looking forward to my math final today..
1,I am def. not able to handle this all at once.....  Getting ready for Emily's showing up tomorrow.
0,why don't i show up as a follower on someone eleses page??
1,USER  olÃ¡a!!!!!! vÃª lÃ¡ isto www.ideafixa.com
1,"i have to get up at 830, shit. i'm still in the best mood ever though. mayday parade august 9th in syracuse, no questions asked <3  night."
0,Is it more wrong that a) biochemical journal refers to its website as 'bj central' or b) I giggled about it for a good 30 seconds?
0,Needs to fall asleep but my mind just won't let me  had a difficult day and now wondering what tomorrow holds...
1,USER defo  got a nice dress  x
1,anyone suggest any more interesting / funny people to follow?
0,"I love USER!! Office is empty 2day! USER, USER, USER not here 2day so Im all alone!  where r my friends?"
1,Good Morning ... hope your day is good!!!
1,wow twitter is addictive!!
0,USER Is this the first time you read this...today? I thought u saw it last night ... I am sorry.
0,Maybe my asthmanex isn't working as well as I thought. Needing my rescue inhaler again this morning.
1,"Off to my friend's house to do school work. See you later, followers"
0,USER I want a JavaScript day  all i have today is PHP
1,USER Thanks dear
0,bored.. & i hate this taste in my mouth.. BLEH! i need to hurry up & get better! everyone's going out!!
0,is getting her wisdom teeth out tomorrow
0,"USER oh gee, I wish I had.    I've just started digging into understanding it."
0,Man I think I just got a virus on my computer.
0,has a baby that likes to sleep all day and party every night.
1,USER That is a very nice sentence. But I think those guys would jump from anywhere hehehe
1,USER I'm so buying it now and setting it as my ringtone!
0,USER it on right now  cant wait till mondayyy!
0,USER Are they making you return the shopping ?
1,Majlis Citra Karisma selesai.  Smooth flowing production.
1,"done with that psychology.  SAT, bio, history, breaking bad, san andreas"
0,doing units... and they suck
1,"great band, great name  URL"
0,hmmm... my sweet potato fries look ugly  but strangely are tasty. maybe it's the cinnamon.
1,"USER Been there many a day with Matt.  He'll play in any temp & thinks it's fun for me to drive him around!  Fun 4 who, I ask?"
0,depresseddddddd ((( eatin strawberry dibs  i hate emotional eating
1,USER OOC: Already done.
0,"USER doyle got a chip and a chair, pas de 12eme bracelet"
0,Oh my goodness!!!! Cute shoes!!!!!! Sigh there goes my bank balance
1,URL - my sister did that for me
1,WENT BACK TO MY OLD HOUSE TODAY. FIRST TIME IN YEARS
1,USER Its very long bahaha. ;p Sorry
0,USER  that made me cry.
1,is ready for bed! Nice day of painting tomorrow...blah..followed by watching Stephie play sand vball!
0,"after almost over-stuffing myself at McDonalds... wondering where have 2 burgers, 1 med. ice tea and medium french fries vanished"
0,Had a blood test today.   Wasn't too bad really. Needed to dash 2 Starbucks after to revive my spirits with a nice Iced latte & a bun.Yum!
0,Just left a horrible day at school!  but ready for the weekend!
0,"USER you need another holiday already, ha? It's been ok, just been seeing uni friends lots before they leave brum  sad times x"
0,"Baby cousin is sleeping, now I have no one to play with  wake up kynnedy..!!"
0,"USER Toooooom, I just want to say ... love you, I'm a sweet hahaha"
0,"USER lool same!, cant wait its all the way in novemeber tho"
