0,Oh epic work fail. Also KAs still need to be incinerated and doctors suck 
0,is revising for her exams... is revising das polistishe System Deutschlands 
0,Very annoyed about this game. I dont think its installing.  
0,Jackson's not feeling well...boo to that 
0,Can't bring my CLEARBOOK !!! 
0,I just broke up with my boyfriend...... all I want to do is cry... 
0,@Jenty  I must admit that I would be too fearful walking through there....and then probably upset by what I saw. Well done 2 u!
0,@NaiveLondonGirl Still no sex though 
0,"i miss HK, screw swine flu for being such pandemic  i want my disneyland & highways & flea markets... i want HK back!"
0,The past 13 hours have been the most hectic ever  thank God for good friends <3
0,back home. still sleepy  off to work to make some money today!
0,"@Kogenre crap, im a week out on the geek meet ?  i guess i have been quite distracted the past week, doh #kilaumeet"
0,"Chief had to be put down last night! sad, sad night! "
0,"is in a sad mood today..  I hate feeling this way. I have to work tonight, but Im almost done with all the computer work! YAY"
0,"Good morning...work today  tired from last night, but it was fun...anyway how is everyone?? I miss u all"
0,I'm up way too early. 
0,"Footy's over, back to work "
0,"going to soccer game, in the rain "
0,Track meet  im to tired for this mess!
0,I can't sleep...it's only 3:25 a.m. here right now 
0,is not having much success with her Garage Sale.     
0,ok what i said earlier ain't gonna happen  i was so close! Oh well i guess that's life hahaha
0,Felt great after Tue and Wed training this week.  Feel crap after tonight though.  My right shoulder is killing me 
0,I don likey swiney  lolz hahaha WHERE IS EVERYONE?!?!
0,"Sniffling, and lonely. Great, just how I wanted to spend my day with you "
0,Back to work   boo
0,OMG RIP GRANDMA....I AM GOING TO MISS YOUUUU SOOO MUCHH OMG! 
0,"Rain, rain go away. You're messing up our yard sale. "
0,mom and dad out of town............  <3
0,Had fish curry for lunch today. I am still moaning over the fact that Vesak day falls on a weekday. Hmmph  I got to start my ppt.
0,@PauliinaP83 Yea I gotta work today  BUT Mom's Birthday Party is Tonight so I'll be Pretty Drunken after lol
0,i really hate my fake family now! please gimme a little space for my own life 
0,Loving the M25..   http://twitpic.com/4eg72
0,@withinwithout I will call the venue to follow up on my email to Port Merch yesterday.  
0,"went to bed at 4a.m., up at 9a.m. extremely tired and still not finished downloading my music for iTunes  i think i'm off to Sam's Club?"
0,@KKarthik nah.. not yet.. 
0,No marching today  our band parade is canceled due to bad weather... 
0,listening to music... its windy outside 
0, NICK BRAUN'S TWITTER IS BEING BLOCKED!!!!!! I LOVE HIM!!!!!!!!!!!!!!!!!! THIS SUCKS!!!!!!!!!!!!!!!!!!!!!!!!!!!!!!!!!!!!!!!!!!!!!!!!!!!!!
0,Thinks australia is boring 
0,Today would be the perfect day to be all cuddled up with someone.. Bummer. 
0,"Sun shining in my window, and i am studying  Currently looking at the unification of Germany!"
0,Left dog beds out on patio - rained.  Found 50 eathworms underneath. Collected them & put in flower bed covered lightly with soil. ;-)
0,@Braders007 aw you gotta help me... I don't know what to do... 
0,My wittle bunny friend... 
0,Everybodys at the March of Dimes 5k this morn except me!!   Im stuck working.... Have fun guys!
0,it's so sad that i can't sleep in past 8:30 on weekends anymore 
0,i suck at useing my time well 
0,@LittleLiverbird We certainly do!  Just a pity it hasn't worked 
0,feels better now that its time to sleep...  nite all
0,oh my god i have two tests next week 
0,WTF?!?! Boots have changed my fave king prawn salad  I now have sweet chillie sauce with it and no peppers 
0,"glad to know my family bought tons of gluten food for the birthday party, and I can't eat it. "
0,"@dottorblaster will check, I do not know it. it is for a laptop with windows. Tried unebooting, but it fails "
0,Hope evryone has fun at #pawpawty today. Mollyd has to take care of her grandma so no pawty for her 
0,is at work 
0,"@slatham100 : wish we could post you one!  Actually adoptions are going well,  but short of foster homes able to handle dogs w. 'issues' "
0,@pastelpastel hockey is the biggest bummer. Oh and taking notes in School could be tricky. 
0,"I just dropped my 3rd cup of coffee on the table, & it spilled all over when the cup broke  Had 2 clean up a mess. & i'm 1 cup short n ..."
0,@tommcfly i missed falling in love on radio 1 > and i haven't yet seen it on the music channels  cannot wait to hear it live in June! 
0,freaking bred & missing someone  <3
0,booo! can't go to @innocentdrinks AGM as clashes with Teach First SPLiC Summit 
0,"so tired, i said up till 3  and woke up at 7 "
0,Dammit! Was doing a blog post and the power went out! The ridgeway and storms don't mix together 
0,@roflsaurus bad news as well - the link doesn't work anymore - they must have taken it down... 
0,Man it sucks when you want to do something but none of your friends do 
0,bout to upload Saturdays vid  ...btw it sucks... 
0,@wyvernfriend its it though.....  My work bans everything. 
0,"I am wondering why it is so hard for me to sleep these days. I am so exhausted, yet sleep still eludes me.  "
0,I hate goodbyes. So much 
0,I wanna go back to sleep but I need to go to the bank so I gotta wait a little longer 
0,doesn't appreciate the effects of alcohol the next day 
0,"had a short look on the SIGInt 09 schedule (http://ow.ly/4OYa): too much social stuff, almost no technical sessions ... "
0,"@TraceyHewins ermm took it hour ago lol, and nope i aint hung over aint drunk in ages  lol,"
0,is confused????  http://plurk.com/p/rdshb
0,@Misssarahnoir first time here and so far find it to be stunning - am walking in history but... the men are not from Milan so not feeing 
0,"@MusicCeleb7 hah lol. oh sounds exciting i have like an hour and a half science test i think, can't wait "
0,sitting here wondering how my checking acct bal goes down so fast 
0,@Antionette2299 I didnt get any tickets in teh mail 
0,is enjoying a rainy day at home with the family. Soccer games canceled 
0,@RebelSean We had double the amount of rain we normally get in April. Another wet year here in Toronto 
0,@Buddhabar i need you 
0,Sprained my ankle.  Can't go to waterpolo 
0,has the hiccups and they wont go away 
0,crummy weather 
0,I wish I lived in America so I could go to Bamboozle.  So many amazing bands in one place!
0,I think im going to die today. Sounds better than feeling like vomiting. 
0,"Damnation, how come CSIA membership dues have ended up being �50??? "
0,...damn noisy kids doing coke in the park by my house.. I'M TRYING TO SLEEP! 
0,@xGabii yup still fluuish..feeling pretty shitty  but im sure ill be beter soon...how are u? <333
0,@whisperygenie I know  I'm on disc 4 of the X Files already...it's not as bad as I initially thought it would be.
0,ccache: not found #openmoko 
0,@Lipvixen Did your Curves Lady look like Summer Glau?  Knowing the answer is probably 'no' 
0,is planning on a great night tonight...too bad Kemal can't come!   I hate jagaaaa!
0,"@LemonpiY i'd be willing to try the ants right now, nothing else is working! "
0,Just looked at me @replies and i never saw some of ur replies so if i ever didn't tweet u back i'm sorry 
0,I lost my drumsticks (again XD) Where the hell are they! Why can't I just find tmy important stuff x( I'm tooo untidy 
0,lonely again...have no 1 to talk to..!!!!! 
0,@couturecori1  Boo on tummy aches!
0,"things jst kp gtin worse nd worse, y do thngs lke dis alwys happen 2me "
0,Lost my phone and a follower...what i do 2 deserve this?? 
0,I'm nervous....I haven't been for a spinn in over a month...I think I might die or lose a lung 
0,my stomach hurts  and im hella cold.  extremely bored to.  my room got boring. its boring here to.
0,Happy Birthday Noah!  one year went by so fast 
0,@JuleeKessinger without 
0,i thought when i woke up today my neck would feel better...definately not 
0,Montana horse slaughter bill 418 becomes law  http://bit.ly/bill-418
0,I'm a coward and a pathetic loser. No wonder I can't get any  guy that  I like. 
0,WOOT FOR TRAVEL PLANS WORKING OUT! but i'm going to miss London so much when i am gone 
0,"Around The House... Waiting For Matty To Get Home, I Miss Her Already! "
0,I lost my drumsticks (again XD) Where the hell are they! Why can't I just find my important stuff x( I'm tooo untidy 
0,@adamsconsulting  My younger son - he speaks of how he wishes he had a twin (I actually miscarried his @ 9 weeks.  Have yet 2 tell him.) 
0,No flying to Ponca City today for breakfast  Oatmeal at home here I come. Oats FTW !
0,annoyed that Time Machine doesn't backup iPhoto if it is running - just lost all my pictures for the last two weeks 
0,@surfingthesun and NOOB SHIT!! HAHAHA. omg. i miss jiaoraja i very long never talk to her alreadyyyyyyyyyyyyyyyy  ask her get twitter sia
0,Why do i wake up so early in every weekend  ?
0,It's Derby day...23.75 years of life and I've still never been to Churchhill Downs. 
0,@kristenstewart9 i saw you guys on E.T and i am pumped for new moon. although i still have not seen adventureland.  having fun in canada?
0,"i want 2 follow automatically every1 who follows me ,but how ? tweetlater demo is over  now waat?"
0,"Hm, Work at 9-6 with a 30 min lunch break. While my boyfriend is going to test drive and might get a lotus. Thanks responsibility. Ugh "
0,i'm going to fail this qrter i can feel it... 
0,@Caraandclo  same ere. but just dropped a full tub of jellybeans all over the floor. pmsl!
0,@ChipsterFL don't think I can make it  hope you get a great turnout for Newt!
0,Exams... Exams... Exams.. Wrote 2 papers of 80 marks each today. Fingers are paining.. 
0,catching up on my anoop fix. i miss anoop. 
0,off to work. 
0,@katietaty I hope your revising! Im getting ready for work dreading half 3 
0,wish i could be @ bamboozle. 
0,had a dream last night i was on daisy of love and i was the 6 person kicked of 
0,Hopping back in bed to see what's on TV...looking for something funny.  my son doesn't want to get up yet to play with mommy 
0,ahhh - sunshine...but that means gardening too 
0,"@Maddork aww, that sucks  "
0,Mojos on 49th and Dodge went out of business 
0,listening to sad songs 'cause i' m feeling alone today..  
0,This gloomy weather makes me wanna stay in bed 
0,1st baseball game of the season is rained out. 
0,soo tired. needs some entertainment though 
0,@ThisIsRobThomas Rob. Please say hi. I miss you!!!  
0,Why cant i ever sleep in anymore? 
0,i am soooooooooooooooooooooooooooooooooooooooooooooooooooooooooooooooooooo soz twitter i feel so ashamed 
0,@stephenstohn no! that's rather upsetting 
0,878 words?  It felt like more 
0,Eaten at mcdonald's ! My tummy is full of calories! 
0,I'm up early on a Saturday. I suck!  I'm really sleepy. 0_o
0,I miss Aya. & my stuffed toy which he named Bulca Chong. 
0,@riellaelise OH MY FREAKING GOD I HATE YOU 
0,"im writing my book, apparantly its something every good copywriter should have... Working at 6  boo"
0,I hate it when I mismanaged my $$ 
0,I didnt know Archie was on Paula O'Grady!  I shall now go onto youtube haha ;)
0,woke up with a headache.  I think I clench my teeth at night and that's what causes it.
0,Stuck on a lousy dinner with my cousin's family.god!they're so boring 
0,want to try Tangomonium today 
0,saying farewell to my bro - getting sent to Iraq - 
0,Just left kelsy's. Was epic fun. I have work tomoro nay 
0,@droccc I think I need to sit my butt down this weekend.. 
0,2:35 and only starting the day 
0,want cake 
0,twitter membosankan 
0,@iba_oshun I SOOOO sorrie ur not feeling well sweetie  Is ur baby there 2 take care of u?
0,@Tarzy I think mine lives 36 hours away 
0,"@willneal yea, "
0,My throat hurts like no other and all I want is my hockey god but it's not happening 
0,so fast the long break is almost over. . 
0,@marmitemania damn! u must have alot!!... ive won nothing  My mum or dad havent won anything this month either.. 1 always usually does!
0,Why are my allergies so much worse here in Va Beach??? Oh no! Maybe I'm allergic to Va Beach!!! 
0,@TraceyHewins omg very contagious #ChrisFlu aint good 
0,I am hungry but can't eat coz my stomache is killing me  I am seeing the doctor tonight 
0,@papertimelady running is my 2nd most hated exercise(ergs = death) but le gym is shut and i haven't lifted anything heavy in over a month 
0,@postsecret I don't think the link works. 
0,Ugh.  Feel yucky this a.m.  Coming down with a cold.   Have a 1st communion meeting in a bit - 2 hours?!?
0,no electricity...missed the match between Middlesbrough and Manchester U. 
0,I will be grading again today in the AM  Antiracism group planning meeting PM. What for 2nite? ? ?
0,Waking up from bad dreams  Wondering who it is was last night that wanted to come chill at the house tonight... hrrmmmm
0,@thejetset do you mind working away without it for a bit?I'm being called away by family members 
0,@justinberrier He handed me a huge spindle....I've got it covered...pray for dana...she's comin down w/ strep  she might stay home ton ...
0,Is in a quandry. I don't know what colours to use. 
0,"@_Gila yea, but minus me "
0,I want coffee! 
0,@feeru I demand to know who's this friend with a Wii becos I wanna join a Wii party when I go back to M'sia too 
0,"Headed to the river... but radar looks like some iffy weather around Knoxville. May be cut short       <""))>>><"
0,How the weather affects my mood..No sun til Tues now.  BUT two sunny 80 degree days by mid month. Why didn't I move somewhere warmer?
0,@JennPershing Hey! What self tanner do you use? I cannot seem to find one that works 
0,is SO SO SO SO SO SO SO bored! And its going to be like that the whole day!! whaaaa 
0,@inebriation  Try to have a good day.
0,"i wanna go cry.  i mean, bill looks sexy with him now hair. [: but it's different. TOO different. i want lion back."
0,@steveschoon Ew oh no! People fail. I was going to comment that Tuscan Express doesn't have a website. Boo.  And Schuler Books as a treat?
0,my boyfriend updated his blog.. after 6 months of abandoning it! *cross finger* don't judge that picture of mine he uploaded though 
0,I want bacon and pancakes 
0,@HelpHealthCare I'm republican. But I think Obama is in the right direction. Just my only worry is hyperinflation. 
0,"Woke up early when B left for work, can't get back to sleep  Why is it so much easier to get up on Saturdays??"
0,@undefeatedimage get on ichat if you think the same internet dc bla is being gays?  or just calllll/fb if you wanna chattttt
0,I moved bedrooms the other week and I put a box of CDs some where.. But where I don't know 
0,going to soccer this morning...had to bribe him to play...i think he's tired of his teamates 
0,watching a young HOT Tom Cruise in one of my fav movies.. Top Gun... its almost over... no good 
0,@JohnHoldun Thanks for the insight. I seem to be the only person who missed that connection. I hereby relinquish my JJ Abrams street cred 
0,on to other things. we need to go through temperature screenings before sitting for our exams now. that sucks. 
0,Fed up now. Nearly got hit in driving instructors car 
0,@ home bored 2 death 
0,Ehh I need to check my twitter more often it was like um 16 && 60 tweets . Ugh it's early! [not really] I wanna sleep a little bit more 
0,in sfarsit acasa.... obosit... m-am intalnit si cu @cart00n. pacat ca nu au batut recordul 
0,wishing I could see Tim and Jess before Prom   
0,geez.. I am sneezing and feeling damn thirsty 
0,@twinschick1  Ugh.  Been there.
0,and then the remake of it to come out!? WTF I am not THAT old am I???? It makes me feel really old?! 
0,@uhkaysha sorry I missed the prom 
0,@Bonelle Nah I got to do my work  what about you? xx
0,ughh communions all day... wish i was at bamboozle 
0,@inebriation   Try to have a good day.
0,"I had the urge to eat a banana. That's why I'm eating one right now, *chews* *swallows* My teeth hurt like crazy, and my gums... "
0,On the way home from dinner. Good nite even though I was sick 
0,decided not to go night swimming because the pool's curfew is 10  and it's already 9:30 so how's that fun:| http://plurk.com/p/rdurz
0,@miss_evaded I rewallt hated missing your set  And steph gettin up there... ugh.. I thought we would b outta there sooner that than 
0,Feels awful today!  so hung over! Funny night though! X
0,i hate waiting around all day just to go into work 
0,wishes her CLASSES wont start on MAY 20  http://plurk.com/p/rdusl
0,Market didn't have the pigs head I wanted for a photo  try another time #photogs #ldn
0,"oh my GOD the bogans on the bus today. I really wanted to punch them in the face. Feel sorry for the poor bus driver, he got most of it "
0,@raditsracquel Luckyyyy  I couldn't get off work today. Blehhh. Have fun though!
0,@ScottDavis get me a ticket for#startrek when you book bud. My mrs won't come 
0,pretenders didn't work  ? http://blip.fm/~5exzk
0,City girl that I am roadkill is hard to see 
0,"3-1 Celtic, a flattering scoreline. Tough being a Dons fan "
0,@CarolinaGyrl00 I'm LOVING the weather here. But I'm missing people day by day... im still HOMESICK 
0,"@PeggySheehy Wishing I was there with you, @annecollier @knowclue @artdabbler13 ... flight ACY-BOS only $239! Wish I'd known! "
0,ugh stop tweeting about bamboozle already. i am jeluz enough 
0,Getting ready then leaving I hope it doesn't rain 
0,is pissed! I have no water... just want to shower.... 
0,Wants new technology/game to play with 
0,ah 17 Again ad in the HM mag. i sware someone is determinded for me NOT to see that movie 
0,@paulwaling hoping for btwn 3:30 and 4. Longest recent run only 18 
0,@TwiTrooper I have NOOO Idea Hollie I still cant think of a Title for mine  Sorry luv
0,Nightmare.  fucking terrible.
0,@shondarhimes aah thank you so much for not giving us a rose baby!!! want Merder to be happy! but totally lame for other viewers i guess 
0,"@vvvwong22 i have a habit of picking at my face when im bored, stressed or concentrating - pretty much always!im making myself ugly "
0,missin all the fun  i wanna be with my friends~~ (((((
0,"@ponyy bahaha, i was putting butter back and bam it hurt "
0,"@airliebee It just feels so incredibly heavy, sad & numb. Don't know quite where to start "
0,"@denharsh Can't get into FTP, sites perpetually ""loading"", support ignores me "
0,Got to cut the grass   http://twitpic.com/4egwz
0,@genjadeshade Why? 
0,Yellow Car isn't any fun on your own. 
0,Shutup college. I know my exams in a months time  no need to remind me 
0,Can't go to the football game 
0,I want to go to bamboooooozleeee 
0,it is raining here in Memphis  Our big music fest is downtown...drenched.
0,i'm in loooove with a guy who live in an other country ! i don't know what to do ! 
0,i have a cold! 
0,cant believe i have to be back at work in 9 hours  ergh
0,cleaning the house... just cant seem to get my act together and keep writting 
0,"knows that, although Oxford is very good she is still a Cambridge girl "
0,Mmmm.   Went flying my toys this morning at 6am.  I now have proof that the lighting pole in the park is stronger than my plane!  
0,(@MisfitGemma) Shutup college. I know my exams in a months time  no need to remind me 
0,"@kitcat72 I'm good finishing work, have laundry to today and pick up gf lateron, workin sun "
0,@PerezHilton that didn't work 
0,"I'll be your teddy bear i'll be your clown (:  Listening to Down by JJ Lin, very touching  its in english everyone  Check it out !"
0,We've lost Tiny ham   I hope you're safe and come back to us mini-est hamster ever ;____;
0,fixen 2 go 2 bg and and then study 4 my s.s test 
0,I'm so bored at work right now  there's nothing to do
0,@ChownTown aww WIKKID! Shame it's out of stock though 
0,"Tomorrow the Mom's Day!!, I know what to do for her! :] , My dad can help with with that!. I have to do homeworks  too "
0,@AudiKhalid i wanna go Taboo too! but that place is too hot and i shy to take my shirt off 
0,"Oh Lordy !!   Hayfever, now that was unexpected!! Non-drowsey meds have me knocked out !! No drive to park this afternoon "
0,"ok! so my allergies have my left eye all puffy and watery, & my right wisdom tooth needs to come out! can i hav a new head?? ooouuuuch! "
0,Still drunk from lastnight and I have to be to work in 20 mins not a good look right now 
0,@peekaboo_nannon which episode was it? I was busy cooking 
0,spongebob is kind of gross sometimes. i'm too lazy to get ready for work  i'd go back to sleep if my cousin didn't steal my bed.
0,My tat is scabbing now 
0,I wonder where's my voice. Can't even open my mouth to speak.. Ouch!  - http://tweet.sg
0,@kiestaster  no big o even with all that build up?
0,@shaddybabybitch yeh im good. just did 5 hours of work serving NO ONE cause the store was deserted. AND im back at work in the morning 
0,I'm all better!! But now I have to study for finals and I really don't want to. 
0,I woke up with the worst headache  So rude!
0,The prom shoot..not happening 
0,"Ok, last day with internet access... I will miss you my friend "
0,"@gjarnling Oh, but Mr Jarnling, I said I was sorry in 2 languages...but am not forgiven? Am going to cry into my meatballs... "
0,"@DanielMysterio  you cant buy it, but you can promote it!  lol"
0,"@viafalyn ikr, i haven't seen them since sil toured with them "
0,At ballet school with the brat!! Haven't been here in a while.. rain rain go away!! 
0,: Coaching! College!! Coaching!!! 
0,"Finally a hotel that didn't ding me $$$ for wireless access. Kudos to St. Regis, Aspen. I did just pay $40 to bring my luggage on United "
0,"@CatLatham espire;) where was yours! snaapp!  i have had to grip my fringe back, it is sticking to my head lol xx"
0,@Isaaatje Cant c it 
0,i hate my phone  damn qwerty keyboards always make me wanna buy them.
0,its rainin again 
0,I reallyyyy wanna startt like one of my 7 video's ..but I gotta finish this episode 
0,@WolverineNYC so I guess no chance getting claws in Germany? Too bad 
0,"listening to ""From Silence to Noise"" by Nosound .. matches the weather .. starting to think the weather gods are reneging on our deal "
0,Studying for finals and making graphics....wishing I could go out and do something. 
0,ohhh i think i'mma go sleep. my eyes are.. kinda hurting 
0,"Man U win, yay!  Going to the gym, need to do more work though! :'( Exam Tuesday "
0,Please someone take this sweet little kitty! She needs a home and it can't be mine! 
0,In dokkum right now. Can't find anything i like 
0,is home watching melrose place on a saturday night. thank god im sick or this would be sad 
0,K. I partied to hard I'm assuming!! I have NO voice!! 
0,"@magpiecreative the ticks are horrible up here, too.  Dogs loaded up with Frontline plus and they still get bitten. "
0,"@daliuhh yeah, i also thought about this  I think if there's a pandemia, they should cancel the tour"
0,@veganB12 bullrunners antagonise the bulls 2 run thru pueblo streets during festivals- in2 a pen until they R killed l8r at bullfight 
0,is eating patatoe chips...ino its morning...oh well &&im the only one awake  i WOKE UP TO EARLLLYYY
0,Turns out I am a 34 waist and a 36 arse! Fed up of trousers shopping now 
0,"Off to Home Depot and Sams with Dre, Autumn has to work...  "
0,"Drinking tonight while watching horror movies, this cannot turn out good? Stephen King's IT will be put on, but I don't think it's scary. "
0,Just heard about the 'HalloWhedon' and 'Chevron 7.3' conventions. Y do I have to live in Australia and be poor?!?!?!?!    
0,"I'm not well, probably won't be anytime soon "
0,feel sick as a dog...shouldn't have taken those shots of brandy last night 
0,Havin lunch wi my chica's then off 2 get ready 4 2nt! Shoppin has tired me out   X
0,"@jordanknight Please tell us what it is!!  or at least give us a clue.  Yesterday I was sure  knew what it was, but now I don't know "
0,"Thought for my day - ""Love Makes Life Beautifyl. Mine is ugly yet...""  "
0,My house back home flooded and we lost a lot.  
0,"@erin_rosie ouch, yea I have to work at 4am tomorrow "
0,I am $75 richer! But my legs hurts 
0,Last day of lift accessed skiing  in VT #killington
0,"@jamescantbeseen what's wrong, su? "
0,"goodnight, have to wake up early.  science test monday, geo test tueday, re assignment due tuesday."
0,"At the laundrette bored, not getting an iPhone now  i am getting an iPod Touch so it's still cool but i did want the iPhone"
0,Ahhhh... I can't wait to leave! I'm so bored. 
0,"@hindmezaina than ks but that wasn't what i was looking for, need that button where you see what the world right now randomly wrote. "
0,i'm at home so tared  i just want to sleep a lot!
0,"up early, cant sleep "
0,Give the donkeys a rest! Plea to visitors over tourist site cruelty http://tinyurl.com/c5w5s5 geez 
0,Ack. Woke to a headache. 
0,Heading off to bed. Early morning tomorrow. Big week next week. 
0,"@kaskade Oh man, now I'm craving poutine "
0,"@arisaja i know that man, but my mom is having one at the moment  sigh .. that's why i'm really worried, i don't want her to leave yet =("
0,"Work meeting at seven, fml. I just want to sleep in once this week "
0,Allergies are kicking my ass right now.  so is studying.  
0,doing lunch with ange. back to work in 10 
0,Allergies are wiping me today. 
0,@sexychi Nope! only me and my 2 bros/...EVERYBODY back home.....  
0,pathan out  #IPL
0,angie i need you to send me train info.  please come online today.
0,aw. i wanna run it  haterBmotivatrs
0,Seeing all the tweets about Boozle is bumming me out. 
0,"Ughhh this kid will not stop coughing, im gunna end up sick "
0,x  + y =  where x = early morning train and y = very late Stevie night.  Stevie hair do . day 2 = ;-)
0,Gotta go to the vet's for a shot this morning.  ? http://blip.fm/~5eyd8
0,@ainzneal I knoooowww I'm really hurting right now. I don't want my coworkers to see me like this 
