0,"@steveo_2cent Yes, that joke has been haunting me since high school "
0,"Love you too, sorry kelly "
0,had a amazing time last night with her favourite person in the world  didnt want to come home 
0,"Going to finish watching Vampire knight for elaine <3 Lost 2 followers  I'm sorry I tweet so much, Last one for a few hours. Promise"
0,@GMANandRIZK i didnt go  sick...was it good?
0,@alison89 Its on my old computer. I would recreate it but I dont remember the website 
0,"Yea, thanks for the tip! Im taking it in today to see if they do anything else for it -  thanks for the effort AJ!"
0,"@shamara99 Noooooo dnt do it!! LOLjk..I cant eat fried foods anymore either  I havent had anything wit da word ""fry"" in it for 3 weeks!"
0,@keza34 see told you be in trouble with @annwhit 
0,"Going to Spain on tuesday, give @virginamerica outside america "
0,I shouldn't have drank that Pepsi.....know I can't have caffeine...feeling crazy already... 
0,the dance was so fun! im gonna miss sarah 
0,Not a good day for Waterfront Park.  Need to come up with Plan B. It may involve the mess in this room I'm looking at.
0,@DisneyLuis Yup thats the one im at 
0,My car's brakes are going to cost me over $300. 
0,says i have duty tom..  and its a sunday!!  huhuhu (angry) http://plurk.com/p/reybb
0,Work up with a horrible head ache.....its been hurting for 3 days now. [   ]
0,At my brothers baseball game bored out of my mind 
0,Sorry @JoeTalamo  . I hoping I Want Revenge recovers quickly
0,bored much. I don't to revise  its boring
0,Just got home from a family BBQ and am now getting ready to go to work! 
0,@RealLadyGaga Is this really lady gaga because there are soo many people saying they are you im so confused  :S i just want the real gaga.
0,sitting at work trying to figure out how to get off work so i can go to the june kink/pool party. 
0,@xohanna im well sad anyway lolz cause i wanted to go to the one in Ldn the day before my 18th but it sold out 
0,@brynf pssshhh I would but I never get invited 
0,Watching the final episode of Pushing Daisies.  Sad sad day 
0,ugh...so many good games on today...hope didn't have to go to work 
0,"Just woke up feeling kinda tired.  I really don't want to go to work, especially on a Saturday "
0,Yay! Work is crazy and my shoulder hurts real bad! Woot  IT'S GINGER!
0,Trammell's last performance at Darden  Then picking up @JenSam at the airport!
0,home from work 'cause xander's sick and nikki's out of town. 
0,"@allapparel no, unfortunately we lost to the mets 7-4 "
0,"@lovebscott um, I lost my wallet B..... so, I can't do anything this wknd... "
0,@allyheartsBB No.. not yours BB. You can keep that one.   
0,"@digitalutopia That has happened to me a lot, girls and guys have done that to me. It's fucking rotten. "
0,"my head feels not quite good  bad, bad alcohol. i will never ever drink it again"
0,@annietullo what pic are you referring to?  the wonder woman 'ho' pic or the floppy haired Rob gif?  i cant believe u changed ur pic!  
0,@bevysmith dying inside reading abt the fab nite i missed 
0,"I've had a sore throat since last night.  Sebastian is feeling better, but it's likely that I won't be within the next 24 hours "
0,MY PHONES BROKEN  i can only txt. (bleh.. i need a new phone anyways!)
0,sooo bored wish i could go out 
0,crutches  leg brace        no heels for prom!! whyy meee
0,@Meretseger I know how you feel 
0,My family ruins everything   
0,@JuanaLuisa Yes I have too - don�t like it all... my clothes doesn�t fit in a good way 
0,OMG Allergies!! Staying at home doing laundry. I wanna kiss Leoooo but I can't 
0,@shrlv COME ON!!!!!!!!! mama dont do rigshot asham to me  you know that i am ragish ! i love you and you know it dumbi mama XD
0,"@key714  I'm sorry, didnt know that..."
0,"Happy 2nd birtday Wiktoria, i wish i was there "
0,@cris_tini  Demetri Martin = Not cool. But Cristina still = Cool
0,ugh!! just so confused about the man i love  HATE NOT KNOWING
0,@BENIBLANCO thanks ben I cannot believe it I'm only 22 and my back gives up on me  x
0,"@tallycast: are you guys tracking h1n1 cases in FL? If not would make good feature on your site, especially if cases develop in tally "
0,@jennytalia I hope the Animal doesn't get it  what does your Shar Pei look like?
0,@lovebscott  children r growing up tooo fast i dont know why 
0,"Ugh,hate this feelin "
0,ty to those who sent out the tweets abt my lockup..man there were some BUTCHESSS up in thurr they wanted my booty 
0,Wishing I can be at bamboozle right now..studying all day 
0,"finished New Moon and excited for JONAS, if only she had the Disney Channel on her TV  Youtube better come thru for me."
0,@allyistoocool ah that sucks.  so many other good bands there too.
0,@mssinglemama what is wrong with people? Ugh! 
0,@DerrickJWyatt I'd go by @GeneralTekno's theory and say that he wasn't present because he failed the drug test. 
0,I just realized that I passed 30K omg  i should quit
0,I think I ate half a pizza last night  There goes the jogging i did. A little too tipsy btw.
0,"@waxkrayon hey, it seems like Twitter thinks you're not following me, so I can't DM you back  Twitter is flaky like that. :\"
0,"@Blogography I don't know - I need to drown my sorrows in a culvers burger with Kim right now, then I'll hit the apple store. So sad... "
0,@ComcastGeorge  Any updates you can share with me??  
0,@mikegentile http://twitpic.com/4ats4 - where are the canadian dates??  specifically vancouver?
0,My iPhone is just staring sadly back at me with it's sad cracked face 
0,wants to form a band... just like The Bloomfields  http://plurk.com/p/rezbo
0,@djh I'd obviously have to agree that @jbh_dc beats you 
0,"Just finished the gig, think it went well. Now off to work for 5 hours "
0,why do things have to be like this?? 
0,"CMSK! WHY! WHY!  BECAUSE OF YOU, NO SKYPE ACTION TONIGHT! "
0,I feel poor without a camera! 
0,to bad that I'm not gonna see Jonas...  OMJ... I wanna cry... 
0,thinks i better go to bed seeing as its 1:52am sunday morning and im EXTREMELY tired 
0,@bccarlso Congrats on arriving in Tacoma! I saw your tweet about Yellowstone closed  Do you have a place to stay yet?
0,Weather has been fantastic here in Sri Lanka. Had a very chilled out relaxing holiday although had extremely sad news bout friends son 
0,"Bernard is my shadow today, it's going to be so hard to leave him  working 1 to 10! Yay then i probably dropping a test off @lion's"
0,Doing home work  x
0,@houstonchick sadly not independently wealthy  but instead no longer at the Chronicle as of 7:30pm last night believe it or not!
0,@BergenLarsen what the heck is up with MTN lately 
0,"my home boy got robbed last night at gun point  they took his phone, money and gum.... Yeah gum wtf!"
0,"@1ChazD am chillaxin at home right now with the Fam,  prolly go somewhere tonight, but dnt know where yet, wkend looking bleak "
0,Wolverine should've been waayy darker!!! I wish this done by Marvel Studios 
0,Getting ready for work 
0,"@bassyc yeah i know little bit, not much.. this work keeps me busy all the time "
0,"what shall i drink during the game?: Stella, Molson Export, LaBatts, or Heineken? No Yuengling in KY "
0,I just quit dizzywood forver because of kbg. 
0,@herevilroyalty  Tempted to make some now. Not sure if I have eggs though 
0,@LLAmos I'm sorry to hear that 
0,@fire_princess Sorry sweetie 
0,"just said goodbye to chloe, my cat of 16 years. her kidneys failed "
0,"@key714 so sorry!  when you said ""shh"" I had already posted...."
0,@xNitsuj LOLL they're so cuuuuttteeee. Got me thinking of bird flu LOL. I just left them 
0,is at workkk 
0,I partied a bit too hard and have an ugly hangover 
0,"Finally watched Taylor Swift's music vid for ""You Belong With Me""!  AHEM....people I asked to help me! W/E I guess ur 2 famous to help me "
0,yea i miss you too 
0,Mayhawfestival.org gets the cheap plug for the day! After Breakdance Day it's a celebration weekend. Then back to work 
0,"no parties this week , that's so sad "
0,@nate_robinson sorry you did not get your size 
0,"yea, i think the 3rd person thing isn't so important on here! lol. omg thanks for reminding me, I have to clean my car too..... "
0,darn.... its getting so difficult to get a free computer at the ipc 
0,Having an awesome time at monsters of contemporary in Chicago!!!!! Don't wanna go home 
0,@BEFOREthehypee thankss hunnieeeeeeee bun!!! wish you were out here to celebrate with meeee 
0,"@StarlingFitness I bought Dance, Dance and am now trying to sell it on CL.  I can't get it!  Too hard, and not tutorials.  "
0,"I have to do the least fun things today.  All I want to do is go to the movies, shop for some new things... Grr."
0,May 1st showers bring flooding waters??? WHAT?!!!! Floods are fun! (not) ready 4 a SPECTACULAR Saturday 
0,"@Calzer nope, i can agree with you in this one cal, dundee is crap! you win.  nothing to do in this dump."
0,@dr_zu DAMN It...  I tried... not to be there.
0,Dave McMurty deleted me as a friend. Maybe you should consider the same. The cool kid who rejects you is often not as cool as thought.  
0,"wishes ma dad would hurry up with this fckin shower!  i need water, im sooo thirsty"
0,"@jimmeemajor aw  haha i wont drop this one then. if you want, we'll use the same line with andy and dblaise?"
0,"Just back from soccer. Bury fc won 1-0 but as the other fixtures went, they needed to win 2-0 for automatic promotion  It's play-off time"
0,"@naughtyeliot @naughtyeliot naaa im in england u tease not fair, goes away and sulks "
0,@belindamay92 i g2g now  gr8 speaking 2 u tho! thnx 4 lettin me know bout adam and nicky  luv u! enjoy bgt xxx
0,@whysgirl i'm not familiar with WHY magazine.  Also tried to follow you but i have a limit   i will try later.
0,662/3000 words by monday. ARGH  should've started earlier lol
0,"have a cup of coffee then i'll start coding , what else i can do ? "
0,Sick with a cold 
0,wants ice cream. 
0,Thumbs up @sophysophia pic --- I love lookin @myself In others pics... O I wore that dress last wk n the zipper broke 
0,"feeling a little lazy.  p.s. i had the worst nightmare of my life this morning.  it was about dog poo, my teeth and a campground bathroom "
0,"@damagedscene my art exams went fine, although i have a sore back "
0,shall not be running the Oslo 10k tomorrow (still not 100% fit) 
0, so pm this weekend started out greaaaaat even though manduh had to leave meh 
0,to think only half the day has gone by  I still have 4 hrs left
0,@kingdomless Also I am going through Gina-withdrawal and my skin has become quite pallor. 
0,@bobbyhighway how come you guys were supposed to be @ Bamboozle today and they switched you to tomorrow?  
0,Dam*it! I just got a huge snag on my Miro Satan jersey 
0,"in alot of pain  really wanted 2 go out 2nite aswell,not good!!"
0,"Now that @CWills23 is gone, Twitter is my only friend  BUY DINNER SHOW TICKETS TO KEEP ME COMPANY AND FREE ME!!! I am going crazy."
0,"waiting in the garage. waiting for the person buying my moped  ... that is ok, ill pick another one up in the near future and..."
0,@aplusk  we try too. home cooked food is def better thn fast food. bt depends on schedule  sometimes unhealthy food is more accessible.
0,Busy morning so far. The rest of the day should be relaxing! I wish I were going to see Kenny Chesney! 
0,"@Tahiryjose hella mad u started ur tweet abt ur party with ""twiggaz"" even madder that I'm going to miss it. "
0,is training & missing Paul's game   . I'm having lazy kids in my next life.
0,"Only had 6 hours of sleep, but I'm awake enough to drive around.  I guess I'm hitting the fair tonight with Butcher? my tummy hurts "
0,@cronogenesis Im on Msn on my phone..your not answering so I'm assuming your afk or Mobile Msn just really blows..either way 
0,I REALLY hope that Chocolate Bears phone isn't broken cus I REALLY need to talk to him and see him...bah 
0,why must my new htpc be such a #$%#$^$^ to set up.. not seein the tv as a monitor via hdmi 
0,Just weighed myself  i'm never going to reach triple digits
0,"@camelgal bus stalking was not worth it this time, no one came out  oh well i tried!  looks like rain 4 nyc won't be much better! lol"
0,On the plane about to take off back to minn. I am really not ready to come back yet 
0,"@nc_carol there are more non-official cases registered   , hi  *waves*"
0,Cough cough cough...I'm sicker than a dog and this weird weather ain't helpin 
0, I need a trophy shelf. We have too many for the top of the dvd shelf.
0,aww man just saw ep 5 of skins fckin sid! he just needed to open his eyes.  ugh i wish we could use the net at work. anyways. im out
0,I feel bad for my youngest.  I'm working and can't take him to the parade today 
0,Really can't be bothered getting ready to go out tonight 
0,Heading back to ny for her race tomorrow- bye cornell 
0,im on the phone with mia  i miss her!!!!
0,Leaving for bowling. Busy day Jacobs going to prom 2day. My babies are all growing up. 
0,if cupids got a gun...hes shooting 
0,Working on Sat. 
0,I`m listen music of the JONAS!! I Love the JONAS BROTHERS!!.. What a pity that I can�t go to his concert!!  
0,SHOWER TIME !...thn work... 
0,"@sywtt Already tried making a ""Becoming a Fan"" page (friends become a fan of becoming a fan), Facebook wouldn't let me "
0,"Grandparents, uncles, atnties, cousins, they're everywhere ! Save me  They be zleepin in mah house. I just wanna disappear right now... xD"
0, i hope this gets better..
0,Revolutonary Prodution Design - http://360.u2.com/ They don't come to Portugal   Barcelona only - 2 days...
0,back hurts 
0,Everyone needs to stop tweeting about hershey... 
0,twitter wouldnt make me qet on  & know im on lOl .
0,OMFG WHAT IS THIS ON MY ARM 
0,wishing i was at bamboozle with everyone else 
0,studying at the library for finals 
0,never being aunty carolyn ever again. worst day ever 
0,"@CoreJas43 Again, I'm no good at this sort of thing. "
0,@dizzle82 what that is crazy!! Did they steal stuff or just break the window?? Poor you that sucks 
0,Bank holiday weekend ROCKS!!!! Shame my husband chose today to start sanding the family room floor 
0,Wishing I had gone to the Derby  Wearing my big hat at home though! lol
0,Points to Ponder! It takes 37 muscles to grown  And 22 muscles to smile But only 3 to pull the trigger!
0,feel a little sick 
0,BLEVE IT OR NOT A oOoBA3O9`AoOo 8R9TNNEY 15 8R9A BWAJ7Y   aka: it`s areel story .
0,@RiyuChan08 Cool! I would love to attend a Game's Midnight launch atleast once :S The game is good.. but its ultra expensive here 
0,Why does God make life so hard  hate my life sometimes.
0,is terrible at twitterr 
0,@christinefarmer Thanks for that - made my afternoon Napster only allows 30 secs of Led Zep   (bit mystified by the Jedi myself!)
0,imY<----      goin to church.  Family shit 2day. =x
0,@moosegrinder aww that's so sad! 
0,The first beautiful day outside in like two weeks and i'm stuck inside working! 
0,Also saw the new wolverine movie last night. WTF @ Deadpool. 
0,"its a beautiful day in the city, wish I could enjoy instead of bein stuck at work "
0,One of my friggin' exes. So this is goodbye. 
0,@jungaar thnx I hope so 
0,today is gonna suck. 
0,@pbuzzell ahh you didn't go?!??  Hang in there! 
0,now i'm hungry can't decide what to eat 
0,i wished nexus didnt go so soon. i have so much to share and i feel so alone its not cool 
0,@Little_Lin been working lovey 
0,@hamelinlive awww...I heard it was getting cancelled.  
0,@the1Res I was rooting for those two. 
0,didn't win the domain contest 
0,Feeling like total ass!!! What a waste of a Saturday! Missing my cousins shower and everything 
0,Work at 330 on a Saturday  shifts next weekend are fucking lame tooo
0,"@Adrienne604 yeah very expensive! And I bought all ScubaPro which was top-of-the-line then,but it was very old "
0,Today is so pretty and I'm stuck editing and adding onto my thesis 
0,still 1 hour 
0,"Watching Cartel! It's all of a sudden sweltering, and i'm wearing a leather jacket "
0,Is back in the BAY... Vegas weather is SOOOO MUCH BETTER than it is over here 
0,@xSmotherMe I don't want to write mine either.  it's a 20 page term paper. i have 5 done.
0,is awake 
0,@iWester I was just at a waiting room.... I didn't really have a choice 
0,trying to learn french folio. its not working at all 
0,Has a wicked awesome cramp 
0,"In line for coffee, damn it. Still upset they closed Java n Jazz!!  "
0,@all well wk sucks. People suck. I havent met one honestly nice person today. Very evil. 
0,has no idea how to write on other peoples twitters....how sad 
0,my card reader has been died 
0,"@Rawrrgasmic Feast! No Fab! No mint Feast! Shit, I need the pictures  Actually it's freezing I don't want ice cream."
0,"i lost you guys' numbers  lemme know!!! cuz my new phone book is pretty much empty LOL ; break time over, back to work "
0,gotta mow the lawn 
0,"@stilettoheights upstate til 2nite,  they closed a school with confirmed swine flu next to my sissy's house so I guess I didn't get away "
0,@ummeesa nope  im just craving them havent had them in forever.
0,got to drunk last night...feel great right now.. 
0,Our first night not sleeping @ home with the kids. 
0,@karijobe aw you'll be there? i have to work 
0, hi papa had to go to bocce for me cuz my backo is wacko
0,Sorry Ive been neglecting you Twitter Fam 
0,@T0y_T0y I don't know! I'm pissed I have 2 get a new 1 now & I think they R over priced 4 what they R! 
0,"Felipe Contepomi looks 2 have done his knee in  doubt he'll play again this season, meaning this is his last game for Leinster. poor bloke"
0,i have to stop eating at burger king. im starting to get fat! but its sooo good! 
0,Up with a sore neck and back.  Somehow hurt my back while tanning last night. Twisted myself into some unnatural shape and *snap* ouch!
0,she is on gmai... and i want to hang out with ian!! 
0,"Anyone have tips on handling a fest by yourself? Only thing I'm worried about is not being able to see the stage, as I'm short "
0,@andrea1ista ohhhh love that place too! I miss Ft Lauderdale/Miami 
0,"@girlluvzermac  .. but it does work now on 10.5.2 , right?"
0,Windows 7 RC official from MSDN now installed using Boot Camp. Sound drivers not working 
0,Free comic book day and I'm too lazy/have too much work to do to nip out to Forbidden Planet 
0,Swine flu has fuck-all on this beast of a hangover 
0,"@missbrandii Good, I gotta do a lot of manual labor here in a minute "
0,My bb Mauer returned last nite triumphantly & I missed it  Saw the highlts on SC this a.m. though. *glee* Can't wait for tonite! #twins
0,Been shopping in Preston all day! My dad won't let me have any wedges  ! My brother is away on camp! YAY!!
0,going 2the Tomato Fest @Prompt Succor in Chal. miss Bag of Donuts! they wont be there 
0,"@yaykimo who won? can you say a name, I guess it wasent me cause i havent got an email "
0,@LeeCollins I don't have curtains  I try pulling covers over face but figure mite as well start day w @OahuAJ & go play tennis
0,Busy with loads of work 
0,would have to watch the replay of the epic Celtics-Bulls Game 7. I won't be around to watch it in the morning. 
0,Lemme find out @dancer24lboog is on Miss Twitter!!! Lol...AAAND I wanted to bowl last nite so bad n u ain't txt bak! I'M OVER IT!    
0,@jskoda It's not in assignments 
0,@virtualgirluk well it is a Saturday afterall. I'm doing SWOT analysis 
0,@shytreejosh man I wish I could be there... my wife took the car 
0,I told you someday you come crawling back and asking me to take you in! <3 Sorry Babe 
0,Beautiful day.  Too bad there's sidehandshakes & awkward moments 07 occuring. Why is water being served only in cup form 
0,@0mie Gamestop. The only place I know here that sells used games. 
0,still getting ready.. steressing out cause i cant find my necklace 
0,Gonna check if there's anything good giving on tv... I need major distractions right now 
0,Back...having a blah day  hope i get into a better mood soon .
0,@choley sorry   http://twitpic.com/4ewe1
0,Aw - the sun went away.  But there's still time to make it to the library and pick up some reading material before the rain arrives!
0,"Haven't been here n a while. Had a bad night, but I made it to work on time. I need some me time "
0,@tnez Hope you're not ill for too long. 
0,St. Louis is 38 miles away and I'm scared - Kel just read off the list of most dangerous cities and it's #1 
0,Casey is not feeling good today 
0,I want to go somewhere. 
0,"9 people here, 3 GIANT banners to do.  fml"
0,"I like t9 now. well, it's not that i like it, it's just that it's addicting and i'm incapable of regular texting now.  Hahaha"
0,"@jordanknight hey, what happened to you pic?  Can't see your smiling face anymore."
0,I want israel  http://tinyurl.com/cu7guo
0,"@WatariGoro i am too tired...had a after meeting after the meeting and no one waited up for me when  i came home , not even the doggie "
0,@beeraday I don't get that show on my FIOS  
0,"@okragly Dude, I'm crushed you're not following me anymore.  Absolutely crushed.   You wound me, Kevin. Lol."
0,@QOTFU that sounds miserable  best of luck with that
0,I'm tired  but unfortunately I have to be on the road
0,is missing his Blackberry right now!! there is no real way of fixing it though 
0,going to the movies to see Wolverine with my love.....wish the sun was out though!!! 
0,"I miss prom  W/bubba though, cozy at home and gonna eat breakfast."
0,I feel absolutely shit and I hate everyone right now 
0,@yisel shouldn't I be happy being perfectly poor?  guess not!!!
0,"@lameBIRDIE wow.. that's a lot.. when I get one i'm just getting the 8g  but hey, it's good enough for me, like, now i just got a 4..or 2?"
0,"I hate how celebs twitter so much, i just want to talk to them but im not worthy enough  LOLOL"
0,ugh... have to study for science test... 
0,@eljeppy okay...  I'm with you on the headache thing...
0,is finally at the bottom of page 14....two paragraphs later. Slow going. 
0,i wanna be at bamboozle so bad right now.  OMFG HINT HINT? better be selling the booty shorts at the summer show!!
0,I need to do science homework   i like graphing though : I
0,@spittingcat _i'm still pissing about with the Rasta. Rc31's on now. Bloody Rock Shox discs  Grrrrrrrrrrrrrrrrrrrrrrrr.
0,Taking amer gov and econ during the summer.. yay 
0,OMG today's the day hahah but not here  buuh1
0,last day in Markham... last day at home...   I'm sad. But I'm ready to take SCHOOL to SCHOOL.
0,i need someone to go to the mall with me but everyone seems to hate me today 
0,internet and tv and phones going down. aaarrrgggh. 
0,"needs more coffee. And a tylenol, my tooth hurts  http://plurk.com/p/rf836"
0,135th Kentucky Derby Today - Party Celebrities at  http://tinyurl.com/cwm9a2 ... But where is Alizee??? 
0,OMG! I do a 130-930 today. which means I'm going to miss the game  I hope my girl @janae24 will be on later....
0,@thepromisehero unfortunately not  but i will if i find some1 who's got a credit card..it's a bit difficult to get it here in germany  ?
0,@GdUpSwag  follow me its my birthday and  thats my present 
0,"@gerrymoth when you have the latest E71 firmware, its not hackable; so I cannot sign free-isms "
0,Omg! Im almost done with the second gossip girl book! 
0,I think I did mediocre on the SAT's 
0,does your sack weep when it rains?  mine does.. and boy does it let me know about it 
0,"wishing I had a balancing ball to sit on, it looks fun & comfortable  also, f sociology"
0,@sam_e_licious what happened last night 
0,@adecemberist Good luck � hope you're driving.  My car is in Pinole 
0,"Kevin & Bean passed on the HIGH HOPES promo interview     Oh well, what's a girl to do? Maybe eat $240 worth of pudding."
0,@kpkane you should be at bamboozle 
0,@decaydance I'm jealous. I wish I was at Bamboozle 
0,bored so bored nobody 2 talk 2 
0,Sick at home 
0,"I'll go from 28 (sort of) laptops to 11, not exactly 1:1 with 25 to 30 stu's. "
0,@ClaireRx me too  claire we gotta do something..im sick of this..its becomin routine sitting in on a saturday ha
0,Accidentally killed garden snake with lawmmower. Sorry little buddy!! I'm sad now. 
0,is at 345 Park today 
0,Had to cancel the treasure hunt part of my bday party bc of rain 
0,STUDYNG FOR BASIC ELECTRONICS HAVE A TEST ON MONDAY 
0,"Omffffg! Black Butte Porter from Bend,  Oregon is here!! My favorite beer in the UNIVERSE!! Can't get it in NC. "
0,May be figuring this twitter thing out...  'cept my phone isn't registered yet. 
0,Washing machine has beaten me  I tried @philomathickat! Looks like plumber tools needed 
0,@Fearnecotton  lil wayne. i fancy him so much
0, No Baseball Today (:  I Hate the Rain!!  It is May right?
0,"@crave4dave aww lol.. but you know that if you end up getting higher than me, i will never talk to you again LOL. "
0,@dividepictures Alas the nearest comic book store is 2 hours away by train. 
0,"@KristenjStewart thinks twitter will turn into a huge competition between ""celebrities"" to see who can get the most followers... "
0,I'm mad!!!! Kalan was in the chat room yesterday and of course I wasn't online!!!! 
0,"finally don't have to wash dishes for five hours straight..unfortunately, studying is worse. "
0,I am not enjoying all the ~Bamboozle~  twitter updates 
0,working until nine now. fuck my life 
0,you've been framed!! was newcastle with @ether_radio and @danger_skies a week ago  makes me sad AGAINAGAIN!!!
0,Nooooo! My fav celeb couple may be donezo. I heart Kelis so this makes me sad...  
0,@DDubLover uh oh u sound like me 
0,What did to make me hurt me. What did to make u scared 
0,http://twitpic.com/4ewtl - My shell ferrari collection.i have all but now waiting for the garage.damn all out of stock.  and also wait ...
0,@ItsJustDi just think you aren't driving for 5 hours.  
0,@cockneycomic i hae this game!  lol
0,@SoWrongItsChels DangDangDang!! THis is crappy. 
0,"tried to look at AM's profile - still ""temporarily unavailable"". If memory serves, for the fourth or fifth day running "
