0,@gilltaylorphoto oh no!!! That's terrible. Poor you 
0,"@keytar you're mean to me  also, 5 hours, 26 minutes remaining :|"
0,"I'm all caught up on Dollhouse  I want moar now. LMFAO, Wash. I love that Joss recycles his people in different series."
0,boom. and it's sunday 
0,Can't feel my body! Just got in bed! Early rising in a few hours 
0,"@edney45 b'nell is Hebrew for mutant child, loads about up there, I'm desperate for a poo "
0,"@NeonLimelight the final mix of ""I Wanna Know You"" is not as good as the TV version! They took out the solo parts David does on HM! "
0,"@Claire_m75 Morning love, it's crappy here "
0,"had a great gig last night, but are now suffering the after-effects "
0,bad news from MC  
0,misses bubbas already 
0,Going to Carrefour to see if they at least have asparagus on offer. Miss the asparagus season in Germany. Here almost unknown 
0,had the worst sleep last ni ght 
0,"@danjite what's wrong with backend accessibility, other than no-one does it? "
0,"answer: ""no"" (end-result is still not the image I'm looking for). That was a short photoshop session  Ooh, the waste!! All that film! ;)"
0,@binnyva The lunch is done there..? I didnt have mine yet  #bck5
0,@jonaslovato gah i know.thats two days in a row 
0,I think I'm just going to start a new torrent :/ megaupload link will be available soonish. 
0,tried to find karmichael hunt... sadly they dont have anyone with that name 
0,I'm pretty sure the girl I could hear argueing just got her heart broken  she is crying like crazy ... So much for sleep
0,@Klutzie yea u should have  It's so quiet here! Coco and Kody miss u! Hurry back! Can u bring a nigga some cheesesticks 4m Jack in da box?
0,"@ttaasshhaa my virus back again or something, my throat is so bad, can barely speak "
0,"@atiqah02 Omg, go away.  I don't want my ham to die. T_T Her hair's falling, too. :/"
0,"Just got up, my eyes are huuuuurting lol "
0,Passing the fuuuuck out. Work at 1 tomorrow 
0,where is my dog miggy?!    waahhh!!!
0,feels rubbish! 
0,I want to be stalked... 
0,@Don_J i wont sleep  creeped myself out in wrk hearing ghost stories about my ward and others 
0,I hate when my AIM buddies sign off while I'm in the middle of my nightshift 
0,"I am feeling sad, dissapointed, unloved, forgotten, and ignored  :'( why do I always get left out?"
0,@OnlyIsabella no i love fred. 
0,Don't want my Darwin holiday to end! 
0,Need deez damn tickets 
0,It's 2:30. I should totally get to bed now. My eyes hurt so much 
0,@MoocherGirl it's a compaq shiny & black - they didn't have pink. 
0,@pellism cook that meat for me! we're having the grossest dinner tonight 
0,my internet keeps goin on n off grrrrrr  not gd .....
0,"so, I ran over a duck tonight. Perfect ending to my day. "
0,I had a lift home from a Ambulance early in the morning with a sick mate!! 
0,Waiting in the cold for bf to pick me up. He's late. 
0,its 10:30 now 
0,Thinking about crawling into a hole right now... UGH chem test tomorrow 
0,Nooo we leave in 2 hours 
0,@aussiefrenchie I wish I had bought one when I was there. I miss my caramel scented candle and my apartment smelling of sweet cupcakes 
0,"@kazwccsocialnet if thats the case, It will take till today evening to get online,.. "
0,@nick_harrison I am actually worried about you  x
0,I just found a hole in my favorite dress 
0,Hasn't quite grasped this 
0,hungover is not the word... 
0,"@ShanteRowlandd kelly didn't do much live promo for either album here  I saw stole 8 billion times, dilemma 20 billion...that was it rotfl"
0,I have done the party circuit today. Not one of them was for me 
0,School tomorow !  All girls Catholic shool . . . Kill me now ! Cant wait till after exams !
0,"@Pao_Villacastin Aww. I`m sorry to hear that, Pao. "
0,@4cthepower yessss boooo 
0,well my net is back but slow.. 
0,mourning the possible death of my beloved HP PSC1210 all-in-one printer and scanner. It is a sad day 
0,"@anthonybaxter I've come to the opinion that Telstra hate iiNet, there are always problems at the Telstra exchanges when moving "
0,going out in the sun soon. looove to the weather! after that i'm going to dance for the last time for this semester. sadface! 
0,Misses his bro's ! 
0,where is kr 
0,up to phase #2 with BizCha.mp ... looks like I've got a whole lot more tweaking to do though! 
0,"@tommcfly Ahhh, I tried. But it didn't work..  I'm knackered... but I'm seeing you guys on Tuesday, so I'm HAPPY HAPPY HAPPY  xxx"
0,"My weekend was full of music, alcohol, great friends, good laughs, and wonderful magic moments w/my Husband. Goodbye weekend. "
0,I'm out of coffee! 
0,"has lost three whole kilos this weekend alone, on a diet of cornflakes and sleep   not such a bad thing... but should have been more p ..."
0,"sick.  that's ok though, i guess the ability to breath is overrated."
0,im fucking sleepy and i gotta go to my second job in da morning 
0,@smallnotes oh no the Bellaforma link isn't working 
0,@pretty_michy omg what's wong? 
0,"morning, quick helooo...will be out of wifi range in deepest darkest Liverpool for next 24 hrs & don't have technology to tweet otherways "
0,"@mileycyrus  i was going to go to that show :'( But my dad cant afford tickets , cause we live in australia.. "
0,doing homework 
0,c'est la vie!!you can't always win his eyes 
0,no groovin the moo for me  i'll just have to wait a whole  year then wont i
0,@skoduri I'm fine thanks. Apparently I'm a big baby who can't handle a bit of trapped wind. 
0,"@Dutch_Bitch nope, I'm working instore again tomorrow "
0,Watching the last ep. of Cowboy Bebop on Adult Swim...why do they have to kill Spike? 
0,The thunder woke me up   and my power just went out.... Back to sleep i go... And woooow the thunder is LOUD
0,@PlayboyMic That's good I miss ya'll   but I c ya'l back there gettin that smooth 2 step on n Ciara video (Never Ever) Get it 
0,Verizon blackberry sucks major balls!! I just wanna c if this goes thru...but bb storm really does suck. 
0,Went to London yesterday to see WICKED the Musical for the second time. AMAZING. Kerry Ellis is amazing at Elphaba!! she's leaving 
0,"Just got kicked off isketch.net forever for being a hardcore G!  with Madison & Bailey, yay!"
0,What lovley things we can discover in life...no 
0,so lazy to go out and have lunch 
0,I love that the first thing I step barefoot on when I walk into my house is puppy poop..so disgusting..oh and the house smells like it 
0,Jus got gome from rehearsal with Croom and T...awesome show can't wait to perform it! Back is killing me  bedtime..nitey nite twiggies...
0,@Caraandclo yh it is  how many weeks is it off your birthday? x
0,I want to work at Alton Towers 
0,im so worried if i he's not gna like my suprise. ain't nothing compared to the big moolahs he spent on me 
0,"@indiesarah Apparently there are 2 Crackers.  I circled the block, didn't see a sign, checked Gmaps & it gave me the address to the other."
0,@dailyPRIME JAJAJAJA LIZZIE MCGUIREE! I MISS THAT SHOW SO MUCHH 
0,"note to self, don't watch scary true things before going to bed   http://tinyurl.com/c5qorl"
0,i have a caramel chocolate chip ice cream. msn doesnt work at my grandmas house.  dumb lol.
0,is really tired 
0,i am sad that Hatton did not win 
0,@takearidewithme  lauren! I think you need to go to the er that really doesn't sound good at all
0,"(@AshleyNSingh) note to self, don't watch scary true things before going to bed   http://tinyurl.com/c5qorl"
0,finally in my own bed. time for some Z's! wish I coulda stayed at corey's 
0,@DaniellaY Still not feeling well huh?  I wish I could fix it. 
0,is very tired . 
0,i wish real people would follow me 
0,Hury my knee 2night..jumpin to attack my bf on the couch didnt go so well the wood in the couch got me 
0,@DenzelBurks im lonely too  i needa cuddle buddy lol
0,Cant believe i am up. 
0,@Epic_War_MT I don't wanna hear about it! Mostly cause I'm jealous 
0,I don't want to pack 
0,"Pitch black hotel room. Woke thinking it's 8am, but it's 4:30. Now my mind is on, can't turn it off.  &  for the last day of shooting."
0,Savouring her last piece of Hi-Chew while watching K-ON!. 
0,@mwhi Get to writing or you'll end up like me. That's right. Slacking causes ginger hair. 
0,really really want to go to SF Opera 
0,"@dukesofdaville ric, you suck for changing the plan.  dude would have been gone by now.  thanks for nothing, old friend! "
0,IM CRYING  i found out something shocking and sad 
0,"I want some coffee or either ice cream, but I already used up all my calories for the day   Diets fucking suck! Instead I had egg whites"
0,Not a happy girl right now 
0,@twistingaether When in July are you over? I'm overseas in July? 
0,The Belfast boys are away  now tockear up and get writing. It's going tone a long day.
0,the hannah montana  movie was so cute omg 
0,tummy is making noises 
0,"Vegas, @ Tao, got Jay-Z & Diddy on stage, & it's my bday. But the only thing I want is WATER which I haven't been able to get. WTH? "
0,tired from last nite!! got like 4hours sleep  LOL
0,the weekend went WAY to quick 
0,Had to get out of bed with my lover to go to work 
0,@Orchidflower The humans are all fine but we have an unwelcome colony of ants to deal with... they went but now back 
0,@Claaairey aww clarieey  have a coffee
0,"I'm so sad, I was lucky to see Brysons show, but I missed Jeydons, cuz that was like 2:.... AM in my time and I was really tired "
0,"good morning on this sunday, it will be a rainy day "
0,"@sthompson717 yes, me too...that's what happens when i sleep in the evening and wake up at like 11:30/12:00   I missed a night out..."
0,sitting waiting wishing this hideous study load would disappear 
0,A little red after a day in the sun 
0,@feliciousonfire what's wrong 
0,"@mcosaurus lots of stuff to do, assignment to finish, massive week next week. i have no time for myself let alone anyone else.  ok now."
0,all that pizza yesterday has left me feeling so ill 
0,"Kitteh won't leave me alone. Can't sleep well, but gotta be up in 1.5hrs "
0,Not feeling the best. Im a lil upset about @mileycyrus's concert on 1st of May that i was gonna go to but cant afford 
0,"Bummed that I won't be going to Bandung with mum next week, thinking that I still have the ticket. Might or might not burn it. "
0,it's 4:30am and i cant sleep!!! 
0,"@amcmillen Oh snap. Or that's what the hardware did, anyway. Doesn't sound good at all "
0,"@hyperactivekid Haha, joey joey.. Lucky you. I'm going for tuition soon. "
0,Got up at 7 am to do text updates about ESWC. Shame cant get stream working on my MAC 
0,9 hours of sleep should be more than enough to feel well rested... why don't I? I feel like I'm getting a headache as well... Ugh! 
0,Just watched the Hatton fight. Over v.quickly - �2.5 per minute that cost me 
0,daym...for the past few days I can't go to sleep for some reason...feels like I'm on some good shyt..blah! I wanna sleep 
0,"Oh crap, here comes another monday! "
0,@jacobonthecoast I'm sorry I've been a shitty friend. 
0,"@soumen08 Geany has a plugin architecture, the problem being that it can be written only using C and they need to be compiled "
0,@claudiachaouka1 your scaring me . :\ dude i'm still studying . Not happy jan ! lol need help 
0,needs melatiiiiiiiiii buat ngeplurk where are you meeeeel?  http://plurk.com/p/ri98u
0,@daisypops awww you havn't got it yet 
0,drank like 8 cups of water in the last two hours and my bladder will not forgive me! 
0,is seriously craving for sleep..  http://plurk.com/p/ri996
0,the downside to illegal parties is smelling like smoke 
0,"in 4 hours modelcasting... my internet doesn't work anymore in my room, so I can't tweet the whole time..makes me sad "
0,@autonomylost I hate those nights...  I hope you figure things out!!
0,[Nob friends] :     For some reason Firefox doesn't keep me logged into things anymore...   .. http://tinyurl.com/czpgnp
0,"Feeling ronery, eating mrs. munchies, working on stuff, and in love always with craig tucker. I miss Shaba Wakie. "
0,"tried to get entered into geofollow three times now, no luck  any idea why?"
0,All but me left 
0,"Woke early, tweeted, read, dozed. Just woke up again and now feel like poo "
0,"@Broooooke_ noooooo  i was on bradies myspace, and theres a pic that says my son drew this for me which means his got a gf or wife "
0,"Remember I zapped my devlist? Now, suddenly 1000 or more have come back out of nowhere.  :confused:"
0,@ashleyxtellez i totally will girlie!  (ps we never talk anymore  we really gotta :p )
0,I wanna be asleep still 
0,"today is sunday, but i have to work "
0,but seems like a singer of ICF has changed? 
0,@rastAsia I have family and friends visiting from Australia and Sweden. I honestly don't think I can make it. Breaks my heart. 
0,I HATE WAKING UP TO THIS!!!!! THIS SRLSY SUCKS I HATE LIVING IN BELGIUM!!!!!!!!!!! AAAAAAAAAAAAAAAAGGGGGGGGGHHHHHHHH  i want the songs to
0,@Evelyn_Ross aaasssshhh me olvide 
0,"@CherylH77 Well, aren't you lucky...  I seriously need dessert. This writing is boring me to tears... Nothing here though "
0,"RIP Tobi, you will be terribly missed  http://tinyurl.com/ca8mx3"
0,i missed a call from my mother AGAIN!!!!!!!!  she is somewhere in Lhasa (travelling) !!  
0,Finally a day off! - still have to work bank holiday monday though 
0,@Joseph_A_Jonas awww i cant wait 2 c it...hasnt aired in Australia yet  Sonny With a chance just air here last week 
0,"Saw LX3 at PIM. No black, only silver.  ah, I want it sooo baaaadddd.."
0,I want seafood. 
0,fukk franks. gotta be there at 10 am 
0,Bought a DSi tonight and Rhthym Heaven. Holy crap! Very addictive. Played for 2 hrs straight. Now I'm going to be tired all day tomorrow. 
0,i'm ridiculously smitten with robert pattinson after watching how to be. ok im obsessed 
0,twitter virgin but my Berry just broke down 
0,@eastcoastvegas I hope you come back.  Otherwise it'll be very boring late nights   That's DooDoo
0,"Good morning, here we are again. Another Sunday but rainy this time "
0,@GardenNymphA ANNA! feeling neglected here...lol.  *my lip is quivering for emphasis and I'm giving puppy dog eyes*
0,@RoCkDreeGo Can't sleep  Miss you lots
0,"3 huge cups of jungle juice (aka hairy buffalo), shot of jager, and 6 jello shots later...I did not get drunk  "
0,Epic dinner of vegetables.. trying to make what I think is food poisoning go away 
0, going on holiday 2 weeks today! NOOOOO! 
0, My puupy is still in hospital  I was crying soo much last night for him <3
0,@joshtastic1 yeh but have to go to work at 12 
0,Shower pump has failed.   Good job I'd ordered a replacement. Know what I'm going to be doing tomorrow.
0,Goodmorning! It's Sundaymorning in Holland..and the weather is really bad.. its raining!!    Gonna make little chocolate cupcakes today!
0,@MrFlossy LOL I'm just evil tonight he he - I don't have icecream though 
0,Light looks interesting... should get out and take some landscapes... Need location ideas though... Feel like I have done Kent to death 
0,Shower pump has failed.   Good job I'd ordered a replacement. Know what I'm going to be doing tomorrow.
0,Has to go into Uni on a Sunday  not cool
0,@howlertwit Oh booooooo!!!! Gutted I missed it!!!!! 
0,@lmmenge yeah I agree! I was so excited to see the movie and I'm really dissapointed 
0,"I dont want the MidYear exams to come,  This is so sucky, i aint liking a single bit of it. Booo (!)"
0,A filtered ejournal search for computers & society gets me 'Computers in the schools' and 23 pages of suggestions to page through 
0,Drinking warm milk b/c I can't sleep 
0,gahhh. cant sleep i wish i could go get bride wars but Kinsley car seat wont fit in the audi. 
0,"Wow, we have a familyof touch screens at home now =P Im getting my nano back  but I won't have the itouch nemore "
0,ouch! extremely sore toe 
0,5hrs of digging=13.6m of trenches and 1 out of 2 pipes laid under driveway(yet to be laid). Oh how an office workers hands have suffered 
0,Up with a very painful UTI 
0,really wanted to go see mcfly on 8th may ONLY to see @DavidArchie but i can't 
0,Just dropped nephews off at airport. Feeling really sad 
0,OOPS I DID IT AGAIN!!!!!!  i missed a call from my mother !!!!!!!    she is somewhere in lhasa (travelling)...... 
0,"i have the monday blues  nothing that beer can't fix! ice cold, kgo! adventure awaits."
0,my legs wont stop hurting ugh...I hope I get a chance to sleep b4 work 
0,@Caraandclo yeah ive got the hurting cough now  and a rlly blocked nose.. but some how it still seems to run. LOL.  hope ur better soon!
0,Come on Kent Twitterers... Where in Kent is good for landscapes? There must be somewhere I have missed 
0,"whatever it is Java, C#, or C++... it is always one only thing... debugging "
0,"@heybonnie it faillllllllled  so i redownloaded the new one, and it just completly fucks up my computer :/"
0,So cold this morning in London 
0,No - doesn't work  I can only add private #Diigo-notes to a tweet. Too bad!
0,"just got home, im fuckin hungry and theres nothing to eat  FAWK!"
0,@d0opeb0ii im bored  entertain me w/ a song and dance 
0,@calvingarner so sad u can't be there on wed. 
0,why am i wide awake at 3:30 am?!  
0,Waiting for Fanboys to encode and then burn it. 
0,"@Joelsk_ that's what everyone keeps saying, but I wouldn't know where to find it, don't have any tools, and my plumbing is ancient! "
0,@scottmeinzer I am so sorry to hear what has happened.    *HUGS*
0,@EAJosh  
0,Just finished a fun night with friends and has to wake up for work in 2.5 hours 
0,Thought it was going to be nice today but it's a bit chilly 
0,@_snaphappy oh poo.... need to buy lint remover at ace hardware kasi.. 
0,"Bugger, the other team are a no show. This will be a fun 2 hours "
0,Ahhh almost 5 and i cant sleep  what to do what to do   oh ya maybe i should find my keys  hmmmm
0,Sorry 'Merlin'.  I can't sit through fifteen minutes.  You haven't grabbed my attention at all.  That makes me sad 
0,"@djmc Hah, I've been such a happy Ihug/Voda customer I've not paid much attention. Telecom delayed install at this house by 6 months "
0,weekend is halfway done 
0,my watch died  and I just got it ...a few years ago :'-(
0,"@NintendoWiiAlot I like the new Nick Chase game http://tinyurl.com/auxmk2 - hell, no time to play today "
0,"@jonathanrknight You are killing us you know???!!! We need to know about the rattlesnake, you can't leave us hanging on here "
0,I'm up in AZ & a little drunk. Who's partying in LA and feels like texting me? One of those weekends I really miss HWood 
0,i have to go to work 
0,I can't find my besfriend's twitter. 
0,"@byronrode ouch.  That sucks, sorry my friend "
0,... makes it all soooo tiring  Flying is no fun. I loved it when  I was younger...
0,"@DenzelBurks  lol yea im crushing on someone bad, have for years,     Points to @drefromthebay  he's patient n kind, and right! LOL"
0,I just lost $200 on an ebay slot   this is why i don't usually gamble.
0,@KillerFly probably bugged out because i clicked it a few times 
0,Just finished giving Push a bath. Thought he had fleas. He has dermatitis.  
0,My ears went from an 8 to a 14 gauge! And I lost the $20 earrings. 
0,Haven't unpacked since my trip back home. I dont like the disorder in my bedroom 
0,Downside of students creating work online - when site is down I can't mark it (not OU!) 
0,Alone in a late night thunderstorm  Some things in life should be shared.
0,is feeling that chatting to a friend on the phone until 2.15am was a bit of a stupid thing to do....tired again.  
0,"at curtin, but we lost touch ages ago... & he doesn't seem to have facebook "
0,Since swine flu came to the UK our media doesn't seem to report cases in other countries. It's like they don't care 
0,@spankylou1973 monday nights a school night so I wont be on too late   look out for you then love x
0,"Amazing weather. Depressingly, I have a target of 1500 words for today "
0,@justjuniper i live in both worlds unfortunately  don't we all? boo to that! lol
0,@Avie89 sorry to hear that... 
0,@Avie89 sorry to hear that... 
0,"Woke up with a raging sore throat  Great family BBQ yesterday, more decorating today"
0,"Have to get up for a 8am phone conference tomorrow public holiday  but if it helps my system, I will!!"
0,i need a new phone 
0,@theanand Can you get a #bck5 Tshirt for me? I couldn't come. 
0,in the cab w/ blacks 
0,tried salvia tonight... worst experience ever. 
0,So drunk I love erin so much for riving us. Mark is drunk and going to lick my face 
0,In Fiction was one of the best Fucking  concerts i've been to in the history of ever ever land....       I'm going to miss you boys 
0,Internet has been down since this morning.  Argh!
0,Monkey World yesterday was a big hit. They're doing great work. Off to the beach this morning. Joy! I hate beaches. 
0,"i look so funny. i am in pjs, ugg boots, cup of tea, beanie and a box of tissues.  clear signs of sickness "
0,"No bike ride this morning - got something bronchial - when my son has got a cold, he is like an industrial crop sprayer "
0,"Almost 4 a.m., still not tired  What's wrong with me?!"
0,"iis at home now! Hoping no more storms come so she can sleep, but I think I hear one coming "
0,Up and having trouble falling asleep. 
0,"@vectisdebs yep  oh well, lol, so how are u, got much planned for today?"
0, got earache and wants to go home
0,@EmmaRhoyds It doesn't look like it  He's played the last 2 years so he's probably giving it a miss this time. Hopefully next year though.
0,"lamp purchased, bought and assymbled. To bad Walmart doesn't price match walmart.com  #walmart"
0,"is at home now! Hoping no more storms come so she can sleep, but I think I hear one coming "
0,have worst headache  painkillers and coffee for me !
0,@john827 Ok than go and watch with me!!! I just have to work Crooners after the show. 
0,is feeling a bit sad for ricky hatton 
0,More slab laying today  Even though i never did anything yesterday!!!!! 
0,@xXFriendXx Not having the music is what i hate ituns belgium 
0,@john827 Ok then go and watch with me!!! I just have to work Crooners after the show. 
0,Can't sleep. I'm so worried he's mad at me  ugh. Such a bad night...
0,"@elharaty but bike riding = sweaty, and doing so in underwear sounds like a recipe for fun chafing "
0,@abbaaayy  i hope it be ok
0,@ruchikabhalla omg how I miss WaWa runs at random hours living at RU. There isn't a WaWa in sight here  lucky you
0,Up at 3 A.M. couldn't sleep 
0,"We Heart Our Hive - Q And Not U ][ not much songs on blip  @fredsablan ooh, death from above 1979 <3 yay your... ? http://blip.fm/~5gzch"
0,@ellyasabdullah It will soon be over  U r happy abt werkin on Sunday? Beautiful morning to go to the beach though...
0,Eurgh real trouble sleeping & now feelin washed out 
0,@ninjamoeba what happened? 
0,HOME... LAYIN DOWN... DON'T FEEL 2 GUD    THINK I NEED SUM VITAMIN S... LM{sexci}AO
0,I'm just having my morning frappe. Have to work tonight  Well I guess I'll be fine.
0,Harmony in house has been disrupted indoor cat got locked out all night now is running around beating the other cat and then dog  noisy
0,have to pay the cab driver an extra 5 cause blacks wanna play mp3s 
0,@sjcNKOTB the only time we get more pay is when we work xmas day and new year day apart from that no extra 
0,searching for a torrent/RS link for the RMadrid - Barca game of yesterday ... able to find only ones with Spanish commentary... 
0,Hello my lil darlings. This is my last twitter  Yeah so sad. Dicks of parents are making me quit.
0,"My bestfriend is eating dinner, i miss her already  I love you lish."
0,@casual_intruder awh and me picking on ya too  get well soon babe
0,@lastkaled I liked your picture. Except that you look about 10 years younger than me in it which just isn't fair 
0,No one ever talks to me....    
0,3 more weeks! and i' done with these nonsense 
0,@Moriqua143 I'm at home switching tv's out  putting my 20 inch where my 46 inch was
0,"@casey_pearson  I left a $2 tip on takeout the other night, but later I started thinking like she took 2 steps and handed me a pizza box. "
0,"Friday night I wondered where my week went, my weekend wasn't much different "
0,@Valgal210 @smiley_steph I got restricted for 15 minutes! 
0,"my TV is on the fritz again  shuts itself off even when watching netflix on xbox, which used to be the one way it wouldn't fritz"
0,Had a great night with some pretty awesome friends  But now I have to go to work for some sunday banter. booo 
0,@angie_k2 I know  
0,I want to sleep.. but I'm wide awake   Maybe some more reading will get me back to bed.
0,He's leaving on a jet plane 
0,http://twitpic.com/4gy8v - awww...too big 4 this ride...  
0,"Oh, not so cute... but sad  http://tinyurl.com/cl5xxh"
0,Having to use windows to test excel integration for a customer project 
0,"Day of washing, hoovering and ironing planned "
0,http://twitpic.com/4gy99 - naww...too big 4 this ride...  
0,"@reeginee well we must hang out anyways just because we both rule so hard :p i'm sad... no more fun  cups, and fat people "
0,"@tsuvik Hey, I would love to watch that too, Sadly no live links are available I guess  #bck5"
0,"Purse party was fun! I'm sooo tired, and I gave away my day off tomorrow "
0,is craving for tempura!  http://plurk.com/p/riayn
0,is annoyed  why do people never pick up the phones when you really need them too?
0,"@shaundiviney, You know what sucks major donkey balls? Parents, Mum wont take me to see you guys cause i have been to a concert this year "
0,"@lizluvsJK He has and we appreciate it. But Danny is mmm mmm good, I could do without all of the tattoos though "
0,I hope he doesn't use this against me. 
0,"just got out the shower, tired like something old and fraile  day two of reset begins in less than two hours... bring it on!"
0,@JoeJonasLuvr49 oh I'm sorry  is she in college??
0,I cannot believe I am up @ 4am even though I took an Ambien.  I just can't sleep. 
