0,"I'm about to go to bed, its been busy, I miss you guys "
0,my boyfriend just texted me..because he wanted to break up. why? why did he have to do this to me? all my efforts for him are vain now 
0,i am finally in! it wouldn't let me a while ago 
0,I wonder y @bustabusta has stopped text me back and she blocked me from following her. I didn't do anything to her. I just wish I knew y 
0,Im siiiick!  thats wat get for srayin outside til 5am)
0,"it was such and ugly, hot, and humid day today "
0,"  are there any parties tonight!? im hella bored at home, and its seems like everyone is busy!! LAMMMMEEE"
0,@gerardway scared. won't you ever come ck to mexico because of thishitty virus? 
0,A Nice quiet Saturday evening.  my Xbox has RROD.
0,@youngshay ill make it look smooth tho :O what size fitted do you wear? i see alot of them on sale all the time in sizes i cant fit 
0,i'm hungry. i need mcdonald's like noooow. 
0,@JaydDragyn yep first song he sang too 
0,Don't know what 2 wear.... 
0,Now back to that fun bedrest..  Yaayyy....   ..But I'm still blessed... always a silver lining although at times it may be hard to see it
0,"@JKsGirlx2 awww i am sorry  this is my favorite radio show evah, cause in 2 hours he played like 6 songs i requested for me and my peeps"
0,@n00dzisaBAMF sorry I just got off work like 20 minutes ago  I would have come over if I got off sooner
0,"wanted to see Cinderella, but Isabella didn't... "
0,With my brother in home :s    he`s noot exactly like i want it
0,Homework is bad. 
0,"""with endless love, we left you sleeping, now we're sleeping with you, don't wake up"" <-  really touchy phrase :O"
0,another exams next week ? WTH ?! 
0,feeling the effects of the venti chai 
0,"is up, thinking what to do. So in halwa puri mood right now, but not going "
0,"is hating the cold, rainy weather "
0,Oh Nucks  next one!
0,aladdin can make this night even better. i hurt my tongue on a fucking blowpop. 
0,"Soo jealous of anyone who saw Third Eye Blind, Asher Roth, All Time Low, and New Found Glory at Bamboozle. Tell me why I didn't go?!?! "
0,my babe girlfriend just left for home and work  devvv
0,"@Neekatron  Can you tell us what it was, now?"
0,Alone at last. Times like this I wish I had a girl... 
0,All the you belong with me videos got taken off youtube 
0,"Beauty and the Beast usher for 12 of 15 shows (picked up grandma for 1, sick for 2). I'll miss it  It's gonna be in my head forever"
0,was going to go visit New Moon set today but then it started raining 
0,@666TheBeast666 yeah i do need a hug. a real hug NOT an internet hug 
0,"my aunt took my ipod and still hasn't given it back  ugh! give it back, right now!"
0,"@TrishaTECA It was ok, I did enjoy it though, but my mind was on Simon.  But I enjoyed myself. "
0,@rayretaliation I don't really want to do all that colouring and drawing  what were your websites about!
0,i miss michael 
0,"@phonography  aw, poor spencer. i hope he's ok!"
0,... and  @ the amount of paper & ink I'm going through to do it.
0,goodnight... bbl tomarro... http://100wpd.com  ... notice no ads from google...  arg...
0,@cybie2k I agree! He's utterly fantastic. That Dominic impression - I'm wowed. Going to be sad once show's over  What do you think so far?
0,Still Hungover from last night 
0,@Miss_FreshNESS and u don't miss me 
0,doesnt get anything anymore like for example why only Nick and Kevin arent in Australia and Joes by himself in australia i dont get it 
0,so want to sleep - but have to have the first pizza run in 45min -  _ Why do kids grow and then work stupid hours and can't drive yet?
0,"is hating the cold, rainy weather  ..perfect night to cozy up in PJs and drink some hot choco x]"
0,@jeanettep I know! 
0,"@tyDi dude awesome album, but where is ""You Walk Away""?! "
0,The march of dimes event was very awesom today !!!!!!!!!!!!!!!!!!!!!! To bad I didnt win the car.    
0,iStat iPhone app remote for monitoring macs seems pretty cool. Don't think I'll use on prod server with such a weak pass though 
0,At work for 12 hours. 
0,Not feelin too good! 
0,stayin in tonight... movie night... solo status 
0,jusst saw the cutes video ever 
0,"""Obsessed"" was good!! hanging out wit my girls is the best! too bad i didn't c my boo thang  ... lol"
0,@johnnymetro was just thinking about it at work tonight. still sorry dude. 
0,@thetealgiraffe yeah. well finally my computer got fixed now and i turned fifteen today. i'd like to have a party but we're broke. 
0,New kitten jumped right into the toilet tonight......had his first bath.  He HATED it!  Poor little guy 
0,@JustinLongxxx 
0,Still doing P.E 
0,"this stokos is sooooooo good! grilled chicken sandwich nd fries that im not supposed to b eating  ...1st time n a month tho,no more!!"
0,Its like pouring rain outside  so much for the nice weather!
0,@LydiaStack hilary lost  soz love
0,"Just got back from barnes and noble I know sorry I am a book worm, got 2 books and seventeen to read after state testing this week gross "
0,@ strip club for 3rd time in LIFE! hiccups and strippers and bounders prevail!  crazy day
0,Back damn ouch my brother just closed the door on my hand!! In pain 
0,Must have mug tattooed on his forehead  for fuck sake.....
0,"Man... seeing all these tweets from everyone at @dasro_kast's wedding... while the occasion is  I'm all   I'm there in spirit, really!"
0,@WYLMITE705 no kevin just couldn't stop telling me thanks for coming joe asked if i was okay & nick looke so tired 
0,"Out in new York, tired, sore feet, and not enough drinks to hit the minimum tab...college was 10 months ago...what happened to me  lol"
0,Today I learnt the importance of keeping pain killers up. 
0,"@anima ya, kejang2 ampe pingsan..  thanks dude."
0," RIP BRIEANA PAIGE HOPSTAKEN : MARCH 1ST, 2009 - APRIL 30TH 2009. love you and miss you..."
0,"Price updating my comics (suddenly lose all of my followers LoL) so far no ""jems"" "
0,@raquellxoxo zdisneygirl1990 and UGH! Why won't it work? 
0,Is sad cos I had to put my guinea pig to sleep 
0,is using SmartBro! 
0,@hopped no!  i promise!  i left it with ryan nielsen with the promise he'd return it to dave peterson.  sorry.  i was up late packing..  
0,@MattWRoberts I had a photoshoot today. My flight back home is tomorrow morning though  Not enough time here at all 
0,"@tavagrl35  I wish you were online right now  I need someone to talk to for advice, which you excel at when it comes to me for some reason"
0,@eatit007 Noctural Myclonus 
0,"packing my bags, and ready to go "
0,Think I've got a cold   Doing Social Studies for exam tomorrow  x2
0,"python bit me. i know, I should have known better.   http://trac.jwp.name/blog/python_got_me  #python #postgresql"
0,@shizie lol i do too. figures that everyone else's AK mugshots are everywhere and huge but patrick's is all...tiny. 
0,ughh shit i walked into my grandmas wall! my head hurts  haha but it was kinda funny xD
0,I have a MAJOR headache 
0,@arabmula As soon as i replied to you about DM's....I got 5 more lol 
0,Folks over for a night in the observatory. Cloudy and rain.  But I saw my first gPhone. Star map app is wicked cool.
0,Dinner at Muse in Kensington was the worse service I've ever had. Seriously dissappointed and the server didn't care two shits 
0,darn it all I was attempting to tweak my blog and youre all distracting me !  lol
0,".... I woke up at 6am, I thought it was a Monday ... I am going back to my bed .... I need more sleep "
0,"@burnhipsterburn haha. You make me laugh. I'm djing thurs, but I'm sure you prob won't be near bmore. "
0,@FightFairsd  im gonna do my best to make it tomorrow
0,At the ER. lonely 
0,worst day ever 
0,the sound of rain would be amazing right now without all the wind 
0,Aww Damn! I would have came home if i would have known.  @kyladreamsmusic
0,@bennagel yea old ones were rusted and frets are at risk 
0,I suppose this Niagara Falls downpour we're now having is a result of the sunny April we had...? 
0,@Becca1Checca yep...and what's worse... @Jassy1015JamZ left me 
0,"@VenetianBlond damn, I'm doing Somewhere Men Are Laughing @ Odd Duck til June 9th "
0,"@CHRIS_Daughtry I apologize for all the random BS- but I have to ask, & many want to know...Were you offended by ""The Pants"" business? "
0,And more... now perhaps an ear infection? KILL ME PLZ. I can't take this anymore. 
0,@cindyrella7 you better be bringing back some for us! 
0,"<--- Just found out there was a BLCS going on     I'm now listening to BLCS, watching Boys N DA Hood and studying.  Multi-task FTW!"
0,@meghannian LOL I'm sober now 
0,needs to diet and exercise. 
0,"just read ur mail again..and just realized how stupid i was. it was too sudden and so long at the same time, lief.. stupid me. "
0,@KatieLaRowe LUCKY!! Dont celebrate our 5 month without me  and dude.. you're absolutely invited!! Find a cure for my headache?
0,@waxkrayon awesome saturday night idea - arson. set fire to a random building! perfect plan! ... no? ok... 
0,@ work...of course! This is how I spend my Friday & Saturday nights... 
0,"I am so excited to sleep on the good mattress tonight. Also, I think I'm the only filipino who didn't watch the fight "
0,"Britney fell during ""get naked"" tonight at her concert. "
0,@michpee i needa vent  psych ward?
0,hatton lost! bye bye money! 
0,@KirbyRadioStar where did you go? No tweets in like 3 days? 
0,@stronger do not play with menstrual people OK and omg i love her  IT'S IN MY BLOOD
0,Oh dear gods! They are showing Alexisonfire on the Punk Show. 
0,Why aren't we like we used to be? I hate not knowing what we'll end up happening. Drift Away 
0,has a massive fucking migraine 
0,Loving every minute of the ou reunion! Do i have to leave? 
0,@THEBEASTWiTHiiN yeah it's here too 
0,I wish my baby would cheer up. 
0,"""python bit me. i know, I should have known better.   http://trac.jwp.name/blog/python_got_me  #python #postgresql"": http://twitter.co ..."
0,"Tano had another seizure tonight. This makes two now, both under the same circumstances. This one lasted longer though. "
0,i miss ya to ally!!! 
0,maybe next year bulls 
0,So my legs twitching......I don't think that's a good thing 
0,@keslerftw What's wrong girl? 
0,"@FUCKCITY Fucking amazing show tonight, I was sad we didn't get to meet you guys  Oh well, next time!"
0,"They fryin fish, got meat on da grill *pause* and sellin o-cups out front!  I should've known! ... But da coon in me...smh...   "
0,"@carsonjdaly I have an old fashioned rocking chair from my grammy, but no porch.  hopefully next year."
0,This pizza smell is sooo strong  And it made my belly hurt! Damnear Divine is on now <3
0,@scarletmandy i'd play more of their songs but i dunno how to get blip.fm to work properly!!  it keeps playing two songs at once
0,"Tough night, my poor little man Casey has a fever, headache and chills. Had to take him to the doc.A little unsettling, please pray 4 him "
0,I missed the jonas brothers show  I know I'm a complete dork but I really wanted to see it! I'm sure my 5 year old niece did. ahaha.
0,@socialitebeauty I'm sooo sorry about your back!  Hope it feels better in the morning!
0,@xkathy thanks!! I had a lot of fun! I wish you could be here 
0,@danielledillon Nope....its back. 
0,not feeling so good 
0,too much coooookie crisp 
0,@lindyyr yes cause you promsed you would be back tomorrow  i miss you sf
0,@mina_roxx im not on the computer right now 
0,@joanteh hey i've read you're supporting invisible children. me too! i wanna buy a bracelet but i still don't have enough money 
0,my phone  .. i forgot my phone ..cry*
0,I miss london  I wish i lived there.
0,Back from the standup show at yuk yuk's. The guy was really funny. I just can't remember his name 
0,watching Channel V Pattaya music festival special commercial GUESS WHAT I DIDN'T GET TO GO I WAS SO CLOSE YET SO FAR 
0,"@IsadoraR yeah iz i did  i think i need a hip replacement now, i cant walk properly.  I KNOW, he's so creepy but i still love ahahh !"
0,"My friend, Jacy, has been working really hard on this & now 'GOP lawmakers put money before safety on highways' http://tinyurl.com/dy7lcy "
0,my heart hurts. it took a brutal beating today. like 4 times playyyyed in one day...that shit cant be healthy 
0,@TheDavidBlaise david i met you earlier tonight and you told me you guys were playing nyc in july but that dates not on your myspace 
0,just had the ambo's at her house. Mum's back isn't in great shape but hopefully it's nothing too serious 
0,"I can see it in ur eyes, taste it in our first kiss, stranger in this lonely town, save me from my emptiness....I miss Reagan "
0,It was her last show on the american leg of her tour! 
0,"Is it considered torture if we are confined to an ""area"" to watch our government be dismantled? That is torture to me.  http://bit.ly/ ..."
0,sleeping alone is not one of my favorite things .. i miss ice 
0,I wish i was there.  I want to dance with irene. <MixJunkie 360>
0,"I love my sister a.k.a brianna!!! Missing her..we might be away by distance,never in heart.. "
0,last day of #tourdeblono before i leave on the greyhound at 7pm.  thanks to everyone who helped make this trip a vacation
0,And I'm taking my sad drunk butt to bed.  This has been a long night.  And I can't talk til Monday.    Y'all know that's a lie!
0,@minalove I have to leave on wed 
0,"Figures, everyone's statuses indicate this was the best night of their lives, when it's one of the worsts nights of mine. "
0,"Going back to Kuala Lumpur shortly, high way sure very jam. "
0,Chad got owned!  he's the most bad ass character. More than ichigo...
0,@Sterkworks Never tried that.  Had to settle for Coke Zero as they were out of Fresca. 
0,Gah! I wish it were raining 
0, gah. so much less ok than i was trying to tell myself i was.
0,"The bus was supposed to leave 20 minutes ago, and it's not even HERE  yet! "
0,And it didn't even have room service! I was so excited too  I hope that employee gets fired because of this
0,"Wish I was home watching Shannon fight, but I'm stuck at work! "
0,we lost the film festival 
0,Stampin' UP! May workshop cancelled for tomorrow 
0,in pretty much bored rite now. 
0,I kinda feel like I'm goin to be sick. its only 2am. this sucks 
0,"@thomasdurden http://twitpic.com/4gowx - Wish I could be there, but sadly, I""m in MI, and it's quite a drive. "
0,its sad have so many disapoitmants in one day  wolverin's movie its sucks 
0,Having braxton hicks contractions...and a really sore spot near my belly button.  Feels like I'm ripping apart.  AWESOME 
0,has realised my sheer disdain for mowing my lawn spans all borders. Getting the house ready to leave for Oz tomorrow. 
0,I did so bad on calories today. Having a pregnant sister does not help you eat less. Tomorrow is going to be self-punishment... sans kink 
0,Cops stopped the party 
0,checking out hurricane ike flim on you tube. I can;t believe Uba was outside for all of that. 
0,"@stringeilcuore  I'm sorry...I've gone through that myself too, so I kind of know how you feel."
0,GOD I'm fucking BORED AS SHIT!  Come pick me up 
0,Wish i was at bamboozle  for the first time im my 13 years of life im not going to bamboozle 
0,Aaargh I hate the cops.. Can a nigga just ride n smoke in peace 
0,House closing was delayed 
0,Went to a clariol party and missed the  kentucky derby 
0,I really can't deal with this freaking cough!!!! It won't let me sleep!!! 
0,"@br0nnie Also, that sucks so bad  I wish i could help"
0,"my mom's laptop has ie 6, i didn't know people still used that ... sadly it's her work laptop so i can't even update "
0,@LucasHilton why did you log off so fast? 
0,its sad have so many disapoitments in one day  wolverin's movie its sucks 
0,Laying on the floor in our hotel... I can't sleep! 
0,http://twitpic.com/4gqfp - Me and Quin! No picture when I met Dan and Bert.. 
0,it's pouring out 
0,"@_supernatural_ http://twitpic.com/4gm4i - He looks a little disappointed in us  And I think he wants to say ""told you so."""
0,@_protos Chin! Que se reponga pronto 
0,CANT WAIT ANYMORE. off to lunch. goodbye comp. omg. see you on saturday  LOL
0,Trapped at Ray's. 
0,@rgobea it was the song my sis linked from her twitter that made me do it. 
0,"Watching Cops on NBC, Vegas episode.  See streets I traveled and sites I saw for years makes me miss it.  I know Vegas better than home! "
0,@fountain1987  hope u're ok! X
0,@robbinsadam I believe the star trek vita.mn one did  I already convinced him to come see intelligent homosexual with me however
0,just had pizza and am now going to bed (how healthy is that?  not at all...)  Work tomorrow 
0,bumed about the fight 
0,@altwheels He did something to his hip or leg turning around to get out of the car tonight... he's not yelping now but still hurting.  
0,I am so facinated by OctoMom!!! No new news... 
0,@StudioTwin ... Really... Packing fudge eh... 
0,It's been two hours and all I have built is a road. Not my game 
0,beer was such a bad idea. apparently im dehydrated. i didnt think charlie horses could get worse then how they were earlier. owwww f.m.l 
0,so very hungry 
0,"@Mashaaaaa dont make fun of the dead. actually its okay,.its not like they're gonna cry or feel sad .. if they did that wouuld be creeepy "
0,@vegabruin aww shit.. if i woulda known.. i woulda rode with ya boys! 
0,me and joe drove 3 hours randomly to make a suprise visit  to lars...but he wasnt there  oh well danny and steve were completely suprised
0,i was at the studio with my girls had fun im missing rave though 
0,"@listfull Aww.. I'm sorry  On the bright side, you won't have to go back for a while after this, right?"
0,....I miss my mommy 
0,highhhh. madd fun at the hotel party. although i miss him... 
0,is getting impatient where are her friends???? [stil feels sorry bcuz she stood mark up  SORRY]
0,"@singa I love how empty the gym gets when warm weather arrives. Alas, fewer hunks in the lockeroom, though.  "
0,just woke up! & going nowhere 
0,http://twitpic.com/4gqin I FEEL LIKE I'M ALWAYS READING THIS ANTHOLOGY OR WRITING ABOUT SOMETHING IN IT. wahhhhhh  retainers & glasses on
0,Dave & Busters is kind of ghetto...so many people have babies here. It's...after 11. So much stimulation for a kid under 1 year. 
0,I miss you guys...sorry I was gone all day!  I guess I'll see you all in the morning and figure out how I can get LIVE on here to chat w/u
0,my mom came back from FL today w/ an XS anne taylor jacket for me. it chagrins me that she thought i'd fit this  http://tinyurl.com/cf2hfq
0,"@tommcfly haha i met dan at my last dream, so funny.. Wish it was true  i'll try to meet you now, ha! Xxx"
0,@Mashaaaaa wait NO I MEANT DONT MAKE FUN OF YOURSELF .. its not good 
0,"I'm awake! Am I really awake??? OK, need some coffee. In this way, I'm really German.  Can't tell you how much I hate this habits!!!"
0,I wish I didn't make eggs for lunch.  The house smells like a giant fart. 
0,@_HeatherBailey So strange... I haven't received it.  Can you resend? Checked spam folder and could not find it.
0,Thinks she has the swine flu!  ahhhhhhhh
0,getting zero sleep before i hafta get up early again 
0,"Hey, the DJ that's normally at Katz isn't here. Nooooooo DJ Handlebar where did you go "
0,"@andrewturner thought there was a particular software other then TweetDeck for Linux...will get Air on there later, school work now "
0,"@scarlet121 I think the pic's great!  He's a 'was', like my 2?  I have a stoney..tks,I need ta give him some! Mine(Batman) is'black smoke'"
0,I could care less about partying with celebs. I just want to get my groove on. It's only halfway happening right now 
0,"BROOKE! YOU OWE ME A PICTURE OF BRADIE  hahaa bored as hell, "
0,Just caught a glimpse of my studious self in the mirror... Geeze if i dont look like the walking dead! So much more to go... 
0,Stretching my sore msucles and sniffing the Hungry Jacks smell coming through the back door... great way to spend a Sunday 
0,@Spazzapan @velocit I hope you both have a great day in Geelong! And I hope your eyes are ok Steve 
0,I'm closer where I started....chasing after you........I'm fallin even more in love with you* holding on to all I've held on to 
0,"need a new phone  okay, maybe want.."
0,@MatMladin Totally agree... Stewart doesnt need help! Good luck Sunday down the street from my house at Barber. I miss Mladin vs Spies 
0,Umm fuck I think I just blew out my BX5's  crapolla
0,yeah....   >:-/
0,This Old lady in this movie is SCARY lookin 
0,I miss laying on his fat belly while he runs his fingers thru my hair 
0,"so good to reunite with my 2-time prom date, b-rad! we haven't seen each other in years "
0,Yo apple hear my cry PLEASE PUT A VIDEO CAMERA IN THE IPHONE.. the twit world need to see these fucking girls sadness 
0,@CBD126  That's upsetting.
0,Home now. So exhausted. I shouldn't have gone out with mono 
0,"For once, im being forced to go to bed. lovely. I didnt get a chance to apologize "
0,@OfficialAshleyG poor rob 
0,i am so drained but i have no idea how i'm gonna sleep tonight. 
0,headache from soccer 
0,I am despairing of ever getting some decent sleep! wtf am i doing still awake at this time of morn! too much thinking over too little  lol
0,@a_willow Good morning. Not finished; not feeling well. 
0,@Jadal86 can't see the video. It's set to private 
0,@TalesOfSaku thanks for blowing my cover 
0,How is it that all it take is one person to ruin your birthday. 
0,CAT scans are waaaaaay too freaking traumatizing! 
0,@earanequa cuz uuuuu were just all the sudden goin to the grove at 8:00!! Lol u would never got here haha..ida been waiting ..forever 
0,@MissSummer @djm2 I'd love to go see you guys 
0,"im sick, cause i got soaked in the rain while riding my bike yester day ughhh, and its a shit day  u?"
0,@babybabybaby no i didnt get no doubt kimmel ticket  but i have to work that day probaby
0,today is ME day YAY lol...though I have to work the whole thing 
0,@imagetic That's a bit disappointing. 
0,"I am SO upset that @johncmayer is in Vegas this weekend! I was just there last weekend, why couldn't he have gone then!  lol"
0,wow. i sent a billion twitter updates from vacation and they never sent  boo
0,im at the hospital!!! 
0,was at the greek theatre tonight.........I did not get to go  ? http://blip.fm/~5gqhk
0,My ears hurt 
0,@shaunjumpnow i loose a follower a day  mabey coz my updates suck haha
0,@foomin231 lisa... YOU... are amazing... come live with me! I currently live with 2938472394 people... none of which will make me a cake 
0,"@tylerabramfitch ME TOO! About the throat thing, never eat a tblsp of cinnomon and try and swallow it. It hurts SO bad. "
0,@songbookbaby You leaving me already? and we were getting along so well... 
0,can't wait any longer. downloading the new sonic youth album stream with @voxequinox right now. album release too far away. more $$ tho 
0,How does a Badass Weekend turn to shit in less then an hour..  Some ppl are gonna DIE!
0,Ugh. Just lost $100 on Deal or No Deal slot 
0,I love death note. Stupis kate wouldnt let us watch it 
0,@LiveLights Now you know how I feel when someone told me Ben Gibbard was engaged to Zooey Deschanel 
0,stuck in traffic on the 101 
0,Can't get into pure for the after party cause my dumbass forgot dress shoes 
0,"Just getting to work...I have drunk people to deal with, I really do not like dealing with drunks! "
0,I can't get to sleep. I have an urge to make friendship bracelets. 
0,"@newmer First of all- you should still get a Facebook, Princess Hookah (new nickname, like it?).  I'm bummed I missed your drunkeness! "
0,@foreverdecember ughh tummy hurts 
0,Going 2 go fold some more clothes.Fun. 
0,@pageoneresults now a tecate sounds really good right about now...I wish we had it where I am 
0,@stephaniemm is that time?  feel better
0,i'm a possum murderer!   he didn't stand a chance 
0,The old lady beat me 
0,"Study hall, soo much work to do "
0,Oh my gawd. Eleven thirty a.m. not p.m.  no yo gabba gabba tonight.
0,"I'm emailing some pics from today to my mom, then heading off to bed. Gotta start out in the morning back to Missouri  Want to stay here!"
0,@suzieqslife That's a bummer - I really like those 2 actors. 
0,@jarilyn_ashley I was trying to red eye down there yesterday... no sucess 
0,@xstarfly82 @mrcsh or... CHEESE!!  
0,"Typical, laid wide awake most of the night and now it's time to get up I could sleep for a week!!!! "
0,Okay I think sickness is all in my head. But my poor comp is actin up.   I'm actually kinda tired tonite.May go to bed soon.I dunno though
0,"Cant believe the four-day weekend is also already over ! This is incredible..oh how I wanted that ""best job in the world"" but no swimming "
0,Omg what the hell is going on? 
0,I wish AURA was still around 
0,@Tarahdice thats wack 
0,"@Emdoggg - so cassie and i are going to the store and we will be back in like 45 min. so, i'll be back soon! on skype!!!!! i miss you "
0,Finally home... Going to bed now 
0,Bamboozle seems so fun. Sucks it`s impossible to go 
0,"Just finished my CoD 5 missions, then got word I'm not allowed to make female friends due to boredom at work "
0,@tmdbbh2 yuh post to be my boo  
0,"@SChavez09 LUCKY FAT bitch  , i wish i was old lmao"
0,@saintartaud Soderbergh's Solaris was terrible. 
0,"@NKOTB I am DEFINATELY not a winner. I didnt win the contest or runner up or even honorable mention, And I never get tweeted back. "
0,"@angel_lisa ill put you on the list. unfortunately you would be number 43,926 "
0,"I have not rite to be jealous, but paranoia mixed with past experience.. throw in the fact that I'd've loved to've been there.. "
0,It doesn't get easier 
0,@whatswiththis thats too bad. I also forgot to set my DVR since we went to the movies   I guess we'll have to catch a REPEAT grrrrr... lol
0,"Obama will be at the Beverly Hilton on May 27th (I think).Tickets ar $15,000 (that amount is not a typo).  Maybe they'll need volunteers "
0,missing my man....... 
0,trying to figure out why I can't upload a picture on here 
