0,I feel icky  Exams tomorrow.
1,USER hehe i dont know who tyrese is but that ok  i give him props for not killing bruno and ill watch it but i wont be happy about it
0,"Shame on me, lastfm downtime temporarily broke my site too   Oh well fixed now."
1,"USER I actually come here to get love! True! I completely understand, many times I get blissed out by how loving tweeple here r!"
0,It isn't bad today. But I wanna go to home
1,USER of course they dooo  i would love if that happened !!
0,My aunt and uncle just arrived from philadelphia! I am loving my nails except one of my toes got messed up!
0,USER: eeek! When do you move officially?
1,USER sent essay. No poems or pics
1,am following my first south africa based twitter acc (its a big deal for me USER..now to figure out what its about
1,heya I am online now...check my web to chat with me
0,USER ear infections are worsum. I feel Ur pain
1,USER Sounds like the Captain and myself need to be more attentive to our working spouses    Deb hates it as well.
0,"Damn,  no hawaiishirts available , nowhere"
0,"USER Or crossing his arms, even. Must be tough being an mecha-styled Transformer"
1,USER ...no worries.. i know you ar eso budy..just take care though...mwah!
0,USER hahaha HOMEWORK HOMEWORK AND MORE HOMEWORK  haha and u?
1,USER what a great idea!
0,Yucky rain in Philly
0,has a fever
0,I have moobs
0,"USER I haven't left the house all day, FML. Doing some sort of 'fun' homework.."
1,Laughing at this goofy rollover feature on #cpanel for the #rails app section
0,feeling sick.. its not fun
1,USER wow did your iPod break? You haven't posted in hours
0,Aw two sheep are in the field. There scared of me.
0,"USER yes, USER n I are campaigning. ps-sweetcheeks still didn't change his pic!"
1,"#redsox if anyones got an iphone, everyone should get ESPN ScoreCenter from the app store  it's awesome"
1,USER URL - lol luv it! come to australia??  pretty please
0,USER I accidentally wrote on ur side for tommy's yearbook. I'm so sorry. Complete accident
1,SHOWERSHOWERSHOWER  I'm so glad that hot water was invented.
1,"heading to Vegas / LA / San Fran in a couple of months, suggestions of things to do would be great"
1,USER Thanks for the hugs BB
0,chinese delivery.  more coffee.  liver is madddd today.  gotta get it together for the neighborhood speakeasy rogue bar tonight! i'm old
0,USER ahahaha! it's the cheesy side of me.  | Charlesss! we never fixed that MESH song problem.
0,OMG the look my mom gave me that time I was unable to UNDERSTAND...but surely it was a NO for a twitter account for my tortoise Tracy.
1,Ive chosen Grease
1,USER well...in about 1 1/2 months' time
1,just put the kids to bed and getting ready for another day
1,is watching Gossip Girl
0,"USER sheesh, dude, i feel your pain! exact same thing happened to me about 5 years ago  its horrible"
1,wanting to have some fun
1,Tonight's faux foofy wine party at our house was a success!!
1,USER Just wanted to say how much I've enjoyed reading some of your Tweets and I look forward to what is to come!  x
1,USER i have to wait until I get to Lazboy- my 2nd home to get the java  if in New York in Syracuse it's pick a pair...ask for Ruthie
1,"Whew, found someone on Kubuntu IRC who had the same problem as me with the freezing, helping me through it step by step"
0,Another damn day ends...!!! But still i have got work to do...
1,i'm playing restaurant city
0,I do so love only getting 3 1/2 hours sleep...
1,im not going to school today!
1,USER Thats why I'm still sitting inside!
1,Giving Thanks for a New Day!  Phone already ringing off the hook ...
0,"USER Oooooh, I see  Sorry"
0,is in the office. Crossover is lonely.
0,"Just mowed the lawn partialy. Earlier this day Pien, Anke and Esmee visited us. Lots of fun with J'mien and Ella,.. not without damage"
0,Analyst consumer financial market in Thailand.
0,USER ugh.  that does not sound fun at all.
1,USER i might love you   I will a bit later! kiddos dragging me out to swing.
1,USER  me wants!!
0,please oh please . someone MUST save me from bein stuck in the house . lol i CANNOT take it .
0,landon donovan is a beast!!!!!!!!!!!!!!!!!!!!!!!!!!!!!!!!!!!!!!!!!!!!!  2 bad U.S. lost tho...
0,tada home. well this means back world =P is everybody asleep now  boo
1,Watching High School Musical 3
0,"USER Mine are terrible too  Can't believe how much this is hitting me. Eden's post really helped, but today I'm feeling down again."
1,im out of the office and I really love to rest!!!
1,"Just got back from picking my sister up from work @ KFC, she got me a large popcorn chicken and a choc moose. She loves me!"
0,studying ...evidence   listening to Miley Cyrus ... The Climb bye  xoxo
1,soooo excited for tonight..JB stuff..and New Moon stuff!..eeeep!
0,has been outside all day snapping photos..now I am super bored
0,USER so i take it u won't be here 2day!!!
1,HughLaurie - Protest Song URL
1,really loving the song ''never say never'' by the fray.  really great songg.
0,Moving the boyfriend to his new apartment today... No tears today..well....maybe 1 or 2
1,USER did it all make sense? will you explain it all to us when you get back?
0,My fingers hurt
1,good games of ball today
0,"Giants get me broke... I think it's time to save for season tickets ;) hehe.... Warriors I love you and all, but you have bad transport."
0,USER I feel you.  The virus is what I'm more concerned of. I'm scarrred.
1,"Twitter article in today's Ilta-Sanomat ""Celebrities and Twitter""  Finally Finnish media is talking about tweeting"
0,"a little rectangle shape of heaven... i wish too have one,.."
0,USER exactly
0,"USER Oh man. I'm sorry  Did you ever message my friend, Amber? She said she'd be more than happy to share what she's learned."
0,USER  i miss summer 06 too. soooo much. i talk about it all the time and how it was hands down the BEST summer of my life.
1,USER But you did.
0,"USER STOP, I do want to not know anything about sad things for today because today is much"
1,Nick Shen is baaald!   History and Calc Final tomorrow. Oh the Joys of being a student
0,Pissed off still about what happened. Im just disappointed... Is all.
1,USER Thank you glad you got some good laughs  Still not 100% happy with my hair but I never am IRL either :p lol
1,Wishing All my mothers Happy Mothers Day!!!!!
0,Off to work.... Have to be in Stratford by 7am
1,"USER haha, yes! That's for sure  sorry I missed your bb msg....we were watching a movie."
1,It's such a beautiful day! I should listen to my audio bible on my phone while I am sun bathing!!!
1,What is your favorite wine?  Please tell and why.   I'm drinking a Pinotage right now.
0,feeling like shit. awesome.
0,PROM=AMAZING NIGHT can't believe it's all over
1,listening you've got a friend - mcfly. UHU today is the day of mtv movie awards
1,USER haha sure  thats really ausgefuchst  ^^
1,USER USER i'm going to both sway sway sydney shows... been telling tam for ages to come too !! can't wait  ox
0,Awww... I'm trying to sing but I can't cause I'm sick!!! Ughhh... I hate the feeling!!!
1,"in the office today, working hard.  Very nice ride into work: top down, blue skies, singing Dave Matthews Band tunes."
1,USER Oooh I've been using mediaconverter.org  Ima give this a tryyyy~
1,Could imagine if starbucks was actually putting crack in their coffee. We could never tell. I'm so addicted. I need help.
1,"on the way homee, bamboozle was siiicckkk"
0,Hmmm can't see tweets on my phone    have fun tonite all you O2 girlies!!!
1,"USER hey, you read my daughter's column on tech and chess - see cap at bottom  URL"
0,says ...but i saw you and you drove yourself away from me.  URL
1,USER Happy Birthday to your Dad!
1,finally offah work
1,USER I know. Be sure and follow him....  USER  (His name is Bryce)
1,USER HEY! who do you work for?
0,Crap. I overslept like no other.
1,Call of Duty Modern Warfare 2 just announced at E3
0,Dam*it! I just got a huge snag on my Miro Satan jersey
1,Even 7 days  !!!
0,"ok..2 of the songs deleted off my comp was ""games""...& ""didnt i blow ur mind"" any1 wanna email me those mp3s? i cant find my box of cds!"
0,I want people to leave so i can go to sleep!
0,So allergic to bugs. I got bitten out on my terrace yesterday and now both bites are red and bigger than silver dollars.  owie!
1,USER I'd like to nominate Die Hard and Seven please   #film_club
0,2 more weeks till my birthday?! D: what?!  I don't like getting older.
0,It's a rainy day today.
0,USER nooooo.  dun be sad
0,Hatess Headaches
0,Hey USER i need kristen stewart   (X17Live live > URL
0,Who stol my nick TheHorn?
0,applied for unemployment.
0,USER Ahh! normally I would jump at that but i'm manning the office solo today
0,"USER I really hate the south for that bit of tradition. My folks are in NC so I'm very familiar with that ""law"""
0,Played one hole at north palm and it started raining.
1,"Planning to check out what the ""One Minute Manager"" is all about. Ganesh had gifted me the book on his wedding. To relationships buddy.."
0,"USER yeah, if only the compiler would let you have initializer syntax anywhere BUT an initializer..  (i.e. an Action<T>)"
1,Going to eat
0,TGIF - Still no chance to twitter today!
1,First day of summer was awesome
0,URL - fried rice + mayo + tomato sauce. I found a piece of broken glass
0,The death toll on the red line has risen to 4  somethings telling me that it's only going to get worse.
1,USER Thank you Michael
1,USER  Hey there! How are ya
0,misses bailey already  don't forget about the pigeon bailey!
0,i'm having a mental breakdown. CRRRYY.
1,USER strawberries are good with or without chocolate.
0,USER and I missed it
0,USER -__- wth...people should do some research beforehand. hai. poor creatures
0,it's sofaking cold here... 56Âº at nite. I'm so disappointed in u Chi
0,"USER I know, i am too. The one year I'm not going to be in NYC"
1,"USER Exactly. It is kinda pointless, especially in the morning when I need to wake up!"
1,i'm watching the little mermaid  i love this movie. haha. the disney movies from the 90s are the best!
1,"USER it's ok, at least I got praises from tita Precy!"
1,USER i already brought mine
0,USER Tried to give you some props but blip says I already gave you al the ones I can give you today  #pawpawty
0,Devoid of inspiration  how can it be this hard to follow commission guidelines? D:
0,USER ( poor thing   kiss them for me .. it breaks my heart hearing news  like this ..
0,Sitting in the car. My ipod is about to die so Im not gonna have anything to do.
1,USER wow I just recently figured out the formula to success lol. and it worked!
0,i wet to hyper and excited to down and sad
1,USER thats because you are glorious
0,Coming down from the 5 day weekend. Boo!!
0,con tortÃ­colis....
0,"USER There is one of those setups a day. Haven't had one today though, so I sit."
0,"USER s'all this love, thought you lived with ya mam? I don't have a spare sorry"
1,USER that's my cousin's birthday!
1,"night guys,leave me stuff   love ya   **Loves the Hardys**"
0,I need a mars duo
1,"USER Interesting! Seems as if usage is intense. I don't consider 25 MB/month a lot, though. Maybe the gov't needs a bigger pipe?"
0,cuz im not
0,"USER Awww...  Don't let the boys get to you, girl..."
0,Maaaan I need me some money. I'm like not getting any hours at work
1,"USER happy gardening day Joan, I love peonies post some pictures"
1,: Solo drive around town a roaring success. Getting behind the wheel rocks!
0,"Gutted - Come to work, find out #MarsVolta are playing in London tonight AND the 13th July.  I already have commitments on both occasions"
1,USER um... every day?  hee hee
0,"having breakfast near my new house, moving house day! but later need to go back to office"
0,"I don't wanna get old and mean, or old and slow."
1,USER I fucking love the fucking internet.
0,"USER dammit!  i wonder what their backup plan is humm.. I call soon, bout to take off now weeeeeeee"
1,"USER you could easily replace ""links"" with ""women"" and it'd still be valid"
1,"USER make a short one that can ACTUALLY be accomplished w/a space left in the day, then forget about the long one till the next day"
0,"Will not get her drank on tonighttttttttt, must let my liverrrrrr restttttt YO!"
1,"Snaaaap. Alize Cornet? Wow. Anyway, we got some family visiting from SD and they brought some good-as-fuck bagels. NY-quality, goddamn!!"
1,loved my friday night and is looking forward to 2014!!!
0,Twitpic on twitterberry's not working. Says file type not supported.
0,"USER JK, I STILL CAN'T VOTE!!!"
1,USER Patty Have you seen the Trailer For NEW MOON?
0,says cant biliv that her best friend celebrating her buffday on her bf's buffday  URL
0,"USER Fun hanging out with you, too! Would be even better if I were on the beach"
1,"USER lol... Yes, u can check out the site to find some really good style advice! But w/e u need, I'm here to help!!"
1,USER I thought so!
0,"USER Yeah, it's heartbreaking  who could do that to a loved pet???"
1,"USER Funnily enough, Roland is President of my social club!"
0,Driving to the reception I'm sleepy and hungry
1,watching the Britains Got Talent repeat atm. Im pretty happy Diversity won though
0,"USER Aw Tom, I bet that brazilians are better. Ok, i know, you have got lots of fans around the world, but we are crazy about you"
1,USER why would you want 16 GB? Buy two 4 GB or 8 GB max. Two is better backup in case one goes AWOL or FUBAR
1,Watching Saturday Night Live guest starring USER !!! LOVE IT  Have a fantastic night everyone!
0,got off work! wrappin mums gift! then nightlife here i come! sellin the jetty 2marrow hopefully  from pt A-Z!! i love little white!
1,going back to OS X after a forced 5 month hiatus with only my Windows and Linux boxes makes me a happy camper
0,USER those aren't spoilers  anyways i am overall disappointed with this 'update' some things are worse and its really buggy.
0,comedy central removed from zattoo  no more sarah silverman? family guy? Saus park?  no more wasting time
0,USER <3 I hate timezones  they make me angry. are you at work now?
1,I'm listening to music and reading new moon  [stephanie meyer] is a wonderful book
0,USER I'm a little shocked too... the big hotels are still charging for WiFi but the little ones offer for free.
0,got a mosquito bite in the morning  I hate them!
1,USER That is just as cruel as USER taken pics of desserts he knows full well others can not partake in...
1,"waking up on a beautiful, sunny island is hard to beat"
0,Watching this dick pigeon steal all the food from his buddy pigeon. Buddy pigeon is eating scraps
0,Wanted to see Monsters vs Aliens but was too late.
0,still fuckin sick  HELP ME
0,USER Already home
1,<---- Tired of elementary tricks on twitter. This shit needa be 18+ unless u a celeb! ( i'm 23)
1,USER I've been doing that since forever! Avoid twitter/facebook until you watch the episode!
1,USER 2months & like 3 weeks until the god that is bradford graces cowboy stadium
1,excited about meeting the baby and being pool side tomorrow
0,USER What's wrong?
0,I need the new update for my iPhone!!
1,Just watched the Shaolin Warriors at the Playhouse in Edinburgh. Bloody brilliant! ...'nough said!
0,Working. Tired. I wanna be just lazy...
0,"USER even though i'm late... hopefully we will have hbo by then, if not i gotta wait"
1,i cant believe i have so much metal  i am proud of myself.
1,USER thx
1,Twitter Karma. See who's following you and who's not among your followers. LMAO. Useful!  URL
0,i see USER has been onlione quite a bit! lolz -poor sickly bed ridden poppet  -miss that silly twig
1,Pleased the weather has settled enough for my fair-weather cycling to work today!
1,USER can you pretty please come on tour soon? i love you so much & wanna see your show!
0,USER I can't text you back
0,is bored at work
0,got soccer training in like 20 mins but my back is sore
1,"USER USER being a fan is certainly not about being attractive. But, if you like the pink, to each their own  #canucks"
0,"USER Yeah, it follows his little sister...I am rather skeptical. No Jake Gyllenhaal."
1,"Road trip to Orlando with the fam to see the cuz!  were blessed she's out of the hospital, yay!!!!! Blessings to ALL!!"
1,USER is there nothing on the crime network you can watch?
1,"993 followers ,setting for 1000 by tunite,someone pls recommend me?? #follow #love  #tellmrtweet"
1,USER haha me too! i mostly use the brushes too. curves not really. u can start designing your blog header!
0,USER i'm not going to NY
1,"has a ""communist"" daughter"
0,"USER realy ? that's so cool, but, I will need to wait a little more"
1,I'm so excited!  my god! I'll be there... at the River Plate Stadium  yay!
0,USER Itâs been sidelined until I feel on top of what I need to get done this week.
1,USER lol you and your greeley
0,USER Ah Soph i'd love to but i seriously can't afford it! Weekend after i think i can because that's when i get paid.  Hailstones!
0,USER I know what you mean. the Makka na Ito one makes me tear up every single time.
0,".. And yet again, no lady-luck beside me"
0,If jenn doesn't call me back i won't be seeing 17 Again.
1,By the way: if someone needs to know something about Poken or wants to buy a Poken: visit poken-shop.de Special Deals for my friends
0,USER   So we can't talk today damn it!!!!
1,USER you might be the only guy I know that has seen the entire series of the OC and is workin on a second time. FIND A NEW SHOW
1,SuBo in the top 3 of Britain's Got Talent. What a surprise  I hope she fails.
1,USER We don't make waffles per se.. but we do serve in some kickass waffles cones
0,is working while freezing...
0,"I think I might be in love with Srider. He's amazing. ElfBoy's pretty cool too, though. So depressed that wizard dude died"
0,"USER no pain to really be the issue though, there's the thing.. can't figure it out..."
1,"is going excited, going out to night xD WOOT!   got the Harajuku lovers fragrance 'lil angel'"
0,USER Ouch! That does not look like fun
1,USER omg I'm so proud of you.
0,Tori has now gained possession of my favorite sweater. I liked that sweater
1,watching laura's nephew dance
1,USER I floss out of necessity and I don't dislike it at all   Healthy gingiva is muy importante
1,Playing dynasty warrior gundam 2 with alexis and eric
0,USER USER my siblings and cousin just left after a week of visiting. Its too quiet now and I miss them so much
0,USER I feel so sorry for the women that lost her husband to those disgusting thugs! Hearing her story made me cry
1,"USER is the airbrushed painted pic official? brooke, you can do so much better. really"
1,"USER arf! yeah, that's bad"
0,USER lol oh thats a shame  so whatre you gonna wind up doing? art stuff probably?
0,USER I'm sorryy!! My internet kicked me out and now for some reason I can't log in msn  I'll try to fix it <33
0,USER Lol! My throwing range doesn't extend to 1000 miles
0,Aww...my family went home...now im by myself...
0,"It starts at 3 but I have to pick up a friend from the tube in a bit, and it seems I shall have to walk down with a umbrella just incase"
0,USER Do you know how to turn off TWITTASCOPE? Please someone help !!!!
1,USER Ok you should let USER know about this.. maybe we can convince her to go LOL
0,USER who from the mayhem crew is USER and whycome they don't love me  lol
0,USER Cause I got it that I haven't  truthful friends   and I was crying long time (lol)
0,Just caught a glimpse of my studious self in the mirror... Geeze if i dont look like the walking dead! So much more to go...
0,Tummy hurts
1,"USER I hope you put everyone in one row, Hahn style."
0,"Wish I was with Cece, Alex, and Dan.  I miss you guysss."
1,USER  sounds very chilled
1,"USER Congratulations, sir! I hope you and Bethany have a great life together!  Also, read any good comics lately?"
1,USER Great!  And after that bike ride it surely must be time to update the bio..?! ;)
0,... He came in the bathroom with me!  and he was like doing his hair and stuff. It was so strange. And we were talking and what not. Weird
1,USER I feel for you -- I'm a coffee addict too
1,"USER Hey man, 3am is fashionably late. I got to see some nice drama, I got my monies worth."
0,awggahhh. My tooth really hurtssss.
1,"USER Please play this in Philly on June 30th  311- ""Jackpot"" URL (via USER)"
1,"USER Mr Smith told us this story about how he lost all of the Year 12 work, and he freaked out about it. But then he found it."
1,in graph comm with colley ! weekend was awesome. got sunburn ! looking forward to the birthday
1,Two of my favorite websites...URL and URL Hours of entertainment.
1,"dad n mom r home, wad a day"
0,ChillN wit da boodizzle K FED! Hatin to see her leave  Was prankN wit her n my Biga niga Mesh rizzle but dat turn'd to a truF ceramizzle..
1,"any one fancy writing a guest post? more than welcome as long as it's all LEGAL content and not too offensive, just @ reply"
0,"Going to bed, hope im ok  Cant wait til morning to call the doc. Pray for me yall. Goodnight!"
1,jus got homee. gooddd day
1,Switched rooms at work. Finally some space
0,"USER 9.30? That's just showing off. I've had the old ""wake up at work o'clock"" thing this weekend"
0,mÃ¡m zÃ¡nÄt moÄ?ovejch cest...ach ne
0,"USER oooh really? Well, the polutions surprised me though. Ghosts? Haahaha,Goin back to reality suckss"
1,USER Hoorah - you're back!!
1,i think its time for another cool fact
0,"USER If you can, but DM doesn't seem to work much for me"
1,"USER Yeah, he told me you were braggin bout your new tat, hehe! j/k"
0,"USER i miss that place, but miss wegmans even more. whole foods != wegmans"
0,"USER some guys dont like to be chased after,maybe he will ignore me forever,i hope not though*tear*"
0,USER Tammy doesn't teach my class  (Love the profile pic btw)
1,"USER night, you! am proud of u being sober  xxx"
1,"Demo of Holy Invasion of Privacy, Badman!: What Did I Do to Deserve This? is definitely awesome. NIS has done it again."
0,"wow, yesterday/today was so awesome, i'm gonna miss you guys"
0,There is a blackout  I'm just playing the piano that doesn't need to use electricity
0,i'm standing here but you don't see me
1,Feeling really good
1,"USER  Been doing alright! Surprised I remember as much as I do, which makes it easier!  So far so good!"
1,"USER  - Good luck on Sunday. I started training to late, so hopefully I will see everyone next year"
1,USER. No way. I really can't stand her! Each to their own i suppose
1,"USER well said, my friend"
0,I miss everyone...i still feel like poop tho.
1,Friday afternoon 15min design challenge is on right now  URL
1,"USER The week before that it was even funnier, or was that just cus we were drinking cider?"
1,"I last saw a movie 115 days ago, back in January. Uni life sucks. Resuming with what else... but Transformers!"
0,woke up early.Just got a text USER so sad
1,"SurpriseSurpise 30mins in2 the movie,Dad falls asleep. I tried 2tell him! Lol. So no Omen2nite. Darn!Haha. Maybe 2tomorrow...or not, hehe"
1,USER thanks  you rock!
1,Lets get it on
0,OMG my stomach feels like it's in a blender on puree. I haven't puked after drinking but I guess there's a first for everything.
0,what am i going to name my blog? My first and lastname were already taken
0,"USER oh my god! that eminem video is so freaky  wish i didnt watch it, lol!"
1,USER it is  I usually just go over into the next post etc. flashback: telling a friend a story over twitter in 50 updates hahaha
0,Driving back to Tampa depresses me  I am perfectly content staying at my mommy's house
0,"USER awww I'm sorry  I am no Brandon, but I would have totally gone with you lol"
0,"To add insult to injury, the rear wheel was stolen off my crippled bike.now it just looks like a sad pile of scrap chained to a fence  #fb"
0,USER i cant connect to msn!
1,finding twillight books
0,"darn, get way too excited and unable to finish this damn two pages of a simple translation."
1,USER see?
1,"USER Nee, Individualtourismus ist viel cooler."
1,"Fangame, Life: ..Oy, nightmares... Anyhow, gonna work in private today for just a few hours. I work better undisturbed."
0,"rainingg again  but the suns outt. rainbow on its wayy(: School tommorow, more tests!"
0,im choking on this vlog man omg! i needa rehearse b4 i get on cam
1,is still up  and watching have i got news for you on catch up. Enjoyed BGT 2night as well
1,USER I'm the same way... and you're right... they either love it or hate it... Scary hot b!tches we are!
0,i have GOT to get a boyfriend this summer...i feel so alone...
1,"USER no way!!! surely that's impossible, there's loads of us!! might just sleep with my eyes open in a bit"
0,"Brunch in 3 hours, so NO breakfast this morning"
1,USER Aww cool
1,"USER now its like, i don't even want to watch them.. but then again i do cause i love drama. haha!"
1,listening to nick and p-nut on loveline
1,"USER Hi!  I was in Wellington (back now).Good idea, should probably start mine- A:Short updates are easier then long blogs. Everyday"
1,USER yeahh. You are..but that's okayy.
1,"USER  no that means you have a good imagination or deep down, you're still an optimist"
0,"USER Sorry to hear about your dude probs, what is it that's too much?"
0,"By the way, Ed McMahon died."
0,"USER loving the Eagles, haven't heard in ages..........you a bit down hun?   x"
0,USER o rly? whose ur friend? just june.lol cant believe u dont trust me
1,im going to go to nicoles house soon!!!! YAY
1,Nathan might go mini putting with Marcus and chill at his house for a while. Nicholas and I can chill together and do something
0,Waiting to hear from the girlfriend..
0,Signing off to enjoy the rest of the game...and because my laptop battery is dying.  GO CLIPPERS!!! #cclip
0,USER Don't know
1,USER Happy Saturday
0,USER i dont know how long it takes  and TGIF
1,"survived my 3rd year even though it was a little rough-overall great kids, great team members, & a great school ... tues @ 12 = summer!"
