1,business coursework. what fun
1,USER tu fais des excuses maintenant  ?
0,USER I guess people that are goodness and light find it hard to believe how low someone can go  BTW your son rocks!
1,"USER thank you muchly  you, too!  Love your froggie av - so cute!"
0,"ow, i can't move my neck or my back   hurts too much and i don't know why D:"
1,"Dreaming about Diving in Silfra Rift in Iceland, where Europe and America meets"
0,USER Hands in the air
1,USER ill be there after i get home tonight! just dont end it early
1,"USER good !!, awww thats good then  glad its better !!, yh am good tar!!"
0,Played B&B this morning with the hikers. I could do that for a job. Now gonna ride the Va. Creeper Trail. Its 55 out though.
1,She really makin me work for This SHIT! Lol. Ight ma. You got it.
1,USER LOL sounds like my kids
1,...sorry kid....no lady killing today  your sweet talking won't work this time
0,USER I'd like to do the same with my jewelry! Business stuff eats too much valuable creative time
1,"USER I don't think she is THAT hot, but I like to see her pick of hairstyle-make up-dress. She knows how to look good"
1,USER ciao Ju
1,USER Get 100 followers a day using www.tweeteradder.com Once you add everyone you are on the train or pay vip
0,USER Damn you man! I am the only one without an iphone
0,Not supposed to be this close!!!!  traffic got me stuck right next to the tracks ahhhhhhh URL
0,Throat is still SOO sore.
0,just lost playing the price is right dvd game to a 8 year old
1,USER dont worry lol... i can see if they have  thanks anyway
1,USER lol there's even corn flavored ice cream now! haha   3 in 1 plus 1! LOL.
1,USER try that on a saturday morning and then serving breakfast to over 100 people
0,I am so sad Randy orton just lost his title
0,USER potentially a dealbreaker for me right now
0,"Chillin out on sunday morning, and enjoying his boredom. On Monday it's back to work"
1,"Hi new peeps, come and chat, I wont bite... well not hard anyway"
0,"Stuck next to raisin in ICT, joy. No help at all he's to smart"
0,"back in Athens, back in the office...achy and spaced! Blah"
1,USER hello pooh  me waiting for class nizz ughh!! yay keys! have fun ;)! xoxo!
0,@ gadgetopia need to DM you but you're not following me.   Will send email.
1,"the longer I spend writing this proposal, the more I think I should up the price"
1,"USER Touche! (As in ""two-shay!"")"
1,"In the graden, lovely weather  Got a headache+feel ill though from last night! It was good thooo"
0,arrrgha  i wish i had a blackberry
1,OMG COMMON is at the Applebees in Alhambra! Ahh i love him!  <3
1,My eye is back to normal! Finally
1,"USER yep it will be fun, full of stimulating conversations I guess as  USER has done his back-in"
0,i want to go back to bed
1,USER See I feel last year was slightly 'weak' but still good enough to justify going  i just wish Devin was there also
1,"USER : Darn, could only pray for that.  I'm probably gonna start saving for a new desktop and build it from scratch."
0,"USER That's so sad, sorry to hear that! I hope things get better for you soon"
1,USER : i thought you had longer hair..  anyways your hair looks good  xx
1,USER thanks.  tired of explaining it to non kannadigas. wat does 9_6 stand for???
0,USER awww... shame man.  my mom sometimes catches me if i'm not careful
0,USER I will contact them Monday and see what they say... What a pain  Technology doesn't seem to last 5 minutes these days.
0,"Foreva in my heart...grandfather, grandmother, cousin, aunt.."
0,"Just heard about my girl USER and she doing okay and the bay bay bay is fine too!  Keeping her over night, though"
0,i thought i had Modge Podge  spray mount will work but i am clumsy with it
0,"reading Bible, studying for chem lab, working on that presentation  and its BEAUtiful outside. mmk. thx. :'("
0,"man i need that blkberry 8900, t-mobile talkin bout i can't upgrade til january, wtf been wit the company for like 4yrs now!"
1,USER it's hard to get them mixed up  but I understand what you're saying.
0,can't wait for the 6th! miss my class and gl
1,rocking to vintage mcr
0,"on the way PRJ with mamski, papski, aa jian, neng and si gendut aling.. waaa macet bgt, fikri belum ngabarin lagi"
0,USER Oh btw I did try magicians quest again and it doesn't work with my internet  It's lame. And it makes me very very sad :'(
0,If I had my way I could forget all about the fact that Lady Gaga exists. Unfortunately that's not an option.
0,What'd i do? What i did i honestly didn't know i was doing.
0,4 true friend ... where are the other ???
0,USER I want some noodles now
1,USER I understood what you were saying about O'Reilly and respect it. Just didn't care for how USER twisted it (in my eyes).
1,USER how does it feel to work with megan?
0,"USER i wanna be where you are, no donnel jones"
1,USER I'm watching the mentalist  what you doing?? no I'm from Manchester in the north west of England
0,"oh USER I told my friends that your blips were cool, & now u have gone and put on a Genesis track"
0,"Fuck, they turned it over."
0,"Thunderstorm over now, bright blue skies above...shame it's meant to rain all week"
0,"USER No fun, I don't want to win...I want to play  lol"
0,i eathier have hay-fever or i'm allergic to something. badtimes
0,I hate the international shipping rates. They are too high for me. I don't want to spend this much money but I want those things.
1,searching for friends to follow and to be my followers. and now there's ng kim.  haha. so glad to see more friends here.
1,"On my roof top sipping on coffee, taking in the sunshine and revisiting the pages of Maya Angelou's poetry...Happy Sunday"
0,USER now I have to name it é»æº  the pressure
0,Least u can get some more! Im broke
0,My wrist hurts
0,tickets for sale for hbp at local cinema. ticket for 18th July please    . i'm gonna get off that plane and go straight to the cinema!!!
1,THANKS DADDY!!!!
0,Going to work
1,USER When I was younger I wanted to be just like Sarah Greene; I was also convinced I was going to grow up & marry USER
1,with my cousin
0,am wondering if i can get away with sleeping at my desk today i'm so tired
1,USER Have a good time Wendy!!
1,"USER You talking to me? Haha. Yes, multi-tasking is a gift, but laziness just gets the best of you sometimes. You know, excuses."
0,USER I don't feel old except when I look in the mirror
1,USER Thank you
0,USER yes and i'm all mixed emotions
1,Wants to hang with Joshy JonJon and Mandar!!!
1,Well good morning all....& what another lovely warm n sunny day it is here in the good old UK lol  Im lovin it!!!
1,"my sister bought this nail polish today, and when it dries it smells suppperr goood! its kinda fruity"
0,reading more reviews just makes me want it more  URL
0,USER hes my fave youtuber EVER. way better than mitchell davis. HAS TO BE SAID
1,USER block them don't lock your account. it doesn't take extra clicks. just read the new twitter emails
0,USER me too..aint nuthyn to do at mah crib
0,"Have a lovely day tweeters, i'm off to sulk because of lack of tea bags"
1,USER and that's why you don't design shoes
1,"USER Yea, we've got plenty!"
0,"had to rescue all my little corn stalks, just about every little stalk was lying almost flat on the ground"
1,Going to try and fit 2 weeks worth of college work into 2 hours. Somehow don't think i'm going to do it. Ah well...    <3
0,"It's too early for a Saturday.  Oh summer break, I pine for you!"
1,#MotionX Share: Testing motionx gps iPhone app twittering  URL
0,cleaned allllll day today. i wish theree was more to do in Glenullin
1,USER im not sad
0,"USER awwwwwwwwwwwww i am to far away  to get down there fast enuff, la salle ill is about 90 mins away"
1,USER LOL! I'm only alive + well right now b/c it was a BABY!
0,knowing that i am not alone in my extreme dislike of my co-worker makes me feel a little bit better. it doesn't make her go away though.
1,OKAAY. BYERS.  :|
1,Wow Germany were very disappointing. Quite disappointed with Dita's performance too. I can't believe Norway won  Roll on next year!
1,USER take care on your way home gelli!
0,USER - i've been playing this in the office for months!! you only ever take music advice from USER da Bank now
0,I can't believe this happened. it's like a nightmare that I'm never going to wake up from. But its life and I have to deal with that....
1,URL - Ready for a night out wif sissy
0,Had to say goodbye to my mac for awhile because it's sick
1,but most of all I'm chilling with  Amanda Lynn !!!!!!!!!!
0,AHHHHHH my bag is stained  I'm so stupid...
0,USER We all know we missed out!  Your boy Danny Tweeted about some rumor of a cruise every 6-12 months...Got us all riled up!
1,My new hair freaking rocks. And those little kids at locks of love with have hair. I am so damn nice!
0,is wondering if there is any pain worse than a toothache
0,"USER awww bb,m my computer broke, and my sister's computer can't handle photoshop"
0,Its finished now  i cried.  Brillant movie
1,"USER Hi, You got some really nice button and wallets out there. At least you got something to ship out."
0,Yay ! The show Chuck is coming back next season ! It was almost canceled   2nd Fave Show !! Scrubs being 1st of course !
0,is munching on a hershey's bar...will be home from DC at midnight!
1,follow DRPOSTALOT ON TWIITER Follow REMEMBERMENINAB ON TWITTER URL
0,Wet and cold. Now warning up in the pub. I don't wanna venture outside again
1,had a wel good nite how fit was the dj upstairs!? Hehe
1,USER yes  sorry i couldn't text back because i was waiting for drew to answer! hah
0,Bradley Whitford and Jane Kaczmarek to divorce.  thats too bad   :  URL
0,"Staying at home for now, no swimming. It's raining."
0,Hates petco! Jerks wouldn't give the new puppy a flea bath even though she really needs it  going to canyon lake tomorrow to get her shots
1,I doubt that perfectionism and excellence is a bad thing...  eu-stress not dis-stress.
0,USER yes a pencil bag! I have all my stuff in there
0,yuck doing revision. Yes dad I AM doning it. i dont see what the point is as im going to die of swine flu anyway. Oh well back to physics
1,USER  ? Grazin' in the Grass - Friends of Distinction.
0,New hair but all my pictures look horrible  Xx
0,I can't get to sleep  i'm like spamming twitter. I have to get t early tomorrow. I wanna  sleep
1,Add our facebook page  URL
1,hahahahahaha that sentence kinda makes me cracking up  but of course i'd be the 95%!!
1,Half way through my first day at internship. Not bad so far
1,Hey USER  Can i please get a shout out too Bow?   (officialbowwow live > URL
1,Woooo I got accepted!
1,USER I miss Howie too.. Although I'm really starting to like James now  I really hope he wins.
0,"is wishing she wasnt leaving so everything could work out with youuuuu, maybeeeee another time another place"
1,Hands up if you love dressing for autumn
1,listening to Paranoid  it's Swedens national day today  June 6th..
0,The Lakers played yesterday and won !!!!!!!! Go Lakers! Looking for something to do. I'm SO bored
1,"""aunt katie, why does that girl have wrinkles in her hair?"" ""gracie, those are called curls. Aren't they pretty?"" ""no.""  lol"
1,I finally got my drivers license today. Only 2 years late. At least I got it before college which is better than some friends expected
0,"reallly sick, going to school  I just want today to go by reallyy fasttt!"
0,I don't want this day to end yet
0,Again... cleaning up freelance code
0,"...Wait, what? Mr Kennedy released??? This is a sad day"
0,Going to the gym... Yay
1,USER good things come in small packages  and jersey definitely does have a crush on TGN
1,Yo im so hot just like a tamale! NICKJ IS OFF THA CHAIN!
0,URL lmao random and HOLY SHIT i sound manly  kinda bugs me
1,USER LOL Always glad to be an inspiration sis!  We like normal names... Much like yours!!
1,USER there is no absolute truth when defining fun. You are so modern.
1,USER Thanks man
0,I rly want to watch terminator pls!
0,nothing to do
0,I miss him soooo much  not gonna see him for 2-3 months
1,at work ... man i like twitter
0,"USER Awful, awful sad story."
0,cant sleep D: i feel sick from all the cupcakes  fuckin hate myself i am a fatty D: i am going to eat this shit off lol
0,USER omg what woman want is the best film ever!!!!!  i loves it lots hee hee  wish i had known it was on!!!
0,My grandmother's homemade cookies are terrible now! What changed
0,"USER It was ""Dont Forget"" delux edition and somebody moved it from where i had it and now no one knws where it is."
0,Alea is teething & fussy which equals not much sleep for daddy
1,USER Thats because they kno people will listen to you.
1,Early morning rpm is a great way to start the day. Time for work!
0,"honestly, i need a special someone atm. feel so lonely.. i so cannot be left alone  sigh.."
0,20 minute chili's...ehh pretty pathetic
0,Hungry.  Work in a bit.  Gym in the morning.  Then my last day of sleep with air conditioning.
0,Why is it that my family think that because i work for Virgin Media i know why there services are down
1,I love Jumper.  def one of my favorite movies.
1,USER Studying for the PMP while watching movies?  I'm thinking bad multitasking!  :-P
1,USER ohhhhhh booed up!!! Gone head then girl!  I won't keep ya ;)
1,USER Thanks!
1,"USER Waiting 4 V of A, Luv Atty. Sutton & family, Solid folk as per Roz Turner's Executive Assistant 2 years ago  GREAT TEAM!"
1,What would be really interesting is to see their fee's from each project on 'logomyway'
1,The VirtualBox manual makes a lot more sense when the right version is installed
0,I don't like Bing.com. It doesn't know I exist.
0,I hear everyone talk about how great twitter is and how you can follow so many cool things. I just don't know how
1,USER ahhh. i shallllll . cant waittttt!
1,So ur gonna take a plan ride when I leave 2 come  see us huh? Just remember 2 leave ur extra baggage @ home!! Lol!! Xoxo!!
1,"is home from shooting the most awesome music video  Charlie's here now, woohoo!"
0,USER have you seen the trailer? It looks too different from the book
0,i LOVEEE it when u smack my ass USER! dont move
0,USER yoooo nothing much been super busy lately. wondergirls won't be at any of the jonas shows near by
0,USER downtown chill!! I'm not even suppose to be here!! My family don't love me!
1,"Good morning Twitches!!! Here is your Pam Talk of the day: ""Be brave. Take risks. Nothing can substitute for experience."""
0,sick  and HAPPY 13th Amanda
1,"USER haha thats how einstein did it. Read it in a book somewhere, but nice read anyway"
1,USER please let me know when your script for USER is ready
0,"has jus got in from work, tired"
0,Stonking ride by Dave Wentworth in the Bossard 10. 24:37 on a slowish course on a windy day. Will have to train more to get near him
0,Just lost my brickbreaker game   I'd been playing for weeks... 360000+ points... down the drain.... time to start over I guess.
1,USER network maintenance requires servers to be taken offline. network maintenance is VERY essential to have a GREAT server
1,USER my folks live in cushing...last house on Pleasant point. I'll be @ much of the MiA...look for me
1,"USER HAHA, great idea! Maybe you could say you are Marty's brother.  OR SON!"
0,"USER awww  oh well, you will def be there in spirit. While Im talkin, I hope my butt can make it to GUMBO. LOL"
0,doesn't even know how the heck twitter works
1,Just woke up going to bush gardens soon
0,Just remembered I forgot to put away the dishes  ugh. hahaha.. beyond tired!
1,I love walking around my house in leggings and heels.. my type of exercise
0,USER i remember when you couldn't see any space with all the posters! i might just take it all down. but then it will look empty
0,USER so bitchy  you're breaking my heart Flad.
1,flights are booked now  i'll be in vietnam for 2 weeks and 1 week in bali (diving & relaxing *gg*) can't wait to get there *hrhr*
0,Watching NBA games from 3 am is getting harder and harder every year.I have fallen asleep short before the game has ended
1,Woke up. Sunshine. New hair colour. Dad. Nice day
1,Oh and btw... Magic are going to the Eastern Conference Finals!!!!!
0,Only 8 days until I leave for New Glasgow. Gotta clean the house today but my back is killing me
1,USER hahahah indeed it will.  Can't wait! Hope you're ready for your role. ;)
0,USER
0,ay ''inipit''. :&  [phplurk.com] URL
1,USER  Oh yeah and they found it two days after my jazz show.  Ticked me off!!!    But I'm okay now   Good luck!
1,Just started the packing process for N.Y. SO excited! Off to bed now!
0,I jus got cussed out by my momma .........
0,"USER I'd come in the chat, but I'm about to watch The Boy In The Striped Pajamas. It's gonna be a sad movie."
1,Post your question: URL & tweet url USER. Thatï¿½s fun
1,USER oh =/ damn. my advice? BURN IT. Because fire solves everything  -is hyper on music-
1,USER thank you. Just without a reason
0,USER I play this for you hahaha ;p  URL fuckin muggy ass day  kinda ruined out a bday bbq or something then.
1,USER thanks
0,geez its so cold   winter sux
0,I'm missing my frens huh!
1,Thai house
0,"USER Yea, that sucks!  I sorry!"
0,USER Baseball has no following in Europe at all & it saddens me as I love baseball. It's miles better than cricket!
0,BUGS or ME? boyfriend: BUGS!
0,emotional day   i miss daarrreeennn x
0,the scenes between daniel and little charlotte on lost are so sad.
1,"I just remembered that I have no reason to get out of bed until toys ""R"" us @ 10pm tonight. Ticket sales went really well in the end"
1,"USER Well Meg, that's because you're timeless"
1,USER Coffee will take care of that...or nodoz...Na than you'll have way to many bad habits to break
0,i try it to make my mind is blank or ZONK!
1,i have 92 friends in pet society. wow!
1,USER Amazing show
0,"USER i've been invited out to dinner, such an effort to go back out in the cold"
1,"what a gorgeous day!!   Perfect for Pimms by the Thames, if it weren't for work..."
0,uhhh horrible British weather
1,PS just texting me (twice!) to test my fortitude...and I have NOT replied via text. 1 point for me!
0,"no viewers  and and USER, did you block me on skype?"
0,hates flatmates and their visitors
0,Such gloomy weather outside. I actually closed my curtains I couldn't stand looking at the rain.
1,USER Thank you for the follow friday love
1,USER wish I coulda been there to ring the bell! I'm truckin' in Virginia. That's why God invented Satellite radio
0,USER I saw loads of robins between (and while) volunteering today. No cuckoos though
1,USER That's my favorite part too!
0,"USER i've been busy. maybe you needed the sleep sweetie! i know i tried to take a nap, but my brain would NOT stop thinking"
0,Really sick
0,"just got up, from aches and pains from playin footie"
0,ughhh now im really upset!
1,"USER I know, I canny wait 4 TS3 to be released"
1,I am back home tomorrow
0,I feel so sick! Got the  the shakes this morning
1,ok awesome aweomse. uploading
1,My gma is snoring. Lol.  off to bed soon.
1,USER jeeze how mny tyms does he need to ask u do u no beyonce. Why wud u do dat? I wud ave killed him if dat wer me LOL
0,USER not goin well. spent like an hour on CT. that was last week
0,Af 447. So sad  my thoughts and prayers go out to the families touched by the tragedy.       (AP)  URL
1,Nikki Shaffi is thinking about food  .......... `. URL
1,i love watching Beyonce's 'single ladies' song as i feel better about how big my thighs are
0,USER Oh sure...rub it in  I'm craving fresh dead fish like nobody's business. I'm #onamission
1,"fucking cooooold, but had a good weekend"
0,Dude xbox live down for 24 hours
0,USER haha I'm good...I'm washing clothes  lol
0,is stuck on stupid...i lost my phone..
1,USER i know riight
0,whoo last monday of the school year!!! this means the last full class of history!!!!! and the last of theatre too though  but oh well.
0,"USER causing mayhem and debauchery.. too tired right now and need sleep, but I probably wont."
0,USER it won't let me do it
1,USER not a problem  whats the address?
1,URL check this out and comment on it  please ^.~
0,How to get a $40 trumpet book - get caught in the rain with an $80 trumpet book ... oh dear  NY
0,Doing laundry cuz I was lazy yesterday and put it off till today (if I didn't need clean scrubs for tomorrow I'd put it off another day)
0,USER Get local recommendations before you change vets   Sending positive thoughts your way.
1,fingers crossed i can see millsy today  URL
0,USER  I know
0,heading back to bath - missing the afternoon session at #fowa  - shame -it's been a good event so far
0,USER I think Sam's Club hates you
0,USER how did that come about  i've never heard of that before. *hugs*
0,"Fehk, work is slow.Im bored as shit playing music! How sad  come entertain me."
1,Meeting a deadline.. hope everything's fine
0,Just got home from an eventful evening. Loaded with assessments.. Gonna be a busy week. Swim training commences tomorrow morning
1,having lunch with my favorite girl in the whole world.
1,class starts on june 17
0,"i just want to crawl in bed with some cough drops, tissue box, and put on a movie. (("
1,which is a great thing btw  hopefully more Twilight wins!!!
0,Working on my Mythology power point. Agh I wish it was finished already
1,"USER ...yes, nothing like a sunny day in England. I can almost hear Vaughn Williams. Enjoy the day"
1,Had a crazy long day
1,All my siblings loved my cookies! I'm so glad. Even my picky mom and my old man liked them!
1,"USER its great following you on here, very kewl stuff"
1,URL Anna & her brother Albert flying through the sky...
1,Loving working with buyers! Need some listing...do you know anyone that needs to sell their home? Send them my way
1,USER Okay make sure you put a smile on that beautiful face of yours the worlds your oyster..........
0,has pre-ordered her WATCHMEN dvd but is sad she had 2 watche 3 goals go in the wrong net
0,"USER Yes do, I have a few of those too"
1,Onion rings it is!!! With spicy dipping sauce! Check the blog for picture tomorrow!
1,"Watched part of ""Yes Man!"" with Jim Carrey! That movie is hilarious! Can't wait to watch the rest of it!"
1,My weekend was fabulous! I'm blessed!
0,USER Egads Blogger seems to be awfully buggy.
0,is still gassy and hates going to sleep this way  Someone punch me in the gut PLEASE?!!!!
1,USER was it the chocolate conveyor episode or the wine making one? those R the only 2 I ever see on TV  Enjoy UR wknd in the Adks
1,USER psssssst. can you advertise my westonbirt ticket? Â£20 i just want to get rid of it.
1,USER you poor thing! get well soon
0,I hate getting let down by a song we wrote  U put it out there optimistically & hope it finds a home. It hurts when it comes back unwanted
1,USER you sound stressed out my man you should have a nap on the plane LOL
0,USER yes  serious dont think they love me anymore (story of my life)
1,"USER That is so true, my friend. Ehh... I'm gonna go to sleep with dreams of Chris Pine now. Good times, good times"
1,"USER Only thing that stops the itch is alcohol, and then there's the rubbing kind if you want to try that too"
1,"everything I need I have, anything useless & unnecessary God took out my path. I'm excited about life!!"
1,Feelin Fresh Out The Shower
0,how do i reply to peoples twitter things on my phone? godddd twitters so confusing
0,really really really doesnt like hayfever
1,USER It's all about balance....
1,USER Oh goodness. Does this mean you like big butts and you cannot lie? (P.S. Thanks for the advice. I'm getting the movie a.s.a.p.)
0,is having to survive without a capo for a few weeks...
1,i will be buying geiger empire shoes in black. I am soooo excited
1,Dave looks so cute in the dark
1,USER  Oh cool!!  I'll have to look that company up!
0,USER shut u up
1,USER I'm glad!  I'm just thinking of what's best for USER ;)
0,i cant stop coughing. im afraid im going to stop breathing soon
1,"USER love your style new and old all the movies are awesome still love the song ""candy"" lol  laterz"
0,Is wondering why there are no whales in Hermanus when my parents flew from so far to see them
1,USER My husband has that. It's awful. Glad you are feeling better today.
0,D-10 to Mid term... Get away
1,USER USER  Thanks for the recommendation.  And you covered all the bases to boot.  #followfriday
0,USER i miss you too
1,USER yeah I feel you Lol
0,USER you did get me...   LOL
1,USER holy cow girl!  Thanks so much for the FF shout out!  You totally made my day!
1,"listening to ""Grapevine Fires"" by Death Cab for Cutie while i work. lovely!"
1,last night 'San Isidro' ~ today lunch with family
0,"USER I don't, but I wish I did"
1,USER because you want to set the sims on fire to see what they are going to do ? or starve them to death?
0,someone can write down what Edward says when he's breaking up with Bella pls. I cannot understand he speaks so fast for me
1,Nothing like a bowl of awesome cereal for dinner on a Saturday night! Yum
0,Tweetdeck has given up on me  I think thats my cue for lunch
1,I'm going to the park today  ahahaha
1,USER Good for you! All in one go too? Nice.
1,USER Youtube is awsome
1,USER i'm not off in till 5th  can't wait to leave tomorrow can you? x
1,"USER - I hear U!! dont worry, U're not alone in yr obsession. U'll find ppl discussing Twi 24/7.. either teamedward or teamjacob"
1,"USER Keep us up to date, all through the drunken rampage, arrest and booking"
0,stress induced stress. who knew?
0,"So, now we have a tile floor, which is new for us and gives us cold feet. Walmart and Target don't have slippers."
1,"USER that's a beautiful dog!  Mine ain't so prettty, :S She's like half a cocker and half a poodle, haha. Bless"
0,USER I MISSED IT  glad it was boring and i didnt miss anything good
1,URL - awww Steven from Hello Hollywood! looove him  reppin' the ACOP shirt
0,"USER *This is me eating crow for you Ginge.... Tough, disgusting, crow.* Goodbye 4."
