0,USER Grrr. Missed the free download. Grrr. Plus extra Grrrr.
0,"URL - 7th straight day of rain, 4 more to go"
1,"USER Well, its a 32bit cap. Not a vista cap. Sounds like you're a little far in but 64 bit vista would get you that extra 300MB"
0,mentally preparing myself for my 9 hour shift.
0,ughh. 2 of the WORST days of my life.  ima try to just sleep this ish off.
0,"Back after 7 hours out of the house, 5 of those spent in the car"
0,USER I only made it to 9:30 myself
0,USER Lol I know  Its not good eh! ha ha xx
1,I'm home now! Talk to me please  I'm bored -.-
1,This Monday...beach. Next Monday...Vegas. Next 52 Mondays X 18 years...Julie Anne.
1,USER otherwise i'm ok. after this week i'll be tweeting twice a day again.
0,what hot one! Temp @ work 101!!!!
0,my wisdom teeth are coming up soooooooo sore
0,Oliver broke my shades
1,USER lol~! goodnight~!
0,this will probably hurt me more than it will hurt u
0,isPlayer Has Died! Sorry
0,"trying to watch the MTV movie awards, but internet is so slow .. I can't stand waiting until thursday to see it !"
1,Love you ky chels and meg
1,Offerdahl's for breakfast with USER
0,majorly injured my elbow at work last night  so much painnn.
0,term is over   See you all in October.
0,"USER ew. ew. ew. It's one thing to be hit on, it's another thing to be ACTUALLY hit on lol"
1,just wait a second and go back to my profile and ull see
0,Going to be nice all week and crappy this weekend.  Guess my long weekend is Maine is out
0,No one wanted to go to the shore with me  - URL
1,im so0 happy that i cnt take off the smiLe out of my face..  feeLs g0od wen ur inLove.
1,USER U go girl...cleanse youself of the negative peeps
0,USER yay but you missed naptime
0,got my nu metro VIP card woohoooo. but stomach cramps overshadowing good fortune of free movies
0,USER hi ya! Melissa here. How are games at Bellagio? I wish u still hd the goats
0,School worked all day today  Phew! Off to bed.
0,First day of summer school
1,lol @ my mistake
0,USER I really don't think Bale rules anymore.  Especially not as John Connor. And how random (to me) that Anton Yelchin was Kyle!
1,"USER thank you, my dearest friend!"
0,"USER Tom, respond me"
0,"just woke up, now i have to pack."
1,is preparing for todays TAB surfing! 15 TEÂ´s at one time
0,is now off to the grind
1,"USER  Hi Marlee, I had the same problem earlier..it's temperamental.Look forward to seeing your new pic tomorrow"
0,Home alone bound tonight
1,USER where can i find more info about that?
1,is enjoying some ME time in the tanning bed....12 minutes of pure bliss...and photo ops for my man
0,ewww work time yay mid nuit
0,The Nintendo spokeswoman needs to lower her left arm. She reminds me of a disapproving teacher.
0,USER USER didn't make the sound. neo soul takes over my car when i drive. and someone nearly crashed into me
1,USER I didn't even know the Dutch played cricket
1,this whole motorcycle thing should be fun.
1,watching tutorials on youtube!
0,o im srry i didnt know
1,USER I hate you right now.
1,USER I'd go with basketball  much more entertaining..
0,"Xbox Live to Ozone: ""No Rock Band tracks for you."""
1,is AUNty JennyD....yeahhhh...
0,Great. Im only 60% done and stuck again.
0,"USER The man has a point. Lots of work for them, though. Worth it if they can whack everyone with big charges"
1,USER  He is probably really hungry.  One time we were away for two weeks. Our dogs snubbed us when we came home.
0,"USER I'd go, but I'm going to play #WSOP40 . I won 2 free tix to all HOB shows for year but haven't used any yet this month"
1,Is now using mobile.
0,USER I KNOW RIGHT?! I regret not having said anything because my mom bought it for me.  But I just know she would have started summin.
0,Gah naked Miranda Kerr does not = news. I have lost my CD case this is big news as I have idea where it's trodden off to
0,Hmm mileyand nick looked like they were very happy. They kept smiling at each other Ect.  No they didn't play keep it real
1,Will try to scan some old family pictures.  ang cute ko eh. Haha!
1,Pool with mollie
0,"is trying to get some sleep.  i already miss matthew... 9 freakin months until i see him again, including 1 deployment."
1,Going to the bookstore - just because I can
1,Ice cream  text meeee :] URL
0,USER you're complaining to god about me  gtfo on msn then!
1,"doing laundry, when i get back, id like to recieve a million @ replys <3   tytyty"
0,"How does a mosquito bite you on the bottom of your foot?!?! Who knows, but it's hard to walk on... I'm all itchy"
0,USER Thanks for the tip but it is a wireless network
1,MTV Movie Awards tonight
0,trying to buy tickets for the Killers in Oslo.  having no luck though
1,USER  USER thank u so much girls  !
0,USER i wish i could have been there
1,waiting for his brother and best friend ot get back to the hotel
1,USER Totally cool - I think I might make your pb brownies instead!
1,"USER o o o hold up! havent seen it, u kno I am a HUGE fan...searching now!"
1,USER OMJ! My friend recorded JONAS for me. and i'm about to sit down and watch it
1,"USER n the fact thar u take the time to correct spelling errors, its like whoa! Ur melting my heart here"
1,USER hahaha I try! well i'm just doing me!
0,"Happy birthday Edward Cullen, sorry I wasn't able to go to your party."
1,I just got a job with my boyfriend and best friend
0,"I want to go outside and play in the sunshine, but I have to sit in front of a computer all day   At least I can have lunch on the patio!"
0,"USER I guess the sessions are too involving. Updates are poor and are mostly news and quotes, no tips are flowing out..   #bck5"
1,USER yeah .. you are right  I'll let him know about this
1,"Retweet USER NBC is bringing back ""Chuck"" for a 3rd season.  I know a few people who'll be pleased  - URL"
1,USER mhmmmm. this my shh. this my shhh. I LOVE HANNAH MONTANA  baha URL
0,"USER hey, snap! i have two modules to revise in 8 days, fuck"
0,say ttg  lunch is over URL
1,beautiful day    i love you miley
1,USER YOU DO? I love surprises!
0,waiting for my iPhone to finish syncing. Its so slow
0,USER he was old too  hahaha
0,USER are you crazy? any week w/ school is boring
1,"USER ""drill and kill"" : wow, I'm not gonna pass that turn of phase onto Daphne!"
1,"USER Re helicopters--ah, thanks for letting me know!  Ever oblivious to the news I guess..."
0,is dissapointed in people.
0,USER not tonight bb....tomorrow....gotta get up early
0,USER    yup
0,USER I'm so jealous! I've never been to a drive-in
0,USER and USER thanks for having me over for LOST. We'll have to do it again..... In 2010!!!!
0,is getting ready for our family picture day with most of us sick!!
1,"USER yep, lets do it  It'll be bliss (viaUSER) - thats my business"
1,USER does that mean you are getting married soon?
1,"got some decent sleep! Whoooo! No vocal training today, Kyle's got flu!  Hopefully next week!  Oh, i also got a keyboard!"
1,"Listening through every episode of USER, on Episode 4 now, only 88 episodes to go"
0,USER have a fun time in Toronto!! I'm so sad I'm gonna miss you guys!  xoxo
0,USER daaammmnnnnn I do wish I was there.
1,USER Thanks for the tip. I've been slacking since my mom's been visiting. Oh. And she says I spend too much time online.
1,USER hey thank you!!
0,"Sitting In Ann's Having A Glass Of Wine, I'am Dying"
1,USER ilymore babe!! I thought bout you and how you walked from riverwood to my job just for me two yrs ago  ahhh come home asap!
1,ouuwhh !! I like twitter  There is so much korean boy who I like
0,it's raining
0,going to bed...very sick; aceing and running a fever
1,USER miley!!!!! plzzzzzzzzzzz tweet back n say hi!!  plz plz plz plz plz plz am goin to both of ur dates in dublin!!!! plz plz plz
1,USER Just bought me a gift for someone in Gouda
1,USER I think it'd be wrong of me to not have a book- my stories are  2 goofy!
0,Was working most of the weekend  But got out for a short Kayak trip to Island Eddy yesterday.
0,"Walao, I want continue my dream."
1,"The first rule of scam is ""Do not talk about scamming,"". The second rule of scam is ""Ask the client first""."
0,Please GOD let it just be food poisoning!
1,"USER : Hahaha.... I thought you have a pretty wife already.....yes, is sooner or later ....by the way, how are you?  Brenda Goh"
0,Brought camera. Forgot to put an SD card in it!
0,6 AM - soon to be massive headache
1,Watching Hatching Pete
0,Not really
0,USER   I found an awesome graphic game for iphone but I can't remember the name...
1,"USER So far so good  Not sure if novacaine has worn off completely yet, but no pain!!  Ice Cream & No working out 2"
0,USER Hello from a fellow DS'er lol!  Ewww the spider   Did you see where it went? Is it still on the lose?
0,"USER yeah I'm surprised too  USER I would love to have the punishment. Ok, back to rehab. My neck hurts so bad"
0,Good.... Afternoon? *yawn* I have to do the laundry pa before I go to work
0,"USER: I know I should just be happy, but I really loved that show."
0,USER I'm trying to figure out why I don't see your tweets even though I'm following you.
1,loves when Austin comes to visit her at work
1,USER I love your updates
0,i'm really sad about the news about Jon & Kate. I was hoping that it was all a misunderstanding.
0,USER I wish mine would be small. :-/ shes gunna end up kickin' Napoleons ass one day if she keeps growing.
1,Good morning to those along the east coast that are just waking up. Hope you have a fantastic Tuesday
1,USER awww... bless!
1,gng to macdonald  wif sis =D
0,"just made a new myspace, old one deleted it's self  so add my new one! www.myspace.com/shelbybarrow"
1,USER and how is your niece?
1,USER aaaaw that's good
1,morning tweeps
1,USER yeah. get a blackberry
1,USER christina milan is a stunna ..avta chek dat out i think
1,"USER at least you wont have to shave off your beard when you do the Ballroom dancing thing, not like when you were a clown"
0,Slow day at work...trying to think about not drinking another cup of coffee and Slim Fast Bars DONT suppress my appetite at all
0,USER  keep your head up my brother
1,Looks like a nice day today
1,goodnight Sealthrose.
0,Suffering from breathing problems and really bad hay fever
1,USER hope you are having a great time in my home state!
0,"Getting ready. At least this is the last week of school, but I still have an algebra final today  wish me luck!"
0,Is it possible to miss someone who hasn't even gone yet?
0,USER  i got my phone taken away!! soo whats ur number and can u text hannah?
1,What a great day!
0,"Finished my short film, feels a little wrong, but it's 15 seconds over..."
1,USER yea buti at least he's backed down now and accepts its for the best  what you up to today anyway? xx
0,Being Lazy because i don't feel good
0,I love the sun!! I hate school that keeps me out of the sun
0,USER USER still not able to get my maxoam sims to work on iphone and nokia 6280
0,USER omg yeah! i hate them so much and we get loads in our house
0,waiting for lukess to start playing... yay ! but nsw is losing footy
1,USER right!  finally you have twitter like us!  so excited to see what are u doing as miriam!
0,omg my babe almost got killed. wat wud i do wif out him...
1,frozen Reese's Peanut Butter Cups make me happy!!
0,"No, my london lass didn't call"
1,USER yay!!!!!! I'm soo excited for the concert!!!  And I'm happy that ure YouTube account is back!
1,USER idk!
0,USER we got a club here called bliss...i was like OH HELL NO! i thought u were here n didnt call me
1,"My beloved D-Link stopped working, have ordered new PowerSupply from Hong Kong on eBay"
1,URL - Besides the fact the doll looks like she has wine spots...I like the doo  just teaching myself how 2 read  ...
0,Waiting at ROC airport for our flight to SFO. Sign on and headlines are all abt missing jet. Not a gd time to read about missing plane.
0,"USER ily2 dude, wish u cud be here with me!"
0,Would rather be at the beach than sitting in math class  #fb
1,"USER yess  was awesome! i loved the moves the kid with the afro did before the buzzer part, camera only on him - legendary!"
0,USER: sorry I've been silent. I'm stressed as hell and have shut down temporarily  xoxo
1,new lolmagnetz: mah puppeh sez i wantz moar playing wif toyz! u fix dis k? pls?  ...or i bring teh harbl doom!
0,So I have colitis  haha.   Ugh
0,USER I'm terribly sorry people flip out when you or anyone else from the ATLfam joins in. It's annoying
0,USER WHAHAA?! I CAN'T FIND MY PHONE
0,"ugh, i wish today was friday! but no, its only tuesday"
0,"USER I so wish, things not looking too rosy on this side of the world"
1,Might be going swimming today
1,USER It takes a big man to type a sad tweet like that!
1,"off to session - four hours of heavy rubber, ropey goodness  Shame my twitterberry is disturbingly not working or I'd write sordid updates"
0,burnt my arm making burgers yesterday...HOT OIL!!! Now it has red marks on it
0,It's rainy for the wedding today.  I hope it clears up.
0,"ick, i woke up with my eyes shut together. Great!  Now my eyes are all bloodshot and I have to go to work soon. :/"
0,back home. think i lost my 021...fuuuuk!  cant find it
0,USER yay I'll be there for the Nov one. I just got a new job that's why I couldn't go this time. Sorry
1,"All #Gravity users with ""Save-Settings"" probs, could you eMail me (ole at mobileways.de) and I'll send you a debugging version. Cheers!"
0,"From 8pm until way past 1am, there were 2 choppers circling in the sky above my head. Had to close windows to sleep even in hot weather"
0,"Morning all. The water heating's packed up, so i can't have a bath. I REALLY want a bath!"
0,"#crystaldermy can't get this image upload code to work, done it a million times before  I'll find it, I hope! Http://twenty9seven.co.uk"
1,"USER No, getting ill I guess. headache to match, fever earlier today"
1,munching a cold snicker's bar.... couldn't be happier
1,USER  LMAO.... So you didnt take a DD or what?? I have about two of those for tonight  lol
0,Could have won
0,USER i know
0,just wake up im ill  i not at school and i have't eatin in ages
1,yess..Leet World Episode 10 is out.. Player ftw !!
0,wow i want my page to look like USER! looks a bit more cooler then mine  ha ha! go brit!
0,USER you never answered my DM about my sister
0,being v stressed out is not how this day began! nor is it a good emotion when its boiling out
1,"USER USER I've never heard of Paul Potts, but I'm guessing *he's* never heard of Pol Pot! It's like Peter Files..."
1,"USER I love it how you call us 'Dreamers'  But it's true, where would I be without my dreams ... grtz from Belgium"
1,USER do you know when they are going to put the tickets on sale for USER in december?   x
0,"USER BAH!!!! wish i could... at work  and the dumb'os in the IT dept crippled my PC to the bone, so i can't get on those fun stuffs xD"
0,"at home, sick...."
1,USER I had Ace of Cakes on but it was just in the background.  I wonder if I would've caught you if I were watching.  Cool!
1,"USER Thanks for the fam shout out Joe, so so happy  We just need to sesh together one day haha and then head to IHOP!!"
1,"USER It's not he who needs to check up what's happening, it's us who want to see what he's doing  Twitter is great PR!"
0,Is back from major shopping spree...sucks that its raining  Where is summer???
1,USER LMAO
1,With USER and a bunch of others. Rulin at life. Blue Plum rules my life
1,USER but it'S so pretty!
1,USER URL - Good Morning Guy !  Kisses for the most handsome bass player in the world !
1,i is all.. sittin at tha computer!!! smilin      wut is twitter anyway
0,USER   hopefully it will go fast. I think you have like 6 or 7.
0,"done w disney going home tomorrow, vacation almost over  boo hoo"
1,Almost done with work and my feet don't even hurt! I must be getting used to it thank god
1,Nah. Acoustic drums
1,USER Yay!  Only 175 days left until the finished article  Good luck at the MTV Movie Awards
1,I LUVVVV(lindsy22 you can tell im serious)) Marlenes sister...she really is my idol  I want to be just like her!
1,USER Night
0,nevermind being a life guard. I don't have 130 Dollars for the classes
1,"Thought Of The Day: ""I don't enjoy cocaine, I just like the smell of it"""
1,got 18th place out of 23 playing laser tag and had fun at waffle house tonite with my favoritest person in the world USER!
0,USER that would make me sooooo sad.
0,"USER Hangover was funny, but it was much too hyped it. argh. i hate when movies are super hyped up. ruins my expectation"
0,"Sigh just knocked my iomega external HD on the floor whilst it was spinning, its now make horrid noises"
0,Work is dragging  roll on half five!
0,Broadway joes tonight. RIP Tommy Law
0,USER Did you try a real functioning one?  We went to the Rogers store and they only had non-functioning display models.
0,absolutely no work today...sittle idle for the whole day is really really difficult
1,"USER That's where I was headed with that, but i ran out of characters. So which one do I start with?"
1,On my way to LA with USER (pray he doesn't kill me) and I totally bit keri hilsons ensemble - my outfit is siiiick  loves it
1,Hey! Jay from Queer eye for the straight  just passed by our salon!
0,"USER i think we live different twifestyles. i'm twollowing 110 ppl vs your 14, so i'm def twoversaturating your feed. tworry"
0,USER it's been drying for 2 days...i replaced the batteries today and still nothing   luckily amazon is pretty affordable
0,Mr. Mahatma Gandhi....happiness depends on my trackball workin or not
1,me convencieron geek is the new sexy! yo votare por el PNG !!
1,USER thanks!
1,USER okay I sent the email with the info. If you need any help just email me
1,USER ....i'm saving money....  i promise i'll come to LA ;) haha
0,Just realize I haven't really eaten today ... If you don't count the 5 Golden chocolate oreos and the 2 dove miniatures. That's just sad
1,I just got my first wink !
0,Today my DSLR id died. it just turn on  ...
1,Head down to do some revision for last day of exams tomorrow
1,USER here's one for ya URL heavy
1,"liam - DJ Liam - Live(15.05.09) URL via USER Friday nights show (set rip) worth a listen, i think"
1,A good nights sleep and a good workout this morning...Maybe work won't suck today.
0,no pics of leighton yettt
0,USER yes its bleeding because of my earings!
0,Off to cut the grass...wow hayfever and cutting grass...not like im rubbing my nose in it.
1,USER no problem
1,Tomorrow is the wedding! Hope to see you all there!
0,is watching kayne west with an orchestra on channel two.. I advise everyone in adelaide too do the same.. Skinny by thirtieth
0,Work. Till 12pm then back 5pm to 12am   URL
0,"i don't know whats wrong with me. im never happy anymore, im just so sad and feel so down and lonely. i just want to get better"
0,Trying to find a new home for her bunny rabbit
1,"USER, ask."
0,Packing to move to Phoenix.  Getting divorced    but it'll be a fresh start for me.  Leaving in about a week!
1,"i cant see bugger all, still though. sun. cant argue with that can you!"
0,Not feeling so hot this morning. Jaw is killing me this morning.  Come on Tues. (Gets pulled.. Yaaay...)
1,Has another mental day at work tomorrow - yet more fighting with egos! But I'm ready and have my armour on
0,Still doing homework. :/ I'd rather be with the gang at vivis right now. Fml
1,USER muah
1,woke up from a good nap and from a good wakeup call  . now back to studying with a strawberry banana shake made from my brother.
0,just really wants to go to warped
1,fuck i feel like dancing!
0,betrayed by my own pencil..stabbed me in the hand
1,Think am becoming a bit more OC hehe I made my brother pack a tiny bag filled with all possible things to keep my parents comfy
1,USER Yeah i think it is... hopefully on the flight deck so I can watch from my office in the warmth
0,Something I Miss: The Shaun of the Dead shovel I had on my key chain. People keep holding my keys by that and it broke  I Miss It.
0,I got a sunburn...again
0,my phone died
1,School for a couple hours. Leave early to go to vegas
0,i am soo fucking sick of wades mood swings... uhh i hate him.. he's an asshole!! ahhhh
0,Haven't been feeling too well since yesterday afternoon. What to do what to do?
0,USER  Is Khloe on Twitter?  I hope I didn't follow the fake one.
0,USER Yeah its getting a bit boring now
0,So tired and achy. Don't feel like going downstairs.  Better not be swine.
0,USER awwwwwwwwww huni i feel for ya......i really do!!! i'm still tired from BTCC
0,"USER: sorry, don't think so"
1,"USER kidding man, was talking about your recent bowel movements."
0,is doing laundry then has to go to work later
1,LAKERS BABY!!!!  Yipppie hititng Rancho tonight Its Reggae night!!!
0,USER (OOC: Really sorry.  I have the opposite: an inability to ratchet my emotions up when I want to.)
0,Helloo and good morning ppl. Gotta go to work now   but not before I get a starbucks drink. White chocolate mocha   Mmmmmm.......
1,USER thanks for the recommendation!
0,USER sounds like my every day  except gym
0,Tweetie isn't working well.. it doesn't tell  me when there are new tweets
1,Goodnight
1,USER You mean with the sunglasses and all? Wow.. Now I really wanna see the pics  USER USER
0,USER awhh im sorry
0,USER we were only shopping though. no stressful activity at all
1,USER We need a little more real-time interaction here tomorrow!  #mozmae
1,"for the most part, had a nice evening"
0,Shoulder is killing me
1,USER Hope you're having a lovely time! Am looking forward to Muses at Primavera
1,USER Love Is In The Earth is one of my FAVOURITES. My copy shows a whole lot of lovin'
0,USER LA gets all the cool people
1,USER thanks so much for the follow mention!
1,"USER ha! I've never heard you call someone ""girl"" before. I'm sorry but that's funny"
0,Watching the parade from home  But Loving all the highlights from the season! I LOVE THE LAKERS!!!!!!!!!!!!!!!!!!!!!!!xoxoxoxoxoxoxoxoxoxo
0,wish i could be home right now. missing everything about it. have to wait 18 days....  dk if im gonna make it
1,USER they really should. ive only listened to the self titled album but i just get deeper and deeper in with each go. its brilliant.
0,totally craving for ice cream at 2 am
0,still up
0,not going to musikfest anymore
0,"USER booooooo! it's a one time only thing, too, joe and eric (dan's brothers) live in montana, and they're going home on monday"
1,USER I see ya'll
0,"USER Awww and you still haven't said 'hi"""
1,Watching USER... Wishing He Was In Atlanta...
0,"USER haha, u know it!!! i'm sorry i had to run from the show,i had errands to run!"
1,USER No way!! Really? I've only ever made it to 13. I could go through 3 husbands in that time!
1,hi every1
0,LIVE NOW  LIVE! )  DJ JAYEM B2B E.S.R  Click : URL
1,USER Hi there!  USER just spilled the beans that you are a fellow PumpEase user...  so I am following you
1,USER haha im about to eat taco bell
1,USER you were amaaaaaaazing in wembley yesterday! i loved it! can't wait for november now!
1,USER Admit it ... I got you playin'
0,No MMS for AT&T #iPhone 3.0 users yet  lol URL
0,"USER Same here, Tweetie in my Mac but thinking of chainging to Tweetdeck, but I don't like the UI of the desktop version"
1,USER Thank you!  It's nice to see you here.
1,wow thanks for following me all
0,"hope u guys have a blash 2morrow at da parade, I will b watchin from my tv"
1,mtv music awards
1,USER just arrived from my second mcfly gig. thank you for the best day of my life!
0,I have no money until my mommys check is put in
0,"now in a hurry to Lunetten, i'm to late"
0,Omg. I seriously think the emergency room is callin my name. I'm in so much pain Still  save me!
1,USER damn am I that predictable
0,USER hot babe sorry i hacked ur myspace
1,Downloading IBM WebSphere V6.1 for testing #ColdFusion 801 on CentOS 5.3 Linux just coz I can
1,Just got back from the postoffice were the lady told me my package was too big  good times!haha off 2 re pack my package now.
0,"Pray for April Rose and her family right now, she's declining fast URL  USER USER"
0,I hate people trying to sell things door to door. I feel bad for shutting them down before they even start their pitch.
1,if you are in the market for a pre negotiated discount car and or a vacation make sure to visit our site we are ALMSOT ready for you
0,is wondering how do u add pictures on here
1,"is very happy to be 25, even if he does feel a little more urgency for life to progress."
0,washed eye out but got water up my sleeve
1,"USER wow, you get to illustrate a cow! that's awesome   looks like a nice place to visit too!"
0,Went to Ault park to play. They had a band. We had fun playing right up to the point Peri pooped her pants.
1,good morning  I hope you're all having a great monday
0,wanna watch mtv movie awards but the channel isn't in list of my tv. huuh
1,"i quit smoking  woooo. day 1, no cigarettes. let's see how long i can last...."
0,My dad hijacked my computer...Crazier might be tomorow. Sorry guys!
0,USER I've barely been able to log onto FOD.  Don't think I'll be able to stay up to hear the cell cast. Too tired tonight.
1,"ok, time to head home. its 2:30am, i have to be back at 10am. get some sleep"
0,dissapointed. hmv still dont have any los campesinos.  iv been waiting about a year now...
0,Thanks tanasaurus rex for this fat lip. >:o. no more otterpops to put on it now.  man i fucken luv otterpops.
1,USER I love Twilight!!!
0,My blackberry is on the fritz. I can't update from my phone.
0,This new obsession with agent provocateur lingerie is both expensive and distracting me from my homework . I want the perfume to
1,USER Great minds think alike!!!
1,The songs are back! now they have a lot of singles to edit
1,Warmed up some leftovers for lunch
1,Got the munchies...enjoying some cantaloupe. It was already cut up so the hard part was already done.
0,"finally got unpacked, only took me four days! trying to get my back in golf shape for tomorrow.... questionnable"
1,USER Big ending to your mixtape mate
