1,Kristen's Raw: Tuesday's Raw Food Intake  URL
0,Whether I can twitter in church or not is now moot - I haven't made it again this week... Rubbish
1,"Ugh dentist appointment, but then voice lessons later today"
1,I am having a surprisingly good morning.  Hopefully that means I'll have a great day
0,"USER i had a UTI not long ago, man, it hurt  lots of cranberry juice does the trick though!"
0,not tired
0,USER Poker would Kick ass but I am on call so I cant chance it..
1,"watching mall cop with my cousin.  florida seems more fun at night. love you, USER"
0,If i have a nightmare about the ruins tonight i'm going to kill myself. Seriously :/. Sleep with me  scare the monsters away.
0,USER I finish work at 6:30  huhuhu... Oohh I checked Phua Chu Beng.. haha I think u look like Jin.. Hmm maybe it's the pic..
1,"USER wow..hehe..haba ng comments..inlab na nga tlga bunso ko ke archie,yihii!USER are you thinking my lil sis?"
1,"USER LOL, oddly enough I don't eat very much lobster even though I love it & live in Maine. Maybe I'll eat it more in Boston"
0,"brownies did not turn out, now we are late for first Sundsy"
1,Chatting with my friends..  !! ^^
0,Suprise my gigantic head. but
1,OMG USER !! Amazaing..I think heaven maybe feel alot like drinking shopping and  all rolled into one!
1,"Vamps, haha i luved it tho. I got eaten in the end, lol people i knew were i it. Seriously tho i should write it down. Idk if i will   ..."
1,"USER Did you know, we are seeing USER USER USER and USER in FIVE days? ahhhh!"
1,"'Time Is An Illusion and All Time Is Now'... ""You ready to have some fun?  I thought so..."" Read Ariel's full article @ URL"
1,"Walking my dog, then going in the pool"
0,"USER it is the one I meant. They have the film I want, but by the packaging, only with French subtitles.."
1,night. im off to bed.
0,show finished i soo tieredd
1,"i've lost friends, lost lovers, but i've still got my soul"
0,"USER ooo I had her as a follower too, then she found lovin elsewhere"
1,USER Thats where I went  - Clicks  Also got some vitamins which were k8k expensive! Going to attempt the bday cake on wednesday!
1,"USER It's ok hon  we really don't have much to do in SOA..just monitoring the posting and,and accepting new members etc.."
0,being forced to watch saw. not looking forward to it
0,"USER I have no idea what nudging does haha, miss you too  life is not as bright with you not in my day to day <3"
0,Chick flicks always remind me how alone i am.  but i can't stop watching them! What's wrong with me!
1,USER you & chicken soup & I'll be good!
1,USER I'd rather listen to Amelia's new lyrics. I hope your girls don't forget Ryan the red rhino.
1,"URL - Like a ball, sir."
1,USER Youu look really good
1,USER and our little babybear cub USER
1,is infatuated with someone she never met... yet ; ). I will meet you B. O. and we'll fall madly in love and have lots of babies
0,I see what's happening in #iranelection and wonder why this didn't happen in the USA in 2004.  Americans are fat and lazy and content.
1,"USER code my own SharePoint RSS viewer web part to work with auth feeds? Hehe no thanks, and no need, testing other RSS webparts"
1,USER USER BTW did you download USER's Need For Speed? Can't wait for The Sims 3 next week!  #iphone
1,"USER awwwwww!!! ok, now i really wanna eat chocolate (*opens up the fridge*) yummM!!"
0,"darn IT! it was taken down, i hope it wasn't because of 2 weeks in Hawaii, cuz that is like the whole video"
0,They just keep pushing me around.
1,USER Enjoy your last night at home and then good luck when you go back to work
1,"Chilis, then Caralines"
1,"USER thankyou  bet your eye looks lovely, consider an eye patch if only to spare others pain on looking at your gooey eye ;)"
1,"USER I am, actually! . I was going through the mail and discussing with my team about it. How did you find me, btw?"
0,So USER posted dates!  URL   Atl and bna. Otherwise scant on the south  we'll make it work.
1,"USER - Well, once you pop....!"
0,Going to see my dad today! his might be his last Father's day
0,"USER wow, you guys were online, and i left like the best comment i've ever left but then you were offline by the time i posted it."
0,"USER ahh, i don't know! i'm not escaping, but really, i dn't know.  for me, its an undefinable thingie... dsn't hv to hv a definition"
0,USER goign home have assignment work to do
0,USER I know huh.  I think my partying nights are windling down.  One night I had 2 Malibu pineapples + 3 AMFs = pukeville
0,USER Looking forward to seeing them. Suffering a dry spell myself
0,Last night in Hawaii!!!  Saddddddddd   But I'll be back in August....3 Hawaii trips in 2009?  Not too bad!!!!
1,Emily got nicks guitar pic
1,USER I love how u live normal and down to earth at your ranch. Makes you real  thanks 4 sharing!
0,"USER  ok, i will do then. Hows the new gaff btw? x"
0,theres so much i wanna do that i cant do bc i have to get other things done with first
1,Yours is the most dopest pick of the day! haha! serious!
1,USER welcome to twitter friend...
0,"USER I did hear that sad fact, yes.   Next Wednesday, let's all go for the hat trick: harumph hmph hump day"
0,waiting for my daddy... but he's taking forever. forever and a day. i wanna finish my room.
1,USER Enjoy the playtime! It's not often we get to let our inner child out to have fun in our grown-up world.
1,Morning everybody
0,cant stay mad. kjasdkjsdagjklsdgjklasd
0,Skins: Good programme. But I missed this weeks episode
1,USER i bet australia could do better
0,i fancy scampi and chips so bad  when did i get so food obsessed
1,USER can you tell people to follow me please? would be nice to have some miley fans on here   x
0,no homework done this weekend
0,Can't believe what Digg has done.  So much for trending Twitter..
0,studying for exam tomorrow
1,"USER pfft, forget Disgaea (great game)... play some Suikoden on the PSP instead."
0,halfway through reading dissertation through....then onto revision  URL
1,"Mmm... gotta love wine after work  Massages too, but no one is up for giving me one."
1,USER thanks love!!
0,"USER Yeah, I know"
1,PAYDAYYY!!! whooooooop
1,USER Exactly what I was thinking!
0,USER AH sorryyy y y y! I haven't gone on til now
0,USER i hope your ok and feeling alot better babe
0,Happy mothers day to all you mothers. To the rest jug or call your mom!          Off to FL tomorrow
1,"Taking my bike for a spin. First ride since last summer, excited for the ride, but not for the pain."
1,Eep! Last day of actual classes.
0,"aick...seriously hehe. The law may be harsh, but it is the law"
1,"no more school. summer summer summer! &, graduation tomorrow!"
1,lmao @ vibrating uterus - fennex95: Thatâs perfectly normal for me & Shayna  yes our normalness makes our... URL
1,USER Oooh ! I thought Timbaland was old !!
0,"Woken up full of cold, feel like crap!"
1,USER It's a breakfast for champions...that like to nap afterwards.
0,"Corner Bakery, I miss my friends"
1,USER wait! Are u gonna see Oasis??! I love them! I saw once when they came to Moscow!
1,Watching Cake Boss then sleep... Leaving at 6 am for our adventure trip... So excited
1,URL - USER is that your car?!
0,I think I left my phone in Kayley's jacket
0,USER who babyshower joanna?? & how I'm goin 2 get n k.o.d??
0,USER I'm so jealous-all I had was leftovers
0,Whats wrong with my phone? Im not getting any messages
1,hope sharapova and fed will win the french open....they just have to believe
0,"USER I'm going to see it at the movies this time. I didn't see Twilight last time, I had to wait"
0,USER we had whataburger well not eni and Claudia  night! ima think about that idea u had!
1,"awake and up  hair done,,,sunny again but it woke me up wayyy to early"
0,"USER that poor guy.  we got one here kinda the same, only i think it's her meds."
1,Me and Apes has had a fun night
1,USER URL Lets go home (yeah..i wish)
0,USER Yeah I do too!! Frig why am I so tired!! I got a fairly decent sleep last night but by 4:30 I could barely keep my eyes open
0,Waiting to fail my first exam at 2  I just want these to be over and done with & start fresh!
0,"i just cant seem to find a photo small enough to put up  even though my mac says there under 700k, twitter seems to disagree....!!! grrr"
0,"I heat sunday, and I don't know why? Do you heat too? hahahaha. I don't want make my bed  . I see you later..."
0,Getting my acrylic nails off. Poo.  Then hitting up panda express!
0,"USER I was waiting for her to be horribly shamed by the cashier, but no such luck"
0,USER yeah it's absolutely awful!! This year is weird
1,"USER lol, fine Hermano.   you can come be a guest on my show, whichever kind it turns out to be!"
1,USER USER aren't you nice!  If he doesn't text i'm choosing you to lead the consoling...
1,"with my girls, were gonna go bikini shopping!"
1,USER I love it! I am a firm moderate & it's nice to watch the badminton w/ peeps like you & USER
0,Motherday here in germany- cold and cloudy
0,"USER maybe. i think it's america though. but we'll see.  i don't think so, no!"
1,USER OMG...yeah i thought Kaia was spoiled but i don't give her bday cakes and have her dress up like robin hood! so cute though!
0,"USER Michelle, I slept for 11 hours last night. I'm still stick with this fever."
1,is up and drinking teeeeeeaaaa.. and flirting with the Joker  URL
1,USER haha. ok lang yan sis. at least you're back to where you belong. hehe. mas gusto mo naman dyan diba?
0,Watching Dan in Real Life one of my faves* many ppl don't like it.. I can relate in many ways <3 -- about to feed the babies
0,I want bbq pao
1,USER nice ......women these dayz dont know how to cook...dont get it twisted...im nice with it
0,"need to go and get some food, and do some french revision  sucks ! be back later xx"
1,gonna enjoy the super hot weather and go fishing...well just burn really
0,Would have been 2nd in the relay too if we hadn't been disqualified. Sad times
0,"USER there was no post-milk debate  but regarding your earlier reply asking about sexual favors, do you even need to ask?"
0,USER  my dad doesn't want to buy pinapple. I was like but kathleen will help me eat it!
0,"USER yea i'm back, didn't end up going to perth  yeah didn't watch the footy haha, the eagles lost anyway by 41 points lol ;("
0,baghhh i dind't know it was gonna like thunderstorm today  so unprepared and concerned about how i'm gonna commute 'unscathed'
1,USER lol sorry had to laugh  jp its like showing who's cool to follow if you're on the list -- apparently you're cool so its all good!
0,USER stop enjoying the rain!!! It's sticking around because of you
0,"If I keep losing followers, I will be in that 80 Percent Of Accounts too"
0,dang it! i cant seem to find my grey denims!  dont remember the last time i wore them
1,"USER Shaun Rogers, the blonde one from a couple of series ago"
0,feelin ill...need rest
1,USER People who actually live here! aha but i love it here
0,On hour 4 of a 17 hour drive  I am already a little board.
0,Editing video isn't as easy as I thought it would be
0,Soar throte  must b from all my ISP stress
0,My doggy doesn't feel good   I hate that   AND I have puking cat. Wtf.
1,USER you're sitting on 3 seats?
1,"USER aaww Thank you for including me in your ""Great Moms"" follow friday group!  That's too sweet!"
1,makeup alley swapping
0,my boyfriend = asshole.
1,"happy bank holiday monday twitter! bath time, spring clean, movie marathon , lazy day"
0,USER OMG! I have the same problem! I lent it to someone and they never gave it back!!!
0,USER make it go away
1,USER URL - so cute. look at his bottom teeth
0,There is no special sauce to go with my pork intestines!
0,My phone is broken  Talk to me on here or myspace
1,USER you are welcome!  USER would probably be worth following
0,leaving tomorrow
0,"evdeyim cumartesi gï¿½nï¿½ biraz hastay?m grip , at home at saturday  cuz I m ill , flu , hapshuuuu , I cleaned my home eat lunch hi everybody"
1,Happy to hear you're happy  Whats new ? USER
0,URL - Jane Eyre doesn't want to grade finals either.
0,Is going to Philadelphia tomorrow. Airport at 445 am.
0,I miss my boys
1,USER Sure can. I got a portfolio started here:  URL Let me know what you think.
0,30 min till campanile time and I still need a partner
1,USER Kris is going to be in your show? I wish I could watch. I love him to bits.
1,"USER: So I'm not the only one to cry during ""Up""? It was an excellent movie    <--- You cried?!?!?!? You have to be kidding!  LOL"
0,I feel that I'm so much behind taking care of my shops  Just don't have the energy for some reasons.
1,I hope nobody wears the same ben sherman shirt as me today. Ill bring a backup shirt to be safe
1,USER I'm not worried about it. I'm already thinking how I will spend your $11
0,"USER ""nice day?"" maybe in BK but in Bmore it's cloudy,  70 degrees & supposed to rain, that took the ""nice"" outta my day"
0,im with randy! i hope startrek is on.   LIVE LONG AND PROSPER MY FRIENDS
0,"its a beautiful night, im stuck inside feelin ill instead of being a crazzzzzzzy ass party!"
0,Ran my first 5K in 5 months after a knee injury in 33:04. Sooo slow
1,"hmm....write a story...about the ""vormÃ¤rz""^^ this is crazy"
1,USER Yes! Plus aie and hotel!
0,Well the new iPhone OS is not out yet...  I will go to sleep and if it comes out in the morning! Night all!
1,USER I've actually considered it. I have that administrative type of mind. Maybe even a fine arts administrator. That'd be nice.
0,"Reading, as always. Too bad its so cold outside.  Blah."
0,is finally home but bored to death
1,USER Sweet! I love garlic spears. Thanks for catching USER at the grocery store and making him buy them
1,eXo JCR website live on JBoss.org : URL (ok quite minimal but enough  )
1,weather is looking like it will hold out until the weekend!
1,"Finally going to sleep, last day of school tomorrow & the Jonas Brothers album is released!"
1,Happy Mother's Day USER
1,"USER ahhh, lucky! only thing my siblings do is moving to australia.. pffhh.. lol"
1,USER u welcome  anytime
1,He got the hang of his rolling over. Now I will never be able to keep him still
1,"Took the dog for a little walk on the trail head. Church in a little bit, then perhaps over to PO"
1,Just found out someone I know is CANCER FREE
1,USER HI Gwynne! How are you? You're on the roll with the games. You're always keeping me updated
0,"i hate when ""shit happens"""
1,"Just got back from the city, interviewing 'Stomp' was awesome! Getting ready to go back to the city now to go backstage"
1,"this ""Grooves from the Pit"" mix by Nicholas von Orton on USER is awesome .. it will wake you up!!"
1,new atl song
1,Loves having a blackberry at work it gives me somthing to do!!
0,"OMG! 0_o  3 exams in a one week?! that's right!   -> American Press, Audiovisual culture n' U.S. History *!help!*  I go to learn :/"
0,Waaaaah. I hate having to be stuck at home because there's nothing going on. I hate Jersey....sometimes. Mostly when it rains.
0,hell no! 2day i got an e-mail from a boyfriend i had when i was 15! they let anyone on the internet lol that no good cheating ass liar
1,"USER me too!You would have to come to Italy and meet your most hardcore fan  thanks 4 replying and btw,who are your music idols?"
1,"just about to go home. I'm usually 'mr. positive' but this has been one of those daze. well, 15 mins until tomorrow!"
0,"Yep, early lunch yields a long day. 4 1/2 hours left of work day."
1,USER Love the updated pic! You look great
1,"USER Aw c'mon, leave the poor little boy alone."
0,USER will have to pare down his collection of portraits of USER and bangbang
0,"I wish I lived far far away, in a fairytale land.... With lots of happiness and love... Ahhhh to daydream"
1,USER how's the feeling at #mysqlcamp given yesterday's news?
0,"USER sooooo true, feels like that's all I have  URL"
0,3rd headache this weekend
1,i cant wait to watch im a celebrity; get me out of here! is anyone going to watch it?  i need someone else to! haha
1,USER going where? down the toilet
0,USER why was it such a struggle for them to admit it? Were they anti-musical too?? we are a dying breed
1,Photo: capucha: most adorable little girl ever! i hope when i have kids they will be this cute  URL
1,USER that ain't junk baby...pass it on.
0,The entire back half of my body is scorched  That`s what I get for falling asleep on the beach.
1,USER LOL.  For you?  A time machine.
0,"USER hey, no fair. i get a first before you get seconds."
0,"Ha! Try finding a mother's day card on the 7th of June in America, good luck !! But but if u do... pls let me know"
1,"Mornin' all, very dreary here...hubs's taken dogs....in the rain....I'm still in bed"
0,omg I need to use more make-up....I colelct it but I hardly use it now...no one to impress
0,USER yess! i left him a comment with like 20 sad smilies yesterday  he will be missedddd. *sigh*
0,USER I wish! I have a fever
1,"Tracy is on her way over. After that, I'll make her some chicken enchiladas and then we're off to see Terminator!"
0,"noooooo an hour of planned maintenance on friday, what to do without twitter  hahaha"
0,USER I couldn't hang  ima hour ahead of u lol ... okay ima wait for the perfection of the shashawn
1,juss got home. went 2 thunder valley last night. my friend won cuz im his gud luck charm. ha. & u know i am mister.
0,I really wanted 2 go 2 the Nwe Moon set...
0,"USER brat! You have to rub it in, don't you.... I want a mocha"
1,that was probably the most ridiculous night out with my wife ever.
0,"has gym'd, showered, and now sitting down to carry on the revision.  I think it might be a late one too"
1,is starring in her own High School Musical
1,"Thinkin about USER, like always   SKEET[F.T.W.]"
1,Had fun workin on the house with the fam until G came to spoil the party...what a Debby Downer!! Still can't wait to do it again tomorrow
0,still waiting for iPhone 3.0 SW
1,"USER no my lovely cupcake, my gramps isn't doing good at all, waiting on word from his surgery, but have lots of fun for me"
0,my loneliness never leaves
1,USER - wait for the third day!!
0,ok too melty to remember my telegraph blog address
1,USER  You lucky duck! Where in Ireland are you going?  Went there about 8 years ago for a month. Both Ireland and Northern Ireland.
0,"I have to lay grass today, that sucks. Wish I could have went to A-day."
0,USER lol whateva and na we cant go to jeans  you can thank pam for that one! Lmfao
1,my school's sweeney todd play was incredible...just saw it
1,USER nev mind. just accepted your friend request.  thanks.
1,USER ... because I'm gonna live with my dad and his gf...
1,Is having an awesome time in Boston! Congratulations to Yen! Woohoo!
0,I would give up everything to go into space
0,"ughh, summer is so boring. that tv taping was so whack didn't even get to see ruby &the rockits."
0,USER u're fool  mmm if u were not so nice I could angry
0,USER I tried using that code and the site says it's invalid
0,"Enjoying the Tonys, going through boxes, organizing new house. Good to be home, but having serious waka withdrawls within"
1,"ARION, then superindo"
1,Back in Zagreb.
1,USER can I interview you today if you have nothing to do?
0,"USER I am having a yummy drink at the melting pot, so good. I am still missing DDub. Too"
1,Going to some tower in the dark. I'm gonna fall off the edges and plunge to my death
1,Please FOLLOW my girl (oh you didn't know???) Lol USER
1,??????? ?? ebay ??????? ???? ?? ???? ????????
0,My eyes are so sleepy
0,Frank from UPS' last day today...  sad to see him go   best delivery guy EVER!  Hope the new guy is NOT a fucktard...
0,Back to work.
0,ugh  I'm off to school!
1,"USER Ok, I have enough character now - can I win the lotto?"
0,Sun sun sun...but I have things to do
1,In the process of doing things to my hair. I look like a bumblebee.  Adding purple in a week or 2.
0,"thinks my bff is mad at me   she won't answer texts, call back, etc.....  the conversion went well yesterday!  Now for tomorrow..."
0,cantttt fall back to sleep.
1,USER The Top 10... That's what I like best
1,"wen i see u , i run out of words to say"
0,Just split glue all over my mac
0,USER Sorry you've had such a crap day   Hope you have some nice wine at hand.
1,lol i love music!  via URL
1,"Sitting out in the sun reading Chinese utopian theories, i.e. the makings of a good day."
0,having mentrual cramps  i hate to be a girl....at present.
0,back to work tomorrow.  boo hoo
1,â« â« â« #musicmonday - well while we're w Ziggy > Ziggy Marley - Tomorrow people URL
1,USER  how's the V on this sunny sunny day I bet you're smiley hahaha
0,"I have my headphones on and a book out, yet two people have felt the need to small talk"
1,USER's album comes out on july 21st!!!!!!!!!!!!
1,"but i wont, i'm too nice. but i can always dream"
0,"very, very cold"
1,"fun night at sean's show, which also happened to be ryan's show too!"
1,just made a VS purchase - happy early bday to me
0,just got back from disneyland and is totally jealous that brit gets to see david archuleta WITHOUT ME!!
1,Off to get some sleep
1,gonna download all those all time low songs i didnt know
1,USER G8 stuff. I will need that in the comming weekedn  Greatly appreciated...
1,USER yeah seeing them next Wed too
1,Made it to top 20 =D Vote for Gracy   URL
1,"USER Hahahaha yes!  Good for you Kakak! May you have a graaaaaaaaand wedding, dgn titik peluh sendiri lagi lah feel (:"
0,i want wagyu steak!!! I miss having lunch at lola's house
0,dont think i am using my twitter properly since i am only using it to have a  long running convo with daggers... oh well
1,USER Hi  How youre doing in school? ^--^
0,Have now woken up tired the last three days in a row
1,seeing the crew today!!
1,Good morning people of the world.... im up and going back to bed.... talk soon YEah?
0,"I reallllyy don't wanna go to work, I hope I dun gotta be on the register all day,  URL"
1,USER that'd be a yes
1,USER Try it!
1,USER I knowww.  It's gonna be epic.
1,OMGOMGOMGOMGOMGOMGOMG! ATLATLATLATLATL! TOMORRRRRROWWW! USER USER
0,Wish i had a spare set of sony ericsson headphones to leave in my bag
0,USER No.   Asshole beat my record by a good 140
0,cheer early in the morning
0,Headache  but excited for tomorrow!
1,Can't be bothered to put more stuff on ebay tonight. Going to stop now  URL
1,Is done with play practice for the day and is enjoying yummy Indian food.
1,USER USER nah he likes to be incognito. I think his wife likes it better too
1,chillin with the neighbor
0,goku's dead...
1,1 more follower makes 100! woooo!
0,USER It makes me really miss my Zia.
1,Finally I found my sister  -> TheABchan *squeez*
0,USER if they were for the 7th of august i'd get them...
1,"Chawlie bit my fingah, ouchh chawlie. Ouuuchh.  History time... blegh."
0,is ill at home
0,i met USER after 4 freakin LONG WEEKS!!! YES!!!!! FINALLY!!! IM SOO HAPPY!! I MISSED YEW SOO MUCH!!
0,"Don't you hate that you have to decide HOW nice you're going to be to a guy SMH.  Tired of the games, but I sure know how to play them"
0,USER  hey!  got your IM!  I was away from my desk.
1,Tomorrow i'll seeing my mom after so long. Mmmm.. from now nervous and excited at the same time
1,You have to listen to Kiss the Rain... It's so relaxing and sad in some way...
1,bedtime. more studio tomorrow and guest vocals on friday
0,USER Apple isn't letting anyone deliver them until Friday so they are holding them  #fml #fail #violence
1,USER I'm going to get ready now. Thanks again for the chat and introducing me to cool tweeps. I'll talk to you soon
1,"Gonna go finish doing my hair, put a better shirt on [I'm wearing my Top Gun shirt right now, lol!], and eat some grapes. Yumm"
1,USER I love your tweets Jim. They R always so timely & say exactly what I need to hear on that day.  We're synchronised.
1,USER no but saturday is over! And have a busy day tomorrow. So in effect over!
0,"USER I know  He said he'd send it before 5, then before 7, & then he didn't even call me. I need to get shit for my bbq!!"
1,USER Enjoy it sweetheart !!!  XX
0,USER Hey bae when R you gonna go live again? i always miss out    What ya up to now
0,Why the fuck is it so cold in june!? I'm pretty sure I'm sick now
0,"omg. URL In other news, no internet for a month"
1,"I'm off now, going for a bubble bath/ and a listen to of The Block  I'll be back around 8.30pm...are we mass-tweeting my blog tonight?????"
0,"Watched Marley & Me this morning, gets me everytime"
0,USER that made me think of my friend Phil's son.  This kid lost his dad (phil) and step father both to suicide.  Poor kid.
1,USER Use mozy.com
1,USER he sure is
0,USER I'm sick too!
0,Another weekend spent at home alone   FML
1,has probably gone over her limit. I text too much
1,Damn just got woken up by a conference call from my boys in LA and Philly. Dudes are crazy! Looks like I'm going to LA soon  yay!
0,time is winding down *feeling blue*
1,<a>cuma test doang..   URL
1,USER ive got hot pink on today and so far its a great monday
0,USER is it any good at the moment? was there at about 1:30 but it started raining
0,Fuck! I'm an emo
1,Happy Mothers Day! Doing mom's nails then hopefully laying out by the pool
0,trip went by too quickly. bye la quinta
0,My perfect work of art on my hand has smudged!  Poooeypoopoo..
0,#Pakcricket #t20 no loadshedding during final. Same promise was not fulfilled in semi.
0,"USER Aww, that's not good!! I hope you feel better"
1,"typical - replace my av receiver as i think its broken and turns out if might just be the speakers... oh well, shiny new toy"
0,I've eaten dinner alone for the past 4 nights
0,"Knee hurts, bored"
1,whatz goin on 2day twitter pplz
1,"what a great random weekend....dirt bike ride  mt bike ride   gardening, clean house, and lots of fun  sad tomorrow is Monday."
1,i'm getting a laptop for my bday...woo
1,"USER Thanks!  I haven't had a float tank for ages - not so many in Prague, where I live these days."
1,USER I do hope so
0,wants Sims 3
