1,Watched best epic scene from Leon (The Professional) @ URL
0,Just woke up and showered....... Class starts today!! Bummmmeeeerrrrrrrr!
0,"USER my mac's hard drive crashed then i brought it to powermac, they couldn't recover the files  no back up ("
0,"Bored to death, school got out yesterday and I have nothing to do!"
1,USER Daisy is somewhere. FEEFEE is HERE!
1,"USER I hope you feel better, mac"
1,going to see my baby today excited to see him
0,The Linux Â» Windows thing is not going very well  I'm missing a makebt\TEE.BAT file in my computer so I can't boot my USB stick!:'( Help?!
0,Wow really bad accident on 95 south. Car fliped over.
1,"USER Der mit OpenOffice ist gut, das stimmt total!"
0,USER she's not there. and it was her husband on the phone
0,so fast the long break is almost over. .
1,USER That was the shortest music video ever.....kind of violent too with that light
1,USER
0,is too depressed to think of a good story to write
1,USER Awwwww. Noah is the cutest baby ever! Great shot.
1,"USER  thank u, thank u!"
1,USER ta... appreciated
1,USER  why don't you move the garbage dumpster closer to your balcony when you go to your car!?  It might be easier
1,USER - Have a contest to invent swearword substitutes for you to use.
0,I don't think we're going to England anytime soon. That is unfortunate for the graduate of British Lit. Oxford
1,"USER so Tom you already have a team in Twilight? Edward or Jacob? please tell Edward, vampires always do it better"
0,english final USER
0,USER Oh no...UTI's are the worst.  I hope you feel better soon.
0,I have to put my dog down tomorrow
0,Just woke up with a nasty cough
1,USER we're on the  A358 heading down  Yeovil way - but there  are other options at  the approaching  roundabout
1,"USER Haha... somehow I don't expect to hear ""dining"" and  ""Carl's Jr."" used in the same sentence."
0,"I'm so tired. This class is such a drag.  Ugh, and math."
1,USER 5:40 am EDT launch for #STS-127 - early!!
0,USER me too... I spent all afternoon in bed
0,I'm a loser who needs a shower.  I also...should clean up the room. Eh!
1,"oh, it's flossing time. then study time...taking my test on june 10th!!!!  then...bed"
0,"USER I was going to vote, when I register, told me I cant vote, it is 13-19 years, Im 16! i was going to vote for u! Sorry"
0,Playoffs it is then
1,"USER Haha! yes, but I never was risk averse!! lol And I love making nobheads angry"
0,I HATE my emotions
0,USER Stop tempting me with all these pictures  URL looks awesome
0,Saw the world's largest goose and pecan! But not the world's largest ball of string
1,"If u hv no rights to talk 2 people who r richer than u, than they don't have d rights to talk 2 a person who is richer than them--you."
0,USER Uhm...duh. Neil Patrick Harris. The hottest thing on this earth. I bet parties for the Tony's in New York are 10 times better
0,OMG I totally got my laptop back and went to send tommy a message to let him know and I couldnt find his profile
1,USER
1,USER All the original members of Destiny's Child will always have a place in my heart <3 Yeah Thii is so cool.
0,USER I miss you and Mandie so bad bc I know you're at the pool without me  but this weekend were all over it!! RUMPLESTILTSKIN
0,Loved the roadtrip. Now finding it extremely disorienting to be back in class
0,USER pls don't sneak out.
1,USER Need to get my hands on one!  <3
0,USER URL - noooo dont dye ti  its pretty enough as it is!!
0,"had clear the pic!!! i was so angry, because it was a really good one.  i'm so sorryy"
1,USER True.. thanks for following miss
1,"USER sure thing...just as soon as you get your butt back here, son!"
0,laying in bed.. i dont want to get up..
0,Hubby passed over 4 another job - wrong skill set
0,said final farewells to roommate.  almost finished packing then it's dc or bust on the 3rd. california: i divorce you x 3!
1,"USER lol  unfortunately, my second thought was ""crap I have work in 3 hours"""
0,"USER uh trust me i wanna go back to ny so bad, where ma friendz are, u and jude are there too"
1,one of the best days of my life
1,yum - mother's day lunch at The Food Business in Burnside was delicious! such a gorgeous day
0,USER and pointless... pointless.
1,I have many favorites but just need to add them. It will be a little while but I promise it will be good  I hope you enjoy!
1,Good Morning!!!
0,USER malas la ;) and you had lunch with shak????
0,so I bought a shirt the other day and found out that it could definitely be used in a wet t-shirt contest
0,USER Have fun tonight without me! I'm so bummed I can't come!
1,USER She's not really a DW fan. Perhaps this will help.
1,Having a wonderful piece of cake for lunch - what else could I want???
1,USER Gaming day tomorrow then lol And then out for some fresh air on Sunday then.
0,URL - I miss my babyyy
0,USER CAN YOU SEE WHAT IM SAYING
0,worried about so many things atm
1,"USER thank you  I really enjoyed my visit, just wish I'd had more time!"
1,is wasting the day away with tv and yoohoo
1,I am such a dim wit when it comes to all this sort of stuff...  all these stars talking I dont think so I am very sceptical
0,Audrey's fic made me sad
0,"Jordan cabiling, you make me miss you so much more"
1,USER Sure thing
0,happy to have a bank holiday weekend. looking forward to work ending. day is dragging a little
1,true beauty lies within
1,USER lmfao . gee thanks . go back into ur tentt ! maybe antonio wont steal it  haha.
0,"USER  You are never going to be a ""fucked up little kid"". If anyone dared say that to you i'd fucking punch them D: you're amazing."
1,"I'm excited that I found a friend from high school on myspace. I sent her a friend request tonite, I really hope she accepts."
1,FLY WITH ME!!! Ahhhhh!!!
1,USER met one of your clients today. she had wonderful things to say about you and jeff
1,"AND, it taste's INCREDIBLE!!"
0,USER nope but i'm sorry you do
0,so no one wants to join the ghost club?  i swear...dying doesn't hurt THAT much...at least not for too long...
1,Looking for apartments in calgary
1,USER I got it today!!! Omg it was amzing! Lol
0,my sister is gonna watch the hannah montana movie but i cant join her
0,"USER DAAAVIIIID my squiggle webmail won't work, can you help? the page just won't load"
0,still so sleepy.. Kai woke up in a fit again
0,USER thank you so much for coming out & supporting me today! it was wonderful seeing you before you left for the whole summer  drive safe
1,USER hahahha just kidding Athar.. Thanks ya  I believe you're sincere kok hehe.
0,"USER why didn't u tweet me ""it's going down""? U hate me"
0,My cat defiantly just attacked my foot. Ouuuuch
1,"Twitterrific seems to have died sometime Friday, so I caved and bought Tweetie. We'll see how it goes."
1,my cousin gave me a present from spain
1,Off I go to fail a Critical Thinking exam and to see Star Trek!
0,Fotoshoots make me hungry  but food is on the way! yummmm..
1,USER
1,USER Congrats Shannon on the birth of Billie Ella. The love of a daughter is the purest love a man will ever experience.
1,"USER Yeah, trying to play when I can muster the strength to sit upright."
0,It's back to square one: so cold and windy here. As a result I've to drop the idea of after-work shipping party
1,USER lol thanks
1,will now go to school! D and Good Morning!  URL
1,USER LOL. I too am in a perpetual state of confusion.
1,USER Cute hair!!! I take it you had fun   I like the bangs   Can't wait to see how they go with your motorcycle & halloween outfits
1,URL - JMS school's band and choir singing i'll make a difference.
0,USER ouchies.    have a good day .......and goodnight USER.
1,"Just got in, now in bed, very fucking tired! Thanks for all the birthday wishes!!!!!"
1,USER Did You havee a Good Day today ?? i did A Dancing Competion And Came 1st !!  x
1,"i hope ftabh grows on me again, seeing as it's summer. new jack penate album should be interestint"
0,Omg USER u r gettin it today? Lucky u! Where do u buy it? I can buy it 2day too but im not going to ambasador
1,So much to do ... so little time to get it all done!!!
1,Who ever said love was blind got it wrong.... It is deaf n it is good
1,USER My Grandma had to use one and hers 'sploded all over my parent's bedroom.
1,USER anytime!!! Now help me get above 2k!
0,"USER  That's really sad. Spose it fits with your neighbour seeing you as ""the foreign woman"" without a man in the house. Pathetic."
1,eating ketchup... lol! xD funny! looooooove ketchup..yummy!
0,Someone in UNITED STATES didn't like Unlock The Locker URL
1,"ok so im bored, and after i get off twit, im probly gonna give myself an at home pedi  i need a little pampering..."
0,Well USER says were being grown up by not going to the boston show.   wahhh. I don't wanna grow up!!
0,ok tweeple im outta here for the night. im taking my lil girl back to her mom tom.  but ill get her again in 2 weeks.
1,"At home all day today, no plans. PHOTOSHOOT SOON!"
1,In and out of the dentist's office in record time: 35 minutes. No problems found; keep on doing what I'm doing. Happy.
1,"All going well out there in T land?   Remember, if your glass is half empty, make sure there is a full one standing behind it"
0,USER is that the airport?
1,haven't been sleeping for 24 hours :/ but it was worth it somehow  ;P
1,"Oh Hi there, Oh look at the time, Bye there"
1,Last day of lessons! Then it is just revision until the exams
0,My gum fucking hurts
0,"n now, i cant have them for mine."
0,aw bastard!! sonic the hedgehog is only for the iphone!  i think i may have 2 purchase the iphone!  x
0,"Dr. A: I think I did read that email, but I haven't looked at it again.  Man, you guys are so mean..."
0,"watching scrubs, haha theres nothing else on"
1,"ok I totally  music geeked about  Junkfood, Bart's really nice tho"
0,Aww. I missed another chance of getting a reply from USER
1,at thee mall
1,USER Thanks! More to come
0,im in the car driving to my uncles to catch up in my last day of Melbourne
0,muss shoppen demnï¿½chst
1,"USER Oh! She was called Grundgetta apparently. In my head she's Lucinda, cos of the book Oscar and Lucinda I suppose."
0,just got home from the movies no ones phone is oni wanna go out.
1,USER  its a rainbow
0,USER where have you been all my life? I haven't seen you in 2 days!!!!
1,Last night was soooo good
1,We've got FAB lollies   URL
0,USER I've seen it before. Just rewatching it. The ending bums me out.
1,"had her foot surgery this morning, followed by my mother buying me lunch (for  being a 'good girl' @ P. F. Changs"
0,"All I want is to go home, buy bread & milk, and jam some L4D. What I *have* to do is get this stupid project finished"
1,USER classic
0,"first patient has arrived, but ive not finished my breakie yet"
1,USER sings hoedown throwdown  is so easy! as miley cyrus
0,i want it to rain! just liddo sprinkles right now
1,USER thanks babe  xx
1,"USER It is right Vargasss..you talk a lot but you do say too good stuff!  would you tell me whats ""the user"" to you??"
0,"USER damn, that sucks."
1,"All of a sudden I find myself being really excited over something. No idea what, though. But that's still a good thing, I guess"
0,USER USER It's because there was such a long period of time (7 months) between permanent employment jobs due to redundancy
1,Thinking on what to order for dinner.
1,"Wee  I got 'cross my heart and hope to spy"""
0,"Been On The wii,,Realii Bored Today  lol"
1,Laying in bed thinking about anyone and anything
1,"just came back from supermarcet, met a long mist friend , day starts good today"
1,Ugh has nothing to do today but help my brother pack. but music is keeping me entertained.
1,"Woo! Learnt the start of Hey Bulldog on piano, and 5 other Beatles songs on guitar."
1,"USER she know about all the coach sandels before they hit the streets..all the bootleg sandels, the year 3000 sandels"
1,USER i'm sitting next to you!
0,USER no music love for me anymore?  haha jk. i just got back into songwriting. little rusty but maybe i'll share with you!
0,USER oh nooooooo!  i have the sat's tomorroww
1,USER It was great thanks  Slept badly though....how was yours? What've you got planned for today?
0,CC and Mariano failed me today
1,USER & I think you are lovely.
0,My weekend is almost over.  Now I get to do a week of the late shift at work
1,OMG! The Six Flags guy is back!  *hums we like to party*
0,Im bumbed though cuz ima miss da laker game        |double sad face|
1,The deposition of Kevin Rose  URL
1,USER Sure ya are....you're a DDG.....we're all HOT!!
0,USER oil what? Haha. It still hurts  2 days na!
0,USER aww - i'll probably be asleep at midnight  so i'll just say it now lol - Happy 5th band birthday!!  yous are amazing!!
0,Now I only have 50 pages left.  [Btw--these are very short pages. They're double spaced.]
0,missed it last night
0,USER I missed you sis! I realized it a while ago when we were together. Now we aren't classmates anymore.  Also USER..
0,I hate when Thursdays feel like Fridays..
0,oh no i have to get up at 4:00 tomorrow morning
1,Gotta love iChat
0,cannot truly explain just how disgusted and ill the mere sight of maggots make her feel.
0,My son stold my ice cream  even tho he had his own! Lol
1,great! move up by 3  97. top10optimizer.com
1,USER yay! hope its a good one.
0,USER
1,"can i just say, the guy from step up 2 is one CUTE human being! goodnight"
1,"done with the researches,  tired already, wants to sleep."
1,USER 	 Gio you ever thought about coming to Brazil to vacation?
1,"USER you are good. i should go to the gym. instead, i'm about to wind down and watch TV/movie"
0,"USER I was sad cuz  well lets just say dont ask a question in which you know the answer 2, if you know it will disappoint you"
0,"Getting under GM's hood. Wow the engine is gone!  A lack of vision then,and a lack of vision NOW, A hydrogen program is the only ""future""."
1,Why am i still awake >=( listening to colbie caillat  ocean to city tomorrow woo
1,"It's so peaceful right now...don't wanna go to bed, but my eyes fail me.  Hoping for happy dreams.  G'night Twitterville."
1,USER Is there a season 4? I sure hope there is!
0,USER  But my stomache hurts . . lol Put it in a thermos
1,USER :O:O:O can you give me the guitar chods to those songs at school ? i did giutar last term
1,have just found out Dananananaykroyd won't be playing YNot. Gutted! Have started reading 'The Life of Pi' though. This looks promising
0,Took n ambien n still up so ha! Party! LOL for one  LOL
1,USER Thanks for the props! Glad I could take you down memory lane!
0,Morning! Feel really uncomfortable in this heat  Postive: 4 day week! Yippee!!!
1,"USER The 10.1"" Aspire one netbook? it rocks."
0,USER not today  off to London!
1,Uuuuh New Red Deltas song xD ^__^ thanks to USER for giving me more music to listen to
0,is trying to remember what happened back in the interaction. friend with the hard to spell french name help meeee!
0,USER
0,considering what to do with my day. scanning is not going well
1,Sprint review now #SCRUM 1 sprint down 5 or 6 to go
1,"worked 15 hours yesterday, just so they can open today. My body is killing me now. I feel like I worked non stop for a week"
0,wtf i'm postive my friend wali has flown over the cuckoo's nest..um its just gettin crazy:awkwardness.Screenin ur calls & shit now sadly
1,On a boat cruise with the wife post pics soon! Gotta eat
0,Ahmadmajed murdering his own people because they want freedom and justice URL The whole world is watching  QC
1,"yeah it is actually really annoying when you miss one half of the conversation. tell them to follow ME, USER !"
0,"That and the proliferation of the spammer/splogger friendly shortcut urls (tinyurl, bit.ly) etc are negative side-effects of #Twitter"
0,"USER of course I think your a serious buyer. I was stating that for everyone that check URL.  USER few games I own, need $ asap"
1,Unfortunately theres no subtitles but it's fun to watch anyways
0,Geeze. How did jim fall in love with such a horrible fat cow?
0,is feeling very down
0,USER yep
0,USER im shoocked  I might cancel all my shoots.. cus it will be like this till tuesday i think.... i can't do no shoots like this
0,Just leaving Chicago.. Now comes the LONG ride home.
0,USER
0,"USER We think its grass or something.Ankles legs tummy, bald, rashy & stinky a lot! Antifungal stuff keeps it at bay but never goes!"
0,USER i'm not allowed to do that because the first ice cream man i had was a molester
1,I never realized how much I love the movie sky high
0,My 'Dove of peace' Avatar on Green background was replaced by default on #IranElection   - I've reloaded in hope it now gets displayed
0,I want a huge butterfinger right now
0,"So fucking sick. No worries, chug on m'son! You have things to do and places to be..."
1,"USER nah, but im down to throw a verse on there!"
1,Soup kitchen.
1,i got a new phone
1,im on twitter in school yep i bet you know that already
1,"USER shhh....don't tell anyone!!! *looks to the right, to the left* It's a secret"
0,USER I am happy you had a blast.  Sorry I couldn't make it  I owe you drinks
1,USER i do to. But you can always put your hand to your ear and make them think you're on a bluetooth headset.
0,"Star Trek Reboot: ""Compatibility Test"", Kirk/Spock, NSFW, Vulcan biology. URL Skeevy premise though."
0,"USER Yeah, I took it down though after getting the laugh at the title. The conflict isn't that funny."
1,"USER You don't put on a Condom YOU Risk INFECTION BY CHOICE!! Swine Flu Infection, is NOT BY CHOICE!! Just my opinion."
1,eating Eskimalitos  if u dont know what that is...google it xD
0,Rain  again and again ....bad day :[
1,Good morning!
0,"I'm playing Scrabble with  friends on Facebook, only I can't cos it's region-locked and I'm in the US  Don't they know the web is global"
0,so no bowling and trav had a really bad day.  watchin a movie at his place..
0,So its my bday weekend and shit is already headed south...might have to drive to atl tonight
0,USER The link did not work for me
0,"Woot I'm fully weight bearing on the leg, but apparently its forgotten how to walk"
1,Just rocked out to untouched  take me on the floor seems good to have next :p
1,.miss the hubs love sex.
0,USER aww :/ kk I need to do a huge shopping trip at joshstore to get you also a joshmobile.. pft.
0,"USER we are actually getting good weather here, so hah!!! It's' that horrible humid heat though so it's not actually that nice"
1,USER great to meet you. it's like 16 minutes long
0,USER awww lol. I have talked to tom from mcfly 3 times and no reply :S lol weather is shit here too
0,USER it was horrible! I tried my best though so thats all that matters
0,"USER Thanks for the drawing, looks awesome! This is the first time that I have checked my acct since Friday, sorry"
1,USER Thank you.. thank you very much for following.. and for the kind words. I really work hard to get it right for you!
1,"Random movie  My best friends girl, thought it'd be usual rom com sh1t, but was actually funny! Dane Cook <3"
0,Its so  lonely up here
1,USER WOW!! how short? I want one too!  ... and a tattoo
0,i am bored!!!! i'm only!!!!!
1,USER Which movie were you referring to anyway? Wonder if I've seen it
0,work tomorrow.  Yum.
1,USER okaaay  thanks heaps! xo
1,"Hanging out at the Apple Store on Michigan Ave with Erick, Destiny and Zachary"
1,"USER yes, it's the food festival there. Food from all parts of the world  you pay a small amount and get to taste..."
1,USER It got number 1? That's awesome! It was a great concert
1,USER Have been waiting for your real twitter. There's tons of fake ones out there.  Love you!!!
0,USER I'm walking home... I'm in pain not used to working this much normally only 6a wk hours done 36 this week
1,Mother home from hospital today. Minor episode this time.
1,USER Glad you're home okay mate!
1,"USER you don't look dorky. but it does seem like karim is pointing to his family jewels, and you are looking obligingly.  haha"
1,USER still says august!
0,need to start studying soon
1,I'm watching my son play in his kiddie pool outside and he is such a ham!
1,"""Psych"" is just about awesome"
0,I havee to get up S0000000 early !
0,Stuck in ATL airport until 1030 am tomorrow due to #airtran delay  seems silly that there's no comp or contingency. Terminal floor = hard
0,USER i'm not He's talking to me about my cat.
1,"bout to watch movies with my mom for a while, and pick out a new hair style. maybe ill dye my hair purple"
0,USER sorry to hear it Pink  you're in my prayers girl
1,sweet dreams twitter
0,USER 'I do not like my current life and it's not in my hands.' - I'm very sorry to hear this!
0,Pushing worms broke car!
0,USER Ever seen this guy's interactive Flash vids? URL Stick with #13 to the end...
1,i was in brazil mh 4 or 5 years ago and it was..interesting  mexico is way cooler  sexi mexis
0,"USER Miley, i got exams  wish me luck xoxo"
0,dislikes ipods breaking down immensly.
1,going outside to jump on my trampoine  WOOOT!
0,I have such a headache
1,miley concert on decdember 2nd  thank GOD for presales !
1,USER do it! The mint juleps look pretty tasty.
1,Over at the new house.
0,USER she cant come!!  Car shopping today meant no study meaning she can't come tomorrow!  She has an exam on weds
1,had a great day in Battersea park with Merlin
1,Likes sitting in the Four Seasons Starbucks stealing Wi-Fi and using Tweetie OS X before he goes for a swim!
0,Dang i hate just sitting around thinking... I miss my dad... Alot. Wow.
0,Getting ready for work.  Living in L & W hell.  Pastor Steve leaving
1,"USER Hey, Super C, I Hope You Have A Good Time In London & I Can't Wait To Hear More About Tha Shows You Are Doing!!"
1,Congrats to James & Becky Hester on the birth of baby Zak
0,USER Creepier because you know where I live
1,my iphone is missing...if you find one and it smells like Patron please return it. Thanks
1,USER - that's why you listen to music while you watch the game
0,is thinking about you
1,Had a fantastic time in Asheville with Jeff. Saw Biltmore and my apt feels sooo small now.  I need a pool in my basement!
0,"USER:  Cheer up, baby cakes! Everything okay?"
1,USER Gnite gwen baby  <3 maja.
0,USER i would but i cant im on my phone and it dont let me do that
1,"USER Thank you Sir, really glad to hear that."
0,"USER call me when you can, i want to know whats going on..."
1,URL - This was a goody bag prize in my sisters bag...mine now
1,Cooking!
0,USER apparently the plane was hit by lightening when passing through a storm
0,"just realized that i left a whole bunch plates, bowls, and vases @ my pottery class from last summer...  i miss them now."
0,... BUT I COULDN'T.
0,USER Because a plane has gone missin over the atlantic  andd i said u because u asked me how i was so i asked how u are lol x
1,Just been for a nice walk up in the hills.  Feeling nicely tired now. Maybe a snooze on the sofa is in order
1,USER  okay  that's good! oh and you missed an AMAZING concert last night. i wish you were with us
1,is thankful that music has lifted my spirits after a weird/sucky day at work!
1,Almost done with the first of 3 Real Estate books. Going to take the first of those 3 tests on Sunday!!!!  Finally!
0,USER Can it be said too often?  Why does it have to be said at all?
0,"USER Seems, like the rain is going to blanket the whole country  and here was me thinking the summer had arrived lol"
0,Lost again without USER
0,wishes he would come on msn
1,"just had my nails done. french tip. CUUUUTTTEE :""> and also received new yellow nail polish from my friend's mom. wow!"
1,USER like that list too
0,"Is having a bad day, as had a fight with my g/f"
1,USER grats on your new job!  I've missed watching you since VM went off the air...
1,USER check out my older posts. i twitpic'd buddy!
1,USER American Psycho huh? Oh man I own 3 copies.   Let me know what you think so far!
0,USER I love csi vegas but it's not the same without Grissom & Warrick
0,USER oh no this music remind me of my freshman year  man
1,Just had good talk with cousin Angela.
1,USER hey congrats on the job
1,helping my friend get used to his new macbookpro....
1,"Photos from today's grand opening of the Savannah Trail at Coyote Bear County Park.  Yes, there are caches on it (now)."
1,Costello should have called Swan a goose
0,is sat inside watching everyone sunbathing outside
1,"USER you owe me an email and invitation to connect.    BTW, your account should be working again.  Time for bed at last."
0,my poor little guy   ....thinking an ER/DR visit might be in order (fuckin' fabreeze doesn't work either...gag)
0,Choosing whether to back Chelsea or Everton is like having to choose  whether to marry Hitler or Mussolini
1,USER  hahaha well so would you! But that's not good enough
0,I miss my Twitterrific app
1,"Up at 4am, can't shut the mind off, so here I am checking out what everyone has to say... Does that make me a twitter alcoholic?"
1,USER lets see.. we hate that groupies are damn near stalkers.. we love that they send gifts..
0,bummed that my sis is gone! and all my boys are gone too  cuidense muchachos
0,USER: what's wrong
1,USER I now can see that and I am wiping the virtual egg off my face and I haven't even eaten breakfast yet this morning
1,"USER It will never be balanced, but you might find harmony"
0,USER i miss USER too  how you doing?
1,USER Ben added Press Record on twitter. you happy?
0,Im going to beat these damn raccoons up! They want my kitties for a midnight snack
1,Ohhhh yeh can I just say new York have the besttttt cocktails EVA wowww will defo be back if not 4 cocktails this time with USER
0,I hope john and Kate is better this week. Last week's was too sad
0,USER no fair...  there are never prizes fro the uk  lol
0,LLBean is out of every single item I wanted to order
1,USER  moi?  whad I say ?
0,I mess up everything! Can I do ANYTHING right?!?!
0,grr my eyesight is getting worse.
