0,USER Yes! like every year it happens
1,"Had breakfast with people from sweden, china, ecaudor, england I was the only American at the table!"
0,Prom is in 2 and a half hours!! I am going to miss all you beautiful Collingwood people sooooo much  xx
1,"USER Why thank you Aaron, for filling up my tweet page with a report on total crap I don't give a good goddamn about."
1,"13-year-old Kansas girl wins National Spelling Bee. Makes Olathe, KS proud.   URL"
1,"USER cool, thanks"
1,USER lol its very funny. Proscrastinators 4 life
0,USER yep well its true she doesn't deserve the love of JOE JONAS  x
0,I passed the last 4 Days in Summer (sunshine 24/7) in just around 300 miles away - and here at home it is still raining....
0,USER I used to climb outside of Golden all the time (No Table Mtn)... I miss CO
1,"USER have to avoid the burning desire to say I already have one  no, no room for piglets, just enough room for chucks"
0,Horribly sore wisdom teeth today
0,I miss Aaliyah sooo much... RIP
0,"Oh, and RIP David Carradine."
0,USER That just makes me Sickle.    Lol Kia.
0,exam today.
1,"oh, and I have a ""date"" for the 27th"
1,Chapter 108 Part 1 is up
0,"USER 12 hour shift tomorrow, so not many Tweets, am afraid  And YAY - 2000th Tweet!"
0,Busy day 2moro. I can never just sleep in...
1,USER Happy Mother's Day!
1,hmm just realized the Django fest is mucho expensive...maybe next year
0,i dont really know who my real friends are  sigh
1,Popped two final tables yesterday so i was happy. 1 of them was a win
0,USER I've never been to Vegas.  I need to fix this.
1,USER USER Thanks! It's not easy to drive with a dog on your lap
1,USER it was good seeing u today  wish I could have talked to u longer...where r u guys headed tonight?
1,Ok so mums up and almost ready. Di has rang to see where we are. Gunna go grab some toast then get going. Lateerrrr Allllll
0,"Trust me, I know, I can barely smell anything  USER: Throw out your Zicam! URL  That shiz can eff you up - big ..."
1,"USER Hey I know where Dubai is! Cool place, I've been told, friends have been there  And yeah, I did see 30STM in Finland!"
1,USER Sounds like my Snowflake !
0,11:30- Let the MCAT studying commence!  Yesterday was a good day: AAMC-3R Complete! Bad part is: 17 overall   GOTTA KEEP STUDYING
0,USER XP i ate it all sorry >.< they don't ever give enough chocolate to satisfy me  haha
0,"Aww, it ended already  Haha, it was cool though =D"
0,USER hahah nice candid. dude my rate is still 8.00
0,USER so when my youtube finally decides to love me again. the video you wanted me to watch is disabled
0,USER sakit..sakit demamnya muka gw ampe merah !!
1,playing some poker  lovely Sunday!
1,"USER rt-Must Follow-- USER She's beautiful, smart and hilarious!! Makes me lol everytime I talk to her  - My heads big now! lol"
1,TY4U  USER USER USER USER USER USER USER USER USER USER USER
1,"Aww, cleveland... U gonna' Cry King James? Guess they gotta' hurry n make a Dwight Howard Puppet!!"
0,"Revisited Aliens, still love it! But seeing Nute again always makes me sad now.."
0,No twang photopass for tonite
0,is fed up of stupid bots adding me
0,Couldn't get to sleep last night. Prob only got 4hrs of rest & now I've gotta get up and at it. Ughh its gunna be a longggg day
1,USER Therese  I Love you ) xxxxxxxxxxxxxxxxxxxx
0,"USER Now, I bought the 2nd gen iPhone in April and the 3rd gen is coming out in June again!  When will I ever learn?"
0,Firefox is eating up my RAM
1,"getting ready for school. after i print out this song, fancy, i know."
0,USER It's making it a real bugger replying to Tweets
1,"USER also, always mess with people who are sleeping bed to you. Rules of life. It's in there somewhere."
0,"Having lunch at St. Dymphna's. Sadly, they no longer have their scones."
1,USER URL - These look cool  I can't wait to see you guys this summer! *cough*july 24 ;)
1,Have you ever noticed that commercials have BOMBass music?!
0,Bar is too dark. I can't get a pic with my cell
1,USER  Nice website man keep it up
1,"USER Tom, I saw again a guy who looks like you in my campus today. He's SOOO adorable... :"") But you're still cuter than him. Haha.."
0,USER DANIEL! Why have you not visited me yet?
1,"Goodnight stars, good night moon"
0,is at work! It's been a long weekend
0,"And AGAIN not in the mood + too tired to study. I've been sitting in front of my book for like 1,5 hour already. Hmpf"
0,USER *sigh* wish I was going
1,USER  OK - hang in there    it'll be ok.....
1,Bye tweeple! Gotta GO!..
0,I just realized I touched this lady's boob money! EEEWWWWW
1,"On the bus, going to the musical theatre awaaards!"
1,USER you're welcome
0,its obvious
1,"Andy saying hello to Bella, our 2 year old niece over the phone. awww"
1,USER and u'll see many exciting things will be happening in there soon!  just believe!(ive a problem with the 140 characters thing xD)
0,USER aww  ok well just let me know what she says hah <3
0,"USER yes I was, nd still is, but i think i gotta wait next year.... so sad  lol"
0,my wife (Shoplooker) said I get a cold yesterday and i shouldn't twitter in english - hmmmm maybe she have right
0,Omg im so tired but everybody wants 2 play ball. Gotta get up now
1,USER Wow - thanks! Glad you liked the Ancient Academy map.   Did you post your entry someplace yet?
1,. USER  Who won't volunteer to help him lose that first?
1,USER missy! how was the run?
1,First CF Total: 440  Not too shabby... Out celebrating some new PR's with the girls!
1,USER Have fun out there
0,pigging out -_-* here comes the pain
1,"USER oh hell yes. lol. deffo. i cant wait 2 c him again this summer. im just happy he'll be in london,never mind the concerts!"
0,4 tests tomorrow...
0,"USER ??? Why does no work make you go ""  ""? That's... odd. What's up?"
1,"finishing essay, watching greek, txting & bedd"
1,is sleeeeeeeepy. Such a good day
0,at paytons leave me alone what your doing thingy
1,USER we're really happy you love it  because we love you!
1,"USER both, but mostly S"
1,USER I wish I was going!
1,USER Good luck with being listed!! let me know if you get on it
0,Thanx USER USER USER but i still only got 72 followers  RIP Me 6/23/09
0,Stuck with something i don't like .
1,yayyy another hot day in Milford Haven..Little mans going to school..Big man is going to work...Bliss
0,URL - one of the cutest and most active kids in america LOL i miss my nieces  cant wait to see them!
0,"Neil hasn't called yet and his phone isn't working, getting worried"
1,USER hopefully that's it!
0,"Good morning everybody! Unforyunately, I had to take down my picture recently because I have been working some undercover assignments"
0,Just noticed a new feature in iTunes Connect - crash reports. All mine are for UIKit things though...so I got all excited for nothing
0,USER you ahve to come to germany again  its been quite some time since bootshaus! ALBUM!
0,URL - At work again on a sat  at least it's gloomy outside ;)
0,#haveyouever not trusted any female because your ex-girlfriend cheated on you??? SAD BUT SO
0,Done with geology!! But I'm really missing my favorite sisters! Especially because they can't go to banquet tonight
1,one word: Band. one reaction:  !!
1,"he knows how much I love him, and I know how much he loves me"
1,Graduation parties
0,I hate customers who ask for shakes. : I hate customers who ask for shakes.  URL
1,Watching FlapJack til 5 then going to see UP with Alicia and Tricia
1,^^ Need a massive breakfast & most important a Latte to start my day!
0,"New chic just texted me saying ""Thanks for the e-mail"" but didn't answer to my question, might need to look for newer chic now"
0,USER haha. indeed it will. i was just thinking about that... at 3:00 in the morning... well im dissapointed that the cake is gone
1,just finished watching Ace of Cakes where they showed how they made the cake for the 100th episode of LOST
0,where is everyone
1,URL - Mmm. Two of my favorite things. Orbit Bubblemint gum and a Monster Energy drink. yum.
1,USER  What a question!!!!!!! Pls giveaway
0,"really enjoying Disco Exotika on IFMX, wish I could be there in Amsterdam instead of work"
0,USER i hate those days  its like something significantly bad happened that day and you don't know why
0,"USER Yea, I tried keepin' it real recently... I felt like they were laughing at me, too.  Am I really that alone w/ pressed vinyl?"
1,USER Happy Anniversary. . .now get outa here and go celebrate with u'r man!
0,got robbed on holiday lost itouch and ds
1,ended up getting a new version of my old phone and a new version of the new macbook. happy
1,Jim Lind playing LIVE *now*!!  Come join in the music for the next 3 hours!   #livemusic
0,Some guys just never go away.
1,- starts work again in 2 weeks. Cannot wait to have moneyyyyyyyyyyyy
0,USER unable to borrow shares $MTXX on etrade    was feeling confident on that one....will keep my eye on other interesting twits
0,grrr!!..2 weeks to go before the class will start!
0,"USER  awe, yeah definitely visit it, it's so lively and colorful!"
1,USER Andy looks pissed!!!!  too funny
1,Payment day. Hard one again!! Anyone knows somebody to invest?
1,"USER Thanks, Steve! Very sweet, and I'll take them."
0,USER I was informed of it by USER but I already had something scheduled.  Maybe next year!
0,I have noone to hang with tonight.  because of USER 's stupid mom haha hit me up if ya wanna chillax!
0,USER he probably wont
0,"Listening to Hindi songs while editing slides and script, again. Imran will be home very very very late."
1,USER #throwback I love the clean sweet taste of the Throwback Dew  My vote to keep it permanent or longer !
0,"Chips & guac at Club de Capitanes. Wasting time b4 heading to the bus station - just said bye to ""Chemistry"" (my boat) for the summer."
0,USER How am I being besmirched?
1,happy easter! ..  .. having breakfast noow
0,grrrr going to the mall is dead  keeping it lowkey at home...looks like a boring night
0,USER what interview! leave me alone
1,is watching tosh.o on USER with her fam
1,USER I'm from to Brasil! Mr. Octopus
1,Pikmin 2 + cousins = fun times.  Oh and Conker's bad fur day<3 annnnd super smash bros. Hellllz yeah!
1,"USER liked the site, but you didn't add sistahs jammin, that was also a site you created...huh huh"
1,"USER Hahaha  And how was it? I don't like her, eww^^"
1,USER URL -  yay!!!! nice pic!
0,"USER You were in my hometown and I couldn't make it,   Hope the crowd showed mad love..."
1,Hey you can get money from Twitting in Twitter: URL   check these out!
0,was feeling cool in the twitter world until..... i just realized like half of my followers are spam...
0,Mmm costco pizza Fuck yeah! Oh gramps why now
1,URL - USER & me at grad lunch  good ol' can can- in all it's glory haha
0,USER bummed I'm missing out
0,USER does ryanross have swine flu?
1,USER haha *winks*  jia you jia you
1,USER USER Oh! It's in Arabic - too complicated to read
1,USER ...lol yea I gotta drink a sparks b4 the movie.... hope I stay awake this time
1,I got a 110 (out of 120) from the TOEFL test - rather proud of myself!!!
0,Working on a sunday... Nice!
1,Rooibos Tea has the highest antioxidants of any plant in the world!  It is also yummy   URL
1,URL - my wallpaper on twitter...a beautiful pic in my profile...iÂ´m waitin' the beach!
1,USER Is it? LOL!!! Hope that does not happen in T20
1,USER love david mead
1,home from work after having a night out that could give a full grown man a hangover - yet im still hangover free - Love you liver
1,h?.. bï¿½nh th??ng c?ng ?ï¿½ng l?m t?i m?i ng??i v? quï¿½ + ?i ch?i. dps ch? h?t l? ?ï¿½ xem th? nï¿½o
0,"This can't be true!Why me?What have i done?I can't get through this anymore!please,my nerves can't stand throught this!!!"
1,Screenshot  URL
1,USER Understandable! Ang cute nila! I need a lint roller for all this fluff! Hahahahah!
1,I love being spoiled. I'm a little too old to be spoiled but oh well.
1,USER I'm on my way...just fyi
0,I hate shots  But I guess its worth it to find out whats wrong with me.
0,NASA launch scrubbed again due to hydrogen leak at the same place
1,G'night all. Wee the kings gig tomorrow night
0,Black widows are so not okay with me!  just found a large one behind some boxes in the warehouse... Wondering how many more are hiding...
0,"USER Man it started SO good, like the promos and then when the studio released the new trailer with the bad CGI I got scared"
0,in Btec:/ Cat has swone flu!!  and i have a tumour on my arm
0,USER don't think I'll make it for national donut day. so sad.  and...I saw The Decemberists 3 years ago
1,"USER Thanks, for #FF back at you, Mr. #1 Twitter person in Pakistan on grader."
1,USER The rest of the US doesn't have those kinds of petroleum laurels to rest on.
0,i has no friends
0,Ribs were way greasy and pretty disappointing altogether.  URL
1,USER Well an over-reaction on the mans part I think! Glad Pickles is fine
1,USER but let me know if ya need a hand with anything
1,USER aaaw love Nairn friend kelly is from there
0,"USER sweet! I wish I could buy it, but I'm too poor. Yup, it's that bad. I'll have to wait till my brother gets the cd"
0,just got out of class alll day and now im off to a cpr class in a-town til 10 pm  llong ass day.
0,USER Why have you got a link to website that hasn't been built yet? From a disgruntled series three fan.
1,huaaaaaa Burny's Partyday
0,"rest day, school again tomorrow. it's rainy outside. wanna go to the mall."
0,"USER Oh, to be in Ohio tonight ..."
0,Finally got me some greens. 2 bad the dog kept tryna get all up in my mix. I guess she wanted some greens 2. Now I'm snifflin and sneezin
1,USER any chance you need a stills photographer? hoping the squeaky wheel gets the grease.
1,"I propose a #Twitter4MMO, Twitter for ""make money online"" experts. To spread among themselves. And leave other alone here"
0,USER btw did u unfollow me??  ..twitter has been such a pain today
0,Thats 3 people i know of who've lost a baby in the last 3 weeks. Sucks hugely
0,sad part  im not going to cry.... tears*
1,Got to go through the vip security gate.. We feel very special   Waiting at the gate and everyones getting some food or coffee
1,"It was the pleasant memory maybe.""Shinjyuku gyoen""and ""Syouwa kinen park  in Tachikawa"" with good lawn perhaps. Where did you go?"
0,Forgot Conan was on...missed the first half hour.
1,"USER Actually I spotted the misspelling, removed, and reposted (hoping I'd be fast enough before you saw it)."
0,and of course..the american itunes store has everything i want!
1,USER Thanks for the #ff shout out!
0,"god damn, gran torino made me sad/depressed/happy at the end of they movie"
0,USER hahaaha i haven't managed to put a new pic on yet my laptop is really slow  i thought u had forgot me
0,USER I never even went out in the sun today!!! :O
0,Think I'm getting sick! My throat is burning
0,"havent gottten to see or talk to my boyfriend in two days, im not liking this summerball thing"
1,Move in day!
1,Off to beach today dnt think im taking my phone. Everyone going to see the Jb movie have a great time  x
1,USER lol I kno  thanks boo..love u guys forreal forreal
1,just created a blog!
1,"Finished the rock and roll marathon, 4 hours"
0,USER Yes - we had one in there back in November but the house-owners wouldn't do anything about it. So it's happened again
0,Working on the DVD menu. Not a lot of inspiration
0,USER  ((()))
0,following the updates coming in on USER makes me
0,Using my granny's laptop  its slowwwwwwww. gosh i want my fricken desktop with internet soon
0,"Apartment finally clean, still procrastinating over doing my real estate homework"
1,is trying to workout this tweetdeck software....looks  good....once i can learn how to use it properly!!! lol
0,USER lol yup its on the-n now.. and im jealous bout the strawberry shortcake ice cream.. i havent had any in forever
0,"my booooty hurts   gunna sleep soon, and text meagan (:"
1,USER hi! Nice to meet you!  I'm a navy reserve wife - seabee wife.  Thx for the follow!
1,USER ditto but I graduate next week
0,USER u better I feel bad we don't talk that much on twitter.
1,USER that's a lovely view you've got thete
1,chocolate cake with a delicious strawberry yummy yummy
0,@ work w/ stomach ache  song of the day URL ..'njoy it!
1,"USER Why is that? Nerds will just make the cool apps and plugins using Wave, so non-geeks can have fun too"
0,"cant afford to see Angels and Demons, so i watched it for free: URL"
0,This is a bad day because there is bad time
1,USER LMFAO AHAHA OK MAKE UP YOUR MIND LMFAO
0,oh boy do i hate stress! it makes me an emotional wreck.  i can't wait for tomorrow to be over and my english final to be passed. :/
0,Can't believe that mandy musgrave is only about 20 mins away from my house at the moment and I can't meet her
0,USER aw I'm so sorry to hear. I hope it's nothing serious!
0,Can feel its going to be a long boring day
0,Grrr...freakin' comcast on-demand. Now it doesn't wanna work
1,USER sounds like my life!
0,oh! i dOn't want tO gO at schOOl...ToT i gOt physic One hOur! it's terrible!
1,"In the land of #makerfaire where Makers of all kinds roam, all the misfit toys in the toybox get shiny new purposes & R made whole"
0,USER Shiny? No. Magpie-related holes? Yes
0,USER too bad we cant get a bit faster connection
1,"USER hey, right now i'm watching fred on youtube!"
1,Good Morning. Good Morning. Good Morning!  Ahhhhh coffee!
0,I don't know why my dog continues to be sick
0,civil war has begun......  #iranelection
1,USER Do you read the books? They are disappointing me. Hope True Blood doesn't.
0,USER my flight doesn't get get in until night  BUT i don't work thursday until 5! so i think we should hang out before!
1,Bfflbwash made my day better.
1,USER thanks
1,Archi project is killing us all  I'm being chased down the corridors of the faculty
0,USER ah sry I ditched ya for awhile there  ugh I have finals tomorrow. Save meeeee
1,Happy Mother's Day!
1,Off to see Star Trek   Happy Mother's Day to all
0,Apparently Twitter is experiencing some delays - my text tweets are showing up like an hour after I send them.   Sad panda.
1,USER hahahah okis... USER heheh we culd nail him up though
0,Really?? Idk he makes me sick yo n I keep unfollowing him it don't work  USER
0,USER Hi Corey.. just saw your reply now.. here it is 5:30PM .. an I have a long night coming...
0,"USER yeah, that fool. i was hoping he'd get to meet everyone."
1,USER im 15  and ive just come home frm school lol  its craazyy that your just going and im leaving lol x
1,very amused with the amanda palmer live auction
0,USER nope..  i failed some exams... so i will have to STUDY again for the next re-examination... that will be in one-2 weeks (
1,USER Ive discovered via Twitter that pilsbury-can-pop phobia is at an epidemic level.
1,USER That sucks! Hope you're able to finish soon
0,"None of us won an iPhone today  *blink, blink*  Which means we enter for tomorrow! #squarespace"
1,"one day i might open up a store that sells air conditioners, dryers, and coconut water in germany."
1,USER Thanks mate  We're both really happy with the news - we'll be having a few drinks tonight.
0,"USER I wish i was wherever you was, its like 7:15 pm here"
1,USER P.S i don't mean to sound like your mom. lol.
0,ready to sign the last yearbooks of my high school career this week!
1,USER u can edit the articles there.  )) not really the best :|
1,USER lauren!  only if i can hand it to you in person when im in austin next week. i need some lauren in my life!
1,Nothing like a nice big glass of orange juice to quench my thirst
0,Frustrated already with download speeds on 256kbps connection...
1,USER Room for one more!
0,The Life Of A College Stay At Home Mom: Delay in the Bash  URL
1,new york in july!
0,"USER I'm logged out now too, and login form seems to be at cc.thesims3.com which is, obviously, not available"
0,Juans Moving On The 27th
0,DRAG ME TO HELL def scared the HELL out of me!!!!!!!!!.....scared to go to sleep
0,"is having crash issues with Sims 3, just lost a good 3 hrs of work. Needs to remember to save every (sim) nite. No autosave"
1,USER You have to sit on it to close it and everything...  it makes me feel like I'm in those '90's Disney World commercials...
1,"So, how cold will tomorrow be then because today's already pretty warm."
1,That makes me feel special
0,Tried & working late shift until 8 at SLQ. Need real coffee but shop is closed.
0,Finished 11th. Not bad but not in the top three  Man I wish the cards went my way on a few hands. The turn and river killed me today.
0,"I feel really bad fo poor big blue   He doesnt deserve to be totalled.  He was a good truck, and will always have a place in my heart <3"
1,sundays u tend to be lazy....mondays ...more lazier
0,URL ...pretty much witnessed one of the worst bad beats i've ever seen in my life... 5k HU too  sawry Brian
1,USER WHAT ARE YOU TALKING ABOUT!!! J/k
0,Is at work while everyone else got 2 sleep in
0,sims 3 doesn't work on my pc.  will have to persuade my dad to buy a new one.
0,"USER USER USER USER You all make fair points, and perhaps it would be best for my health not to watch"
1,"USER not too well, but have decided that we'll look to buy, so hopefully will make it easier"
1,good morning world
1,"played in a little freeroll poker tourney with USER, had a bit of fun"
0,missing my friends
1,USER you look so pretty in your gown!  summer*09
1,is home from mass. dinner time  URL
1,Positive part of tonight; met an amazing new contact for work n going to the shoot for the HBO show Hung tmw
0,"should have been an artist *designer, painter or fine arts student*  URL"
1,getting ready for work
1,It is time.... party party
1,URL - Sexy Bear in the hizzouse.
0,USER  Hi jonas brothers  you came to argentina la otra vez
0,"""Please wait a few minutes to vote again"" really puts a damper on the fun of thumbs-upping or -downing parts of films on youtube."
0,"No sushi  Mexican instead  few blocks down USER..LOVE the Shrimp Diablo burrito..finger licking good, pollo asado fries rock too!!"
0,Why doesn't my college website work with f'ing safari or firefox ugh!  I need to sign up for my geol lab there is only 2 spots left ;|
1,looking for scholarship points
1,"USER I am here, online but not twittering."
1,Hopefully getting a book today that USER recommended in the back of Dot.Robot.
1,URL 25 steps to a healthier you
0,USER *yawn* is it too late 4 fun picnic times?!
1,Cool USER tell me more about this shower-equipped Quantus club lounge
1,Bwahahahaha!!! i am awesome!!!! I just killed the other fly's sex buddy!!!
0,is at home feeling very ill!!!    not good!!
1,"USER If you know such agent, do let me know"
1,sittin in my room eatin milano cookies sooo yummmy!
1,USER Thanks hun! sorry for the dealy btw.. you're so sweet! love you too
1,"going to Taman Tun, then damansara perdana and then to midvalley!!! with MRB of coz!"
0,is sitting in bed with a well sore throat
0,"USER I don't have a good partner to have fun tonight, he wants to go home"
1,USER
0,USER  nuts that happened 2 me! had a SHIT nights sleep
1,USER Bloody hell they sound pretty good!
0,At school now. Someone get here
0,"Thunderstorms today, got 3 dogs freaking out. Seems it's the ones who lived in an outside kennel before arriving here  Poor little guys!"
1,USER excellent good to see
1,I love days that start with two people calling in.
0,Is soooooooooooooooooooo ill it sucks
1,USER AND it was great to finally meet you
1,USER lol. I should've known you'd get a turkey joke in there somehow.
0,USER that sucks
0,alana never came over   have dance then 2 hours of gym....
0,Still not the same  my parents read my diary :'( so upset right now.
1,"Yes Selena, they are. haha"
1,USER youre welcome
1,USER Liked the outfit on Sunday. Also it must have been the red sweater that made your hair look red. Looked as usual yesterday
0,"USER LOVING the zune, hating the lack of Canada love"
1,USER gonna catch it for a change  who are they playing?
1,told ben to go on twitter for her but never actually told him what to tweet.  so he is going
1,"new phone ! finally.  trying to full in contacts , give me your number !"
0,USER body stander flat is sproke  love u
0,Bar exam madness:  topic for today is torts
0,Officialy gonna get ready for School . I feel like crying
1,"Tea, toast & morning papers and after that the gym. Then: sweet Sunday pastimes."
0,Wants to go fishing dammit.
0,"USER that is too bad about the event  good luck with today. Not sure if I will be caching, but hubby is gonna fix some caches for me"
0,I hate growing up.
1,I can't wait for Sky and Ash to come over!
0,"USER With torches and pitchforks, I get the picture. Whateffer happened to island hospitality"
1,"Thanks for the comments on the blog! USER USER You guys are both wonderful, love the feedback!"
0,USER Oh god! i donno how these ppl even browse here.. they are giving us 5% of the total bandwidth!
1,Meanwhile - I just discovered something that has made my day considerably better
0,darn it! affect! not affects
0,USER Images in my head that I never wanted
0,i feel SOO ill  i need a hug! any offers?? lol
1,USER lol shutup. i get in for free an hangs backstage  suck it haha
0,is feeling that she possibly offended someone
0,unfollowing USER No m'havia fixat que es una merda de twitterfeed
1,likes hangin out with jeremy and jake
1,USER mini milks.. now that takes me right back..
1,Is getting ready for a bbq with the kids (take that anyway you want)
0,Yay lakers parade today ..unfortunately ima be unable too attend
0,102.2  not going to work camp..
1,USER Good Morning to you too
1,USER URL  << Right there  Lyrics for Chocolate n Cream
0,"Worked till too late, up again to pack and go bowl more. My left shoulder hurts, this makes no sense.  Forgot our chargers, phones dead."
0,Ok. How can it go from being 23 degrees on Monday to 11 degrees now? Insane and typically British.
