0,USER lol. just got off the train in Harlem. I was greeted by rain. I walked 8 blocks in it.
1,USER USER  You guys should wake up now k thanks
1,I think I like woo bin
1,"Lots of ducks on the river, begging for food, they quack me up"
1,"USER haha, I'm teasing. Being facetious, I suppose. You should write halmark cards if you can come up with stuff that quick"
1,jumping in the shower. the hubby and i are off to a late night movie date
1,loves the off days
1,"USER if I get the new one I'm probably giving the 3G one to my dad. If not, I'll let you know."
1,"The food here looks amazing! Our dessert is Frozen Grand Marnier Souffle, of course we have to eat @ the bar"
0,oh my... excitment is over... they printed the wrong image!!!  i guess 2 out of 3 isn't bad...
0,ahh facebook is dead right now
1,Good 2 c more Black & Latino kids getting in to skateboarding on a pro level! It has never been a white thing its for everyone! Luv that
0,IT band flare-up  Time to join a gym.
0,"Pensando en Todo lo que paso hoy ""Im thirteen now And dont know how my friends Could be so mean"" Mal Dia"
1,USER AWWWW >< you can go here and i can drive you around ;;) ;)) ) HAHA! yah we really should
0,"mann I was tired, I was suppose to take a ""nap"" and it turned into something else lol, gettin ready for work"
0,Terrible case of the hiccups. They hurt.
1,USER LOVE your show  !
0,"When they say more tests, I get nervous."
0,is sad and worried and doesn't want to face next week
1,another day
1,USER haha very true.  and this sucks...i got the trophies in boggle but no achievements..*sigh*
1,Is watching sonny with a chance
1,USER I dunno...he sounds pretty happy. I can go check on the bird if you want. I love stumbling blindly through the woods.
0,wishing a had mad money to buy a ticket for summer jam 09
0,"USER yep! My RSS feeds are indeed on, but only the image in the ""Comics"" category appears to not show up in the feed. Very strange"
1,is thinking about makin some pasta for her tea. mmm
1,"USER Re:Ten stupid things about inFamous.That article is trying too hard,point 5 makes me laugh... he should try pressing 'O'"
0,who knows someone with really AMAZING credit i am in desperate need of a co-signer i got screwed over bad it's sad!!! please have pity
1,USER Aww that's awesome! I work in Gulf Bank.. Human Resources  Who's performing this monthhhh?
1,"USER rough start to the morning here, but shaking it off and ready for 3 days off"
1,USER OMG! im laughing so hard now  you are sooo crazy! goshhh.. i love you to bits! miss you dear
0,"it's still so sunny, lavly, but i'm inside cos i'm lobstery, even my forehead  eh USER ;)"
0,USER im so sad that you have duty tomorrow baby.. what am i gonna do all day..  your wifey is gonna miss you love!!!
0,Just relaxing...getting bored and hating the summer heat..
1,USER I have tumblr  follow me 7036561.tumblr.com
0,USER USER but the problem is Microsoft has so influenced enterprise customers that people working there have to use IE
1,yet another monday. but only 2Â½ days left at work!
0,I need somebody
1,"USER We found one now, so it's done!"
0,"USER Wondered where #167 was only to realise I missed it, there's the hat-trick gone  MISIDENTIFY"
0,"ugh, stupid dvd player"
1,USER I'll be following your progress.  It will be interesting to see which way it does go. You never know! Exciting times.
1,USER We missed you... Guess you have no time for your friends
1,USER You're very welcome  Where are you trying to move to?
1,"(USER) OMG SHUT UP!!! (sorry. still venting at that person who's annoying me. It's none of you, I swear  )"
0,USER I know right   I cant even go out side especially in this rain. Im ready to pull my ice chest on wheels back out!
0,USER good idea! But I'm on a budget. Boys will have to wait
0,doing nothing at the church coffee morning. nobody wants their face painted
0,For some reason I'm full of aches and pains today
0,Wishes his xbox gets error 74 nd then he can send his xbox to germany to get it fixed for free rather than 2 red lighting all the time
0,"#turnoff being on my period when I wanna get some. i make it work, but its just not the same"
0,In B town.  Nat's over.
1,up and at 'em! happy sunday.  maybe today is the day the room is finally liveable?!?! im gonna go make an omlette.
1,"Just got home from a sweeeet night, finally without work!! OMG, cant even believe it! peace, everybody!!!!"
1,USER Phew im glad im not the only one
0,USER ROFL thats why i want one of those graphic thingies for mahself  one can colour in there soo fast...
0,Wish I had some more beer to watch the tennis with. I'm all out
0,Ugh im up early. My face swollen and my back still hurts. Im hungry but it hurts to eat a full meal.
0,USER I hope that strange couch is a comfy one if that is where you'll be sleeping tonight
0,Louis Luzi Seitter had a great weekend. Sorry to see it end  URL
0,Im bleeding from yesterday
0,took the exam just then. 3hrs. failed. 600/1000
1,"USER USER USER USER  hello back to thwe world of twitter, in laaws gone, garden almost looking tidy"
0,has nothing to do today
0,I really dislike my job. I really want to quit. It makes me so fucking angry.
1,USER  dream - miley cyrus? YEAH!! amazing
0,"USER eek  if i had a dvd burner, i'd make you a copy. i have to find a new one anyway. i'll let you know!"
0,Hates how fast time is going!
0,USER Yes! I've never had them before
1,brad hit me over the head.. pepperoni pizza soon
0,"USER I would say I'm SURPRISED people are hating on you but because it's SPN fandom, I'm not. Sorry they are though, darling!"
1,Please follow USER Thanks so much! It would mean a lot to the both of us!!!  Please?? Thanks!!  ;)
1,USER.. Thank you.. I just approved the comments this morning..
1,Flight's at 7:45 am. Still must pack and finish some stuff. Half-bottle of wine on table. Could use workout at gym. Stay up all night?
1,"USER she will still get to sing and no doubt get a recording contract, I don't think she will disappear again anytime soon"
1,USER I like Tweetie myself. I'm sure you'll get tons of responses with other recommendations.
1,"USER Written the title, she got pissed off with me   The funniest thing is, that was one of Tahlias cheerleading Judges  HAHA"
0,Guitar lessons tomorrow. ( I have to wake up early again.
1,"Looks like Kuznetzova for French glory. Shame, I favoured the cute one, Safina."
0,USER agreed
1,Morning Sunshine!!!! Happy June! What shall I do today????
0,Its not a two way love  ?!      USER
0,"they say everything's ok in the end.. so if your not happy, then it's not the end.. so what does that mean for us cos I'm not happy??"
1,CPA Island in second Life-looks like CPAs designed  AWESOME that they are using this technology to meet up!  Interesting stuff
0,is sadly going to have to cancel my Chicago trip next week.
0,Twitter is boring. Nobody talks to me. I gots no friends
1,"USER Indeed.  well, it's almost 2:00 in the morning, so I better go because I think I'm starting to hallucenate. Love ya! xo"
1,USER Sweet - I heard from a coworker it was one of the best in awhile. Looking fwd to seeing it (on dvd after the kid is in bed  )
0,USER USER I'm having a problem with followers not being added too...
0,just wants to cry
0,"USER sorry bby, I can't make it..honestly I'm just getting over this cold & it's freezing outside so I don't wanna get more sick"
0,Want to finish bio and health earlyyyy 'cause I got banquets and stuff to do after school this week.
1,just got back from school
1,"USER Yea! That's the usual story. Anyway, ATB!  Just two more days and yippiiee! CDC's done forever."
0,USER weve got it all to come  haha
1,"USER USER USER Oh dear god, no. Not even a slave outfit for Leia!bf.  Ewoks on the other hand..."
1,hangin out with nicolle.
0,"Wow, so tired... Exam tommorow  then 2 more to go! SUMMER"
1,"saw the babies, they will be punk rock"
1,USER what are you downloading
0,"waitin on food, im starvin"
1,i remember when sean kingston used to be the shit.
1,USER Be grateful for what is given to you in life LMAO
0,wondering why only me and ivana are in this room right now...everyone inc. the teacher went to get tim tams
1,USER Good idea!  those bad boys r definatly goin
1,i would love to meet T.I and keri hilson in person (one on one) ! that would be one of my greatest accomplishments !
1,"USER Oh that's nice  so your writing goes well? I didn't write anything this weekend, only the unfinished haiku I sent you."
1,USER oh and good luck in your show
1,"I'm excited for the CPB Happy Hour in celebration of the interns  Feeling the love, not even gonna lie lol"
1,Swimmin was FUN.... <3  Bout to go in the sauna!
1,"USER thts not the real it USER, the real it is USER ..USER n USER can confirm  jus a heads up"
1,goodnight twitter-erz ill see you all tomorrow  <3
0,USER ... holy shit.
0,Baby's 1st day in buggy. Pram consigned to loft. Growing up too fast  Best have another one!?
0,feeling very guilty for not going to class today because angeline needs her book back
0,wants it to be the weekend now  xoxo.
0,Orange Juice. Tastes. Like. Heaven! I don't like my new backgorund image  But I couldn't find a picture where he wears a blue t-shirt.
1,USER USER   no words necessary
0,my cold is back
0,USER when are you coming to spain? i've been a fan of yours for 5 years now and i've never been able to see you guys live  x
1,USER You seem hella cool
1,USER u really like animated cartoons ha!
0,take the pain away
1,USER lol yh it was funny  I dunno why Norway won though they wernt that gd
0,"I look like crap after my waterski-camp , Gavin will think I'm hideous!"
1,a new day has come
1,USER lol you are right..I can't wait for tomorrow night..we actually saw them play and met Jackson and chatted with the band!
1,"""What if my life goal was to be a black man?"" I was completely serious when I asked that. Mesa so tired! Almost home(Ohio version)!"
0,Jon and kate was so sad
1,"doesn't have braces anymore, yay!"
0,"sigh as usual i wake up about this time. have to go back to sleep, work tomorrow and no twitter at work"
0,Oww fuckin a
0,USER they don't have milk chocolate snowies
1,USER OMG i love youuuu ahahhaha i must repay you somehow! thanks fran  <333
0,USER Thats a LATE appointment! :| Hope all is well!! I'm gonna try and sleep work early and i have a super duper headach!
1,Sunday sunshine track  ? URL
1,"USER O yea, o yea"
0,There is no moon tonight!
0,Naiyak ako dito:  URL Oh justice.  Another motivation to continue studying and be able to change this.
1,USER I did that this week too. I almost had a little panic attack
0,I feel like just laying down and crying my eyes out  Refinnyj <> Mat1234
0,Public Enemies looks good. So many movies so little time... and so little money I guess...
0,ok so the job i thought i got just called and said that i audition for the job on monday?? wtf?! they told me i started monday
1,USER yea they were recording  and my friends and i were in the front. awesome show! now at hotel eating pizza and watching Kimmel
1,Late lunch with a friend and brother @ Olga's in Lansing.
0,just chilling in front of my comuper ... go for lunch or something don't kow just bored
0,just back from craft fair - should have been called jumble sale  competition was lady selling jean greenhowe copyright knits
1,USER Why thank you!!!
0,My mom says i have 2 go bowling with my sister on saturday.
1,Good morning! How are you? I am working the job jamming out to 1club.fm listening to 93.1 The Beat. One of my fav channels
1,ORLANDOOOO  I LOVE that the Cavs are out. Too much cockiness gets you to this.
1,Gonna look at my list and start to materialise all of them
0,USER I'll miss the old liberal Nicole.
0,"USER Probably not a good idea, its hard to tweet on the web, I miss Tweetdeck!  *cry*"
1,I want a poster of TaylorLautner. <33 T.L.O.D. fo' life! Hahh. I'm really lame.
1,"USER I like the idea of eliminating bludgers and beaters just tackling ppl, makes it nearly as dangerous as book quidditch"
1,USER Hello Mr Spacey..peace to u
0,USER Have a WONDERFUL time! We'll miss you in the office
0,Man woke up to find the A/C busted again.  It is getting hot in here and it is only 8:00 AM. Time to call the repair man again.
1,USER see you later  x
0,blahh 12 hrs on set  edgefest today!
1,"USER  Good morning! Did you ever get the link again? I resent it, it worked for me. Hoping it worked for you!"
0,USER i want the entire collection! i love that heart box! i only have 3 seasons
1,USER  glad to hear that  hope you're enjoying this beautiful weekend!
0,there is no god  & if there is he's fired!
1,USER I'm not REALLY ready for dogs yet. But at least I'm honest about it
1,USER but gastropubs do such good food
0,"USER awwww, jealous! england misses you  x"
1,Had a great morning...mini golf with 3 kids and the wife...lunch at Islands with Grammy and lolo.
1,"USER Awesome, we might see it next week."
0,"Awake... laundry, and then a movie tonight... Think I've seen everything, but I guess I'll find something. Another bad dream last night"
0,In my car taking care of a drunk Becca  (#109 why I don't drink lol) ANDICANSTILLHEATHEMUSIC!!!
0,SO. TIRED.
1,USER  werd ughh its okk we got 6more games
1,USER  Good morning.   What's all this coping of your art about?  Do you mean by paintings or reproducing by printing?
1,So board. TWITTS!!!
1,"USER LOL!!! i don't see it as ""addiction"" any longer..more like a ""way of life"""
1,USER Very  just walked past him on the stairs. You don't get that type of intimacy with the commercial artists..
0,bummer did not get call 4 2nd interview blue day  been a long times since a pink day
0,"Ohh, I need work."
1,"USER i predict yours will progress quickly. Plus, you've got Saint Ex, Regent, etc"
1,USER ikr. Now I love Katy Perry moar
0,awww you heard it
1,I have been extra MIA. Crazy week
1,"listening to "" beautiful lie by : 30 Seconds To Mars "" << i reaal like this song"
1,going to enjoy the rest of my sunday afternoon and sit in the sun and read a book!
1,"USER Thank you, thank you. I'm pretty excited about the awesomeness we will do next year."
0,At work but would rather be at home.  bad day
0,destroyed my painting for the art contest! my panda shanaynay looks like it got decapitated...its head is like two inches too low
0,Fail. Found a place a 10 minute walk away from my house which sells *most* of the beers that I dragged all the way back from Belgium
1,Heading over to Sarah's graduation party
0,USER hey if u not havin freaky hour u should let us kno
1,USER Looking forward to the show!  Make sure I get VIP treatment!
0,"the ultimate slow jam, I haven't heard this in years  â« URL"
1,"thank you USER. your ""lullabye"" make me calm everytime"
1,drinkinqq waterr &'d surinq tha myspace
0,putting plugs back on hurts...alot
1,I Am A Proud Misha Collins Fan Girl!! After My Photo Shoot With Him On Sunday At The Asylum Con!!
0,stayed way too long in the sun. I LOOK LIKE A HUGE TOMATO..... im in a terrible sun burn paiiiinnnnnnn
1,Even my hair smells like summer!!!! MMMM coconut milk organix conditioner. Yummy
1,Just got back from a trip to Dan Murphy's where trolley's are always a bad idea  Good news is I have 18 new drops to try out!
1,I HAVE A NEW EMAIL ADDRESS yay huzzah go me
0,"oh gosh :S school tomorrow. to-do list: french, english, study welsh, graphics...artbooks nowhere to be found."
1,USER It's all good  The next 6 months are going to be awesome.
0,USER yea! I think once u hav a lot of detail the file gets to big & just freezes  so i just ended doing my sctions in autocad lol
1,"Got to be part of the ""breakfast tradition"" this morning with Papa and Hannah.  Feel so special"
1,"Back from coffee with USER, thanks for stopping by"
0,Really really sick!! Like I'm on my death bed
1,Going to mamas!  what a beautiful day to be in a town!
1,USER I guess raaz has managed to do away with your sleep at least
1,fell asleep! woke up to wonderful offline messages  will eat dinner now
0,layin in  bed..should be sleeping by now..work at 8...fml..i cannot stop thinking baout everything thats going wrong with life
1,check out USER LIVE at URL he's awesome!
1,Morningg  Today is another day of studying & hopefully watchin the ANTM 12 finale
0,USER  IKR? Need to see something normal at the moment. (Rob) *grins* Glad u liked the pic. Sorry didn't leave link
1,"3rd jump today! Hunter came along! Fun day, fun day  next stop, solo"
1,DEMI AND TRACE ARE SUPER CUTE
1,USER AWW.... i totes <3 you.  i wouldn't ever follow that piece of shit ever.  there's no reason to. ::hugs:: nite!!!
1,USER um if I wasn't at my sister's baccalaurette at church I'd be on your door step to have done of those pancakes. Delicious.
1,chattin' with ckaye. we're planning a sleepover. hihi. i hope my mom won't argue with me later. i think it'll be a great night USER's.
1,USER wow congratulations!!! That's awesome! Well done.
0,USER  That part was sad
0,"Boo has kennel cough  Went to the Dr last night, got antibiotics, but she was up all night coughing... And still is. Poor baby."
0,"There are a lot of things I like about Flash CS4, but the 3D tool just isn't bug free yet"
0,isPlayer Has Died! Sorry
1,USER why do you have holes in your house? get some polyfiller!
0,I am so so so so so bored of studying
1,happy birthday andy! cleaaaaning from the painting advernture  wcs! <3
0,wants to be at the atlanta fest
0,my hairs a freakin mess today oh well going to school nhow
1,bored until later; im going to take a drive with shelby
1,"canard65 has just commented in Fr my blog post 3,2,1... Lift off !  URL  USER"
0,USER I sorry but I do not sell the knit socks.
0,USER You're a lucky duck. I wanna think of canada when I hear a song. 1st I need to go to canada
0,True story: my family's sail boat was struck by lightening and burned to a crisp. No sailing this summer
0,"Just lost in the semis  super tired. It was a really close game tho, now i gotta rest for tomorrow's event"
1,What are everyone giong to do today??
0,"""always gonna be an up hill battle, sometimes Iâm gonna have to lose"""
0,"USER Nah, realistically there's no WAY I'll do it at a convention. I've tried before, and failed every time.  But thank you very much!"
1,"is just seeing what twitter is, might delete, might recommend to friends."
1,Man...white guys were just not NEARLY as blessed with good looks as the brown boys were
1,USER liya liya.. its is anyways pretty much readable.. don't need a test to certify that I am romantic  re: URL
0,regrets the waste of daylight
0,USER still don't understand help......
0,Rough past 2 days of school
1,"USER oh okay I see, well keep in touch"
0,URL - Popcorn burn 2 days later
0,should have taken my own advice this morning....I was unsuccessful at staying cool today.
0,housework is calling
1,USER IS ASKING FOR PRAYER. WOW !
1,Just figured out that USER are all my friends. It broke my heart.
0,just watching tv. looking for my ipod touch which is no where o be found.
0,You have no idea how messy my room is. Haven't even made the bed in 4 days - and I have no idea where my shorts are
0,twitter is in meltdown haha!  I don't want to follow U.S. sports and fashion freaks go away.  It won't even let me delete them! bah
1,USER Yes because I haven't worn jeans in ages
1,Watchin monster in law with my sister
0,"ChÆ°a ká»p thá» máº¡nh ÄÃ£ láº¡i nÃ­n thá» lao vÃ o cuá»c Äua má»i rá»i.VÃ¬ lá»?-vá»? TN mÃ  bá»? báºµng káº¿ toÃ¡n,cuá»i thÃ¡ng nÃ y thi mÃ  Äáº§u rá»ng ko, ná»­a chá»¯ ko cÃ³"
0,USER wahhh if going over means shopping n mahjong..I WANTTTT...but cannot!! Need to finish my accounts!!
0,USER a bunch of taylors fans are waiting for her outside the rose garden (me included)  we're colllld. you're lucky.
0,Work? Really? I was just there 11 hours ago
1,USER  apun doing Accounting study  waise trying to do MBA...
0,"just because apple comes out with a new macbook doesn't mean you have to get it, y'know?"
0,USER I wish my period would find it's way to me
0,On my way to shool
0,My Ipod has finally died  RIP
0,USER It would be awful  I desperately want it to happen but I just can't get my hopes up for it right now :|
0,USER i dont think you kno who i am u played me wit the email  bad !!!!!!!!!!!!!!!!!!!!!! no more stage performance
0,"USER Yes, yes it was"
0,I hurt my shoulder in a Rugby match and now my back really hurts.  AND I'm getting toe surgery soon. My body takes a lot of abuse. lol
0,USER Yes I agree with that one!Clue starts next week without Humph sadly  but with USER as a host...
1,"grilling, my girls, hockey and beer....it's a good Saturday"
1,"?????????, ????? Firefox URL"
0,Mom's leaving
1,i'm in a wheelchair. hahaha it's funziezzzz  lol
1,Going to see Star Trek....
1,Watching jonas in the livingroom with the family
1,USER good night! & hope that you Birthday is totally out of this WORLD!!!!!!!!!!!
0,texas roadhouse. hmph
1,"just about done cleaning out my drawers, hopefully gonna go bike riding soon, then on to the ladies Bible study at church."
0,"To bed at 2, awake at 7  My head hurts from sleep deprivation. Well to me it is sleep deprivation <sticks tongue out>"
1,USER Good to see you here  How have you been? Is little Swartz all better now?
0,NOooo....not games 1 & 2. Wasn't expecting this 1 @ all  Nevertheless Im still rockin with the MAGIC! Back 2 O-town... 08-09 CHAMPIONS!!!
1,"USER But especially that song...it means the world to me. And yes, we do"
1,"USER Ahh, thanks - I feel so warm and fuzzy at once"
0,I wanna still be asleep
0,USER  ..thatz not even cool  lol
0,two day long headache is a direct result of the fact that there is no coffee left in my house.
1,USER curtious of Akron Ohio
0,I dont like strapless bras either.
0,"Just finished, - for today   - with painting the house. At least I did not fall down or get bee-stung again. Now for some #EQ2 and tea."
1,Today's peach sticks stayed in my hands   ... URL Wonderful Maker.wma
0,wow!  and let the inquiries poor in!  too bad i'm booked for most of them.
0,"USER Agreed. It's a principle not a method. But client's dig holes and ask for ""demonstration of benefits"" to pull themselves out"
0,USER TWEETUP! That's an awesome idea. I want to go!!!
0,SOO NOT DIGGIN THE 140 CHARACTER LIMIT!
0,The Sims 3 runs slowly  I guess it's because I have played it allot today :|
0,"USER plz say ""Happy Birthday Or , Roni & Mickey!"" plz plz plz"
0,USER it's only been one day and im sooo tired!!!!
0,1st saturday nite i hvnt went out in months...feel better 4 it this mornin...got work at 3  gawh roll on the summer...
1,"USER what I got inside, I can't make'm see. Ain't proving nothing to any one but me.  wrote a song  people blues, explains it."
0,"Is off to be a genie, but wishes she couldve stayed with THM  xx"
1,Welcome to Twitter world USER ! Lets follow guys!
1,And the countdown begins! 10 DAYS.
0,USER The Heart breaking part!   URL
0,Worried about USER!!
1,USER awww thanks!! we are excited too!! he came home from work and said honey im home when he walked in. i was like
0,Damn I am such a hot mess. I had the weirdest but most amazing dream ever. Too bad its not coming true.
0,"Havin another lazy day today, and countin down to the footy again, missing Laura a lot  at least I've got town 2morrow with USER"
0,I'm hill!
0,"New phone, so i can save money on my bill...no twitter app!"
0,USER I know  I'm thinking of another pet one I could leave at home- or a really tiny one I could bring to work?
0,USER thanks for the bracelet sale post!  So sad about your favorite Rope bracelet     URL
1,I love my big brother very much.
1,USER $9.75 at the Levee.
0,I just realized that I need to finish school... I only have like a year and a half left...
0,OMG. WTF. I just say a van hit a bird that was trying to fly across the road.#squarespace I am in total shock. MoFo didn't try to stop
0,Wondering if its possible to be huanted purely in dreams - conversations with those who are not anymore
1,USER That's what he calls me!!! Hence the 'awesome one' on my profile!!  Clever huh?
0,Sat at a picnic table on the swamp and watched a bulldozer tear down Bear's Den & Center Court.
1,Watermelon is the heroin of fruit
0,USER tayler hurt her knee again  may need surgery after summer. but going to see some specialists in los angeles while im there
0,I wish I was going to the live diggnation in nyc next week.
1,he Jogging with Lii was perfict! it was warm and the talking was good.  I liked it! let's do that again tomorrow.
0,USER time to put the pt out in the pasture. bullet to the head.
0,Sigh... USER is all business... Won't even let me show him pictures of people's dogs
0,"The tall hispanic Aaliyah-looking chick was pretty damn fine, too! I could never rock those damn eyebrows..."
0,School in a few hours like 8  i dont wanna go :'( i hate school the worst 7/8 hours of my life  i?myfriends for making it bearable ???
0,"USER ew, im not mean...am i?"
0,USER Consider our app -- www.fuzemeeting.com for your next meeting!  Sorry for the interruption but saw your tweet about WebEx.
1,"Schooling right now, but I'm telling ya'll 2night is gonna be 1 hell of night!!!! You feel me Dawgs & Shawty's!!  Peace ya'll............."
1,USER Hugs! Hey big bro how's it going. Im BACK! Making it happen Twitter watch out. It's contagious again.
1,USER hey babe
0,I suck at MGO
0,hates williamdtown station..creepy people everywhere and its getting dark
0,"USER that's a joke, right?"
1,USER Good Morning to you as well
0,Drunk hiccups WTF
1,"USER no, no I can't"
0,"Oh, fuck. So little sleep."
0,just came back from 'saving my teeth operation'! several more dentist appointments to go...
1,USER byeeeeee
1,USER happy belated bday babe!
1,Just had my nails done...  (Fingers and Toes)
1,"LOVES HER BRIGHTLY COLORED, BOOTY SHAKING, KICK BALL CHANGING BFFS"
1,USER You have time to nap?! Woulda NEVER thought! Seems like it's always jus go go go!! LOL
