0,i hate sundays
1,Fully ready for my driving practical.....
0,"skool now  huge day.... 3 tests/quizzes, project due tuesday, cat wait til its summer (Y)"
1,G0iN' 2 THe aMeRiCaNa N0W.. G0T B0ReD 0F THe uNiVeRSaL CiTy WaLK. LMa0..
1,USER They're awesome!!! â¥ ps: did you get my convo?
0,Why you sad??
1,"USER cuz ur 3pm is my 9am and Id be either asleep or airport- bound...  Ima sneak sum'n special in 4u, tho ;-)"
0,USER I am expecting a call about how amazing the book is ;) lend me wolf at the table
0,fucked everything up  Im soo sorry !
1,USER nice work. hot lippy!
1,USER hiiii my sweet USER missed you  *hugs* I missed ur *pandahugs* glad u are back!!!!
0,USER The little fella has a mind of his own - it's not nice to laff.
0,My oatmeals gone im sad now
0,i feel so siiiiiick :'( headache & blocked nose!!!  BUT I GET TO SEE MY COUSIN TODAY!!
1,feels good to be out of town for a great vacation with family...
0,Adam's left! And I didn't get to say goodbye
0,nothing it did nothing!! >:\ mad! and sad my Esme aka Brittany is moving to Texas  i already miss her to death!!
1,Some articles under the same deadline.. what a day
1,"cleaning, then escoooo"
1,If i hit u up...that means im followin u so im askin everybody that im talkin to thats not followin to plz do so..thankz
1,USER follow me  lol
0,USER Not me  I'll be in Chicago for another conference earlier in the week but can't stay.
1,"Oh, I've just realised, I'm coming upto my 300th update! How exciting!"
1,I've learned that sum things are out of my control. No sense in getting upset. The universe tends to unfold as it should.
0,"Mama pulled out her rollers, after Mom fixed it for her 30 min ago. Thinking it's morning. Mom almost started to cry.Then had to redo it."
1,"USER Hey James, not too bad.....Thanks for asking!!!"
0,"USER I type 100+ words per min, would offer to help out but I have exams"
1,Had customer w/ my birth name. Told her it's my sister's name bc i wanted to say something!
1,"URL - Hanging out at exki, a cool bio resturant in paris.. Just had carrot soup and a stella for a snack"
0,internet connectivity from fone acting up...me Don't likes
0,USER yeah very true. I mean the same lemma holds for french food as well
0,thinks her body may have become immune to her new allergy medicine already.
0,"USER oh yeahh, still wishing that I could turn back time."
1,you have to help me mentally... make RobSten come true! use The Secret with me please  (FYI: RobSten= Robert[Pattinson]+Kristen[Stewart]â¥)
0,long shift at work today
0,Sat at home Ill and bored
0,My lamp broke  I can only study if I have lots of light :'(
1,"Was channelsurfing and came across ""Weakest Link"" on BBC Prime. OMG, that's a mean concept of a TV show. But I think I like it"
1,it will be nice day
1,USER Don't overdo it girl.  Hope you have a good one. Will call you later today.
0,"USER aww miss u too, we have to get together this weekend! I am so home sick! Especially this week since I'm by myself"
0,I hate Mondays
1,"USER Hey Thx for the #followfriday shout out!  Back at ya, my fellow wino!"
0,Does anyone else clean house when they are mad and depressed?
1,USER... you're psychic you should tell me about myself
1,"well, i must say, im rather looking forward to my bday now.. hahahahaa, USER ;)"
1,"USER Congratulations as of this moment you are now Number 1 in MsTwitterWorld, hope we can maintain the lead for you, Cheers!"
1,USER lol hoping you can still include our stuff in there somewhere
0,I miss my high school friends.
1,"USER It was, very"
1,"Morning everyone! Another lovely day, and I'm not working! yipeeeee. Off out to buy to materials in a bit"
0,Re-pinging USER: USER lol i know it does....man i wanted lumpia and pancit  oh well....--Ill try 2 get u a plate
0,I feel so unpopular on twitter.
0,USER I was doing my fashion thing today. Missed your music selections
1,gets to hang out with my boy today
1,new job is awesome
0,The Pursuit of Happyness has to be the saddest movie ever  It's amazing though.
0,"Gossip girl, now lang e. u know  i was busy the whole day.. kaya bumabawi lang rin ako ng tulog.. sayang absent Kends later.."
0,USER Nope. At jury duty.
0,English exam tomorrow
1,"I don't know why, but amish ppl make me nervous."
1,it wouldnt anyway.we had us just for ourselves yesterday.it wouldnt ruin it.i love you veronica and dont you forget about it
0,SAD to miss Ink n Iron    I miss LA so bad !!
0,USER THEY BETER FIGHT TO GET US SUNDAYS OFF! THEN AGAIN..WHO WILL DRIVE BUSES TRAINS & ACCESS-A-RIDE BUSSES AROUND?
0,Dumb Ass Twitter Fon Isnt Letting Me Refresh The Page...I Exceeded The Limit
1,Loving this promotion  allow me to splurge a bit lol
1,eating pop tarts
1,USER USER USER USER USER USER USER USER USER it's still #FollowFriday
0,sleepy! my ankle hurts and the thunder woke me up! work time
0,USER aw i AM too late  i bet you look awesome in the JP dress.
1,USER You need to come to the UK  <3
1,"USER Hey Hun, sorry Ive only just seen this!! The other girl is Emmy Rossum! Enjoy your weekend with your mans!"
0,"My curry mash experiment turned out okay, even with the near-disaster that happened, though not sure if I can get it to croqette form now"
0,4 days until a much needed vacation; need to relax & have me time - heading for burnout
0,"USER we made a really cool present for you, and we couldn't give it to you in rio de janeiro"
1,come 2 find out no one spilled on my wireless keyboard the connection was obstructed ...thats fancy for i needed to clean off my desk
0,I WANT MY FUKIN PICTURES!!!
0,USER hayuuk but cannot.. exammers on monday.  thinking of after siiih
1,USER Good Morning or is  it after noon at this point.
0,"Going to the last New Believers class tonight, I wish it was not ending!"
1,Saw 'Up.' Pretty amazing.
0,Got a meeaannn hangover!!  Didn't even make it to work.
0,USER i think im going to go to sleep now.. (so tired  ) .. but i will talk to you tomorrow  .. and im looking 4ward 2 your songs
1,USER can't argue with that
1,USER schools done next thursday ? FUCKK YESSS ! means i get to spend more time with you and eugene ! LIFES GETTIN BETTER
0,The 2009 Schedule is out and Single Day Tickets are on sale too. Get at it URL (via USER) $80
0,is almost done packing. has found the cheque book icici issued when he opened his account 2 years ago. no luck with the transcript
1,USER and all 3 exceptionally honorable
0,"USER Things like OCC catering are why most 3-day conferences are more than $249.  Sad, but true"
1,UP= another great Pixar movie. Much better than Wall-E last summer. I loved the cute love story behind it.
1,I found two lovely dresses this morning  The Darling Buds are great : URL
1,USER yea baby!!! Muah! Hehe...
0,is up and feels like going back to bed... aaaahhhh
1,USER URL - aaww! so cute
0,USER Yes thanks not been on twitter much lately; not alot to say really; seems to have died down a bit
1,"Thx...I like this jazzy blues tune!   USER: ""...USER"" ? URL"
0,USER Im so pissed i missed the show
1,Going to shut the world out with my music.
0,USER  i love you
1,"Getting ready. Meghans picking me up soon. Then heading to church, and going up to big lake for the day. Text me?"
0,"great way to end the night with USER, USER, USER and idk amandas twitter  work in the am"
1,USER URL - you are so pretty
0,"Pig farms have grills for floors. All the dung falls directly into sewers. Till we implement that at home, I'll be cleaning house. Again"
1,USER How 'bout a shout out to us open ecosystem loving Android fans
0,I was too blind 2 c...you were my everything  â« URL
0,"Ugh. Called the cable company. There's an outage in our area... No phone, cable, or internet."
1,On the bus now
0,"USER Hi, thanks! Was not at Harrogate, we are a new company with no products yet   Expecting to launch at the BPA show in October"
0,USER  why you doing that? *Gives you hugs* the ellies are telling me telepathically that they want to go take care of you..lol.
1,USER i agree with that  haha. alright well im off to bedd. see you 2morrow. ahh skool =( xoox
1,URL - Finally!
0,"Watching ""Marley and Me""...too cute of a movie!!! Anywho, my lucky sprinkles have been retired since the CAVS lost....ohhhhh the pain"
0,ohh how i wish i was Dallas right now
0,i hate is when pizza has too much cheese on
0,had money stolen from my table on our deck last night. about $10. u gotta get to those outside tables to get ur tip fast. people steal.
1,USER 'ello  what you up to on this fine day
1,night tweeeeeters. interesting day today  Hopefully tomorrow will be the same! Looove.
1,USER new burn notice tonght!
1,"USER Thanks for #followfriday. Yes, I was twitter off, but I'm back  It was nice to know you and speak, in person, at #cloudviews"
0,"Some boys are so annoying,and so hard to trust"
1,USER thanks Jessica! you too! quit yet?
0,hopee yu all have a Great Dayy & i Am Veryy ILL  x
0,"Duhhhhh, marah2 terussss! Capeee deee!! Padahal nganggur sharian huhuhu.."
0,URL -    guess I should stop drinking... not... saturday was sooo much fun
0,Geting ready to go white planes.. Gonna surf!! But i gotta rent a board  Mines has a big cut in it...
1,unpacking and daydreaming...came back yesterday form the beautiful isle of Ibiza
1,USER Thats sexy  lol...my friend is a pinoy and we are thinking of saving up money and going over there next year ...
0,my leg reallyyyyyyyyy hurts today
0,Iniwan ako ng buong pamilya ko dito sa bahay! How could they?!
1,"good morning, yo  good day today? i have no darn clue."
0,"Pumped for Jess' game, but I can only stay til about 4:15."
0,@ the airport saying bye bye to mom
1,"Just did a LONG over-due update to my Ryze page. If you are on Ryze, say hi and add me as a friend!  URL"
0,tha beach is callin my name
0,"USER: i just so mad i don't undertame y ppl treat me like shit, even family.  i miss you!"
0,AM so happy Melpulled an all nighter for my bday!!!! you are a champion!! and guess what???? I dont have Swine FLU!!!  DAMN WORK
0,"USER i don't know, it just wasn't that great. i think i had too high expectations"
1,"USER Ah, you should be, Sir."
1,Finds herself often having words pop into her head and looking them up on the online dictionary. Odd but vocab shd be improving!
0,"USER the work placement  I'm applying online to a few more places, then going to get serious and start phoning people up."
0,USER fucking faggot
1,"USER Hehe, funny (the midget thing) ! Cheer up Alex, and wave from below  Is it that you are in Germany right now? .. or in Spain? ;D"
1,USER thanks for the insight on the game! Looking forward to the next game
0,"USER I know, I've spent too much money lately, rather than saving it up for my car  That's why no more shopping for 1 month!!!"
1,I'm aiming for an all-nighter!
0,ugh. sad/mad/lonely.
0,USER i'm officially jealous
0,own 2nit but i cant go.
0,"USER Check out the Midnight Sun draft! Twilight from Edwards point of view. Its good, its a shame Stephenie Meyer has shelved it"
0,USER We just got back from shooting. I'm going to have to wait till tomorrow to start editing.
0,"having a great day  , though my left arm hurts!!!"
0,"USER no more ben  it will be a bittersweet show, will you be there?"
1,One more trip to adult swim to pick up the last speaker... Great day
1,"USER do you have plans to visit asia?? maybe philippines?? swear, i'll be on the front row & it'll be heaven"
0,breakfast then cleaning the kitchen then finishing the cookies and meatballs from last night..way too clumsy to finish  better today?
0,Aww Stavros Flatley aren't through to the britain's got talent live shows
1,"Beauty only grabs attention, but personality captures the heart and refuses to let go."
0,"my phone is eating my txt msgs. says i have 6 new ones, but my inbox is empty"
0,"Nikole's ""Magic Trick"" Is Still On My Hand. And It Hurts"
0,cookies! mmm...i think i've got to clean the house today.  boring.
1,USER TELL MARISA I SAID HI AND TO BRING BACK SOME WATOTO!! maybe she can nab twins so ours'll match...
1,USER where we all going
0,About to get shots. Scared.
0,how goes it on your saturday nite??? getting my son ready 4 bed  another lonely nite
1,"USER I only get the ones I like so I only have a few. I like Reckoner as well, just because it featured on Adam & Joe's show"
1,"USER Come back to the UK! I saw you at Carling Festival in Finsbury Park, London back in '03 and on your own tour shortly after"
1,"""Better to understand a little than to misunderstand a lot"".GOOD MORNONG"
0,"USER DUDE,, send us some suuuuun!!! we already told tom to tell danny to send some sun back home to us"
1,is going to grad service at church!
0,"USER F---. My coughing fit during Woody Allen didn't get you sick, right?"
0,"USER wish i could've been there  congrats josh, you completely deserve this honour!have a good feed and an even better night ;-)"
1,USER Why not 3? That's how I tell if abattender likes me.
0,"USER - Aw, that is sad! I have never met him  - I hope one day that I will be able to."
1,Oh what a night/morning
0,THE PROPOSAL!! <3<3<3
1,USER i watched it live and it was amazing!
1,USER you're welcome
0,I dont feel so well
1,"USER yeah buddy get your ass over this way for Anika's party tonight, she specifically mentioned there will be lots of single girls"
1,USER thanks for following I hope you like what you see
1,"going on an extended holiday trip through the county today. First stop: Carinthia.  give me sun please, for cabrio's sake!"
0,"USER aw man, mines didn't come with it"
0,Im honestly scared. it's bothering me  we'll see what happens
0,USER both my knees hurt  lls and a jay would be wonderful right about now lls if i wasnt in class fml
0,USER plenty of countries fit that bill
0,i put up a new video but it didnt turn out how i wanted it
1,USER yes! ice cream at 8:30 am sounds good to me!  #junedairy #farm
0,Just getting started on my day.Im mad its raining   Maybe I need to eat more then this yogurt for breakfast or lunch...brunch there we go
0,first day back at school today.
0,is hurt... wishes I could be with him.. instead of her..
0,i have sore eyes  dammnn shampoo!!
1,USER aww..you say the sweetest things  *kiss*
0,lunch @ work and some unamed bint pinched the paper i wanted 2 read
1,USER have you seen the video of fly with me? heres the link: URL  IT RULES!!!
0,is vewwy lonely.
1,USER WOOHOO! Have fun  when's your new merch comin in?
0,"if i had your number previously you should pm me it, cos my simcard karked it and i lost all the numbers  or even if i didnt have it +"
0,i am so friggin bored.  i wanna go somewhere else.. like.. korea.. maybe.. i wanna see dbsk & snsd.. i wanna greet yoochun oppa!
1,USER cool - let's stage a kidnapping and i'll give you a %50 kickback... to the extent that I don't then whack you and keep it all
0,Came back from Belgium. It was lovely but I'm ill now
0,"It appears I'm going to a Sounders game in like, 20 minutes.  Sorry, no updates from there - I haven't paid my phone bill."
1,"USER Do you need anything ? *hands a cherry* .. well, that won't help, obviously. But still, you can have it !"
1,USER nice
0,USER It isnt sunny where I am!  But glad your enjoying the sun xD
1,USER simple plan is awful
1,just got a side fringe cut. its kinda cute
0,isnt feeling good right now
0,I wish I could have gone to MoCCA.
1,USER Have a great day -- I'm off to karate
1,uploading some pictures
1,"tried oprahs free unfried kfc and loved it  i went back for another try and topped it with boba and wolverine.Chilled with pope,dave,ben"
1,Only 2 more days...I love a good road trip!
1,chevy camaro for sweet 16?  oh yes mom that sounds like a great car haa
0,"Has an exam in Filipino, Chemistry and AP today... I HAZ NO NOTES IN CHEM"
1,USER HIIII  how are you?
0,"USER I am depressed, almost every day I lose some followers"
0,Tweeting from church! Dave's last day -
0,USER www.Pandora.com - plays music based on an artist or song that you pick. ONLY thing is I think it only works in the States
1,just created a blog! URL
1,USER Hey!! i love u'r style! it'z great  plz write back! THANKZ!!!
0,USER i know! i'm growing my wisdom teeth too and it hurts!
1,"USER No worries Diana, hope you are having a great day"
0,Eating probiotic and prebiotic in huge ammount today.. Should reduce that chillis
0,USER hhaa! Yeeah! But its kinddda sadd
0,roll on 8 o'clock
0,Stay in camp and hang out with people that are more perverted than me
0,USER ? this sounds not good
0,is slighty hungover  now going to get food in my system...yum!!
0,"omg i finnished the twilight books! breaking dawn was amazing! love love love them <3 sad now tho, have nothing to read  20.11.09 <3"
0,Its sooo hot in sac
1,USER Don't forget to call your Mom today
1,"howdy hu hum and a barrel of laughs to all (translation hiya, hope all is well)"
1,USER Thanks! You too
0,USER Adam should obviously win.  But how is Kris still in it??  It should have been Adam vs. Allison
1,is sitting around...wondering what's next!
1,"USER Hahaha please dnt stay away frm me =( , u wil jst hve 2 keep an eye out 4 the crease in my neck they culd hve super powers"
1,USER oic.. will need to get upgrade space if I do want to use it then.thanks  Will most prob only use photoshop and dreamweaver
1,Uuff! I can't study any more! is too much! I need sleep
1,USER If you can Tuesday would be great...need it by thursday at the latest  (thanx)
1,"USER In terms of hockey russia is a threat. Lost an MiB, afaik, are not related to any"
0,USER don't dislike them all just because of one
0,I FORGOT MAH FACEBOOK PASSWORD  I CANT GO ON NOW T.T AND SEE RENE OR ADD OTHER PPL THAT BARELY GOT IT T.T   ... FML
1,This almost made me choke on water lol so awsome    URL
1,Finished instruments for the 1st song
0,is really devestated...why? wish all the clocks would freeze...riiiight NOW!
1,"USER PS, another tip: Follow people back (hint, hint) esp. when you are having a conversation with them"
0,USER i failed the first time; i overslept on finals day
1,My license just came in the mail.
1,thinks that for the sake of the few people she has following her she better start tweeting a little more often  ..
1,USER - I'm sure you and your site will!
0,"About to board on the plane  ill miss nina, leslie, Krysha, mocha, my babu paul, daphne, lola, chancey, milo, hercules, and pookie! Lo ..."
0,USER crazy about you! but i see your not as much about me!
1,boooreeed  i need nothing personal
0,"i'm outta tha shower, but i can't be botherd getting ready. the shower made me more tired. baah"
1,USER sorry to hear you feeloing down. twitter me back and i will cheer you up
1,USER quiz call is free online I think...wait till thurs and try that
1,Early am in HiKai Sunday then visit with USER USER and more for Petey's bday  I'm good from First Friday to go out now ;)
1,USER thank you.  It's how we were raised for sure that makes the difference.
1,on the way to cedar point
0,USER gingerbb
0,Hello all. #fb Busy day ahead.. Our rain is not materializing. Very little last night and none today yet. The river is really low.
0,"USER Would have loved to come to CMK this year, but didn't work out with our travel plans"
0,i forgot my phone at home today... WHAT a sad day..  .. 200th update.. wow
0,USER when will these stores in Sacramento open? Been waiting and nothing
1,"USER bahaha, BOF? you've gotta get a life... although i can't say much with my obsession with miley cyrus.. I'VE gotta get a life"
0,I'm Missing Jessy - I Wish He Didn't Have To Be At Work Today
0,USER Have you left for NYC yet?  I'm a terrible friend   Safe travels!!!
1,definately off to la la land now. nite twits
0,Had a not-so-good night last night and have to go shopping today. And Internet is not working so using neighbor's wireless. Bad morning
0,USER oh whats that? have been sitting at lappie for 4 hours to do assignment and still have blank paper
0,I don't like my make-up today... it's to much
0,is sad because of karma down ..  URL
0,I am so behind on reading Otalia fic.
0,scare about ma laptop
0,I feel like I'm bein punished in the worst way...but I dont know what I did wrong.....I'm just want to give up cuz this is too difficult
0,USER I don't use anything..I'm so over the internet
1,down fall of us all - a day to remember (i could watch that video all day  )
0,"I think today is a science revision day. Nerd day. As is Tuesday, which will also be an art coursework day. ehhh"
0,USER at the beach. He's being mean to me
1,chinese fooood  mmmmm
0,"fun night...too too fun.  getting ready for my last day at adams, at least for the school year."
0,Fireworks all done   They were loud...I couldn't hear Bones over the noise.
0,USER sorry you feel that way.
0,USER you're on but i can't get in your chatroom?
1,USER how about seeing someone so handsome face-to-face and nearly taking all your breathe away? Argh. Reminiscing.
0,USER  def. Not good
1,"BAMB ass night. + no hangover X]. Bring on work, baccaleaureate& work again!"
0,URL - Miss them.
1,USER URL - awww...!!! it's sooo cute
0,"I wanna watch BOF! Currently eating @ Hjh Maimunah. Oh, and I haven't studied a thing for Bio tomorrow"
1,USER I love you too!
0,i hope the people make it back all right. im sorry for anyone that lost some one
1,Off to college now  for my meeting Wahay. Wish me luck.
1,USER not yet! When I'm actually at my computer and not my crackberry I will!
1,USER I hate telling
0,"USER cge cge.. you know, i was just there. but I can't seem to make a new topic... i can't find the link."
1,phone with alec
0,My mouth hurts
1,There's starwars day? ) OMG Rocio!
0,USER were not done  ! Lol
0,USER I meant for you to be included in that tweet.. but you is leaving soon
1,"USER noo I don't think I'm trackeing anywhere, maybe Dallas  yayy which part of Mexico are you going to?!"
0,USER Ughhh you and me both !
0,mom passed out last night at like 2 in the morning!!! i hope she doesnt have the swine flew!!!   well the swine flew to marion county
1,USER You sure cram alot of information in 140!
1,Uggh  Is Math Illegal   USER    I saw your dance at The Grand Theatre Yesterday Wellll Donee    Isnt Avery Wong In Your Class?
1,USER thanks  x
1,Wishing for warmer weather
0,"Oh, did I tell you guys? I got BRACES  Will upload pictures soon! I gave myself a nickname, Braceface ((:"
1,just held some lambs...how cute?!
0,soooo bored  anyone wanna talk?
0,i want to go to the resevoir
0,"He takes off her dress now, Let me go, I just cant look its killing me - The Killers"
1,USER how's it going your side of the planet?
0,Orientation almost over and I'm a little sad.
0,Sometimes the pieces just don't fit anymore.  i've just given up
1,"soo over him, -.- had a good day today until he decided to wreck it, oh well i dont care. peace and love"
1,USER joa muss wa
0,USER on saturday...
1,New version of 'Raushnion Kay Shehr' uploaded  Listen here:  URL Love to hear your comments!!
1,I love miley cyrus  ... and for some reason I can't stop eating today
0,i have personally confirmed that my favorite flower shop closes waaaay too early on Saturdays.   4 o'clock!!??!!  Really??
0,I love the Bachelorette but it makes my eyeballs hurt watching for the full 2 hr show - way too long - even w/ fastforward!
0,USER OMG. Grill'd on Burke? ftw! now you're making me crave for hot chips
1,USER It was nice
0,USER that sucks  we're having like a heat wave!! Lol
0,Cool. Landed in Atlanta early...now only a 2 hour layover  I'll be home soon though!!!
1,I'm awake!!  just looked through pictures from the cabin trip! fun! now I'm reading loads of articles about the game last night
1,USER Ooo good....but the real question...Does Dicaprio look hot?!
0,what a nice day but i dont want to go out
1,Come in France  pleaseee ! #FrenchMcflyTeam Love McFly
1,USER I'm glad you liked the post! I try to see the funny side of being mistaken for IT
1,About to put shea butter in my hair and put a mint julep masque on my face
1,Sims 3 = Love
0,"USER OK, now that the show's over tell me: did she confirm? I missed the start  Pete's Space was funny though!"
1,USER that's a really interesting post on flour...
0,USER Poor you   If I was with you right now; I would probably give you a hug ;D
0,"just got back from cross country camp, and got a really bad time for my two miles...so out of shape!"
1,USER thanks ladycakes! Egon Schiele is by far my biggest influence!
0,"I want to go out tonight, but no one else wants to..."
1,USER Why thanks! Can't wait to hear from #aguywhoknowsaguy
1,We got Baby back!!!
1,USER USER
0,USER And... no (decent) movietheathre here (anymore)
0,USER It's great . To bad I don't have the time at the moment to contribute. Karma-100
1,world! any way mate.. Nice talking to ya.. gotta go it's 12.08am here.. see ya soon  take care
1,Time to clean today.  PEACE!
1,day off after a very full weekend - woo-hoo!
1,Rush - A passage to Bangkok for Olaa  - URL
0,USER without me
0,"Hey tweeters, sorry I have been gone, I have had some health/incident issues. I have been in and out, trying to get back on track."
1,USER I was up in the air about his return but glad to have him back! So happy baseball has begun! Now all is right in the world.
0,USER aww..  why'd you go to work? you should've just called in sick..
1,USER hope I get a delivery down there
0,someone please remind me of the upcoming investment paper! i need inspiration
1,USER I completely agree about the revenge! My personal vendetta!
0,seriously.. sometimes shit just doesnt work for me
1,"USER Ain't shit  I'm sitting here chillin in my Uncle's office at the moment, what's good with you love?"
1,"""yeaaah! same mummy! TWICE!"" hahaha watching the mummy III  brenda's still awesome, so is john (R)"
0,Today is going to be a lonnnng day
0,"USER Oh, wine. I miss wine. It makes me sick now.  I know, I tried!"
0,"Shoulda,coulda,woulda.,"
1,Is sims 3 worth it? reply tweeterr
1,"USER you're so cute demi â¥ really, you're my idol teenager"
0,USER
0,USER  i want my yearbook
1,USER Go you hun!!! Have fun at Vegasssssssssssssssssss!!!!
