0,i hate sundays
1,"USER okay so more... geesh, it doesn't all go in one tweet! Wahhh. A bunch of herbs.  Flowers bordering, morning glories for the wall"
0,is getting stressed with t-mobile
0,Oh Bruce willis...y did u hve to go and get married
0,Fukc me. Why is vacation more stressful than a normal day?    Can't believe I fukced my alarm clock.
1,"Mmm lemon berry slush, that made my morning better"
0,"USER USER I'm in County Kildare, Ireland at the moment. Only 1 hour difference from Spanish time. I shouldn't be up earlier!"
1,"USER Fortunately, it's not too late for either of us"
0,ok i'm at work right and i'm missing my lil sugar. i hate the fact that i am working the mid shift and day cares are not open on my shift
0,#MTV Movie Awards borat nigga made eminem leave.. holy shiiittt lmfao 69'd his ass! lmao
0,"at Stanford Guest House, CA is too hot  should find food at some point."
0,"Oh, the games conference at Bedfordshire Uni I got invited to is cowering under the awesome that is E3"
1,USER You're welcome!!!!  Glad you like
1,had another great run w/ the group! 4 miler!  Took about 50 min. w/ walk breaks.
0,achooo ! i  got the sniffles
1,"MY LIFE STORY live at Koko, London 26th Nov 2009. Get your tickets NOW from LiveNation"
1,Going to meet our lovely graphic designer for a beverage at the Standard.
0,Back to reality
1,USER sciau bello!
0,USER why the sad face?
1,all set for 2 p.m. tee time with the guys .. proud that many here at the club are wearing pink for Amy Mickelson today
1,USER Skin and bones/Marianas Trench & Top of the world/T.I
1,too much sulking over being single going on tonight on tumblr - gru3some: I am here to save the day.  URL
0,staying home tonight! Too sick to go out!
1,USER - I actually like TMP. Especially once they cut out 12 minutes.  Only one of the movies that's honest to goodness Sci Fi.
1,USER Thank you SO much!
0,USER and I also feel sick after my noodlebar
1,USER Hahahahahahahahahah! That tickled me so much!
0,"Stoked, found i had 4 unopened PS3 games in my DVD drawer... unfortunately i have a tonne of reading to do... back in the draw they go."
0,STUPID BLOODY REF.  Is he blind??  Bill Harrigan isnt much better tonight.  I feel like chucking something at the tv
0,"i have to study, but I don't want to  it's so booooooring"
1,im researching for my english speech. what topic should i do? i dont know... i guess ill have to figure it out
1,"USER Good morning, it will be a fantastic day"
1,your my cuppycake gumdrop snucklebunchbukems...your my sweetie pie. this song is gonna be stuck in my head foreverrrr.
1,About to muder some avacado crab cakes and sweet potato fries
1,"Farmers Market every Sat on 3rd St. Promenade. It rocks! I love LA  Yes, I do"
0,oooooo ok cuz i was wonderin how the hell ur about to eat supper when its like 3:30 cuz i thaugh u were in america srry
1,USER Drink plenty of cranberry juice
0,"USER the sidebar to the right doesn't seem to work in FF3.5 (post an update, search twitter, add a twiter account)"
1,"USER Alas you are right, Jeremy slipped away peacefully at 23:15 that night and his remains slipped into a salad"
1,"USER Yes, it seems like we have (: but what's your dream?"
1,USER   Thank you
1,USER Thanks!  I look forward to tweeting with you too.
0,"I am thinking that this 12days_of_clois story is either going to be REALLY short, REALLY rushed, REALLY unbeta'd or all three."
0,"last day at Sugarscape towers today  Spencer has challenged Ashton to a Twitter race...ha! Good luck with that one!! Sun's out, YAY!!"
0,"USER  we coulda gone to LEFT AT ALBUQUERQUE...that is a MUST when i'm up here in a couple weeks, i mean really, it has to happen"
0,No sales     Kids r enjoying the summer off.
0,hates the rain
0,"USER Not a lot.  Have to pack, so I'm up.  Also finishing some stuff at work."
1,USER You can do it GF! Get a good rest.
1,USER Thank you for the follow friday
0,Local beauty spot
0,USER better luck next time Jack.
0,egg mcmuffin at 10AM  (no lunch broke)
1,USER tweeting. Just had a cup of coffee. Thinking to get dress & head out
0,What a crummy day to start. Client is making much fanfare about her horse's problems. At least one she came with. Jen came by last night.
1,had a gud day altogether.. feeling soo sleepy now.. gudnite u all.......
1,USER yeaaaah!!!
0,USER USER and the boys are at my sisters for a 1st communion tonight. i had commencement 2day
0,USER I leave for airport @ 11. Going alone so I get to freak out all by my self
0,USER  how come?
0,Anyone know why when you view your followers it show's less than you supposedly have.  Only got 8  but can only see 5..??
1,"USER Ciao,how are you romantic man?"
0,USER I am lost. Please help me find a good home.
0,USER well that's not a prob no more.
1,USER awesome! I am at 1505 west lake street: right across from the dunn brothers on lake
1,"England beat in cricket as well,,is there any sport they are good at?? maybe they should make up a new sport"
0,"USER I can't have it, I'm outside the US  Thanks for the tip though! I really appreciate it!"
1,it'd be nice if it was on PS3  and.. it reminds of me the grudge URL  lol..
1,USER ta for promoting It's a knockout in aid of the Hospice on sat 13th june.
1,USER a fiesta goin on downtown
0,USER sad day
0,USER I am lost. Please help me find a good home.
0,USER Yes I am coming in August... but I have seats  I am trying to get a standing ticket for the 7th. Bring on payday :p Are u?
0,i am sweating like a pigggggggggg  i went running in a tshirt and a hoodie LOL!!!!
0,USER that shits gine
0,USER URL - I miss them too!! It's been way to long for me   Hurry BOYZ!
0,USER Don't they have any arcade games in the airport?
1,Yayyy three hour delayy
0,USER sad news fella  hope all works out ok
1,"USER that sucks! I'm not coming if there aren't any high grade narcotics, supplied, I'm not bringing my own"
0,I'm so tired but my own cough is keeping me awake! So stupid
1,USER hey Trey i'm heading to bed and i just wanted to say goodnight hope u have a gewd day tomarrow bye
1,Good night tweeps~~~sweet dreams and many blessings
1,just came back from britts party
0,I want my hay fever to go away!
0,"USER yeah, its really temperamental"
1,"USER I know what you mean., Sometimes I listen to my own web site. Little creepy."
0,Man school again already
1,"kids: we're hungry! Nikki: oh look, there's a McDonald's! Ianseeing a gigantic lit up M) that's a giant glow stick!"
1,"USER  me too. Hahaha. Truthfully, I think I liked Tourgasm better though. How're you gorgeous?"
1,USER ...I live in a permanent state of missing u Pastor Barrett!!  Have an ACE day... Look after Wagon Wheel Mender for me!!
1,USER Im up and wearing my t-shirt already!  Excited? Love you xxxxxxxxxxxxxxxxxxxxxxxxxxxxxxxxxxxxxxxxxxxxxxxxxxxxxxxxxxxxxxxxxxxxxxx
1,USER not yet but looks good  fyi here r some of the sa escapes we do currently have (from qantas inflight mag) URL
0,USER USER you assholes arent invited to my sweet sixteen now
0,how do i twitter from my cell phone...????   i am new !!!!!!!   do i go to internet ???       help  !!!!!!!!!     thanks
1,USER Yes do! The brighter the better!  Gotta gooo and sort my face out! Hope you enjoy your evening
0,USER lol 62 now ha yeah right The Texas heat will be here by noon about 90 I think
0,should be doing biology
0,Going to work
1,"USER 17 is not a kid. He would probably agree, if he watched House."
1,I have a new found love for the show robin hood.
1,tired as hell!!!! bed time from cara  nighty night twitter world..
1,URL  this is video is so funny! you guys should watch it  hahaha
1,I'm obsessed with eating GRAPES!  So yummy!
1,half an hour bitchez!
1,USER nice article. only a true Apple fanboy would make such an effort
0,"USER please call me, your number has been lost"
1,Back home...makin me a pb&j  then gotta make dinner..
1,"just finished my poligov hw, NATSCA's next!"
0,I wanna go to asheville!
0,I don't wanna get ready for the week
0,I want my update...I want my love...I just want everything to work..
1,time for a glass of wing and some racing....sounds funny i know!!
1,USER Very my love. Hope you are enjoying it
1,USER haha i love you too misss
1,patience is a virtue
0,secretly wishes that she hasn't signed exclusive.  USER KIM BUM!!!!!!!!!!!!!!! USER yay! more tumblr peeps!
1,i am babysittin tonight wish me luck
0,USER damn I need one of those
0,i want walgreens rainbow sherbert but they are closed
0,USER i wish i could b there....
0,Oh and forgot to mention. I have no voice.
1,"USER right ON! good for you hon! should plug it, get others to attend"
1,USER Thanks for the mention!
1,".USER it looks really nice! btw I am such a nerd, after I saw the pic I went & looked at the exif info  so .. sidecar for USER ?"
1,We were never meant to be we just happened
1,USER lol it's okay. she is pretty darn cute.
0,"Today is a patriots shirt day, September seems so far away, roll on new NFL season. Omg why are the Yankees losing matches so badly??"
0,USER I'm bummed. I just got back from the ice cream place. Apparently they stopped carrying maple soft serve
1,USER WEEEEE i love Mondays! Sched ko is 11am-12pm lang eh! HAHA. Aww meet tayo.  I LOVE YOU!
1,"Enjoyed the Curious Case of Benjamin Button today. And spending an afternoon with friends, cups of tea and chocolate. Content"
0,"should i go 4 a run or walk the dog? cant do both, she cant keep up"
0,"Hi everyone! The weather is very nice today, but I am very tired  And the school is boring..."
1,USER yes you do (most of hte time)
1,"200 words over with still more to write, lame. burritos for tea"
0,"USER me too. . . I have some Jamaican rum, but that doesn't really help you. Sorry."
1,Purely made using javascript (preferably jquery)
1,"Thats the third time ''horny hottie'' has tried to add me this morning,good grief,doesn't give it a rest does she,block block block lol"
1,"I have no idea what the excitement is about getting more followers when all we really want or need is good, quality, friendly contacts."
1,Estou curtindo o novo cd do The Black Eyed Peas - The E.N.D. .... MUITO BOM!!!! recomendo
1,USER I'm doing my 'So you think you can dance' audition in Boston to Headstrong...great song! Have a safe trip!
0,"USER Yeah, but that's not new."
1,made $104 in tips today.  // taking a break // work 5-close
1,off to church    and i get to see Dee
0,Teeth is all sore tonite from adjusting braces n wearing rubberbands
1,"USER Well, I have got to move my butt so I'm getting off here.  Have agreat one and really nice to chat with you.Ur fun!"
0,"USER  Oh man, hope they find him"
0,"USER i'm from over sea, europe, was hoping I could listen through internet, not such luck"
0,Air France Airbus down in the Atlantic.
0,Very hungry
1,I'm on page A1 and B1. TWO covers of ONE paper!!!
1,Good morning
0,USER Yeah I'm fine. Just really sick. my throat is killing me and I'm running a high fever. I'm just not use to being sick.
1,USER  Had to buy a new car and stuff....that's why I'm not seeing Carrie this year in Chi town.  Definitely next!!
0,USER Just watched Tinselworm on 4 Shame that they cut bits out
0,I just can't get over it... R.I.P Logan
0,USER you met 3OH!3?? Lucky..
1,"USER USER A lot of alliteration from anxious anchors placed in powerful posts! (1 of my fave lines from ""Broadcast News"")"
1,"bye bye USER, I'll still come back and visit! Hello USER"
0,Goin To My Camp Rock yeyyy ;) I wish i could meet USER
1,Love my Starbucks boys on Mem Dr.
0,USER I misss you
1,at work!! going for CJ's wedding dinner later!  I brought my killer heels along! haha!
0,"called his mom to ask her if he could quit his job. she says no. also, had to stop in the middle of the story so she could vomit. FHL."
0,ohh.. i watched the last 2 episodes of the 4th season of House MD. It was soooo sad.  I LOVE 13! <3<3<3
1,cruise mentality is on high!!!!!! Im going to work it out!!
1,"haha who am i kidding i'll finish tomorrow  watching some tv, then going to sleep"
1,USER URL - Yep another great gag reel moment with Jared   Awesome !
0,Gutted I couldn't/cant go the LMHR fest
1,"USER dawww, thankyou."
0,USER Seen it already...  many times today
1,going to add some friends later.
0,spelling errors!Anywho I'm going to sleep for a little since I won't be able to cause of the pens parade the noise from people
1,USER You may rely on it
0,USER it wouldn't come on my phone even though I can do video now  laaame
0,OMG major thunder storm! Why do we seem to have them so often lately?
1,"USER ""c'mon, show auntie Blue ur Mausi "" - and he did ^^ URL doesn't he look just so proud?"
0,"USER Eep, didn't mean to make you feel bad. Sorry  It's a good thing! Hence why I'm being all positive and that xx"
0,"USER  It really is, I can't imagine what the families and loved ones of those on the flight are going through right now."
1,USER Morning!
1,Sadness is looming... I wish this weekend never came to an end. My favorite #coachella ever
0,USER Link to 'SM Paying Off?' returned 'article not found'
1,USER your tweet was just included in The Longest Poem in the World www.longestpoemintheworld.com/tweet/14296/
1,USER I can very much see where you're coming from with the Jarvis Cocker thing
1,I really don't get this twitter thinggy :|
1,"USER Karl! It went well, I just spoke fast as I had little time with lots of info. Thanks again for the help  Have a great night."
0,How boring are sundays
0,USER Sort of. Can't think of what to do to have a good day
1,"I just saw my first lightning bug of the season, it is oficially summer"
1,"Moh yummy stwawbewwies, peas   Did a load of laundry. Guess which shirt did not make it to the closet....LOL"
1,USER USER Now both of U tell me to go to bed. The circle is indeed complete
0,"Ok, so much for that plan then. Shipping food and candy to USA is strictly forbidden, so there'll be no delicious presents for Sisyphean"
0,USER oh my god the running animation is super adorable
0,"Mood's fluctuating. Not good right now. The rain always does this to me, or perhaps dementors."
1,"Chatting with USER : URL . Who knows, maybe I will give out some codes there"
1,Putting my hair in braids  what do they call me?
0,"3GS launch a million times better than the 3G launch... downfall, no new shirts"
1,USER  so u learnin or u already know?
0,Today is going to be a long day!
0,USER chuchu
0,Waiting desparately for the monsoons. Hate to be a couch potato  during wkends
0,"getting ready for work, 4 to midnight. sunburned! Paul is sick on the couch.  He's been there all day."
1,"USER just get your tax on line ,you dont need your policy then & youre instantly covered"
1,USER may or may not have enjoyed a whole block of hazelnut chocolate more....
1,"Jus Decided Im Going Wash The Pots, Have A Cigarette Then Cook A Sausage And Egg Cob"
0,USER No Max???? He and Taz were the stars of the show. Not sure bout watchin it now
0,"fighting with my outlook rules & alerts, need to raise support ticket as this behavior is screwing my workflow"
1,"USER ??????????????? ??????, ????? ?? ??????, ???????  ?? ??????? ????????? ??????."
1,USER haha...how are you
0,USER I made my white friend mad today  bc i told him his job was a scam n proved it....
1,just watched star trek again.  still good!
1,USER they're moving to opensource.. thats why
0,Went swimming today... And got so sunburned that I have blisters... And I am in SO MUCH PAIN.......
0,90210 on kino.to... but it needs so much time to load...
0,Key Club banquet is so boring! My back hurts   sitting with Kathy right now!
0,USER London Forum standing sold out!!!  Will try tomorrow
0,USER think i need more beers now!
0,wants her boo  btw love fhnixon's posts hilarious!!!!
0,is burnt from the sun
0,feeling the effects of the venti chai
0,she is leaving on the 28th ...
0,Why [TOS]?? Why??
1,USER Phew...there is a God
1,USER you know what I'm talking about
0,USER Suppose Essex is a bit far for you to venture...
1,Changed my mind. Off to bed. Tweet tomorrow
1,all these little babies around...i can't wait to be an aunt!  my niece (hopefully macy) will be here in september
0,USER OMG and ur not even coming back  screw it!
1,USER thanks! will investigate
0,"USER Hi there. How's the day going for u Into chocolate`..naughty, naughty. I agree with u, chocolate is great (me on a diet right now"
1,"USER Doing okay I guess  How about you, how is the recording going?"
0,gutted i need to cancel on my dad tonight  been so long so i saw him.
0,USER me too! Even tho it hurts
0,is @ UCL hospital
1,"Hi Tweety-birds! Hope everyone's havin' a good wknd  FINALLY fig. out BBM--after MONTHS;yup, I'm def. a natural blonde..for sure, lol; ..."
1,"USER ohhhh, I love Morse, have every episode on video & sometimes gaze lovingly at them"
1,USER ooo and some of the names of their songs  xo
1,USER Gonna watch it again tonight after I am a lil under. It will be AWESOME! Gives me trippy dreams for weeks!  That and VanillaSky
1,USER i wish i went i would of loved to c u live
0,I feel so disappointeddddddddddddddddddddd.
0,"USER Well now I feel jealous, Caliche's is a three hour drive away for me."
1,USER Tell them to let me back in on Tuesday
1,"USER Excellent  I'm doing good thanks. Yeah, I was waiting for a launch of 2 new programs in a marketing system I'm in at 2am."
1,"A great day with GF and friends. BBQ, beer and sunshine with good company does life get any better? I think not"
0,its really cold tonight
0,USER I'm not getting it until tomorrow
0,"11:24PM, goodnight moon, thankyou for always being so shiny and bright. Your not outside my window tonight  where r u moon?"
1,USER i love every single one of em ...ima have my girl LaLa hook me uP with one of MeLo's team mates
1,It's good to beeeeeee home!
1,I need plans for this beautiful Sunday.
1,USER That also describes my energy levels
1,may possibly have found something which may link Windows Media Player->Flock->Twitter->Facebook.  ... A discovery yet to be discovered!
0,Hour and a half nap did not work. Now I'm nauseous and I have a headache.
0,"USER i went to get icecream, and we didnt have any... so now im watching an episode of how i met your mother to console my pain"
1,"It's raining AGAIN AGAIN&AGAIN !!!! AAAA!!!! Stop the rain, cause I can't stand it anymore :s Seriously, I think my country has a problem"
0,six people confirmed dead   from bad to worse
0,a fucking monday
0,had the worst 24 hour hangover... and i totally missed friday.
1,USER good  i love it here . did you go down oxford street or harrods? i love shopping in these places and Westfield
0,mum cracked it at me for seeing how the internet worked on my hopefully temporary phone she's really grumpy today  it only cost 8c sheesh
0,OMFG Lost makes me think now. 2010 is next season of lost  FAWKKK. Gonna take awhile.
1,USER good morning! Coffee? Yes have some.
0,"USER ah yes, gin and tonic has a way of doing that...drink of champion days! shitty about the sucky day tho..."
1,USER OMG GUESS WHAT I'M DRAWING!!! hi
0,I feel like all I've done today is cook/clean. I miss my baby even though he's been w/ me all day.  & I'm so tired. Diapers are put away!
1,USER yeahh  girly night in  I'll have to get some nice food in  Any suggestions? Haha
0,I just got to work and everything is topsy turvy. Poor Erin
0,USER get me one will you ? I'm suffering x and on a school day  x
1,"USER Now you're packing my style...right before you leave haha - Have a safe trip, and I know you'll have a great time!"
1,i will fail chem test tomorrow. meh atleast i don't have to go to weights anymore
1,USER Thank you
0,USER you ok lovely ?  sending hugs.
0,USER Yeah I remember Brendan selling his original iPhone to get the 3G. I have the 16G. I might have to downgrade.  Bummer...
0,"Feeling a bit better today, at least I can walk. I have NO idea what happened yesterday. On my way to school now... Ugh..."
1,USER
1,USER Treadmill at a minimum. Probably needs to do a little heavy weight lifting since that's it's primary job description.
0,"Bad day so far and I've been up for about 2 hours... Anyway, beautiful weather, homework to do..."
0,USER yep i'll b there unless its cancelled  which I hope it doesn't
1,Just tell me. Now what do I do? I've fallen for you. And I can't tell u how crazy my heart is for u.
0,Please stop raining!  - URL
1,"USER he'd think im a freak D: 3.)you stfu k? you deserve everything bbz  <3 & 4.)I CANT WAIT EITHER! if mum loses it, i'll kill her;"
0,after last nights bbq my garden looks like glasto post festival
1,Talkin 02 The Hubbie.
0,Out of Ritter Sport
0,USER It's so sad
1,USER why not to release beta in closed community like M*?
1,"USER hey!  Yeah, for some reason folks really liked that one."
0,Gonna try to enjoy the weekend. and not have dad drive me insane. I also broke my spot-bot carpet cleaner
0,USER Nooooooooooooooooooooo! If you go to www.graze.com you can report it as missing... my wednesday one didn't arrive last week
0,USER he's not logging in yet.  and i doubt if he will check his his replies here in twitter. but we must keep on trying!
1,Hung out at Jimmy's today....that was just awesome....tired right now....I'm out...
1,USER I was going to DM you something but couldn't
0,awwww.... no one wants to make reservations with me  lol....
0,USER i know!  i miss you!
1,"USER Goodness, you're too kind. But thank you. I envy your talents more than you know  Have a fantastic weekend!"
0,"USER I doubt it.  That will probably never change. Bummer, huh?"
0,USER me too
1,USER  what was that for?
0,My last day with my baby girl Bella
0,Sleepy & I want to nap. But I can't.  damn it.
0,with mommy. WTF am I gonna do without her for 2 months?
0,USER Ouch!  What happened?
1,"I'm so happy to finally have heard from Seth. Like months of no contact and I missed him but hoorah! A contact email, he's still alive!"
1,"Good morning, I overslept...but that's allowed!"
1,USER you can do an inspection on me any time
0,USER My mom hates any music that's not Vietnamese.
1,"USER That is one freaky movie. I like ""I got life"""
1,#myweakness his smile
1,USER my worst game ever! my trainer gave me this look of disgust  excited for the upcoming tourney though
0,USER Turn you phone on i have an hour break  x
1,USER  ROFLMAO thats why your are funny and cute
1,"USER Thanks, love it too now"
1,USER YAYAYAYAYAAYAYAY im happy for you
0,Google App Engine corrupted my indexes again  Doesn't help versioning. All user data is gone until I get to rebuild the indexes again
1,hopefully breakfast soon (: tv  going to pamona with nikki and joana? :]
1,nah i wont he he
0,USER it was. i had a gerat timee!! i will upload some pisc. USER is deleting her twitter today. im sadd
0,wishing i had me a perfect boy
0,ughh French exams in 2 days and the only thing i know  : je m'apelle Seta
0,Tweet Deck keeps crashing
0,i haven't peed in almost 18 hours. i assume this is a bad thing
0,I can't sleep  what's wrong with me I need rest half yearlies tmrw FCUK URL
0,Question: How much gravel is there on 10 square yards in your garden? More than you can handle
1,USER thanks!
0,USER *hugs* I'm sorry your server glitched like that.
0,i miss people
0,On my way to work... Boo
0,USER looks lovely! Im sat in an office booo
0,so VERY hungover right now  quadruple sailor jerrys and coke is winnnnnn
1,USER I do care
0,USER I don't know what it is either  #ONTD
0,Took a benadryl to help me sleep earlier...big mistake. Now COFFEE can't wake me up. Should have known better
0,WOAH! That was my 100th update! :O Was nothing special.
1,paid rent and got a free 6 pack
0,"the bruising on the ankle is still looking awful, tripping down stairs isnt any fun"
0,USER Damn Canadians
0,I soooooo cant sleep!
0,USER Was bit tender on Sat night but ok now. Hate it as I'm usually like you and go brown
1,@ Moncky #scottishcupfinal - Make mines a double
1,has gotten sleep...thank goodness. now to clean the pool chairs....with nate
0,"USER i hope it's me!! but the winner is probably already on the line, which means not me"
1,USER Be happy you've got enough to fall out!
0,"Damn...can't get on the community, My sis is still logged in!  x"
0,"USER hope you feel better, i am almost over a terrible cold/fever/flu"
1,going to help film my friends english project WOOO  aha!
1,Tweet Dreams
1,"USER URL - Sos cuteee!! kiss , geetings"
0,Debugging Git integration for Atlassian Bamboo.  NOT exactly release quality..
1,"home sweet home, back in my bed in LA"
1,USER run away to Vegas now please?
0,I miss my mom today and would like to show her a really good time and all but she's like 3000 miles away right now.
0,It's all gone wrong....
1,USER yeah. i miss tha old WWF that was that shitness  have u gone 2 a WWE show?
0,"Been out for dinner with the grandma, revised and going out with Chel and Abi in a bit. Don't want to do maths test tomorrow"
1,"USER thx. i'm just used to the ""tech"" term being more the commonly used phrase"
0,GIMP keeps shutting down on me. I need a new copy of photoshop. I hate being broke.
0,tonight i say goodbye to the little girl ive raised since she was two. My heart is broken
1,"USER Yep, #Up is not exactly for kids."
1,USER hope ye had a good time here in Bonnie Scotland
0,"from *kilig* and *excitement*, i got so depressed thinking about my HMO  well, not depressed. mebbe just a little sad and teary-eyed."
1,USER as of a few hours ago Closer by Nine Inch Nails
1,"USER Whee. Summer. Plotting time, too."
1,"What am I doing? Get your nose out of it, Twitter!"
1,USER have an awesome day !  have fun in the studio - my husband records me singing - although on a somewhat smaller scale
0,USER yah and dont support multiple twitter accounts as far as i can see
0,"I'm thinking pierogies for dinner tonight. We're out of sour cream, though."
0,shud be sleeping but cant! im guna be so fucked and grumpy for this 6am flight!  but hey... im going on holiday so good times!
1,USER it's really awesome.  Thanks for sharing.
0,USER That is sad news
0,"studying but im so not going pass hayes test, rain tomorrow"
