0,i hate sundays
1,USER seen someone do that before  they wudnt let him in anywhere so he had to go home again haha
1,USER i'm pretty good & yourself? i'm sure just as busy as ever! lol
0,USER Isn't lack of sleep bad for your voice? It kinda worries me.  You should start getting some good sleep. ;-)
1,USER you make yourself up to look haggish?cool..
1,"USER Ooh, your birthday too! Have a happy one, and a nice wander"
1,"USER Hi Holly, Welcome to twitter..lol looking forward to tweeting with you"
0,confused.
1,Had a great day with the moms and sis  really makes ya appreciate those days
0,Big project due today so I'm going into work early. Hopefully I don't have to stay late too
1,#mileymonday #mileymonday #mileymonday #mileymonday #mileymonday #mileymonday #mileymonday #mileymonday #mileymonday #mileymonday  retweet
0,USER sorry I cut the wrong wire
0,my shoulder has been aching for a week & a half now.. what's wrong with me??
1,"Soo excited for Lines, Vines, and Trying Times  USER"
0,New to Twitter not sure wot to do  Help????
1,USER Both of those would motivate me for sure...
1,"Pancakes, music and train..."
0,USER Awwwwwh.   I wish I could give you a jump.
0,USER please come home baby  i cant sleep now and i need you here
0,"im tired  *yawns, rubs eyes, and goes to bed*  Goodnight! i will Twitter in the morning!"
1,USER yeah i KNOW it will be someone but whatever...quit hatin  jk jk you know you love me
1,"greeeeat friday, rutgersfest wit my tutt butt, sweet 16 for the young cuzo, and partyin it up for my roomie's 20th, time for breakfast"
1,USER Yeah that be fab l am a huge shane fan!!! I'm from newcastle be great to make friends with you
1,oh waaaa eeeeeeeeeeeeeeeee. i have my sportsgirl interview friday. i am freaking out!! i hope i get the job!
0,Stupid cast is itchy can't play  guitar and don't get to play nrtball or footy for state
1,USER upload di indowebster dong banggggg
1,Showing my mom twitter
0,USER Nebukadnezza are great. I wish  I could make the launch party
1,.. bye twitterworld. think im going to... i dont know  bye love you xD
0,Fell asleep. Missed Banana Split. Err. Still not feeling better.
1,Just got up. Slept with both Windows open. Quite a refreshing breeze.
1,"""its a long way to go for a date"" - ur right. see you in the next life. maybe."
1,USER I'd probably say 11ish/noonish.
0,"Well, that was freaking annoying. More teeny boppers dancing around to a song I've heard a thousand times now."
0,Hooking up an older Mac G5 for our summer students so they can see how easy it is to develop on a Mac.  We're primarily a PC house.
1,USER I love that song
1,OMG Pride was so much fun!! Gregory's party was also fun!
1,USER Paul said P!nk is absolutely amazing  enjoy xx
1,USER  i will pass in time and you will have a beautiful new baby!  i'm off to bed. have a great day! xx
1,"USER Ooo, shall join you in coercing--er, persuading NPH to join Twitter."
0,Ewww james just flopped out his balls
1,"USER - uh, i used to stalk max, i know where you are"
1,Finland deserved to win eurovision! Loved the song  we did cone a respectable 5th
1,"Hahaaa,the rain fall so hard like i said,and i often hear sound of thunder!It's quietly spooky,but still love the rain!Cold!"
0,USER  Oz sounds like Iowa when it comes to puppet awareness  A bit of a struggle. Other US states MUCH BIGGER aware
0,I guess ima be drinking alone tonight
1,look - USER and a REAL Firefox  URL
1,"URL - Last one, I promise. But can't leave out the Canine Billboards.   Was quite effective, really....."
0,"Installing Safari 4 and the iTunes that accepts IPhone 3.0! I hate how it makes you feel ""right at home"" with the windows look"
1,USER Your welcome
1,USER they're having enough sales to not bother with troublesome customers like yourself!!! who wants to answer queries?
1,USER sounds like fun
0,"procrastinating.  I so do NOT want to go to the gym, and I so need to"
0,I should never write in pen when i dont have wihte-out.
0,Seeing land of the lost cuz all the hangovers are sold out
1,"USER ohh that sounds exciting!!!  good here, nice weather today"
1,cousins are comin over.
1,250 followers!  Thanks everyone!  Shooting for 1k by the end of the month!
1,USER That would be anoying. Have you tried our Tech team to see if they can tweak something for you? try them on 133 933. Tristo
1,USER morning to you
1,USER Kick her in her chest?! LMAO! I missed that! Crazy ass!
0,is waiting for the telly man to turn up
1,I guess someone might be too tired from partying last night to RISE & GRIND early today
1,"Pancake dinner's over, I'm stuffed  Nice to see old friends again and get updates on the funny life of other even longer not seen friends."
0,wants to rain!!!  URL
0,USER I hated finding unagi on the red list in USER's sushi buying guide.
0,"I think I may have another kidney stone.  Dull, mild ache in myleft side. Had to leave PEERS early"
1,USER I so appreciate what you're doing!
1,USER np  just keep on posting inspirational quotes
1,"USER WOW! We have a new Over Lady (unless you prefer to be an Over Lord - your choice, of course."
1,"USER Hmm, cool  But why your downfall?"
1,"Hubby's plane had landed, so I'm off of here. Glad to have him home."
1,USER that's too funny!
1,"Hi everybody, how are you doing ?"
0,is sad her twitter pictures isnt working!
0,I hate mean people
0,Is on an epic FAIL this month
0,nothing!
0,Naptime with anferney before work
0,My throat is KILLING me. I can't sleep
1,"USER While waiting for the kiln, I do other experiments so it's an endless process & it does drive me mad sometimes!"
1,USER Hey! Yes. I am
0,"USER if you were taking about that twitter train, it was a virus on here  so i changed my password so hopefully it wont come back!!"
0,Plucking the brows.. ouch
0,"Made sickest laydown of my life tonight and was correct, but took terrible beat two hands later to bust 12th out of 180 in KFAN tourney"
0,"USER  List it ""Missing"" on FarceBook"
0,"Stupid me, accidentally gave my honey the Atomic flavored buffalo wings and now his stomach feels just awful..... Im sorry baby"
1,USER lmfao youre sick as helllll
0,I just got smashed in the face by a 5th grader thowing a football... Twice. Now I bleed
1,"USER Presentation went well  Yes, I also met a buch of cool people. Checked your portfolio, nice work/details in the projects."
0,USER  just like i doubt i'll find my cell phone since i have to leave soon
1,USER I can indeed confirm that we are real  and we are here if you need any assistance - Tez
1,"USER hi Sara, i just want to share my happiness that my bf start to get better  thanks for ur prayer"
0,Can't sleep  hoping today will be better
0,"USER Yes, I like Little Dorrit a lot, too-- though I keep falling asleep before the end --"
0,omg megavideo why would you do this to me? you've always been my choice video host if i need to watch something. why oh why
1,USER Another comment on your blog... I am loving this exchange!!!
1,Are you a fan of Mountains of the Moon on Facebook?  You should be!   URL
0,USER You're still not following me and my feelings are hurt.
0,Back home tomorrow - last night in Stafford Court!
0,5 mins to go to the Ireland v Bulgaria game!! Dunne looks like he's out of the game  #wc2010
0,have been sick with a fever for about 6 days
0,USER Wow... That's so sad.
1,Happy Mother's Day!
1,USER 600 clickthru's to the page vs 70 actual plays. that would be my guess.
1,USER USER  why're we smiling?
0,[library] feeling like the snots i've got in my nose...
0,USER biiatch. i think i might be a loner.  ahh well ill go find james. ROFL. =]
0,is so bloody cold
1,"Brain is wired, body is tired, but i still feel happy, with my lovely Natalie"
0,"yeah.. my favourite time of year, summer! but iÂ´m not so exiding cause there have been rainy all week.."
1,Off to Six Flags Great Adeventure for our private safari!!! Sooooo excited!!!
1,USER Congrats on the deep run!!  Just attended the bootcamp last weekend had a cash recently on stars using your methods! ty!
0,USER haha I have the crazy 393 midterm that day in the evening. Pretty sure I am supposed to be sober
1,Enjoying the day off
1,USER Thanks you for welcoming me!
1,USER How exciting!
0,"lol i just totally ignored you emily, sorry"
1,USER ok cool... thanks! cause I can see it but it says waiting for approval... so I thought I'd try lol Thanks
0,USER I think that may be because it is the US site  URL
1,"USER Haha, oh the benefits of employment  Plus I get paid double-time-and-a-half tomorrow (Y) Nine hour shift, FTW!"
1,off to see smackdown...PEACE!
0,Playing games to calm my boredom. It's raining and there's nothing to do
1,"USER hope you will upload them back, it would be pitty to keep us uninformed  i enjoy your work"
1,Waiting for oldest to go to bed so I can have a scoop (or two) of ice cream in peace.
1,crazy day in lake havasu filming piranhas 3d! finally time to kick back with some cocktails
0,just got home -   -  my skin is a shade darker now ..  leaving to KOEL art gallery ---  Mobile almost discharged -
0,USER noo. I can't find one that works..
0,Even dogs do not like Kevin
0,USER take a rental car and would drive also to kansas....but this would also be only a short time  I think about that every day
1,"USER haha i can't stand the name of that place. but i must admit, the adverts are catchy"
0,"YAY My Mac doesn't run as slow as it did a few hours ago, I relly think it was the Spotlight indexing."
1,Good morning world! The earth says helllloooo!
1,"USER wednesday! staying with USER, seeing you on thur i believe, in warwick, then con fri-mon. so looking forward to it."
0,USER Aww  I know I felt like that yesterday at work
0,just got home...and no food to be found...and i gotta go in early tomorrow cuz i gotta give back my friend's giant hello kitty poster
1,I am HUNGRY. I ate like a really hungry man yesterday.
1,photos. what do you think? Fairy?
0,USER Aww. Now my night is really boring.
0,Damn apparently im not allowed to be a vicor
1,fabulous workout....HOT!...relaxing watching a movie...then takin roomies doggie for a walk!
1,"If I can make it to bed without running into a wall or tripping over my own feet, that is. Heh."
0,"USER agreed.  J & K love those kids and its always been so apparent, but the media could care less and is already attacking em."
0,good day turned bad.  at least i have my TJ sisters to cheer me up
1,"Mark Lee - Hey All,great weekend here in zante with lots of yummy sunshine  Good to be back for another week of Zante's best music mix!!"
0,"USER I loved the book.  A very ""fast"" read.  I hope the movie isn't a letdown"
0,feeling a bit rough. Work laters and still no car
0,"Some one drank all my capri sun, i wanted to cry"
0,Was stupid and bought RAM without making sure it was compatible..... doesn't fit
1,whatever trever
0,"So, I went to a friends wedding in Hawaii and it was cancelled...  and I have yet to have hear from my friend.  I'm worried!"
1,USER oh snap. just looking over my to do list - wish i could just tick everything and go back to bed.
1,USER Hey Miley  How are you? Cool pic haha....so funny
0,at home with my sad and sickly doggy
0,"JUST CALLED RAISSA AND TALKED TO HER ABOUT THINGS HAPPENED HERE AND THERE! AAAAH I MISS HER SO BAD, MASIH SEBULAN"
0,I hate the drive home.
0,lost my kitty already
0,USER the show is cancelled ?!  thats r so bad news
1,uploaded a few pictures of my fiance's and my home  URL
1,USER Hope you've got plenty of sun cream with you mate! Have a great day
0,Homework
1,USER Just type bollox like i do.
1,USER its one of my top 10 feel good songs
0,"USER. Talk to me, please"
1,USER Thanks for that  haha
0,USER heyyyy amigaaaa!! where's da luv'???!
0,"at home, feeling rather sick on a saturday night  bugger."
1,last math exam!
1,waiting for my lunch and doing some online shopping
0,I really miss home today
0,I think I may need to leave sooner than I thought... I don't know how much more of this I can take.
1,raves about foreign women.
0,USER  the 3 of us r here for u always xox
0,"Working on this DAMN Financial project, Definitely not having any fun this weekend  , I want to spend it wit my BAAABY waaaah"
0,"USER i know  its such a drag, and i dont think anyone has seen it yet, maybe coz its fallen into some weird place."
1,"Bonding time with mum, watching 'HJNTIY' again"
0,"still raining here   todavÃ­a estÃ¡ lloviendo...how is the weather over there, whereever you are? cÃ³mo es el tiempo, dondequiera estÃ¡is?"
1,"USER You must be really good to fix all those styles in 10 mins LoL. If you want my opinion, straight and straight up look best"
1,Watching iCarly
1,USER oh wow your going twice. lucky you.    thank you. (L) x
0,damn u dem dum ramen noodles are my thing  and ryan makes people cry
0,"morning twitter, i really dont wanna b up right now lol"
1,"Vacuuming, and then camera shopping"
0,USER a game eh? what happened to the facebook date?
1,USER  I am laughing so hard!  You will get a call
1,Yes!the exam come  hope I can do all the best of me!  Amin!
1,hohum. wants to go to the movies with maddie
0,USER Im only 23 and this is my first child. Probably my last. Its a VERY tuff JOb. I love it though just hard.
1,going to grad night
0,is getting ready for kalis going away party    text me <3
1,"""God doesn't give us what we can handle...God helps us handle what we are given."" - Thanks Dorothy"
1,USER I would say.... aaaaaaaaaaaaaaa...........hmmmmmmmmmm... none
1,"tonight was fuuuuuun USER USER USER USER & jackie. goodnight tweeterhoes. a|x, 2morrow then swim party"
1,USER Haha! I was wondering if that blonde guy was you  Sorry I didn't say hi.
0,Carrie has a bad eye infection...just waiting for hear from the vets to see if they found anything
1,USER  Morning Miss Sunshine.
0,"i just remembered part of my dream ""why is she your number 1 and im not even on there"" i have problems i even dream about the internet!"
0,USER mee too !1 i love this song !!! but i dont eating strawberries !!
1,"Working on transfer papers, then lunch with Luke."
1,school picnic! leavin soon. good day!
0,"Aw, you guys i wish our school didn't mess EVERYTHING up"
0,USER i don't wanna go to this interview baby
1,chillinchillin with brennerrr
0,USER Don't think we will be getting anymore MW2 details for a while now unfortunately
0,USER wow...i'm so sorry. that's terrible
1,USER aku udah selesai belajar Ash  Cuman kurang yakin
1,USER URL - Oh i know that one
0,USER i know its so shit  thankyou ox
1,OMG is everyone asleep or something??
1,USER haha don't take it to heart so much  shes an idiot!!
0,USER weh? :o
1,WASUP HOMIEES?! im about to get my captin crunch on and watch some tv  duces
0,USER Indeed. Blend generated XAML not too far removed from FrontPage-generated HTML  Tutorials tend to focus on Blend.
0,"Some people are full of shit. Studying for my math final on Friday, so I'm missing Run's House tonight"
1,at work
1,USER Morning!
0,If I have one more stressful day this week I may just break down crying right here at work  Its only 10 and its the worst day this week
0,rawr! lol  work 2 - 8:30 today  blech
0,"Atlantis Unleashed by USER out tomorrow!  Yay!  Sadly, won't get to read it until August, after Bar Exam."
0,Ireland is sweltering today... would be thrilled only im stuck indoors looking out
1,USER Its alright I get plenty of hikes in dont worry   The dogs are snoring
0,is worried. My grandaunty is on breathing support. She's not conscious and its been hours.  URL
0,Sad realization: Truffle Oils are fake/ synthetic.
0,USER i dont know how to make my pictures become smaller so i can upload them as my dp
1,USER Yeah that pretty much sums it up!
0,craving chocolate
0,"USER if u understand, good.if u dont understand why,for gods sake dont b so stubborn and TELL me #unfollow"
0,redsox win 8-1!!! even though lester didnt get the perfect game
1,"USER hey homeslice. it doesnt work if you don't spell the hashtag correctly     ""#sqaurespace"""
1,"USER of course!  i've been a moffatts fan since i was 11.  they were the first ""celebs"" i ever met."
0,"Going to bed , tomorrow is going to be a long day"
0,USER i dunno ohwaaaaa ay wa7id feehum  help!!!!
0,"USER  I sowwie. If it makes you feel any better, I'm in pain. lol"
0,beastingggggg.   museum ?!  not.
1,i love u short stack!!
1,Goodnight y'all
0,USER i guess but then tweetie will go unused
1,"USER like i said, fuckunappreciativeidiots"
1,Hopes i get the job at the Daycare i applied for
0,Very tired today.  Our apartment is so hot it is hard to sleep
1,USER  The mall is always a fun place!  Enjoy.
1,"USER then again, it might backfire"
0,Going to sleep even if I wasn't able to JB my iPhone
1,USER iyaaa stuju...plg gawe next time ntn yg ringan kaya gini yooo rame2  URL
0,USER Why did you take down your pretty picture of yourself??
0,"USER Following your followers will get the word out. In other news, Vengeance (1968, Anthony M. Dawson) was removed from Netflix."
1,USER Will you go out with me (y) (n) (maybe)  circle and return
1,hey lizzy send me a msg on yt.
0,woooo watchin britain's got talent or somethin?  should really be in bed but  xxxx
1,thanks to USER  now all I want is a cucumber   maybe will do a big salad for dinner
1,Not sure why I have joined this site....Wanted to see what all the hype was about I suppose...will give it a couple of weeks
0,"is sat on her bed, listening to music. However i should be revising for my exams"
1,Emmett yoyo club was pretty sweet  had 4 kids show up
0,This blows!!! I missed the new moon trailer
1,USER Strawberries will not bore so soon. They are heavenly
1,"USER I know! lol, it's so true about my life though.. I love it.  &I have a TON of ""Fragile"" boxes, which also reflects my life."
0,i wann ago see tbs and anberlin on friday
0,USER Spent a lot of money today haha. I wish more people could see my stuff though  It would be a lot more worth it.
0,8 hour shift at Pinkberry  sooooo long
0,USER hahah that sucks! I'm sorry  If I could I would save you from your closed minded and mean aunt and uncle haha
0,is its suppose to my birthday festivities..but im feeling sad
0,I miss Conan being in NYC
0,USER youmean the green power ranger who then become the White one...I miss good power rangers
1,USER he'll love us once he recognizes us  and we'll be best friends : D if we're irresistible to Joey he'll love us even more!!
1,jumping up and down for Vettel !!
1,sunbathing instead of history essays is alot funner
1,Homemade Black Forest Choccies for Morning Tea
0,Drinking alone at your parents house is no fun.
1,"also, shit life is shit."
0,"USER Sorry to hear that, dude!  Shall I summon an exorcist for you?... :-/"
1,Heading to bed. Sleepy after long homework load. Hoping to accomplish much tomorrow!
0,"Big cup of coffee then back into garden. Lots to do, and it's raining"
1,USER Cool.  Been wanting to find a league to play in that I could actually keep up with.  Like 60 yrs old & up
1,Good long day... Enjoying glass of wine and house
0,Too hot in my room
0,Its like really hot in the office.
1,"Just back from Terminator. Better than expected (though expectations were low). And only 4 people in the screen, including myself"
0,"""market forces"" I'm not real sure I know what that means anymore  Lately it feels like we have been condensed to the big 5"
1,still in love with marky mark
1,New art work up for sale  $25 with free shipping!
0,"Oh FFS face, please stop being a twat... I think I'm getting another coldsore / ulcer inside my top lip  Dear Christ!"
1,USER speaking of...lynn summers found me on facebook  soo reminisced bout sundancers..who who in NC???  miss u
1,RE: USER LOL  you seem to be butt-slepping-obsessed :>> does it have anything to do with the fan fic   ***lookâ¦ URL
1,"life is good, if some one know you....yesterday enjoy alone in my garden"
1,Gone Phishin'....
1,"My life is pretty damn good. Thank you universe.  URL (via USER) Amen, brother!"
1,USER well how about reestablishing a connection then.  How have you been? I've been praying.
0,USER i know they should of but they didnt.   i want to give them a high five. its funny
1,USER here i am
0,USER not today  up friday - you in town then?
1,"USER too late, baby..."
1,About to sleep. Just got back from grocery shopping  I saw what's-his-face there !
0,the remains of lip balm from newyork  URL
1,USER i already miss you! keep me updated on the road trip
1,1 nostril piercing and 1 wrist implant later  it's gonna be a good night tonight... Open till midnight if you wanna visit
1,USER  plzzzzzz miley cyrus i am inviting u to come to egypt\cairo there is no one doesnt know u in egypt...plz think about it
0,USER thats wat i heard but people lie to me
0,USER i can do dat but whose gona apply it for me?  an im hurtin!!
1,Now I'm watching the movie '21'. Great movie
1,friend call me 2 ask what 2 present 2 his girlfriend... So cute!  diamonds are girls best friends ;)
1,Just watched mcfly!! on T4 ..  am now watching wolverine origins T4 special HUGH JACKMAN! sadness haha
1,"I'm going to the Apple store and screaming ""You did it! Congratulations! World's fastest browser! Great job, everybody!"" I love Elf"
1,"USER ...hmm its cool , nice !!"
1,USER oh cool thanks  I really need to get some sleep. Zzzzzz
1,USER that is nice of you.
1,My fav commercial is on...Dwele in the McDonalds commercial!!! I don't know why it's so funny to me
0,Good Morning
0,ellinor won survivor.....  not good at all
1,USER why so sad? I'm kind of sad too though~ maybe strawberry ice cream or pinkberry will help?
0,USER Me too  Get skype. P.S I'm making it my summer goal to read all of  Bukowski's books. Pretty sure I can get through each one in 24
0,USER me too! group two FTW. shoulda been the top 3
0,USER I'd wish it
0,I'm sad. this may be my last time with these girls  time to move on I guess?
0,USER yea I'm supposed 2 b. You got my damn chargers!
1,Sunshine! Jonny & Jess are coming this afternoon
0,getting ready for practice
1,Church was uplifting!!  let's pray for others more than for ourselves.. Off to the movies with the sis before life teen.
1,"got back from 2 hour shopping trip.  ahh, bought some really cute outfits! whoop woo!"
1,is hungry.............going out to eat soon.....
0,"USER Ah, well, you see, I did know  Exams dear boy, exams! Breaks my heart indeed, but sacrifices must be made"
0,"USER We sometimes rotate going back to Southbridge but for some reason, my colleague's going back nxt wk"
0,"It's suppose to rain here, but it's just teasing me."
1,USER I heart 9th Life
1,Getting ready for surprise party!  It will be fun. I saw Up! It was a cute movie.  Wanna see Year One. And Land of the Lost.
0,I think my phone stopped updating my tweets  In other news I now have 40/40 points in my class so hurrah!
0,USER i havent been online to read and review
0,"USER I do, too! And I totally wanna use that, but my name is pronounced De-anna, instead of Dean-na. Not the best transition"
1,USER its ok
1,USER  I'll keep my eye out for that special cuckoo
1,"USER It's okay.  I work this afternoon so the break's actually at a fairly good time for me, I think."
1,New record: shaving 13 minutes off my gps eta.
1,text the celly  2672426
1,LEAVING THE ISLAND TOMORROWW !! yaii  bak to my apartment in NY ... [ Â¡ É?É?É?É¥É?É¥ ×É?uÄ±É¯É¹Ç?Ê Ç?É¥Ê ÊÉ? ××Ä±Ês ××É?Ê Ê×É os É¯Ä± ]]
1,I think I wanna go out Wednesday evening (most likely after work)...hit me up if you wanna roll with me
0,I'm not high anymore and some stinky guy with a mail order bride is pissing me the fuck off..
0,Exams start on wednesday..wish I'd done more study 6 months ago instead of dossing!  x
0,"USER toni, di ko napanood yung elive kanina  what's with you;re twitter account? gusto ko mging updated. hehehe."
1,"USER Missed you but this just means we have another get together, right?"
1,"USER Not at the moment, but I bet we could come up with some! I'll talk to my Business Partner and get back to you!"
1,"USER USER - Don't forget 'contradictory,' too!    I know we're each reading it from our own point of view."
0,"Played Catan today, desert directly in the middle of the board. Wacky! Oh and I lost"
1,"USER LOL goooood  blah I can't way to dream tonight, I'll tell u why tmrw ;)"
0,USER yeah he not coming back til Dec.
0,USER That is not making me feel better
0,Now Im crying....  Poor thing..
0,irl school so i have to go
1,USER thanks for referring me
1,"Sometimes, having a small car is great"
1,"USER Ok Don, you're like half a mile away from me right now! I went there for lunch last Thursday."
1,"USER Ha ha. No thanks.  Been there, done that!"
0,"ugh, ugh, ugh. having some doubts. have to write a paper. this has been a bad week for classwork."
1,"USER yup  I just had to get that out of my system, haha"
1,Goooood morning
0,"USER I am not tired, I don't sleep well"
0,.And I don't get along with that kind of stuff
0,cogratulations to adam and kris!!!they are both great performers...but i really feel bad for danny...
0,USER  i can't believe its over.
1,i am updating my accounts.
0,just found out missed out on a mcdonalds with the girls last night
1,USER we should!!  let's get t-shirts to make it offical.    haha!
0,Anybody needing a T in the Park ticket this year? after last weekend i have to sell mine
1,"USER thx for the offer, but I shan't impose upon you"
1,Running late. Luckily sisters and grandmas tend to forgive easily.
1,USER haha.. in that case you are just gonna blend into the crowd  USER
0,USER i was in a hospital for a week and a half pretty much on the virge of dying.
1,USER LMAO!!! xD so put ur nick by my nick in the note and it'll be OK xD hahahahahah
1,"Replacing hanging baskets flimsy strings holding Strawberry plant out the reach of creepy-crawlie bugs, but not to high for bees & water"
1,USER haha there is a bit of that! makes getting up early easier too.
1,USER Congrats  How exciting!
