0,i hate sundays
0,"Had a great weekend  - Our yard looks awesome, now ...time to paint"
1,USER I ended up getting sponsored to go to kickstartz in Miami this weekend.  I'm sure I'll be able to make a trip out there.
0,Just woke up. Ate a bowl of cereal. Should be getting ready for work. Blahhhh!!!
1,Just got the news. Classes will start on June 15th and not tomorrow.. yayyy! So I still have 1 more week of vacation.
0,USER uhm i went to the link and there is nothing there  whats going on
1,USER thanks for the reminder
0,"I can't believe it's fucking working! First try, too! My new computer looks so fucking sweet. Too bad I'm failing the exam tomorrow."
0,"Actually, I am getting two shots today"
1,Oh how great that sleep felt
0,Emotional Last Night @ Work...Not Good At Goodbyes...Never Gets Any Easier
1,I like someone A LOT right now...
1,Going to go kennel the dogs and then I am going to watch Goblet of Fire
0,Back to work tomorrow
1,Conference at FLA this morning... Raiser's Edge this afternoon... time to my put on my learning hat!!! Happy Thursday
1,USER oh I see. Flat packed David LOL cool. Hope be arrives tommorow!!! Squeeee
0,work..... wahhhhhh!!!!!!!!
1,"USER I love the listing for  ""Special Projects"" under the firm's practice groups!"
1,distraction-away-i-go-2-distract-elsewhere! (if u r just now joining this program plz find note on distraction below)  :-o::::::::::~~~
1,USER hahahha omg I was listening to it 2day and thought of u  haha halllllaaeeee beeerrrayyyy
0,writing my first non-mvc asp.net code for over a year.
0,USER your not fat  be positive about yourself dont be hating <3
1,Driving througt the internet is a fantastic feeling!!!
0,There is no hope for darkness up here in Northern Finland
1,Yay! Picture issue is fixed!!  URL
0,USER i know i missed u!   wknd was awesome-i bet u ill be getting a ring within the yr. lol
1,USER thanks lol
1,"USER Hola, Seth! Do what you need to do!!!"
0,I'm out of tokens at chuck e cheese. This is an FML moment
0,Pal's mrs made him throw out all of his records  sad. He gave me his record player!  WINNER!
0,workin' like a dog.
0,USER too bad in most professions this is not true nowadays
1,@ briches good luck!
1,"And, I took second @ the IBO shoot  Great odds..."
0,USER i don't have tart tins  strawberry pie it is!
1,"USER Thanks Patrick!  We're back in recovery and she's resting nad groggy, but doing well."
0,Is sad she's not allowed to go to Harry's party tomorow afternoon  x
1,USER np  I tried to dm you back  but I cant
0,I was sunbathing in the pool and my brothers jumped in! It was FREEZING and water went EVERYWHERE.
0,only feature i like abt 3.0 so far is Cut-Cpy-Paste and landscape keyboard for txt'ing...no MMS support yet in US
0,"USER Oh no! Bicycles are indoor creatures in Petworth, sadly  I'm sorry that's how your week started..."
0,"is NBA Draft tomorrow! Patty Mills is leaving SMC  [Warriors? I can hope, right?]... I miss my SMC girls.."
0,my hand hurts a lot this morning. maybe next time i beat someone i should wear protective hand gear. no but seriously its bruised
1,"USER I know! My husband & I both just got over colds! Summer...come quickly& yes, thank God for the sun today!"
1,My dad's van broke down at sonic...that was fun
0,USER B i want popcorn!!! im sad cause i couldnt see u guys
0,USER you poor thing! toothache is no fun. I recently had a troublesome wisdom tooth removed so sympathise
1,USER because that's what he wanted for his birthday
0,USER USER  I WANNA BE INVOLVED IN GROUP THINGS TOO!!!!!!!!
0,I WANT MONDAY NOW!!
1,USER aww thanks!!
1,i reckon another star wars movie should come out
1,Finished my ap outline for world history come on Chonis you can do it!!!
0,USER I'm very sorry about your cat   Zen hugs to you and Peter.
0,"Is off to bed, got to be up in 5 hours"
0,USER aha 5th lttr stopp working now  think i n to gt a man in (translat)
0,USER Thanks so much Erin!  I miss you too; I think I leave before you get back
0,"3 perspecitves approach to Open System Science: Synthesis, (missed the other two  ) I'm getting slow #TEDxTokyo"
0,"Just watched Scrubs, ""My Finale"".  ""You smell like a fatherfigure"""
0,My toes are cold.
0,and trey just threw up all over me agian!!!!!!!!!!! idu this boy
1,Finally bought my mini flat iron!
0,USER it wasn't even intentional - i'm appalled by my own sense of humour
0,USER I've been waitin for mine for...2 days now. I think they forgot about me
0,Christian and Cindy rode bikes to see UP. Then Cindy's bike broke.
0,"I'm so jealous. I missed the last TBM show, and i know my friends are all out having a blast. I'm so homesick."
0,Old (1st gen.) iPod no longer holds a decent charge
1,its officially 2 months w/ my babe  he got it right at 12 o'clock  ilu baby!
1,Signing off twitter until lunch. Otherwise I don't get any work done !
0,no fire tonight  i guess im going..well i am going to tacoma to crash at his place...
1,Feeln Niceeee  Luvn My wknd wit the girlzzz!!
0,I'm the worst sister in the universe. I forgot to call my baby brother for his birthday.
0,"USER LOL, watch you don't get raped  !"
0,USER omg no
1,"USER, yeah I hear ya. After all this rain, we need to train for time in the sun. They shouldn't just spring it on us like this"
1,USER USER I can see that the vegie lovers got called out from that kale confession.  love that.
1,Is it really true that if you dream about someone they went to sleep thinking about you?...I Really Hope So
0,cant concentrate
0,Worst migraine ever
1,USER de cand cu amandina aia...you're not funny anymore
1,USER no selena?  love you girls!
0,Wet hair in my eyes.
1,Waking up to people talking and it's getting later every morning  x
0,"Glad mom feels better after last night... Slept w/ puffy eyez,Woke up late and didn't get to run to the bank.  bout to eat a late lunch!"
1,magic mountain today!!!!
0,USER girl my shit still hurt  I'm still limping
0,Eugh  hate early work def napping when finished!
1,USER fuck you shes not . USER Hey tori
0,"USER  I'm sorry...I'm working hard, I promise. I'll come home as soon as I can."
1,the lady at the nail salon told me i had weird feet. thanks. i've been dancing for 18 years. they're supposed to look like that  mani/pedi
1,USER its funny coz there really is one of those  LOL!
1,Up soooo early.. but its ok. MY BROTHERS ARE HOME
0,So life right now is as miserable as it gets.
0,heading home to unpack a few more boxes. Yuck
1,USER manda o link
1,just noticed Journey to the End of the Night starts the night of your birthday
1,perusing the art at bushwick open studios
1,says gud evening  URL
1,"USER I might try out for the bounce showdown  I know it has nothing to do with cucumbers, haha."
0,Work  :/
0,Forgot about the water running in the flower bed ! Most of the top soil has made a great escape down the driveway
1,I learn a lot of science stuffs from CSI and Fringe and a lot of life stuffs from How I Met Your Mother
0,my twitters being stupid & not letting me upload pics
0,USER Magners is clouding my brain today. In your terms Magners 1 USER 0
1,USER Lol it wasn't supposed to be nice!!  Blah sfklgjdfkljdfl I keep getting prank phone calls!
0,USER awwwwww....u got lost  poor thing you!!
1,"can play the first verse & chorus of Tears in Heaven - Eric Clapton from memory, and I think it sounds amazing"
0,USER yes dear....  ... I'm opff bbl8r
0,"...checked 'Help' section on 'Controls' and found out, no Charge-Up Spin Dash on this game...that makes me sad..."
1,Goodmorning lonely friends
0,Heavily medicated but can't sleep. Ugh...
0,My sheep has fallen down behind my taskbar
0,USER but but it was funny when I wrote it
1,USER I love you.
0,"USER Oh..okay.  Well, twitter is good to waste time...or you can call some friends.  I have a dude, but I'm not in love with him"
1,"USER I leave the wednesday after you guys visit. How good, I get to see you guys"
1,"USER Well, cheer up because everyone knows that you're going to win at the MTV Movie Awards tomorrow. Your fans <3 you, Miley"
1,"is Carlo Ancelotti, the new Chelsea's coach. viva don carletto!  URL"
0,"USER I am partial to ""Dicky Dearest"" but sadly I am in last place."
1,USER Haha and you should! State pride is important
0,"has problems she can't talk about right now, but she wishes she could"
0,Awe.  you okay.
1,USER I make greeting cards that say EFFING on them!  URL
1,Thank you USER & USER for the Follow Fridays!
0,Praying for the Air France crew and passengers
1,USER I was just kidding b/c you said I'm a girl that goes after what she wants.  How are you?
1,"USER the front look's ok to me, but that pocket could be a bit bigger. otherwise, it's really what the doctor's ordered!"
1,USER Well I've knocked out seasons 1-7 in 2 weeks tops before...so I'd say at least 3-4x.
0,"NOOOOOOO! ...he's out at 653,700  Billy Mitchell retains the record #weibe #e3"
1,happy 1yr anniversary to me  *cheers* this calls for a celebration.
0,I wish I could sleep right now.
0,USER hahahahaah OMG I swear to gawd I did too a month ago! My friends said not to tell anyone
0,*packing. And tired
1,"I love love love love ""The climb"" by miley c.! Im so attached to the song"
0,neck hurts. a lot.
1,USER masi bangun km yaan? Hihi. How about bandung on wed? Let me know darliing
1,USER I found HIMYM for freezies  been going through season 1 finally.
0,"gosh i wanna have another puppy mommmmy,but still nothing can replace my Pepper"
0,USER I have a dog and a camera but no coller.
0,USER actually that happens to me quite often with those cookies ...seems like the oven gets hotter with each successive batch
1,USER your last four tweets? brilliant!!!
1,ooooo iv breached the 200 followers mark  go me!
0,babysitting right now wish i was fishing
1,"going to noodles & jamba juice w/ andrea! finaly!!!  listening to valencia, i like today."
0,"USER WOW. If I had known you were still there, I'd have met you there to eat with you.  Sorry! Drive carefully."
1,"USER U're silly. Yet, entertaining."
0,"Heading off to concert, unsure if composer will be in attendance"
1,A night of harry potter and then a bit of captin jack sparrow.....pleease bring on the weekend  thursday night here we come!!!
0,8 days and counting
0,still can't find the pod.  aural skillz test tomorrow.
0,Def. a cover up!
0,USER Wha?!  You miss my costumes?  Well I haven't been able to cosplay since.
0,Can't say TGIF yet- whole day work tomorrow
0,"USER Fantastic - I am running Steamtown in Scranton, PA - Did not get into NY this year"
0,Going to miss my besties tomorrow  goodnight.
1,USER shoot..I'm abt to put thesze jointsz in a basket..forreal..lol...but nah..I'll manage
1,17 again is super awesome!
1,USER you could buy it as a gift
0,good morning all. another day thats going to be too hot for anything
1,"USER Yeah, it definitely has been  Glad to speak to you again!"
0,Head hurtin
1,"USER dude, it is such a relief not having to stress on work, I can go back to using photoshop for fun again"
1,trying to figure out what ive got to write here to get more  random strange   followers =D  nah i love you guys
0,USER says they r going to WIPE the US off the MAP!
1,Put on light switch cooooovers. At least I'm getting paid
1,"Shared some tots and had a great convo with Rumya tonight. Luv all my friends who will endure my ""moments"""
1,"USER Wow, that's ambitious!  I hope everyone hits their targets today lol!"
0,USER I knowww  I'm trying to sort it out now
1,I make the good girls go bad. // Im gonna go watch Gossip Girl.
1,USER  new
1,The most followed Dosanjh on the whole of Twitter  ..... i love having a name that is not that popular lol
0,USER Exam was pretty Ok I suppose. Problem was that I had no time to see people after. It makes me sad....
1,USER LOL i just got that joke! Good one!
0,"ugh girls r an odd thing very hard 2 know wat they thinkin....had a little ""fight"" wit my gf"
0,Another fine Coast Guard Day! Sike.
0,"i get to see my cousin tonight, he just got out of jail its gonna be weird but exciting! still depressed bout orlando"
0,Back in Texas. No air conditioning.
1,"had a lovely day at the shops, eating raspberries outside city hall and at chilis for dinner with friends  Now deciding what dvd to put on"
1,I've just hijacked Seans twitted. Shhhhh don't tell him
0,"Wow, David Carradine dead - ""in a closet with a rope around his neck and body. """
0,"USER I'm always up for games, even preschool ones... but no iPhone."
1,Amazingly fun time. I love you guys
0,Sad that I'll miss a band signing cause I'll be on a 'vacation' next week
0,USER :  I kno what u mean... I don't sleep at all anymore
1,hangin with amanda  today was exciting and very new.... ;D
0,so pm this weekend started out greaaaaat even though manduh had to leave meh
0,Im so ill  i got the swag flu...lol
0,USER huh what? I'm lost.
1,Great Auto Pilot For Twitter URL For All You Busy Tweeple.
0,I have to retake my Chapter 3 test for math.  I'm so bummed.
1,"USER yup..me contradctry..datz y I wrote ""memene""&followed it wid an evil wink ;o) see I proved mahslf"
1,i got a new mic today for my podcast! can't wait to try it out...
0,USER i don't have  but i'm pretty sure i need one
1,Engaged!!!!!!!!!!!!!  Happiest night of my life  Future Mrs. Kruse
1,Drinking tea and watching tv
1,"(id) canggeeh, saykoji yg ""online"" udah online beneran di tipi (on air maksudnya) -no pertamax please"
0,"USER Yep, the magic is gone. Can't we geeks have anything to ourselves anymore?"
1,USER oh....hey....it looks like that ones already done.
0,It's amazingly hot. I tanned yesterday but forgot to take my sunglasses off  now I look a bit like a panda in negative.
0,USER i long for the day that i can tweet while on the go...  lol
0,USER ohhh gooosssshhhh lol...I saw trish yesterday...I guess I wasn't da only 1 dat missed ya nite
1,I'm off to see USER @ The Fly in a mo
1,Yay season 1 complete finally lol well time for bed. Gnight twitter bugs
0,I fear we have lost contact with our Iranian brothers  #Iranelection #Iran9
1,"liveincolor - liveincolor: yes. (: yes, i do. sheï¿½s awesome, aye? uyy. flattered. haha sobra!  Your edits... URL"
1,USER #Midomi can identify songs from humming   URL
0,Great. Rain and my poofy hair?
1,USER Thanks for the mascara input. It's appreciated.
0,USER me toooooo
0,Feels really bad for his dad
1,Had a wonderful chat with USER. He is so sweet <3
0,USER darn I won't get there in time then
0,Summer is going better
0,finally she texted me back!! me and sophie are going to laker game tomorrow! but im broke now! shit cost too much
1,URL - was bored so whatever .  . follow if ya want .  thanks . URL
1,USER Yep  Lets hangout soon man.
0,why do people insist on talking about the stupid prom. IM NOT INTERESTED. and i cant be dealing with people who cancel plans last minute!
1,"Also, the other name is a tad bit personal so I decided to change it."
1,USER your dad is a superman for pulling through! Take it easy
1,USER Thanks for the rec and one of the nicest compliments!  #followfriday
1,USER hey v! i hope all is well! San Diego misses you! come back sooon!
1,Keeping warm from less -  URL save money and the environment
0,Hayfeaver season has started
1,USER I bought the last one
0,USER I'm sorry  I wish u coulda come to orpheum. Love u!
1,USER Downloaded #dublinbus to check out the Twitter integration. Very cool!
1,damn... long shift tonight... I really should sleep but I'm not tired. Had a nice talk with Jon after work  Gotta love that boy!
1,I'm so very glad that i put my phone on silent. 18 new tweets all night.  i'm totally documenting my day. lol
1,USER have a safe flight! It was great seeing u guys  Thank you so much again
0,Is eating lunch... Alone
1,USER I'm doin' not too bad (he says 3 hours later)
1,USER phewww Mama said otherwise she take her in a heart beat
1,didn't you notice i'm always busy in Yahoo! Messenger. but i'm not really busy !.
0,USER Wish I was there... I have to work...
1,Morning  Feels weird not going to school :/ Dont know what to do today. Weather don't look great but it's supposed to be warm this weekend
1,USER is graduating high school today! Congrats sis!!
1,I love humpday
0,somebody knows where is Orlando Bloom?? he's out of the world
1,USER i'll buy tweetie for mac as soon as you give me the option to not show the dock icon
0,USER Aunnie hope u feel better...u HAVE to come
0,Cribley's in the shop (At my cousin's house) and my cello is almost gone (rental) Music is my love and it's not there  What do I do?
1,"Waiting, waiting I h8 waiting! hurry and arrive bro!"
0,I just want to see my commercial  !!!!
0,Can't let it go. She wins today
1,Still awake!  Some people are going to wake up to full inboxes in the morning. Ha!
1,"USER Adam Sandler  in 50 first dates, he was awesome."
1,"USER   hungarian , german, english, and  serbian or croatian  , how about you ??"
1,USER Hello Jonathan. hope all is good
0,Working on my class   paper
0,"i have been so domestic today, it amazed me for a split second, until i realized i forgot to start dinner"
1,jESUS+ church+ fellowship+ friends+ family+ beach +steaks + grills  = shiny happy people holding hands on a beautiful  Sunday afternoon
0,tomorrow mathematics exam
1,"Opera in the ball park with friends.  thx, isabel."
1,USER  I think our next hangout should be at a pool with snowballs in hand. Yummm.
1,USER count on it. Chat later
0,"USER I saw that. I was so glad they showed him in it, but it made me so sad! I never got to see him perform...  Not once."
1,USER does that represent a typical day @ the office
0,"URL - no iPhone OS 3.0 for UK users until at least 1700 BST, apparently"
1,"okie im new here, looks good though i must say"
1,"USER  G/F, mine was on May 22nd. I'm glad it's over.  he he he"
1,"beautiful morning, gone to billy's beach bar to enjoy a mocha latte and start the day off right!"
0,up too early. i knew the idea of sleeping late was too good to be true
0,Going to have a cat. Still not sure if it's a good idea.
0,USER yeah....you see im up. lol  and i gotta meet with the rest of the interns and my supervisor tomorrow....egh.
0,I HAVE TO FIND A NEW POWER CORD FOR MY LAPTOP TOMORROW ITS ALMOST DEAD SO I CAN BARELY POST ANYTHING ANYWHERE
1,Where's the pickle?THAT'S THE SURPRISE!
1,USER it was gloomy for one day half the day.. then it was sunny
1,gotta love those 2 am phone calls
1,"USER best way to approach a realtor ... is with an extended hand.  Get to know their market, their challenges, their biz! add VALUE!"
0,USER URL - That is a lot of people and a very small award(?) which i can't read
1,USER  daisy you are gay
0,USER it's fucked. same thing happened with a friend's sidekick. the phone is fucked. assuredly.
1,theres crickets in the pepsi center.   u guys paid to see lakers win wow
1,USER Cant wait to see it!!!
0,"USER I would have, but I'm in Austin, and I don't think they've installed the bullet train yet"
0,Omg really you feel lonely why?
0,USER so many people said they felt great the second trimester   my energy is definitely NOT coming back.
0,"He just keep s on talking, THIS IS HOW MARKETING WAS DONE 10 YEARS AGO, BUT NOT TODAY  ,I feel sorry for him"
1,"USER haha, we did  i hope you had a fabulous weekend!"
0,Having a bad end to a bad week ... Never going to be a great coder at this rate  #nevergonnamounttanuthin
1,USER omg yes dollhouse is the mutts nuts! Watch it all and we'll talk about it on tuesday  x
0,I think I'm coming down with a sore throat....   I hope not.   I need more rest and less stress.  Good night
0,Craving Pizza Rolls and Milk.  Ofc I'd be craving things we wouldn't have in the house.
0,USER Ha ha I got banned from plans when I was 18 - by myself. Even with caps I would get $800 bills. Just pre-paid for me now
1,USER Welcome to the underbelly of the web  I hear you can go faster than steam itself!
0,We went to the zoo today but I was so worn out by the time we got there I was the first one to want to leave. That NEVER happens...
1,"Sad to see Rangers win the Scottish Cup, simply the worst team to win the league and cup ever, but happy that Falkirk didn't win"
0,USER you're a whore why u didn't invite me!!!???
1,"USER I been on VO since ""Special Girl"" (Room 4 Improvement)... he's a baaaddd boy! Can't wait to hear more from him"
0,"USER can't believe i missed it   it's all of my favorite things combined in one: politics, baseball, and thad looking dumb."
1,USER  We had pancakes and almond/fruit smoothies with it.  Thanks  Mrs. P
0,"Nothing much came from these storms.  Blah!  All hype yet again.  I am such a fool, and an idiot.   I hate it."
1,USER I certainly don't miss not getting scottish bank holidays
0,really does not want to go work when its this  hot outside
0,"USER good luck at the movie awards!! wanna see it, but it's at 3 am  youuu will win!! YAAAAY D"
1,Packing to go back to college! need more suitcases  have to take the flipping bus... 4 hours on public transport...sucks
0,USER
1,is kicking butt at work today! I'm soooo looking forward to the 4 day weeks coming up soon...maybe not so much the 10 hour days though.
0,USER ur leaving us?  bye mobear
1,I like my hair when its curly.
0,gotta go shortly
0,speakin of prom.....who wants 2 take my place in the fuckin hummer il be goin in
1,USER lol I love em-have since I was a kid  Howie and Nick are my faves  What bands do u like???
0,USER wish I did... gotta work in the morning
1,"USER I'm ok I guess. talking to - biiip - right now, or..on sms. haha well, how are you?"
1,USER haha lmao indeed we are  but then im not there the two weeks after :S xXx
1,USER tried that also with no sucess! I'll ultimately find a way! Thanx
0,USER my good mornings?  i'm kidding ) love you!
0,So bored! Nothing to do tomorrow!     Not impressed!
0,USER that is the saddest thing I have ever heard
0,its 12pm and I'm fucking tired
1,USER enjoy your weekend!
1,Hit me up on myspace.  www.myspace.com/winkymcsnaggletooth
1,"just finished a text art LP, using leaves"
0,I sharded
1,USER but in 4.21 she wears the same sleeping gon she was killed in. i'm confused
0,its raining
1,I love u baby  ----------  ludajuice: Thank u for your comments tod
0,If today wasn't shit enough I just ate a mouldy roll
1,"Soooo tired today, off for a nap"
0,USER lunch was ok  and studies.. i dont understand where i mised my efforts.. wen i revise its like ye to aata hai  :S
0,Drunk people are not nearly as fun when you're sober
0,Heading back to quantico
1,"looking up bands playing belladrum, quite a few decent bands playing! off for some lunch then off out to work"
0,im sad cause i might be moving
0,"Played Left 4 Dead but my heart is with Ghostbusters (the game), which is perpetually out of stock at the video store"
0,Gotta get ready to go to work.
0,Busy day! Work till 14.30 and then deliver newspapers
1,"USER if I only could know  it's kind of quicksand, I guess"
1,USER How'd I get the reference?I'm a Burton fanatic
1,Haven't got another exam until thursdayyyy!
0,USER omg!!!! That sux!  I'm sorry. You can sleep in my twin bed with me!
0,USER LOL! I try.... and yeah the Horny Kitty and Britney Sex Tapes follow me ALL the time. Its really annoying
1,Actually had a good time and just might go next Sunday.
0,USER ugh for you.
0,i'm so bored!!!! it will rain the whole day today.... i can't wait for summer to come. rainy days makes me sad
1,Well my first time on Twitter and Zsolï¿½j turulcsirip.hu a magyar oldal  Welcome evribodi
1,sunshowers
1,"USER is what it takes, I am soooo dragging his ass up there!"
0,Is it bad that I don't like my yearbook/grad photos because they made me look old?! I feel they added 5years.
1,veronicas & lesley roy concert tonight!!!!!!
1,USER I took a few.  Am uploading them now.
1,just saw a poster of USER at Charlie's Bar on Neighbours.  How cool is that.
1,USER no quiere revivir  asi es que me voy a dormir... Good night and sweet dreams
1,USER yeah i tried it today and it worked!! take a look at my pic and tell me what you think of it
0,USER I'm hella tryin to go! Prolly won't happen tho.
0,USER I so wish I could B at the picnic.  Didn't have the money but I still get 2 see the show. Hope U R doing well.
0,Went to the #dforum festival.Very interesting.Canon *CPS cleaned Equipment.No win in the sweepstake  still saving up for that #5DmarkII
1,found her wedding dress
0,@ the desk! :-/   wish i was in NY!!!!!!
1,USER slightly. They both get worse @ nite when their heads aren't up & draining. Lily seems better w/more sleep. Thks for asking
1,USER At least you can be nice and warm inside!
1,USER I just listened to your set at #asot400. It was excellent!
1,"trendy topic - Record Store Day - just becuz a song has the word ""Lollipop"" in it, doesn't mean it's appropriate for children."
0,"USER i have been snacking on pretzels, now my mouth is dry"
0,USER  hey! I have no money for miley tickets
1,Happy Sunday works! Looking forward to a day of love & laughter (and no work) with my 4 favorite boys.
0,lovely saturday and i'm stuck in the house!!
0,says nakakapanlumo...should've printed it while I had the chance..  URL
0,"Right, enough PC. Time to go to the supermarket.. oh joy"
1,"OK - off to the pool for a days work changing the liner, etc.  I will snap a photo with my cell phone to show you the muck at the bottom"
0,is suprisingly okay. or possibly still drunk. goodbyes suck though
1,Wow beautiful sunrise in Henderson
0,"Did not go gym today. Oh well, ended up practising my vocals and I screwed my voice for not practising in so long"
1,USER A rebel...I've been wanting one for like 2 years and I finally decided I'm going to use my money up and get one
0,did I mention that today is National Doughnut Day - sorry USER   when is National Cupcake Day?
0,"USER you'll be able to claim ur name on Sunday, June 28, 2009, we're waiting too"
0,why does my dad have to be such a douche'?
1,just woked up (:   dunno what to do today besides listening to fly with me on repeat
0,USER it won't catch   URL
1,"USER hehe, you love being teased, admit it"
