0,"उपयोगकर्ता सच है, लेकिन अगर मैं इस पर मामला नहीं डालता तो मैं इसे एक सप्ताह में तोड़ दूंगा।  चिंता मत करो बीमार इसे काम करने का एक तरीका खोजें।"
1,"उपयोगकर्ता वाह, जोश ने टिप्पणी की?! हाहा, वह महिला इतनी मूर्खतापूर्ण है। मुझे खुशी है कि मैंने उसके उत्पादों की समीक्षा नहीं की। और मैंने उसे अवरुद्ध कर दिया"
0,उपयोगकर्ता दो सप्ताह! Yikes। वे हालांकि परेशान हैं
1,आज रात 22 वें एशले के लिए बाहर
0,उपयोगकर्ता aww गोवन क्या गलत है?
1,उपयोगकर्ता एक गीत लिखें !!!
0,उपयोगकर्ता यह सबसे बुरा है!  मेरा सबसे पुराना बेटा उन्हें हर समय प्राप्त करता था और वह दुखी हो जाता था।    आपके लिए बुरा लग रहा है ...
0,"ट्रैफिक रिपोर्ट का शाब्दिक रूप से 5 सेकंड बहुत देर हो गई ... ""दुर्घटना"" यातायात में 91-एन पर अटक गया।"
1,कल रात एक गुस्से में परी शूटर था ... डेफ उन्हें सलाह देता है
0,"उपयोगकर्ता मैंने किया, मुझे वास्तव में अपडेट मिला और जैसे वापस चला गया और यह वैसे भी धन्यवाद गया है धन्यवाद"
0,अनिद्रा? सो नहीं सकते और कल परीक्षा है
1,1/2 दिन कल कार्ला स्कूल के बाद आ रहा है।
1,"उपयोगकर्ता yup। मेरे अधिकांश हैक सभी मज़े के लिए हैं, यहां एक त्वरित वीडियो है जो मैंने बनाया है। जब यह किया जाता है तो मैं पालन करूंगा।  यूआरएल"
0,"थोड़े यहाँ उबाऊ हो रहा है। माँ यहाँ नहीं है, मेरे भाई भी ... दूर, दूर ... और अब मैं अपनी दादी के साथ छोड़ दिया है।"
0,जाने के लिए एक और परीक्षा! ...भूगोल।
0,उपयोगकर्ता ओह नहीं! मैं अब शाप देना चाहूंगा कि आप वास्तव में अगले साल कनाडा आने के लिए मेरे निर्णय को सुविधाजनक बनाने के लिए सब कुछ कर रहे हैं!
1,जीजी बैक एचएम nw.alisons एक बंदर।
0,आज बारिश हो रही है।
1,उपयोगकर्ता गुटेन ऐपेटिट में एक अच्छा समय है। अनानास केवल दिव्य है।
0,"उपयोगकर्ता इसे आपको निराश नहीं करने देता !!  तुम बहुत प्यारे हो! अगली बार बेहतर होगा, मुझे यकीन है।  हिम्मत मत हारो! अर्जेंटीना से Fla।"
0,मेरे चचेरे भाई के घर छोड़ने का समय। वापस होटल में। दुखी।
1,उपयोगकर्ता मेरे दोस्त महान है!
1,मेरे प्रेम गीत को पूरा करना चाहते हैं?
0,उपयोगकर्ता मुझे क्षमा करें
1,"उपयोगकर्ता lol, यह मेरा मतलब नहीं है। XD आप कह रहे थे कि आपको सहयोगियों के लिए एक और नाम की आवश्यकता है। और कैसे के बारे में '? लेकिन हमेशा हाँ!"
0,उपयोगकर्ता याद नहीं कर सकता था। हमेशा मेरा पिन भी भूल जाओ।
0,"हो सकता है, उम्मीद है, im ओवररिएक्टिंग। उस मामले में, मुझे याद दिलाया जाता है कि मैं कितनी मानवीय रूप से दोषपूर्ण हूं"
1,स्कूल फील्ड ट्रिप आज yeaaaa
1,"उपयोगकर्ता धन्यवाद, जेस!  ये रहा! मैं इसे रीट्वीट करूँगा!  यूआरएल"
1,उपयोगकर्ता को लगता है कि सिडनी छोड़ने और यहां जा रहा है! नॉर्थ कोस्ट एनएसडब्ल्यू पर कोई भी एक मार्केटिंग मैनेजर/डिजिटल विशेषज्ञ की तलाश में है?
0,"यह या तो गंभीर पीएमएस है, या वास्तव में एक द्विध्रुवी biatch है। एक बहुत गंदे मूड में im और im बेवकूफ की तरह व्यवहार किया जा रहा है"
0,"ओके ट्विप्स, फर्स्ट: ए गुड मॉर्निंग टू यल! आज आप कैसा महसूस कर रहे हैं? दूसरा: मुझे काम पर जाने की जरूरत है ... मॉर्निन की भीड़ और कोई ट्विटरिंग नहीं"
1,उपयोगकर्ता मैंने आपके लिए ऐसा किया था .. आपका कैमरा हालांकि lzzy के उद्देश्य से था।
1,उपयोगकर्ता मैं कुछ भी कम की उम्मीद नहीं करूंगा
0,भगवान मैं डरावनी फिल्मों से नफरत करता हूं
0,ट्रॉट पर 16 दिन .. बस एक झूठ बोलना चाहते हैं
1,उपयोगकर्ता धन्यवाद। मुझे लगता है कि मुझे इसकी आवश्यकता है
0,मुझे लगता है कि जब मैं बिस्तर पर गया तो उसने खुद को बीमार कर दिया और उसे लिविंग रूम में रखा
1,जो बिल्कुल याय! आपके लिए अच्छा
1,यह जून 1 है!  जिसका मतलब है कि 11 दिनों में डेविड घर आता है और 12 दिनों में दीदी स्नातक!  यह एक शानदार सप्ताहांत होने जा रहा है।
0,Gmorning twittadolls.so मुझे एहसास हो रहा है कि मैं सो नहीं सकता।
0,"नीचे लेटना, लेकिन शोटाइम पर एवीएन को देख नहीं सकते"
1,उपयोगकर्ता yayay महान समाचार
0,उपयोगकर्ता मैं अभी उठा और मैं अभी भी थक गया हूँ
1,उपयोगकर्ता आपको अब हमें बताना चाहिए !!!!  ज़ोर-ज़ोर से हंसना
1,"NKOTB कॉन्सर्ट अद्भुत था !!! लोग पूरी तरह से इसे लाया! वाह, मैं बहुत खुश था 2 सुनो जो गाना पॉप्सिकल!  मैं सलाह देता हूं कि 2 हर 1 शो !!!"
1,lmao ... ummmm कुछ भी नहीं ...
0,मैं चार साल की तरह एक खिलौने आर के लिए नहीं गया है
0,नफरत सुबह की कक्षा
0,बच्चों को काटने के दौरान घास काटने की कोशिश कर रहा है ... और बस एहसास हुआ कि ईवा लॉन घास काटने की मशीन से नफरत करता है
1,उपयोगकर्ता क्या विश्वास नहीं है ??? स्टबल खोदना? आप फिर से जाने पर दाढ़ी प्राप्त कर रहे हैं?
1,खुशी के साथ उपयोगकर्ता मैं 10 में खत्म हो जाएगा!
1,उपयोगकर्ता हैलो स्टीवन ने जोआन को बताया कि मैंने आपको पाया है।   यह जैकी यहाँ जोआन के दोस्त है।
1,"एक JazzCookbook के लिए आगामी रिकॉर्डिंग के लिए ""टॉकिंग गाय"" के साथ पूर्वाभ्यास करना। यमी!"
0,"चीजें थोड़े भद्दे हैं, लेकिन मुझे एक सीडी मिली है जो मुझे कभी भी पसंद है और इसने पूरी तरह से मेरा दिन बना दिया है!"
1,एक दिन में सिंगापुर जा रहा है!
1,"""भाइयों, हम जीवन में क्या करते हैं जो अनंत काल में गूँजता है।"" - मैक्सिमस (मैं अभी ""ग्लेडिएटर"" देख रहा हूं।)"
0,ऑनलाइन क्लास सोमवार से शुरू होती है .... बू
1,"उपयोगकर्ता का समय अपने स्वयं के बढ़ने के लिए, एह विली कि हम यहाँ क्या कर रहे हैं, हमारे किसान जड़ों पर वापस जा रहे हैं!  बेहतर भोजन और गर्व n यह!"
1,उपयोगकर्ता hehe मुझे पता है। मुझे लगता है कि यह और मेरा दूसरा पैर होगा और फिर वह मेरा बहुत कुछ है। मैं इसके लिए बहुत बूढ़ा हो रहा हूं।
1,"उपयोगकर्ता omgosh मैंने अभी फिर से बाइक चलाना शुरू कर दिया है! मज़ा, आसान और अच्छा व्यायाम"
0,: S यह ट्वीटडेक मुझे नफरत कर रहा है
1,"उपयोगकर्ता f *** *** जैसे, उपयोगकर्ता xxxxx"
1,उपयोगकर्ता hehe हाँ .. मैं एक निष्पक्ष बिट को धीमा कर दिया जब तक कि वे गलियों को नहीं बदलते थे!
0,नीचे बैठने और किराने के खरीदार के साथ एक चर्चा करने की जरूरत है और पता करें कि आज रात मैं जो एकमात्र जंक फूड पा सकता हूं वह है *ग्रेनोला बार *
1,एक अच्छा कॉफी ब्रेक और उपयोगकर्ता के साथ चैट किया था! धन्यवाद ... चलो संपर्क में रहते हैं
0,"@ घर। उह बहुत भूखा है और मैं नहीं खा सकता, क्योंकि मेरा भाई वह सब खाना खाता है"
1,आज न्यू इंग्लैंड में 90 डिग्री
0,साइलेंट हिल 2 खेलते हुए जब तक कि द शैडो ऑफ द कोलोसस की मेरी प्रति नहीं आती। नियंत्रण इस समय थोड़ा अप्राकृतिक है।
1,वाह टेलर स्विफ्ट एक भयानक आवाज है उसके गाने आर वास्तव में अच्छा है
1,मैं वापस आ गया हूं और मैं भीग गया हूं। हा! मैं बारिश को कम करता हूं
0,गोना .. मुझे शुभकामनाएँ .. मुझे इसकी आवश्यकता है haha ​​xx
1,उपयोगकर्ता मुझे बताएं कि यह कैसा था
1,"लगता है कि किसके पास एक सूजी हुई गर्दन/कंधे फिर से है ?? हम्म्म्म उन बैगों को ले जाने से होना चाहिए था। ओह ठीक है, खुशी है कि Grndpas सामान को नए घर मिल गए!"
1,मेरा भगवान पुत्र दुनिया में अपने रास्ते पर है
0,मेरे पीसी से नफरत है! मेरा ब्रांड नया सिम्स 3 अभ्यस्त 'ठीक से खेलता है
1,उपयोगकर्ता अच्छी तरह से आराम करने का दिन हमेशा अच्छा होता है
1,उपयोगकर्ता awww मैं सहमत हूँ! अपने दिन का आनंद लें
0,उपयोगकर्ता wazzup !! kya kar raha hai saale !! मुझे टीवी पर साउथपार्क देखना ... ऑडियो सभी सेंसर हैं
1,मैं अपने दोस्त गैल के साथ लक्ष्य कर रहा हूँ और फिर गुडनाइट ट्वीटी को सोने के लिए रवाना हूँ!
0,सुप्रभात हर कोई !! .... मेरा दिन एक बादल/बरसात की तरह दिखता है
1,URL - क्षमा करें उपयोगकर्ता को आपका नाम गलत मिला! यहाँ 1 है
0,जल्द ही घर छोड़ना होगा। मैं बर्लिन वापस जाने के बजाय यहां रहूंगा और अपना बीए लिखता रहूंगा।  जीवन इतना कठिन है! boohoo
0,"उपयोगकर्ता मैं इसे याद किया, स्ट्रीमिंग रोकती रहती है"
0,चॉकलेट कुकीज़ और कॉफी खाने से - एक घंटे पहले मैं वजन कम करने के बारे में था!
1,"ठीक है दोस्तों, मैं गुंबद ग्राफ्ट करने के लिए यहाँ से बाहर हूँ !! जहाँ भी आप परतें हैं प्यारे दिन है ..."
1,उपयोगकर्ता याय! और सैमुअल मोर्स 3500rpm तक पहुंच गए हैं।
1,नींद..लेकिन एक ही समय में उत्साहित कारण कल स्कूल के अंतिम सप्ताह की शुरुआत है! Yayyy !!!!
0,बाकी दिन के लिए कुछ नहीं करना है
1,मैं इंतजार नहीं कर सकता !! अच्छा ... हाँ मैं कर सकता हूँ और मैं करूँगा ... लेकिन मैं उत्साहित हूँ
1,दो सप्ताह में कॉन्सर्ट के लिए पूर्ण सेट सूची मिली।  एक प्लेलिस्ट बनाने और होमवर्क पर वापस जाने का समय।
0,अभी भी काम करने वाले कार्यालय में फंस गया है!
1,उपयोगकर्ता ठीक है अब यह धारावाहिक है ... अब मुझे बस इंटरसेप्टर को अलग करना है और इस LINFU 2.0 में एक सीरियलाइज़ेबल प्रॉक्सी होगा
0,आज रात के लिए ब्लॉग के साथ पर्याप्त गड़बड़ करना ठीक है।  इस सप्ताह बहुत सारी चीजें।  संभवतः लाइव टिल नहीं होगा ... 10 वीं या तो
0,आदमी मैं संगीत सुनना चाहता हूँ लेकिन कार में मेरे iPods
0,"गति उच्च दांव की आवश्यकता संगतता मोड पर काम नहीं करती है। लानत है कि आप एक अच्छा खेल बनाने के लिए खाते हैं, यह सच होने के लिए बहुत अच्छा है"
1,उपयोगकर्ता मुझे आपकी छोटी तस्वीर पसंद है यह प्यारा है!
1,उपयोगकर्ता जो मुझे अपनी माँ के गुलाब के बगीचे के बारे में सोचता है जब मैं एक बच्चा था। अनुस्मारक के लिए धन्यवाद मेरी इच्छा: संडे पेस सोम-शुक्र
0,काम से घर का कारण Xander की बीमार और निक्की शहर से बाहर है।
1,"उपयोगकर्ता तो मैं सोच रहा था कि आपको ""फिक्स"" को फिर से जारी करना चाहिए .... इसके बारे में कैसे?  मुझे यह पसंद आएगा। एक अद्भुत दिन है"
0,उपयोगकर्ता मुझे इसके बारे में बताओ! वर्ष का सबसे गर्म दिन। आपके साथ कैसे चीजें? अभी भी मुझे अभी तक भुना हुआ नहीं है
0,यार मुझे आशा है कि आप कल बेहतर महसूस करेंगे!
0,क्यों समझने की कोशिश कर रहा है?!
1,उपयोगकर्ता मैं खुशी के साथ रो रहा हूँ
1,भविष्यवाणी ... 5 सेट में फेडरर
1,उपयोगकर्ता ने सिर्फ अपनी साइट को बुकमार्क किया क्योंकि मुझे कहीं भी ऐसे कार्ड नहीं मिलेंगे। इस तरह की सुंदरता साझा करने के लिए धन्यवाद।
0,उपयोगकर्ता मैं चाहता हूं कि मैं आप के रूप में प्रेरित था
1,"बहुत अच्छा लग रहा है!  आज मेरे दोस्तों की शादी में जा रहे हैं, टेरीज़ और रोनी!"
0,मैं स्किन्स 3 के आखिरी कुछ एपिसोड देखने जा रहा हूँ ... यह बेहतर जल्द ही अच्छा हो गया !!
1,"उपयोगकर्ता वहाँ आप लोग जाते हैं, ily"
0,उपयोगकर्ता कल मरने वाला है .... कृपया इस आदमी को अपनी संवेदना भेजें
0,मुझे आशा है कि उपयोगकर्ता जल्द ही बेहतर महसूस करता है
0,उपयोगकर्ता यह अच्छा होगा मेरे पास एक पुराना घर है जिसमें कोई तूफान शटर नहीं है; _; मैं कुछ करना चाहता हूं
1,उपयोगकर्ता thx
1,आह मैं कमबख्त <3 उपयोगकर्ता पूरी तरह से मुझे हाई स्कूल की याद दिलाता है।  दुनिया के लिये शुभ रात्रि!
0,"उपयोगकर्ता हाँ, आम तौर पर वाईफाई भी लेकिन 3wireless मेरे पास आज रात भी परतदार है"
0,"मैं वही कर रहा हूं जो एकल लोग करते हैं ..... आइसक्रीम का एक टब खरीदने के बारे में, मिंट चॉकलेट चिप मेरे लिए कभी भी ऐसा नहीं होगा ...।"
0,यह अगले सप्ताह की शुरुआत तक नहीं हो सकता है जब तक कि मेरे घर पर मेरा एसी ठीक नहीं हो जाता!
1,मुझे भी उपयोगकर्ता !!!!  चलो बर्बाद हो जाते हैं और रात को नृत्य करते हैं! मिस यू कार्ला!
1,अपने माता -पिता के लिए कोप्पांग की ओर यात्रा के अंतिम चरण के लिए तैयार हो रहे हैं!  तब मुझे उनके किचन-टैब पर कुछ स्क्रैपिंग करनी चाहिए ...
1,BBQs कमाल के हैं
0,खांसी खांसी खांसी खांसी
0,उपयोगकर्ता हैप्पी फादर्स डे डेफ ने आपको अपने फॉलो नहीं पर आंसू नहीं करने पर आपको संदेश देने की कोशिश की
0,इसलिए मैं अपने Gmail खाते और Google Apps को मेरे फ्रीलांस गिग्स के लिए मेल की मेजबानी नहीं कर सकता? ज़बरदस्त!
0,हे देखो कि मैंने 2 अनुयायी खो दिए
0,उपयोगकर्ता वह बहुत कम है।
1,बोरी से टकराने के बारे में। डेविस कल !!! वूओ !!!! खाड़ी में/ मेरे घरों के साथ भयानक दिन आध्यात्मिक सामान [: शुभरात्रि दुनिया
0,प्रमुख मिजाज झूलता है ...
0,सिरदर्द खराब हो रहा है
1,Nimbuzz v1.2 अब Apple स्टोर में ... 1.3 जल्द ही आ रहा है
1,"मुझे लगता है कि उनके पास प्रभाव और स्कोर उपयोगकर्ता की गणना करने के लिए एक अलग एल्गोरिथ्म है, यदि आप अपने स्थान को अपडेट करते हैं तो यह भी बदलता है"
0,टूर पर जा रहे मील! XD वह अच्छी तरह से आयरलैंड नहीं आएगी
0,बस मेरी जीभ को जलाया मेरे सूप को चखना
1,उपयोगकर्ता जो एक firsttttttttt है। यहां तक ​​कि * मैंने * रात के खाने के घंटे पहले खाया था
1,बस सेलिस हाउस छोड़ दिया।
