0,"उपयोगकर्ता हां, शनिवार और रविवार को - मुझे केबल मिलती है लेकिन मैं एक बॉक्स और पुराने टीवी पर परीक्षण कर रहा था जिसे एनालॉग चैनल 7 डब्ल्यूएसवीएन बी 4 मिला"
0,मेरे सबसे बड़े बेटे का नी नंबर अभी पोस्ट में आया है। वह बड़ा हो रहा है और मुझे इससे नफरत है
0,काश मैं इस ट्विटर स्टफफ को समझता। मैंने भी Google पर देखा कि इस साइट को कैसे समझा जाए। Im एक भ्रमित और व्याकुल giirl।
1,हालांकि नए हत्यारे के पंथ 2 ट्रेलर ने मुझे कोई अंत नहीं किया है
1,BEACHHH।
1,उपयोगकर्ता यकीन है कि यह मेरा Tumblr स्क्रीन पर मेरे जीवन की तरह है।
1,चिप्स और साल्सा मम्म
1,अशर हाँ अजीब .. मुझे पता है! XD लेकिन कल यह वही था ... मैं इतनी जल्दी जाग गया! ... im अजीब XD और आज कोई आँसू ठीक नहीं है?
0,"काम पर। पूरे दिन करने के लिए कुछ भी नहीं, कोई कार्य नहीं। Lindsays अभी केवल एक ही खत्म हो रहा है ... हुर्रे !!! मैं बहुत बीमार महसूस करता हूं"
0,मुझे कल रात लड़के के साथ शराब पीना चाहिए था
1,गो गो गो एक घर पर आज सिर्फ मनोरंजन के लिए देखो! फिर हम पार्क के लिए बाहर जाने वाले हैं ... सोफिया के लिए मजेदार होना चाहिए
1,बस एक और शिविर से वापस मिल गया! याय स्कूल अगले सप्ताह में स्थानांतरित हो गया! OMG रोडट्रिप। हाहाहा मेरे लिए अधिक योजनाएं!
1,"ओह, और ""वूट"" ""दुनिया भर में ऑनलाइन ओलंपियाड प्रशिक्षण"" URL के लिए खड़ा है"
1,#BB10 E4 पर अभी लाइव फ़ीड IDIOTS URL
0,उपयोगकर्ता क्यों उदास चेहरा दोस्त?
0,सैन एंटोनियो को गुरुवार को छोड़कर। मुझे अपने मम्मी और डैडी की याद आती है
1,उपयोगकर्ता हैंगओवर से लड़ने का सबसे अच्छा तरीका अच्छी शराब है
1,उपयोगकर्ता मैं सहमत हूँ! उसे स्पष्ट रूप से जीतने का एक शानदार मौका मिला है .. मुझे लगता है कि शाहीन के पास एक अच्छा मौका है! मैं स्टावरोस फ्लैटले से प्यार करता हूँ!  : L
0,"हैप्पी उसकी डिग्री आखिरकार पोस्ट की गई। FAMU धीमा है, लेकिन मैं इसे दुनिया के लिए व्यापार नहीं करूंगा। मुझे पहाड़ी की याद आती है"
0,उपयोगकर्ता कभी -कभी मुझे लगता है कि मुझे एक नए जीवन की आवश्यकता है!
0,"ओह्ह ... तो थक गए चलो सो जाओ, कल मैं फिर से काम करता हूं"
0,भयानक की तरह लगता है = \ बेवकूफ सिरदर्द
1,"Soooooooo ... स्लीपीईईईईईईईईपी! उन Empanada के निश्चित रूप से अच्छे थे! आपको उनकी कोशिश करनी चाहिए! बिस्तर पर जाते हुए! नींद तंग, मेरे tweeps!"
1,"एडी, अगर आपका लंदन में एक गुप्त टमटम भी वहाँ भी है! उत्तर में गिग्स के बारे में ईमेल प्राप्त करना हमारे लिए यातना है"
0,"उपयोगकर्ता हमारे 30 ""गेटवे डिस्प्ले में एक महीने में वारंटी से बाहर हरी रेखाएं हैं। यह पता चला कि यह एक सामान्य दोष है कोई इलाज नहीं है"
0,"उपयोगकर्ता इसके बारे में सोच रहा है y o u r सही। ट्विटर - संक्षिप्त, मुफ्त, कहीं भी उपलब्ध है। अधिसूचना - MSG> 140, शुल्क, स्थान विशिष्ट शुल्क लिया"
1,#followmestephen कृपया !!
0,मेरा हाथ नहीं उठाया है
1,उपयोगकर्ता अपने सिर को खिड़की से बाहर चिपका दें
1,"मुझे एक लिल पिल्ला मिला है! लील ओरियन, चलो घर जाओ।"
0,"यह एक लंबा दिन है, थका हुआ है, लेकिन अभी भी काम करने के लिए थोड़ा सा है"
0,उपयोगकर्ता मैं खो गया हूँ। कृपया मुझे एक अच्छा घर खोजने में मदद करें।
1,अभी उठा। उपयोगकर्ता। मुझे सोने दो। धन्यवाद बेब।
1,उपयोगकर्ता मेरे पति ब्लूज़ और रॉयल्स और मेरे बेटे को कोल्डस्ट्रीम गार्ड में थे। यह उन्हें देखने के लिए बहुत अच्छा है
0,उपयोगकर्ता वे हाल ही में सभी के लिए कैचअप खेल रहे हैं। मैं अपने PS3 को और भी अधिक नहीं चालू करता हूं
0,बहुत खांसी
1,अशर हाँ।
1,"उपयोगकर्ता etitions: #electrik Red ""P पावर के लिए है"" BET एक्सेस दिया गया URL URL साइन साइन pls"
0,उपयोगकर्ता Skype पर आते हैं !!! मुझे अभी भी कोई प्रेरणा नहीं है
1,"उपयोगकर्ता हाय डोरियन, यह जानकर खुशी हुई कि मैं आपको उपयोगकर्ता और उपयोगकर्ता के लिए ""परिचय"" कर सकता हूं! आशा है कि सब कमाल है!"
0,"आज रात प्रशिक्षण याद कर रहा है, लर्जी मेरी छाती पर है"
1,"एक और गर्म और मग्गी दिन! आगे कोई राहत? मैं आपको 5,6 पर बताऊंगा, और 10 KGMB9 न्यूज गाइ पर 10 आज रात बंद है, और मैं वह लड़की हूं जो अंदर है"
0,तो अब मैं लैंकेस्टर नहीं जा रहा हूं और मैं गौडवो को और अधिक साफ करता हूं ताकि कौन बाहर घूमना चाहता है?
1,"जस्टिन, एरिक, और तातियाना के साथ शादी की योजना मसान-मॉम शादी के लिए"
0,"मैं मूल रूप से पूर्वी समय (6 घंटे पीछे) तक रहता था, अब मैं ऑस्ट्रेलियाई समय (9 घंटे आगे) तक रहता हूं और मैं गंभीरता से jeglagged हूं"
1,वास्तव में एक अच्छा टेक रिहर्सल था!  निक और जोएल के साथ रात के खाने के लिए
0,मुझे धूम्रपान करने की जरूरत है
0,उपयोगकर्ता खौफ ... यू शनिवार को काम करता है?
1,शुभ रात्रि
1,उपयोगकर्ता अच्छा टिप!  एक्स
1,वाह!!! माइक जोन्स आज रात शहर में है ।।
0,"ओह, मैं पेंट करना चाहता हूं, लेकिन मुझे बहुत काम करने के लिए और अच्छे कपड़े मिले हैं"
1,हिल्स सीजन 2 को देखने में बाद में काम करते हैं
1,हैप्पी 4-20। ड्रग्स मत करो।  इसके थोड़े ठंडे और मैंने अपने घर पर अपनी जैकेट छोड़ दी
1,आप जानते हैं कि यह एक अद्भुत मदर्स डे होने जा रहा है जब वैम्पायर बीटल्स ट्रेंडिंग टॉपिक <3 है
1,उपयोगकर्ता pllleeeaaassseee मुझे एक चिल्लाहट भेजें? मेरा नाम सना xoxoxo है
0,उपयोगकर्ता लानत है ... मैं वास्तव में सामान्य नहीं हूँ मैं?!
0,उपयोगकर्ता अद्भुत! मुझे जानने दो जो आप सोचते हो। प्रकाश नहीं पढ़ना
0,मैं क्यों देखता रहता हूं ... मुझे पता है कि मैंने जो पढ़ा वह चोट लगी है लेकिन मैं अभी भी देखती हूं! मुझे लगता है कि यह सिर्फ एक लड़की की बात है और मुझे उस पर चढ़ने की जरूरत है।
1,उपयोगकर्ता विशेष रूप से जब आप उन्हें गलत तरीके से भरते हैं
0,मुझे लगता है कि अभी बहुत गरीब किसी ऐसे व्यक्ति के साथ टूट रहा है जो मूल रूप से सब कुछ रखता है इसका मतलब है कि आपको सभी नए सामान खरीदने होंगे! बू
1,वास्तव में यह 3 घंटे है लेकिन जो भी हो। हाहा। यह बहुत अच्छा है अब से एक घंटे की तरह इंतजार नहीं कर सकता
0,MHM .... मैं आपकी बहुत मदद करना चाहता हूं ... लेकिन मैं सिर्फ एक सपने देखने वाला हूं।
0,"मैं सिम्स 3 प्राप्त करना चाहता हूं, लेकिन मेरे पास पर्याप्त पैसा नहीं है"
0,मेरे t'pol पर जोर देना
0,URL - मैं एक महीने के लिए अपने समुद्र तट पर रहना याद करने जा रहा हूं
1,उपयोगकर्ता काश yall यहाँ थे। हम जेन्सेन में एमबीवी और ड्रोल देख सकते थे।
1,"उपयोगकर्ता उसे thats, हम एक दुकान पर गए और वह एक बड़े पैमाने पर कुर्सी पर बैठ गया, और मूर्खतापूर्ण टोपी डाल दी !!! संकोच 14, गुड बच्चा,"
0,"उपयोगकर्ता ने आपको धिक्कार है, मैंने आपसे कहा कि #Spymaster करना बंद करें"
1,उपयोगकर्ता मेरी प्रतिलिपि मेरे लिए मेल में है ... मैं कास्टिंग के साथ ज्यादा मदद नहीं कर रहा हूं।   #20boysummer
0,मैंने जॉन और केट प्लस 8 के सीज़न पांच का पहला एपिसोड अभी देखा। कैट
0,"रात के ट्विटर्स, प्रार्थनाएं एयर फ्रांस के लिए बाहर जा रही हैं।"
1,उपयोगकर्ता क्या एक गुड़िया बच्चा ... thx 4 साझा करना
0,उपयोगकर्ता मैं यूएसए पर रहना पसंद करूंगा लेकिन दुर्भाग्य से अब तक मैं आपको एक संकेत प्राप्त कर सकता हूं
1,उपयोगकर्ता गुडनाइटटीटीटीटीटीटीटीटीटीटी! मीठी नींद आए!
0,उपयोगकर्ता मैं रिवाइंड करना चाहता हूं और फिर वहां 2 IHOP को जोड़ता हूं 2 में 2 और डी-डब से मिलना-क्या हम बसों के इंतजार में याद करते हैं
1,नई फिल्में मुझे उत्साहित करती हैं और यह तथ्य कि मुझे कुछ क्षणों के लिए टेलर को देखने को मिलता है
1,खुश है कि उसके नए थ्रेडलेस tshirts आ गए हैं! एक tshirt के लिए of £ 2.5 के साथ गलत नहीं हो सकता
1,2 कुरिन्थियों 12:10
1,"वर्तमान में मेरे कमरे पर नजर गड़ाए हुए, जो एक बार के लिए उतना ही सुव्यवस्थित है जितना कि यह हो सकता है"
0,आज कुछ नहीं करना है ...
1,आराम करने वाले योग कर रहे हैं। फिर जस्टिन के साथ फोन मैं आज एक लंबा दिन था !! मैं अब एक वेस्टलैंड हाई स्कूल के पूर्व छात्र हूँ !!  woop woop!
1,उपयोगकर्ता मुझे खुशी होगी
0,Huuh SO SO SO SO SO .. मैं सोना चाहता हूं इसलिए मैं इसे भूल सकता हूं लेकिन मुझे अध्ययन करना होगा क्योंकि कल एक कठिन परीक्षा URL है
0,इंटरनेट+टीवी+फोन डाउन। संख्यात्मक इसे ठीक करने के लिए अगले सप्ताह एक तकनीशियन भेजना चाहते हैं!
0,"उपयोगकर्ता मैं Zach स्पेंसर से प्यार करता था, वृत्ति से कैमरा आदमी। नफरत है कि उन्होंने उसे #sanctuaruessunday को मार दिया"
1,उपयोगकर्ता योग्य। आप किसे चूहे कहते हैं?
1,काश वह <3 के साथ cuddle करने के लिए एक कैटरीना बैलेरीना था
0,उपयोगकर्ता काश मैं वहाँ था <3
0,"बारिश हो रही है और मेरे पास एक कोट या ब्रॉली नहीं है, मुझे आशा है कि यह दोपहर 1 बजे से पहले साफ हो जाएगा।"
0,पोशाक मुझे वापस url रखना था
0,मैं अपने घर में अकेला हूँ
1,मुसुबी मंगलवार उपयोगकर्ता और एल
1,उपयोगकर्ता आह हाँ - लेकिन कभी -कभी आप बस वापस खड़े हो जाते हैं और गिरावट को पकड़ने के लिए इंतजार करते हैं - यह एक सच्चा दोस्त है
0,"खुशी है कि जेन और जेसन बोस्टन में मज़े कर रहे हैं! ए और लोरी, सोनिक, बेड के साथ बाइक की सवारी पर जा रहे हैं, काम कर रहे हैं, लेकिन सबसे अच्छा दोस्त के साथ!"
0,"idk यह ""वास्तव में आसान"" इको होमवर्क कैसे करें"
0,... मुझे आश्चर्य है कि क्या कॉलेज में एचएस के समान ही होगा। मुझे नहीं लगता।
0,Manchesta बाउंड ... मूर्ख। लापता हो जाएगा
1,उपयोगकर्ता इसके शीर्ष दो पहले से ही !!
0,"बीमार फिर से - बिस्तर, पायलट (एक एहसान कर रहा है), फिर स्कूल - उम्मीद है कि मुझे पता है कि जल्द ही क्या हो रहा है"
0,हुर्रे यह बैंक हॉलिडे वीकेंड है और लगता है कि कल दोपहर 1 बजे तक कौन काम कर रहा है ???
0,उपयोगकर्ता जो कोई बीनो नहीं है
1,शुभ प्रभात! बहुत सुंदर और दिन में कूदने के लिए तैयार।
0,पैनिक टाइम 3 परीक्षा ... 3 दिन ... ओह ओह
1,सुप्रभात केंटकी!
1,उपयोगकर्ता एक नई यात्रा शुरू हुई ... बधाई हो! खुशी रखने की कोशिश करें।
1,घर पर लटका हुआ है। सैम के साथ एक विस्फोट था wiiiiii
1,उपयोगकर्ता मैट कल रात निराश हो रहा था क्योंकि वह बिना किसी भाग्य के मेरे फोन पर ट्विटर को बंद करने की कोशिश कर रहा था
1,उपयोगकर्ता मैं पहले स्थान पर उसका पालन नहीं करता था!   वह अंतरिक्ष की बेकार बर्बादी है। और मैं एक रूढ़िवादी नहीं हूँ! ज़ोर-ज़ोर से हंसना
0,मैं आज के लिए तैयार नहीं हूं। आज मुझे अपने तीन सबसे करीबी दोस्तों से अलविदा कहना है और मुझे कोई सुराग नहीं है जब मैं उन्हें फिर से देखने के लिए मिलूंगा।
1,"उपयोगकर्ता हेहे, या आप अपने साथ आटा ला सकते हैं। (""मुझे क्षमा करें सर, मुझे बस इसे नीचे गिराने और इसे थोड़ा गूंधने की जरूरत है।"")"
1,"उपयोगकर्ता अरे, यदि आप मौजूद हैं, तो मुझे नौकरी चाहिए"
1,उपयोगकर्ता ने आपको NST पर जोड़ा
1,उपयोगकर्ता thts v मीठा यू
0,मुझे अपने गिटार को चहकते हुए दोस्त की याद आती है ... मेरे चाचा ... लेकिन वह एक शादी के लिए स्कॉटलैंड गए थे!  कृपया वापस आना!!!!
1,हे लोग शुक्रवार का अनुसरण करते हैं उपयोगकर्ता को दूसरों को भी करने के लिए यह भी करने के लिए plz xx
0,URL मैं भारत से एक एयरबस A330-200 द्वारा आया था। रियो से वही विमान आज लापता हो गया
1,उपयोगकर्ता hahahahah मुझे पता था
1,"उपयोगकर्ता हा !!!!! मुझे खुशी है कि आप जैसे हैं। मैं यू चीजें सिखाऊंगा, ग्रासहॉपर पेपरबैट"
1,साँस। यह एक मजेदार पार्टी थी। बहुत सारे बूढ़े और newbies के साथ कुछ डेल टैको के साथ पकड़ा गया
1,"उपयोगकर्ता हैलो, व्हाट्स अप?"
1,उपयोगकर्ता yessss nooo यहूदी n मेरे पागल परिवार को देखने के लिए इंतजार नहीं कर सकता मैं रविवार तक रह सकता हूं
1,"यह सुबह है, इसलिए मैं कॉफी पी रहा हूँ .... मैं अब खुश हूँ !!"
0,उपयोगकर्ता आज की ड्राइव बहुत कम घटनापूर्ण थी
0,"भोजन किया, नाट को सो जाएगा। हाहा, कल फिर से कर्तव्य"
0,उपयोगकर्ता aaaaaaahhh मुझे शराब चाहिए !! कल!
1,बाहर नहीं गया ... काम के बाद घर आया। बस शॉवर और मास्क कर रहा है। मुझे लगता है कि मैं आज रात जल्दी सो सकता हूँ!
0,"उपयोगकर्ता erm, मुझे लगता है कि यह लगभग 4pm हो सकता है लेकिन बहुत से लोग कह रहे हैं कि O2 पर उन्हें देखने की संभावना पतली है"
1,हाय उपयोगकर्ता! मैं अपने इलेक्ट्रो प्रोजेक्ट के संगीत का सुझाव दूंगा *** url *** मुफ्त डाउनलोड करें और मज़ेदार चीयर्स करें
1,"उपयोगकर्ता अच्छी तरह से, मुझे लगता है कि आप महान हैं!  मुझे लगता है कि आप बहुत अच्छे लगते हैं।  उन्हें नरक बंद करने के लिए कहें !!"
1,"उपयोगकर्ता आपके लिए अच्छा है, उंगलियों ने हुन को पार किया"
1,उपयोगकर्ता बेन किसने जुनून गड्ढे की समीक्षा की ??? इतने सारे अपडेट किए गए मुझे यकीन नहीं है कि आपका क्या मतलब है
