1,उपयोगकर्ता अभी तक नहीं।
0,अच्छा नहीं लग रहा है। मेरा पेट दुखी है।
1,मैं ni loca यात्रा करने से नहीं चूक जाएगा !! तो रियो सेलेस्टे जाने के लिए तैयार
1,उपयोगकर्ता मुझे एक कृपया दे
0,आज सुबह उसके पंप क्लास के बाद दर्द हो रहा है
1,"आशा है कि आप लोग अच्छे हैं, मैं हरा रहा हूं और घास मार रहा हूं ... रात"
0,मैं आज तैरना चाहता था और लेट गया ... अब लसग्ना बनाने में समय नहीं है!
0,उपयोगकर्ता नहीं!  लेकिन वह अभी भी देख सकती है कि मैं उससे क्या कहता हूं ...
0,उपयोगकर्ता और मुझे arthas आइकन मुझे खुश करने के लिए
0,"मैं वास्तव में, वास्तव में यार्ड बिक्री से नफरत करता हूं। यह 2 दिनों में दूसरा है।  मैं अपने लैपटॉप के साथ बग्स द्वारा हमला किया जा रहा हूं।"
0,उपयोगकर्ता लानत डाट wulda डोप किया गया
1,रविवार की सुबह और मुझे एहसास हुआ कि एमएसएन एंटरटेनमेंट पर कहा गया है कि यह एक फिल्म स्नोब है
1,एक और खेलना था और इस गीत के वाइब को साझा करना था। इसके बारे में कुछ जूस 'अच्छा महसूस करता है।   टा ...? यूआरएल
0,एक सिंगल लड़की बनना चाहती है कि मेरा लड़का इतना ईर्ष्या और एक कंट्रोलफ्रेक क्यों होना चाहिए ?? !!
1,यह एक महान दिन होने जा रहा है! चीजें आखिरकार दिखने लगी हैं
0,"मेरे चाचा, इवान का रविवार रात निधन हो गया। वियतनाम उसके लिए बहुत निर्दयी था। उनका जीवन कभी भी एक जैसा नहीं था।  वह आखिरकार शांति से आराम कर सकता है।"
0,"मेरे BFF को याद करें, काश मेरे पास बात करने के लिए एक बैकअप BFF होता।"
0,मैंने आज जेरबी नहीं देखा
1,लगभग 1 बजे और अभी भी उस रश प्रोजेक्ट पर काम कर रहे हैं। मजेदार थियो
0,मैं वास्तव में चाहता हूं कि मेरा कमरा साफ हो
0,उपयोगकर्ता मैं आपसे कभी नहीं सुनता! क्या आप जानते हैं कि ऐसा क्या है? बस कहो कि मैं नहीं रह सकता
0,"उपयोगकर्ता ओह बकवास, देर से जन्मदिन मुबारक हो! (मेरा पाठ नहीं भेजा)"
0,"16 पर उपयोगकर्ता ... दो बार एक बहुत लोल की तरह है। मैं समझता हूं, हालांकि, मैं 17 साल का हूं और मेरा दिल दो बार टूट गया है। यह सबसे बुरा एहसास है।"
0,उपयोगकर्ता hoooooooooooooooooooooolla! हाहा तुम कैसे हो? *-* मैं अब स्कूल जा रहा हूँ xxxxxxxxxxx
0,उपयोगकर्ता मैं एक लंचबॉक्स नहीं है
1,उपयोगकर्ता क्या मार्कर 1988 से वापस वहाँ मैं 1 साल का था
1,उपयोगकर्ता धन्यवाद आदमी। डायलन मोरन अच्छा होना चाहिए!
1,उपयोगकर्ता उपयोगकर्ता असली है ....... मैं जीवित सबूत हूं
1,उपयोगकर्ता ने बस सिस में आपके प्रदर्शन को देखा और बुलगा खाया। तुम कमाल हो।
0,बहुत खूब। इस वर्ग के लिए सिलेबस डराने वाला है। मुझे बिस्तर पर जाना है और कल सुबह पहली बात का अध्ययन करना है। मेरे लिए कोई टोकन नहीं
1,यह नहीं करना चाहता था ... लेकिन मौसम को सप्ताह के अंत तक गर्म होना चाहिए - याय!
0,"सोने के लिए जाना होगा जल्दी उठो !! और एक बार फिर मैंने आज रात ज्यादा शराब पीने का रास्ता पी लिया, मैं एक डरावना बन रहा हूँ !!!!"
0,उपयोगकर्ता मुझे लगता है कि मैं तब बिस्तर पर जा सकता हूं। उदासी।  मैं इस जल्दी बिस्तर पर कभी नहीं जाता। lol ily और गर्लज़! <3 और हमारे बेटे जेम्स। ;)
0,इस तथ्य से नफरत है कि उसे मेरे चचेरे भाई के साथ खरीदारी करने के बजाय काम करना है !!!
0,उपयोगकर्ता वे आज दोपहर बेल पर स्कूल के बाहर प्रचार कर रहे थे।   शुक्र है कि अधिक बच्चों ने आइसक्रीम वैन को चुना।
1,बगीचे में बाहर कुछ आईटी कोर्सवर्क कर रहा है। मजेदार मज़ा मज़ा! Sooo अच्छा और गर्म और धूप और loovellyyyy। आशा है कि यह tmoro के लिए अच्छा है!
1,उपयोगकर्ता हाय वहाँ श्री ग्रीटर!
0,उपयोगकर्ता मुझे लगता है कि यह मेरा हाउंडिंग था जिसने यह किया। मैं वैसे भी सोचना चाहता हूँ। मुझे यह भी लगता है कि प्रोफ़ाइल में बदलाव का नेतृत्व करता है
0,वह बड़ा समय बेकार है
1,"उपयोगकर्ता I Dunno, गैस कैप थोड़े पर Apple लोगो इसके लिए बनाता है"
0,अब और नहीं कर सकते ... मैं दुर्घटनाग्रस्त और जल रहा हूँ
1,उपयोगकर्ता ओह बहुत अच्छा! *स्नैप**स्नैप*
0,उपयोगकर्ता धन्यवाद! मैं अब उपयोगकर्ता की जाँच कर रहा हूं। नया डेस्कटॉप संस्करण मेरे मैक पर नहीं चलेगा जो 10.5 अपडेट करने के लिए बहुत पुराना है
1,उपयोगकर्ता कुछ भी नहीं बस पूर्व bf के साथ सामान स्पष्ट करने की आवश्यकता है
1,उपयोगकर्ता मुझे इस तरह से करने का विचार पसंद है।  और इस तरह के एक अच्छे दोस्त होने के लिए धन्यवाद!  मैं तुमसे प्यार करता हूं!
0,यार अब 12:21 बजे है। काम पर वापस जाना होगा।
0,उपयोगकर्ता भी अंधेरा!
0,"उपयोगकर्ता मुझे पता है, लेकिन इसे लीक करने की जरूरत है या कुछ और, यह बैंड बनाने पर था और फिर मैंने इंतजार किया और इसका इंतजार किया लेकिन नाडा"
1,मैंने आज फुटबॉल का खेल खो दिया है! मैं फिर कभी गोलकीपर नहीं खेलूंगा! मैं रक्षा में संबंधित हूं
1,"उपयोगकर्ता पर्याप्त नहीं है ... और वह आश्चर्य करता है कि मैं उसे ""बार्गेन फ्लैट्सक्रीन टीवी खरीदारी"" जाने में मदद क्यों नहीं करूंगा ..."
0,आश्चर्य है कि केवल 18 लोग मेरा पीछा क्यों कर रहे हैं
1,उपयोगकर्ता बस आपको सूचित करने के लिए कि अगले साल पोर्टलैंड ट्रेलब्लेज़र होंगे
1,"उपयोगकर्ता अच्छी तरह से, मुझे लगा कि मैं थोड़ा ताज़ा करूँगा। और आज का अवतार आज URL के लिए मेरे संगठन से मिलता -जुलता है"
0,आश्चर्य है कि बस कब बेहतर लग रही होगी? वह एक mot पर बंद है इसलिए कल कोई स्ट्रॉबेरी हिल फेस्ट नहीं है
1,बेकार बिल्ली url
1,"उपयोगकर्ता मुझे सुपर मिड बैज पसंद है, जो सितारों की तुलना में बेहतर है"
0,कुछ आराम की जरूरत है
1,लंदन के लिए मैं गुरुवार को टोरंटो के लिए goooooo..back
0,अस्वीकरण: di ako LXP सदस्य। MGA रॉयल्टी लैंग एंग पार्ट नन। मैं कोई रॉयल्टी नहीं हूँ। ईसा लमंग अकोंग हमक ना ... साइलेंट रशर ।।
1,उपयोगकर्ता धन्यवाद
0,"yessssss, कोई और अधिक स्पेनिश वर्ग अब, classe de मौत! (लॉस मर्टोस) हे, सभी बचे हुए सभी इतिहास और रसायन विज्ञान फाइनल कल"
1,मेरे सभी पूर्व प्रेमी मुझे छोड़ देते हैं
0,उपयोगकर्ता क्या यह आपके लिए भी काम करता है? मुझे हर समय मेरा प्लग करना होगा
0,उबंटू मंच नीचे है
0,आज उचित थक गया है मुँह अभी भी ट्वीट ट्वीट है!
0,"उपयोगकर्ता अरे तुम मुझे dm और मैं जवाब नहीं दे सकता, तुम पालन नहीं करते"
1,उपयोगकर्ता अपने पोस्टकार्ड दोस्तों के लिए मेरे कुछ पागल पोस्टकार्ड भेजें!  यूआरएल
0,ठीक है। MJY कर्मा इतना नहीं बढ़ रहा है।  मेरी मदद करो url
0,उपयोगकर्ता अच्छी तरह से अब मैं बहुत खास महसूस नहीं करता
1,सीनियर वॉक बस कोने के आसपास है!
0,उपयोगकर्ता आशा है कि आप बेहतर कर रहे हैं। मेरे पिताजी के चचेरे भाई उसके साथ थे। विनाशकारी। मुझे खेद है कि आपके साथ हुआ।
1,"कल सभी विंडोज 7 सेट होने के बारे में था, आज स्नो लेपर्ड के बारे में है। अब मेरे सभी एपर्चर प्लगइन्स को पुनर्स्थापित करना।"
0,उसके बिना इतना अकेला है
0,"लेकिन मैं आपको सोमवार को सुनिश्चित करने के लिए बता दूंगा, बीसीयू मेरी पीठ लगभग 2 सप्ताह के लिए तनावपूर्ण है"
1,"उपयोगकर्ता - काई के हैलो मित्र! बस देखा कि आप उपयोगकर्ता का बचाव करने वाली भीड़ में से थे, और आपको एलजे, हे से मान्यता दी!"
1,"सोम 15. जुन: मैंने अभी -अभी अपनी प्रेमिका को हवाई अड्डे पर छोड़ दिया है, लेकिन मैं पूरे दिन ईमेल का जवाब देने के लिए उपलब्ध हूं।  मुझे एक लाइन छोड़ने के लिए स्वतंत्र महसूस करें"
0,गंदगी के रूप में ऊब गया
1,"संतों के लिए yay। 11 और 0, क्लब रिकॉर्ड"
1,उपयोगकर्ता धन्यवाद दोस्त
1,मैं अपनी अंग्रेजी परियोजना पेश करने के बारे में वास्तव में आश्वस्त हूं। यह आपके विषय को वास्तव में अच्छी तरह से जानने में मदद करता है
1,"वैसे, आज होमोफोबिया के खिलाफ अंतर्राष्ट्रीय दिवस है।"
0,"अब बाहर, भले ही मैं केवल यहाँ से मिला था !!"
1,आपके चेहरे पर उपयोगकर्ता चेल्सी जीता !! & nfg अद्भुत थे वे नहीं थे?  X X
0,एक और दिन के लिए जाग गया ...... लेकिन अभी भी इतनी नींद लग रही है ..... मेरे पिताजी घर के आसपास कुछ मरम्मत की नौकरियों को करने के लिए बहुत शोर कर रहे हैं !!!!
1,उपयोगकर्ता aww thats बहुत सुंदर है आपका इतना मज़ा है .... आह याय अच्छी तरह से आशा है कि आपके पास एक भयानक समय समय लड़की <3 मिस और ...
1,उपयोगकर्ता lmao नहीं वह नहीं है!
0,"उपयोगकर्ता नहीं, कोई तस्वीर नहीं"
0,तो यह अद्भुत कहानी अंत में आ गई
0,उन्हें बहुत याद आ रही है - वे मेरे दिन के लिए यहाँ नहीं हैं
0,हे भगवान! मैंने पी रखी है! नो मोर ड्रिंक 4 मी 4 एक समय
1,कुछ भयानक वीडियो के लिए मेरी सदस्यता लें ... youtube.com/navivids!
1,उपयोगकर्ता कूल कूल। वैसे मुझे आशा है कि यह एक दिखाता है और आपका समय बर्बाद नहीं करता है।
0,आज कोई क्रिकेट के रूप में ऊब गया है
1,"आह !!! वहाँ कुछ pplz मुझे नहीं पता कि मेरे घर में खा रहा है यह थोड़े अजीब है, लेकिन अच्छी बात है कि मेरी समुराई तलवार है"
1,आज शाम को रोसलैंड बॉलरूम में तीसरी आंख अंधा देख रहा है।
0,"लगता है कि मैं शुक्रवार को घर आ सकता हूं, आखिरकार।  अभी भी काम कर रहे हैं किटियों को घर कैसे पहुंचाएं।"
0,फिर भी रागिन टू स्ट्रीटलाइट और पूरी तरह से याद है कि मैंने अपने चोको टैको को काम पर छोड़ दिया था।
0,"स्नोबोर्डिंग जाना चाहता है, लेकिन इसे बर्दाश्त नहीं कर सकता"
0,"एहसास हुआ कि मेरे फ्रिज में भोजन के लिए फिल्म का अनुपात गलत दिशा में आगे बढ़ रहा है, इसे तुरंत सही करना चाहिए!"
1,"प्रभु की स्तुति करो, मैं cfsiium जा रहा हूँ"
0,मेरी डेस्क इतनी अव्यवस्थित कैसे होती है?  मैं कसम खाता हूँ कि यह तब करता है जब मैं नहीं देख रहा हूँ ...
0,"अपने पैरों के साथ चकित, मैं अभी भी सामान्य रूप से चल सकता हूं। धावक के शरीर की तलाश करने के लिए बुकस्टोर में गए - इसकी बिक्री!"
0,मैं हमेशा रविवार को पसंद करता हूं लेकिन इस रविवार को नहीं
1,"ऐश और मैं देख रहे हैं 'क्या नहीं पहनने के लिए', फिर लेकर्स गेम .... ओह और हम सिर्फ चेहरे के मुखौटे पर डालते हैं।"
1,उपयोगकर्ता बस आशा है कि यह कुछ अच्छा करता है!  #charitytuesday
1,उपयोगकर्ता मैं दूसरे दिन एक एस्प्रेसो मार्टिनी था ... अब यह एक भयानक संयोजन था
0,गर्मियों के स्कूल के 9 दिन जाने के लिए। गह कैसे कष्टप्रद
1,अपनी यात्रा के शेष भाग को चाहने वाला उपयोगकर्ता धन्य और सफल है !! देखा समाचार कवरेज और आप के बारे में सोच रहे हैं !! अपना ध्यान रखना!!
0,"बहुत खेद है अगर किसी ने कल ट्वीट्स द्वारा बमबारी महसूस की तो कल इन अवांछित घावों की मदद करने के बारे में बहुत परवाह है, मुझे थोड़ा दूर ले जाया जाता है"
0,"गूड मॉर्निंग लोग ... सूरज बाहर है .. निश्चित रूप से अब वसंत, हमारे पास हमारा पहला वसंत ओला तूफान था, मेरी कार में अब डिम्पल हैं ।।"
1,बस स्लमडॉग करोड़पति देखा! यह सच में अच्छा हैं! अब सो रहे हैं .. इतना थक गया! XX
1,मैंने पूरे दिन व्यावहारिक रूप से अंदर ठंडा किया। वह बुरा नहीं था।
1,उपयोगकर्ता आपको उस पर प्राप्त करने की आवश्यकता है जैसे आपने दूसरी रात की थी जहां वह इसे पोस्ट करने वाला है?
1,उपयोगकर्ता हाय वहाँ ... मैं अपने ब्लॉग को फिर से बनाने की प्रक्रिया में हूं। लेकिन .... आपसे मिलकर बहुत अच्छा लगा
1,मैं डाउनलोड नहीं भूल गया और चढ़ाई !!
0,आज रात एक दोस्त के पास जाने में सब कुछ परेशानी है
0,: देखना: फाइटक्लब। ट्रुओरोमांस पहले एक असफल था = बहुत सारे रुकावटों को दिन में quiiite किया गया था। । ।
1,उपयोगकर्ता आशा है कि आप एक अद्भुत दिन कर रहे हैं ...
1,मैंने सिर्फ सलाह दी कि वास्तव में 'किसी को' पहना '
0,आधे कार्यकाल के अंतिम दिन रविवार ... मैं फिनिश SKWL पूरी तरह से 15 मई को फिर से करने के लिए सभी हवलदार को परीक्षा के लिए जाना है ... गर्मियों में ड्रेडिन परिणाम!
1,उपयोगकर्ता जो लगभग लगता है कि यह एक नई कॉमिक बुक श्रृंखला का शीर्षक हो सकता है
1,कल अब तक के सर्वश्रेष्ठ दिन की 1 साल की सालगिरह थी! याय एमसीआर !!!!
1,"उपयोगकर्ता यकीन है, क्यों नहीं !! जूड LOOOOOOOVES द लेडीज़, लोल बहुत बुरा वे एक साथ नहीं खेल सकते"
0,थाईलैंड के एक सहकर्मी के साथ मैंने कई बार काम किया है और कल रात कैंसर से पीड़ित है। ट्रेन पर रोना।
1,"वर्तमान में 4 वीं बार ""रेडियोहेड: इन द बेसमेंट"" देखना, एक पॉप्सिकल खाना, मेरे पिल्ला के साथ कडलिंग, और चित्र अपलोड करना। वाह!"
1,सिरदर्द मर रहा है
0,-.- मन्नो विल आच
1,उपयोगकर्ता आप सुनिश्चित कर सकते हैं! वाना बेबीसिट ब्रैडेन? हे ... मैं बस उम्मीद कर रहा हूं कि उसके पास एक विस्फोट होगा। उन्होंने लिटिल लीग में दोस्तों की एक बहुत बनाई है।
1,आज अध्ययन करने जा रहे हैं !!! लेकिन बेशक दोपहर के भोजन के बाद
1,"उपयोगकर्ता वह किसी भी तरह से स्केटिंग में महान नहीं है, वह सिर्फ मेरे पुराने चर्च में एक स्केट पार्क चलाता है"
