1,उपयोगकर्ता www.tweeterfollow.com का उपयोग करके एक दिन में 100 अनुयायी प्राप्त करते हैं
1,रात 9 बजे स्टार फिल्मों पर 27 कपड़े देखेंगे।
1,"गुड मॉर्निंग फिलीपींस, हैलो वर्ल्ड और सभी जानवरों को हाय ..."
0,"बहुत बुरा, वह बीमार है और कोई और नहीं है जो मुझे बता सकता है"
1,उपयोगकर्ता नकारात्मक नहीं है - ईमानदारी ठीक है!  आशा है कि आपके MODPP को सुरक्षित रूप से घर मिलेगा
1,30 मिनट से कम समय में वाह 12 अनुयायी! ट्विटरगेटर चट्टानें!  आपको यह कोशिश करनी चाहिए! -> url
1,क्या आपको नई शैली पसंद है?
1,"उपयोगकर्ता मीठा। आप समय का नाम देते हैं, क्योंकि मैं कभी भी दिखा सकता हूं।"
0,"उपयोगकर्ता चॉकलेट। जब से मैंने इन-एन-आउट बर्गर का आनंद लिया है, तब से यह वर्षों हो गया है!"
0,"उपयोगकर्ता मैं इसे भी देखना चाहता हूं, लेकिन वे पूरे समय सीजन 3 को फिर से देखें"
1,उस तीन घंटे की रात की नींद मेरे साथ पकड़ रही है। लेकिन देर से होने के कारण काफी सार्थक थे।
1,उपयोगकर्ता हाँ .... लेकिन हम अभी भी अपनी उंगलियों को और अधिक कनाडाई तिथियों के लिए पार कर रहे हैं जो जोड़ने के लिए *संकेत ... ओटावा *
0,उपयोगकर्ता aww सॉरी बू! काश मैं भी जा सकता था .. लंगड़ा होने के लिए
0,मेरे दोपहर के भोजन ने मुझे सबसे खराब पेट में दर्द दिया। मुझे लहसुन से नफरत है
1,"उपयोगकर्ता मुझे नहीं पता, उपयोगकर्ता मुझे निर्देश दे रहा है"
1,"रात ट्विटर, सुबह आपको पाठ"
0,"हाय सब, अधिकांश डेवोन, बुरे समय में कोई O2 सिग्नल के रूप में स्पर्श से बाहर हो गया! हालांकि, मौसम और कुटीर भयानक, अच्छा समय! घर tommorow"
0,"उपयोगकर्ता यह बहुत तनाव था, हालांकि, इसके साथ और दो बड़े परिवारों का समर्थन करते हुए उन्होंने कभी धूम्रपान नहीं छोड़ा और 51 में फेफड़े के कैंसर से मृत्यु हो गई।"
0,उपयोगकर्ता सॉरी स्काइप अभी?
1,मेरी बहन लगभग कुछ भी करने में सक्षम है
1,"कल रात JDCC का एक अच्छा सत्र था क्योंकि मैं एक सप्ताह देर से UG पर जा रहा था क्योंकि मैंने कैलेंडर को borked किया था .. JDCC = JD, कोक n कोड"
0,"उपयोगकर्ता एक धारणा नहीं है .. वास्तव में एक अच्छा अनुमान है, लेकिन यह ट्विटर पर एक काँव नहीं है .. थोड़े चारा .."
1,"मैं Disneys सिंड्रेला देख रहा हूं, मुझे अपनी खुशी का आनंद मिलता है"
0,उपयोगकर्ता क्या गलत है?
0,गंभीर पीठ दर्द हो रहा है
0,उपयोगकर्ता क्या समय? Roxy एक नीलामी til भगवान को जानता है कि आज रात कब
1,"कर्टिस पीपुल्स, ब्रायन ग्रीनबर्ग और ग्राहम कोल्टन द्वारा लाइव ध्वनिक को सुनकर ""अक्रॉस द स्ट्रीट"" पर"
0,उपयोगकर्ता क्या गलत है ??
1,"""क्या कोई मेरी कहानी सुनने के लिए वहाँ है? एक लड़की के बारे में जो रहने के लिए आई थी?"""
1,"रात, सब! और अगर आप आज रात वाह में उपयोगकर्ता से मिलते हैं, तो मुझे आप पर दया आती है। मुझे पता है कि वह पहले से क्या कर रही थी।"
0,"उपयोगकर्ता क्या हुआ? बुरे लोगों की बात नहीं, आप कमाल के हैं"
0,"मुझे वास्तव में न्यूपोर्ट में LostProphets देखने की जरूरत है, लेकिन किसी के साथ जाने के लिए कोई नहीं है"
0,उपयोगकर्ता क्या बिल्ली आप बीटल का रस देखते हैं?!?! मैं इसे मैड लॉन्ग के लिए देख रहा हूं।
1,"उपयोगकर्ता आह, आप इसके लायक हैं।"
1,ई ग्रेजुएट को नमस्ते कहो।  मैं अपने 1 ए! हाहा।
1,"उपयोगकर्ता यह बहुत अच्छा था! .. कुछ भी नहीं पागल, बस सामान्य राहेल पागल बकवास हे"
1,* yawwwwwwwn* सुप्रभात!
0,बस iPhone 3.0 डाउनलोड किया गया है और विशेष रूप से ईमेल खोज के बारे में समझदार हूँ !!   वॉयस डायलिंग के बारे में क्या ... वह कहाँ है?
0,जो मुझे हंसाता है और रोता है वह भी अंदर चिल्लाता है! !लानत है ..
1,"धन्यवाद girly !!! मेरी माँ ने वादा किया कि अगर मैं पूरी बात जीतूंगी, तो वह मुझे नए टेनिस कपड़े खरीदेंगी, इसलिए अभी टेनिस जगह पर खरीदारी करें"
0,"उपयोगकर्ता, आप हमारी उम्र के अंतर को भूल गए। मूर्ख।"
1,"बहुत धन्यवाद का उपयोग करें, कैंटेस!"
1,शर्म आती है कि मैं कंप्यूटर को बाहर नहीं ले जा सकता हूं और प्रशिक्षण को बाहर कर सकता हूं।
1,वू हर कोई #hoppusday मनाता है
1,उपयोगकर्ता OOO!  मुझे वह विचार पसंद है। अगर मैं आता हूं तो क्या आप मुझे कॉकटेल बना देंगे?
0,उपयोगकर्ता मुझे लगता है कि फटे हुए होंठ नाक की तुलना में अधिक परेशान थे
0,"उपयोगकर्ता मुझे आशा है कि यह वास्तव में यहां बारिश होगी। यह बहुत गर्म है। जब इसकी ठंड, यह वास्तव में ठंडा है, जब इसकी गर्म .. मनीला की तरह लेकिन बदतर"
0,समय के बारे में उपयोगकर्ता; माइस्पेस बहुत उबाऊ है
1,हैप्पी है।  मेरे चेहरे पर बड़ी ओले मुस्कान। ;) <3
0,"मैं काम नहीं करना चाहता, लेकिन मुझे करना है"
1,उपयोगकर्ता url - बहुत बढ़िया
0,URL - यह मेरा लॉन्ड्री है जो 24 घंटे से बाहर लटका हुआ है।
1,LOL @ खुद को मुझे गैस करने की अनुमति देने के लिए ... मैं उस वर्ष के किसी भी दिन की तारीफ करूँगा!
1,उपयोगकर्ता हम झींगा और साइड पर खट्टा रोटी के साथ लीक की भाषा कर रहे हैं। यह स्वादिष्ट पकाने और स्वाद लेने के लिए सुपर आसान है
1,आपको फिर से सिम उपयोगकर्ता देखकर अच्छा लगा
0,इसका कारण मैं नवीनतम अखाड़ा पत्रिका नहीं ढूंढ सकता क्योंकि यह मंदी के कारण मुड़ा हुआ है। Grrrrr। GQ/FHM जीवित है? कोई न्याय नहीं।
0,"उपयोगकर्ता मुझे लगा कि मैं एकमात्र व्यक्ति था जो तैर ​​नहीं सकता था। ज़ोर-ज़ोर से हंसना। मैं या तो इसे फुक नहीं कर सकता, कम से कम मैं संगीत और नृत्य खेल सकता था।"
0,"Yay को आखिरकार एक नया कंप्यूटर मिला, लेकिन इसका विस्टा और इसका पेशाब मुझे हाहा से मिला।  कोई भी लिटिल बेकी को सुनता है"
1,उपयोगकर्ता आओ मुझे नाश्ता करें ... के-थैंक्स
1,"उपयोगकर्ता OOC: उन चीजों का उल्लेख किया गया है जो किताबों में थीं, जैसे कि एरिका की कलात्मक प्रतिभाओं की कमी।"
0,मेरे दांत काले हैं
0,"उपयोगकर्ता ने कहा! प्रतियोगिता से गायब होने जा रहे हैं, क्योंकि मैं अगले सप्ताह इंटरनेट एक्सेस के बिना एक फील्ड ट्रिप पर दूर हूं"
0,"उपयोगकर्ता कि लड़कों के होने का 1 आनंद है-वे मेरे सामान में नहीं आते हैं-लेकिन फिर से, वे भी उत्साहित नहीं होते हैं 2 नए उत्पादों की कोशिश करते हैं"
1,सुंदर स्थानों के लिए उपयोगकर्ता धन्यवाद #fukduk.tv ch.15 घोषणा।
0,उपयोगकर्ता मुझे नहीं लगा कि यह होगा लेकिन यह किया।
1,"अच्छे दोस्त ...... अच्छी बातचीत ...... अच्छा समय!  आज रात, मैं चिलक्सिन हूं। '"
1,अच्छा दिन लेकिन मैं अपनी बहन उपयोगकर्ता को याद किया!
1,Rachaels पार्टी में जा रहे हैं!
1,हन्ना मोंटाना सीज़न 3 को फिर से देखना।
1,मूत कहते हैं!  मैं पहले से ही मनीला URL में हूँ
1,वाह। स्लीपओवर।  केवल इसलिए कि यह आसान है और हमारे पास कल रात एम्मा की बात है।  वाह।
1,अपने जन्मदिन पर मैंने खुद को एक नया ट्रिपल पूरा करने का उपहार देने का फैसला किया। बहुत अच्छा लगता है
0,उपयोगकर्ता ने जो भी छोड़ दिया था! इससे पहले आपके और उपयोगकर्ता के साथ छोड़ दिया उपयोगकर्ता को लगता है कि इससे पहले
1,दोस्तों के साथ लटका हुआ है
0,यह उबल रहा है! मुझे यह पसंद नहीं है
0,उपयोगकर्ता लिंक URL में घातक त्रुटि है
0,"उपयोगकर्ता वहाँ हमेशा शराब, बड़ा आदमी है।"
0,उपयोगकर्ता doh! यह हटा दिया गया!
0,थोड़ी देर के लिए नया सेल नहीं
1,मैं आज के मौसम को बोतल करना चाहता हूं और इसे 26 जुलाई (ब्रिकयार्ड 400 दिन) के लिए फाइल पर रखना चाहता हूं .. बस सुंदर !! स्पष्ट नीला आकाश और 65 !!
1,"उपयोगकर्ता सेवानिवृत्ति स्वर्ग = द्वीप सूर्य, झूला, और कैबाना लड़का ... सटीक स्थान टीबीडी।  आपको कामयाबी मिले!"
1,"एक हीरो मैराथन है, एपिसोड 11 से शुरू हो रहा है, जहां मैंने कुछ हफ्तों पहले छोड़ दिया था"
1,"ठीक है मुझे खाने का मन है: चॉकलेट कवर स्ट्रॉबेरी, घुंघराले फ्राइज़ और पेप पिज्जा लेकिन ...... यह लोल होने वाला नहीं है"
0,बस कुछ जले हुए टोस्टीज़
0,यह समझ में नहीं आ रहा है कि लड़कों के पास हर रात मंदी क्यों है।  वे सिर्फ दिनचर्या के साथ नहीं मिलेंगे।  मुझे और कुछ नहीं सुझ रहा।
1,"उपयोगकर्ता अच्छी तरह से मुझे उम्मीद नहीं है। 12 वें ग्रेडर की अंतिम परीक्षा होती है, इसलिए जब वे उन्हें ले जा रहे हैं, तो हमें स्कूल जाने की ज़रूरत नहीं है।"
0,उपयोगकर्ता मैंने आपको बताया था कि मैं अकेले इंतजार कर रहा था और बीयर पी रहा था और बीईई की कामना करता था यहाँ आपका फ्लू बेहतर हो रहा था?
1,सिर्फ 3 बिक्री मारो .. मेरी खोज? सभी मोमबत्तियाँ और मोमबत्ती से संबंधित। कौन!
0,ïber बीमार काम में सिर के लिए ताकत बनाने की कोशिश कर रहा है ...।
1,#MRTWEET मैं उपयोगकर्ता की सलाह देता हूं क्योंकि परतदार क्रस्ट के लिए है।
0,"x उपयोगकर्ता क्षमा करें, लेकिन इसके पत्र का आकार मुझे आशा है कि यह आपके दिन को बर्बाद नहीं करता है। उनके पास एक पीसी पर एक अच्छा सौदा था इसलिए माँ को एक देर से बी-डे वर्तमान हो जाता है"
0,उघ !! मुझे बीमार होने से नफरत है
0,उपयोगकर्ता कोई ट्विटरिंग नहीं है कि क्या हो रहा है
1,#kevinjonas सबसे अच्छा है!  हैप्पी #kevinjonas Day!
0,उपयोगकर्ता हे कूल डॉग। ट्विटर पर im। खोने के लिए कोई और वोट नहीं
0,उपयोगकर्ता मैं चाहता हूं कि मैं AP HWK कर सकता
0,क्या यह अभी तक 10 है ??
0,"उपयोगकर्ता मैं केवल एक बार मेरे कान सिरिंज था और मैं इसे प्यार करता था। फिर पिछली बार मैंने इस तेल का इस्तेमाल किया था, सिरिंज के लिए गया था और नर्स ने स्पष्ट कहा था"
0,"उपयोगकर्ता स्वादिष्ट लगता है !!! शिकागो में बारिश हो रही है, इसलिए कोई ग्रिलिंग नहीं।"
0,"हे कीथ आपको ऑस्ट्रेलिया में देखने के लिए इंतजार नहीं कर सकता, लेकिन एसए के लिए नहीं आ रहा है ??"
0,मसालेदार कोरियाई बीबीक्यू + बीयर = पीएस अब पूपिंग।
1,//surveys.polldaddy.com/s/f3c8bb4dac58d58a/ - स्कूलों में 1: 1 लैपटॉप के एडू -व्रू प्राप्त करने के लिए पोल - उन लोगों के लिए धन्यवाद जिन्होंने जवाब दिया है
0,उपयोगकर्ता bpgcm qbsdmup ptaj यह पता लगाओ
1,"मुझे आशा है कि सभी के पास एक धन्य दिन है! भगवान का आशीर्वाद, भगवान अच्छा है! जब आप कर सकते हैं तो उसे धन्यवाद।"
0,उपयोगकर्ता मुझे कैडबरी की याद आती है
0,वाह उनकी कोई पैनकेक मिश्रण नहीं है
1,"Heeey peoples, मैं अब स्कूल से वापस आया"
0,उपयोगकर्ता uggggggh इस suckkks tay। im सोर्री
1,"उपयोगकर्ता यह जून तक नहीं है और Avebury, Wiltshire में होगा"
0,उपयोगकर्ता ओआईसी ... दोपहर के बीच में स्मैक बैंग क्या आपको समय में कोई विकल्प मिलता है?
1,"उपयोगकर्ता हां और हां! और पूरे ""मिशन"" बात (मेरा मतलब फिल्म है)"
1,उपयोगकर्ता यह सिर्फ काम करता है यदि आपके पास सही हार्डवेयर है या थोड़ा शोध करना है।
1,उपयोगकर्ता सड़क घर की तरह दिखता है
1,उपयोगकर्ता बोनजोर मेल्लीबो ने क्या आपको अभी तक कोई हस्तियां मिल गई हैं?
1,उपयोगकर्ता को गर्मियों से प्यार होगा
0,अशर हाँ। यहां तक ​​कि जो शर्ट मैं पहन रहा हूं वह है .. मुझे मारना।
1,आज रात क्या अच्छा है !! चलो इसे अच्छा बनाते हैं! चिल्लाई
1,उपयोगकर्ता के लिए बड़ा दिन - बड़ा बड़ा दिन ... अचानक बड़े पैमाने पर शिकागो देरी के रूप में ज्यादा चोट नहीं है
1,डीसी मौसम बदबू ... लेकिन यह शुक्रवार है! तो यह सब अच्छा है।
0,"जब से मैं उपयोगकर्ता की सुनवाई से तंग आ गया, तब से संगीत सुनना; पी मैंने डरपोक होने और सभ्य हेडफ़ोन को बैग करने की कोशिश की। मुझे लगता है कि मैं असफल रहा"
1,Dekho nashe mein..sara jahan hai ... kitni hassin mulakat hai ... betabi chahiy hothon mein aai..dil mein chupe jo baat hai..bahaaon mein ~ `` `
1,"उपयोगकर्ता शब्द। मैं आपको मध्य सप्ताह कहूंगा। या बेहतर अभी तक, जब आप तूफान गुजरते हैं तो आप मुझे फोन करते हैं"
1,"सुप्रभात मेरे tweeple !!!!!!! यदि आप ऊपर हैं, तो मुझे मारो !!!!!"
0,आज बहुत अच्छा नहीं लग रहा है
1,मैं फिर से चाहता हूं।
0,ठीक है मैं कल जाहिरा तौर पर स्टेपल के लिए बाहर जा रहा हूँ ...
1,बस तेजी से और उग्र फिल्म देखी! 2 लव फास्ट कारें मिलीं ... वाट यू ऑल? मांसपेशी बनाम आयात?
0,उपयोगकर्ता ओह नहीं यह भयानक है
1,उपयोगकर्ता बुकशेल्फ़। मैं इसे खरीदा। मेरे पास एक किताब की लत है। हे एक दोस्त से मिलते हुए @ एक बार अब। मुझे एक पेय और भोजन चाहिए।  खुशी 2
1,उपयोगकर्ता OOC: BYE!
0,उपयोगकर्ता IDK। मुझे लगता है कि मैं आपको पहले से ही याद करता हूं।
1,रोड ब्लॉक्स के माध्यम से स्मैश करने के लिए तैयार यह करने देता है!
0,"उपयोगकर्ता AAH, मैं आज से प्यार करता हूँ, लेकिन आज एक बारिश 4 NXT सप्ताह के बारे में कैसे?"
1,उपयोगकर्ता awwww ... इतना मीठा मैं puke puke।
0,उन कष्टप्रद स्पैम संदेशों के लिए क्षमा करें- बस मेरा पासवर्ड बदल दिया और उम्मीद है कि यह उनसे छुटकारा पाएगा !!!
1,हैरी पॉटर #wordcamp
1,उपयोगकर्ता उपयोगकर्ता रात मैं वास्तव में छोड़ने की कोशिश कर रहा हूँ
0,Dyinggg ..... मैं घर जाना चाहता हूँ!
1,मुझे पसंद है जब एक अच्छा दिन बेहतर नोटों पर समाप्त होता है।  शुभ रात्रि।
