1,उपयोगकर्ता अच्छी तरह से योग्य है। आपकी तस्वीरें प्यारी और सता रही हैं। मैं निश्चित रूप से एक किताब उठाऊंगा! क्या आप फोटो केक रॉकस्टार हैं?
1,"उपयोगकर्ता धन्यवाद, मैम! मैं हमेशा उसके बारे में सोचता था।   मैं अभी भी यहाँ पर नाश्ता खत्म कर रहा हूँ और कागज पढ़ रहा हूँ ..."
0,"माँ ने कहा कि हमने ड्रेसेज में बहुत अच्छा किया, लेकिन फिर उसे स्कोर मिला और कहा कि हमारे पास काम करने के लिए कुछ 'चीजें' हैं। लेकिन मैं बहुत अच्छा था!"
1,उपयोगकर्ता वास्तव में हरे XO
1,उपयोगकर्ता इसे रोकना ... आप मुझे rofl बना रहे हैं
1,#familyforce5 #danceordiewithavengence 19 मई को जाओ
1,मेरी छोटी लड़की के साथ घर पर चिल करना। इस पर पहला उचित समय तो बस इसे लटकाने और कुछ पीपीएल जोड़ने के लिए।
0,"बीके घर अब अपने खत्म हो गया !! NXT एक के लिए बचत पहले से ही !!!! Lenty 2tell, लेकिन नींद की नींद! एक्स"
1,"आप जानते हैं, सच्चे दोस्त पृथ्वी के अंत में जाएंगे, उन्हें उन चीजों की आवश्यकता है जो आपको चाहिए। आपको क्या लगता है कि 'मुक्केबाज़ी? मैं वास्तव में जानना चाहता था।"
0,नॉर्थ वेस्ट और यॉर्कशायर/हम्बर के आंकड़े और अफवाहें मुझे मैनचेस्टर में ग्रीन्स के मतदान को देखने के लिए अच्छा बना रही हैं।
1,उपयोगकर्ता ओह मैं लव नुटेला और कुरकुरे मूंगफली का मक्खन टोस्टेड ब्रेड पर!
0,पूरे दिन घर पर रहे। मैं आइसक्रीम के लिए तरस रहा हूं।
0,आप एक ऐसे रिश्तेदार के साथ क्या करते हैं जो सोचता है कि दुनिया उनके चारों ओर घूमती है?
0,बारिश हो रही है
0,मुझे एक आलसी दिन चाहिए
0,उपयोगकर्ता मैं अपने बेवकूफ अंक नहीं चाहता हूँ ....... â¬_â of ठीक है मैं जुरासिक पार्क हालांकि बेहतर है
1,"शिकागो से कल रात घर गया। घर 4 24 बजे से कम। फिर 2 ट्रैक टाउन, यूएसए 4 प्री क्लासिक।  मेरे बच्चों के साथ 2 दिन बिताएं!   #FB"
1,उपयोगकर्ता ने आपको चुप करा दिया। ज़ोर-ज़ोर से हंसना। मैं एक कार्यालय में काम करने वाला हूं। फोन और कागजी कार्रवाई की बकवास।
0,"उपयोगकर्ता मैं इसे जीके के माध्यम से प्री-ऑर्डर करना चाहता हूं, लेकिन मैं यह तय नहीं कर सकता कि मुझे कौन सी शर्ट चाहिए।"
0,"रसोई की एक अलमारियाँ में से एक को साफ करने में, मैं उन सुइयों में भाग गया, जिन्हें मैंने पोपो इंजेक्शन देने से रोक दिया था।"
1,एरिक हेस ड्राइविंग लोल के साथ फिल्मों के लिए मेरे रास्ते पर
1,"बस बिस्तर से बाहर निकलने की कोशिश की, लेकिन सभी चक्कर आ गए, इसलिए मैंने बेड स्लीपि टाइम में मेरे लिए बेक को समाप्त कर दिया है"
0,"कल रात के बारे में 14 घंटे सोए थे। एक सिरदर्द हमारे ऊपर एक पार्टी थी, वे बंद @ 2: 30 ए, कोई परेशान नहीं।"
1,यह: मेरी पहली यात्रा के बाद घंटों!
0,एक माइग्रेन के साथ जाग गया ......
1,उपयोगकर्ता पागल कौशल यो
0,"उपयोगकर्ता हे जेमी, आपका ट्यूटोरियल (URL बहुत मीठा है। किसी भी विचार को लाइटबॉक्स के साथ काम करने के लिए कैसे पता चलता है? मेरे लिए काम नहीं करना चाहिए!"
0,"मेरी बेटी को दांतों को परेशान करने की कोशिश कर रहा है, लेकिन वह यह नहीं कर रहा है।"
0,"उपयोगकर्ता क्षमा करें, मुझे आपको और उपयोगकर्ता को देखने को नहीं मिला"
1,कार्यालय छोड़कर ... अंत में ... सैंटोस लता
1,उपयोगकर्ता मैं देख सकता हूं कि वे इतनी अच्छी तरह से क्यों पसंद कर रहे हैं
1,उपयोगकर्ता मैं यह भी नहीं जानना चाहता कि गंध क्या है।  मैं वहाँ जाने के लिए पर्याप्त बहादुर नहीं हूँ .....
0,हम्म आधी रात के युवा सिर्फ रस पर थे।
0,लीसेस्टरशायर लंकाशायर द्वारा अंकित हो गया!  यह हमारे लिए एक गर्मी का एक लंबा नारा है!
1,उपयोगकर्ता मैं तुमसे ज्यादा प्यार करता हूँ जितना मैं तुम्हें प्यार करता हूँ तुम बहुत याद आती है !!
0,"मैं बहुत हंग्वी हूँ, .... लेकिन भोजन मुझसे बहुत दूर है ..."
0,"उपयोगकर्ता मैं 7 पर नहीं जा सकता, इसलिए हम इसे 9 पर देखने जा रहे हैं।"
0,मुसीबत में आने के मूड में नहीं
0,"दर्शन के लिए बहुत सारी महान साइट मिली, फिर भी मैं अब बहुत उलझन में हूँ"
0,उपयोगकर्ता जबकि उन्होंने वर्ष की किताब का आदेश दिया था?  मुझे वास्तव में समझ नहीं आ रहा है कि ऐसी गलती कैसे हो सकती थी।
1,"उपयोगकर्ता शीर्षक, दोस्त पर क्लिक करें। आप क्या होता है पर चकित हो जाएंगे"
1,उपयोगकर्ता haha ​​बहुत बढ़िया यह बहुत अच्छा लगता है!
0,@ travellinda अच्छी तरह से हमारे पास कोई सूरज नहीं है बस बारिश है इसलिए आपके पास इस समय के लिए थोड़ा आनंद लें।
0,मेरी छवियों में से 2 को शटरबग फोटो COMP के लिए इस वर्ष के असेंबल के लिए चुना गया था (हालांकि फाइनल नहीं बनाया)
1,"उपयोगकर्ता ओह प्यारा !!! क्या अच्छे पुराने दिनों में वापस देखने के लिए मजेदार नहीं है पी.एस. हाँ, मैं चाहूँगा! BTF = सर्वश्रेष्ठ ट्विटर मित्र"
1,Url हाय! क्या हम दोस्त बन सकते हैं? (या अधिक उम्मीद हो सकती है कि हम एक दूसरे से मेल खाएंगे। मैं आपको अपनी निजी पिक्स भेज सकता हूं। भेजें ...
1,मेरे प्राइमोस हाउस में
1,उपयोगकर्ता मैं आम तौर पर अपने सभी अनाज मिलाता हूं। इस तरह मैं नए स्वाद बना सकता हूं।
1,Im गिटार बजाना
1,मेरे पिताजी ने एक बहुत ही स्वादिष्ट पकाया! स्वादिष्ट!!
0,"उपयोगकर्ता इसका आनंद लें! हर बार जब मैं ""काम के साथ"" रहा हूं तो मेरा दिल निश्चित रूप से बाध्य नहीं हुआ है और मैंने देश का अनुभव नहीं किया है"
0,"उपयोगकर्ता उपयोगकर्ता, उपयोगकर्ता, मुझे बहुत जलन हो"
1,मैं बिल्कुल ट्रैक्टरों से नफरत करता हूं जो मुझे 40 मील प्रति घंटे के नीचे ड्राइव करने का कारण बनता है। लेकिन इसके अलावा मैं एक अच्छे मूड में हूं
1,कुछ नए अनुयायी हैं! मुझे फॉलो करने के लिए धन्यवाद।
0,"मेरी कार एक सप्ताह से अधिक समय से गैरेज में है, यह मुझे नट नहीं कर रहा है"
1,यह 1 बजे है और मेरे पास 7-4 से काम है। मेरे सिर के साथ चिकन की तरह दो घंटे के चारों ओर भागना। 6-11 से शो के बाद। वू !!
0,म्यां हमेशा के लिए है। मैं आप लोगों को याद करूँगा
0,"मॉर्निंग दोस्तों, जल्दी उठ गया था इसलिए देखें कि क्या हमारा घोड़ा आज दौड़ रहा था, लेकिन उसे एक चोट लग गई है, इसलिए बुधवार को टिप टिप करने के लिए मिला है"
0,उपयोगकर्ता मिचेल मूसो कल वहां अपनी एल्बम रिलीज का जश्न मना रहे थे और सितारों का एक गुच्छा था। मैनें इसे खो दिया!!
0,"उपयोगकर्ता ओह चुप रहो! तुम बेहतर आकार में हो तो मुझे! मैं जा रहा हूँ, लेकिन मेरे पास कमरे और पार्टी के लिए पिच करने के लिए पर्याप्त $ नहीं है"
1,बिना किसी कारण के गदगद
0,"एक साइट्बर कैफे में, उन्हें लगभग 30 पीसी मिले और उनके सभी डिफ़ॉल्ट ब्राउज़र IE6 है"
0,"यदि आप आज मेरी जीप से मेरी बतख चुरा लेते हैं, तो कृपया इसे वापस करें"
0,उपयोगकर्ता को एहसास नहीं था कि आप अपने फोन पर थे। मुझे यह नहीं मिला।
0,उपयोगकर्ता ये !! उन्हें यहां बहुत सारे प्रशंसक मिले और हम हमेशा उन्हें बताते हैं कि !!! यह उचित नहीं है कि हमारे पास यहां कोई संगीत कार्यक्रम नहीं है !!!
1,उपयोगकर्ता उपयोगकर्ता टिप के लिए धन्यवाद। इस सप्ताह के अंत में इसे देखेंगे।
1,इतनी ठंड। बिस्तर में वाना कर्ल। मेरे सबसे अच्छे दोस्त को जन्मदिन की शुभकामनाएं
0,"उपयोगकर्ता और उपयोगकर्ता क्षमा करें, मैं आप लोगों को निराश करता हूं।"
0,सेलेना के लिए उपयोगकर्ता टेलर बहुत अच्छा है!  grr। मुझे नहीं पता कि क्या मैं ईर्ष्या का यह कारण कह रहा हूं)))
0,मेरी सभी पुस्तकों पर जा रहा है। कल स्कूल के लिए तैयार हो रहा है
0,उपयोगकर्ता यह लगभग मुझे पागल कर दिया है सभी पते को हटाना था और खरोंच से शुरू करना था! आज आप कैसे हैं ?
0,उपयोगकर्ता मैं अपने रास्ते पर 2 डी सबसे खुशी की जगह पृथ्वी पर हूँ !! LOL को वह सब नहीं पीना चाहिए जो आखिरी नीट है !!
0,अब एक होटल में उपयोगकर्ता im। और मैंने लोटा डरावनी कहानियाँ सुनीं और इम सुपर एफिन डराने वाले मैं भी दर्पण में नहीं देख सकता। हाहा!
0,"उपयोगकर्ता मैं इसे याद किया !!!! मैं घर से कार तक चला गया, और जब तक मैं कार में मिला, तब तक यह खत्म हो गया था !!!!  क्या यह अच्छा था?"
0,"उपयोगकर्ता आप मुझे 2nite ऊपर/नीचे किया था। Gr8 समाचार पर Janet #raam, संगरोध पर उदास समाचार होप उर अच्छी तरह से।"
0,उपयोगकर्ता कैसे के बारे में मैंने अभी भी देखा है! मैं पहले एक से प्यार करता था। सोचा कि यह एक महान फिल्म थी! न्यू मून हालांकि एक लंबा रास्ता है।
0,बारिश में दुकान पर चलना ... फिर से
0,मेरी धूप शनिवार को लगभग और साथ ही मुझे होने का एहसास नहीं था ... कल रात लगभग 6 बजे के आसपास पछतावा होगा
1,उपयोगकर्ता मैं भी मैग पढ़ता हूँ .. महान दोस्ती की कहानी!
0,मैं दुखी हूँ ...... सोने के लिए वापस नहीं जा सकता
1,शांतिपूर्ण wkend। उत्पादक सप्ताह के लिए आगे देख रहे हैं। दुनिया पागल है ... तो मुझे लगता है कि मेरे बहुत सारे दोस्त हैं !!!
0,उह ओह ... मैं पिस्सू हो सकता है
0,कोई भी सुनता है अगर रॉबोस वापस ?? मुझे उसकी याद आती है!
0,कुछ अजीब बूढ़ी औरत कासा डे सालसा में टॉयलेट में हमसे बात कर रही थी
0,बहुत थक गया हूं
0,URL फ्लैशबैक उपयोगकर्ता उपयोगकर्ता
1,अच्छा ठोस वसूली आज सुबह @ 5am 4.5 मील सुप्रभात ev1
1,फैब गीत के स्टूडियो फिनिशिंग में हैं ... यह देर हो चुकी है लेकिन हम काम करना पसंद करते हैं!
0,"काश वह इतना चमक और पागल महसूस नहीं करता था, क्योंकि वह अलग -थलग हो जाता है और वह जो प्यार करता है उसे दूर धकेल देता है।"
0,"उपयोगकर्ता काश मैं शुक्रवार को आपके साथ जुड़ सकता था, लेकिन मैं माँ ड्यूटी पर हूँ"
1,अशर हाँ।
1,कुछ नहीं कर रहे
1,मैं सिर्फ हमारे प्रशंसकों को धन्यवाद कहना चाहता हूं! हम वास्तव में आप सभी से सभी प्यार और समर्थन की सराहना करते हैं। एक बार फिर आपका धन्यवाद!  एक्सओ निक
1,कभी हार मत मानो। कल एक और दिन है।
1,URL - नया बिस्तर
0,..... मैं छुट्टी नहीं चाहता!
1,उपयोगकर्ता! मेरे नन्हा छोटे fwend!
0,"कोई बारिश के लिए ईर्ष्या!  विस्कॉन्सिन में सभी सप्ताहांत में बारिश हो रही है, लेकिन हम अभी भी इसे एक शानदार सप्ताहांत बना देंगे!"
0,उपयोगकर्ता मुझे यह सुनकर बहुत खेद है कि कोई भी आप चाहते हैं कि मैं आपके लिए हराऊं?
0,कभी भी 'ट्रिक' उर कार को डब्ल्यू कोच इंटीरियर और कोच पैटर्न को बाहरी पर न करें। Smh। यह एक आदमी भी था
0,मेरे आइपॉड हेडफ़ोन मर रहे हैं और मेरे पास नए लोगों के लिए पैसे नहीं हैं
0,बोरिंग वेकेशन डेज़ से नफरत है
1,"उपयोगकर्ता हाय माइक, हैप्पी 2 समीक्षा कोचिंग सामग्री। यदि संभव हो तो 2 मुझे 7 दिन का नोटिस दें, क्योंकि यह बहुत व्यस्त समय है 4 कुछ कारण है"
1,उपयोगकर्ता मज़ा है !!!  मैं तुम्हारे लिए उत्साहित हूँ!
0,"उपयोगकर्ता क्षमा करें, लेकिन अब इसके लिए केवल एक चीज है जो मुझे बेहतर महसूस कर सकती है ..."
1,"उपयोगकर्ता LOL, इस बारे में कि मैं 3 mote महीनों के लिए लंदन में रहता हूं या नहीं और जनवरी 2010 के लिए अपने लंबित नौकरी की पेशकश के बारे में भी"
0,उपयोगकर्ता लेकिन इसकी बारिश यहाँ
0,उपयोगकर्ता यह है। Wtff अच्छी तरह से कम से कम मैं केवल एक ही धन्यवाद नहीं हूँ
1,"कल रात के शो को इतना मजेदार बनाने के लिए मानस, वीए के अच्छे लोगों को धन्यवाद"
0,"वास्तव में एक नौकरी की जरूरत है, इसलिए मैं अपनी प्रेमिका को नहीं खोता"
0,"उपयोगकर्ता यह है कि मैं कैसे काम करता हूं। इसके अलावा, उदास।"
1,"उपयोगकर्ता एवेन्यू Q ftw लेकिन अगर आप स्टॉम्प के लिए गए, तो हाहा के लिए गए, तो मैं बहुत नाराज नहीं होगा।"
0,उपयोगकर्ता गरीब मिल्की पीपीडब्ल्यू आपको एक कप चाय और कुछ सूप <3 देगा
1,उपयोगकर्ता अरे टॉम आप कैसे हैं? URL टिप्पणी कृपया
0,मैं महसूस कर रहा हूँ
0,उपयोगकर्ता कि शैतान है ... क्या बिना im के एक bb है
0,कोई फ्रेड मर गया मैं पूरी तरह से उसके बारे में भूल गया। वह मेरा पसंदीदा था ...
0,टोमोरो मैं ची के लिए जा रहा हूं .... मैं चाहता हूं
1,उपयोगकर्ता lol हे लड़की ... मैं आज तस्वीर बदलना होगा
0,"कुछ बहुत बढ़िया दोस्तों के साथ एक महान रात थी, लेकिन अब मुझे कुछ संडे बंटर के लिए काम पर जाना है। उछलना"
1,मैं इसे प्यार करता हूं जब मैं किसी को मुस्कुराता हूं तो मुझे खुशी देता है।
0,जौ को किसी भी नींद मिली मुझे कुछ ज़ज़्ज़ की जरूरत है
1,सम्मेलन में वापस जाना होगा - कम से कम यह मुझे आँसू के एक पोखर में भंग करने से विचलित कर देगा - बाद में वापस आ जाएगा
0,उपयोगकर्ता मुझे आशा है कि रोजर टाइगर जैसी ही परेशानी में नहीं जा रहा है! मैं उम्मीद कर रहा था कि वे एक साथ 15 वां स्लैम जीतेंगे!
1,उपयोगकर्ता आपका स्वागत है
1,नए डिग्स में एक आरामदायक शाम का आनंद ले रहे हैं ... इसकी अच्छी तरह से एक साथ आ रही है!
1,उपयोगकर्ता हुहुहुहू: '(मैं स्ट्रॉबेरी खाना चाहता हूं
