0,"किरा एक झपकी ले रही है, उम्मीद है कि हम किरा को फिर से बाहर ले जा सकते हैं आज जेसन वापस काम करने के लिए चला जाता है कल बीमार मेरे लड़कियों के साथ घर पर हो!"
0,मैं आज रात उड़ना नहीं चाहता! मुझे आशा है कि मैं लुइस को याद नहीं करता कि वह जानता है कि मैं उससे प्यार करता हूं और वह मुझसे प्यार करता है इसलिए यह सब मायने रखता है और मेरे बीएफएफ
0,आज यादृच्छिक विकी पर कुछ भी अच्छा क्यों नहीं है .. url
0,फिर से होमवर्क करना .........
0,ऊब/अकेला होने की बीमार
1,उपयोगकर्ता को आशा है कि आपका दिन बहुत बढ़िया रहेगा!
1,"उपयोगकर्ता ने कभी ऐसी महिला को नहीं सुना, जिसने ब्रोथ्स को कहा था"
1,उपयोगकर्ता तो अब हमें बस यह जानने की जरूरत है कि कहां जाना है!?
0,अभी डर गया!
1,उपयोगकर्ता आप यहाँ क्यों नहीं हैं और y o u yelena के पास नहीं आ रहे हैं?
0,"उपयोगकर्ता नाह, बस ट्विटर खुद इसे अब तोड़ रहा है।"
1,"उपयोगकर्ता सुबह फिर से मिठाई ... एक महान दिन है, इसे आराम रखें"
0,"बस एक झपकी से जाग गया, भूख से मर रहा हूँ, लेकिन खाना पकाने के मूड में नहीं।"
1,उपयोगकर्ता वाह..मेरी विचार बिल्कुल ..
1,काम करने का इतना लंबा दिन!  अब मज़े और रोमांचक लोगों के साथ एक और रात के खाने के लिए
0,बस में .... अभी भी
0,उपयोगकर्ता मैं अधिक नाराज हूं कि मेरे 17 साल पुराने चचेरे भाई (जो 19 दिन छोटा है) को जाने के लिए मिलता है क्योंकि उसके पास एक नकली आईडी है और यह अधिक है ...
0,कल स्कूल जाना नहीं चाहता है - बहुत ज्यादा करना चाहते हैं कि दिन को पकड़ना चाहिए ताकि मैं आज आराम कर सकूं
0,"ऑर्थो से वापस। 20 मिनट देर से कारण मुझे कैलेंडर पर समय गलत मिला, इसलिए ऑर्थो ने मुझे 3 डिग्री दी।  उज्ज्वल पक्ष, दांत बहुत बड़ा लेकिन अच्छा लगता है!"
0,उपयोगकर्ता इसके ठीक है
0,मेरी छुट्टी के केवल 3 दिन बचे ... दुखी
0,आज करो या मरो; 3 बजे गणित फाइनल
0,फाइनल = चूसना !!! दो नीचे दो जाने के लिए ... सबसे कठिन दो बेशक ...।
0,"उपयोगकर्ता ने आपको रिजवान का संदेश दिया कल रात आयरलैंड में उन्होंने बहुत कुछ खोजा, यह अखरोट हम वहाँ नहीं जा सकते।"
0,नॉरफ़ॉक में एक और दिन मैं कल यहाँ से बाहर हो जाऊंगा!
1,मुझे भी उपयोगकर्ता
0,क्या आज काम पर नहीं जाना था
0,उपयोगकर्ता उपयोगकर्ता मेरे पास कोई योजना नहीं है- बस बड़बड़ाता है और तेजी से विघटित होता है कि वह सभी निजी जानकारी को भरने के लिए ... अनिश्चित
1,क्या आपको मेरा ट्वीट पहले हारे हुए थे?
1,पिक्सर की बात करें तो मैंने पहली बार वॉल ई देखा। वह छोटा आदमी सिर्फ इतना प्यारा है
0,"यहाँ एक ही उपयोगकर्ता! डनो डिनर के लिए क्या कर रहे थे, हालांकि मुझे उम्मीद है कि जल्द ही या इम गुनना मरो !!!! XXX"
0,"मैं कमजोरियों का पता लगाता हूं, मेरे पास जूता बिंगिंग को नियंत्रित करने में सक्षम नहीं होने के विपरीत कोई नियंत्रण नहीं है। यह एक कमजोरी नहीं है।"
1,[[मुझे कुछ प्यार <3]] ... मीठा जीवन प्यार करता है। नाइट्स
0,"आज रात पूरी दुनिया में मेरे पसंदीदा चचेरे भाई को देखा!  बहुत बुरा वह ट्विटर पर नहीं है और यह कभी नहीं पढ़ेगा।    वैसे भी लव यू, मुकदमा!"
0,मेरी माँ के घर पर रात के खाने का समय - रात बस मुझे बच रही है
0,उपयोगकर्ता लीड में टॉम है? यह मुझे अब और देखने नहीं देगा
1,"मेरा नया fav शब्द ""शब्दजाल"" हाहा है"
1,उपयोगकर्ता मैं एक के साथ आ सकता है।  आप क्या भुगतान करेंगे
1,ट्विटर पर होने से उपयोगकर्ता की शिथिलता अध्ययन! आप क्या करते हैं - काम या अध्ययन या दोनों?
0,पूल के द्वारा बैठे .... मेलिसा और हडसन की कामना अभी भी हमारे साथ घूमने के लिए यहाँ थे। यात्रा बहुत कम थी!
1,बस एक और दिन ... कुछ पेंटब्रश खरीदने वाला हूँ। बाकी दिन DIY मूड में जाने की कोशिश करते हैं
0,उन दिनों में से एक ... जब कुछ भी सही काम नहीं करता है
1,"उपयोगकर्ता हां, वे हैं और, मुझे ग्रीसवुड फ्लैट्स बहुत पसंद हैं!"
0,अंत में मेरे कंप्यूटर को छाँटना
0,उपयोगकर्ता URL - मुझे लगता है कि न्यूक्वे और कॉर्नवॉल की इच्छा है कि मैं एक दिन वहां वापस जाने का खर्च उठा सकूं
0,उपयोगकर्ता yup भगवान बेकार है lol
0,"उपयोगकर्ता ओह नहीं, हर कोई कैसे आता है जैसे मैं जाता हूं - यह एक संकेत है - सही मेरी गेंद, मेरे नियम, *हफ *"
1,शांति से मेरी खिड़की के बाहर बिजली और गरज के साथ सोते हुए
0,तो खुशी का काम खत्म हो गया है। इसलिए आज अराजक।
1,अंत में काम बंद !! वू हू!
1,उपयोगकर्ता आपका स्वागत है
0,"तो ... ईस्ट एपिसोड 11 का ईडन। एक कहानी खत्म करना। ज़रूरी नहीं। मुझे श्रृंखला पसंद आई, लेकिन अपने अंतिम फैसले के लिए फिल्म का इंतजार करना चाहिए"
0,"उपयोगकर्ता मैं आपके लिए महसूस करता हूं कि सोने में असमर्थता कुछ ऐसी चीज है जिसे मैं कभी भी पीड़ित नहीं करता, शायद आपने बहुत अधिक कॉफी पी ली?"
1,उपयोगकर्ता हाँ! मैं आखिरकार भी कहूंगा
0,उपयोगकर्ता मेरे लिए प्रतीक्षा करें .. कृपया .. हाहा .. मैं भी हाहाहा साझा करना चाहता हूं ..
1,उपयोगकर्ता तेह क्या है?
0,एक रविवार को काम में
0,"उपयोगकर्ता अभी आप पर है? मैं वहाँ से हूँ, लेकिन मैं अब वहाँ नहीं रहता हूँ"
0,उन चीजों को नहीं करने में विफल रहता है जो वह नहीं करना चाहती है।
0,उपयोगकर्ता सर्दी कभी सिंगापुर आ रहा है? यह यहाँ बहुत गर्म है।
0,"जब आपके पास उस व्यक्ति की कोई शौकीन यादें होती हैं, तो किसी की मौत कठिन हो जाती है।"
1,"उपयोगकर्ता yup।  कह रहा था कि मैंने आश्चर्यजनक रूप से इसका आनंद लिया। कुछ बुरी तरह से सूखा उम्मीद थी, लेकिन यह वास्तव में मेरे लिए बहुत मनोरंजक था।"
0,प्रस्ताव देखना चाहते हैं
1,संगीत का समय उपयोगकर्ता के साथ कुछ ट्रैक पर काम करने वाला है
1,वाह! होली!
1,"उपयोगकर्ता हाँ, फिली में। क्या आप भाग लेना चाहते हैं?"
0,उपयोगकर्ता अकेला हो रहा है
0,(मेरी झिलमिलाहट को चोट लगी है और घर जाने के लिए तैयार है)
0,"उपयोगकर्ता ने मैक्सिको रद्द नहीं किया? आप मुझे भ्रमित कर रहे हैं कि वे मेक्सिको नहीं जा सकते, फ्लू संकट अभी तक खत्म नहीं हुआ है।"
1,उपयोगकर्ता यह बहुत ज्यादा है कि मुझे ट्विटर क्यों मिला
0,सोशियो के कारण सीएसआई रिवाइंड को छोड़ दिया
1,उपयोगकर्ता मैं अपना नाम एलिसन भी जादू करता हूं! छोटी के लिए एली! हम इसे सबसे अच्छा जादू करते हैं
0,Polyvore.com काम नहीं कर रहा है। मैं खुश नहीं हूं!  खुद को खुश करने की जरूरत है।
1,उपयोगकर्ता वास्तव में अच्छा है .... वास्तव में मैं अब थोड़ा डर गया हूँ (* बूट शिविर* आआआआह!) बस मेरे ब्लॉग लॉन्च की योजना बना रहा है ... कैसे व्यापार है?
1,"मैं एक हैप्पी मामा का दिन भेज रहा हूँ, जो कि सबसे बड़ी ट्विट -मामा को उपयोगकर्ता के लिए कभी भी ... यू किक गधा, पूरे दिन - हर दिन! लवली संस !!"
1,"हम्म आगे क्या?  ओह, सही, ब्लश url"
1,वू!  सब कुछ अद्भुत लग रहा है!  मैंने अच्छा किया
0,हा बिस्तर पर नहीं जा रहा है .... बहुत से लोग बात करना चाहते हैं .... लानत है मुझे वास्तव में कुछ अनुयायियों की आवश्यकता है !!!
1,रिची के साथ संशोधन कानून इस परीक्षा के लिए इतना खराब हो गया
1,उपयोगकर्ता मैं खुश करने का लक्ष्य रखता हूं और मैं लक्ष्य करने के लिए कृपया
0,अब अजीब बात है
0,वेगास में पैसा खो रहा है ...
1,"उपयोगकर्ता का अनुमान है कि मेरी मूत अब अनुमान के माध्यम से क्या देख रही है, इसका मतलब है कि यह एक अच्छी रात होने वाली है"
1,"बस सिम्स 3 खेला। एक शॉवर लेना, बिस्तर पर जाना, तैयार होना, लेस की स्नातक की पढ़ाई, फिर उसकी पार्टी। बाद में, गैटरज़"
0,काश कोई मुझे इस सब से दूर करने से दूर कर सकता है xxx
0,सभी कुत्ते स्वर्ग में जाएं...
0,मुझे एक साथ निक एंड माइली से नफरत है ।।
1,कम से कम ट्विटरफॉक्स अभी भी जीवित है!
1,"उपयोगकर्ता वास्तव में नहीं है, मुझे सिर्फ मैं दिखावा करने की आवश्यकता है"
1,"अरे इस क्रैनबेरी को देखो - ज़ोंबी कॉन्सर्ट वीडियो पेरिस url महान गीत, महान सब कुछ"
1,"मैंने साइट में 6 नए दत्तक ग्रहण जोड़े, और कुछ इमोटिकॉन्स"
0,"उपयोगकर्ता ओह और उसे समलैंगिक होने से रोकने के लिए कहें और मेरे पाठ का जवाब दें, मुझे दुखी कर दें।"
1,उपयोगकर्ता मैं सहमत हूं। वह बहुत ठीक है
0,उपयोगकर्ता मेरा सामान्य रवैया होगा लेकिन मोंटी केवल 3 महीने है
0,मेरी पीठ पागल की तरह क्यों चोट लगी? मुझे इससे नफरत है
1,शुभ प्रभात
0,"अभी भी वास्तव में बम्ड जेल ब्रेक समाप्त हो गया है। Ive अब देखने के लिए कुछ भी नहीं है, हालांकि वेंटवर्थ मिलर हालांकि <3"
1,उपयोगकर्ता गुडलक !!
1,"उपयोगकर्ता मैं तुमसे प्यार करता हूँ बेन xd तो पसंद है, इसे खत्म करो"
0,बस मेरे पिताजी से बात की। काश मैं आज उसे देख पाता।
0,मेरे गैस टैंक का दरवाजा खोलने के लिए तंत्र टूट गया और मैं खाली हूँ ... मदद
1,असहमत होने के लिए सहमत .. जब रोम में
1,उपयोगकर्ता मुझे लगता है कि मुझे अपने ची टाउन शो के लिए एक सवारी मिली !!! Nkotb.com पर वापस जाना होगा एक मिनट ... वापस आ जाओ !!!    मैं तुमसे प्यार करता हूं!!!
0,उपयोगकर्ता lol मैं कभी नहीं रहा कि मैं बहुत geeked haha ​​हूँ
1,उपयोगकर्ता www.tweeteradder.com का उपयोग करके एक दिन में 100 अनुयायी प्राप्त करते हैं
0,क्या यह मैं या खुराक ट्विटर वास्तव में उबाऊ लग रहा है? एफबी पर कोई खेल नहीं है और मुझे वास्तव में परवाह नहीं है कि सेलेब्स दिन -प्रतिदिन क्या कर रहे हैं!
1,Helloooooooo ... क्या दृश्य लोग !!!
1,उपयोगकर्ता ईमानदारी से आप टेलीविजन लोग कुछ भी करने की कोशिश करेंगे।
0,काश मैं अपनी सबसे बड़ी बहन की तरह इतालवी होता
1,क्षमा करें यदि मैंने थोड़ी देर में ट्विटर नहीं किया है
0,एक अच्छे मूड में नहीं है और क्यों न पूछें
0,किसी को भी नहीं देखा है सभी w'end (M & S खाद्य पदार्थों में तक कोई अच्छा आदमी नहीं गिनता है!) और अब कुछ अकेले महसूस करना शुरू कर दिया
0,और मैं एक स्पाइडर वेब में चला गया और अब मेरे ऊपर रेंगने वाले फैंटम बग्स हैं।
1,बोस्को ग्रेजुएशन तब सारा की वॉयस रिकिटल
1,"उपयोगकर्ता ब्रिटस बे कल दक्षिणी स्पेन की तरह था। खैर, इसके अलावा अपमानजनक कीमत 99 की कीमत"
0,"क्षमा करें, उपयोगकर्ता उपयोगकर्ता और मैं ऑनलाइन 24/7 उपयोगकर्ता हाँ नहीं रह सकते हैं, लेकिन किसी कारण से नेट उबाऊ लगता है"
1,उपयोगकर्ता www.tweeterfollow.com का उपयोग करके एक दिन में 100 अनुयायी प्राप्त करते हैं
1,"उपयोगकर्ता उपयोगकर्ता उपयोगकर्ता यदि आपको पता था कि यह पृथ्वी पर आपका आखिरी दिन था, तो आप किस सेलिब्रिटी के साथ इसे खर्च करना चाहेंगे?"
1,#Ff के लिए उपयोगकर्ता धन्यवाद
1,उपयोगकर्ता यू यकीन है कि कुछ ट्विटर कल रात ह्यूग थे .... हा
1,रीज़ के टुकड़े और कविता।   यूआरएल
1,"उपयोगकर्ता हैलो, मैं Cassvn भी दोस्त nhÃ o भी हूँ ??"
0,"ब्रेट कल अपने ज्ञान दांतों को बाहर निकाल रहा है, जिससे वह कुछ अच्छा ठंडा गर्मियों के खाद्य पदार्थ ला रहा है ताकि यह बेहतर महसूस हो सके"
0,उपयोगकर्ता आप कभी भी मेरे प्रशंसक नहीं रहे हैं ???
1,उपयोगकर्ता मैं तुमसे प्यार करता हूँ और तुम्हें याद करता हूँ। मैं तुम्हारे लिए इंतजार नहीं कर सकता। बीमार मत बनो !!
1,उपयोगकर्ता!*गले*!
0,आज जोनास याद किया
1,उपयोगकर्ता हर 20 मिनट योग्य जो जीत जाएगा
0,मेरा ट्विटर c r a c k पर है
0,मैंने कभी नहीं सोचा था कि मुझे 'ब्लैक कीज़' से पहचाना जाएगा
1,उपयोगकर्ता woah। यह मेरी तरह की चीज की तरह लगता है
0,उपयोगकर्ता कैसे सनबर्न है? आउच।
0,"चिंता मत करो, दोस्तों। 2 इंटरनेट ""कूलिज़"" मुझे बर्बाद नहीं करते हैं। वैनेसा वास्तव में दुखी लगती है।"
0,"उपयोगकर्ता मैं केवल एक तस्वीर को समाप्त कर दूंगा, लेकिन आप पहले से ही जानते हैं।"
0,"मेरे चचेरे भाई जूली के लिए प्रार्थना करें, उसने बस बहुत खून बहाया।"
0,उपयोगकर्ता यह जानना चाहता है कि डेटा बंद के साथ वाईफाई का उपयोग क्या नहीं है? बीजाइव
0,उपयोगकर्ता गरीब आप
0,अरे उपयोगकर्ता awww मुझे कहा गया है कि मुझे toodles (TeamDemi_lovato लाइव> url
1,"उपयोगकर्ता बेंजामिन बटन एक looooooong फिल्म है, wierd, quirky और मजेदार"
1,"पांडांडा के लिए इंतजार नहीं कर सकता ""द पर्पल डोर"" ऊओह ... आआआह ..."
0,इसका अच्छा सूरज तक जागना। toodles उदास! स्कूल के लिए तैयार हो रहा है। उपयोगकर्ता sowwwwieee besty
1,उपयोगकर्ता Tagaytay। यह बहुत अच्छा था।
1,"उपयोगकर्ता अच्छा जा रहा है।  धन्यवाद! || दस्ताने भी! हाथ गर्म रखें || जल्द ही, पहले कुछ और भागों को समाप्त करें"
1,मेरे जीवन में कोई नाटक नहीं हमें यह देखने दो कि कल क्या लाता है!
1,बस मेरी कार आज धोया ... और अब इसकी बारिश हो रही है। हमेशा होता है। मेरे पास एक मजेदार रात थी। गर्मियों तक इंतजार नहीं कर सकता
1,सुबह की ट्विप्स!
1,खिचड़ी भाषा शुक्रवार को पीने के लिए इंतजार कर रही है !! मजेदार होना चाहिए!
0,Url - मेरे टखने thats
