1,यह आंख बनाम की तरह है। कान की चीज़
1,"उपयोगकर्ता हाहाहा, अब यह कुछ है जिसे मैं देखना चाहता हूं। ;) मैं स्कूल में लोगों की प्रतिक्रिया की कल्पना कर सकता हूं कि अगर यह एक कोलोन था !!"
1,"उपयोगकर्ता अच्छी तरह से, इसका जन्मदिन, पागल हो जाओ ... लेकिन याद रखें कि फ्रिज में ड्राइव न करें!"
1,Ashleyscandy.com पर मेरा 24/7 स्पाईकैम देखें! इस समय मेरी रात को मेरी fav पैंटी के साथ पहने im आप देखने के लिए बाहर झांकते हैं
0,"अशर हाँ, यह वास्तव में निराशाजनक है,"
1,"उपयोगकर्ता आप कल बेहतर हो सकते हैं, कोई खाद्य विषाक्तता मुझे आशा नहीं है!"
1,उपयोगकर्ता आपको 29 मई को आईटीआर पर देखें!
0,इस तरह के दिनों में मेरे CJ-7 को याद करना
0,उपयोगकर्ता के पास कुछ बेहतरीन समूह थे ... दीदी पॉप सिर्फ उन्हें मारता है
0,आज बाहर निकलते हुए शायद यह बारिश का मौसम है।
0,आखिरी बार जब मैं बाहर गया था और वास्तव में अच्छा समय था ?? मैं वास्तव में याद नहीं कर सकता
1,"कुत्ते के साथ दिन बिताएं, जब कुत्ते के पार्क में एक अच्छा दिन था .. मिसिन मेरे आदमी!"
1,"lmfao। हर कोई सौंदर्य सांस नहीं ले सकता। अहा, जिसने मेरी सुबह बनाई। समुद्र तट के लिए तैयार हो रहा है"
1,याय बस बेन से वापस आ गया (वह एक खेत पर रहता है) मुझे लगा जैसे एक शहर की लड़की कॉम्प एड की तरह था। हमने रात भर फिल्में देखीं
1,उपयोगकर्ता आपको क्या कहता है कि!? = \ _ आप अभी ड्राइव क्यों नहीं करते हैं और मुझे अभी उठाते हैं? (; Im स्नातक!
0,लव यू स्टेडी। काश मैंने तुम्हें आज देखा होता *गले *
0,"ACSVXDCBGFN सॉकर अब। डी के बाद युवा फोएबे को देखेंगे: मैं उसे कपड़े पहनना नहीं चाहता, हालांकि"
1,"उपयोगकर्ता जाहिरा तौर पर 20 जुलाई को, अमेरिका में भी कोकुरु से प्रसारित करता है।"
1,उपयोगकर्ता आप इस अगस्त में मेम्फिस में एल्विस वीक उत्सव में जा रहे हैं?
0,"बाहर जाना चाहता है, लेकिन अभी नहीं कर सकता। बीमार होने के नाते भी इस शहर में बाहर घूमने के लिए मेरी उम्र का कोई भी नहीं होता है ..."
1,हमारे eBay स्टोर की जाँच करें।
0,उपयोगकर्ता anooo हम शायद हमेशा की तरह एक वॉक लोल चलेंगे!
0,सप्ताह 8 WI ....: Hellooo हर कोई: फूल: वाह इसकी उम्र की तरह लगता है क्योंकि मैंने आखिरी बार पोस्ट किया था मैंने अभी -अभी अपना नया काम किया है
0,"उपयोगकर्ता मैक का आनंद लें, वे एक Winblows मशीन की तुलना में बहुत बेहतर हैं ... खराब करने के लिए मैं काम के लिए इस पर अटक गया हूं"
1,schwastedddd पाने के लिए तैयार हो गया
0,"उपयोगकर्ता thats arsey coz हम शायद एक ही वर्ग में नहीं होंगे, आप मुझे उच्च होगा:/: s"
0,बहुत मज़ा आया @ झील। मिस यू जेक
0,"उपयोगकर्ता तब हम खराब हो जाते हैं क्योंकि लड़कियों ने हमेशा पुराने लोगों (अब गधे) को दिनांकित किया है, फिर मीठे लोगों को दूषित करें, दुष्चक्र, शातिर चक्र"
0,"अब मैं अवाक, बेमानी, और उदास हूँ ... इतना बुरा मैं कहने के लिए सही शब्द नहीं पा सकता हूँ ... मैं वास्तव में, वास्तव में खेद है ..."
1,क्लीनिंग हाउस क्योंकि हमारे पास बाद में कंपनी हो सकती है ... गैरेज में क्रेग खेलने की चाबियां सुनकर।  मेरे लिए रविवार पूर्णता।
0,मैं ब्रेकअप देखना चाहता हूँ
1,"मैं तुम्हें आज ऊँचा मिला। क्योंकि यह शुक्रवार है, आपको नौकरी नहीं मिली है, और आपको करने के लिए बकवास नहीं है!"
1,उपयोगकर्ता Sweeeet लड़की! मैं अभी भी नहीं जानता कि क्या पहनने के लिए है लेकिन Whatevaaa हा
0,"मुझे लगता है कि हम एक साथ होने के लिए नहीं हैं, क्योंकि मुझे आपको समझने की आवश्यकता है, लेकिन आप नहीं कर सकते"
0,लगता है कि मेरे कैव्स बी फिशिन मैं ऐसा नहीं करना चाहता था !!!
1,फिल्म पुरस्कार अब तक बहुत अच्छे हैं
1,"#Stl ArtDtour पर बहुत मज़ा आया, उपयोगकर्ता के नमूनों से बहुत मुस्कुराहट देखी, एक उपहार बॉक्स को रफ लिया, उपयोगकर्ता से वाइन का स्वाद लिया"
1,उपयोगकर्ता #followfriday के लिए बहुत बहुत धन्यवाद
0,"मैं अपने भाइयों के साथ सोफे पर आराम कर रहा हूं।  मुझे खुशी है कि वे घर हैं, लेकिन वे मेरे पिल्ला पैड को बदलने के लिए बहुत आलसी हैं और यह मेरे कमरे में बदबू आ रही है"
0,"खैर यह Apple स्टोर के लिए कोई नहीं था क्योंकि वे उन लोगों के लिए प्रस्ताव का विस्तार करते हैं जो इसे कुछ महीने बाद मिला था, लेकिन मैं नवंबर में मेरा हो गया"
0,सिम्स 3 के बारे में उत्साहित !! अब अगर केवल मेरे पास इसे खेलने का समय था
0,मुझे होमवर्क करना है
0,सबसे दुखद/सबसे डरावना सपना था। फिर भी थोड़े हिलाया
1,उपयोगकर्ता हाय हाँ वह बिल्कुल भयानक नहीं था! पृथ्वी पर वह अपने कानों से एक अच्छी धुन कैसे सुनती है? ज़ोर-ज़ोर से हंसना
1,उपयोगकर्ता चलो यह कहते हैं कि इसमें 75 फुट की नौका (उर्फ बोट) पर शामिल है।
0,मेरे फोन में मुद्दे हैं
1,"व्यापार पर पकड़, उम्मीद है कि सभी के पास एक शानदार सप्ताहांत था ~ यहाँ किया गया था। अब बारिश हो रही है, लेकिन यह ठीक है ..... इसका आनंद ले रहा है।"
1,उपयोगकर्ता कुछ भी संभव है ..... मुझे विश्वास है! बस नेवर नेवर नेवर नाट हार
1,उपयोगकर्ता हा!  यू विश बॉब
0,वाह हर कोई ट्रांसफॉर्मर 2 के बारे में बात कर रहा है। मैं सो नहीं सकता
0,"अहा, यह बाहर बहुत रसीला है। लेकिन मैं बहुत बीमार हूं। सूरज मुझे एक गले में सिर दे रहा है"
0,"इस सप्ताह एमएसएनबीसी के डिजिटल कैफे से आ रहा है, जहां उपयोगकर्ता ने कुछ भयानक कॉकटेल बनाए! उपयोगकर्ता का हॉट चोको अप्राप्य था"
1,"उपयोगकर्ता वह कल थी।  लेकिन, आज पर नहीं है।"
0,उपयोगकर्ता aww मैं इसे याद करने जा रहा हूँ! बुमेर।
0,लगभग रोना - माता -पिता का पार्ट टाइम खत्म हो गया है - मेरे 100% काम में भी शुक्रवार को काम करना भी
1,मेँ क्या कर रहा हूँ? मेरे अपने व्यवसाय को ध्यान में रखते हुए
1,उपयोगकर्ता मैं वास्तव में एमिली हूँ मैं 10 अनुयायी अब yay lol x x की तरह है
1,उपयोगकर्ता मैं - धन्यवाद
1,थोड़ा और पूल में एक्वेरियम अगर मौसम होता है तो कुछ और गिटार हीरो मेटालिका आज रात मेरी परीक्षा पास करने के लिए मनाते हैं
1,मैं आज पूरे दिन परिवार के साथ रहा हूं और फिर जाँच कर रहा हूं। रूसी फिलिग्री गहने बनाने पर एक महान डीवीडी देखा।
0,आज अच्छा दिन नहीं है।
0,"मैं अंदर सोना चाहता हूं, लेकिन कुत्ता मुझे नहीं होने देगा।"
0,जेटब्लू पर हाउस मैराथन देखा। हाँ। मुझे उसकी बहुत याद आती है।
0,अब स्ट्रॉबेरी को तरसना .... आश्चर्य है कि क्यों ... प्रतियोगिता में प्रवेश करने की कोशिश कर रहा है लेकिन यह व्यस्त है
0,"उपयोगकर्ता मैं आपसे पूछता हूं, यदि आपने नहीं किया है-यदि ऐसा है, तो मुझे खेद है-अनुभव करने के लिए opiates और वे धारणा को कैसे बदलते हैं। किताबें काफी मजबूत नहीं हैं।"
0,क्या यह रविवार है
0,"अभी भी उसे याद करता है और चिंता करता है जैसे यह उसका काम है या कुछ और ..> _ <काम ठीक है; एक दिलचस्प सहकर्मी, हा! O_O टाइपिंग के बहुत सारे, क्या मज़ा!"
1,Omg गीत सुंदर झूठा अद्भुत है! ... वीडियो .... हॉट! हाहा!  बेयॉन्से बेयॉन्से शकीरा शकीरा।
1,उपयोगकर्ता URL - शो के दौरान ट्रेंडिंग टॉपिक्स पर टॉप 3 टुनाइट
1,एक पर एक और मौत के लिए उपयोगकर्ता!
1,उपयोगकर्ता आपको एक प्राप्त करने की आवश्यकता है जो CIG लाइटर में प्लग करता है ताकि यह गर्म रहता हो
1,उपयोगकर्ता मैं आपकी मदद करूंगा! चिंता मत करो
0,नाटक से थक गया
0,NetBeans PHP संपादक की कोशिश कर रहा है। इसमें कोड पूरा नहीं होता है
1,"मुझे नींद आ रही है, मैं बिस्तर पर जाता हूं! Goodknight दोस्तों !! सभी के लिए अच्छे सपने, गले"
1,मेरा अपना टिम मैकग्रा है। उम्मीद है कि वह हमारी सभी सुखद यादों को याद करता है।
1,निर्वाण-कर्ट कोबेन निरपेक्ष प्रतिभा को सुन रहा है
0,धूप में कंधे या पतले पड़े टॉप पहनने के लिए इस तरह की देखभाल करने के बाद मैं आज एक खूनी टी-शर्ट टैन प्राप्त करने में कामयाब रहा हूं
1,"उपयोगकर्ता lol u ने मुझे कभी नहीं मारा, इससे पहले कि आप वेगास के लिए छोड़ दें, यू एक बड़ा समय है"
0,"यह खतरा है, मैंने अपनी एपीआई कॉल सीमा को पार कर लिया है"
0,मेरी कार में नरक के रूप में गर्म ...
0,उपयोगकर्ता काश मैं जा सकता था। मुझे दुख है कि मेरे पास 2 नौकरियों के काम के साथ भी शून्य $ है।
1,"4 घंटे में दो 400-शब्द निबंध, मुझे लगता है कि मैं इस का लटका हुआ हूं"
1,"उपयोगकर्ता ब्रूस विलिस फिल्म, उन वास्तविक समय फिल्मों में से एक? गंदे पुलिस आदि ... बहुत अच्छा!"
0,"उपयोगकर्ता अच्छी तरह से, आपके बारे में मेरी कल्पना जाती है, न कि एक ताए kwon करते हैं"
0,इस्तेमाल किए गए पोर्श ने कहा कि वह यू 20 मिनट से मिलेंगी। उसका फोन मर चुका है
1,उपयोगकर्ता स्पष्ट रूप से। 30 यह बहुत मजेदार नहीं है!
1,घर पर अपने आप को रात के ट्वीट्स के साथ कुछ बहुत जरूरी समय बिताना
1,"उपयोगकर्ता आप नहीं हैं, आपके गधे में दर्द नहीं है, इसके अलावा कभी -कभी"
1,उपयोगकर्ता कि 1998 में किस तरह का जंगली है मैं अभी भी अपनी IRL चित्र दिखाने के लिए बहुत डर गया था
1,उपयोगकर्ता अमेज़ॅन नियम !! ;) तो क्या आप
1,कल केविन के साथ लटका!  बाहर उत्पादक हो रहा है।
0,उपयोगकर्ता कम से कम आपके पास कुछ खाने के लिए है
0,"अघ! फिर, मैंने कुछ भी नहीं किया है जो मेरे पास इतना समय था। मैं कल कक्षा में सो रहा हूँ ..."
0,उपयोगकर्ता काम के लिए तैयार हो रहा है
1,अब हार्ड रॉक
0,"इस wkend के अतीत की गर्लफ्रेंड के 2 सी भूत चाहते थे, लेकिन मुझे कुछ मैथ्यू मैककोनाघे नहीं लगे !!!"
1,अशर हाँ आप हैं
1,उपयोगकर्ता आप सभी समय के मेरे पसंदीदा व्यक्ति हैं। मैंने सोचा आपको आपको पता होना चाहिए
0,पीएमटी स्ट्राइक फिर से मैं पार्टी के लिए बहुत दुखी हूं इसलिए इसे एक मिस दिया
0,"- नाक में आग लगी है, साइनस अवरुद्ध हैं, कान बज रहे हैं और मेरे बच्चे के लड़के के पास भी है।   #FB"
0,मैंने अपने बॉयफ्रेंड को 'इमो' 'हराया और मुझे यह पसंद है लेकिन उसे नहीं
1,उपयोगकर्ता lol thx Glad u पसंद आया यह मैं अनुग्रह और शैली के साथ हर तारीफ लेने के लिए उठाया गया था
0,लेकिन कोई विकल्प नहीं मिला क्योंकि कोई भी मुझसे जुड़ना नहीं चाहता है
0,"उपयोगकर्ता buat अध्ययन केस pokoknya aaa, मदद कुत्ते की मदद"
0,"उपयोगकर्ता अच्छा है।  मुझे आपको पहले पाठ करना चाहिए था, मैं शामिल हो गया था।"
0,"उपयोगकर्ता पोंछने वाली प्लेट-प्लेट स्लिप-प्लेट ब्रोक-टेरकट हैंड-डीप घाव को सी कर सकते हैं, जो अब टांके के लिए डॉक्टर को रक्त-भारी प्रवाह का प्रवाह कर सकते हैं"
0,आह टॉसिन और टर्निन सो नहीं सकते हैं! मेरे दिमाग में बहुत ज्यादा
0,"बम्पिन संगीत मेरी Keyy के बारे में सोचता है! उसके SK ने S0 को तोड़ दिया, मैंने पूरे दिन 2her की बात नहीं की।"
1,"उपयोगकर्ता aww, अच्छा है कि क्या है? <3"
1,उपयोगकर्ता कम से कम आपके पास सब कुछ योजना बनाने का समय है।  हबबी को इस गर्मी में अपनी थीसिस को जल्दी और खत्म करना था।  वह अगले सप्ताह बचाव करता है।
1,उपयोगकर्ता मुझे लगता है कि आप हमेशा एक अच्छा समय पा रहे हैं !! ओहियो में भी xoxo
0,"मेरी मम्मी को अभी तक नहीं दिया, मेरी बहन सो गई। मुझे लगता है कि मेरी मम्मी ने कहा कि हमें उसे कुछ भी नहीं मिला। मुझे बुरा लगता है"
0,"उपयोगकर्ता शुभ संध्या। क्षमा करें, रविवार की शाम के लिए, #Anagramsunday मेरे सिर में काम करेगा"
1,"उपयोगकर्ता - मैं यह सुनिश्चित नहीं करूँगा कि जब मैं यहाँ पर सभी तरह से हूँ, लेकिन मैं कोशिश कर सकता हूँ कि अभी बहुत खाली समय है"
1,उपयोगकर्ता उपयोगकर्ता सुप्रभात वहाँ।
0,अपने स्पाइनल टैप के लिए कैम लेना।
1,बिग बाइक राइड से पहले ब्रेकफास्ट @ पैट्रिक मोलॉय की चॉकलेट चिप्स पेनकेक्स हो रही है
1,"उपयोगकर्ता आप मुझे सिखा सकते हैं कि अपने दोस्तों को ट्विटर, मिस मेग में कैसे बदलें?"
0,"कोशिश कर रहा है ... कोशिश करने पर जोर, बिस्तर पर सबसे कम उम्र के होने के लिए ... वह थक गई है, लेकिन यह लड़ रही है"
0,खिचड़ी भाषा सो जाओ !!! समय की उड़ान। सुबह में वैश्विक रीजेंट्स को कॉर्टन रोग मिला
0,"यह सब नया बर्फ और 70 बंद है मुझे पता है कि मैं 285 ले सकता हूं, लेकिन मैं कुछ साल पहले केनोशा पास से लगभग फिसल गया हूं"
0,"ईस्ट लांसिंग कल, एक परीक्षण के लिए बहुत बुरा है"
0,क्या मुझे लगता है कि मुझे जल्द ही पेपर 2 को संशोधित करना शुरू करना होगा: |  महान बीमार शर्त मुझे कल संशोधित करना होगा! मेरे जन्मदिन पर
1,"आज सुबह ट्रेन को मजबूत करने के लिए। 30 मिनट की पैदल दूरी पर, 30 दिन के पहले 2 स्तरों को वापस 2 वापस आ गया + भार उठाने का एक घंटे"
0,उपयोगकर्ता मुझे कभी भी ऑडियो सुराग नहीं मिल सकता
1,हमारी कनाडा यात्रा के लिए योजना ...
0,आपके नुकसान के लिए उपयोगकर्ता क्षमा करें
1,"उपयोगकर्ता मैं रेंटन में अपनी चाची के साथ रहूंगा, लेकिन इसकी तरह नहीं है कि हम लॉकडाउन पर जा रहे हैं, हमें एक साथ मिलना होगा।"
