1,"उपयोगकर्ता मैं वादा करता हूं कि जब मैं एक करोड़पति हूं, तो मैं आपको एक मैक खरीदूंगा"
1,"मेरा लक्ष्य बारफलाइट पढ़ना और फिल्म से पहले इस नए चंद्रमा कचरे को पढ़ना है। अगर मैं ट्वि-टर्ड्स को कोसने जा रहा हूं, तो मुझे सबूत चाहिए।"
0,उपयोगकर्ता को बस बुरी खबर मिली।
0,सुबह है।  मैं धुंधला हो गया हूँ और बिस्तर से बाहर होने के लिए खुश नहीं हूँ
0,"उपयोगकर्ता जो भयानक है।  BTW, मेरे काम को वास्तव में चित्रों की आवश्यकता है।  तो आप अपने रॉकस्टार चित्र के साथ एक नई कार प्राप्त कर सकते हैं।"
0,"काम बहुत धीमा है, मैं इस सप्ताह अपनी नौकरी छोड़ने पर गंभीरता से विचार कर रहा हूं"
0,"उपयोगकर्ता की खदान को किलिंग डाउन दुर्भाग्य से मिला है, यह पूरी तरह से क्यों है कि मैं प्वाइंट ब्लैंक 2 को मना कर देता हूं 2 को एक बिल्ली फ्लैप मिलता है!"
0,"मैं जोई द्वारा एकल महिलाओं को नृत्य करना चाहता हूं, लेकिन, खाता निलंबित है: |"
0,शहर में जूते के लिए एक जंगली हंस का पीछा करते हुए क्यूज खदान टूट गया
1,उड़ान नियंत्रण पर कुछ रिकॉर्ड तोड़ने के लिए उपयोगकर्ता समय! ... अच्छी तरह से प्राप्त करें
0,आज थका हुआ और चिंतित लग रहा है।  घर पर अपसेट और सबसे छोटा बेटा जीवन या उसकी मम्मी का मुकाबला नहीं कर रहा है! बहुत दुख की बात है.....
1,बस पीएसी ब्रीज़ी से वापस आया! कक्षाओं के अंत का जश्न मनाने का अच्छा तरीका!  प्लस गैंगस्टा गधा लू सील के साथ एक तस्वीर मिली!
1,मैं विशेष रूप से छुट्टियों के लिए सुबह में बेवकूफ समय पर जाग रहा हूं। लगता है कि मैं एक युगल o 'घंटे (y) के लिए सोने के लिए वापस जाऊंगा
1,उपयोगकर्ता आप शहर में हैं?! आशा है कि आप अपनी चाची के साथ मज़े करेंगे!
1,उपयोगकर्ता भगवान का शुक्र है कि मैं अकेला नहीं हूं जो ऐसा करता है। इसे बाहर जाने दो!
0,"आज रात किसी भी तरह से जा सकता है। हम देखेंगे, लेकिन मैं इतना टूट गया हूं कि यह किसी को भी कुछ स्टॉक होंडा व्हील्स और हब कैप खरीदना चाहता है!?"
1,haha मेरा पहला साइटमॉडल आइकन url
1,जब मेरे दो पसंदीदा गाने मेष: लव स्टोरी से मिलते हैं विवा ला विडा। एक YouTube वीडियो है: URL | आपका स्वागत है
1,हे हे मैं अभी भी ऊपर हूँ
0,उपयोगकर्ता अब आपकी वजह से मैं एक जेट स्कीइंग के लिए जाना चाहता हूं
0,मैं oouuuut जाना चाहता हूँ।  मैं अब घर पर फंस नहीं सकता !!
0,उपयोगकर्ता दोस्त मैं आपको हमेशा के लिए प्यार करता हूँ अगर मैंने मुझे पाठ किया है क्योंकि मैं कोई संपर्क नहीं है haz yo numba जो उपयोगकर्ता के लिए भी जाता है (:
0,इस साल अभी तक कोई स्नातक केक नहीं था।
1,इटली तक 24 दिन
1,लगता है कि मैं आधिकारिक तौर पर पुरुषों पर हूँ !!!!  यहाँ हमेशा के लिए सिंगल होने के लिए है !!!
1,"अब, इटली के लिए"
0,"ओह, मैं स्याही n आयरन में भाग लेने में सक्षम होने के लिए क्या नहीं दूंगा!"
0,उपयोगकर्ता ouch! आपको कामयाबी मिले!  इसके बारे में खेद
1,उपयोगकर्ता चिंतित नहीं है! मैं सुरक्षित और ध्वनि हूँ!  <3 आप!
1,कुछ अकेले समय से प्यार करना। घर को धूल देने की जरूरत है
0,30 सेकंड में बारिश में भिगोया गया और मैं पिछले सप्ताहांत की तरह बारिश में 2.5 मील की दूरी पर 8.4 मील की दूरी पर भी नहीं था।
1,"नाराज ... इस घर से बाहर जाने का समय। अन्य खबरें, मैंने पहले से ही 5 पाउंड खो दिए हैं ... गंदे एनएस भोजन पर लाओ !!"
0,लेखांकन में है .. eewwww
0,"बॉलीवुड पूरा, रेवेन्सबॉर्न में अंतिम उत्पादन यह अच्छा रहा है"
1,उपयोगकर्ता I #LovesouthAfrica!
0,उपयोगकर्ता हम वास्तव में मेरे लिए अच्छी तरह से दोस्त नहीं है मैं इसके लिए बनाऊंगा। nowww
1,"उपयोगकर्ता btw, आपका याद है कि मुझे हंसी आती है, खुशी है कि आपके पास एक बेहतर मेमोरी है जो मेरे लिए है! हाई स्कूल ने निश्चित रूप से हमें कुछ अच्छे समय दिए"
1,उपयोगकर्ता तस्वीरें बहुत खूबसूरत हैं! एक बहुत ही शांतिपूर्ण लेखन स्थान की तरह दिखता है।
0,उपयोगकर्ता गाने के बारे में ज्यादा नहीं सोचता है जुगगान्ट्स थोड़ा निराशाजनक है।
0,"आज ओ'हारे से मेरी माँ को उठाया। मैं अपने कॉन्डो द्वारा गिरा दिया ताकि वह अपने पोते को देख सके, लेकिन विलो सो रहा था। पूरे समय।"
0,उपयोगकर्ता ओह माय गॉड। मैं खेल के बारे में भूल गया!
1,उपयोगकर्ता आज Kiwi विजेता है।
1,ऊर्जा वापस आ गया है ... yayeee
1,"उपयोगकर्ता हे JD, तो खोज करने के लिए आपकी पसंदीदा जगह कहाँ है? दुनिया हर जगह महान है, आप सीखते हैं"
1,"उपयोगकर्ता धन्यवाद!  मानो या न मानो, मुझे इस बात में दिलचस्पी है कि हमारे पीछे आने वाले लोग क्या कह रहे हैं।  यह सब अब तय हो गया है"
1,उपयोगकर्ता के पास एक सुरक्षित यात्रा है और आशा है कि आपके पास आज एक महान दिन है!  बहुत प्यार और समर्थन हमेशा?
0,सैंडली केस एयर फ्रांस गायब है और हमारी बहन एरोमेक्सिको एयर फ्रांस के साथ स्काई टीम एलायंस का हिस्सा है।
0,"अब यह अंधेरा हो रहा है, अवसाद कार्बन मोनोऑक्साइड की बाढ़ की तरह आ रहा है। सप्ताहांत आंसू पर है।"
0,जैसे ही मैंने पोस्ट किया कि ट्वीट मेरे कुत्ते ने कालीन पर फेंक दिया और एक गरीब डायलन यूआरएल को गड़बड़ कर दिया
0,मेरे प्यारे दोस्त से मिलने के लिए मेरे रास्ते पर! मैं हमेशा बस में मेरे साथ एक शराबी बैठने का प्रबंधन करता हूं। सांस लेना
0,मुझे अपने कॉफी फ्रेंच प्रेस ऑपरेटर #fail में कॉफी ग्राउंड मिला
0,उपयोगकर्ता आप अभी भी शनिवार को विंबलडन जा रहे हैं? और मैं सोओ ने राफा को वहाँ नहीं किया
0,"उपयोगकर्ता ओह नहीं, क्या मैंने बुरा किया? क्षमा मांगना"
0,लड़का ऊपर है ...।
0,"उपयोगकर्ता आप जानते हैं कि मैं शनिवार से राल्फ से बात नहीं करता हूं। मैंने कोई भी कॉल, txts, कुछ भी नहीं मिला है"
1,URL - ब्लॉक पर नए बच्चे
0,उपयोगकर्ता geog मैं सी यू कर सकते हैं !! XX
1,कोठरी पुनर्गठित ... कपड़े धोने ... अनपैकिंग ... क्या हम लगभग अभी तक किए गए हैं?
0,वैक्यूम की गंध को तरसते हुए उस लालसा को कुछ और के साथ भरने की कोशिश कर रहा है ... कोई भी विचार
0,प्रीसेट amaazing थे! निश्चित रूप से उन्हें लाइव देखने के लिए एक सिफारिश! कमबख्त बहुत बढ़िया। वर्तमान में मेरे दाहिने कान में बहरा
1,उपयोगकर्ता कभी -कभी संयमक एक अच्छी बात है। हाहा!
1,सोमवार को मेरे जन्मदिन का इंतजार कर रहे हैं
0,उपयोगकर्ता हाय कैसे आपका दिन लगभग ऊपर रहा है तो रविवार को सोमवार और वापस SKWL पर तो आप कैसे हैं? lol x
0,"मुझे लगता है कि मैं बिस्तर पर हूँ। मैं बहुत थक गया हूं।  डीवीडी के लिए कल: कब्जे, अंडरवर्ल्ड: लाइकन्स का उदय, और ग्रज 3। <3"
0,"उपयोगकर्ता जो मैंने सीखा है, वह यह है कि साइनसाइटिस नाक में दर्द है!"
1,उपयोगकर्ता गुड मॉर्निंग हेल्मुट। मैं एक एस्प्रेसो enlongee कृपया होगा
1,"उपयोगकर्ता किसी को भी लेकिन उसे। मैं स्टावरोस फ्लैटली को पसंद करूंगा #बीजीटी जीतने के लिए यह बहुत बुरा नहीं है धन्यवाद, खिचड़ी भाषा वेट वे कर रहे हैं! तुम्हारा कैसा है?"
0,उपयोगकर्ता पागल/उदास नहीं है
0,"उपयोगकर्ता क्यों आप अपने फोन को चालू नहीं करते हैं, यार?"
1,URL - ओह हाँ अच्छा समय!
1,"उपयोगकर्ता अपने वेलकॉम्म्म्म्मे !!  btw..i ने सुना कि आप एक स्ट्रिप बार में थे, पिछले नीट ??? टेवी ... टेवी ... टेवी ........ tsk tsk !!!"
0,दोस्तों सकल हैं
0,"उपयोगकर्ता अपने चुटकुले सामान्य रूप से प्रफुल्लित करने वाले होते हैं, लेकिन माइक टायसन की बेटी के बारे में एक ... यह मज़ेदार नहीं है और यह भयानक है"
0,उपयोगकर्ता मैं खो गया हूँ। कृपया मुझे एक अच्छा घर खोजने में मदद करें।
1,आज। था। इसलिए। अधिकता। मज़ा।
1,उपयोगकर्ता को जन्मदिन की शुभकामनाएं ... आशा है कि यह एक महान है!
1,Devon iloveyousomuch Devon <3 के साथ ड्राइव के लिए तैयार हो रही है
0,उपयोगकर्ता हाहाहा। ठीक है तुम वहाँ मिलो। हाहा मजाक। वैसे हमारी गर्मी लगभग खत्म हो गई है
1,बहुत संगीत पर sytycd reruns देखना !!  Yayyyyy
1,"रेगिस और केली को देखना, फिर LVATT खरीदने के लिए सबसे अच्छा खरीदें!  यूआरएल"
1,"इस सप्ताह के अंत में शराब के उत्सव के लिए फ्रेस्नो ... ओह, और महिला"
1,"उपयोगकर्ता ""किसी भी टी-फॉर्मर 2s नहीं खरीद रहा है ... या कम से कम बहुत कम"" ... प्रतिबद्ध करने का तरीका ... उम नहीं"
1,उपयोगकर्ता मुझे अपने favs को साफ करने की आवश्यकता है! इतने सारे बेचे ... लेकिन यह हमेशा एक अच्छी बात है
0,"वास्तव में दुख की बात है, लेकिन मैं ईमानदारी से महसूस करता हूं कि लंबे समय में यह सबसे अच्छा है"
1,उपयोगकर्ता हर!  नहीं। इसके लिए धमकी दी गई है। फिलहाल यह विशुद्ध रूप से मैनकुनियन हो रहा है।
0,URL - मैं अभी भी आपको याद करता हूं।
0,"उपयोगकर्ता इसके अलावा, यू हमेशा अपने सभी सपनों को याद नहीं करते हैं, यू वास्तव में 2 वेक या हाफ-वेक हैं जो वास्तविक सपने में आपको 2 याद हैं"
1,अमांडा और दादी की बिरफडे पार्टी लोल में। रॉकिन आउट ऑन माई गिटार (कोई गिटार हीरो गिटार नहीं!)
0,माता -पिता चूसना !!!!
1,उपयोगकर्ता मैं कल रात जोएल को पूरी तरह से नजरअंदाज कर दिया।  हा।  क्या मजा!
0,"उपयोगकर्ता मैं गेंदबाजी करने के लिए प्यार करता था, लेकिन मेरे हाथ अब इसे नहीं ले सकते"
1,उपयोगकर्ता मैं एक wii वर्जिन हूँ बस पर अपना ट्वीट करने की आवश्यकता है! अब मैं पंप कर रहा हूँ और पिक्सेल और वैक्टर पर वापस आ रहा हूँ!
0,बेवकूफ गीत..हाह यह दर्द होता है!
1,"उपयोगकर्ता धन्यवाद! क्या आपने अल्फा के लिए पंजीकरण किया? यदि नहीं, तो url"
0,उपयोगकर्ता महिला। यह एक तन नहीं है ... मेरी पीठ और पैर गुलाबी हैं !!!! यह दुखदायक है
0,आखिरी बार रॉक बॉटम में जाना
1,"आज भी हल्के से टैनिंग नहीं, इस साल नकली बेक टैन की आवश्यकता हो सकती है, बस मुझे याद दिलाएं"
1,"उपयोगकर्ता मुझे याद आती है:-/ बहुत, कोई नहीं, अच्छी तरह से आप जानते हैं"
1,उपयोगकर्ता हाय रोब - एक अच्छा है
0,लंबे समय तक सेब याद आती है
0,इसे नैशविले के लिए बनाया ... अब मेरे रास्ते पर वापस
1,Ihop अच्छा लगता है।
0,तो मेरी परीक्षा में एक एपीआई चाहते हैं
0,"गणित पर दिया।            मैं बस उच्चतर विफल हो जाऊंगा, मुझे परवाह नहीं है ..."
0,उपयोगकर्ता 2day..it बस टीवी पर चला गया ... एक नई रिपोर्ट के रूप में
0,Useruser #9 outta दा नीला किसी को नीले रंग के बाहर छोड़ दिया जा रहा है
0,मुझे अपनी प्रस्तुति से नफरत है
0,उपयोगकर्ता मैं बीयर पोंग खेलना चाहता हूँ!
0,यहाँ बैठे .. हाल ही में यहाँ पर नहीं किया गया क्योंकि मेरा फोन उदास दिन टूट गया !!
1,उपयोगकर्ता धन्यवाद
0,"एक पिंग पोंग टेबल के लिए खरीदारी, लेकिन यह सुनिश्चित नहीं है कि मेरा अतिरिक्त कमरा काफी बड़ा है ... 9x5 मानक है।"
0,"कभी नहीं सोचा था कि मैं यह कहूंगा, लेकिन हार्टले का नारंगी स्वाद जेली बहुत मीठा है! मैं बर्तन खत्म नहीं कर सकता .."
0,उपयोगकर्ता सहमत हुए।
1,"उपयोगकर्ता हाहा। मुझे इंतजार नहीं कर सकता है और अपने ब्लॉग पर बार -बार तीन जेबी गाने सुनना पसंद करते हैं, LOL!"
0,Urg मुझे एक मिनट में काम करने के लिए जाना है।
1,Mitchel im पर पकड़ मैं sooo n आशा है कि मैं u से बात कर सकता हूँ !!!!!!!!!!!!!!!!!!!!!!!!!!
1,"#ohyeswedid.. मैं अभी भी क्या कर रहा हूँ? यह सही है, मैं एक अनिद्रा हूँ"
0,"स्वयं पर ध्यान दें: ए, कभी भी शराब और बी की एक बोतल पर न जाएं, बाद में शिफ्ट फ्लॉप प्राप्त करें"
1,OMFG कितना भयानक खुराक यह देखो ... URL और भी बेहतर Sas init हैं
0,उपयोगकर्ता वू !! वेगास ... मज़े करो। काश मैं जा सकता।
0,उपयोगकर्ता मुझे एक के लिए कोई पैसा नहीं मिला है
1,"मैं अब सितंबर में नहीं जा रहा हूँ, इसलिए मिसिसिपी के लिए एक सड़क यात्रा अब निश्चित रूप से है"
0,उपयोगकर्ता मैं न तो सो सकता था और न ही अब सिरदर्द इसकी वजह से मौजूद है।  आपको अमीना के एल्बम कुर को सोते हुए सुनना चाहिए
1,बाद में एक प्रोफ़ाइल तस्वीर मिल जाएगी
1,"उपयोगकर्ता उपयोगकर्ता सिर्फ कॉन्सर्ट में यू लोगों से मिलने जा रहा है, एमएस को उठाएं। बेकर ओह रुको ... मैं अपने tix hav। मैं v के द्वारा उन्हें छोड़ दूंगा"
1,"मुझे उपयोगकर्ता, मुझे !! आओ मेरे लिए खेलो"
0,घर जा रहा है बीमार
1,उपयोगकर्ता लूल फ्रेंड! मुझे लगता है कि मैं सोच रहा हूँ: एस
0,"लॉस्ट 3-1, क्रेजी फास्ट स्ट्राइकर, मेरी ऊँची एड़ी के जूते पर था, सभी खेल भी 9 पुरुषों के साथ खेले गए क्योंकि हमारे लोग नहीं दिखाते थे।"
0,सप्ताह के लिए एक बहुत खराब शुरुआत है !!!
1,उपयोगकर्ता महान विचार
0,Â «â ª ª ª सुनना बुद्धिमान - aimee mann â« Â Â Â Â
1,पूरे चालक दल के साथ उपयोगकर्ता पर महान समय। उपयोगकर्ता को फिर से देखना अच्छा है
1,मेरा गरीब छोटा मिक्सर वास्तव में तेजी से टूट रहा है !! बैगल्स का डबल बैच! हालांकि यह कर रहा है !!
0,सुपर थका हुआ मुझे आराम के समय की आवश्यकता है .. कल बहुत अच्छा दिन था .. मेरे एमएफएफ और परिवार के लिए धन्यवाद?
1,उपयोगकर्ता ने अपना HW अभी तक किया है?
