0,कोई बीमा उपयोगकर्ता नहीं
1,"खैर, कम से कम काइल जीत नहीं पाई"
0,"मुझे इस सेमेस्टर में स्नातक करने से हर किसी से जलन हो रही है, ऐसा लगता है कि मैं वहां कभी नहीं पहुंचूंगा"
1,अब सोने का समय .. अच्छा नीट हर कोई आशा है कि आप एक धन्य रविवार था
1,उपयोगकर्ता हा हा हा मैं इसे प्यार करता हूँ। वे मेरे लड़के हैं
0,मुझे ऑस्टिन गिब्स ईपी चाहिए - मैं केवल माइस्पेस पर गाने सुन सकता हूं:/ url
1,वास्तव में ट्विटर में अधिक प्राप्त करना चाहिए
0,उपयोगकर्ता मैंने कोशिश की।
1,उपयोगकर्ता ;; मेरा मतलब है कि केवल एक चीज हम तुलना कर सकते हैं !!! भ्रमित छोटे लैटिन अमेरिकी देशों ;; लेकिन मैं उन्हें प्यार करता हूँ
0,अब दुखी है
1,सुप्रभात लोग मैं सूरज का आनंद लेते हुए अपनी घास पर लेटते हुए सभी नाविक कपड़े पहने हुए हैं
1,"उपयोगकर्ता आह हाँ, मैंने आपके ठीक पीछे एक तस्वीर ली! अच्छा तस्वीर btw"
0,"उपयोगकर्ता क्षमा करें, कल शाम कोई ट्वीट नहीं, 'कोई कनेक्शन नहीं ..."
0,मैं स्तंभ मोड में खोजकर्ता प्यार करता हूँ! मेरी विंडोज मशीन ने कभी ऐसा क्यों नहीं किया!?
0,"उपयोगकर्ता: हाँ, मैं कल वास्तविक दुनिया में वापस आ गया हूँ। इसलिए मेरे पास मेरा फेयर शेयर मुझे कस्ट डिसरिएमेंट्स होगा।"
1,उपयोगकर्ता का मज़ा है? शुभ प्रभात
1,आज महारत हासिल करने वाले ट्रैक हो रही हैं !! फिर प्रेस के लिए बंद .. हर एक साथ आ रहा है!
1,"गोद में gf के साथ बैठे, *खुश *"
0,मेरी माँ ने लिंकन स्क्वायर मॉल में खरीदारी करने का फैसला किया .... LOL भगवान वहाँ खाली। मैं अपनी अंगूठी के बिना नग्न महसूस करता हूं .... इसे याद करें।
0,"उपयोगकर्ता मुझे यकीन है कि साइमन-सोक्स आपको भी याद करते हैं;) जब आप वहां नहीं होते हैं तो उन्हें ज्यादा ध्यान नहीं मिलता है, वह उन्हें जंजीर में रखता है"
1,मेरा दिन अच्छा रहा।
0,उपयोगकर्ता उसने मुझे अपना मर्च भी नहीं दिया। मैंने उसे पांच मिनट के लिए देखा लेकिन वह बहुत व्यस्त था। और उसे भ्रमित नहीं करना चाहता था
0,"उपयोगकर्ता आप टेलर को भूल गए, उसके पास यहां प्रोफ़ाइल नहीं है।"
0,होमवर्क और बहुत कुछ
0,उपयोगकर्ता कब आप घर आ रहे हैं बीए? 8- |
0,बिस्तर पर जा रहे हैं ... एक और रात जो जल्दी से समाप्त हो गई।  बेहतर भाग्य कल?  कौन जानता है ... शायद नहीं।
1,कल स्कूल के लिए तैयार होना मेरे बेस्टफ्रेंड को देखने के लिए इंतजार नहीं कर सकता! मैं अगले साल कॉलेज जा रहा हूँ! yeehaa!
0,"उपयोगकर्ता उम, फ्रैड नहीं ..."
1,"उपयोगकर्ता यू को केकड़े के बाकी लोगों के साथ अंटार्कटिका में जाना चाहिए, मुझे यकीन है कि उपयोगकर्ता मज़ा में शामिल होगा!"
0,"एलेक्सिस के पास सबसे खराब डायपर दाने हैं, वह रोती है जब वह पॉटी जाती है, यह वास्तव में दुखद है"
0,खांसी रखता है। मेरा गला मुझे मार रहा है !!
1,पटक देना। रात और गीत क्रिस।  एक्स
0,सवारी करना चाहता है !!!! बेवकूफ बारिश !!!!!!!!!
0,उसने VH1 को बंद कर दिया
0,एक गोफन और धड़कन में हाथ
1,धूप निकली हुई है!
1,jammin to weezyy babyyy
1,मेरी बहन के साथ।
1,यहां मजाकिया टिप्पणी डालें!
1,उपयोगकर्ता मेरा काम यहाँ किया जाता है
1,"उपयोगकर्ता ""डैनी जोन्स अत्यधिक बुद्धिमान है ... फुर्तीली ... यौन"" मैं पूरी तरह से पिछले एक से सहमत हूं।"
0,उपयोगकर्ता कल सिनॉप्टिक या डीजे और शेक्सपियर है? मुझे यह भी नहीं पता।
1,"उपयोगकर्ता घोस्ट राइडर ... ट्रांसफॉर्मर ... और टॉम फ्लेचर!  हाह, आशा है कि आप एक अच्छा समय बिता रहे हैं।  हालांकि आप अभी भी मुझे जवाब नहीं देंगे।"
0,मेरे सह कार्यकर्ता की 17yr पुरानी भतीजी को उम्मीद है कि सब कुछ काम करता है
0,उपयोगकर्ता वास्तव में? हमें लगता है कि उसका शो यहाँ नहीं है
1,उपयोगकर्ता हाय आज कैसे आर यू?
0,"बिल्ड 39 में उपयोगकर्ता, मिरांडा को अभी भी मिरांडा फ़ोल्डर में प्रोफाइल नहीं मिलती है, यह हमेशा AppData में एक नया बनाना चाहता है ..."
1,"@ Cgigandet: यदि आप ऑनलाइन हैं, तो कृपया मेरा अनुसरण करें ... एक इच्छा मेरे लिए सच हो जाएगी।"
0,"अतृप्त लग रहा है। अब मेरे पास ओएस 3 है, मैं चाहता हूं कि 3 जी एस- अभ्यस्त हो, हालांकि- जर्मनी का टी-मोबाइल हमें अपग्रेड के लिए एक वर्ष की प्रतीक्षा करता है।"
1,एक अच्छे मूड में है
1,ईरान से दोस्त बनाने के लिए देख रहे हैं। मुझे यहाँ चर्चा!
1,आश्चर्य है कि इतने सारे लोग मेरा अनुसरण क्यों करते हैं तो रुकें? क्या उन्हें लगता है कि मैं कोई और हूँ ..? ओह अच्छा
1,यूजर फ्री डिनर और लावो में एक बोतल के साथ जन्मदिन का उत्सव! और मुझे कल काम करना है! हाहा दिलचस्प होना चाहिए
0,तूफानों के कारण पावर आउट।
0,उपयोगकर्ता ओह शिट मुझे अभी याद है कि ट्विटर आपकी कुंडली पोस्ट करता है बिना वास्तव में आप ऑनलाइन होने के बिना
1,"उपयोगकर्ता उस साथ, महिला को भेजें।"
0,मुझे अस्पताल की कॉफी से नफरत है!
0,लिब्बी मेरे डैडी URL को याद कर रहा है
0,"मेरे पति के साथ बिस्तर पर लेटकर, अंत में सोने का प्रयास किया। काश मैं इतने दर्द में नहीं होता!"
1,उपयोगकर्ता URL - पोशाक पर अच्छा विवरण .. क्या यह उसके हाथ में एक लॉटरी टिकट है?
1,LIGHIE LIZZIE और GEARS 2 खेलना
0,उपयोगकर्ता एक एडिनबर्ग गिग के लिए कोई योजना है?  आज रात ग्लासगो नहीं बना सकते
0,माइली के बारे में उपयोगकर्ता वाट
0,नहीं शकीरा का गाना 2 दिन। इसे चोदना
0,आज बहुत गर्म है
1,अगली बार जब आप Hollywood.tv से Alyson के साथ हैं .. तो कृपया एक तस्वीर लें! हमें यह देखने की जरूरत है कि वह क्या दिखता है। आशा है कि आप अच्छी तरह से हैं
0,मेरी किटी को डरा रहा है
1,पास हो रहा है !!  बाहर जाना चाहते हैं और फिर से अच्छा भोजन है! - URL
1,"हो सकता है ........... ""फिआ की तुलना में? n"" ="
1,उपयोगकर्ता मुझे पता है क्यों !!
1,काम पर लोगों से प्यार है
0,अब यह वास्तव में विडंबना है! पता नहीं क्या करना है
0,उपयोगकर्ता मेक्सिको का आनंद लें। मैं अपने स्व निदान स्वाइन फ्लू का आनंद नहीं ले रहा हूं
0,idon'tfeelikeironingggggg।
0,उपयोगकर्ता yup!
1,"हमने एक अच्छा दिन समाप्त कर दिया, लेकिन आदमी हर किसी की एलर्जी icky है !!  वह ठीक है! मम्मा जानता है कि मेरे चालक दल की देखभाल करने के लिए क्या करना है!"
1,बस मजाक मैं तुमसे प्यार करता हूँ !!!!!
0,यह tmnt गेम पूरी तरह से #e3 चूसना है
0,"मेरा फोन मिला, और सैट प्रीप स्टफ कर रहा था"
1,जेफ के साथ डिनर पर जाने के बारे में
1,"वापस आ गया, लोग।"
0,क्या किसी के पास एक मूल अंतिम कट स्टूडियो 2 सीरियल नंबर है जो वे मुझे उधार दे सकते हैं? किसी कारण के लिए मेरा काम नहीं करेगा धन्यवाद!
1,"7-11 से काम कर रहा है, 1 पर स्नातक स्तर की पढ़ाई पर जा रहा है और रात के लिए चेल्सी की ग्रेड पार्टी!"
1,उपयोगकर्ता prohost.lt
0,उपयोगकर्ता हा! यूएस यूके यूजर्स के लिए कोई आवाज नहीं है
1,साफ और मेरा मेकअप कर रहा है
1,उपयोगकर्ता बहुत सच है! लोगों को 2 प्यार/दयालुता का तरीका दिखाने में मदद करना। काश मैं उन सभी साइटों को हटा सकता हूं *साइन *। यू एक अच्छा दिल है!
0,"सर्जरी की वसूली के लिए एक अच्छा दर्द दिन नहीं है, लेकिन मुझे कंप्यूटर पर बैठकर अपने पैर को ऊंचा करने का एक तरीका मिला!"
1,आह। डेमो टीम प्रतियोगिताओं। मैं स्वर्ग में हूँ अब भगवान मैं इस बकवास को याद करता हूँ।
0,"काश बीएमडब्ल्यू इन क्वालीफाइंग सत्रों में चिकन नहीं खेलता, यह मुझे कोई अच्छा नहीं करता है"
0,उपयोगकर्ता मैं वास्तव में टोरंटो में आप लोगों को देखना चाहता हूँ !!! मेरे मिशन दोस्ताना खोपड़ी खोजने के लिए है
1,उपयोगकर्ता Bufala एक प्रकार की गाय है जो आप एक विशेष और वास्तव में स्वादिष्ट मोज़ेरेला बनाते हैं- लेकिन एक बुफला भी एक बड़ा बकवास है
0,पीटर पाइपर में नूह के जन्मदिन के लिए! मजेदार समय!  ... ऑर्डर से आधे खेलों को छोड़कर।
1,हम उसे वास्तव में प्यार नहीं करते।
0,"उपयोगकर्ता मुझे कभी जवाब क्यों नहीं देता है, उसे वास्तव में मुझसे नफरत करनी चाहिए: एल"
0,मेरे पास उन चीजों के लिए बहुत सारे सामान हैं जो मैं भूल जाता हूं कि मेरे पास क्या है
1,उपयोगकर्ता वाह! रास्ता अच्छा लगता है।  परियोजना और अपने फाइनल के साथ सभी बेहतरीन।
0,वाह मुझे लगता है कि एक लंगड़ा tonite
1,उपयोगकर्ता मैं समझता हूं कि कंप्यूटर फिर से मज़ेदार हैं!
1,यह जाम सत्र है और जैज़ को सुन रहा है। मैं जैज़ से प्यार करता हूँ यह हमेशा मुझे ठंडा महसूस करता है
1,वह यम था
0,पीने का सूप और सोच वता ने अगला ..... E5555555555 I WANA TRAVEEEEEEEEEEL
1,उपयोगकर्ता:-डी खुशी है कि आपने इसका आनंद लिया!  हम इसे करने का भी आनंद ले रहे हैं।  ट्विटर और फेसबुक से 20+ नामों की एक सूची मिली।  #Tweetiepoll
1,"उपयोगकर्ता ""हमारे गर्म के लिए चिल"""
1,उपयोगकर्ता आप कैसे हैं? गुड लक 'अपने करियर का मुकाबला!
1,"उपयोगकर्ता यह छह पाउंड है, लेकिन यह हवाई अड्डे पर था इसलिए आम तौर पर बहुत सस्ता है।"
1,अपनी पुस्तक लॉन्च पार्टी के लिए इस सप्ताह के अंत में NYC जा रही है!
0,रविवार आप उबाऊ हैं
1,"निश्चित नहीं है कि वास्तव में आज क्या चल रहा है, लेकिन उम्मीद है कि आज रात रयान के घर जा रहे हैं"
1,"उपयोगकर्ता निष्पक्ष होने के लिए, हालांकि, मैं उनकी राय पसंद करता हूं"
0,"उपयोगकर्ता यह wuzzz नट! मैं बस घर गया n मुझे मिला हो गया! पिछली बार जब से मैंने 830 बजे खाया था, तब से कोई ब्यूनो नहीं था"
1,"""जब आप मीलों दूर होते हैं, तो यह ठीक है कि मुझे आपको कहने की आवश्यकता नहीं है: मैं आपको चाहता हूं!""  : डी: डी"
1,"उस खूनी को पूरी तरह से अविश्वसनीय, अद्भुत, शानदार शब्दों का वर्णन कर सकते हैं, सभी प्रयास और पैसा इसमें चला गया xx"
0,1/2 जिस तरह से हम सोचते हैं कि एक ओक लीफ है और सीखा है कि मैं पेंट करने के लिए तैयार होने से 3 दिन पहले लाइन ड्रॉइंग सेट नहीं करना सीखता हूं; नमूना की मृत
0,उपयोगकर्ता एस्टी ला फ्रू? यह विश्वास नहीं कर सकता! NOI SUNTEM LA STUDIO PESTE DRUM ... DAR NU PUTEM IESI ACUM PUPAM!
0,हालांकि पैर में चोट लगी है
1,उपयोगकर्ता मेरे घर से मैनचेस्टर में ग्रामीण इलाकों में चोरल्टन में नेचर रिजर्व में बैठ गया
0,उपयोगकर्ता आप अकेले प्यार नहीं कर रहे हैं! मैं सो नहीं सकता
0,गोधूलि भूल गए और वापसी कर रहे हैं
1,उसके बारे में सोचकर ... मैं आज उसे देखने के लिए इंतजार नहीं कर सकता!
1,"कोई भी मुझे स्नो पैट्रोल के नए एल्बम का नाम बताना चाहता है? मैं व्यक्तिगत गाने डाउनलोड करने के लिए बहुत आलसी हूं, इसलिए मुझे पूरा एल्बम मिल जाएगा।"
0,उपयोगकर्ता - सिर्फ रॉक एम रिंग 2009 के फुटेज देखा।  वास्तव में अफसोस बर्लिन में शो देखने में सक्षम नहीं है ।।
0,ओह मेरी दीया संता तंपान मैं तुम्हारा बनना चाहता हूं
0,स्कूल से घर .. ब्रेन में दर्द होता है और यह बरसात है
1,उपयोगकर्ता आपके बारे में सोच रहा है
0,मुझे रिलायंस के बारे में कुतिया से नफरत है !! लेकिन मुझे ब्रिटिश काउंसिल में शून्य कवरेज मिलता है !!!!! मेरे फोन में कल शाम को कोई कवरेज नहीं था !!
0,उपयोगकर्ता इस सप्ताह के अंत में आपको देखकर खुश है !! यह बहुत लंबा हो गया था!  आशा है कि आपके पास एक सुरक्षित यात्रा घर था!
0,उपयोगकर्ता क्योंकि चर्च सेक्स छिपाते हैं और अक्सर युद्ध करते हैं .... दुख की बात है
0,बस परीक्षा खत्म होनी चाहिए ताकि मैं अपने पोप्स <3 के साथ चिल कर सकूं
0,"मैं माइस्पेस पर नए गीत ""वन डे"" को समाप्त कर रहा हूं"
0,उपयोगकर्ता कैसे कटिस्नायुशूल से छुटकारा पाने के बारे में
0,"3 बजे सो जाना, एक पंक्ति में 4 रातें समाप्त हो रही हैं"
1,एक आलसी रविवार का आनंद ले रहा है
1,"Ive ने इस गर्मी में मेरी सभी परीक्षाओं को विफल कर दिया! = डी डीरड्रे मुझे मार डालेंगे, लेकिन सूट!"
0,भारत एक वार्म अप मैच में न्यूजीलैंड से हार गया ...
1,अलविदा कहो और आपको एक अच्छी शाम की शुभकामनाएँ!  Keepâ ofon shinging
0,एक पूर्ण बेवकूफ है जो आपके लायक नहीं है
1,मेरे रन से वापस ... यह एक अच्छा था
0,मैंने सिर्फ एक मरे हुए बच्चे को देखा
0,अलविदा मेरे कॉम्परचर खेल रहा है ...
1,मुझे पैसे धोने के लिए बनाया जा रहा है .. ओह डियर लोल। और पकाने से मेरी उंगली पर एक छाला है।
0,"परिणाम: मैं रोता नहीं था, लेकिन यह हर बादल में एक बहुत बुरा दिन था, हालांकि कोई व्यक्ति मुझे खुश करने में सक्षम होने पर कुशल हो रहा है ..."
0,सिर के लिए उपयोगकर्ता धन्यवाद। उन्हें मेरा वोट नहीं मिल रहा है।
0,"""डिवाइस, \ device \ harddisk0 \ dr0 को देखकर, एक बुरा ब्लॉक है।"" मेरे लैपटॉप हार्ड-डिस्क में त्रुटियां। अच्छा नहीं है। पूरी डिस्क का बैकअप लेने का समय।"
0,"टूटी हुई वाशिंग मशीन, ईजीएम, बीमारी सभी चीजें जो मुझे अभी से निपटने के तनाव की आवश्यकता नहीं थी"
0,"उपयोगकर्ता मुझे नहीं पता कि आप सब कुछ क्यों नहीं दिखाते हैं, बस मजाक कर रहे हैं! मैं तुमसे प्यार करता हूँ, जितनी जल्दी हो सके ब्राजील वापस आओ! Â Â Â Â Â Â Â Â Â Â Â"
