1,"क्षमा करें, इसमें देरी हो रही है! उपयोगकर्ता ने रविवार रात बड़े समय पर गुंबद को हिला दिया !! वह अभी भी अपनी धड़कनों से जागरूक थी।"
1,इस धूप को प्यार करता है मेरे मैमी के साथ पिकनिक के लिए किया गया है
0,उपयोगकर्ता मुझे आशा है कि यह कपड़े या भोजन नहीं था।
0,"आज कोई कैमरा डे नहीं था, इसे याद किया। जूरी ड्यूटी, आदि .... कल रैंडमाइज़र के साथ काम करने के लिए एक और फ़ंक्शन या विषय का चयन करेगा।"
1,"उपयोगकर्ता ए) कोई ट्रॉली, बी) आपने नहीं पूछा है!  (मैं क्या हूँ? एक पैक खच्चर!?"
1,केवल एक घंटे की तिल मैं घर जाता हूं
1,उपयोगकर्ता अच्छी नौकरी लड़की
0,"उपयोगकर्ता इस समय एक सर्वर बदल जाता है, मुझे लगता है कि सभी साइटों को स्थानांतरित कर दिया गया है लेकिन मेरा"
1,उपयोगकर्ता और उपयोगकर्ता के साथ amours bday के लिए 12 के लिए नेतृत्व किया
0,"Im अकेला मुझे कंपनी रखो! 22 महिला, याकिमा - वाशिंगटन"
1,"उपयोगकर्ता वहाँ था, मैं इसका भयानक कह सकता हूं।  मुझे वास्तव में यह पसंद है।"
1,"उपयोगकर्ता कूल।  कृपया, क्रोएशिया में आने पर विचार करें। ""कैंडी"" ने हमारे सबसे लोकप्रिय रेडियो स्टेशन चार्ट पर एक नई प्रविष्टि के रूप में नंबर 33 को हिट किया।"
0,मैंने अपनी जीभ इतनी मुश्किल से मुझे जगा दी! OWWWW
0,उघह .... उदास दिन।
1,शराबी।   ... मैं अब एक कम्यून में लाइव की तरह हूं। यह बहुत अच्छा है। <3
1,उपयोगकर्ता मैं एक और गीत w/गेराज बैंड लिखने की प्रक्रिया में हूँ। मुझे लगता है कि मैं 1 गीत के लिए 4/4 समय से चिपक सकता हूं
1,ध्यान रखना झुकना! एक धन्य रात है!
1,उपयोगकर्ता क्या एक महान कार्यकर्ता! अगर मैं कर सकता तो मैं तुम्हें काम पर रखूंगा !!!
0,"तो, मुझे पूरा यकीन है कि मेरे पास इस सप्ताह करने के लिए बहुत ज्यादा है ... आशा है कि मैं जीवित रहूंगा !!!"
1,aw yay:] अच्छा ish बुरा दिन अमांडा कल?
1,"उपयोगकर्ता ठीक है, यह आपके सुझाए गए ईमेल नाम का उपयोग करने जा रहा है। मैं यू हैप्पी एचआर ड्रिंक्स देता हूं"
0,"यह बहुत है ... ""सनी नहीं"" यहाँ सैन जोस में .. क्या यह गर्मियों में नहीं माना जाता है!?"
1,"सेंट मरे पर उपयोगकर्ता, टिप्पणी करने के संरक्षक संत, हम सभी सहमत हो सकते हैं!  #F1"
0,"काश मैं 10 वीं नहीं छोड़ता, इसलिए मैं अपने घर पर thmdk कर सकता था"
0,कुछ घंटों में मेरी परीक्षा है
1,"उपयोगकर्ता मीठा, आप थोड़ा सा .. x"
1,लंदन जा रहा है
0,बुरी माताओं का दिन। 12am मेरे कुत्ते और सबसे अच्छे दोस्त के पास एक जब्ती थी। सुबह 6 बजे। सुबह 8 बजे आरआईपी एल्विस को बुरी तरह से याद किया जाएगा
1,"उपयोगकर्ता lmao ओह गंदगी यह असली लग रहा था मुझे लगता है कि मैं वास्तव में बहुत अधिक देख रहा हूँ, मुझे लगता है कि मुझे अच्छा काम लगता है, बहु-प्रतिभाशाली मैं देख रहा हूँ"
0,"बोल्ड पाने के लिए $ 400 से अधिक खर्च नहीं करने का फैसला किया, भले ही मैं वास्तव में यह चाहता हूं कि यह छूट के बाद $ 199 है, लेकिन अभी भी $ 299 का भुगतान अभी है!"
1,उपयोगकर्ता अनाम प्रेषक
1,"वाह, क्या एक पागलपन से 4 दिन।"
0,"अभी बीमार लगता है। मैं वास्तव में करना चाहता हूं, लेकिन मैं नहीं कर सकता"
0,आज कोई चिकन नहीं
0,उपयोगकर्ता काश मैं एक और कारमेल कर सकता था .... - मैं सिर्फ आपको वेगास में उन्हें सौंपने का एक वीडियो देख रहा था।
1,उपयोगकर्ता मैं आपको मिला। ऐसा करने के लिए धन्यवाद। बस कुछ दिनों के लिए और मैं अपने कैटी फिक्स के लिए जोन्सिन था। आपका दिन अच्छा रहे।
0,काम पर
0,पूरी तरह से उदास
0,उपयोगकर्ता ठीक वैसे भी धन्यवाद
1,उपयोगकर्ता हाँ रास्ता
0,@ द वर्ल्ड: ठीक है यह हास्यास्पद है कि मैं पिछली रात से इतना नशे में हूँ
1,LOL उपयोगकर्ता मुझे रोकना बंद करो !!
1,डी-डे की 65 वीं वर्षगांठ। अगर बच्चा आज पैदा हुआ है तो मैं बहुत गर्व करता हूं। हालांकि संभावना नहीं है
1,बस बाहर लेट गया। एक स्नोकोन पाने के लिए जा रहा है
0,उपयोगकर्ता ऊह पू उसके साथ शुभकामनाएँ! एक तस्वीर देखने के लिए प्यार जब वह निर्माण किया है !!
0,"मुझे नहीं लगता कि कोई भी वास्तव में समझ सकता है कि अमेरिकी संविधान कितना उबाऊ है, जब पढ़ना है तो इसके सभी धूप बाहर"
1,सुप्रभात कहते हैं ..* url
0,"अब 38 पर अस्थायी। ओह, मुझे आशा है कि मैं अभी भी इसे शिविर टीएमआर के लिए बना सकता हूं !!!! लेकिन मुझे लगता है कि मैं जाप भोजन को एक मिस देने वाला हूं"
1,"उपयोगकर्ता मोयल्स = बोनो, लोल! आप शुक्रवार को कागज में थे, यह दिन के अंत में सभी प्रचार है"
1,उपयोगकर्ता वह एक पटाखा है .. ग्राहकों का अपमान करना पसंद करता है मुफ्त रिफिल्स ftw
0,उपयोगकर्ता मेरा एक दोस्त .. मुझे परेशान करता है .. हाहा। एनवीएम। ;) केएसपी सिया।
0,"मैंने अपना 8start तोड़ दिया, मुझे इस ऐप के अपने संस्करण का पुनर्निर्माण करना होगा"
1,"आज मेरे सर्वश्रेष्ठ के साथ एक गुणवत्ता का समय है, धन्यवाद भगवान .."
1,"उपयोगकर्ता mmmmm, मेरी पूरी स्क्रीन आपकी उछालभरी उछालभरी, हा हा से भरी हुई है।"
1,उपयोगकर्ता को कनाडा में कहीं होना चाहिए या हम अटलांटिक-डेलाइट-टाइम-टस्डेज़ स्थापित कर सकते हैं और फिर यह यहां भी होगा
1,"शाम की ट्विप्स। दुकानों पर, मफिन ब्रेक की मुफ्त वाईफाई पर यह कैसे हो रहा है? (पीएस मेरे पास एक अच्छा समय था जहां हम गए थे)"
0,बारिश बारिश दूर जाना
1,"OKEY, उपयोगकर्ता IOS संस्करण EIGRP सारांश का समर्थन नहीं करता है (विज्ञापित नहीं)। अब लैब के नियमों को तोड़ने की जरूरत है"
1,"उपयोगकर्ता ओह, मैं देखता हूं..ड्रा। शायने !!"
1,मेरे छल्ले के बारे में इस लेखन के लिए उपयोगकर्ता को धन्यवाद!  यूआरएल
1,उपयोगकर्ता क्या मुझे अपने शीर्ष दोस्तों पर #Myspace पर होना है ?????????
0,मेरी ट्रेन छूट गई
0,"बस मेरे 4 साल के रिश्ते को समाप्त करना समाप्त हो गया .... मैं एक स्वतंत्र महिला हूं, लेकिन एक टूटा हुआ भी।"
0,Im एक महीने के लिए जेम्स को देखने वाला नहीं है
0,उपयोगकर्ता मुझे नींद आ रही है। मैं यह मदद नहीं कर सकता हूँ मैं हरा दिखता हूँ!
1,उपयोगकर्ता अच्छी तरह से आप यहाँ आ रहे हैं और खी के पास आ रहे हैं .. अजीब
1,मैं '' जोनास '' शो में दुखी हूं। डिज्नी पर अच्छे शो = हन्ना मोंटाना और विजार्ड्स ऑफ वेवरली प्लेस।
1,माकिन 'लेमन बार्स
0,"उपयोगकर्ता बगुला गया!  यह बहुत अजीब है। मैं यह सोचकर गया था कि मेरे सहकर्मी ने लड़की के साथ मेरा लैपटॉप स्थापित किया था जिसे मैं प्रशिक्षण दे रहा था, लेकिन उह .. नहीं"
0,मैंने वेबसाइट पर एक NKOTB शर्ट बनाने के लिए बहुत सारे घंटे बिताए। मैं 2 इंतजार नहीं कर सकता! हा! मुझे पसंद नहीं है कि अन्य लोग इसे पहन सकते हैं 2 ..
1,उपयोगकर्ता शुभ रात्रि! Mwah!
0,उपयोगकर्ता मैं हेडर द्वारा चकित tres हूँ। अगर मेरे पास कोई लेआउट स्किलज़ होता तो मैं आपकी मदद करता बी.बी.
1,"उपयोगकर्ता अच्छी तरह से, इसका आनंद लें, और एक महान दिन है आप हमारी बारिश में स्वागत से अधिक हैं। मुझे नो लाइक, लोल"
0,"उपयोगकर्ता जो ऐप बहुत मजेदार है, लेकिन मैंने कल रात एक वास्तविक स्थिति में इसका उपयोग करने की कोशिश की और यह मेरे फोन को दुर्घटनाग्रस्त करता रहा"
1,उपयोगकर्ता थाई वेबसाइटों को अपने नाम URL द्वारा रैंक नहीं करना चाहिए
0,उपयोगकर्ता मैं इस पर जाना पसंद करूंगा लेकिन यात्रा करने के लिए थोड़ा दूर है
1,URL - न्यू मून टीज़र ट्रेलर आशाजनक लगता है। यह गोधूलि से बेहतर है!
1,मैं अपने बाल हो गया!
0,"उपयोगकर्ता वे सदमे में थे, पिछले साल ओशकोश बाढ़ का शिकार हुए थे .. जब वह अपनी बिल्ली के बारे में सुना तो वह गिर गया ..."
1,उपयोगकर्ता हे यो
1,मेरे ब्लॉग पर एक नई पोस्ट। मेरे दादा -दादी के बारे में URL
1,आह्ह देर रात मार्गरिट्स मुझे बीम बनाते हैं।
1,"उपयोगकर्ता उसे बताता है कि वह मम्मी बहादुर छोटा सैनिक है और वह कोशिश करेगा और खुद के लिए चीजों को गंभीरता से करूंगा, हालांकि, मुझे आशा है कि वह ठीक है"
1,उपयोगकर्ता तो इसका मतलब है कि आपकी बैकपैकिंग यात्रा जल्द ही शुरू होगी? क्या आप उत्साहित हैं?  यात्रा कब तक होगी?
0,उपयोगकर्ता मैं इसे अभी देख रहा हूं और मैंने वही बात कही है
0,ये लोग पागल हैं !! इसकी तरह वे हमेशा मुझे देख रहे हैं..तो 4 मेरी अगली गलती। उन्होंने पहले ही आज रात कई बार मुझ पर हमला किया
1,FAM और करीबी दोस्तों के साथ NOBU में फैंसी स्मैंसी डिनर। किराए 37 वीं वर्षगांठ मना रहे हैं! WOWZERS !!!  चालक दल अच्छा साफ करता है!
0,मैं माइक के फोन कॉल को याद कर रहा हूँ !!!
1,"उपयोगकर्ता मैं यहाँ हूँ ... आप? लानत है, मुझे 3 और अनुयायी मिले"
1,"उपयोगकर्ता ने आपको YouTube पर SSB गाते हुए देखा। तुम अदभुत थे! अफ़सोस आरएसएल नहीं जीतता। ओह ठीक है, आप के लिए शुभ रात्रि और ध्यान रखना!"
1,उपयोगकर्ता को उम्मीद है कि मोमबत्तियों को 2.30 बजे रोशनी मिलेगी। तब आप देखना
1,उपयोगकर्ता को वास्तव में केवल हार्ड ड्राइव पर ओएस एक्स स्थापित करना है और इसे स्कूलों के आईएमएसी पर बूट करने के लिए प्राप्त करना है।
0,उपयोगकर्ता बहन ने कहा कि यह Awsome नहीं जा सकता था। मेरे पास परीक्षा थी
0,जो चीजें मैं 4 यूथ डीपीटी @ चर्च करता हूं ... गोट्टा ट्राई 2 याद रखें फिर भी मैं फिर से बढ़ता हूं 2 फिर से 2 परफॉर्म
0,asdfasdfasdfasdf ;; आपकी याद आ रही है!
0,im भूखा ... मैंने वह किया जो किसी भी माँ को करना चाहिए .. मैंने सुनिश्चित किया कि मेरा बेटा खा गया ... लेकिन अब मैं क्या खाने जा रहा हूं ???
1,उपयोगकर्ता के लिए एक बहुत अच्छा दिन है केली
1,उपयोगकर्ता यह देखते हैं कि आप सैक्रामेंटो में कब आ रहे हैं जो मेरे दिमाग में है
0,डाउनटाउन पोर्टलैंड उबाऊ है जब आपका टूट गया है तो हर 1 में कवर चार्ज क्यों है ????
1,इस्तेमाल की गई कारों की बग्स लाइफ: एल इनक्रेडिबल्स
1,Lmaooe Keisha मूर्ख है!
1,उपयोगकर्ता मुझे एक विस्तारित संस्करण rewatch करना है ... मुझे वह लानत फिल्म श्रृंखला बहुत पसंद है
0,इस बास्केटबॉल खेल में जाने के बारे में ... पुराने हुड का समर्थन करें! हा हा वे कभी सामने नहीं! बकवास नकली गधा ppl dnt मुझे बुलाओ
1,सिस के साथ कुंग फू पांडा देखना
0,"उपयोगकर्ता awwww जल्द ही ठीक हो जाता है, आप कल स्कूल जाने वाले हैं? XXX"
1,"उपयोगकर्ता हन्ना रो रहा है, पेसिंग ... क्यूज यू ने जीसी लिया।"
0,OMG मैंने सिर्फ एक लड़का एक लड़की कहा। मैं बहुत बुरा लग रहा है। लेकिन मैं भगवान की कसम खाता हूं कि वह एक जैसा दिखता था।
1,उपयोगकर्ता कॉलेज दोस्त यहाँ? कृपया मुझे बताएं कि क्या यू ने फैसला किया 2 आओ। नेकां सुंदर यू पता है !!
1,उपयोगकर्ता haha ​​यकीन है कि मैं आपको ले जाऊंगा। याद रखें जब आपको गोधूलि पसंद नहीं था ... योग्य
0,उपयोगकर्ता मैं तुम्हें बच्चे को याद आती है!   मैं भी बीमार महसूस करता हूं
0,मैं दयनीय बू की तरह हूँ
1,उपयोगकर्ता सुपर कार्लॉस
1,"एक और धूप, कैनकन में स्वाइनफ्लू-मुक्त दिन!"
1,उपयोगकर्ता उपयोगकर्ता उपयोगकर्ता हां मैं पूरी तरह से सहमत हूँ!  ANNOOP FTW !!!  ज़ोर-ज़ोर से हंसना!
0,"उपयोगकर्ता Dammit आप मेरी सूची में आज वापस आने के लिए हैं, मैं शनिवार को नहीं कर सकता यह मिया की जन्मदिन की पार्टी (जेरेमी और कैथरीन) है"
1,"रूममेट बाहर निकलता है, घर की सफाई करता है, और अब यह हम में से सिर्फ 3 होने के लिए वापस आ गया है। वाह"
1,"उपयोगकर्ता नया चाँद = = lol। पी। एस। सुपर गर्व मेरे बच्चे अल्बा पर गर्व है, लेकिन नहीं, इसका मतलब यह नहीं है कि आपको फाइनल के लिए अध्ययन करने की ज़रूरत नहीं है।>"
0,उपयोगकर्ता Awww आप कैसे बीमार हो गए?
1,उपयोगकर्ता वाह। काश मेरे फ़्लुक्स ऐसे होते
1,उपयोगकर्ता आकर्षक
0,भाड़ में जाओ मैं एक बार फिर बिल्ली पर बैठ गया
1,"उपयोगकर्ता अविश्वसनीय, लेकिन भयानक कल हम (मैं और उपयोगकर्ता) जुबली के बारे में बात कर रहे हैं..त"
1,उपयोगकर्ता gnight।
0,यह आश्चर्यजनक है कि वास्तव में मेडफोर्ड में 3 जी सिग्नल और गति है। एटी एंड टी 3 जी डेटा कवरेज में अनुदान पास बेकार है।
0,"उपयोगकर्ता मेरे पास अभी भी इस पर खेलने का समय नहीं है, शायद यह एक है, हे। मुझे बस पेरिस यात्रा के लिए इसकी आवश्यकता है। मैं वास्तव में ब्लैकबेरी पसंद करता हूं"
1,"उपयोगकर्ता hahaha मुझे इंद्रधनुष पसंद है! मुझे आपकी पृष्ठभूमि भी पसंद है, मैं देख रहा हूं कि उनके पास अब एक नया विज्ञापन है! इस सप्ताह के अंत में प्रस्ताव आ रहा है!"
0,3 तक काम करना
1,जोनास ब्रदर्स संगीत
0,सोचता है कि मैं प्यार करने वाला खेल छोड़ने वाला हूं ... मैं इसे अब और कर सकता हूं
1,उपयोगकर्ता बहुत अच्छा है मुझे खेद है
1,उपयोगकर्ता की तरह लग रहा है कि बारिश के लिए मुझे आशा है कि यह मजेदार था
0,हाँ बस मेरा फोन वापस मिल गया ... बेकार है कि मुझे अपने सभी संपर्क फिर से प्राप्त करना है
0,"अर्घ, गलती से कल रात मेरे संपर्क लेंस के साथ सोया था"
