0,"मुझे बेकर्सफील्ड से नफरत है और मुझे बंदरगाहों से नफरत है, मुझे पहले से ही घर जाने दें।  मैं अपनी छुट्टी शुरू करना चाहता हूं।"
0,उपयोगकर्ता को लगता है कि एक lil मतली अभी अच्छा समय देखें। दीदी और वह लानत सिरोक।
1,"जानकारी के लिए thxs और हम बाद में ड्राइव करेंगे, पागल मौसम न्यू जर्सी को बर्फ और ओलावृष्टि मिली।    सीबी"
1,उपयोगकर्ता ज्ञान जॉर्डन के अपने शब्दों के लिए धन्यवाद
0,बस एक मिनट के लिए धूप में बाहर हो गया है ... लेकिन दुर्भाग्य से वापस अंदर आना पड़ा।
1,"उपयोगकर्ता ठीक है, उन में से। यह या तो 'जूक बॉक्स हिट' है या 'चित्र' मैं अपना मन नहीं बना सकता। उन दोनों को प्यार करो, साथ ही साथ गाना"
1,हैलो ट्विटर
1,उपयोगकर्ता OOOH - अब यह एक शो है जिसके बारे में हम बात कर सकते हैं!
1,"उपयोगकर्ता अच्छी तरह से, यो नेचुरल नेगा नैप्स और फ्रॉ फिर से सांस लेते हैं, रैना!"
1,"पुन: उपयोगकर्ता मैं वास्तव में उस वाक्यांश को पसंद करता हूं: anpoppous ass things अच्छा लगता है, इसे और अधिक URL का उपयोग करना शुरू करें"
0,बाड़ के लिए तैयार होने के लिए तैयार है।
1,उपयोगकर्ता: LOL !!  nincs!
0,उपयोगकर्ता मिकी ... जहां आर यू
1,उपयोगकर्ता मुझे वह उद्धरण पसंद है
1,बिन बुलाए इतनी अच्छी फिल्म थी
0,क्या सिरदर्द देख रहा है दोस्तों को क्षतिपूर्ति होगी? : L
0,यह पता लगाने की कोशिश कर रहा है कि वीडियो फ़ाइलों के एक सेट का स्थानांतरण क्यों नहीं किया गया जैसा कि विज्ञापित किया गया है - सीम यह ठीक से फिर से कोशिश नहीं करता है!
1,उपयोगकर्ता यह एक खुशी है जो आपके द्वारा डंक मार रहा है
1,उपयोगकर्ता वह और उसके बैंड हॉलीवुड में आज रात एक शो कर रहे हैं।
1,"उपयोगकर्ता मुझे लगता है कि कानूनी लड़कों को माइली जैसे, जब तक कि अधिकांश जनता यह सही है कि लड़कियां थोड़ी उबाऊ हैं"
1,उपयोगकर्ता को सुनने के लिए एक अच्छा नया इंडी बैंड चाहिए? किसी को पता है?
0,"@ कैथे स्टारबक्स, ताश खेल रहे हैं। मुझे नहीं लगता कि ब्रिज खेलने के लिए एक अच्छा समय खेलने के लिए एक अच्छा समय था। आह।"
1,बड़े कप कॉफी शुरू करने के लिए मुझे एक सुपर उत्पादक दिन होने की उम्मीद है
1,एवीआई चेंजिंग ट्रेन पर उपयोगकर्ता लिंडसेया! सुंदर लड़की!
0,"उपयोगकर्ता मैंने इस लिंक को देखा, लेकिन मुझे सीएनएन साइट पर एक त्रुटि मिलती है जब मैं इस पृष्ठ को खोलता हूं और लेख नहीं पढ़ सकता।"
1,उपयोगकर्ता हिया सारा। आशा है कि आप अच्छी तरह से कोशिश करेंगे और कल आपके साथ पकड़ लेंगे xxxx
1,तो ... चावल कुरकुरी/स्वीडिश मछली/फल रोल-अप सुशी बहुत अच्छा है। हाहा
0,बहुत ज्यादा होमवर्क
1,उपयोगकर्ता के पास आज बहुत बहुत हैप्पी है। मैं जश्न मनाने के लिए आज रात पार्टी में भाग लूंगा और बेट्टी को हमेशा याद रखूंगा।
0,बीमार है।  और बिस्तर पर वापस जा रहा है।
1,1 दिन दूर!
1,URL - इन बादल आपको सिम्पसंस की याद नहीं दिलाएं..तो वे इससे पहले कि मैं इसका एक चित्र लेता था
0,आज शाम के लिए मेरी अलमारी चयन के माध्यम से नहीं सोचा था। फ्रीवे पर Kilt + मोटरसाइकिल = विफल। पैंट जीत।
0,"जब से मैं इन गोलियों पर रहा हूं, तब उपयोगकर्ता सबसे अजीब सपने देख रहा हूं। गंभीरता से। उन्हें ब्लॉग करने के लिए अर्थ रखें। सपने का अर्थ? नहीं"
0,"उपयोगकर्ता यह शायद कुछ समय के लिए बी गले में जा रहा है, अपना ख्याल रखना ... मैं अच्छा कर रहा हूं, काम करने के अपने रास्ते पर।"
0,लिल फोटो शूट करने के बारे में उत्साहित नहीं
0,मैंने उनसे कहा है कि मैं किल एरी ईपीएस नहीं देख सकता!
1,"तो उपयोगकर्ता ने बस हमारी शादी की तस्वीरें ब्लॉग URL पर पोस्ट की ""हम चमक रहे हैं"""
1,T2psalm URL द्वारा JP में नकली और आलसी समरूपता
1,हेनरी पूले साउंडट्रैक को सुनना।  धन्यवाद मैट!
1,"उपयोगकर्ता गीज़, पहले से ही दोस्त हैं। मुझे अनुमान लगाना चाहिए था।  अगले हफ्ते यह है!"
1,"ओह और विचार करते हुए कि मैं कल रात सो नहीं रहा था और आज 3 घंटे की परीक्षा थी, मैं थका हुआ महसूस नहीं करता। डिनर माइंड के बाद कोशिश और झपकी"
0,बर्डसॉन्ग रेडियो के बंद होने के कारण अलार्म घड़ी विफल हो जाती है
1,उपयोगकर्ता पानी नहीं पीता
1,मुझे लगता है कि आप सभी को www.thedirtydmographic.com की जांच करनी चाहिए क्योंकि वे कमाल के हैं !!
1,"उपयोगकर्ता यह है कि आपका तरीका हमें अपनी नई दुल्हन, SI से परिचित कराने का है?"
0,उपयोगकर्ता URL - आप अपने साथ थोड़ा दोस्त मिल गया?! इतना अनुचित .. मुझे सब मिला एक पेट में दर्द था
1,उपयोगकर्ता अच्छी तरह से किया!  अब बिस्तर पर जाओ!
1,शुभ रात्रि।
1,उपयोगकर्ता मुझे लगता है कि तथ्य मशीन नहीं विश्वास नहीं है !!! अगले हफ्ते मुझे यह करना चाहिए !!  Im नया तथ्य माचिन लूल !!
0,"QVC के सामने एक आलसी दिन होने पर लेकिन खरीद नहीं, मेरा कार्ड टूट गया है !! लिनन को बदल दिया है और अब ऊर्जा को हूवर के लिए बुलाने की कोशिश कर रहा है।"
0,"जिस तरह से डेविड कैराडाइन संभवतः मर गया, उससे बहुत अच्छा है। परिवार के प्रति संवेदना"
0,यह बहुत गर्म है ...
0,"मैंने अभी -अभी डंबे की बात सुनी है, आप एक झटके में हैं, इसलिए यह सी क्या संगीत आ रहा है ...... आँसू"
1,"कल रात ""गडजो कैलोम"" के साथ जैज़ की तस्वीर लेने के लिए बाहर गया था। भयानक बैंड और एक महान समय था। आज: अभी भी थक गया है!"
1,"जल्दी बिस्तर पर जा रहे हैं ... कल मदर्स डे के लिए यात्रा करने के लिए बहुत सारी महत्वपूर्ण महिलाएं मिलीं! पीएस- आज रात की आधी रात के रूप में, हैप्पी बीडे बू भालू!"
0,"समय 2 भेड़ियों का सामना! मैं आज काम से दूर होने वाला था, लेकिन ड्यूटी कॉल मैं नौकरी करने के लिए आभारी हूं, मैं नौकरी करने के लिए आभारी हूं ..."
1,मुझे लगता है कि यह निकेलबैक लोल से कुछ गंदे गीतों के लिए समय हो सकता है
1,"उपयोगकर्ता के लिए धन्यवाद के लिए धन्यवाद, मुझे शुक्रवार का अनुसरण करने पर आपका उल्लेख करना होगा।"
1,उपयोगकर्ता धन्यवाद
1,मैं घर पर हूं
0,"मेरे आवेदन कहाँ चले गए हैं!   वे डॉक से गायब हो गए हैं, और मैं अब उन्हें नहीं ढूंढ सकता"
1,स्पष्ट #followfriday: उपयोगकर्ता!
0,बहुत खूब। सिर्फ एक दिन में मैं हाई स्कूल से स्नातक हो जाऊंगा और मैं उन लोगों को नहीं देखूंगा जिन्हें मैंने 4 साल से रोज़ देखा है
1,"मेरे कैमरे के लिए एक मछली मिली। लेकिन यह वास्तव में एक दरवाजे के लिए एक झलक छेद है, लेकिन यह उसी तरह काम करता है। यह बहुत अच्छा है!"
0,बुरा दिन। कल इतिहास परीक्षण। और मैं धूप में बाहर जाना चाहता हूं और खेलना चाहता हूं।
1,"उपयोगकर्ता .... ""फ्लाई विद मी"" के प्रीमियर के बारे में बहुत उत्साहित है"
0,उपयोगकर्ता नहीं उसे मेरे आकार का ऑर्डर करना था और 2 सप्ताह में होगा। यह छोटा था और उनके पास कोई 38 एफ नहीं था।
0,उपयोगकर्ता Ive Dunno के बाद से DSLR के लिए पैसे बचा रहा है। और यह अभी भी पर्याप्त नहीं है !!  हाहा।
0,"इसके अलावा, उसकी जीभ स्वाद परीक्षण हाहा जला दिया।"
0,"उपयोगकर्ता मैं कमबख्त 7:30 बजे जाग गया क्योंकि मेरा परिवार इतनी जोर से बात कर रहा था, इसलिए मुझे पता है कि आप कैसा महसूस करते हैं।"
1,"खिचड़ी भाषा के लिए नया एकल ""किसी दिन"""
0,उपयोगकर्ता हे पीटर बस सोच रहा था कि नर्स जैकी को फिर से कब हवा मिलती है? मैं इसे टेप करने के लिए अपना DVR सेट करना चाहूंगा। यहाँ कोई iPhone नहीं
1,उपयोगकर्ता एन्जिल्स और राक्षस अच्छे थे
0,उपयोगकर्ता lmao naw उस में से कोई भी नहीं..गोट डोर फिक्स्ड $ $ .. हेयरशो के लिए अभ्यास किया था..फेल सॉरी फॉर खुद को बाउट 2hrs तो वापस पीस पर कोई स्टॉपिन नहीं
1,उपयोगकर्ता उन्हें सुनते हैं - मुझे पता है कि आपने उनके संगीत को पहले से ही सुना है .. और उपयोगकर्ता की जाँच करने वाला है
0,जब से मैंने ट्विटर किया था तब से बहुत लंबा रास्ता। मुझे दुखी करता है। मुझे याद दिलाता है कि मुझे कौन याद करता है
0,डिनर पर। रेंजर्स हार गए। मुझे सांत्वना देने के लिए किसी की जरूरत है।
0,उपयोगकर्ता AHHH बहुत बढ़िया !!! धन्यवाद!!! बहुत दुखी हूँ मुझे शाऊल विलियम्स देखने को नहीं मिला ...
1,उपयोगकर्ता और उपयोगकर्ता को बताएं कि आप WARD पर देखने के लिए इंतजार नहीं कर सकते।  #Warpedwednesday#warpedwednesday#warppedwednesday#warppedwednesday
1,कल वापस काम करने के लिए और मैं पहली बार एक कार चला रहा हूं - मैं बहुत उत्साहित हूं
0,दंत चिकित्सक के लिए रवाना
1,उपयोगकर्ता Whoa! यह soooooo गर्म है! क्या वह अमावस्या से है? मैं अंदाजा लगा रहा हूं।
0,"उपयोगकर्ता aww शहद मुझे पता है कि यह कैसा लगता है ... इस सप्ताह के रूप में अधिक घंटे नहीं किया गया है, लेकिन सूर्य चमकने के दौरान कार्यालय में फंस गया है"
0,उपयोगकर्ता यह बहुत प्यारा था ... हालांकि इसे 3 डी में देखने के लिए नहीं मिला
1,हम एक ginormous तूफान kearnyyyy प्राप्त करने वाले हैं !!!!
0,अभी भी बकवास की तरह लग रहा है। ऐसा नहीं है कि मैं इस तरह के एक अद्भुत सप्ताहांत के बाद कैसा महसूस करना चाहता हूं
0,उपयोगकर्ता इसके लिए एक सीधा लिंक है? मुझे नहीं मिल रहा है कि आप सेंकना कर सकते हैं और कोल्डवॉटर कैनियन के पास हैं?
0,मैं अब ठंडा हूँ
1,उपयोगकर्ता अब यह वास्तव में जीवित है। बस उत्सुक ... क्या तूफान आपके कॉफी का स्वाद बेहतर बनाता है?
1,"उपयोगकर्ता url - haaha, साला पेंगिन शेड्स रसीला दिखता है, मैं गंभीरता से नींद ले रहा हूँ इसलिए इस pge l का पार करने वाला im ..."
0,"ओह, और मेरी एलर्जी मुझे बैट-शिट पागल कर रही है! कोई भी मेड या तो मदद नहीं करता है।"
0,घर के रास्ते में यातायात में बैठने के लिए उत्सुक नहीं ......
1,"मुझे ""बस मैं तुमसे प्यार करने के लिए कहा जाता है"" कॉल करना पसंद है।"
1,उपयोगकर्ता मुझे पता है कि अभी कुछ अच्छे प्रदर्शन हैं
1,उपयोगकर्ता यह अभी भी अद्भुत होगा और लंदन जोड़ा गया बोनस हा एक अच्छा समय है और आपको प्यार से प्यार है xxx
1,खिचड़ी भाषा का मानना ​​है कि मैंने वास्तव में हाई स्कूल समाप्त किया ... 3 सप्ताह में स्नातक। 3 दिनों में 19 साल की हो गई !!
0,अभी उठा। बहुत थक गया हूं
0,यात्रा पर कैमरे के लिए कनेक्टर नहीं लाया ... नई तस्वीरों को बचाने के लिए एक और सप्ताह इंतजार करना होगा ...
0,वास्तव में यह नहीं समझता कि यह सब क्या है ...
0,मुझे विश्वास नहीं हो रहा है कि मैं चावल बना रहा हूं।
1,दल!
0,"7 वें एवेन्यू दृश्य आज बहुत अच्छा है, मेरे फीट गले में हैं, हालांकि"
0,"वास्तव में, उदास मेरे चाचा चार्ली ... आज आखिरी बार उसे देखने के लिए जा रहे हैं"
1,उपयोगकर्ता आप इस तरह के व्यक्ति शेरोन हैं।
0,मेरी आँखें आज मर रही हैं मैं अपने पुराने काजल में वापस जा रहा हूं
1,नई बीजी!  1280x800 रिज़ॉल्यूशन में सबसे अच्छा देखा गया * फुसफुसाते हुए: Ninoxsho पूर्वाग्रह * XD
1,उपयोगकर्ता yup ... m so लानत है इसके लिए इंतजार कर रहे हैं ...।
0,"उपयोगकर्ता ने भी आदमी को समाप्त नहीं किया, मेरी पीठ बहुत अधिक चोट लगी। सॉरी होमी आशा है कि आपकी रात हमारी तुलना में बेहतर थी"
1,उपयोगकर्ता एक छोटी राशि।  मैं एक कम सी देख रहा हूँ
1,थिएटर शिविर मजेदार था याआआआआई !!!
1,Aint ने इस फिल्म innawhile को शांत देखा जैसे कि यह xx
0,मेरे नाखूनों को चित्रित करना ... बीमार [पाठ meee]
0,मैं बहुत नाराज़ हूं। यह आज इतना गर्म है और मुझे अपने बैचलर के काम पर काम करना है!
0,उपयोगकर्ता को लगता है कि यह फ़ाइल का आकार हो सकता है। फोन पिक्स हमेशा 1k से ऊपर। यह कहता है लेकिन कुछ भी कभी नहीं आता है। मेरे ट्रैफिक जाम को पोस्ट करने की कोशिश की
0,नाखून अभी भी गीले हैं। मेरे लिए कोई नाश्ता नहीं!
1,उपयोगकर्ता जो गर्म है! Thx 4 प्यार और हमें लूप में रखना
0,अब मैं दुखी हूं कि मैं क्वान के स्नातक को मिस करने वाला हूं। USC से
1,उपयोगकर्ता ने आज सुबह इसे योग करने के लिए बनाया?
0,मैं याद करने के लिए जा रहा हूँ
0,उपयोगकर्ता OHHHHHHHHHHHHHHHHHHHHHHEEEEEEEEEEEEEEEEEEEEEEEEE। बोलेरो मोजे मेरे वर्तमान में जूते की स्थिति पहनने में असमर्थ में उपयोगी हैं।
1,"उपयोगकर्ता वे भी बहुत कुछ कूदते हैं, जो एक और पेशाब है"
1,हाय सब लोग मैं अब पर्याप्त है क्या हो रहा है
1,"उपयोगकर्ता URL के पास एक लंबा दिन था, न कि वह दौड़ जो मैं चाहता था और इसने एक नोट को मारा, समय नहीं मिला, लेकिन वास्तव में खुद का आनंद लिया!"
0,उपयोगकर्ता मुझे 2 लड़की n उदास हिस्सा मैं पूरी तरह से इसके बारे में भूल गया ... SMH
1,URL - दिसंबर समर
1,"उपयोगकर्ता भगवान, मैं वास्तव में आशा करता हूं कि कोई कुतिया आपको ""द हिल्स"" के अगले सीज़न में थप्पड़ मारता है।"
0,fml मैं सिंगल नहीं बनना चाहता
0,"डर 2 अभी भी डाउनलोड नहीं किया। जब मैं सो रहा था, तो ""डाउनलोड शुरू करने"" पर अटक गया।"
0,"उपयोगकर्ता सॉरी रोब लेकिन क्रिस और मैं दोनों कार्डिफ़ जा रहे हैं ... गंभीरता से आदमी, शेफ में एक बैंड शुरू करें, हम एक स्प्लिट ईपी करेंगे।"
