1,"वर्ष में 3000 तकनीक ""You-Twit-Face!"" नामक एक समय-अपशिष्ट वेबसाइट में बदल जाएगी। (YouTube, ट्विटर और फेसबुक गठबंधन!)"
0,उपयोगकर्ता लानत है।
1,उपयोगकर्ता haha ​​im प्रभावित!  मैं अभी भी डिडक्टिव/इंडक्टिव बिट हाहा नहीं मिलता है। भाड़ में जाओ यार। Im केवल शुरू करने के बारे में: s
0,इतना अजीब कभी -कभी मेरे दोस्त। चार लोगों ने कुछ ट्रिफ़ल पर झगड़ा किया ... और इससे मुझे बहुत दर्द होता है। लेकिन मुझे समझ नहीं आ रहा है कि क्यों ...
0,"उपयोगकर्ता नोप अभी भी गायब है ... मैंने ग्रामीण मेलबॉक्स में नोट्स डाले हैं, मैं उसे बहुत याद करता हूं"
1,अरे हर 1 आप मुझे एक सीधा संदेश क्यों नहीं छोड़ते?  XXX
0,उपयोगकर्ता प्यारा हाँ ... लेकिन कुछ उदास भागों भी
1,शुक्रवार की सुबह का आनंद ले रहा है
0,OMG आज रात को 0 डिग्री होना चाहिए।  soooo coollddd!
0,उपयोगकर्ता में से कोई भी गतिविधियाँ आज सुबह मेरे मैथ्स क्लास के लिए काम नहीं कर रही हैं ... URL
0,"उपयोगकर्ता नहीं, Thats मैं अपने छोटे स्व को बताऊंगा ... योग्य मैं अगले साल किया जा सकता है और $ 500/दिन बनाना शुरू कर सकता हूं ... मुझे क्या लगता है ??"
0,मैं ट्रेडमिल के लिए आगे क्यों देख रहा हूँ ?? ज़ोर-ज़ोर से हंसना! बस मेरे भोजन के पचाने के लिए मैं शाम 6 बजे खाया। बड़ी गलती।
1,"उपयोगकर्ता बेकी, आपसे मिलने के लिए अच्छा है। वास्तव में आप कोलोराडो में कहाँ रहते थे?"
0,"रेस्तरां में गायक ""अनटाइटल्ड"" गाता है। बंद करो"
1,यह मेरी प्रेमिका उपयोगकर्ता का जन्मदिन है! Y'all बेहतर पहचान!
0,"उपयोगकर्ता यह वास्तव में शुरू नहीं हुआ है ... मैं एक मामूली हैंगओवर का अनुभव कर रहा हूं, इसलिए मैं भयानक महसूस करता हूं लेकिन मैं हालांकि अच्छा हूं"
1,उपयोगकर्ता अच्छी तरह से आप वहाँ जाते हैं! बैग भव्य है। मैं आपको इसका उपयोग करने के लिए इंतजार नहीं कर सकता!
1,उपयोगकर्ता मैं एसी को नीचे ले गया
1,नेतृत्व के लिए उपयोगकर्ता yayy !! आशा है कि यह अच्छी तरह से चला जाएगा
1,"आज मोमो टीम, उपयोगकर्ता, उपयोगकर्ता, उपयोगकर्ता, उपयोगकर्ता, उपयोगकर्ता, एलन मूर और जो पाइन II के साथ पोंट 13 में डिनर"
1,कुछ संरक्षक गेट्टिन !! फिर इसे हैमबर्गर मैरी पर समलैंगिक करने के लिए बंद
1,"उपयोगकर्ता कोई ""ई"" सांस की तरह लगता है कि ब्रेथ की तरह लगता है"
1,"वाह, मेरा आखिरी ट्वीट एक महीने पहले था। कुछ समय के लिए इस बकवास का उपयोग नहीं किया है, लेकिन im सुपर वापस आने के लिए उत्साहित है"
1,उपयोगकर्ता याय!  साझा करने के लिए धन्यवाद!  क्या आप कल रात की तुलना में बेहतर महसूस कर रहे हैं?
0,उपयोगकर्ता अप्रत्याशित यात्रा। मुझे लगा कि मैं आपको सत्रों में देखूंगा लेकिन मैं समुद्र तटों में दोस्तों से मिलने गया। मैं सुबह 6 बजे छोड़ता हूं।
1,उपयोगकर्ता हमेशा एक अंडरचीवर की तुलना में एक ओवरचाइवर होने के लिए बेहतर है
1,उपयोगकर्ता अब तक वीडियो में केवल एक ही शॉट खा रहा है। हालांकि अभी भी संपादन है।
1,नॉर्वे में उपयोगकर्ता हम इसे आज मिले सभी गाने अद्भुत हैं और तस्वीरें बहुत गर्म हैं
0,बस अंग्रेजी कक्षा के लिए 100 पृष्ठ पढ़ना समाप्त हो गया कल वूओहूओओओ ...
0,मुझे अपनी प्रेमिका की जरूरत है ...
0,नीचे बैठे पसीना आ रहा है। यह 40% आर्द्रता के साथ यहां 28 है। इसे प्यार करना! : D आज का पहला मच्छर आज का समय। उम्मीद है कि कोई पश्चिम नील नहीं।
1,हमारे बीच हाउस को छोड़कर!
1,"उपयोगकर्ता हाँ, करेंगे"
1,"1। मेरे लैपटॉप पर घर वापसी 6/17 पर, इंतजार नहीं कर सकता!  2। आज मैं नाश्ते के लिए एक डोनट और दोपहर के भोजन के लिए चिली रेलेनो में भाग लूंगा। मम्म!"
1,एक और सप्ताह
0,तो यह 2:28 बजे सबसे अच्छा/सबसे खराब दिन है और मैं एक फ्लैट के साथ बुफोर्ड हाईवे की तरफ हूं ... यह वास्तव में और वास्तव में एक मजाक होना चाहिए !!
0,उपयोगकर्ता मुझे भी मैं इसे नफरत है
0,"उसे। यहां तक ​​कि पशु चिकित्सक ने रोया, क्योंकि वह विश्वास नहीं कर सकती थी कि वह पूरी बात के बारे में कितना शांत था। कम से कम अब उसे कोई चिंता नहीं है।"
1,यू के लिए उपयोगकर्ता #pughug इसे पास करें।  -buddythepuggy
1,मैंने 1 कोर को उद्धृत किया। 10:31 जबकि हमने कचरा उठाया; कैटिलिन ने 'लो' गाया।
0,K-on को देखते हुए HI-CHEW के अपने आखिरी टुकड़े का स्वाद लेना!।
0,उपयोगकर्ता खौफ। आपको याद करने जा रहे थे!
0,उह मैं अपने दिन की छुट्टी पर इस तरह के एक घंटे में क्यों कर रहा हूँ?
0,"बारिश का ठंड दिन। मेरी ग्रीष्मकालीन कक्षा शुरू की गई है ताकि किताबों और खेलने के लिए वापस आ गया।     वापस बेहतर हो रहा है, अभी भी रेकी की तलाश में है"
1,"उपयोगकर्ता आप बहुत कूल हैं !!! BTW, ट्विटर पर आपका स्वागत है"
0,उपयोगकर्ता लेकिन बहुत कुछ आने के लिए।
0,उपयोगकर्ता EU L-AS FACE LINK FARM DAR E PACAT CA VA PUNE BACK-U-UL IN CURAND
1,"""बेबी यू माय एवरीथिंगगग"" मुझे प्यार करने के लिए मुझे प्यार करने के लिए मुझे प्यार करने के लिए"
1,"उपयोगकर्ता धन्यवाद मैं इसकी सराहना करता हूं .. कैसे शिकागो, यह कनाडा में ठंडा है!"
0,"कोई समुद्र तट नहीं, बच्चा पिघल जाएगा"
1,"उपयोगकर्ता AW, मुझे नहीं लगता कि आप लोग झटके हैं"
0,सोमवार के लिए तैयार नहीं है
0,"बस ला लाइव लेकर्स परेड और सेलिब्रेशन, वोहू से कार्यालय में शामिल हो गए! ... अब मुझे काम करना है"
0,"उपयोगकर्ता मैंने किया था, लेकिन वह तम्बू जो मैं चाहता था वह स्टॉक से बाहर है ..."
0,Im थोड़े उदास कारण SU3D ने फिल्मांकन शुरू कर दिया है और मैं वास्तव में इसके लिए ऑडिशन देना चाहता था
1,"उपयोगकर्ता टा बेब, आप मुझे जानते हैं कि मैं अपने करी से प्यार करता हूँ"
0,"मैं गुस्से में हूं और मैं दुखी हूं और अपनी स्थिति में मदद करने के लिए असहाय महसूस कर रहा हूं, एक बार जब मुझे पता है कि मुझे क्या करना है .. तो मुझे मदद करने के लिए एक संरक्षक की आवश्यकता है ताकि मैं मदद कर सकूं ...।"
0,"LBK के लिए ड्राइविंग - पिछले कुछ दिनों में मेरे जीवन की कहानी। Quads, flexors, और बट को चोट लगी है जैसे कि खूनी नरक पेंच आप, crit - मैं तुम्हें क्यों प्यार करता हूँ"
1,उपयोगकर्ता याय!
1,एक अच्छा चुंबन url के शीर्ष 10 लाभ
1,लौरा-ऐनी डी के साथ डिज्नीलैंड
1,"इससे पहले कि मुझे नए टीटीआर डेव मैथ्यूज बैंड की जांच करनी है .. बस इसे लोड किया, लेकिन इसमें कुछ समय लगता है .. अब बीट्स के लिए तैयार है"
0,डॉक्टरों के कार्यालय में ... फिर से!
0,आकाश l0ose को जाने वाला है और यहाँ मैं w 'कोई छतरी नहीं हूँ
0,"कल जल्दी काम करें, लेकिन मैं सो नहीं सकता, मेरे दिमाग में बहुत सारी चीजें"
0,"उपयोगकर्ता मैं सहमत हूँ वनी ... यह बहुत घृणित है, और लोग बस बैठकर देखते हैं"
1,"उपयोगकर्ता एक तस्वीर पोस्ट !!!! मैं आपके नए बाल कटवाने को देखना पसंद करूंगा !!!  मैं एक भी पाने वाला हूँ, प्रोम के बाद! यह ऐनी हैथवे की तरह होगा !!"
0,एक झपकी लेने के लिए मेरे डेस्क के नीचे जाने पर गंभीरता से विचार कर रहा है। Soooooo थक गया
1,उपयोगकर्ता उपयोगकर्ता मुझे लगता है कि मैंने लगभग 7 बार दौरा किया। चाहते थे कि उपयोगकर्ता लोकप्रिय महसूस करे
1,"बुधवार: सनी, 69 के पास एक उच्च के साथ। 3 और 7 मील प्रति घंटे के बीच उत्तर उत्तर पश्चिमी हवा। देखने में अच्छा"
0,"मेरा प्रेमी और मैं आज सुबह टूट गए। दुख की बात है, लेकिन असली .... अब मुझे इसे खत्म करना है"
0,URL - हम सिर्फ अपने पहले बैच (परीक्षण) हार्डवेयर मॉड्यूल को तली हुई हैं; 2 साल में पहला दुर्घटना
0,वास्तव में वह काम चाहता है ... प्रतीक्षा कर रहा है ...
0,उपयोगकर्ता अपलोड चित्र आइकन मेरे लिए सक्रिय नहीं था जब मैं इसका उपयोग करने की कोशिश करता हूँ !! मैं नहीं जानता
0,मिनी-डब्ल्यूएसओपी 1055 वें से बाहर।  कम से कम मेरे पैसे वापस मिल गए
0,मेरे परिवार को याद कर रहा है ...: '(चीन से जल्द ही वापस आओ .. कृपया
0,मुझे लगता है कि मैं आइसक्रीम के लिए बाहर नहीं जा रहा हूं
1,पुरानी आदतों को वापस लाने के लिए अच्छा दिन ... ट्रक को अच्छी तरह से धोते हुए फ्लीटवुड मैक को सुनना।
1,उपयोगकर्ता डोमिनोज़ !!  हालांकि पापा जॉन्स के पास बहुत गर्म मिर्च हैं!
0,उपयोगकर्ता आप फिर से फ़ायरफ़ॉक्स अभिनय कर सकते हैं? Ayyiya Lol 2 दिन r u मुख्य ट्वीटर नहीं जीत सकता है या कोई समूह है? तुम हो ...
0,मैं एक घंटे के लिए सिर्फ यू से बात करने के लिए रहा .. विश्वास नहीं कर सकता कि मुझे केवल तीस सेकंड के लिए यू से बात करने के लिए मिला है।
0,"लानत है, दंत चिकित्सक! आपकी वजह से, मेरा चेहरा आज आदेश से बाहर है।"
0,उपयोगकर्ता मैं tivo पर daisies को धक्का दे रहा हूँ - मैं tivo की जांच करने और इसे रिकॉर्ड देखने के लिए बहुत आश्चर्यचकित था! मुझे नफरत है कि उन्होंने इसे रद्द कर दिया।
1,"उपयोगकर्ता हाहा, वास्तव में। छात्र का समय अब ​​फिर से शुरू होता है"
1,उपयोगकर्ता मुझे बीमा मुद्दों के साथ थोड़ा तनाव था और फिर निराशाजनक फिल्म देखें। नासमझ पसंद! ~: पी लेकिन कोई वास्तविक शिकायत नहीं
0,दोस्त। इसलिए मैं w/ रोमियो के बाहर हूँ और कुछ पागल लोग आते हैं और हर किसी की कार को अंडाकार करते हैं
0,"उपयोगकर्ता मैं स्टूडियो में एक ही prob yest था, चाय बनाने के लिए गया, दूध डाला, और गांठ विफल हो गई"
1,उपयोगकर्ता सुपर बेबी!? चो बॉय में इसकी 909- वास्तविक होला! अहा
1,उपयोगकर्ता y o u 'r e loveliest मिस डेल्टा। यह आयरिश गिट आपके जैसी प्यारी ऑस्ट्रेलियाई महिला के लिए बहुत भाग्यशाली है। McNuggets के बड़े प्रशंसक
1,आशा है कि हम उस नाव को देखते हैं जो कल हिला रही थी जो जाहिर तौर पर एक मजेदार फिल्म है जो इसे देखना चाहती है ......................
1,उपयोगकर्ता हाँ यह टेरिटरी के साथ आता है। मैंने अपने शेयर के साथ भी लोल से पूछा है कि ओली ने मेरे पुराने गैया गिल्ड में क्या किया।
1,विले के लिए मेरे रास्ते पर
0,अशर हन्ना मोंटाना ने आपको रोया? Aww - गले-
0,उपयोगकर्ता सूरज ??? !!! ल्योन में नहीं !!  अच्छा सप्ताहांत
1,उपयोगकर्ता मैं कोशिश करता हूं।  आप पिट्सबर्ग में किसी के लिए एक स्लिंगबॉक्स खरीद सकते हैं और फिर उन्हें पिट्सबर्ग टीवी देखने के लिए इसे आपके लिए हुक कर सकते हैं।
1,वाह ..... ठंड लगना .... आज रात लिटरली और भावनात्मक रूप से भयानक/अद्भुत था। यह सही लगा ...
1,उपयोगकर्ता उपयोगकर्ता।  धन्यवाद।  अब मैं बेहतर महसूस करता हूँ।  ;) अगर आप उपनाम का उपयोग करते हैं तो मुझे कोई आपत्ति नहीं है।  मुझे इसे बोर्डों पर देखना पसंद है।
1,मैं अपनी अंग्रेजी के लिए क्षमा करें ... मुझे बताएं कि कृपया अगर मैं कुछ गलत करता हूं तो मुझे प्यार है
0,"कोई फर्क नहीं पड़ता कि मैं कितनी भी कोशिश करता हूं, मुझे यह पता नहीं है कि अपने फोन से ट्विटिक का उपयोग कैसे करें। क्या कोई मेरी मदद कर सकता है??"
0,उपयोगकर्ता यह यहाँ बारिश हो रही है!
0,उपयोगकर्ता जो बेकार है *गले *
0,"उपयोगकर्ता मैं सहमत हूं, खासकर अगर हेलेन ने मुझे आपके बारे में क्या बताया, यह सच है"
0,"उपयोगकर्ता मेरे पास एक है और मुझे अच्छा लगेगा, लेकिन मैं पोर्टो एलेग्रे में नहीं हूं आज मेरा जन्मदिन है क्या आप मुझे जन्मदिन की शुभकामनाएं कह सकते हैं? pleeeease?"
0,डॉक्टरों को जो मैं चुनता हूं वह हमेशा हमेशा के लिए ले जाता है?!?!  मुझे प्रतीक्षा से नफरत है ... यह पहले से ही 30 मिनट है
1,उपयोगकर्ता मुझे पता है !!!  मैं बहुत उत्साहित हूं मुझे लगता है कि आपको एक बड़ा इजामी साइन करना चाहिए ताकि मैं आपको लोल पा सकूं!
1,आयोवा सिटी से वापस हमारे रास्ते पर मॉम के लिए मॉम के साथ बाहर रॉक करना और आइसक्रीम कोन खाने के लिए
0,उपयोगकर्ता नहीं।
0,मेरी मूत बेक्का कल फ्लोरिडा जा रहा है उसे याद करने वाला है: '
0,Oi vay।  चलो हम फिरसे चलते है।
0,"गंतव्य शादियों की शूटिंग के बारे में अच्छी और भयानक सभी चीजों में से, मैं कुछ दिनों के लिए अपनी बच्ची को याद करूंगा।   #FB"
1,Shiney नया चेस कार्ड आया - मेरे पास पेपास टैग हो सकता है
0,इस्त्री किया जाता है। अब मैं सिर्फ ऊब होने के बारे में मोपिंग कर रहा हूं
0,उपयोगकर्ता मुझे पता है ......
0,"उपयोगकर्ता ओह नहीं, हम उसे 2meet नहीं मिलेंगे, हो सकता है कि आप उसे पाएंगे जब बागवानी udo ताकि आपको लॉन घास काटने की मशीन के साथ सावधान रहना पड़ेगा!"
1,"उपयोगकर्ता यह दर्दनाक था यह सब ऊपर सेट किया गया था, इसलिए मैं थोड़े उपयोग कर रहा हूँ! उस पर गौर करेंगे! धन्यवाद दोस्त!"
1,उपयोगकर्ता कोई समस्या नहीं - अगली बार
1,ठीक है। सोते समय अब ​​.... फिर भी सभी को देखें
0,"उपयोगकर्ता दुख की बात है, वे सभी नो-शो थे। यह पूरी तरह से लंगड़ा था। प्लस रस्टी ने विशेष रूप से उन्हें प्रशिक्षित करने के लिए दिखाया। वह शर्मनाक था।"
1,उपयोगकर्ता मैं सोचता रहता हूं कि मैं एक तीर्थयात्रा बनाऊंगा और देखूंगा कि क्या मैं उसे साइट कर सकता हूं
