1,"Ikea फाइबर लाइट, लेगो, एक Arduino और रूबी एक अच्छा मूड लाइट URL बनाते हैं"
0,उपयोगकर्ता हा हा हा * ब्लश और गिगल्स * धन्यवाद! मैं काम कर रहा हूँ और सिरदर्द हो रहा हूँ!
0,उपयोगकर्ता यह अब तक का सबसे अच्छा दिन था
1,उपयोगकर्ता वास्तव में और वह मजाकिया भी है
0,नहीं ..... एक संदेश मिला कि मेरा फोन डिस्कनेक्ट हो गया और सिंक रद्द कर दिया .... नहीं !!!! फिर से कोशिश करने की जरूरत है
0,यह सुनने के लिए उपयोगकर्ता क्षमा करें
0,मैं फिर से बीमार महसूस करता हूं
1,"मेरे पास सिर्फ 12,000 गेम इनाम अंक हैं () £ 30)"
1,"उपयोगकर्ता मैं मेलबर्न में रहता हूं, मैं थोड़ी देर के लिए अमेरिका जाना पसंद करूंगा जो कि बहुत अच्छा होगा कि आप कभी भी एलए में गए हैं ??"
0,Geez idk यह मेरे लिए कठिन क्यों है! मैं बहुत कतरन हूँ!
1,"मेरे भाई ने मुझे अभी तक का सबसे अच्छा ब्रंच बनाया।  अब मैं अपना कपड़े धोने जा रहा हूं, अपने कमरे को साफ करें, और शॉवर"
1,इंटरनेट एक्स पर टेलर लॉटनर को घूर रहा है
0,"एक प्यारा दिन, धधकते हुए धूप .... बहुत बुरा मुझे काम करना है"
0,मेरी ब्लैकबेरी स्क्रीन को खरोंच दिया और मैं बहुत परेशान हूं।
1,उपयोगकर्ता tila अपने भयावह अद्भुत प्यार शब्द #waf <--- इसे प्यारा लोल रखें जैसे कि यू के लिए एक समस्या होगी
0,मैं बहुत ही ठंडा हूं! मैं सिर्फ एक 'डंकिन' डोनट्स कूलटा 'नशे में है और यह बाहर ठंड है - आप लोग कल्पना कर सकते हैं कि आगे क्या होता है! (मेरा शरीर ठंड से जमता जा रहा है!)
0,उपयोगकर्ता उनमें से कोई भी आपको नहीं लगता है कि आप जापान की छुट्टियों के लिए यहां देख सकते हैं: URL
1,मेरी तस्वीर बदलो
1,"बिछाना!  काश उपयोगकर्ता अपने दादा -दादी के पास नहीं जाता, इसलिए वह मेरे साथ हो सकती है! हा, मैं इसे लटका हुआ हूँ!"
1,सर्वोच्च विकास टीम WWDC 2009 की ओर बढ़ रही है। हम आपसे मिलकर पसंद करेंगे। सर्वोच्च टी-शर्ट पहने दो लोगों की तलाश करें
1,"जा रहा है आज अपने नए बाथरूम में फर्श रखना।   और इसका उच्चारण baff को स्नान नहीं करता है, लेकिन आम है"
0,"जब भी मैं बीमार होता हूं, किसी को हमेशा आना पड़ता है।"
1,सुबह ट्विटर
0,यहाँ जम्हाई।  आज रात जल्दी बिस्तर पर जा रहे हैं। एक अच्छा एक है!
1,उपयोगकर्ता शुक्रवार 10 जुलाई 10 वीं वह बहुत मज़ेदार है!
0,उपयोगकर्ता पागल समुद्र में सभी खेला। मुझे यहाँ सिंगलॉन्ग याद आती है
1,उपयोगकर्ता बहुत स्वागत है! XOXO
0,उपयोगकर्ता वह सोचता है कि यह कुछ प्रकार का गंदा स्पाइवेयर या कुछ है
0,दोपहर के भोजन के समय एक पिन कुशन की तरह होगा
1,एक भयानक बैक वर्कआउट था ..... योजना के अनुसार झुकना
0,मैं एक लावा दीपक जीत सकता था
0,उपयोगकर्ता को सुनने के लिए खेद है।
0,उपयोगकर्ता ouch .. इसका मतलब है कि अगले सप्ताह मैं ट्वीट करने में सक्षम नहीं होगा ???
0,उपयोगकर्ता मैं सिर्फ एक दिन आपको ले जा सकता हूं। मैं अभी दुनिया की यात्रा करना पसंद करूंगा
0,आउटलुक माइग्रेशन के मुद्दे होना। यह पूरी सुबह लेने जा रहा है
0,यह नहीं मिल सकता है !!
0,"टाइटैनिक देख रहा है, यह बहुत दुखद है"
0,एंटीबॉडी के ज़िलियन के बावजूद बीमार है कि (जैसा कि वह अब सीए के लिए जीव विज्ञान का अध्ययन करने के बाद जानती है। 2429 घंटे) उसके शरीर के बारे में whiz। असफल
1,क्या स्मार्ट 2 किक जिम में दिन शुरू कर रहा था ... परिणाम के रूप में 2 रात की नींद का पूरा 8 घंटे भी मिल सकता है
1,"अरे! बीबी के लिए नया एफबी ऐप सुपर-फास्ट है, लेकिन अभी भी कुछ खामियां हैं। अच्छी तरह से मैं क्या उम्मीद कर रहा हूँ? कोई पूर्णता नहीं है लेकिन भगवान।"
0,उपयोगकर्ता idkk .. मैंने उसे ट्विटर पर रखा..तो वह शांत हो जाओ .. waddup tho?
0,"6 पुलिस ने बस कुछ बच्चे को रोक दिया। फोटो लेने के खिलाफ फैसला किया, लेकिन मैं वैसे भी खुद को रोक गया, फिर मैं फिर से 5mins बाद में रुक गया"
0,कभी -कभी जीवन वास्तव में बेकार है
1,सुबह!  लैपटॉप ने मुझे फिर से दिया ... मुझे लगता है कि मैं ब्राइटन जाऊंगा और अपनी स्वतंत्र आत्मा के साथ संपर्क में रहूंगा
1,Inbetweeners को देखने का समय गुरुवार को क्रैंक देखा गया। क्या फिल्म है! इतना हास्यास्पद लेकिन वास्तव में बहुत अच्छी तरह से बनाया गया है
0,"उपयोगकर्ता lol मैं दो साल में अपग्रेड किया गया है .. मेरे पास केबल भी नहीं है, मैं उपयोगकर्ता को दुखी करता हूं मैं मुझे दुखी करता हूं"
0,उपयोगकर्ता आपने क्या किताबें खरीदीं? मैंने दूसरे दिन बैंकी को देखने की कोशिश की लेकिन बहुत लंबी कतार
0,उपयोगकर्ता = o omg thats इतना घटिया हूँ मुझे खेद है ashy *गले *
1,उपयोगकर्ता वर्ण नियम!
0,स्पीडबंप्स चूसना जब यू गॉट्टा पेशाब !!
0,बस एक गौटियर शर्ट को सिकोड़ें यह दुखद है।
0,"तितलियों को याद करना और जब आप किसी को पसंद करते हैं, तो आपको जो महसूस होता है, उसे महसूस होता है।  यह बहुत लंबा हो गया है जब से मैंने ऐसा महसूस किया है।"
0,कुछ नहीं कर रहा है
1,मेरे 18 महीने के बच्चे के साथ झपकी लेना
0,"4 घंटे की सफाई की नालियां मैं सूखा हुआ हूं, नालियां स्पष्ट हैं और मेरे हाथ बदबूदार हैं ...... ब्लीच के। चरित्र निर्माण सामान।  हो हम ..."
1,उपयोगकर्ता मेरे घर शहर! BW सावधान
0,उपयोगकर्ता मुझे खेद है कि आप बीमार हो गए हैं यह भयानक है-जब सूरज बाहर है! समुद्र तट पर बैठा अब एक आइल पर एक बोनस 2 जीवन!
1,"उपयोगकर्ता मुझे आपका पहला ट्वीट होना पसंद है, मैं आपको याद करता हूं .. पूरी तरह से। बहुत कुछ ट्वीट करें ताकि मुझे पता हो कि जब तुम्हारा स्वतंत्र है। लव यू बेस्टफ्रेंड।"
1,एम्बर बिस्ट्रो में भोजन ... यम! मम्मी को बिगाड़ने वाला
0,उपयोगकर्ता गरीब लिल मफिन !!! यह अच्छा बच्चा नहीं है !! कुछ कैनोली मदद?
0,"ओह, दुह। मैंने अपना पासवर्ड बदल दिया - यही कारण है कि पिंग.एफएम ट्विटर पर पोस्ट नहीं कर रहा था।  आप लोग एक सप्ताह के अपडेट से चूक गए।"
0,यह अभी भी बारिश हो रही है ...
1,एक और जीत के लिए अपने रास्ते पर जेनसन बटन और विश्व चैंपियन होने के करीब एक कदम
0,उपयोगकर्ता मुझे पता है और मैंने सुना है कि वह अस्पताल ले जाया गया था?
1,मेरी भव्य प्रेमिका के साथ पॉटस्टिकर्स - फोटो: URL
1,बस एक किकस वर्कआउट से घर गया .... अच्छा लग रहा है
0,काम करने के लिए रवाना
1,उपयोगकर्ता नमस्ते! टॉम
1,बस कार्लोस के घर जाने के लिए इंतजार कर रहे हैं ..... तो हम खा सकते हैं !!!
0,कैमिला एक खूबसूरत लड़की है! वह जो के साथ रहने के लिए भाग्यशाली है!  मुझे ईर्ष्या ??? ... अरे हाँ!
1,"उपयोगकर्ता को पता है कि आपका क्या मतलब है, सूरज और हवा में सूखने के लिए कपड़े धोने से प्यार है, हमेशा धूप में गंध आती है"
0,"उपयोगकर्ता की बात है, मुझे लगता है कि वह शायद सही है ।।"
1,एक पोशाक पहने हुए
0,... कोई और साहसिक समय नहीं
1,"होटल का कमरा, लैपटॉप, ट्यून्स टू गो थ्रू, डिसकॉन"
1,उपयोगकर्ता क्रिस मार्टिन साक्षात्कार के बारे में कुछ समाचारों के साथ क्या है? कृपया
0,"बेहतर जाओ 2 नींद, यह सिरदर्द rly मुझे मारता है !!!!!!"
0,रविवार को याद करते हुए
1,"बारिश हो रही है! वाह!  हाँ ... मैं एक ""बारिश वाला व्यक्ति"" हूं। :]"
0,सूर्य की विषाक्तता
0,"मेरी बैटरी सेल मर रही है, मुझे इसे चार्ज करना है।  [IDK जहां चार्जर है]"
1,उपयोगकर्ता सभी #RoyaltyFreemusic नहीं है
1,उपयोगकर्ता मैं बेहतर उल्लेख नहीं करूँगा कि मैं एक ईमेल में cc'd था जो डॉक्टर कौन उत्पादकों को वर्तमान और भविष्य के लिए भेजा गया था
0,कृपया मेरे घर के लिए प्रार्थना करें। एक बड़ा पानी का रिसाव है जो मेरे पूरे घर को दरार कर रहा है और संभवतः अलग हो गया है
1,"आज ""द डेली शो विद जॉन स्टीवर्ट"" देखने जा रहे हैं ... ऑफिस से एंडी (एड हेल्स) अतिथि है ... मजेदार होना चाहिए"
0,"मेरे नए होममेड कार्डबोर्ड लैपटॉप सनब्लॉक सॉल्यूशन का परीक्षण करें - हालांकि यह काम करता है, यह शायद ही टाइपिंग के लिए कोई जगह छोड़ देता है"
1,गर्मियों की तरह लगता है कि उपयोगकर्ता के लिए दुनिया का दौरा करने के साथ पैक किया गया है और अगली बार आपको एडिनबर्ग में वापस देखेगा
0,उपयोगकर्ता मुझे आशा है कि आप इसे इतनी तेजी से नीचे नहीं लेंगे
0,मैं वास्तव में वास्तव में चाहता हूं कि मेरा टैबलेट अभी भी काम कर रहा था ताकि मैं इस पर फ़ोटोशॉप कर सकूं।
0,मौसम थोड़ा बेहतर हो गया। वास्तव में आज काम पर केंद्रित है। सामूहीकरण करने का समय नहीं
1,ट्विटरल
1,बेशक उपयोगकर्ता! इसका गैरी पापी!
0,"उपयोगकर्ता: 90% ताजगी के लायक नहीं है? Aww ... मुझे अपनी उम्मीदों को कम करना चाहिए, जब मैं इसे देखता हूं।"
0,"उपयोगकर्ता ठीक है, लेकिन यह अब चिली-पनीर घुंघराले फ्राइज़ को वापस लाने का समय है।"
0,खिचड़ी भाषा का मानना ​​है कि यह बाहर कितना बदसूरत है ...... झील में दिन के लिए बहुत कुछ
1,"उपयोगकर्ता अधिक पानी पीता है, यह काम करता है!"
1,"निश्चित रूप से, मैं मुझे जो कुछ भी देता हूं, उसका ध्यान रखता हूं और मुझे खरीदता हूं"
0,उपयोगकर्ता और मुझे लगता है कि मैंने आपको मुफ्त में प्रायोजित किया है
1,"मैंने ऐश की तस्वीरें लीं, आज मैंने सचमुच महीनों के लिए कोई नहीं लिया था। <"
0,"उपयोगकर्ता मुझे नहीं पता, लेकिन मुझे एक रास्ता मिल जाएगा!"
1,"""अगर यह बुरी किस्मत के लिए नहीं था ..."" Â «url"
0,"तो मैंने झूठ बोला ... मैं वास्तव में अभी भी जाग रहा हूं। नो स्लीप हम्मम बीटीडब्ल्यू मजेदार है कि कल मैंने केवल एक ही चीज कैसे खाई थी, एक हॉटपॉकेट और 9 ट्विज़लर थे।"
1,उपयोगकर्ता नफरत हाय नफरत करने के लिए ईएम फ्रीस्टाइल को वे चमकने की कोशिश कर रहे हैं
0,उपयोगकर्ता हाँ! मैं चाहता हूँ! मैं आज रात नहीं कर सकता
0,आज रात एक अच्छा डिनर और सुखद समय था। आत्मा भोजन पर ढेर करना; यह परीक्षाओं का एक और कोशिश करने वाला सप्ताह है
1,बेन आई लव याह बेब <333! मुझे याद है कि आप उम्मीद करते हैं कि कल मम्मी आई लव यू टुमॉरो हैप्पी मदर्स डे! सभी माताओं को हैप्पी मदर डे!
1,उपयोगकर्ता हाँ हाँ! काउंटिंग क्रोव्स! मैं भी!
0,उपयोगकर्ता मुझे बहुत खेद है टिफ़नी मैं बस खुश हूँ आप जानते हैं कि मैं एक दोस्त के लिए ऐसा काम नहीं करूंगा।
0,किसी को पहले से ही याद कर रहा है और वे केवल एक घंटे चले गए हैं
0,हाहा माफ़ करना!  रुको आप हैं या आप कल उस किशोर चीज़ में नहीं जा रहे हैं? नटुरी है..मैं आज के आयोजन के बाद उससे बात की ...
1,सुप्रभात मेरे प्यार! आशा है कि आपका एक शानदार दिन होगा। सुरक्षित रहें और शुद्ध रहें
0,उपयोगकर्ता व्हाट्स अप बेब?
0,"ठीक है, यह बहुत अधिक उबाऊ है तो मैंने सोचा और मैट ने मुझे मुल्ला के लॉकडाउन बीसी पर रखा है ..."
1,धन्यवाद मेरे मित्र उपयोगकर्ता #followfriday
0,होपिन वह वापस आ गया
1,उपयोगकर्ता को हथेली से प्री मिलता है ... अगर आप इसे नहीं चाहते हैं तो मैं आपका आईफोन ले सकता हूं
0,"मुझे इसके बारे में बताएं कि उपयोगकर्ता चचेरे भाइयों के साथ पिज्जा हट खा रहा है, फिर एक नए बैग के लिए खरीदारी करें क्यूज खदान हाहाहा गिर रही है"
0,बहुत यकीन है कि बारिश ने स्टूडियो में हमारे इंटरनेट को यहाँ खटखटाया
0,उपयोगकर्ता को लगता है कि आप अभी विजेताओं का समर्थन कर रहे हैं
0,"इसलिए मुझे पता है कि यह वियर्ड है, लेकिन मैंने पूरी तरह से पवित्र देखने के लिए कुछ बड़े पैसे दान कर दिए। मुझे लगा कि यह मुझे कुछ तपस्या अर्जित करेगा"
0,उपयोगकर्ता एस्टो एक पैनिकैट कॉम ए फिसिका
1,मुझे नया ईमेल शोर बहुत पसंद है जो मेरा आइपॉड बनाता है
0,नींद .. जल्द ही बोरी मारा !!! गले में सभी गायन से दर्द होता है .. मेरे आखिरी लोज़ेंग्स को खो दिया है क्योंकि मैंने इसे प्लास्टिक से पॉप किया और यह उड़ गया
1,शर्तें पत्रिका / नई आर्क पत्रिका ... पहले अब जारी करें: URL THX उपयोगकर्ता
0,"उपयोगकर्ता ERK, यह अच्छा नहीं है।  अपेक्षित से अधिक काम, या शॉर्ट नोटिस में बदलाव?"
0,ASPCA वाणिज्यिक मुझे दुखी करता है ...
0,बीमार है लेकिन कल में वापस जा रहा है। छुट्टी रद्द
1,"उपयोगकर्ता मैं चाहता हूं। लेकिन शायद नहीं। मैंने जो शीर्ष पर देखा, वह 1973 की तरह था, इसलिए शायद वे कुछ नकदी के लायक थे।"
0,"मेरे पास एक कॉफी टॉफी ट्विस्टेड फ्रॉस्टी थी, और मुझे कहना होगा"
1,तो मैं आज एक हास्यास्पद संगठन में जाग गया .. हा। मेरी नई रेट्रो दिखने वाली बाइक पाने के लिए जा रहे हैं!
0,"एक महिला के साथ एक ईआर में जाना मेरे लिए सबसे अच्छी चिकित्सा नहीं है ... हाँ, न्यूटन वेलेस्ले एर में अब आँसू में पकड़े हुए।  मिस यू ब्रैड <3"
1,दोपहर के भोजन के लिए बाहर जा रहे उपयोगकर्ता im एक पूर्ण पेट पर खाना नहीं चाहते हैं
1,टेक्सास के लिए उसकी किताबें और योजना बना रही है!
0,उपयोगकर्ता खदान ने सभी घुंघरालेपन को नहीं किया
