1,उपयोगकर्ता wooow .. आपके सिर में नहीं रहना पसंद करेंगे .. उन सभी मुर्गियों और काले बादलों के डीन का काम महान है - वास्तविक दूरदर्शी
1,यह एक मजेदार रात होने जा रही है।
0,उम्मीद करने वाले रैड्रिल अंततः इस बग को हल करते हैं।  मुझे लगता है कि यह एक एएसटी/पार्सर रिसाव है। ग्रहण को खोदना पड़ा।  यूआरएल
0,"URL - OREO .... बिना मार्सेला के रूप में मनोरम नहीं है, लेकिन अभी भी स्वादिष्ट है।"
1,"उपयोगकर्ता मुझे लगता है कि आपके पास गलत पीकबैबी है! आपको ट्वीट करने में अच्छा लगा, हालांकि"
0,मुझे दुख की बात है कि फूड फेयर और अकादमिक पेप रैली के बाद कोई आवाज नहीं है !! मुझे अपनी आवाज चाहिए।
0,उपयोगकर्ता im अभी तक कुतिया नहीं किया! मुझे अभी भी एक और सबक मिला है
0,मैं बहुत अच्छा महसूस नहीं कर रहा हूँ
1,कुछ delumpcious गधा भोजन!
0,मेरा कैमरा URL का अभिनय कर रहा है
0,उपयोगकर्ता अरे पति ने आज नौकरी खो दी क्योंकि आर्थिक संकट के कारण हम सोचते हैं कि हम जल्द ही थाईलैंड के साथ किसी भी छुट्टी पर जाने वाले हैं
1,आपको बचाव करने के लिए उपयोगकर्ता पृष्ठ genny
0,उम्र के लिए धँसनी सप्ताह .... और परीक्षा
1,गुड मॉर्निंग (ट्विटर) वर्ल्ड!
1,"हम्म्म्म, स्कूल उबाऊ था। आकलन और सामान था। कष्टप्रद ! जीआरआर आह। अब एमएसएन! खुश"
0,"पैर मोच, फिर भी फिर से। हम्म, क्या यह गुर्दे/यकृत/पाचन तंत्र में कुछ असामान्यताओं से संबंधित है? एक डॉक्टर #me पर जाने का समय"
1,पूरे दिन समुद्र तट पर
0,"उपयोगकर्ता तो रोज़बर्ग के साथ क्या हो रहा है, अभ्यास सत्रों में महान लेकिन योग्यता में भयानक!"
1,आज दोपहर 4 घंटे सोए। डी-मैन मुझे बीबीक्यू पर एक स्टेक डिनर बना रहा है। जीवन अद्भुत है
1,उपयोगकर्ता हाहाहा नीने उर सू स्मार्ट! lmao मुझे लगता है कि यह कौन है .. अच्छा लग रहा है .. गुरली को whts ?? मैं इस सप्ताह के अंत में घर आता हूँ!
0,"जल्द ही घर वापस आ जाएगा, याय! मेरी सभी चीजों को उतारना और अनपैक करना ... इतना नहीं!"
1,उपयोगकर्ता चिंता नहीं है। मैं पूरी तरह से वहां रहने का इरादा रखता हूं।
1,अक्टूबर की जरूरत है टा जल्दी एफए 2 कारण: बीमार कानूनी हो और लिटिल मिस थांग को 20 वीं कॉमिन माना जाता है!
1,उपयोगकर्ता एक विशाल mazal tov !! Â Â मुझे यकीन है कि आप उसे सिखाएंगे कि कैसे कुछ समय में ट्वीट करना है
1,बच्चों के साथ पुस्तकालय में .... कमाल है कि यह सोमवार सुबह कितनी खाली है!
0,उपयोगकर्ता डेमेट्री मार्टिन = शांत नहीं। लेकिन क्रिस्टीना अभी भी = शांत
1,आज वास्तव में बीमार लग रहा है ..!? urrgghhh .. नफरत है ..
1,"उपयोगकर्ता सेलेना ??? वह शिट थी .... मेरे आइपॉड पर ""यू ऑफ यू"" और ""फॉल इन लव"" मिला।"
1,उपयोगकर्ता और बच्चों के साथ मेरे दिन का आनंद ले रहे हैं। कुछ खरीदारी करने जा रहे हैं। बाद में एमिली का बैले पुनरावृत्ति है!
1,उपयोगकर्ता बहुत बहुत धन्यवाद!  आप बहुत प्यारे हैं
1,उपयोगकर्ता आपको अपने शो को पाउला गेस्ट जज होना चाहिए। तब आप वास्तव में 10 मिलियन दर्शकों को पार कर सकते हैं
1,60 अपडेट। यह ज्यादा नहीं है लेकिन
0,जियोफिजिक्स रिपोर्ट को पूरा करने के लिए अभी भी जियोप्लॉट तक पहुंच की आवश्यकता है
0,उपयोगकर्ता आपके साथ क्या गलत है
0,मेरा नकली तन इतना विनाशकारी है कि मुझे नहीं लगता कि मैं आज रात जूस से बाहर जा सकता हूं क्योंकि इसकी वजह से
1,मैंने पास्ता को उबाला और फिर से नए चाँद के ट्रेलर को देखने के लिए अपने कमरे में चला गया और भूल गया कि मैं खाना बना रहा था
1,सबसे सुखद रात के बाद घर जाना।
1,उपयोगकर्ता धन्यवाद !!!
1,"स्टैमफोर्ड ब्रिज में एक ऑल कॉम्प चैरिटी फुटबॉल इवेंट, कल के लिए खिचड़ी भाषा, फिर पीने के बाद।"
1,उपयोगकर्ता कभी भी ... कहीं भी ... मैं आपको नीचे ले जाऊंगा!
1,मेरे पास मेरे जूते हैं ... फिर से
0,"मैं अपना कैमरा अपने साथ ले आया, इसलिए उम्मीद है कि मैं कुछ पिक्स ट्वीट करूँगा। हालांकि Computercable भूल गए"
0,मैं कल डॉक्टरों के पास जा रहा हूं ताकि कुछ टांके निकल सकें और मैं घबरा रहा हूं
0,उपयोगकर्ता मैं वास्तव में आपके लिए अपनी गरीब कार के लिए महसूस कर रहा हूँ
1,उपयोगकर्ता मुझे आपकी शैली पसंद है .... आशा है कि आप एक अच्छा सप्ताहांत भाई था !!!
0,शिप $ 4300 लेकिन अब तक निराश!
1,देखने जा रहा है और! फिर लड़के मुझे घर चला रहे हैं और पिज्जा के लिए आ रहे हैं और मेरे घर पर घूम रहे हैं
0,उपयोगकर्ता aaaaw मैं अभी अपने दिन की उम्मीद कर रहा हूँ उम्मीद पिछले कुछ घंटों से उड़ान भरती है
0,"मेरा ट्वीटडेक काम नहीं कर रहा है मैं विस्टा से नफरत करता हूं। कम से कम, मुझे लगता है कि विस्टा समस्या है- मैं इन दिनों इस पर सब कुछ दोष देता हूं।"
0,"खिचड़ी भाषा स्वर्गदूतों और राक्षसों को देखने के लिए, इसलिए मैंने इसे मुफ्त में देखा: URL"
1,"उपयोगकर्ता योग्य मुझे पता है, लेकिन पिछले सप्ताह जो हमारे पास था वह इतना अच्छा था कि हम एक और चाहते हैं"
0,"उपयोगकर्ता मैं उन लोगों से एसएमएस अपडेट प्राप्त करना चाहता हूं जिनका मैं अनुसरण कर रहा हूं, लेकिन जब मैं '' पर क्लिक करता हूं तो '' यह काम नहीं करता है आप कृपया मेरी मदद कर सकते हैं ???"
1,"उपयोगकर्ता मुझे भी ऐसा लगता है, जैसा कि मैंने उपयोगकर्ता से उपयोगकर्ता को भेजा है और कुछ भी नहीं देखा है? देखने के लिए एक हो सकता है"
1,"उपयोगकर्ता मैंने सस्तेफ्लाइट्स.कॉम के लिए टेक्स्ट विज्ञापन लिखे।  हाँ, मैंने रोशनी देखी!"
0,डीए भारी पैकिंग से समाप्त हो गया।
0,"मैं अब वेगास छोड़ने के लिए तैयार हूँ! मुझे लिटिल किंग्स्टन, मेरे दोस्त और बेहबे की याद आती है।"
1,उपयोगकर्ता का अनुमान है कि कौन?
1,"उपयोगकर्ता मैं सहमत हूं, बस उस समय और स्थान का नाम दें जो आपके हार्डवेयर को पहले से ही चुना गया है? यदि आपके पास एक तेज़ सीपीयू है, तो एक WINTV प्राप्त करें"
1,उपयोगकर्ता यदि आप यूएस वर्जिन द्वीप समूह में किसी का अनुसरण नहीं कर रहे हैं तो यू मेरे साथ शुरू करना चाहिए
0,बचाव का एक गुच्छा चलता है ...
1,उपयोगकर्ता suppp sis? लव यू सो
0,"मुझे 1 घंटे में ब्रेसिज़ मिल रही है। ऊघ!   उल्टा, माइली को 10 टीन च्वाइस अवार्ड्स के लिए नामांकित किया गया है! अब मतदान करो! जाना! जाना! जाना! जाना! जाना! जाना!"
1,"उपयोगकर्ता: हाँ! आपके पास संगीत में बहुत अच्छा स्वाद है ... एक बढ़िया उन्माद, चाँद के लिए एक रॉकेट, किड रन रन ... मैं भड़क गया हूं"
0,"मैंने सोचा कि संकेत ने कहा ""कृपया विकसित होने वाले दरवाजे का उपयोग करें"" लेकिन मुझे कोई अलग नहीं लगता।"
1,"बिग ब्रदर 09!  BB10, खिचड़ी भाषा का इंतजार .. आज रात xD"
1,उपयोगकर्ता को जन्मदिन की शुभकामनाएं!
0,"उपयोगकर्ता गरीब यू मुझे आशा है कि आप काम के दौरान नहीं सोते थे, क्योंकि यह एक बड़ी समस्या हो सकती है>। <मैंने कहा शायद: पी"
1,सोचता है कि सिडनी और कोडी अजीब हैं
0,उपयोगकर्ता एमएचएम। बहुत बुरे यू ने अपने सभी को समर्थन देने वाले बेटे को प्राप्त करने के बारे में अपने सभी को पैसा खर्च किया: पी हाहा। इतना दुखी मैं शायद ही अब एक गले लगा रहा हूँ
0,"""एपिक स्लो"" दिन काम पर।"
1,"उपयोगकर्ता खदानों myspace.com/daniellexxx21 अगर आप कभी चैट करना चाहते हैं, लेकिन अगर आप ठीक नहीं हैं, तो बस lemme kno अगर वे u या नहीं..ttyl अलविदा"
1,"अशर हाँ, मैं अच्छी बात कर रहा हूँ .... lol smh, मेरे ब्लॉग की जाँच करें और देखें कि मैं LOL URL कैसे बात करता हूं"
1,"बस क्लब नोयर से वापस, भयानक रात!"
0,हर कोई कहाँ जाएगा?  मुझे लगता है कि मैं भी bbl हूँ ...
0,Wtf यह बारिश हो रही है इतनी मुश्किल से बेसबॉल गेम रद्द कर दिया गया
1,मैं अलेक्सी के साथ मेंटल लेक पार्क में हूं
0,मुझे ASAP UGH जैसी नौकरी चाहिए!
0,डेनिस की एक तस्वीर भेजने की कोशिश की। यह मुझे 4 काम नहीं करना चाहता था।
1,एल्चिको में दोपहर का भोजन करना
0,"आज मैं पूल में गया और वे वास्तव में पूल डेक पर जैक हथौड़ा मार रहे थे, जबकि जल व्यायाम वर्ग सत्र में था"
0,उपयोगकर्ता उस लिंक को फिर से नहीं भेजता है।
0,एक महीने और अट्ठाईस दिन भाड़ में जाओ। पर्याप्त तेजी से नहीं आ सकता। और IDK पर चीयरलीडिंग्स खुद के साथ क्या करना है। भावुक नुकसान।
0,"बकवास !! मुझे अपनी पिछली टिप्पणी वापस लेनी है, वह केवल 17 एक और साल है !! लेकिन, गंभीरता से कोई अपने गेहूं खा रहा है !!"
0,"उपयोगकर्ता को लगता है कि मैं एक अंतहीन गड्ढे निबंधों में हूं, किताबें और भगवान जानते हैं कि अब और आरटी आरटी है, जो उच्च स्कूल में है, वरिष्ठ वर्ष एक पाप था ...... अब नहीं"
1,दिन दो। BBQ के लिए दुकानें।  नेक्स्ट मैन-प्रोजेक्ट के लिए लकड़ी। डेव ने आज सुबह एक पग के लिए कहा। बॉस ने कहा नहीं। निष्क्रिय हाथ शैतानों कर रहे हैं
1,URL - OMG मेरे पास गुलाबी गेंद है
1,उपयोगकर्ता ओह भगवान बैटमैन !!!!!!! मैं अभी बहुत कड़वा हूँ मैं बंदूक काटा की कला का अभ्यास करूंगा और उसकी जगह पर जाने की कोशिश करूंगा
0,2 बिस्तर जा रहा है। घर जा रहे हैं 2mrore। बहुत दुख की बात है
0,"अशर हाँ, मैं आज ऐसा महसूस कर रहा हूँ !!! आदमी...."
0,बीमार लग रहा है ... अच्छा सप्ताह लेकिन इतना अजीब थकावट ... कोई है जो मुझे एक मालिश देना चाहता है ??? कृपया!
0,उपयोगकर्ता सॉरी कक्षा में था जब आपने व्हाट्स द प्लान फॉर द प्लान टू गेटिंग फॉर दंग
1,सभी को धन्यवाद जिन्होंने मेरा पीछा किया है
0,उपयोगकर्ता मुझे पता है। अगर उनके डेनवर और साल्ट लेक की तारीखें फ्लॉप हो जाती तो यह सही होता
1,उपयोगकर्ता मैं तुमसे प्यार करता हूँ। सचमुच पसंद है। आपने बफ़ेलो में मेरा पूरा जीवन बनाया। घर में ब्रिटेन। सुरक्षित ट्रैवेलिन बेबी
1,"Im अप और पूरी तरह से जागना! और यह 1:40 बजे है ... जीज़ मैं वास्तव में वास्तव में आलसी हूं। मेरी गलती नहीं है, तिल 5 में नहीं मिला"
0,उपयोगकर्ता आपका वीडियो नहीं खोल सका
0,उपयोगकर्ता 1 मैं एक छड़ी मोती गिरा दिया। फिर कुछ धूमकेतु-अर्जेंट स्वारोवस्की ब्रियोस कोटिंग के बिट्स खो गए। मैं आज ginxed हूँ
1,उपयोगकर्ता कई आशीर्वाद!
0,*समय मैं 30 वें में मिला।
0,गंभीरता से? क्या यह सिरदर्द कभी चलेगा?! मेरा मतलब है कि यह एक -डेढ़ सप्ताह की तरह है
0,उपयोगकर्ता वह सच्चाई नहीं है। मैं आपसे बात करने के लिए एमएसएन पर आया था और जब मैंने चैट विंडो खोली तो आप ऑफलाइन सही हो गए
1,"उपयोगकर्ता कूल, धन्यवाद"
1,शुभ प्रभात
1,वह bahhhhhmb मुझे पसंद है
0,जम्हाई लेना। खिचड़ी भाषा सो। खिचड़ी भाषा का अध्ययन। किसी से भी बात करें। खाने के लिए कुछ नहीं। केवल पानी।  मुझे कुछ पनीर और गहरी तली हुई जरूरत है।
1,उपयोगकर्ता मुझे लगता है कि विश्वास करना मुश्किल है! यह 4 दिन के सप्ताहांत से पहले सप्ताह का आखिरी कार्य दिवस है! वू कौन!
1,"बिग बॉस पूरे सप्ताह बाहर है .. छोटे याय। आज कार्यालय के लिए मुफ्त दोपहर का भोजन, बड़ा याय!"
1,उपयोगकर्ता जब मैं एमटीवी एशिया या विशेष रूप से इंडोनेशिया में एमटीवी मूवी अवार्ड देख सकता हूं .. मैं बहुत उत्साहित हूं .. मैं बहुत बढ़िया हूँ !!
1,सब खत्म हो चुका है! PRAC मेरे जीवन के सबसे अच्छे अनुभवों में से एक है जो मेरे सभी छात्रों को याद करेंगे
1,साथ। मेरा जुड़वां सीस उपयोगकर्ता आज रात के लिए तैयार हो रहा है
0,"उपयोगकर्ता awww .... बेवकूफ, मूर्ख दांत।  आशा है कि यह जल्द ही रुक जाएगा।"
0,"- मून बुक लेकिन यह दूर हो गया, इसलिए मैंने इसे अपनी पिप्पी लॉन्गस्टॉकिंग बुक के साथ मारा, लेकिन अब मुझे नहीं पता कि यह कहां है कि मैं उन उड़ान वाली चीजों से नफरत करता हूं!"
0,उपयोगकर्ता iiggt मैं मैं धक्का देने की कोशिश कर रहा हूँ n सही निर्णय ट्रस्ट बनाने के लिए नहीं करना चाहिए n का उपयोग नहीं करना चाहिए विषय मैं मृत हो सकता है! अभी
0,उपयोगकर्ता यह ग्लासगो में यहाँ नीचे पेशाब कर रहा है!
0,बीमार महसूस करते हुए खुद को बेहतर महसूस कराने की कोशिश कर रहा है
1,इसे मेरे साथ देखना चाहते हैं? यहाँ लिंक है!  ---> url आनंद लें!
1,"""मेटामोर्फोसिस"" ... जो कि गंदगी को सीडी करता है।  मेरे एक फव्वारे के बारे में सोचो ... lol .. लेकिन thats cuz मैं इसके लिए थोड़ा और संबंधित हो सकता है। & मुझे वह अच्छा लगता है"
0,निपुण लगता है! अब दोपहर के भोजन के लिए इसका समय !!! हालांकि मेरा पिज्जा नहीं मिला
1,उपयोगकर्ता pmsl ahh dnt लगता है कि मीठी फैनी आँखें कभी भी अपना आकर्षण खो देगी !!! हाहा
0,मौत के लिए भूखा है
1,गूंगा निर्णय #532532823985 ... मुझे वैसे भी स्कूल पसंद नहीं है
0,"अब बिस्तर पर जाना, अकेला महसूस करना: पी गुडनाइट xxx"
1,मैं सभी को इस सप्ताह के अंत में जाने की सलाह देता हूं - कोशिश करें: URL या URL मैं चीजों को चलाने का वादा करता हूं
