0,उपयोगकर्ता उपयोगकर्ता मैं सिर्फ एक ग्रील्ड पनीर और एक सेब खाया
0,उपयोगकर्ता: छिपाओ !!!! सुरक्षित हों!!!
0,असाइनमेंट के संदर्भ में यह सप्ताह बकवास होने वाला है। खुशी है कि क्रूज कॉस पर नहीं जा रहा है तो मुझे कल रात तक सब कुछ खत्म करना होगा
0,विज्ञान सबसे मूर्खतापूर्ण चीज है जो कभी भी मुझे नहीं पता कि मैं क्या कर रहा हूँ ajsslkfjsl; aj SO DUMB! बेशक मैंने इसे एक दिन पहले छोड़ दिया
1,बेबी सामी के साथ समय बिताना!
0,बहन के साथ घूमना और फिर अध्ययन ...
0,"उपयोगकर्ता हम एक शांत था ... सप्ताहांत की अधिकांश बारिश हुई।  कल रात एक स्टेक डिनर था, जो स्वादिष्ट था !!! दूर जा रहा है"
0,उपयोगकर्ता ईर्ष्या! मैं एक चाहता हूँ
0,रोटी पर मूंगफली का मक्खन अभी के लिए करना होगा।
0,पहेली कैश ने मुझे परेशान किया कि कुछ समय पहले कैशिंग से बाहर निकलने में सक्षम होना चाहिए !!
1,लोग यह नहीं समझते कि आप 100 अच्छे लोगों को पाने के लिए 1000 तस्वीरें लेते हैं ...
1,आज M435 की सवारी। मैकलीन में एक लाइव बर्न में दिन का अधिकांश समय बिताने के लिए जा रहा है।
1,उपयोगकर्ता aww धन्यवाद यू !! यह सब ऑप्टिकल भ्रम के बारे में है ... हाहा तुम्हारा बेहतर है !!
1,दा मोर्निन के ऊपर 'मेरी ओर से o शहर से ya !!  उपयोगकर्ता
1,दिन के लिए कल न्यूयॉर्क के लिए हेडिन! इंतजार नहीं कर सकता!
0,उपयोगकर्ता बस काम और सामान। यूनी से पहले छुट्टियों का अंतिम सप्ताह
1,उपयोगकर्ता हाँ 'थोड़ा अचानक यह नहीं था; लेकिन फिर भी पसंद आया
1,"उपयोगकर्ता ओह इस छोटे से एक? मजेदार कहानी, मैंने उसे एक दिन सड़क पर पाया"
1,"उपयोगकर्ता कोई चिंता नहीं है, आपके पास कोई है जो आपके लिए प्रार्थना कर रहा है"
1,उपयोगकर्ता ... बस नए दृश्य मुद्दा खरीदा .. और आश्चर्य .. सीडी पर एक लॉन-ट्रैक ... अच्छा
1,"उपयोगकर्ता हाहा बेशक हॉट-डॉग स्टार आकर्षण हैं! आप बहुत मजाकिया हैं, इंतजार नहीं कर सकते कि आप यात्रा कर सकते हैं!"
0,फिर से ऊब गया है! LOL ..... अंत में मेरी साइडकिक को पंजीकृत करने की कोशिश कर रहा है। मुझे लगता है कि यह बारिश हो सकती है ... लेकिन इसके थोड़े शांतिपूर्ण .... मुझे txt !! (907-6625)
1,मेरे पास हिचकी है ... यह ट्विटर के बारे में लिखने के लिए एक बात हो सकती है?  हाहा
0,मुझे अपने BFF की जरूरत है
0,वर्तमान आर्थिक स्थिति के बारे में चिंतित है ... ज्यादातर मेरा अपना और यह अच्छा नहीं है
0,मुझे हमेशा बहुत अधिक पैसा खर्च करने के तरीके मिलते हैं। निराहार
0,उपयोगकर्ता आधे दिन के शुक्रवार को ब्राइटसाइड पर अच्छा नज़र नहीं है ... इन-ऑर्डिनली लॉन्ग वीकेंड
1,उपयोगकर्ता * drools * मैं एक निश्चित लंबा ब्रिटिश आकर्षक चाहता हूं कि मैं कितना छोटा हूं ...
0,"उपयोगकर्ता यो, मैंने गलती से मिटा दिया कि डीएम आप इसे फिर से भेज सकते हैं"
0,वट्टा दिन।  Im लापता गर्मी।
1,फिर से इंटरनेट होने से राहत मिली है
0,"ठीक है, मेरे पास एक सुपर लंबा दिन है और मैं पहले से ही बता सकता हूं"
0,"रविवार तक एक सप्ताह के लिए न्यूयॉर्क जा रहा है। मुझे यह कहने में दुख हो रहा है, मैं सोमवार को वापस आने तक #paint नहीं कर पाऊंगा।"
0,इसे अपशब्द कहें!!! मैं देर से काम करने में कैसे लूप हो जाऊँगा।  इतना दुखी .... दोपहर के भोजन पर खरीदारी!
1,"उपयोगकर्ता वही करते हैं जो हम आम तौर पर अपनी माताओं के लिए करते हैं, उसे अनदेखा करते हैं, और अपनी भाषा को ध्यान में रखते हैं कि एक क्लिप राउंड द लूग होल आगामी है"
0,बीमार लग रहा है .... एक फेफड़े को खांसी
1,"उपयोगकर्ता एजे राफेल (भयानक संगीतकार, YouTube पर प्रसिद्ध) ने आपके गीत को कवर किया, मत भूलो। कृपया इसे देखें यह अच्छा है! यूआरएल"
0,उपयोगकर्ता आशा है कि आप इसके सबसे बुरे के माध्यम से हैं!
1,"ओह और, मुझे कोई आपत्ति नहीं है अगर आप मेरे ब्लॉग पढ़ते हैं। ज़ोर-ज़ोर से हंसना। यह ठीक है, हालांकि यह काफी शर्मनाक है, और मेरी अंग्रेजी इतनी अच्छी नहीं है।"
1,उपयोगकर्ता oooooooooohhhh सुपर हॉट मिलिट्री बॉयज़ सब मैं चित्रित कर रहा हूं।
0,... 7:30 बेकार है
0,उपयोगकर्ता वास्तव में? मैंने नहीं देखा .... मुश्किल से आज ट्विटर पर रहा
0,"उपयोगकर्ता उनमें से कोई भी मेरे लिए विकल्प नहीं हैं, दुर्भाग्य से।"
1,"उपयोगकर्ता आप वैकल्पिक रियलिटी गेमिंग, ट्विटर माफिया युद्धों में दे रहे हैं?"
0,"उपयोगकर्ता मैं करूंगा, लेकिन आप मुझे अब और पसंद नहीं करेंगे"
1,अब बहुत बेहतर लग रहा है कि ईमेल को पादरी को सीधे सेट करने के लिए भेजा गया था और वह मेरा समर्थन करने के बारे में सहमत हो गया। उसे सही आकार में मार दिया।
0,"इंटरनेट फिर से उपयोगकर्ता नीचे है ...... हाँ, यह एक लंबा दिन url होने वाला है"
1,यूजर तो किसी भी विचार पर कोई विचार है कि फादर्स डे पर लैरी के लिए क्या प्राप्त किया जाए?
0,"ओह, मुझे लगता है कि मैं वास्तव में योग नहीं कर सकता।"
1,उपयोगकर्ता आश्चर्य है कि क्या Zac फिर से सैंडविच बना देगा ... वह वर्ष के कर्मचारी के लिए एक शू-इन है।  #Chuck
1,मेरे पास एक मिनीजोब है जो आज लोगों को स्थानांतरित करने में मदद करता है! Scooore! केवल पाँच रुपये एक घंटे का था। फिर भी पैसा
1,"उपयोगकर्ता ने मुझे बताया कि ""7 वीं और चढ़ाई"" भी अच्छी हैं"
1,"कल रात देखा, बहुत अच्छा। अब खेल के मैदान में सुपर फैट लॉस वर्कआउट के साथ इसे मारने के बारे में"
1,उन सभी बैंडों की जाँच करना जो सभी समय कम समर्थन कर रहे हैं। वे बहुत अच्छे हैं। विशेष रूप से चोरी ओ'नील
0,आज रात के लिए बड़े पैमाने पर विफलता नहीं ले जा रहा है
1,उपयोगकर्ता omg आपका नाम मेरे सबसे अच्छे दोस्तों के समान है!
0,मेरी आंखों की गेंद दर्द होती है और जलती है और ऐसा लगता है कि किसी की पोक हो रही है।
1,उपयोगकर्ता आश्चर्य है कि क्या आपका ग्रैम्पो मेरे ग्रैम्पो को जानता था
0,शम्सी एक टूटे हुए पैर के url के साथ बहुत खराश है
1,उपयोगकर्ता धन्यवाद। आप के लिए बहुत अच्छा है।
1,नहीं चाहता कि गेवी को छोड़ दें! रात के खाने के लिए धन्यवाद
0,"उपयोगकर्ता सू अद्भुत !! मैं आपके किसी भी कॉन्सर्ट में जाना पसंद करूंगा, लेकिन मैं इसका कारण नहीं बना सकता, मुझे चिली से हमारे लिए यात्रा करनी होगी"
0,"उपयोगकर्ता देसी, अपने बारे में इस तरह से बात करना बंद करो! यह आपके आत्मविश्वास के लिए अच्छा नहीं है"
0,की वेस्ट बहुत करीब है ... मुझे लगा कि मैंने आज सुबह समुद्र तट सुना है ... लेकिन नहीं ... बस मेरे कमरे में प्रशंसक मैं इंतजार नहीं कर सकता!
1,सोने के लिए!! सभी को शुभरात्रि!!
0,"उपयोगकर्ता मैं सेंसरशिप में विश्वास नहीं करता। मैं आपको इतना गर्म होने के बारे में तारीफ करने की कोशिश कर रहा था! और आप जो करते हैं उसमें अच्छा है। मुझे माफ करना, स्टोया।"
0,"अधिकांश समय उपयोगकर्ता, माता -पिता * और * छात्रों को नहीं पता कि यह कितना बुरा है। एक दोस्त के एक दोस्त ने सिर्फ JPR #SAD के लिए 9 लाख का भुगतान किया"
0,मैं अभी soooooo बीमार हूँ
0,"उपयोगकर्ता गाह, 2 बार जाने के लिए अच्छा ड्रेसिंग, काश आप यहाँ थे मेरी मदद करने के लिए मुझे खुद को स्टीमपंकिफाई करने की कोशिश मैं आपको गर्व करने की कोशिश करूंगा"
0,"उपयोगकर्ता मुझे पता है, जॉर्ज उसे गोली मारता है, यहां तक ​​कि आधे रास्ते के माध्यम से भी नहीं और मैं पहले से ही अंत (मित्र) जानता हूं"
1,अपनी हंसी अपनी मुस्कान और उन आँखों को याद करना
0,उपयोगकर्ता मैं Playasia के लिए इंतजार करूँगा
1,उपयोगकर्ता मुझे आशा है कि हमें यहां एक और खराब सर्दी नहीं मिलेगी। नहीं लगा कि हम इस पिछली सर्दियों से छुटकारा पाएंगे कि आज आप कैसे हैं?
1,रेड बुल को अच्छी तरह से किया गया ब्रॉन जीपी के लिए सभ्य परिणाम! लेकिन आशा है कि ब्रॉन जीपी अगली दौड़ में मिश्रण में मिल सकता है। ;)
1,ठीक है। फोन चार्ज किया गया। अधिक काम चलाने का समय।
1,उपयोगकर्ता हम मानते हैं कि एक ईमेल आपको भेजा गया है?
0,दोपहर के भोजन के लिए टैको बेल। मैं दुखी हूं क्योंकि मैं दालचीनी ट्विस्ट ऑर्डर करना भूल गया। मेरे पास हमेशा दालचीनी ट्विस्ट होती है।
0,"मेरे पिता केवल एक ही हैं, जिन्हें मेरे दूसरे पक्षी के नुकसान के लिए सहानुभूति है, मैं सिर्फ इसे नहीं ले सकता, और अब ट्वीटी अकेला है"
0,"मुझे गले लगाने की जरूरत है, सुनिश्चित करें .."
0,मेरे पैर चोट
1,"उपयोगकर्ता ए) मिनिस!  ख) बहुत बढ़िया, मैं आपको बता दूंगा कि क्या मुझे यहाँ कोई नहीं मिल रहा है c) awwwww <3 वह बहुत प्यारा है"
1,उपयोगकर्ता बहुत अच्छा था कि कैसे आपका क्या था
0,"उपयोगकर्ता कुतिया आप एक लानत मूर्ख! मैं आपको, अलाना, या उपयोगकर्ता ईवा फिर से नहीं कर रहा हूँ! मुझे लगता है कि गंदगी"
0,अभी उठा। इसके बाद फिर से सोएं। पैसे के लिए कुछ भी
0,काश एमटीवी अवार्ड्स आज रात होते
0,उपयोगकर्ता मैं इसे भी याद करने जा रहा हूँ *sobs *
1,निश्चित नहीं है कि ट्विटर ईमानदार कैसे काम करता है!
1,उपयोगकर्ता URL - एमएस केरी आप वास्तव में सुंदर हैं !!! और मैं आपके संगीत का बहुत बड़ा प्रशंसक हूं
0,"Yay, Apple ने दोषपूर्ण nvidia मैकबुक पेशेवरों पर 3 साल तक वारंटी बढ़ाई ... दुख की बात यह है कि खान दोषपूर्ण लोगों का हिस्सा है"
1,उपयोगकर्ता मैं शर्त लगाता हूँ!
0,उपयोगकर्ता मुझे लगता है कि मैं के माध्यम से मिला !! फिर वे बिना कुछ कहे लटका रहे
1,"उपयोगकर्ता योग्य! ओह मुझ पर विश्वास करो, हैजेन डाज़ चला गया है! ज़ोर-ज़ोर से हंसना! अब सभी पेट के अंदर।  हे, सुगंधित अच्छाई स्वर्ग"
0,आज थोड़ा अजीब लग रहा है
1,उपयोगकर्ता लेकिन मैं अब बहुत बेहतर हूं।
1,घर जाने का इंतजार !! : P GNA पार्क में बैठते हैं
1,उपयोगकर्ता अरे! आप क्या कर रहे हैं?
1,"ये वक़्त क्या है? समरटाइम स्कूल के बाहर, चिल्लाओ और चिल्लाओ!  पित्ताशय जन्मदिन मुबारक हो माँ"
0,Mmmm बकवास क्यों मैं बीमार हूँ
0,उपयोगकर्ता रिपोर्ट 'यह सिर्फ आप है। URL ऊपर है '
0,"मुझे आशा है कि मैं वास्तव में बीमार नहीं हूं, यह देखते हुए कि मेरे पास इस समय स्वास्थ्य बीमा नहीं है।"
0,डीसी गॉव से डैन टेंगरलिनि ने टीम ओबामा के लिए असिस्ट यूएस ट्रेजरी सेक्रेटरी यूआरएल को नियुक्त किया! डीसी के लिए थोड़ा कठिन
1,उपयोगकर्ता yup ... !!  क्या चल रहा है? क्या आप सोते थे?
0,बस मेरा गणित फाइनल लिया। आधा दिन आज! जो। मुझे चेल्सी की याद आती है
1,मैं आज रात उपयोगकर्ता के साथ अपनी तारीख के लिए बहुत उत्साहित हूं। मैं 530 का इंतजार नहीं कर सकता। क्या वह सबसे अच्छा नहीं है?
0,Wtf?!?! जूते ने मेरे चेहरे को बदल दिया है राजा झींगा सलाद मैं अब इसके साथ मीठी मिर्च सॉस है और कोई मिर्च नहीं है
0,उपयोगकर्ता OMG OMG OMG मुझे बहुत खेद है। वह भयानक है!
1,उपयोगकर्ता awww मुझे खुशी है कि मेरी पोंडोनस ने आपकी रात बनाई
0,"उपयोगकर्ता ओह अच्छी तरह से, हालांकि मुझे मीबो पसंद नहीं है, लेकिन यह वाईएम-ब्लॉक किए गए कार्यालयों का एकमात्र समाधान लगता है"
0,खिचड़ी भाषा खांसी बंद करो। मुझे लगता है कि मैं फेंकने वाला हूं।
0,यह बहुत लंगड़ा है
1,घर पर अकेले शनिवार * मेरे प्रोजेक्ट पर काम करने के अलावा कुछ भी नहीं करना है ... यार! यह मैं उबाऊ!
0,उपयोगकर्ता मुझे यूएसपी से नफरत है
0,कल वारसॉ के आसपास 20 किमी बाइक चलाने के बाद मेरे बन्स में दर्द महसूस करना
1,उपयोगकर्ता ठीक कूल धन्यवाद ...।
0,एक जन्मदिन के लिए कल के लिए ला के लिए ऊपर जाने के लिए स्टोक किया गया !! वूट !! लेकिन उदास im लापता कोचेला ...
1,"उपयोगकर्ता: मैं अपनी नौकरी में भी ""वाइन"" करना चाहता हूं, चॉप स्टिक मजाक को #epichilarity के रूप में टैग करूंगा"
0,उपयोगकर्ता मैं ऊपर से गायब हो रहा हूँ!
0,"आहह डेड एमएसएन!  मुझे विषय दें? 07742765771, इसे एंटी बोरियत के अच्छे कारण के लिए करें!"
0,"उपयोगकर्ता सॉरी एमी, लेकिन वे buttheads की तरह लग रहे हैं! यह अच्छाई की खातिर है। परिवार!"
1,हे दोस्तों मैं कल तक ऑफ़लाइन होने वाला हूँ! इतना अच्छा हर कोई !! ^^
0,गंभीरता से उपयोगकर्ता को लाइव प्रदर्शन करते देखना चाहता है !!!!!
1,उपयोगकर्ता ठीक है बस एक विचार जो मेरे लिए हुआ ...
1,"अशर हे! मुझे भी आपकी याद आती है! हाँ, मैं सबको बता दूँगा कि आपने हाय कहा। या बेहतर अभी तक, मैं उन्हें एक ट्विटर बनाने के लिए मना लूंगा"
1,उपयोगकर्ता आप अच्छी तरह से बेब करेंगे .. मैं एक lil प्रार्थना 4 u * गले * mashhh eeet upp कहूंगा! ; )
1,कुछ सामान की सफाई पर काम करना
1,आज रात बहुत मज़ा आया
0,उपयोगकर्ता नहीं! मैं इसके पास नहीं जाना चाहता था
0,टॉम क्या आप जीवित हैं? आप मुझे जवाब नहीं देते
0,कॉफी अलविदा हो गई
1,उपयोगकर्ता अभी तक नहीं .... आ रहा है!
1,उपयोगकर्ता सच है कि गीत चट्टानें
0,सारा कहती है कि मैं ला क्यूज में एक आदमी नहीं ढूँढ सकता हूँ मैं हर किसी को जानता हूँ! लानत है
1,Hisss मूवी ट्रेलर URL दिलचस्प
