0,"मैं अपने ईमेल, ट्विटर या एफबी को 5 के बाद तक नहीं देख सकता क्योंकि फॉक्स 3 बजे तक #एफ 1 रेस नहीं दिखा रहा है जब यह वास्तव में सुबह 8 बजे #FB पर शुरू हुआ"
0,मुझे एक बुरा लग रहा है कि कैव आज रात नहीं जीतेंगे।
1,मेरा ट्विटर वापस lol *<3 *पर है
1,उपयोगकर्ता URL - मुझे उर बाल बहुत पसंद हैं !! यह एक ही समय में वास्तव में गर्म लेकिन उत्तम दर्जे का दिखता है। ईर्ष्यालु। ज़ोर-ज़ोर से हंसना।  एक्स
1,उस के साथ उपयोगकर्ता शुभकामनाएँ
1,उपयोगकर्ता mmmmm आहार डॉ। काली मिर्च और स्तन ... एक दिन का पालन करने के लिए एक दिन
1,जेक के साथ
0,उपयोगकर्ता मेरे इंटरनेट को भी चूसना है।
1,"निकी निक के अलावा किसी और से बात करते हुए, मैं बहुत मज़ा ले रहा हूं एल - लिआ"
1,उपयोगकर्ता haha ​​oooh मैं उस फिल्म को कैसे प्यार करता हूँ
0,AHHHHHHH अलौकिक S4E22 समाप्त हो गया है !!!! मुझे अब सीजन 5 देखना पसंद है। सीजन 5 पहले से ही बनाओ !!!
1,समुद्र तट फिर यूनिवर्सल स्टूडियो! Yeeeeeeman!
1,"चिंता करने की बात नहीं है, कोई भी वह नहीं मिला। अगला प्रश्न 1 मिनट में शुरू होता है, अपनी सोच कैप्स प्राप्त करें"
1,"उपयोगकर्ता मुझे भी ऐसा लगता है, मुझे लगता है कि आने वाले हफ्तों में हम वहां पहुंचेंगे, #Militarymon इसे बनाएंगे!"
0,मुझे नफरत है कि इनलाइन वेटिंग .. लेकिन मेरी माँ मुझे लाइन कूदने नहीं देगी
1,कोई और बुखार नहीं! ट्विटर में होकर जश्न मनाते हुए! yey!
0,"उपयोगकर्ता ओह, समय में आपका संदेश नहीं देखा गया था, ओपीपी को याद किया।"
0,उपयोगकर्ता heyy its एक खेल luvv: _ याद रखें कि मैंने क्या कहा था यू हाहा फोन foof kthx
0,कैंट एक स्टारबक्स पाने के लिए परेशान हो सकता है अगर मेरी बहन यहाँ थी तो मेरे लिए यह मुझे याद आती है !!! मुझे लगता है कि परेशान महसूस करता हूं
0,"रात, यह ग्रेड 8 का मेरा अंतिम अध्ययन सत्र है! हाँ! किए गए। Tommorow के लिए इंतजार नहीं कर सकता .. गणित की परीक्षा लेकिन शेल्बी के साथ घूमना!"
1,शुभ रात्रि
0,बहुत दुखी ... मैंने सिर्फ एयर फ्रांस की उड़ान के बारे में सुना ...... मैं उनके लिए प्रार्थना करूंगा।
0,"और अब, यह वास्तव में मुझे डरा रहा है।"
0,मुझे असली खाना चाहिए
0,"उपयोगकर्ता ~ चलो कल बोस्टन में एक साथ खाते हैं, डी। यह मेरा आखिरी शो है और मैं बहुत दिल टूट गया हूं"
1,"हाँ! फोन कनेक्शन वापस आ गया है ~ !!! और GOSH मैं एक 8 वीं ग्रेडर नहीं हूँ, अब dx lol ima freshie .... क्या मुझे गर्व होना चाहिए? लोल ओह वेलज़"
1,"उपयोगकर्ता wakakaka pantes ujan, eh tau deh yang yang baru ganti javelin haha ​​-_- उपयोगकर्ता adaada hsna_040807user.com ya hihi धन्यवाद जोड़ें"
1,happyppppyyyy motherdayyyyyyyyyyyyyyyyyyy आप सबसे अच्छे हैं
0,"सोच रहा है कि उसे कभी भी ईमेल क्यों नहीं मिला, जिसे वह आज जल्दी ही हथेली खरीदने के लिए मिलती थी।"
1,पत्नी के साथ दोपहर के लिए इवान्स्टन में
1,उपयोगकर्ता और मैं यहाँ कुछ स्वादिष्ट भोजन खोजने जा रहे हैं
0,उपयोगकर्ता URL - AW मेन मुझे एक बड़ी तस्वीर की आवश्यकता है
1,"खैर, अभी भी कल रात की रेसिंग के बाद एक असली जगह में ... सुनिश्चित नहीं है कि कैसे महसूस करना है ... लेकिन समग्र रूप से अच्छा लग रहा है ... और सूरज बाहर है"
0,"उपयोगकर्ता हमें एक समस्या है, हमने शुक्रवार को रोटी खरीदी है और हम पहले से ही बाहर हैं कि आप अपनी रोटी ओह सूओ क्यों बनाते हैं?"
1,उपयोगकर्ता ने कहा कि खूनी अच्छा था !!!
1,रिहाना - छाता .. पुराना लेकिन अभी भी अच्छे जोनास भाइयों! केंट नवंबर तक प्रतीक्षा करें
1,मैं इस ट्विटर के साथ पुतला करता हूं
0,अभी ट्विटर में शामिल हो गया है और पता नहीं है कि क्या करना है
0,- यह सब चला गया पीट टोंग ...
1,उपयोगकर्ता वहाँ भी URL बनाम URL बनाम URL है
0,एफजीएस। 6 लड़कियां सिम्स पर। मैं चाहता हूं कि एक लड़का उसे अल्फी कहे।
0,"मेरे ब्रेक के लिए जा रहे हैं, फिर घर के समय के पास हो, नदी के किनारे कोई भी आफ्टर नहीं है, आज इतना अच्छा नहीं है"
0,"उपयोगकर्ता अरे, मैंने हमें सिम्स पर एक घर बनाया! ओह और आपको एक आदर्श संतुलन पसंद है और मुझे हमेशा मज़े आदि जैसे सामान की कमी है!"
1,"बस कुछ अच्छे क्रॉफ़िश ने मेरी लालसा को पूरा किया, लेकिन अच्छी खबर यह है कि मुझे एटी एंड टी जॉब वूट वूट विशेष thnx मिला"
0,मैं समय पर chords शिफ्ट नहीं कर सकता।
1,"उपयोगकर्ता हे, डेविड यह जानना अच्छा है कि आप ट्विटर में हैं। जब आप फिलीपींस में यहां थे तो मैं आपको नहीं देख पा रहा था। अपना ध्यान रखना!"
0,आज रात कुछ अच्छे चिली कैबरनेट सॉविनन के मूड में! उस कारमेन रिज़र्व की तरह लेकिन हाइपरमार्ट स्टॉक से बाहर लगता है
1,"#Unfollowfridays के विपरीत उपयोगकर्ता ... जब आपका सोशल मीडिया क्यूरडगॉन खेलने के लिए बाहर आता है? सुप्रभात, स्पाइक"
1,"उपयोगकर्ता को तुकबंदी ~ ""ड्यूमा कुंजी"", बाउंटीफुल आशीर्वाद, ट्वीट्स गुड मॉर्निंग, लोल को रखना चाहिए था! आज सुबह बहुत हाइकू-ईश!"
0,उपयोगकर्ता धन्यवाद! मेरे साथ फांसी पर लटकना कोई मज़ा नहीं था
0,"उपयोगकर्ता मैं पिछले कुछ वर्षों से उसकी तस्वीर पर क्लिक कर रहा था और फिर बीएफ तस्वीर आई, मैं आपकी जानकारी के लिए द्विध्रुवी ध्वनि करता हूं"
1,आज मेरे नए टैटू के बारे में बात कर रहे हैं और दोस्तों के साथ बाहर घूम रहे हैं
1,उच्चारण की दीवारों से सेब हरे और एक जले हुए नारंगी अशुद्ध फिनिश को चित्रित करना। नारंगी नारंगी नारंगी - नारंगी जैसे अधिक लोग क्यों नहीं?!
1,"कल दुबई में मेरे अंतिम संगीत कार्यक्रम के बाद, फिर कल के लिए ला चेकइन के बाल/मेकअप और अलमारी से बाहर, फिर मैं बाहर उड़ता हूं !!!"
1,"उपयोगकर्ता मेरे पास बहुत से पसंदीदा हैं, जैसे 45 या 7 .. लेकिन मुझे क्या पसंद है, यह है कि आप किसी प्रश्न का उत्तर देने के बाद डेटा कैसे प्रदर्शित करते हैं"
0,उपयोगकर्ता मैं आपको और अधिक याद आती है
1,उपयोगकर्ता आप उस अंतिम #firefly उद्धरण का जिक्र कर रहे हैं ?? * हंसने पर गिरता है* यह सिर्फ एक उद्धरण था !!
1,उपयोगकर्ता www.tweeteradder.com का उपयोग करके एक दिन में 100 अनुयायी प्राप्त करते हैं
1,#NMM नई संगीत सुबह उपयोगकर्ता पर। अब!
1,उपयोगकर्ता मिच?! हाहा वैसे भी मैं इस समय आपकी एक तस्वीर खींच रहा हूं और आप बाल मुझे परेशान कर रहे हैं
0,उपयोगकर्ता मुझे पता है कि आपका क्या मतलब है।
0,आशा है कि हमारे समुद्र तट की तारीख के लिए कल बारिश नहीं होगी
0,उपयोगकर्ता यह एक दोहराने वैसे भी है
1,भारहीन
1,नाश्ता: सॉसेज बिस्किट। हैश ब्राउन और 1 सेब पाई!
0,शुक्रवार की रात की योजनाओं को स्क्रैप करना था
0,उपयोगकर्ता मैं चाहता हूं कि सब कुछ अभी भी ऐसा होता: '(मैं चाहता हूं कि वे सफल हों लेकिन मुझे हन्ना मोंटाना पर प्रीमियर होने से पहले याद आती है
0,काम पर वापस होने की कठोर वास्तविकता !!!
0,2 हफ्ते! धत तेरी। =। = '' मुझे जल्द ही Chiong कला की आवश्यकता है। प्रिय भगवान।
0,उपयोगकर्ता हम्म अंतिम मैंने सुना है कि हिटिन इट एंड नेल्ड को दुकानों में देखा गया है। बॉर्डर्स या बीएन शाल्ड ऑर्डर 4 यू।  हाथ पर है ऊप
1,"उपयोगकर्ता ouch! डबल व्हैमी लोल। मुझे अपने किडनी की समस्या हो रही है। पिछले हफ्ते वास्तव में बुरा था, लेकिन इस सप्ताह बेहतर था"
0,"वैली वर्ल्ड .... रात के खाने के लिए शॉर्टी बाहर ले जा रहा है, क्योंकि वह हमें मम्म ग्रीक भोजन से दूर ले जा रही है!"
1,* आह* मैं अपनी पत्नी से प्यार करता हूं। वह अब तक की सबसे प्यारी चीज है। जूस ने मुझे बिस्तर पर नाश्ता किया क्योंकि
0,उपयोगकर्ता मुझे आश्चर्य है कि क्या हुआ जिसने उसे अचानक खाई के लिए प्रेरित किया?
1,एक ऑनलाइन मेकओवर की बात यह देखने के लिए
0,ट्वीट के अन्य भाग में यूके लोल को वापस
1,उपयोगकर्ता धन्यवाद। यह मेरी सूची में भी है
1,GOC पर चिलिंग ..
1,उपयोगकर्ता धन्यवाद!  करूंगा!
0,उपयोगकर्ता दुखी है
1,मेरे चचेरे भाई की शुरुआत में जा रहे हैं। Im एक गुलाब
0,उपयोगकर्ता उपयोगकर्ता लेकिन Tweetie में अभी भी कुछ अनफ़िक्स बग हैं। मैं अभी भी सर्वनाश है।
1,एक शूटिंग स्टार देखा
1,उपयोगकर्ता oo मैं वास्तव में देखना चाहता हूँ!  मस्ती करो!
1,"माइस्पेस पर 9,999 Viewz ... Hek yea!"
0,मैं इतना ऊब गया हूँ कि मुझे लगता है कि अलिसा का इंतजार है
1,"उघ। शावर, काम, फिर मेरे बच्चे के साथ समय।"
1,उपयोगकर्ता ने इसे पसंद किया
1,ग्रीस देखना ... निराशाजनक रूप से आप के लिए समर्पित है
1,URL - यह एक पुरानी जेडी मजाकिया है
1,गुड मॉर्निंग ऑल हैप्पी हंप डे
1,"उपयोगकर्ता धन्यवाद बहुत सारे ब्लॉगर्स हैं जो मुफ्त पृष्ठभूमि करते हैं, और आपके लिए निर्देश हैं।"
0,"उपयोगकर्ता नहीं, यह एक स्ट्रीमिंग वीडियो रिकॉर्ड करने के लिए था"
0,केम होमवर्क मैं इस वर्ग से नफरत करता हूं
1,उपयोगकर्ता स्विफ्ट/शहरी कमाल के हैं ... लेकिन यह वास्तव में देश-स्वाद वाला पॉप संगीत है। ऐसा नहीं है कि आप जॉर्ज स्ट्रेट या कुछ और देखने जा रहे हैं
1,उपयोगकर्ता को लग रहा है कि वह picky है लेकिन हाँ
1,जीत के लिए काम पर पूरे दिन N2N सुनना!
1,उपयोगकर्ता गुड मॉर्निंग सर एक अद्भुत दिन है!
1,उपयोगकर्ता *उच्च पांच *
0,"मुझे नफरत है कि आप लूज़-इन-द-ट्वीटिसफेयर ट्वीट्स को संपादित नहीं कर सकते हैं, क्योंकि आप हमेशा 'अपडेट' पर क्लिक करने के बाद एक मिलीसेकंड की वर्तनी की गलतियों को नोटिस करते हैं"
0,"उपयोगकर्ता सैग सबसे बीमार है, मुझे एआईएम यूरोरव पर मारा, मुझे कुछ दोस्तों की आवश्यकता है"
1,"उपयोगकर्ता योग्य! तुम मुझे दरार करते हो, मैं उन कार्टूनों से प्यार करता हूँ जो मैं भेज रहा हूँ। अब जब मैं घर पर हूँ तो मैं एक loong ईमेल हूँ"
0,"गोना मिस क्रिस्टीन, इसाबेल और जैमे को अपने फ्रेंच विसर्जन यात्रा में मज़े करते हैं! :* एयू रेवॉइर उपयोगकर्ता उपयोगकर्ता उपयोगकर्ता"
1,"मैं ट्विटर पर हाँ, हाँ"
0,आज रात मेरे पसंदीदा शिक्षक की मृत्यु हो गई ...।
0,* अधिक मिन्स टिल ब्यूटी एंड द बीस्ट इज़ ओवर मैन मैं पूरी रात रोता रहा हूं
0,Memtest का उपयोग करके कुछ निम्न स्तर की मेमोरी परीक्षण चलाना। यह सुंदर नहीं लग रहा है ... दोषपूर्ण रैम
1,हाँ शनिवार यहाँ है
1,ग्रेगरी के साथ Gremlins देखना
1,"बेशक उपयोगकर्ता!  अगले सप्ताह के अंत में मज़े करो। । हाँ, मुझे कहना होगा, रात का खाना यम था"
1,उपयोगकर्ता आप तब खेल का आनंद ले रहे हैं
0,पिछले साल मेरे साथ हुआ उपयोगकर्ता यह बहुत कष्टप्रद है
0,ट्विटर का उपयोग करने के लिए वंडरिंग
1,मेरे एलेक्जेंडर के साथ चरम मेकओवर होम संस्करण देख रहा है
0,यह बॉयस्टाउन के लिए अंत है। मैं शो को याद करने वाला हूं।
1,Addy के बपतिस्मा के लिए तैयार होना।
1,"उपयोगकर्ता उर व्यवसाय उर व्यवसाय है और हमारा नहीं।  बस खुश रहो, जो भी आप करते हैं।"
1,उपयोगकर्ता वास्तव में! मैं बहुत बड़ा माइकल मान प्रशंसक हूं।  यूआरएल
0,बीएनपी के लिए 2 सीटें तब ..
0,#Wheniwerealad Liverpool ने सब कुछ जीता। अब
1,वापस आकर खुशी हुई...
1,डब्ल्यूटीएफ? इसका छिड़काव ?? हमारी परेड पर बारिश नहीं हो सकती
0,"Daaamn, I ant भी tha tha tha to to tovit the the the tot ah nigga व्यस्त था .. लेकिन मैं यहाँ बिस्तर पर झूठ बोल रहा हूँ @ 5:48 पूर्वाह्न पूर्वी; फिर भी थोड़े थक गए"
0,उपयोगकर्ता एमएमएम हम्म। कल डॉक्टर।
1,उपयोगकर्ता को दिन के अलग -अलग समय पर ट्वीटअप जानकारी को ट्वीट करने की आवश्यकता है
0,ठीक है तो सबसे अच्छा वजन नहीं ...
1,हैप्पी बर्थडे शेल्बी।
0,"आज स्कूल, फिर आंटी का। यह सप्ताह इतनी धीमी गति से चला गया है"
1,"उपयोगकर्ता ने मुझे एक बैंड, डाउनटाउन फिक्शन के बारे में ट्वीट किया। वे बहुत भयानक लगते हैं। ट्वीट के लिए धन्यवाद, उपयोगकर्ता!"
1,एक नींद! मूल कल है!  मैं बहुत उत्साहित हूं! और मैं बस इसे छिपा नहीं सकता ...!
0,"'' चिंता मत करो, वह अपंग है, हम उसे मार सकते हैं। '' -बेथी"
1,हम अपने दादा -दादी से मिलने जा रहे हैं!
0,"वर्षों में एक स्वैप मीट के लिए नहीं किया गया है! एक साइड नोट पर, मेरी हार्ड ड्राइव विफलता है"
0,पीठ में दर्द है
0,उपयोगकर्ता मैं गंभीरता से नए हैरी के बाहर आने के लिए इंतजार नहीं कर सकता। केवल टोरेंट्स बाहर बहुत भद्दे हैं। यह गूउड लगता है !!!
0,"प्रिय ट्विटर, मुझे लगता है कि हम सिर्फ एक मेंढक के ऊपर भाग गए।"
1,उपयोगकर्ता आपको पेशाब करने के लिए सही परोसता है जो मेरे बारे में सनबेड्स पर जा रहा है! हमें जल्द ही 2 प्ले शोर गेम चाहिए
1,आपका बहुत-बहुत धन्यवाद! हा हा मैं अभी हूँ। (गायन) क्या लग रहा है !!! हा हा
0,एक तन पाने की जरूरत है! गंभीरता से बहुत उचित d।  मुझे समय चाहिए
0,"उपयोगकर्ता धन्यवाद! इतना महान नहीं शुरू करना ... मैं एक कुत्ते के रूप में बीमार हूँ!  लेकिन, मैं इसे सबसे अच्छा बनाऊंगा"
0,अगले साल फिर से दूर जाने के लिए हॉलिडे कैंट पर वापस जाना चाहते हैं! XXX
0,उपयोगकर्ता EWWW। मेंढक के पैर। मेंढक खाने के लिए बहुत प्यारे हैं
