0,"ऊब + लेकलैंड में अकेला आओ! यहाँ करने के लिए बहुत सारी चीजें, और एक अतिरिक्त कमरा। बुश गार्डन आज कमाल का था।"
0,रेनो में वापस
1,"प्यार क्रिसेट मिशेल की ""एपिफेनी"""
1,उपयोगकर्ता कैसे स्कूल जा रहा है? जब तक आप उरने के लिए ट्रंक में एक युगल मिल के साथ उर वाइफ को बचाने के लिए कितना लंबा समय आते हैं
1,पाठशाला के रास्ते पर। केवल 2 दिन का टिल ग्रेजुएशन!
1,सबको दोपहर की नमस्ते!! सूरज के बाहर सुंदर दिन चमक रहा है और मुझे खुशी है कि आप जीवित हैं
1,"#Javaone की यात्रा करने के लिए सैन फ्रांसिस्को की यात्रा शुरू करें।  मैं अभी उत्साहित महसूस करना शुरू करता हूं ... एसएफओ, मैं आ रहा हूं"
0,आज काम पर जाने का मन नहीं करता है
1,उपयोगकर्ता यम।
0,उपयोगकर्ता sarahhhh !!!!! जैसे कि ताड़ी केली ने कहा कि आप ऑनलाइन गए थे और वह हाय कहने वाली थी .. लेकिन फिर आप आआआआआआआआआआआआआआआआआआआआआआआआआआआआआआआआआआआआआआआआआआआआआआआआआआआआआआआआआआआआआआआआआआआआआआआआआआआआआआआआआआआ को बंद कर दिए गए थे।
0,"क्या यह है कि im इतना बीमार लग रहा है जितना मैं वास्तव में चाहता हूं और कल चर्च जाने की जरूरत है, बड़ा समय meh"
1,हैंड मी डाउन से एक नया फ़ाइल सर्वर बनाने की कोशिश कर रहा है
0,इतना आलसी बाहर जाने और दोपहर का भोजन करने के लिए
1,"उपयोगकर्ता हमेशा मुड़ जाता है, मेरा मतलब है कि मैं उसके बड़े अहंकार से मुकाबला करता हूं, लेकिन वह जानता है कि मैं वही था जिसने सेक्स का आविष्कार किया था ... लोलज़ वह जानता है कि मैं हैम लोल!"
0,एक हैंगओवर है और रात 8 बजे तक काम पर है
0,"सोफे के लोगों के आने के लिए इंतजार करने के लिए मजबूर किया। हाँ, हम नए सोफे मिल रहे हैं ओह हाँ! मुझे आश्चर्य है कि मेरा जीवन कितना बर्बाद है ..."
1,उपयोगकर्ता लक्ष्य है .... खुशी है कि आप पसंद करते हैं
0,"इसलिए, अगर मैं बैटरी को बाहर निकालता हूं, तो इसे वापस डाल दें और बैकलाइट को 3 मिनट पर सेट करें, तो मुझे फोन से 3 मिनट का उपयोग मिलता है। आनंद।"
0,"कौन, रविवार को मज़ा अधिक घरों को देख रहा है?! ओह खुशी! ... अभी भी बहुत कुछ करने के लिए एक नरक है"
0,उपयोगकर्ता शांत मिस्टर ... मैं आपके लिए कभी नहीं रहा .... मुझे लगा कि हम कलियाँ हैं
0,नहीं।  फ्लैश वीडियो के लिए ऑडियो काम कर रहा है।  फिर भी दो लैपटॉप नीचे।
1,उपयोगकर्ता उन्हें बताता है कि आप प्रतिभा से gobsmacked थे।
0,"उपयोगकर्ता बहुत मज़ा के लिए अपने काम ईमेल की जाँच करें! मैं थोड़ी देर के लिए आशा करता हूँ कि आप मज़े करते हैं, पोती।"
1,उपयोगकर्ता हम सभी जल्द ही एक साथ चिल कर सकते हैं!
0,उपयोगकर्ता आप बहुत स्वागत करते हैं .. काश मैं कनाडा में रहता
0,उपयोगकर्ता awww bax !!!! अभी तक मत छोड़ो ...
0,मेरे iPhone 3G Sâ £ प्राप्त करने के लिए इंतजार नहीं कर सकता। शायद एक या दो सप्ताह के लिए यहां नहीं होगा।
1,और मैं फिर से देख रहा हूँ..मुझे आज शाम करने के लिए कुछ भी बेहतर नहीं है
1,उपयोगकर्ता आपको जापान में खेलना चाहिए हाँ कृपया।
1,शुभ रात्रि
0,मैं ... हूँ ... तो ... थक गया
0,शादी बंद है .. लेकिन मैंने पहले ही अपने ब्राइड्समेड की पोशाक के लिए भुगतान किया है
1,उपयोगकर्ता eeehh .. मैं dunno .. भ्रम हवा में है ... या मेरे सिर में eeehm .. im ठीक है अगले सप्ताह जब im वापस ??
1,आर्कटिक बंदर और एडी मर्फी डेलिरियस
0,"यह बहुत बारिश करता है, लेकिन यह नहीं है।"
0,अगली बार इस तिमाही में डीन की सूची नहीं मिली ...
1,उपयोगकर्ता हाँ !!! मैं बुक ब्लॉगर पैनल के बाद उनसे मिला।  मेरी याददाश्त जॉगिंग के लिए धन्यवाद
0,"मैं भूख से मर रहा हूं और हम भोजन से ताजा हैं।  मत पूछो कि मैं इस जल्दी क्यों हूँ, यह अदृश्य k के नए स्वाद के साथ कुछ करना है ..."
1,एक और संस्करण ... बस शवेज़ की तरह ...? यूआरएल
1,इस पूरे ट्विटर चीज़ का पता लगाने की कोशिश कर रहा है!
1,उपयोगकर्ता आह अच्छी तरह से .. कम से कम आपको यह काम किया गया
1,शायद सवाल पूछने से पहले इसे पढ़ें?
0,"पेरिस में एफिल टॉवर को देखा, लौवर के बाहर (यह बंद था इसलिए हम मंगलवार को नहीं जा सकते थे), द सैकर कोयूर ..."
1,<3 देखने जा रहा है
0,उपयोगकर्ता मैं ट्यूबिन जाना चाहता था
1,मैं अपने ट्विटर को अपडेट कर रहा हूँ !!
1,इतना खुश कि मुझे टेलर स्विफ्ट शो के लिए फर्श की सीट टिकट मिला जो तीस मिनट से भी कम समय में बिक गया। माताओं और प्रेसीडेंट्स के लिए भगवान का शुक्र है।
0,क्या आकार के बादल हैं ... ऊह वह है ... नहीं
1,उपयोगकर्ता आपका स्वागत है
1,परिवार और उपयोगकर्ता के साथ जैतून के बगीचे में
0,उपयोगकर्ता दिलचस्प 2 चीजें। 1) KWN अभी भी उपयोगकर्ताओं में नहीं दिखाता है जिसके लिए मैं एक कॉलम जोड़ सकता हूं। 2) मैंने 2 ट्वीट के बाद दर सीमा मारा।
1,उपयोगकर्ता जब आप डॉ द्वारा जाना शुरू करने जा रहे हैं। Schwarzenegger? अपनी USC डिग्री का उपयोग करना शुरू करें
1,उपयोगकर्ता yup! अंडरडॉग जाओ! ... सभी ने हॉवर्ड और उसके चालक दल को गिना है! लेकिन वे एक लड़ाई के बिना नीचे नहीं जा रहे हैं! हेहेहे
1,"नई साइट अब ऊपर !! नई नेकवियर, समर टॉप, और एक नया टी! नया लोगो, सभी अमेरिकी परिधान पर! www.lividthorn.com, xo"
0,uuugg !! मुझे आज बकवास लग रहा है .. मेरे एक कुत्तों की मृत्यु हो गई। मैं sooo saad हूँ!  हम आपको याद करेंगे दोस्त !! T_t
1,"फांसी कल रात बस अविश्वसनीय थे। लंदन कारण है, c'mon !!!"
1,उपयोगकर्ता मैं पूरी तरह से यू संडे @ कन्वेंशन लोल हाहा *कैट *से मिला
0,"उपयोगकर्ता मैं केवल यहाँ सोमवार तक हूँ, फिर मैं इवान के साथ यूरोप के लिए उड़ान भरता हूँ"
0,"उपयोगकर्ता मैं हलवा पसंद करता हूं।  मुझे नहीं लगता कि वयस्क पर्याप्त अच्छी गुणवत्ता, घर का बना हलवा खाते हैं। ज्यादातर लोग उदास छोटे हलवा कप खाते हैं।"
1,उपयोगकर्ता अरे! मैं वास्तव में चीजों को वर्तनी में बहुत अच्छा हूँ। बस छोटे शब्दों को प्रमाणित करता हूं जो मैं कभी भी उपयोग नहीं करता हूं जो मुझे मिलता है। भगवान का शुक्र है कि मैं तुम्हारे पास है।
1,"उपयोगकर्ता अच्छा - लंदन दोपहर, बादल लेकिन कौन परवाह करता है"
1,बस एक वेबपेज मिला जो मैंने 1997 में बनाया था। यह अभी भी एंगफायर सर्वर पर बैठा है। मुझे इससे लिंक करने में बहुत शर्म आती है
0,"लंबे समय तक लंदन से वापस नहीं मिला, एक शानदार समय था, लगभग क्रिस्टोफर बिगिन्स को देखा, लेकिन बस उसे याद किया"
1,उपयोगकर्ता क्या आप जर्मन टीवी देखते हैं? Hehe MTV? या विवा?
1,उपयोगकर्ता अधिक फिल्में देखते हैं।  यूआरएल
1,उपयोगकर्ता haha ​​मैंने उन्हें बैट फ़ैग कहा और वे लोल को बंद कर देते हैं। मैं बिस्तर पर हूँ और सो नहीं रहा था
1,"असिस्टइंडो बर्न नोटिस .. एह, एह लीगलज़िनहू .."
1,उपयोगकर्ता mmrrewww
1,"मैं आपके लिए कामना करता हूं और अब मैं बिस्तर पर जा रहा हूं, गुडनाइट।"
0,उपयोगकर्ता यह स्वादिष्ट लगता है
0,आज रात ... मेरी जानेमन में से एक वास्तव में बीमार है। उसे कभी इस तरह नहीं देखा। मुझे आशा है कि वह बेहतर हो जाएगी! बेकार चीज!
0,अच्छी टोपी ... सोच ...?  हम्म्म्म .....
0,उपयोगकर्ता हेहे। मुझे तुमसे प्यार है! मैं थक गया हूँ।
0,"उपयोगकर्ता हम ट्रैफ़िक को याद करने और याद करने के लिए थोड़ा पहले छोड़ने जा रहे हैं, इसलिए अगली बार उम्मीद के लिए यह प्रस्ताव के लिए धन्यवाद नहीं होगा!"
1,"संयुक्त राष्ट्र आर्टिकोल फ्रुमोस, स्क्रिस फ्रूमोस url बधाई उपयोगकर्ता"
1,उपयोगकर्ता धन्यवाद। यह आप का भयानक था।
1,"उपयोगकर्ता ग्रैब, मानदंड। मैने शोध किया; डमी पाला फ्लेमेंको फॉर्म्स और सब-फॉर्म। कलोका!  मैंने एक सोलिया का प्रयास किया। कलोका एंग 12-बीट!"
0,अंतर्राष्ट्रीय संबंधों के लिए मेरा सेमिनार नहीं गया ... मुझे इसे लगभग पूरी तरह से फिर से लिखना होगा
0,लड़कियों के घर के रास्ते पर नीट विश्वास नहीं कर सकते कि यह पहले से ही खत्म हो गया है
0,मेरे bff से बात करते हुए ... एक लड़के ने उसे दुखी कर दिया
1,उपयोगकर्ता मैं टेलर स्विफ्ट द्वारा सबसे अच्छा दिन सुनना चाहता हूँ
1,उपयोगकर्ता TweetDeck महान है!  आप कभी भी कल्पना नहीं करेंगे कि ट्विटर इसके बिना कैसे दिखेगा।
1,उपयोगकर्ता मुझे पता है! लेकिन कम से कम आप वहां पहुंचे !!!  मैं सोमवार को डिज्नी के लिए इंतजार नहीं कर सकता ... मुझे आशा है कि मैं बेहतर महसूस कर रहा हूँ!
1,: उपयोगकर्ता चलो देखते हैं ... पिरामिड?
0,"उपयोगकर्ता मैं फ्लोरिडा में रहता हूँ और तुम यहाँ नहीं आ रहे हो मैं तुमसे प्यार करता हूँ, तुम एक आशीर्वाद हो!"
1,"गोना एक व्याख्यान को संशोधित किया गया, फिर 10 के रूप में 2 व्याख्यान मिले। फील्ड ट्रिप, याय से सभी नए पैलियों को देखने वाले"
0,काइल कैटिलिन को देखना चाहता है।
0,मेरा बैंक कार्ड AHHHHH खो गया
1,Excedrin मेरा दोस्त है
0,उपयोगकर्ता यह बहुत बुरा है
0,"एक महान बोस्टन कानूनी (हमेशा की तरह) - बस एक और जाने के लिए एक और। डिनर का समय, और फिर #IndyCar बाद में सप्ताहांत को लपेटने के लिए - फिर से Sobsob"
1,उपयोगकर्ता को इसके बाद भी अब बाद में ..
0,"बस मेरे डीसी निर्देशक को देखा, मेरे एचआर का कोई संकेत नहीं!"
1,"वेटिंग जय-जेड का ""डीओए"" मेरे आईट्यून्स में खुलता है।  यूआरएल"
1,मेरा शेड्यूल बर्बाद हो गया! .... ओवेल क्या नया है? मुझे उम्मीद है कि मैं आज भी सब कुछ पूरा कर सकता हूं
1,उपयोगकर्ता उसे विचलित करने की आवश्यकता है / और उसके पास इस समय 3words3sentences में इसे करने की ऊर्जा नहीं है।
1,आह .. सुप्रभात!
1,मैं अपने बी-डे के लिए इंतजार नहीं कर सकता!
1,उपयोगकर्ता आपका स्वागत है स्वीटी!
1,"उपयोगकर्ता हे नहीं, मेरा मतलब था कि आपका कनेक्शन उसके साथ अलग है, मेरी तुलना में मुझे वास्तव में एक टोपी मिली है!"
0,"उपयोगकर्ता नमस्ते! BTW, मैंने अपने हाफ-मालायली चचेरे भाई के साथ जाँच की, और वह मुझे आश्वासन देती है कि मल्लू हाटबॉय जैसी कोई चीज नहीं है। क्षमा मांगना"
0,"मेरी मम्मी दुखी हैं जो मुझे दुखी करती है कि मैं दुखी हूं, इसके संक्रामक"
1,एक मजेदार भरे दिन के लिए योजना।  एक दोस्त के साथ लटका हुआ है और फिर लड़के के साथ लटका हुआ है।
1,उपयोगकर्ता im वर्तमान में मेरे 43 वीं सूची को सूचीबद्ध कर रहा है!
0,अभी तक अपने घर को ऊपर से नीचे की सफाई कर रहा है और बाहर जाने और अपनी सफाई की नौकरी शुरू करने के लिए
0,उपयोगकर्ता क्या?  मैं इस सप्ताह के अंत में आपके दोस्त के पहले शो में जा रहा हूं। मैं तुम्हारे पास जाना चाहता हूँ !!
1,"उपयोगकर्ता मुझे यह सोचना पसंद है कि अगर मैं आपको वास्तविक जीवन में जानता था (क्योंकि ट्विटर वास्तविक जीवन नहीं है), तो आप और मैं अच्छे दोस्त होंगे"
0,मेरी दादी ने मुझे एक बेवकूफ कहा!
1,एक गर्म रविवार की पूर्व संध्या पर जेली से प्यार होगा ...
0,मेरे कैमरे को ठीक करने की कोशिश कर रहा है ..... 500 से अधिक चित्रों को खो दिया
0,"प्रॉप्स के लिए tnx, खिचड़ी भाषा हमेशा उन्हें viuser नहीं देखती है: ""ऊह ... आह ... आह ... ऊह ... कीमती क्षण ..."" """" Â «url"
0,मुझे ऐसा नहीं लग रहा है कि मैं क्या कर रहा हूं
1,उपयोगकर्ता खौफ !!! मुझे देखने की इच्छा है
1,"वाह ... मुझे आखिरकार एक ऐसी फिल्म मिली, जिसमें मैं खड़े हो सकता हूं जो केइरा नाइटली को दर्शाता है! मुझे लगा कि यह असंभव है"
1,उपयोगकर्ता www निक मेरा चेहरा भी है! और तुम मेरी fave mcfly है
1,उपयोगकर्ता बच्चे की तस्वीर प्यारा था
1,उपयोगकर्ता मुझे संदेह है कि आप मेरी सेवाओं को वहन कर सकते हैं।  मैं सस्ता नहीं हूँ।
1,बस कॉफी बीन गेटवे से आया
0,"काश मैं अभी अमेरिकन टैक्सी के लिए नृत्य कर रहा होता, लेकिन मैंने सचमुच आज कोई खाना नहीं खाया है और मेरा पेट ""योग्य नहीं"" है"
1,उपयोगकर्ता मैंने आपको रविवार के लिए आमंत्रण भेजा। मैं फिल्म प्रस्ताव के साथ कल गुड नाइट रिक के साथ पालन करूंगा!
1,उपयोगकर्ता मैंने पंच से यू बचा लिया क्योंकि यू ने कहा कि आपके माता -पिता के लिए y o u 'r e खाना पकाने
0,यह सिर्फ उपयोगकर्ता के लिए नहीं बुलाया गया है
0,मुझे इतना अच्छा नहीं लगता। मुझे लगता है कि मुझे स्ट्रेप गला और बड़े पैमाने पर सिरदर्द मिला। मुझे लगता है कि नॉर्थसाइड का पानी मुझे बीमार हो गया
1,"उपयोगकर्ता: आप बाहर काम करने के लिए क्या कर रहे हैं? पुश अप? बैठो? चलो, विवरण। मैं वास्तव में कल्पना नहीं कर सकता कि आप बाहर काम कर रहे हैं। ~ सेक्सी ~ लोल"
0,गर्मियों के शेकडाउन की योजना/पता लगाने की कोशिश कर रहा है। आह मदद शाली को सराय मिलता है
0,"मैं काम शुरू होने से पहले पहले 30 के दौरान उत्पादक होने की कोशिश करता हूं, मैं आमतौर पर यहां कुछ भी नहीं करता हूं।"
0,उपयोगकर्ता मैं सभी बतख (हिलर को छोड़कर) से नफरत करता हूं। गह। >> यह श्रृंखला उस तरह से नहीं जा रही है जिस तरह से मैं चाहता हूं।
1,उपयोगकर्ता आपको शायद उस पर फोर्स लाइटनिंग का उपयोग करना चाहिए - यह इसे ठीक करने की गारंटी है
