0,उपयोगकर्ता मेरे कान में दर्द होता है
0,लगभग एक घंटे पहले उठना था और मैं अभी भी अपने बिस्तर में लेट रहा हूं। गूंगा। कोई नींद नहीं मिली
0,हे भगवान।  मेरे अंडाशय ऐसा महसूस करते हैं कि वे बाहर निकाल दिए जा रहे हैं और चबाते हैं।
0,उपयोगकर्ता उपयोगकर्ता मैं ichat नहीं है और बाकी दुनिया करता है
0,उपयोगकर्ता क्या होगा अगर यह काम नहीं करता है ... मैं क्या करने जा रहा हूँ?
0,लोगों बढ़ो!! मेरे अनुयायियों की संख्या पाने में मेरी मदद करें .....
1,MCD (फिर से!) पर खाना समाप्त करना अब sency-ing url
0,उपयोगकर्ता हे। क्या चल रहा है? मेरे ट्विटर अकाउंट को फिर से सक्रिय करने का फैसला किया। हालांकि मैं वास्तव में निश्चित नहीं हूं कि इसका उपयोग कैसे करें
0,मैं मेरी भावनाओं को खा रहा हूँ।  उसके बिना इतना कठिन है। 3000 मील बहुत दूर है
0,मैंने बस XLDB को कई अन्य यात्राओं के लिए आमंत्रित किया। विशेष रूप से डब्ल्यू/ एक लंबी उड़ान वहां पहुंचने के लिए।
0,उपयोगकर्ता यह पहले से ही शुरू हो गया है? मुझे आशा है कि मैं इसे याद नहीं करता
0,"आर एंड एस के साथ बाहर जा रहे हैं।    मेरे ""एम"" को याद कर रहा है।"
1,उपयोगकर्ता हेह 'यह महान डिग्स बती अयू काय गामे पा को केला सा ट्विटर
0,बस घर पनासनी मिल गया
1,pf चांग मेरे चेहरे में eeeeeeeeeeeeee ooh तो अच्छा है
0,मैं सो नहीं सकता क्यों !!!!!
1,डिजिटल मीडिया अवार्ड जीतने के लिए कृपया 4AM प्रोजेक्ट के लिए वोट करें! Url pls rt!
0,मुझे लगता है कि हम थोड़ी देर के लिए गर्म दिनों से बाहर हो गए हैं ...
1,उपयोगकर्ता बाहहा..गूड वन
1,"चर्च के लिए तैयार हो रही है, फिर सॉफ्टबॉल !!!   यह एक शानदार रविवार है।"
1,"उपयोगकर्ता मैं नहीं, लेकिन यह डरावना सामान lmao है"
1,"थका हुआ, लेकिन खुश है कि मैं स्कूल जाता हूं"
0,"वाही कुकीज़ नीचे की तरफ फ्लेवा फ्लेव की तुलना में ब्लैक हैं और चॉकलेट चिप्स पिघल नहीं गए थे, मुझे लगता है कि ये अनट-सक्षम हैं।"
0,हवाई अड्डे में खड़ा है। कहीं भी काम नहीं कर रहा है!
1,आज asda में £ 20 खो दिया wtf। ओह अच्छा। अभी भी हमेशा की तरह एक भयानक दिन
0,उपयोगकर्ता मैं नहीं हूँ
1,उपयोगकर्ता हे माइली क्या आप कल फिल्म अवार्ड्स के लिए सुपर उत्साहित हैं? आप भाग्य के टन की कामना करते हैं
1,उपयोगकर्ता यह मुझे याद दिलाया और मंगेतर © क्यों हम बच्चे नहीं हैं
0,उपयोगकर्ता मुझे एक भी नहीं मिला।  मेल हमें प्यार नहीं करता है!
0,उपयोगकर्ता कि के लिए अनकला था !!! क्या मेरी मम्मी ने आपको चोट पहुंचाने के लिए किया है?   अगर वह इसे पढ़ती है तो उसे चोट लगेगी
1,"उपयोगकर्ता हे, मैं गंभीरता से गोधूलि कप के लिए एक लत है"
1,एमबी पब इस w/e को क्रॉल करता है।
0,अभी भी बिस्तर पर बीमार एमएसएन पर बात कर रहे हैं .. काश यू मुझसे बात करेंगे
0,उपयोगकर्ता aww।   जब कारें मर जाती हैं तो मैं दुखी हो जाता हूं।
1,"किसी भी रात जो सुबह 5:30 बजे समाप्त होता है, मेरे माथे पर 'डिस्को' शब्द के साथ एक नाइटबस से गिरना एक महान एक रहा है"
0,"[विंडोज 7]: स्थापना के 1 मिनट बाद, डेस्कटॉप प्रेप।, और ... नियंत्रण ने काम करना बंद कर दिया। सिर नीचे लटका। ।  यूआरएल"
0,क्या मैं जुरासिक पार्क देख रहा हूँ !!?! मैं बहुत उलझन में हूँ
0,उपयोगकर्ता ओह ग्रैंड !! आप? नहीं .... मुझे लगता है कि मैं आज शुरू करूँगा ... मुझे पैकिंग से नफरत है!
0,"उपयोगकर्ता ओह लड़का, मुझे नहीं लगता कि आपको ऐसा करना चाहिए था, मैंने #pocky की कोशिश की और अब मैं इसके बिना नहीं रह सकता!"
0,उपयोगकर्ता क्या आपको मदद की ज़रूरत है ?? * आह* मुझे लंबे समय तक अनपेक्षित होना मुश्किल लगता है - मुझे लगता है कि यह एक आनुवंशिक कमजोरी है
1,निम्नलिखित उपयोगकर्ता के लिए धन्यवाद
0,"आह कार में मेकअप कर रहा था, मैं सुसान बॉयल को बीजीटी पर अब चर्च के लिए देर से देख रहा था और वह 2 आया था"
1,उपयोगकर्ता महान ज़ेन कहावत।   साझा करने के लिए धन्यवाद...
1,"गुटेन मॉर्गन! * umarm* अपना सिर ऊपर रखें! आप मजबूत हैं, चीजों के फैसले में बहुत जल्दबाजी न करें। इसे एक बार एक कदम लें। एक अच्छा दिन है <3"
1,उपयोगकर्ता नमस्ते
0,उपयोगकर्ता वास्तव में नहीं
1,URL - खूनी शानदार पैरोडी! देखो अगर तुम एक एनबीए या कान्ये प्रशंसक हो
0,क्या मैं केवल एक ही नहीं था?
0,"सो नहीं सका, पूरी रात, मुझे यह पछतावा होगा जब मैं काम से घर जाऊंगा"
0,ऊह !! बस जब आपको लगा कि आप पकड़े गए हैं। आपका बैकअप कैमरा आपके द्वारा उपयोग किए गए 40D या 30D की तलाश में मर जाता है
1,नेवी पियर में लवली डे
1,रात ट्विटर! पहला अंतिम कल! एफ के लिए याय!
0,उपयोगकर्ता मुझे आशा है कि आप JB <3 OMG से पहले बेहतर हैं कि हम स्वाइन फ्लू के पास जा रहे हैं।
0,जब मैं अपने स्कोलियोसिस को महसूस करता हूं तो मुझे दुखी करता है
1,मैं केसी से उपयोगकर्ता और ज़ैक एस के साथ बिज़ आउटरीच को मॉडरेट कर रहा हूं।  कौन भाग ले रहा है?  #AIGA_09LR
0,उपयोगकर्ता आह्ह्ह्ह ... धुंध
1,उपयोगकर्ता ने ontd के बारे में सुना? इसका एक प्रशंसक यू को समर्पित है
0,उपयोगकर्ता मैंने एक पिल्ला मिल लोगों को खरीदा था और यह वर्षों पहले नहीं जानता था और वह इतना बीमार था और 7 साल की उम्र में मर गया था
0,शराब की एक बोतल से ज्यादा दर्दनाक कुछ भी नहीं और कोई कॉर्क पेंच फिर से नाकाम नहीं है !!!  #FB
0,एक और प्यारा लड़का रोता था ... उसे लगता है कि मैं इसकी वजह से बहुत खूबसूरत हूँ ... काश मैं उससे शादी कर पाता
0,उपयोगकर्ता मुझे खेद है कि आप आहत हैं!  आशा है कि आप एक तेजी से वसूली करेंगे!
1,6.23.09 (((:: यह एक मजेदार रात के बच्चे हैं। ((अगर मैं जाता हूं)) हाहा नेवर्रशाउटटटनेवर्रर
1,"उपयोगकर्ता हे, बेलफास्ट में आओ आप अद्भुत थे @ पेचीदा अप टूर, ब्रिटनी कैसे थी? Im 19 वीं पर चल रहा है"
1,उपयोगकर्ता वह वास्तव में करता है!
0,उपयोगकर्ता मैं lydiaaa ट्विटर के भ्रामक के रूप में अच्छी तरह से मैं तुम्हें याद करेंगे> <।
0,"उपयोगकर्ता ओह मेरी अच्छाई !! आज रात मेरा छोटा हरे फूल! मैंने हरे रंग की मुड़ने की कोशिश की, लेकिन मेरे पंख किसी कारण से इसे भिगो नहीं पाएंगे।"
1,उपयोगकर्ता को आशा है कि आपकी पत्नी के पास एक महान माता का दिन भी है
0,काम के बाद एक लाउंज या सोमेथिन को मारना चाहिए
1,उपयोगकर्ता सयांग मैंने आपको देखा
0,नरक से मध्यावधि ने आधिकारिक तौर पर मेरे सप्ताहांत को बर्बाद कर दिया है
1,उपयोगकर्ता - मेरा BFF एक मालिश चिकित्सक है और पीठ दर्द के लिए चमत्कार करता है।
1,"उपयोगकर्ता आप सबसे अच्छे हैं, धन्यवाद !!"
0,"उपयोगकर्ता हाँ यह भयानक cuz मेक्सिको अब 5 वां स्थान है, लेकिन एक ही समय में होंडुरास अब 4 वां बेवकूफ सल्वाडोरियन योग्य है"
1,ट्रेन में कुछ रोमन और जर्मनिक लोग। बेशक असली जर्मनिक जनजाति नहीं। असली जर्मनिक लोग घोड़ों का उपयोग करेंगे #Carnuntum
1,मुझे याद दिलाएं कि उपयोगकर्ता और उसके भाई के साथ शिविर लगाने के लिए कभी नहीं।
1,"उपयोगकर्ता - इस जीवन हवलदार उद्देश्य में सब कुछ। कोई गलती नहीं है, कोई संयोग नहीं है, सभी घटना आर आशीर्वाद से हमें सीखने के लिए दिया गया है"
1,उपयोगकर्ता मुझे लगता है कि मेरे पास अभी भी आपका पता है एक सीडी आपके रास्ते में आ रहा है
0,लिवरपूल में उपयोगकर्ता का मौसम हालांकि थोड़ा ग्रम्पियर है!
0,मैं इतना दुखी हूं कि डैनी चला गया है!
1,उपयोगकर्ता योग्य। यह निश्चित रूप से ऐसा लगता है। ;) मुझे आशा है कि आपके पास एक महान समय है।
0,स्वयं पर ध्यान दें ... जूली और कोरिन के साथ आग में सांस लेने का प्रयास कभी भी .. यह एक जले हुए होंठ में परिणाम हो सकता है
1,CityRail Haha पर फ्रेंच घोषणा ... मुझे लगा कि मैं एक सेकंड के लिए पेरिस में खो गया था
0,"शुरुआती शो के लिए शहर में जाने के लिए सुबह 3 बजे जागने के बाद, मैं थक गया हूं ... फिर भी इसमें मोड़ने से पहले सिंक को साफ करने की जरूरत है, हालांकि"
0,अब 3am hayfever लक्षणों से थोड़ा नाराज हो रहा है
1,ऑन डिमांड पर ITV प्लेयर में ADS उपयोगकर्ता नहीं है
1,वहाँ से बाहर धूप का उपयोगकर्ता बिट और यह हम सभी को खासतौर पर तब पूरा करता है जब आपके पास तौलिये का पहाड़ धोने और सूखने के लिए होता है!
0,बस जल्दी से जल्दी उठ गया।
0,"ओह, तूफान पर आओ, एर आरआईपी चलो! इससे पहले कि वे वास्तव में अच्छे हो जाते हैं, वे फ़िज़लिंग करते रहते हैं। मैं सुनना चाहता हूँ कि यह घर को गुनगुनाता है!  तूफान मेरी तरह हैं"
0,जल्दी उठना बस मुझे इस गिरावट के बारे में तनाव के लिए अधिक समय देता है .. मैं हैमंड जाना चाहता हूँ
1,हुर्रे हुर्रे! केक था!  सोफे पर किसी को भी फ्लिप करने के लिए नहीं था।
1,उपयोगकर्ता McFly और जोनास ब्रदर्स हुह? अच्छा टॉम
1,"URL - आज रात, मैं @ स्कीनी के यति को देखने के लिए, बाहर आओ!"
1,मुझे लगता है कि मुझे आज थोड़ा सा तन मिल गया होगा
0,उपयोगकर्ता वह मुझे बता सकता था।
1,इसलिए मैं अपने स्कूल के साथ कल चिड़ियाघर जा रहा हूं और मैं थोड़े उत्साहित हूं
0,"क्षमा करें चीनी, लेकिन मुझे चढ़ाई बहुत पसंद थी - माइली साइरस"
0,एक ओबिटरी लिखना। कैसे खुश है कि जब यह बाहर बहुत सुंदर है?!
1,"अफसोस की बात है कि मेरे दोस्त ट्विटर पर नहीं हैं। इसलिए यदि आप मुझे जानना चाहते हैं, तो मुझे एक संदेश लिखें"
0,सीआई के बिना उपयोगकर्ता बोरिंग एक ही समय पर हो रहा है !!
1,विविधता जीता <3 yay! मेरे पास आज के बारे में क्रोध करने के लिए कुछ भी नहीं है
1,"उपयोगकर्ता केके, pls ने मेरे पहले के ट्वीट को नोट किया - MotoGP या SBK til Tomoz नहीं देख रहा है, इसलिए सुंदर कृपया परिणामों को ट्वीट न करें? धन्यवाद मेरे प्रिय"
1,"Yaaaaaaaawn ... यह एक और दिन है, लेकिन हे, यह बुधवार पहले से ही है"
1,उपयोगकर्ता yupyup। हाहाहा
1,उपयोगकर्ता योग्य कॉपी और पेस्ट
1,उपयोगकर्ता कि एक पागल गधा तस्वीर है !!! बहुत खूब!!!
0,मैं मास्टर क्लीन के 8 दिन और 10 पाउंड हल्का हूँ! मैं 5 और एलबीएस के लिए उम्मीद कर रहा हूँ इससे पहले कि यह सब खत्म हो जाए!  अभी भी कोई DWYL टिकट नहीं है
1,"बस whodini को खींच लिया ... इसकी जब आप बस छोड़ना चाहते हैं ... कोई ""अलविदा"" नहीं, बस गायब हो गया! लोलोलोल ... शुभ रात्रि"
0,थक गया है और बिस्तर पर जाना चाहूंगा केवल मेरे पति ही अपना चालान कर रहे हैं और चाहते हैं कि मैं उनकी जांच करूं
0,"ऊर्जा दक्षता आदमी के लिए कल जल्दी उठना है, वह आधे नौ पर आ रहा है !! दुनिया के साथ क्या गलत है"
1,यूजर उर वेलकम भी आओ शाही कोफा के साथ भरवां खीमा: पी चाहेय? यम है
1,उपयोगकर्ता मुझे इसकी ज़रूरत नहीं है मैं सुंदर हूँ;) haha ​​बात ya ltr पर
0,कुछ कारणों के लिए स्रोत sdk अभ्यस्त लॉन्च मैं नफरत भाप
0,सनी मल्लोर्का पर दो सप्ताह के ऑफ-नेट से वापस। डोडी बाथ-टैप वॉशर तय किया और अब मुख्य टपक रहा है जो हो रहा है?
1,"मुझे भूख लग रही है! मुझे लगता है कि मैं अब खाने जा रहा हूँ .... सोचो, अच्छा मैं हूँ !! हाहा"
0,"उपयोगकर्ता मुझे लाल झाड़ी चाय भी पसंद है! यह यहाँ बहुत महंगा है, हालांकि, अच्छी तरह से अच्छा सामान वैसे भी"
0,उपयोगकर्ता कृपया करते हैं!  सॉरी मूस लोल।
0,"ओह, Man.mtv मूवी अवार्ड्स इस रविवार को 9.00pm.No MTV एशिया से समाचार है कि यहाँ पर हवा हो।"
0,चर्च में जाना चाहिए लेकिन मैं नहीं हूं
1,"संगीत सुनना, नेट सर्फिंग और GTA SA खेलने के लिए जाएगा"
0,कपड़े धोने के कमरे में कुछ टूट गया। हर जगह धुआं उठता है। और जले हुए रबर की तरह बदबू आ रही है।
0,क्या दिन !! अगर केवल यह लंबे समय तक एह हो सकता है ??
1,"Ugg, खिचड़ी भाषा नींद। मेरा कमरा गर्म होना है। ओह ठीक है, इस समय का उपयोग कर सकते हैं स्टारगेट पर पकड़ने के लिए"
1,"उपयोगकर्ता ओह, मैं तुमसे कैसे प्यार करता हूँ, YouTwitface xoxoxoxoxox"
1,"उपयोगकर्ता ""ऑटोफोलो"" .... मैं अपने तराजू को क्रॉलिंग महसूस कर सकता हूं !!!!!"
1,स्पा ओहमन ~~ विश्राम में यहाँ मैं XD आता हूँ
0,"उपयोगकर्ता ओके आपको काम पर लिंक भेजेगा, यह सिर्फ कहता है कि समुद्र तट के लिए तैयार न आएं, सोचें"
1,थोड़ा थक गया ... कल और अधिक अपडेट करने वाला। और मैंने देखा कि कोई और मेरा पीछा कर रहा है! क्या! मैं अपने सभी अनुयायियों से प्यार करता हूँ!
0,इस सप्ताह के अंत में वह फुटबॉल नहीं खेल रहा है
1,उपयोगकर्ता ब्रेन ट्रिविया केवल तभी उपयोगी है जब ओएस अभी भी सामान्य रूप से काम कर रहा है।
1,उपयोगकर्ता हे मैं इस तरह से अपनी उंगलियों की प्रोग्रामिंग के लिए ट्वीटी को दोषी मानता हूं।
0,काश मैं तैराकी जा सकता था .... लेकिन उस सपने को गोली मार दी गई थी
1,"उपयोगकर्ता लानत है! जैसे मैंने कहा, क्लासिक! सुनने के लिए धन्यवाद"
1,घर पर एक आराम रात बिताना: कुछ भयानक लोगों के साथ टीवी और वीडियो चैटिंग देखना
1,"इस सप्ताह के अंत में बीएमडब्ल्यू पीजीए टूर देखना, और जॉन डेली के संगठन से हैरान थे"
1,अब बस में
