1,"मुझे ट्वीट से मिलाने के लिए ताज़ को प्यार करना, जीवन इतना आसान हो जाएगा अब मुझे लगता है कि मैं अब 2 बिस्तर से दूर जाऊंगा। XX"
1,टेलीविजन फिर बिस्तर ... इतना थका हुआ और थोड़ा धूप
0,"उपयोगकर्ता awww, मेरे साथ कुछ साझा करें"
0,"शहद के छोरों को खाया है, लेकिन अब वे सभी चले गए हैं"
1,एक लग रहा है उपयोगकर्ता एल्बम मेरे साउंडट्रैक को समर 2009 के लिए जा रहा है <3 मेरी साउंडट्रैक टू लास्ट समर यूजर एल्बम था
0,"सूरज चमक रहा है। पक्षी गा रहे हैं, और काम करने जा रहे हैं"
0,उपयोगकर्ता y यह है कि जब यू का सबसे अच्छा इरादा होता है कि लोग चाहते हैं कि 2 छुरा यू को इतना मुश्किल है कि जब उर रक्त ठंडा हो जाए तो इसे एक साथ रखना
1,उपयोगकर्ता मैं कल था ... आनंद लें
0,उपयोगकर्ता क्यों?! आपको मुझे ऐसा भद्दा इंटरनेट कनेक्शन क्यों प्रदान करना चाहिए?! मैं सिर्फ अपने केबल मॉडेम को शूट करना चाहता हूं
0,उपयोगकर्ता संशोधन बेकार है: मैं कल नफरत करने वाला हूं: एस
1,मेरा पोता ठीक कर रहा है!    2 हर्नियास होने के कारण समाप्त हो गया।  उसके पेट के प्रत्येक तरफ एक।
0,डबलिन को या नहीं डबलिन ...
1,"उपयोगकर्ता योग्य, भयानक आदमी। खुशी है कि यह बहुत सुखद था"
0,मेरा ट्विटर दयनीय है
0,उरघ मैथ्स होमवर्क कर रहा है
0,"5555 मैं अपने फोटो स्टॉक वेबपेज को कल से अपग्रेड कर रहा हूं, क्योंकि यह अभी भी दुर्घटना है"
1,उपयोगकर्ता धन्यवाद!
0,उपयोगकर्ता मुझे यकीन है कि आपकी प्लेलिस्ट आज के लिए बनाए गए नरक को बाहर निकाल देगी।  मुझे 10 गाने की तरह छोड़ना पड़ा
1,सनी बाहर जाना चाहता है कि मेरे साथ आता है शायद माइली साइरस मेरे साथ आना चाहता है
1,उपयोगकर्ता मैं इसे प्यार करता हूँ ... यह मेरे नए fave उद्धरणों में से एक होने जा रहा है।
0,रोमानियाई नंबरों पर जा रहा है .. बोरिंगग: एल
1,उपयोगकर्ता का अनुमान है कि मुझे हैलोवीन के लिए वेयरवोल्फ पोशाक पर पुनर्विचार करना चाहिए। मुझे पुलिस द्वारा आवारा के रूप में गोली मार दी जा सकती है।
1,"ठीक है, यह देखने के लिए कि पिछले दो घंटों में कितने अनुयायियों ने छोड़ दिया है, सभी की निगरानी/मज़े के लिए धन्यवाद! आप महान थे! #BACHELORETTE"
1,एक और फिल्म और मिंट चिप आइसक्रीम के साथ मेरी रात को समाप्त करना!  शुभ रात्रि!
0,दिन के अंत तक काम के दो प्रमुख टुकड़े मिल गए।
1,उपयोगकर्ता ने अभी मेरा जन्मदिन प्राप्त किया है! धन्यवाद (बहुत खुश आदमी)
1,मेरी बहन में अध्ययन और बाद में घर का बना पिज्जा बनाना
1,"खरपतवार खींचे, झाड़ियों को छंटनी की, और लॉन को माउड किया ... अब आराम करने का समय"
1,Yay इंजीनियरिंग बैज मिलता है! कोई भी विज्ञान के लिए व्यापार करना चाहता है?
1,मैं घर पर हूं। आखिरकार वापस घर। अब मेरे पास दो महीने का ग्रीष्मकालीन ब्रेक है
1,"गाजिबो पक्षों को पाने के लिए आर्गोस गज़बो को वापस आ गया, गज़ेबो को ऊपर रखा, यह प्रयास था। Becontree में टोनी से मिलने जाना था, एक घंटे के लिए रुके थे"
0,मुझे पता था कि यह जल्द या बाद में होने वाला था। मैं बीमार हूं
0,उपयोगकर्ता उस पुस्तक को बहुत दुखद है।
1,उपयोगकर्ता के माध्यम से: ty मैं आपके ट्वीट्स के लिए तत्पर हूं! आप ट्विटर पर क्या कर रहे हैं?
0,बस देखा वोनगट ने इसे काट दिया .. मुझे लगता है कि मैं दरवाजे पर जा रहा हूं और अब लटका हुआ हूं .. मौसम के नीचे थोड़े लग रहा है।
1,Tweetmorning lovelies कैसे हर कोई है?
0,मॉल में। मुझे कुछ भी देखने को नहीं मिलता। रग्स खरीदने वाले मेरे माताओं
1,बाद में ई संग्रहालय में रात को पकड़ने वाला
0,उपयोगकर्ता यह लगभग £ 35 प्रति सिर और इसलिए औसत है
0,उपयोगकर्ता मुझे 80 के पोर्न भी टेरी विगल (एसपी) और मूल सवाना से प्यार है
0,उपयोगकर्ता उसे देखने की मेरी बारी नहीं है। क्षमा मांगना
0,मुझे माफ़ कीजिए! और आप जानते हैं कि मेरा मतलब है
1,"""यार कि दोस्त खौफनाक है।"" हाहा। ओह केसी! फिर चक अभी भी लंबे समय तक दिखता है कि सारा #CHUCKMEMONDAYS #CHUCK गई"
0,उपयोगकर्ता अच्छा कर रहा है! काम पर थक गया ... न्यूज़ रूम में नहीं रहना चाहते ...
0,उसे बिस्तर पर जाने के लिए।
1,"उपयोगकर्ता को छोड़ दिया गया! LOL को ""अप 3 डी"" GF/ TEST #10 ""देखने के लिए 4 घंटे कहीं न कहीं बनाने की जरूरत है, अगर वह रो नहीं करती है तो वह एक रोबोट है""।"
1,शुभ दिन।  मेरे मम्मी और मेरे भाई के साथ खरीदारी।
1,तैरने और रात बिताने के लिए शेरोन्स के ऊपर जाकर गर्मियों को सही से दूर कर देता है। मान गया?
0,मैं कुछ करना चाहता हूं ... लेकिन सभी की योजना है
0,मेरी कैलकुलस प्रोजेक्ट समाप्त नहीं किया है! ऊ
0,"मेरे पति की दादी, डोरिस को देखने के लिए अस्पताल का नेतृत्व किया। हमें नहीं लगता कि वह इस बार अस्पताल छोड़ देगी।"
1,मेरे चालक दल के बीच उपयोगकर्ता वोट उस कमी के> पत्थरों की कमी है। (मुख्य रूप से इस तथ्य के कारण कि कमी का स्टेक है)
1,"उपयोगकर्ता आप एक मांग अनुयायी नहीं हैं। यह सब घोषित किया गया है, लेकिन आपको जून 2009 को देखने वाले समय को बचाने के लिए।"
0,संशोधन संशोधन संशोधन
0,कोई मुझे सिखाता है कि ट्विटर का उपयोग कैसे करें
0,उपयोगकर्ता शुभकामनाएँ आज @ g m a .... कोई भी मुझे नहीं लेगा मैं तुमसे प्यार करता हूँ !!!!! हम एक ही राज्य में हैं
0,घर पर <3 को कुचलना
1,उपयोगकर्ता आपको पता था
1,चर्च के लिए बारिश ड्राइव के लिए कुछ एला ...
0,उपयोगकर्ता हाँ मुझे यह पसंद नहीं है कि मैं नहीं चाहता कि मैं मरना चाहता हूं
1,"उपयोगकर्ता जो एक भयानक ट्वीट था। अगर मैं एक शर्ट पर एक ट्वीट डालता, तो यह एक होता।"
0,उपयोगकर्ता ने अब अपनी खबर को ट्विटर करना बंद कर दिया है?
0,"उपयोगकर्ता - वास्तव में यह बहुत अच्छा है, मैं इसकी सराहना करता हूं =) मुझे नहीं लगता"
1,"अब, मैं परमोर के ""दुख व्यवसाय"" को सुन रहा हूँ !!!!!! क्या क्लासिक हिट !!"
0,"टिंक? अरे नहीं अभी तक नहीं ... कॉन्सर्ट सिर्फ महान था, हालांकि कुछ और मीठे सपनों की जरूरत है"
0,उपयोगकर्ता? Ñ? Ñ? Ð ° ° ð · ð ° ° ð ñ ñ? Ñ ñ ð ð ° ð ° ð½ðñ ðð ð।
0,एक बीमार बच्ची के साथ व्यवहार करना। वह एक माइग्रेन के दिन 2 पर है।
1,उपयोगकर्ता आह ily2 <3
0,मुझे वेंचर ब्रोस बहुत पसंद हैं।
0,यह मेरे जीवन के सबसे दुखद दिन में से एक है। </3
1,उपयोगकर्ता योग्य - यह एक अच्छी तस्वीर है इसलिए आप सही हो सकते हैं
0,उपयोगकर्ता मैक केवल QuickPWN अभी भी लंबित है ...।
0,ठीक है मैं ट्वीटडेक के साथ चुदाई करता हूं ... अब वापस अपने पेपर पर
1,उपयोगकर्ता उपयोगकर्ता हाँ #wine एक शाम को एक बोतल खोजने के लिए एक शाम को हवा देने का सबसे अच्छा तरीका जीतता है *
1,उपयोगकर्ता मैं आपकी मंजूरी के रूप में ले जाऊंगा।
0,शेवी में रात का खाना था और फिर हवाई अड्डे पर मेरे चचेरे भाई को गिरा दिया। मैं दुखी हूं।
1,आज के जन्मदिन की पार्टी के लिए मज़ा !! इतना उत्तेजित!
0,उपयोगकर्ता मुझे पता है! अब देखने के लिए मेरा दिल तोड़ देता है
0,घर पर दो बीमार बच्चों के साथ उम्मीद है कि वे आज रात अच्छी नींद लेंगे (इसलिए मैं भी सो सकता हूं ;-))
1,उपयोगकर्ता मैं मानता हूं; वह जोनासब्रॉर्स वीडियो लामिश है; लेकिन निक हॉट है (: और गीत अच्छा है!
0,"उपयोगकर्ता dnt knw अगर dey corrct थे, लेकिन acc 2 में नहीं थे, तो यह nd केवल 1 टीम frm 6 मैंने देखा है कि मंचों में पोस्ट डेर वीडियो है।"
0,बहुत यकीन है कि मैं अपने गणित फाइनल में विफल रहा
1,नए अनुयायियों का स्वागत है
0,"उपयोगकर्ता यह केवल अक्षरों, संख्याओं और अंडरस्कोर को स्वीकार करता है।"
0,उपयोगकर्ता ughh मुझे खेद है कि क्या आप चाहते हैं कि मैं मौत के खतरे के ग्रंथों को भेजा? मैं करूँगा...
0,"उपयोगकर्ता आह्ह्ह, मैं वेल्लल के रूप में आनंद लेना चाहता हूं, लेकिन खराब मौसम।"
1,बहुत सारे मजेदार रोमांच से भरे एक शानदार सप्ताहांत के बाद काम करने के लिए।
1,उपयोगकर्ता वाह बहुत बहुत धन्यवाद!
0,मुझे अपनी पैंट नहीं मिल रही है
0,कैसे कर सकते हैं?  #FB
0,"उपयोगकर्ता lmao मैं kno hahaha नहीं था ... वे दिखाते हैं tho तो इसकी wateva ... अच्छा है कि नीट को यकीन के लिए सोया था, लेकिन फिर से नहीं किया"
1,उपयोगकर्ता मुझे लगता है कि यह सेक्सी लग रहा है मैं इसे चाहता हूँ !!
0,आज बहुत दुखी और नीचे महसूस कर रहा है!
0,मैं अपने सबसे अच्छे दोस्त और अपने अच्छे दोस्त के साथ एक स्थानीय ब्रेनवॉशिंग सेंटर में गया था ... मुझे खाना कमबख्त भोजन के लिए एक घंटे के उपदेश के माध्यम से बैठना था!
0,उपयोगकर्ता मैं आपको याद करता हूं और आपको बहुत प्यार करता हूं
0,बस मेरे डेस्क का आदेश दिया ... यह 3 सप्ताह लेने वाला है! आह
0,उपयोगकर्ता क्या आपके पास साइट के अलावा कोई और-स्टोर है? Dm u नहीं कर सकते।
0,CUHS मैं आपसे फोन पर बात करना चाहता हूं .. और इसके अलावा आपको अभी भी एचडब्ल्यू करना है हम आज मुश्किल से बात करते हैं। मैं दुखी हूँ कि तुम्हारा मज़ा आ रहा है और मैं ...
0,"डंब और डम्बर अभी कॉमेडी सेंट्रल पर शुरू हुआ है, लेकिन मुझे स्वीकार करना चाहिए कि मैं भूल गया कि यह वास्तव में कितना बकवास था"
0,मुझे यह नफरत है कि मैं हमेशा इस तरह से क्यों समाप्त होता हूं?
1,आज से एक सप्ताह छोड़ दो! ऊपर और एक दौरा देने के बारे में जा रहा है
0,मैं इतनी जल्दी क्यों हूँ !! - मैं ऊब गया हूँ और पिछले घंटे के लिए मेरे सिर में अटक गया ट्रैंटुला गीत था !!  / www.stalkdaily.com/georg ...
0,प्रेम गीतों को सुनना। मुझे जॉन की याद आती है
1,"सुप्रभात, ट्विटर्स !!! सुप्रभात, सोमवार !!"
1,उपयोगकर्ता किसी भी बिजली की आपूर्ति की समस्या?
0,"बैंगलोर में उपयोगकर्ता दोस्त, गुड़गांव में जीवन कैसा है .... अब मैं ईर्ष्यालु गायब एनसीआर महसूस कर रहा हूं ..."
1,शीर्ष 5 प्लेसमेंट पर उपयोगकर्ता बधाई!  हम आपको वहां रखने या आपको उच्च स्थान पर रहने की कोशिश करेंगे!
1,उपयोगकर्ता हम 5 मिनट में वैम्पायर के साथ बेसबॉल खेलने के लिए मिलते हैं ;-)
1,"छोड़कर, एमी का यहाँ। हालांकि बैक लेटर्स"
1,"उपयोगकर्ता यह एक शानदार दिन रहा है जब मैंने आपके फ्लैशबैक फ्राइडे ब्लॉग, BTW का आनंद लिया। आप बहुत मनोरंजक ब्लॉगर हैं।"
1,मैं भूल गया! सुबह के लोग !!
0,Gizillion समय के लिए एक ही गीत सुनकर !!!  उन्हें नेली कोज़ क्लोन करना चाहिए वह कमाल है!
0,"ऊब मुझे लगता है कि मैं उस स्टीफन डोरफ डीवीडी के बाकी हिस्सों को देखने जा रहा हूं कि मैं शुक्रवार की रात को देखने के माध्यम से आधे रास्ते में सो गया, योग्य"
1,उपयोगकर्ता मैं तुम्हारे साथ गाना चाहता हूँ।
1,उपयोगकर्ता यूप यहां जाएं: URL (पासकोड ब्लॉकड्रीमर) और अभिलेखागार पर क्लिक करें
1,"उपयोगकर्ता कि सिर्फ मेरा दिन बना, धन्यवाद!"
0,घर के लिए 5 घंटे में जागना होगा। मुझे अपने भतीजे पहले से ही याद हैं।
1,"उपयोगकर्ता हाँ यह करता है !!!  कि मुझे एनएम के बारे में सभी उत्साहित हो गए, फिर भी, मैं हैरी पॉटर के लिए उत्सुक हूं !!!"
0,"Im अभी भी जमे हुए मैं दंत चिकित्सक URL के बाद डेविड की तरह महसूस करता हूं ""यह हमेशा के लिए होने वाला है"" योग्य"
1,उपयोगकर्ता आप 1 मिलियन अनुयायियों तक पहुँच गए। याय जॉर्डन !!!!
1,उपयोगकर्ता ऊब? कभी नहीं ... कभी-कभी पूर्व-कब्जे में ... कभी-कभी।  उपयोगकर्ता - मुझे नहीं पता कि वह किस बारे में बात कर रही है :: एंजेलिक मुस्कान ::
0,ooooo; (धक्का देना disies समाप्त हो गया है
0,उपयोगकर्ता हाय टॉम! मुझे याद आती है जब आपने Google अनुवाद में पुर्तगाली बात की थी! मैं तुमसे बहुत प्यार करता हूँ आदमी! कृपया मुझे जवाब दो! मुझे तुम्हारी जरूरत है यार!  XX
1,लड़कियों की रात के लिए मेरी फिल्म किराए पर लेने के लिए।
0,"उपयोगकर्ता 27 मिनट, ईप !!! मुझे वहाँ 7 tho तक वहाँ की अनुमति नहीं है?  नहीं चैट कर सकते हैं?"
0,बिस्तर पर जा रहा है
1,"ओह, मैकडो, मैं तुम्हें याद किया। लेकिन मैंने अपने आप को अपने सामान का इलाज करने का संकल्प लिया है। जैसे, महीने में एक बार या हर दो महीने।"
0,अब प्रोविंसटाउन जा रहे हैं लेकिन मौसम भद्दा है
0,मुझे एक नया फोन चाहिए !!!
0,"विक्स पर पिज्जा, 5000 साल की कुछ छलांग पढ़ना, और फिर ..... काम"
1,"उपयोगकर्ता आप बीके के लिए आ रहे हैं? वाह!! हम आज के पेपर पर प्रेस को रोक देंगे, बस एमडी फ्रंट पीजी न्यूज! बीके वेलकम यू डब्ल्यू/ओपन आर्म्स!"
0,"उपयोगकर्ता OOOH मैं चाहता हूं कि मैं समुद्र तट पर था, आज मैं एक परीक्षण कर रहा हूं इसलिए मैं पढ़ रहा हूं।"
1,"उपयोगकर्ता हे कली, आप जी रेटेड दर्शकों के सदस्यों के लिए आर को वापस जोड़ना चाह सकते हैं"
1,"जब से मैं काम नहीं कर रहा हूं, तब से अपने शनिवार का आनंद ले रहा हूं"
1,"लेकिन जो मुझे जीवित रख रहा है वह ईश्वर है, मैं उसके बिना अपने जीवन की कल्पना नहीं कर सकता।"
0,मैं और मेरा बड़ा मुँह!
