1,एक विल फोर्ड चेगौ ईएम कासा प्रीकिसवा पूरा करने वाला मिन्हा कोलो को कुतिया!
1,"उपयोगकर्ता यदि यू आपके टीवी पर वेरिज़ोन फियोस है, तो यू उर टीवी पर एपिसोड से पहले कभी नहीं देख सकते हैं"
1,#110 भी उपयोगकर्ता द्वारा हल किया गया
0,उपयोगकर्ता बीजेपी के बारे में अपनी अंतिम पोस्ट देखें।
1,उपयोगकर्ता lol हाँ हाँ कोई समस्या नहीं है .. चिल्लाओ के लिए धन्यवाद
0,उपयोगकर्ता मुझे चॉकलेट कवर स्ट्रॉबेरी यू कुतिया चाहिए !! यू आयोजित तब तक जब तक मैं यू पिघला हुआ अंधेरा नहीं था u urghhhhhhhh !!!!!!  मुझे तुम्हारी याद आती है!!
1,मैं स्पंज मार्टिन स्क्वायरपैंट लोल
0,उपयोगकर्ता lol मैं नहीं कर सकते हैं किसी भी twangs
1,oooooohhhh! ज़िग्गी मार्ले आज सुबह स्टूडियो में हैं। मुझे लगता है कि मैं आज अपना कैम लाया
0,"उपयोगकर्ता जो हास्यास्पद है! मेरे मम्मी के साथ भी वे हमें सूखा ब्लीडिन! यदि आप 11k छूट प्राप्त कर रहे हैं, तो अपने पिताजी को मुझे किराए पर लेने के लिए कहें! srsly।"
1,Hilprado मुझे आशा है कि शब्द के लिए एक फिल्म होगी
1,"हर लिंडसे को कुछ 1 लगता है कि यह कौन है ... पूरी बात ""हाय"" के साथ शुरू हुई"
1,उपयोगकर्ता एक योजना की तरह लगता है जिसे आप अच्छा महसूस कर रहे हैं?
0,मेँ घर पर हूँ!!! अब मुझे अनपैक करना है।
1,हरित दिवस
1,"उपयोगकर्ता मोल्सकाइन सबसे अच्छा है। इसके अलावा, वे आपको एक गहरे विचारक की तरह दिखते हैं जब लोग आपको उनका उपयोग करते हुए देखते हैं।"
1,सारा और पागल लोलोल के साथ। क्रेजी एडवेंचर ने कल और फिर बीबीक्यू की योजना बनाई! इतना उत्तेजित
0,उपयोगकर्ता या कि मैं डिब्बाबंद हो सकता है!
0,"उपयोगकर्ता न केवल पिज्जा ... हाथ से बने आटा, धीमी पकी हुई चटनी, सभी ताजा सामग्री। बच्चों को डोमिनोज के रूप में अच्छा नहीं कहेंगे"
0,मैं अभी भी बहुत बीमार हूँ
0,उपयोगकर्ता मुझे साफ करो!
1,उपयोगकर्ता मेरा भी !!
1,... लेकिन मुझे एक मेंढक चूमने की उम्मीद नहीं है।
0,उपयोगकर्ता क्यों ??
0,मुझे रसभरी बहुत पसंद है। मैं उन्हें दिन के सभी भोजन के लिए खा सकता था। मुझे एक रास्पबेरी झाड़ी होने की याद आती है।
1,अब मैं गोरिल्लाज़ गुड सॉन्ग द्वारा फील गुड इंक।
0,उपयोगकर्ता मैं बहुत उत्साहित हूँ !!! काश मेरे पास एक पालतू था ...
1,उपयोगकर्ता सुप्रभात!
0,"उपयोगकर्ता योग्य ""केप माइल्ड ट्रेपिडेशन"" सबसे अच्छा है। क्षमा करें, आप आर्क से चूक गए!  यह वास्तव में बहुत अच्छा है।"
1,उपयोगकर्ता ऊह बैकयार्ड में खरीदारी से प्यार करते हैं
1,"उपयोगकर्ता, आपको बस यह पता लगाने की आवश्यकता है कि इसे कैसे रहस्यमय बनाया जाए कि हम सभी आपके ग्लैमरस गुप्त जीवन के बारे में उत्सुक हैं।"
0,नहीं! मेरे पास एक पुराना मेनू है और उनके पास पहले से ही वह शराब नहीं थी जिसे मैं कोशिश करना चाहता था
0,Im शिट के मौसम के कारण शिविर नोमोर्स के लिए उत्साहित नहीं है। और Mossimo एक मिड सीज़न सीज़न OMFGGGG है।
1,6 एक्स ग्रीरॉक मार्लबोरो सेव ब्लैंक
1,नए अनुयायियों ने मेरे बाद 4 thx 4!  ily। मैं माँ को फिर से 2mrorow की मदद करूँगा। आज बहुत बढ़िया रहा है। गणित की परीक्षा के बारे में नहीं सोच रहे हैं !!
1,"उपयोगकर्ता हैप्पी एनिवर्सरी 2 यू, हैप्पी एनिवर्सरी 2 यू, हैप्पी एनिवर्सरी यू टू, हैप्पी एनिवर्सरी टू यू! क्षमा करें, मैं थोड़ा दूर था"
0,"खैर, मेरा पीसी SFIV नहीं चला सकता।"
0,हर कोई कहाँ है?
0,कल इस कक्षा का इंतजार नहीं कर रहा है
0,"उपयोगकर्ता ओह यह सुंदर है! मुझे नहीं पता था कि रोने वाले मिमोस थे। मेरे यार्ड में एक ""चॉकलेट"" था, लेकिन यह अच्छी तरह से सर्दियों में नहीं था"
1,उपयोगकर्ता मुझे साइन लैंग्वेज पता है
0,"उपयोगकर्ता शायद मैं सिर्फ picky हूँ, लेकिन यह भीड़ लगती है! मैं निकटतम पार्क से 20 मिनट बस की सवारी हूँ !!  हम हम कभी खुश नहीं हैं"
1,उपयोगकर्ता IIII को पता है कि मैं बहुत उत्साहित हूं
0,तो ... मेरा डिनर सुपर स्वादिष्ट था।  हालांकि पिक्स नहीं लिया।
1,"उपयोगकर्ता अहहा ठीक है, मैं ऐसा करूँगा"
1,"रात की ट्विप्स। अच्छा दिन, बहुत कुछ किया"
1,उपयोगकर्ता? ?????
1,ऊब। (: फेसबुक पर एक क्विज़ बनाया! इसे ले लो!
1,"उपयोगकर्ता के पास एक अच्छी दिन लड़की है, मैं आपको बाद में फोन करूँगा"
1,बचे हुए बफ़ेलो चिकन पिज्जा को फिर से बनाना। यह खाने के बाद मेरी सांस अविस्मरणीय होगी
0,उपयोगकर्ता lmaaooo उन सस्ते गधे जूते !!
1,दिन के लिए अंतिम वर्ग!
0,मेरी कार टूट गई है
0,जाहिरा तौर पर नोवेल मूनलाइट भी मेरे जौनी पर काम नहीं करता है
1,उपयोगकर्ता हाय जेसी! आप कैसे हैं? अर्जेंटीना से चुंबन !!
1,"उपयोगकर्ता सुप्रभात, धूप।"
1,मेरा इनबॉक्स आज अच्छाई से भरा है - उपयोगकर्ता को नए अनुयायियों का भार और IE6/बिंग कहानी के लिए TechCrunch से एक ट्रैकबैक भी
0,उपयोगकर्ता ओह नहीं!
1,उपयोगकर्ता हाय वहाँ veeple!  हम एक छोटे से आला में हैं इसलिए हम बहुत सारे विचारों की उम्मीद नहीं करते हैं। ऊ क्या है?
0,उपयोगकर्ता आप अस्पताल में क्यों जागेंगे?
0,बस उसे जाने देना है .....
1,फोटो हो गया। ग्राफिक्स के लिए रवाना। लंबा। लंबे दिन की नीट।
0,"क्या मेरे कमरे, बाथरूम, रसोई और कंप्यूटर को फिर से बूट कर रहा है मुझे लगता है कि मैं सुपर मारियो को पकड़ कर रखूंगा ..."
1,उपयोगकर्ता haha ​​मैंने सूप के लिए पानी को प्रीहीट किया था
1,Oshyn का पंद्रह URL डाउनलोड करें
0,कल रात महान नौकरी हर एक मैं अगले साल आप सभी को याद करने जा रहा हूं
0,उपयोगकर्ता को पैर के बारे में क्षमा करें।  मुझे उम्मीद है कि यह जल्द ही बेहतर हो जाएगा।
0,लेकिन यह दुर्घटनाग्रस्त हो जाता है
0,वास्तव में काम पर नहीं जाना चाहते हैं क्या मैं घर पर बस थोड़ी देर के लिए चूतड़ नहीं कर सकता?
1,उपयोगकर्ता मुझे विश्वास नहीं हो रहा है कि मैं इसे देखने के लिए इतने लंबे समय तक इंतजार कर रहा था।  यह बहुत अच्छा था।  वो नहीं जो मैं उम्मीद कर रहा था।  Tupac अभी भी मेरी गुफा है।  ज़ोर-ज़ोर से हंसना
1,बहुत खूब!  आज मेरा जन्मदिन हे!!! Yippee !!! उन सभी लोगों के लिए धन्यवाद जो आज मुझे शुभकामनाएं ...
1,अरे ट्वीटर गुड नाइट और गॉड ब्लेस यू यूजर यूजर यू यू सो सो वेल इन उर न्यू रूम हैंडसम ;-)
1,उपयोगकर्ता अंतिम प्रश्न। जीसीजी ट्रिपल एल पर एक ऑपरेशन की योजना बना रहा है?
0,खुशी है कि क्रोनिक स्पिटर्स और क्रोनिक होनर्स की भूमि में रह रहे हैं!
0,पवित्र बकवास मेरा सिर धड़क रहा है! यह कहाँ से आया? कोई लूट नहीं मिला 4 moi 2nite..left 4 Club N Cant भी CTREN C CANT
1,उपयोगकर्ता oooohoh कि मेरे द्वारा लगभग फिसल गया .... ओह पांच सितारे उसके लिए!
1,उपयोगकर्ता यह बहुत तीव्र है! रोज ने कहा कि यह शायद आराम कर रहा है जबकि इसके पंख सूखते हैं।
0,जरूरत 2 जानें 4 मंगलवार .... वित्त नहीं चाहते हैं .. लेकिन भी है !!!!!
1,"हैप्पी सोमवार, Twitterverse !! सूरज बादलों के माध्यम से टूट गया और मेरे कार्यालय की खिड़की में मेरे लिए चमक रहा है। मुझे तुम पसंद हो।"
0,कोई मेरी कार में बड़ा समय टूट गया = वास्तव में बुरा दिन हो गया
1,उपयोगकर्ता आपका स्वागत है फिर से
0,रॉक एन रोल क्लास का कोई और इतिहास नहीं है।
0,"उपयोगकर्ता हैलो मूल्डर हम आपको याद करते हैं) अच्छी तरह से स्कोर उस शानदार नहीं हैं .. आखिरकार बीबी के लिए कोई नुकसान नहीं है, लेकिन लाल सितारे खो गए हैं"
0,शुक्रवार की रात के लड़कों के पास अपनी नई सीडी पर केवल एक गिटार एकल है।
0,उपयोगकर्ता गर्मियों के बारे में एक बुरी बात यह है कि इस गर्मी के लिए गुरुवार को किसी भी बड़ी योजना का कार्यालय कोई नया नहीं है?
0,पाली इतनी धीमी है अब मैं मुश्किल से एक घंटे के भीतर एक सेट बना सकता हूं
0,"Soooo ने फिर से मेरी कसरत को नकार दिया - इस बार मेरे पास पांडा से एक मंदारिन चिकन/चाउ मीन बाउल था, और S'mores आइसक्रीम ... faaat"
1,उपयोगकर्ता अच्छा विषय। चलो आशा है कि बहुत अधिक बिक्री होगी
0,कोई हमारे गेमिंग समूह से बाहर हो गया। तेह चूसना।
1,"स्लाइडशेयर पर कुछ अच्छी प्रस्तुतियाँ, जब आप प्रकाशित करते हैं, तो कृपया URL को ट्वीट करें ताकि हम सभी इसे realtime #Barcamphanoi उठा सकें"
0,उपयोगकर्ता मैं अन्य आवेदकों के साथ एक पूल में हूँ
0,मैं कल रात बहुत भारी सोया था। सुबह सब। मौसम ने बदतर के लिए एक मोड़ लिया है .. इस सप्ताह पहली बार बारिश
0,"एटी एंड टी और सेब के बीच 3 घंटे उछलते हुए ... दोनों दुनिया के सबसे विनम्र लोगों को किराए पर लेते हैं ... ऑर्डर पर 3 जीएस, लेकिन मेरे लिए कोई लॉन्च डे मज़ा नहीं"
1,इसमें हन्नाह और एलीईईईईई चेरिल एन कोल के साथ बहुत मज़ेदार है!
1,"उपयोगकर्ता मैं क्या कह सकता हूं, जब आप एक अच्छे मूड में होते हैं, तो आप अच्छे मूड में होते हैं ..."
1,"यह निश्चित रूप से स्कूप नहीं है, लेकिन ठीक है!  नया फोन, आह्ह इसे सेट करने के लिए जा रहा है, <3"
1,हमें फॉलो करने और हमारी साइट पर जाने के लिए twilighters धन्यवाद। क्या किसी और को लगा कि रॉब के नए एब्स स्टीमी गर्म थे?
0,"यदि इसमें पहिए हैं, तो परेशानी होगी।  एक और सपाट टायर।"
1,"इसलिए मैं लगभग 8 बजे सो गया। woops। आधी रात को जाग गया, फिर 5 पर। और यहाँ मैं हूँ। उज्ज्वल आंखें और झाड़ीदार पूंछ"
1,उपयोगकर्ता ईयू ते एमो हर समय।
0,ग्रीन डे इतना पुराना लग रहा है
1,उन लोगों के लिए ट्रैक: मी: 1 चक: 0
1,URL - किसी को भी इस चेहरे से प्यार कैसे नहीं हो सकता है?
1,उपयोगकर्ता हैप्पी बी-डे कर्टनी को उम्मीद है कि यह एक शानदार एक योग्य है ..... कनाडा से ग्रीटिंग्स
1,"अभी जाग रहा है। अपने प्रेमी, किट के साथ एक फिल्म और गेंदबाजी के लिए डायरसबर्ग जाना"
1,गुलाब चॉकलेट एक्स खाने के आसपास लजीज का आनंद ले रहे हैं
0,"उपयोगकर्ता आप मॉर्गिंग स्लिपर पहन सकते हैं, या एक गर्म स्नान या शॉवर ले सकते हैं, तो आप मेरी कृमि प्राप्त कर सकते हैं। क्या आप अपने घर में ऐसा कर सकते हैं?"
0,काम पर कम से कम अच्छे संगीत पर काम करता है
0,मेरी प्रतिरक्षा प्रणाली आखिरकार मर गई है
1,"3man, लड़कियों, दो ओहियो लड़के, डोम, एमी, द ओशन ... समान परेशानी कर सकते थे।"
0,हे भगवान! केवल एक और स्कूल-मुक्त दिन है
0,उघ। यह तूफान बहुत जोर से कमबख्त है।
1,घर पर एक सप्ताह और मैं एक पूरे नए व्यक्ति की तरह महसूस करता हूं ... अभी भी घर का घर!
0,OMG ट्विटर मुझे अपने किसी भी अच्छे पिक्स का उपयोग नहीं करने देगा !!
0,मेरे तकिए को गले लगाना ... gdnite
1,स्टारबक्स से उपयोगकर्ता? मेरे पास एक समय था जब यह अच्छा था
1,मेरी टीशर्ट रेंज के लिए डिजाइनिंग में व्यस्त है ... आशा है कि यह बहुत अच्छा काम करता है
0,"Im चीजों पर एक सकारात्मक स्पिन लगाने की कोशिश करने के लिए ... अगले 48 घंटों में से 26 काम कर रहे हैं .... बकवास, बकवास, लानत, ..... लानत है मैंने कोशिश की।"
1,"उपयोगकर्ता शायद आप अपने एमएम को पहले कर सकते हैं और इसे अपने पीबी के शेमह की तुलना में बाद में प्रकाशित कर सकते हैं, कभी -कभी मैं यही करता हूं।"
1,उपयोगकर्ता तो आप सभी को मज़े के लिए क्या करते हैं?
0,कभी -कभी लोग बदल जाते हैं और यह आपके साथ बहुत अच्छी तरह से नहीं बैठता है
1,"यह सुनिश्चित नहीं है कि संतुलन अभी तक सही है, लेकिन 1 नींबू, 1/2 नारंगी, चीनी, टॉनिक पानी और बर्फ का रस। एक धूप के दिन ताज़ा करना।"
1,हाय नफरत ... जो बात कर रहे हैं मेरे एलेम स्कूल की तस्वीर chellelilbmoreuser मैं आपकी नई तस्वीर प्यार करता हूँ आप तब भी सुंदर थे और अभी भी है
0,"इन पॉप अप्स के साथ क्या है, आवाज के साथ और आप इसे नहीं पा सकते हैं? अजीब"
1,"उपयोगकर्ता URL - किसी कारण के लिए बहुत चीकू, मैं ""वाइल्ड"" देखना चाहता हूं: -डी"
1,उपयोगकर्ता वे साथ खेलने के लिए बहुत मजेदार हैं!
1,"इलेक्ट्रिक कंबल, शहर में 4WDs के रूप में इको फ्रेंडली के रूप में"
1,घर पर वापस लात मारना
0,"उपयोगकर्ता मैंने इसे या तो नहीं देखा, लेकिन लगता है कि यह एक महान विचार है! चीजें लूप और सामान पर तेजी से और उग्र हो रही हैं"
1,"रविवार मुबारक हो,"
0,मुझे याद है कि 12 घंटे सीधे सोने में सक्षम हैं
1,एक ही शहर में im शब्दों के लिए एक नुकसान woop woop है
0,बाथ टुनाइट गन्ना में अंतिम रात को सुनिश्चित करें कि यह एक अच्छा है!
1,"उपयोगकर्ता yup, yup! और वह बहुत आकर्षक है।"
1,उपयोगकर्ता विडंबना यह है कि मैं काम पर हर दिन इसका उपयोग करता हूं
0,ठीक है। आधिकारिक तौर पर जा रहा है। 30 मिनट में टैक्सी मुझे हवाई अड्डे पर ले जाने के लिए आ रही है। दुखी। उन्होंने मुझे टेक्स्ट नहीं किया <iwillalwaysloveu>
1,"उपयोगकर्ता लेकिन सांपों की मृत इसलिए वे एक और गेम बाउट नहीं कर सकते हैं =/ प्लस, रैडेन इन दिनों बहुत कूलर है"
0,यहां कोई ग्रीन डे टूर नहीं है।  यह मजेदार होगा हालांकि URL
