0,जल्दी उठना है।  यूआरएल
1,बस जोनास ब्रदर्स 3 डी कॉन्सर्ट अनुभव देखा; अद्भुत! सर्वश्रेष्ठ फिल्म मैंने उम्र में देखी है!
0,"उपयोगकर्ता नहीं, ब्लैकबेरी। मैं 6 महीने के लिए अपग्रेड के लिए अर्हता प्राप्त नहीं करता"
0,अगर आप मुझसे पूछें: मुझे वास्तव में अंग्रेजी पसंद है। लेकिन मैं इस पर चूसना कर सकता हूँ आप कृपया मेरी मदद कर सकते हैं xD
0,"उपयोगकर्ता रे: ""सबसे बड़ी पीढ़ी"" - उनके पास उस युद्ध में एक नैतिक प्रमाणित था, क्योंकि बहुत से लोग कमी हैं"
1,"उपयोगकर्ता उपयोगकर्ता के पास था कि दूसरे सप्ताह जीनियस पर, उसे उस पर शुरू न करें!"
1,URL - खौफनाक ... लेकिन कुछ आराध्य
0,वास्तव में फ़ायरफ़ॉक्स छोड़ने पर विचार करना। लेकिन मैंने अपने सभी बुकमार्क को Google टूलबार के साथ संग्रहीत किया।
0,"उपयोगकर्ता पर दक्षिण अमेरिका के लिए 40,000 मील पुरस्कार यात्राओं के लिए 24 मई की समय सीमा के बारे में भूलने के लिए वास्तव में अपने आप को पागल कर दिया"
1,"अपने लैपटॉप को अंदर ठंडा करने के लिए छोड़कर (सूरज से पहले इसे पिघला देता है) और अब एक आई-डॉग और रीडिंग लाइफ, द यूनिवर्स और एवरीथिंग के माध्यम से धुनों को नष्ट करना"
1,Url अगर नया चंद्रमा ऐसा होगा तो मैं हार गया। जाओ और देखो।
0,पैकेज के लिए इंतजार किया गया जो नहीं आया और अब मौसम मुझे लगता है कि कल जल्दी सवारी बेकार है। पकाने का समय ...
1,यह आसान है ... बादाम मक्खन और केले के साथ टोस्ट। मम्म
0,"कॉन्सर्ट अद्भुत था;), लेकिन मैंने उसे पूरी तरह से उसके साथ उड़ा दिया"
1,उपयोगकर्ता हाँ कृपया। तुम्हे करना चाहिए
1,"उपयोगकर्ता oooo, शब्दों के लिए बहुत स्वादिष्ट"
1,उपयोगकर्ता अरे जो अच्छा लग रहा है!
1,"आह। मेरे पास $ 100 की जरूरत है $ 35 को सड़क के दृश्य में पहुंचने के लिए, फिर मैं आखिरकार लड़की को बात कर सकता हूं।"
0,"उपयोगकर्ता मैं चाहता हूं कि उसके चाइनाटाउन चमकदार पेंसिल AUS में थे, हालांकि उन्हें आज़माने के लिए इंतजार नहीं कर सकता!"
0,उन लोगों को ट्विटर की व्याख्या करने की कोशिश कर रहा है जो मुश्किल से इंटरनेट का उपयोग करते हैं। यह पता नहीं लगा सकते कि इसे उनकी शर्तों में कैसे समझा जाए।
1,फोटो: उच्च URL
1,$ 5 थ्रेडलेस टिल अगले सोमवार! टी-शर्ट खरीदने का समय
0,उपयोगकर्ता Meeeee भी।
0,उपयोगकर्ता मुझे ईर्ष्या है। अभी भी प्रशांत क्षेत्र में यहां अध्ययन कर रहा है।
0,"OCW के लिए बहुत थक गया, लेकिन शायद वैसे भी जाओ।"
0,"आह-हा ... नाडा लेकिन मैंने बी-फास्ट के लिए एक बैग में एक आमलेट बनाया, इसलिए अच्छा खाया ~ इसलिए कोई चिंता नहीं, मैं दूर नहीं होगा!"
0,उपयोगकर्ता दोनों ...
0,"यह आज लंदन में एक निराशाजनक दिन है, मेरे जूते और शीतकालीन कोट पर वापस कि पिछले सप्ताह हमारी गर्मी थी?"
0,"मैं बर्न नोटिस के सीज़न प्रीमियर से चूक गया, मैं पहले सो गया था"
0,उपयोगकर्ता मुझे अपने उपयोगकर्ता की भी याद आती है!
1,उपयोगकर्ता उपयोगकर्ता आप सभी से नफरत करता है
0,"कानून के बहुत सारे, बहुत कम समझ में"
0,"उपयोगकर्ता haha ​​अच्छा, मेरे पास आज पहले एक पाने के लिए मेरे बैग में कोई जगह नहीं थी"
0,पूरी तरह से उदास है कि मैं अपने कैमरों को grrrrrr काम करने के लिए नहीं मिल सकता है
1,उपयोगकर्ता क्या आप इसे मेरे साथ साझा करने के लिए पर्याप्त होंगे? बस ऐप डाउनलोड किया
0,"खैर, यह लगभग 11 बजे है और अभी भी कोई मार्विन नहीं है। यह तब है, अगर वह मर नहीं गया है तो मुझे नहीं लगता कि वह बाहर एक रात जीवित रह सकता है"
0,इसप्लेयर की मृत्यु हो गई है! क्षमा मांगना
0,"Ive को फ्लू मिला और मुझे शादी की कारों को देखने जाना है, मैं वास्तव में परेशान नहीं हो सकता, भयानक महसूस कर रहा हूं"
0,मुझे लगता है कि मेरे पास 5 मिनट की बात है जब तक कि मुझे बेटों को धोने में बीबी सामान नहीं मिला। नमस्ते!! lol मुझे ट्विटरिंग याद आती है
0,कंप्यूटर से उतरने के बारे में !!  कोई फोन नहीं तो कोई पाठ की जरूरत नहीं है
0,उपयोगकर्ता गह! गरीब चिबी! मेरा दंत चिकित्सक शुद्ध बुराई है! वह कभी नहीं है और सहायक हमेशा अपने हुक चीजों के साथ मेरे मसूड़ों को छुरा मारते हैं
0,विश्वास नहीं कर सकता कि वरिष्ठ लोग छोड़ रहे हैं मैं आप लोगों को याद करूंगा
0,उपयोगकर्ता मेरे बुरे! उन्होंने मुझसे कंप्यूटर छीन लिया
0,"उह वे पड़ोस में सभी भव्य पेड़ों को काट रहे हैं, क्यों ??  (यह भी सुबह 8 बजे AAAGH पर)"
0,मेरे छेद एक 12g तक नीचे हैं। मुझे अपने गॉजी की याद आती है।
0,"उपयोगकर्ता मैं शर्त लगाता हूँ! मैं ईर्ष्या कर रहा हूँ। काश मैं अभी आप लोगों के साथ बाहर घूम रहा होता।  क्या चल रहा है? मुझे अब विवरण चाहिए, कृपया।"
1,बच्चों का बच्चा सम्भाल रहा है
0,"पैरामोर और लगभग लेआउट समाप्त कर दिया। बिस्तर के लिए समय, मेरी आँखें मुझसे नफरत करती हैं। कल का दिन।"
0,आपकी हमेशा याद आती है
0,उपयोगकर्ता अरे कम से कम आपको अपनी माताओं के दिन कार्ड याद है।  मैंने अपने घर पर अपना छोड़ दिया।  लेकिन मुझे मेरी माँ चीज़केक मिल गईं ताकि हाह के बराबर हो
0,"बस नेट्टी से घर गया .. हम हार गए, फिर से ... !!"
1,क्रैंक 2 देखने के लिए रवाना
0,मेरी छोटी कार की कल स्मैश रिपेयर शॉप में डेट है
1,उपयोगकर्ता याय! यह हो चुका है। इसलिए मुझे अपना fav हिस्सा सुनने को मिलता है। अधिक और फिर से!
0,"गर्मियों के बारे में एक चीज जो मुझे नफरत है वह है मधुमक्खियों। आप उन्हें अपने चारों ओर उड़ते हुए सुन सकते हैं लेकिन जब आप देखते हैं, तो उन्हें कहीं भी नहीं देख सकते। उघ।"
0,अरे नहीं डोरा को रात भर रहना है। वह बहुत डरी हुई है
0,उपयोगकर्ता अनुलग्नक नहीं खेल सकता है
1,थाश और जैकब विल्सन कल डिकेंस में URL
1,उपयोगकर्ता मैंने जब चाहें टीवी पर पूर्वावलोकन को फिर से शुरू करने के लिए पुरस्कार शो को सहेजा है! क्या टिकट कृपया पहले से ही बिक्री पर जा सकते हैं?
0,उपयोगकर्ता मैं तुम्हें राजकुमारी याद आती है!
0,एक महीने के लिए पैकिंग कठिन है .. मुझे अब तक इसका इस्तेमाल किया जाना चाहिए?
0,बस वास्तव में एक बहुत उबाऊ दिन
1,"दो लोगों से बात करते हुए, जो सबसे बड़ी किक सिर्फ एक -दूसरे को हंसाने में है, ऑडियो/विजुअल क्रैक की तरह है।  #KPCS"
0,"मेट्रो स्टेशन एटीएम को सुनने वाले उपयोगकर्ता ... जेम्स ब्लंट को जल्द ही सुन सकते हैं ... मेरे प्रेमी को अलविदा कहें, दुखद"
1,अपार्टमेंट में जाने के लिए तैयार हो रहा है
0,"उपयोगकर्ता क्या आपको आखिरकार आज आराम करने के लिए मिलता है, या आप कुछ और काम कर रहे हैं?"
1,"इस ट्विटर चीज़ के लिए नया Im, इसलिए यदि कोई भी चंचलता मुझे बताती है कि इसका उपयोग कैसे करना है तो यह महान xxx होगा (यदि आप यह कर सकते हैं: s)"
0,काम मुझे खराश करता है
1,उपयोगकर्ता हैलो डार्लिंग
1,"उपयोगकर्ता ट्विटरबेरी - अब आप आधिकारिक तौर पर एक ट्विटर एडिक्ट हैं - लोल! पिक्स साझा करने के लिए धन्यवाद, वे महान हैं"
1,उपयोगकर्ता हाहा। मैं अपने #1 से प्यार करता हूँ।  मैं बस कोशिश कर रहा था उसे पेशाब कर दिया। ज़ोर-ज़ोर से हंसना
0,एक दुर्भाग्यपूर्ण और बेतुका जिद्दी माइग्रेन से उबरना
1,ट्रैशमेन द्वारा सर्फिंग बर्ड पर कभी थोड़ा जुनूनी हो गया है क्योंकि हर कोई जानता है कि पक्षी शब्द है
0,उपयोगकर्ता का स्वागत है! मैं हालांकि यहाँ से बाहर होने जा रहा हूँ ...
1,मेरे पसंदीदा शो को देखकर ... OC!
0,उपयोगकर्ता lol मैं आज रात घर जा रहा हूँ बुधवार के बाद से यह सिर्फ एक छोटी व्यावसायिक बात थी इसलिए मज़े के लिए ज्यादा समय नहीं था
0,उपयोगकर्ता मैं वास्तव में वास्तव में चाहता हूं कि आप मुझे #MP2 कोड दें Mr.Josh Olin कृपया हताश है
1,उपयोगकर्ता यह एक परिवार के दिन का एक सा अनुमान लगा रहा है
0,मुझे 7 घंटे से कम समय में जागना है .... यह मेरे एप्ट में हेड्स के रूप में गर्म है
1,मैं थॉर्नटन से अपने 44oz फव्वारे के पेय के बारे में परेशान नहीं हूं
0,यह सिर्फ एक ही नहीं है।
1,उपयोगकर्ता प्रमुख वास्तविकताएं?  इस तथ्य के रूप में कि आप हमारे पहले आधिकारिक घर के अतिथि बनने जा रहे हैं?
0,उपयोगकर्ता ओह नहीं! गैर-इष्टतम अभी भी बहुत रोमांचक है!
0,"बैंकॉक में टीवी पर रैंडम एर एपिसोड। नए के साथ पुराने की तुलना करना .... नया वास्तव में बकवास था! यार, उन्होंने साजिश खो दी! कितनी शर्म की बात है ..."
0,नहीं यू लोग! उपयोगकर्ता ने पेरेज़ हिल्टन को एक गुस्से में ट्वीट में कैलिफोर्निया कहा! जोनाथन इतना परेशान था कि उसने कैलिफोर्निया को गलत बताया
0,लेविन बाल्टीमोर!  फिली से एक लिल बिट दूर
1,जिम में ... मेरी वर्कआउट को प्राप्त करें
1,उपयोगकर्ता शेड्यूल मुरानो ग्लास फैक्ट्री टूर से पहले आप उतारते हैं।  तो आप सभी कम महंगे इतालवी ग्लास से पहले ब्राउज़ कर चुके होंगे
1,वू !! खोई हुई भूमि! यह बहुत बढ़िया था!
0,उपयोगकर्ता cuz मैंने ऐसा कहा
1,उपयोगकर्ता एक दिन ... मैं एक मुफ्त प्रति की भी उम्मीद कर रहा हूँ
1,"उपयोगकर्ता योग्य, हाँ, मैं मजाकिया होने के लिए सामान्यीकरण कर रहा हूं।  तो मैं अमीश होने पर चूसना। या एक ""शेकर"" जैसा कि येहुदा मून कहते हैं। यूआरएल"
0,उपयोगकर्ता अच्छी तरह से शांत नहीं है। आपका ट्वीट मुझे गुमराह करता है
1,उपयोगकर्ता इसे प्यार करता हूँ
0,उपयोगकर्ता 7/10 को शायद यह कोशिश करनी चाहिए जब मैं सिर्फ जागता नहीं था।
0,"उपयोगकर्ता ooohhh यम! लेकिन नहीं, वे करते हैं कि नाय ने उन्हें यहाँ और न ही lucozade किया है! इस देश में हैंगओवर होने का कोई मतलब नहीं है!"
1,Im बस इच्छा है कि एलेक्स सो जाएगा तो मैं मम्मी समय और आराम कर सकता हूं
1,मैं परिवार का स्कारलेट लेटर/व्हाइट भेड़ हूं ... यह अद्भुत है!  किसी और को मेरी स्थिति चाहिए? आपके पास वह एक हो सकता है!
0,फोन वर्तमान में काम नहीं कर रहा है। मुझे अभी तक बिल का भुगतान करने का मौका नहीं मिला है। मैं एक व्यस्त भौंरा ee रहा हूँ!
1,उपयोगकर्ता बहुत अच्छा होगा यदि आप इसे नीचे देख सकते हैं जो आप मुझे देखेंगे। लेकिन एक कार वेलोड्रोम के चारों ओर सभी तरह से प्राप्त कर सकती है
0,आह यह बहुत लंबी सड़क है
0,सुखद बरसात का दिन है
1,फिल्म जैक को देखकर इस फिल्म को बहुत पसंद है।
0,"उपयोगकर्ता सैन फ्रांसिस्को के लिए गया था, लेकिन मुझे पूरा यकीन है कि मैंने जो एकमात्र समुद्री शेर देखा था वह एक समुद्री दुनिया में था"
1,"उपयोगकर्ता अच्छी तरह से, वह अब 14 है, इसलिए यह एक दीर्घकालिक योजना है।"
0,"मैं एक जैकेट पहन रहा हूं ... जून में बाइबल अध्ययन के लिए शीर्षक, अभी भी बारिश हो रही है"
1,ट्रैफिक नीलामी में 1.4 मिल के लिए AD.com की कंपनी (Directi) ने Ad.com खरीदा। ऑनलाइन विज्ञापन उद्योग में मंदी के लिए बहुत कुछ
1,मेरे नए लॉन फर्नीचर का आनंद ले रहा है
0,कैलिफोर्निया के कला संस्थान में फाइनल के लिए अध्ययन ... जब आप सफल हो सकते हैं तो किसे नींद की जरूरत है? .... <-a>
1,ईश्वर!! मुझे कोई खूनी विचार नहीं है कि मैं क्या कर रहा हूं लेकिन मुझे यह पसंद है
0,उपयोगकर्ता मुझे ऑन-डिमांड पसंद है मैं हाल ही में इराक से 15 दिनों के लिए घर आया था। मुझे जीएच के 2009 के एपिसोड देखने को मिला। अब वापस इराक में
0,दंत चिकित्सक की प्रतीक्षा में। बेहद घबराया हुआ है और यह आज केवल XRAYS है।
0,उपयोगकर्ता
0,Aww ... बस मेरे होमब्रेव्स के आखिरी को समाप्त कर दिया।  अगले कुछ हफ्तों के लिए स्टोर पर बीयर खरीदें।
0,उपयोगकर्ता मैं बाहर हूँ। 11: 30-4: 30 से शिलो में सभी हाथ हैं
0,मुझे लगता है कि एस्प्रेसो के 4 शॉट्स ने आखिरकार मुझे मारा है .... और मेरे शरीर के लिए बुरी चीजें की हैं!
1,फिनिशिंग स्कूल तब कुछ दोस्तों को देखने जा रहा है
0,"बिक्री के लिए मेरी कार की तस्वीरें, Starbucks और गोना जा रहे हैं .. अकेले सभी क्योंकि हर कोई 9-5 है"
1,टेक्स मर्फी श्रृंखला गोग के पास आती है ... ऐसा लगता है कि यह एक अच्छा मौका है जो एक हत्या के चंद्रमा के नीचे अंत में खत्म करने का एक अच्छा मौका है।
1,इसके 8:00 बजे यहाँ रात का खाना समाप्त हो गया..तो कुछ शुरुआती Zzzzz को पकड़ो। उम्मीद है कि कल बेहतर और मजेदार होगा?! शुभ रात्रि  ;)
0,ड्रेस पाने के लिए बाउट
0,उपयोगकर्ता मैं अभी जाग गया मैंने 3 घंटे की झपकी ली।
0,बहुत खूब। पूरी तरह से सिर्फ एक पैट्रियट्स टोपी का एक आवेग खरीद। ऑनलाइन शॉपिंग मेरी आसन्न कैलिफोर्निया यात्रा की मौत होगी।
0,मैं बहा रहा हूँ!
1,"मेरी लड़की को देख रही है, रविवार के लिए एक शानदार फिल्म क्या है"
1,Booyah! मेरा मैक बर्मिंघम में वापस आ गया है। मुझे मंगलवार को वापस लाना है मेरा प्रिंटर और मेरी बेड शीट है
1,उपयोगकर्ता वूट!    क्या आप टैनिंग कर रहे हैं और एक निश्चित छुट्टी के लिए तैयार हो रहे हैं?
