1,"उपयोगकर्ता <30 अनुयायियों और ट्वीट के साथ ट्विटर पर ""सोशल मीडिया गुरु"" बहुत सारे हैं।  क्या उस तरह का आहार प्रोग के समान नहीं है?"
1,उपयोगकर्ता अपने एक adoroable लड़की नहीं कर सकते हैं जब तक बैठा!
1,आज चर्च में महान दिन।
0,"ठीक है, मुझे पता है कि हबिस भूखा है, लेकिन मैं इतना गर्म महसूस नहीं कर रहा हूँ! लगता है कि उसे अपने लिए टोनाइट के लिए फेंट करना पड़ सकता है ..... उसे बहुत खुश नहीं होगा मुझे यकीन है कि"
0,कुछ व्यायाम के लिए समय (या पर्याप्त बंद)। मेरा अच्छा DDR पैड कहाँ है? किसी ने इसे स्थानांतरित कर दिया
1,कार और उसके चमकदार को धोया है
1,"आज सुबह, सहयोग क्षमता-बिल्डर के रूप में उपयोगकर्ता पर एक URL लेख का मसौदा तैयार करने का आनंद-> मुझे अपनी नौकरी से प्यार है"
1,क्ले पर उपयोगकर्ता कम नहीं!  मुझे नहीं पता था कि फेड ने अभी भी उस में था
1,"मैं वैंकूवर से बाहर घूमने के लिए रवाना हूं, जबकि मेरा बेहतर आधा काम करता है।  मैं इसे सबसे अच्छा बनाऊंगा।"
1,उपयोगकर्ता मैं तुमसे प्यार करता हूँ टेलर
1,उपयोगकर्ता वास्तव में?  यस
0,गहरी नींद की बात करें। इसके खत्म होने के लिए। 2 काम!
1,"उपयोगकर्ता ठीक है। तुम कहते हो तो। मैंने इसे बहुत अधिक चक्कर नहीं दिया है, लेकिन यह Google की तुलना में तेज लगता है"
0,* स्क्रीम* रविवार को गणित की परीक्षा
1,उपयोगकर्ता अपने जूते की तरह।   आप उन्हें कहां से प्राप्त करेंगे?
0,आज पता चला कि हमारे हेजहोग को कैंसर है।  बहुत दुख की बात है! उसके पास केवल कुछ महीने बचे हैं।
0,"उपयोगकर्ता, AHHHHHHH 21 जुलाई के लिए उत्साहित है (: ecxept बेवकूफ ऑस्ट्रेलिया इसे decembberrrrrrrrrrrrrrrrrrrrrrrrrrrrrrrrrrrrrrrrrrrrrrrrrrrrrrrrrrrrrrrrrrrrrrrrrrrrrrrrrrrrrrrrrrrrrrrrrrrrrrrrrrrrrrrrrrrrrrrrrr"
1,"उपयोगकर्ता यही कारण है कि वे कहते हैं कि हमेशा आपके पुराने तकनीकी खिलौनों पर पकड़ रखें, भले ही यह विस्फोट करने की धमकी देता हो!"
0,यहाँ ओला/गड़गड़ाहट तूफान। बिजली तब चलती रहती है। यह बेकार है।
1,क्यू सेरा सेरा - गाना से प्यार करता हूँ ... किसी दिन पियानो पर खेलना चाहते हैं? यूआरएल
1,"उपयोगकर्ता AW !!! अरे हाँ!! मैं अपनी बहन से इसके बारे में बात करूँगा! क्या आप ठीक हैं, BTW? कल रात क्या हुआ, टिकट?"
0,ट्रे देखना .. एक दांत दर्द मिला
1,बस मेरी दादी में होने से। कॉलेज में आज एक और गौरव मिला (इसे जादू नहीं कर सकता)
1,उपयोगकर्ता mhmmm twas प्यारा!
0,बस जॉगिंग से वापस आया; मुझे वर्क-आउट पार्टनर की जरूरत है। मुझे बहुत अकेला लगा
0,"उपयोगकर्ता Awww * गले * जब मैं मेलबर्न जाता हूं, तो मैं यात्रा करने का वादा करता हूं और वास्तव में दिखाता हूं।"
1,"मेरी पत्नी और मैंने देखा, नई पिक्सर फिल्म, आज।  यह सभी उम्र के बच्चों के लिए मजेदार है!"
1,उपयोगकर्ता याय ट्विटर्स एक टैड शांत
1,बस डैड को ऐस हार्डवेयर स्टोर में अपने पिता दिवस का उपहार मिला।
1,मेघन बस रुक गया मैं उसे याद किया ।।
1,उपयोगकर्ता और मणि के साथ बगीचे में धूप उछालना जल्द ही यह एक भयानक सप्ताहांत है
0,इसे बर्दाश्त नहीं कर सकते ... मेरी माँ और भाई .... वे एक दूसरे पर चिल्ला रहे हैं ..
0,उपयोगकर्ता और उपयोगकर्ता मैं सिर्फ आरएसवीपी आप लोगों को पार्टी के लिए कहा था आपने कहा कि आप इस शनिवार की रात मेरे साथ जाएंगे। एक झूठा मुझे बाहर मत करो
0,अब उदास
1,उपयोगकर्ता महान विचार। मैंने अभी कुछ क्रेडिट खरीदे हैं!
1,उपयोगकर्ता बहुत सच है! उन्हें इसका सम्मान करना है!
0,"उपयोगकर्ता सयांग, सॉरी पल्सा एसिया एन im3 अकु अबिस"
0,उत्तर की प्रतीक्षा में..मैं 1 दिन की प्रतीक्षा करता है और वह इसका जवाब नहीं देता है
0,उस कुल शरीर से मेरे पैर और ऊपरी शरीर कड़े और गले में खराश है। मुझे एक रगड़ की जरूरत है।
1,मुझे एक एसएमएस मिला है!
0,मुझे सभी दोस्तों की याद आती है।  यूआरएल
1,। सिर्फ सेक्सी
0,"ठीक है, यह एक घंटे पहले धूप अबू था। सूर्य, plz वापस आ गया?"
0,खुशी है कि ली कुआन यू डोंस टी लिम किट सियांग URL उपयोगकर्ता उपयोगकर्ता उपयोगकर्ता उपयोगकर्ता उपयोगकर्ता उपयोगकर्ता उपयोगकर्ता उपयोगकर्ता उपयोगकर्ता उपयोगकर्ता उपयोगकर्ता उपयोगकर्ता उपयोगकर्ता उपयोगकर्ता उपयोगकर्ता उपयोगकर्ता उपयोगकर्ता उपयोगकर्ता उपयोगकर्ता उपयोगकर्ता उपयोगकर्ता उपयोगकर्ता उपयोगकर्ता उपयोगकर्ता उपयोगकर्ता उपयोगकर्ता उपयोगकर्ता उपयोगकर्ता उपयोगकर्ता उपयोगकर्ता उपयोगकर्ता उपयोगकर्ता उपयोगकर्ता उपयोगकर्ता उपयोगकर्ता उपयोगकर्ता उपयोगकर्ता उपयोगकर्ता उपयोगकर्ता उपयोगकर्ता उपयोगकर्ता उपयोगकर्ता उपयोगकर्ता उपयोगकर्ता उपयोगकर्ता उपयोगकर्ता उपयोगकर्ता उपयोगकर्ता उपयोगकर्ता उपयोगकर्ता उपयोगकर्ता उपयोगकर्ता
0,"उपयोगकर्ता के पास शनिवार रात एक scentsy पार्टी है, इसके बारे में। और कुछ नहीं"
1,उपयोगकर्ता अभी भी 2 बचा है! बस एक चोक बार मिला और साथ ही धन्यवाद दोस्त!
1,उपयोगकर्ता आपको फोटो जज करने के लिए एक फोटोग्राफर होने की ज़रूरत नहीं है! यदि आपकी बात जानने वाली चौकोर फसल के बारे में बात की गई थी
1,उपयोगकर्ता lolz अपने टैटू की जाँच करें
1,"ठीक है, मेरे पास एक नई पृष्ठभूमि की तस्वीर है - यह बहुत अधिक है। ओह और यहाँ आप उपयोगकर्ता url मीठे सपने जाते हैं"
1,उपयोगकर्ता last.fm में विंडोज और मैक दोनों के लिए देशी रेडियो क्लाइंट हैं। आपको अमरोक की जरूरत नहीं है।
0,मुझे आज अपने चेहरे पर मुस्कान लाने के लिए SUM1 की आवश्यकता है
0,(उपयोगकर्ता) मालिक कल आउट्टा राज्य छोड़ रहे हैं।  मेरे बिना। मैं उन्हें याद करने जा रहा हूँ !!! मुझे गले से लगा लो!
0,उपयोगकर्ता इसे लानत है। मैंने आपकी प्रोफ़ाइल पर देखा कि आपने पाउला नामक किसी को जवाब दिया और एक मिनट के लिए मुझे लगा कि यह मुझे ओह है ..... एक्स।
1,उपयोगकर्ता ?????! ?? ????? ? ????? ? ??? ????
1,उपयोगकर्ता nope ... लेकिन यह उसके लिए खेला गया था!
0,उपयोगकर्ता मुझे बहुत खेद है प्यार।  प्रैग्नेंसी क्या है?
1,"हां, यह आधिकारिक है: आज रात आलसी पिज्जा रात है। पैसे को सो जाओ, यह पेपरोनी के लिए एक रात है और मेरे पैरों को ऊपर रख रहा है"
1,उपयोगकर्ता याय! तो खुशी है कि आप आ रहे हैं!
0,"यकीन नहीं होता कि मैं 7HR, नॉन-स्टॉप ट्रेन यात्रा के साथ कैसे सामना करने जा रहा हूं। वर्षों से एक ट्रेन में नहीं है। एक लैपटॉप नहीं है!   किताबें यह है।"
1,पहला ट्वीट। चिरप ...... चिरप
1,omg hahaha मुझे वास्तव में नींद की जरूरत है !! यह मुझे गिड़गिड़ा रहा है
0,"बुरा नहीं धन्यवाद, नफरत रविवार को यह सप्ताहांत उपयोगकर्ता के अंत का संकेत देता है"
1,मैं एक कोलाब चैनल शुरू कर रहा हूं। यह यादृच्छिक रूप से 5 या रैंडमैक्स 5 कहा जा रहा है मैंने अभी तक फैसला नहीं किया है
0,"मैंने आपको एक ट्वीट बनाया, लेकिन ट्विटर ने इसे खाया"
1,कल (रविवार) एक जब्ती मुक्त वर्ष
1,मेरा दिन बस एक बहुत उज्जवल हो गया
0,"उपयोगकर्ता ने अपना फ़ोन नंबर बदल दिया, या आप मुझे अनदेखा कर रहे हैं?"
0,मैं कल भी नहीं जाना चाहता। मैं उसे बहुत याद करने जा रहा हूं।
0,"Jamison हमेशा एक प्रकाश छोड़ देता है ""यदि आपको बाथरूम के लिए उठने की जरूरत है"" उह धन्यवाद पिताजी। उनकी नई जगह अच्छी है। कोई हाय टोपी नहीं"
0,"उपयोगकर्ता खौफ, उपयोगकर्ता ने मुझे इस बारे में बताया, लेकिन मैं इसे आज रात नहीं बना सका, हमें वास्तव में कुछ समय के लिए बाहर घूमने की जरूरत है! XOXO"
1,उपयोगी विज्ञान अंतिम में! उपयोगकर्ता हा हा मुझे पता था कि यह सच था - आदमी फ्लू मौजूद है - url
0,उपयोगकर्ता जो मुझे पागल बनाता है। मुझे डाउनग्रेड करना पड़ सकता है।
1,उपयोगकर्ता आप मजाकिया हैं! मुझे इसकी आदत डालने में थोड़ा समय लगा।
1,मैं अपने क्षेत्र में बाहर खड़ा हूँ ~ फसल स्काउटिंग आज
0,उपयोगकर्ता आप कहाँ हैं?!?!?
0,पवित्र गाय! नडाल फ्रेंच ओपन में खो गया
0,मेरे माता -पिता को अलविदा नहीं कहना चाहता।
1,"उपयोगकर्ता क्षमा करें, आप अच्छी तरह से महसूस नहीं करते हैं .. अब सोने के लिए और सोचना बंद कर दें..क्या बुरा यह आसान नहीं है? एंबियन मेरे लिए काम करता है"
0,पीड़ादायक। मेरे जन्मदिन और मेरे लड़के के बारे में सोचकर <3 सो।
0,"उपयोगकर्ता मैं आज कार्यालय के काम के साथ दलदली हूँ, अब अपने सभी प्रशासनिक कर्तव्यों को पकड़ने के लिए सप्ताहांत का उपयोग कर रहा हूँ, इसे नहीं बना सका"
0,"पिछले हफ्ते 2 घंटे के लिए रोज काम किया, अच्छा खाया। इस सप्ताह? पूर्ण विपरीत उरघ"
0,उपयोगकर्ता आपने कल मुझसे बात नहीं की थी ... और यह मुझे दुखी करता है
0,"उपयोगकर्ता awwwww, मिस्टर ग्रेप जो मुझे दुखी करता है, लेकिन मुझे खुशी है कि आप समझ रहे हैं कि क्या गलत है <3"
1,मेरे लोग मुझे `` bartâ of the the the creation quests questions '' कहते हैं। मैं अनुमान लगा रहा हूं कि यह अच्छी बात है।  #zeropoint.it
1,उपयोगकर्ता एक ही सामान्य क्षेत्र ... आप कैसे हैं?
0,"मेरी कार एक सब्जी है जो वास्तव में उदास है। और जो लोग दूसरे लोगों के गम को चबाते हैं, वे ग्रो हो जाते हैं।"
1,मैं peggle मास्टर हूँ! खेल ने ऐसा कहा
1,उपयोगकर्ता उपयोगकर्ता अनुवर्ती सुझावों के लिए धन्यवाद
0,टोरंटो के लिए कार्गो रेड जी 5 के आगमन को कल दोपहर को स्थगित कर दिया गया है।  गोना मेरे लिल ब्रो के दिन की याद आती है ... वह 4 मुझे इंतजार कर रहा है!
1,2hrs के बाद ग्लासगो हवाई अड्डे में। सुपर विनम्र सुरक्षा और एक greggs द बेकर्स ब्रेप ब्रैप। संभवतः दुनिया का सबसे अच्छा हवाई अड्डा
1,दिन के दोस्तों का अंतिम ट्वीट।  आपने आस - पास देखो।   शुभ रात्रि।
0,उपयोगकर्ता वहाँ एक पर नहीं है। सुनिश्चित करने के लिए।
0,"उपयोगकर्ता मुझे टेनिस भी पसंद है, लेकिन मैं वास्तव में इसका पालन नहीं करता। अपने खिलाड़ी को खोने के बारे में क्षमा करें।"
1,मैंने आज लेक्चर 11 पर शुरुआत करने का प्रबंधन किया ... और नट-विरोधी और समर्थक प्रसवोत्तर नीतियों को भी। अब ब्लॉग जाना होगा। बहुत कुछ कहने के लिए
1,"उपयोगकर्ता इसके एक मू कार्ड ""केसी स्वीकृत"""
0,"मजेदार एक वावा में एक सलाद है जो 104.5 सुन रहा है और मैं फिली में नहीं हूं, वे अच्छे दिन थे ..."
0,उपयोगकर्ता बहुत मज़ा नहीं लगता है कि क्या वे आपके मेड को बढ़ा सकते हैं? आशा है कि आप कम से कम जल्द ही घर जाने के लिए मिलेंगे!
0,सुबह 3:00 सुबह। सो नहीं सकते।
0,"उपयोगकर्ता वे मज़ेदार हो सकते हैं, लेकिन मेरे शेड्यूल के साथ यह मेरे लिए उनके खेलों को देखने के लिए काफी कठिन है। बस एक और चूक गया।"
1,उपयोगकर्ता इसे प्यार करता हूँ!
1,यह सोचकर कि मैं कल के लिए कैसे अजीब हो सकता हूं ..: एस .. मैं बस अपने सामान्य स्व काम करेगा
0,"उपयोगकर्ता मुझे अभी तक नहीं पता है, लेकिन यूरोप में फिल्में लगभग एक महीने बाद अमेरिका की तुलना में दिखाई देती हैं (यूके के अलावा, मुझे लगता है)"
1,हाँ पाऊ !! मुझे खुशी है कि मैंने आज रात आपकी शर्ट पहनी थी
1,#FollowFriday उपयोगकर्ता उपयोगकर्ता उपयोगकर्ता उपयोगकर्ता उपयोगकर्ता उपयोगकर्ता उपयोगकर्ता उपयोगकर्ता उपयोगकर्ता उपयोगकर्ता उपयोगकर्ताओं ने संचार किया है
0,उपयोगकर्ता मुझे आशा है कि आपको शेष वर्ष के लिए घर नहीं रहना होगा !!! आप कैसे हैं?!?!?!
1,उपयोगकर्ता मैं कैसे रखूँ? बहुत ही अपूर्ण रूप से और बहुत सारी आत्म-स्वीकृति के साथ। पूर्णता अप्राप्य।
0,क्या किसी के पास अपनी हरी अंग्रेजी पुस्तक है? इसके बिना एक Mi2 निबंध को फिर से लिखना कठिन है
1,उपयोगकर्ता ने किया। धन्यवाद
0,Im बोरिंग मैं वास्तव में नहीं समझता कि इसका उपयोग कैसे करें
1,बस स्पा से आया था
0,मेरी बीमारी खराब हो गई! मैं बहुत बुरा लगता है!!!
0,अशर - हाँ यू वहाँ eeeeeeeeee नहीं था
1,"उपयोगकर्ता वाह, यह कितना दुर्लभ है, आपको ट्विटर का उपयोग करने के लिए !! XD LOL हैंगओवर शानदार था !!"
0,अब उपयोगकर्ता यदि केवल हम यूएस विंडोज उपयोगकर्ताओं के लिए विशेष रूप से कुछ विशेष रूप से प्राप्त कर सकते हैं।
0,मैं सिर्फ द सिम्पसंस का सबसे खराब हेलोवीन एपिसोड देखता था!
0,बेवकूफ सुबह 7 बजे
0,घर जाना चाहता है और मेरे कमरे में पीछे हटना चाहता है
0,"हाँ, बाद में 5 बियर के बाद पूरी तरह से नशे में और ummmm ... कूल बैंड! मैं = हल्का। बड़े पैमाने पर ट्वीट्स के लिए खेद है कि सभी #ladytron"
0,"कुछ घंटों में घर वापस उड़ान भरना, इसे केवल इसलिए फैला रहा है क्योंकि मेरे कान ऊंचाई नहीं कर सकते"
0,"OMG कल रात मैं सो नहीं सका, क्योंकि एक बुरा सपना"
0,"उपयोगकर्ता 1 किट-केट पर्याप्त नहीं है। मुझे चिंता को कम करने के लिए मुझे कम से कम 10 की आवश्यकता है, मुझे परीक्षा से नफरत है।"
1,"ठीक है, दोस्तों, यह मेरे लिए बिस्तर पर जाने का समय है।  शुभ रात्रि।  वापस आना बहुत अच्छा रहा है।"
1,"सुबह -सुबह पूप। ड्रमगोग किया, ऑटोट्यून 32percent"
