0,और मुझे अपने वीजा के लिए लॉस एंजिल्स के माध्यम से क्यों जाना है? मैं दक्षिण के बाकी हिस्सों में क्यों नहीं जा सकता और शिकागो से गुजर सकता हूं? वे जल्दी हैं।
1,उपयोगकर्ता मेरे लिए लिसा क्रोन को हाय कहते हैं!
0,Blah हमारे पास midterms और फाइनल क्यों है?  यह वास्तव में कठिन है।
0,उपयोगकर्ता हाय! आपको अधिक बार अपडेट करना चाहिए।
0,"डीजे ईयू शिखर सम्मेलन: ईयू बैक प्लान लातविया एड मनी - ड्राफ्ट, आईटी केए? iedos naudu, bet jä गैस nekä? दास"
1,उपयोगकर्ता हे ब्री! YouTube पर आप के बारे में हर पल ive बहुत मज़ेदार है! मेरा fav वेस्टलाइफ हाहा के साथ lollypop है !!
1,अभिनय कक्षाओं में जा रहे हैं आशा है कि हर कोई एक महान दिन है!
1,"उपयोगकर्ता मुझे गोधूलि की किताबें बहुत पसंद हैं .. इसलिए न्यू मून मूवी के बारे में बहुत उत्साहित हैं, खिचड़ी भाषा!"
1,समुद्री ऊदबिलाव को आकर्षित करना आसान है क्योंकि वे छोटे चेहरों के साथ फर के विशाल गांठ हैं
0,उपयोगकर्ता मैं चाहता हूं कि मैं कर सकता था लेकिन यह मूल रूप से मेरे लिए असंभव है
1,आज उन दिनों में से एक है जहां मैं सोच रहा हूं: OMG! मेरी व्यावसायिक योजना वास्तव में हो रही है! LOA फिर से हमला करता है।
0,मुझे सबकी याद आ रही है
1,"ट्विटर पर यह मेरी पहली बार है, लेकिन कोई भी ऐसा करता है ... अच्छी तरह से जाने देता है"
1,उपयोगकर्ता हाँ मैं हूँ !!  मेरा एक नया अंतिम नाम है। मेरे तलाक को अंतिम रूप देने के बाद मैंने अपनी माताओं का नाम लिया। आप कैसे हैं? मैंने माइस्पेस को हटा दिया
0,वजन कम करना ... एक अच्छे तरीके से नहीं ...
0,बहुत अधिक गर्म सॉस डालें। मैं अपने चिपचिपे चावल को खत्म नहीं कर सकता
0,बहुत सारे प्यार उपयोगकर्ता के रास्ते भेजना। प्रियजनों को खोना कठिन है ...
0,कुछ लोगों को विशेष घोषणा की आवश्यकता है ... बहुत बुरा
0,"यह दबाव नहीं है, लेकिन जिम्मेदारी की भावना मुझे रोती है कि मैं मेरे बजाय उर भावनाओं के बारे में परवाह करता हूं। और इस बार मैं क्या कह सकता हूं ..."
1,उपयोगकर्ता मैं शर्त लगाता हूँ! मेरे साथ अभी तक ऐसा नहीं हुआ है
1,उपयोगकर्ता मैं ग्लोब का उपयोग करता हूं।
1,"उपयोगकर्ता हमें पता चल जाएगा कि क्या हम कभी भी घर आने की योजना बना रहे हैं, मुझे अपने परिवार की याद आती है"
0,कितना दुखी ... मैं टीन च्वाइस अवार्ड्स के लिए वोट करने के लिए अयोग्य हूं क्योंकि मैं बहुत बूढ़ा बू हूं!
1,दोपहर के भोजन के लिए ऐलिस से मिलना और हन्ना मोंटाना फिल्म बाद में!
1,"उपयोगकर्ता आह, गोच! यह इतना अधिक समझ में आता है कि मैं हाहा के साथ आ रहा था। स्पष्टीकरण के लिए धन्यवाद #squarespace"
1,उपयोगकर्ता URL - मुझे लगा
1,डेक पर गर्म पूर्वी ब्लॉक डीजे और मार्टिनी रेंच में अन्य टेबल
1,मेरे नए उत्पाद समीक्षा ब्लॉग पोस्ट लोगों को देखें
0,मेरे पेट में दर्द होता है!!!
1,उपयोगकर्ता वाह ... यह डरावना है ... उसे डरावना चेहरा बनाने के लिए कहें
0,"जैसा कि हम आगे बढ़ते हैं, हमें याद है, हर बार हम एक साथ थे .... मैं आपको याद करने वाला हूं मिशेल !!!"
1,अदालत के साथ समुद्र तट पर एक महान समय था!
1,"उपयोगकर्ता क्यों अपनी कहानी को 140 ch तक सीमित करें। सभी को बताएं कि आपको www.iamsoannoyed.com पर क्या परेशान कर रहा है, यह आपके तनाव को दूर करने में मदद करेगा"
1,MMM योगर्टलैंड और पूर्वावलोकन
1,चचेरे भाई और भाई-प्रतिद्वंद्वी के साथ डांस फ्लिक देखा! मिडनाइट सन पढ़ रहा था मैं आप लोगों को याद करूँगा विशेष रूप से आप itzel! और सूसी और डेविड <3
1,अब उपयोगकर्ता .. कुछ नहीं!  क्या आप आज जूनिना पार्टी अहाह के पास जा रहे हैं ??
1,"बिस्तर पर, मेरे पिता के व्यवसाय के बारे में जल्दी होने के लिए!"
0,पाठ योजना के साथ हर रविवार को बर्बाद होने के बाद तंग आ गया है
0,उपयोगकर्ता क्षमा करें आपको जाने के लिए नहीं मिला। जब मैं शिकागो में रहता था तो मैं एक कॉन्सर्ट में नहीं जा पा रहा था।
1,उपयोगकर्ता हम आपका समर्थन करेंगे
1,"अंत में रिवरसाइड में है और उसकी भविष्यवाणी (1:35 बजे) लगभग हाजिर थी - यहां 1:34 बजे, ओह और ई 3 टीएमआरडब्ल्यू"
1,उपयोगकर्ता हाँ मैंने देखा। सौभाग्य से मेरे पास वास्तव में अपने कैमरे का उपयोग करने का समय नहीं है। इसलिए मैंने अभी तक किसी भी पारिस्थितिक तंत्र को नुकसान नहीं पहुंचाया है
1,"एक पक्षी पिंजरे की सफाई करते समय बच्चों को कभी भी अकेला न छोड़ें, यह एक महान समय है।  यूआरएल"
0,उपयोगकर्ता मुझे पता है !!
0,"उपयोगकर्ता ने उसका ट्वीट देखा?  पाउला और ""उनके तलाक के बारे में और वे w/ उनके 8 बच्चे क्या करेंगे""।  हा।  और"
0,मैं गर्व करने के लिए नहीं आ सकता था wkd ओह अच्छी तरह से कम से कम मैं यहाँ & #bpd पर y'all से चैट कर सकता हूं। आपके पास बहुत बढ़िया समय लग रहा है 4WD CIN PICS
1,आज मेरी पुरानी सीस स्नातक देखने के लिए इंतजार नहीं कर सकता !!!
1,Y'all मेरे लड़के उपयोगकर्ता का अनुसरण करें। क्यों?? Cuz वह खेल में पिघला हुआ है और हम एक साथ इतिहास बनाने जा रहे हैं ... हमें देखो!
1,उपयोगकर्ता कोई रास्ता नहीं!  क्या वह हमारे साथ पेरिस के लिए साइकिल चलाना चाहती है ???
1,"क्या एक भव्य दिन..ब्लू आसमान, धूप, पूर्ण पेट और एक नए सहयोगी के साथ मेरे कॉन्वो का अच्छी तरह से आनंद लिया।"
0,एटीएम ने कल रात मेरा कार्ड लिया।  अच्छी बात यह है कि मेरे पास एक और खाता है जिसका मैं उपयोग कर सकता हूं।
1,"मेरा मतलब है कि। वैसे भी, मुझे लगता है कि अगले 3 महीनों के लिए दोहराने जा रहा है।"
0,स्टीन मार्ट बुराई है ... उनके पास लकी ब्रांड जींस में मेरा आकार नहीं है ...।
0,URL मार्गरेट माउंटफोर्ड अपरेंटिस छोड़ने के लिए - AW!
1,"उपयोगकर्ता hahahaha हाँ, मैंने देखा है कि एक .. मैं बहुत मुश्किल लोल soo मजाकिया हँसा .."
0,उपयोगकर्ता lmao क्यों नहीं
0,"उपयोगकर्ता यह एक महान लानत है। लानत टोस्टर ने जहाज को उड़ा दिया, हालांकि।"
0,"XD ने eBay पर सज्जनों के गठबंधन cosplay पाया, हालांकि 80 $"
0,उपयोगकर्ता मैं अभी चला गया !! लेकिन लाइनअप लंबा है और मेरी 12 लोल पर एक बैठक है
0,"उपयोगकर्ता मेरी पूर्व पत्नी सिर में f'd थी, यह एक तुलना नहीं है। मुझे उम्मीद है कि उसे खुद को प्रस्तुत करने में मदद करने का एक तरीका होगा। यह कठिन लगता है"
1,उपयोगकर्ता मैं अभी छंटनी की।  मैं जल्द ही तस्वीरें पोस्ट करूँगा
0,इसलिए मैंने अपने वेलो वैन रबर के हिस्से को शार्पी में लिखे सामान को प्राप्त करने के लिए सब कुछ करने की कोशिश की है और यह केवल थोड़ा लंगड़ा है।
1,"उपयोगकर्ता योग्य चीयर्स, यह सब सही दिखने में थोड़ा समय लगा"
1,URL - उपयोगकर्ता हे निक
1,सैन फ्रांसिस्को में! 2 दिन के भयानक शहर
0,उपयोगकर्ता I ने गेंद के लिए कई बार गोता लगाया। 50% को बचाने के लिए और बाकी को बचाने के लिए सीमा से बाहर जाना
0,निराश
1,"उपयोगकर्ता हाल ही में, ऐसा लगता है कि सभी के बारे में बात कर रहा है"
1,"उपयोगकर्ता चीयर्स, आज भी मतदान के साथ मेरा कर्तव्य था"
0,"उपयोगकर्ता जाजजजा उफ़, क्षमा करें"
0,जब वे कल छोड़ते हैं तो टीम को याद करने जा रहा है
0,मेरे सामान को पैक करने और घर जाना शुरू करने का समय।
0,उपयोगकर्ता मुझे पता है कि तुम सिर्फ मेरे लिए lyin हो 'मुझे मैजिक सिटी ले जाओ ... हम जानते हैं कि आप वहाँ B4 हो गए हैं! मुझे नौकरी के लिए आवेदन करने की आवश्यकता है
1,"अपराध के अंधेरे दृश्य में पुलिस का दृश्य, चाक लाइन, टकीला शॉट्स। <<<< अगर मैं बहुत ज्यादा करता हूं तो मैंने डैमड की बात सुनी। गैड लानत है"
0,बस मेरी कार बर्बाद हो गई
0,खराब। तीसरा मामला
1,"उपयोगकर्ता - मैं सिल्वरस्टोन के लिए अपने रास्ते पर हूं, लेकिन यूरोप के सुन्नियर भाग में कुछ दिनों के लिए थोड़ी छुट्टी का आनंद ले रहा हूं"
0,उपयोगकर्ता आपके मित्र भी प्लास्टिक हैं
0,"उपयोगकर्ता हाँ डेव ... मैं अलार्म को 7.30 - 8am पर सेट करता रहता हूं, लेकिन इसे इतना निराशाजनक रूप से बंद करता रहता हूं!"
0,"उपयोगकर्ता अरे मेरा पासवर्ड काम नहीं कर रहा है और पासवर्ड भूल गया मुझे पहचान नहीं है कि क्या आप मुझे रीसेट कर सकते हैं? ""McAnnon"" (URL"
0,"हेयर कट = आपदा वास्तव में नहीं, लेकिन मुझे अभी भी यह पसंद नहीं है"
0,रविवार शुभ हो।  सप्ताह का मेरा पसंदीदा दिन।  हालांकि मुझे कपड़े धोने और किराने की दुकान करनी है
1,"कुछ चीजें हैं जो मैं कभी नहीं बेचता हूँ..जब अगर इसकी मृत तकनीक अगर यह एक उपहार था? नहीं, कभी नहीं। ग्रीनमिनी आइपॉड <3"
1,मॉर्निंग ट्विट हेड्स .... आज सुबह मैं मोपेड लेन पर हंस रहा हूं
1,जर्सी के लिए मेरे रास्ते पर
1,"हर किसी को व्हाट्स अप .... अरे, अगर मेरे किसी भी दोस्त ने इसे बाद में एमएसएन पर जाना या मुझे ट्विटर पर देखें"
1,"मैं पहले से माफी मांगता हूं, मैं आज रात बहुत ट्वीट कर सकता हूं। हाहा"
0,"उपयोगकर्ता मुझे उचित पूर्वावलोकन के लिए आमंत्रित नहीं किया गया था।  पड्रेस में जा रहे हैं। चिंता मत करो, मैं सुनिश्चित करूँगा कि यह एक नशे में उत्सव है!"
1,बहुत अच्छी तरह से करने वाले उपयोगकर्ता बहुत बहुत धन्यवाद - पीसी के पीछे बहुत समय बिताना लेकिन एक फोकस और दृढ़ संकल्प के साथ
0,उपयोगकर्ता आह! आपको ब्लिंक टिकट मिला? मैं प्री-सेल टिकट प्राप्त करने जा रहा था। लेकिन मैं टोरंटो से वापस उड़ रहा था जब वे बिक्री पर थे
0,"Freaking Apple सर्वर pwned हो रहे हैं, इसलिए खुशी है"
0,मेरी बेवकूफ वर्दी में बदलना
1,उपयोगकर्ता thanx xo
0,उपयोगकर्ता मुझे साफ करो!
1,"उपयोगकर्ता TEDXSHANGHAI के सभी वीडियो Tudou.com पर एक आधिकारिक चैनल पर उपलब्ध होंगे, जिसमें घटना के बाद उपशीर्षक शामिल है।  #tedxsh"
1,काम के लिए तैयार होने जा रहे हैं। मेरी धुनों को सुनकर।
0,"ठीक है, मैंने लगभग सब कुछ किया। बस जिम नहीं गया, हाहाहा। दोस्तों, मेरे पास बताने के लिए कुछ भी दिलचस्प नहीं है"
1,"- हम सिर्फ रेंट द म्यूजिकल देखने से घर गए और पति ने तुरंत रेंट डीवीडी में डाल दिया।  हाहा, उपयोगकर्ता हमें यह पसंद आया!"
0,संयुक्त राज्य अमेरिका के दूसरी तरफ मेरे बेस्टफ्रेंड्स और ... मुझे उसकी याद आती है
1,"उपयोगकर्ता हाँ, 2 ब्लॉक नीचे 2 सर्कल और सी 4 खुद को चलें, वे क्या कर रहे हैं। गंदगी अब किसी भी मिनट में हमारे ड्राइववे में होगी"
0,थका हुआ है ... आंग डेमिंग ल्यूसिड! हिंदी ko maayos ung फाइलें agad ... url
1,उपयोगकर्ता मुझे पता है कि।  मुझे पता था कि आप पूरे संग्रह को प्राप्त करने के लिए झलक रहे थे।  आपके लिए WW शिकागो की यात्रा के कितने दिन हैं?
1,उपयोगकर्ता क्या समय है कि हमारे लिए चूने के लिए
1,उपयोगकर्ता कल रात का शो बिल्कुल अद्भुत था। तो खुशी है कि मैं गया। मेरी शनिवार की रात को यादगार बनाने के लिए धन्यवाद!
1,उपयोगकर्ता हाँ और मेरे ब्रैकेट किट्टी लोल im दा पहले हेड यू पता है कि क्या प्रभारी ... मेव लोल
0,"उपयोगकर्ता क्षमा करें, मैंने ट्विटर की जाँच नहीं की। लेकिन आप लोगों को टाम्पा वापस आने की जरूरत है। जब आप एक या दो साल पहले खेलते थे, तो मैंने आपका शो याद किया"
1,मैं सिर्फ एक जिम में काम करने के लिए अपने कुछ दोस्तों का इंतजार कर रहा हूं
1,हैप्पी 4/20 !!! जिम्मेदारी से मेरे साथी दोस्तों का जश्न मनाएं
0,"Lainey गंभीरता से मुझे बहुत ईर्ष्या करता है, मैं अभी भी MTV मूवी पुरस्कार देखना चाहता हूं .."
1,उपयोगकर्ता बिल्कुल
0,मेरी ताजा याद आ रही है
0,उपयोगकर्ता मैं वास्तव में एक प्राप्त करना चाहता हूँ
0,एक फिल्म के साथ बिस्तर में हॉटचॉक का आनंद ले रहे हैं जबकि हवा बाहर हो रही है और एक मात्र 9 सेल्सियस को अस्थायी कर रही है!
1,उपयोगकर्ता आपका स्वागत है।
0,मैं बहुत निराश हूं कि रात का खाना सिर्फ मैं ही निकला और क्रोधी यहाँ खाने के लिए यहाँ नहीं होगा।  व्यर्थ में मेरे सभी ग्रिलिंग।
0,"भरी हुई नाक, खुजली नाक और गले, झोंकदार आँखें .. लानत एलर्जी!  उघ। उम्मीद है कि आज डॉक्टरों के पास जा रहा है।"
1,"उपयोगकर्ता आप बहुत बुद्धिमान हैं। बेशक एक छोटे से प्रशिक्षण से हमारे पास मिस्ट्री स्कूल भी मदद मिलेगी, लेकिन हर कोई ""इंस्टेंट"" शीश चाहता है!"
1,उपयोगकर्ता मैं एक फिल्म देख रहा हूँ यह मुझे 911 व्यक्ति अभी तक lol lol j/k करता है
0,बस उसके बाल और उसके बारिश हो रही है
1,नई उल्लू ट्यूब लेने के लिए पारिवारिक यात्रा। कितना रोमांचक है
0,उपयोगकर्ता देखो मैं वास्तव में नहीं जानता कि क्या करना है ... !!!  मैं अपने पूरे जीवन में प्रिंसटन में रहा
0,उपयोगकर्ता शायद! इसे प्यार करना! लेकिन पता चला कि यह मेनू पर सबसे खराब चीजों में से एक है! बकवास
0,"डेटाबेस खराब हो जाते हैं। खैर, कुछ, मेरे सर्वर पर। मैं उन टिप्पणियों पर बहुत खेद है जो खो गए हैं।"
1,omg मैं गोधूलि से प्यार करता हूँ मैं खिचड़ी भाषा तब तक इंतजार कर सकता हूँ जब तक कि अगले एक बाहर नहीं आता!
