0,"मुझे अभी पता चला है कि आप स्पाइमास्टर नहीं खेल सकते क्योंकि यह सर्वर ट्विटर तक पहुंचने में असमर्थ हैं। तो, अगर ट्विटर नीचे है तो खेल भी है"
1,बस दा लील एक से अंगूठे और कूल-एड मुस्कान मिल गया !!! इसका मतलब है कि नाश्ता एक सफलता थी
1,"मल्टीटच बार्सिलोना - हाय, एक वास्तविक मानव इंटरफ़ेस। URL लगता है कि Microsoft सतह एक बॉक्स में एक आदमी से मिलता है"
0,उपयोगकर्ता पास हो रहा है।
1,उपयोगकर्ता हम tila <3 से प्यार करते हैं
1,उपयोगकर्ता उपयोगकर्ता किया!  जेफ फाउले ने मुझे ऐसा करने के लिए कहा।  अभी भी सीख रहा।  मुझे यहाँ पर डालने के लिए कुछ दिलचस्प लगता है।
0,कोई सेलफोन नहीं होना मुश्किल है ...
0,वह मेरे पिता-लूथर वैंड्रॉस के साथ नृत्य खेल रहा है! यह गाना मुझे बावल करना चाहता है
0,उपयोगकर्ता aww haa मैं चाहता हूँ कि मैं उस टमटम पर जा सकता था xxxxxxxxxxx
1,बहुत थका। मेरे सिर में दर्द होता है। मैं एंडी sooooo बहुत प्यार करता हूँ!
0,उपयोगकर्ता आपको एहसास नहीं है कि मैं कितना जलन हूं। कोई भी मुझे नहीं ले जाएगा और मुझे यह देखने की अनुमति नहीं थी कि उन्हें मेरा जीवन बर्बाद हो गया है!
0,"क्या मेरी सोच के बारे में तुम्हें पता है?? मुझे लगता है कि एक शुभरात्रि के लिए इसका समय .. इतनी अच्छी रात और मैं बिस्तर पर जा रहा हूं, मुझे 7 पर उठना है ... याय !!!"
1,उपयोगकर्ता सही वापस atcha!
0,मैं सिर्फ अपनी पहली चीनी प्रश्नोत्तरी में विफल रहा।  लानत है
0,गोश मैं नफरत करता हूं जब मैं दुर्घटना से वॉशर में चैपस्टिक डालता हूं तो मेरे होंठ नहीं हैं ...
1,"उपयोगकर्ता और विश्वास के साथ क्रैंडन पार्क बीच। उसके बाद, उसकी जगह। मिस यू भी रयान"
1,"मैं एक ईसाई हूं जो दीर्घकालिक दर्द के कारण, मेरे हाथों पर बहुत समय है, इसलिए लोगों के लिए प्रार्थना करना पसंद करेंगे"
0,कुछ विश्वविद्यालय स्टड जानें ...
1,उपयोगकर्ता अच्छा नहीं लगता ... लेकिन कम से कम आप इसे पसंद करते हैं
1,उपयोगकर्ता आप डाउनी गर्ल का अनुसरण करते हैं?
0,"मैं एनजे में बहुत खुश हूं, लेकिन मुझे अपने कुत्ते की याद आती है"
0,साफ करने का समय .............................. बोरिंग
1,"कल इतिहास है, कल एक रहस्य है लेकिन आज एक उपहार है यही वजह है कि हम इसे वर्तमान कहते हैं"
1,उपयोगकर्ता क्रिप्टोग्राम!  सादे-टेक्स्ट अजीबता
1,"उपयोगकर्ता अभिवादन! हां, यह रात में नहीं होता है।   कृपया, अपनी प्यारी आत्मा के लिए समर्पित गीत का आनंद लें .. सभी के लिए!"
0,मैंने आज रात 50 सिट-अप किया। यह स्थानांतरित करने के लिए दर्द होता है।
0,मुझे वास्तव में पसंद है कि कैसे iMac और iPhone पर मौसम विजेट हमेशा अलग मौसम की भविष्यवाणी करता है ... नहीं!
1,"उपयोगकर्ता आईडी कहते हैं कि मैं यू, सी यू एन स्वर्ग प्यार करता हूँ"
1,Sup peeps lol मैं वापस पर हूँ
0,"आश्चर्य है कि लोग मुझे पसंद क्यों नहीं करते, मैं मजाकिया हूं और वास्तव में दयालु सब कुछ करता है 4hors बिना कुछ भी मांगने के बदले में क्या यह इसके लायक है?"
0,"पढ़ने और तालगंग टोटू के लिए बहुत सारे लेख, हमारे संविधान में संशोधन करने के लिए ग्रे क्षेत्र हो सकता है कि कोई भी अत्याचारी-वानाबे का शोषण कर सकता है"
0,उपयोगकर्ता वाह।  मैं अब अपने रन में बहुत निराश हूं।  मैंने सिर्फ एक चपटा चिपमंक देखा।
1,उसके बाल धोने के बारे में है
1,घर वापस url
0,उपयोगकर्ता का मतलब है कि चित्र जो मुझे पाठ कर रहे हैं। मेरे और उपयोगकर्ता के पास एक ही फोन है और वह कर सकता है लेकिन मैं पाठ की तस्वीरें नहीं देख सकता
1,उपयोगकर्ता को बस मेरे फोन के लिए एक पाठक मिला। सोचा कि इसमें मेरा पता नहीं है ... और वे वास्तव में Qool हैं ...
1,"उपयोगकर्ता ठीक है, मुझे अपने कैलेंडर पर चिह्नित करना होगा।"
0,गृहकार्य के बारे में सोच
0,बिना किसी ट्वीट के घर आना दुखद है।
0,boooo अलौकिक एक दोहराव है
0,कृपया कॉफी। ...
0,मुझे निश्चित रूप से मुझे सांत्वना देने के लिए किसी की जरूरत है
1,उपयोगकर्ता URL जोड़ने के लिए धन्यवाद
1,"डेलिगेट बॉब मार्शल: एक अच्छा उद्धरण पाने के लिए बहुत तेजी से बात करता है, लेकिन घर को हिलाता है।"
0,दुख की बात है कि पहाड़ियों के पास लॉरेन नहीं है ... मैं शायद अब शो नहीं देखूंगा
0,बस काम करना उचित नहीं है
1,उपयोगकर्ता क्यों अपनी कहानी को 140 ch तक सीमित करें। सभी को बताएं कि आपको www.iamsoannoyed.com पर क्या गुस्सा आ रहा है
1,मंदिर के पास दो बिल्लियाँ थीं और एक बहुत अच्छा था जो मुझे उसे पालतू बनाने के लिए था।
1,"उपयोगकर्ता मैं देख रहा हूँ, अच्छी तरह से सुंदर तस्वीर !!! वे यू लड़कियों से प्यार करते थे!"
1,उपयोगकर्ता हाहाहाहा। तब वह हार नहीं मानेगा और मुझे खराब कर दिया जाएगा। उपयोगकर्ता धन्यवाद youuuu!
1,उपयोगकर्ता अच्छी तरह से मुझे ठीक किया जाता है कि मैं आज आपके सम्मान में कुछ चीजें tumbl'd। इसे देखें Sweettangerine.tumblr.com आपसे प्यार करता है!
0,"दुख की बात है कि मेरे लड़के कल डलास के लिए रवाना हो रहे हैं। : | आई एम गोना मिस या, निक"
0,मेरे मुंह में दंत चिकित्सक को एक्स किरणें मिलती हैं
1,उपयोगकर्ता हे हे - चीजें कैसे हैं?! जी एंड आई को जुलाई में किंग के लिए बाहर (सेमेस्टर ब्रेक के दौरान!) को सत जीडे के लिए जाना चाहिए
1,उपयोगकर्ता हाय yrina! कृपया मेरे पीछे आइए?
0,उपयोगकर्ता अपने वास्तव में वास्तव में समलैंगिक आईडी की तरह कुछ धन्यवाद
1,मुझे पता है कि मैं कोई ऐसा व्यक्ति पा सकता हूं जो मुझे वह दे सकता है जो मैं चाहता हूं।
1,मुझे लगता है कि मैं प्यार में गिर रहा हूँ
0,"हम देखेंगे और प्रतीक्षा करेंगे और कल मैं किसी को भी ले जा सकता हूं, जो डॉ। डब्ल्यू/ओ को हर किसी को लेने की जरूरत है .... एन के गाल और कान लाल मेरे बालों के रूप में"
0,"उपयोगकर्ता मैं soooooo जलन हूँ !!!! हमें ग्रे स्काईज़ मिला है, और मैं एक टी और हूडेड स्वेटर पहने हुए हूं"
0,ऊ मेरे भगवान हम खो देते हैं I.T क्यों दुनिया हमसे नफरत है !!
0,बीमार हो रहे हैं और बहुत तंग आ गए हैं कि चीजें कैसे निकली हैं
1,उपयोगकर्ता हाय जेफ ... कार्यशाला का बहुत आनंद ले रहा हूँ! आपको इसके बजाय मुझे यहां फॉलो करना चाहिए: Ctabor और/या imwebgraphics
1,उपयोगकर्ता मैं जुलाई में आपके साथ उपयोगकर्ता Nikon डिजिटल कैमरा पल के लिए इंतजार नहीं कर सकता <33333
0,मैं किसी को खुश नहीं कर सकता और मैं सभी दिशाओं में फटा जा रहा हूं। एक क्लोन बनाने की जरूरत है।
0,क्षारीय तिकड़ी आज खेल रही है और मैं उन्हें देखने नहीं जा रहा हूं
1,"उपयोगकर्ता aww, मीठा। मैं वास्तव में उसे भी पसंद करता हूँ!  हम अभी बाहर हैं, इसलिए मैं आपको बाद में पकड़ लूंगा - एक अच्छा दिन है!"
0,उपयोगकर्ता मेरे colab sry में होना चाहते हैं अगर im कष्टप्रद im ऊब
1,हन्ना मोंटाना फिल्म अभी देख रहे हैं
1,"प्लस साइड पर, यह सब लगभग 48 घंटों में खत्म हो जाना चाहिए"
0,दुखद खबर और एक दुखद दिन !! हम अगले साल प्रशिक्षु पर मार्गरेट के बिना क्या करेंगे!  #FB
1,हाहा आज रात हास्यास्पद था लेकिन फिर भी मजेदार हाहा। वैसे भी .. शुभरात्रि
1,"उपयोगकर्ता आप ऑरलैंडो में उनके शो में आ रहे हैं, सामाजिक में FL?"
1,उपयोगकर्ता यह सबसे अच्छा है कि आप अच्छे गायक हैं
1,उपयोगकर्ता मैं एक आत्म-पोस्ट-यह नोट नशेड़ी को स्वीकार कर रहा हूं और मूल रूप से उन पर बकवास का भार डालने के माध्यम से चला गया हूं जो बहुत चमकदार है
0,डेविड कैराडिन उदास समाचार
0,#wichita अंत में भयानक परिस्थितियों में एक ट्रेंडिंग विषय बन जाता है
1,उपयोगकर्ता अरे मैं वहाँ गया हूँ !! कई बार।  कोई झूठ नहीं। हाहा। मैं मालिबू में रहूंगा।  हाहाहा मज़ा है!
0,हेलो उपयोगकर्ता आप सभी कैसे हैं? मेरी ठंड बदतर हो गई है और मुझे लगता है कि एक मरीज की तरह कोई धैर्य नहीं है
0,उपयोगकर्ता मैंने अभी किया है और यह नहीं है ... मेरे पास 0.25.1b ट्वीड है
1,माइकल क्लोथ फोटोग्राफी से उपयोगकर्ता सुंदर कला हमेशा एक स्वागत योग्य उपहार है।
0,"एक कप फाइनल के लिए एक दिन। चलो डबल लिपटे रेंजर्स प्राप्त करें! और मैं आज जलाने जा रहा हूं, मैं इसे महसूस कर सकता हूं"
1,बस कुछ पैड थाई मिला। मम्म।  दोपहर के भोजन और एक अच्छी किताब का आनंद लेने के लिए चर्च से घर वापस जाना। और आज रात कोई काम नहीं! ट्रिपल याय!
0,ट्विटरफॉन आइपॉड टच पर दुर्घटनाग्रस्त होने पर जब मैं कुछ पसंदीदा करता हूं
0,जब नया चाँद बाहर आने वाला है ?????????????? !!!!!!!!!!!!!!
1,"वू हू !!! फोरेंसिक पेपर किया और डिजिटल ड्रॉप बॉक्स में डाल दिया, अच्छाई का शुक्रिया, अब मुझे बस इस सप्ताह के बाकी हिस्सों के माध्यम से प्राप्त करना है ..."
0,मेरे लिए Farcry 2। इसे फिर से शुरू करना है! क्षमा
0,खिचड़ी भाषा मेरे कार्डिगन = ठंडे नहीं मिले
0,अंत में फिर से घर है। क्या शानदार सप्ताह है। मैं इसे फिर से करना चाहता हूँ
1,उपयोगकर्ता अलहाई पेनट मैकम स्कूल के पहले दिन। सेलमत मलम।
1,हास्यचित्र देखरहे हैं.....
0,क्वाड पर बड़े समय की स्क्रब करने के लिए मैं लोल पर चला गया
1,सिचुआन के लिए उपयोगकर्ता त्वरित अवकाश यात्रा। तनावमुक्त होते हुए। सांस लेना। लंबी पैदल यात्रा और निश्चित रूप से खाना
0,आज काम बकवास था। वास्तविक गंदगी की तरह। वापस सुबह वहाँ हालांकि
1,यूजर हैप्पी बर्थडे एंडी
0,"इस गिब्सन डॉग टैग को छोड़कर कुछ चीजें मिलने से पहले बाजारों में नीचे चले गए, मैं वास्तव में चाहता था कि मैं वापस जाने और फिर से देखने की उम्मीद करूं"
0,"वही पुराना स्कूल ... हमारे पास अगले 3 दिनों में MCAs है, Eww।"
0,उपयोगकर्ता hii मैं काम कर रहा था
0,काम 2mrorow =
1,उपयोगकर्ता अरे हम पेंट सूखी देख सकते हैं
0,कनाडाई क्यूकास्टर्स यहाँ अकेले हैं - हम में से बहुत कम हैं #samesexsunday
0,उपयोगकर्ता मुझे 18 वीं के लिए आपका उत्तर मिला है
1,"उपयोगकर्ता अच्छी तरह से, एक बार जब मैं माह पिंप हाथ उठाता हूँ तो आपको कोई परेशानी नहीं होगी। ... मुझे क्षमा करें, शराब नियंत्रण लेती है।"
1,सिडनी में मेरे पास एक भयानक समय था
0,उपयोगकर्ता मैं खो गया हूँ। कृपया मुझे एक अच्छा घर खोजने में मदद करें।
0,मैं स्कूटर चाहता हूँ
0,मैंने सिर्फ लोगों को बताया कि मैं गणित के लिए कोई सिद्धांत नहीं जानता और जाहिरा तौर पर एक बड़ी बात है।
0,उपयोगकर्ता आप सीजन के अंत में सेवानिवृत्त हो रहे हैं? यह एक वास्तविक शर्म होगी!
0,iPhone ver3 17 जून को उपलब्ध है। NZ के लिए नहीं। हमें 18 वें इंतजार करना होगा? क्यों हम इसे थोड़ा पहले नहीं कर सकते क्योंकि हम +12 टाइमज़ोन हैं
0,हैप्पी टुमॉरो स्कूल का आखिरी दिन है जो गणित के फाइनल के लिए तत्पर नहीं है। मुझे मुश्किल से यह सब याद है
0,"ठीक है, तो नौकरी बाजार वहाँ से बाहर बड़ा समय चूसता है!  पिछले 2 हफ्तों में 2 परिवार के सदस्यों ने बंद कर दिया।  मुझे बताएं कि क्या आपके पास कोई व्यवस्थापक नौकरी है।"
0,Maaaaan मुझे अपने नाखूनों को पूरा करने से नफरत है। इसका इतना समय इन दिनों में से एक का सेवन करता है
0,"आधिकारिक तौर पर, पूरी तरह से पैक और मिशन यात्रा के लिए तैयार है !! : डी सुश्री जॉयस के साथ बैठने के लिए ओशन स्प्रिंग्स में वापस आ गया।"
0,उपयोगकर्ता कोई चिंता नहीं है यह महान दिन है! इसलिए दुखी क्रिस वेइट्ज ने एक अद्भुत काम किया।
1,उपयोगकर्ता इसे क्यों नहीं करते हैं
0,"उपयोगकर्ता अच्छी तरह से अपने आप को प्रस्तुत करते हैं, क्योंकि यह सभी सप्ताहांत, बू की तरह होने वाला है।"
0,उपयोगकर्ता को अभी आपका पाठ मिला है।
0,मुझे याद है कि केविन ओ'नील एक बहुत भद्दे कोच थे जब वह रैप के साथ थे और अब वह ट्रोजन बास्केटबॉल भी नीचे ला सकते हैं
1,"उपयोगकर्ता बोल रहा है, आप लोगों की अफवाहें हैं जो सोलजा बॉय के साथ कुछ कर रही हैं!"
0,"एफबी पर एक लिंक पोस्ट करने में मुझे ~ 10 मिनट लगे। असफल! क्या एक घृणित इंटरफ़ेस। यह अधिक सहज होने के लिए उपयोग किया, अब यह सिर्फ भयानक है"
0,उपयोगकर्ता ugh मुझे लगता है कि मैं भी हूँ ..
1,उपयोगकर्ता मैं अस्पष्ट रूप से उन्हें याद करता हूं। हाहा सिर्फ मजाक कर रहा हूं। मैं काफी बीमार डब्ल्यू/ एक ठंडा और काफी गदगदों से बहुत गदगद हूं ... हम्म।
1,"उपयोगकर्ता अपने सभी lovey-dovey यहाँ, थैंक्यू। ओह! और मैंने आज देखा।"
1,डाउनटाउन डिज्नी! यह जगह बहुत अच्छी है
0,उपयोगकर्ता कोई विचार नहीं
0,"रणनीतिक योजना में एक स्प्रिंग अंतरिम पाठ्यक्रम लेने जा रहा था, लेकिन यह साइनअप की कमी के कारण रद्द हो गया।  अगस्त तक हुक से दूर।"
0,कुछ गुलाबीबेरी की लालसा
0,"उपयोगकर्ता अरे! आप अपने फेसबुक पर टिप्पणियों को अक्षम कर देते हैं, मैं आपको अच्छी तरह से देख रहा हूं कि मुझे आज हंसी हुई है!"
