1,उपयोगकर्ता उलटी गिनती शुरू हो गई है! अंत में!
1,"उपयोगकर्ता मैं केवल इस बारे में ट्वीट करता हूं कि मुझे क्या पसंद है, मुझे वास्तव में बनाने के लिए आपके लिए और अधिक धन्यवाद है! कठिन हिस्सा है!"
0,उपयोगकर्ता वह सिर्फ ऑटोग्राफ पर हस्ताक्षर करता रहा xp मैं मैट फ्लाईज़िक के साथ एक तस्वीर नहीं मिला
0,वर्षा ब्लीच में आगे बढ़ने वाली उपयोगकर्ता सौभाग्य आशा है कि यह जल्द ही साफ हो जाता है! आपका दिन अच्छा रहे!
0,Im एकल अब स्पष्ट रूप से।
0,मेरी उंगलियां चोट लगी हैं ...... 2 ज्यादा गिटार
0,"खैर, डारन। मैं NATS PARK में फिल्मांकन में एक अतिरिक्त नहीं होने जा रहा हूं क्योंकि मैं शनिवार 13 जून के सपने उपलब्ध नहीं करूँगा। बिखर गया।"
1,उपयोगकर्ता मैं सहमत हूँ !! हम जल्द ही मिलेंगे।
0,प्रिय इंटरनेट। तुम चूसो!
1,कल्चर शॉक एसडी की मदद करें और बुधवार को 600-1200 से हमारे साथ ऑसर हूटर एमवी में शामिल हों। आपके चेक का 20% हमें पीने और मीरा होने का समर्थन करेगा!
0,उपयोगकर्ता OMG नहीं! मैंने वास्तव में डिज्नीलैंड में रेडहेड प्रतिमा को देखा है। नहीं पता था कि आपके पास था। तो सुनकर क्षमा करें।
1,वू यम मेरे एचबी मग से बीयर पी रहा है! और कुछ कलियों के साथ बाहर लटकना
1,मेरी चाची की जन्मदिन की पार्टी में जा रहे हैं ... बाद में आपको ट्वीट करें
1,उपयोगकर्ता मैं तुमसे प्यार करता हूँ
0,"ट्विटर..मैंने एक कंप्यूटर पर अंत में ग्रीस में। यह यहाँ अद्भुत है, लेकिन मुझे घर की याद आती है"
0,YAAAAA मैं एक जुनून के साथ फ्रेंच से नफरत करता हूं। वाह मैंने कभी नहीं सोचा था कि कुछ मुझे अपने कंप्यूटर पर इतना पागल बना सकता है
1,इस सप्ताह के अंत में मेरी माताओं के लिए जा रहे हैं
0,उपयोगकर्ता कैफीनयुक्त कॉफी से बाहर चला गया .... उदास चेहरा
1,मेरे बालों के लिए कुछ करने के लिए बाउट करें और आज कुछ करने के लिए कुछ खोजें .. मुझे शुभकामनाएं!
1,पनीर स्वाद वाले आइसक्रीम।
1,उपयोगकर्ता धन्यवाद
0,"आह्ह्ह्ह्ह्ह्ह, कैसे बकवास करते हैं आप अंशों को करते हैं !!!"
1,आज कोई अंडे नहीं ... शर्म एक अंडे और बेकन सैंडविच के लिए आगे देख रही थी
0,आई आई एम हंग्री ओह इट्स ठीक है। मैं '1300882525' कॉल कर सकता हूं। हाहाहाहा लोल
1,उपयोगकर्ता बधाई लड़की !!! वैसे भी मनाएं ... यह काफी उपलब्धि है!
1,उपयोगकर्ता आपका दिन कैसा चल रहा है?
0,IPhone के लिए 1.3 पर कोई भी समाचार उपयोगकर्ता? लगभग 3 सप्ताह!
1,उपयोगकर्ता hahahaha आप उस ध्वनि को एक बुरी बात की तरह बनाते हैं !!!!!
0,उपयोगकर्ता ... मैं हार मानता हूं ...
0,BLEH! बीमार! और वहाँ बुक क्लब था आज ओह अच्छी तरह से * ऊतक के लिए पहुंच * ओह और दो सप्ताह में एकमात्र दिन भी जब कोई गणित नहीं है!
1,मुझे खुशी है कि हमने अच्छा काम किया
0,"उपयोगकर्ता अच्छी तरह से मेरी पार्टी खत्म हो गई है और मैं आज सुबह एक गले में सिर के साथ पीड़ित हूं, जो कि बेलफास्ट, एन.आईआरलैंड में सुबह प्यारी धूप है"
1,"उपयोगकर्ता प्यार, रोजी सबसे प्यारी और सबसे प्यारी प्रेम कहानी में से एक है जिसे मैंने कभी भी अपने सबसे अच्छे दोस्त के साथ प्यार में पढ़ा है"
1,उपयोगकर्ता मैंने fb btw पर यू को जवाब दिया
0,उपयोगकर्ता URL - LOL! आपकी तस्वीर मेरे से बेहतर है; पीपी और मैं छुट्टियों पर भी आगे होने के लिए तत्पर हूं।  पर ये है ...
1,सराह द्वारा मुझे अनुशंसित कुछ बैंडों को सुनकर मैं वास्तव में शुक्रवार की रात के लड़कों को पसंद करता हूं <3
1,प्रिंस हैरी एक ब्लॉक दूर x3 है
0,चिंतित है मेरी कार ..... यह मजाकिया चल रहा है
1,"उपयोगकर्ता मैं जिस तरह से वर्डप्रेस जा रहा है, उसके साथ अच्छा महसूस नहीं कर रहा हूं, और MovableType के साथ अच्छा महसूस नहीं कर रहा हूं। इसलिए मैं इस लंबे समय के बाद शिविर तोड़ रहा हूं।"
0,उरघ! विन 7 आरसी में पहला बीएसओडी
0,उपयोगकर्ता कैसे मेरे बच्चे को है ?? मेरा घर भयानक रूप से शांत और अकेला लगता है ।।
1,Url यह यहाँ है!
1,कानूनी रूप से गोरे देखने के लिए जा रहे हैं और कुछ चबाने के लिए कुछ खोजें। उम्मीद है कि च्लोए मेरे साथ छींटाकशी करेंगे!
0,उपयोगकर्ता हाँ ... मैं इस बात का ट्रैक खो देता है कि वह किस समय पर होने वाला था!
0,"अगले हफ्ते कुछ भी नहीं, गुनना एनीशेस में एक रात ड्रम-किट जल्द ही वूओ ... मुझे लगता है कि एक कुतिया मेरे सप्ताह को और भी बदतर हो सकती है ??"
0,"अभी भी थक नहीं है .. ठीक है, शायद थोड़ा।"
0,सिवाय मेरी माँ iwill को जल्द ही सी
0,"मेरी बाली संक्रमित है और दर्द होता है, इतना बुरा।"
0,उपयोगकर्ता हम हॉप शैतान लोग हैं - मैं कहीं भी नहीं रह सकता है जो लाभ नहीं कर रहा है। काश माइक कोप सीएफ में स्थानांतरित होता। मुझे अपने भाई की याद आती है।
0,इतना अधूरा लग रहा है। मैं चाहता हूं कि मैं अभी अपनी खुशी पा सकता हूं
0,छुट्टी लगभग खत्म हो गई है
1,बस मेरी उंगलियों को पार करने जा रहा है कम से कम मेरे बाल रॉक्स 2 दिन! #selfhi5
0,अभ्यास आज एक जानवर था। आज रात जूलियन देखने के लिए नहीं जा रहा है
1,"उपयोगकर्ता अच्छी तरह से, मुझे खुशी है कि मेरे पास कंपनी है"
0,"पिल्ले अब जा रहे हैं। यह अजीब है, मैं केवल एक दिन के लिए था और मैं उन्हें याद करने जा रहा हूँ"
1,"कुछ लोग मजाकिया होने के लिए व्यंग्यात्मक होने की कोशिश करते हैं लेकिन पूरी तरह से विफल हो जाते हैं। रिटर्न्स! इसके अलावा, कुछ लोग वास्तव में प्यारे हैं"
1,उपयोगकर्ता बीमार !!! यह सकल लगता है !!!!!!!
0,"मैं ग्लोबल ए के लिए तैयार हूं, मुझे एहसास हुआ कि सुबह 10 बजे के बाद मेरे ब्लॉक में मैट अजा कॉर्ट बिली मेरी कक्षाओं में नहीं होंगे। मैं नहीं चाहता कि क्यों?"
0,कुछ गर्म सफेद लोगों और मेरी वॉलीबॉल लड़कियों के साथ हैंगिन ... कल रात @ पीएसयू
0,लापता एयर फ्रांस विमान मिल सकता है। यूआरएल
1,"उपयोगकर्ता आह, इसलिए यह बताता है कि यह 79 डिग्री अंदर क्यों है।"
0,हिटमैन के लिए मैं रोया है! तौलिया में फेंकने का समय आप घर पर गर्व करते हैं M8 ... आपके प्रशंसकों के लिए एक सच्चा चैंपियन .xx
1,"उपयोगकर्ता मैं खुद को याद दिलाता हूं कि उन्हें कुछ वर्षों (दशक?) में भुला दिया जाएगा, जबकि असली किताबें हमेशा के लिए रहती हैं"
0,"पूरी तरह से इस बात पर ध्यान दिया गया है कि ने-यो दौरा कर रहा है, जबकि वह अयिया नपा में है, विशेष रूप से अब उपयोगकर्ता उसके साथ दौरा कर रहा है!"
1,URL - एलन क्विनलान को इस स्वाइनफ्लू महामारी के दौरान यात्रा करने के बारे में चिंतित होना चाहिए ...
0,वह चीर पर है
1,अपनी तुलनात्मक नीति के मुद्दे के लिए FTTP और ऑस्ट्रेलिया के राष्ट्रीय ब्रॉडबैंड नेटवर्क पर सामान पढ़ रहा है।
1,"उपयोगकर्ता OHHHH -.- आप SO LCUKKKY, XD WOOO मैं तैराकी जा रहा हूं, अगर मेरी बहन O_O आती है तो मुझे आशा है कि मैं डूब गया>>>"
1,"उपयोगकर्ता निरपेक्ष नहीं! अगर मैं इसे अभी कर सकता था, तो मैं पूरी तरह से करता"
1,उपयोगकर्ता हैप्पी एनिवर्सरी!  इस बदमाश के दिन आशीर्वाद।
1,हर कोई ट्रेंडिंग विषयों पर #MooseMonday प्राप्त करने का प्रयास करता है (कृपया रीट्वीट करें)
1,"उपयोगकर्ता ओह अच्छा, बहुत प्रयास बचाता है"
1,उपयोगकर्ता उपयोगकर्ता मैं यहाँ एक नाम है? whoda thunk। वीपी सोमो ** लहराते हुए **
0,"गोश, अंतिम परीक्षा आ रही है, मैं तैयार नहीं हूं"
0,मेरी छुट्टी अब खत्म हो गई है। आज रात सिर्फ एक और स्कूल की रात है। कल पीसने के लिए वापस
1,"उपयोगकर्ता उपयोगकर्ता उपयोगकर्ता उपयोगकर्ता उपयोगकर्ता ~ अपने नए अनुयायी को im, अपने ट्वीट के लिए तत्पर हैं"
1,उपयोगकर्ता - मैं उत्पादन/प्रत्यक्ष/फिल्म/संपादित करता हूं ... मैं लिखता हूं ... मैं घटनाओं का समन्वय करता हूं ... मैं डॉन फेट्टी का प्रबंधन करता हूं ... बहुत कुछ नहीं है जो मैं नहीं करता!
0,मेरे प्यारे स्टेपडैड जिमी के बिना मेरे पहले पिता के दिन के लिए तैयार होना
0,घर 4rm काम; लेकिन सू ऊब !! लानत
0,बिना किसी कारण के मैं अभी इतना बीमार महसूस कर रहा हूं
0,मैं बहुत निराश हूं। मेरी एकमात्र प्राथमिकता अब ब्लैकबेरी बोल्ड है!
0,मेक अप शिट
1,"उपयोगकर्ता BTW, नील का अधिकार! यह 'लीह,' की तरह 'राजकुमारी लीया' है।  और हाँ, मैंने 1977 से इसे प्राप्त किया है। LOL! एक बार फिर धन्यवाद!"
1,सभी को मीठे सपने!
1,उपयोगकर्ता और आप जानते हैं कि आपकी राय केवल एक ही है जो मायने रखता है ... मुझे लगता है कि मैं शरमा रहा हूं..जह यह है कि मैं सिर्फ गर्म चटनी करता हूं
1,अलविदा लेब्रोन .. शायद अगले साल
0,बस बॉयफ्रेंड को अलविदा कहा। अब रोना मेरे शेड्यूल में है।
1,इस सप्ताहांत के लिए sooo stoked
1,"डेव + लिंग टोमरो को स्नातक कर रहा है, धन्यवाद उनके यहाँ चुटकुले से बाहर"
1,उपयोगकर्ता सॉरी मेरा सब चला गया है ... मैंने उन्हें सब खाया
0,"बेवकूफ वसा मिन्नी माउस लड़की ने मेरे हेडफ़ोन को तोड़ दिया, चालीस डॉलर पीने के पैसे मुझे चाहिए"
0,"उपयोगकर्ता नहीं, वे घर में आ रहे हैं। मैं बाहर गया हूं, लेकिन अब मैं मेरा पीछा करता हूं"
1,उपयोगकर्ता ð ° ðºL ° ðº ð ð ° ° ° ° ð ° °?
1,उपयोगकर्ता जो क्लासिक्स के बीच एक क्लासिक है। मैंने इसे वर्षों में नहीं देखा है!
0,उपयोगकर्ता हाँ हाँ यह है
1,"उपयोगकर्ता ओह हाँ, और अगर वे कभी दिन की रोशनी देखते हैं तो मैं पूरी तरह से परिवार के सदस्यों को पीडब्ल्यूएन करूंगा। परमिट के साक्ष्य को नष्ट कर दिया जाना चाहिए"
1,इसे सुरक्षित और ध्वनि के लिए बना दिया ..... लगता है कि मैं एक झपकी लेने जा रहा हूँ!
0,"बस तुर्की से वापस आ गया। गोश, मुझे वापस चाहिए!"
0,अब मुझे समाप्त करने के लिए असाइनमेंट का एक गुच्छा मिला
1,उपयोगकर्ता हाँ हाँ! आप पास करेंगे!
0,"उपयोगकर्ता मुझे सुनने में बहुत खेद है।  हम अपने खुद के एबी के साथ क्या कर रहे थे, मुझे पता है कि आप अभी कैसा महसूस करते हैं। विचार आपके साथ हैं ..."
0,"उपयोगकर्ता ने एपीए देखा? Iyanih Emang Kesel Bgt udh Exam Lagi Nanti Liburnya Cm Bentar Msk Lagi Deh Haha अगले सोमवार तक, आप?"
0,22:15 और अभी भी कोई स्क्रिप्ट नहीं
1,अशर आपको एक ट्विटर मिला !! आपका उपयोगकर्ता नाम shaneofshanes होना चाहिए था
0,उपयोगकर्ता मेरे पास एक वेजी बर्गर था जो पहले मुझे प्रभावित नहीं करता था ... इसलिए मैं आपको महसूस करता हूं।
0,शर्मीली आज अर्निका 30 बीमार हो गई है और अपने बुखार को थोड़ा बढ़ा दिया है ... उसके अस्थायी पर नजर रखते हुए - आशा है कि उसके इम्स सीस ने उन्हें तेजी से कीड़े को मार दिया!
0,";)) भूख .. << मुझे ,। प्रतीक्षा .. मेरे दोस्तों को इतनी देर हो चुकी है। ("
1,उपयोगकर्ता मुझे नहीं। मैं चेरी बॉर्बन को चुका रहा हूं और पिज्जा अगर स्लाइस खा रहा हूं।
0,उपयोगकर्ता तो ........ आपका मेरा अनुसरण नहीं कर रहा है? मुझे चोट लगी है
0,मेरा राउलिटो कहाँ है? ...
0,अब तक के सभी तूफान मेरे ईमेल को काटने के लिए हैं
1,"उपयोगकर्ता नहीं, लेकिन आप रिची ब्लैकमोर और इंद्रधनुष के साथ गलत नहीं हो सकते"
1,"यदि आप Apple और UR में काम करते हैं, तो यह पढ़ते हुए, कॉफी रश, 8: 30ESQUE, DOBSON और RAY। कुछ करें वरना ऐसे ही रहें"
1,उपयोगकर्ता mmmm ... लेटेक्स।  क्या आपने कल पोस्ट की गई पिक्स की जाँच की? मैं मिस्टर/ मैडम से प्यार करता हूं। लेकिन कुछ और मैं प्यार करता हूँ ...
0,मुझे टीसीएम की याद आती है
0,उपयोगकर्ता मैं आपको Â eelsâ का एक एमपी 3 भेजने जा रहा था? Â लेकिन अफसोस कि ट्विटर पर ऑडियो ट्रांसफर करने का कोई तरीका नहीं है
1,सोप्रानो अनुभागीय समाप्त। आश्चर्य है कि अन्य खंड कैसे कर रहे हैं!
1,रात के खाने के लिए कुछ आपूर्ति प्राप्त करने के लिए फ्राई में बंद कर दिया- इसके मैक्सिकन सोमवार!  नोम नोम
1,उपयोगकर्ता ओह हाँ गीत और वीडियो वास्तव में अच्छा है
0,मैं बिस्तर पर जा रहा हूं। अच्छी नींद लें। मैं चाहता हूं कि मेरा सूरज मुझे जगाए
1,उपयोगकर्ता aww धन्यवाद मीठे सपने।
0,यह एक निराशा थी !!  कब से Jjohnson 36 वें स्थान पर है ????? !!!!!
1,उपयोगकर्ता आप भी - आशा है कि आपका दिन अच्छा था!
0,अशर OMG। मैंने आपका डीएम पढ़ा लेकिन मैं अपने फोन पर जवाब नहीं दे सकता ... बस OMG
0,मुझे सिर दर्द है
1,"सामग्री को ज्ञान, ज्ञान और विशेषज्ञता के आधार पर रेखांकित किया जाना है अन्यथा यह उन स्थानों पर बहना है जो आप नहीं होना चाहते हैं"
1,क्या प्यारी रात
0,"उपयोगकर्ता AWW बधाई, उपयोगकर्ता। पॉलीडैक्टाइल बिट का जिक्र क्या था? मैंने सोचा कि शायद 90 +7 = अलिंगी।"
0,"उपयोगकर्ता आह, यह दुखद है"
0,"उपयोगकर्ता URL - मुझे ऐसा लगता है! खैर, आप भाग्यशाली हैं"
1,उपयोगकर्ता मुझे दर्दनाक चिल्लाने के बाद हैशटैग पसंद है
0,दुर्भाग्य से आपके नए ग्रीन अकाउंट पर कोई भी कुछ भी नहीं पढ़ सकता है
0,मुझे एक गले लगाने की जरूरत है ... और कम निंदक। यह मुझे उदास कर रहा है।
