0,"मैं बेहतर बनना चाहता हूं इसलिए मैं बाहर जा सकता हूं, कोई मेला नहीं"
1,"उपयोगकर्ता हाँ, मैं इसे अपने होम सर्वर पर 128MB पर सेट करता हूं। अब अच्छा काम करता है! MODX 2 बीटा बहुत अच्छा लग रहा है"
0,लानत है !!!! बारिश हो रहा है n मैं बस से दा लड़कियों को प्राप्त करना होगा
1,उपयोगकर्ता कृपया स्पाइक जोन्स और 'उसके गिरोह के साथ/ सभी मूर्खतापूर्ण आवाज़ और ध्वनि प्रभाव से प्यार करते हैं
1,"उपयोगकर्ता उपयोगकर्ता उपयोगकर्ता धन्यवाद लड़कियों। मैं अभी भी बीमार हूँ पू .. lol..sore गला भरा नाक के साथ। लेकिन हाँ, यह एक माँ दिवस है"
0,मेरे भगवान सिर्फ कॉलेज सुपर क्विक से घर चले गए और दुनिया में सबसे खराब सिलाई थी! अई
0,बारिश बारिश दूर जाना......
0,उपयोगकर्ता आपने मुझे बुलाया? ऐसा नहीं मिला।  सुनिश्चित करने के लिए घोंसला समय। शायद मैं जल्द ही ला आऊंगा। मैं हेला वाना डिज्नीलैंड जाता हूं।
0,कल दो बार मिशन पीक पर चढ़ना होगा।
0,गंभीरता से उपयोगकर्ता अधिकांश लोग कहते हैं कि अंगूठे स्माइली के लिए नीचे? वैसे मैं कहता हूं कि बस है
0,"उपयोगकर्ता मैं बहुत बीमार महसूस करता हूं।  मैं देखूंगा कि मैं सुबह कैसा महसूस कर रहा हूं, लेकिन यह अच्छा नहीं लग रहा है।  वाह। क्या आपके पास एमएसएन है?"
1,माइक द पेन फैन के साथ हॉकी गेम और एक स्वस्थ प्रतिद्वंद्विता का आनंद ले रहे हैं। मैं जीत रहा हूं
1,उपयोगकर्ता वे फिशे लेंस हैं।  धन्यवाद!!!
0,"स्कूल से वापस और एक दोस्त, पहले से ही फिर से थक गया है।"
1,उपयोगकर्ता उपयोगकर्ता मैं जेनी के बारे में दिल से सहमत हूं जो आपको मिनी कॉन तक खींचता है। अगर आप गए तो मुझे अच्छा लगेगा।
0,"घर पर बैठकर कुछ भी नहीं था, लेकिन फोन देख रहा था। स्टार ट्रेक को देखना चाहता था, लेकिन हर कोई आज शाम को उबाऊ है।"
1,यह सुनने के लिए उपयोगकर्ता क्षमा करें। आशा है आप जल्द ही स्वस्थ हो जाएंगे!
1,इस शुक्रवार को राम कैसे कर रहे हैं? Dolce हग्स लेडीज उपयोगकर्ता उपयोगकर्ता और बाकी सभी #followfriday
1,उपयोगकर्ता im को सुन रहा है ओह ओह बस इसे बंद कर दिया!
1,"उपयोगकर्ता बस ब्लिप पर था, मुझे संगीत की ध्वनि बहुत पसंद है"
1,उपयोगकर्ता हाँ! यह एक बढ़िया विचार की तरह लगता है। मुझे इसके बारे में LJ पर संदेश दें
1,"हैलो मल्टीवर्स! बाहर जाने के लिए एक महान दिन, और यह भी कि * जो कुछ भी है वह भगवान आपको करना चाहता है!"
0,उपयोगकर्ता नो स्ट्रिप क्लब आसानी से नेट पर और 3GS सोमवार तक यहां नहीं है। D'OH!
0,रात का खाना खत्म हो गया..स उपयोगकर्ता का कमरा .. मेरे कानों ने मेरे गले स्वाइन फ्लू फीवर के साथ ही चोट पहुंचाई
1,"उपयोगकर्ता अरे लड़की, जोड़ने के लिए धन्यवाद!  ट्वीट करने के लिए तत्पर हैं!"
1,रयान रेनॉल्ड्स के रूप में। मैं उस फिल्म को इतना बुरा देखना चाहता हूं।
0,"सुबह, स्कूल जा रहे हैं और भाग्यशाली आकर्षण खा रहे हैं, मैं वास्तव में बस कार्ज़ी स्टाकर आदमी की सवारी करना चाहता हूं"
1,"उपयोगकर्ता बहुत सेक्सी yaself lol के लिए प्यारा है। अगर उर बहुत सेक्सी के लिए सेक्सी है, तो मेरे साथ कुछ साझा करें"
1,उपयोगकर्ता हा हा स्टिंग इस तरह से नहीं है
1,मैं बहुत थक गया हूं। स्कूल के लिए तैयार हो रहा है। उघह
0,"एक प्यारा दिन अब तक थोड़ा तनावपूर्ण था, लेकिन उन्हें सही समय पर आया था धन्यवाद दोनों लड़कियां JJ इंजेक्शन के लिए 3pm XXX पर सोते हैं"
0,माह चेहरा सनबर्न है। मेरे freckles ouchies बाहर लाता है
1,थकने के बारे में जाने के बारे में! मेरे जन्मदिन तक कुछ मिनट!
0,उपयोगकर्ता हाइज़ ... रेडियो पोर्टल अचानक मेरे पीसी पर काम नहीं करेगा। आपके शो को सुनने में सक्षम नहीं था।  वैसे भी नमस्कार।
1,उपयोगकर्ता को अब दोहराने पर 'निर्णय' मिले
1,उपयोगकर्ता im आपको एक प्रशंसक साइन चीज़ बना रहा है
1,उपयोगकर्ता btw मैं अभी भी विश्वास नहीं कर सकता कि NewJabbakidz प्रदर्शन कितना भयानक था ... यू मास्क में..मैं अपने पीसी पर चिल्लाया
0,उपयोगकर्ता
0,एमटीवी अवार्ड्स को फिर से देखना -.- soooo ऊब
0,"मैं सिर्फ एक मधुमक्खी से डंक मार गया !!!  बुरा समय, मधुमक्खी के लिए बहुत कुछ- मैं मरने लायक नहीं हूँ! गरीब मधुमक्खी और मेरे गरीब पैर! आउच वास्तव में दर्द होता है!"
0,मैं संशोधित करना चाहता हूं लेकिन कोई प्रेरणा नहीं है
0,लारिसा के लिए अपनी प्रार्थनाएँ बढ़ाएं। उसे बहुत चाहिए।
1,"उपयोगकर्ता अच्छी योजना। मुझे आशा है कि यह सब काम करता है, हालांकि। यह सोचकर मुझे खुशी होती है कि आप इच्छाशक्ति के बारे में ज़िप करने में सक्षम हैं!"
0,सभी सूँघने के लिए अग्रिम में माफी जो मेरे फ्रेंच में आ रही होगी
0,उपयोगकर्ता ने मेरी भाभी को एक बार चेरी के साथ देखा।  मैंने कोशिश की लेकिन अच्छा कौशल नहीं कर सकता।
1,अशर ओह्ह शिज़ल !! LOL अच्छी तरह से आपका अभी भी जीवित है!
1,"मुझे नींद आ रही है, मुझे कुछ कॉफी चाहिए"
0,केरी की शुभकामनाएँ यहाँ लानत ज्ञान दांत थे !!!
1,उपयोगकर्ता हेह! आप इंडी को ले जा रहे हैं और Nowheresville की तरह एक मोटल 6 होटल प्राप्त करना चाहते हैं! सुनने के लिए अच्छा है कि आप सुरक्षित और ध्वनि वापस आ रहे हैं।
0,"फ़राह फॉसेट, इस तरह के एक महान आइकन का आज सुबह निधन हो गया - URL - दुर्भाग्य से, उसने कैंसर के साथ अपनी लड़ाई खो दी"
0,उपयोगकर्ता umm सिर्फ परिवार के साथ दोपहर के भोजन के लिए बाहर जा रहा है। लेकिन आह मैं बहुत थक गया हूँ wbu बेब?
1,उपयोगकर्ता का स्वागत है
1,शुक्रवार स्पैम का पालन करें अस्थायी रूप से रुके।
1,आरटी के लिए उपयोगकर्ता तो यू यू और याद है कि आप जो कुछ भी चाहते हैं वह कर सकते हैं मैं जीवन का अनुसरण करता हूं अगर आप चाहते हैं कि मैं यू महान दिन जोड़ूं
0,उपयोगकर्ता मैं अभी पढ़ता हूं कि OS 3.0 अपडेट शाम 6 बजे तक उपलब्ध नहीं होगा
0,अभी भी बीमार लग रहा है
0,"उघ।  बाल।  मौसम + frizz = मैं कभी भी ""नुकीला"" बाल कटवाने के लिए नहीं होगा"
0,उह ओह ! मैं प्रभावित नहीं हूं
1,"उपयोगकर्ता मुझे पता है, लेकिन हमारे पास अभी भी जादू है, है ना?"
0,काश मैं डलास में ओपनिंग जेबी कॉन्सर्ट में होता
0,उपयोगकर्ता धन्यवाद जेन। मैं अभी तक तैरने में कामयाब नहीं हुआ। यह यहाँ गर्म और आर्द्र है लेकिन यह गर्म नहीं है और पानी ठंडा है। होटल पूल गर्म नहीं है
1,अलविदा यू.पी.  फॉल में मिलते हैं
0,मेरे पास ओवरटाइम अपराध है
1,उपयोगकर्ता यह अद्भुत है! बहुत अच्छा!  *आलिंगन*
1,गुडनाइट ने मेरा राजनीति विज्ञान पेपर किया और मेरी पाठ योजनाओं का आधा हिस्सा। मैं कल बाकी खत्म कर दूंगा।
1,"ट्विटर पर जा रहा है, देखें कि क्या होता है"
1,"वाह। DLSU में स्वाइन फ्लू, उन्होंने 2 सप्ताह के लिए कक्षाओं को निलंबित कर दिया। एर ... भाग्यशाली? हाहा।  ऊपर दीन! Lol *मजाक"
1,"बिस्तर पर जा रहे हैं, फिर देखें!"
1,"जाग रहा है और सोच रहा है कि आज सुबह, आज, आज रात क्या करना है"
1,"ओकी, यह सब #SSS सामान रास्ते से बाहर है। कुछ ताजा बेक्ड क्रोइसैन और जावा का एक अच्छा बड़ा कप महसूस करें"
1,"ठीक है, मैं इसे अब मिल गया हूँ मुझे स्मार्ट लग रहा है"
0,मैं एक तस्वीर नहीं जोड़ सकता और रंग बदल सकता हूं
1,उपयोगकर्ता - मैंने अभी भी काम किया है !!!! उपयोगकर्ता मैं प्यार करता हूँ नींबू पानी esp जब इसमें वोदका होता है
1,"ग्रीष्मकालीन पढ़ने की सूची (क्रम में): अमेरिका में डर और घृणा, सड़क पर, लेखन पर, गुलाब की घूंघट, वाल्डेन और सिविल अवज्ञा"
0,आज रात मेरी कर्फ्यू 12 साल की थी
1,उपयोगकर्ता आप मेरे bewbs उधार ले सकते हैं क्योंकि मैं आपको पसंद करता हूं।
0,उपयोगकर्ता मैं प्रार्थना कर रहा हूँ यह मामला gerri है। अगर मेरे bf ने मुझे अवरुद्ध कर दिया तो यीशु यह नहीं होगा?  मैं दिनों के लिए रोता हूँ!
1,इस सप्ताह के अंत में समुद्र तट पर जा रहे हैं हैम्पटन रोड्स? अपने मौसम के लिए मुझे अपने साथ ले जाओ
0,बस घर मिल गया था मजेदार .. थोड़ा नशे में मुझे लगता है कि (ए) मेरे लिए कोई पोकर नहीं।
1,"उपयोगकर्ता lol, यह इसलिए है कि Microsoft विंडोज को कम कष्टप्रद बना देगा"
0,गर्मियों की हवा में एक बालकनी पर
1,उपयोगकर्ता ज़िपलाइन की कोशिश करना सुनिश्चित करें! मैंने पिछले हफ्ते ही किया था!
0,#Pre पाने के लिए लाइन में खड़ा है।  मेरे लिए अच्छा नहीं लगता।
0,उपयोगकर्ता जो मुझे बहुत बेहतर महसूस कराता है।  मुझे लगता है कि ईरान की जानकारी महत्वपूर्ण है और यह आपको परेशान कर रहा था ...
1,उपयोगकर्ता साइरस मेरे दोस्त निकोला चाहते हैं कि आप यह जान लें कि हम हन्ना मोंटाना को हैंगओवर के साथ देख रहे हैं
0,"खुशी है कि मेरे दांत दर्द हो रहा है, खुश पिता दिन! सैम का दूसरा पिता होने के नाते, हालांकि मेरे पास केवल 1 है"
0,उपयोगकर्ता ugh। हे भगवान। यह मेरा शॉट होना चाहिए था! कल रात मुझे लगा कि मैं अभी भयानक शॉट्स संपादित करूंगा।
0,"ओह, कल काम करने के लिए वापस 1/2 टर्म लेकिन केवल 7 सप्ताह तक गर्मियों तक पूरे 6 सप्ताह तक काम बंद हो जाता है - आनंद"
0,उपयोगकर्ता क्या?! यह कहाँ और कब हो रहा है? क्या हम आमंत्रित हैं।
0,बहुत दुख की बात है कि मैट को अमेरिकन आइडल से वोट दिया गया था
1,उपयोगकर्ता * हूडि को वापस सौंपें * मुझे इसका उपयोग करने के लिए धन्यवाद!  मुझे बेहतर लग रहा है
1,उपयोगकर्ता बस कहना चाहता था कि मैं आपके साथ twittering को याद करता हूं gniiiiteee प्रेमियों!
1,"एल्मवुड पर लिज़ जॉन एक केविन के साथ उपयोगकर्ता।, आइसक्रीम खा रहा है"
0,Url - मान मुझे उसकी बहुत याद आती है
1,मैं बेहतर महसूस करता हूं अब धन्यवाद उपयोगकर्ता उपयोगकर्ता उपयोगकर्ता उपयोगकर्ता ily <3
1,"अब तक किए गए बेहतरीन एल्बमों में से उपयोगकर्ता 3 (हमला, छह, क्लेप्टोमेनिया) मुझे बहुत पसंद है, लेकिन .... हाँ ..."
0,"उपयोगकर्ता lol Luck u, मैं इसे पसंद करने के लिए या उस मामले के लिए इसे देखने के लिए नहीं मिल सकता है"
0,#पहली बार मैं बैटमैन को देखता हूं और एलडीबी से मिला हूं! फिर भी कोई रोमियो मैं एक अपरिपक्व सनकी था! अभी भी हूँ!
0,"काश एयर कॉन कार में काम कर रहा था। मोटरवे पर 60 मिनट के बाद शॉवर में स्ट्राइट होना पड़ा, मैं शुक्रवार को एयरकॉन फिक्स प्राप्त कर रहा था"
1,समर ब्रेक का आनंद लेना- एक शिक्षक होने के बारे में बेहतर चीजों में से एक!
1,वास्तव में कुछ नींद लेना चाहिए .. कल थोड़ा व्यस्त दिन।
0,"उन सभी को धन्यवाद, जिन्होंने कल रात मुझे BlogTV पर लाइव में शामिल किया! क्षमा करें, मैं बिना अलविदा कहे छोड़ दिया मेरी शक्ति बाहर चली गई"
0,यह यहाँ बहुत गर्म है
0,उपयोगकर्ता आप उस SM मिशिगन क्लब URL को Tynyurl के अलावा कुछ और कर सकते हैं? ज़ोन अलार्म उस ऐप का प्यार नहीं दिखाता है
0,लेकिन मैं पागल लोगों के बीच नहीं जाना चाहता
1,उपयोगकर्ता उपयोगकर्ता .... किसी दिन कोई व्यक्ति प्राप्त करने के योग्य होगा और आप दोनों के लायक प्यार करेंगे ...
0,जस्टीन के मम के विपरीत सिम्स 3 को बचाने की जरूरत है जो उसके खेल खरीदता है - URL
0,कॉन्सर्ट आज रात soooo परेशान नहीं किया जा सकता है
0,एक ऑनलाइन पार्ट टाइम जॉब? URL की जाँच करें -बाहर निकलना और वालेस को छोड़ देना
0,उपयोगकर्ता नहीं मैंने नहीं किया। मैं अपनी कार को सुबह की दुकान पर ले जा रहा हूं:/ मुझे नहीं पता कि कल कैसे काम करने वाला है!
0,"आदमी काश मैं शहर में होता! ची में ""myblackisbeautiful"" दौरे पर किसका जा रहा है? उपयोगकर्ता वहाँ जा रहा है यो! smh @ havin2missit"
0,"उपयोगकर्ता जबकि मुझे पता है कि यह आपकी गलती नहीं हो सकती है, मैं वास्तव में चाहता हूं कि स्ट्रीमिंग मेरे इंटरनेट कनेक्शन पर मांगों को देखते हुए एकमात्र विकल्प नहीं था"
1,मेरे पैर की उंगलियां ठंडे हैं। लेकिन कम से कम चीनी भोजन आने वाला है
0,पियानो पर बैठे लेकिन ओचेन थके हुए url
0,मेरा भाई मुझे चुनना भूल गया।  *अधिक काम करता है*
0,मुझे लगता है कि मैं दिन भर घर पर रहने वाला हूं। यह बहुत बादल/बारिश है
0,पेन गेम को याद करने वाला im
0,उपयोगकर्ता बहुत बुरा है कि एमए में गर्मियों के पहले दिनों में बारिश हो रही है/बादल धूप होनी चाहिए। मेरा भी बरसात था।
0,"मेरे पूर्व में भाग गया, लानत है, वह अभी भी सुंदर है।"
1,डेनिस मजाक - सुअर छत पर कैसे मिला? स्वाइन फ्लू!
1,उपयोगकर्ता .. यह सच नहीं है क्योंकि क्रंच जामुन मेरे जैसे सबसे अच्छे हैं ताकि कथन गलत है !! ज़ोर-ज़ोर से हंसना
1,कितना रोमांचक है
1,"एक न्यूजीलैंड वेब डिजाइनर जो एक ट्विटर नौसिखिया है, अब ट्विटर कुंवारी नहीं है! नमस्ते नमस्ते"
0,"ठेठ! क्लब खुलने से पहले मुझे और अधिक पीना होगा। मैं जल्द ही सो जाऊंगा,"
1,अशर हाँ! यह वास्तव में उसे योग्य है
0,3 से ऊपर गया और वास्तव में बीमार लगता है
1,जापान में प्रेमी हमेशा मुझे बाहर जाना चाहते हैं और फुटपाथ के नीचे छोड़ देते हैं
