0,"उपयोगकर्ता हाल ही में मैं 2 बहुत सो गया हूं, आमतौर पर मैं पर्याप्त नहीं सोता हूं। Im 3 चम्मच चीनी के साथ एक गर्म चॉकलेट की लालसा"
0,"उपयोगकर्ता और मैंने सैट पर आउटलेट्स पर यू को देखा कि अब मैं टीआई के बारे में सोचता हूं, बोलने के लिए क्षमा करें"
0,किसी को ???
0,"यार, मैं कक्षा में वापस नहीं जाना चाहता"
1,मिचेल मस्सो को जाम
0,"पत्रिकाओं, साबुन, रेज़र, आदि को मेरी स्वीटी को भेजने के लिए जा रहे हैं जो दिसंबर तक विदेशों में है। वह दुखी है।  कम से कम कॉम्स आर गुड।"
1,उपयोगकर्ता मुझे अभी भी कुकीज़ चाहिए।  *गले*
1,उपयोगकर्ता मुझे अपने रडार पर पाने के लिए एक ट्विटरिंग को एक पायदान पर ले जाने की आवश्यकता हो सकती है जो एक महान निमंत्रण होगा!
0,कल रात गिग महान था। अब यह संशोधन के लिए वापस आ गया है ...
0,कोई आइसक्रीम नहीं
1,उपयोगकर्ता noooooooooooooooooooo ... केवल lol lol lol ;-) lol आज !!!!
0,"उपयोगकर्ता मैं काम के लिए मेरा दावा करता हूं;) पिछले साल पिछले साल मैं दावा कर सकता था - हालांकि - मैं एक नया प्यार करता था, लेकिन वास्तव में जरूरत नहीं है"
0,उपयोगकर्ता को पता नहीं है कि अब क्या सोचना है ... मैं भी किसी भी नाम का उल्लेख नहीं करूंगा ...
0,मैं मिचली महसूस करता हूं और मुझे नहीं पता कि क्यों। Ew।
1,उपयोगकर्ता lol noooo ... हम Camden Fri Nite के लिए लेविन हैं
1,मुझे अपने सभी नए ट्वीट पसंद हैं। आपका स्वागत है और कृपया मुझे पाठ करें हम एक दूसरे को जान सकते हैं।
1,उपयोगकर्ता बस प्रशंसकों को याद दिलाएं कि वे इसे फिर से MTV.CA और MTV.com IM में टोरंटो में देख सकते हैं और हमारे पास कुछ ऑडियो मुद्दे थे
1,उपयोगकर्ता: हम एक Redneck पार्टी में हैं।  बेशक वह ठीक नहीं है।
0,यह जानना चाहता है कि आज रात क्या कर रहा है!
1,बगीचे में एक आलसी शाम पिकनिक है! कितनी तेजी से शिविर !!  यूआरएल
1,गह! अपडेट करने के लिए बहुत सारी चीजें! इतना कम समय! मैं सबसे अच्छा दोस्त के साथ midvalley के लिए रवाना हो गया हूँ! Ciaoz!
0,यह 2.55 बजे है और मैं व्यापक जाग रहा हूं
1,मैसाचुसेट्स में। मैंने वास्तव में कुछ इंटरनेट पकड़ा है इसलिए मुझे लगा कि 'क्यों नहीं मेरा डेलीबॉथ?'। मैं अपने ... url में हूँ
0,मुझे लगता है कि मैं सिर्फ बीमार और बीमार हो रहा हूं। मुझे लगता है कि गंदगी और अगर मैं सो जाता हूं तो अब मैं सुबह नहीं उठता
1,ट्विटर की दुनिया में आपका स्वागत है आपको याद आती है! पी। एस। आपको मुझे फॉलो करना चाहिए
0,मुझे नहीं लगता कि मैं जीता था मुझे वास्तव में नहीं पता था कि कब कॉल करना है..यह व्यस्त था। ओह वेल्स मैं कल फिर से कोशिश करूँगा!
1,"उपयोगकर्ता जन्मदिन की शुभकामनाओं के लिए धन्यवाद, मैं इतना व्यस्त हो गया हूं कि मुझे धन्यवाद कहने के लिए नहीं मिला।   तो धन्यवाद! :-डी"
0,अभी भी ब्रांटफोर्ड में केविन स्मिथ से उबरने की कोशिश कर रहा है और ब्रॉक में मेल्स बिड पार्टी। सुबह 5 बजे तक रहना बहुत कम व्यक्ति के लिए है
1,आज रात कोई अनिद्रा नहीं !! yey !!
0,उपयोगकर्ता मुझे पता है कि मैं सपने देख सकता हूं।
0,उपयोगकर्ता और पूरी तरह से मुझे पूरे दिन टेक्स्टिंग नहीं कर रहा है! वू!
0,उपयोगकर्ता वह मुझे पसंद नहीं है।
1,"उपयोगकर्ता उपयोगकर्ता ""चक्कर पानी"" क्या है जो अमेरिकी पिता पर रोजर अल्कोहल कहता है ... और मैं आमतौर पर केवल वोदका पीता हूं"
0,क्या कुछ iPhone ऐप्स के साथ इसे nerding है ... काम? PSSHAW! (दोपहर के भोजन के बाद तबाही होने जा रही है ...)
1,"Fuzion $ 7.45 के लिए अच्छी शराब है। रंग मुझे प्रभावित किया। रात के खाने के लिए बेक्ड सैल्मन, अब आज शाम को देखने के लिए।"
0,मेरे डेस्क पर सभी कॉफी। मेरा Etch-a-Sketch घातक रूप से घायल हो गया है।
1,ल्यूक थॉम्पसन कल रात प्यारी सी प्यारी थी। उन्होंने मेरी सीडी पर हस्ताक्षर किए
0,आज अधिक सॉफ्टबॉल है। एक खेल थियो नहीं। बस एक अभ्यास ... लेकिन मेरी बांह अभी भी खराश है
1,उपयोगकर्ता उस सर्किट को पॉप नहीं करता है अब बिजली कंपनी आपको वास्तव में = $ $ पसंद करेगी
1,उपयोगकर्ता धन्यवाद आदमी खुशी है कि आपको यह पसंद आया
1,उपयोगकर्ता url - हाँ im यकीन है यू आर
0,कल अब तक का सबसे अच्छा दिन था !!!  sooooooo बहुत मज़ा !!! वहाँ जाना चाहते हैं agaian प्यार ya लड़कियों! :-*
0,मुझे आणविक सेल बायो से नफरत है। मैं इस पर अपनी गर्मी को बर्बाद करने की कोशिश क्यों कर रहा हूं?
0,फिर भी एक और सोमवार
1,उपयोगकर्ता - काफी उचित है
0,काम के लिए तैयार हो रहा हूँ!
1,उपयोगकर्ता ऊह?  बहुत बढ़िया। मैंने उस व्यक्ति के बारे में नहीं सुना है जिसने अभी तक इसका आनंद नहीं लिया है।
0,मैं बाहर आने के लिए न्यू मून के लिए उत्साहित हूँ !!! मैं इसे अभी देखना चाहता हूँ!
0,"मेरे सभी अनुयायियों के लिए जिन्होंने 5*किया था, क्या उन्होंने आपको एक पूर्व -समूह समूह करने दिया ???? मैंने पढ़ा है कि कुछ ने किया और कुछ को टीआईए की अनुमति नहीं थी!"
0,"Arrgh! क्या मीडिया मंदिर में 311 सबसे बड़ी हिट होनी चाहिए, क्योंकि उनके पास संगीत हो रहा है"
1,उपयोगकर्ता ओह मैं देख रहा हूँ! तुम बहुत दयालु हो मेरे दोस्त!  हालांकि यह एक खराब ड्राइव नहीं है
1,उपयोगकर्ता www वहाँ लटका हुआ है ......... आपको एक ऑटो-रिप्लाई सुविधा की आवश्यकता है। मेरे ईमेल का उपयोग करना चाहते हैं? मैं बहुत विनम्र हो सकता हूं
0,यह बहुत कष्टप्रद है जब वह रात के बीच में अपने कंप्यूटर पर टाइप करना शुरू कर देती है!
0,उपयोगकर्ता यह मेरे लिए plz & kthnx के लिए करते हैं
1,20 वीं वर्षगांठ किराए पर! सभी बाहर 2 रात के gtin का इलाज किया गया .. By IV ने फैसला किया कि मैं इस कमरे को लहराने से इनकार करता हूं/ अपने iPhone का उपयोग करता हूं जब तक कि मैं gd a gd a ppqs पर हूँ !! : पी .xx
1,TIPIBACKUP टूरन SUR MOCBOOK: O) (उपयोगकर्ता के माध्यम से) -> बधाई! मुझे मेरा चाहिए
1,"@ Boxxxybabeee [स्वयं को नोट] वह मुझसे प्यार करता है? वह मुझे प्यार नहीं करता? : '[शेल्डन माय बेबी, लव याआआआ <3"
0,उपयोगकर्ता यू पता है मैं luv u लड़की! मैं sum1 in2 yr life 2 नहीं लाऊंगा 2 इसे दयनीय बनाओ मुझे लगा कि यू wl lk sum1 है जो ऊपर रखा गया है
1,उपयोगकर्ता कैसे कॉन्सर्ट था? मैं गुरुवार को अटलांटा शो में जा रहा हूँ!
1,उपयोगकर्ता अपने नए एल्बम के लिए इंतजार नहीं कर सकता
0,अरे बाप रे। मुझे यह स्वीकार करना होगा कि मैं सौंदर्य प्रसाधन का आदी हूं।
0,"पॉवरपॉइंट को समाप्त कर दिया, लेकिन मुझे नहीं लगता कि यह बहुत अच्छा है। जब मैंने ऐसा किया तो मैं बहुत थक गया था। ओ अच्छी तरह से। मुझे स्कूल से नफरत है। बकवास"
1,"उपयोगकर्ता आपका स्वागत है, हमेशा की तरह"
1,वास्तव में इसका उपयोग करने की कोशिश कर रहा है ... इसलिए वह काम पर है और फिर आज रात BFF के Bday के लिए रात के खाने के लिए बाहर जा रही है !!! हैप्पी आवर प्लीज
0,मेरे अनुयायी उतार -चढ़ाव करते रहते हैं। मुझे कौन अनफॉलो करेगा?
1,विश्वास नहीं कर सकता कि यह होनोलुलु में मेरा आखिरी दिन है। काश मेरे पास अधिक समय होता। इस जगह को याद करते हैं।
1,जल्द ही नया ईपी! और वीडियो
1,उपयोगकर्ता हे ddub! लोगो प्रतियोगिता के साथ क्या हुआ?  परिणाम? या क्या आपने कलाकृति की एक ऑनलाइन गैलरी को mk किया था?  बताना ज़रूर
0,मुझे बहुत मज़ा आया था ... लेकिन सब कुछ अंतिम की तरह लगने लगा है।
1,आशा है कि मुझे यह काम मिलेगा!
0,उत्कृष्ट सुजाकू 7 वापस एक साथ वापस आ गए हैं पिछले एपिसोड को आशा है कि यह एक खुश एक है मैं इन वास्तव में लोल शाह के लिए एक चूसने वाला हूं
1,अब वापस काम करने के लिए!
0,मेरे क्यूब में सब अकेले
1,किंग्स द्वीप कोस्टरिन 'यह ऊपर!
0,उपयोगकर्ता awwwwww हमें rai/min/gen और rai/ibi/tom कुछ अन्य समय करना होगा >>
0,"मेरा ""सबसे अच्छा दोस्त"" अजीब अभिनय कर रहा है! :/ मुझे लगता है कि वह एक और दोस्त OMG के साथ मुझे धोखा दे रही है !!!!!"
0,"उपयोगकर्ता; लोग क्यों लिख रहे हैं यह सामान मुझसे परे है, आप लोग मुफ्त में काम कर रहे हैं - यह आक्रामक पढ़ना है"
0,काश हम अपने YouTube उपयोगकर्ता नाम LOL बदल सकते
0,"उपयोगकर्ता को एक iPhone मिला, कोई वीडियो रिकॉर्डिंग नहीं"
0,"भूख, थका हुआ, प्यासा, आज रात लैंकेस्टर में कोई पैसा नहीं। मुझे आशा है कि मेरे पास एक अच्छी रात है।"
0,बस बाथरूम के दरवाजे के हैंडल पर मेरी बांह मारा जो सुबह में एक चोट लगने वाला है
1,"उपयोगकर्ता शानदार, धन्यवाद! मुझे इसकी ही खोज थी"
0,"उपयोगकर्ता यह मुझे एक मैक से डाउनलोड नहीं करने देगा, शुक्र है कि मेरे पास एक दराज में कॉलेज-शासित कागज का एक गुप्त स्टैश था।"
1,उपयोगकर्ता अपने बाल आग पर है
1,उपयोगकर्ता yuuummm मैं मेरे साथ एक बैगेल था
1,"जिम के लिए, बाद में वापस आ जाओ"
1,बस मेरे भतीजे ब्रायन्स स्नातक की पढ़ाई छोड़ दी ... कोच हार्डर ने स्नातक स्तर की पढ़ाई की और लड़के ने यादें वापस लाईं।
0,"क्षमा करें फ़ायरफ़ॉक्स, आपको दुर्घटनाग्रस्त करने का मतलब नहीं था।"
1,ब्रिटेन के शीर्ष दस महल और महलों को देख रहा है। आदमी मैं इंग्लैंड से प्यार करता हूँ ... और यात्रा चैनल।
0,उपयोगकर्ता url - heeeeyyllloooooo ... यह जानकर अच्छा लगा कि आप मज़े कर रहे हैं !!! जहां केविन
0,बस अभी उठा! ताजा हो जाओ। तब पढ़ें!
0,"यह वास्तव में अद्भुत है .. एक टिप्पणी/तारीफ और आपका दिन बेहतर के लिए बदल जाता है। बहुत बुरा इसका लगभग सोते समय, पू"
0,उपयोगकर्ता nay।  उन्हें सेंट पीटर्सबर्ग में देखा। दिमाग। उड़ा रहा है।
1,उपयोगकर्ता बहुत बढ़िया!  वह अद्भूत है। मैं उससे प्यार करता हूं। <3
1,बस डैडी के लिए सलाद बनाया
1,उपयोगकर्ता उपयोगकर्ता और मेरे भाई ..
1,उपयोगकर्ता जो मेरा परिचय भी था
1,केविन बहुत अधिक प्यार करता है जितना मैंने सोचा था
0,मुझे आशा है कि आप बेहतर डीजे महसूस करेंगे
0,"उपयोगकर्ता haha, अच्छी तरह से मैं आज रात में वापस जा रहा हूँ अगर आप शामिल होना चाहते हैं ... * ode में * ऑल-नाइटर्स * फिर से।"
1,"प्यार करता है कि BEP के पुराने गीतों में से एक ऐसे गीत की आलोचना करता है जो सिर्फ ""बूम बूम"" पर जाते हैं और कहते हैं कि वे असली संगीत नहीं हैं"
1,उपयोगकर्ता अरे धन्यवाद! मैं बहुत उत्साहित हूँ coz मुझे कुछ स्टार ट्रेल्स मिल गए! कुछ के रूप में अधिक 15 एक्सपोज़र! खिचड़ी भाषा उन्हें ढेर करने के लिए इंतजार करती है।
0,इसका शुक्रवार! .. लेकिन मुझे कल काम करना है
0,ऊब नहीं पता कि मुझे एक YouTube वीडियो क्या करना चाहिए?
1,मैं आज से बहुत थक गया हूं। अब बस आराम कर रहा है
1,मैं बहुत उत्साहित हूं
1,उपयोगकर्ता मुझे पूछने के लिए धन्यवाद! और आपके लिए हाँ ... अपने महान लेख पर बहुत गर्व है।
0,क्लीवलैंड केवल वीडियो गेम में खिताब जीतता है ...
1,उपयोगकर्ता मैं काम कर रहा था! लेकिन मैंने पढ़ा कि मतदान वास्तव में अच्छा था यह बहुत अच्छा है कि आप अपने सभी कारणों से बहुत सक्रिय हैं!
1,"उपयोगकर्ता url - हा, प्रतीक्षा करें कि अंतिम शब्द क्या कहता है कि मैं नहीं कर सकता"
0,"BESOK KERJA LAGI ... OOOH, मुझे पता है कि अब हर कोई सोमवार से नफरत क्यों करता है !!!!"
1,उपयोगकर्ता
0,व्योमिंग के लिए मेरी छोटी यात्रा से पहले मेरी अंतिम परीक्षा की तैयारी करने की कोशिश कर रहा है (: लेकिन हन्ना मोंटाना के साथ व्हाट्स अप जब Im अध्ययन करने की कोशिश कर रहा है?
0,"मैं फिर से गति नहीं करूंगा, मैं फिर से गति नहीं करूंगा ........ $ के लिए $!"
0,FFFFF HARO कृपया मेरे बिस्तर से रोल करना बंद कर दें। यह असमान नहीं है।
0,"MOD क्लब में उपयोगकर्ता महान शो। आज रात का टमटम याद आ रहा है, लेकिन मुझे उम्मीद है कि आप लोग जल्द ही फिर से खेलेंगे! आराम से लो"
1,मेरे पास नरक बुरी आंखों की दृष्टि है। इस बिंदु पर जहां मैं शायद ही सड़क के संकेत पढ़ सकता हूं-थैट्स क्यों मैं खो जाता हूं
1,अधिक ff# प्यार उपयोगकर्ता उपयोगकर्ता उपयोगकर्ता उपयोगकर्ता उपयोगकर्ता उपयोगकर्ता उपयोगकर्ता
0,Wtf !! मेरे गिटार हीरो पर बटन बदल गए हैं मैं जेसस गर्ल पर विशेषज्ञ कर सकता हूं लेकिन इसके अलग
0,"मेरे पास एक ठंड है, यह ठंडा है और मैं अपने लैपटॉप के साथ सोफे पर नहीं छीन सकता। यह मुझे बहुत दुखी करता है (भी, दयनीय)।"
1,उपयोगकर्ता अच्छी बात है कि आपके पिताजी भी फोटोग्राफी में हैं!  कल एक अच्छा शूट है! अभी शांत मौसम को प्यार करना।
1,@ व्हिटनी के साथ मार्की
0,उपयोगकर्ता यह वास्तव में काम करने के लिए कठिन है .. मुझे इतिहास और भूगोल पसंद नहीं है ।।
0,उपयोगकर्ता हाँ कृपया करते हैं !! मुझे आपकी vids याद आती है
0,"प्लस साइड पर पूरे जोरों पर गर्मियों की सफाई की गई है। जब तक मेरे पास गर्मियों की छुट्टियों की विलासिता नहीं है, तब तक इंतजार नहीं कर सकता"
0,काम पर है
0,एक और दिन और मैं अभी भी नहीं जानता कि क्या कहना है
0,मैं अपने पेट के लिए बीमार महसूस करता हूं ... और मुझे नहीं लगता कि जल्द ही किसी भी समय इसे हल करने की कोई उम्मीद है ...
