0,बहुत ठंड है
0,"उपयोगकर्ता OH 2MRW? हाँ, मैं वहाँ नहीं था, लेकिन शायद अगली बार"
1,उपयोगकर्ता yay शादी के उत्सव के साथ मज़े करते हैं
1,उपयोगकर्ता बहुत धन्यवाद
0,उपयोगकर्ता मुझे लगा कि आप अभी मेरा अनुसरण नहीं करना चाहते हैं।
0,उपयोगकर्ता अर्ल ने कभी जॉय को नहीं हराया।
1,उपयोगकर्ता हे पाब्लूओ लोल। एक सेकंड के लिए मुझे लगा कि आपने कहा था कि आप अभी अनूप के साथ हैंगिन थे।
1,मैं एक पागल व्यक्ति की तरह दिखता हूं।
0,"उपयोगकर्ता हाँ, मैं ichat और इस तरह की चीजों की इच्छा कर सकता हूं, लेकिन मुझे संदेह है कि यह होगा"
1,उपयोगकर्ता मजेदार लगता है।
0,"आज रात पार्टी है !  ... लेकिन पहले मुझे अपना होमवर्क करने के लिए मिला है, हैप्पी बर्थडे कैटरीन। ;पी"
0,अब 2 लोग मारे गए
0,Jeez मैं बहुत याद किया जबकि इंटरनेट एक्शन grr xxx से बाहर था
0,मैं एक शादी में जाना चाहता हूं।
0,गुड मॉर्निंग ऑल! Im अभी भी मैनी के 2min ko से पिछली रात से उच्च है!
0,"उपयोगकर्ता हाय! मेरा नाम Irene im स्पेनिश है, मैड्रिड में आपका शो बहुत शानदार था कि शो के अंत में क्या हुआ ??"
0,गर्मी शुरू हो गई है और मुझे ठंड है
1,कुछ और सूरज पकड़ने जा रहे हैं और फिर चाय के लिए जाएं
1,"उपयोगकर्ता मैंने इसे बीटा में लिया, मैं विफल रहा (एक संकीर्ण मार्जिन द्वारा) मुझे इसे खोजने दें, लेकिन यह कौशल के लिए भी एक महान परीक्षा है"
0,काम में।  बिना किसी दाई के साथ लेफ्ट सी पीछे
0,"घर, शहर 2moro, गुरुवार को उड़ान 2 एनएम। बस सामान के बारे में सोच ..."
0,उपयोगकर्ता * केवल यह सुनिश्चित करने के लिए फोन की जाँच करता है कि मैं इसे याद नहीं किया है * क्या आप गंभीर हैं?
0,11 के बाद मेरे लिए उपयोगकर्ता nothin i gotta werk 2nite
0,मुझे लगता है कि नृत्य हास्यास्पद रूप से अनावश्यक हैं।
0,"उपयोगकर्ता मुझे पता है, लेकिन मौसम की समाशोधन और मान लीजिए कि अच्छा सत और सूरज है"
1,मैं कुछ रयान बुएल को तरस रहा हूँ। LOOOOVEE HIMMMM।
1,अंत में इस हॉस्टल से बाहर की जाँच कर रहा है और वापस इंग्लैंड जा रहा है !!
0,"उपयोगकर्ता धन्यवाद, बेक। आईडीक्यू थिंक टैंक और बबल और कल बोलने के लिए तत्पर था लेकिन अब सवाल से बाहर"
0,उपयोगकर्ता मुझे पता है ... मैं सिर्फ कामना कर रहा हूं
0,और अभी भी मेरे FAV अभिनेताओं से कभी उपयोगकर्ता उपयोगकर्ता उपयोगकर्ता उपयोगकर्ता से प्रतिक्रिया प्राप्त करने की उम्मीद है
0,उपयोगकर्ता उपयोगकर्ता ओह नोज़! मैं इसे इस सप्ताह एडिनबर्ग के माध्यम से नहीं बना पाऊंगा!
0,उपयोगकर्ता दुर्भाग्य से मैं यह सुनने के लिए नहीं था कि यह पहले हाथ से उपयोगकर्ता द्वारा रिटोल्ड है
1,उपयोगकर्ता आपके लिए स्टोर में एक आदर्श शाम की तरह लगता है! आनंद लेना!!
1,उपयोगकर्ता महान! मेरी माँ कहती है कि वह असली है!
1,"मेरे पसंदीदा पास्ता जगह मिमी धूप, शराब और पास्ता स्वर्ग में दोपहर के भोजन के लिए बंद"
0,"उपयोगकर्ता सॉरी शील्स, इस बार इसे शुभकामनाएं नहीं दे पाएंगे, थो!"
1,"उपयोगकर्ता उपयोगकर्ता आर/टी के लिए धन्यवाद, मुझे उम्मीद थी कि मेरे पास कुछ * उत्तम दर्जे का * अनुयायी हैं"
1,उपयोगकर्ता yay बहुत बहुत धन्यवाद जेनी!   क्या आपको पता चल जाएगा कि क्या उर ऑफ़र XXX पर यू लेने की आवश्यकता है
1,उपयोगकर्ता बहुत अच्छा !!! Thanx एक बहुत #ec09 #educamp
1,उपयोगकर्ता हे - मुकदमा वापस आ गया है!
0,उपयोगकर्ता नाह मुझे नहीं लग रहा था कि हमें वास्तव में इस गर्मी में उन्हें देखने की जरूरत है
1,"Coles ब्रांड कप नूडल्स, FTW!"
0,अशर मैं आपको देखकर बहुत दुखी हूँ!
0,यह डांग ... लगता है कि मुझे इस सप्ताह के अंत में काम करना है वे हमेशा अंतिम समय में ऐसा करते हैं! n मैं वास्तव में अपनी बात का अभ्यास करने के लिए कुछ समय चाहता था
1,उपयोगकर्ता yup। 6 से पहले जो कुछ भी लंबे समय तक खाएं। उसके बाद .. पानी को छोड़कर कुछ भी
0,उपयोगकर्ता क्षमा करें!
1,मेरे डेस्कटॉप से ​​मॉनिटर को लैपटॉप में प्लग किया ताकि मैं 2 स्क्रीन के साथ वीडियो को आसान तरीके से संपादित कर सकूं
1,#FollowFriday उल्लेख के लिए धन्यवाद; उपयोगकर्ता उपयोगकर्ता उपयोगकर्ता उपयोगकर्ता उपयोगकर्ता उपयोगकर्ता उपयोगकर्ता उपयोगकर्ता #ff
1,"बस कुछ चाय पाने के लिए तहखाने के कार्यालय से बाहर निकाला गया और भुना हुआ ट्रिना की गंध मिली है, रात के खाने के लिए खाना पकाने के लिए, अब काम करने के लिए वापस।"
1,उपयोगकर्ता का धन्यवाद शुक्रवार के लिए फिर से एक अच्छा सप्ताह है!
1,डेवलपर्स पर आओ ... मैं इसे बढ़ावा देने में मदद करूंगा ... मैं झूठ बोल रहा हूं-मैं झूठ बोल रहा हूं ... योग्य! फॉलोफ्राइड सिस्टम्स मैनेजमेंट ऐप #FFSMA
1,अब मेरी स्क्रीन गंदगी की तरह दिखती है। लेकिन मैं अभी भी इससे इंटरव्यू कर सकता हूं
0,उपयोगकर्ता awwww अच्छी तरह से मुझे बताएं कि क्या आपको मदद की ज़रूरत है!
1,वू बेबीसिटिंग और आगे बढ़ते हुए पूरे हफ्ते फिर अगले सप्ताह के अंत में मैं इतना मजेदार हूं कि मैं इंतजार नहीं कर सकता!
0,उपयोगकर्ता Awwww! तुम्हारी हिम्मत कैसे हुई!!!
0,अचानक एक अंडे मैकमफिन और एक बड़ी कॉफी की लालसा! मेरा 9 साल का एक और दो घंटे तक सोता है ...
0,बस घर गया और अभी भी HW उपयोगकर्ता है मैं बहुत खुश हूँ आपके बैककेक
0,"कार सेवित हो गई, लेकिन उम्मीद है कि बहुत लंबे समय तक नहीं।"
0,कल तक सभी को ट्वीट नहीं किया जाएगा
0,उपयोगकर्ता क्या हुआ?  दुखी मत हो !! मुझे विषय दें!
1,"उपयोगकर्ता Awww धन्यवाद ... ओह रुको, आप मेरे बारे में बात नहीं कर रहे हैं। दामित!"
1,"वर्क टिल 5, जिसका अर्थ है ट्विटर/फेसबुक/और यूटुबिन 'ऑल डे"
0,पेडल सत्ता से बाहर चल रहा है। इस चीज़ के लिए एक एसी पावर स्रोत प्राप्त करना होगा। इतनी आसानी से बैटरी की बैटरी
1,उपयोगकर्ता हाय आप कैसे हैं?
1,#flylady लॉनमदर वापस आ गया है - याय! जब मैं लौटता हूं तो स्कूल से बच्चों को लेने की जरूरत है - पेपर अव्यवस्था
0,एक बुरे मूड में एक महान दिन नहीं है
1,शुभरात्रि हां। सुरक्षित रूप से ड्राइव करें और अच्छी तरह से सोएं
1,उपयोगकर्ता ओह गुडी! एक और पनीर प्रेमी! क्या आप सभी प्रकार के पनीर में भी नीले पनीर में हैं?
0,मैं भी ऊब गया हूँ ... काश मैं वापस उपयोगकर्ता के पास जा सकता
0,"मैं वास्तव में याम फ्राइज़ चाहता हूँ मुझे असली रात्रिभोज, bleh याद आती है"
0,"आह ... रॉकेट खो गए, फिर केल्टिक्स भी खो गया।"
0,सन + द होलवेज़ एल्बम = ब्लिस। शर्म की बात है
1,"चूंकि मैं WJHL को हवा में देखता हूं, इसलिए मुझे ""केबल कंट्री"" नहीं मिल सकता है।  इसके बजाय ""एंटीना देश"" खंड का कोई मौका?"
0,पूल क्यूज से वापस बाहर बारिश हो रही है
0,"अरह, कल रात। क्या रात को यह पसंद आएगा। लेकिन अब के परिणाम महसूस करते हैं।  एक्स"
0,मेरे पास यह तीव्र सिरदर्द है।
1,उपयोगकर्ता असंभव! मैं तुम्हें हंसाऊंगा
1,"सबको सुप्रभात!!!! एक ओहके रात को अच्छा नहीं लग रहा था, लेकिन यह पारित हो गया है मैं अब बहुत बेहतर महसूस करता हूं। बस थक गया।"
0,मूर्खतापूर्ण सपनों को हिलाता है .... मैं कसम खाता हूं कि एक सपना प्रगति के महीनों को बर्बाद कर सकता है ...।
1,ट्विटर पर व्हाट्स अप!?  चलो इसे कबूतर करते हैं!
1,URL इसे देखें और मुझे बताएं कि आप नई नवीनीकृत वेबसाइट के बारे में क्या सोचते हैं!
1,उपयोगकर्ता हाय लीलैंड।  आपका जन्मदिन प्रार्थना करना आशीर्वाद और परिवार और सब कुछ अच्छा है।  शानदार दिन हो!
1,"उपयोगकर्ता ने अभी तक एफबी नियम नहीं देखे हैं - बाद में इसकी जांच करेंगे। फिर किसी ऐसे व्यक्ति से पूछें जो वास्तव में इसे जानता है, और आपके पास वापस आओ"
1,आज एक शॉपहोलिक के गॉइन वॉचिन कन्फेशन ... अगर हन्ना अपने फोन का जवाब देगा !! X X
0,"हाँ। मैंने सुना है कि हर उदास गीत ट्विटर है। और यह कहना सुरक्षित है, कि मैं दुखी से बहुत बदतर हूं। मैं सालों तक सोना चाहता हूं"
0,उपयोगकर्ता मैं दुखी हूँ मैं आप लोगों के साथ शामिल नहीं हो सकता
1,आप नीले रंग का महसूस करने से कैसे निपटते हैं? सुझाव? आज कुछ विचारों की जरूरत है
1,मोर्निन 'लोग! और crikey क्या एक भव्य दिन!
1,"उपयोगकर्ता आह, मैं चाहता हूं कि मैं कर सकता था, लेकिन मुझे नहीं लगता कि मैं उनकी अच्छी किताबों में रहूंगा, हालांकि मेरा आईफोन ले रहा है"
1,मेरे पीछे आओ!!!!
1,"उपयोगकर्ता, क्योंकि यह आपके खो जाने पर डिलीवरी में मदद करता है"
1,"उस इंटरनेट पर उपयोगकर्ता, URL"
0,उसकी सोच ……।
1,गुडनाइट ट्विटरलैंड लोल में मेरे सभी twittheads
0,अगर वह मुझे 3 दिनों में नहीं करता है ... क्या मैं बस उसे भूल जाता हूं .. (#zenjar के माध्यम से)
1,बस मेरे पहले लेख में भेजा गया।  यह याद किया।
1,उपयोगकर्ता aww मुझे बताओ कि यह कैसे जाता है और सभी को हाय कहते हैं !!
0,"Grrrr वापस सोने के लिए नहीं जा सकता तो मुझे अब क्या करना चाहिए, क्या यह गर्म है?"
0,"आज रात लॉन्ड्रोमैट में जाने के लिए जाता है, जबकि उसके ससुराल वाले बड़े लड़कों को एक सुपर कूल मूवी में ले जाते हैं = भयानक के विपरीत"
0,उपयोगकर्ता मुझे क्षमा करें
0,पूरी रात काम करने के लिए एक दिन की थकाऊ ...
1,URL - कृपया इस छोटे से कुत्ते की मदद करने के लिए www.islanddog.org पर जाएं ...
0,"एफएफएस, कैम्बरवेल के बाहरी इलाके में जा रहा है। बर्डवुड एक्सचेंज मिला। कोई और ADSL2+ नहीं"
1,डॉल्फ़िन उनमें से बहुत से हमें बोते हैं
1,"उपयोगकर्ता हां, एक minuten में। बस फिनिशिंग टच को 'दा न्यूज थिंग एक्स में जोड़कर"
1,तो खुशी है कि चाचा रे रे और केटी को आज क्रॉसविंड परिवार के साथ यात्रा करने के लिए मिला (इसका अच्छी तरह से हिस्सा)।   मम्मोम के साथ समुद्र तट पर गया!
0,"जहां सभी शांत LiveJournal लोग जाते हैं ?? मुझे लगता है कि मैंने उन सभी को खो दिया था, जबकि मैं हर समय उपयोगकर्ता नाम बदल रहा था"
1,मेरे बच्चे से बात करना जो मुझे पसंद है
1,यदि आपके पास सर्दियों में गर्मी पंप या कुछ है तो उपयोगकर्ता निश्चित रूप से आगे बढ़ने के लिए अच्छा है।  यह है कि मैं कैसे चीजें कर रहा हूँ।
0,मेरी झटका मशाल टूट गई है यह एक असली बुमेर है
0,बहुत से लोगों को यह एहसास नहीं है कि संरक्षक के पास भी बुरे दिन हैं
0,"मुझे अपने कागजात खत्म करना है। ओह, कृपया।"
0,काम भयानक है ... यह 90 डिग्री और पुराने लोगों की कारों की तरह है
0,उपयोगकर्ता मैं पूरी तरह से झपकी लेता अगर मैं पहले से ही कैंपस में आधे रास्ते पर नहीं था जहां मुझे फिल्म करने की आवश्यकता है! अगर मेरे पास मेरी बाइक होती तो यह एक अलग कहानी होती
1,उपयोगकर्ता मैं में हूँ
0,"#F1 शापित चीज़ में से अधिकांश को याद किया गया रिकॉर्ड नहीं था। फिर भी, ज्यादा याद नहीं किया। अच्छा किया रेड बुल, बधाई"
1,उपयोगकर्ता कुछ कठिन था
1,उपयोगकर्ता यह बेहतर होगा TMRW! अगर आपके पास वही बात है तो आपको अभी भी कठिन समय लगता है। कुछ आराम करने की कोशिश करो!
1,उसके लिए उपयोगकर्ता चीयर्स
1,उपयोगकर्ता बधाई दोस्त
1,"उपयोगकर्ता मैं एक सप्ताह दक्षिण टाइनसाइड आर्ट स्टूडियो में कर रहा हूं, फिर एक सप्ताह कॉलेज में आपने क्या किया?"
1,"मेरी पत्रिका को अपडेट करने का समय। रिकॉर्ड करने के लिए बहुत सारा सामान मिला। शुभ रात्रि, ट्विटर। शुभ रात्रि, मीका (जहां आप कभी भी हैं)।"
1,उपयोगकर्ता मेरे लिए अपने कुत्ते को नमस्ते कहते हैं
1,उपयोगकर्ता thechedhouse www.thatched-live.co.uk/ मजेदार की तरह दिखता है। हमारे पीछे आने के लिए xd thx
0,#inaperfectworld यह टीटी तब तक #iranelection नहीं कर सका जब तक कि नाटक बाहर नहीं निकला। लिमिटेड के बारे में बात करें। attn। स्पैन! शर्म के लिए !!!
0,बहुत अच्छा नहीं लगता!
1,"उपयोगकर्ता क्षमा करें, मैंने आज सुबह उनमें से अंतिम का उपयोग किया"
1,उपयोगकर्ता बैटलफ्रंट कमाल है!  मैं बैटलफ्रंट के लिए वोट करता हूं।
0,उपयोगकर्ता मैं अभी घर आना चाहता हूं।
1,"उपयोगकर्ता मैं वास्तव में कन्या और लियो दोनों हूं, क्योंकि मेरे जन्मदिन के दिन और समय के कारण।"
1,अंत में होमवर्क गुडनाइट खत्म करने के बाद कुछ नींद लेना
0,"मौसम दयनीय है .. छोटा आदमी सो रहा है, इसलिए मेरी आँखें भी बंद करने का मेरा अवसर! नींद = इन दिनों मूल्यवान! Mwhoehaha"
0,उपयोगकर्ता कोई Azeroth अर्थव्यवस्था या DAILIES अपडेट आज नहीं है?
0,"स्टोर में एक दुखद दिन, शेली हमें छोड़ रहा है"
0,"उपयोगकर्ता हाँ! कम से कम thats क्या im मान रहा है। इस तरह से कंपनी इसके उपयोग को अवरुद्ध कर देगी, क्योंकि यदि आप इसे खो देते हैं तो वे अभ्यस्त नहीं होंगे।"
1,उपयोगकर्ता मुझे थाईलैंड ले जाओ! हमें बैठकर योजना बनाने की जरूरत है
0,व्यापारिक कार्य -कार्य
1,यह रिचमंड वा चिली कुक ऑफ में एक खूबसूरत दिन था ... हाँ हाँ
1,उपयोगकर्ता रिची !!!  चीजें अच्छी हैं।  आशा है कि आप अच्छे हैं।  मैं अब एक अनुयायी हूं।
1,मेरे फ़ोटोशॉप कौशल को पुनर्जीवित करना
