0,बहुत ठंड है
0,उपयोगकर्ता उपयोगकर्ता कम से कम y'all niggas इतने अच्छे गधे के दिन पर काम नहीं करते हैं
0,"उपयोगकर्ता lolol मेरे खराब tiff मैं कसम खाता हूँ मुझे आपका ट्वीट नहीं मिला, लेकिन हाँ im vegas के लिए अभी भी def !!! Yaaayyyy"
1,आई लव यू कॉनन
1,उपयोगकर्ता धन्यवाद Coolie लड़की .. LOL
1,"उपयोगकर्ता SLC, UT में आपके शो में बैकस्टेज पास करने का कोई भी मौका है?"
1,"उपयोगकर्ता आप हमारे आने पर हमारे नए ब्लैक वन, न्यू व्हाइट वन, या बचाव पूर्व-बैटरी हेन्स में से एक का नाम दे सकते हैं। जो आप लेना चाहते हैं, लें!"
0,URL - इसकी बारिश ... और मेरा चाक फेस्टिवल अभी शुरू हुआ
1,उपयोगकर्ता c'moon !! विल्को+जेफ बेक?
0,उपयोगकर्ता क्या आपको लगता है कि एड के पास ट्विटर है? मेरा दिल यह जानकर खाली है कि वह सोमवार को वहां नहीं होगा
1,उपयोगकर्ता मैं अच्छा हूँ। स्केल और मेट्रो के लिए रुक गया। अब मैं ओहियो के लिए रवाना हो गया हूं
1,मेरे किराए मुझे बुधवार को कॉन्सर्ट में जाने दे रहे हैं
0,"मेरे स्तन गुब्बारे लगा चुके हैं, और मेरे कूल्हों के साथ -साथ ... मुझे नहीं पता कि यह कैसे है, मैं बढ़ रहा हूं।  मेरी कमर वही है, डब्ल्यूटीएफ !!"
1,आज रात मेरे परिवार के साथ उपयोगकर्ता डिनर ... आज काम करने के लिए धन्यवाद।
1,मैं मुस्कुराता हूं क्योंकि मुझे पता नहीं है कि क्या चल रहा है
1,उपयोगकर्ता को प्रोत्साहन के अपने तरह के शब्दों के लिए बहुत बहुत धन्यवाद।  आप आज मेरे लिए एक वास्तविक आशीर्वाद रहे हैं!
1,उपयोगकर्ता यदि आप havent तो आप अवज्ञा कर रहे हैं तो
0,उपयोगकर्ता हाँ फुकता बेकार है !!!!
0,घर पर रहो>। <यह बारिश का दिन अकेला महसूस होता है
0,7 पर काम करने के लिए वापस जाने का समय!
0,एक सप्ताह या डेढ़ सप्ताह पहले उपयोगकर्ता
1,मान लीजिए कि अभी चल रहा है ... लेकिन इसका सिर्फ गर्म रास्ता है..गामना आज रात तक इंतजार करें
0,वाया मोनिक मऊ पिंडाह उरल कहते हैं
0,क्या कोई जीवित है?
1,"उपयोगकर्ता lol बस हमें सभी $ 1 भेजते हैं, लेकिन केवल हम शीर्ष पर हैं"
1,नए संगीत में हम भरोसा करते हैं ... रेडियो पर 1 एएसटीए एस्कुल्ट ईयू एकम ...
0,#Goodpussy आप शहर की फिल्म लोलोल में उस लंबे गधे सेक्स को देखेंगे .... मुझे लगता है कि मैंने अभी खुद पर बताया था
1,उपयोगकर्ता सिर्फ एक स्पॉइलर। यह पूरी तरह से बेकार है। इसे बर्बाद करने के लिए क्षमा करें
1,उपयोगकर्ता ध्यान? चॉकलेट सॉस के साथ? यह 'om' #omnomnomnom की तुलना में अधिक 'NOM' लगता है
0,काश मैं अपनी आँखें झपका सकता था और सब कुछ अनपैक हो जाता!
1,उपयोगकर्ता hahahahaha मैं चाहता हूँ कि यह वास्तविक था = p
0,यह स्नान बहुत सुखद नहीं था दुर्भाग्य से यह ठंडा हो गया लेकिन अब गर्म हो गया। im एक जम्पर नहीं पहने जो दिखाता है कि im ठंडा नहीं है: ओ कैसे
1,आई लव यू नाइटी नाइट <3
0,मेरा टीवी केबल क्षतिग्रस्त हो गया था
1,"उपयोगकर्ता बस काम से घर गया और भोजन और शराब के साथ घर पर आराम कर रहा था, शायद शराब यू एन yr मम को थोड़ा शांत करने में मदद करेगी"
1,दोपहर में 3 और माँ ने अभी भी प्रोजेक्ट लंच पर काम करना शुरू नहीं किया है !! #Momfail !!
0,सैट पर काम ... क्या यह किसी भी अधिक अनुचित हो सकता है
0,उपयोगकर्ता nope
0,हैलो और हाय इसका एक दिन में से एक आप अंदर रहते थे क्योंकि यह बरसात है
0,"इसके अलावा, मैं चाहता हूं कि मेरा भाई उसे ढेर कर देता है।"
0,"उपयोगकर्ता मुझे यकीन नहीं है, लेकिन यह वास्तव में बेकार है .... उदास और दुर्भाग्यपूर्ण ..."
1,"उपयोगकर्ता ओह, यह कूल मैं नहीं जा रहा हूँ या कुछ भी"
0,"उपयोगकर्ता नहीं, हनी खदानों को भी! Sighhhhhhh। JHB फ्लू चूसना है। जब हम बेहतर होते हैं तो चलो ड्रिंक करते हैं, हाँ?"
0,Dunno क्या करना है ...
1,उपयोगकर्ता स्वादिष्ट प्रकार
1,"उपयोगकर्ता मैं पढ़ता हूं कि ""चिकन म्यूजियम"" के रूप में .. मुझे हंसाया - ड्रमस्टिक्स लोल में एक नया आयाम जोड़ता है ... एक महान दिन है"
1,क्विनी के साथ मेह बिस्तर में लेट।
0,"उपयोगकर्ता ब्लेक, यह अपना पिरामिड बनाने के लिए बाहर निकलता है।"
1,उपयोगकर्ता एक पिल्ला मिलता है !!  काम करने से ज्यादा मजेदार !!!
1,"उपयोगकर्ता मैंने आज ""द क्लीन"" शुरू किया। मैंने भी आधे बहुत बड़े बदलावों में धूम्रपान में कटौती की है, लेकिन दिन 1 वास्तव में आसान था"
1,उपयोगकर्ता आपसे मिलकर अच्छा लगा। बायो दिलचस्प लग रहा है आपके साथ ट्वीट करने का आनंद लेंगे।
0,शिकागो में है। किसी भी बेलुगा व्हेल को न देखें।
0,कोच पर। फ्रांस से घर जा रहे हैं यह उबाऊ है और मुझे अपने दोस्तों की याद आती है: |
1,उपयोगकर्ता कॉलर हड्डी भ्रूण पूरी तरह से सामान्य हैं।
0,उपयोगकर्ता याय। मुझे भूख लगी है।  @ Assante जाल में मज़े कर रहे हैं। उपयोगकर्ता बिल्कुल। पागल बकवास। ज़ोर-ज़ोर से हंसना।
1,क्षमा करें ... मैक्सिकन ट्रेन को लंबे समय तक नहीं चलना चाहिए था और मैं भी करीब नहीं आया। डांग फैमिली फन नीइट्स
0,"हर कोई सभी अराजक हो जाता है जब बारिश होने लगती है .... एक और नोट पर, मेरे जूते भीग गए"
0,"जीन्स की मेरी पसंदीदा जोड़ी नहीं मिल सकती है, भले ही मैं अभी कहीं नहीं जा रहा हूं"
1,हम्म और क्या बेहतर है 1/144 या 1/100 स्केल? या यू कुछ बेहतर या महान है? मुझे 2 पसंद है कुछ गुंडम रोबोट मॉडल खरीदें शायद 2: पी
1,काम से दूर .. मेरे पति के साथ दोपहर के भोजन के लिए 2go
1,"उपयोगकर्ता हां, यह एक अच्छा दिन है। दक्षिणी यूटा से भी प्यार करें। विशेष रूप से गिरावट/सर्दी के दौरान।"
1,कुकीज़ और डोनट्स पर शाम 6 बजे तक और फिर कुछ कॉफी के लिए जेसन को देखना
0,"ugghh .. बीमार और फाइनल, भी"
1,उपयोगकर्ता उपयोगकर्ता यह मजेदार है यदि आप इसे उस गीत उपयोगकर्ता के साथ करते हैं जिसे आप इसे प्यार करते हैं।
1,दादा -दादी के लिए मेरे रास्ते में कार में
0,बर्थडे पार्टी के लिए रवाना
1,Baccalao खा रहा है
0,"उपयोगकर्ता पुस्तक .... ओह पुस्तक ने मुझे कई, कई आँसू बहाए"
0,बिस्तर का समय huft मेरे पति कल छोड़ रहा है मैं अकेले होने से नफरत करता हूं
0,उपयोगकर्ता हमारे पास पांच दिन बचे हैं
1,उपयोगकर्ता ... पहेली को पूरा करने के लिए ..!  या शायद अधिक टुकड़े ...
1,"लंबे सप्ताहांत के लिए पहाड़ों में केबिन में जा रहे हैं, कोई इंटरनेट सिर्फ भालू, कोयोट और बड़े गिलहरी नहीं है"
0,पूरे दिन एक फोन नहीं होना अजीब था कि मैं इसके बिना कभी घर नहीं जा रहा हूँ!
1,मैकप्रो के रैम को अपग्रेड करना शुद्ध मज़ा है। रिसर कार्ड FTW
1,उपयोगकर्ता आह मैं सिर्फ स्कूल और allllll को नहीं जानता। और मैं पृष्ठों को ताज़ा करता हूं जब मैं भी ऊब जाता हूं। ट्वीट मनोरंजक हैं
1,"URL - केला, तरबूज, सेब, और गाजर .. स्वादिष्ट !!"
1,अच्छा हास्य एक साथ हंस सकता है।
0,अगर मैं अभी एक रिश्ते में होता तो मैं उसे फोन करता और उसे कुछ भोजन लाने के लिए कहता ... मेरा पेट दर्द होता है
0,उपयोगकर्ता मैं अभी तक खेलने के लिए अपनी डिस्क प्राप्त करने में सक्षम नहीं है
1,उपयोगकर्ता महान!  उपयोगकर्ता और मेरे पास कुछ पीएचडी पद हैं
0,मुझे आश्चर्य है कि अगर ईरान अब अपने स्वयं के एक मिन स्क्वायर एपिसोड प्राप्त कर रहा है
1,स्पाय/न्यूटर प्रोजेक्ट पर काम करना
1,रेमन के लिए आ रहा है! हम स्मोकिन 'इक्के देख रहे हैं।  - URL
0,उपयोगकर्ता उपरोक्त में से कोई नहीं? उपरोक्त विकल्प में से कोई भी नहीं है।
0,Url मैं एक नया टैब खोलता हूं और मैं यह सी करता हूं
1,जिम जा रहा है; खरीदारी; एक तैराकी पार्टी के लिए; फिर एक युगल दोस्तों के साथ बाहर!  एक दिन बचा !!!
1,मेरी माँ के साथ एक dninner के लिए बाहर
0,उपयोगकर्ता को डीएचएस के लिए लिंक नहीं मिल सकता है ...
0,#Dontyouhate कैसे यू को पुराने चैपल शो को देखना है
1,उपयोगकर्ता अपने sooo सुंदर एस्टेले
1,आज रात एक अच्छी रात थी।
0,"आज एक ए एंड आर ने कहा ""अगर आप स्वैग के लिए प्रार्थना करते हैं, तो 'पॉप कल्चर गॉड्स' इसे प्रदान करेगा और यू अप को उड़ा देगा"" ... Awwwh लानत है ... तो यह कैसे काम करता है!"
0,"बस बिस्तर पर जाने के लिए तैयार हो रहा है, आशा है कि आज कल से बेहतर है"
1,उपयोगकर्ता और उपयोगकर्ता सुबह पिल्ले! आने के लिए धन्यवाद। जल्द ही आप पर भौंकने के लिए fwd देखो !!  यह ट्विटर कुत्तों के पास जा रहा है!
0,"आज व्हाइट कैसल में गया, जब मैं AZ पर वापस आऊं तो pics होना चाहिए। गर्मी के बारे में सोचने के लिए आश्चर्यजनक है जब आप इसके साथ अपमान करते हैं"
0,उपयोगकर्ता उपयोगकर्ता सौदा हमेशा मेरी खरीद के बाद होता है। मर्फी की खरीदारी कानून।
0,उपयोगकर्ता और आशा है कि आप बेहतर महसूस करते हैं कि यह दिखावा करने की कोशिश करें कि जॉन केवल मजाक कर रहा था! (मदद कर सकते हैं) ;-) हाहा
0,अरे नहीं ... #Iphone ने #iranelection को पार कर लिया है - यह परेशान है।
1,आज सुबह साइकिल पर एक और 24 मील की दूरी तय की। और डॉल्फ़िन को सर्फर्स के साथ मस्ती करते हुए देखने को मिला।
0,सुप्रभात दुनिया!! आज का एक अद्भुत दिन .. बस b/c मैं जाग गया! [लेकिन मेरा गला अभी भी दर्द होता है!] लेकिन कोई दर्द नहीं ... कोई लाभ नहीं! हा!
1,उपयोगकर्ता मैं आपको कल ऑक्स पोस्टर लाऊंगा
0,* आह* इस ब्लॉग पोस्ट को पोस्ट करने के लिए उत्सुक नहीं है।
1,"अरे, हे, हे ट्विटरलैंड!  मुझे यह पूरा दिन याद आया: \ _ आप कैसे हैं? मुझे अपने ड्राइवर टेस्ट पर मंजूरी दी गई थी!  वी! \ o/"
1,बस कैरोलिन और रीनाआ के साथ बाहर घूमने से वापस मिल गया
0,URL - स्वाभाविक रूप से घुंघराले बाल
0,"सुनने के लिए क्षमा करें, Jisko S/W कि शक्तियों को बंद करना पड़ सकता है"
1,FF उपयोगकर्ता उपयोगकर्ता उपयोगकर्ता उपयोगकर्ता उपयोगकर्ता सुंदर ट्वीटर हमेशा XX ट्वीट करने के लिए एक खुशी
0,"बहुत बीमार है। आश्चर्य होता है कि कब बेहतर लगेगा। चमत्कार जब भाग्य बदल जाएगा। दूसरे शब्दों में, HappyCat खुश से बाहर चला गया है"
0,उपयोगकर्ता मुझे पता है कि मुझे लगता है कि '' ब्लैंक '' भी मुझे पसंद नहीं है।
1,उपयोगकर्ता मैं इसे सिर्फ यह देखने के लिए सुनूंगा कि क्या आता है। ट्रैफ़िक में लोगों को छोड़ने से बाहर निकलने वाली हवा को सुनने के लिए।
1,vamos एक escuchar एक मिस उपयोगकर्ता
1,उपयोगकर्ता !! वहां आप हैं
1,"गुड लक, जोशुआ। मुझे पता है कि आप मुझे गर्व करेंगे।"
0,"उपयोगकर्ता उपयोगकर्ता हां, बेरी पर बस कुछ स्कफ ..."
1,बिस्तर पर .. एक बार के लिए एक उचित समय पर ..
1,"मैंगो को बचाओ! Â मैंगोस खाने से वे बहुत स्वाद लेते हैं! उनमें से एक खट्टा-ईश था, हालांकि O.O url"
0,गंभीरता से ... यह अभी भी केवल मंगलवार है?
1,उपयोगकर्ता आप जाते हैं! क्या यह अकादमिक था?
0,बस एहसास हुआ कि मैंने अपना आइपॉड घर पर छोड़ दिया। इसलिए मैं काम पर उपयोगकर्ता को गाने के लिए नहीं सुन सकता
0,उपयोगकर्ता हम आपको भी याद करते हैं।  आशा है कि आपके पास एक व्यस्त दिन है इसलिए यह जल्दी से चला जाता है
1,उपयोगकर्ता योग्य आप greaaaat दोस्त हैं।  EU TE AMO MUITO!
1,खैर यह बहुत मजेदार था।  खुशी है कि मैंने इसे खेल के अंत को देखने के लिए समय पर वापस कर दिया।  अब मुझे कुछ आराम करने की जरूरत है।
0,क्या यह पास से पास/नो पास से एक ग्रेड में बदलना है ...।
1,उपयोगकर्ता जितना अधिक हो!
1,एक और ट्विटरर के माध्यम से उपयोगकर्ता - यादृच्छिक मुझे लगता है।  और मैं ऑटो पायलट में ज्यादा नहीं हूं
1,"हैरी पॉटर बाद में स्काई फैमिली एचडी पर है - डैनियल रैडक्लिफ को प्यार करने वाला, वह देख रहा है"
0,बकवास की तरह लग रहा है !!!!!!!! बस घर जाना चाहते हैं
1,उपयोगकर्ता मैं वहाँ रियो में था ... भगवान आपके जीवन और परिवार को आशीर्वाद दें!
1,यह बहुत संभव है कि मैं अगले कुछ घंटों के भीतर ए/सी वापस आऊंगा! 8 दिन जब तक हम 'Roooooooo' के लिए नहीं निकलते!
0,"उपयोगकर्ता ने भारत में इसकी गर्मजोशी से खुशी जताई - यह वास्तव में होना चाहिए, यह नहीं होना चाहिए? कल्पना का उपयोग करेंगे;) उपयोगकर्ता - बस मेरी गर्मी पर रखो !!!"
0,इसलिए जैसे मैंने पहले एक सफेद तितली देखी थी और मैं ऐसा था जैसे 'इसका मतलब है कि किसी की मृत्यु हो गई' तो एक बार जब मैं घर आया तो मुझे पता चला कि मेरी गॉडमदर मर गई
1,पहली बार ट्विटरिंग और सोच रहा था कि यह सब गुस्से में क्यों है।
0,'वैली ऑफ द डॉल्स' पढ़ना - प्यार करता था प्यार करता था - लेकिन देर रात में एक ताजा किताब शुरू करना पसंद नहीं है
0,"उपयोगकर्ता मैं आपकी या मेरे कार्यों की निंदा नहीं कर रहा हूँ, लेकिन मैंने इसे कुछ बार देखा है"
0,"उपयोगकर्ता की तरह लग रहा है कि iTunes स्टोर उस कष्टप्रद 8001 त्रुटि हो रहा है, इस समय इसे डाउनलोड नहीं कर सकता है"
1,चमकदार सुबह।
1,उपयोगकर्ता मुझे लगा कि वह था। यह करेन है वैसे।
1,उपयोगकर्ता का मतलब है कि 'कोई' शायद थोड़ी परेशानी में पड़ रहा है
