0,बहुत ठंड है
1,Fkj; lsdkfj d: यह वास्तव में आराध्य है
1,"उपयोगकर्ता क्षमा करें, बस किसी की परिभाषा को साफ करने के लिए, क्योंकि आप थोड़ा भ्रमित हो सकते हैं। कोई भी = sydneysider haha"
0,स्टीव ने आज मेरी भावनाओं को चोट पहुंचाई और उसने चॉकलेट को मेरे हाथ पर रगड़ दिया और मुझे एक प्रीस्कूलर कहा।  ज़ोर-ज़ोर से हंसना। *शावना*
0,उपयोगकर्ता ओह क्योंकि जब मैंने वीडियो देखा तो मैंने उन्हें बिल्कुल नहीं देखा
0,ट्वीट ट्वीट। अभी ऊब गया है
1,उपयोगकर्ता दुख की बात है नहीं !!  लेकिन मुझे पता है कि कुछ असली मुसोस ... क्या यह काफी अच्छा है? ;-)
0,उपयोगकर्ता duh मेरे जैसा मिलता है !!!! LMAO !!!! Ummmmm मैं बैंगनी बारिश देख रहा हूँ ... जब मैं बीमार pnuemonia हूँ तो मैं सभी पुराने गंदगी को बाहर निकालता हूँ
1,"समर प्लान इंटर्नशिप, पेंटिंग क्लास, एसएमपी, लोगों का दौरा करना, शायद कुछ स्वयंसेवा। बस रहने के लिए कुछ जगह चाहिए, एचएम।"
0,"मेरा सिर, गर्दन और दाहिनी कोहनी बेहद आहत थी ।।"
0,5 टीम टूरनी। माइक/एंड्रयू को 1 और वेन/मुस्तफा 2 में आया। यह तब तक बहुत सुखद था जब तक कि स्टीवेज ने अपना प्रकोप नहीं किया।
0,स्कूल वापस जाने के लिए रवाना हो गया है
0,देखकर वह लुक फिनाले मिल गया है ... मैं वास्तव में करिन को जीतना चाहता था ...
1,"आज सैम के साथ हार्ले पर बहुत मज़ा आया!  सैम, मॉम और जेफ के साथ Poconos के लिए बाइक की सवारी के लिए इंतजार नहीं कर सकता!"
1,उपयोगकर्ता अच्छा!
0,"उपयोगकर्ता वलाओ एह, मूर्खतापूर्ण YouTube GO को WGM के 30 के बाद EP को हटा दें।  अब मैं veoh से पूर्ण EP डाउनलोड करता हूं और इसे अपने दम पर संपादित करता हूं"
1,उपयोगकर्ता यह सिर्फ नहीं है।
0,"उपयोगकर्ता एक अच्छी दौड़ होनी चाहिए, मुझे सिल्वरस्टोन से प्यार है और यह आखिरी आश्चर्य है कि एफ 1 में क्या होने वाला है ??  ईक"
0,मैं किसी के साथ प्यार में हूँ मैं नहीं कर सकते
1,उपयोगकर्ता: मैंने अंततः यह पता लगाया।  स्वार्थी जीन से पूरी तरह से कैसे अलग है।
1,"उपयोगकर्ता आपको जल्द ही फिनलैंड में देखने के लिए इंतजार नहीं कर सकता, यह मैं था जिसने आपसे फेसबुक में पूछा था कि क्या आप फिनलैंड में आते हैं <3"
0,उपयोगकर्ता मेरे पास केवल छह हैं
0,"उपयोगकर्ता ik ik! मुझे तुम्हारी भी याद आती है और मैं कल वहाँ जा रहा था, लेकिन मुझे बेबीसिट करना है, और बुधवार को मैं किसी को दूर जा रहा हूं"
0,उपयोगकर्ता यह ठीक है मैं पूरी तरह से समझ गया! मेरे सप्ताहांत में फैमिली हैंग शामिल हैं जो मेरा जीवन आया है? मुझे जो पसंद है उसे कोई पसंद नहीं करता है
0,कैसे आओ मैं अपने फेसबुक को अपने ब्लैकबेरी के माध्यम से कनेक्ट नहीं कर सकता ??
0,"उपयोगकर्ता haha ​​yeh inet मेरा जीवन है, उदास LOL"
0,उपयोगकर्ता मुझे कोई आपत्ति नहीं है क्योंकि मैं इसमें नहीं बैठ सकता - मुझे खुशी होती है कि अन्य लोग जो लोल नहीं कर सकते
0,दिन के लिए काम खत्म करने और स्मिथफील्ड नोक्टर्न के लिए रवाना होने के लिए आगे देख रहे हैं। पहले साल मैं इस पर सवारी नहीं कर रहा हूँ
0,"काम पर, तो ऊब मुझे मनोरंजन का पालन करें अगर ऐसा है तो आगे बढ़ें"
0,"उपयोगकर्ता, यह सिर्फ मुझे दुखी करता है।  दोनों दिशाओं में सेक्सिस्ट * और * ""इंटरेस्ट-इट"", अगर यह समझ में आता है।"
1,उपयोगकर्ता omg ... itz अब तक के सबसे मजेदार vid की तरह ... इसे कई बार पहले से ही देखा और अभी भी मुझे वास्तव में कठिन हंसी करता है ... मैं इसे प्यार करता हूँ '
0,"उपयोगकर्ता इसका सिर्फ एक दिन हो गया है, और मैं पहले से ही इसे याद करता हूं .. -.-"
1,रहस्य वीडियो गेम बहुत अच्छे हैं- तो क्या!?
0,यह हो रहा है!!!! बुरा गुण।  ओह अच्छी तरह से
0,उपयोगकर्ता मंगलवार से यहां भी ऐसा ही होगा
1,"उपयोगकर्ता मैं एक पंक्ति हाहा में तीन गिग्स में गया, एक बुधवार को, एक गुरुवार, एक शुक्रवार को यह महाकाव्य था!"
1,तंग जींस डबल डी के makin मुझे गो * सीटी * लॉली !! 3oh! 3 सबसे अजीब बैंड हैं
0,मैं सूरज से जल गया हूँ !!! उत्तरी सागर में सूरज महान था। लेकिन अब मेरी त्वचा में दर्द हो रहा है
1,जब स्पेन में रहते हैं..आप कभी भी एक गर्म स्नान नहीं कर सकते।
0,उपयोगकर्ता LOL अजीब था कि क्यों। मैं ऊब गया हूं
0,"उपयोगकर्ता यह बहुत अच्छा है, मुझे अब एक iPhone चाहिए। मैं आज बकवास की तरह आवाज करता हूं ... मजाकिया होता। मुझे चीनी चाहिए"
0,मैं सोने जा रहा हूँ यह मेरे लिए बहुत ज्यादा है मैं वास्तव में रोने जा रहा हूँ
1,उपयोगकर्ता अपने उस लीड पैर से सावधान रहें
0,बेशक उपयोगकर्ता!  लेकिन कल तक नहीं
0,"प्रसिद्ध लोगों के खिलाड़ियों की बहुत कम सबसे अच्छी बात है, केवल yt url पर अच्छा है"
0,सब कहाँ हैं
1,उपयोगकर्ता wut का अच्छा !!!! अभी से 2 के बाद से शो luv था !!!!
1,उपयोगकर्ता धन्यवाद आज आप कैसे हैं?
0,मैं वास्तव में जस्टिन को याद करता हूं मैं वास्तव में वास्तव में करता हूं। = '(
0,उपयोगकर्ता कि पोस्टर भयानक था !! स्वाभाविक भी नहीं लग रहा था !! Eww। गरीब रोब
0,"उपयोगकर्ता मैं सुनने के लिए तनाव कर रहा हूँ, लेकिन यह यहाँ पर सभी तरह से बहुत कठिन है।"
0,उपयोगकर्ता धन्यवाद - मैं धैर्य रखने की कोशिश करूंगा।  मैं इस बहुत से गुजरता हूं।   लेकिन इस crumby को कभी महसूस न करें।
0,मेरे पास एक गले में खराश है!
1,"ज़ोर-ज़ोर से हंसना! ऐनी हैथवे के साथ यह प्रफुल्लित करने वाला दृश्य है, क्योंकि वह अपनी बहन (दूसरी बार) को बुलाता है।"
1,दिन के लिए समुद्र तट पर है!
1,उपयोगकर्ता अपने आराम को पहले से ही ले लो
1,उपयोगकर्ता आप अभी भी सूंघते हैं
1,"जल्द ही ऑरेंजविले जा सकता है, मुझे उम्मीद है कि मैं कर सकता हूं"
0,कल रात ज़ैक की गोद में सो गया और पॉन्डरलैंड के सभी को याद किया और फिर हम आज लगभग 1 बजे तक सो गए। <3
0,आर पागल होने जा रहा है:/ नींद का विज्ञान गायब है और यह वापस होने के कारण है! मैं भी इसे देखने के लिए नहीं मिला!
1,मैं एक स्टारबक्स frappuccino चाहता हूँ!
1,उपयोगकर्ता यदि आपको 2 हंसी पसंद है।
1,"McFly के बारे में सुनकर, (8) काश मैं आपके साथ हो सकता है, दृश्य साझा करने के लिए ... (8) xx"
0,उपयोगकर्ता मैं कहूंगा लेकिन मुझे लिया गया है
0,"उपयोगकर्ता आपको लगता है?! यह ड्राइव के लायक है। मैं हेला जाऊंगा, लेकिन मैं अभी भी बच्चा पैदा कर रहा हूं।"
0,उपयोगकर्ता डार। मैं इसे भी स्क्रीनशॉट करने वाला था:/
1,।
0,सुंदर और धूप वहाँ से बाहर और मैं एक किरकिरा पहनने पर अटक गया हूँ
1,उपयोगकर्ता मुझे उम्मीद नहीं करनी चाहिए !! आशा है कि आप j/k फिर से
0,उपयोगकर्ता क्या आपको लगता है कि तनाव आपकी आपूर्ति के कारण हो रहा है? क्या आपने डोनर दूध में देखने की कोशिश की है?  गरीब पंक्ति! *गले*
1,आकर्षक चून ... नमूना चयन महाकाव्य है।
0,"जल्दी मेरे बच्चे को याद करते हैं, लेकिन 2 दिन एक अच्छा दिन होगा मैं इसे महसूस कर सकता हूं। हाँ! ("
0,काम पर करने के लिए बहुत अधिक - खुद को प्रेरित नहीं कर सकते
1,अरे मेरी झांकियां जोड़ें !! उपयोगकर्ता !! उन्हें एजे के लिए बहुत प्यार है! आपको एजे के लिए प्यार मिला? उनकी मदद करो !!
1,उपयोगकर्ता OMG! मुझे यह चाहिेए!
0,बस मुझे गोली मारो
1,"मेरी ""निडर"" पीवीजी पुस्तक अंत में आई थी !!! वाह!"
1,ऑपरेशन डर्टी बीवर केज क्षेत्र एक जाना है !!
1,नागपुर से वापस ताज़ा ...।
0,उपयोगकर्ता उपयोगकर्ता आप पहले स्नान कर सकते हैं ... मैं बाहर हूँ ... यह मजेदार था! Zephyr यात्रा के साथ URL बैठक सुबह 9 बजे
1,उपयोगकर्ता आपको प्यार करता है !!!
0,बारिश और फीलिंग को सुनना
1,कृपया सदस्यता लें और मेरे वीडियो को अधिक दृश्य और अनुयायियों को अधिक चित्र देखें;) www.youtube.com/user/jazziieeeeeeee
0,उपयोगकर्ता मैंने रेडियो पर आपके बारे में सुना। और ट्विटर नवीनतम एक्स
0,फिर से स्कूल का सामना करना है tmr डरावना ..
0,आप मुझे विश्वास नहीं करते हैं कि आपको अभी भी एक कहानी बताने की जरूरत है
0,उपयोगकर्ता हमने कोशिश की कि ... कोई उपयोग ZZZ ...
1,"उपयोगकर्ता का स्वागत अच्छी तरह से, #FollowFriday सिर्फ एक टैग है, इसलिए लोग इसे (ट्रेंडिंग टॉपिक्स में) खोज सकते हैं और देखें कि आप किसका पालन करने की सलाह देते हैं"
1,अब जाग रहा है!  आप कैसे हैं?! यूआरएल
0,यह मेरे घर में बहुत ठंड है।
0,रास्ता बहुत थका हुआ है और मेरा चेहरा दर्द होता है मुझे एक सप्ताह की आवश्यकता है एक वैरागी और घर छोड़ने के लिए नहीं
0,काश कोई मुझे सिखाता कि मैं गिटार कैसे खेलता। मैं यहाँ बैठा हूँ खुद को सिखाने की कोशिश कर रहा हूँ
1,उपयोगकर्ता AHH COO। मैं आपकी समीक्षा देखने के लिए उत्सुक हूं
1,"उपयोगकर्ता मैंने कुछ रुपये खर्च किए और उन क्लिकर लम्बे में से एक को मिला, bcuz"
0,वाह? 12 नए ग्रंथ! ?? मैं बहुत प्यार करता हूँ !! बस विल्सन के सभी ट्वीट्स का मजाक कर रहे हैं ...*निराशा*
0,जॉन और केट बी 4 को विभाजित यादें देखना (
0,URL - कटे हुए नाखूनों के साथ ब्रैलेस
0,ओह स्नैप I 4got सभी ट्विटर के बारे में तो अच्छा नहीं है
1,"काम, काम, और अधिक काम ... यह काम करने के लिए बंद है मैं जाना!"
0,धूप का चश्मा टूट गया। कोई और नहीं मैं कान्ये पश्चिम से मिलता -जुलता है।
0,#IREMEMBER शूटिंग कैप गन रात के बीच में एक हफ्ते के लिए अभी भी इस दोस्त ने मुझे और मेरे भाई को एक असली के साथ डराया।
1,उपयोगकर्ता खौफ ... काश मैं वहाँ था! दक्षिण जर्सी में आने की जरूरत है
0,नहीं! मुझे सनबर्न मिला
1,Im वास्तव में बहुत धन्य है
1,उपयोगकर्ता आप बहुत अच्छे हैं हाँ
1,एक महान कसरत के लिए मुझे उज्ज्वल और जल्दी जन्मदिन मुबारक हो!
1,उपयोगकर्ता यह स्वादिष्ट नहीं है ?? यह मेरा नवीनतम जुनून है ... स्वाद माउथवॉटर है !!  आशा है कि आप एक महान wkend है !! मिलते हैं NXT सप्ताह ??
0,"उपयोगकर्ता woooo चित्र! हीथ्रो soooo बोरिंग है। और Rhuby यह सब यात्रा पसंद नहीं है, वह बहुत खराश है"
1,उपयोगकर्ता आपके समर्थन के लिए धन्यवाद! बेल्ला बारंगान बुतन मलेशिया!  हे ...
0,"न्यू ऑरलियन्स ब्लेंड कम्युनिटी कॉफी के मेरे तीसरे कप पर, मैं अपने घर को वैसे भी 3 दिन के सप्ताहांत में इस सप्ताह और नए दिन के लिए नए दिन की याद आती है!"
0,उपयोगकर्ता चिपोटल अच्छा लगता है। Dnw sundae कैलोरी ugh मुझे बस पता है कि मैं w/e से नाराज हो जाऊंगा
0,अजीब मौसम!
1,सुबह की बेकिंग करने के लिए रवाना हो गया है। स्ट्रॉबेरी टार्ट? जी कहिये!
1,"आज मैंने सबसे प्यारी टी-शर्ट खरीदी है, यह एक हरे कछुए के साथ नारंगी है। ^ ^ ^"
1,उपयोगकर्ता धन्यवाद til अच्छी तरह से चल रहा है।  हालांकि रुकने वाला नहीं। बाद में एक्स बात करें
0,2 दिनों में ट्विटर नहीं किया गया है ... मेरा इंटरनेट नीचे है और अब मेरी चाची के घर में यहाँ है ...
0,काश मेरे साथ मेरी बाइक होती
0,गला खराब होना
0,"वूप्स, मैंने इसे फिर से किया। सोचें कि यह मुझे भ्रमित करता है जब मैं डीएम स्क्रीन में होता हूं। बेटी ने उसकी उंगली को मैश किया, इसके बारे में उपयोगकर्ता से बात कर रहा था।"
0,उपयोगकर्ता हाँ .. आपको बताना चाहता था लेकिन फोन को लटकाने के बाद हमेशा याद किया जाता है
1,मैं सिर्फ भौतिकी का अध्ययन करता हूं
0,दांत soooo गले में हैं
1,उस कार्य को लेने के लिए उपयोगकर्ता धन्यवाद।
0,WHOOOHOOO गर्मियों की कक्षा के केवल छह घंटे बचे ... दुख की बात यह है कि वे इसे दो दिनों में विभाजित करते हैं
1,उपयोगकर्ता हा !!  स्पष्ट रूप से मैं आपके नट देख सकता हूं।
1,उपयोगकर्ता जो आज सुबह मेरे दोस्तों को चीयरियोस में पेशाब करता है?
1,"उपयोगकर्ता सबसे स्वागत समाचार - निश्चित रूप से दोपहर को उज्ज्वल, धन्यवाद और बधाई"
0,मैं बस चाहता हूं कि मेरे पिताजी घर आएं
0,मैं इस बात की चिंता करना बंद नहीं कर सकता कि क्या स्थल के लोग किसी अन्य व्यक्ति को प्रोम में अनुमति देंगे या नहीं ... उन्हें चाहिए लेकिन मेरा दिमाग चिंता करना बंद नहीं कर सकता है
0,"शोक! #WT20WC सेमीस में, Ind एक abysmal प्रदर्शन NZ 145/5/20ov Ind 58/6/13ov में डाल रहा है। बाद में आज #T20WC सेमीफाइनल में, इसका SA बनाम पाक"
1,उपयोगकर्ता - मैं अभी भी Android पर अधिक देखने के लिए उत्सुक हूं। मैं अपने नए लैपटॉप को सुलझा ले रहा हूं।
0,मुझे लगता है कि मुझे लगता है कि मैंने एक पाठ भेजा है लेकिन कभी नहीं किया।
0,"ओह मेरे भगवान यह मेरे जीवन का सबसे कठिन निर्णय है! मैंने किसे चुना? जोनास या ग्रीन डे, उघ"
0,"बिस्तर का समय अब, कल जल्दी ऊपर"
0,किराये के लिए यूके में उचित मूवी डाउनलोड सेवा के लिए इंतजार नहीं कर सकता। यह लगातार डफ डीवीडी को समाप्त कर देगा जो हमें लवफिल्म से मिलता है!
0,उपयोगकर्ता आप नया सीजन देख रहे हैं? मुझे पहला ईपी पसंद नहीं था
0,उपयोगकर्ता जो कुछ भी हमारे साथ था चिलिन?
0,उपयोगकर्ता मैं अपने lllllllllateeee कहूंगा
1,उपयोगकर्ता योग्य। इतना शांत है कि। मुझे लोडिंग गेम फीचर बहुत पसंद है ...
