0,काम!! सेल को txt और मनोरंजन मुझे पोर एहसान !! मैं तुमसे हमेशा के लिए प्यार करता हूँ।
0,बिलंग: '-((आँसू) url
0,"उपयोगकर्ता गरीब आदमी उस नट से शादी की जा रही है जो आपको आसान नहीं हो सकता है, वह इससे बेहतर है!"
0,कृपया मदद की जरूरत है
1,उपयोगकर्ता जो नहीं करेगा?
0,क्लेम्सन को एक पूर्व छात्र के रूप में छोड़कर ... मैं नहीं करना चाहता
0,Namechange Daynah/Starcandi & C.A.T का अर्थ है Creme Angel & Turbo।  कभी भी मोर पर मत जाओ! कभी भी जिमी ने मोर न देखें। बहुत दुख की बात है!
0,मैं धूप में खेलना चाहता हूं लेकिन मेरा पेट फिर से दर्द होता है!
1,"यह सुनने के लिए उपयोगकर्ता क्षमा करें।  इसे इस तरह से देखें, आपका दिन केवल यहां से बेहतर हो सकता है!"
0,दंडित किया जा रहा है
0,मुझे नहीं पता कि अब क्या सोचना है
1,कोई विशेष पुरस्कार नहीं। आह लेकिन एंथोनी डेविटो को 100 डॉलर मिले! उसके लिए Yay निश्चित रूप से शीना गीत को 175 डॉलर मिला। -_- डी:
0,मेरे प्यार के साथ स्टारबक्स में। ईएफएफ स्कूल। मेरे पास बाद में भी काम है।
1,"काउंटर -स्ट्राइक 2 डी - ??????????, ?? ??? ?? ??-????????"
1,एक लंबे समय में पहली बार उपयोगकर्ता को सुन रहा है और इसे प्यार कर रहा है।  वे कुछ अच्छे गाने भी बजा रहे हैं ...
0,काम करने के लिए तैयार है याय
0,"टैंक 2 में टैंक 1 के माध्यम से चमकने वाला सूरज अद्भुत इंद्रधनुष बना रहा है। काश मैं उन्हें कैमरे पर पकड़ पाता, लेकिन वे सिर्फ दिखाने के लिए नहीं लगते"
0,"उपयोगकर्ता मुझे पता नहीं है, वह कुछ समय के लिए मेरे क्षेत्र में नहीं है इसलिए मैं उसे नहीं देख सकता। और मैं जल्द ही चला जाता हूं"
1,LOL उपयोगकर्ता WHOOOAAAAA इतना luvly !!!
1,11 वीं महीने की सालगिरह सयांग की शुभकामनाएं
0,मैंने बहुत ज्यादा खा लिया। अब मेरी पेट में दर्द होता है
1,"येइक, मैं बेहतर चुप हो गया और अपनी पलकों के पीछे अच्छी रात प्रिय शून्य XO"
1,उपयोगकर्ता जो कि रेहमन ने इसे देखते हुए दिया था। यह उतना ही अच्छा है जितना यह मिल सकता है
1,"उपयोगकर्ता हाँ, im कल 12-4 काम कर रहा है"
0,उपयोगकर्ता के पास कल एक ही बात थी! Piriton ने कुछ नहीं किया! महसूस किया कि इतना छोड़ दिया गया बस ऊतक का भार है!
0,मिसो सूप पर मेरी जीभ जलाया अब यह सब मज़ेदार लगता है।
1,उपयोगकर्ता धन्यवाद मैं करूँगा
0,वापस स्कूल 2morrow
0,"अपनी नई पत्नी के साथ उपयोगकर्ता मैं देख रहा हूं कि अब आप अपने ट्विटरर्स की उपेक्षा करते हैं हाहा हमारी उपेक्षा मत करो! अगले शो तक इंतजार नहीं कर सकता, पिछले एक को याद किया"
1,"नौकरी के शिकार पर, फिर से .... Heee llllppppp !!!"
0,उपयोगकर्ता मैं आपको थोड़ी देर के लिए नहीं देखूंगा .. अगले सभी सप्ताह के अंत में मैं न्यूटी में रहूंगा
1,"मेरे Glastonbury रेन आउटफिट की योजना बनाना शुरू करने का समय, पहले से ही कुछ बॉस विचार हैं"
0,मैं खरीदारी बंद कर रहा हूँ अब मेरा जीवन बस बेहतर हो जाता है
1,Sunbeams आपको खोजने तक उपयोगकर्ता
1,"आज लिंकन में, यह f@#किन 'हत्यारे की पंथ की तरह है"
0,मुझे जैकी लिनफिन और रोज की याद आती है !!-निक
0,उपयोगकर्ता गरीब आप!  क्या आपके घर में किसी के पास फ्लू या कुछ भी है?
0,मैं बहुत थक गया हूं लेकिन मुझे राजनीति और जीव विज्ञान के लिए सीखना है
0,"उपयोगकर्ता मैं तीव्रता से बीमार महसूस करना जारी रखता हूं, क्रिस इसे ठीक करता है!"
0,एक पक्षी बस मेरी खिड़की में उड़ गया।
1,उपयोगकर्ता np यह वास्तव में काम करता है और मुझे त्रुटि संदेश देता है जब चीजें खराब हो जाती हैं। (मुझे याद आया कि mail.app में)
0,बहुत ही सुशोभित लग रहा है।
1,आलसी रविवार ..!  नहीं था `लेकिन बिस्तर में चारों ओर लेट गए और पूरे दिन फिल्में देखीं ।।
1,"उपयोगकर्ता उपयोगकर्ता यदि मुझे एक टिप्पणी करने की आवश्यकता है, तो मैं हमेशा उपयोगकर्ता को एक चिल्लाहट देता हूं। छिपाने की जरूरत नहीं है।"
1,"उपयोगकर्ता मैं हर जगह जेनी लिंड हूँ - फेसबुक, स्काइप, आदि ... उद्देश्य 'itsmejennilind' है, हालांकि एक अच्छा दिन है!"
1,उपयोगकर्ता मुझे नहीं लगता कि मैं एक मार्शल आर्ट्स दोस्त के साथ कल 11 बजे नियुक्तियां कर सकता हूं ... यह सोचता है कि मैं बना सकता हूं। क्या आप भीड़ पर फिल्म रिकॉर्ड कर सकते हैं?
0,उपयोगकर्ता ने सिर्फ प्रसिद्धि के रीमेक के लिए एक ट्रेलर देखा।  अच्छा नहीं लगता
1,उपयोगकर्ता ने मुझसे हाल ही में ट्वीट करने के रास्ते में बहुत कुछ नहीं किया है। मैं देखकर बहुत खुश हूं कि आप वापस आ गए हैं।
0,URL - यहाँ उम्मीद है कि यह बिस्तर में मेरा आखिरी दिन है। हर्नियेटेड डिस्क मजेदार नहीं हैं
1,सुप्रभात ब्राजील !!! बस ऊपर चला गया और कुछ कॉफी थी ... चलो जॉगिंग करते हैं? आपका दिन शुभ हो!
1,"बेहद ठंडा, और इसकी सर्दी भी नहीं है, लैपटॉप खरीदारी करने के लिए तैयार होना चाहिए"
0,तो डेटाबेस के बारे में सीखना ........ याय ..... नहीं
1,उपयोगकर्ता आशीर्वाद मैं शर्त लगा सकता हूं कि यह बी कर सकता है
1,"आरबी विउसर। धन्यवाद! BTW, यह वीडियो बहुत मनोरंजक है ..? यूआरएल"
1,उपयोगकर्ता मुझे बताने के लिए सबसे मजेदार बात है
1,उपयोगकर्ता hahaha तो कल चलो उस के बारे में बात करते हैं और फैसला करते हैं
1,"हाँ, मैं दिल pacquiao !!!! अद्भुत!"
1,थिएटर पर विचार करना ...
1,लड़कियों की रात एम्बर की!  गपशप शुरू हो गया है!
0,उपयोगकर्ता मैं इतना faaaaaaaaaaar छोड़ रहा हूँ। डी:
0,उपयोगकर्ता भाग्यशाली ... एक समुद्र तट ... यहाँ कोई समुद्र तट नहीं है और यह बाहर ठंडा है
0,"मुझे बस तब तक इंतजार करना है जब तक कि मेरी माँ घर नहीं जाती, इसलिए वह मुझे वहाँ जाने के लिए ड्राइव कर सकती है, मुझे नहीं लगता कि मैं उस लंबे समय तक इंतजार कर सकता हूं !!!!"
1,शाकाहार का एक महीना!  उत्सव में आलू के वेजेस
1,उपयोगकर्ता sicher
1,सुबह यहाँ पनेरा ब्रेड के yummmmm के लिए ..... इस जगह से प्यार करो !!!!
0,"उपयोगकर्ता ;; आप अभी मेरा पसंदीदा गीत सुन रहे हैं। <3 (क्षमा करें, लेकिन मुझे ऐसा लगता है कि ऐसा स्टाकर है।)"
0,मेरे बाल बकवास हैं। यह सिर्फ बकवास है
1,उपयोगकर्ता देखें YA बाद में मज़े करें!
0,उपयोगकर्ता पहले से ही अधिक फुटबॉल नहीं है!
0,उपयोगकर्ता उपयोगकर्ता यह मेरी राय में सिर्फ दुखी है .. जो भी कोई सम्मान नहीं है ... लेकिन उम्मीद है कि यह कम हो जाएगा और फिर से नहीं होगा!
0,बहुत थक गया हूं। 7 8 9 10 11 12 13 14 समाजशास्त्र अध्याय 1 करने के लिए 1 किया। और एंथ्रो का एक बहुत।
0,"ऊब, टीवी देखना, लेकिन परीक्षाओं के लिए अध्ययन करना चाहिए अभी तक अध्ययन नहीं किया गया है और विफल होने वाला है: | एफएमएल"
0,उघ wth इस बारिश के साथ है ??  अगर यह ऊपर रखता है तो मुझे आर्क के माध्यम से मिल्वौकी की यात्रा करने की आवश्यकता है
1,"नि: शुल्क डोनट्स का विरोध किया, काम से और काम करने के लिए बहुत सारे व्यायाम किया, और यह आधिकारिक तौर पर सप्ताहांत है।  सभी अच्छे दिन में!"
0,Btw.this यह है कि कैसे जापान में बच्चों को वर्ष की उम्र में आत्महत्या कर ली जाती है क्योंकि तनाव..क्या है?
1,"स्टूडियो में ... एक अच्छा समय संगीत बनाने के लिए, yooooooooo"
0,"ओह, बुमेर! मेरी उड़ान रविवार को खेल शुरू होने से 11 मिनट पहले आती है।  यूआरएल"
0,उपयोगकर्ता हाहाहाहा। लंदन में मज़े करो मैं चाहता हूँ कि मैं जा सकता था ...
0,उपयोगकर्ता इसकी श्रृंखला प्रीमियर और यहाँ कनाडा में नहीं
0,उपयोगकर्ता हेय। मैं प्रोम रात देख रहा हूँ। यह बेकार है आप मर गए पहले यह मेरी पहली बार इसे देख रहा है
1,"उपयोगकर्ता मैं ट्विटरफॉन का उपयोग करता हूं। नया मारो, फिर कैमरा आइकन, फिर फोटो लें और अपलोड करें यह निर्भर करता है कि आप yr iPhone पर क्या उपयोग करते हैं"
1,"उपयोगकर्ता अरे मेरे नाम किम, सारा के एक साथी अपने चचेरे भाई एक्स"
1,"उपयोगकर्ता योग्य: 1 महीने ... जैसे, हमेशा के लिए !!! मुझे फॉलो करने के लिए धन्यवाद! अब आप का अनुसरण करते हैं!"
1,"काम, फिर पंखों का खेल"
1,केंडी के साथ मॉल बाउंड ... शीतलता।
0,"उपयोगकर्ता mmm nope मैं शनिवार को जा रहा हूँ मैं gunna मिस atb हूँ, लेकिन आपको जाने की कोशिश करनी है!"
0,उपयोगकर्ता गरीब शहद! क्या आप एक नींद की गोली चाहते हैं?! मुझे कल रात एक ले जाना था !!
1,उपयोगकर्ता एक अस्पष्ट छोटे कार्यक्रम को एमएएम कहा जाता है। मैं #sh2 के बाद पूरा विवरण डालूंगा।
0,"बस परीक्षा समाप्त: | je tres difficile agh, इसकी सारी बारिश और गीला .."
0,नवंबर तक इंतजार कर सकते हैं ... * p! nk * रॉकिंग देखने के लिए प्यार ... हैम्बर्ग में मैं अच्छी तरह से देख सकता हूँ। मेरे सामने इतने लंबे लोग
0,"उपयोगकर्ता मुझे आपका दर्द महसूस हो रहा है! उन्होंने मुझे स्टोर अकाउंट पेज पर निर्देशित किया, जो सिर्फ यह दिखाता है कि मुझे उम्मीद है कि यह जल्द ही आ जाएगी"
1,उपयोगकर्ता ऐ धन्यवाद के लिए धन्यवाद!
0,मैं ऊपर हूँ ... मैं काम पर हूँ ... लेकिन मैं नहीं देखता कि मेरे दिन में क्या योगदान होगा ... मैं घर जाना चाहता हूं और एक झपकी लेना चाहता हूं ... और यह केवल 9:15 बजे है।
1,कल कोई कक्षाएं नहीं!  कल के लिए तैयार !!!!!! -- ज़ोर-ज़ोर से हंसना;; आशा है कि चीजें योजना के अनुसार जाएंगी
0,#udderbelly #stephen amos किसी को भी पता है कि क्या यह कोई अच्छा होने के लिए है? #Rhod गिल्बर्ट टिकट नहीं मिल सका
1,"उपयोगकर्ता हमारे ज़ो को उसी तरह से। वह पूरे हफ्ते मेरे बगल में लेट गई, जब उसने मुझे अपनी सीढ़ियों से नीचे गिराया और मेरी पीठ पर चढ़ गया।  वफादार/दोषी"
1,उपयोगकर्ता की अनुमति आपको मिलने के लिए तत्पर है।
0,अभी -अभी ग्रीनफ्लाई के एक शानदार झुंड से छेड़छाड़ की गई है! मैंने अनादर महसूस किया!
0,रात को रात को रात में बुरी तरह से खो दिया!  मैं 1997 वाल्डिकवा ब्रुनेलो डि मोंटाल्किनो रिसर्वा मैडोना डेल पियानो का एक मामला हूँ
0,कुछ टाइलेनॉल लेने वाला है ... सिरदर्द कभी खत्म नहीं होता
1,"मौसम वास्तव में अच्छा है लामाओ, स्कूल एक्स के बारे में शर्म की बात है"
0,उपयोगकर्ता। क्या याद आ रहा है .. गीत जल्द ही किया जाना चाहिए .. मुझे बस यह बुरा ठंडा मिला कल लोल ने जैज़ को एक ट्विटर पाने के लिए कहा।
0,"इसलिए इस जल्दी होने के बारे में उत्साहित नहीं, समुद्र तट पर नहीं होने और काम पर वापस जाने के लिए।"
1,#IREMEMBER जब मैं छुट्टी पर बिस्तर से बाहर निकला और एक सूटकेस में उतरा
0,मैं सिर्फ एक विमान पर जाना चाहता हूँ !!! अब की तरह !! मुझे याद है कि मेरे साथ यात्रा करने के लिए कोई नहीं है T__T
1,उपयोगकर्ता मैंने किया ... बस इसे फिर से जवाब दिया!
1,वहाँ उपयोगकर्ता है
0,अभी उठा। अभी भी निकोस में। जल्द ही घर जा सकते हैं और मेरे भाई का सामना कर सकते हैं
0,"उपयोगकर्ता के पास एक नकारात्मक टिप्पणी नहीं थी, व्यक्तिगत रूप से मैंने बहुत मेहनत की है, मैं बहुत मेहनत कर रहा हूं कि मैं गर्व करने का अधिकार अर्जित कर रहा हूं"
1,कैथी एन बारू के साथ
0,उपयोगकर्ता aww लेकिन यह कभी भी ba tha कभी नहीं होगा ... हम सभी अब बड़े हो गए ... वापस तो हमारे पास कोई जिम्मेदारियां नहीं थीं n जीवन इतना मजेदार था n आसान !!
1,उपयोगकर्ता मैं सिर्फ एक XD नहीं है
1,"उपयोगकर्ता अच्छी तरह से, हमें मज़े करने की आवश्यकता है। भले ही यह भ्रामक हो"
1,"उपयोगकर्ता बेबीस, मैं हाववा क्लुई को डंट करता हूं, मैं सिर्फ लोगों को लिखता हूं और आशा करता हूं कि डे ने बैक इनिट ब्लड लिखा है।"
0,स्कूल शुरू करना 2MRW ... कोई मज़ा नहीं! इस खूबसूरत दिन का आनंद ले रहे हैं !!
0,"उपयोगकर्ता उपयोगकर्ता आप लोगों ने फोन नहीं किया।  लेकिन, मैं अभी भी आप लोगों से प्यार करता हूं, हेहे। जब मुझे बैकक, ily मिलता है"
0,अब यह मेरी गणित की किताब है। हर कोई अपनी छुट्टियों के लिए वापस लंदन/जहाँ पर वापस चला गया।  केवल मैं और चेसर ने छोड़ दिया।
0,बस मेरे सबसे अच्छे दोस्त के लिए एक कविता लिखी ... यह बहुत दर्द होता है कि मैं घर से दूर तक बहुत दूर हूं
1,उपयोगकर्ता url नया ब्लॉग
1,उपयोगकर्ता सुबह! यू मस्ट मिस मी
0,"उपयोगकर्ता hmmm मेरे किराए डरपोक हैं, वे मुझे लोल की जाँच करेंगे, साथ ही वे जानते हैं कि मैं नहीं हूं क्योंकि मैं बीमार था"
1,आज बीयर खरीदी
0,श्रीमती अरागोंडे ने मुझे कुछ भी नहीं सिखाया है और मैं रसायन को विफल करने जा रहा हूं
1,उपयोगकर्ता पहले एक अविश्वसनीय सुंदर है और यह मेरा वोट है
0,एक सुंदर 90 डिग्री पर धूप ..... मैं छोड़ने के लिए दुखी हो जाऊंगा
0,प्याज की वजह से मेरी आँखों को अत्यधिक पानी से रोकने की कोशिश कर रहा था
0,उपयोगकर्ता यह ठीक है ... मुझे लगा कि आप मुझे लोल को पीछे छोड़ने के लिए कभी नहीं आएंगे। यकीन है कि मेरा दिन बना! ;-)
1,उपयोगकर्ता चुनौती: 24mins को हराया।
1,मान क्यों मैं इतना प्यासा हूँ !! उह्ह्ह मैं तत्ति बेला दही भी तरस रहा हूं
