0,"मैं बहुत बीमार हूं, मुझे अस्थमा से नफरत है"
0,उपयोगकर्ता नाह ने बारिश को विकसित किया लेकिन यकीन है कि समुद्र तट पर एक सूखा दिन
0,"उपयोगकर्ता मुझे अभी भी पता चला है..क्या वास्तव में डीसी पर हाल ही में समाचार का पालन करें, लेकिन यह अभी भी बहुत दुखद है"
1,"आज रात मिस्टी बाहर आने के लिए उपयोगकर्ता धन्यवाद! तुम्हें पता है कि हम अपने शो के लिए सभी तरह से आने के लिए आपको बड़ा समय देना चाहते हैं, है ना?!"
1,अगर आप करेंगे तो मैं इसकी सराहना करूंगा। मैं एक बड़ा टिम कौल प्रशंसक हूं जो जानता हूं
0,मुझे एक नया माइक्रोएसडी कार्ड चाहिए।
0,मैंने अपने संपर्कों में हर फोन नंबर खो दिया
1,जूलिस और मिक्सर हैप्पी समर?
0,सोचता है कि नर्जिन अंग्रेजी दुलु आजा देह उरल
1,उपयोगकर्ता मुझे लगता है कि यू आर ... मैं अपने जीवन में 2 10 स्कूलों में हूं और केवल शिक्षकों को मुझे प्रेरणादायक आर ... 2 या 3 केवल मिला। वैसे भी हमदुल्लाह
0,ugh मेरी तस्वीर अच्छी नहीं बचाओगी
1,अब यह एक 3 है और फिर एक 1 जिसे मैं नफरत करता हूं। लेकिन मैं इसे करने जा रहा हूँ! यहाँ मैं बहुत प्यारी किताबें नहीं आ गई!
0,मुझे याद दिलाएं कि दोपहर के नैप्स कॉस को अपने 4 के पास न लें और मैं अभी भी सो नहीं सकता!
1,उपयोगकर्ता URL - xoxo
1,एटीएल हवाई अड्डे पर ... ताइवान वापस जा रहे हैं! उसने मुझे कल रात अंगूठी दी।
0,बस उसके नाखूनों को मिल गया और काम पर जाने वाला है
0,दिनचर्या शुरू करना .. स्कूल के लिए मेरा रास्ता
0,उपयोगकर्ता अपने फोन का जवाब सही ...... अब! Lol ..... ooups मैंने आपका # url खो दिया
0,कल वर्ष की पहली कॉटनवुड हड़बड़ी थी। अगले महीने के लिए क्लैरिटिन पर रहेंगे। यशस्वी।
0,उपयोगकर्ता
1,सहयोगी के लिए एक जैस्पर वीडियो बनाना
0,मेरे बिना उपयोगकर्ता सुशी? अशिष्ट
1,Runescape पर पैसा कमा रहा था। मेरा कोयला इसे करने का एक तेज़ तरीका है
1,गोधूलि को देखकर मुझे यह फिल्म बहुत पसंद है
0,उपयोगकर्ता क्यों मैं इसके लायक हूं?
1,"उपयोगकर्ता क्लिकर, मैं आकस्मिक नल से नफरत करता हूं और न देखें कि आपको टैप की आवश्यकता क्यों है जब आपको केवल पैड पर क्लिक करना होगा"
0,आप नहीं जानते कि यह कितना दर्द होता है
0,यह शुक्रवार की रात 10.30 बजे है और मैं बिस्तर पर जा रहा हूं। कितना दयनीय है।
0,"अपने पीछे से उतरने, शॉवर करने और उस नौकरी को अंतिम रूप देने की जरूरत है ... उह। मैं आज बहुत आलसी हूं।"
1,हवाई अड्डे पर उपयोगकर्ता को गिरा दिया। देखा 15 अमीश लोग पार्किंग गैरेज के शीर्ष स्तर पर विमानों को देखते हैं
0,जितना मैं चाहता था कि ड्वाइट और जादू जीतने के लिए मैं राजा जेम्स के लिए बुरा महसूस करता हूं * आंसू ड्रॉप्स * अब जादू इसे शून्य के लिए नहीं बनाते हैं।
0,उपयोगकर्ता सं।
0,मेरी दादी के 2 दिनों में मैं घर जाना चाहता हूं!
1,उपयोगकर्ता मैं उत्तर देता हूँ!
0,बहुत जल्दी सुबह सब!  उपयोगकर्ता मैं 2nite आशा नहीं देख रहा था कि यू एक अच्छा एक एक्स था
0,मेरा कैमरा केबल खो गया ... यह बहुत डरा हुआ और अकेला होना चाहिए
1,हा !! इसे हराया !!! यह मैट डलास का अनुमान नहीं था। आपके चेहरे में!!!!
0,Im हिचकी से मर रहा है किसी ने मुझे बचाया ... योग्य
0,उपयोगकर्ता ओह तो हर कोई है जिसे मैं ईमानदारी से जानता हूं
1,"भूल गए कि मैं ओटालिया को 4-22-09 एपिसोड से कितना प्यार करता हूं। अद्भुत क्षण, इसे फिर से देख रहे हैं।"
1,"उपयोगकर्ता जेके राउलिंग किताबें लिखता है, उसे एक पत्रकार नहीं बनाता है!"
1,"राहेल के घर पर, GHWT HEHEHEHE खेल रहा है"
1,उपयोगकर्ता यू को नूसा में आना चाहिए !! यह वास्तव में थोड़ा कोव पर सुंदर है
0,जब मैंने 3 ब्लॉकों के लिए एक बस का पीछा किया तो एक बछड़े की मांसपेशियों को चीर दिया .. मैंने पूरी तरह से बस थो को हरा दिया .. (और मेरे दोस्त अंदर सवारी कर रहे थे)। लेकिन मैं 'लोल' में एक लंगड़ा हूँ
0,"उपयोगकर्ता बहुत बुरा मेरे पास बाथरूम में टीवी नहीं है, तो मैं बहु कार्य कर सकता हूं!  मैंने सुना है कि वे शो रद्द कर रहे हैं।"
0,यह थोड़ा ठंडा है
0,एंडी ने सिर्फ यांकीज़ गेम को छोड़ दिया और फिर सोहो और चाइना टाउन में खरीदारी की
1,ट्विटर का उपयोग करने से इंकार ... psht।
1,"उपयोगकर्ता ~ Â »उसका अनुसरण करें। अगर तुम मुझे नीचे कर दो ... तो यू नीड ""मेरे जैसा हो जाओ"" && उसे नीचे उतरो ... जाओ और उस 4 ya गुरल पर जाओ।"
0,"आकाश नीला, सप्ताह के अंत में महान, लेकिन काम पर वापस"
0,गेबी (तारो) से यम (ube) = बैंगनी सिनिगांग (खट्टा सूप) URL
0,"मुझे लगा कि स्क्रब्स फाइनल आज रात को था, लेकिन जाहिर है कि यह अगले सप्ताह है"
1,उपयोगकर्ता Kristennnnnnaaaaaaaaaaa !!! बंद करो itaaaaaaa !!! मिस Youuaaaaaaa
1,"ilovegoogle, 1 17 तक आगे बढ़ें। Rumahabi.com"
1,उपयोगकर्ता lmfao माइट अपलोड मेरी बहन का चित्र मुझे लगता है
0,"जर्मनी में कोई नाचो नहीं ??  मेरा मतलब है कि मैं उसके लिए खुश हूं, लेकिन कोई नाचो दुखी नहीं है"
1,उपयोगकर्ता ya te vas एक डॉर्मीर? = S Buuu Buena Noche Brendita
1,"जब मिस्टर हैंडसम आपका नंबर मांगता है ... तो उसके पास है। वह उन चीजों की तलाश कर सकता है जो आप कर रहे हैं ... मेरे लिए, बस एक महान कोनो"
1,उपयोगकर्ता सच है! लेकिन मैं हमेशा अंतिम शब्द होगा! सू ने मेरा आखिरी शब्द है!
0,सबसे लंबा महीना।
1,खिचड़ी भाषा ट्विटर सब कुछ। माफ़ करो मां
1,उपयोगकर्ता उर स्वागत है
1,उपयोगकर्ता मैं किसी दिन होगा! अक्सर बड़े समूह सिर्फ अपने तरीके से चारों ओर धक्का देते हैं और एक मुस्कान यहां पैकिन चीजों को वापस करने के लिए सबसे अच्छी बात है।
1,"उपयोगकर्ता हम्म, कुछ चमड़ा लेकिन ज्यादा नहीं, कम रक्त भी, लेकिन मैं कहूंगा कि अंत में उचित मात्रा में तबाही है"
0,"उपयोगकर्ता एह फेडा, मेरे लिए मज़ा है टोनाइट मैन। मैं वहाँ 'आत्मा' में रहूँगा"
0,यह कैसे संभव है कि यह अभी तक 11 भी नहीं है?
1,"उपयोगकर्ता ब्रेंडा, ब्राजील आपको प्यार करता है।"
1,whos एक अंतिम tommarroww मिला ??? nnottttt meeeee !!!!!
1,यूजर हैप्पी बर्थडे टीज
0,उपयोगकर्ता idk मुझे नहीं पता कि यह कैसे करना है और मैं धैर्य से बाहर भाग गया
0,मुझे इस हैंगओवर को मारने के लिए एक अच्छी कसरत की आवश्यकता है!
1,"उपयोगकर्ता कोई चिंता नहीं है, इसका मतलब है कि मैं उन्हें तब होगा जब मैं स्कूल से घर जाऊंगा!  कोई भीड़ नहीं, चिंता मत करो।"
1,वाह! मैंने पिताजी के साथ संग्रहालय में रात को देखा
1,आशा है कि हर कोई अच्छा कर रहा है मैं आप सभी को याद करता हूं! यूआरएल
1,"उपयोगकर्ता वाह, फिर मैं यह सुनिश्चित करूंगा कि आपकी मासूमियत संरक्षित हो, होबाग"
0,"मैं सिर्फ प्लग के लिए दो आकार गया, मैं एक 10g था और अब एक 6g और निश्चित रूप से माँ को मंजूरी नहीं है"
1,"उपयोगकर्ता ....... url मेल इस पर एक नज़र डालें ..... मुझे कल मिल गया, मुझे पता है कि आप इसे xoxoxoxo पसंद करेंगे"
1,मैं ऊब गया हूँ- ओह ठीक है मुझे आशा है कि कल एक बेहतर दिन होगा- सुबह में चर्च हमेशा अच्छा है
1,"वाह, मैंने fma या किसी भी एनीमे को forevs में नहीं देखा है .. मैं otakon '09 के लिए इंतजार नहीं कर सकता"
1,उपयोगकर्ता किस तारीख को ट्रैबलोगन में खेल रहे हैं? इसके लिए मर रहा है
1,हा! मैंने अभी अपने फोन से पहली बार ट्वीट किया था!
1,"उपयोगकर्ता क्या वह टकीला के बाद एंटी क्लॉक को बदल देता है?  मुझे एक और कॉफी की आवश्यकता हो सकती है, बच्चों को स्केट और पियानो सबक और ... आदि ..."
1,मुझे विश्वास है कि इसके लगभग जून पहले से ही है और चीजें अभी भी सभी की तरह पागल हैं। खिचड़ी भाषा अस्पताल में काम शुरू करने के लिए इंतजार करें
0,स्कूल में फ्रीडम राइटर्स डायरी देख रहे हैं। दिन के दौरान घटनाओं के बारे में सोचना एएमडी मेरे सूजे हुए पैर को नर्सिंग करता है।
0,मेरा इंटरनेट इतना धीमा क्यों है
0,बस गिरोह के साथ डिनर किया था। हम पर जल्द ही केएल में स्थानांतरित हो जाएगा।
0,उपयोगकर्ता अभी तक नहीं।  आज सुबह मेरे भाई और माता -पिता से कुछ मदद मिल रही है। वे अपने रास्ते पर हैं।
1,"उपयोगकर्ता प्रति समस्या नहीं है, लोगों को यह पसंद है कि इस आधार पर क्या नहीं है"
0,उपयोगकर्ता मुझे पता है कि आप उनसे नफरत करते हैं ... लेकिन मुझे यह भी पता है कि वे आपको इसके लिए मौके पर किराए पर लेंगे ... URL
0,"मैं केवल 5 मिनट के बाहर था, और मुझे पसीना आ रहा है कि यह आज बहुत गर्म है"
0,"Y नहीं कर सकते हैं gostbusters ब्रिटेन के समय में 360 पर बाहर नहीं आ सकते हैं, जो कि सस्ते ps3 mab के तरीकों की तलाश में हैं। और मुझे पता है कि आज मेरा सिर कैसा लगता है।"
0,मैं नहीं जानता कि मैं नहीं जानता कि क्या करना है
0,आज कोई आवाज नहीं ... लानत हैफाइवर/साइनस/गले का संक्रमण ... eww yuck
0,मैं एक बच्चे की तरह रो रहा हूँ क्योंकि मैं देख रहा हूँ कि मैं सैम हूँ ...
1,एक बहुत पूरी सुबह का आनंद ले रहा है कि आप के बारे में कैसे?
0,पिताजी हमारे कुत्ते को पाउंड में ले जाना चाहते हैं!
0,उठने का समय और वास्तव में कुछ काम करते हैं
1,उपयोगकर्ता hahah aiiight मैं अपना सारा सामान अपने नए घर में ले जा रहा हूँ! आप कैसे हैं?
0,"उपयोगकर्ता मुझे लगता है कि लोग वास्तव में अपनी जेब के बारे में अधिक परवाह करते हैं, फिर 6 महीने के समय में उनकी जेब।"
0,बस एक आश्चर्यजनक गर्म कौगर से मिला !! और वह अपने पति को धोखा दे रही थी! प्रलोभन के बारे में बात करो !!!
1,उपयोगकर्ता प्रिय Giuliana - मैं मलेशिया से ई पर यू देखता हूं ।।
1,उपयोगकर्ता यह शानदार है!
0,"उपयोगकर्ता ouch, ठीक है मामा जूली, जिसने मुझ पर बताया था ..... मैं कबूल करता हूं, मैं शायद सबसे खराब अपराधी हूं, मैं इस मुद्दे पर काम करने का वादा करता हूं"
0,उपयोगकर्ता ठीक है आप सही हैं - सभी प्रमुख लाइनों पर सप्ताहांत में रखरखाव
0,19 अंक .... इतना बुरा नहीं है
0,आदमी! बिली क्रिस्टल बूढ़ा दिख रहा है (जे लेनो शो पर)। जय की एक और रात
1,एडम लैंबर्ट पर जुनूनी।
1,सिम्स 3 खेलना।
1,टीवी पर पुराने गेम शो देखना।  मुझे सिर्फ मैच गेम पसंद है।
1,उपयोगकर्ता मेरे रविवार को परिवार के साथ समय बिताया। मैं तुम्हें बहुत याद करता हूँ! मैरी के कैसे जा रहा है?
1,उपयोगकर्ता केनी डब्ल्यू ने अपने ट्विटर पेज बूम को उड़ाने के लिए कहा! G/l @ pocono mickey!
0,"यार, मैं हार्ड कोडिंग के साथ खिलवाड़ करने से नफरत करता हूं, आप इसे बदलकर कुछ तोड़ने के लिए बाध्य हैं"
1,बस एक भयानक योग वर्ग समाप्त! अब 4 घर की सफाई!
0,मुझे अन्य लोगों के किसी न किसी ड्राफ्ट को पढ़ने के लिए अनुरोधों को बंद करना बुरा लगता है।  मेरे पास अभी बहुत अधिक लेखन और संशोधन है।
0,मेरी बहन की सुशी पार्टी के बाद से भोजन के लिए अभी भी भोजन के लिए कोई जगह नहीं है
1,काम पर दोपहर का भोजन विशेष राई पर स्मोक्ड मांस है
0,"उपयोगकर्ता चीयर्स, मैंने अभी इसे बदल दिया है, लेकिन यह मुझे टाइल नहीं देगा"
0,"बारिश, अच्छा नहीं"
0,"निकटतम बीजीटी टूर कार्डिफ़ या लंदन डैम है यह क्यों चकले ब्रदर्स के अलावा कोई भी नहीं है, वेस्ट कंट्री का दौरा करें?"
0,मुझे C# 3.5 काम क्यों नहीं मिल सकता है?  मुझे व्हेंट!
1,मुझे अपने प्यार के साथ खरीदारी बहुत पसंद है
1,मुझे लगा कि कल रात ब्रिटेन की गॉट टैलेंट पर उस होली के लिए बहुत खेद है
1,"उपयोगकर्ता मैं वास्तव में नगेट्स को खोने पर दुखी हूं, लेकिन मैं अभी भी खुश हूं कि हमें जितना भी मिला।"
1,किसी ने मुझे बताया कि मैं दुनिया में सबसे अच्छा प्रस्तुतकर्ता हूं। यह आश्चर्यजनक है कि कोई कैसे छोटा परिधीय है जो किसी और को कुछ अच्छा कर सकता है
0,"उपयोगकर्ता अपने लाइव चैट दिवस की तरह है, मेरा सबसे व्यस्त दिन है। यदि आपकी चैट लंबी है तो एक घंटा, शायद मैं इसे देख सकता हूं!"
0,इतना अकेले। । ।
0,"उपयोगकर्ता lmaoooo। वह कहता है कि मुझे यात्रा करनी चाहिए जब मैं अपनी उम्र चल रहा हूं, 24 चोद रहा है, हालांकि डी: इतना अच्छा लामाओ।"
0,"मुझे पता है कि मैं कह रहा था कि यू को सिर्फ आज बीसी आईएम को कॉल करना चाहिए, वास्तव में बीमार एन आईएम गुन्ना बी घर सभी दिन"
0,"जानता है कि उसे संशोधन करने की जरूरत है, लेकिन यह नहीं करना चाहता है"
0,"उपयोगकर्ता इसके बस वहाँ और वापस आ रहा है, ड्राइव नहीं कर सकता"
1,अब ** क्षमा करें ... और मैं शॉन के साथ घूमने के लिए इंतजार नहीं कर सकता
0,एक पावरपॉइंट प्रस्तुति बनाना
1,"- यह सप्ताहांत मज़ेदार होने के लिए जा रहा है, उम्मीद है कि पिछले सप्ताहांत की तरह मज़ेदार! मैं चिल्ला सकता हूँ!"
1,Wolfram अल्फा ist ऑनलाइन eine neue tole toleschine url
0,"कल रात अब तक सबसे व्यस्त !!!  आज रात के लिए कोई भोजन नहीं बचा है, हालांकि"
1,उपयोगकर्ता ओह और हम अपने इनपुट के लिए हमारे फादर्स डे ईमेल के लिए मुफ्त शिपिंग के साथ गए!
1,अशर हाँ बुरा नहीं था - एक अच्छे तरीके से थोड़ा अजीब
