1,उपयोगकर्ता डू डू डू डू डूओश मैं आपका नाम मानता हूं।
0,cual es tu संस्करण इसके ऊपर
1,उपयोगकर्ता lol na। वापस जाने के लिए मेरी उड़ान को पकड़ना था
1,एमटीवी मूवी अवार्ड्स आज रात निश्चित रूप से देखने जा रहे हैं। मुझे बस इतना करना है कि मेरी लैब रिपोर्ट हो जाए!
0,मैं अब Tunisiaaaaa पर ध्यान केंद्रित करने के लिए स्वतंत्र हूँ! भले ही रॉबर्ट ने मुझे आज इसके बारे में बहुत दोषी महसूस कराया हो
0,@ पोंप: अरे!
0,अंत में मेरा लैपटॉप वापस मिल गया .... 600 नए गाने मैंने डाउनलोड किया
0,मैं इतना नीचे क्यों महसूस कर रहा हूं? पूरी तरह से! सबसे बुरे दिन में से एक ...
1,उपयोगकर्ता हे याय यू ट्विटर एक्स है
1,बस प्रोग्रामिंग एंटिटी फ्रेमवर्क के 17 वें अध्याय को समाप्त किया। अध्याय है ... Woooh ... एक असली रोलर कोस्टर
1,वे सिर्फ मेरे पोकर चेहरे को नहीं पढ़ सकते। हाँ!!
1,उपयोगकर्ता लिंक का पालन करें
0,उपयोगकर्ता मैं चैट याद किया
1,"अरे बाप रे! #sytycd ""लड़ाई"" प्रफुल्लित करने वाला था! गंभीरता से? क्या वास्तविकता उन लोगों में रह रही है ?? ....... Awww लेकिन अच्छा टेलीविजन"
1,एक टैक्सी में एन 'आउट बर्गर के ड्राइव के माध्यम से जा रहा है! मैं कैलिफ़ोर्निया कर रहा हूँ
0,URL - मुझे टोरी की याद आती है!
0,मुझे कुछ गंभीर जयकार करने की जरूरत है
1,"उपयोगकर्ता मैं देखूंगा कि मैं व्यवस्था करने के लिए क्या कर सकता हूं, यह एक खुशी है"
1,उपयोगकर्ता www.tweeterfollow.com का उपयोग करके एक दिन में 100 अनुयायी प्राप्त करते हैं
0,"खिचड़ी भाषा इस smr-mu चीज़ों तक सोती है, लेकिन इसके मजेदार थे! चल दर!!"
0,ट्विटर के बारे में खुद को थोड़ा सा सूचित करने के बाद अब मर चुका है और बिस्तर पर जा रहा है ... पी.एस. 2 दिन के खाने के लिए एक बूरिटो था! हालांकि XO हालांकि YUM नहीं है
0,फ्रांस में अंतिम दिन
1,"उपयोगकर्ता हां, वास्तव में एक धूप सप्ताहांत के लिए उम्मीद है"
0,लगता है कि मैं एक माइग्रेशन बग हो सकता है!
0,पानी पर दिन बिताने के लिए तैयार हो जाओ। Antalya में अंतिम सप्ताहांत।
1,खाना पकाने
0,यहाँ कोई फूड नहीं है
1,अच्छी तरह से मेरे लिए काम के लिए तैयार होने के लिए मेरे लिए - एक अच्छा है !!!!  और हाँ मैक नियम
1,"अब और साथ ही उपयोगकर्ता के साथ हम इस सप्ताह उस काम को करेंगे, गुरुवार को कैसे ध्वनि?"
1,आज रात ग्रिंगो स्टार। दक्षिणी गेराज।  यूआरएल
0,दंत चिकित्सक में मैं दंत चिकित्सक से नफरत करता हूं!
1,"त्वरित पासिंग बी 4 स्लीप: फॉलोमी कार मैग्नेट प्राप्त करने पर विचार करना, मेरे निक के साथ। बस इसलिए मैं एक महीने बाद परिणामों को पोल कर सकता हूं।"
0,उपयोगकर्ता: मुझे यह भी याद है
1,"उपयोगकर्ता सुप्रभात, क्या हो रहा है?"
0,URL - अब मुझे पहनने का कोई मौका नहीं है:/
0,उपयोगकर्ता ओह लानत है। यह वास्तव में बेकार है
1,मेरे सभी दोस्तों को प्यार करता है।
1,24 घंटे Pho ... अंत में
1,उपयोगकर्ता मैं आज उस सटीक उद्धरण को ट्वीट करने के बहुत करीब था।
0,के लिए सभी सेक्सी हो रही है ... के लिए .... काम
0,मुझे उस अंतिम मिनट कॉल नहीं होने दो मैं घर जाना चाहता हूँ !!!
1,रविवार = खेल दिवस मेरे लिए
0,मुझे इस बार lol #squarespace नहीं था
0,मैंने मुह केनेथ कोल धूप का चश्मा तोड़ दिया!  चूहों
0,उपयोगकर्ता पी.एस. यू ने मेरा नाम गलत शुक्रवार पर किया
1,"उपयोगकर्ता उत्कृष्ट, यह अधिक पसंद है"
1,"उपयोगकर्ता URL - वास्तव में बहुत बड़ा ... आपके लिए! मुझे तुमसे प्यार है   !! >>, c ===== 8"
1,उपयोगकर्ता aww मुझे वह फिल्म पसंद है
0,मुझे कुछ कट्टर ध्यान कक्षाएं चाहिए
1,कुछ संगीत onn gott
1,"उपयोगकर्ता हाँ, यह वास्तव में बहुत बढ़िया है"
0,ऊब गया हमने कल रात मनाने के लिए कुछ नहीं किया। ऐसी निराशा।
1,"उपयोगकर्ता बस अपने कुछ भावनाओं ट्विटर पोस्ट पढ़ें, न ही दुखी हो हम अभी भी आपके बारे में सोचते हैं और आपको याद करते हैं और आपसे प्यार करते हैं"
0,मैं वास्तव में एक 3 डी फिल्म देखना चाहता हूं ... कभी नहीं किया गया
0,मुझे लगता है कि मुझे कान का संक्रमण है
1,आईट्यून्स पर #1 शीर्ष गीत पर उपयोगकर्ता बधाई! <3
1,चरम नियमों की प्रतीक्षा है? समय उड़ता है जब आप किक-आउट में मज़े कर रहे हैं !! कुश्ती!  यूआरएल
0,उपयोगकर्ता धन्यवाद! आज सुबह एक नज़र था और जो मैं चाहता हूं वह स्टॉक से बाहर है फिर से जल्द ही जांच करेगा!
0,Usenix सम्मेलन। फिर से जल्दी
1,उपयोगकर्ता c'moon तब !! सीटू yg cibuk berath ciihh ... hehe: p bener yaaaa oneday!!! n ओह्या गुडलक w/ उर अंतिम परीक्षा YA CIMOD! c u darl ..
0,उपयोगकर्ता मैंने आपके सुझाव की कोशिश की ... अब मेरा उद्देश्य और बीबीएम जम गया है ... मैं इसे सिर्फ मोबाइल 2MRW पर ले जाऊं
1,"उपयोगकर्ता अच्छी तरह से मेग, ईर्ष्या की आवश्यकता नहीं है! वे मुझे जल्दी काम से बाहर निकालते हैं ताकि मैं किसी को ""यात्रा"" कर सकूं, जैसे पुरानी बुध रातों की तरह"
0,"लंच, क्लब मीटिंग, इफिन बोर"
0,मैं बस जाग गया आह! आई मिस्ड स्कूल
1,Ailey वर्गों पर उपयोगकर्ता अच्छा देख रहा है।  मुझे उनकी जरूरत है।
1,उपयोगकर्ता व्हाट्सएप खरीदने के लिए एक अच्छा इलेक्ट्रिक ध्वनिक गिटार? ide अपने शब्द को किसी भी समीक्षा साइट पर ले लो IDE वास्तव में एक उत्तर की सराहना करते हैं धन्यवाद
0,उह बकवास काम मेरे पेट हेला दर्द। मुझे बहुत सारे पानी चाहिए
0,"उपयोगकर्ता धन्यवाद Cuz Maegan मुझे इसके बारे में बता रहा था, लेकिन मैं इसे याद किया ... केट हालांकि जॉन के लिए बहुत अच्छा है"
0,मिसेस मैटी पू!  जब वह वापस आ जाता है तो उसे एक डच पतवार मिलेगा! लामाओ
0,रेस्ट इन पीस फ़राह फॉसेट
1,"Btw, यह पवन सप्ताह url है"
0,"बस मेरी लड़की को बताया कि मैं ट्विटर में शामिल हो गया, वह सोचती है कि इसकी बकवास ....... क्या कुतिया है। मैंने पक्षी whaaahhh पर डेढ़ साल बर्बाद कर दिया है!"
0,उपयोगकर्ता मौसम का पूर्वानुमान कहता है कि कल से आंधी से संभव है!
1,विल एंड ग्रेस xx के लिए याय
0,"नई पृष्ठभूमि n आइकन की तरह उपयोगकर्ता? और हाँ, वह पूरी तरह से अद्भुत है। मैं पप्पराज़ी से नफरत करता हूं जो उसे एक बोबले-हेड की तरह जस्टिंग करता है।"
0,उपयोगकर्ता क्या गलत है ??
0,मैंने लंबे समय में एक तितली नहीं देखी है
0,"उपयोगकर्ता जब स्काउट्स अभी भी खड़े नहीं होते हैं, तो दवा उनके मरने वाले गधे को ठीक कर सकती है क्योंकि उन्हें यह सब चिकोटी होना पड़ता है"
0,पहाड़ियों के सीज़न का समापन मुझे बहुत याद आती है। फुउक।
0,Gmail में बस हटाए गए या 106 संपर्कों को विलय कर दिया .... मैं कैसे चाहता हूं कि यह आसान था #squarespace
1,ऑडिशन-डे! यूआरएल
1,पोलैंड तक एक महीने और एक सप्ताह पहले हमारे पास पहला निन शो होगा। क्या यह बेहतर हो सकता है?
1,उपयोगकर्ता - वास्तव में नहीं। मध्यम आकार के बारे में। वह 7 महीने की टैबी है।  वह अब जेल से बाहर है।  वह ठीक से विपरीत प्रतीत होती है।
1,जाने के लिए उपयोगकर्ता का तरीका! मुझे आप पर गर्व है
0,तो वाट मैं करियर के लिए करता हूं अब क्यूज रेडियो कम हो रहा है
1,सुबह! मेरे बेस्टियों के साथ चाय के कमरे में जाना
1,काम बेकार है मुझे आज रात घर ले जाओ
0,"उपयोगकर्ता यह सिर्फ मेरा फोन है, या मोबाइल अपलोड के साथ एक अंतराल है? मेरा प्रतीत नहीं हो रहा है"
0,"इतनी बुरी तरह से अपनी आँखों को बाहर निकालने के लिए, G'night TwitterWorld, यह आज पढ़ने के लिए पर्याप्त है"
1,अदालत में एक अच्छा खेल था और बहुत अच्छी नई चालें विकसित कीं .... मुझे अब भविष्य का आदमी कहा जाता है
0,"वह मुझे वापस पाठ भी नहीं करेगा, वास्तव में वह चाहता है कि वह होगा।"
1,Rawunion URL के लिए नया रंग उड़ गया
1,उपयोगकर्ता आप सिडनी में हैं? MMM Apple स्टोर ..
1,"उपयोगकर्ता मैं थोड़ा इंतजार करूंगा और फिर इसे करूंगा ... क्या आपको नवीनतम एफडब्ल्यू पसंद है, क्या ब्राउज़र किसी भी तेजी से है? यह मेरी मुख्य चिंता है"
1,घर जाना
0,"उपयोगकर्ता निश्चित रूप से सुधार के लिए जगह है, लेकिन बहुत अधिक प्रोत्साहन नहीं है क्योंकि कोई भी उस बिंदु पर वापस नहीं कर सकता है।"
1,"Google Wave पहले Google कैलेंडर को मार देगा, फिर MS Office।"
1,उपयोगकर्ता :: प्यार प्रकाश और आपको भी गले लगाओ! ::
1,"यह आपके दांतों को डस्टिन बॉय को ब्रश करने का समय है, अब तक उसने कभी गुहा नहीं प्राप्त की है"
1,उपयोगकर्ता आप बेतरतीब ढंग से नहीं चुने गए थे।   मैं एक या एक महीने में समझाता हूँ।
1,उपयोगकर्ता nope।  मुझे नहीं पता था कि आप एक थे! D'OH!
1,स्पिडी पर कोई और नफरत नहीं! मैं उनसे प्यार करता हूं
0,उपयोगकर्ता URL - mg !!! थोज़ आर फूउकिन हूओटट !! लानत है मैं थोज अच्छा विकल्प 4 क्यू डैडी चाहता हूँ !!
0,"उपयोगकर्ता जी धन्यवाद। ;) मुर्गियां अच्छे हैं। बस उन्हें साफ करने के बारे में, मुर्गियों के मालिक का यह हिस्सा मुझे दुखी करता है।"
1,तीसरी मंजिल की बालकनी! कितना बुरा गधा?
0,"उपयोगकर्ता आह मैं देख रहा हूँ !!  मैं वास्तव में, अपने टेलली के सामने बैठा हूं जैसा कि मैं टाइप करता हूं .... काश यह जेन्सन पर एचडी में होता!"
1,"उपयोगकर्ता ... आप हमें बताने जा रहे हैं कि आप दिन के शब्द के लिए क्या तय करते हैं, इससे पहले कि वह खत्म हो जाए?  क्या आप टेनेब्रस पर बस गए?"
1,"ऑफ तू दा रेसेस! रेड बुल एयर रेस, कि वे आज शहर में हैं! जैसे -जैसे दिन आगे बढ़ता हूँ, मैं कुछ पिक्स ट्वीट करूँगा"
1,"तो, गोना वॉच जीजी 'के सीज़न 2 का फिनाले एपिसोड। मैं गपशप लड़की को याद करने वाला हूं। दो माह तक!! ज़ोर-ज़ोर से हंसना।"
1,GUS को एक समस्या हो रही है एक REF निर्णय - GUS के अनुसार इसका ठीक नहीं है।
1,उपयोगकर्ता मुझे इस सप्ताह #ff पर मिलेगा
1,हलीकला शिखर पर बाहर बहुत ठंडा रास्ता। लगता है कि मैं सिर्फ कार के अंदर से सितारों का आनंद लूंगा ... और शायद कुछ छूटे हुए ज़ज़ को पकड़ें
0,अभी अभी काम से घर आया हूं। बहुत लंबे दिन। मेरे घोस्ट हंटर्स शो को पोगो पर थोड़ा सा चूक गया और फिर रोशनी कर दी।
1,उपयोगकर्ता www.tweeterfollow.com का उपयोग करके एक दिन में 100 अनुयायी प्राप्त करते हैं
1,"यार, कोई मुझे टेगन और सारा को देखने के लिए ले गया और साथ ही उह उसे भी !!"
0,उपयोगकर्ता हमें इस ऑस्ट्रेलिया मुद्दे के बारे में बात करनी चाहिए ..
1,उस गाने में उपयोगकर्ता अद्भुत होने जा रहा है। इस एल्बम को सुनने के लिए इंतजार नहीं कर सकता।
0,मेरा दिल टूट गया है।
1,"बस एक नया ब्लॉग पोस्ट किया, इसे lemonadeday.wordpress.com/minneapolisst-paul पर देखें, मुझे पता है कि फिर क्या लगता है !!"
1,पट्टी लेने के लिए उसके रास्ते पर
0,दो घंटे की नींद के बाद अध्ययन करने के लिए उज्ज्वल और जल्दी लेकिन सूरज चमक रहा है।
0,"उपयोगकर्ता अच्छी समीक्षा, मैं चाहता हूं कि यह कुछ समय के लिए भारत को हिट करे"
1,"उपयोगकर्ता हाय, हुन! ) HRU? उसे आपको ट्वीट करते हुए देखकर खुशी हुई!  #MARSISCOMING #MARSISCOMING #MARSISCOMING #MARSISCOMING #MARSISCOMING"
1,उपयोगकर्ता धन्यवाद! आशा है कि आपके पास एक महान सप्ताह भी है!
0,उपयोगकर्ता आप उन्हें जॉर्डन बताते हैं;) मुझे लगता है कि आपका दर्द स्वीटी है।  ily। एक्स
0,उपयोगकर्ता मैंने सुना है कि बेहतर सीटें होंगी लेकिन इसके साथ मैं अशुभ हूँ!
0,मुझे यकीन नहीं है कि अब मैं कॉन्सर्ट में जा रहा हूँ ..
1,गुड मॉर्निंग ट्विटरविले कॉफी के साथ दिन अच्छा और आसान दिन शुरू करता है
1,हाहा। मैं लियोना को उत्साहित कर रहा हूं।
0,"उपयोगकर्ता lmao, बस यादृच्छिक हो रहा है !! यह लानत कुर्सी आज मुझे परेशान कर रही है हालांकि !!  हाँ, शायद मैं इसे बाहर फेंक दूंगा lol lol !!"
0,अभी अपने निबंधों को खत्म करना चाहता है! मैं बहुत ऊब गया हूँ। मेरे पास अभी भी 5 निबंध हैं।
1,दुनिया भर में सुप्रभात दुनिया भर के लिए फिट-फॉर-फॉर-फन #m outsli वॉन उपयोगकर्ता macht ja sowas von फिट)))
1,"उपयोगकर्ता मुझे 'फेल व्हेल' को बचाने के बारे में परवाह है, अपना ग्रीनपीस शुरू करें; 'पेटेपियास' फिर इस एक मिशन के बाद डिसपियर।"
0,"खैर, मेरी प्यारी केटी लड़की, मैं सिर्फ अस्पताल से घर गया! मैं ठीक हूं, लेकिन मुझे लगता है कि मुझे सर्जरी की आवश्यकता है - बाद में जल्द से जल्द!"
0,बकवास .... मुझे लगा कि वह भूल गई है।
1,"- खेलने के लिए, प्रश्न की प्रतीक्षा करें और फिर #spotquiz टाइप करें अपने उत्तर के बाद - और फिर एक छोटा संदेश"
1,"उपयोगकर्ता haha ​​हाँ, Fe वास्तव में हमारे प्यारे दोस्त हैं, उन्होंने हमारी पोस्ट वेडिंग पिक्स किया"
1,उपयोगकर्ता मैं वास्तव में अब बिस्तर पर जा रहा हूँ todo bien .. इस आगामी सप्ताह के लिए तैयार होने की कोशिश कर रहा हूँ
1,आगे देखने के लिए चीजों को देखना अच्छा है।
0,URL - गरीब बच्चे को अभी अच्छा नहीं लगता
0,उपयोगकर्ता मैंने साइन अप करने के लिए साइन अप किया है कि आप वेबसाइट बनाने और काम नहीं कर रहे हैं।
0,बस अब तक का सबसे लंबा नृत्य पुनरावृत्ति छोड़ दिया और हम उत्तरी चार्ल्सटन के डरावने यहूदी बस्ती में खो गए हैं
