0,उपयोगकर्ता मैं जानना चाहता हूं कि आप इसे देखने के बाद क्या सोचते हैं - मुझे इसके बारे में बात करने के लिए कोई नहीं मिला है!
0,मेरा घुटना आज गले में है कि यह क्या है कि बूढ़े को लगता है कि हाहा im अलग हो रहा है !!
1,मैं बहुत प्रेरणादायक हूँ ... और मुझे यह पसंद है कि मेरे बारे में
1,"उपयोगकर्ता: धन्यवाद।  बहुत दयालु है।  मुझे खुशी है कि वह खुद पर विश्वास करता था और कड़ी मेहनत की।  सभी के लिए मुझे परवाह है, वह बाहर मारा जा सकता था।"
1,"दुनिया को एक एहसान करो और एक साथ रहो, बस कोई भी बच्चा नहीं है जिसे समाज को समर्थन देना होगा।"
0,"अध्याय 14 कचरा की इस पाठ्यपुस्तक में सबसे खराब अध्याय है।  मुझे विश्वास नहीं हो रहा है कि मैं पुस्तक के अंतिम अध्याय, लोल को दे रहा हूं।"
0,"उपयोगकर्ता (वसा उंगली अंतिम प्रतिक्रिया) आप एक जानवर हैं - मुझे यह पसंद है! दोनों नहीं बना सकते ... पैक किया गया हूँ tmrw, अब 20yro नहीं"
1,उपयोगकर्ता आपको ट्विटर पर और हमारे टेलीविजन स्क्रीन पर वापस देखकर खुश है।  अगला नॉकआउट चैंपियन
1,ओची बेबी में है! मामा को एक इलाज देना - स्पा दिन और इतालवी दोपहर का भोजन ... यम!  मैं अपने मामा से प्यार करता हूँ!
1,उपयोगकर्ता www.tweeteradder.com का उपयोग करके एक दिन में 100 अनुयायी प्राप्त करते हैं
0,"दिन के गिरने की तैयारी में कॉफी की मेरी दैनिक खुराक। हालाँकि, मैं कुछ भी नहीं कर सकता।"
1,मेरे मम्मी के साथ नाश्ता करना।  फिर im कपड़े पहनने जा रहा है। WOHO! आज का दिन
0,मुझे यकीन नहीं है कि कभी -कभी क्या करना है ...
1,धूप में संशोधन! कनटाइम्स
1,देर रात बातचीत को प्यार करता है
0,"उस प्रश्न का उत्तर देने के बाद उपयोगकर्ता लोल ट्वीट! बेशक मुझे पता है कि सभी फिर से हैं, लेकिन यह एक लूवकी पुश है"
0,उपयोगकर्ता हाँ nuthin! बस रात के खाने की प्रतीक्षा कर रहा हूँ .. मैं भूख से मर रहा हूँ coz मैं आज केवल एक मिलो था
0,एक ब्लॉग मिला आप लोग इसकी जांच कर सकते हैं www.jely.blogg.no नहीं
0,मेरे माता -पिता और ब्रदर्स। मेरे बिना मॉल गए और यहाँ मेरे घर पर यहाँ सब अकेले मैं खरीदारी करना चाहता हूँ !!! :*(
0,"क्रिस्टोफर इंगल, आपको शो के बाद क्यों छोड़ना होगा?"
0,OMG सोमवार को एक BAAAAAAD होने जा रहा है
1,उपयोगकर्ता रसोई में एक रेस्तरां में काम करता है इसके ठीक योग्य। कुछ भी नहीं है आलसी haha ​​आप/ x
0,"अगर मैं बीमार हो रहा हूं या अगर यह एलर्जी है, तो गले में खराश, नाक, छींक दूनो को छींक देता है। बाद के लिए प्रार्थना ....."
0,उपयोगकर्ता मुझे अपनी सालगिरह के लिए पत्नी के साथ एक सप्ताह की ऑफ़लाइन करना था। नो ईमेल नो नथिंग इनबॉक्स फट गया
1,"वू, जल्द ही मैं अपने 360, साथ ही फेसबुक से भी ट्विट कर सकता हूं"
0,विज्ञान में im उम्मीद कर रहा हूँ कि मैं मर गया
0,"घर पर बैठे, काश हम वहां होते"
1,"रात का खाना उठाते हुए, पहले से ही फिल्में मिल गईं।"
1,उपयोगकर्ता धन्यवाद स्वीटी
1,काम करने के लिए तैयार 'मज़ा'
0,"काम। ऊघ, मैं बल्कि सो रहा हूँ"
0,उपयोगकर्ता मैं आज लाइव शो से चूक गया जब डाउनलोड बाहर आ रहा है? इसके लिए आगे देख रहे हैं! #मोड़
1,"उपयोगकर्ता ओह पिश, मैं उपयोगकर्ता का अनुसरण कर रहा हूं क्योंकि वह पहली बार शामिल हुआ- उसके कुत्ते ने भी एक बार मुझ पर ट्वीट किया"
1,"उपयोगकर्ता हम्म चिंता मत करो, btw मुझे भी सो रहा है [लगभग वास्तव में] MKT को अपना काम करने दें, हम अपना काम करेंगे, जीवन का आनंद ले रहे हैं"
1,"उपयोगकर्ता अभी भी अच्छा दिखता है, कोई चिंता नहीं!"
0,कल सुबह एक भयानक वापस मोच थी !!! पूरे दिन बिस्तर पर चढ़ा हुआ था
0,शिट मुझे 700 यूरो होलीशिट के लिए ए 4 के लिए दो टायर बदलना चाहिए
1,उपयोगकर्ता इसे एक साथ मिलाएं और यह रूओक हो जाएगा।
0,उपयोगकर्ता बहुत बुरा हम स्वीडन में हैं जहां अक्टूबर तक यहां सिनेमाघरों में नहीं है
0,मुझे लड़कों के साथ अपनी पिज्जा पार्टी में कल रात हुक्का पर ओडेड किया गया होगा। मैं इस धारणा के तहत था कि आज शनिवार थे
1,उपयोगकर्ता haha ​​अच्छी तरह से यह 8 अगस्त को है .. तो हाँ
1,मेरे मेरे iPod टच के साथ Playin
0,उपयोगकर्ता SOOO ने हमें तबाह कर दिया जो ऑस्ट्रेलियाई सैनिकों को अब आपको प्यार दिखाने के लिए नहीं मिलेगा। हमारे संगीत समारोहों को रद्द कर दिया गया है।
0,"उपयोगकर्ता - यह Sa mundo ng शोबिज से परहेज नहीं किया जा सकता है, दुख की बात है।  केवल एक चीज जो हम कर सकते हैं वह है [और बाकी सभी दोनों का भी समर्थन करें]"
1,ट्विटर पर मुझे जन्मदिन की शुभकामना देने के लिए उपयोगकर्ता Ty। आप केवल एक ही थे।
0,उपयोगकर्ता भी आप नहीं
0,इतना थक गया लेकिन 2 बिस्तर पर नहीं जाना चाहता
1,उपयोगकर्ता वह एक eplictic [sic] नृत्य शैली स्पष्ट रूप से #IanCurtis था
1,हा हा एयरो..मैं इस बारे में सोच रहा था कि हाल ही में .. !!
1,"तो, उपयोगकर्ता मेरे हाथों से मेरे फंकी पुरानी डेस्क को लेना चाहेगा। क्या एक ट्रक के साथ वैंकूवर में ट्विटर पर कोई है जिसे रिश्वत दी जा सकती है?"
0,जल्दी उठा क्योंकि यहाँ लोग वेंट्स की सफाई कर रहे हैं
0,मैं नहीं कर सकते
1,री-पिंगिंग यूजर: क्या कोई ऐसा व्यक्ति है जो एक अच्छी बातचीत करना चाहता है?! कोई साइबर सेक्स नहीं !! ..
0,"मुझे सोमवार की सुबह एक्सेल करने से नफरत है। अर्घह, आधा दिन, और बजट अभी तक तैयार नहीं है!"
0,ईसा मैड कि मेरा पेट इतना बुरा चोट लगी है ।।
1,फॉलो पारस्परिक के लिए उपयोगकर्ता चीयर्स
0,"उपयोगकर्ता: Aww !! वहाँ हमेशा अगले साल है, प्रिय! बहुत दिल टूटना नहीं है !!"
1,बारिश ने वॉक को ठंडा कर दिया है। बूंदा बांदी सुनना बहुत शांतिपूर्ण है। यह मेरे दिमाग को शांत करता है।
0,"क्षमा करें कि पिछले ट्वीट को वास्तव में देर हो चुकी थी, मुझे एहसास नहीं था"
1,उपयोगकर्ता शुभ रात्रि!  <3 मैं आप अधिक से अधिक!
0,उपयोगकर्ता मेरे फोन को यू सॉरी लोल पर मर गया और मैं अपने चार्जर को नहीं ढूंढ सकता हूँ .... यह बेकार है
1,एस्टोनिया में अगले साल के जेसीआई बाल्टिक सम्मेलन के आयोजन में कुछ जिम्मेदारियां लीं। इतना उत्तेजित!
1,उपयोगकर्ता कांटे वाह! बहुत बढ़िया अवसर!  बालों के लिए भयानक लेकिन भयानक अवसर! लोल बहुत सारे पिक्स ले लो
0,जब तक माइकल जागता है तब तक मुश्किल से सोता रहा
1,शुक्रवार का अनुसरण करें उपयोगकर्ता का पालन करें वह पागल मजाकिया है। मेरे चेहरे पर रहता है।
1,"उपयोगकर्ता हाँ w/एक डेटा योजना से अलग, केवल अन्य विकल्प सिर्फ w/पाठ है ...।"
1,"उपयोगकर्ता haha ​​i dunnoo, मैं देखूंगा कि क्या चल रहा है! नेबरहुड स्नूप हियर एक्सपी ... बीटीडब्ल्यू, लगता है कि आज मैंने नाश्ते के लिए क्या किया है"
1,"उपयोगकर्ता जो हमेशा की तरह, दृष्टिहीनता में तय किया जाएगा। मुझे अभी भी रिलायंस आईपीओ के लिए लंबी लाइनें याद हैं"
1,मेरी चाची के साथ @ कारें देख रहे हैं
0,मैं सिम्स खेलना चाहता हूँ
1,11-4 काम कर रहे हैं!  फिर जॉन फ्रेंडज़ के साथ शहर के चारों ओर जॉन दिखा रहा है।  यीशु खलिहान और भूत शिकार !!
1,डेल्फ़्ट के लिए कुछ मिनटों में और आइसक्रीम के साथ-साथ मेरे निंटेंडो डीएस
1,मैं * प्यार * चिया बीज! sooooo यम्मी!  एक खूबसूरत दिन मुबारक हो! XO
1,अब URL ट्यून में लाइव है!  #IHC #HOUSEMUSIC #DEEPHOUSE #DJ #HOUSE #HOUSIC
1,इसके पहले से ही गर्म!
0,उपयोगकर्ता आपको यान क्यों पसंद करना चाहिए
0,"उपयोगकर्ता यह मेरे सभी मेकअप, मेरे जो ताजा स्वेटर और मेरी वर्दी लेकिन बर्फ पर सितारों के लिए उत्साहित थे! (और जोनास अगर केवल हमारे पास डिज्नी था)"
0,उपयोगकर्ता क्या मैं अभी भी क्लब में आ सकता हूं कि मेरे पास फेसबुक नहीं है? रोब कहते हैं नहीं।
0,सुबह .. मैं वास्तविकता के लिए तैयार नहीं हूं
0,"उपयोगकर्ता एक बॉट? -माई मैं अभी भी इस तरह की तकनीक के लिए उपयोग नहीं कर रहा हूँ -""बहादुर नई दुनिया"" ged, लेकिन एक बॉट को भी नजरअंदाज किया जा सकता है, अवरुद्ध, ध्वजांकित किया गया है"
0,स्किपिंग सुबह की दौड़। नेशनल रनिंग डे के लिए आज शाम को कारा के साथ चलने की योजना बनाएं।  आज पूरे दिन पीटीए जेल में वापस।
0,IPhone पर ऐप्स को व्यवस्थित करने की कोशिश करना एक ऐसा PITA है
1,Arrrg शुभरात्रि मेरे दो lovvves उपयोगकर्ता और उपयोगकर्ता:*
1,वाह जो तीव्र था। मेरे सभी पसंदीदा अभी भी जीवित हैं।
1,उपयोगकर्ता अब यह टॉम का आनंद लेने का समय है!
1,और दिन दो आधिकारिक तौर पर क्रॉपलूजा में शुरू हो गए हैं। URL पर यहाँ से पिक्स की अनुमति नहीं हो सकती है
0,"हमने आज एक बन्नी को छींटा दिया, पूरी तरह से सपाट था, यह भयानक था"
1,"#followfriday उपयोगकर्ता - मजाकिया, राय, वुडलिस को नापसंद करता है और महान सुशी बनाने पर सबक देता है"
0,पैट्रिक डेम्पसी = आज रात राउंडहाउस में ... एक बार मुझे काम नहीं करना है
1,जल्द ही बिस्तर पर जाने की जरूरत है .... या घर के लिए घर
0,Tryna मेरे लिए अपने मनोदशा को हल्का करो मेरे लिए y'all ...
0,यह सुनने के लिए उपयोगकर्ता क्षमा करें!  हालांकि आप #prideto टैग के साथ सभी कार्रवाई का पालन कर सकते हैं: URL
1,हवा पर उड़ान और स्थिति अद्यतन
1,उपयोगकर्ता आपको उन्हें ठीक करने के लिए उनके सेल फोन या कंप्यूटर पर आलू को ढेर करने के लिए कहा जाना चाहिए
1,शुभ प्रभात
1,मेरे पिताजी को नहीं लगता कि वह खर्राटे लेता है !!
1,उपयोगकर्ता हे ट्विट्टी
1,"ऊबने और संगीत सुनने के लिए, लैकुना कॉइल ftw"
0,बहुत यकीन है कि मैं बीमार हूँ ... या मर रहा हूँ।    नए APT के लिए यह नो-क्लटर पॉलिसी इतनी अच्छी तरह से काम नहीं कर रही है।  गंदगी को दूर किया जा सकता है।
0,उपयोगकर्ता ओह .. यह है? > _> मेरा मतलब है!  बेशक यह है ...: l im थक गए
0,SOO खेद है कि मैं आपके जन्मदिन की पार्टी केविन के पास नहीं जा सका! मुझे आशा है कि आप मजेदार w/o मुझे होगा
0,उपयोगकर्ता: //twitpic.com/7qo9s समुद्र तट पर जाना चाहते हैं .. लेकिन फिर भी बाहर बारिश हो रही है!
1,उपयोगकर्ता टीवी पर शो देख रहा होगा और शर्त लगाएगा कि आप एक उपस्थिति बनाएंगे!
1,उपयोगकर्ता अच्छा है।  LMAO मैं अपने दोस्त के साथ डिनर पर गया और उसे आइकिया में अपनी रजिस्ट्री करने में मदद की क्योंकि उसके मंगेतर आलसी हैं। ट्वास मज़ा थो। = पी
1,कुछ दिन के लिए! जिम का समय!!!
1,सिटिन 'यहां रे विली हबर्ड को सुनकर KNBT जड़ों और शाखाओं पर रहते हैं। मुझे रे से प्यार है। क्या महान आदमी है।
0,"बस एक धर्मी झपकी से जाग गया। अभी भी थक गया है, हालांकि"
1,क्या किसी को एक अच्छा मास एसएमएस प्रदाता पता है? सस्ता और अच्छा?
0,"चाय पीना, बारिश देखना।  इन कार्यालय खिड़कियों को वास्तव में सफाई की आवश्यकता है।  आज ऊब गया"
1,उपयोगकर्ता यह मेरे लिए एक सामान्य अनुभव है! मैं इसे अपनी आँखें बंद करके कर सकता था ... लेकिन मैं coz नहीं करूँगा मैं कुछ पर यात्रा कर सकता हूँ
0,"प्लर्कलोव सभी सो रहे हैं, अलग -अलग समय क्यों होना चाहिए?"
0,"बस मेरी माँ और रिकी से बात की। वे दक्षिण डकोटा में एक और सप्ताह रह ​​रहे हैं, मुझे अपने बच्चे की याद आती है"
0,"उपयोगकर्ता मैंने उसे कुछ समय पहले जगाया था और वह एक खुश नहीं था, मुझे यह प्रफुल्लित करने वाला नहीं था, उसे .... इतना नहीं।"
1,उपयोगकर्ता
0,उपयोगकर्ता gnr i aint सुनो u say dat! मेरा बुरा
0,पता नहीं कहां से इन सभी पैकिंग/सफाई के साथ शुरू करें ... मैं अभी घर जाना चाहता हूं
1,आज रात चिकन कोरमा में मेरा हाथ आजमाने के लिए जा रहे हैं।  मुझे शुभकामनाएँ दें!
0,कारमेल से कारमेल उच्च वृद्धि और बस मेरे बाल कटवाने मिल गया ... खिचड़ी भाषा कहो मैं इसे प्यार करता हूँ ... यह गर्मियों के लिए पतला हो गया
0,"उपयोगकर्ता Naiiiice, आपका स्काइप क्यों काम नहीं कर रहा है?"
0,"उपयोगकर्ता ""डरावना"" सोच ग्रंथि बुखार वापस आ रहा है"
0,उपयोगकर्ता मैं उस उम्र में हूं जब मुझे 3 डी फिल्में देख रहे हैं
1,उपयोगकर्ता मैं सिर्फ एक अकेला ट्रक है
0,Doctorrrrr के लिए जाना
1,उपयोगकर्ता im आज मछली प्राप्त कर रहा है !!!!
1,"व्यंग्य सेंट्रल: ""अगली बार जब मैं आपकी राय चाहता हूं तो मैं इसे आपको दे दूंगा।"""
0,उपयोगकर्ता निबंध लेखन
0,"काम पर जा रहे हैं ... उम्मीद है कि मैं एक सवारी घर पा सकता हूं, Bluuhhdd। या फिर im स्क्रू।"
0,मैं झूठ नहीं बोल रहा हूँ मैं अपने नए सबसे अच्छे दोस्त उपयोगकर्ता की उपेक्षा कर रहा हूँ .....
0,"जब तक आपके सर्वर पर लोग हैं, तब तक अन्य लोग शामिल होंगे। यह एक विरोधाभास है, मुझे पता है।"
1,"स्कूल बहुत उबाऊ था, फिर भी दुखी था, लेकिन ठीक होने में कामयाब रहा"
1,उपयोगकर्ता हाय मैं आपको एक डीएम स्वीटी भेजने की कोशिश कर रहा था
0,"देखा जय लेनो ने कहा कि आज रात को अलविदा कहो थोड़ा दुखी है। खैर, आपको शुभरात्रि, मीठे सपने।"
1,फिर से धन्यवाद डेविड कुक और उपयोगकर्ता एक amaaaazing अनुभव के लिए मैं कभी नहीं भूलूंगा आशा है कि आपने यहां रहने का आनंद लिया है
