1,"उपयोगकर्ता पुराने कैमरे शांत हैं! मुझे एक लीका एम 8 (डिजिटल वन!:>) और लोमो कैमरा चाहिए।  हां, Cory एक मैनुअल कैमरा का उपयोग करता है"
0,"मेरे गमोसा/वेलोर प्रकार के जूते बर्बाद हो गए हैं, बारिश को हर बार जब मैं घर गया तो बारिश को रोकना पड़ता है?!"
0,"उपयोगकर्ता ओह भगवान मुझे पता है, मैंने इस मौसम में अध्ययन करना असंभव है!"
1,"बिस्तर पर, रात सब"
0,ऐस एंडर्स और COD4 <3 रोजर के काम से बाहर निकलने के लिए इंतजार नहीं कर सकते। मुझे उसकी याद आती है।
0,"URL - मैं परेशान हूं लेकिन जब जीवन आसान नहीं है, तो प्रार्थना करें"
1,"उपयोगकर्ता ive को इटली और स्लोवेनिया में रिश्तेदार मिले, इसलिए जब मैं स्लोवेनिया में होता हूं तो मैं उनके स्थान पर कुछ रातों में रहूंगा!"
1,#andyhurleyday
0,उपयोगकर्ता आह नहीं! वह बेकार है
0,मैं गर्मियों में jaaaaaaaaaaaaam देखना चाहता हूँ!
1,"वे मजेदार मेले से प्यार करते हैं, मैं अपने सभी दोस्तों से प्यार करता हूं!"
0,"उपयोगकर्ता एक बार के लिए NY में रह रहा है, कुकआउट सैट और सन में जा रहा हूं, फिर मैं अभी भी सोमवार को काम कर रहा हूं"
1,उपयोगकर्ता आप मॉडल-पुरुष के साथ नहीं थे?
1,चीज़केक फैक्ट्री गिफ्ट सर्टिफिकेट आया
1,आपका स्वागत है नए दोस्तों! निम्नलिखित के लिए धन्यवाद!
1,"उपयोगकर्ता wassup शहद, za ofto to visi the po ovome"
1,"उपयोगकर्ता मैं इन शब्दों को अच्छी तरह से जानता हूं। यदि आप उनसे मतलब है, तो वे जादू कर सकते हैं!"
1,उपयोगकर्ता आह अच्छा मैंने सिर्फ सिंगापुर में अपने सामान्य अड्डा के साथ जाँच की और उन्हें 2TB स्टूडियो II इकाइयों में से कुछ मिले; RAID1 के लिए आदर्श।
0,टेक थिएटर मेरी आत्मा का मालिक है
1,एडवर्ड कुलेन को सेड्रिक डिग्गरी को प्राथमिकता देता है और 6 वीं एचपी मूवी के लिए इंतजार नहीं कर सकता !!
1,"सोमवार के लिए रूट करना चाहता है, मैं वास्तव में करता हूं, लेकिन मैं अभी नहीं कर सकता। सोमवार का सबसे अच्छा हिस्सा यह जान रहा है कि शुक्रवार को केवल 5 दिन दूर हैं ..."
1,वर्तमान में 90210 देख रहा है ... साइड पर स्नैक्स के साथ
0,बस बोन्स के शहर को पढ़ना समाप्त कर दिया। उतना अच्छा नहीं जितना मैंने उम्मीद की थी।  मुझे नहीं लगता कि मैं बाकी त्रयी पढ़ूंगा।
0,उपयोगकर्ता eeee मैं piou piou नहीं जानता था
0,"उपयोगकर्ता: यह अच्छा था, हालांकि बारिश के कारण छत और बाहर बंद थे। और एक्सएल बॉल पिट बाहर है।"
0,थोड़े नीचे महसूस करना।    काश मैं बिस्तर पर वापस जा सकता।  बच्चों को बाद में जंगल में एक प्लेडेट पर ले जाना।
1,उपयोगकर्ता धन्यवाद
1,"उपयोगकर्ता धन्यवाद, माननीय।"
1,उपयोगकर्ता आज आप कैसे हैं #ff के लिए बहुत बहुत धन्यवाद?
0,उपयोगकर्ता यह असली एमिनेम आपके नकली नहीं है
1,मेरे लिफाफे आइकन पर अपडेट ... MacThemes देखें (URL कोई लेबल संस्करण नहीं ..
1,"एक लड़की जिसे मैं नहीं जानता, वह मेरे कुत्ते के साथ cuddling है।  500 अपडेट। ट्विटर मजेदार है।  एक अच्छा दोस्त हैरी पॉटर प्रीमियर पर मेरे साथ जा रहा है ।।"
0,वास्तव में अब बिस्तर पर जाना चाहिए ... लेकिन मुझे भूख लगी है। मुझे नहीं लगता कि मेरे पास कोई अच्छा त्वरित स्नैक्स है
0,डॉक्टर के पास मेरी बिट्टी बग लेना।
1,"हम ट्विटर पर बहुत अधिक समय बिताते हैं, गड मॉर्निंग"
0,उपयोगकर्ता आपको कामना चाहिए कि मैं अभी घर था
1,उपयोगकर्ता नाइट नाइट! आपके साथ फिर से ट्विट टॉम।
1,"अरे हाँ, मैं भूल गया ... मुझे गेंद के लिए किस रंग की पोशाक मिलनी चाहिए ?? विषय ""लास वेगास"" है, कृपया उत्तर दें"
1,शुक्रवार से बेहतर क्या हो सकता है?  यह एक छुट्टी सप्ताहांत पर शुक्रवार है! WOOHOO !!!
1,सुझाव देने के लिए उपयोगकर्ता धन्यवाद! बाकी सब मुझे लगता है कि सो रहा था!
1,"Url - अरे यह मेरी टिप्पणी पोस्ट नहीं किया! मैंने कहा कि जब आप मुझे देखते हैं तो उपयोगकर्ता प्यार करता हूं, मैं आपको नशे में लूता करता हूं! गुनगुनाहट"
0,"। बस बहुत दुखी। जब वह ""ग्रासहॉपर"" था, तब उसने मुझ पर सकारात्मक प्रभाव डाला था"
0,उपयोगकर्ता यूके में आपकी सीडी किस तारीख से बाहर आती है? मैं इसे यूके XX में इंटरनेट पर कहीं भी नहीं पा सकता हूं
1,उपयोगकर्ता ने सिर्फ आपका वीडियो देखा - आप लड़की जाते हैं। मैं वास्तव में हां के लिए खुश हूँ
0,"7 साल के बाद, रॉसी ने इतालवी MotoGP नहीं जीता है ... कम से कम उसे एक पोडियम फिनिश मिला है!"
0,मैंने अब अध्ययन किया है ... वे वास्तव में जानते हैं कि निर्दोष लोगों को कैसे यातना दी जाए।
1,उपयोगकर्ता आपको भी प्यार करता है
0,मेरे भरोसेमंद मैकबुक प्रो की हार्ड ड्राइव अंत में 2 1/2 वर्षों के बाद मृत्यु हो गई। इसे खोलने और एक नया स्थापित करने के लिए समय चीर! उघह
0,बहुत अच्छी तरह से नहीं।
1,"आश्चर्य है कि इयान जोन्स को ट्विटर पर जाने में कितना समय लगता है, क्योंकि वह ""बागवानी छुट्टी"" पर है और फेसबुक में अपने दिन को भरने के लिए चारों ओर घूम रहा है"
0,उपयोगकर्ता wowâ ¦ उन्हें मदद पाने की जरूरत है यह अच्छा नहीं है
0,मैं अब अपना वसा चलाने वाला हूं।
0,उपयोगकर्ता योग्य! मैंने बिस्तर को चीरते हुए सुना! फिर भी एक और बात मुझे इस टाउनहाउस पसंद नहीं है!
0,मैं एवन करने के लिए बाहर जा रहा हूं और अपने मम बीएफ महान दादाजी को देखने के लिए अस्पताल जा रहा हूं क्योंकि उन्हें पिछले हफ्ते दिल का दर्द था
1,"वाह मैं सब कुछ के साथ शिथिलता, मुझे एक समस्या है"
0,काश एल्विस अभी भी जीवित होता
0,गृहकार्य
1,घर पर yayayyyy
1,उपयोगकर्ता अच्छा बाल कटवाने। बहुत अच्छा
0,उपयोगकर्ता नहीं! मैं रुक जाऊंगा ... कृपया नहीं।
1,"यदि आपके पास जीतने की इच्छाशक्ति है, तो आपने अपनी आधा सफलता हासिल कर ली है! यदि आप डोते हैं, तो आपने अपनी विफलता को आधा हासिल कर लिया है! उस बारे में सोचना"
1,उपयोगकर्ता हम 100 y/o विला में हैं - सर्दी हमारे लिए डक्ट टेप का मौसम है
1,रयान के साथ पोर्च से शुक्रवार को चीयर्स देखना। लोग देख रहे हैं। ओय!  यूआरएल
1,"उपयोगकर्ता मैं अभी भी बीमार हूँ, लेकिन देखा v डाउनलोड हो रहा है"
1,पूर्वी और पश्चिमी सम्मेलन फाइनल के लिए इंतजार नहीं कर सकते
0,उपयोगकर्ता lol मुझे याद है मैं इसे अब से पहले फ्लिप कर सकता था मैं नहीं कर सकता
0,"उपयोगकर्ता Aww, मुझे यह सुनकर खेद है"
0,उपयोगकर्ता सुंदर गीत - आशा है कि आपका दिन बहुत दर्दनाक नहीं था
0,"उपयोगकर्ता उपयोगकर्ता ने सुझाव दिया कि मैं खुद को इंट्रो; हमारे पास बहुत कुछ है, esp। इस सप्ताह के खराब प्रदर्शन को देखते हुए"
0,"पूल द्वारा बिछाना, अभी भी मेरी परियोजना पर शिथिलता है। वास्तव में मूड में नहीं, लेकिन मैं कभी नहीं हूं।"
1,क्या आप जानते हैं कि एमटीवी मूवी अवार्ड्स की मेजबानी कौन कर रहा है?  हॉलीवुड में एकमात्र लड़का है कि मैं पूरी तरह से जुनूनी हूँ !!!!
0,उपयोगकर्ता im वास्तव में स्वादिष्ट अंडा मुक्त आइसक्रीम #favoriteicecream खोजने में परेशानी हो रहा है - किसी को भी किसी भी सिफारिश मिली?
1,नोवा में मेरे नए एप्ट में मेरे बिस्तर पर लेट। आह्ह्ह्ह घर होना अच्छा लगता है
1,हाहा! सही?! आपको लगता है कि मैं अपना सबक सीखूंगा और यह कभी नहीं कहूंगा।
0,"कभी -कभी मैं कुछ इतना बुरा चाहता हूं और यह बहुत करीब है, लेकिन फिर भी मेरे पास नहीं हो सकता है। मेरे हाथ इसके लिए पहुंचने के लिए बहुत कम हैं"
0,जब दौरा समाप्त होता है तो यह पसंद नहीं है।
0,"उपयोगकर्ता ओह रुको क्या आप सितंबर में एक संगीत कार्यक्रम में जा रहे हैं?! मेरा अक्टूबर तक नहीं है, लेकिन कम से कम मैं इस पर जा सकता हूं!"
1,उपयोगकर्ता मैं उससे सहमत हो सकता हूँ!
1,"उपयोगकर्ता आपका स्वागत है, que o tema e a teoria bem merecem"
0,"अच्छी तरह से लानत है। मेरी मृत्यु हो गई।  लानत गोरों (मरे, नस्लवादी हाहा नहीं)"
1,हाहा वाह मैं एंडी सैमबर्ग प्यार करता हूँ
0,उपयोगकर्ता ने कहा कि इसके बहुत देर से कारण वह पहले से ही फ्लायर बना चुके हैं जो मैं वास्तव में यू चाहता था
0,"मेरे पैरों में चोट लगी है, मेरे पास बहुत ज्यादा नशे में नशे में धमाकेदार नीट है, सुबह के बाद हमेशा सबसे खराब होता है! लानत है शराब !!!!"
0,बहुत थका हुआ है और बहुत बीमार महसूस कर रहा है किसी को अभी तक छीनने की जरूरत है
1,उपयोगकर्ता धन्यवाद
1,उपयोगकर्ता मुझे पता है।  कम से कम हमारे पास एक -दूसरे को वेंट करने के लिए है क्योंकि हम इसके साथ सौदा करते हैं #Autism
1,उपयोगकर्ता lol यह थोड़े प्यारा है
0,"#NADAL को इस #Wimbledon URL को याद नहीं करना चाहिए ""मैंने सब कुछ आजमाया"""
0,कामों में
0,इस बालों की बात करना। अगर यह काम नहीं करता है ... अच्छी तरह से विफल।
0,"मेरे कैमरे ने आखिरकार उघ को तोड़ दिया, इतनी सारी चीजें जो मुझे चाहिए, टूट रही हैं!"
0,उसे चाहता है
1,उपयोगकर्ता आप या टैप टीम में से कोई है जो ट्विटर में शामिल होने के लिए स्टीव प्राप्त करने जा रहा है? तुम्हे करना चाहिए!
0,रेत फिल्टर में 350 पाउंड रेत को बदलना।  पहले से ही 3500 पाउंड की तरह लगता है।
0,"मेरी बिल्लियों को तरल मौखिक मेड देने से नफरत है। कोई हिसिंग, काटने, खरोंच करना, लेकिन फिर भी मुझे ऐसा लगता है कि मैं उन्हें या कुछ और कर रहा हूं।"
1,उपयोगकर्ता मैं डेव हाउस का एल्बम भूल गया। यह बढ़िया है। BanquetRecords.com उस बुरे लड़के को पाने के लिए जगह है
0,"मेरा ब्लॉग दुखद है, यह कहता है कि कोई भी मुझसे Google कनेक्ट के माध्यम से जुड़ा नहीं है"
1,"इससे पहले कि मैं अपने से आगे व्यस्त दिन से निपटने के लिए नाश्ते के लिए मुझे क्या करना चाहिए, इस पर विचार करना।"
1,दुखी घर का सौदा हो गया .... अब हम आगे बढ़ते हैं .... उंगलियों को पार करते हुए
1,उपयोगकर्ता अच्छी बात है कि यह लगभग खत्म हो गया है
0,"उपयोगकर्ता awhh, कि बेकार है।  मुझे माफ़ करें।"
0,मुझे बीयर पोंग खेलने की अनुमति नहीं थी
1,"उपयोगकर्ता मैं सप्ताह में एक दिन वैन ब्यूरन में एक स्क्रैपबुक स्टोर पर काम कर रहा हूं, मेरे पास कोई निश्चित कार्यक्रम या कुछ भी नहीं है"
0,उपयोगकर्ता मैं उसी तरह महसूस करता हूं
1,अकाउंटिंग का मेरा होमवर्क करना: विश्वविद्यालय में तिजुआनाआ यूएबीसी
1,"उपयोगकर्ता erm, यह कैसे सुझाव देगा कि मैं गठिया हो सकता है मुझे बेहतर महसूस कर सकता है?! हालांकि सूरज के लिए हुर्रे"
1,"वापस अंदर, बहुत गर्म"
1,"उपयोगकर्ता yup, im शुक्रवार को कार्ली और ओली (और जैक!) के साथ लाइव!  फिर देखें"
0,"अब, अधिक कपड़े धोने"
1,"मैंने अधिक पाई खाई है, और लेयर्स मैगज़ीन की खोज की है, कभी -कभी, उन लेखों को चलाएं जिनका मैं उपयोग कर सकता हूं।"
0,"Im बीमार, मैं स्कूल के लिए अनुपस्थित था और मैं अपने घर से बाहर जाना चाहता हूं लेकिन यह ठंडा है"
1,उपयोगकर्ता हाय शीला! मुझे हॉर्नी किटी के बारे में आपकी पहेली पसंद आई। मजाकिया और सटीक। क्या कीट! आपका दिन अच्छा रहे!
0,उपयोगकर्ता मुझे भी उम्मीद कर रहा हूं कि Lollapalooza
0,अब मैं अपने कमरे की सफाई करते समय एक शॉवर ले रहा हूं।
0,"Usher हाँ मुझे भी, बस बहुत कुछ सीखने के लिए है"
1,"वर्तमान में इस कोरियाई श्रृंखला ""बॉयज़ ओवर फ्लावर्स"", ""हाना किमी"" और ""प्रिंसेस ऑवर्स"" की पूजा करते हुए। महान श्रृंखला, मैं वादा करता हूँ!"
1,"हम घर हैं! और मैं अपने नए, स्वच्छ बेडशीट, हाल ही में फ़्लिप किए गए गद्दे, और रात-रात के साथ छीनने के लिए एक पति का आनंद ले रहा हूं"
1,उपयोगकर्ता मैं वहीं मैं ya बेब lol के साथ मेरे cuz मुझे सुन रहा है ...
1,उपयोगकर्ता मुझे भोजन और स्पा से प्यार करता है।
1,"उपयोगकर्ता, उपयोगकर्ता, उपयोगकर्ता: हम अपने मित्र की कपड़ों की लाइन के लिए मॉडलिंग करेंगे।"
1,"उपयोगकर्ता Hehehe aww बेबी! नहीं, मैं यह याद रखना चाहता हूं कि अगर मैं नहीं, तो यह मुझे परेशान करता है"
1,"ऊप! इससे पहले कि मैं जाता, यहाँ लिंक 2 मेरा मासिक समाचार पत्र w/जीने के लिए महान सुझाव! यह हर महीने चाहते हैं? url"
0,अभी तक नहीं किया गया! मेरी आँखें बहुत थक गई हैं ना .. url
0,अस्वस्थ लगता है। हम्म (सोच) दर्द एक बार में एक बार मेरे सिर में पॉप होगा। मुझे पता है कि यह क्या है
0,"उपयोगकर्ता हाँ और यह ठंड है, मैं सर्दियों im से नफरत है सचमुच कंबल पहने हुए"
1,उपयोगकर्ता मैं आपको शुभकामनाएं देता हूं।
1,Spotify से 'जिया' को 'हाय ज़िया' कहना
0,#optus 3g दुर्घटनाग्रस्त हो गया है और मैं अपने #iphone पर कुछ भी नहीं कर सकता ... मुझे लगता है कि एक हाथ काट दिया गया है
1,उपयोगकर्ता मैं इस तथ्य के रूप में अभी अनुभव कर रहा हूं।
0,विज्ञान होमवर्क!
0,कोई नज़र दोस्तों पर नहीं आया! यूआरएल
0,काम पर जाने के बारे में।
1,सिल्वर क्रीक सोउन yayyy में जा रहे हैं!
1,"29 नवंबर एक नीट होगा कि फिलिप्स एरिना में कोई भी कभी 4GET नहीं होगा ... क्यों? becuz मैं लोला, सहयोगी हन्ना, और पिताजी में पिताजी होगा"
0,यह सिर्फ महान है ...
