0,हमारा एक्सचेंज छात्र आज घर गया - मैं उसे पहले ही याद करता हूं।
0,अंत में घर ... यह एक लंबा दिन रहा है ... और इतना अच्छा भी नहीं
0,उपयोगकर्ता बकवास।   क्या आप उसे पुराने टैंक / सेटअप में वापस ले जा सकते हैं?  शायद वह ठीक हो सकता है?  मैं दोपहर के बाद दोपहर के भोजन/रात के खाने के बाद आपको फोन करूँगा?
0,मेरे कुत्तों के साथ सबसे अद्भुत रन। मैं समुद्र तट से प्यार करता हूँ- अब डांस स्टूडियो के लिए।
1,परीक्षा दी गई है
0,मेरी गर्दन कठोर है और दर्द होता है ...
0,उपयोगकर्ता मैं dm के लिए उचित पहुंच नहीं है आप मेरे मेलिंग पते ... ...
1,"उपयोगकर्ता हाहा, मैं सिर्फ पर्ल स्क्रिप्ट + टोर सोच रहा था, लेकिन आप वास्तव में गंभीर लगते हैं!"
1,एक -एक करके उपयोगकर्ता। क्रमशः।  इस तरह से कार्यों को सफलतापूर्वक सौभाग्य को पूरा किया जा सकता है
1,उपयोगकर्ता शहद पूरी दुनिया मेरी पसंद के लिए बहुत पीसी है
0,URL - अंत में पुराने स्पिनर हब कैप को बाहर फेंक दिया
1,369 और गिनती। लगभग खत्म हो गया। कल नई किताब खरीदने के लिए इंतजार नहीं कर सकता
1,"कोपी ऐश उली के साथ, आशा है कि निराई की तरह एक प्रभाव होगा"
0,उपयोगकर्ता - यह बंदर स्तन बेकार है क्या आप सुनिश्चित हैं कि यह आपका सीडी प्लेयर समलैंगिक नहीं था? LOL XD
1,उपयोगकर्ता मुझे विश्वास है कि आप जल्द ही उस स्टार पर अपना नाम होगा!
0,उपयोगकर्ता url यह कहता है कि वे नहीं आ रहे हैं
0,मेरी तथाकथित छुट्टी खत्म हो गई है .......... ... मैं हाइड पर वापस नहीं जाना चाहता .... कोई .... समय मशीन ??
0,परीक्षा तैयारी !  #FB
0,अशर हे मैं एक सप्ताह के लिए चैट के लिए एक प्रोफ़ाइल बना रहा था और यह मुझे नहीं होने दिया
1,यह लगभग एक घंटे के लिए लगातार टपका रहा है। अच्छी हवा अच्छी।
0,उपयोगकर्ता ऐप दुर्घटनाग्रस्त रहते हैं
0,खुश नहीं है मुझे लगता है कि मेरे पास गले में खराश है और मुझे गले में खराश होने से नफरत है
0,उपयोगकर्ता आपको मेरी मदद करनी चाहिए और मेरे कुत्ते के लिए एक रेड नाम चुनना चाहिए। मैं अटक गया हूँ वह नामहीन है !!
1,नीर्ड ब्लिस के लिए उपयोगकर्ता हुर्रे! मैं सभी सप्ताहांत में मेकर फेयर में रहूंगा।
0,"उपयोगकर्ता यह बहुत बेवकूफ था, हम सभी को उन्हें पत्र लिखना चाहिए, लेकिन अच्छे नहीं हैं !!"
0,शुभ रात्रि..आप इतनी जल्दी उठने के लिए
0,और अब कोई भी और हर कोई मेरे पागलपन को देख सकता है
1,मुझे 50 अनुयायियों को धन्यवाद आदमी मिला
0,"उपयोगकर्ता आप उसके लिए कहाँ जाते हैं? मैं ओक ब्रुक में मारियो ट्रिकोसी में जाता हूं, लेकिन मेरा पसंदीदा पूर्वी ब्लॉक मालिश करने वाला आदमी चला गया लगता है"
1,कहता है अरे!  यूआरएल
0,अप फैंटेआस्टिक था।  अब घर वापस होमवर्क कर रहा है
0,उपयोगकर्ता मैं उन सभी को चुनता हूं! मैं उसे फिर से जीते देखना पसंद करूंगा।  मैंने उसे दौरे पर देखा और हम इस चिल्लाती हुई लड़की के सामने बैठे
0,Ive आपको उपयोगकर्ता याद आ रहा है! Yooooooou कहाँ हैं?  एक ¥
1,उपयोगकर्ता मैं आपको मेरी प्रदर्शनी कैटलॉग उधार लेने दूंगा।  इस सामान को देखने के लिए अच्छा था-इतना पुराना! लेकिन भीड़! और बहुत सारे खड़े हैं।
0,"मैं बहुत हाइपर हूं, शायद रिवर्स जाना चाहिए, लेकिन मैं बहुत हाइपर हूं! यही कारण है कि मैं बार -बार नए चाँद ट्रेलर को देखने से मिलता हूं! मैं बेवकूफ!"
0,आज सुबह खुद को व्यस्त रखना। नफरत ऊब रही है
1,"उपयोगकर्ता जो भयानक लगता है, हाहा। मुझे खुशी है कि वीडियो गेम कंपनियां तकनीकी रूप से ""काम"" करने के साथ मज़े कर सकती हैं।"
1,कुछ भी नहीं url के एक दिन के बाद बेहतर महसूस कर रहा है
1,"पीसी के लिए डीजे मैक्स ट्रिलॉजी खरीदा, हालांकि, यह चट्टानों!"
0,"uck मैं बहुत बीमार महसूस करता हूँ !!! 2 नीट अब आप रात का खाना खत्म नहीं कर सकते, क्या $ की बर्बादी। हो सकता है 2 गो 2 वॉल्ग्रेन्स ... मैं दुखी और मिचली हूँ"
1,उपयोगकर्ता sooooo खुश * थोड़ा खुश नृत्य कर रहा है * yay!
0,"बू, हबबी शहर से बाहर है टिल टॉम रात एक व्यवसाय यात्रा पर उसे पहले से ही याद आती है"
1,वोहो कूल। आज का दिन है। मैंने अपना ट्विटर अकाउंट बनाया है
0,"उपयोगकर्ता ओह यार! मैं वर्षों में एमएसएन पर नहीं गया हूं, मैं वादा करता हूं कि मैं आज रात को आऊंगा, मुझे नहीं मिला है कि आप आज आपको जवाब दें"
1,Colby O'Donis वह पहली बार Chantelle Paige के साथ जाना जाता था! लेडी गागा नहीं! यह मेरे मुंह से एक तथ्य है !!!
0,"एक फ्रांसीसी परीक्षण के लिए अध्ययन करने की आवश्यकता है, gaay (n) शब्द के अंतिम दिन"
0,"13 लैप्स टू जाने के लिए .. सब कुछ सही लगता है 4 पेड्रोसा;) नाह एक अच्छा दिन 4 कालियो, हालांकि"
1,बीजाणु खेलना और शर्लक होम्स देखना।
1,"काइल और जेम्स के साथ वास्तव में अच्छा समय था, यह बहुत मज़ेदार था"
1,"उपयोगकर्ता मुझे लगता है कि एक पूरी तरह से अभी तक बाहर नहीं है, हालांकि हाहा!"
0,मेरे हाथों को फिर से चोट लगी ...
0,सो रहा था 'तिल 6pm! यह आगे एक loooooooong रात होने जा रहा है - फिर से!
0,"उपयोगकर्ता awwh धन्यवाद! इसका मतलब है ढेर। हाँ, यह वास्तव में उन्हें अनदेखा करना मुश्किल है जब वहाँ हमेशा वहाँ हालांकि वहाँ!"
0,"उपयोगकर्ता यदि आप एक विशाल गिलहरी लड़ी, तो यह आपको मार डालेगा मैं नहीं चाहता कि !!"
0,मेरा लैपटॉप लगभग मर गया।  लेकिन वह अब ठीक है <3
0,"उपयोगकर्ता दुर्भाग्य से, वे ड्रॉ के एक ही तरफ हैं ...।"
0,"उपयोगकर्ता वे धक्का देते हैं। मेरे दोस्तों ने घोड़ों की कंपनी को रखने के लिए उन्हें अपने खेत में रखा था, लेकिन माउंटेन लायंस उन्हें मिलते रहे।  #प्रलोभन"
1,"उपयोगकर्ता योग्य, अच्छी तरह से यह मेरी अच्छी नीट है"
0,"ठीक है, यह ट्विटर के साथ मेरा तीसरा प्रयास है, मैं वास्तव में इसे नहीं समझता!"
0,उपयोगकर्ता के रूप में मेरे वसा गधा में 5 हाहा के लिए मायने रखता है
1,अशर हाँ idk! तुम्हें पता है मैं बोस्टन से प्यार करता हूँ
1,"उपयोगकर्ता लेकिन निश्चित रूप से, सोसेल थे !!!!"
0,आधी ईंटों के बैग के साथ डंप के लिए है। मैनुअल श्रम मेरे लिए नहीं है!
0,ग्रे के एनाटॉमी क्यूज आई कैंट स्लीप और इसकी 2AM देखना
0,उपयोगकर्ता मैं knoow। Smh
0,"उपयोगकर्ता मैं सहमत हूं। रुको, क्या आप एक दुखद दिन हैं?"
0,"उपयोगकर्ता वाह! याम चा, काश मैं भी ऐसा ही कर पाता, लेकिन यह सिर्फ मेरे यहाँ है ..."
0,"मेरी पुरानी चेशायर कैट पजामा पहने हुए, और वे कुछ साल पहले की तुलना में मुझ पर बहुत तंग हैं।"
1,उपयोगकर्ता AUS #1 डीजे को बहुत जल्द हमारे कानों को पकड़ना चाहिए
0,"उपयोगकर्ता मुझे आशा है कि आप बेहतर महसूस करेंगे और मुझे लगता है कि मैं अपनी बहन ले रहा हूं, क्षमा करें"
0,लोगों से नफरत करता है। Whyyyyy?
1,शुभ रात्रि सितारे…।
1,उपयोगकर्ता कोई जोर से संगीत नहीं तो यदि आप चला रहे हैं..ओह दूसरे विचारों पर जो सिरदर्द को दूर भी कर सकते हैं
1,उपयोगकर्ता अच्छी तरह से मैं इसकी सराहना करता हूं। धन्यवाद आदित्य
1,उपयोगकर्ता im खुशी है कि हमें बहुत जल्द एक और स्लीपओवर होना चाहिए। मुझे पता है कि कब और im
0,मुझे हॉकी की याद आती है। अब एक सप्ताह हो गया है।
0,मैं उससे प्यार करता हूं लेकिन अब मैं उसके जैसा कोई व्यक्ति मेरे जैसा लड़की पसंद नहीं करेगा
0,इतना ही....
0,"इतनी सारी चीजें मुझे अध्ययन करने की ज़रूरत है, लेकिन मैं सिर्फ परेशान नहीं हो सकता"
0,"आज मेरे सत को याद करना है, और मुझे अपने पिताजी की कंपनी पिकनिक को याद करना है। दो चीजें जो मैं महीनों से आगे देख रहा था, मैं मोनो से नफरत करता हूं"
0,"उपयोगकर्ता क्यों? यही कारण है कि हमें 45mins के लिए बैठना है, आप मजाक कर रहे हैं, अच्छी तरह से मेरा दिन बर्बाद हो गया है मुझे लगा कि हम कम से कम संशोधित कर सकते हैं"
1,"उपयोगकर्ता ने आपके खाते को अनफॉलो कर दिया, लेकिन अभी भी उपयोगकर्ता का अनुसरण करते हैं, आरपी या ब्लिप ट्वीट्स में रुचि नहीं रखते हैं।"
0,दर स्पेन से घर नहीं आना चाहते हैं कल मैं इसे यहाँ प्यार करता हूँ
1,/ बहन जैकी के साथ गुणवत्ता का समय।
1,आज का दिन अच्छा है।
1,"उपयोगकर्ता मैंने वेब सूप नहीं देखा, लेकिन जब से मुझे यह ट्वीट मिला, मैंने इसे रिकॉर्ड करने के लिए अपना डीवीआर सेट किया!"
0,"उपयोगकर्ता यह नहीं है कि मैं उन्हें नहीं मिलता है .. मैं अभी जवाब नहीं दे सकता, मेरे उत्तर मेरे पास वापस आते हैं"
1,"ओह मेरी अच्छाई, कि मांस पाई स्वादिष्ट थी।"
1,उपयोगकर्ता गुड मॉर्निंग और हैप्पी मदर्स डे
0,"उपयोगकर्ता कि ट्रोल है, गरीब बच्चा xx है"
0,यह एक looooooooong दिन होने जा रहा है!  अच्छे तरीके से नहीं ;)
1,उपयोगकर्ता क्षमा करें !!! योग्य मुझे सिरदर्द का एक सा मिला है
0,... सिंगल होने के साथ समस्या यह है कि मेरे पास एक बेहतर आधा नहीं है
1,"उपयोगकर्ता हे हुन, यह वास्तव में अच्छी खबर है! आप दोनों के लिए बहुत खुश"
1,तो खुशी है कि मैंने अपनी सभी समय सीमा बना ली है अब यह मज़े का समय है
0,बस फिर से जाग गया। लड़कियां लंगड़ी हैं। पूरी तरह से इस पर। मुझे यह जानने की जरूरत है कि हर समय इतना कमबख्त क्यों कमबख्त। रोज रोज। Zzzzzzzz।
0,मैं यू के बिना नहीं रह सकता
1,"उपयोगकर्ता ने आपको कल रात उपयोगकर्ता पर डेरिक और रोमेन के सर्वश्रेष्ठ पर सुना .. अब, मैं प्यूर्टो वल्लार्टा जाना चाहता हूं!"
1,उपयोगकर्ता धन्यवाद आपके दिन का आनंद लें। ज़ोर-ज़ोर से हंसना
1,मेरे चेरी मिमीएम खरीदने के लिए मुकदमा करने के लिए सभी तरह से चलने के लिए सुबह 7 बजे उठे
0,उपयोगकर्ता ऊह मैं प्यार करता हूँ !!!! निष्पक्ष नहीं है
0,"क्या किसी को पता है कि मैं एक तस्वीर को कैसे स्केल करना चाहता हूं, मैं अपनी तस्वीर बदलने की कोशिश कर रहा हूं, लेकिन मेरे सभी पिक्स आर 2 बिग एन मैं उन्हें क्रॉप करता रहता हूं ... मदद"
1,उपयोगकर्ता मिस यू भी!  एक विस्फोट किया!
0,बस जाग गया और बीमार इम। गला घोंटना
1,उपयोगकर्ता उपयोगकर्ता बताता है कि वह काम कर रहा है।
1,उपयोगकर्ता मुझे आपके लिए नकली का एक गुच्छा मिला है ... मैं आपको AM धन्यवाद दोस्तों में एक ईमेल भेजूंगा!
0,"उपयोगकर्ता मैं जुड सर से नफरत करता हूं !! मैं वास्तव में अनजाने में अपनी पहली कक्षा को छोड़ दिया! ""मैथ"" हाहा, डेन Clasm8s ने समूह 2 ना!"
1,"बाय ट्विटर्स, जल्द ही वापस"
0,उपयोगकर्ता मैं उम्मीद कर रहा हूं
1,"उपयोगकर्ता ओह मेरी, एक पहेली? निर्भर करता है - कौन सी किताब ???"
0,"उपयोगकर्ता को यकीन नहीं है कि क्यों ... यह t*pepad पर है और इसलिए मेरी अन्य साइटों के विपरीत, चीजें कैसे काम करती हैं, इस पर मेरा बहुत कम नियंत्रण है"
0,उपयोगकर्ता इसकी भयानक है यह मैं आशा करता हूँ कि मैं अपने ठीक है
0,उपयोगकर्ता को यह सुनने के लिए खेद है।
1,मेरी आपकी मम्मी के साथ कैसे मुलाकात हुई थी? अभी तक का सबसे अच्छा शो
1,उपयोगकर्ता शायद कम वसा वाले स्निकर्स? हम इसे मंगल सलाखों के साथ भी बना रहे हैं
0,"उपयोगकर्ता मैं अपने मोबाइल पर हूँ इसलिए यह मुझे नहीं होने देगा, लेकिन मैं आपके बारे में सोचना बंद नहीं कर सकता;) x"
0,"उपयोगकर्ता कूल। फ्लेक्स बहुत बुरा नहीं है ... लेकिन वास्तव में बहुत सारे, वास्तव में कष्टप्रद भाग हैं"
1,"उपयोगकर्ता yup लेकिन फिर भी, मैं आपके समर्पण से ईर्ष्या करता हूं ~"
1,उपयोगकर्ता हाय वहाँ अपने नए सीडी dddd प्यार करता हूँ
0,समर स्कूल ठीक है मुझे लगता है कि कल फुलरटन हाई का एक व्यक्तिगत दौरा मिलता है
0,बच्चों के साथ उपयोगकर्ता बहुत अच्छा महसूस नहीं कर रहा है
0,Noooo ... मैं भौतिकी के लिए अपना कैलकुलेटर भूल गया ओह अच्छी तरह से वर्ग लगभग खत्म हो गया है: 3
0,"बहुत ज्यादा व्यर्थ स्थान पर, बस घर जाने के मूड में"
1,"मेरे सभी #followfriday के लिए धन्यवाद, सभी नए अनुयायियों को चिल्लाओ और हे"
1,"अब बिस्तर पर जा रहे हैं, और सुबह कारा की शादी की तस्वीर। उम्मीद है कि मैं सो सकता हूं-मैं बल्कि उत्साहित हूं"
1,उपयोगकर्ता आह! उत्तम! अपने बालों को फिर से ऐसा करें
1,"उपयोगकर्ता को रेडियो 1 पर उर साक्षात्कार पसंद था, यू लोग बहुत मज़ेदार हैं और दयालु आप हरे, नीले, पीले रंग के लाल <3 mwah x x x x x x x x x x x x x x x x x x x x x x x x x x x x x x x x x x x x x x x x x x x x x"
0,"उपयोगकर्ता नहीं, मैं नहीं कर सकता कि वे सभी आकार 5-6 1/2 हैं। मैं 7-7 1/2 हूं। मैं सिर्फ उन्हें और अधिक $ के लिए फिर से बेकार करने के लिए खरीदा है इसलिए यह ठीक है। मुझे ईबे लोल बहुत पसंद है"
0,कल की आम यात्रा को स्थगित करने के लिए बुरा लगता है
0,बगीचे में सूरज को भिगोना .. जीपीएस को साफ करने से पहले (बगीचे में भी बाहर) गर्मियों की सुंदर ध्वनि घास काटने की मशीन पर हबबी द्वारा व्याप्त है!
1,"मैंने अभी देखा कि मेरा कैपो उसी महीने और वर्ष में बनाया गया था, जब मैं हीरे से मिला था 6-06"
