1,मार्ले और मुझे देखकर उपयोगकर्ता यू के बारे में क्या? । क्या आपके पास एक अच्छा दिन था?
0,"संरचनावाद, महत्वपूर्ण काम की कोशिश पर एक नृविज्ञान भाषण लिखने की कोशिश कर रहा है"
1,"उपयोगकर्ता ओह क्षमा करें, मैंने गलत लिंक भेजा !!! यह कोशिश करो: URL धन्यवाद डेबी, धन्यवाद !!!"
1,URL - काम के लिए मेरे नए शिया Labeouf डेस्कटॉप से ​​प्यार करें!
1,हार्ड ड्राइव रिकवरी पर सभी ट्वीट्स के लिए धन्यवाद!
0,काम करने के लिए बहुत कुछ है। इतना कम समय
0,"बाहर, आराम करना .. डॉक्टर कल नियुक्ति करते हैं .. चिंतित।"
0,वाह आज बेकार है मैं भी पूरे दिन अच्छा महसूस नहीं किया है।
0,याद आती है केडीएच .. बहुत कुछ !!! उसकी आवाज के बिना सो नहीं सकते
1,जल्द ही समय पैकिंग। एक असमान ड्राइव घर के लिए उम्मीद कर रहे हैं
0,उपयोगकर्ता हमारी तारीख
0,मैं सबसे अच्छे स्लीपओवर से चूक गया ... हुआआआ: '(:' ((: '
0,"अशर हाँ, मुझे हर समय ""गुप्त"" ईमेल मिलते हैं। लेकिन मैं अगले गुरुवार को बफ़ेलो में रहूंगा"
1,"समर कैंप तक 2 महीने: टेंट और डोंगी के साथ 2 सप्ताह स्वीडन, 15 वयस्कों, 43 किशोर और मच्छरों के ज़िलियन - महान होंगे !!!"
0,जल्द ही काम करें
0,"वे उस जगह पर इंतजार नहीं करने देते, इसलिए हम टिन के कोने के आसपास कुछ रेस्तरां में चले गए। बेशक, मुझ पर कमबख्त सॉस गिरा दिया। दाग।"
0,.... बुजुर्ग कि मैं बनने से घबरा गया हूं। मैं स्वस्थ युवा बुजुर्ग लोगों को बुरा नहीं मानता। लेकिन इस। यह मेरा पूर्ण भय है। और मैं नहीं छोड़ सकता
1,"उपयोगकर्ता हाहा! IZ ठीक है, यह आपकी बातचीत के माध्यम से मजेदार पढ़ना था। हा हा हा हा! Mwah!"
1,उपयोगकर्ता - स्टील ब्लू? URL मेरा रंग है!
1,"उपयोगकर्ता धन्यवाद ^- ^, क्या भूत दिखाता है?"
0,उपयोगकर्ता बस पत्नी के साथ एक बहुत कम यात्रा दूर। पहली बार विदेश में एक साथ - हमारे पास कोई हनीमून नहीं था
1,बस ट्विटर में शामिल हुए
1,"उपयोगकर्ता मैं भी मुझे जानता हूं। लेकिन इसका मतलब है कि स्कूल लगभग OH BTW किया गया है, इस शुक्रवार को कोई बैठक नहीं है।  प्यार मोनी"
1,ट्वीट ट्वीट आज मेरे मुस्कुराते हुए भतीजे एक्स के चेहरे पर जाग गया
0,आप ट्विटर पर कैसे काम करते हैं
1,उपयोगकर्ता रंग?  हाँ।  सभी बहुत खूनी रूप से ...
0,अध्ययन का एक पूरा दिन
0,डीप का नया मुद्दा लेटरबॉक्स में आया था। अब कोई काम नहीं कर सकता। एक साथ और
1,उपयोगकर्ता aloha
1,मेरे ब्लॉग के लिए नया लेआउट ... मुझे बताएं कि आप क्या सोचते हैं -> url
0,"नए एलन कार विज्ञापन से प्यार होगा! नया शो देखने के लिए इंतजार नहीं कर सकता !! बस फली के बारे में मेसिन, बुरा समय मैं सो नहीं सकता"
0,उपयोगकर्ता मुझे लगता है कि मैंने अभी -अभी पैकिंग खत्म कर दिया है ..
0,उपयोगकर्ता URL - ओह .. आप अब पेरिस में हैं? क्या आप 2 दिन तक टीएलवी में 2 बी नहीं थे ??
1,उपयोगकर्ता मुझे पता है कि आप करते हैं ...।
1,हमेशा उपयोगकर्ता! मैं रविवार को स्पेन जा रहा हूं।
0,"मुझे तुम्हारी याद आती है, लेकिन मुझे समझ नहीं आ रहा है कि क्यों"
1,बौछार फिर बिस्तर ... सुबह चर्च
0,टेलर लॉटनर पूरी श्रृंखला के बाद वापस नीचे झुकने जा रहे हैं
0,"देर से फिल्में देखना और संगीत डाउनलोड करना ... मैंने सही काम करने की कोशिश की, गुस्सा बहुत अधिक था मुझे लगता है।"
1,"उपयोगकर्ता मैं 28 साल का हूं और मैं अभी भी एक क्लब में नहीं गया हूं। बहुत सारी बार, हालांकि। मुझे नहीं लगता कि मुझे बहुत याद आ रही है"
0,"काश लैरी घर आ जाता- अगर हमारा नया बिस्तर एक साथ रखने के लिए इंतजार कर रहा था, तो मुझे इतनी देर हो रही थी"
1,"MTV पर सुपर स्वीट सोलह: क्या आप मुझसे मजाक कर रहे हैं? कृपया fl, ऑड्रे नाम के इस योनी को जलाएं"
0,आज रात #SyTyCD परिणाम पसंद नहीं था। अधिकतम।  उपयोगकर्ता
0,मैं पागल हूँ मुझे अभी भी अपनी चॉकलेट नहीं मिली है। मेरे अगले उत्पादन के लिए स्क्रिप्ट पर वर्किन '। इस मुश्किल है
1,"उपयोगकर्ता नोगूम एफएम को जल्द ही बदल दिया जाएगा, बहुत जल्द"
1,"उपयोगकर्ता पिछली रात के लिए बधाई, और अंतिम में यू से मिलने के लिए अच्छा है"
1,केटी के साथ!
0,"यदि आप NYC में हैं तो ITP स्प्रिंग शो आज और कल है। अगर, मेरी तरह, तुम नहीं हो,"
0,मुझे पसंद नहीं है कि #GroundSpeak #GeoCaching #Iphone एप्लिकेशन लॉन्च पर दुर्घटनाग्रस्त होना जारी है।
1,उपयोगकर्ता धन्यवाद
1,उपयोगकर्ता आप जानते हैं कि आप क्या करते हैं
1,"उपयोगकर्ता अच्छी तरह से .. मैं इसका मतलब नहीं है। मैं सिर्फ कह रहा हूं। और btw, अच्छा ब्लॉग।"
1,लोगों ने बस बाड़ की उम्मीद की और अंदर आ गए
1,उपयोगकर्ता nope जैसे nomnomnom नया!
0,दोपहर के भोजन के बाद 4 और घंटे ... Im उत्साहित।  बहुत बुरा मुझे कल सुबह 7 बजे काम करना है
0,मैं क्रिस्टिन के साथ उनके संगीत कार्यक्रम में जाना चाहता हूँ ...... बकवास
1,"उपयोगकर्ता आह मुझे आश्चर्य हुआ कि उनके पास क्यों नहीं था!  यह ठीक है, हालांकि देखो परिवार आदमी ऑनलाइन बचाव हा में आया था"
1,"उपयोगकर्ता चिंता नहीं है।  आज आप कल की तुलना में छोटे हैं और जैसा कि हम सभी जानते हैं, कल कभी नहीं आता है"
0,उपयोगकर्ता अच्छी तरह से मैं तब तक इंतजार कर रहा हूं जब तक मुझे एक नई नौकरी नहीं मिलती। मैं दवा परीक्षणों के बारे में घबरा गया हूँ! X_X
0,im वास्तव में यह देखकर आंसू आंसू हो रहा है ...
1,"ट्विटर की हैलो दुनिया, हम सब कैसे हैं? एक और bbq whoooooo के लिए रवाना !!"
0,उपयोगकर्ता cudn एक आदर्श मैच खोजें
1,उपयोगकर्ता और अपने लिए उससे टिप्पणियां देखें।  awwww वह बहुत प्यारा है। क्या आपको मेरा पासवर्ड याद है? मैं इसे आपको संदेश दूंगा
0,#Brighton में दिन कैसे जाता है ... घर URL याद आ रहा है
0,जल्द ही काम पर जाना होगा
1,"उपयोगकर्ता मैं कोशिश करता हूं, मैं कोशिश करता हूं।"
0,"उपयोगकर्ता aww एक उदास तरीके से सुंदर है, लेकिन सच है ..."
1,"उपयोगकर्ता hahaha ... shiiit, न मैं एक douche बैग की तरह महसूस करता हूं =/ hehe! युक्तियों के लिए thx वैसे भी बहुत सराहना की!"
1,"उपयोगकर्ता grood, grood"
1,मुझे ट्विटर बहुत पसंद है!
1,"उपयोगकर्ता हाहा। हाँ, भगवान का शुक्रिया, अब्बा के लिए बहुत युवा थे। ओह"
0,उपयोगकर्ता अभी भी दर्द होता है!
1,मेरे अधिकांश महान दादा-दादी 1880-1910 में यूएसए में आ गए। मेरा रक्त 100% इतालवी है।
1,मेरी रियाल वर्कशॉप सिखाना
0,"Topshop उपयोगकर्ता ST में गया, केवल यह पता लगाने के लिए कि वहाँ H1N1 संक्रमण के 7 मामले थे।"
1,उपयोगकर्ता यू को उपयोगकर्ता से मिलना चाहिए क्योंकि वह एक तूफान चेज़र है! शायद वह आपको कुछ जानकारी दे सकता है! LOL सुरक्षित रहें!
1,"बेन एंड जेरी की ""जमैका मी क्रेजी"", हैरी पॉटर, वाटर और ब्रिकैबिल। आज बाहर होना बहुत अच्छा है!  यूआरएल"
0,"आज मेल में कोई लाइसेंस नहीं है, शायद जेरी की तरह 8 दिन लगते हैं ।।"
0,बेहद ऊब गया है ...।
1,उपयोगकर्ता अच्छा है लिंक
1,उपयोगकर्ता आपके लिए बहुत उत्साहित है
0,मुझे लगता है कि हम मुसीबत में हैं। कॉन्सर्ट रुक गया।
1,"उपयोगकर्ता yees, मेरे साथ दिन साझा करें!"
0,"उपयोगकर्ता मैं मानवता में अपने विश्वास को नवीनीकृत करने के लिए क्या कर सकता हूं? (इस तथ्य की अवहेलना कि मेरा टूट गया है, भी ...)"
0,मेरे Wittle लड़के के बीमार शुभ रात्रि ट्वीट।
0,"To sch nw! 2 घंटे बायो, 2 घंटे माउंट और एल के एक घंटे।  - URL"
0,बस पता चला कि ए/सी तकनीक जो हमारे घर पर सत पर थी। उस दोपहर बाद में मृत्यु हो गई। कृपया ग्लेन के परिवार के लिए प्रार्थना करें। मुझे पता है
0,"बकवास, मैंने काम पर अपना G33K B33R छोड़ दिया।  मैं वास्तव में इसे पीने के लिए उत्सुक था।"
0,मेरे राज्य में H1N1 का पहला मामला मेरे बेटे से सिर्फ 2 स्कूल जिलों पर है। मज़ा नहीं है।
1,सच्चा रक्त सीजन 2
1,हमें www.thetazzone.com n 'पर जाएँ
1,उपयोगकर्ता वापस बॉन्डी के पास गया और यहाँ बहुत कुछ एक ही है! धत तेरी कि! जीसी मौसम सबसे अच्छा
1,उपयोगकर्ता उपयोगकर्ता को अपने #FollowFriday में शामिल करने के लिए धन्यवाद
1,उपयोगकर्ता योग्य! ndi nmn mainit dugo q sayo noh !!!! हाहा! .. सिर्फ मूर्ख था '  पिस ..
0,noooo इसकी सैट क्यों इस सप्ताह तेजी से चल रही है!
0,दोनों बीमार हैं
0,और मैं कोशिश क्यों करता हूं? #squarespace #trackle मैं कभी कुछ नहीं जीतता
0,"एक मिनट im ठीक है, im नहीं और im इसे मुश्किल, बहुत कठिन, इस समय दर्द कर रहा है !!"
1,उपयोगकर्ता ... योग्य! शायद कैरिबियन में थोड़ा मीठा! उष्णकटिबंधीय द्वीप अद्भुत लगता है।
0,उपयोगकर्ता ओह मुझे क्षमा करें। बेशक आप जानते हैं कि मेरा क्या मतलब है। कृपया सॉरी न कहें
0,जूरी ड्यूटी बूओ
0,"उपयोगकर्ता ओह नहीं अर्थव्यवस्था गोट्चा?  क्षमा करें, लेकिन इतना खुश कि आपको ला में एक और मिला!  SoCal का आनंद लें! अहाय! ज़ोर-ज़ोर से हंसना"
0,मेरे बाल एक गड़बड़ है मुझे लगता है कि मुझे इसमें क्रीम और फोस्टर मिले हैं। मैं कल बहुत शर्मनाक था कि मैं वास्तव में इसे प्यार करता था: ') क्या यह सामान्य है? प्रोब्स नहीं
0,उपयोगकर्ता वह वापस नहीं आ रहा है
1,टेक्सटिंग और क्या नहीं।  आज उबाऊ होने जा रहा है।
1,"नए दिन, नए अवसर"
0,"यह बहुत गर्म है, मैं बीमार महसूस करता हूं, काश मेरे पास एक स्विमिंग पूल होता या पानी की लड़ाई होती: डी, ​​आह!"
0,मेरे गहरे फ्राई ड्रमस्टिक्स उतने अच्छे नहीं थे जितना मैंने सोचा था कि वे होंगे
0,उपयोगकर्ता जो आपके दोस्तों को चुराता है?
0,नीचे ग्रेड की स्थिति महसूस करता है ... URL
0,उपयोगकर्ता aw गरीब यू उसे 2 यू नहीं मिलता है बस उसे नजरअंदाज कर दिया उसके n उर सिर को ऊंचा रखो वह सिर्फ अपरिपक्व lil लड़की lol lol
0,एक विशाल सिरदर्द है ... काम पर यहाँ asprin नहीं है।
1,"जब तक आप चलने के लिए सुबह में उठ रहे हैं, तब तक आप जितना चाहें उतना टीवी देख सकते हैं।"
1,उपयोगकर्ता गुड लक
1,"बस हनी के साथ एक महान रात से मिला, अब स्नान करें और अपने कार्यदिवस के बाद नैश के साथ वापस जाने से पहले आराम करें"
1,"उपयोगकर्ता और, हे, क्या आप BSNL GPRS इंटरनेट के बारे में जानते हैं? मेरे पास BSNL कनेक्शन है और जाने पर इंटरनेट है"
0,मुझे अपना बिस्तर याद है।
0,घोषणा के लिए जल्दी उपयोगकर्ता और यह 7 पर है
0,"उपयोगकर्ता आप सोने के फैनी को बदल दिया! आप कैसे कर सकते हैं!? हाहा! मैं उस कार्यक्रम के PIC कारण को नहीं देख सकता, जिसे आपने अपलोड करने के लिए उपयोग किया था"
0,कार में बैठे ... मुझे बेकार लग रहा है
0,"दिन की शुरुआत कॉफी की एक विशाल बाल्टी की जरूरत है, यह अच्छा होने वाला है"
1,उपयोगकर्ता हाहा! आप और कायला दोनों।
0,उपयोगकर्ता मैं वास्तव में एक ही बात सोच रहा था! शुभरात्रि मुझे आशा है कि आप बेहतर महसूस करेंगे
1,"उपयोगकर्ता हाँ बहुत ज्यादा ... यह इसे शुरू करने के लिए शायद सबसे खराब समय था, लेकिन पता है कि क्या करना है का एक अच्छा विचार है"
0,"उपयोगकर्ता आपके लिए ""इतनी जल्दी"" क्या है? मेरे दो छोटे लोग हर दिन सुबह 6 बजे उठते हैं"
1,उपयोगकर्ता मैं सीधे संदेश दिया youuu
0,काश मेरे एबीसी नेटवर्क wld उनकी बकवास 2gether मिलता! मेरे किसी भी शो को रिकॉर्ड नहीं कर सकते
0,उह मेरे पेट में अब बुरा दर्द होता है
0,उपयोगकर्ता मैं चाहता हूं कि मैं चाहता हूं कि मैं इसे चाहता हूं! (लेकिन फिलहाल काम पर)
1,उपयोगकर्ता मैं अनुमान लगा रहा हूं कि यह वहां 300% फ्रिज़ी की तरह है। Scrunchies और जेल रास्ता है।  ट्वीट्स के लिए धन्यवाद।
1,अब लैपटॉप पर!  मेरा कंप्यूटर मेरा सिर अंदर कर रहा है और मैं एक डेस्क पर बैठा हूँ किसी भी समय haha ​​xo
1,हम्म मुझे प्यार नहीं लगता। मुझे और लोगों की जरूरत है।
0,उपयोगकर्ता क्या।
0,उपयोगकर्ता मुझे क्यों नहीं
0,काश उसे आज काम नहीं करना पड़े
1,बिग ब्रदर 9 जुलाई से शुरू होता है
0,गलत क्रम में दोपहर का भोजन किया ... पहले रेगिस्तान करना चाहिए था! अब मेरे पास कमरा नहीं है।  ज़ोर-ज़ोर से हंसना
1,राजकुमारी के साथ एक महान रात थी! मुझे वो बहुत याद आती है!
0,एक खूबसूरत दिन! थिएटर में टेक में फंसने के लिए
1,उपयोगकर्ता मुझे मंबा से नफरत है! नफरत है यह नफरत है इसे नफरत है! मैं मुस्कुरा रहा हूँ क्योंकि मैं इसे केवल इस तथ्य के लिए चला रहा था कि मैं इस पर नहीं हूं।
0,* आह* मेरा सिर दर्द होता है।  क्या किसी को पता है कि क्या आप बेनाड्रील को क्लेरिटिन के साथ मिला सकते हैं यदि आप पहले से ही इसे सुडफेड के साथ ले रहे हैं?
1,"वाह, 100 अनुयायियों को आप सभी के लिए धन्यवाद!"
0,"फिर भी गंदगी महसूस करते हैं। कम से कम कम से कम मुझे अपने सभी प्यारे काम के दोस्तों को देखने के लिए आज का आनंद नहीं ले रहे हैं, कभी नहीं सोचा था कि मैं ऐसा कहूंगा ..."
1,उपयोगकर्ता yayyy! अब आपके बारे में; और अब आप अपने नियमों से अपना जीवन जी सकते हैं और अपने सपनों को जी सकते हैं
0,रात एक: im अभी भी घबराया
0,कभी -कभी आपको बस उन लोगों पर भरोसा करना पड़ता है जिन्हें आप प्यार करते हैं और कभी -कभी आप निराश हो जाते हैं
