0,उपयोगकर्ता मैं शनिवार की रात गंदे मोच पर एक कैफे TACVBA कॉन्सर्ट को कवर करते हुए गिर गया।
1,उपयोगकर्ता ये एलएम ज्यादातर गैर-प्लेटफॉर्म से संबंधित हैं।  आपको कुछ प्लेटफ़ॉर्म कॉल शेड्यूल करने के लिए उपयोगकर्ता को बग करना होगा।
1,उपयोगकर्ता सभी अच्छा प्यार यह यहाँ पर फ्रीज कर रहा है MELB OMG ... पर्थ द्वारा यह कैसे है ??? मैं रेडियो डिज्नी XD सुन रहा हूँ!
0,बस T4 चीज़ से एक मिलियन स्क्रीन कैप की तरह मिला और मेरा iPod सिंक करने के लिए उम्र ले रहा है।
1,उपयोगकर्ता केसफेस ने मुझे बताया कि आप घर वापस आ रहे थे! बेहतर गर्मियों में आप में से बहुत कुछ देख रहे हैं
1,`डि ना सिया नगरेप्ली। मुझे लगता है कि वह asleeeeep है!
0,"चचेरे भाई की सगाई पार्टी में, बैठने की व्यवस्था के साथ भ्रमित करें मेरे छोटे आदमी यहाँ है, लेकिन वह नींद में है"
0,सुबह की शुरुआत। मुर्गियों ने हमला किया और उनमें से 3 को खो दिया। माँ वास्तव में परेशान है
1,"यदि आप यहां रहते हैं, तो उपयोगकर्ता आपके पास चुनने के लिए 3 प्रकार के जिन होंगे।"
1,उपयोगकर्ता हाहा ... मैं केवल कल्पना कर सकता हूँ !! मैं आखिरी दिन काम करने के बाद से वहाँ नहीं गया था! मैं इसे थोड़ा याद नहीं करता!
0,कुछ मज़ा चाहता है!  अच्छा नहीं है! इतना उबाऊ!
1,"उपयोगकर्ता मैं PHP, JS और HTML/CSS के साथ भी काम का एक अच्छा काम करता हूं।"
0,उपयोगकर्ता मुझे घर पका हुआ भोजन याद आती है
1,4 मई आपके साथ #starwarsday हो सकता है
0,मैं दुखी हो गया जब कुछ लोग खुद पर दर्द करते हैं। मैं वास्तव में उन्हें उस दर्द को भूलने में मदद करना चाहता हूं जो वे महसूस कर रहे हैं।
0,"उपयोगकर्ता ने सोचा कि यू एक अल्ची यू था, मुझे नीचे यू माना जाता है"
1,फिल्म देखने के बारे में सोचकर एक शक्तिशाली दिल
0,उपयोगकर्ता जो बेकार है।
1,उपयोगकर्ता कैसे बाउट .. न तो nahhhh अगर मुझे def शरीर की गंध लेनी थी। मज़ाक कर रहा है!!!!
0,"- आप मुझे क्यों नहीं सुन सकते? ओह्ह्ह्ह ठीक है, इसका कारण मैं अपने भगवान लानत आवाज खो दिया है!"
1,उपयोगकर्ता धन्यवाद यू !! इसका निर्माणाधीन लेकिन सामग्री अपडेट की गई है। शुद्ध हॉटनेस!   हम यू पर भी एक कहानी कर सकते हैं!
1,"5 घंटे तिल मैं घर हूँ और साक्षात्कार, हाइलाइट्स और चित्रों के घंटे देख सकता हूँ!"
1,उपयोगकर्ता यदि आपको इसका जवाब देने का मन है। । । सबसे गर्म आदमी कौन था जिसके साथ आप कभी एक प्रेम दृश्य थे?
0,"उपयोगकर्ता, बहुत देर हो चुकी है, यह कल है"
0,पीने का सिरोक। थका हुआ
1,"मैं एक तरह से ऊब हूं। मैं वास्तव में एक बोर्ड गेम खेलने के मूड में हूं, एकाधिकार अच्छा लगता है"
1,मैं आज रात को बहुत सहज महसूस कर रहा हूँ!
0,सर्जरी से पहले अधिक परीक्षण
1,अभी ट्विटर में शामिल हो गया है और सोने के लिए तैयार हो रहा है
1,"अब घर से दूर। पिताजी का जन्मदिन आश्चर्य ... चिंता मत करो, वह कोई ट्विटरर नहीं है"
0,उपयोगकर्ता मैं खो गया मुझे अब जीतना चाहिए
0,"क्या यह हो सकता है या मार्च ??? !!! मौसम, ग्लोबल वार्मिंग के साथ क्या हो रहा है? वैश्विक ठंड की तरह!"
0,पिकनिक को प्यार करता है और उसके प्रेमी को पहले से ही याद करता है! यह केवल 2 घंटे हो गया है! उपयोगकर्ता मैं बेंजामिन बटन से प्यार करता था! मुझे दुख है कि आपको यह पसंद नहीं आया
0,सुधार: मुझे वास्तव में आज 3 चोटें आईं
0,उपयोगकर्ता इसके क्या मैं कहता हूं क्यों !!!! K4ge पिछले दिन नौकरी पर आज हम उसे अब और आसपास नहीं कहेंगे
0,"बीमार लग रहा है, इसे एक दिन कॉल करने की आवश्यकता हो सकती है"
1,"कुछ और गोधूलि पढ़ने जा रहा है, फिर बिस्तर पर।"
0,उपयोगकर्ता I Cannae Spell Headide। मुझे वापस रिसेप्शन पर भेजें। काश कोई भी भागता और मुझे एक बड़ा गले गैरी की ठंड देता।
0,"मैं अपने खाते से इंटरनेट पर नहीं जा सकता, कुछ वायरस के खतरे के बारे में कुछ। मुझे अपने कंप्यूटर में सुधार करने की आवश्यकता है, लेकिन मुझे नहीं पता कि कैसे।"
1,रात के खाने के लिए कॉफी क्लब यह प्यारा होना चाहिए!
1,URL ने आपके चेहरे पर मुस्कान डाल दी।
1,उपयोगकर्ता यह बहुत मज़ेदार है! मैं बस सोच रहा था कि हमें चाहिए! और कितना मज़ा होगा क्योंकि आपके पास थोड़ा सा है!
1,उपयोगकर्ता उपयोगकर्ता उपयोगकर्ता उपयोगकर्ता बहुत बहुत धन्यवाद
0,उपयोगकर्ता मैं करूंगा। यह निश्चित रूप से इस तरह से महसूस कर रहा है। मैं दूसरे से अधिक साउंडचेक चाहता था।   ओह अच्छा।
1,मेरा अपनाने-एक-पीड़ा यूआरएल
0,बारिश बारिश दूर फिर से एक और दिन आओ -प्रिंसमिचेल
0,"अशर हे क्या आप जेबी के साथ लंदन आए थे? वेम्बली में आप के लिए एक नजर रखी गई, लेकिन आप लिल एक्स को नहीं देख सकते थे"
0,NYC में फर्म ऑफसाइट में।  आर्द्रता के लिए पढ़ना
0,क्षमा करें ट्विटर; वेंट करना था।
1,उपयोगकर्ता को पलक झपकते हुए जब मैंने देखा कि Natchitoches निश्चित रूप से उस ड्राइव से परिचित है।
1,उपयोगकर्ता 100xHugs !! मैं यहाँ हूँ तुम्हारे लिए चलो एक साथ हो जाओ ~~
0,उपयोगकर्ता मैं वर्तमान में काम पर हूँ
1,अपने नथुने में अवैध पदार्थों को छीनने के लिए किसी और को दोष न दें
0,काम पर थोड़ा बीमार लग रहा है
1,"उपयोगकर्ता ठीक है, बहुत बहुत धन्यवाद !!!"
0,उपयोगकर्ता haha ​​मुझे सही पता है ??
0,क्यों यह फिर से गर्मी नहीं हो सकता है
1,"चिंता करने की बात नहीं है, कोई भी वह नहीं मिला। अगला प्रश्न 1 मिनट में शुरू होता है, अपनी सोच कैप्स प्राप्त करें"
1,अच्छी तरह से BGT जीतने वाली विविधता के लिए किया गया। वे बहुत अच्छे थे।
0,उपयोगकर्ता बीमार आपको पता है। यह सब देर से
1,उपयोगकर्ता मैं वहाँ रहूँगा !! पीएस पैरानॉयड बस मेरे आईट्यून्स पर आया था
1,उपयोगकर्ता आप बहुत दयालु हैं
1,उपयोगकर्ता कौन? आप कौन हैं? जोश ग्रोबन? कौन?
0,दांत दर्द
0,उपयोगकर्ता को w/ उपयोगकर्ता और उपयोगकर्ता और मैं नहीं करने के लिए क्यों मिलता है?
1,उपयोगकर्ता ट्रे के पास लोरी फोस्टर इवेंट में एक महान समय था।   आपको अगले साल इस पर आना होगा!
0,NY में वापस नहीं करना चाहते हैं .... और अभी भी बारिश हो रही है।
1,और बफी मैराथन जारी है।
1,हेरोइन की अपनी गलतफहमी मुझे लगातार खुश करती है
0,..... ओह और मेरे एजेंटों ने मुझे गलत दिन बुक कर लिया था।  X1000000
1,10 घंटे के लिए comatize करने का समय।
1,मेरी माँ किसकी उपयोगकर्ता की तरह थी? और मैं हुह की तरह था? और उसके बाद उसने मुझे मारा। ओह्ह्ह। मुझे दे दो मुझे दे दो मुझे दे दो। मुझे मेल में अपना ग्रहण कार्ड मिला!
0,कभी -कभी यह वास्तव में मेरे पिताजी को छोड़ देता है
1,Reals के लिए उपयोगकर्ता !!!!!!!!! बिल्ली हाँ ... बहुत बहुत धन्यवाद !!!!    क्या Wiebe ने गधा नगेट मिशेल को हराया?
0,इस तथ्य से प्यार है कि मैं खुदरा के बारे में चिंता किए बिना अपने सप्ताहांत का आनंद ले सकता हूं ... यह 4 सप्ताह के समय में सभी बदल जाएगा
1,"हार्डवेयर स्टोर में रुके, किराये के ट्रक को लौटा दिया, आज के लिए भोजन के लिए किराने की दुकान पर गया, और एक बार मेरी कार को छुआ नहीं!"
1,यह बजर सुनकर अच्छा लगा और इसका जवाब देने के लिए जल्दी नहीं था
0,उपयोगकर्ता विश्वास नहीं कर सकता कि आपके पास ट्विटर है जो आप बहुत सकल हैं।
1,उपयोगकर्ता धन्यवाद लिसा। मुझे आशा है कि आप और उपयोगकर्ता के पास आज रात एक शानदार तारीख है हैप्पी वीकेंड आप दोनों के लिए। - क्रिस्टीना
1,"उपयोगकर्ता आपको कौन सा खिलाड़ी अधिक फेडरर या नडाल पसंद है? मैं फेडरर से प्यार करता हूं, वह अब तक का सबसे अच्छा खिलाड़ी है और वह मेरी तरह स्विस है"
0,उपयोगकर्ता मोटा लगता है! गरीब छोटे मुंचकिन। शर्म की बात है
1,"बुधवार को दोपहर के भोजन के समय, प्रबंधक ने आज टर्मिनेटर देखने के लिए एक टीम फिल्म इवेंट की संभावना का उल्लेख किया। आशा है कि ऐसा होता है।"
1,फॉलो की तलाश में मेरी मदद करो ... धन्यवाद
1,"उपयोगकर्ता nghe भारी v? मैं मौत धातु घास वा, बैलाड एनएच? l? m tu? n Sau s? v ‘c usb sang chï½p मृत्यु"
1,"उपयोगकर्ता इतना सच है, इतना सच है कि मैं सिर्फ धूप में बीबीक्यू करना चाहता हूं"
0,मुझे अभी भी समझ नहीं आ रहा है ... मैं उससे बहुत प्यार करता हूँ ।।
1,केल्टिक्स देखना और दोपहर का भोजन करना
1,उपयोगकर्ता आह ठीक है। कृपया O2 की शक्तियों को बताएं कि पाम प्री की बहुत सराहना की जाएगी - बशर्ते कि बाहर आने में बहुत लंबा समय न हो!
0,अधिक सिंहपर्णी खींचने के लिए जा रहे हैं ... बहुत जल्द मेरे पास कोई लॉन नहीं होगा
1,लगभग बाहर निकल रहा है। बहुत थका। सू भावुक। विश्वास नहीं कर सकता कि मैं सेंट मार्टिन विश्वविद्यालय के साथ समाप्त हो गया हूं।
0,एक लंबे दिन के बाद बीके में ऑर्डर करना। मैं अपने APT पर आने पर तुरंत सोने की योजना बना रहा हूं। थका हुआ...
1,सभी को प्यार करें और समृद्ध जुटें! ... स्पॉक ने यह नहीं कहा कि उसने किया ??
0,उपयोगकर्ता नमकीन रॉबर्ट नहीं है।
0,काम के लिए तैयार और तैयार यह चार पहले से ही था
0,ड्राइव होम के लिए वैन लोड हो रहा है ... इतना दुखी !!
0,Aaaaaaaaaaaaaahhhhhhh !!!!!!!!!!! ई -बुक्स पढ़ना बहुत कठिन है।
1,"मैं कुछ चिप्स खाने वाला हूँ ?? !! कोई भी, कुछ चाहते हैं ??? हाहा!"
1,उपयोगकर्ता आपके ब्लॉग की तैयारी कैसे चल रही है? योजनापूर्ण?
0,"कॉलेज वर्ल्ड सीरीज़ जिस तरह से जा रहा है, उसे पसंद नहीं है"
1,उपयोगकर्ता आप मेरे घर क्यों नहीं आते हैं? मैं इसे बिल्कुल भी बुरा नहीं मानूंगा।
0,2 स्कूल जाने से परेशान हो सकता है
1,जासलिन + पैट्रिस के साथ भी।
0,मेलबर्न शानदार था !! कॉकटेल और खरीदारी ..... अब वास्तविकता में वापस ।।
0,Im rly गले में आज यह बेकार है
0,उपयोगकर्ता मुझे ऐसा नहीं लगता ..
0,मैं बिस्तर पर जाने के लिए तैयार हूं ... लेकिन मैं इतना काम नहीं कर सकता कि पर्याप्त समय नहीं है
1,"मेरा आखिरी #FollowFriday उपयोगकर्ता ... वह थोड़ा असभ्य है, लेकिन, मज़ेदार है! www.snedwan.com भी देखें"
0,"TweetDeck की स्थापना - गोटा कहना, नए सुधारों से प्यार करना - बेकार है कि मैंने अपने iPhone #Tweetdeck पर Tweetie के लिए भुगतान किया था"
1,उपयोगकर्ता प्रत्येक MEPs खर्च को एक रसीद की आवश्यकता है और सभी ऑनलाइन प्रकाशित किया गया है ??  #EU09
1,एक टीना फे को खींच लिया।  एक नेवार्क लेओवर के लिए प्लैटिनम कार्ड + राष्ट्रपति क्लब = स्वर्ग! इसे किसी तरह उपन्यास में काम करना होगा।
0,विश्वास नहीं कर सकते कि केयरन के रूप में चला गया ...
1,अब बिस्तर। रात के ट्वीट। कल क्लास
1,उपयोगकर्ता ओह वास्तव में? मैं अपने साथी एंडी गिब्सन के साथ उसके सामंजस्य से प्यार करता हूँ
0,बस संशोधन इतना उबाऊ कर रहा है
0,उपयोगकर्ता मुझे यह भी नहीं पता था कि आपके पास यह पहले से ही था! यह अब आ रहे कानूनी संस्करण के बहुत करीब है! लानत है!
1,#FollowFriday ट्वीट्स के लिए सभी को धन्यवाद - आप सभी की बहुत तरह।
1,OSKAR को देखने के लिए एक संगीत के लिए एक संगीत के सर्वश्रेष्ठ पुनरुद्धार के लिए टोनी जीतता है! और उसकी सूक्ष्म चिल्लाहट समान शादी के लिए? केक पर सजावट करना।
1,ट्विटर पर उपयोगकर्ता का स्वागत है
1,मुझे मत बताओ कि एक ट्रेन आ रही है! ओह रुको कि बस एक ट्रैफिक लाइट लोल बस थक गया है।
1,उपयोगकर्ता paedalo ?? मैं अनुमान लगा रहा हूं (और उम्मीद कर रहा हूं) आपका मतलब पेडालो है
0,"गुड मॉर्न 'बेटी के स्कूल के आखिरी दिन, फिर वह 2 सप्ताह के लिए बंद है,"
0,"मैं अपने इतिहास ग्रेड के बारे में बहुत चिंतित हूं, मैं सो नहीं सकता"
1,"उपयोगकर्ता हाँ, मेरी आईडी ZDNComputers है - मुझे जोड़ें"
0,"मैंने एक झपकी भी नहीं ली ... ओह लड़का, यह एक लंबी नीट होने वाला है!"
0,यार मैं ट्विटरिंग बुद्धि यू छोड़ दिया! आप सगाई के नियमों का सम्मान नहीं करते हैं! तो शुभ रात्री!!!
1,"बर्डवर्ल्ड में और जगह बच्चों से भरी हुई है, मैं पैर की अंगुली में एक बच्चे के बिना केवल एक ही हूं ... आपके लिए ईस्टर छुट्टियां"
0,उपयोगकर्ता मैं एक बार रॉकी नाम का एक कुत्ता था
0,उपयोगकर्ता हां। सभी इंटरनेट फोरा के साथ समस्या
1,उपयोगकर्ता जो कमाल है !!!  तुम जाओ!
0,अभी भी स्टीव के बारे में चिंता है। अभी भी अस्पताल में। मुझे उसकी बहुत याद आती है। घर एक ही नहीं। चीजें बेहतर हो जाएंगी ... किसी दिन।
0,मेरे भाई ने मुझे केवल Xbox संगत कमरे से बाहर कर दिया
1,उपयोगकर्ता के पास एक अच्छा रात्रिभोज है। खुशी है कि आपने आज मज़ा किया।
0,मैं केवल 40 मिनट के लिए ब्रेंडा के साथ काम कर रहा हूं और मैं पहले से ही अपने दिमाग से बाहर जा रहा हूं! केवल 5 घंटे और 20 मिनट बचे
0,लगभग 2 घंटे के लिए गर्म विषय पर कुछ भी नहीं है और मैंने इतना दुखी कुछ नहीं जीता
1,उपयोगकर्ता अरे कैसे आर यू? मेरा नाम ऐली है!  उर जोनास में बहुत मजाकिया मैं <3 यह! यह 2 काम की तरह 2 काम है जो निक एन केव के साथ?
0,तुलसा छोड़कर .... उदास दिन ..... असली दुनिया ..... यहाँ मैं आता हूँ।
