0,वैनिशिनाटिन चॉकलेट काली को दुखी करता है
1,उपयोगकर्ता haha ​​मैंने सोचा था कि दूसरे दिन मुझे टेक्नोलॉजिकल पसंद है
0,मैं डलास में क्यों नहीं हूं? शुभ रात्रि।
0,अशर हाँ लोर मर गया पहले से ही मैं ज़ोंबी बन रहा हूँ! लेकिन मुझे पहले शौचालय में गंदगी करनी चाहिए!
1,धूप में संशोधन !!  अच्छा समय।
0,उपयोगकर्ता अभी भी मेरी आँखें खोलने की कोशिश कर रहा है।  मैं एक अच्छे दिन का इंतजार कर रहा हूं।  मेरे बेटे को आज रात एक नींद का अध्ययन है
1,उपयोगकर्ता यह cuz है जब आप उसकी कुकीज़ के लिए देख रहे हैं आपके पेट का अपना एजेंडा है। ज़ोर-ज़ोर से हंसना। अच्छी तरह से कम से कम मेरा करता है
1,उपयोगकर्ता यू टीएमएल बेब देखें! tkcr ओके..हैपी मिनी-शॉपिंग-स्प्रेज़!
0,यहाँ फिर से बारिश हो रही है
1,उपयोगकर्ता hehehehe मैं foreal shortie u maddd प्यारा हूँ
0,"(कॉन्टेस्ट।) मुझे आप लोगों के लिए एक वीडियो बनाने के लिए कम से कम बिल्ड देखने के लिए। मैं अभी भी जारी नहीं कर सकता, क्योंकि फाइलें सभी ट्रेस करने योग्य हैं"
0,अच्छा दिन नहीं है
1,उपयोगकर्ता मैं पूरी तरह से सहमत हूं
1,मेरी प्यारी 16 की योजना बनाना
0,"उपयोगकर्ता Awww, यह भयानक है! आशा है कि आप उसे ना पाएंगे"
0,"उपयोगकर्ता नहीं, मैं अभी तक यह सब देख रहा हूँ!"
0,"बहुत दुखी .. मैं ""एक निरपेक्ष दुनिया में"" नहीं जा सकता"
0,उपयोगकर्ता मुझे कोई विचार नहीं है।  मैं उन्हें देखने नहीं जा रहा हूँ। मेरे पास कोई पैसा या कुछ भी नहीं है क्योंकि मुझे अभी भी अपनी कार ठीक करनी है।
0,"XRON, HAIRMANN360, ICEDRAGON 1B RS-GAMER OFFICE में पहुंचे हैं, हम अनजान हैं, मीटिंग में किए गए बदलावों के कारण मुझे चाय मिली"
1,उपयोगकर्ता लेकिन यह मेरे लिए संयुक्त राष्ट्र के तर्कसंगत पक्ष है ... cuz यह नहीं होगा ... मैं इस विषय की तुलना में बहुत अधिक रूढ़िवादी हूं और आप इसे जानते हैं।
0,Im मेरे लिए बाउट लेकिन सोने के लिए देर से देर तक नहीं रहा ... असफल
0,उपयोगकर्ता Aww!
0,उपयोगकर्ता lol हाँ मुझे सही पता है। और उसके ब्रोंसन wtf के साथ Ceez ?? ओह और मैंने अपनी कविता FML भी शुरू नहीं की
1,उपयोगकर्ता मुझे यकीन है कि यह धूप होगी! तुम लोग बहुत मज़ा आएगा! बहुत सारी तस्वीरें लें और कहानियों के लोटा तैयार करें!
0,स्पर्स खो गया ... मनु वापस आओ !!!
0,"उपयोगकर्ता lol, im Okeyy। मुझे पता है..मैं आपकी दीवार पर किसी भी सब कुछ लिखा, शीश वाइफ, अब मेरे बारे में मत भूलो"
0,OMG एपिक वहीं विफल
1,वाह!!! ट्विटर पर अधिक दोस्त !!
1,मेरे ईरानी दोस्तों द्वारा मुझे दिए गए एक ईरानी स्टू बैंगन और टमाटर डिश को पकाने के बारे में सोचना।
0,मेरे पैरों को चोट लगी।
1,उपयोगकर्ता हां मैं बोली से भी प्यार करता था।  सभी सर्वश्रेष्ठ 2 आप भी।
0,मुझे उम्मीद है कि दाना ठीक है
1,"अशर हाँ, और यह एंटीट्रस्ट समस्या है।"
1,मुझे लगता है कि आज एक अच्छा दिन होने जा रहा है
1,भाई के स्नातक स्तर की पढ़ाई!
0,मुझे लगता है कि घर में हर बार कुछ गायब हो जाता है यह डिफ़ॉल्ट रूप से कॉर्बिन की गलती है।
0,जब आपको दूध पिलाई करनी चाहिए? अनाड़ी मुझे रसोई के फर्श पर एक औंस से अधिक एक बोतल से अधिक एक बोतल खटखटाया।
0,उपयोगकर्ता आप ठीक हैं? आपके ट्वीट मुझे दुखी कर रहे हैं
0,यदि आप चाहें तो उपयोगकर्ता अभी भी रह सकते हैं!
1,BTW हर कोई - यह हाई स्कूल के लिए एक नागरिक परियोजना है
0,काश मैं एसडी में होता ..
1,"उपयोगकर्ता जो कि कमाल के दोस्त है, आश्चर्यजनक हस्तियों के लिए yay!  मैं कुछ साल पहले उनसे मिल गया, वह बहुत दोस्ताना था।"
0,मैं ihop जाना चाहता हूँ और मैं अब जाना चाहता हूँ .... जो मुझे ihop तक ले जाना चाहता है ??
1,लेटरमैन पर रॉबिन विलियम्स को देखना और उम्मीद है कि मैं सो सकता हूं? वह अभी भी एक मजाकिया आदमी है!
0,उपयोगकर्ता आप कभी भी cameeeeeeeeee lol
0,"URL हमने देखा कि यह आ रहा है, लेकिन यह अभी भी मुझे बकवास की तरह महसूस कराता है"
1,उपयोगकर्ता yup मुझे यह अच्छा लगा धन्यवाद
1,"आज रात 10-11pm mtv r पर स्कार्ड है, देखें कि क्या आप एक सेक्सी आदमी देखना चाहते हैं!"
0,Okey मैं हार मानता हूँ .. मैं अब सो नहीं सकता था; और मुझे फर्श में अपना टेडी बियर मिला
0,उपयोगकर्ता कहाँ प्यार है?
0,"अभी भी अच्छा नहीं लग रहा है, लेकिन मुझे अपना होमवर्क करने की आवश्यकता है"
0,कल सुबह सर्जरी के लिए अस्पताल में जा रहे हैं।
0,मेरे पास एक नोपल है ... यह सिर्फ मेरे ईगल के पीछे छिपा हुआ है
1,उन सभी के लिए धन्यवाद जो कपकेक टूर के लिए बाहर आए थे! उन लोगों के लिए जिन्होंने अगली बार आपको नहीं देखा। मैं उपयोगकर्ता सोच रहा हूँ
1,"उपयोगकर्ता [उत्तर 10] मैं कैसे कपड़े पहनता हूं? इसका आसान, मेरा पहनावा $ 20 है ... हाँ मेरे पहनावे $ 10 जूते, $ 5 पैंट, $ 2 सहायक उपकरण और $ 3 बाएं 2 खाएं"
0,उपयोगकर्ता yesssssssssss .... plzzz purrrtyyy plz
0,काम पर जाने की तैयारी हो रही.......
1,यह उत्पादक था: मैं उपयोगकर्ता पर किसी ऐसे व्यक्ति से मिला जो मेरे बालों को काटने वाला है और पूरी तरह से प्यारा है और 2) मुझे अपना पुराना सहकर्मी जेसी मिला
0,मम्मी अभ्यस्त मुझे उसके comp argh पर जाने दो!
0,"मैं अब सोने के लिए रवाना हूं, मैं चाहता हूं कि मेरे और मेरे दोस्त के बीच चीजें सामान्य हो जाएंगी"
0,उपयोगकर्ता आपके लिए बहुत दुखी है
1,"उपयोगकर्ता यदि यह एक अंतर बनाता है, तो यह पनीर स्पेगेटी है"
1,उपयोगकर्ता इतना खुश है कि आप कक्षा में थे। महान योगदान!
0,उपयोगकर्ता मैं पंपिंग गैस से नफरत करता हूं!  मैं चाहता हूं कि अधिक स्थानों को आपके लिए यह करने के लिए लोग होते।
0,मुश अपने पीसी पर केंद्रित है .. किसी से जवाब नहीं देगा या बात नहीं करेगा। Mush se awito ..
1,उपयोगकर्ता संपादक? आप एक किताब लिख रहे हैं या क्या?
0,"उपयोगकर्ता अच्छी तरह से, आवश्यकताएं काफी अधिक हैं"
1,"उपयोगकर्ता उपयोगकर्ता उपयोगकर्ता उपयोगकर्ता यदि हम समूह बनाते हैं और इसके बजाय शहर को हिट करने का निर्णय लेते हैं, तो ऐसा ही हो।"
0,बकवास बस घर मिल गया। तो थक गया अब सो जाओ। क्षमा करें उपयोगकर्ता कि आप ऐसा नहीं कर सकते
0,तो अब यह मेरी महान चाची बॉबी की यात्रा के लिए अंतिम संस्कार घर जाने का समय है ... मुझे अंतिम संस्कार के घरों से नफरत है
1,"कौन बाहर उपयोगकर्ता का अनुसरण नहीं कर रहा है या URL नहीं किया गया है? आपको चाहिए, और मुझे कुछ प्रतिक्रिया देनी चाहिए"
0,उपयोगकर्ता सहमत हैं।
0,आश्चर्य है कि मैं ट्विटर में क्यों शामिल हो गया हूं
1,उपयोगकर्ता लाइव @ ustream url
1,उपयोगकर्ता को बहुत पसंद है। यह समाप्त हो गया
1,"अरे हाँ, और पंक्ति पंक्ति शक्ति से लड़ो! या कुछ और!"
0,उपयोगकर्ता कम से कम आपको बीटल्स गाने के लिए मिलता है
0,उपयोगकर्ता आप भाग्यशाली है! मैं 2 घंटे के लिए मुझे लगता है के लिए studiyn किया गया है! मुझे Historyyy से नफरत है! आईडी बल्कि उबाऊ हो रहा है
0,"अच्छी तरह से जल्द ही माँ, तुमसे प्यार करता हूँ"
0,काश मैं उसके साथ नृत्य करने के लिए वहां होता
1,"गुरुवार आज! इसका मतलब है कि शुक्रवार कल, और ईएससी सेमी फाइनल 2 टुनाइट गो अजरबैजान!"
1,इसलिए Valkyrie एक अच्छी फिल्म थी
1,"यदि आपका उत्पाद/साइट एक भद्दा बिक्री पृष्ठ की तरह दिखती है, तो मैं शायद इसे रीट्वीट नहीं करूंगा!"
1,"उपयोगकर्ता मैं तुम्हें मिल गया, लड़की! ।"
0,नहीं जानता कि उसका फोन चार्जर कहां है और टाइपिंग आपकी गोद में पिल्ला के साथ कठिन है
0,"समीक्षा के लिए प्रोटोटाइप, एक तीव्र सेश के लिए समय इस पूर्व संध्या से पहले यह समीक्षा के लिए बंद कर देता है"
0,उपयोगकर्ता आप उस अंतिम ट्वीट में जोड़े जाने के लिए थे ...
0,मेरी बहन के लैपटॉप पर। बस मुझे पता चला कि मैं सोमवार से शुरू होने वाले ग्रीष्मकालीन शिविर में जा रहा हूं। यही कारण है कि मुझे गर्मियों से नफरत है
1,"उपयोगकर्ता ओह्ह हाँ। हम नाम से नियमित रूप से अभिवादन करते हैं ताकि आप, कॉल करने वाले, चिंता करना बंद कर सकें"
1,मेरे कला इतिहास निबंध में डिज्नी चित्र हैं
1,"एक झपकी की सख्त जरूरत में! मैं अपने शेष 2 महीनों के इंटर्नशिप के लिए राक्षसों पर 2 स्टॉक करने वाला हूं, मेरी लिल की लत के लिए नमस्ते कहो!"
0,मेरे नाखूनों में चोट लगी
1,"मैं थोड़े ट्विटर की उपेक्षा कर रहा हूं। Woops। वैसे भी, फिर से हैलो, ट्विटर-लोक।"
0,बस ग्वाटेमाला फ्रैजेन्स एफआरएम उपयोगकर्ता के लगभग 2 एलबीएस भुना हुआ। रोस्टर आज Janky था। इस नई अश्लील पर बैच का आकार 6oz से नीचे है।
0,"उपयोगकर्ता - मैं सिर्फ आपको @ करना चाहता था क्योंकि मेरे सभी दोस्त थे। मैं सहकर्मी दबाव में देता हूं, यो।"
0,उपयोगकर्ता अच्छी तरह से मैं टीएन की स्थिति के तहत शारीरिक और मानसिक समस्याओं वाले लोगों के साथ काम करता हूं और मुझे नहीं लगता कि वे इसे पसंद करेंगे
0,मैं फॉलो रिक्वेस्ट यूजर भेजता रहता हूं लेकिन कोई जवाब नहीं देता
0,काम पर नहीं होना चाहिए
0,"उपयोगकर्ता मैं बस यहाँ मिला, सायरन!  आप नहीं जा सकते!"
0,उपयोगकर्ता aww
1,ट्रेनिंग #स्टड-लाइफ: ए फोस्ट टिबेरियू लविन ला नोई। Am aflat ca sunt imbecili peste tot। मज़ा
1,उपयोगकर्ता वास्तव में? आप चाहते हैं? आप खुश हैं? यह अच्छा है।
1,aw jamie बहुत प्यारा है मैं एक दिन उसके जैसा एक लड़का है
1,उपयोगकर्ता मैं वास्तव में अपनी तस्वीर को प्यार की दुनिया में आपका स्वागत है!
1,भौतिकी भौतिकी भौतिकी और भौतिकी ...:/ यह सब कल रात तक किया जाएगा!
1,उपयोगकर्ता टिम्मी मुझे सक्रिय करता हूं मैं ताज़ा हूं और मैं अब देख सकता हूं !!!
0,उपयोगकर्ता यकीन है! यह बहुत धन्यवाद होगा! क्या वे अभी भी महंगे हैं? मैं बहुत अधिक भुगतान नहीं करना चाहता; दुख की बात है कि पेड़ों पर पैसा नहीं बढ़ता है।
0,उपयोगकर्ता मैं कल ब्रुकलिन में था और ट्वीट कर रहा था क्योंकि मैंने बोस्टन थ्रू कोनिटिकट में वापस आ गया था।  केवल घंटों के लिए Bklyn में था
1,"अशर हाँ, जब मैं इतना कम पैसा रखता हूं तो वे हमेशा क्यों दिखाते हैं"
1,वाह!!! राजा के द्वीप के लिए उत्साहित
1,बिस्तर में ट्वीट करना। सबसे बड़ा डिनर था - इतना भरा हुआ! सैलून और शॉपिंग टॉम।
1,यार मैं कैसे चाहता हूं कि मेरे पास जीवन में हर चीज का जवाब था। आईडी बहुत बेहतर का नरक हो
1,ईआर के लिए पहली यात्रा!
0,"इससे पहले कि मैं फिर से अपार्टमेंट की सफाई शुरू करूं, आराम करने का प्रयास करना चाहिए"
0,एक मधुमक्खी @ लंच द्वारा डंक मार दिया।  अब मधुमक्खियों की देखभाल करने के बारे में चिंतित है और उसे एलर्जी है !!
0,आज एक अच्छा गेंदबाजी दिवस नहीं है
0,"उपयोगकर्ता hahaha .. मैं ऐसा सोच सकता था ... हाहा .. यह अंत में 'मजाकिया था .. लेकिन फिर, यह सू था- मुझे नहीं पता कि स्थिति क्या करना है"
1,चार्लोट के साथ उपयोगकर्ता गुरुवार शाम पब यात्रा की योजना बनाई गई है
0,मुझे अब जाना चाहिए .. मैं आपको gz और elf की याद आती हूँ .. अलविदा ..!
1,"उपयोगकर्ता रात सारा! PS, रिटर्ड्स पर मत छोड़ो, वे अच्छी कहानियों के लिए बनाते हैं"
0,उपयोगकर्ता तो मैं पूरे दिन कार्यालय में 30 जंपिंग जैक के 5 सेट करूंगा। शायद इससे मदद मिलेगी
0,उपयोगकर्ता मैं लोल की कामना करता हूं .... इज़राइल में सभी दा रास्ता Im ..
1,4:30 बजे जाग गया।  एक पहाड़ पर चढ़ा।  एक पेड़ में चिल करना।
0,यह बहुत दुखद है कि भारत टी 20 विश्व कप से बाहर है
1,30 मिनट में चर्च जाना। सुसमाचार याय
0,Louie दुखी है उनके एक दोस्त ने अपने gpa n अस्पताल में मेरे विचार r w u & ur परिवार सर !!!
1,उपयोगकर्ता मैंने कुछ सप्ताह पहले VX खरीदा था। V इसके साथ खुश
1,"उपयोगकर्ता क्षमा करें, मैं केवल त्रुटि 16826 से परिचित हूं, लेकिन आप करीब हैं (दंड के लिए आग्रह का विरोध नहीं कर सकते)"
0,"उपयोगकर्ता हाँ, लेकिन यह इस पर एक कारण था? हा! अरे हाँ मुझे पता है, मैंने उस हा को अवरुद्ध कर दिया। मैं देख सकता हूं कि आप अब इस के आदी हैं: डी।"
0,अपार्टमेंट में .... अकेले .... फिर से
0,"उपयोगकर्ता मुझे नहीं पता, लेकिन मुझे बुखार है"
1,फिल्म शूट के लिए शहर के लिए मेरे रास्ते पर
0,उपयोगकर्ता oaidfdsihgfi deffinition को wtf प्रकाशित नहीं किया गया था
0,"टिनी..कॉल्ड मॉर्निंग सोमवार ~, ~ / बीन्स लगभग सो गए थे।"
1,रिचार्जेबल एए बैटरी और चार्जर की डिलीवरी ली गई। बाद में Xbox गेमिंग पर वापस
0,उपयोगकर्ता केवल मैंने अच्छे प्राधिकरण पर सुना है कि आपका वापस नहीं आ रहा है
1,वांछित। । यह इतना लंबा हो गया है । । मैं अभी भी इस फिल्म पर नहीं हूं। एक आश्चर्यजनक घुमावदार प्रक्षेपवक्र पर उड़ने वाली गोलियां अभी भी मेरे दिमाग में चमकती हैं।
0,मेरे भाई की याद आ रही है
1,एक पोशाक में आज सुबह काम करने के लिए पूरी तरह से गर्म चलने वाला उपयोगकर्ता मेरे चेहरे पर एक बड़ी मुस्कान डाल दिया।  हुजाह!  गुड लक पिघलना।
1,उपयोगकर्ता URL - हर एक बहुत कम है!
