0,उपयोगकर्ता कोई क्रेडिट = कोई और अधिक असीमित संदेश नहीं
0,4 में से 2 निबंधों में सौंपा। अभी भी आज कोई काम नहीं किया है
1,#GONZPIRATION ‘ए बग ग्रेव पुटेन डी स्ट्रीमिंग !!!!!   (पेरिस लाइव> URL में विश्व रिकॉर्ड प्रयास
1,"उपयोगकर्ता यदि आप केवल आधा हो गए हैं, तो आप अभी भी बहुमत का प्रदर्शन करेंगे। तुम एक सच्ची प्रेरणा हो, क्रिस्टीना"
0,आज रात उदासी
0,किसी को भी पता है कि क्या परमारत में 24 घंटे मैककास हैं? मुझे याद नहीं है
1,"उपयोगकर्ता सुप्रभात! हाँ, मैंने यह थोड़े गर्म थो था, लेकिन अभी भी एक अच्छी नीट थी, आपके बारे में कैसे?"
1,उपयोगकर्ता उपयोगकर्ता उपयोगकर्ता उपयोगकर्ता उपयोगकर्ता ऑस्ट्रेलिया लड़कों में आपका स्वागत है।
0,उपयोगकर्ता नहीं! अभी तक नहीं !
1,उपयोगकर्ता का तर्क है कि दोनों नियम geeks और खुद को O_O के लिए उत्तर देते हैं
0,मेरे pidgin पर ICQ में लॉग इन नहीं कर सकते
0,उपयोगकर्ता dunno अगर मैं आपको देखूंगा
0,मुझे एफसी की याद आती है।  मैं आप लोगों के साथ घूमना चाहता हूं लेकिन ओह मेरे व्यस्त कार्यक्रम।  हाहा।
0,(उपयोगकर्ता) iewww सुबह पहले से ही? शट अप अलार्म घड़ी .... खेल दिवस। मुझे शुभकामनाएँ दें!
1,फिल्म मैराथन पर उपयोगकर्ता और हाँ plz!
1,"उपयोगकर्ता मज़ा है! मैं इज़राइल गया हूं, तेल अवीव में रहा। वहाँ से बाहर नृत्य कार्यशालाएं सिखाईं। महान शहर, और भी बेहतर भोजन।"
0,उपयोगकर्ता omg अच्छा! सेना बकवास है! भगवान का शुक्र है कि आप अपने होश में आए हैं! चीजें खराब क्यों हैं?
1,उपयोगकर्ता नरक हाँ। दूर ब्लॉक करें। बस मीठी लिल 'ओले मुझे नहीं।
0,'चेंजलिंग' देखना .. यह 15 मिनट में है और पहले से ही दुखी है
1,अंत में शीत युद्ध की शर्तें समाप्त हो गईं। 4 प्री-कैलकुलस असाइनमेंट खत्म करने के लिए। oy vey d :; आप कैसे सोते हैं - जेसी मेकार्टनी
1,हैप्पी मदर्स डे है!
0,ट्विटर मुझे कभी -कभी भ्रमित करता है
1,5 जून - चाची 12 जून - सुबह 8 बजे (ZZZ ...) - चचेरे भाई 12 जून - 5pm () - BFF
0,"y ने इसे फिर से बारिश करना शुरू कर दिया, जब मेरी कार पैक कर रही थी"
1,उपयोगकर्ता haha ​​सच मुझे पता है कि मुझे उनमें से कुछ मिल गए हैं जो वेब की तरह होगा अगर यह कोई स्पैमर नहीं था
0,जॉन और केट! कृपया ब्रेक अप न करें!
0,बैल यह मैं नहीं कर सकता
1,उपयोगकर्ता अन्य तो मुझे ज्यादा नहीं
1,#goodsex वह है जब वह सीधे बाथरूम में नहीं चल सकती है
1,"उपयोगकर्ता awww धन्यवाद यू मैं उसकी फोटोग्राफी प्यार करता हूँ, आश्चर्यजनक ... और उसने डेविड बोवी को गोली मार दी है!"
0,उपयोगकर्ता मैं dunno haha ​​इसे ठीक नहीं चुराता
0,Maddest सिरदर्द AH ME N RAWZ ने कुछ BDAY पार्टी को 2 दिन बचाया
0,बिना किसी कारण के सभी सकल और अजीब महसूस करें
0,उपयोगकर्ता सदस्य wen u कभी भी किसी को भी जवाब नहीं देता है?
1,आवश्यक से जल्दी waaay! तनाव मुझे मिल रहा है ... महान। आज एक पत्थर के साथ दो पक्षियों का हत्या
1,उपयोगकर्ता बुराई CFII प्रश्न एक नया साधन छात्र लाल बत्ती चलाने और अन्य मोटर वाहन कानूनों को बस्ट करने के लिए क्या कारण है
0,हमारी कार टूट गई ..... फिर से
0,मैं अपने पिल्ला से प्यार करता हूँ ... वह बहुत दुखी हो जाता है जब मुझे काम के लिए छोड़ना पड़ता है
0,यह आज पिछले शुक्रवार को उपयोगकर्ता है
0,मेरी दादी ने मुझे अपनी माँ के साथ लेने का फैसला किया। मेरी कार reeks।
1,"उपयोगकर्ता im अभी अवाक है। मैं बहुत खुश हूं, मुझे विश्वास है कि टेलर स्विफ्ट भी जवाब दे सकता है। लेकिन, मैं अभी भी खुश हूं, आपकी वजह से!"
1,मेरी नई पृष्ठभूमि से प्यार करता हूँ फोटोशॉप्ड बहुत? .....
1,उपयोगकर्ता हमारे पास 2-4 का आकार है ... निश्चित नहीं है कि अगर मैं एक आकार 0 में मदद कर सकता हूं तो मैं मदद कर सकता हूं
0,Whyyyy मैं कभी स्लीप नहीं कर सकता
0,दक्षिण अफ्रीका से हार गया
1,"उपयोगकर्ता: ओह निश्चित रूप से! बस कहो ', तुम्हें पता है।  दल।"
1,वालन के साथ!  यूआरएल
1,"उपयोगकर्ता हाय सैंडी ... यह नियम के बजाय अपवाद लगता है! तो crass, मुझे पागल बनाता है"
0,उपयोगकर्ता हम एक्वेंटेंस होर्स्ट नहीं हैं। हम सबसे अच्छे दोस्त हैं। काश मैं आपको अभी एक बड़ा भालू गले लगा पाता।
0,उपयोगकर्ता AW जल्द ही बेहतर नहीं मिलता है! शहद और नींबू पेय है!
0,"#Swineflu Jums Jums to> 1000 मामलों में VIC, सिंगापुर ने लोगों को चेतावनी दी है कि वे यहां यात्रा न करें"
1,मुझे अब अपने बिस्तर की नींद बहुत पसंद है। Itkog कल फिर डिनर और एक फिल्म मुझे विश्वास है!
1,बस मेरी यात्रा प्रोफ़ाइल को अपडेट किया गया है ताकि मैं अगले सप्ताह विमान पर जा सकूं अगर मैं फ्लोरिडा में फंस गया तो एक बुमेर होगा
1,उपयोगकर्ता nononono ... मैं पूरी तरह से आड़ू हूँ !! मुझे बस अचानक कुछ माइंडब्लास्टिक एहसास हुआ .. यह सब है
1,उपयोगकर्ता इसे प्यार करता है जब कंपनियां सोशल मीडिया और माताओं के बारे में सीखना चाहती हैं
0,"मेरी लड़कियों की याद आती है jsi, जहाँ r u? (मुझे पता है l, तुम यहाँ हो"
1,"उपयोगकर्ता Cintiq 21 भयानक है, लेकिन इतना महंगा है ...।"
0,काम पर जाने के लिए तैयार होकर मैं चाहता हूं कि मैं उसके साथ सो सकूं ...।
1,मुझे लगता है कि उपयोगकर्ता आज सुबह बहुत ऊर्जावान है
1,"उपयोगकर्ता महान! आपको पता होना चाहिए कि मैं वर्तमान में ""अगर कोई गीत मुझे मिल सकता है"" का आदी हूं और एक आगामी वीडियो बहुत प्रत्याशित है!"
1,"नई हिल्सॉन्ग यूनाइटेड सीडी की जाँच करें, गीत जल्द ही अद्भुत है।"
1,"OMG की तरह ... शॉवर में सूखा ... Uugh .. यह जिम है, लेकिन फिर भी उर फुकिन बदसूरत!  जेके सब लोग सुंदर .. यह जूस सकल था!"
1,"अब बेहतर महसूस कर रहा है। धन्यवाद, मेरे प्यारे दोस्तों!"
1,उपयोगकर्ता अपने सनस्क्रीन को न भूलें
0,कैसे उदास ब्रिटनी ने स्वर्गीय एड मैकमोहन URL को याद किया
0,"उपयोगकर्ता मैं अभी भी आज रात काम कर रहा हूँ, मैं इसके बजाय कुछ भी बनाने के लिए कुछ भी दे रहा हूँ"
0,यह एरिज़ोना नरक का मौसम बहुत ही अनियंत्रित है
0,उपयोगकर्ता बेवकूफ दुकान एम्स्टर्डम और लेसी गिटार में घरों के स्टॉक से बाहर था।
1,मेरे ई मेल की जाँच करते समय USHER के लिए लिस्टिंग के आसपास बैठे .... यह बाहर बहुत सुंदर है मुझे लगता है कि मैं बस चारों ओर नृत्य कर सकता हूं! ज़ोर-ज़ोर से हंसना! मत पूछो!
0,उपयोगकर्ता मैं खो गया हूँ। कृपया मुझे एक अच्छा घर खोजने में मदद करें।
1,शो सेट अप अद्भुत लग रहा है! 47 वीं मंजिल से शहर का 360 दृश्य इसे जोड़ता है।
0,सुपर ... सुपर बोर अभी। बाद में काम करें। फिर शायद एक बीयर। अभी तक फैसला नहीं किया है। मेरा जीवन जैसा है ... सुपर लंगड़ा
0,काम का समय ....
0,"उपयोगकर्ता यह मो है, मेरे BFF के साथ BET अवार्ड्स में मज़े करें!"
1,उपयोगकर्ता क्या मेरे बाद के लिए धन्यवाद है !! आप शांत लग रहे हैं इसलिए मैं भी आपका पीछा कर रहा हूं! होला @ मुझे!
1,उपयोगकर्ता मुझे पता है कि यह मजेदार नहीं है
0,लानत है!!!! अब जकार्ता में गर्म
1,"उपयोगकर्ता सही पर!  हाँ, क्लाइड नियमित मेहमानों से उस स्थान पर एक उच्च अनुरोधित सर्वर है! आप की तरह! ज़ोर-ज़ोर से हंसना"
1,उपयोगकर्ता यू ने एक मिनट में URL का उल्लेख नहीं किया है जो उत्सुकता से अधिक सुनने के लिए इंतजार कर रहा है
0,"उपयोगकर्ता awww मुझे खेद है कि हुन यह कठिन है, हां सिर ऊपर रखें"
1,Thx 4 #ff luv! उपयोगकर्ता उपयोगकर्ता उपयोगकर्ता उपयोगकर्ता ये लोग बहुत बढ़िया हैं 2 का पालन करें!
1,उपयोगकर्ता आपको एक मिलना चाहिए! इसे Cafepress.com से ऑर्डर करें ओह और BTW को सैट नाइट पर आप और आपकी लड़कियों की तस्वीर पसंद है
0,उपयोगकर्ता मुझे नहीं लगता कि केट कभी जॉन के लिए अच्छा रहा है!
1,मुझे अपने जानकारीपूर्ण भाषण के लिए क्या स्वादिष्ट भोजन बनाना चाहिए और एक घंटे या whatev से अधिक सकल और गंदगी नहीं मिलेगी?!
1,रेंटल हाउस के WOOHOO-मालिक हम चाहते थे कि हमारे प्रस्ताव को कम कीमत स्वीकार करें! भगवान कुछ हफ़्ते में इस कदम के बारे में बहुत अच्छा है
0,शुभ रात्रि की झलकियां।  एक शानदार रात हो..
0,"उपयोगकर्ता तो बहुत से लोग करते हैं-अन्य स्क्रीन कैप सॉफ्टवेयर है, मुझे नहीं पता कि वे क्या हैं ... क्षमा करें मैं मदद नहीं कर सकता"
1,उपयोगकर्ता Hahahahaha! यह मैं तुम्हारे लिए रात में चिल्ला रहा हूँ ... यह एक गीत से एक पंक्ति है
0,"मैं वापस बिस्तर पर जाना चाहूंगा, बाहर नहीं जाना और अभी के बारे में।"
1,उपयोगकर्ता वे सभी बहुत मनोरंजक भी हैं।
1,उपयोगकर्ता यह एक अच्छी कविता है। धन्यवाद मैं शायद करूँगा। तब मैं जीवन की विचित्रता पर आश्चर्य करूंगा और यह सब खत्म हो जाता है
0,वास्तव में नफरत प्रलेखन ... खासकर यदि आप इसे लिख रहे हैं ...
0,कपड़े धोने का समय
1,एक अद्भुत सप्ताहांत इच्छा थी कि हम हर रोज एक दूसरे को देखते हैं हम एक दूसरे को देखते हैं
1,उपयोगकर्ता यह अधिक सुंदर कारण है कि मुझे आपका चेहरा देखने को मिला
1,उपयोगकर्ता को मुझे बाद में देख रहा है ताकि आप शिकायत कर सकते हैं <3 xxxx
1,उपयोगकर्ता लानत है कि वास्तव में अच्छा लग रहा है। मुझे अब यू से बहुत जलन हो रही है!  ज़ोर-ज़ोर से हंसना
1,"उपयोगकर्ता धन्यवाद, कैथी"
1,उपयोगकर्ता एक छाता ले लो !!! यह पोमीलैंड में लंबे समय तक भव्य नहीं हो सकता है!
1,"उपयोगकर्ता मैं आपको टीवी पर देखता हूं, रॉक एम रिंग पर। मैं आप लोगों को देखने के लिए बहुत रोमांचक हूं। और मैं आपको फ़्रीक्वेंसी फेस्टिवल में देखूंगा"
1,"उपयोगकर्ता आप एक बहुत, बहुत दिलचस्प साथी की तरह लगते हैं।"
1,"और मैं अंत में अपना ""बुबुर तंजुंग"" यमी प्राप्त करता हूं ..."
0,"उपयोगकर्ता sveta ऐसी प्यारी है, वह वास्तव में एक और स्लैम के हकदार थी।  मैं बस चाहता हूं कि अंत बेहतर हो सकता है, उन दोनों के लिए"
0,उपयोगकर्ता यह यहाँ गुरुवार है। और बूट करने के लिए 4:11 बजे
0,"उपयोगकर्ता मैं शिकायत करने के लिए बुरा महसूस करता हूं, लेकिन ऋण मुझे सभी घबराहट और ए; lkfjsf-ish बनाता है।  फिर भी, एक साथी ऋण महिला को गले लगाता है।"
0,मौसम मुझे उदास कर रहा है
1,उपयोगकर्ता url - np यह सब एक प्रशंसक के काम के दिन में था
0,उम्मीद है कि मैं बीमार नहीं हो रहा हूं। काम से लोगों का गुच्छा पिछले हफ्ते बीमार था। अब मुझे गले में खराश हो रही है
1,इस बात का पता लगाने की कोशिश कर रहा है ... उह
0,उपयोगकर्ता वह उनका मालिक है ?? मैं नहीं समझता
1,जो बीके को पसंद नहीं करता है!?  -> url
1,"उपयोगकर्ता im कुछ जींस और एक शर्ट बनाने के लिए uni .. और yeh u कर सकते हैं, अगर कीमत सही है"
1,इसे प्रेम करें!
1,"उपयोगकर्ता रुहानी, संगीत के लिए धन्यवाद!  अच्छा ~~~~ विश यू एक #Brilliant संडे भी, यह अब तक कैसे है?"
0,गंदे मौसम अब मुझे मिल रहा है
0,उपयोगकर्ता मैं amp पीऊंगा लेकिन मुझे नहीं लगता कि उनके पास एक चीनी मुक्त संस्करण है
1,#FF के लिए उपयोगकर्ता धन्यवाद!
1,मेरी दादी ने मुझे चुदाई से पेशाब कर दिया लेकिन हे! उसने कहा कि मैं अपनी सौतेली बहनों को सुंदर हूँ।
1,उपयोगकर्ता आप और ऐन मुझे हँसाते हैं
1,"उपयोगकर्ता का स्वागत है! मुझे लगता है कि आप जितना अधिक ट्वीट करते हैं, उतना ही आप दिखाई देते हैं और अधिक ट्विपल आपका अनुसरण करते हैं।"
1,"भले ही मिस्ट्री गर्ल ने हमारी सभी योजनाओं को बर्बाद कर दिया, लेकिन हममें से बाकी लोग एन आर्बर में हैं। हंटर, द ट्विन्स, डीजे जस्टिन और माई परफेक्टेस्ट बेबी केटी"
0,उपयोगकर्ता महान: | एक dnt चाहते हैं कि लंबे समय तक शहर से नफरत हो
1,मैं आधिकारिक तौर पर आदी हूँ! बस गोल्डन ओरेओस और दूध खरीदने के लिए एक ऑफ ब्रेक लिया!
1,ब्रिटेन के गॉट टैलेंट को देखना!
1,विचार राष्ट्रपति ओबामा के साथ हैं ... मुझे यकीन है
0,तो मैं आज इसे लकर परेड में नहीं बना सकता
1,"उपयोगकर्ता अच्छा बिंदु, कम से कम वाह में आपको इंतजार करने के बजाय समय पारित करने के लिए पीसने की मन-सुखदायक गतिविधि मिलती है"
1,उपयोगकर्ता haha ​​यकीन है - आप श्रेणी में फिट ... मेरा सप्ताहांत? व्यस्त। हमेशा की तरह ... बहुत सारे ड्रिंक्स सैट नाइट थे। LOL - आप कैसे 'मुक्केबाज़ी करते हैं?
1,मेरे Tumblr लेआउट को ट्विक किया।
1,आपको सलाह देता है कि आप इसे बाहर निकाल दें।  स्वर्ग के लिए एक ब्लॉग प्राप्त करें।
0,उपयोगकर्ता url - * आह * मैं कभी भी इसके अलावा नहीं होगा!  ज़ोर-ज़ोर से हंसना
0,उपयोगकर्ता plz उन खेलों के बारे में लिखते हैं जो मैं उन्हें नहीं देख सकता हूँ जो मैंने पढ़ा है लेकिन मैं आपके ट्वीट्स में उनके बारे में पढ़ सकता हूं !!! प्लाज़
0,माँ के लिए लिविंग रूम और किचन को साफ करना और गरीब क्विन को देखना उसकी पट्टी को चाटना।
0,अधिक homeworkkkkkkkkkkkk
0,इस गर्म खूनी मौसम में स्टीमबोट डिनर के लिए बाहर जा रहे हैं। परिवार का विचार।
