0,उपयोगकर्ता मैं बहुत खेद है .. आप अपने विचार और कुछ आभासी गले भेज रहे हैं
0,काम पर बैठकें मुझे दुखी करती हैं। मैं नहीं जानता।
0,"आदमी। मैं वास्तव में शायद यह करने के लिए बाहर चुपके हूँ, भी"
0,ऊबा हुआ!! सत का कल मोरिन! उह पढ़ाई करने की जरूरत है !! कोई आउटिंग टोनाइट तब!
1,हल कोगुला को हल करें एट कोगुला है
1,सोशल नेटवर्किंग पर युक्तियों के लिए उपयोगकर्ता thx!
1,उपयोगकर्ता आप और उपयोगकर्ता दोनों के लिए क्षमा याचना - क्षमा करें।  बेहतर करने की कोशिश करेंगे
1,2-दिवसीय सहकर्मी नेतृत्व प्रशिक्षण पाठ्यक्रम के साथ समाप्त हुआ ~ मेरे समूह के साथ बहुत मज़ा आया! मैंने अपने बारे में भी बहुत कुछ सीखा
0,मुझे एपिक ontd पोस्ट याद आती है
0,"उपयोगकर्ता सीजन 5?! क्या आप मुझसे मजाक कर रहे हैं? मुझे अभी बहुत देर हो चुकी है। मुझे आपसे नफरत है, उपयोगकर्ता"
1,उपयोगकर्ता हम इंतजार करेंगे
1,यह आधिकारिक है बक्से और उन्हें सामान से भरने के लिए ... नया घर यहाँ हम आते हैं
1,व्यस्त व्यस्त व्यस्त। मेरी वर्तमान परिभाषा।
1,Yayyy मेरे डैडी मुझे ग्रिल्ड पनीर बना रहे हैं जब हम देर से होने के लिए माफी मांगने के लिए घर जाते हैं। मैं हालांकि वैसे भी उस पर चिल्लाने के लिए बहुत थक गया हूँ
1,मैं वापस आऊंगा जब स्पेन बाद में जर्मनी के खिलाफ खेलना शुरू कर देता है। हम देखेंगे कि क्या U21s अपने सीनियर्स के साथ स्तर कर पाएंगे।
0,"उपयोगकर्ता हाँ ... मुझे भी ... मैं कल रात बाहर निकाल रहा था 'क्योंकि यह कुल देजावु था।   लेकिन स्नोइक भी नहीं, बस एक बुरा फ्लुकोल्डिंग"
0,SOOO Google अक्षांश पर स्टॉक किया गया। केवल दोस्त गायब हैं
0,नाराज और अभिभूत
1,"मैंने अंत में ट्रांसफॉर्मर देखा ... LMFAO मैंने केवल इसे देखा क्योंकि मैं 2 चाहता था कि 2 एक को देखें, और वाना नहीं खोया ..."
0,भूखा!!!!!!!!!! मुझे इस आहार से नफरत है
1,"उपयोगकर्ता 4?! लानत महिला, निश्चित रूप से तुम नींद नहीं तो लोल। मेरे लिए डबल जयकार (हालांकि मुझे लगता है कि आप वास्तव में 2x योग्य नहीं हो सकते)"
0,किसी को बुरी तरह से याद करना ...
1,अब स्कूल जाएंगे।  आप बाद में ट्विप्स को पकड़ो। K? XXLL एक ‡ Jhe
0,सोच रहा है कि क्या वह सिर्फ * ड्रा * अपने रफ ऑडियो स्लाइड शो कर सकती है क्योंकि ऐसा नहीं लग रहा है कि वह समय में किसी भी वास्तविक लोगों तक पहुंचने वाली है
1,उपयोगकर्ता पूरी तरह से सिर्फ 2 दिन पहले की तरह आपका जवाब देखा यह बहुत सच है lol .. पूरी तरह से स्पष्ट .. xD
1,भविष्य पर ध्यान दें!
0,पोकेमॉन डायमंड पर उपयोगकर्ता 200 घंटे ... और मेरे पोकेडेक्स में केवल 311/493
0,मुझे Zend Studio F प्यार है। ग्रहण (पूरे ग्रहण के रूप में भी)।  RSE SSH प्लगइन बस काम नहीं करता है और IDE को मारता है।
0,मेरा ब्लैकबेरी मुझे पागल कर रहा है! OMG दिन से बाहर 5 मिनट काम करता है! तू
1,उपयोगकर्ता बहुत प्यारा है
1,सुप्रभात MRSJONESAXLE !!
1,"अब घर वापस आकर आकाश बहुत बेहतर लग रहा है, नीले रंग के बड़े पैच"
1,"उपयोगकर्ता हे, अपने स्वयं के लिंक के बाद मुझे यह url मिला"
0,यह सिएटल में अब धूप नहीं है।  यूआरएल
0,डनो ... क्या करना है
1,जन्मदिन मुबारक हो Zachary Quinto!  (ontd_st उसे ट्रेंडिंग विषयों में चाहते हैं और मैं केवल उपकृत करने के लिए बहुत खुश हूं)
1,"सप्ताहांत के लिए बहुत उत्साहित। Mi, NYC, CHI और ... ओह, इज़राइल से शहर आने वाले आगंतुक!"
1,"उपयोगकर्ता ओह, और आपने अभी तक मेरे चुटकुले नहीं सुना है, बस यह है कि हम इसे कैसे करते हैं, यह Htown में धन्य हो।"
0,"उपयोगकर्ता काश मैं देख सकता था, फेबर/ब्राउन फाइट आज रात #websoup है"
0,uggers ..... मुझे नफरत है कि Cory की मृत्यु हो गई।  मैं अभी भी इस पर विश्वास नहीं करना चाहता ... मुझे और अधिक अनुयायियों की आवश्यकता है !!
1,उपयोगकर्ता अरे मुझे लगता है कि मुझे यह पता चला है
1,उपयोगकर्ता मैं सिर्फ एक कॉफी जिलेटो था।
1,उपयोगकर्ता मैं तुमसे प्यार करता हूँ
1,उपयोगकर्ता मैं एचपी के लिए सिल्वरसिटी कोक को मार रहा हूँ और साथ ही साथ इंतजार नहीं कर सकता!
0,उपयोगकर्ता लानत है कि आप इसे इस तरह डालने की जरूरत नहीं है!
0,अंत में स्कूल बाहर !!! बेवकूफ स्नोडेज़ .... मैं इस सप्ताह के अंत में एक तैरना है और वास्तव में घबराया हुआ है ...
0,ooommgg मैं soooo स्लीपल हूँ! बहुत बुरा मेरे पास काम से पहले एक झपकी के लिए पर्याप्त समय नहीं है
1,हताश गृहिणियों के सीज़न फिनाले को देखना
0,"कोको पॉप, कोको चट्टानें = सबसे अच्छा अनाज लेकिन सबसे अच्छा रविवार डिनर एक्स नहीं"
0,Url शर्म की बात है कि यह मेरा नहीं है
0,सभी मैं सुन सकता हूं कि खर्राटे हैं। मुझे उस शोर से नफरत है। लेकिन मुझे ईर्ष्या है कि बाकी सब अभी भी सो रहे हैं
1,उपयोगकर्ता मुझे नहीं पता कि मैं क्या कर रहा हूँ
0,एक सपने को बर्बाद करने का उपयोगकर्ता तरीका।
1,.User कौन सा आपको सबसे अच्छा लगता है?
0,मैं इतना तो पढ़ने से ऊब गया हूँ
1,"URL - देखो कि वह कितनी खुश है मैंने उसे एक कैंडी दी है, लेकिन वह इसे तब तक नहीं खाएगी जब तक मैं उसे खाते नहीं देखता। मुझे लगता है कि वह w ..."
1,YAY मैं देख रहा हूँ उपयोगकर्ता awwwww लानत है यह होने वाला है
0,"उपयोगकर्ता हमें तब तक बंद करने के लिए कहा गया है जब तक कि यह आधिकारिक सेवा नहीं है जो अभी भी एक महीने दूर है, हालांकि यह नहीं है?"
0,आपके नुकसान के बारे में सुनने के लिए उपयोगकर्ता क्षमा करें
1,उपयोगकर्ता वास्तव में प्रतीक्षा करें?! झूठा
1,उपयोगकर्ता इस सप्ताह के अंत में निर्माता पर जा रहा है?
1,उपयोगकर्ता आप मुझे ट्विटर पर कैसे मिला?!
1,हाँ !!! यह एक विशाल दिन होने वाला है @ बाथरूम
0,"उपयोगकर्ता हम्म, शायद हमारा दोषपूर्ण है - यह सूर्य से चार्ज नहीं करेगा, केवल इसे मुख्य रूप से मुख्य के माध्यम से चार्ज करने से"
1,केवल सुबह काम करने के लिए। फिर दोपहर में मस्ती के लिए लंबे सप्ताहांत की खरीदारी!
0,"उपयोगकर्ता haha ​​मैं अन्य लोगों को पढ़ना पसंद करता हूं, लेकिन मैं एक हारा हुआ हूं और ट्विटर के बारे में कोई जीवन नहीं है"
0,उपयोगकर्ता कुछ भी धूप में बैठकर धूप की ओर देख रहा है
1,"पहली पोस्ट वोहू! एक बार जब मुझे इस ट्विटर लार्क की आदत हो जाती है, तो मैं अक्सर अपडेट करना सुनिश्चित करूंगा। मैं अब पशु क्रॉसिंग सिटी लोक एक्स खेलने के लिए बंद हूँ"
1,"मैं इसे प्यार करता हूँ, सड़क के लोगों को सड़क पर घर से बाहर जाना नशे में बात कर रहे थे कि हमने यूरोविज़न में कितना अच्छा किया, मैं यूरोप से प्यार करता हूं!"
0,"उपयोगकर्ता प्रफुल्लित करने वाला है, लेकिन मैं गोरा lmfaooooool क्यों नहीं हो सकता, मुझे एक लॉगिन बना सकता है ताकि मैं Haaaa बीमार पोस्ट कर सकें"
1,उपयोगकर्ता एलिसा के लिए चिल्लाओ
0,5 के बाद से काम पर। खिचड़ी भाषा एक झपकी लेने के लिए इंतजार कर सकती है। मैं मिसहिम <3 तक मिलता हूं जब तक वह बंद नहीं होता
0,अशर हाँ जो हमेशा कठिन हिस्सा होता है
1,उपयोगकर्ता hahah हाँ मुझे पता है कि जब वह कहता है तो मेरा नाम कैसा लगता है
1,मेरे अपडेट पर उपयोगकर्ता kemontre seeinq yor जघन बाल वास्तव में परेशान कर रहे हैं। Chanqe yor pic के शीर्ष पर सेटिंग्स पर जाएं।
0,"उपयोगकर्ता नीस ... हम फिल्टर कॉफी कला के काम से बाहर भाग गए, अच्छा नहीं, मेरी रोटी को भूल गए कि टोस्ट को दिन में खराब शुरुआत करें"
0,उपयोगकर्ता लॉगिन करने में असमर्थ (सफारी 4 का उपयोग करके): अनंत लूप रीडायरेक्ट्स में
0,दिल वास्तव में टूट रहा है ....... यह कोई नया बच्चों को सहन नहीं कर सकता ??? क्यों?
0,"इसलिए मैंने 3.0 iPhone अपग्रेड डाउनलोड किया है, लेकिन इसे स्थापित नहीं कर सकते क्योंकि iPhone सर्वर नीचे लगता है"
1,"उपयोगकर्ता उम, यह एक पल के लिए एक अप्रत्याशित अतिथि लेखक था।"
1,उपयोगकर्ता यह एक ऐसी फिल्म से है जिसे मैंने आपकी फिल्म प्रविष्टि के जवाब में जोड़ा है।
1,आइसक्रीम प्राप्त करना
1,"महान वर्क आउट इस ए.एम. मेरे भक्ति करने जा रहे हैं, कुछ फोन कॉल करें।  और फिर मेरे दिन की तारीख, फिल्म (ऊपर) और रात के खाने, मेरे आदमी के साथ"
1,उपयोगकर्ता वास्तव में वह एक काला आदमी है
1,@ स्मोकिन 'अल की शुरुआती जन्मदिन के खाने के लिए। सभी को इसकी जाँच करनी चाहिए
0,मैं गुणा 4.0 पसंद नहीं है यह बेकार है
1,"उपयोगकर्ता को आशा है कि आपके पास एक सुरक्षित यात्रा थी, क्षमा करें, हम इसे किक नहीं कर सकते। मेमोरियल डे के लिए वहां रहें"
1,कैटरीना देख रहे हैं क्या आप लोग कर रहे हैं?
1,उपयोगकर्ता का तरीका होने का तरीका
1,कार्देशियनों के साथ बनाये रहना
1,मैं बहुत थक गया हूँ। जल्द ही एक अच्छा शॉवर लेने के लिए '
0,उपयोगकर्ता भी आपको याद करता है!
1,अब जा रहा है..कच्या बाद में
1,"उपयोगकर्ता हे ट्रेसी, सुप्रभात!"
0,उपयोगकर्ता मैंने अब तक आपके ट्वीट की जाँच नहीं की। मुझे पता है कि तुम लोग मज़े करते थे। जब छोड़ देते हैं ? और इसका मतलब है कि आपका कभी वापस नहीं आ रहा है
0,उपयोगकर्ता हाँ इसके 30 सी बिना हवा और बहुत मजबूत गर्म सूरज के साथ! लेकिन मैं पूरी दोपहर के अंदर रहूंगा
0,"उपयोगकर्ता गरीब रोब!  उन साइकोस .. उन्हें GTFO की आवश्यकता है! मुझे उनसे नफरत है! लगभग उन कार Bcause की Themn, यह एक अपराध है! यूनीव के लिए रवाना"
1,उपयोगकर्ता aww yea मैं एक बिल्ली भी धारियों है !!
0,उपयोगकर्ता स्प्रेडबी शरीर तरल पदार्थ? मानव से सुअर संपर्क? बेहतर है कि हम इसके पास नहीं जाते कि मुझे लगता है
1,उपयोगकर्ता #rosazahnbÃ½rste
1,100 अनुयायी!  वाह!
1,उपयोगकर्ता viciado कोई कतार नहीं? ट्विटर?
0,"उपयोगकर्ता अच्छी तरह से, मुझे एक दिन की छुट्टी की आवश्यकता थी और मुझे यह नहीं मिल रहा है।  हाहा। मैं कहता हूं ""हां"" बहुत सारी बाहरी परियोजनाएं करने के लिए!"
0,मैं बहुत निराश हूं कि मैंने पेरिकार्डिटिस के बाद से आज पहली बार काम करने की कोशिश की और मेरे पास अभी भी लक्षण हैं।  मुझे लगता है कि यह नहीं गया
0,उपयोगकर्ता सस्ता अब के लिए मुफ्त के करीब है।  मेरे पास एक साइट है लेकिन इसका एक प्रीमियर लेआउट है।
0,मुझे अपनी कार वापस चाहिए
1,"उपयोगकर्ता क्यों अपनी कहानी को 140 CHR तक सीमित करें। सभी को बताएं कि आपको www.iamsoannoyed.com पर क्या गुस्सा है, यह आपके तनाव को दूर करने में मदद करेगा"
1,उपयोगकर्ता ने Mactalk ट्वीट की जाँच की जिसे मैंने अभी -अभी रीट्वीट किया था। ये लोग बहुत अच्छे हैं - उनके साथ पकड़ो! बताएं कि ईएम ड्रॉफ्रेमोक ने भेजा है
0,यह सप्ताहांत मेरा 20 वां हाई स्कूल रीयूनियन है और मैं इसे याद करने जा रहा हूं।
1,Geburtstag। उम्मीद है कि मेरे ड्राइविंग टेस्ट को पास करने के लिए दौड़ सही है।
1,उपयोगकर्ता geez अच्छा आप सबसे अच्छा होने के लिए अच्छा है
1,"बहुत सारे पैसे के साथ, आप सभी नकली प्रोफाइल खरीद सकते हैं जो आपको मिलते हैं)"
0,बस लगभग 15 मिनट में एक अनानास को नीचे गिरा दिया ... मुँह में दर्द होता है
0,URL - ny uke फेस्ट में नेल्ली मैकके ... सुनिश्चित करने के लिए घटनाओं की दिलचस्प श्रृंखला
0,काम पर भद्दा बदलाव।  थोड़ा उदास लग रहा है
1,मेरी भतीजी के साथ बाहर लटकना .....
1,"मैं नए घर में गया हूं और कॉकफॉस्टर्स, ओकवुड और बैक टू बार्नेट के पास गया, बारिश से पहले कुछ खरीदारी की .. धन्यवाद स्पेंकी"
0,"उपयोगकर्ता ऐ, लेकिन फिर आप मोब्स दिखाते हैं। मैं वैसे भी करता हूं"
0,"उपयोगकर्ता मुझे क्षमा करें, लेकिन मैं केवल उन आवेदकों को स्वीकार कर सकता हूं जो यूरोपीय संघ का हिस्सा हैं।"
0,"मैं बहुत थक गया, आधा मृत पहले से ही लाह!"
1,"उपयोगकर्ता अगर यह एक माँ थी, तो यह tingle के लिए है"
1,उपयोगकर्ता सुबह बीबी बाकी सभी को: लिविंग कलर क्लिप लोलोलोल में अच्छा समय।
0,"परीक्षा के बाद की गतिविधियों की जाँच, इतने सारे अर्थशास्त्र और भूगोल पूरक कक्षाएं"
1,उपयोगकर्ता आह! बुध! मुझे भी वह मेरे जैसा ही जन्मतिथि है और मुझे याद है कि यह XDDD पर परमानंद है
1,Alamy Pay चेक फ्री 1M20 OCTABOX?
0,मेरा डोटर मतलब है ... मैं रोना चाहता हूं
1,"उपयोगकर्ता मैं वास्तव में स्क्वैश को नहीं छोड़ता था, बस इसे काट दिया और शुरू से ही चावल और स्टॉक के साथ इसे डाल दिया। महान निकला"
0,मुझे उठना चाहिए।  लेकिन मैं नहीं कर सकता
1,उपयोगकर्ता एह वह वास्तव में मेरा प्रकार नहीं है ... योग्य लेकिन उन्होंने फिल्म में अपनी भूमिका के साथ एक अच्छा काम किया
1,मेरी नई मैक बुक के लिए कल सिम्स 3 खरीदने के लिए जा रहे हैं !!
1,उपयोगकर्ता धन्यवाद!
0,उपयोगकर्ता मैं यह पढ़कर हैरान था कि उपयोगकर्ता ने आपसे क्या कहा। हैरान और दुखी। गरीब वर्तनी और अज्ञानता मुझे रोती है।
0,उपयोगकर्ता हाँह !!
1,"* गाता है* फल सलाद, स्वादिष्ट स्वादिष्ट। दही के साथ, यहां तक ​​कि यमी-एर! (मैं #f1 पर मेरा स्नैक -ब्रिंग है !!) c'mon webby !! जाओ किमी!"
0,पिछली रात से सिरदर्द पर है
