1,उपयोगकर्ता आशा है कि आपका एक मेगा महान समय @ एवेन्यू क्यू होगा
0,जीएम कल दिवालिया हो जाता है। मुझे आश्चर्य है कि अगले चुनाव में मिडवेस्ट में कितने नीले राज्य लाल हो जाते हैं
1,"उपयोगकर्ता url - मैं looooook fattt mahnnn haha ​​और मेरे पैर पीला है, लेकिन अब हाहा नहीं मिला है !!"
0,बस मिडवले से वापस आया और अब चेरस में वापस आ गया है
0,"मेह। उपयोगकर्ता द्वारा 3 ""द डोंगल ऑफ डोनाल्ड ट्रेफुसिस"" एपिसोड अभी भी उपलब्ध नहीं है। ट्यूब के घर पर सुनना चाहता था ..."
1,उपयोगकर्ता दोस्त यह सामान्य बैठक की तरह मजेदार था।
1,लिंक के लिए उपयोगकर्ता धन्यवाद!
1,उपयोगकर्ता - ब्लॉग सुविधा पर बधाई
1,"मुझे रोज की याद आती है। & im थोड़े अजीब लग रहा है .. लेकिन im हमारे गीत को सुन रहा है bff <3 ""दो दुनिया टकराओ"" - उपयोगकर्ता क्षमा करें अगर मैंने इसे गलत बताया"
0,उपयोगकर्ता कुछ वास्तव में भी irate हो जाता है! लेकिन वे बुरा नहीं मानते? मुझे लगता है कि वे ऐसा करने से नफरत करते हैं।
0,मुझे लगता है कि मैंने अपना दोपहर का भोजन बहुत तेजी से खाया .. मैं अब बीमार महसूस करता हूं
0,"उपयोगकर्ता MMMM, कोको-पॉप्स!  कल रात कैसी थी, गुड़िया? वास्तव में खेद है कि मैं नहीं जा सका। मुझे सही सेवा देता है, जैसा कि मैं अब भी बीमार हूँ!"
0,"उपयोगकर्ता Awww, क्या हुआ?  मुझे उम्मीद है कि कुछ भी गलत नहीं है"
0,बिस्तर पर जा रहे हैं .... मुझे तूफान पसंद नहीं है।
0,मैं जल्द ही इतना अकेला हो जाऊंगा
1,"उपयोगकर्ता ने इसे फोन ब्राउज़र पर चलाया। कार्य करें, कार्य करें। मैं उपयोगकर्ता की हत्या करने जा रहा हूं, लेकिन वह लगातार एक है"
0,उपयोगकर्ता मैं आम तौर पर आज काम पर एक भद्दा दिन है। कभी एक ऐसी नौकरी में फंस गया था जिसे आप प्यार करते थे लेकिन अब नफरत करते हैं? यह अच्छा नहीं है
0,"प्यार करता है कि मौसम कितना भव्य रहा है, लेकिन काश उसके साथ सामान करने के लिए अधिक लोग थे"
1,"अशर हाँ, मैं हो सकता है कि एक बहुत शाब्दिक। ज़ोर-ज़ोर से हंसना"
1,एक आरामदायक जन्मदिन का आनंद ले रहा है ...।
1,"मार्ले और मैं इतना महान नहीं था। जेनी के साथ दोपहर का भोजन, हैली, और दादी रूथ फिर माँ के साथ फर्नीचर की खरीदारी"
1,काम पर। इन कॉफी राउंड को करने में अच्छा हो रहा है।
0,उपयोगकर्ता मैं नहीं जानता कि हारून! क्षमा करें! यदि आप चाहें तो मैं उसे ट्वीट कर सकता हूं?
0,मेरे पास पेट है ...।
1,"ठीक है, आज रात उपयोगकर्ता कहाँ है? उसकी हिम्मत कैसे हो!"
1,उपयोगकर्ता आभार वापस भेज दिया है! धन्यवाद
1,"उपयोगकर्ता हाहा, मैं कोशिश करता हूं"
0,"क्या आप 3 घंटे तक एक लाइन में खड़े होने की कल्पना कर सकते हैं? फिर जब आप लक्ष्य तक पहुंचते हैं, तो इसमें केवल 3 मिनट लगते हैं? = मेरे पैर दर्द करते हैं।"
0,im नरक के रूप में ऊब गया
1,उपयोगकर्ता एक हा! खुशी है कि मैं दर और आपको मेरी पोस्ट पसंद है
1,आज रात प्यार की पूजा! मुझे लगता है कि भगवान मुझे एक नई दिशा में खींच सकते हैं ... बहुत रोमांचक!
1,अंत में एक धूप का दिन! ईव सारा रिमी और केफ़ेड के साथ समुद्र तट
0,आज मेरे भाई और पप्पी के साथ गोल्फ खेला ... मैं बीट हो गया मैं बास्केटबॉल से चिपका हुआ हूं।  Cici के पिज्जा पर खाया!
1,"उपयोगकर्ता आह ... मैं बहुत ईर्ष्या कर रहा हूँ! इसके लिए उत्साहित और ऑड्रे टाटुओ के कोको चैनल, ट्रांसफॉर्मर 2 में फेंकते हुए लेकिन शाह!"
0,क्रैश होने
1,उपयोगकर्ता कितना रोमांचक है;)
0,"बस हैरलेम में हमारे पसंदीदा रेस्तरां में नोम नॉम्स से वापस आ गया। मैं दुखी हूं, मैं वहां खाने से चूक जाऊंगा, खाना अविश्वसनीय है"
0,"उपयोगकर्ता मैंने मंगलवार को नहीं देखा, मैं काम पर था"
0,"उपयोगकर्ता भगवान, काश मेरे पास पैसा होता !!!!"
1,उपयोगकर्ता बहुत बढ़िया (: मुझे कोई अंदाजा नहीं है कि वह कहाँ है। लेकिन ठीक है
1,डॉकवेइलर बीच बोनफायर में अल्कोहल का टन।
0,खेल के साथ उपयोगकर्ता शुभकामनाएँ! बारिश यहाँ वापस आ गई है
1,"ओह, इसकी मल्टीप्लेटफॉर्म, अच्छी तरह से ठीक है तो लानत है कि आप ई 3 मैं महिला अधिकारों को संशोधित करता हूं"
1,उपयोगकर्ता aww bummer..या जानता है कि मेरे बच्चे उन्हें चिप्स के साथ/सैमी और इस तरह के चिप्स की तरह खाते हैं। वे ज्यादा वेजी नहीं खाते हैं इसलिए यह मुझे बनाता है
0,अस्पताल के वेटिंग रूम को दोपहर 3 बजे पैक क्यों किया जाता है? मुझे शायद खुद की जाँच करने से पहले खाना चाहिए था
0,उपयोगकर्ता मुझे पता है..तो उस के बारे में दुखी
1,ऑनलाइन है।  यूआरएल
0,"मैंने पुष्टि की कि यह गैस्ट्रिक था। भोजन के बाद, सभी दर्द चले गए। मुझे लगता है कि मेरे पास ट्रांसफार्मर 1 डीवीडी है, नहीं, मेरे पास नहीं है।"
0,"आप जानते हैं कि मुझे अब क्या चाहिए। दोस्तों, सोफा, फिल्म, पिज्जा। कोई भी?  एक्स"
1,"उपयोगकर्ता वूट! आशा है कि यू सुरक्षित उड़ान है। तो यू के लिए उत्साहित! यू आर वहाँ रहते हुए सम टेक्स-मेक्स और बीबीक्यू खाना सुनिश्चित करें! और सबसे अधिक, इसे रॉक!"
1,उपयोगकर्ता uhuuu क्रिस मैं वास्तव में नोटिस नहीं था यह आप haha ​​था। Sooo COOL। प्रोत्साहित करना!  नीलकंठ
1,आज रात दौरे का सबसे अच्छा शो
1,"उपयोगकर्ता: बड़ा प्रशंसक, और आपके पास एक सुंदर बेटी है ..."
0,फुटबॉल में सीएल हैंगओवर जारी है
1,"उपयोगकर्ता पवित्रता मजेदार है, लेकिन अपनी सुबह की कार्यशालाओं को याद मत करो"
1,माइक ने मुझे डॉक्टर हू स्टिकर दिए
0,"मेरे पीछे वेश्याओं के भार क्यों हैं, मैंने उन सभी को ब्लॉक करने की कोशिश की है, यह सिर्फ डरावना है! छिपाना:-|"
0,Im इसकंड को 100 रुपये में एक घंटे के लिए सड़क पर खुद को मारने के लिए। मुझे केवल तीन बार पर्याप्त करने के लिए करना होगा
1,उपयोगकर्ता यह था
0,उपयोगकर्ता को लगता है कि यह एक और पक्षी हो सकता है। फील्ड गाइड में पढ़ें कि वे अन्य बक्से पर आक्रमण करते हैं और अंडे खोलते हैं। खूबसूरत पक्षी इतना कठिन
0,"लेकिन मैं ""असाइन"" पर क्लिक नहीं कर सकता! असाइन करने के लिए स्क्रीन पर कुछ भी नहीं। एक और मदद के मामले की तरह दिखता है।   User.com"
0,यह पता लगाना कि ट्विटर क्या है .. बस मेरे बेसबॉल सामान पर नज़र रखने के लिए ... लेकिन इस बकवास पर बहुत सारे फोन्स
1,"उपयोगकर्ता लड़की मुझे यकीन है कि आप अपने तरीके से भाग्यशाली हैं। वे हमारे जैसे सामान्य लोग हैं, सिर्फ टीवी और समृद्ध लोल पर।"
1,उपयोगकर्ता धन्यवाद!  मैं प्यार करता हूँ lv यह आपसे मिलकर अच्छा लगा
1,उपयोगकर्ता aww धन्यवाद heps स्वीटी - मैं वास्तव में उस *गले *की सराहना करता हूं
1,उपयोगकर्ता मेरी बहन उस पर जा रही है!  और im लगभग आत्मकथाओं के साथ किया जाता है बीमार उन्हें कल आप लोगों को ईमेल करें
1,नई जोनास ब्रदर्स सीडी कल बाहर आती है !!
0,"बस। #जब जीवन जटिल नहीं था, तो #iremember। एफएमएल"
1,"कमाल है, हर किसी की रीट्वीट मदद के साथ हम उपयोगकर्ता को #8 तक प्राप्त करने में कामयाब रहे हैं! यदि आपने अभी तक उसका पीछा नहीं किया है, तो अभी करें"
1,आज रात का लाइनअप - कोई लुगो url नहीं
1,उपयोगकर्ता बहुत अच्छा है!  नथिन बहुत: मैं ऊब गया हूँ।
0,"उपयोगकर्ता मुझे डोनट्स के लिए गिनती है! हाँ मैं वास्तव में नींद के पैटर्न के साथ संघर्ष कर रहा हूँ, हर समय और 3 के लिए वापस wed पर knacked"
0,उपयोगकर्ता हाँ ... ठीक है। इसने मुझे चोट नहीं पहुंचाई लेकिन मेरी गतिज
1,बस सैम के साथ खरीदारी करने के लिए जा रहा है
0,उपयोगकर्ता ने बहुत कुछ किया?
1,मेरे पास अंत में कुछ भी स्वस्थ नहीं था .. मेरे पास सिर्फ टमाटर का सूप और ब्राउन ब्रेड बूर ब्राउन ब्रेड स्वस्थ था
1,उपयोगकर्ता g'day दोस्त
0,"लोग क्यों सोचते हैं कि मैं उन्हें अलग -थलग महसूस कर रहा हूं?  क्यों ... अगर लोग मेरे खिलाफ हो रहे हैं, ठीक है ..."
1,उपयोगकर्ता हाँ प्लस यह एक कार्टून है इसलिए अच्छे समय को समझना बहुत आसान है
1,उपयोगकर्ता वाह ..... आप क्या करते हैं?
1,मुझे जल्द ही स्नान करने की जरूरत है
0,खेल दिवस कल ओ अच्छी तरह से मैं हाहा नहीं जा रहा हूँ
0,"उपयोगकर्ता ओह, ओह-बस उस 'अद्यतन' को स्थापित किया"
0,Awww आदमी। यह चूसना
0,"Sats - मुझे चोदो, किसी और को उन्हें ohhh yea करने की जरूरत नहीं है! यूआरएल"
0,"मेरा प्रतियोगिता गीत नहीं खेल सकता, क्योंकि किसी तरह मेरी बाईं कलाई को चोट लगी और यह बहुत कठोर है। मुझे आशा है कि यह जल्द ही बेहतर होगा। ओह दुख।"
0,आज दुर्भाग्य से काम करने के लिए वापस।
1,उपयोगकर्ता मेरी गलती नहीं थी
1,"सुधार मुझे वास्तव में 32 सरल योजना पोस्टर 22 नहीं मिले, मैं उन सभी को कहां रखूंगा?"
1,उपयोगकर्ता धन्यवाद हुन तनावपूर्ण स्थिति
1,गड़गड़ाहट। अभी उठा। मैं वास्तव में कल रात एक घंटे से अधिक सोया था!  डोर्रा।
0,उपयोगकर्ता हे बस स्विमिंग सूट खरीदारी से घर! और मुझे फिर से कुछ भी नहीं मिला! क्या आप अभी भी पानी की लड़ाई कर रहे हैं?
1,उपयोगकर्ता सभी मैं कह सकता हूं कि लानत है। अवाक
0,"- थंडरबोल्ट्स और लाइटनिंग, बहुत भयावह ... Eekkk !!! एक्स"
1,उपयोगकर्ता का अर्थ है कि आप क्या कर रहे हैं?
1,"@ ricykai: आपकी दया के लिए धन्यवाद, मुझे आप ट्यूब दे रहे हैं"
1,उपयोगकर्ता: मैं करूंगा !!  धन्यवाद!!
0,उपयोगकर्ता जीवन के लिए रिले के लिए आज 80 से अधिक किशोरों की अध्यक्षता कर रहा होगा ... काश मैं वहां हो सकता। हर जगह नहीं हो सकता
0,कॉफी एक बुरा विकल्प था ... अब मैं सब घबराहट कर रहा हूँ ओह! दिल पाला!
1,उपयोगकर्ता के पास इस सप्ताह के अंत में काम करने के लिए एक अच्छा दिन है?
0,मेरे पेट में दर्द होता है।
0,पहली घटना के लिए देर से
0,"उपयोगकर्ता nope। काश वहाँ थे, बस कुछ रेव रेव लोगों को देने के लिए जो आज वहां नहीं थे और सब कुछ सेकंडहैंड सुनेंगे"
1,रविवार के लिए इंतजार नहीं कर सकता:] सोमवार के लिए इंतजार नहीं कर सकता:] और मैं बहुत खुश हूं कि मुझे अपनी पत्नी मिल गई
1,"हम्म मुझे आश्चर्य है, कितने दिन जाने के लिए? 5 यह है"
0,उपयोगकर्ता यहाँ भी है लेकिन यह बहुत महंगा है।
1,"उपयोगकर्ता Aww, धन्यवाद!"
1,"मैं घूर रहा हूँ !!! मेरी शाउट पत्रिका में, इसे पढ़ने के लिए मर रहा है"
1,मुझे गेज परिवार से प्यार है
1,"उपयोगकर्ता URL - यही वह जगह है जहाँ मुझे मेरा मिला, या जैसा कि वे भी कहते हैं, कार्ड कॉलिंग।"
1,उपयोगकर्ता मुझे और यू शूदा 2 रॉक हाउस में चला गया
1,"उपयोगकर्ता शुक्रवार को मैं तुर्की के लिए रवाना हो रहा हूँ, 2 दिनों के लिए वापस और फिर ग्लेस्टो !!!! मैं स्पष्ट रूप से बहुत उत्साहित हूं कि अच्छा ग्रब = अच्छी योजना है"
1,उपयोगकर्ता gdnight sp!
1,उपयोगकर्ता मुझे लगता है कि सभी doit लोग अब पुराने हैं। यहां तक ​​कि श्रीनी भी।
0,"दिन में tae gleeeeeesga जाना चाहता है,"
1,अन्य एसएमएस प्राप्तकर्ताओं के लिए उपयोगकर्ता के साथ -साथ ईमेल।
0,Usher aw आदमी मैं जुलाई r 3 तक घर नहीं होगा
1,"बरसात के दिन नॉन स्टॉप है! अब एक सप्ताह के लिए घर पर रहें। हाइज़,"
1,उपयोगकर्ता अरे क्या हो रहा है? मेरा नाम कालेब है और मैं आपका सबसे नया अनुयायी हूँ !!!
0,कल रात महान पार्टी। हालांकि मेरे डैड्स कैमरा को तोड़ दिया
1,"""वन शॉट"" के रूप में अच्छा था जितना कि मैं इसे प्राप्त कर सकता था। बस कहानी प्रस्तुत की।  मुझे शुभकामनाएँ दें।"
0,उपयोगकर्ता iTunes में नहीं
1,उपयोगकर्ता यह निश्चित रूप से दिलचस्प था
1,उपयोगकर्ता टॉम अब कॉमेडाउन नहीं है ... हमने छोड़ दिया लेकिन जो लोग रहते हैं वे वास्तव में प्रशंसक नहीं हैं ... अच्छी रात
0,आज थोड़ा खो गया
1,आज यह साबित करने के लिए एक और दिन है कि मैं महान हूं .... इतनी खूबसूरत चीज
0,उपयोगकर्ता फिलाडेल्फिया हवाई अड्डा बहुत अद्भुत नहीं है। मुझे माफ़ करें।
1,"झपकी मेरे सबसे अच्छे दोस्तों में से एक बन रही है, अब इसका समय YouTube पर कुछ ऑफिस फैनविड्स देखने का समय है ... शनिवार के लिए याय!"
0,"एक आंख को पिघलाने, दिन की तरह नशे की तरह। मुझे लगता है कि कट ऑफ"
0,उपयोगकर्ता awwww अनिद्रा? क्या आप कुछ भी नया कर रहे हैं? मुझे पता है कि आप उत्तेजक के लिए सुपर संवेदनशील हैं
0,"कुछ लंबे समय तक जावा के कुछ लोगों को ध्यान में रखते हुए, अच्छी तरह से, इस साल जावाओन के बारे में कम खुश हैं"
1,URL - एलेक्स हॉटी मार्शल फ़्लिप। वह शावक उसे और अधिक आराध्य बनाता है
0,जीवन के लिए रिले गीला और ठंडा था।
1,बोटिंग करने के लिए रवाना! यिपी
1,उपयोगकर्ता kamusta ang mga whale sharkies ??
1,"उपयोगकर्ता मैं चाहता हूं, 2:55 मैं ओटावा में एनवाई 2:56 और कुछ साल बाद कॉर्निंग एनवाई में 2:53 को कॉर्निंग करता हूं ... यह केवल एक समय की बात है"
1,उपयोगकर्ता wouhou
0,आज ट्विटर को भूल गए। लानत है मैं इस पर बुरा हूँ
0,Sleeppppy एक मॉल में जा रहा है .. कभी -कभी मैं Dunno। मुझे अपने बच्चे की याद आती है। और इस नाटक से बीमार हूँ। स्कूल के 11 दिन।
1,"बिस्तर पर जा रहा है, मुझे सामान छोड़ दो"
