0,उपयोगकर्ता मिलते हैं अब आपके पास अन्य लोग हैं जो वाह से बात करते हैं और मुझे सुनने की जरूरत नहीं है। ज़ोर-ज़ोर से हंसना। मैं उसे yrs के लिए जानता हूँ !! कभी नहीं मिला
0,पैर मुझे काम के एक लंबे दिन से मार रहे हैं - कल और रविवार को आगे नहीं देख रहे हैं
0,काम पर एक और दिन आह!
1,"बस मेरे समकालीन नृत्य शिक्षक से बहुत प्रशंसा थी ""यह वास्तव में आपको सूट करता है"" लाइन। सितंबर के बाद ही मुझे जगाना"
0,"काम पर नहीं, यह मासिक आगंतुक अह्ह्ह्ह का पहला दिन है"
0,Ugh उपयोगकर्ता मैं वास्तव में ईर्ष्या कर रहा हूँ उन waffles अद्भुत हैं।
0,मुझे खेद है कि मैं सही नहीं हो सकता ...
0,"पिताजी ने कलाई, कॉलर की हड्डी और पसलियों को तोड़ दिया है, सर्जरी की जरूरत है"
0,मैंने पूरी तरह से किसी के साथ बाहर घूमने के लिए एक यात्रा पर जाने के बारे में झूठ बोला। 'एयरपोर्ट' एकमात्र बहाना था जो दिमाग में आया।
0,उपयोगकर्ता मेरे पिताजी के भाई की मृत्यु हो गई।  आओ मुझे cuddle।
1,मेरे रास्ते पर Poca
1,बस कुछ कॉर्निश आइसक्रीम यम यम में टक
0,उपयोगकर्ता यही कारण है कि वह मुझे वापस लोल का पालन नहीं करेगा
1,उपयोगकर्ता www.tweeterfollow.com का उपयोग करके एक दिन में 100 अनुयायी प्राप्त करते हैं
0,कोई सनस्क्रीन और एक सनबर्न के साथ पूल में है!
1,SQL से वापस। कल फाइनल ... नया वीडियो आज
1,"उपयोगकर्ता um im नहीं एक सेलेब मैं चाहता हूँ कि मैं था, लेकिन वैसे भी धन्यवाद"
1,उपयोगकर्ता आप घर-आधारित नौकरी की तलाश कर रहे हैं? क्या आप अपनी सेवाओं की पेशकश करना चाहेंगे? कृपया @ या डीएम मुझे; मैं आपको काम खोजने में मदद करने की कोशिश करूंगा
0,"उपयोगकर्ता ने माइली ने आपको डंप किया, इतना दुखी कोई परवाह नहीं करता है! आप डाउच, आपका एक बूढ़ा आदमी पकड़ता है! निक के साथ रहने के लिए माइली छोड़ दो! नील <3"
1,उपयोगकर्ता मैं भी इस लड़की से प्यार करता हूँ
0,"उपयोगकर्ता मैं ट्रोल हो गया जब मैं एक साक्षर /b /tard द्वारा वहाँ पर ट्रोल करने की कोशिश कर रहा था, यह दुखद था। हम दोनों अजीब तरह से बात कर रहे थे।"
1,उपयोगकर्ता दो बार। अब स्पष्ट है।
1,आशा है आप जल्द ही स्वस्थ हो जाएंगे। हमें आपको अच्छे आकार में चाहिए।
0,उपयोगकर्ता वुडब्रिज पब। । .damn ia chi में हो। । ।  इतना पागल। मुझे लगता है कि मैं सभी अच्छे गंदगी को याद कर रहा हूं। । ।
1,"उपयोगकर्ता अच्छी नींद, मेरे दोस्त।"
1,बस नेड के डिक्लेसिफाइड और icarly देखे गए! कौन! मेरे पीछे आओ! और उपयोगकर्ता
1,"उपयोगकर्ता URL क्षमा करें, जब मैंने इसे फिर से मांगा तो मैं पहले ही लॉग ऑफ कर चुका था ... तो यहाँ यह है"
0,"मुझे बस एहसास हुआ कि मैं कल रात में कितना बुरा मूड था, मैं उसे सो गया। उम्मीद है कि बीमार आज खुश रहो!"
0,इतिहास निबंध की तैयारी
0,मेरी सांसें वीज़ हैं।  जब आप पूरे सप्ताह बीमार रहे हैं तो कोई और नॉट्स में नहीं जा रहा है।
1,उपयोगकर्ता सुनिश्चित करें कि इसके क्वार्टरशेड लड़कों के लिए इसका कमरा मिला है
1,उपयोगकर्ता मैं विशेष रूप से उत्साहित नहीं था मैं देर से होने के लिए बाध्य था इसलिए उत्साह जो आपको होश में था मैं स्थानीय पशु चिकित्सक में काम करता हूं।
0,मैं अब और नहीं जानता
0,उपयोगकर्ता URL - वे ऐसे भव्य और प्यारे कुत्ते हैं। मैं एक चाहता हूँ!
0,लोरेना के टमटम ने बंद कर दिया
0,अर्घ! मेरा पैर अभी भी दर्द कर रहा है। उम्मीद है कि एडविल आज काम करता है
1,परिवार का समय फिर से
1,"उपयोगकर्ता हम ठीक हैं! और मुझे यकीन है, लेकिन हम अभी भी संपर्क में रहते हैं .. बहुत, हाहा!"
0,इस दर सीमा के साथ क्या? कहते हैं कि मैं 100 से अधिक अनुरोध नहीं कर सकता एक एचआर लोल IV केवल यहाँ पर मिला और कोई अनुरोध नहीं किया।
1,सीवर्ल्ड जाने के लिए तैयार हो रहा है
0,मेरे माता - पिता तलाक ले चुके हैं। 6 साल। और फिर भी वे लड़ते हैं।
0,अभी भी मेरे दिमाग से 'खतरा' नहीं मिल सकता है ...।
0,उपयोगकर्ता मैं खो गया हूँ। कृपया मुझे एक अच्छा घर खोजने में मदद करें।
0,उपयोगकर्ता ट्विटर एलओएल को समझाने के लिए पर्याप्त शब्द नहीं देता है कि आप क्या सुन रहे हैं?
1,URL के माध्यम से URL ने इस महान कंगन को जोड़ा ... एक झलक लें
1,उपयोगकर्ता लवली वास्तव में उसी पुराने 'बीट सनसेट डीप वेस्ट को आज शाम को देखने के लिए
0,उपयोगकर्ता अपने आप को भाग्यशाली मानते हैं। मेरा आकाश प्लस 160 बॉक्स स्पष्ट रूप से इतना पुराना है कि मैं नया आकाश ईपीजी गाइड नहीं कर सकता
0,और मैं अभी भी अपने दाहिने कान के साथ नहीं सुन सकता
1,एक शानदार सप्ताहांत था..गर्दी 40 वें में पुराने दोस्तों के साथ पकड़ना
0,उपयोगकर्ता जहां आर यू .. मुंबई में ?? .. इस पक्ष में बारिश नहीं हुई
0,केप टाउन में यह बहुत ठंडा और सुस्त है
1,"बारिश का दिन, खेल रद्द कर दिया गया .... लगता है कि हम जन्मदिन की पार्टी के लिए समय पर रहेंगे ... हमेशा एक उज्ज्वल पक्ष"
0,उपयोगकर्ता में मेरे दोस्तों को देखने के लिए उपयोगकर्ता अपने अंतिम बोस्टन शो खेलता है वे 9: 40ish पर जाते हैं जो आपके पास अभी भी समय है। मिलने आना!
0,सोच रहा है कि मैं ट्विटर पर अपनी कोई भी झाँक क्यों नहीं ढूंढ सकता
0,तीसरी नौकरी के साक्षात्कार के लिए अपने सीवी फ़ोल्डर से कोबवे को डस्ट करना .. एक लंबे समय से मुझे आशा है कि मैं इसे चूसना नहीं
1,लगता है कि उत्तोलन कमाल है!
1,उपयोगकर्ता नहीं .. वह बिल्कुल भी नहीं था..लेकिन यह अभी भी मज़ेदार था।
1,5 पर रिवरव्यू में कोरलीन को देखने जा रहे हैं। वूट वूट !!!!!!!!!
0,बस परिवार के साथ भोजन से बाहर हो गया और सामान्य साप्ताहिक परिवार पकड़ लिया! सुबह 6 बजे तक खुश न हो
0,"वाशिंगटन में प्रेमी, मैं बहुत ऊब गया हूं"
1,उपयोगकर्ता कीमती विकास हार्डवेयर ठीक है!
0,"पिछले नीट को तोड़ दिया और मेरे 12 दिनों की स्थिति का भंडाफोड़ किया, अब मैं 0 दिनों पर वापस आ गया हूं और गिनती कर रहा हूं"
1,"URL MARIAH, पृथ्वी पर क्या आप पागल बच्चे कर रहे हैं। - फोटो शूट।"
1,"उपयोगकर्ता क्या आपने उन पुस्तकों में से कोई भी पढ़ा है जो हैरी विंस्टन अभी तक है? किसी दिन, अनजाने, सौंदर्य और अरब की रातें पसंद करेंगे"
0,उपयोगकर्ता मुझे बहुत खेद है।
1,उपयोगकर्ता कोई समस्या नहीं है
1,"याय, 27 लोग मेरा पीछा कर रहे हैं! रोमांचक!"
1,उपयोगकर्ता jesssss हम आपसे भी प्यार करते हैं <3 <3 <3 <3 <3 मुझे लगता है कि आपको एक उत्तर सत्र करना चाहिए। लेकिन कृपया लंदन वापस आएं
0,"उपयोगकर्ता अभी तक 3.0 जेलब्रेक है? मैं ब्लॉग पर देख रहा था, लेकिन मैं इसे नहीं ढूंढ सकता।"
1,"अशर हाँ, मेरा मतलब है कि कोई वादा नहीं है, लेकिन मैं आपको देखना चाहता हूं और बहुत बुरा हूं इसलिए मैं देखूंगा कि मैं क्या कर सकता हूं"
0,मैं इस समय यहां हूं और सोचता हूं कि मैं हर समय काम से पागल हो रहा हूं
0,उपयोगकर्ता ... डबलिन अब दिल टूट गया है ...... जैसा कि मैं हूँ
0,Im अभी भी चिढ़ गया है ......
1,"उपयोगकर्ता वू कमाल, मैं उसके अन्य सामान की जांच करूंगा"
1,उपयोगकर्ता धन्यवाद आदमी! बिल्कुल सही कहा।
1,उपयोगकर्ता अपने इंग्लैंड के लिए कृपया और धन्यवाद
1,शुभ संध्या कहते हैं!  यूआरएल
0,"मैं अपने बालों से नफरत करता हूं, इसकी गाँठ को भंग करने के लिए जो इसे ब्रश करने के लिए दर्दनाक बनाता है, लेकिन मुझे इसे ब्रश करने की आवश्यकता है या अन्यथा यह लार्ड की तरह दिखता है।"
0,उपयोगकर्ता क्या गलत है
1,उपयोगकर्ता यह निश्चित रूप से इसके लायक है; कला को नहीं समझना मुझे नफरत करने से नफरत है; और नफरत पैकिंग और भी अधिक ।।
0,आह मुझे मेरी मम्मी की याद आती है ...
0,उसकी कार की प्रतीक्षा में तय हो जाने के लिए !!! इतना अविश्वसनीय रूप से दुखी ...
0,"सुबह कल रात सोने के लिए बहुत गर्म था, लेकिन कम से कम उसकी खाट में रुका था। ऐसा लगता है कि बारिश होने वाली धूप वापस आ रही है"
0,उस टीना को सुनने के लिए उपयोगकर्ता को खेद है ...
1,"दर्द को रोकने के लिए उपयोगकर्ता। हाहा। मैं इसे बहुत करता हूं। लगता है कि सामान्य से थोड़ा अधिक समय ले रहा है, हालांकि।"
1,वह आज दोपहर एक सही जानवर रहा है। भगवान मैं बहुत भाग्यशाली हूँ
0,"ओह, मेरी गलती..इस उपयोगकर्ता, उसके असली ट्विटर नहीं, हालांकि, मैं वास्तव में उसका संगीत पसंद नहीं करता: पी"
0,मेरे बाल काले हैं
1,"मेरा बोस्टन टेरियर निन द्वारा ""इच्छा"" करने के लिए सो गया .... उसकी लोरी"
0,जब आप घर पहुंचते हैं तो उपयोगकर्ता बिस्तर पर जाता है! मरो मत!
0,तो शेन डॉसन के वीडियो को हरी क्यों दी गई थी ..? तो समलैंगिक। मुझे यह देखने को नहीं मिला
0,"उपयोगकर्ता लानत, एक और याद किया।"
0,उपयोगकर्ता मैं दुखी हूँ मैं कुछ अच्छे दिनों के लिए बीमार हो गया हूँ जो हमारे पास है ... बाहर नहीं चल रहा है
0,उपयोगकर्ता री मूविंग बीकेएस - जीटी मेटल अलमारियों (रिप्लेक। लकड़ी) एक बार पूरे लिब के लिए और इसे एक सहायक + हथौड़ा के साथ किया। Schl Hndymn ने कहा कि NMP
0,"महान, झाई अब हर जगह दिखाना शुरू कर रहे हैं .. बेवकूफ सूरज।"
0,"मेरे मू मिनीकार्ड्स (कोई धारक नहीं) छवि यह नहीं है कि मैं इसे वेबसाइट पर वेबसाइट पर कोई टेल नंबर कैसे सेट करता हूं, फ़ॉर्म 404 के #MOO #MINCARDS पर संपर्क करें"
0,सोमवार से नफरत है !!
1,"अशर हाँ, मैं मास्टर्स स्टूडियो में पॉप होना चाहिए और अगर आपके पास नहीं है तो इसे अपने डेस्क पर डाल दिया"
0,"उपयोगकर्ता ओह यार, तो यह सिर्फ मेरा कंप्यूटर नहीं था मैं सिर्फ अपने sys को जासूसी करने वाला था।"
1,उपयोगकर्ता मुझसे बात करते हैं।
0,मेरी फ्लैट स्क्रीन टूट गई
1,अब बाहर जा रहा है।
0,उपयोगकर्ता आपने छोड़ दिया।  बाद में बात करें।
1,काम करने के तरीके पर .... एक अच्छा दिन है लोग
0,URL - पहले से बिजली का तूफान 1337 था। लेकिन सभी अच्छे मौसम ने हमें याद किया
0,मेरे कमरे में मुर्गा उत्सव
0,"उपयोगकर्ता हिया, कुछ फ़ीड चीज़ पर गोटागो तो धीरे -धीरे नीचे हवा। पूरे सप्ताह ले सकता है कि आप कैसे हैं?"
0,क्रिस्टल होल्ड्सवर्थ ने मुझे स्वाइन फ्लू> दिया। <मैं मुश्किल से बोल सकता हूं। आज इतना विफल रहता है
1,उपयोगकर्ता हाय कुछ भी नया नहीं है। बस शुक्रवार की रात का आनंद ले रहा है। आप?
1,मुझे नौकरी चाहिए। वास्तव में नही। मुझे और पैसा चाहिए। अधिक अधिक मदद!  उपयोगकर्ता;) उहुह
1,"लेटेक्स और शाह के साथ नए सामान की कोशिश कर रहा है, यह एक रहस्य है, यह एक रहस्य है।"
0,उपयोगकर्ता FF Chrome की तुलना में मेरे लिए अधिक है और यह भी लटका हुआ है!
0,"मुझे लगता है कि मुझे बेशक जाने की जरूरत है, लेकिन मैं दोपहर से ही रहना चाहता हूं। जिसका मतलब है कि मुझे अब एचडब्ल्यू करने की आवश्यकता है। मैं सबसे अच्छा दोस्त की तलाश करूँगा"
1,उपयोगकर्ता योग्य !!! मैं आपको और आपके awesomely रचनात्मक विचारों का दिल करता हूँ!
1,"उपयोगकर्ता और btw, मुझे लगता है कि आपकी डिग्री खत्म करना सही दिशा में एक महान कदम है"
1,"उपयोगकर्ता और भी बेहतर यदि आपको अपना घर छोड़ने की ज़रूरत नहीं है, तो शायद कल अपना बीबीक्यू हो। यह इसके लिए एकदम सही होगा।"
0,उपयोगकर्ता डिट्टो।
1,कोई स्कूल नहीं! = [
0,"उपयोगकर्ता नहीं इसका जुर्माना अगर वह मुझसे बात नहीं करना चाहता है, तो वह मुझसे बात नहीं करना चाहता है।"
1,दंत चिकित्सक..डोन। साक्षात्कार..क्या। धूप में समय का आनंद ले रहे हैं .. प्रगति!
0,उपयोगकर्ता हेह - धन्यवाद! अब मुझे बस मुझे पैक करने में मदद करने के लिए किसी की जरूरत है। मैं इसे चूसता हूं।  इस बार मूवर्स को किराए पर लेना भी।
1,"निश्चित रूप से हम करते हैं!  btw.i ने यू टॉम को बताया, डोनू ने ज़ोर से कहा कि उर बढ़ता हुआ ठीक है, दा कोल्ड यू एन डी वापस आ जाएगा!"
0,कोई पैसा नहीं मज़ा!  बुधवार को इंतजार करना होगा!
1,उपयोगकर्ता बस पैन सियर्ड चिली सी बास डब्ल्यू/हनी ए लाइम सीलेंट्रो रिडक्शन को एक ठंडा लहसुन और टकसाल मटर सलाद के साथ जोड़ा गया
0,इतना निराश
1,उपयोगकर्ता योग्य मुझे लगता है कि मेरे पास है - लेकिन निश्चित रूप से #CGFT
0,": ओ लिंकन एक मूल Xbox नहीं खरीदेंगे, इसलिए मैं oogie बूगीज़ रिवेंज खेल सकता हूं!  किसी ने इसे PS2 पर मेरे लिए पाया"
1,"देखना शांत होना (एच) शायद जल्द ही सोने के लिए होना चाहिए, लेकिन फिर कल सुबह सोने के लिए हमेशा गणित होता है"
0,उपयोगकर्ता मुझे तुम्हारी याद आती है!  और मैं लुसी और कॉनर को देखना चाहता हूं! मुझे लगता है कि हमें जल्द ही फिर से यात्रा करनी होगी
1,उपयोगकर्ता हाहा यह सुनकर अच्छा लगा कि अन्य लोग दर्द के साथ रह रहे हैं
1,"उपयोगकर्ता आप इस सप्ताह Aion के बारे में अधिक सोचते हैं, जैसा कि मैंने मेट्स किया था। यह कोई आसान काम नहीं है!  अब तक का बीटा कैसा है? बेहतर तो उम्मीद है?"
1,उपयोगकर्ता यह प्रिय के साथ चल रहा है
