0,"हे भगवान, कृपया मेरी मदद करें"
1,यह सोचता है कि कैसे एक व्यक्ति आपको अद्भुत महसूस कर सकता है !!!!  रातों का एक सप्ताह फिर से काम करना !!! उन्हें मुझसे नफरत करनी चाहिए !!
1,उपयोगकर्ता awee क्या आपको इसे पहनना है? Cuz यदि आप नहीं तो नहीं! आप बहुत सुंदर हो
0,वे अब और साफ करने के लिए असंभव बना देते हैं यह चूसना जा रहा है
1,"वोकल्स को सुनने के लिए उपयोगकर्ता खुश हो गया, लगता है कि चीजें नए एल्बम के साथ ट्रैक पर हैं"
1,उपयोगकर्ता इच्छाधारी सोच?
0,"मुझे टोमोज़, W00H00 से एक बैंक हॉलिडे डे पर काम न करें !!"
0,मुझे उठने दो। सोमवार को काम की चिंता करें।  अलविदा
1,उपयोगकर्ता अच्छी तरह से nuthn..was एक FYI
0,उपयोगकर्ता yup जो राशि है: कुल परीक्षा में 520minutes
0,कल रात भूत व्हिस्परर में OMG! खिचड़ी भाषा का मानना ​​है कि जिम मर गया !! मैं रोया!!! शायद वह मरा नहीं है ... वे हमेशा (yn) के आसपास चीजों को मोड़ते हैं
1,"उपयोगकर्ता क्या मैं एक समुद्री डाकू हूँ? ""मुझे ईमेल"" मेरी उंगलियां आज सुबह काम नहीं कर रही हैं"
1,"पुनर्वितरण के प्रति दृष्टिकोण एक मजबूत सांस्कृतिक घटक url है >> YEP, अभी भी मेरे हाथ में अर्थशास्त्री के साथ"
0,ब्रूकर ओम्निबस वॉल्यूम द्वारा कैप्टन अमेरिका के अंत के पास। 1। निराशाजनक है कि एक वॉल्यूम नहीं होगा। 2 26-50ish के साथ।
0,"उपयोगकर्ता मुझे ये बातें नहीं बताते, उन पर इतना रोना होगा कि ऐसा नहीं हो रहा है !! वह बेकार है।  *वाह*"
1,उपयोगकर्ता आप अविश्वसनीय हैं- आपके द्वारा ली गई तस्वीरों से प्यार करें।  अपने काम से प्यार करो।
0,उपयोगकर्ता बिल्कुल !!! वह अपने श*यह 2 पर! वह कभी पीजे पर नहीं है! हमेशा कपड़े पहने और tanned! वे अलग हो गए हैं!  गोट्टा kno whn 2 जाने दो!
0,मातृ दिवस की शुभकामना!  मैं 5 घंटे के लिए काम करने जा रहा हूं क्योंकि मैं गेंद पर नहीं था कि मैं इसके लिए पूछूं
1,मेरी वेब-साइट पर उपयोगकर्ता मेरे पास छात्र परिषद की घटनाओं के बारे में छात्र लेखों के लिए एक जगह है। इसके लिए लिखना चाहते हैं?
1,उपयोगकर्ता हाय फ्रान और गीनो (गीनोएंडफ्रान लाइव> url
1,"उपयोगकर्ता mmmm, जो स्वादिष्ट हाहा लगता है। कौन फ्राइज़ और सलाद से प्यार नहीं करता है?! तो दोनों एक साथ अद्भुत हैं। हाहा।"
1,कल मैं उपयोगकर्ता के साथ एंटवेरपेन जाऊंगा ... और हम फ्रेंच फ्लेमिश और अंग्रेजी ^ ^ अद्भुत बात कर सकते हैं
1,"उपयोगकर्ता VB विक्टोरिया में ठीक है, मुझे लगता है।  हम इसे अन्य सभी राज्यों में ""ग्रीन डेथ"" कहते हैं। बुंडाबर्ग रम में जाओ।  यह बंद हो जाता है"
0,यहाँ w/ रेडियो स्टेशन क्या है? मैं उन्हें नहीं खोदता .. मुझे सुबह रयान सीक्रेस्ट की याद आती है। जब वे चले जाते हैं तो आप छोटी चीजों को याद करते हैं
0,नतालिया के साथ मियामी में नहीं।
0,फीलिन बैड गले में दर्द होता है
1,"हेडिन आज हीलिंग आर्ट्स फेस्टिवल के लिए।  घर में ओज़ोमेटली!  फिर, कुछ दिनों के लिए कुछ आर एंड आर के लिए होटल डेल के लिए रवाना।"
1,ट्विटर पर वापस
0,उपयोगकर्ता का अनुमान है कि मैं अब क्या कर रहा हूँ ...?
1,उपयोगकर्ता हां। हमने इसे शायद एक या एक साल के लिए किया है? शायद थोड़ा और
1,बहन के साथ दोपहर का भोजन खाने वाले डाइविंग बोर्ड पर बैठा है
1,उठो । कॉफी का समय
1,उपयोगकर्ता अरे माननीय..क्या आप कैसे हैं?
1,"हैंगओवर प्रफुल्लित करने वाला था, आपको इसे देखना होगा! वास्तव में ओज़ के विज़ार्ड के लिए उत्साहित कल प्रदर्शनी!"
1,टोस्टेड सैंडविच मुझे खुश करते हैं
0,"मेरा फोन दिन में शिटियर और शिटर हो रहा है, लेकिन मुझे यह बहुत पसंद है।"
0,"मैं जिस कोंडो को देख रहा था, वह अब सूचीबद्ध नहीं है।"
0,मुझे याद आती है कि आप एक बहुत अधिक url हैं
0,उपयोगकर्ता आप उगते सूरज n oz आदि की भूमि के लिए रवाना हो जाते हैं - Jammy गाय yr हैंड सामान में एक लिटल संयुक्त राष्ट्र के लिए किसी भी स्थान पर है? Im शांत ish !!!
1,एंथ्रोपोलॉजी हमारे प्रोफेसर रेमन बॉतिस्ता एक्सडी की तरह दिखते हैं
1,हाह मेरे बी-दिन वाह!
0,"#CBC.CA स्लाइड ""पहले से ही बात की"" के रूप में पारित किया गया"
1,2 पर कोर्टनैनेज़ जा रहा है! और फिर डांस फ्लिक देखकर!
1,उपयोगकर्ता OOO। मैं उनसे प्यार करता हूँ क्योंकि मैं एक बच्चा था। हमेशा मेरी पसंदीदा फिल्में रही हैं
0,उन सभी चीजों के बारे में सोचकर जो मैं अभी काम करने से बेहतर कर सकता हूं
0,मैं अब और नहीं सो सकता ..
1,"??????????? ???????? ?? ????: 11 - ????????, 20 - संक्रमित मशरूम लाइव, 27 - क्रोनोस 2? ??? ???????? ???????????? ? हाइल्ट ट्राइब"
0,"आह बकवास, मुझे लगता है कि यह वह एपिसोड है जहां दाना मर जाता है ..... गरीब एलिस।"
1,स्कूल: l मैं पूरा दिन गाऊंगा
1,उपयोगकर्ता हाँ हाँ..और मेरे पूरी तरह से गुमनाम कवर को उड़ाने के लिए धन्यवाद। मैं ingogneeeeto था!
0,"9.15 के लिए डॉक्टरों के पास गया, केवल यह बताया जाए कि यह 9 था और मुझे नहीं देखा जाएगा"
0,उपयोगकर्ता चीर मीठा राजकुमार
0,हेट यू हेट यू
0,उपयोगकर्ता बस coz आप भूखे हैं !! तुमने मेरा केक नहीं खाना है !!
1,उपयोगकर्ता प्रतीक्षा ... आपको एक जेके डीएम मिला है ??? हे भगवान!
1,"उपयोगकर्ता मुझे व्यवसाय सेट अप एनालिटिक्स पसंद है, ट्रैफ़िक और Google सर्वर की प्रतीक्षा कर रहा हूं ताकि मैं कोड में डालूं।"
1,"उपयोगकर्ता हाँ, यह है कि ... समाप्त नहीं है, लेकिन अभी शुरुआत, मैंने फैसला किया कि मैं इन सफेद दीवारों को और अधिक खड़े नहीं कर सकता"
0,मुझे लगता है कि im 6 पृष्ठों को रोने वाला है! मुझे अपने शिक्षक से बहुत नफरत है
1,आज हॉवर्ड इलियट थिंग एल्बम द्वारा खेला गया है। मुझे वास्तव में यह पसंद है। अच्छा किया
1,उपयोगकर्ता जंगल की मेरी गर्दन में आपका स्वागत है
0,अंग्रेजी प्रीमियर लीग पहले से ही याद आती है
1,उपयोगकर्ता कोल्ड बाथ?
0,उपयोगकर्ता ओह -माये यह सिर्फ हमारे पर है
0,"उपयोगकर्ता ओह, जैसा कि मैंने कहा कि मैं इसे एक INET लिंक पर देख सकता हूं, मैंने सोचा कि मैंने कहा ... कुछ भयानक"
0,काश उन्होंने अपने पीएम को नियंत्रित करने में मदद करने के लिए एक iPhone एप्लिकेशन बनाया
0,OMG लेडी गागा का कॉन्सर्ट 12 अगस्त।
1,"अच्छे समय का उत्सव मनाएं, आइए!!!!!!"
1,उपयोगकर्ता आप अपने नथुने में उसकी चाबियों की तलाश कर रहे थे?
0,कृपया इस बिल्ली को घर दें। मुझे एलर्जी है।  यूआरएल
0,"जब मैं घर वापस आऊंगा तो मैं शायद कुछ नारुतो एपिसोड देखूंगा, जब तक कि मेरे पास इतना बुरा सिर नहीं होगा जैसा कि मैंने कल किया था"
1,सोना। लास वेगास और एल.ए. सुबह उर
0,"मैं घंटों की गिनती कर रहा हूँ सिवाय मैं ऊब ऊब को गिन नहीं सकता ... ऊह, यह क्या है? क्या मैं इसे चब सकता हूं मुझे आश्चर्य है ....."
0,सुपर बीमार कल और आज के सभी यह मेरे परीक्षण के लिए बहुत कठिन और लगभग गैर -अस्तित्व के लिए अध्ययन करता है।
0,उपयोगकर्ता इसकी केवल बैठा और सब कुछ फ्लॉप है? कि इस सप्ताह बेकार है हमेशा के लिए समाप्त हो गया !!!!!
0,"उपयोगकर्ता दुख की बात है, केवल 1।"
0,"उपयोगकर्ता मुझे पता है कि पिछली बार जब मैंने देखा था कि आप साके में आपके बगल में थे, लेकिन आपके साथ नहीं हाहा आप कैसे हैं। जल्द ही पकड़ो"
0,im तो फ्रिकिन उधार लिया
0,"माइग्रेन ... डनो मैं यहाँ क्या कर रहा हूँ ... माता -पिता के साथ बड़ी, बड़ी लड़ाई। बहुत भयानक। मैंने खराब कर दिया ... बुरा।"
1,"उपयोगकर्ता आह हाँ ... लहर, निश्चित रूप से ... मैं इसके बारे में पल्स के रूप में नहीं सोच रहा था, लेकिन एक स्थायी लहर के रूप में ... धन्यवाद"
1,"मैं ""एम क्रैंकी। इसलिए मैं इसे अपने प्यारे ट्विटरवर्स पर बाहर निकालने के बजाय बिस्तर पर जाऊंगा। क्योंकि मुझे मुझे पसंद करने के लिए यू की जरूरत है"
1,"उपयोगकर्ता नहीं, यह ठीक है। फैसल यह हो सकता है।"
0,मेरे पास हिचकी है
0,उपयोगकर्ता सिड मिशेल से प्यार करता है। आप मिशेल से प्यार करते हैं। कैसी के बारे में क्या?
0,"उपयोगकर्ता बहुत अच्छा लगता है। हमेशा एक सप्ताह के लिए मास्टर कलंक के साथ खेलना चाहता था, लेकिन उसने मुझे ठुकरा दिया कि क्या आप पुनर्निर्माण पर हैं?"
1,उपयोगकर्ता पुन: AXEFX और गिटार बुखार। बड़ी खबर और बधाई। बस शादी के टमटम से मिला। गिटार बेशक बहुत लग रहे थे।
1,"अगर मैं पूरे दिन माचिस बीस/रोब थॉमस को सुन सकता था, तो मैं शायद!  यह फीनिक्स में एक सुंदर दिन है!"
0,उपयोगकर्ता हाँ उन्हें भूखा रखें और फिर अपना भोजन डालें। मेरी बिल्ली को भूख लगने पर आपको काटना पसंद है ... एक दिन चिंतित है कि वह मुझे खा जाएगी
0,आज बहुत बीमार लग रहा है
0,उपयोगकर्ता और आप ऑनलाइन हस्ताक्षर क्यों करते हैं
0,उपयोगकर्ता Argh मैं भूल गया कि यह था - बहुत व्यस्त खेल खेल।
0,मुझे सेपोरा से नफरत है। मैं वहां बहुत अधिक पैसा खर्च करता हूं
0,"उपयोगकर्ता को 2 पर काम करना होगा, लेकिन मुझे प्यार होगा!"
1,"उपयोगकर्ता फे इसे #30Rock में मारता है, लेकिन उस फिल्म का शीर्षक खराब लगता है #inbruges एक अजीब इंडी लिटिल यूरो सिटी हिटमैन गॉन बैड कथा है!"
0,किसी ने ट्वीट नहीं किया
1,टॉम मैकफली: साओ पाउलो में एक और किक गधा गिग से वापस। पूरी तरह से अद्भुत। हर सेकंड से प्यार करता था। बेतरतीब ढंग से स्टार गर्ल को शब्द भूल गए! हा
0,URL - उपयोगकर्ता हम वहाँ थे !! हम इतने परेशान हैं कि हमने आपको नहीं देखा !!  लाई एक्स
0,टिलर शूटिंग URL से फुटेज
0,कुत्तों के लिए होटल मुझे फाड़ रहा है।
0,मेरे पेट में वास्तव में दर्द होता है अब ओह नोस
0,उदास और थका हुआ
0,यह वर्ग हेलल गे है
1,उपयोगकर्ता - आज!
1,उपयोगकर्ता मुझे आशा है कि आप अपने माता -पिता से मिलने में मज़ा लेंगे।
0,उनके संशोधन गाइड अर्घह नहीं मिल सकते हैं और शुक्रवार को एक परीक्षा है
1,काम आखिरकार किया जाता है! लंबा गधा दिन। सभी हलचल के बाद यह बहुत अच्छा निकला
0,कल रात 46 ट्वीट। Dayum। हारून फिर से मेरे कमबख्त सपने में था।
0,उपयोगकर्ता मुझे इसके बारे में बताएं। आप वहाँ क्या देंगे?
1,उपयोगकर्ता आपको कैसे इलाज कर रहा है? देखा किसी की हत्या या अभी तक रिश्वत दी गई है?
1,मेरी नौकरी शुरू करें मंगलवार
1,उपयोगकर्ता awwww गरीब बात !! यदि आप सेरा को याद कर रहे हैं तो आपको भयानक महसूस हो रहा होगा। बेहतर बू
1,रिमाइंड हाउस शुरू होने वाला है। सिर्फ इसलिए कि मैं संशोधित कर रहा हूं इसका मतलब यह नहीं है कि मैं उस शानदार व्यंग्यात्मक जेंट की वापसी को याद करने जा रहा हूं।
0,"मैं वास्तव में इससे नफरत करता हूं जब लोग फ्लैश फोटोग्राफी का उपयोग करते हैं। न केवल यह विचलित करने वाला है, यह आपकी आंखों को नुकसान पहुंचाता है! यह बरामदगी का जोखिम भी लाता है।"
0,"उपयोगकर्ता मैं उम्मीद कर रहा था कि आप लोग एक MMVA जीतेंगे,"
0,"मंगलवार (12 मई, 2009) से शुक्रवार (15 मई, 2009) तक दुखी होगा"
0,सैन फ्रांसिस्को वास्तव में आज सुबह सुंदर है। मैं इस दृश्य को याद करने जा रहा हूं
1,इस महीने के अंत तक एक एचटीसी टच के लिए जा रहे हैं! उस पर मेरा दिल है! आशा है कि यह अच्छा है।
1,आज सुबह बर्न में पुनर्मिलन नाश्ता।  पूर्व छात्र प्यार टक!    काश मैं उनके साथ जुड़ सकता।
1,आज रात की चट्टान!
1,"मेरे मम्मी और मैं डरावने दुकानदार हैं! एक बार जब हम शुरू करते हैं, तो हम रुक सकते हैं।"
0,उपयोगकर्ता मैं हर समय करता हूं और मैं कभी -कभी कुछ हासिल करता हूं!
1,उपयोगकर्ता धन्यवाद मैंने इसे कुछ समय पहले लिया था cuz मैं gmail के लिए खुद का एक अच्छा चित्र नहीं था इसलिए मैंने अभी एक गुच्छा लेना शुरू कर दिया था
1,"उपयोगकर्ता क्यों आपका बहुत -बहुत धन्यवाद आपका कैमरा अगले सप्ताह किया जा रहा है, उंगलियां पार हो गई हैं। आप ठीक तो हैं?"
0,"उपयोगकर्ता मैं गूंगा था और पुनर्मूल्यांकन शुरू होने पर तारीख को गलत तरीके से पढ़ा। और यह जुलाई के मध्य में समाप्त होता है। और यह पहला आओ, पहला-सेवारत है"
0,अभी भी बीमार लग रहा है
0,लापता उपयोगकर्ता soomuch ineedumyangel
0,"मैट जॉन्स टीवी पर नहीं होगा, बहुत दुखी होगा"
1,मैं lovelovelove उपयोगकर्ता!  मैं कार में उसके गीतों के लिए रॉक कर रहा हूँ
1,"एक नई कविता लिखी, लेकिन मैं एक शीर्षक के बारे में नहीं सोच सकता ..... जो इसे पढ़ना चाहता है और मुझे कुछ विचार देना चाहता है?"
1,उपयोगकर्ता यह अच्छा है कि आपके पास एक जीपी भाई है! यहां तक ​​कि कूलर कि आप उसे नहीं खाते हैं।  रोजो के बारे में क्षमा करें! *सूंघ*
1,जॉर्जिया। मेरे ट्विटर पर जा रहा है यह जाँच कर रहा है
1,कुत्ता मेरे पैर पर सो रहा है।  इसे प्यार करने के लिए मिला
0,"उपयोगकर्ता नहीं, पूरे सप्ताह अच्छा होना चाहिए, इसलिए हमारे पास गुरुवार और शुक्रवार के लिए योजनाएं हैं और बहुत सारे पानी लाने के लिए याद रखना चाहिए"
1,"उपयोगकर्ता एक अंधेरा सूरज? एक सूरज जो अंधेरा है? वह मेरे किसी मतलब का नहीं है! अच्छी कोशिश, btw।"
