0,"उपयोगकर्ता मैं निश्चित रूप से तीन कैंची क्लिप था, लेकिन केवल एक ही इसे हवा में बनाने जा रहा था।  ओह अच्छा।  मैं थक गया हूं!"
0,वास्तव में निराश है कि मैं अपनी प्रोफ़ाइल के लिए एक नई तस्वीर अपलोड नहीं कर सकता ...।
1,हाँ! स्टॉर्म ने रेडर्स को नष्ट करने के बाद टैब पर $ 100 जीता। बहुत बढ़िया
1,उपयोगकर्ता वापस ट्विटरिंग पर
1,उपयोगकर्ता मुझे भी याद आती है! मुझे एक विचार है-जल्द ही एक शो देखें और इस पर रिपोर्ट करें। पाठ्यक्रम के उपयोगकर्ता से अनुमति के साथ
1,अपने आप को फिर से सुदृढ़ करने के लिए तैयार हो रही है!  बने रहें
0,यदि आप ऐसा कहते हैं तो उपयोगकर्ता
0,हेट्स स्कूल .... एक और बामबोज़ल कॉन्सर्ट में जाना चाहता है
0,मेरी गर्दन कमबख्त दर्द होता है।
1,उपयोगकर्ता यह अब काम करता है कि मैं इसके बारे में कुतिया है। हुर्रे! ज़ोर-ज़ोर से हंसना।
0,मुझे लगता है कि मेरा सिर फटने वाला है
0,काम के बाद उपयोगकर्ता स्टूडियो सत्र में जा रहे हैं .... मुझे आशा है
1,उपयोगकर्ता धन्यवाद - मुझे लगता है कि एक सभ्य वीए को लेख लिखना चाहिए - उन्हें इससे काम का भार मिलेगा
0,उपयोगकर्ता मुझे खेद है कि मेरा बुरा मैंने बहुत कहा है!
1,उपयोगकर्ता मेरा जीवन औसत है।
0,URL - ब्रिम बनाने का समय! यह एक खराब तस्वीर है
0,उपयोगकर्ता मैं आपको महत्व देता हूं। बहुत ज्यादा।
1,सभी जिमी फॉलन ट्वीट्स को पढ़ना
0,उपयोगकर्ता आप एक मीन हैं
0,'इस तरह की एक अकेली रात .. मैं अकेले बिस्तर पर जाने के लिए थक गया हूँ?
1,उपयोगकर्ता Aww FF के लिए धन्यवाद!
0,आज काम पर वापस
0,"जाहिरा तौर पर आप ट्विटर और एफबी काम से कर सकते हैं !! कोई gmail या gtalk नहीं।  मुझे बिल मरे फिल्म की याद दिलाता है ""बॉब के बारे में क्या?"" ... ""बेबी स्टेप्स"""
0,"यह रविवार है, और मैं काम कर रहा हूं"
1,उपयोगकर्ता मैं वास्तव में उन्हें पसंद करता हूं। उनके YouTube वीडियो भी प्रफुल्लित करने वाले हैं
1,ठीक है ... cufon को तैनात किया गया है ... इसे एक चक्कर लोग URL दें
0,सप्ताहांत के माध्यम से इसे बनाने की उम्मीद नहीं है।
1,"उपयोगकर्ता ब्रिट ने अपनी महिला पार्ट एमी एंडिफ का नाम दिया, जो आपको लगता है कि वह एफ-यू-सी-के-के की तरह लगता है, तो इसकी बकवास एमी"
0,क्या आश्चर्य है कि क्या उसके लड़कों ने बैंड की लड़ाई जीती है?  काम करना था और नहीं जा सका।
1,Im इस नए सामान का पता लगाने की कोशिश कर रहा हूं मुझे पता है कि आईडी कुछ दिनों में आदी है
1,"आप पार्टी के दृश्य के बारे में क्या सोचते हैं? हमें बताएं @ हमें उत्तर दें, और हम आपका ट्वीट ट्वीट करेंगे!"
1,उपयोगकर्ता धन्यवाद। क्या मैं क्लास कर सकता हूं कि आप मुझे अपनी मंजूरी दे रहे हैं?
1,उपयोगकर्ता योग्य।  ** BLOWS KISS ** क्या यू ने इसे पकड़ा?
1,कल लॉन्ग बीच के लिए उत्साहित
0,मौसम का पूर्वानुमान कहता है कि यह अगले पांच दिनों के लिए धूप होने जा रहा है।  काम पर जाने का समय होना चाहिए
0,परीक्षा अवधि !!!
0,मैं चाहता हूं कि सूरज बाहर आ जाए!  ऐसा क्यों लगता है कि यह हर समय भगवान दक्षिण के.सी. पर आता है। जरूरत है और कुछ सूरज चाहता है!
1,खोया हुआ लेकिन ... जो भी url
1,उपयोगकर्ता और आप यह जानते हैं!
1,पहाड़ी के राजा को देखना ..............
1,"बस परीक्षा समाप्त हुई। मैंने ठीक किया, मुझे लगता है।"
1,"उपयोगकर्ता अच्छी तरह से, मुझे लगता है कि आपको चाहिए"
0,कोई विचार नहीं है कि कौन सा कौशल करना है
1,उपयोगकर्ता ट्राफलगर स्क्वायर को मेरा वोट मिलता है
0,"उपयोगकर्ता मेरी बहनों के पिल्ला ने मेरे चार्जर के माध्यम से चबाया, इसलिए यह तब तक काम नहीं करने वाला है जब तक कि मुझे एक नया चार्जर नहीं मिलता"
0,"उल्लू शहर बीके है।  खुश समय के लिए अच्छा है, और उदास के लिए अच्छा है!  .. तेह। मैं तो द्विध्रुवी हूँ! ;)"
1,उपयोगकर्ता उपयोगकर्ता ... यदि आप ठीक है तो चोरी करना चाहते हैं। मेरे पास इस उद्योग में एक प्रतिनिधि है और मुझे इन डेवलपर्स का समर्थन करना है जो इसे बेचते हैं।
0,काश दिन में और घंटे थे !!  आज के रूप में आज के रूप में लगभग उतना ही पूरा नहीं हुआ था!
1,कहता है अरे!  मुझे दूसरी बार Jaunty स्थापित करनी थी। पहले एक मृत दोषपूर्ण था..तो मेरी गलती url नहीं
0,"वाह, 11 अनुयायी। क्या मैं बुरा हूँ?  haha jks, मेरे पीछे आओ! मुझे TMRW LOL द्वारा 20 चाहिए"
0,मेरे पैर दर्द। आपको यहां कहीं भी जाने के लिए 2o मिनट चलना होगा
0,ऊपर। सुपर बीमार। लानत है।
0,बस काम से वापस मिल गया .... क्या एक दिन !! मैं 17 1/2 घंटे प्यार करता हूँ ... तो मेरे कुत्ते करो
1,चित्रकारी
1,OMG उपयोगकर्ता धन्यवाद मेरी पुस्तक पढ़ने और समीक्षा करने के लिए धन्यवाद।  मैं वास्तव में सराहना करता हूं कि क्या मैं इसे अपने पेज से लिंक कर सकता हूं?
0,किसी तरह ट्विटर ने मुझे अनफॉलो उपयोगकर्ता को आश्चर्यचकित कर दिया कि क्या यह मेरी ओर से किसी और को महत्वपूर्ण है? सोमवार को जीआरआर
0,उपयोगकर्ता :: ithen वास्तव में बहुत दुखी और डरावना है
0,उपयोगकर्ता आपने 1600 समस्या को कैसे ठीक किया ???
0,"उपयोगकर्ता और जुड़वा बच्चों में से एक ने उससे कहा, ""तुम इतने मतलबी हो, तुमने मेरे चेहरे के ठीक सामने पिया और मुझे कोई नहीं दिया।"""
1,"उपयोगकर्ता ठीक धन्यवाद, ओह url"
1,पूल में छोटे लोगों के साथ लटकना
0,"उपयोगकर्ता मुझे खरगोशों को रोकने के लिए सबसे अच्छी विधि मिली है, गाजर उगाने के लिए नहीं है।  आशा है कि आप बनीज़ को हरा देंगे, हालांकि, एक रास्ता होना चाहिए।"
0,स्कोर: डंडेलियन 0 लोअर बैक -300
0,उपयोगकर्ता क्या आप मेरे लिए बहुत अच्छे हैं?
1,"भयानक मौसम, खिचड़ी भाषा मेरी बेटी के साथ डी पार्क के लिए बाहर जाती है"
1,उपयोगकर्ता मुझे ऐसा लगता है।
0,अभी तक शुक्रवार है क्या????
1,कल सुबह झील की सवारी की पुष्टि की गई। 40+किमी साइकिल चलाने का मज़ा!
1,उपयोगकर्ता ने किया कि आपके द्वारा अच्छा माना जाता था
0,"उपयोगकर्ता हाँ, मेरे लिए एक अच्छी आसान यात्रा होती। Midweek स्थिरता का मतलब है कि मैं एक घर टाई बनाने की संभावना नहीं हूँ"
1,उपयोगकर्ता वाट वास्तव में डी स्कूल विचार है ......#जिज्ञासु ...।
1,उपयोगकर्ता यहाँ पर समझाने के लिए कठिन है .. क्या इसे बाद में k im अच्छा tho अब hru?
1,"सोना? हाँ, निश्चित रूप से एक रविवार को सो रहा है!"
0,क्यों यह इतना ickky बाहर है !!!
0,"चीनी ए के लिए मग करने की जरूरत है, लेकिन यह ऐसा महसूस नहीं करता है।"
0,पशु चिकित्सक के दोस्त पर। कल एक और कुत्ते ने उस पर हमला किया था।  यूआरएल
1,"उपयोगकर्ता नहीं, मैं यह नहीं था ... mmmbut कुछ भी कार्मेल या टॉफी मेरे लिए अच्छा है!"
1,"उपयोगकर्ता ...... मजेदार रूप से पर्याप्त है, मैं एक शाश्वत आशावादी हूं ... हमेशा खरीदार और विक्रेता ... बस उन्हें खोजने के लिए मिला"
1,"यदि आप पहले से ही नहीं हैं, तो उपयोगकर्ता पहले वोट देना सुनिश्चित करें।"
0,"""हाउस"" (एपिसोड, सिंपल स्पष्टीकरण) का आज का एपिसोड इतना दिल तोड़ने वाला था।"
1,"इसे एक साहसिक कार्य के रूप में सोचें!  बेशक, अब मैं जाग रहा हूँ और कॉफी थी, मुझे चीजों पर एक अलग परिप्रेक्ष्य मिला है।"
0,शाम को नैदानिक ​​paeds शुरू करना चाहता था! मैं फोन और संगीत पर इतना समय बर्बाद करता हूं
1,उपयोगकर्ता मैं किसी दिन आपको दूर करने के बारे में उपयोगकर्ता से सहमत हूं
0,"लंबा सप्ताहांत। पैकिंग खत्म करने के लिए बिल्कुल भी उत्सुक नहीं। अंत में मुझे मार रहा है कि मैं आगे बढ़ रहा हूं। = [इतने सारे लोगों को याद करने जा रहे हैं, बहुत कुछ।  </3"
1,अराजकता के संस - मेरे जीवन का नया प्यार
0,उपयोगकर्ता * रोता है * मुझे तुम्हारी याद आती है !!!!!!  एमएसएन या टेक्स्ट पर टोमरो आईआरएल से बात करें? चुड़ैल कभी आप कर सकते हैं
0,यह है कि हर बार जब मैं स्नान करता हूं तो बाल कितना गिरते हैं। यह घृणित URL से अधिक दुखद है
0,"स्केट खेलना, लेकिन चैट करने के लिए लाइव पार्टियों में शामिल नहीं हो सकते"
0,430 बजे तक काम पर था ... एक और 13 बजे के लिए दोपहर 3 बजे वापस आना था .. और नहीं कर सकता@+*#एनजी नींद
0,काश कीमत सही है रविवार को आ जाए।
1,नूडल्स और सह। दोपहर के भोजन के लिए
1,उपयोगकर्ता trillz
0,उपयोगकर्ता उपयोगकर्ता उपयोगकर्ता वह बाहर चला गया मुझे याद है कि वह पूरी तरह से उनमें है! मुझसे ज्यादा! मेरे पास अभी भी बहुत सारे लोग हैं
1,उपयोगकर्ता aww। थैंक्स
1,उपयोगकर्ता नहीं! : एल इस तरह से और अधिक मजेदार है। अच्छी तरह से वास्तव में अगर नीना एक प्राप्त करना चाहती है तो मैं खुश हूं। लेकिन हम एक साझा करना पसंद करते हैं!  Xx हेहे xx
1,"ऑस्कर, मेरी बिल्ली, फ्लैट में वापस आ गया है + बहुत खुश लग रहा है!"
1,उपयोगकर्ता बाहाहा गीज़ जो सबसे अच्छी कॉल थी।  इसे कितना समय लगा 2 ने सोचा? ज़ोर-ज़ोर से हंसना
1,उपयोगकर्ता सबसे पहले एक माइस्पेस है। आप जानते हैं कि माता -पिता वास्तविक लोग सही हैं? उनके दोस्त और सब कुछ है। नासमझ।
1,उपयोगकर्ता मुझे बहुत खुशी है कि आप बेहतर महसूस कर रहे हैं।
1,मैं थका नहीं हूं। बस सादा आलसी। ngeee ~
1,उपयोगकर्ता HAHA MHMM। आपको पूरी तरह से चाहिए! यह मजाकिया हाहा है और कुत्ता आराध्य था। इसकी पूरी कहानी बहुत प्यारी थी
1,उपयोगकर्ता कूल। मैं अभी भी स्क्वियर्स पर एक नज़र रखने की सलाह दूंगा - मैं अभी भी विश्वास नहीं कर सकता कि वे कितने अच्छे हैं
0,*ट्विस्टेड .. गह अध्ययन मेरे वाणिज्यिक को पेंच बना रहा है
0,उपयोगकर्ता जो वास्तव में आराम से लगता है !! मैं बारिश नहीं सुन सकता
1,उपयोगकर्ता उस पुस्तक का नाम क्या है?
0,उपयोगकर्ता ने सिर्फ इतना सुना कि प्रीमियर लीग के साथ आपका सौदा समाप्त हो गया है। यह सुनने के लिए कि बी/सी मैंने ब्रॉडबैंड सेवा का आनंद लिया।
0,उपयोगकर्ता मैं मैश किए हुए आलू और मिश्रित ब्यूटेड वेजी के साथ एक रसदार टी-बोन स्टेक के लिए तरस रहा हूं
1,"#E3 पर #Microsoft: बिना नियंत्रक के गति नियंत्रण। तुम नियंत्रक हो! वास्तव में महान, हम खेलों का इंतजार करते हैं"
0,"अगली बार उपयोगकर्ता हम अधिक हैंगआउट करेंगे !! क्योंकि हम बहुत समय नहीं मिला, लेकिन कम से कम हम मिल गए!"
0,उपयोगकर्ता मैं बचकाना था
0,सूरज की रात = कल काम ...
0,आरटी उपयोगकर्ता मैं उस क्षण तक कभी नहीं जानता था कि यह कितना बुरा हो सकता है कि कुछ खो सकता है जो आपके पास वास्तव में कभी नहीं था <<-मुझे लगता है कि आप यू
0,आप भी उपयोगकर्ता! अपनी स्वतंत्रता का आनंद लें !!! काश मुझे पढ़ाई नहीं करनी पड़े।
1,"उपयोगकर्ता आज बहुत कुछ सुन रहा है, नए गीत से लेकर मेरे पास वापस आ गया है, मेरे मूड, मेरे जीवन को कैप्चर करता है! धन्यवाद"
1,भव्य सेडोना में इस पिछले सप्ताहांत में बहुत अच्छा!
0,बस एक पंक्ति में 2 एससीवी सप्ताहांत समाप्त हो गया ... और बुल्स गेम को याद करने के लिए केवल यह पता लगाने के लिए कि वे बुरी तरह से हार गए
1,एक सेब और चेरी खाना। Sooooo अच्छा !!
1,उपयोगकर्ता आपको गोधूलि देखना चाहिए। लुल्ज़ के लिए।
1,मुझे खुशी है कि मैं अपने चचेरे भाई के घर पर सो गया!
0,"3rd पर उपयोगकर्ता को प्रत्येक पुरस्कृत करें, जिनमें से प्रत्येक थोड़ी देर के लिए काम करता है, लेकिन फिर वह दुर्भाग्य से फिर से शुरू होता है। बहुत दुखी चैप"
0,मुझे नहीं लगता कि मुझे 9-5 के लिए काट दिया गया था ... मुझे किसी की घर की पत्नी बनने की जरूरत है और अतिरिक्त नकदी के लिए कुछ गतिविधियाँ हैं
0,"उपयोगकर्ता आप बहुत भाग्यशाली हैं! मेरे पति ने कभी भी व्यंजन नहीं किया, मैन्युअल रूप से या डिशवॉशर का उपयोग किया। एक बार नहीं।"
0,अभी भी मेरे पास उस बुखार के साथ अच्छा नहीं लग रहा है
0,उपयोगकर्ता मुझे न तो मेरी पहली बार था! लेकिन मुझे प्यार है जब पीप मेरा नाम जोड़ता है। मुझे अभी भी कोई अनुयायी नहीं मिला है
0,Aiyaah 70smt शब्द wtf
0,उघ ब्रेक लगभग खत्म हो गया है
0,जल्द ही अच्छी तरह से उपयोगकर्ता प्राप्त करें
1,"उपयोगकर्ता ooooh प्रेमी, मैं आपको कवर करूँगा।"
1,उपयोगकर्ता फिल्म का आनंद लेते हैं।
1,फिल्में !!! कुछ पॉपकॉर्न (यम) पर कुतरना
0,यह बारिश कोई मजेदार नहीं है
1,"उपयोगकर्ता धन्यवाद आदमी, वास्तव में"
0,उपयोगकर्ता अरे मेरे देश को भंग नहीं कर रहा हूँ !!!  jkjk नाइटनाइट
1,"उपयोगकर्ता कोई आश्चर्य नहीं कि जब मैं आपको बुला रहा था, तो क्या एक पार्टी जानवर!"
1,उपयोगकर्ता ... पूरी तरह से बहुत बड़ा!
1,क्या किसी को अपनी पोस्ट पर ठोकर की जरूरत है? मैं 1 3 को ठोकर मारूंगा। उत्तर दें या मुझे डीएम करें।
0,हेड आआआचे।
0,उपयोगकर्ता मुझे लगता है कि हम इसे प्राप्त नहीं कर सकते हैं हालांकि .... दुर्भाग्य से
0,अंग्रेजी खेल का समर्थन करने की कोशिश करने वाले उपयोगकर्ता उपयोगकर्ता वर्ष आपको इस तरह से बनाता है
0,घर पर बैठे। मेरे लड़के की याद आ रही है
