0,मुझे लगता है कि सोफे पर लेटने और एनसीआईएस देखने का समय आ गया है! मुझे लगता है कि मेरे लिए सुबह जल्दी उठना - आज काम करने के बाद बर्बाद हो जाना। सप्ताहांत कहाँ गया?
0,कहते हैं हू वहां व्यस्त नहीं है?  http://plurk.com/p/svwwt
0,अब मैं अपनी बायीं कलाई के साथ कुछ नहीं कर सकता
0,"स्टीफन फ्राई ने अभी मुझे संदेश भेजा। स्टीफ़न फ्राई टू, नॉन स्टीफ़न फ्राई...."
0,"पैकिन सफल नहीं है. मैंने अभी तक शुरुआत भी नहीं की है, मेरे पास एक सप्ताह है। मुझे हे फीवर है, कष्टदायक है GRRRRR! और मैं कुछ भी नहीं कह सकता क्योंकि मेरे पास ओवा खुराक है"
0,भाड़ में जाओ मेरा बैंक बैलेंस उपलब्ध नहीं है
0,@TMJP मैं मंदबुद्धि नहीं हूं
0,अच्छी खबर - माताओं को सवैतनिक मातृत्व अवकाश मिलेगा। हमारे लिए बुरी खबर - 2011 तक शुरू नहीं होगी
0,"स्टीफन फ्राई ने अभी मुझे संदेश भेजा। स्टीफ़न फ्राई से, गैर स्टीफ़न फ्राई.... वह असली नहीं है!!!!"
0,"बीमार, बीमार, मैं बहुत लंबे समय से बिस्तर पर हूं"
0,आज रविवार कैसा है? मुझे एक क्रीम पाई भी नहीं मिली
0,मेरा मतलब आज है
0,अंग्रेजी वार्ता की तैयारी
0,मैं ईबे नो फेयर पर डक ड्रेस के लिए अंत तक सोया। *खरीदार का पता लगाया और पोशाक चुरा ली* हाहाहा
0,"ठीक है, मेरा पड़ोसी ज़ी जर्मन सिनेमा अनुभव की मेरी सराहना साझा कर रहा है। सबवूफर, आप सबसे कमजोर कड़ी हैं। अलविदा"
0,सर्दी से पीड़ित बिस्तर पर है
0,एक मिनट में जाकर माता-पिता की कार चुरानी होगी। काश मैं अभी भी अपना काम चला पाता
0,विकासात्मक संशोधन Boooooooo!
0,@MariahCarey मेरे नाखून भी ख़राब हैं। यह या तो पढ़ाई है या नेल पेंटिंग...पढ़ना जीतना है x x x
0,"डाकघर आश्चर्यचकित है कि उनका व्यवसाय कम क्यों है; पोस्ट बारंबार-मेल भेजने वाले के रूप में, उनकी कीमतें अब वहनीय नहीं हैं। अब इनका प्रयोग कम ही करते हैं।"
0,मेरी बेरी गिरा दी. अब बगल में भद्दी खरोंचें हैं
0,"@philippawarr आपका समय अद्भुत रहे। क्षमा करें, मैं वहां नहीं पहुंच सकता, कृपया मेरे लिए टैपर्स को नमस्ते कहें xXx"
0,"मैं सोच रहा हूं कि हाउस ऑफ नाइट कुछ नया लेकर आएगा या नहीं, मैं बेताब हूं!!!!!"
0,मैं अब यह एनआईएन संगीत नहीं सुन सकता।  अगर मैं अपनी कल्पनाएँ नहीं कर सकता तो इसका मेरे लिए कोई मतलब नहीं है
0,"सप्ताहांत कभी भी इतना लंबा नहीं होता, कल से काम पर वापस आना! मैं कुछ अध्ययन करने के बारे में सोच रहा हूं, बस सवाल यह है कि क्या पढ़ा जाए।"
0,गह. सभी लोग पहले ही सो चुके हैं और बात करने के लिए कोई नहीं है
0,@क्लैफामपीएच मैं इस सप्ताह की सूची में कोरलीन को नहीं देख सकता। क्या आप इसे दिखाने की योजना बना रहे हैं? मुझे स्ट्रीथम ओडियन में मत जाने दो
0,दोहराव
0,@the_4th_floor अपने सभी वीडियो केवल यूके निवास पर बनाना थोड़ा अनुचित है..
0,मेरी बूओय्य याद आ रही है.. तुम कहाँ हो?
0,"@Maggie_too नहीं, मैं घर का सपना देख रहा हूँ... चाहे नरक हो या ऊँचा पानी, मैं वहाँ पहुँच जाऊँगा!"
0,"@हर्मेनिल आपको मुझे फिर से फॉलो करना चाहिए, क्योंकि मुझे आपकी प्रोफ़ाइल नहीं मिल रही है इसलिए मैं आपको फॉलो करना शुरू नहीं कर सकता"
0,"आशा है कि www घर पर व्यवहार कर रहा है, सुबह में खूनी वोडाफोन को फोन करना होगा और इसे हल करना होगा > बट में दर्द >"
0,कुछ नहीं
0,"किसी को अभी मेरी पूरी मालिश करनी चाहिए, मेरी पीठ में अब बहुत दर्द हो रहा है, मैं चाहता हूं कि दिन में कभी मेरी पीठ पर चोट न लगे, हाहाहा"
0,"@ग्राहमबीएम काश मैं इसे डिजिटल सुरक्षा तक पहुंचा पाता, लेकिन मैं न्यूकैसल में फंस जाऊंगा क्या स्लाइड/वीडियो कहीं लगाए जाएंगे?"
0,आज सचमुच कष्ट हो रहा है
0,"@TaliyAllTimeLow मुझे पता है जल्द ही बात करेंगे, ठीक है? वादा करनेवाला"
0,"@irasapsup वास्तव में यह ऑस्ट्रेलियाई डॉलर काक है, लेकिन फिर भी........."
0,Twp के लिए कुछ पिल्सेन स्ट्रीट आर्ट की शूटिंग। अभी जल्दी है...
0,अर्घ. यहाँ फिर से बारिश हो रही है
0,"यह सचमुच ऐसा है जैसे मेरा एक हिस्सा मर गया है, क्योंकि मैं अब यह संगीत नहीं सुन सकता।  मुझे सच में रोने का मन हो रहा है"
0,"पिटलेनफैनेटिक बंद है.. सर्वर होस्ट के साथ इसकी जांच की जा रही है, आशा है कि यह दौड़ के लिए समय पर वापस आ जाएगा"
0,"मेरे लैपटॉप से ​​अभी 2 चाबियाँ गिर गईं, अलविदा? / और "" '"
0,मेरा पोप अभी मर गया
0,@मुझे भी याद है. *धूप वाले* सप्ताहांत में करना बिल्कुल भी सर्वोत्तम चीज़ नहीं है। (धूप = मानो।)
0,"टिकट नहीं मिलने के कारण रेडियो 1 सुन रहा हूँ और मैं स्विंडन में रहता हूँ (निराश)।  हालाँकि, ने-यो और एन-डब्ज़ सुनने के लिए उत्साहित हूँ।"
0,बस अभी घर पहुँचा। दुःख की बात है कि तुम एक गधे हो.
0,होंडा जैज़ तुमने मुझे क्यों छोड़ दिया?!
0,"सुबह लगभग 6 बजे उठा क्योंकि मेरी शक्तिशाली गलीचे के कारण मेरी कोहनी जल गई, चादरें बहुत ज्यादा खरोंचने लगीं, क्या बेकार रात थी... - http://bkite.com/07kBj"
0,रस्सी के गलत पहचाने गए टुकड़े के कारण पिछले 6 घंटे *अत्यधिक आतंक* की स्थिति में बिताए हैं
0,पार्क में है लेकिन बत्तखों और हंसों के लिए रोटी नहीं है
0,"मैं अपनी माँ को खरीदारी के लिए ची ले जाने वाला हूँ, इसमें अधिक समय नहीं लग सकता, फिर से विचार करना होगा!!!"
0,पता चला कि मेरा गला और पेट लगातार 2 रातें कराओके बर्दाश्त नहीं कर सकता...
0,@jlstruck मैं भी जानता हूं कि जब उनका ब्रेकअप हुआ तो मैं बहुत दुखी था
0,"मुझे लगता है कि सीवी पुरुष रोमांचक नहीं होते हैं।  मैं झूठ नहीं बोल सकता: एसडी पुरुष, एलए पुरुष और एसएफ पुरुष आसपास रहने के कारण कहीं अधिक गर्म और ठंडे होते हैं।"
0,कृपया मेरे साथ बातचीत करना बंद करें
0,केवल 4 घंटे की नींद ली थी और अब मुझे एक घंटे में बाहर जाने के लिए तैयार रहना होगा... लेकिन ऐसा नहीं हो रहा है क्योंकि मैं एक ज़ोंबी की तरह दिखता और महसूस करता हूं
0,इस बात से निराश हूं कि मैं मदर्स डे पर सो नहीं पा रहा हूं
0,"@elfizz ओह नहीं, मुझे बस तुम्हारी याद आई।  मुझे अपने माइक की याद आती है. मेरे पास वापस आओ, प्रिये।"
0,"हे भगवान, इतनी सारी बातों के साथ नींद नहीं आ रही! और कल सुबह 730 बजे काम करूंगा..मैं बहुत सोना चाहता हूं..मैं सोना चाहता हूं"
0,मुझे विश्वास नहीं हो रहा कि मैं रविवार को रिहर्सल कर रहा हूं। ये हताश समय है. मैं अपने बिस्तर पर हार्वेस्ट मून खेलना चाहता हूं
0,रास्ता 2 जल्दी 2 काम पर लग जाओ
0,"डेक्लान पर प्रतीक्षा कर रहा है, शायद भाग्यशाली बगगर सो रहा है। पढ़ने के लिए पुस्तकालय, फिर घर पर अधिक अध्ययन करें। सामाजिक जीवन आप कहां हैं?"
0,"जैसे-जैसे आपकी उम्र बढ़ती है, देर तक बाहर रहना कठिन हो जाता है.. हैंड स्टैंड करते हुए ऐसे ही बाहर जाने में सक्षम होता था.."
0,मैं अपने बालों को सादे काले शर्ट स्कूल यू_यू में रंगने जा रहा हूँ
0,@naataalieee मुझे लगता है क्योंकि मैंने बहुत देर से पूछा। ज़ोर-ज़ोर से हंसना। जैसे आपने फेयर के साथ किया. और फिर हमारे बीच बहस हुई. माँ मुझे जाने देती
0,सूरज तेज़ और चमकदार होकर वापस आ गया है
0,"सुप्रभात, बस!........... अधिक गणित संशोधन (एन) पर भूमिका ... जीवन कठिन xxx"
0,"मैं काम से छूटने का इंतजार कर रहा हूं ताकि मैं बिस्तर पर जा सकूं, 3 बजे काम पर वापस आना होगा"
0,@anz_rocks आप हमेशा जीतते हैं
0,जेन्सन बटन को 10 अंक लेते हुए और आज फिर से एक और जीतते हुए देखना अच्छा लगेगा - हालाँकि एक फुटबॉल मैच के कारण मुझे इसकी कमी खलेगी
0,जिम से वापस आ गया हूँ और अब 2 सप्ताह में अपने पैर और दौड़ को लेकर बहुत चिंतित हूँ
0,मैं वास्तव में ला सैले जाना चाहता हूं लेकिन मेरे पिताजी का कहना है कि मुझे किसी इंजीनियरिंग स्कूल में पढ़ना चाहिए।
0,मैं नाराज हूं... मैंने एम-इंजीनियरिंग कार्यक्रम में दाखिला लेने का मौका खो दिया..
0,@neo_ Indian + मैंने इसे जिम में देखा है और टीवी लगे स्टेशनों पर वर्कआउट करने से बचता था। उन्होंने मुझे सिरदर्द दे दिया
0,"हे भगवान, मेरी जिंदगी को धिक्कार है, मैं कितना मूर्ख हूं!"
0,हिट वर्जिन्स के लिए 15 जीबी कैप स्पीड सीमा लागू की गई। अधिकतम 280kb/s
0,मुझे एक बॉयफ्रेंड चाहिए!!
0,आज एक और क्रिकेट खेल है....और आज यह 91 डिग्री होने वाला है....अरे!
0,"@shyobaba मुझे नहीं पता यार, मैंने जाँच नहीं की है लेकिन पिछली बार जब मैं वहाँ था तो वहाँ नहीं था"
0,अभी किंग्सगेट से वापस आया हूँ। 1 पर काम करें
0,जब भी मैं बाहर जाने के बारे में सोचता हूं तो फिर से बादल छा जाते हैं। क्या मैं अपने दिन का त्याग करने जा रहा हूँ ताकि हर किसी को धूप मिल सके?
0,सोचो बीबीक्यू ने मेरा पेट नष्ट कर दिया है। वास्तव में ऐसा महसूस हो रहा है जैसे मैं मर रहा हूँ
0,मैक पर काम करते-करते अब बहुत थक गया हूँ।
0,शीर्ष 20 गाने जो आपको रुला देंगे http://tinyurl.com/pzyflg - क्या आप इनसे सहमत हैं? :o
0,अभी किंग्सगेट से वापस आया हूँ। साढ़े 12 बजे काम करें
0,"मुझे नींद नहीं आ रही, मैं कुछ टीवी देखना चाहता हूं। मैं ऊपर रह सकता हूँ."
0,आज सचमुच कुछ करना चाहता हूँ...एक और दिन बर्बाद नहीं करना चाहता
0,"आज बहुत बीमार महसूस हो रहा है, मतली अब तक की सबसे बुरी स्थिति है। और यह बहुत ज्यादा ठंडा है"
0,"अजीब अंगमोह और मैं अभी-अभी अलग हुए हैं। अछा नहीं लगता। अगले सप्ताहांत तक इंतजार करना होगा कि वह गरीब लड़का शिविर में है, ठीक है सोमवार"
0,@ काम
0,बच्चा 1 1/2 घंटे पहले उठा लेकिन उसने मुझे एक सुंदर हार दिया इसलिए यह ठीक है
0,@madeleineannie क्या वह मज़ाक कर रही है हाहा। पी.एस. गुरुवार से शुक्रवार तक सोना? या सूरज तक बैठे रहे? ध्यान रखें मुझे शुक्रवार सुबह काम करना है
0,"@renee_66 मुझे कुछ भी नहीं मिला, मैंने अपना इंटीरियर डिजाइनर 479012652 बार बदला है, हाहा मुझे इस असाइनमेंट से नफरत है"
0,"@aneD ओह, मुझे यह सुनकर बहुत दुख हुआ। उसे तुरंत एक संदेश भेजेंगे. बेकार चीज"
0,"@MzJacqueline मुझे पता है कि मुझे उसके टेक्स्ट संदेशों को अनदेखा करना शुरू करना होगा, मुझे यकीन है कि देर-सबेर उसे संकेत मिल जाएगा। तुमसे प्यार है। मातृ दिवस की शुभकामना"
0,ओह प्रिय ऐसा लग रहा है जैसे मुझे ठंड लग रही है
0,"जब मैं बीमार होता हूं तो मुझे सबसे बुरे सपने आते हैं... मैं अपने ही बिस्तर पर बमबारी का शिकार हुआ, कुचला गया और खूब हंसा।"
0,"@torilovesbradie आउच, मैं भी उन्हें समझता हूँ"
0,"@थेरामी क्या आप गंभीर हैं हे भगवान, मैं बहुत दोषी महसूस कर रहा हूं"
0,टीवी देख रहा हूँ और मैं ऊब गया हूँ
0,"@शीक्विन मैं भी उत्तेजित नहीं हो रहा हूं, रुड बहुत चिढ़ाने वाला है।"
0,एमएएच केस स्टडी पर फिर से काम कर रहा हूं..
0,और फिर से काम पर निकल पड़े...
0,मुझे भूख लगी है और मेरा फ्रिज खाली है
0,"पालतू जानवर को बैठाने के निर्देश पूरे कर लिए... अब, आखिरकार, सोने का समय हो गया है। मुझे नहीं लगता कि मैंने रात का खाना खाया"
0,"वही वही, लेकिन अलग (लेसल) देखने के लिए कुछ भी नहीं, मेरे आर्थिक कागजात में सिर्फ शब्द हैं"
0,"शुभ प्रभात!! मातृ दिवस की शुभकामना। काम पर जा रही हूँ माँ को आज काम नहीं करना चाहिए!! ख़ास तौर पर सुबह 5:20 बजे तो नहीं, हाहाहा"
0,नोट्रे डेम के कुबड़े से क्वासिमोडो जैसा दिखता है
0,@मारोडी मैं नहीं जानता। मैं मैरिकेन के साथ होने के बारे में सोचे बिना अब ट्रेंट की बात नहीं सुन सकता। यह मुझे विमुख कर देता है
0,"@1स्वीटव्हर्ल आप भी प्रिये। धन्यवाद, हालाँकि मेरा दिन फूलों को छोड़कर किसी भी अन्य दिन की तरह है"
0,@squareville अच्छा होना चाहिए... जाहिरा तौर पर हमारी वॉशिंग मशीन टूट गई
0,@amalinaaa अरे यह बेकार है।  xx
0,"@mynameislee हाँ, मेरा टोरेंट ऐप लॉक और लोड हो गया है। दूसरे नोट पर, टीजी यूएसए को डिब्बाबंद कर दिया गया है"
0,@hannaheastwood हाँ यह शर्म की बात है... मैं आपका पीछा नहीं कर सकता
0,मेरी परीक्षा के कारण मेरी बहन की शादी में न जाना *दुखद* *दुखद*
0,रीज़ का पीनट बटर कप चाहता है!  क्या मैंने इसे सही ढंग से लिखा है? वह-वह
0,विज्ञान होमवर्क!
0,"@गैब्रिएलाला अद्भुत एक्शन फिल्म और अभिनेता: लेकिन वैकल्पिक वास्तविकता बीएस के बारे में निराश हूं। कोई और वल्कन नहीं, 2 स्पॉक.... भ्रमित"
0,अपनी बहनों के बीएफ को मास्टर शेफ के बजाय आरई5 भाड़े के सैनिक मोड में बार-बार मरते हुए देखना उतना अच्छा नहीं है
0,"पहले एचडी पर हार्ड ड्राइव की विफलता, आर्गोस की यात्रा का समय..."
0,@जैकीलिन शुक्रवार की रात पसंद का जहर है: टकीला। फिर रात और भी बदतर हो गई। हालाँकि अब सब ठीक है
0,@Kit_Kat1990 मैं बहुत परेशान हूं क्योंकि मैं इसे फिर से चलाना चाहता था लेकिन इसे चलाने का कोई विकल्प नहीं था क्योंकि evry1 बहुत आलसी था! या देश में नहीं
0,डब्ल्यूटीएफ? अब मुझे कुछ नहीं करना है
0,"मैं थक गया हूँ, कल वैसा नहीं था जैसा मैंने एनिमेटेड किया था! मैं तुमसे प्यार करता हूं ?"
