0,"@TiaSparkles अंत देखना दर्दनाक था। अपने आप को कंप्यूटर से अलग कर लिया और अपने मस्तिष्क को रिबूट कर दिया, लेकिन अंत में आपको सूर्य से होने वाला सिरदर्द हो गया?"
0,@ब्रेग्रांट पर्थ ऑस्ट्रेलिया में अभी यही हो रहा है
0,@terawages शायद यह जमीनी स्तर है? मैंने निर्देशों वाला संदेश खो दिया है और संभवतः आपको एक नए बुटीक की झूठी आशा दे दी है
0,@ईनाननान मैं सही जानता हूँ।  एफएमएल.
0,आज मेरी कार धूम मचा रही थी!!!! इसे बेचने या ठीक करने का समय आ गया है: /
0,"@JoJoWright ओह बू। जब भी वह दोबारा केआईआईएस स्टूडियो में आएं, तो आपको कुछ बताना होगा, क्योंकि मैं वहां हूं। बुह-ली डेट."
0,अभी भी ऊपर है 2. मैं अपनी टोपी नीचे रखने वाला हूँ। यह मातृ दिवस है और मेरी मां का कोई पता नहीं है >> वह घर पर खाना पका रही है.. मैं बहुत दूर हूं। लव
0,"@alessandrita यार!  जब मैं एक घंटे पहले अपने सुशी स्थान से गुजरा तो मैं सुशी के लिए उत्सुक था, लेकिन वे रात के लिए बंद हो गए!"
0,सोफे पर बैठकर रेडबुल पी रहा है और मैनली को फुटबॉल खेलते हुए देख रहा है
0,"वहाँ एक ब्लैकआउट है [&] मेरा फोनज़ डाइनक, मुझे डर लग रहा है"
0,क्या उन्होंने हमेशा आग का नाम दिया है?  ऐसा लगता है कि कैलिफ़ोर्निया में आग इन दिनों एक नियमित घटना बनने लगी है
0,@uberGruber मैं ऐसा चाहता था! मैं गोमांस स्टू के साथ समाप्त हुआ
0,मैं सोने जा रहा हूँ। कल उठना है और काम करना है
0,लेकिन 100twt बहुत धीमा है: http://ff.im/2KZ0d
0,@thesouth उसने पूरी तरह से किया! जब मैं वहां था तो कम से कम मैंने क्या देखा
0,@fashion_nugget ने R के सवालों का जवाब देने की भी जहमत नहीं उठाई
0,ठंडा है!  xx
0,"@VoVat मैं हर सात मिनट में उत्तेजित हो जाता हूँ, इसलिए मुझे लगता है कि स्पॉक और मेरी जोड़ी ख़राब है"
0,@RICHLYFE_TEV मेरे बिना शनिवार कैसा था
0,"मैं ऐसा नहीं कर सकता कि माँ यह कहे कि अगर मैं अपना कमरा साफ नहीं करता हूँ तो मुझे परेशानी होगी, वह मतलबी है। यह मातृ दिवस है और वह कहती है कि वह हर चीज की रानी है"
0,बगेर.. 8 मिनट तक ट्वीट प्राप्त नहीं कर सकते
0,"रविवार पहले से ही है इसका मतलब है कि मुझे कल काम करना है, सप्ताहांत कहाँ गया?"
0,क्या रात थी। मैंने आज रात जमकर पार्टी की। मैं अंततः शांत होना शुरू कर रहा हूं। अब मुझे लगता है कि हम पार्किंग डेक में फंसे हुए हैं।
0,http://twitpic.com/4wnpn - सभी क्रोधित हो गये
0,मैं काले बाल चाहता हूँ
0,@unitechy नहीं रे.. बीएसएनएल कार्यालय में 2 दिन की छुट्टी थी.. अभी तक आवेदन जमा नहीं हो सका..
0,लेकिन अभी के लिए... दूध गर्म करने के एक दिन के लिए तैयार हो रही हूँ। वाह!
0,@livlifequeensiz आप भाग्यशाली हैं कि मुझे इनमें से कुछ भी कभी नहीं मिला! हमेशा हमेशा के लिए!
0,"@deeonthegreat ओह, मैंने रीमिक्स नहीं सुना.. मुझे वह गाना गाना पसंद है, यह मुझे कभी-कभी रुला देता है, हाहाहा"
0,"@ हेडनविलियम्स नहीं, मुझे इसकी परवाह नहीं है, मुझे यह पसंद नहीं है कि वह बौसी है"
0,@SONofWRONG मुझे हमारी पार्टी के समय की याद आती है
0,@rklarsson अंग्रेजी. हमने एनिमल हाउस देखना समाप्त कर दिया। पहले कुछ सेकंड मेरे लिए काफी डरावने थे। मैं बहुत बड़ा बेवकूफ हूं
0,"@sshuylerfisk काश मैं वहां होता, लियोनिदास नमस्ते कहते हैं।"
0,रविवार को वैसा महसूस नहीं होता जब मैं फुटबॉल देखने नहीं जा पाता
0,मैं 2 घंटे तक गहरी नींद में सोता रहा।< मेरे पास अभी भी बहुत सारा काम है
0,मेरे बैंग्स मुझे परेशान करते हैं
0,मैंने अपनी कॉलर बोन के नीचे की मांसपेशी खींच ली
0,@alyandajfanatic आह मुझे यकीन है!!! काश मैं वहां होता तो खुशी होती कि तुम्हें मजा आया!! क्या आप उससे मिले??
0,"@प्रोड्यूसरजैकोब हाय जैकब। प्राग में 'द बिग वीकेंड' में जाने में सक्षम होना आपके लिए अच्छा है, मैं सुन सकता हूं लेकिन आईप्लेयर नहीं मिल सकता, आनंद लें! प्रोत्साहित करना!"
0,"जेफ, मेरा फ़ोन मुझे आपको सीधा संदेश लिखने नहीं देगा! लेकिन मुझे भी आपकी बहुत याद आती है"
0,आपमें दिलचस्पी ख़त्म हो रही है लेकिन आप अब भी मेरे दिल में हैं
0,उम्मीद है कि पूरे कोर्ट को बाद में सा बबॉल बनाएं... बकित पा कासी लैगिंग संडे और मदर्स डे ई http://plurk.com/p/sv1f7
0,मैं आज आधिकारिक तौर पर वास्तव में नापसंद की जांच करूंगा।  .
0,@fallenstar_ hannananana यह काम नहीं कर रहा है
0,चर्च जा रहा हूँ... ऐनी उपदेश नहीं दे रही है लेकिन मुझे एक अच्छे समय की आशा करने के लिए कहा गया है।  मेरा सर्वोत्तम व्यवहार अपनाने का समय! ;)
0,"होमवर्क का तनाव, सर्जरी का तनाव, परीक्षा का तनाव... मैं मरने वाला हूँ!"
0,मैं वास्तव में सिर्फ स्किन्स देखना चाहता हूं... इसे लोड होने में बहुत समय लगता है
0,ओह आदमी!! मेरे सिर में दर्द होता है
0,@truXhalo nvm आप ttml कर सकते हैं। इम्मा सो जाओ. ily&tytm. शुभ रात्रि BF[f]। $$. अगर तुम्हें किसी चीज़ की ज़रूरत हो तो तुम मुझे कॉल कर सकते हो.
0,थोड़ी देर में बेकार चीनी ट्यूशन के लिए जा रहा हूँ.. ब्‍लेह
0,"मुझे बहुत अध्ययन की ज़रूरत है, कल 2 परीक्षण: संगीत और भौतिकी में, ओह, और कला का होमवर्क भी! हम्म... मुझे लगता है, कि मैं ऑप्टिकल इल्यूजन बना लूंगा!"
0,"@एनाविल ड्रामज़्ज़ ब्लाह। रूबी ट्यूज़डेज़, चेड्डर में उतना पैक नहीं था, नहीं तो हम वहां चले गए होते। हालाँकि, मुझे अपनी भतीजी पर प्यार आया!"
0,कल रात का शो बहुत अच्छा था! सर्वोत्तम प्रदर्शन! बहुत दुख की बात है कि यह ख़त्म हो गया
0,नादिया के बारे में चिंतित हूं
0,मुझे एपी पत्रिका भी चाहिए!
0,@lisathomas84 यहाँ भी मौसम बहुत गर्म है
0,संघर्ष कर रहा हूँ...लोगों को अपना सर्वेक्षण करने के लिए प्रेरित करने का प्रयास कर रहा हूँ
0,"@kaysmalls वाह उन्होंने उत्तर दिया! और आपने आईडी को किस लिंक के बारे में बताया था? और नहीं, मुझे हार्पर्स द्वीप की याद आई"
0,बहुत थक गया हूं।
0,बहुत थक गया! और मैं अपना तकिया भूल गया. दुखद दिन!  @ पैरागॉन डायनेमिक्स http://loopt.us/D-j5_Q.t
0,मेरा आईटच काम नहीं कर रहा है यह एक मिनट पहले ठीक काम कर रहा था..
0,बीएमटीएच देखना चाहता था लेकिन नहीं देख सका
0,दोपहर का खाना ख़त्म हो गया.. उह. मैं सचमुच इसे नहीं देख सकता! हम अभी घर नहीं जा रहे हैं
0,आपके बारे में न सोचना जितना मैंने सोचा था उससे कहीं अधिक कठिन है।
0,मुझे नाडा के साथ देर तक जागने से नफरत है। मैं घबरा गया हूं और मुझे सो जाना चाहिए लेकिन मुझे नहीं लगता कि मुझे और अधिक प्रयास करना पड़ेगा।
0,मुझे उसी समय एहसास हुआ जब मैंने अपने वाहक कबूतरों की कमर टूटने की आवाज सुनी कि यह काम नहीं करेगा। अब मुझे दुकान तक चलना होगा
0,@मिकीफ़िन हाय मिकी! इनमें से कोई नहीं. बुखार।
0,@wittertainment कृपया अपने पॉडकास्ट श्रोताओं को बताएं कि बीब की साइट पर वोडकास्ट आदि यूके के बाहर के लोगों के लिए प्रतिबंधित हैं।
0,@dirkjohnson मैं निश्चित रूप से उसे ले सकता/सकती हूं लेकिन मुझे यकीन नहीं है कि उसे छोड़ दिया जाएगा। बहुत बड़ी बिल्ली. लेकिन मेरी खिड़की पर उस खोए हुए तरीके से रोना
0,मुझे सुबह 6 बजे तक लोगान पहुँचना है। यहां होटल में सुपर डुपर नाश्ता 6:30 बजे शुरू होता है। बेकार!!
0,@jpdabest मुझे वे दिन याद हैं। लेकिन मुझे नौकरी छोड़नी होगी क्योंकि मैं जॉब कॉर्प में जाऊंगा
0,आपके लिए सर्वोत्तम सामग्री लाने के प्रयास में हमने द डिजिटल रैप्चर की रिलीज़ के 30 घंटे पहले लीज पर जोड़ा है।  जल्द ही... मजबूती से रुको
0,"@SngForgiven और हां, 2002..खैर, 2001 का अंत। यह मेरा 13वां जन्मदिन था और मैं अत्यधिक व्याकुल था कि डेटा की मृत्यु हो गई, अब तक का सबसे खराब जन्मदिन LOL"
0,तो एली चिल्लाती है हैप्पी मदर्स डे! फिर बेनी को गले लगाया! उह.
0,"हमें यह सब बकवास, बकवास चीजें क्यों पढ़नी है जहां कुछ भी व्यावहारिक नहीं है, बस रटना और रटना है"
0,"यूनी वर्क करना, ओह्ह आनंद"
0,@केंद्रजादेरोसी आह मैं चाहता हूँ! बस उस काम से बाहर निकल रहे हैं जहाँ आप गेंदबाजी कर रहे हैं?
0,"@ThatDeniseShow हाँ, मैं यह नहीं कह सकता कि मुझे यह पसंद आया। मुझे डबल वाइड जाना चाहिए था।"
0,सच में बहुत परेशान हूं. स्टार ट्रेक की प्रेस स्क्रीनिंग देखनी थी लेकिन ऐसा नहीं हुआ। सोचो यह मेरी डीएसएल एक्सट्रीम गड़बड़ी में खो गया है।
0,वास्तव में अब सोने का समय....इस समय मुझे अपने जीवन से सचमुच नफरत है प्रिय प्रोम....भाड़ में जाओ। लव-लौरा अलोनएंडडेटलेस लास्को
0,दुर्भाग्य से यहाँ मेरी आखिरी रात नहीं है
0,@dee011902 मेरा दिल बहुत टूट गया है!!!  वैसे मैं घर पर हूँ...मुझे अभी आपका संदेश मिला!!
0,मुझे ट्रॉमा शोज़ पसंद हैं. काश मैं ट्रॉमा सर्जन बनने के लिए मेडिकल स्कूल में होता
0,मुझे लगता है कि @ciaobellame15 को शराब पीने की समस्या है
0,स्काइप काम नहीं कर रहा है और मैं अपनी माँ से बात नहीं कर पा रहा हूँ
0,@sodamnquirky क्या आप मेरे साथ ऐसा करेंगे? ?
0,@JuiicyKisz86 http://twitpic.com/4cjq2 - मैं पिछले साल वहां दूसरी बार जा रहा था...वहां नौकरी मिल गई लेकिन मुझे न्यूयॉर्क जाने की कोई इच्छा नहीं थी इसलिए मैं यहीं रुक गया!
0,"@wproof @Sanji @pem @myriam यहाँ धूप वाला मौसम है, जो टिकेगा नहीं"
0,@amanduh_pauge ओह हाँ हैप्पी मदर्स डे। मैंने अपनी माँ को नमस्कार नहीं किया.
0,बकवास! मैं क्रिस क्रोस हूं - मैं बस शिज्ट अरिवा से चूक गया!! मेरे रास्ते में 2 माह जे ओ बी. ज़ो गीन ज़िन!!!
0,@TC_Chavez : बमर
0,मुझे लगता है कि मैं आज रात किसी को माँ नहीं बना पाऊँगी।
0,"उदास सूरज पर बैठने के लिए रवाना। सुबह उठने के बाद मैंने पाया कि मेरे कमरे में पानी बंद है, न शॉवर, न ही ब्रश किया, यह क्या तरीका है शुरुआत करने का।"
0,ठीक है.. यह बेवकूफी है.. प्रीति जिंटा के नाम को छोड़कर फिल्म बिल्कुल भी अच्छी नहीं है
0,@थारायिल लिनक्स संस्करण अच्छा दिखता है। एकमात्र समस्या यह है कि क्रोमियम का प्रत्येक अपडेट हर बार 450 एमबी से अधिक का होता है
0,अध्ययन कर रहा है गणित जोड़ें! GARRRGHHH
0,बोसार्ड 10 में डेव वेंटवर्थ द्वारा स्टोनकिंग राइड। 24:37 एक तेज़ हवा वाले दिन पर धीमी गति से। उसके करीब पहुंचने के लिए और ट्रेनिंग करनी होगी.'
0,आज कमज़ोरी महसूस हो रही है http://plurk.com/p/sv282
0,"अर्घ, मेरी माँ को नहीं बताया जाएगा।  जब भी वह देर से समुद्री भोजन खाती है तो वह बीमार हो जाती है, तो वह दोपहर के भोजन में क्या खाएगी?"
0,"रास्ते में* ... आह, मुझे अभी एसएनएल में जस्टिन टिम्बरलेक की याद आ रही है"
0,शनिवार और मेरे घर में
0,नया.. .. लेकिन सारा एक एल्बम बनायेंगी! मुझे यकीन है!
0,@adrianasphyxia ने आकर मुझसे मुलाकात की। मैं बस यही चाहता हूं कि उसे घर न जाना पड़े
0,मैंने रात का खाना नहीं खाया. मैं भी परेशान हूं क्योंकि ईबे की नीलामी में मेरी बोली छूट गई थी
0,सुबह 5.30 बजे से जाग रहा हूं
0,@adoran2 मुझे शतावरी बहुत पसंद है और हम हाल ही में खूब खा रहे हैं।  दुर्भाग्य से मेरे लिए कोई मतिभ्रम नहीं है।
0,"@volcanojoe दोस्त, मैं भी! यह भयानक है मुझे क्षमा करें, चचेरा भाई!!!!"
0,@नोरीनजूलियानो बाह्ह्ह मैं वीडियो नहीं देख सकता
0,अब तक की सबसे हास्यास्पद लंबी लाइन में प्रतीक्षा करते हुए मैंने फिली में 9 और पासायंक में पैट्स स्टेक्स देखी है। जिम ऑन साउथ बंद था।  #को ...
0,"मुझे ठंड लग रही है नार्को, संयुक्त राज्य अमेरिका एन 33ï¿½ 57' 0'' / डब्ल्यू 117ï¿½ 33' 0''"
0,मुझे घर की याद आ रही है *दांत खराब हो रहे हैं* मैं कल घर आने की कोशिश कर रहा हूं
0,"इस सप्ताह नेपलान मुझे मार डालेगा!! गणित का सारा होमवर्क कल है, मुझे मार डालो!!"
0,अत्यधिक गर्मी के कारण वाष्पित होकर यहां का तापमान केवल 42.1 डिग्री सेल्सियस है
0,"एलएमएओ। हम बहुत मतलबी हैं! उसकी तस्वीरों का उपयोग करना और विकृत संदेश भेजना। ओह, वे सभी सोचते हैं कि वह सुंदर है। इसे रफू करें।"
0,"मेरे द्वारा किए गए हर काम के बाद क्या हुआ, इसका कोई मतलब नहीं है"
0,@Suzyqbee10 आपने मुझे एक भी नहीं भेजा।
0,"आज मुझसे कहा गया कि मैं कुत्ते जैसा दिखता हूं, क्या कोई सहमत है?"
0,"यम, रात के खाने के लिए हिरन का मांस मेरा पसंदीदा, *खांसी खांसी*"
0,मैं पूरी तरह थक गया हूं...अभी शाम के 5.15 बजे हैं और सोने के लिए तैयार हूं
0,मैं हारे हुए लोगों से घिरा हुआ हूं। और वहाँ एक मधुमक्खी मुझे डरा रही है। यह बेकार है
0,मेरे पैर बेचैन महसूस करते हैं और मुझे अब सोने में परेशानी हो रही है
0,मैं कुछ हार्डकोर हिप हॉप के मूड में हूं लेकिन मेरे आईपॉड पर ऐसा कुछ भी नहीं है
0,केवल चार घंटे की नींद के बाद जागे
0,@Micc_x एक टेल्स्ट्रा है लेकिन मैं अभी भी 13 साल का होने तक इसका उपयोग करने में सक्षम नहीं हूं
0,अच्छा नहीं है...
0,मैं बहुत ऊब गया हूँ....इस उबाऊ शनिवार की रात को कोई भी मेरे साथ घूमना नहीं चाहता...
0,अभी-अभी पेपर राउंड हुआ और जैसे ही मेरा काम ख़त्म हुआ 8 बजे का अलार्म बज गया। भीग भी गए
0,भाड़ में जाओ मेरी बाँहें भयानक लग रही हैं। ऐसा लगता है जैसे वे मेरे शरीर से गिरने वाले हैं।
