0,"@mfhorne ओह, मुझे यकीन है कि यह सब बुरा नहीं है"
0,@victoriawren यह बहुत अच्छा नहीं है।
0,यह फ़िदो का हमारे साथ आखिरी दिन है
0,सभी स्थानों में से अर्ब्रोथ की ओर जा रहे हैं! मौसम भयावह
0,"<लैपटॉप इंटरनेट फिर से बंद, फोन इंटरनेट के लिए समझौता करना होगा"
0,"@betsuni हाँ, मुझे वक्र मिल गया! हालाँकि, इसे काम पर लाने के लिए मुझे ट्विटरबेरी का बीटा डाउनलोड करना पड़ा, लेकिन यह थोड़ा निराशाजनक था"
0,gtalk/AIM/Jabber के लिए एक बॉट लिखने के लिए उत्साहित हूं। पर्याप्त समय नहीं मिल पा रहा है
0,एयरपोर्ट जाने के लिए तैयार हो रहे हैं.  मैं मैड्रिड वापस नहीं आना चाहता
0,/मुझे बीच वॉली प्लेयर की आवश्यकता है। दुखी और क्रोधित होना.
0,"@bonnieroseleigh awww, मुझे खेद है कि आप ठीक होने के लिए काम कर रहे हैं"
0,"@मिसयेरिक्सन बमर मिस्सी!  मैं बमुश्किल उस आस-पास जाता हूँ, आशा करता हूँ कि सिर/कोहनी जल्द ही बेहतर महसूस करेंगे!"
0,मुझे पहले से ही *यहां नाम डालने* की याद आ रही है
0,@itsroxy आप नहीं कर सकते
0,दुनिया में सबसे बुरा एहसास तब होता है जब आपको एहसास होता है कि दो दिन में लिए गए फैसले गलत थे
0,"डांस रिहर्सल, मदर्स डे और फिर सब कुछ"
0,"मैं नशे में हूँ और अभी भी बिस्तर पर हूँ, बुरा समय! हालाँकि कल का दिन गुणवत्तापूर्ण था, मुझे यह सोचकर डर लगता है कि कितनी बीयर पी गई! मेरे सिर में दर्द होता है"
0,"आज रात बाहर है. जोनास को अभी यूट्यूब पर देखा, यह अभी तक यूके में क्यों नहीं आया है"
0,बस अभी उठा। मदर्स डे के लिए अपनी मौसी के पास जाने के लिए तैयार होना है और उंगली अभी भी मुझे मार रही है <3
0,अंत में यह काफी कठिन था। अब बैठ कर ख़ुशी हो रही है। अभी भी ऑफर पर कोई बियर नहीं है
0,"@फॉक्स, देवियो, जीवन में कभी-कभी आप चीजों को अत्यधिक जटिल बना देती हैं.. इस कथन पर दूसरे लिंग का अनुसरण करें ""बकवास होता है"" यह वास्तव में होता है! क्षमा मांगना!"
0,"इस सप्ताह जल्दी सोना होगा, बेवकूफी भरा NAPLAN परीक्षण पूरी तरह कष्टकारी है और मैं इसे नहीं करना चाहता!!!"
0,मैं अपनी छुट्टी के दिन काम करने के लिए बहुत उत्साहित हूं।
0,"घर लौटते समय सूरज चमक रहा है, लेकिन पीछे खेत में तिलहन की फसल है और उसकी गंध से मुझे बहुत बुरा लग रहा है"
0,@McPamy अभी तक नहीं। अभी 2 एपिसोड
0,मुझे नहीं पता कि वह प्यार में है या नहीं :एस
0,"मैं ओहियो के मौसम से सचमुच थक गया हूँ, वसंत का क्या हुआ? तुम्हें वसंत याद है ना? गर्मी थी और फूल थे...."
0,@विराह ईर्ष्यालु। मुझे बताओ यह कैसे होता है! अपनी बहन को भी मार डालो
0,एडिनबर्ग में मौसम नाच रहा है. हमारी सुबह कितनी शानदार रही और अब... http://bit.ly/qsp84
0,और मैं वास्तव में स्टार ट्रेक देखना चाहता हूं लेकिन कोई भी मेरे साथ नहीं जाएगा
0,"थोड़ी देर में काम पर निकल जाऊँगा, देर रात होने वाली है। महीने के अंत की गिनती, पूरी दुकान"
0,"हे भगवान, कल मेरा मीडिया टेस्ट है"
0,मुझे चर्च के बाद किसी के साथ घूमने के लिए चाहिए। कोई भी?
0,एक तरफ: मैं विश्वास नहीं कर सकता कि यह पुस्तक कॉमिक फक्किंग सैंस का उपयोग कर रही है। मुझे पूरा यकीन है कि मैंने उन्हें इसके खिलाफ स्पष्ट रूप से चेतावनी दी थी।    मेरी गलती नहीं!
0,@लीनमास्केल जीटीए अध्ययन तो ठीक था लेकिन सीबीएए ईएसआई?? xx
0,IE (6) और फ्लोटिंग साइडबार। वही प्रक्रिया...
0,आप जानते हैं कि मैं कभी नहीं समझ पाया कि कैसे मैं पूरी तरह से स्वस्थ होकर बिस्तर पर जा सकता हूं और फिर सर्दी के साथ उठ सकता हूं... मुझे बीमार होने से नफरत है
0,"क्या ऐ? लंबा थिंह, ??एनजी नई खींघ, मीं वां? 3 थी h?c kï¿½ n?a ch?"
0,गीत सांख्यिकी विषय के अध्ययन में सहायता नहीं करती।
0,मुझे लगता है कि मेरा दिमाग भ्रम से फटने वाला है। स्पैनिश होमवर्क निरर्थक और कठिन है
0,नील को हवाई अड्डे तक ले जाना
0,मैं अपनी खिड़की के ब्लीच से आने वाली बारबेक्यू गंध से प्रभावित नहीं हूँ!
0,"उहो, माँ का बॉयफ्रेंड कहता है कि नई बिल्ली है और वह दूसरी बिल्ली से लड़ रहा है। हम क्या कर सकते हैं?"
0,छुट्टियों से नफरत है
0,@Mikey_894 चुप रहो
0,घर.. बहुत अच्छा नहीं लग रहा है। बीमार
0,"2000 विषम 5-असाइड फ़ुटबॉल शॉट्स का प्रसंस्करण, कम से कम मुझे इसके लिए भुगतान मिला"
0,मेरा अन्य ट्विटर अकाउंट #BringTaraBack अपडेट नहीं करेगा
0,"उफ़, पेट में दर्द के कारण जल्दी उठना"
0,पिछले ट्वीट के बाद से नींद नहीं आ रही है. सिर लगभग माइग्रेन की अवस्था में है।
0,"@dos4gw हाहा नहीं, रूबेंस और किमी लंबे समय से मेरे पसंदीदा हैं। बस यह बेकार है कि रूबेन्स को उनकी ही टीम ने खराब कर दिया"
0,"मुझे लगता है कि #F1 रेस का दिन ख़त्म होने पर मैं बहुत सारे फ़ॉलोअर्स खो सकता हूँ।  मुझे फ़ॉलो करने के लिए आपका बहुत बहुत धन्यवाद, बहुत मायने रखता है <3"
0,मातृ दिवस पर काम पर
0,यह बहुत दुखद है कि मैं अपने माइक्रोसॉफ्ट का उपयोग कैसे नहीं कर सकता!!!
0,ओह: मेरे बाल आज योनि बन रहे हैं http://tinyurl.com/qr3jyk
0,F1 वैसा नहीं है जैसा फ़ेरारी के रूप में उपयोग किया जाता है और मैकलेरन इसे साकार नहीं कर सकता
0,"@जिम्बोरुस्की के साथ चर्च जाना, अपनी माँ से मिलना और फिर काम करना।"
0,"बारिश, बारिश, चले जाओ, किसी और दिन फिर आना। कृपया। बस बारिश बंद करो."
0,"ओमव कार्यालय के लिए .....दिनम, यह #fb के बाहर बहुत बढ़िया है"
0,"@केविनरोज़ मैं मेटालिका का बहुत विरोधी हूं, मुख्यतः इसका कारण यह है कि यदि पूरा नैप्स्टर कठिन हो जाता है। मुझे पुराने नैप्स्टर की याद आती है।"
0,वेबर को अच्छा प्रदर्शन करते देखकर अच्छा लगा! वह रूबेंस #f1 के लिए खतरा हो सकता है
0,"@Riki_Merav हाँ, मैं JONAs देख रहा हूँ लेकिन मैं पहले कभी किसी जेबी कॉन्सर्ट में नहीं गया हूँ। ग्रीस में कोई संगीत कार्यक्रम नहीं"
0,उस लंगड़े पूजा स्थल के लिए रवाना हो गया है लोल बेल गाना बजानेवालों
0,उह फिल्म अब सभी खुश हो जाओ #तारावापस लाओ
0,@HootyMcBoon खैर यह बेकार है #TWOHANDSFLETCHER #TWOHANDSFLETCHER #TWOHANDSFLETCHER #TWOHANDSFLETCHER
0,@purky_sweet को इस सप्ताहांत आपकी याद आई
0,अर्ररघघह! बिस्तरों में फिर देरी! अब एक महीने से डबल बेड नहीं है
0,अपनी संगीत वेबसाइट पर कड़ी मेहनत कर रहा हूँ (संस्करण 3)
0,यदि आपका बजट सीमित है तो डिजाइनिंग के लिए पीसी बनाना वास्तव में कठिन है
0,"@joshua_fox हाँ, मुझे लगता है कि मुझे सनस्ट्रोक हुआ था, लेकिन अब मेरे गले में अब तक की सबसे ख़राब ख़राश है xxxxx"
0,"@Darkmessiah24 धन्यवाद दोस्त!, *आह*, एक और सोमवार"
0,वसंत/ग्रीष्मकालीन सफ़ाई
0,यूटीडी मैच छूट गया क्योंकि मैं बिस्तर से उठ नहीं पा रहा हूं
0,#F1 ने बड़े पैमाने पर ईंधन की बर्बादी करते हुए अपना तीसरा स्थान खो दिया और अब वह 5वें या 6वें स्थान पर है
0,@Little_Steph eeeewwww वे भावुक हैं
0,मुझे लगता है कि इस पहले फुटबॉल मैच के लिए पहले से ही लिखावट हो सकती है
0,"मैं चाहता हूं कि मस्सा कम से कम चौथे स्थान पर रहे!! चलो, उसने शानदार दौड़ लगाई"
0,एक और सप्ताह की शुरुआत
0,मस्सा अब 5वें स्थान पर ही रुकेगा अन्यथा और अधिक अंक खो देगा
0,"मातृ दिवस की शुभकामनाएँ, काश वह घर पर होती और अभी भी बिस्तर पर होती, यह वास्तव में एक लंबा दिन होने वाला है।"
0,मैं फ़्रेंच टोस्ट पकाना नहीं जानता लेकिन मैं इसे जलाना जानता हूँ
0,मुझे लगता है @k4tie फ़ैक्टरी शॉप में गया है! मैं टिन ओपनर को तोड़ने में कामयाब रहा
0,"नष्ट हो गया, मुझे आशा है कि यह जल्द ही आएगा!"
0,"ठीक है और इसके बारे में। पिछली रात से बरामद, बेकन सैंडविच ने काम किया। पहले ही बहुत सारा पैसा खर्च हो चुका है और दिन ख़त्म नहीं हुआ है"
0,"ओह, मैं शायद ही इसे देख पाऊंगा...!"
0,"एक और। काम पर पूरा दिन तनावग्रस्त रहता हूँ, काश मैं अपने बेटे के साथ घर पर रह पाता"
0,@DideeCassem लेकिन आपने पहले ही केएल छोड़ दिया है...
0,मैं पिछले 8:30 से हमेशा से सोया नहीं हूँ! मुझे इसकी याद आती है
0,"मुझे कभी नहीं पता था कि जलना इतना दर्दनाक हो सकता है, मैं पट्टियाँ नहीं पहन सकता"
0,"@stevepizzati मुझे मत छेड़ो मैं टीजीए का बहुत बड़ा प्रशंसक हूं, और इस बात को फैलाना पसंद करता हूं... मैंने यूके टीजी का हर एपिसोड देखा है।  वाज़ और जेम्स को नमस्ते कहो।"
0,@sherleylueis मैं भी अहाहाहा।
0,"मैं बस माँ के घर जाने के लिए अपने पिता का घर छोड़ने ही वाला हूँ, वास्तव में वापस जाने के लिए परेशान नहीं हो सकता क्योंकि मुझे एम के लिए कुछ अच्छा होमवर्क करना है।"
0,@वाइर्मिसिस अच्छा लगता है। दुर्भाग्य से मैं इस सप्ताह अपने माता-पिता के घर जा रहा हूं और अगले सप्ताह तक नहीं खेल पाऊंगा
0,@aggroboy मेरी समस्या यह है कि वर्षों में पहली बार मुझे कोई भी ड्राइवर पसंद नहीं आया। बहुत नीरस जब आपको परवाह नहीं कि कौन जीतता है
0,जल्द ही अपनी भूगोल परीक्षा के लिए रिवीजन करने जा रहा हूं
0,"@jamiemcflyx नं.  यदि वे नवंबर में अखाड़ा दौरे कर रहे हैं, तो मैं जा रहा हूँ! इसमें कोई संदेह नहीं तुम्हें? xx"
0,"@crazilazigurl अच्छा दुखी नहीं है हाहा, अपने बारे में क्या ख़याल है और यार मुझे कल के लिए बहुत सारा कोर्सवर्क ख़त्म करना है"
0,मुझे रिवीजन से इतनी नफरत है कि हमें परीक्षा क्यों देनी पड़ती है। गरर्र
0,मुझे आज 8 1/2 घंटे के कैटरिंग कार्य के लिए साइन अप करने पर वास्तव में खेद है... मैं वापस सोना चाहता हूँ
0,सुबह।  काश मैं जागता न होता.
0,@pkollar @nsuttner हम सभी को 1up FM की याद आती है। यादों के लिए धन्यवाद...चाहे वे कितनी भी छोटी क्यों न हों।
0,"हे प्रिय, मैनचेस्टर सिटी वस्तुतः बहुत अच्छे नहीं हैं।"
0,ब्रेकअप और परम ग्रे एपिसोड... कोई अच्छा संयोजन नहीं है
0,एआईआर ने पिछले सप्ताह मेरा फोन खो दिया
0,माँ दिवस की शुभकामनाएँ!!! रात 8 बजे तक अपनी माँ के साथ काम करते हुए लगभग 5 मिनट बिताए...
0,"आउच, चिकन को ओवन से बाहर निकालते समय मेरा हाथ जल गया है"
0,नो फाइव स्टोन्स आज पूरे दिन मायर्स में लोगों की जाँच कर रहा है... यह बहुत अच्छा होने वाला है!!
0,मैं काम पर हूं और अभी बहुत थका हुआ हूं
0,रविवार की सुबह जल्दी काम पर होता है!
0,"देर से उठा, जिसका मतलब है कि आज कोई चर्च नहीं है।"
0,"@ckmonster अच्छा है, जब तुम घर आओ तो मुझे बताना"
0,@Mikey_894 आप हमेशा मेरे लिए बुरे होते हैं
0,"@rynsk Xanax ने मुझे और अधिक चिंतित कर दिया।  आख़िरकार मैंने एलर्जी की गोली ले ली। वे बेहतर काम करते हैं.  बहुत अच्छा कार्यक्रम हो, काश मैं वहां होता।"
0,"देखिए मैं जानता था कि मैं सही था!!! एलेक्स पेटीफ़र बुधवार को अपने शो में थीं, मारिया और मार्लिस ने कभी भी मुझ पर विश्वास नहीं किया कि मैं उनसे मिल सकती हूँ!!"
0,@एम्बर कन्फ्यूजन यह सिर्फ एक चरण है...
0,@jackosborn मुझे ईर्ष्यालु बना रहा है श्रीमान!!!!
0,सुबह 10 बजे चर्च जाना
0,+ जिसने मेरा लॉगी चुरा लिया
0,@hpstrfggt आपने कभी फ़ोन नहीं किया! आपने वादा किया था
0,"उफ़, किसी कारण से भोर में जाग गया और अब वापस सो नहीं पा रहा हूँ क्योंकि मैं सोचता रहता हूँ कि आज क्या होने वाला है"
0,यह बाहर बहुत अच्छा है! लेकिन कोई भी कुछ नहीं करना चाहता क्योंकि वे सभी नशे में हैं! बू!
0,4 दिनों तक बच्चों की देखभाल...बहन मेरे बिना ही चाबियों के पास चली गई
0,"मुझे एफ1 के बाद कुछ वॉलपेपर उतारने की जरूरत है, मैं इसे कई हफ्तों से टाल रहा हूं लेकिन इसे अगले सप्ताहांत के लिए करना होगा।"
0,@सारहसर मैंने सोचा था कि आप इसे अगले सप्ताह आईमैक्स पर मेरे साथ देखने जा रहे हैं
0,@fancypance मैं शुरू होने से पहले ही सो जाने के लिए खुद पर बहुत क्रोधित हूं... मैं पूरे सप्ताह इसका इंतजार कर रहा था!!
0,"मुझे ऐसा लगता है, नर्स @जेलीबीनसूप...अब झुनझुनी है। मुझे फ़ज जैसा डॉक पत्ता नहीं मिला, क्या वे एक साथ उगते हैं"
0,"@time2stand वे देखने में अद्भुत होंगे, यदि आप उन्हें देखने जाएंगे तो मुझे आपसे और भी अधिक ईर्ष्या होगी, क्योंकि आप पहले से ही निराश होने वाले हैं, मैं नहीं"
0,@temptationdice मेरे परिवार ने पारिवारिक समारोह आयोजित करने का निर्णय क्यों लिया?  मैं समझ गया कि आप उनसे नफरत क्यों करते हैं। -.-
0,@shawnee_dj ये बुरा समय है
0,बादलों का आवरण बहुत कम है - सरक नहीं सकते
0,@quietmissy अरे! मुझे आपकी मंजिल की सीटों से बहुत ईर्ष्या हो रही है! मुझे बहुत देर हो गई थी और हाँ... मैं वोट थूकने के बारे में सहमत हूँ। हास्यास्पद विचार
0,@फ़िल्सलाइकहोम दुर्भाग्य से वही है - मुझे नहीं लगता कि हम इस बिंदु पर बहुत अधिक सुधार देखने जा रहे हैं
0,"हे भगवान कैनन ने अपनी 50वीं वर्षगाँठ के उपलक्ष्य में अपना नवीनतम डीएसएलआर जारी किया, बहुत बुरी बात है कि इसकी कीमत 6 हजार से अधिक है और मेरे पास अतिरिक्त नकदी नहीं है"
0,मुझे ऐसा महसूस हो रहा है जैसे हर कोई मुझे घूर रहा है
0,@fyrchk और CAPS हार गए!
0,आह! काम पर आधा घंटा बीत गया और एक भी ग्राहक दरवाजे पर नहीं आया
0,पूरे दिन काम कर रहा है. हर कोई चला गया!
