0,"वास्तव में मैं अपनी आँखें खुली नहीं रख सकता.., मुझे बकवास जैसा महसूस हो रहा है"
0,"रयान के सेट के बाद शो से घर चला गया... मुझे धुएं की बदबू आ रही थी, लेकिन उन्होंने मुझ पर भी वार किया, अगर वे नहीं जीते तो मुझे झटका लगेगा, मैं आपको पोस्ट करता रहूंगा"
0,"@अंकलरुश बीमारी, यह बुरी है... शुभकामनाएँ। जल्दी बेहतर महसूस करें. मैं आपका दर्द पूरी तरह से महसूस करता हूं। 3 डॉक्टर, 5 सर्जरी और 1 1/2 साल हो गए हैं"
0,"@जुपामन लानत पाब्लो, एप्पल हैंग इन बेबी के साथ तुम्हारी परेशानियों को सुनकर दुख हुआ!"
0,"नहीं, दो सप्ताह में यदि दवाएं काम नहीं करेंगी तो ओवरबाइट सर्जरी करनी होगी"
0,"मुझे वास्तव में बच्चा होने की याद आएगी, मुझे बदलाव से नफरत है।"
0,@चेल्सीजी83 एएच!! मुझे नहीं पता था कि यह कल रात थी!
0,अंडरग्राउंड में @milleinad और जॉर्डन के साथ। यह बहुत दुखद है
0,"आज लगभग 12:30 बजे मुझे बस एक छोटा सा सैंडविच खाना था, मुझे बहुत भूख लगी है और मेरे पास खाने के लिए कुछ भी नहीं है।"
0,8 बजे काम है
0,असफल सप्ताहांत.
0,@Edi240 मुझे पता है यह कैसा था?
0,माँ फिर से पागलों जैसा व्यवहार कर रही है
0,@Nick_is_awesome मुझे क्षमा करें
0,कल मेरा नया फ़ोन नहीं मिल पाएगा
0,मुझे स्नातक होना पसंद है लेकिन काश मैं अभी भी कॉलेज में होता
0,बस अभी घर पहुँचा। और अब मैं ऊब गया हूं
0,"मेरे पापा ने मेरे लिए बोका बर्गर खरीदा जिसे हमने खाया, फिर वह चला गया"
0,"मैं बीओएफ देखना चाहता हूं! वर्तमान में @ Hjh Maimunah खा रहा हूँ। ओह, और मैंने कल बायो के लिए कुछ भी अध्ययन नहीं किया है"
0,@AlexCouey कम से कम दूसरे के साथ तो ऐसा हुआ। एक नई ट्यूब डालना बेकार है और फिर एक या दो दिन में वह ट्यूब चालू हो जाती है।
0,6 मिनट में सभी 50 राज्यों का नाम बताने का प्रयास करें। यह जितना आप सोचते हैं उससे अधिक कठिन है
0,"अभी इस बिकनी में लगभग नए साल की तरह ठंड है, आह, लेकिन मैं बहुत उत्साहित हूं"
0,"@ayyorudy ओह, मुझे खेद है। मैं जानता हूं वह कैसा है। मैं आज रात बाहर नहीं जा सकता"
0,...मैंने अभी-अभी लगभग 19 औंस कॉफ़ी पी है... यह मेरी अन्य 5 औंस की तुलना में वापसी चाहता है।
0,मेरी कार टूट गई है
0,घर में शराब पीना मध्यम - और थोड़ा आनंद लेना... मुझे क्या हो रहा है?
0,टैटू बनवाना पसंद है! स्वीकार करें कि यह मुझे कामुक बनाता है
0,अजीब स्थिति में सोना बंद करना होगा! गर्दन में असहनीय दर्द हो रहा है!
0,"@nicholasbraun स्टील टो बूट पहने कुछ आदमी ""गलती से"" मुझ पर पैर रख दिया। इससे कोई मदद नहीं मिली कि वह 6'2 का था और उसका वजन लगभग 250 पाउंड था"
0,@फौनाना कम से कम आप अभी भी टिप्पणी कर रहे हैं। यदि आप पूरी तरह से गायब हो गए तो मुझे चिंता होगी
0,"जीवन अच्छा है, लेकिन यह और भी अच्छा हो सकता था अगर मैं आज रात रोडियो पर होता"
0,"@may_gan उसकी पसंद अच्छी हो सकती है लेकिन वह मेरे साथ स्टार ट्रेक देखने नहीं जाएगा, कल मदर्स डे है और उसे मॉन्स्टर्स एंड एलियंस देखने जाना है"
0,उसे खुश नहीं कर सकते
0,@GarrettWalt अभी भी मेरे जन्मदिन पर आपको सोने की ज़रूरत है।
0,"वाह, मेरे घर पर अभी बर्फबारी हो रही है!!, हालांकि स्थिर नहीं हो रही है"
0,@लिंटविट यदि आप अपनी प्रोफ़ाइल को 1.0 में बदलते हैं तो मैं रोब के कई चेहरों का उपयोग करके आपके पेज पर मज़ेदार टिप्पणियाँ छोड़ूँगा। 2.0 मुझे ऐसा नहीं करने देगा
0,उबासी...हुंह? दोपहर के 12 बजे हैं?  क्या मैं कुछ और शीतनिद्रा में पड़ सकता हूँ? वैसे भी करने को कुछ नहीं है.
0,मैं कल परीक्षण नहीं कराना चाहता!!!!!!!!!!!!
0,@TheBlondeTheory क्लब में आपका स्वागत है
0,@illBLvnDW4Evr32 हाहा मेरा पहला संगीत कार्यक्रम 23 सितंबर 2008 को था! मैं उन्हें दिन में कभी नहीं देख पाया।
0,बदबूदार शापित लॉटरी
0,क्या मेरे पास ट्वीट हो सकते हैं? मैंने ओवरट्वीट किया और ट्विटर ने #savotes ख़त्म करने के लिए मुझे बाहर कर दिया।
0,"केक!! हमें केक चाहिए! (जैकी को केक चाहिए) दुख की बात है.. ब्रीना से पहले सभी बच्चों ने केक टॉपर्स छीन लिए, यह सही नहीं है! यह उसका भी जन्मदिन है!"
0,यह बेकार है
0,"मैं दुखी हूं, मैं अब अपने UggBoots नहीं पहन सकता"
0,@unravel101 क्या आपको उनसे कोई जानकारी मिली? और कैसी सर्दी?
0,http://twitpic.com/4wenx - मुझे अपने पिल्ले की याद आती है
0,"ठीक है, मैं फंक उत्सव से वापस आ गया हूँ और बस इतना ही कह सकता हूँ कि वाह!! बीबीडी फैंटेसीया आरोन हॉल की एकमात्र बुरी बात यह थी कि उन्होंने इतना समय लिया कि डौगी फ्रेश नहीं हुआ"
0,मुझे ऐसा लगता है कि लोग चाहते हैं कि मैं चुनूं।
0,"@लियाजेवेल रुको, क्या हमें ग्रेजुएशन के लिए कपड़े पहनने चाहिए? मैं ड्रेस पैंट नहीं पहन सकता?"
0,@व्हाटचंद्र ने कहा कि मुझे आइस्ड टी चाहिए।
0,पता चला कि मेरी कार खराब है. बूऊऊ.
0,डलास में बारिश आ रही है।
0,"मेरे दाढ़ी वाले ड्रेगन हाल ही में बहुत लड़ रहे हैं, अच्छा नहीं! मुझे लगता है कि वे दोनों पुरुष और वे गर्मी में हैं। हो सकता है 2 को एक से छुटकारा मिल जाए"
0,@Jennaa17 क्या वह टीवी पर है? ऐसा कुछ भी नहीं है... और यदि हां तो कौन सा चैनल?
0,"@sexipeaches09 नहीं, अगर आप फ़िली होते तो मैं कहता कि चलो बाहर घूमें, खाना खाएं या कुछ और करें! मैं दा पालना में प्रमुख पायने देख रहा हूँ!"
0,आगंतुक को परिवार के साथ देखना। और डायलअप इंटरनेट का पूरा दर्द महसूस कर रहा हूं।
0,@ashleyvirus उम्म्मम्म.. एक घंटे में LOL तब मैं अपनी साइडकिक पर आऊंगा
0,@Aellai13 मुझे पता है कि वे एक साथ एक गड्ढे में मरेंगे
0,मुझे प्रशिक्षण की याद आती है... http://plurk.com/p/su6lr
0,मैंने अपने सभी बुकमार्क खो दिए.
0,एसएनएल से प्यार करता हूँ... और वह एकमात्र सुइटमेट है जो आज न्यूयॉर्क में रुका है
0,@leylacarter @CelyMcLean ceeelyyy esk leyla नो मी किरी!!! बुआआअ हेहे
0,स्कूल का काम कृपया मुझसे करवाएं.. मैं नहीं करूंगा
0,@swfanworks मुझे ट्व्रिल पसंद है। एकमात्र झटका यह है कि इसका फेसबुक कनेक्शन नहीं है
0,@amber_eubanks वास्तव में निराशाजनक बात यह है कि जब कोई गाना काम करता है और फिर गायब हो जाता है।
0,"आउच, दुख होता है, आईपॉड टच ने खुद को पुनर्स्थापित करने का फैसला किया इसलिए मैंने नीड फॉर स्पीड में अपनी प्रगति खो दी, 28/29 दौड़ पूरी कर ली थी"
0,"@nerdynotdirty ओह, मुझे इसके लिए बहुत खेद है!"
0,"@bunnytrails हाँ, मुझे @sprittibee को नमस्ते कहना है। हालाँकि बातचीत करने को नहीं मिला।  हैंक द काउडॉग के बाद हम एक-दूसरे को नहीं ढूंढ सके।"
0,"@jmarkiz ठीक है, आप एक ट्रेकी की तरह नहीं दिखते हैं, आप एक ट्रेकी की तरह व्यवहार नहीं करते हैं, और शुक्र है कि आप एक ट्रेकी की तरह गंध भी नहीं करते हैं। तो मैंने मान लिया"
0,@सैकोउ मुझे बज्जी चाहिए।
0,मुझे नहीं पता क्या ???  मुझे लगता है हमें फ़ॉलो करें
0,"नहीं, मैंने सिर्फ वीडियो गेम खेलते हुए अपनी तर्जनी में चोट नहीं लगायी... :ओ"
0,अरे नहीं! =ओ मेरा एमपी3 ख़त्म होने वाला है।  और मेरे पास अभी भी 30 मिनट की यात्रा है। -.-ड्रैट्स. एक्सपी
0,मैं अभी जागा हूं और यह अजीब है कि मैं इतनी देर तक सोना नहीं चाहता था... मेरी शनिवार की रात बीत रही है
0,.. बहुत खूब। मुझे लगता है ये सही है.  ज़ोर-ज़ोर से हंसना।
0,"@planet_mars94 मुझे नहीं पता।  मैं नहीं बनना चाहता, लेकिन साथ ही, मैं वास्तव में इसकी परवाह भी नहीं करता, क्या आप जानते हैं?"
0,उसे इसके बारे में कुछ करने को कहें
0,"अपने आईपॉड को सुन रहा हूँ; कुछ शो देखना; अत्यधिक थका हुआ हूं लेकिन सो नहीं पा रहा हूं, एफएमएल!"
0,@stark23x यह एकमात्र सांकेतिक भाषा है जिसे मैं जानता हूं
0,मेरी उम्र लगभग 40 है और मुझे अभी भी मुँहासे होते हैं
0,हां वह है। मैं उसके संदेश नहीं देख सकता. मुझे इसे करने के लिए ऑनलाइन जाना होगा।
0,@क्लचफैन्स को लगता है कि अगर याओ को लगभग हर साल चोट लग रही है तो रॉकेट्स को उसे अपने पास रखना चाहिए?
0,मेरा चश्मा टूट गया! नहीं!
0,"नए Twitteriffic iPhone ऐप को पसंद कर रहा है। मैंने अभी-अभी भुगतान किया है और मुझे ट्वीट करने की आदत हो गई है, लेकिन अब यह ट्विटरिफ़िक पर वापस आ गया है... $3 चले गए"
0,"उल्लू. मेरा सिर क्यों दर्द कर रहा है, 9.30/10 बजे काम करूंगा और फिर स्नान करूंगा। हे हे."
0,@JoshyCouture रूफ टॉप टाइम।
0,मुझे पढ़ना है!
0,कुछ महान लोगों के साथ टेक में अपनी आखिरी मज़ेदार शाम का आनंद ले रहा हूँ! कल पूरा दिन काम निपटाऊंगा। मंगलवार को टेक छोड़ने का दुख है
0,मेरे माइग्रेन ने मुझे फिर से बुखार दे दिया और यह तीन सौ डिग्री तक महसूस होता है
0,मैं अभी सोना नहीं चाहता
0,मातृ दिवस उपहार खोज: महाकाव्य विफल
0,एक छेद के बाद @साइमे बाहर बारिश हुई
0,@necolebitchie...आश्चर्यजनक है क्यों वैसे भी सुरक्षित रहें।
0,@stark23x को डेड्सविले में बाथरूम ढूंढना सबसे कठिन समय है
0,मेरा ब्लड शुगर बिल्कुल 100 है। उंगली चुभाने में कोई मज़ा नहीं
0,@130587 ओह प्रिय। खैर उम्म्म मुझे आशा है कि वे ऐसे नहीं होंगे
0,"मुझे कुछ बेन एंड जेरीज़ केक बैटर चाहिए, कृपया उह"
0,अंतत: हम तुम देख रहा हूं। अकेला
0,"असफल, यह बेवकूफी भरी हेयर डाई है जिसका उपयोग रंगे हुए बालों पर किया जा सकता है।"
0,मुझे दुख हो रहा है क्योंकि जोनाथन मेरे प्रति बुरा व्यवहार करता है।
0,"@AnalystAlterEgo हाँ, मैं घर वापस आ गया हूँ, मेरा चचेरा भाई मेरी दादी के यहाँ रह रहा है, वैसे भी मुझे कुछ मिनट दीजिए, फिर हम यह काम करेंगे!"
0,"मैं जानता हूं कि यह किसी के ध्यान देने योग्य नहीं है, लेकिन मुझे अफसोस करना होगा: मेरे पास ह्यूमस खत्म हो गया है और मेरे पास 1/2 बैग गाजर बची है"
0,अकेले मूवी नाइट। मैंने अभी-अभी अपनी बिल्ली पर कदम रखा है
0,सिरदर्दईईईईईईईईईईईईईईईई
0,वह समझ नहीं पा रही है कि अपनी ट्विटपिक पोस्ट में txt कैसे जोड़ें
0,डेमनिट #कैनक्स 2-2 से बराबरी पर
0,"हाँ, बूंदाबांदी हो रही है, बहुत ठंड है"
0,काश मैं जादुई उपचार शक्तियों वाले किसी व्यक्ति को जानता। मुझे बंद रहना पसंद नहीं है।
0,उनींदापन वापस आ रहा है और दांत में दर्द हो रहा है
0,रात को ट्विटर करने वाले लोग... 8 बजे काम करते हैं
0,चूहों और मनुष्यों के बारे में पढ़ना होगा
0,इसे अपशब्द कहें!!! एक और iPhone ख़राब हो गया
0,"वह इस बात से बहुत नाराज़ है कि वह, कायला और सारा चुपचाप बाहर नहीं निकल सकते"
0,"मैं बहुत थक गया हूँ.. मुझे लगता है कि यह मेरे सोने का समय हो गया है। ओह रुको, मुझे अभी भी 1000 काम करने हैं"
0,हमारा एसी खराब हो गया है
0,"हाहाहा, उस चीनी को पूरी तरह से नष्ट कर दिया। यार, बहुत समय हो गया."
0,"? दोपहर सब लोग! आजकल मेरे लुक्स पर प्रतिक्रियाएँ कम क्यों हो रही हैं? आप जानते हैं, वास्तव में दुखद है... (आँसू) http://plurk.com/p/su7ga"
0,@_कुछ नहीं_लड़की_ मुझे यह सुनकर दुख हुआ।      और धन्यवाद! <3
0,नए फ़ोन का समय... मेरा अभी टूट गया।
0,@JenAlaniz मुझे उस सप्ताहांत ओरेगॉन DARN के परिवार के साथ ताहो में सप्ताहांत बिताने के बारे में पता चला था!! मैं तो जाना चाहता हूँ
0,सोचो मैं कल चर्च नहीं जाऊँगा
0,आज रात क्या हो रहा है दोस्तों... मैं कुछ करना चाहता हूँ
0,@SandiHockeyMom अच्छी खबर नहीं है। कोई ज्ञात इलाज नहीं. ऑटो-इम्यून बीमारी पाचन तंत्र पर हमला करती है। देर से किशोर और बीस वर्ष। बहुत अफसोस।
0,"आज रात हर कोई कुछ मजेदार कर रहा है, जबकि मैं सुबह 8 बजे तक काम पर फंसा हुआ हूं और गुस्साए स्प्रिंट ग्राहकों द्वारा चिल्लाया जा रहा हूं। अछा नहीं लगता।"
0,#SNL पर JT के साथ सियारा के प्रदर्शन से निराश हूं... यह बहुत बुरा था।  एक अच्छा गाना बर्बाद हो गया
0,"@theberaca मेरे पास कोई उपहार नहीं है, मैं बहुत गरीब हूं, मैं कॉलेज को लेकर उत्साहित हूं"
0,"यह दिन बहुत लंबा है, और मुझे आज रात नीचे सोना होगा लोलोल।"
0,उबाऊ होमवर्क
0,कोई मुझे गंध तक ले चलो
0,@DaniSssss आप पोस्ट कर रहे हैं
0,बकवास जैसा लगता है.
0,"@डीचो वाह, मैं बहुत सौभाग्यशाली महसूस कर रहा हूं...और दयनीय हूं"
0,याओस बाहर!! नहीं! अगले वर्ष के लिए शुभकामनाएँ रॉकेट
0,"मातृ दिवस का कार्ड बना रहा हूँ..हाँ, एक रात पहले। मैं एक बुरी बेटी हूँ"
0,@JoeFlirt यह सुनकर दुख हुआ...खुद तनाव के दौर से गुजर रहा हूं...अपने लिए महसूस करें
0,"आह, मैं शुक्रवार की बहुत सारी फ़ॉलो कार्रवाई से चूक गया"
0,काश हमें यहां बारिश मिलती! मुझे इसका हर समय इतना सूखा रहना पसंद नहीं है..
0,एसएनएल पर सियारा + जस्टिन टिम्बरलेक = शर्मनाक
0,बस मेरा फ़ोन बिल पढ़ो। दूर रहने पर कम एसएमएस करने की जरूरत है।
0,@जेनिफर97236 उच। मार्क मार्टिन मेरी गांड को चूम सकता है। पुराने गिट को वर्षों पहले सेवानिवृत्त हो जाना चाहिए था
0,@DAC1MM उह्ह्ह....हम इसके बारे में बात नहीं करना चाहेंगे।
0,मुहं पेट में दर्द हो रहा है
0,"9aba6 el5air, बिल्कुल भी नींद नहीं आई, कार के लिए elfa79 elfannii ख़त्म करने जा रहा हूँ"
0,क्या लोग भोजन के बारे में ट्वीट करना और चुटकी बजाना बंद कर सकते हैं... मैं भूख से मर रहा हूं
