0,आज के लिए fini thk भगवान क्या एक घोड़ी: -s सबनेटिन भयानक है
0,उपयोगकर्ता क्यों
1,"तू AAAHHHHHHH मैं उत्साहित हूं! घर में यह पुश !, यह ठीक है! aawww मैं अभी बहुत खुश हूँ"
0,बस O2 के साथ बात की ... और पता चला है कि वह शुक्रवार को नया iPhone नहीं खरीद सकता है
1,"उपयोगकर्ता योग्य आप सही हो सकते हैं, लेकिन मुझे संदेह है"
1,जेमिन ने उल्लास के कलाकारों द्वारा विश्वास को रोकना नहीं
0,"काश मैं अभी कैप के क्रंच जामुन का एक बड़ा कटोरा खा पाता, लेकिन इन गुहाओं को मुझे मिला, निश्चित रूप से मुझ पर भौंकना होगा"
1,"उपयोगकर्ता पैकिंग बहुत मजेदार है मैं उस सोम को कर रहा हूँ, इसलिए मुझे लगता है कि मैं महसूस करता हूं। यात्रा शुभ हो!"
1,उपयोगकर्ता
1,उपयोगकर्ता धन्यवाद और आपका सप्ताह भी धन्य हो सकता है
1,उपयोगकर्ता ... यू उर वर्कआउट जारी रखने और कार्यक्रम के साथ रहना। यह मदद करता है अगर आपको कुछ 1 चेकिंग हो गया है।
0,उपयोगकर्ता आप वहां क्या कर रहे हैं? क्या यह मोतियों के साथ करना है? क्षमा करें बारिश हो रही है
0,उपयोगकर्ता मैं आपको हर रोज ट्वीट करता हूं जब से मैं ट्विटर में शामिल हो गया। और आपने मुझे अभी तक जवाब नहीं दिया है।  या शायद आप मुझे कभी जवाब नहीं देंगे ...
0,मेरे कमबख्त घर से बाहर बंद!
1,उपयोगकर्ता अपनी छुट्टियों का आनंद लें
1,उपयोगकर्ता चक्कर में rascal मुझे लगता है कि xx
1,"उपयोगकर्ता यह अच्छा है, बस बहुत थका देने वाला!    आशा है कि आपको कुछ गर्म पानी मिलेगा!  आपके स्नान के लिए जिसके बारे में मैं सोच रहा होगा।  मज़ाक कर रहा है। :-पी"
0,"duno क्या करने के लिए doooooooo, चीजों के भार को करने की जरूरत है लेकिन मैं आलसी हो रहा है"
0,उपयोगकर्ता यह मुझसे नफरत करता है
0,"खिचड़ी भाषा क्या देख रही है,"
1,"उपयोगकर्ता आप दोनों एक जैसे दिखते हैं, मैं केवल भूत शो देखता हूं, हां मैं उनमें से एक हूं"
0,डरा हुआ बाउट इस परीक्षा !!
1,"जब आप ""सुझाव"" Google, Google पहला परिणाम है"
1,ऊह। उपयोगकर्ता मुझे याद है कि हाहा। डरावनी बिल्ली
0,मैं एक स्ट्रिपर के साथ प्यार में हूँ
1,उपयोगकर्ता हे
1,उपयोगकर्ता ily xoxo thx बहुत कुछ कहने के लिए हैप्पी बर्थडे पर जाने के लिए एमएसएन!
1,उपयोगकर्ता तो जब आप #HTS2009 पर MIC/STORM को यहां मंच पर जब्त करने जा रहे हैं
0,iTunes गड़बड़ है
1,उपयोगकर्ता आपका स्वागत है
1,अंतिम मिनट के बारे में बात कर रहा है होमवर्क कर रहा है!
1,फिर से बाहर जा रहा है! कभी भी गर्मी का मन न करें! जब तक समय अच्छी तरह से चचेरे भाई और परिवार के साथ बिताया।
0,बिस्तर के लिए तैयार हो रही है! भौतिक चिकित्सा के लिए आगे देख रहे हैं जल्द ही मेरी पीठ और गर्दन को चोट लगी
0,उपयोगकर्ता और बस ट्विटरवर्स को अद्यतित करना है: मैंने आज सुबह बिस्तर पर नाश्ता नहीं किया है
1,पब था हॉट व्हाट्स ग्वानिन आज रात/
0,मेंढक ने इसे नहीं बनाया ...
0,उपयोगकर्ता अगर मैं न्यूयॉर्क में होता तो मैं नहीं होता लेकिन मैं नहीं
0,"ओह के बाहर खेलने के बारे में और मेरी बिल्ली के साथ कुछ गलत है, लेकिन मुझे नहीं पता कि क्या ... संकोच करना"
1,उपयोगकर्ता कि दो बनाते हैं।
0,एलर्जी का अभिनय !!!
0,आज सुबह एक छोटी सी दुर्घटना हुई।  जब मैं एक पार्किंग स्थल में खींच रहा था तो गाय ने अपना दरवाजा खोला। मैं रुक गया लेकिन तब तक बहुत देर हो चुकी थी।
1,"उपयोगकर्ता ""इसकी बारिश बिल्लियों और कुत्तों"" ... क्या यह जर्मन शेफर्ड होगा? * कराहना* हां, मुझे पता है कि यह बुरा था।"
1,'' अप '' देख रहा है
0,आज बिल्कुल बहुत अच्छा नहीं लग रहा है
0,पूरे दिन घर पर .... मेरी कार वापस पाने के लिए इंतजार नहीं कर सकते
1,Spongebob देख रहे हैं !!! हाहा
0,"उपयोगकर्ता स्टीव जॉब्स एक सम्राट, रहस्यमय और मायावी की तरह है। हमारे पास बहुत सारे सुरक्षा स्तर हैं और मैं एक पैर के सैनिक की तरह हूं।"
1,दोपहर के भोजन के लिए!
1,"गर्म आभार के साथ उपयोगकर्ता उपयोगकर्ता!  अपनी तरह की दोस्ती के लिए धन्यवाद, साथी ट्विटरर्स!"
0,उपयोगकर्ता मैं वास्तव में बुध पर Laker परेड में जाना चाहता हूँ! हालांकि मैं काम करता हूं और नहीं कर सकता
0,"कोई आश्चर्य नहीं कि मैं सभी ट्वीट्स से भरा क्यों हूं, मैं अब फ़िल्टर नहीं कर सकता।  सोशल नेटवर्किंग केवल अपने आरएसएस फ़ीड को पोस्ट नहीं कर रही है!"
0,उपयोगकर्ता omg आप गरीब बात। मेरे पास भी होगा।
0,"W/maske'jacqui का दौरा किया, जो सोमवार को Movin 2 sufu है, हमें कुछ हंसी थी..नहीं विन्यान लेकिन मुझे, उपयोगकर्ता तो wicasa को एक।"
1,मैं कभी नहीं सोया। मैं हर रात को काला करता हूं।
0,उपयोगकर्ता यह दिल तोड़ने वाला है। बस स्टीरियो प्रकार को आगे बढ़ाता है कि अमेरिकी बंदूक टोटिंग जोश नट जॉब्स w/ नो टॉलरेंस
1,अब असली के लिए सोने जा रहे हैं कि मेरा फोन मेरे साथ ले जा सकता है
1,"लड़की मेरी बालकनी पर बात कर रही है ... क्या सुंदर नीट कितनी सुंदर है, यह एक पूर्णिमा! मजेदार है कि हम कैसे जा रहे हैं"
0,उपयोगकर्ता आप मेरे लिए बहुत आगे की योजना बना रहे हैं ... जुलाई में भी परीक्षा ...
0,"Url हाय !!! मैं किसी कारण के लिए यहां और अधिक तस्वीरें अपलोड नहीं कर सकता, मैंने आपका विज्ञापन देखा और मुझे लगता है कि आप दिलचस्प हैं ..."
1,Thiinkk greenen
0,aww जस्टिन अब घर का बना देख देखकर चूक गया
1,उपयोगकर्ता जो मेरे पसंदीदा बाइबिल छंदों में से एक है। प्रशंसा!
1,टोनी अवार्ड्स को कौन पसंद नहीं करता है?
0,"उपयोगकर्ता Aww! वैसे मेरे बिस्तर में एक बहुत बड़ा छेद है जिसे आप हेह में बैठ सकते हैं। मुझे तुम्हारी याद आती है, क्या यह भी संभव है? ओ आदमी।"
1,उपयोगकर्ता मैं सिर्फ जीनियस की रिपोर्ट कर रहा हूं ... इसने मुझे गंभीरता से हंसने के लिए जोर दिया-हालांकि कार्यालय में होने के बावजूद।
1,मैं आप पर वापस हड़ताल कर सकते हैं
0,सोचता है कि यह बेकार है कि आप एलजी फोन पर अपनी खुद की रिंगटोन डाल सकते हैं।  चुराना!
1,"उपयोगकर्ता संगीत सुनने के बिना एक दिन पास नहीं कर सकता है, है ना?"
1,"ठीक है, अच्छी तरह से चित्रों में मुद्दे हैं इसलिए मुझे आज रात को उन्हें पोस्ट करना होगा .... बने रहें।"
0,कृप्या मेरा पीछा करें
1,उपयोगकर्ता मैं ज्ञान दांतों के लिए डर गया हूँ ... हालांकि क्रिसलर चीज़ के लिए उत्साहित हूं। नि: शुल्क भोजन+chryslers =
1,बस एक नाना झपकी से जाग गया! उन लोगों से प्यार होगा!
0,मैं कल काम करने के लिए वापस नहीं जाना चाहता हूँ कल 27 जुलाई को मेरे अगले सप्ताह के लिए booooooooooo के लिए इंतजार करना होगा!
1,"उपयोगकर्ता यह ""उस बैंड से उस आदमी"" से बेहतर होगा?"
0,ओल्ड स्ट्रीट पोस्ट ऑफिस - 4.30pm और अभी भी आधे घंटे की प्रतीक्षा की जाती है - यह वहाँ जाने के लिए एक अच्छा समय है
0,"मैं Parc फ्लोरल और आज सुबह, बैंग में पिकनिक लंच करने वाला हूं! मेरी नाक पर कठोर खटखटाते हुए। यह बहुत लंगड़ा है!"
0,लगता है कि क्या प्रसिद्ध $ और लोकप्रियता के बदले में मिलता है। अभी भी मुझे गलत लगता है। अभी भी एक इंसान है
1,उपयोगकर्ता आपका स्वागत है
1,जब से मैं वास्तव में इस तरह से मैं-समाजीकरण करता हूँ तब से यह बहुत लंबा हो गया है!
1,हे ट्विप्स! सबको सुप्रभात
0,उपयोगकर्ता मुझे अपने शेड्यूल को देखना है ... जहां मैं सप्ताहांत काम करता हूं।
0,मैं कसम खाता हूँ गलत बकवास तत्व के लिए एक चुंबक।
0,टेटर टोट्स सबसे अच्छे हैं ... मैं चाहता हूं कि यह चीज़ पहले से ही हो। यह पहले से ही लंबे समय से हो चुका है।
0,hhhaaaasssss कोई कंप्यूटर और नफरत करता है
0,ग्रीस के लिए अभ्यास करने के बाद आज रात बेबीसैट। मैं बहुत थका हुआ हूं! कल कभी नहीं उठेंगे। मुझे हालांकि करना है
0,उपयोगकर्ता मैं घर जाने की योजना बना रहा था .. लेकिन इसे काम के कारण रद्द करना पड़ा।
1,उपयोगकर्ता धन्यवाद! किसी को ले जाने की उम्मीद में कीमत गिरा दी। मुझे अव्यवस्था को साफ करने की आवश्यकता है
1,3 बेबी ज़ेबरा फिंच को सुनकर उनके फेफड़ों को चिल्ला रहा है। वे सबसे प्यारे हैं
1,"उपयोगकर्ता मुझे आशा है कि आप उतना ही अवशोषित कर रहे हैं जितना आप ट्वीट कर रहे हैं, मिस्टर!"
1,आपके पट्टे पर हस्ताक्षर करने के लिए उपयोगकर्ता बधाई! बहुत जर्जर नहीं है।
0,शायद दिन के बहुमत के लिए झपकी और रोना ...
1,संगीत सुनना!
0,ट्विटर क्यों मृत है? सब लोग कहाँ है?
1,डिनर का समय पहले से ही?  यहाँ एक अच्छे सप्ताह के लिए हर कोई है
0,उपयोगकर्ता नहीं
1,"मेरे नए घर में चिलिन, हमने बस समय बिताया कि स्कूल जाने में कितना समय लगता है और फिर वाल्ग्रेन्स चला गया। मुझे एक इहोम भी मिला"
0,मुझे आश्चर्य है कि आज मुझे इस क्रोधी मूड से बाहर निकालने वाला है ..... सोचो कि इसका समय मा दस्ताने लगाने और इसे पंच बैग पर ले जाने के लिए है
1,उपयोगकर्ता हे ट्रेस! मेरा नाम फातिमा। फिलीपींस में आपका स्वागत है! आशा है कि आप इसे यहां पसंद करेंगे।
1,हाहा बेबी मामा कभी बूढ़े नहीं हो जाते
0,पिछली रात एक भयानक भेजने-बंद था। मैं शार्लोट को याद करने जा रहा हूं। मुझे बस एहसास हुआ कि यह आखिरी बार है जब मैं इस घर में रहूंगा। लानत है।
0,उपयोगकर्ता मैंने पिज्जा पर छोड़ दिया है - बच्चों ने मुझे कभी भी अपना fav (हॉट वाले) नहीं दिया
1,"उपयोगकर्ता वाह, उन्होंने वास्तव में एलन वेक दिखाया ?? मुझे लगा कि आकाश में हमेशा के लिए उस महान ड्यूक नुकेम के पास जा रहा है।  प्रोजेक्ट नटाल?"
0,"मेरी माँ ने सिर्फ मुझे नए mocs खरीदने की पेशकश की, अगर मैं खदान से दूर नहीं, यार!"
1,अशर यू को देश भर में लड़कियां मिलीं ...
0,गोल दुकानों को घसीटा जा रहा है
0,हर कोई सांता मोनिका पियर के पास जा रहा है ... आह मैं चाहता हूं कि मैं अभी वहीं जा सकता हूं
0,बड़ी मछली के बारे में उपयोगकर्ता मुझे नहीं पता कि क्या मैं अपने सभी झांकियों को आज रात ग्रोव में जा सकता हूं और आईएम से अनुरोध किया है कि मेरे पास होने का कारण है
1,उपयोगकर्ता lllllooooooooovvvvvvvvvvveeeeeeee आप भी !!!!!
1,"कुकीज़ एक स्पर्श मीठा है, लेकिन बहुत अच्छा है! मैं प्रसन्न हूँ!"
0,मेरा कोई भी दोस्त यहाँ नहीं है
0,आज मेरा आखिरी दिन है जो मुझे पता है कि मैं दुखी हूं। मेरे ट्रक को मेरे पिताजी से कल केवल मामूली क्षति के साथ मिल गया।
0,प्रेस्टन हाउस में जा रहे हैं और मुझे अब तक का सबसे खराब सिरदर्द है
1,उपयोगकर्ता शुभ संध्या। बस सोच रहा था कि आप ऊब होने से पहले आप पुरुषों के कितने खेल देख सकते हैं
1,"बिल माहेर: सोतोमायोर 'वाइज लैटिना ""महिला लिम्बो जैसे लोगों को बाहर जाने और अपने अधिकार को साबित करने के लिए उकसाता है"
0,बकवास।  मैं E3 निकासी शुरू कर रहा हूं।  मैं सभी को गंभीरता से याद करता हूं।  हर कोई इतनी दूर क्यों रहता है?
0,पेट अभी भी 2 दिन पहले से दर्द होता है
1,उपयोगकर्ता ने बस मेरी कॉपी खरीदी।
1,"Goodmorning दुनिया, या सिर्फ ट्विटर। आशा है कि आप सभी के पास एक अद्भुत दिन होगा। मैं एक होने की योजना बना रहा हूं।"
0,मैं वास्तव में सिर्फ खाल देखना चाहता हूँ ... यह हमेशा के लिए लोड करने के लिए लेता है
1,महान डीजे <3
1,>। < -। मैं कोशिश कर रहा हूँ और बाहर निकलता हूँ।
0,थोड़ा संगीत सुनकर .. मेरे ड्राइविंग टेस्ट थ्योरी का अध्ययन करना ठीक नहीं चल रहा है ..
1,"उपयोगकर्ता अच्छा, किसी भी BRW जंगलों का दौरा करने के लिए यह देखने के लिए कि उन छोटे नए पेड़ कैसे साथ आ रहे हैं?"
0,TweetWorld से कटौती महसूस कर रहा था..क्या आज मेरे फोन के लिए एक भी ट्वीट नहीं था
1,उपयोगकर्ता thanx।
0,"उपयोगकर्ता * huggles * मैं सभी उत्तरों को तुरंत नहीं देखता, और मेरा बॉस आज मंडरा रहा है। और मैं जीवन के बारे में पेशाब महसूस कर रहा हूं"
1,अब तक की सबसे बड़ी लड़की के साथ एक अद्भुत दोपहर से वापस आओ!
0,"ईरानी क्रांति आत्मसमर्पण करती है मुसावी चाहते हैं कि शासन के साथ बातचीत करें। यह शर्म की बात है, क्या यह सच है?"
0,कुछ भी नहीं मुझे मुस्कुरा सकता है
1,उपयोगकर्ता k मैं बस ले जाऊँगा यात्रा ahh इंतजार नहीं कर सकता !!
0,"उपयोगकर्ता आह, बहुत दूर है तो वास्तव में अच्छा लग रहा है।"
0,मेरी छुट्टी खत्म हो गई
1,उपयोगकर्ता मैं उन लोगों से प्यार करता था।
1,"उपयोगकर्ता और शो के अंत में वह नीचे आया और हमारे हाथों को पकड़ लिया और हाय कहा। वह शो सबसे अच्छा था, SSSC, NIN, JA = EPIC!"
0,यहां तक ​​कि एक नशीली दवाओं के लिए एक अंतिम संस्कार दुखद है
0,अगली सर्वश्रेष्ठ फिल्म को देखकर हैंगओवर बेचा जाता है!
0,वाह मैं लय में चूसना स्वर्ग।
1,बोरियत थोड़े बेकार है ओह अच्छी तरह से कम से कम यह एक ठीक दिन है
1,"जस्ट ऑर्डर: द न्यू जेमी टी ईपी, नूह और व्हेल का एल्बम। शायद बीबीसी के एल्बम को भी प्री-ऑर्डर करें। आप अपने आप को व्यवहार करेंगे"
1,इस मजेदार फिल्म URL की जाँच करें
