0,"Usher हाँ, मैं जा रहा हूँ मैं अभी अभी तक COMP पर नहीं गया है और अगर कोई धब्बे नहीं बचा है"
1,उपयोगकर्ता शायद मैं इस गर्मी और फिर कुछ बैकपैकिंग करते समय पूरी बोतल का उपयोग कर लूंगा
1,शनिवार उपयोगकर्ता और उपयोगकर्ता का पालन करें
0,"Im अकेला मुझे कंपनी रखो! 22 महिला, रिचमंड - वर्जीनिया"
0,एक दुष्ट भयानक ऐंठन है
0,"थिन लिजी अगले सप्ताह एसी/डीसी का समर्थन करने से बाहर निकलते हैं, चोट के कारण, मुझे एक दुखी है"
0,"मेरे पिता, यूरग के साथ ब्रिस्टल के लिए बाहर जाने के बारे में। खुले दिन के लिए आगे देख रहे हैं, यह सिर्फ मेरे पिताजी हैं"
1,उपयोगकर्ता इसे सुनने के लिए बहुत उत्साहित है। मै तुम्हारा बड़ा प्रशंसक हूँ।
1,कृपया हमें 50 अनुयायियों को प्राप्त करने में मदद करें!
1,", उपयोगकर्ता मुझे जिम की आवश्यकता नहीं है: ओ मुझे उसके लिए एक पूल मिला है"
1,लक्ष्य!!! 4 स्मिथ
1,"मुझे भी उपयोगकर्ता, लड़की ... आज जिम में शामिल हो रहा है! गोना बेहतर खाने की कोशिश करता है, लेकिन अभी के लिए, प्रति सप्ताह 3-4 वर्कआउट करता है oguta मदद!"
0,उपयोगकर्ता को पसंद नहीं है J Joggermeister इसके बजाय कॉफी से चिपकेगा!
1,उपयोगकर्ता मैं अपनी पसंद के एक चैरिटी के लिए पैसे (of पाउंड अच्छा है) का दान/टूर ऑफ़ द बोन्स खरीदने के लिए दान करूँगा। लंबा शॉट ... नहीं?
0,"आज मिया होने के लिए खेद है, काक में काम पर इसलिए कुछ समय के लिए कोई ट्वीट नहीं करना"
0,इस हफ्ते मौरिज़ को याद किया।
1,एशले बर्लिन में था मैं वहाँ था ... एशले बहुत अद्भुत है <3
1,उपयोगकर्ता मैं आपको हर रोज गले लगाऊंगा अगर यह आपको बेहतर महसूस कराता है! आप मेरे लिए सब कुछ हैं! एक अद्भुत दोस्त और विश्वासपात्र।  मुझे तुमसे प्यार है!
1,एक महान दिन @ rbc के रूप में अच्छी तरह से। मैं इस ए.एम. में नर्सरी में था - बहुत रोमांचक।  मेरे पति ने आज रात प्रचार किया और भगवान ने वास्तव में संदेश का इस्तेमाल किया।
0,वाह मैं बहुत भूखा हूँ! मेरे पास मेरा प्रोटीन पाउडर शेक नहीं था जो मेरे पास हर सुबह है .. im भूखा ..
0,सब कुछ गले में है। मैं बीमार हूं
0,उपयोगकर्ता मेरी मदद करो !! मैं वोट मदद मदद मदद मदद मदद मदद मदद मदद
1,मुझे जन्मदिन की शुभकामनाएं आखिरकार आज 15
0,"उपयोगकर्ता हाहा, शानदार, जो मुझे बहुत बेहतर महसूस कराता है! आज * कहीं भी * नहीं मिल रहा है"
1,फैक्ट-गॉड डोंट गलतियाँ गुडनाइट अमेरिका और गॉड ब्लेस यू
0,"उपयोगकर्ता फ़ायरफ़ॉक्स 2, कोई विचार नहीं कि यह फ्लैश का कौन सा संस्करण है। मैं यह पता लगाने की कोशिश करूंगा लेकिन एफएफ सिर्फ दुर्घटनाग्रस्त हो गया।"
1,"उपयोगकर्ता क्षमा करें, आपके सामने एक व्यक्ति मैं बहुत जल्द नहीं कर रहा हूँ ... अपनी आँखें छील कर रखो"
1,ऊपर और एम पर। आज सिटीप्लेस में डब्ल्यू/फ्रेंड्स हैंगिंग
1,"आँकड़े आज बहुत उबाऊ हैं ... मैं मुश्किल से जाग सकता हूं ... मैं सिर्फ अपना बिस्तर, कुछ पॉपकॉर्न और एक अच्छी फिल्म चाहता हूं !!!"
0,उपयोगकर्ता ओह नो हनी पू
1,उपयोगकर्ता हाय केली! मैं आपको बताना चाहता हूं कि मैं आपको सप्ताहांत के दृश्य पर देखने का आनंद लेता हूं। मैं आपके ट्वीट्स का आनंद लेता हूं। वे मनोरंजक हैं!
0,अब बिस्तर पर जाना .. मेरे सप्ताहांत जल्दी जागना होगा मान लीजिए कि सोने के लिए .....
0,मुझे अपने प्यारे प्रेमी की याद आती है।
1,"इसी तरह की भावनाओं के साथ आज सभी ट्वीट्स के उपयोगकर्ता, आपका अब तक मेरा पसंदीदा था ... सीधे आगे और विनम्र"
0,"उपयोगकर्ता और सैंटियागो, चिली कब ??"
1,उपयोगकर्ता ë ë ..
0,वॉचिन मणि अपने प्लेपेन में मुझे याद दिलाता है जब मैं छोटा था।  इतना निर्दोष और अनजाने।
1,उपयोगकर्ता धन्यवाद एक गुच्छा और टन अपने दिन का आनंद लें!
1,उपयोगकर्ता मुझे लगा कि यह आराम के रूप में ठीक से स्वरूपित होगा; लेकिन यह नवीनतम रिलीज (v0.1.1) में तय है
1,"दोपहर के भोजन के बाद अपनी कला परीक्षा में काम करना शुरू करने जा रहा है। अगर मैं जल्दी से खत्म कर दूं, तो मैं कुछ और करूंगा जो रचनात्मक हो।"
0,सभी को याद करने जा रहा है
1,उपयोगकर्ता बधाई ... यह अच्छी खबर है कि हमारी पुस्तक की बिक्री बढ़ाने में मदद करने के लिए हमारी पुस्तक बज़र विजेट की कोशिश करें। www.freado.com
1,समय में कुछ प्यारे नए टक्कर कपड़े मिले हैं और आराम के अलावा कल कुछ नहीं करने जा रहे हैं
1,उपयोगकर्ता आप मेरे साथ सर्द आ सकते हैं लड़की!
1,इस्तेमाल किया गोल्फ एक अद्भुत सुबह है जो आज दोपहर आपको देखने के लिए इंतजार नहीं कर सकता है!
1,खुशी है कि जेड अपने पैरों पर वापस आ गया है और फिर से भारी उठाने का काम कर सकता है
1,उपयोगकर्ता AWWW बधाई!
0,"मैंने महसूस किया है कि मैं वास्तव में, वास्तव में उपयोगकर्ता के पास जाना चाहता हूं और मेरे पास टिकट खरीदने का कोई तरीका नहीं है।"
0,"उपयोगकर्ता lol जो एक स्टूडियो फोटो था, दुर्भाग्य से मेरे पास बाल नहीं हैं और लोग स्टैंड पर लोग बनाते हैं"
1,"उपयोगकर्ता लानत है .. आप घर जा रहे हैं और मैं वहाँ नहीं जा रहा हूँ .. हे .. लेकिन, tonite ya पर है !!"
0,"उपयोगकर्ता नहीं अन्यथा आईडी ने पहले से ही अपने लिए काम करना शुरू कर दिया है;) चुभन ने मेरे आईसीयू दौर को चुरा लिया, जबकि मैं बाथरूम में था!"
0,मेरे माता -पिता का घर मुझे छींक देता रहता है
0,उपयोगकर्ता यहाँ मौसम इतना बुरा है कि बारिश होती है
1,उपयोगकर्ता im JB चैट के बारे में अपनी बात कर रहा है
1,"आज बहुत अच्छा दिन था! जुड़वा बच्चों के साथ बाहर लटका दिया, डायलन और कैटरीना के साथ बाहर लटका दिया, और अब मैं विलिस से बात कर रहा हूँ!"
0,उपयोगकर्ता
1,उपयोगकर्ता विम्पोल हॉल प्यारा है
1,उपयोगकर्ता तुम मुझे मिल गया!
1,आज मेरे कुछ पसंदीदा के साथ इतना मज़ा।  बहुत थक गया हूं।   Tasti d और कुछ MTV मूवी अवार्ड्स
1,"""ट्रू ब्लड"" देख रहे हैं ..."
0,"बस जाग गया और महसूस किया कि मैं उपयोगकर्ता के साथ फोन पर सो गया, मैं बिल्कुल थक गया हूँ! डीसी उज्ज्वल और सुबह जल्दी छोड़कर"
0,"""कंप्यूटर!? Aw, मुझे लगा कि यह कैंडी है!"" हाहा एरिकस प्रतिक्रिया उस नए डेल वाणिज्यिक को देखने के बाद। मुझे लगा कि यह कैंडी भी है"
1,उपयोगकर्ता ने मेरे लिए भी एक ऑर्डर किया?
0,बहुत खूब। लगता है कि कौन सिंगल है ...?
1,उपयोगकर्ता पौधों के बारे में क्या?
1,उपयोगकर्ता याय !!! मस्ती करो
0,उपयोगकर्ता जो जानता है ... अब स्कूल जाने के लिए भी बहुत जोखिम भरा है। एएमएफ!
0,उपयोगकर्ता अमांडा में स्वाइन फ्लू है? : हे तुम गंभीर हो?
1,बस स्नातक
1,सो नहीं सकते। लेकिन मेरे पास अब पुरुषों की शैलियों का एक अच्छा कोलाज है
0,उपयोगकर्ता अच्छी तरह से यह आधी रात है और मैंने काम पर अपना पहला दिन वापस समाप्त कर दिया है * yawn * long 17hour दिन
1,सोचता है कि टिम एक किंवदंती है
1,क्या आपको कभी माइक डेक्सटर खेलने का पछतावा था? आप और सुश्री गर्थ प्यार में कैसे पड़ गए?
1,उपयोगकर्ता अपनी फ्रीलांस प्रक्रियाओं को व्यवस्थित और स्वचालित करने के लिए URL पर विचार करें?
1,उपयोगकर्ता गंभीरता से उर नाम से प्यार करता है। यह बहुत एसजी है। ^^ और यूप मैं बैन और मर्सर में ऑनलाइन मार्केटिंग कर रहा हूं (www.bainmercer.com)
0,"यू के लिए उपयोगकर्ता yay अभी भी जीवित है। गरीब दोस्त 10 मिमी पर गिर गया और उसके घुटने को चोट पहुंचाई, कुछ मील की दूरी पर संघर्ष किया, लेकिन 2 ड्रॉप आउट हुए।"
0,ईक ने बस बंद होने का कारण देखा .... बाड़ के माध्यम से और पोल के खिलाफ पूरी तरह से ट्रैश किया गया।
0,URL - जैस्पर मैट लोल की तलाश में है ... लेकिन वह कहीं नहीं मिला है!
0,आज रात स्लीप्य
0,"Def ने मेरे लैपटॉप को अभी एक आउटलेट में प्लग करने के लिए डरते हैं ... इस मग को बस मुझ पर मरना पड़ सकता है, मैं अभी भी <3 थंडरस्टॉर्म्स"
1,"उपयोगकर्ता उस लिंक को मुझे एक सबक में ले गया, कोई सस्ता नहीं"
1,अब पुचोंग में
1,फ्रेंच टोस्ट मेरा पसंदीदा भोजन बन गया है? अहा
0,"जब मैंने वहां काम करना शुरू किया, तब से कल घर बीमार हो गया। आज बेहतर लग रहा है लेकिन फिर भी चक्कर आ रहा है"
0,"2 उदास .. मैं शुरू कर रहा हूँ 2 यह सब एक बड़ी गलती थी, इसका सबसे बुरा हिस्सा यह है कि मैं इसमें 2 में हूं जो यह नहीं जानता कि कैसे 2 बाहर निकलते हैं"
1,उपयोगकर्ता हाय रोस आज आपके कॉलम का आनंद लिया! लेकिन मैं हमेशा करता हूं
1,मैं इस वेकअप को एक सुबह दो बार पसंद कर रहा हूं
0,"फ़ायरफ़ॉक्स 3.5 का भयानक बार ठीक से काम नहीं करता है। यह मेरे बुकमार्क के माध्यम से नहीं दिखता है, भले ही मेरे पास ऐसा करने के लिए सेट हो।"
0,"मेरे पसंदीदा रेस्तरां में सादे नूडल्स, यम !! Nawt! यार, मुझे इस आहार से नफरत है"
0,उपयोगकर्ता im nl में वापस
1,"उपयोगकर्ता vislabä? Kä? ir jolkina - izskatä? s, ka viå a vipä? r nesaprot, kur atrodas .. धन्यवाद भगवान, ka man nav jä? balso rä «gä? .."
1,बहुत खूब।  एक और सुबह धूप।  मैं इसके आदी हो सकता था।
1,"उपयोगकर्ता हाहा वास्तव में? यह बहुत बढ़िया है, मैं बहुत सम्मानित हूं।  मुझे लगता है कि वास्तव में मुझे इस खूनी यातायात के अगले घंटे तक ले जा सकता है।"
0,उपयोगकर्ता मुझे लगा कि छोड़ दिया है।   ।
1,उपयोगकर्ता ठीक है तो ट्वीट करना यू लगता है कि चिकित्सा lmao betta लीव यू अकेले एक gr8 दिन/रात के गले और प्यार भेजा उर रास्ता xxxxxxxxxxx
1,"उपयोगकर्ता मैं वहाँ हूँ, हुन। अगर हम किसी भी तरह से योगदान करने में मदद कर सकते हैं, तो हमें बताएं"
0,Panera AM 2 फाइनल में मेरे आँकड़े के लिए अध्ययन कर रहे हैं!
0,"उपयोगकर्ता मैं आपको नहीं बता सकता, यह एक सुरक्षा बात है लेकिन आप किन चीजों को चाहते हैं? कपड़े, जूते, गहने, खिलौने? मैं एमएसएन अगले बंदरगाह पर रहूंगा"
0,"awww..oh अच्छा, अगली बार .."
1,"उपयोगकर्ता ने मेरी रात को कल रात बेब बना दिया!  मैं यात्रा करने के लिए घर वापस आऊंगा, और अगली बार लंबे समय तक"
1,"उपयोगकर्ता गंभीरता से, कुछ मुझे बताता है कि यू अभी भी एक बिंकी है। असली के लिए"
0,उपयोगकर्ता मुझे पता है! कॉन्डोस कोई अच्छा नहीं है 4 हॉट टब फिर से एक घर में 2 बी वापस इंतजार नहीं कर सकते हैं ... बस अपने आप को बताते रहें कि यह अस्थायी है!
1,मुझे फेसबुक मिला। यह अजीब है। ट्विटर थोड़े इस पर नियम
0,"जाहिरा तौर पर, एमएम की कॉमेडी रोडशो वास्तव में अपोलो में लाइव का एक रीब्रांडिंग है: ओ फ्यूचर ईपी कॉमेडियन लाइन-अप को देखा ... अच्छा नहीं ..."
0,पूल डब्ल्यू टायलर द्वारा। काश सूरज निकलता
0,"कल प्रीस्कूल से बेटी ""स्नातक""। इतना प्यारा और दुखी जब सभी बच्चों को एक दूसरे को अलविदा कहना पड़ा"
0,"उपयोगकर्ता कृपया ""बारिश की देरी"" शब्द न कहें।"
0,इसलिए मेरा जन्मदिन शुक्रवार को है और अभी भी कोई योजना नहीं है
1,उपयोगकर्ता आप जानते हैं क्या? जब मैं ऑस्टिन में आता हूं तो खाद्य नेटवर्क से भोजन करें! यह बहुत अच्छा सामान होना चाहिए!
0,उपयोगकर्ता जो दुखद है।  तुम्हारी याद आएगी!
1,उपयोगकर्ता मैं सांता बारबरा प्यार करता हूँ! वास्तव में उपयोगकर्ता की अगली ब्लैक टाई चैरिटी इवेंट सांता बारबरा में 15 अगस्त को है!
0,उपयोगकर्ता इस पर भरोसा नहीं करते हैं
1,एरिन मिल्स टाउन सेंटर में रोजर्स में। आइए आशा करते हैं कि यह शामिल होने लायक एक क्रांति है।
1,मैं movin सामान कर रहा हूँ। ट्रक को गिरा दिया। टफ वीकेंड बाउट टू एंड टू एंड। अब गेंदबाजी करने का समय।
1,उपयोगकर्ता हैप्पी स्वीट 16 वें जन्मदिन मिरांडा! एक भयानक दिन है!
0,"उपयोगकर्ता *txt *ठीक है, इस तथ्य के अलावा कि अनुदान कल गायब हो गया"
0,उपयोगकर्ता hah तो आपके युवा नेता बहुत भयानक लगता है कि आप हाल ही में कैसे हैं? हमने कुछ समय के लिए फेसबुक पर बात की
1,"उन्होंने धीमी गति से कहा, लेकिन लगता है कि थोड़ा उठ गया है"
0,अरे बाप रे। हैलो नरक ! अलविदा तनाव-मुक्त दिन!  ज़ोर-ज़ोर से हंसना।
0,"क्या रात थी। मैं अच्छा आदमी बनने की कोशिश करता हूं और शांत रहता हूं, और नशे में लड़कियों के कारण अपनी मंजिल पर सोता हूं।"
0,मैंने उसे धोखा देते हुए पकड़ा..ह्म्म्म url
1,"उपयोगकर्ता हाय, मैंने आपके ब्लॉग पर टिप्पणियां छोड़ दी"
0,मेरे हबी प्यार को याद करना
0,मेरा बैंक खाता हैक कर लिया गया और लोगों ने पागल पैसे लिया .... निराशाजनक
1,उपयोगकर्ता hehe मुझे पता है! लुका अब तक का सबसे अच्छा दोस्त है!
1,हिचकॉक के द मैन को देखना जो बहुत ज्यादा डब्ल्यू/ परिवार को जानता था। बहुत बढ़िया फिल्म
0,"मैं अपने विचारों के साथ अकेला नहीं हो सकता, वे मुझे और इसके बहुत परेशान कर रहे हैं!"
0,मैन यूनाइटेड के नुकसान पर गहराई से परेशान है
0,ग्रह पर सर्वश्रेष्ठ 8 वीं कक्षा के नेताओं के साथ वाशिंगटन में अपने अंतिम दिन बिताना।  खिड़की बंद। धुनें क्रैंक हो गईं।
