0,"उपयोगकर्ता लेकिन मैं अब नशे में नहीं हूँ! मुझे कल रात इसकी आवश्यकता थी, मैं थोड़ा हताश हो रहा था मुझे लगता है"
1,"उपयोगकर्ता हे, सुधार के लिए धन्यवाद!"
1,खिचड़ी भाषा आज रात खेलने के लिए इंतजार करती है और अंत में एक पेय है
1,आज जो हुआ उसकी कोई स्मृति नहीं है
0,उपयोगकर्ता उपयोगकर्ता मुझे लगता है कि मुझे जल्द ही उन्हें फिर से कॉल करना होगा। Chr में काम नहीं करता है। हवलदार।
0,कल फिर से स्कूल
1,उपयोगकर्ता यह एक अच्छा है! निश्चित रूप से एक बड़ा क्षण
0,थोड़े ने कहा कि उस आदमी ने मुझे कभी भी उस के बारे में वापस ईमेल नहीं किया जो उसने बिक्री के लिए सूचीबद्ध जीप को देखा है
0,URL - मुझे इन लड़कियों की याद आती है
0,क्यों उन्होंने उल्लेख नहीं किया कि भूत 1030 के बजाय 10 पर प्रसारित होगा ... मूल रूप से मैं इसके पहले आधे घंटे से चूक गया।
1,अंत में मेरे 4 वें सीज़न को फिर से अच्छी तरह से वापस पाने के लिए जा रहा है ... एक नया सेट कम से कम
1,मैं आज सुबह न्यू मिल्ड्रेड एल टेरी लाइब्रेरी पर एक कहानी कर रहा हूं।  यह आज शीर्ष पायदान तकनीक के साथ खुलता है।  WTVM सुबह देखो।
0,मेरे कंप्यूटर ने कल Apple स्टोर पर हेडिंग कर दी।
0,मुझे उसकी याद आती है और काश वह अभी स्कूल में नहीं होता! Cuz मैं छोड़ने से पहले उसके साथ जितना समय बिताना चाहता हूं
0,मुझे अच्छा नहीं लगता ... फिर से। Fml।
0,FML 11:11 से चूक गया मैं एक रोल पर था
1,कल रात उपयोगकर्ता अच्छी पोशाक पसंद ... मुझे विश्वास नहीं हो रहा है कि लड़की ने अपनी भौंहों को मुंडा दिया। ज़ोर-ज़ोर से हंसना
1,"जब मैं एक छोटी लड़की थी, तो मुझे बर्फ़ीला तूफ़ान के माध्यम से प्राप्त करने के लिए धन्यवाद टेट्रिस, धन्यवाद"
1,उपयोगकर्ता अच्छा!  क्या मैं आपको मैन्सफील्ड में बैकस्टेज से मिल सकता हूं?  Pleeease!
0,मेरे जीवन का सबसे बड़ा सिरदर्द मेरे बिस्तर में लेट गया।
1,उपयोगकर्ता आओ! सच्चाई में कोई समस्या नहीं है मेरे लिए आप बहुत अपडेट हैं! मैं आपको समझने के लिए अंग्रेजी सीखूंगा!
1,उपयोगकर्ता को अब कुछ बेहतर मिला।
0,"उस और इटली के भूकंप के बीच उपयोगकर्ता, यह एक बहुत ही दुखद समाचार दिवस रहा है।"
0,"उपयोगकर्ता मैं जाना पसंद करूंगा, लेकिन उस दिन अन्य योजनाएं हैं"
1,"im नींद .. ""ब्लैक पार्टी"" के लिए आगे देख रहा हूँ मैं एक काले रंग के गुंडे टूटू के बारे में सोच रहा हूँ .. क्या प्यारा होगा?"
1,"उपयोगकर्ता हाँ! नई हिल्सोंग सीडी मेरे कमरे, लिविंग रूम और कार में दोहरा रही है!  हाहा"
1,"उपयोगकर्ता हाय चेरिल, आशा है ठीक है?  XX"
1,तो आज रात जीतने के लिए ब्लूज़ के लिए तैयार है
1,बफ़ेलो में खरीदारी
1,"उपयोगकर्ता योग्य - आप मेरे पति की तरह ही आवाज करते हैं ... 'वह घर है, इसलिए मुझे पता है कि आप उसे नहीं हैं"
1,बस एक नया बिस्तर सेट मिला
1,उपयोगकर्ता मीठा! मैं उत्साहित हूं!
1,उपयोगकर्ता aww धन्यवाद!
1,आज रात को MA d000dz textttt के साथ दिखाओ
0,"उपयोगकर्ता अच्छा!  यह मुझे याद दिलाता है, एक और कैमरा प्राप्त करना है - खोया मेरा @ मेकर फेयर"
1,उपयोगकर्ता बहुत प्यारा! उन्हें मेरा प्यार भेजें।
0,"मेरे पैर आर तो दर्द; थका हुआ bak 4rm wrk! आह वेल जूस ने मेरा नया आइपॉड डॉकिन स्टेशन सेट किया, और अपलोडिन सम गाने on2my नई कराओके मशीन - याय!"
1,उपयोगकर्ता हे बियांका। अहम हाहा। मैं तुम्हें देख सकता हूँ! हाहा लोल
0,मैं एक गोरा क्षण है !! मदद करना!
0,कड़ी मेहनत करना चाहता है ताकि चोट लग जाए।
0,मेरे दोपहर के भोजन की याद आती है ...
1,"उपयोगकर्ता यू पता है कि पीपीएल कुछ भी नहीं कहेगा अगर हां, शीर्ष पर होगा, और एक मजाक प्रशंसा का एक रूप है। हां मैं रॉकिन हैं 'यह !!  इसे जारी रखो!"
1,"मैं सिर्फ इसे किक करता हूं। आज करने के लिए बहुत कुछ नहीं है, लेकिन हे, मैं जीवित हूँ!  मजेदार रात कल रात। मुझे कैटी की याद आती है! वापस आओ! सैन फ्रान बहुत दूर है!):"
1,उपयोगकर्ता haha ​​आप भी Mattcheeew प्यार करते हैं
1,"उपयोगकर्ता nope, मैंने नहीं किया। अपने ब्लॉग या YouTube में सुनिश्चित करने के लिए, है ना?"
0,"उपयोगकर्ता यह व्यवसाय है, हालांकि ... मेरे पास जाने के लिए एक बयान है।"
0,गर्मी है। और मैं वास्तव में अध्ययन नहीं करना चाहता
0,बहुत तनाव के साथ ... || के माध्यम से
0,कोई मुझे जवाब क्यों नहीं दे रहा है?  मुझे ऊबन हो चुकी है। करने की कृपा करे।
1,फ्लाइट #1 टू एच-टाउन ..... मैं कैली से कैली के लिए वापस जा रहा हूं .... लोल !!!
1,उपयोगकर्ता उपयोगकर्ता उपयोगकर्ता हर दिन? आप सभी? क्या समर्पण
0,उपयोगकर्ता उपयोगकर्ता एक महामारी लगता है।
0,ऊपर और उस पर। वर्जीनिया जाने के लिए पैक और कपड़े पहने समय। इस बार हम अपने बच्चे को पीछे छोड़ रहे हैं।
1,"घूर रहा है, मेरा मतलब है कि अब ट्विटर पर 'टैप' टैप्स .."
1,उपयोगकर्ता मुझे यह नहीं पता है!
0,यह दुनिया क्या आ रही है? लाइन @ mcdonalds शहर के किसी भी महान स्थानीय रेस्तरां की तुलना में अधिक है
1,"इसकी थोड़े अजीब बात है कि कैसे कुछ लोग आपके मूड को पूरी तरह से बदल सकते हैं। आज स्कूल। कला। वूप वूप,"
0,मेरे कुत्ते को देखकर! ऐसी दुखद फिल्म
1,एक सुंदर बैठा सुबह कैलिफोर्निया तट के साथ मेरी तरफ से एक कर्कश पिल्ला के साथ चलती है।    URL - फिर ब्रंच w/ एक गैलपल
0,"[ब्रैडी गुच्छा Â बदलने के लिए समय] आवाज, मैं आपको याद करता हूं।  Â «url"
0,काम के दौरान freaken ऊब और गर्म मैं गर्मियों में haaaaate यह मुझे इतना क्रोधी बनाता है!
0,"जल्द ही बिस्तर पर जाने की जरूरत है, सबसे अच्छे दोस्त IRL के साथ कल इंडियाना बिजनेस कॉलेज जाने के लिए और अधिक लेखन नहीं किया गया।"
1,SGA फिर से।  यह मेरे शनिवार और रविवार को बहुत अच्छा शुरू करता है!
1,उपयोगकर्ता यह तभी दर्द होता है जब आप लोल हंसते हैं
1,"ठीक है, मुझे लगता है कि यह कुछ नींद पाने का समय है ... शुभरात्रि!"
0,प्रशिक्षु के बारे में मुझसे बात मत करो! जब तक मैं इसे कल देख सकता हूं
1,उपयोगकर्ता। और तुम हमेशा मेरे पास रहोगे
1,उपयोगकर्ता आप शायद उबाऊ नहीं से अधिक ऊब गए हैं?
0,कभी नहीं मिला ihop जो आज कुछ करना चाहता है?
0,दिन के लिए नींद की रेटिंग आज 8 से 10 है।
0,बस कार्यालय छोड़ दिया।   हमें काम क्यों करना है? ज़ोर-ज़ोर से हंसना
0,एक और मोंटिनी सत्र के लिए तैयार हो रही है ..* आहें* मेरे पास एक परीक्षण है और मैंने अध्ययन नहीं किया..ओह गीज़
0,मेरी गोधूलि डीवीडी को प्यार करना; वास्तव में 2 गो 2 ब्रिटनी कॉन्सर्ट चाहता है।  x o x o
0,कोलोराडो में yaaaay im! इसके soooo डार्क आउट थो। और मैं खिचड़ी भाषा स्लीप cuzz pplz टॉकिन रखो। मेरे पास लगभग 2 घंटे की नींद है
1,उपयोगकर्ता हिया!  Hubbys महान हैं वे 2 दिनों के लिए ईमेल की जाँच नहीं कर रहे हैं।  मैं आज दोपहर को करूंगा और मैं आपको जवाब दूंगा।
0,"उपयोगकर्ता मेरे भाई एक शानदार मालिश/मायोथेरेपिस्ट (यह मांसपेशी चिकित्सा है) और उसके द्वारा पीपीएल की कसम है, लेकिन वह यहां तट पर है"
1,"सोने के लिए ड्रग होने के बाद ऊपर है। Nyquil का नाम बदलकर ""एक बोतल में जादू"" कर दिया गया है। हां हां! यार मैं प्यारा सो गया"
1,"काम ... फिर भी, जर्सी कल!"
0,उपयोगकर्ता asif जब मैं 4 एक तस्वीर yday से पूछा था कि उसके साथ दोस्त ने कहा नहीं
0,Lmao Cootie Cavs पर नफरत कर रहा था .... मुझे लगता है कि वे क्यों खो गए
0,"मैंने मकड़ी को पकड़ा, जो मैंने अपने fckn hott yo को पकड़ा है!"
1,दा नया डीजे कूल है मैं jst hd उनके साथ मालदीवियन द्वीप के बारे में एक संक्षिप्त बातचीत और 15b काश मैं hd उपयोगकर्ता सलाह ले गया और 15b lst nite पर गया
1,उपयोगकर्ता के लिए मुझे सिफारिश करने के लिए उपयोगकर्ता धन्यवाद।
0,"उपयोगकर्ता कूल .. मैं आज पूरे जोधपुर पर भटक रहा था, लेकिन एनटी को उसके रूप में एक उपहार मिल सकता है .. उपयोगकर्ता .. उपयोगकर्ता"
0,और तुम्हारी याद आती है। हमेशा।
1,उपयोगकर्ता हाहा। यह इतना भयानक है कि आप इसे भी प्यार करते हैं! पुस्तक शुद्ध प्रतिभा -एस है
0,मैं एक गीत लिखने के बारे में सोच रहा हूं। खैर सिर्फ गीत। मैं शायद बम हालांकि बम
1,उपयोगकर्ता महान विचार! मुझे लगता है कि आपको बाल्टीमोर में इस विचार का परीक्षण करना चाहिए।
0,जाहिरा तौर पर .. मेरी नींद का कार्यक्रम इतना गड़बड़ है कि 4 बजे मैं अभी भी व्यापक जाग रहा हूं और मेरे पास एक अलार्म है जो मेरे बगल में 5 घंटे में जा रहा है FML
0,"इस खूबसूरत रविवार को अंदर रह रहा है, मेरे पैर @ मरीना को गड़बड़ कर दिया।  खिचड़ी भाषा।  कुल अंगूठे नीचे।"
1,"उपयोगकर्ता मैं हूं, यही कारण है कि मैं अभी अपग्रेड कर रहा हूं। मेरे पास 20% की छूट है।"
0,मेरे काम करने के रास्ते पर। हर कोई midsommar मना रहा है लेकिन मुझे।
1,उपयोगकर्ता sooo soooo सच !!! लेकिन अब के लिए अच्छा है
1,आज मेरी पत्नी के साथ एक अद्भुत तारीख थी। हमारे सप्ताहांत की व्यवस्था करने के लिए भगवान का धन्यवाद ताकि हम एक साथ कुछ गुणवत्ता समय दे सकें।
0,फ्रिट्ज पर मेरे ब्लैकबेरी ...।
1,उपयोगकर्ता खुश है क्योंकि स्कूल जल्द ही खत्म हो गया है? गर्मी!!!!!!!
0,उपयोगकर्ता अच्छी तरह से ... वे सभी पॉज़र्स हैं .... मुझे लगता है ...।
1,प्रोफ़ाइल मूल्य में उस वृद्धि के साथ जाने के लिए उपयोगकर्ता का तरीका मुझे गुदगुदी करता है
1,यार बस एक बम झपकी से 6 घंटे बाद जाग गया
0,"लगभग दो सप्ताह से कम समय में मैं जकार्ता वापस आ रहा हूं। कोई माँ नहीं, मैं वास्तव में जकार्ता नहीं चाहता, मुझे घर चाहिए"
0,"उपयोगकर्ता सैट नाइट्स बिक्री के लिए चूसना, आमतौर पर ... मेरे लिए वैसे भी"
0,हाल के हफ्तों में रॉयल्स भयानक खेल का मेरे समर फन इंडेक्स पर गहरा नकारात्मक प्रभाव पड़ा है
0,क्या यह डिजाइन क्षेत्र में लोगों को नाराज करता है जब लोग आपके काम के संस्करण बनाते हैं? यह वास्तव में मुझे पेशाब करता है
0,उपयोगकर्ता मुझे आशा है कि आपका सिरदर्द बेहतर हो जाएगा !!!!  मुझे नफरत है जब मेरे पास स्कूल में सिरदर्द होता है!
1,उपयोगकर्ता यह बहुत अच्छा है। मेरी फेव फिल्मों में से एक। एंथोनी हेड इसमें शानदार है।
0,"कितना महान है ??  NJ Meeeeee में पागल है। ): मुझे क्षमा करें, मुझे क्षमा करें, मुझे क्षमा करें !!!!"
0,हम्म ¦ मैं अभी भी नहीं खाया है
0,उपयोगकर्ता: आह्ह्ह्ह !!! हाहा !!! मुझे लगा कि मैं उस दिन मरने वाला हूं। मैं मजाक भी नहीं कर रहा हूँ। मुझे इसकी बहुत याद आती है
1,उपयोगकर्ता मैं हमेशा एक व्यस्त ट्वीटर हूँ! क्या आपने देखा है कि मैंने कितने अपडेट किए हैं ?? आपको माइस्पाज़ पर मिला
0,"उपयोगकर्ता पूरी तरह से !। मैं तैयार हूं। Im तो तैयार है। उह हाँ, अच्छे सपने। लेकिन आज तुम्हारे बिना यहाँ, मैं पूरे दिन सोता रहा ।।"
1,"उपयोगकर्ता मेरे fav उद्धरण में से एक: अच्छा होने से संतुष्ट होना; उत्कृष्टता से इनकार करने का मतलब है। 4 मेरी कमजोर अंग्रेजी, लेकिन आप बिंदु प्राप्त करते हैं"
1,बेड यो लोल ग्नट
0,हमेशा इस कार्य के साथ व्यस्त हैं..अर्गीफह्ह्ह्ह्ह्ह्ह्ह्ह्ह्ह्ह्ह
1,"उपयोगकर्ता नहीं, टी हालांकि है। मैं उसके कैमरा गियर को sclepping करूँगा"
1,अभी बहुत खुश लग रहा है .. लगता है जैसे मेरी इच्छाओं के लगभग सभी सच हो रहे हैं!
1,उपयोगकर्ता धन्यवाद बेब!
1,मैंने जेटब्लू में अपने अनुभव को तेज करने के लिए एक बहुत ही रचनात्मक काम किया ... हालांकि मेरे टखने में थोड़ा चोट लगती है ...।
1,अपने आप को कुछ अच्छा जोर से bassy सामान मिला है जो यादृच्छिक सुनहरे पुराने पुराने का उल्लेख नहीं करता है!
1,हैप्पी नेशनल स्क्रैपबुकिंग डे!   अगले सप्ताहांत के लिए अपनी माँ को कुछ खास बनाने के लिए आज समय निकालें।
0,चिकनपॉक्स आज भी बदतर
0,"Url - उह, क्या बकवास बकवास! मेरे लूप की बात क्या हुई? मैं अब तक का सबसे खराब स्वामी हूँ!"
1,"उपयोगकर्ता उपयोगकर्ता .... एक उज्जवल नोट पर मुझे आखिरकार लौंग के साथ एक सीजी स्टोर मिला ... वेनिला नहीं, लेकिन यह एक शुरुआत है"
0,"मैंने अपने पैर को किसी तरह बुरी तरह से क्षतिग्रस्त कर दिया। जब तक मेरे लिए आज रात कुछ भी नहीं है, तब तक एक एक्स-रे नहीं मिल सकता है, लेकिन घर पर शाकाहारी। उघ।"
1,उपयोगकर्ता im अच्छा ... hangin 'वहाँ पूछने के लिए धन्यवाद ... आप' मुझे भूखा थियो 'बना रहे हैं ... धन्यवाद ... हाहा ...
1,"अगले बाइट में हाथ के लिए धन्यवाद उपयोगकर्ता आज बधाई हो, ऐसा लगता है कि सब कुछ आखिरकार एक साथ आ रहा है!"
0,awww काम करने के लिए जाना मुझे आशा है कि आप सभी को पार्टी में बहुत अच्छा समय है! मेरे लिए कुछ पिएं <3
1,उपयोगकर्ता सुबह चिकलेट .... एक्स
0,"ऊ, यह बुरा गधा कॉफी मुझे स्टारबक्स के लिए तरस रहा है"
0,उपयोगकर्ता मैं क्योंकि मैं तबाह हो जाऊंगा
0,"उपयोगकर्ता हे एक्स अफैक टेलर डिसन ट्वीट एक्स नहीं है, यहाँ पर बहुत सारे नकली हैं, मैं आपको एक संदेश भेजता हूं जो असली एक्स हैं"
