1,एक महान शाम सुशी थी और वेलेरी के साथ पकड़ रही थी।
1,केप पर यहाँ सुंदर दिन
0,करने के लिए आरजे है
0,उपयोगकर्ता लेकिन .............. मुझे कुकी भी चाहिए
1,उपयोगकर्ता हा हा! मुझे पता था कि यह आप थे !!!   एक्स
0,"उपयोगकर्ता हाँ। मैंने JRK से कुछ प्राप्त किया है, लेकिन कुछ समय के लिए नहीं।  मुझे लगता है कि वह मुझे अब प्यार नहीं करता है!"
0,उपयोगकर्ता im bgt lols को याद करने जा रहा है
1,वू मैं अपने फोन से ट्विटर काम कर रहा था
1,उपयोगकर्ता योग्य। सभी का उपयोग करें!  मैं दिसंबर के लिए सभी को बचा रहा हूं।
0,उपयोगकर्ता 2 बी मेरे कलाकार नहीं चाहता। मैं सिर्फ उसका 2 ड्रॉप 1 एल्बम चाहता हूं ...
1,"उपयोगकर्ता हे। ब्रह्मांड के साथ अधिक, शायद गोय मार्शमॉलो के साथ थोड़ा कम। हे।"
1,"अच्छा नहीं लग रहा है, लेकिन मुझे लोगों की स्थिति पढ़ना पसंद है"
1,उपयोगकर्ता हाय मिकांग! कृपया मेरे पीछे आइए?
1,उपयोगकर्ता अरे!  उपयोगकर्ता के लिए वोट करें! वह वर्तमान में तीसरे स्थान पर है! URL शब्द का प्रसार! जितनी बार आप कर सकते हैं वोट करें
1,अभी परिवार की याद आ रही है ... लेकिन मैं जल्द ही घर आऊंगा ...
1,और अब पैर मुंडा हुआ है जो अब तैयार हो रहा है। क्या यह अजीब है कि मैंने आज के लिए 3 विकल्प चुने हैं?
1,"उपयोगकर्ता तो क्या आपको लगता है कि आपका कार्पल टनल है? इसके अलावा, हाय, यहाँ पर भी आपको देखने के लिए अच्छा है।"
1,उपयोगकर्ता की बहुत सराहना की।
0,"मैंने आज मौसम को देखा और इसने 92 और सनी कहा .. तब मुझे एहसास हुआ कि यह अटलांटा, जीए के लिए था।"
1,"मेरे दादा -दादी पर, हर जगह इंटरनेट पर।"
1,उपयोगकर्ता मैं एक संग्रहालय 2 की रात में JB देख रहा हूँ
1,यह सब साफ और सुव्यवस्थित करने के लिए iTunes पर संगीत को छाँटना!
0,इस्त्री करने के लिए समय हमें कुछ काम करने की जरूरत है जैसे कि हम दोनों कल काम पर वापस जाते हैं
0,मेरे सिर में दर्द होता है।
0,मेरा जादू
1,आज बस में मज़ा आया
1,उपयोगकर्ता कोई चिंता नहीं है मेरे पीछे आने के लिए धन्यवाद!
0,"काउंसिल एस्टेट्स पर कोई भी हवा जाहिरा तौर पर नहीं है, इस प्रकार पूरे दिन खिड़कियों को खुला छोड़ने से मेरे कमरे को ठंडा नहीं किया गया। मैं अत्यंत दुखी हूं"
0,उपयोगकर्ता मेरे पास एक नहीं है
1,उपयोगकर्ता मेरी बहन को देता है और मुझसे एक बड़ा गले लगाता है? मुझे उनकी याद आती है! धन्यवाद फेला और खुद का आनंद लें!
1,उपयोगकर्ता अच्छी तरह से अपना नाम डीएम
1,फेरारी विश्व चैम्पियनशिप 2009 URL
1,"उपयोगकर्ता अरे वहाँ आपका अधिकार लेकिन हे कोई व्यवसाय बात नहीं है, तो आप क्या कर रहे हैं फिर ट्वीट कर रहे हैं?"
0,ओ और बीटीडब्ल्यू किसने गुप्त जीवन देखा ?? मैं और मेरी बेस्टी इसे 2gether देखती है! वैसे भी- मुझे विश्वास नहीं हो रहा है कि ग्रेस डैड की मृत्यु हो गई! मेरा मतलब है- बहुत दुखद है।
0,"एक और लंबी रात।  वाशिंगटन में, डीसी URL"
1,इसकी धूप फिर से भगवान का शुक्र है कि किसी को भी दिलचस्प कुछ भी हो?
1,उपयोगकर्ता पॉप tarts सबसे अच्छा है! टोस्टेड पॉप टार्ट्स ओवररेटेड है
0,"उपयोगकर्ता हाँ, लेकिन पहाड़ियाँ उपयोगकर्ता के बिना समान नहीं होंगी"
1,"उपयोगकर्ता यह बहुत बढ़िया है! यह मुझे 2 बना दिया होगा। मैं हमेशा उपयोगकर्ता के 2-वर्षीय व्यक्ति को यह कहने की कोशिश करता हूं कि ""चलो इसे प्राप्त करें"" यह बहुत प्यारा है!"
0,"उपयोगकर्ता yuck! हमारे Rottweiler के पास उस साल पहले था, लेकिन हम इसे समय में पकड़ने में कामयाब रहे। बरामद, लेकिन कैंसर ने उसे 4yrs aftr कर दिया"
1,उपयोगकर्ता बहुत कुछ लंबे बालों वाले लोगों के साथ अच्छे हैं
0,"उपयोगकर्ता बहुत धन्यवाद, और मैं ले रहा हूं कि मेरा नाम सुझाव विजेता नहीं था"
0,"उपयोगकर्ता OW, यह दर्दनाक लगता है!"
0,ब्लैक (पू रंगीन स्कूल स्कर्ट) पोशाक के साथ (रिप्ड) चड्डी के नीचे। फ्रिकिंग हेल ओह पू
1,उपयोगकर्ता आप आज रात 20 प्रश्न कर रहे हैं या कुछ और ... वादा मैं अच्छा हो जाएगा
0,उपयोगकर्ता जो वास्तव में आप अभी भी आकर्षित कर सकते हैं?
1,उपयोगकर्ता और वह मांस खाता है
1,"बैंग बैंग, हम सुंदर और गंदे अमीर हैं"
0,"बेलफास्ट में जा रहे हैं, मुझे 200 बस से नफरत है"
0,"मुझे लगता है कि मैं आज बीमार हो सकता हूं, काम करने के लिए ऊर्जा नहीं है"
0,"मैं बहुत सो रहा हूँ, लेकिन काम पर im तो ol 'e.p के लिए नींद नहीं"
1,मेरे एक साल के बेटे ने अभी वह आखिरी ट्वीट पोस्ट किया था! सब उसके द्वारा! यह डरावना है कि एक बच्चा अपने मम्मी के iPhone के साथ क्या कर सकता है! हालांकि चतुर
0,"उपयोगकर्ता अच्छा है। लगता है कि डोप, RuPaul हालांकि मर चुका है"
1,उपयोगकर्ता नहीं जानता। कोई नहीं?
0,उपयोगकर्ता URL - मैं वहाँ से कोने के चारों ओर रहता था ... प्यार बोंडी ... इसे याद करते हैं
0,वैसे उपयोगकर्ता .... वीसी कॉनसेगुई पोस्टार म्यूज़िक कोई मेम नहीं?! यूरोपीय संघ n… o ...
1,उपयोगकर्ता हाँ मुझे और ट्रेसी YAAA एकत्र करेंगे
0,urgg Â? Â? तो इस तरह होने के लिए नाराज!  मैं हमेशा अपने निकटतम लोगों को क्यों चोट पहुंचाता हूं
1,"उपयोगकर्ता हैप्पी मदर्स डे मेग ने सिर्फ टक्सेंटेल्स क्लिप को देखा, कि नारंगी कित्ता आपके लिए एक पेरेफेक्ट फैशन एक्सेसरी की तरह लग रही थी।  purr!"
1,"मेरे सबसे लंबे समय तक siesta से वापस। नींद और न्यूरोइमेजिंग लैब की सलाह अच्छी तरह से। पूरी झपकी के साथ, मैं यू में सकारात्मक लेकिन कुछ भी नहीं देखूंगा!"
1,"#TheDailyShow देख रहे हैं, फिर #Colbertrereport और उसके बाद #conanobrian"
1,उपयोगकर्ता योग्य ठीक है! बस ब्रह्मांड के किनारे से मत जाओ!  g'nite
1,उपयोगकर्ता हे बेबी आई लव यू
0,जब मैं CSI एपिसोड डाउनलोड कर रहा हूं तो अधिक लोग बीज क्यों नहीं कर सकते?
0,उपयोगकर्ता वह टीवी पर अभी तक नहीं है
1,एक और दिन एक और स्कॉचर ओह हाँ
1,उपयोगकर्ता यह gooood है! स्टार ट्रेक वास्तव में आपके पैसे के लायक है!
1,क्या आप सुनिश्चित हैं कि आप जॉर्जिया से हैं? मुझे यहाँ पर गर्मी याद आ रही है।
1,ट्वीट कर रहा है।
0,"IPhone के लिए TweetDeck बहुत दुर्घटनाग्रस्त हो जाता है, वर्तमान स्थिति: कुछ GRP के लिए केवल पुराने ट्वीट दिखाता है, ट्वीट नहीं खोलेंगे।"
1,उपयोगकर्ता किस तरह की जानकारी है। क्या आप ढूंढ रहे हैं? RETA वेबिनार आपकी मदद करने में सक्षम हो सकता है
0,मुझे सिर्फ मैगी छोड़नी थी लेकिन वह अपने नए खिलौनों और कंबल के लिए उत्साहित लग रही थी !!
0,कोई अपराध नहीं: मैं जागना पसंद नहीं करता ... url
0,पर भूख लगाई जा रही है। विमान इस के लिए आगे नहीं देख रहा है
1,उपयोगकर्ता अच्छी तरह से मैं उनसे प्यार करता हूँ। लेकिन आपको यह सुनिश्चित करने के लिए निश्चित रूप से कोशिश करनी चाहिए। कोई भी काला या यातना प्राप्त कर सकता है लेकिन वे अद्वितीय हैं!
0,यहां सेवा बहुत धीमी है।
0,"राए ऊब! राय स्मैश! राय वाह के अलावा कुछ करना चाहते हैं, लेकिन राय जैसा कोई नहीं।"
1,अगर यू नहीं है तो उस पर लटका हुआ है .. लेकिन जब से मैं नहीं पीता तो मुझे लगता है कि हर सुबह अच्छा है
1,"उपयोगकर्ता wot? बादल और fisma? मेरे पास कुछ आइडियर्स हैं, लेकिन 140 चार्ट में नहीं।"
1,उपयोगकर्ता के पास एक महान दिन है।
0,पूरे दिन घर का अध्ययन इस सप्ताह तक इंतजार नहीं कर सकता है
0,उपयोगकर्ता की इच्छा है कि मैं कल छात्र जीवन में आ सकता हूं। लगभग 3-4 वर्षों में मुझे नहीं देखा गया है।
0,मिक्स टुडे / कल बाहर जा रहा है ... वादा! यह केवल मार्च के बाद से किया गया है। बस कॉपी और भेजने का समय नहीं!
1,"मुझे अपना ""शेक-टू-अपडेट"" फीचर काम मिला"
1,उपयोगकर्ता बहुत बढ़िया! बहुत बहुत धन्यवाद
1,उपयोगकर्ता कोई मजाक नहीं है यह बहुत सारी यादें वापस ला रहा है।
1,उपयोगकर्ता #flamewars नहीं चाहते हैं
1,"प्रतिबिंब पर, सुधार: ट्रेवर कभी जंगली नहीं है। वह ""यह उत्साह से बात कर रहा है"" #Le09"
0,गलत सचेतक! बच्चा अभी भी यहाँ नहीं है
1,"उपयोगकर्ता Argh, मैं अपनी आंख में एक कैमरा भी चाहता हूं, यह बहुत बढ़िया लग रहा है तो मैं चारों ओर जा सकता हूं और चिल्ला सकता हूं ""आपको आत्मसात किया जाएगा""!"
0,"उपयोगकर्ता FireUploader Thru समय-वार्नर रोडरनर। गति अधिकतम @ 512kbps। यह उनकी गलती है, आपकी नहीं। P2P फ़िलेशरिंग को विफल करने की कोशिश कर रहा है।"
0,अशर हाँ मुझे पता है
0,दोपहर के भोजन के लिए पोपीस चिकन है और मैं कसम खाता हूं कि वहां चिकन की तुलना में अधिक ग्रीस था
1,उपयोगकर्ता यह वैसे भी मेरा बहाना है और मैं इससे चिपका हुआ हूँ! आपकी भयानक उपलब्धि के लिए गहरा सम्मान
1,ख़ुश है!! फिर से टीवी पर हेयरस्प्रे है! मुझे वह फिल्म बहुत पसंद है! मैं लेकिन मैं इसे सिर्फ..म .. 1 394 849 बार देखता हूं !! XD <3
1,Snarkstock 09 से बाहर आने के लिए पहला वीडियो: कई अजीब क्लिप आ रहे हैं
0,"उपयोगकर्ता लानत है! काश मैं कर सकता था, लेकिन मैं इंग्लैंड में रहता हूं"
0,"उपयोगकर्ता हमारे पास भी है, मैं उनसे प्यार करता हूँ! हालांकि मैंने पिछली गर्मियों में कोई भी नहीं देखा है।"
1,URL - मैं चींटियों से प्यार करता हूँ!
1,"उपयोगकर्ता यह सबसे अच्छा महिला अध्ययन वर्ग है ... हमारे सभी ""पाठ्यपुस्तक"" उपन्यास थे।  और अंतिम परियोजना/फाइनल एक रचनात्मक परियोजना हो सकती है।"
0,अच्छा महसूस नहीं कर रहा है और बेहतर होने की कोशिश कर रहा है
1,उपयोगकर्ता मैंने केवल हफ्तों पहले इसका उपयोग करना शुरू कर दिया था - लेकिन इसे प्यार करो! मैं अपने अजीब सामान को सीजी में लाने जा रहा हूं ताकि हम शाम को इसके साथ खेल सकें
1,केल्स के साथ चिलिंग !! मेरी बेस्टी खाना shiiiit खाना ... और इसे प्यार करना
0,घर जा रहा है। वर्डप्रेस कठिन है।
0,काश मैं ईसाई Louboutins की एक जोड़ी हो सकता है
0,उपयोगकर्ता यू ने मुझे और नहीं मारा। मैंने भी यू कहा और कोई रिटर्न नहीं मिला।
1,वेयरहाउस रेव डब्ल्यू/ ज़ी होमिस
0,"उपयोगकर्ता दोस्त मैं किसी को सीवीएस में क्रैकहेड्स को समझाने की कोशिश कर रहा था, लेकिन कहानी उतनी ही मजाकिया नहीं थी जितनी"
1,अभी रेडियो पर कुछ तेल खेलना! 88.9 WYN FM
1,इच्छा से भरा हुआ
0,मेरी बिल्ली आज अपने बच्चे पैदा कर रही है। वह पहले से ही एक थी लेकिन यह ओह अच्छी तरह से मर गया। कम से कम हमारे पास इससे जुड़ने का समय नहीं था।
1,उसके कमरे को चिढ़ाना चाहिए। लेकिन वास्तव में arsed नहीं किया जा सकता है और इसके बजाय एक दिन का समय लगेगा।
1,उपयोगकर्ता किया और किया!  अब क्या करना है!?
0,"वह विवाद एक नीचे था, दोस्तों अहा। जाओ एडम हंटर!"
0,उपयोगकर्ता शिकागो में शो अद्भुत था मैं 5 घंटे में वापस ला में उड़ान भरता था
1,"अपनी संपूर्णता में गर्म पानी से बाहर भाग गया, लेकिन मुझे अच्छा लगता है"
0,URL - क्या बारिश का दिन ... और इतना ठंडा
1,उपयोगकर्ता किडो? और मैं वास्तव में अपने फोन पर देख सकता था! मज़ेदार!! मैं इसे कल देखने के लिए इंतजार नहीं कर सकता!
1,आपके लिए उपयोगकर्ता अच्छा है ... यह डेवोन और लव समरसेट में स्वर्ग है और डोरसेट ... आप इन दिनों को पसंद करते हैं/कहीं भी काम कर सकते हैं
0,मुझे लगता है कि यह आज गरज था .... मुझे सभी मज़ा याद आ रहा है
1,मुझे फूलों की लॉन्ड्री और सुशी बहुत पसंद है ...
1,कुछ दिनों के लिए घर में आने की खुशी है! हैप्पी बर्थडे सीबी
0,"SOOO मेरा मैक मर चुका है।  किसी को भी माइक्रो फाइनेंसिंग में दिलचस्पी है, जो मुझे एक नए के लिए है?"
0,बिना किसी केबल से नाराज हो रहे हैं। पुराने लगुना बीच एपिसोड। दुख की बात है कि हमने एक यात्रा शहर को बर्बाद कर दिया
0,"उपयोगकर्ता हाँ, हाँ यह करता है लेकिन यह इसके लायक है! (वीएलसी खेलेंगे)"
0,"उपयोगकर्ता यू पेशाब की गंध !!!!! मैं एक स्नान या शॉवर नहीं कर सकता, फिर भी क्यूज मम्मी ने कहा कि वह उन्हें साफ कर रही है मैं गंदा महसूस करता हूं !!! मुझे कोई पसंद नहीं है"
0,उपयोगकर्ता आप मेरे बारे में हंस रहे थे?  गोश पहाड़ियों के सीज़न दो के बारे में बात करते हैं-इतने लंबे लॉरेन ...
1,उपयोगकर्ता धन्यवाद donna..you भी xx
0,आप पिज्जा की बात क्यों करते हैं? मैं इसे अभी करना चाहता हूं और यहां लटूर में नहीं जा सकता।
0,मेरे बगल में विकलांग लड़की के साथ धैर्य रखने की कोशिश कर रहा है। मुश्किल जब वह सिर्फ बालों का एक हिस्सा बाहर खींचता है।
0,"स्कूल में एक महान दिन नहीं, देखा ... यह दिन का एकमात्र आकर्षण है।"
1,"उपयोगकर्ता ð? Ñ, ñ ñ ð ð ñ ñ ñ? Ñ?  Ð ñ? Ñ ​​ð ð¸ð ð ðð ñ ñ ñ ñ ð ð ð ð ð ð ð"
1,कुछ 80 के दशक के संगीत को सुनकर - AAWW क्या एक महान संगीत युग था
1,"उपयोगकर्ता हाय बेबे, आपको ट्विटर पर यहां देखकर अच्छा लगा। मैं आपसे बहुत प्यार है!"
0,"बाय कोंन, imissyousomuuuuuuch"
0,"सुप्रभात लोगों के ट्विटरलैंड! मेरे शहर में बारिश और हवा आज वसंत कहाँ है, लानत है!?!?"
0,"मेरे ट्विटरपिक बहुत शर्मनाक हैं, हाहा, वॉचिन स्काईऑन && बस के बारे में tew भोजन yup ii'm खुश है;]] .."
